-- After_upg_while_logging.sql : complex scenario executed by an emaj_adm role.
-- The E-Maj version is changed while groups are in logging state.
-- This script is the part of operations performed after the upgrade.
--
-- Do not display DETAIL and CONTEXT outputs when an error is raised (\errverbose can be used to debug a statement).
\set VERBOSITY terse
-- Revoke rights granted before the upgrade.
REVOKE ALL ON SCHEMA mySchema1, mySchema2, "phil's schema""3", mySchema4, mySchema5, mySchema6
  FROM _regress_emaj_adm1, _regress_emaj_adm2;
REVOKE ALL ON ALL TABLES IN SCHEMA mySchema1, mySchema2, "phil's schema""3", mySchema4, mySchema5, mySchema6
  FROM _regress_emaj_adm1, _regress_emaj_adm2;
REVOKE ALL ON ALL SEQUENCES IN SCHEMA mySchema1, mySchema2, "phil's schema""3", mySchema4, mySchema5, mySchema6
  FROM _regress_emaj_adm1, _regress_emaj_adm2;
-----------------------------
-- Step 1 : check the E-Maj installation.
-----------------------------
SET session_authorization TO _regress_emaj_adm2;
SELECT * FROM emaj.emaj_verify_all();
                                                                                 emaj_verify_all                                                                                  
----------------------------------------------------------------------------------------------------------------------------------------------------------------------------------
 Warning: In tables group "myGroup1", the sequence "myschema1"."myTbl3_col31_seq" is linked to the table "myschema1"."myTbl3" but this table does not belong to any tables group.
 Warning: The 'dblink_user_password' parameter value is not set.
 No error detected
(3 rows)

-- New or modified table contents.
SELECT * FROM emaj.emaj_install_conf;
 inst_as_extension | inst_by_superuser | inst_installer_role | inst_with_emaj_adm | inst_with_emaj_viewer | inst_with_event_triggers 
-------------------+-------------------+---------------------+--------------------+-----------------------+--------------------------
 t                 | t                 | postgres            | t                  | t                     | t
(1 row)

SELECT * FROM emaj.emaj_param ORDER BY param_key;
     param_key     | param_value 
-------------------+-------------
 history_retention | @ 1 day
(1 row)

SELECT rel_sql_gen_ins_val, rel_sql_gen_upd_set, rel_sql_gen_pk_conditions FROM emaj.emaj_relation ORDER BY rel_schema, rel_tblseq, rel_time_range;
                                                                                                    rel_sql_gen_ins_val                                                                                                     |                                                                                                                          rel_sql_gen_upd_set                                                                                                                          |                                                 rel_sql_gen_pk_conditions                                                 
----------------------------------------------------------------------------------------------------------------------------------------------------------------------------------------------------------------------------+-----------------------------------------------------------------------------------------------------------------------------------------------------------------------------------------------------------------------------------------------------------------------+---------------------------------------------------------------------------------------------------------------------------
                                                                                                                                                                                                                            |                                                                                                                                                                                                                                                                       | 
                                                                                                                                                                                                                            |                                                                                                                                                                                                                                                                       | 
 ' || coalesce(o.col11::TEXT,'NULL') || ', ' || emaj._quote_nullable(o.col12::TEXT) || ', ' || emaj._quote_nullable(o.col13::TEXT) || '                                                                                     | col11 = ' || coalesce(n.col11 ::TEXT,'NULL') || ', col12 = ' || emaj._quote_nullable(n.col12::TEXT) || ', col13 = ' || emaj._quote_nullable(n.col13::TEXT) || '                                                                                                       | col11 = ' || o.col11 || ' AND col12 = ' || emaj._quote_nullable(o.col12::TEXT) || '
 ' || coalesce(o.col21::TEXT,'NULL') || ', ' || emaj._quote_nullable(o.col22::TEXT) || ', ' || emaj._quote_nullable(o.col23::TEXT) || '                                                                                     | col21 = ' || coalesce(n.col21 ::TEXT,'NULL') || ', col22 = ' || emaj._quote_nullable(n.col22::TEXT) || ', col23 = ' || emaj._quote_nullable(n.col23::TEXT) || '                                                                                                       | col21 = ' || o.col21 || '
 ' || coalesce(o.col20::TEXT,'NULL') || ', ' || coalesce(o.col21::TEXT,'NULL') || ', ' || emaj._quote_nullable(o.col24::TEXT) || '                                                                                          | col21 = ' || coalesce(n.col21 ::TEXT,'NULL') || ', col24 = ' || emaj._quote_nullable(n.col24::TEXT) || '                                                                                                                                                              | col20 = ' || o.col20 || '
 ' || coalesce(o.col41::TEXT,'NULL') || ', ' || emaj._quote_nullable(o.col42::TEXT) || ', ' || coalesce(o.col43::TEXT,'NULL') || ', ' || coalesce(o.col44::TEXT,'NULL') || ', ' || emaj._quote_nullable(o.col45::TEXT) || ' | col41 = ' || coalesce(n.col41 ::TEXT,'NULL') || ', col42 = ' || emaj._quote_nullable(n.col42::TEXT) || ', col43 = ' || coalesce(n.col43 ::TEXT,'NULL') || ', col44 = ' || coalesce(n.col44 ::TEXT,'NULL') || ', col45 = ' || emaj._quote_nullable(n.col45::TEXT) || ' | col41 = ' || o.col41 || ' AND col43 = ' || o.col43 || '
 ' || coalesce(o.col31::TEXT,'NULL') || ', ' || emaj._quote_nullable(o.col32::TEXT) || ', ' || coalesce(o.col33::TEXT,'NULL') || '                                                                                          | col31 = ' || coalesce(n.col31 ::TEXT,'NULL') || ', col32 = ' || emaj._quote_nullable(n.col32::TEXT) || ', col33 = ' || coalesce(n.col33 ::TEXT,'NULL') || '                                                                                                           | col31 = ' || o.col31 || '
                                                                                                                                                                                                                            |                                                                                                                                                                                                                                                                       | 
                                                                                                                                                                                                                            |                                                                                                                                                                                                                                                                       | 
 ' || coalesce(o.col11::TEXT,'NULL') || ', ' || emaj._quote_nullable(o.col12::TEXT) || ', ' || emaj._quote_nullable(o.col13::TEXT) || '                                                                                     | col11 = ' || coalesce(n.col11 ::TEXT,'NULL') || ', col12 = ' || emaj._quote_nullable(n.col12::TEXT) || ', col13 = ' || emaj._quote_nullable(n.col13::TEXT) || '                                                                                                       | col11 = ' || o.col11 || ' AND col12 = ' || emaj._quote_nullable(o.col12::TEXT) || '
 ' || coalesce(o.col21::TEXT,'NULL') || ', ' || emaj._quote_nullable(o.col22::TEXT) || ', ' || emaj._quote_nullable(o.col23::TEXT) || '                                                                                     | col21 = ' || coalesce(n.col21 ::TEXT,'NULL') || ', col22 = ' || emaj._quote_nullable(n.col22::TEXT) || ', col23 = ' || emaj._quote_nullable(n.col23::TEXT) || '                                                                                                       | col21 = ' || o.col21 || '
 ' || coalesce(o.col41::TEXT,'NULL') || ', ' || emaj._quote_nullable(o.col42::TEXT) || ', ' || coalesce(o.col43::TEXT,'NULL') || ', ' || coalesce(o.col44::TEXT,'NULL') || ', ' || emaj._quote_nullable(o.col45::TEXT) || ' | col41 = ' || coalesce(n.col41 ::TEXT,'NULL') || ', col42 = ' || emaj._quote_nullable(n.col42::TEXT) || ', col43 = ' || coalesce(n.col43 ::TEXT,'NULL') || ', col44 = ' || coalesce(n.col44 ::TEXT,'NULL') || ', col45 = ' || emaj._quote_nullable(n.col45::TEXT) || ' | col41 = ' || o.col41 || '
 ' || coalesce(o.col1::TEXT,'NULL') || '                                                                                                                                                                                    | col1 = ' || coalesce(n.col1 ::TEXT,'NULL') || '                                                                                                                                                                                                                       | col1 = ' || o.col1 || '
 ' || coalesce(o.col1::TEXT,'NULL') || '                                                                                                                                                                                    | col1 = ' || coalesce(n.col1 ::TEXT,'NULL') || '                                                                                                                                                                                                                       | col1 = ' || o.col1 || '
                                                                                                                                                                                                                            |                                                                                                                                                                                                                                                                       | 
 ' || coalesce(o.col1::TEXT,'NULL') || '                                                                                                                                                                                    | col1 = ' || coalesce(n.col1 ::TEXT,'NULL') || '                                                                                                                                                                                                                       | col1 = ' || o.col1 || '
                                                                                                                                                                                                                            |                                                                                                                                                                                                                                                                       | 
 ' || coalesce(o."phil's col11"::TEXT,'NULL') || ', ' || emaj._quote_nullable(o."phil's col12"::TEXT) || ', ' || emaj._quote_nullable(o."phil\s""col13"::TEXT) || '                                                         | "phil''s col11" = ' || coalesce(n."phil's col11" ::TEXT,'NULL') || ', "phil''s col12" = ' || emaj._quote_nullable(n."phil's col12"::TEXT) || ', "phil\s""col13" = ' || emaj._quote_nullable(n."phil\s""col13"::TEXT) || '                                             | "phil''s col11" = ' || o."phil's col11" || ' AND "phil''s col12" = ' || emaj._quote_nullable(o."phil's col12"::TEXT) || '
                                                                                                                                                                                                                            |                                                                                                                                                                                                                                                                       | 
(19 rows)

-----------------------------
-- Step 2 : for both groups, rollback to the common mark just set before the upgrade, after having unprotected the first group.
-----------------------------
SELECT emaj.emaj_unprotect_group('myGroup1');
 emaj_unprotect_group 
----------------------
                    1
(1 row)

SELECT rlbk_severity, regexp_replace(rlbk_message, E'\\d\\d\\d\\d/\\d\\d\\/\\d\\d\\ \\d\\d\\:\\d\\d:\\d\\d .*?\\)', '<timestamp>)', 'g')
  FROM emaj.emaj_rollback_groups('{"myGroup1", "myGroup2"}', 'Common', TRUE) ORDER BY 1, 2;
 rlbk_severity |                                        regexp_replace                                         
---------------+-----------------------------------------------------------------------------------------------
 Notice        | 0 / 3 sequences effectively processed.
 Notice        | 0 / 8 tables effectively processed.
 Notice        | Rollback id = 4.
 Warning       | The table myschema1."myTbl3" has been left unchanged (not in group anymore since <timestamp>)
(4 rows)

-----------------------------
-- Step 3 : for myGroup1, update tables, then unprotect, logged_rollback, rename the end rollback mark and consolidate the rollback.
-----------------------------
RESET session_authorization;
SET search_path TO myschema1;
--
UPDATE "myTbl3" SET col33 = col33 / 2;
--
SET session_authorization TO _regress_emaj_adm2;
SELECT * FROM emaj.emaj_rollback_group('myGroup1', 'M2', FALSE) ORDER BY 1, 2;
ERROR:  _rlbk_check: Protected marks (M3) for the group "myGroup1" block the rollback to the mark "M2".
SELECT emaj.emaj_unprotect_mark_group('myGroup1', 'M3');
 emaj_unprotect_mark_group 
---------------------------
                         1
(1 row)

SELECT rlbk_severity, regexp_replace(rlbk_message, E'\\d\\d\\d\\d/\\d\\d\\/\\d\\d\\ \\d\\d\\:\\d\\d:\\d\\d .*?\\)', '<timestamp>)', 'g')
  FROM emaj.emaj_logged_rollback_group('myGroup1', 'M2', TRUE) ORDER BY 1, 2;
 rlbk_severity |                                        regexp_replace                                         
---------------+-----------------------------------------------------------------------------------------------
 Notice        | 0 / 1 sequences effectively processed.
 Notice        | 4 / 4 tables effectively processed.
 Notice        | Rollback id = 5.
 Warning       | The table myschema1."myTbl3" has been left unchanged (not in group anymore since <timestamp>)
(4 rows)

--
SELECT emaj.emaj_rename_mark_group('myGroup1', 'EMAJ_LAST_MARK', 'End_rollback_to_M2');
 emaj_rename_mark_group 
------------------------
 
(1 row)

SELECT emaj.emaj_consolidate_rollback_group('myGroup1', 'End_rollback_to_M2');
 emaj_consolidate_rollback_group 
---------------------------------
                               5
(1 row)

-----------------------------
-- Step 4 : for myGroup1, update tables and sequences again then set 3 marks and get stats.
-----------------------------
RESET session_authorization;
INSERT INTO myTbl1 SELECT i, 'DEF', E'\\000'::BYTEA FROM generate_series (100, 110) as i;
INSERT INTO myTbl2 VALUES (3, 'GHI', '2010-01-02');
DELETE FROM myTbl1 WHERE col11 = 1;
SELECT nextval('myschema1."myTbl3_col31_seq"');
 nextval 
---------
      11
(1 row)

--
SET session_authorization TO _regress_emaj_adm2;
SELECT emaj.emaj_set_mark_group('myGroup1', 'M4');
 emaj_set_mark_group 
---------------------
                   5
(1 row)

--
RESET session_authorization;
UPDATE "myTbl3" SET col33 = col33 / 2;
--
SET session_authorization TO _regress_emaj_adm2;
SELECT emaj.emaj_set_mark_group('myGroup1', 'M5');
 emaj_set_mark_group 
---------------------
                   5
(1 row)

--
RESET session_authorization;
UPDATE myTbl1 SET col11 = 99 WHERE col11 = 1;
--
SET session_authorization TO _regress_emaj_adm2;
SELECT emaj.emaj_set_mark_group('myGroup1', 'M6');
 emaj_set_mark_group 
---------------------
                   5
(1 row)

--
SELECT stat_group, stat_schema, stat_table, stat_first_mark, stat_first_time_id, stat_last_mark, stat_last_time_id, stat_rows
  FROM emaj.emaj_log_stat_group('myGroup1', 'M2', 'M6') ORDER BY 1, 2, 3, 4;
 stat_group | stat_schema | stat_table | stat_first_mark | stat_first_time_id | stat_last_mark | stat_last_time_id | stat_rows 
------------+-------------+------------+-----------------+--------------------+----------------+-------------------+-----------
 myGroup1   | myschema1   | myTbl3     | M2              |                  8 | [deleted mark] |                18 |         0
 myGroup1   | myschema1   | mytbl1     | M2              |                  8 | M6             |                27 |        12
 myGroup1   | myschema1   | mytbl2     | M2              |                  8 | M6             |                27 |         1
 myGroup1   | myschema1   | mytbl2b    | M2              |                  8 | M6             |                27 |         1
 myGroup1   | myschema1   | mytbl4     | M2              |                  8 | M6             |                27 |         0
(5 rows)

SELECT stat_group, stat_schema, stat_sequence, stat_first_mark, stat_first_time_id, stat_last_mark, stat_last_time_id,
       stat_increments, stat_has_structure_changed
  FROM emaj.emaj_sequence_stat_group('myGroup1', 'M2', 'M6')
  ORDER BY stat_group, stat_schema, stat_sequence, stat_first_mark_datetime;
 stat_group | stat_schema |  stat_sequence   | stat_first_mark | stat_first_time_id | stat_last_mark | stat_last_time_id | stat_increments | stat_has_structure_changed 
------------+-------------+------------------+-----------------+--------------------+----------------+-------------------+-----------------+----------------------------
 myGroup1   | myschema1   | myTbl3_col31_seq | M2              |                  8 | M6             |                27 |               1 | f
(1 row)

-----------------------------
-- Step 5 : for myGroup2, logged rollback again then unlogged rollback.
-----------------------------
SELECT * FROM emaj.emaj_logged_rollback_group('myGroup2', 'M2', FALSE) ORDER BY 1, 2;
 rlbk_severity |              rlbk_message              
---------------+----------------------------------------
 Notice        | 1 / 2 sequences effectively processed.
 Notice        | 1 / 4 tables effectively processed.
 Notice        | Rollback id = 6.
(3 rows)

--
SELECT * FROM emaj.emaj_rollback_group('myGroup2', 'M3', FALSE) ORDER BY 1, 2;
 rlbk_severity |              rlbk_message              
---------------+----------------------------------------
 Notice        | 1 / 2 sequences effectively processed.
 Notice        | 1 / 4 tables effectively processed.
 Notice        | Rollback id = 7.
(3 rows)

-----------------------------
-- Step 6 : for myGroup1, update tables, rollback, other updates, then logged rollback.
-----------------------------
RESET session_authorization;
SET search_path TO myschema1;
--
INSERT INTO myTbl1 VALUES (1, 'Step 6', E'\\000'::BYTEA);
INSERT INTO myTbl4 VALUES (11, 'FK...', 1, 1, 'Step 6');
INSERT INTO myTbl4 VALUES (12, 'FK...', 1, 1, 'Step 6');
TRUNCATE myTbl2 CASCADE;
NOTICE:  truncate cascades to table "mytbl4"
--
SET session_authorization TO _regress_emaj_adm2;
SELECT * FROM emaj.emaj_rollback_group('myGroup1', 'M5', FALSE) ORDER BY 1, 2;
 rlbk_severity |              rlbk_message              
---------------+----------------------------------------
 Notice        | 0 / 1 sequences effectively processed.
 Notice        | 3 / 4 tables effectively processed.
 Notice        | Rollback id = 8.
(3 rows)

--
RESET session_authorization;
INSERT INTO myTbl1 VALUES (1, E'Step\t6', E'\\001'::BYTEA);
COPY myTbl4 FROM stdin CSV;
--
SET session_authorization TO _regress_emaj_adm2;
SELECT * FROM emaj.emaj_logged_rollback_group('myGroup1', 'M4', FALSE) ORDER BY 1, 2;
 rlbk_severity |              rlbk_message              
---------------+----------------------------------------
 Notice        | 0 / 1 sequences effectively processed.
 Notice        | 2 / 4 tables effectively processed.
 Notice        | Rollback id = 9.
(3 rows)

-----------------------------
-- Step 7 : for myGroup1, generate a sql script on the whole time frame.
-----------------------------
SELECT emaj.emaj_gen_sql_group('myGroup1', 'M1', NULL, NULL, ARRAY['myschema1.mytbl1', 'myschema1.mytbl2', 'myschema1.mytbl4']);
 emaj_gen_sql_group 
--------------------
                 36
(1 row)

SELECT regexp_replace(scr_sql, '^-- SQL script generated by E-Maj at .*', '-- SQL script generated by E-Maj at %') FROM emaj_sql_script;
                                                 regexp_replace                                                 
----------------------------------------------------------------------------------------------------------------
 -- SQL script generated by E-Maj at %
 --    for tables group(s): myGroup1
 --    processing logs between mark "M1" and the current state
 --    only for the following tables/sequences: myschema1.mytbl1,myschema1.mytbl2,myschema1.mytbl4
 SET datestyle = 'ISO, YMD';
 BEGIN TRANSACTION;
 INSERT INTO myschema1.mytbl1 VALUES (1, 'ABC', E'\\x0c');
 INSERT INTO myschema1.mytbl1 VALUES (2, 'ABC', E'\\x0c');
 INSERT INTO myschema1.mytbl1 VALUES (3, 'ABC', E'\\x0c');
 INSERT INTO myschema1.mytbl1 VALUES (4, 'ABC', E'\\x0c');
 INSERT INTO myschema1.mytbl1 VALUES (5, 'ABC', E'\\x0c');
 INSERT INTO myschema1.mytbl1 VALUES (6, 'ABC', E'\\x0c');
 INSERT INTO myschema1.mytbl1 VALUES (7, 'ABC', E'\\x0c');
 INSERT INTO myschema1.mytbl1 VALUES (8, 'ABC', E'\\x0c');
 INSERT INTO myschema1.mytbl1 VALUES (9, 'ABC', E'\\x0c');
 INSERT INTO myschema1.mytbl1 VALUES (10, 'ABC', E'\\x0c');
 INSERT INTO myschema1.mytbl1 VALUES (11, 'ABC', E'\\x0c');
 UPDATE ONLY myschema1.mytbl1 SET col11 = 1, col12 = 'ABC', col13 = E'\\x1c' WHERE col11 = 1 AND col12 = 'ABC';
 UPDATE ONLY myschema1.mytbl1 SET col11 = 2, col12 = 'ABC', col13 = E'\\x1c' WHERE col11 = 2 AND col12 = 'ABC';
 UPDATE ONLY myschema1.mytbl1 SET col11 = 3, col12 = 'ABC', col13 = E'\\x1c' WHERE col11 = 3 AND col12 = 'ABC';
 INSERT INTO myschema1.mytbl2 VALUES (1, 'ABC', '2010-12-31');
 DELETE FROM ONLY myschema1.mytbl1 WHERE col11 = 11 AND col12 = 'ABC';
 INSERT INTO myschema1.mytbl2 VALUES (2, 'DEF', NULL);
 INSERT INTO myschema1.mytbl1 VALUES (100, 'DEF', E'\\x00');
 INSERT INTO myschema1.mytbl1 VALUES (101, 'DEF', E'\\x00');
 INSERT INTO myschema1.mytbl1 VALUES (102, 'DEF', E'\\x00');
 INSERT INTO myschema1.mytbl1 VALUES (103, 'DEF', E'\\x00');
 INSERT INTO myschema1.mytbl1 VALUES (104, 'DEF', E'\\x00');
 INSERT INTO myschema1.mytbl1 VALUES (105, 'DEF', E'\\x00');
 INSERT INTO myschema1.mytbl1 VALUES (106, 'DEF', E'\\x00');
 INSERT INTO myschema1.mytbl1 VALUES (107, 'DEF', E'\\x00');
 INSERT INTO myschema1.mytbl1 VALUES (108, 'DEF', E'\\x00');
 INSERT INTO myschema1.mytbl1 VALUES (109, 'DEF', E'\\x00');
 INSERT INTO myschema1.mytbl1 VALUES (110, 'DEF', E'\\x00');
 INSERT INTO myschema1.mytbl2 VALUES (3, 'GHI', '2010-01-02');
 DELETE FROM ONLY myschema1.mytbl1 WHERE col11 = 1 AND col12 = 'ABC';
 INSERT INTO myschema1.mytbl1 VALUES (1, E'Step  6', E'\\x01');
 INSERT INTO myschema1.mytbl4 VALUES (11, NULL, 1, 1, E'Step     6');
 INSERT INTO myschema1.mytbl4 VALUES (12, NULL, 1, 1, E'Step     6');
 DELETE FROM ONLY myschema1.mytbl4 WHERE col41 = 11 AND col43 = 1;
 DELETE FROM ONLY myschema1.mytbl4 WHERE col41 = 12 AND col43 = 1;
 DELETE FROM ONLY myschema1.mytbl1 WHERE col11 = 1 AND col12 = E'Step    6';
 COMMIT;
 RESET datestyle;
(44 rows)

SELECT emaj.emaj_gen_sql_group('myGroup1', 'M1', NULL, '/dev/null', ARRAY['myschema1.myTbl3']);
ERROR:  _gen_sql_groups: 1 tables/sequences (myschema1.myTbl3) had no pkey at M1 mark time.
-----------------------------
-- Step 8 : for myGroup1, update tables, rename a mark, then delete 2 marks then delete all before a mark.
-----------------------------
RESET session_authorization;
SET search_path TO myschema1;
--
DELETE FROM "myTbl3" WHERE col31 between 14 AND 18;
--
SET session_authorization TO _regress_emaj_adm2;
SELECT emaj.emaj_rename_mark_group('myGroup1', mark_name, 'Before logged rollback to M4') FROM emaj.emaj_mark WHERE mark_comment LIKE '%to mark M4 start';
 emaj_rename_mark_group 
------------------------
 
(1 row)

SELECT emaj.emaj_delete_mark_group('myGroup1', mark_name) FROM emaj.emaj_mark WHERE mark_comment LIKE '%to mark M4 end';
 emaj_delete_mark_group 
------------------------
                      1
(1 row)

SELECT emaj.emaj_delete_mark_group('myGroup1', 'M1');
 emaj_delete_mark_group 
------------------------
                      1
(1 row)

SELECT emaj.emaj_delete_before_mark_group('myGroup1', 'M4');
 emaj_delete_before_mark_group 
-------------------------------
                             2
(1 row)

-----------------------------
-- Step 9 : for myGroup6, perform a table change and verify that no log trigger has been called.
--          And finaly drop the group.
-----------------------------
RESET session_authorization;
INSERT INTO mySchema6.table_with_51_characters_long_name_____0_________0a VALUES (1), (2);
SELECT count(*) FROM emaj_myschema6."table_with_51_characters_long_name_____0_________0#1_log";
 count 
-------
     0
(1 row)

--
SET session_authorization TO _regress_emaj_adm2;
SELECT emaj.emaj_start_group('myGroup6', 'Start G6');
 emaj_start_group 
------------------
                3
(1 row)

--
RESET session_authorization;
INSERT INTO mySchema6.table_with_51_characters_long_name_____0_________0a VALUES (3), (4);
DELETE FROM mySchema6.table_with_51_characters_long_name_____0_________0a;
--
SET session_authorization TO _regress_emaj_adm2;
SELECT stat_group, stat_schema, stat_table, stat_first_mark, stat_first_time_id, stat_last_mark, stat_last_time_id, stat_rows
  FROM emaj.emaj_log_stat_group('myGroup6', 'Start G6', NULL) ORDER BY 1, 2, 3, 4;
 stat_group | stat_schema |                       stat_table                        | stat_first_mark | stat_first_time_id | stat_last_mark | stat_last_time_id | stat_rows 
------------+-------------+---------------------------------------------------------+-----------------+--------------------+----------------+-------------------+-----------
 myGroup6   | myschema6   | table_with_50_characters_long_name_____0_________0      | Start G6        |                 34 |                |                   |         0
 myGroup6   | myschema6   | table_with_51_characters_long_name_____0_________0a     | Start G6        |                 34 |                |                   |         6
 myGroup6   | myschema6   | table_with_55_characters_long_name_____0_________0fghij | Start G6        |                 34 |                |                   |         0
(3 rows)

SELECT * FROM emaj.emaj_rollback_group('myGroup6', 'Start G6');
 rlbk_severity |            rlbk_message             
---------------+-------------------------------------
 Notice        | Rollback id = 10.
 Notice        | 1 / 3 tables effectively processed.
(2 rows)

SELECT emaj.emaj_stop_group('myGroup6');
 emaj_stop_group 
-----------------
               3
(1 row)

SELECT emaj.emaj_drop_group('myGroup6');
 emaj_drop_group 
-----------------
               3
(1 row)

-----------------------------
-- Test end: check and reset history.
-----------------------------
SELECT time_id, time_last_emaj_gid, time_event FROM emaj.emaj_time_stamp ORDER BY time_id;
 time_id | time_last_emaj_gid | time_event 
---------+--------------------+------------
       1 |                  0 | C
       2 |                  0 | C
       3 |                  0 | C
       4 |                  0 | C
       5 |                  0 | S
       6 |                  0 | S
       7 |                  0 | S
       8 |                 29 | M
       9 |                 40 | M
      10 |                 46 | R
      11 |                 76 | M
      12 |                 80 | M
      13 |                 80 | R
      14 |                 82 | M
      15 |                 82 | R
      16 |                 84 | M
      17 |                 84 | M
      18 |                 84 | A
      19 |                 84 | S
      20 |                 84 | A
      21 |                 84 | X
      22 |                 84 | R
      23 |                 84 | R
      24 |                 93 | M
      25 |                107 | M
      26 |                107 | M
      27 |                107 | M
      28 |                107 | R
      29 |                109 | M
      30 |                109 | R
      31 |                119 | R
      32 |                122 | R
      33 |                125 | M
      34 |                125 | S
      35 |                131 | R
      36 |                131 | X
      37 |                131 | D
(37 rows)

SELECT hist_function, hist_event, hist_object,
       regexp_replace(regexp_replace(regexp_replace(hist_wording,
            E'\\d\\d\.\\d\\d\\.\\d\\d\\.\\d\\d\\d(\\d?)', '%', 'g'),
            E'\\d\\d\\d\\d/\\d\\d\\/\\d\\d\\ \\d\\d\\:\\d\\d:\\d\\d .*?\\)', '<timestamp>)', 'g'),
            E'\\[.+\\]', '(timestamp)', 'g'),
       hist_user
  FROM emaj.emaj_hist
  ORDER BY hist_id;
      hist_function       |     hist_event     |                            hist_object                            |                                        regexp_replace                                         |     hist_user      
--------------------------+--------------------+-------------------------------------------------------------------+-----------------------------------------------------------------------------------------------+--------------------
 EMAJ_INSTALL             |                    | E-Maj 3.1.0                                                       | Initialisation completed                                                                      | postgres
 CREATE_GROUP             | BEGIN              | myGroup1                                                          | rollbackable                                                                                  | _regress_emaj_adm1
 CREATE_GROUP             | LOG_SCHEMA CREATED | emaj_myschema1                                                    |                                                                                               | _regress_emaj_adm1
 CREATE_GROUP             | END                | myGroup1                                                          | 6 tables/sequences processed                                                                  | _regress_emaj_adm1
 CREATE_GROUP             | BEGIN              | myGroup2                                                          | rollbackable                                                                                  | _regress_emaj_adm1
 CREATE_GROUP             | LOG_SCHEMA CREATED | emaj_myschema2                                                    |                                                                                               | _regress_emaj_adm1
 CREATE_GROUP             | END                | myGroup2                                                          | 6 tables/sequences processed                                                                  | _regress_emaj_adm1
 CREATE_GROUP             | BEGIN              | phil's group#3",                                                  | audit_only                                                                                    | _regress_emaj_adm1
 CREATE_GROUP             | LOG_SCHEMA CREATED | "emaj_phil's schema""3"                                           |                                                                                               | _regress_emaj_adm1
 CREATE_GROUP             | END                | phil's group#3",                                                  | 3 tables/sequences processed                                                                  | _regress_emaj_adm1
 CREATE_GROUP             | BEGIN              | myGroup6                                                          | rollbackable                                                                                  | _regress_emaj_adm1
 CREATE_GROUP             | LOG_SCHEMA CREATED | emaj_myschema6                                                    |                                                                                               | _regress_emaj_adm1
 CREATE_GROUP             | END                | myGroup6                                                          | 4 tables/sequences processed                                                                  | _regress_emaj_adm1
 START_GROUP              | BEGIN              | myGroup1                                                          | With log reset                                                                                | _regress_emaj_adm1
 LOCK_GROUP               | BEGIN              | myGroup1                                                          |                                                                                               | _regress_emaj_adm1
 LOCK_GROUP               | END                | myGroup1                                                          | 5 tables locked, 0 deadlock(s)                                                                | _regress_emaj_adm1
 SET_MARK_GROUP           | BEGIN              | myGroup1                                                          | M1                                                                                            | _regress_emaj_adm1
 SET_MARK_GROUP           | END                | myGroup1                                                          | M1                                                                                            | _regress_emaj_adm1
 START_GROUP              | END                | myGroup1                                                          | 6 tables/sequences processed                                                                  | _regress_emaj_adm1
 START_GROUP              | BEGIN              | myGroup2                                                          | With log reset                                                                                | _regress_emaj_adm1
 LOCK_GROUP               | BEGIN              | myGroup2                                                          |                                                                                               | _regress_emaj_adm1
 LOCK_GROUP               | END                | myGroup2                                                          | 4 tables locked, 0 deadlock(s)                                                                | _regress_emaj_adm1
 SET_MARK_GROUP           | BEGIN              | myGroup2                                                          | M1                                                                                            | _regress_emaj_adm1
 SET_MARK_GROUP           | END                | myGroup2                                                          | M1                                                                                            | _regress_emaj_adm1
 START_GROUP              | END                | myGroup2                                                          | 6 tables/sequences processed                                                                  | _regress_emaj_adm1
 START_GROUP              | BEGIN              | phil's group#3",                                                  | With log reset                                                                                | _regress_emaj_adm1
 LOCK_GROUP               | BEGIN              | phil's group#3",                                                  |                                                                                               | _regress_emaj_adm1
 LOCK_GROUP               | END                | phil's group#3",                                                  | 2 tables locked, 0 deadlock(s)                                                                | _regress_emaj_adm1
 SET_MARK_GROUP           | BEGIN              | phil's group#3",                                                  | M1                                                                                            | _regress_emaj_adm1
 SET_MARK_GROUP           | END                | phil's group#3",                                                  | M1                                                                                            | _regress_emaj_adm1
 START_GROUP              | END                | phil's group#3",                                                  | 3 tables/sequences processed                                                                  | _regress_emaj_adm1
 SET_MARK_GROUP           | BEGIN              | myGroup1                                                          |                                                                                               | _regress_emaj_adm1
 LOCK_GROUP               | BEGIN              | myGroup1                                                          |                                                                                               | _regress_emaj_adm1
 LOCK_GROUP               | END                | myGroup1                                                          | 5 tables locked, 0 deadlock(s)                                                                | _regress_emaj_adm1
 SET_MARK_GROUP           | END                | myGroup1                                                          | M2                                                                                            | _regress_emaj_adm1
 SET_MARK_GROUP           | BEGIN              | myGroup1                                                          |                                                                                               | _regress_emaj_adm1
 LOCK_GROUP               | BEGIN              | myGroup1                                                          |                                                                                               | _regress_emaj_adm1
 LOCK_GROUP               | END                | myGroup1                                                          | 5 tables locked, 0 deadlock(s)                                                                | _regress_emaj_adm1
 SET_MARK_GROUP           | END                | myGroup1                                                          | M3                                                                                            | _regress_emaj_adm1
 COMMENT_MARK_GROUP       |                    | myGroup1                                                          | Mark M3                                                                                       | _regress_emaj_adm1
 ROLLBACK_GROUP           | BEGIN              | myGroup1                                                          | Unlogged rollback to mark M3 (timestamp)                                                      | postgres
 DBLINK_OPEN_CNX          |                    | rlbk#1                                                            | Status = -5                                                                                   | postgres
 LOCK_GROUP               | BEGIN              | myGroup1                                                          | Rollback session #1                                                                           | postgres
 LOCK_GROUP               | END                | myGroup1                                                          | Rollback session #1: 5 tables locked, 0 deadlock(s)                                           | postgres
 ROLLBACK_TABLE           | BEGIN              | myschema1.mytbl1                                                  | All log rows with emaj_gid > 40 and <= 46                                                     | postgres
 ROLLBACK_TABLE           | END                | myschema1.mytbl1                                                  | 6 rolled back primary keys                                                                    | postgres
 ROLLBACK_SEQUENCE        |                    | myschema1."myTbl3_col31_seq"                                      |                                                                                               | postgres
 ROLLBACK_GROUP           | NOTICE             | Rollback id 1                                                     | 1 / 5 tables effectively processed.                                                           | postgres
 ROLLBACK_GROUP           | NOTICE             | Rollback id 1                                                     | 1 sequences processed.                                                                        | postgres
 ROLLBACK_GROUP           | END                | myGroup1                                                          | Rollback_id 1, 1 tables and 1 sequences effectively processed                                 | postgres
 PROTECT_MARK_GROUP       |                    | myGroup1                                                          | Mark M3 ; status 1                                                                            | _regress_emaj_adm1
 PROTECT_GROUP            |                    | myGroup1                                                          | Status 1                                                                                      | _regress_emaj_adm1
 SET_MARK_GROUP           | BEGIN              | myGroup2                                                          |                                                                                               | postgres
 LOCK_GROUP               | BEGIN              | myGroup2                                                          |                                                                                               | postgres
 LOCK_GROUP               | END                | myGroup2                                                          | 4 tables locked, 0 deadlock(s)                                                                | postgres
 SET_MARK_GROUP           | END                | myGroup2                                                          | M2                                                                                            | postgres
 SET_MARK_GROUP           | BEGIN              | myGroup2                                                          |                                                                                               | _regress_emaj_adm1
 LOCK_GROUP               | BEGIN              | myGroup2                                                          |                                                                                               | _regress_emaj_adm1
 LOCK_GROUP               | END                | myGroup2                                                          | 4 tables locked, 0 deadlock(s)                                                                | _regress_emaj_adm1
 SET_MARK_GROUP           | END                | myGroup2                                                          | M3                                                                                            | _regress_emaj_adm1
 ROLLBACK_GROUP           | BEGIN              | myGroup2                                                          | Logged rollback to mark M2 (timestamp)                                                        | _regress_emaj_adm1
 DBLINK_OPEN_CNX          |                    | rlbk#1                                                            | Status = -3                                                                                   | _regress_emaj_adm1
 LOCK_GROUP               | BEGIN              | myGroup2                                                          | Rollback session #1                                                                           | _regress_emaj_adm1
 LOCK_GROUP               | END                | myGroup2                                                          | Rollback session #1: 4 tables locked, 0 deadlock(s)                                           | _regress_emaj_adm1
 SET_MARK_GROUP           | BEGIN              | myGroup2                                                          | RLBK_M2_%_START                                                                               | _regress_emaj_adm1
 SET_MARK_GROUP           | END                | myGroup2                                                          | RLBK_M2_%_START                                                                               | _regress_emaj_adm1
 ROLLBACK_TABLE           | BEGIN              | myschema2.mytbl4                                                  | All log rows with emaj_gid > 76 and <= 80                                                     | _regress_emaj_adm1
 ROLLBACK_TABLE           | END                | myschema2.mytbl4                                                  | 2 rolled back primary keys                                                                    | _regress_emaj_adm1
 ROLLBACK_SEQUENCE        |                    | myschema2."myTbl3_col31_seq"                                      |                                                                                               | _regress_emaj_adm1
 ROLLBACK_SEQUENCE        |                    | myschema2.myseq1                                                  | RESTART 1001 MAXVALUE 2000 CYCLE                                                              | _regress_emaj_adm1
 SET_MARK_GROUP           | BEGIN              | myGroup2                                                          | RLBK_M2_%_DONE                                                                                | _regress_emaj_adm1
 SET_MARK_GROUP           | END                | myGroup2                                                          | RLBK_M2_%_DONE                                                                                | _regress_emaj_adm1
 ROLLBACK_GROUP           | NOTICE             | Rollback id 2                                                     | 1 / 4 tables effectively processed.                                                           | _regress_emaj_adm1
 ROLLBACK_GROUP           | NOTICE             | Rollback id 2                                                     | 2 sequences processed.                                                                        | _regress_emaj_adm1
 ROLLBACK_GROUP           | END                | myGroup2                                                          | Rollback_id 2, 1 tables and 2 sequences effectively processed                                 | _regress_emaj_adm1
 ROLLBACK_GROUP           | BEGIN              | myGroup2                                                          | Logged rollback to mark M3 (timestamp)                                                        | _regress_emaj_adm1
 DBLINK_OPEN_CNX          |                    | rlbk#1                                                            | Status = -3                                                                                   | _regress_emaj_adm1
 LOCK_GROUP               | BEGIN              | myGroup2                                                          | Rollback session #1                                                                           | _regress_emaj_adm1
 LOCK_GROUP               | END                | myGroup2                                                          | Rollback session #1: 4 tables locked, 0 deadlock(s)                                           | _regress_emaj_adm1
 SET_MARK_GROUP           | BEGIN              | myGroup2                                                          | RLBK_M3_%_START                                                                               | _regress_emaj_adm1
 SET_MARK_GROUP           | END                | myGroup2                                                          | RLBK_M3_%_START                                                                               | _regress_emaj_adm1
 ROLLBACK_TABLE           | BEGIN              | myschema2.mytbl4                                                  | All log rows with emaj_gid > 80 and <= 82                                                     | _regress_emaj_adm1
 ROLLBACK_TABLE           | END                | myschema2.mytbl4                                                  | 2 rolled back primary keys                                                                    | _regress_emaj_adm1
 ROLLBACK_SEQUENCE        |                    | myschema2."myTbl3_col31_seq"                                      |                                                                                               | _regress_emaj_adm1
 ROLLBACK_SEQUENCE        |                    | myschema2.myseq1                                                  | RESTART 1004 MAXVALUE 9223372036854775807 NO  CYCLE                                           | _regress_emaj_adm1
 SET_MARK_GROUP           | BEGIN              | myGroup2                                                          | RLBK_M3_%_DONE                                                                                | _regress_emaj_adm1
 SET_MARK_GROUP           | END                | myGroup2                                                          | RLBK_M3_%_DONE                                                                                | _regress_emaj_adm1
 ROLLBACK_GROUP           | NOTICE             | Rollback id 3                                                     | 1 / 4 tables effectively processed.                                                           | _regress_emaj_adm1
 ROLLBACK_GROUP           | NOTICE             | Rollback id 3                                                     | 2 sequences processed.                                                                        | _regress_emaj_adm1
 ROLLBACK_GROUP           | END                | myGroup2                                                          | Rollback_id 3, 1 tables and 2 sequences effectively processed                                 | _regress_emaj_adm1
 SET_MARK_GROUPS          | BEGIN              | myGroup1,myGroup2                                                 | Common                                                                                        | _regress_emaj_adm1
 LOCK_GROUPS              | BEGIN              | myGroup1,myGroup2                                                 |                                                                                               | _regress_emaj_adm1
 LOCK_GROUPS              | END                | myGroup1,myGroup2                                                 | 9 tables locked, 0 deadlock(s)                                                                | _regress_emaj_adm1
 SET_MARK_GROUPS          | END                | myGroup1,myGroup2                                                 | Common                                                                                        | _regress_emaj_adm1
 ALTER_GROUP              | BEGIN              | myGroup1                                                          |                                                                                               | _regress_emaj_adm1
 LOCK_GROUP               | BEGIN              | myGroup1                                                          |                                                                                               | _regress_emaj_adm1
 LOCK_GROUP               | END                | myGroup1                                                          | 5 tables locked, 0 deadlock(s)                                                                | _regress_emaj_adm1
 SET_MARK_GROUP           | BEGIN              | myGroup1                                                          | ALTER_%                                                                                       | _regress_emaj_adm1
 SET_MARK_GROUP           | END                | myGroup1                                                          | ALTER_%                                                                                       | _regress_emaj_adm1
 ALTER_GROUP              | TABLE REMOVED      | myschema1."myTbl3"                                                | From the group myGroup1                                                                       | _regress_emaj_adm1
 ALTER_GROUP              | END                | myGroup1                                                          | Timestamp Id : 18                                                                             | _regress_emaj_adm1
 START_GROUP              | BEGIN              | myGroup6                                                          | With log reset                                                                                | _regress_emaj_adm1
 LOCK_GROUP               | BEGIN              | myGroup6                                                          |                                                                                               | _regress_emaj_adm1
 LOCK_GROUP               | END                | myGroup6                                                          | 4 tables locked, 0 deadlock(s)                                                                | _regress_emaj_adm1
 SET_MARK_GROUP           | BEGIN              | myGroup6                                                          | Start G6                                                                                      | _regress_emaj_adm1
 SET_MARK_GROUP           | END                | myGroup6                                                          | Start G6                                                                                      | _regress_emaj_adm1
 START_GROUP              | END                | myGroup6                                                          | 4 tables/sequences processed                                                                  | _regress_emaj_adm1
 ALTER_GROUP              | BEGIN              | myGroup6                                                          |                                                                                               | _regress_emaj_adm1
 LOCK_GROUP               | BEGIN              | myGroup6                                                          |                                                                                               | _regress_emaj_adm1
 LOCK_GROUP               | END                | myGroup6                                                          | 4 tables locked, 0 deadlock(s)                                                                | _regress_emaj_adm1
 SET_MARK_GROUP           | BEGIN              | myGroup6                                                          | ALTER_%                                                                                       | _regress_emaj_adm1
 SET_MARK_GROUP           | END                | myGroup6                                                          | ALTER_%                                                                                       | _regress_emaj_adm1
 ALTER_GROUP              | TABLE REMOVED      | myschema6.table_with_55_characters_long_name_____0_________0abcde | From the group myGroup6                                                                       | _regress_emaj_adm1
 ALTER_GROUP              | END                | myGroup6                                                          | Timestamp Id : 20                                                                             | _regress_emaj_adm1
 STOP_GROUP               | BEGIN              | myGroup6                                                          |                                                                                               | _regress_emaj_adm1
 LOCK_GROUP               | BEGIN              | myGroup6                                                          |                                                                                               | _regress_emaj_adm1
 LOCK_GROUP               | END                | myGroup6                                                          | 3 tables locked, 0 deadlock(s)                                                                | _regress_emaj_adm1
 SET_MARK_GROUP           | BEGIN              | myGroup6                                                          | STOP_%                                                                                        | _regress_emaj_adm1
 SET_MARK_GROUP           | END                | myGroup6                                                          | STOP_%                                                                                        | _regress_emaj_adm1
 STOP_GROUP               | END                | myGroup6                                                          | 3 tables/sequences processed                                                                  | _regress_emaj_adm1
 EMAJ_INSTALL             | BEGIN              | E-Maj 3.2.0                                                       | Upgrade from 3.1.0 started                                                                    | postgres
 EMAJ_INSTALL             | END                | E-Maj 3.2.0                                                       | Upgrade from 3.1.0 completed                                                                  | postgres
 EMAJ_INSTALL             | BEGIN              | E-Maj 3.3.0                                                       | Upgrade from 3.2.0 started                                                                    | postgres
 EMAJ_INSTALL             | END                | E-Maj 3.3.0                                                       | Upgrade from 3.2.0 completed                                                                  | postgres
 EMAJ_INSTALL             | BEGIN              | E-Maj 3.4.0                                                       | Upgrade from 3.3.0 started                                                                    | postgres
 EMAJ_INSTALL             | END                | E-Maj 3.4.0                                                       | Upgrade from 3.3.0 completed                                                                  | postgres
 EMAJ_INSTALL             | BEGIN              | E-Maj 4.0.0                                                       | Upgrade from 3.4.0 started                                                                    | postgres
 EMAJ_INSTALL             | END                | E-Maj 4.0.0                                                       | Upgrade from 3.4.0 completed                                                                  | postgres
 EMAJ_INSTALL             | BEGIN              | E-Maj 4.0.1                                                       | Upgrade from 4.0.0 started                                                                    | postgres
 EMAJ_INSTALL             | END                | E-Maj 4.0.1                                                       | Upgrade from 4.0.0 completed                                                                  | postgres
 EMAJ_INSTALL             | BEGIN              | E-Maj 4.1.0                                                       | Upgrade from 4.0.1 started                                                                    | postgres
 EMAJ_INSTALL             | END                | E-Maj 4.1.0                                                       | Upgrade from 4.0.1 completed                                                                  | postgres
 EMAJ_INSTALL             | BEGIN              | E-Maj 4.2.0                                                       | Upgrade from 4.1.0 started                                                                    | postgres
 EMAJ_INSTALL             | END                | E-Maj 4.2.0                                                       | Upgrade from 4.1.0 completed                                                                  | postgres
 EMAJ_INSTALL             | BEGIN              | E-Maj 4.3.0                                                       | Upgrade from 4.2.0 started                                                                    | postgres
 EMAJ_INSTALL             | END                | E-Maj 4.3.0                                                       | Upgrade from 4.2.0 completed                                                                  | postgres
 EMAJ_INSTALL             | BEGIN              | E-Maj 4.3.1                                                       | Upgrade from 4.3.0 started                                                                    | postgres
 EMAJ_INSTALL             | END                | E-Maj 4.3.1                                                       | Upgrade from 4.3.0 completed                                                                  | postgres
 EMAJ_INSTALL             | BEGIN              | E-Maj 4.4.0                                                       | Upgrade from 4.3.1 started                                                                    | postgres
 EMAJ_INSTALL             | END                | E-Maj 4.4.0                                                       | Upgrade from 4.3.1 completed                                                                  | postgres
 EMAJ_INSTALL             | BEGIN              | E-Maj 4.5.0                                                       | Upgrade from 4.4.0 started                                                                    | postgres
 EMAJ_INSTALL             | END                | E-Maj 4.5.0                                                       | Upgrade from 4.4.0 completed                                                                  | postgres
 EMAJ_INSTALL             | BEGIN              | E-Maj 4.6.0                                                       | Upgrade from 4.5.0 started                                                                    | postgres
 EMAJ_INSTALL             | END                | E-Maj 4.6.0                                                       | Upgrade from 4.5.0 completed                                                                  | postgres
 EMAJ_INSTALL             | BEGIN              | E-Maj 4.7.0                                                       | Upgrade from 4.6.0 started                                                                    | postgres
 EMAJ_INSTALL             | END                | E-Maj 4.7.0                                                       | Upgrade from 4.6.0 completed                                                                  | postgres
 EMAJ_INSTALL             | BEGIN              | E-Maj 4.7.1                                                       | Upgrade from 4.7.0 started                                                                    | postgres
 EMAJ_INSTALL             | END                | E-Maj 4.7.1                                                       | Upgrade from 4.7.0 completed                                                                  | postgres
 EMAJ_INSTALL             | BEGIN              | E-Maj <devel>                                                     | Upgrade from 4.7.1 started                                                                    | postgres
 EMAJ_INSTALL             | END                | E-Maj <devel>                                                     | Upgrade from 4.7.1 completed                                                                  | postgres
 UNPROTECT_GROUP          |                    | myGroup1                                                          | Status 1                                                                                      | _regress_emaj_adm2
 ROLLBACK_GROUPS          | BEGIN              | myGroup1,myGroup2                                                 | Unlogged rollback to mark Common (timestamp)                                                  | _regress_emaj_adm2
 DBLINK_OPEN_CNX          |                    | rlbk#1                                                            | Status = -5 ('dblink_user_password' parameter not set)                                        | _regress_emaj_adm2
 LOCK_GROUP               | BEGIN              | myGroup1,myGroup2                                                 | Rollback session #1                                                                           | _regress_emaj_adm2
 LOCK_GROUP               | END                | myGroup1,myGroup2                                                 | Rollback session #1: 8 tables locked, 0 deadlock(s)                                           | _regress_emaj_adm2
 ROLLBACK_GROUPS          | TIME STAMP SET     | 22                                                                |                                                                                               | _regress_emaj_adm2
 ROLLBACK_GROUPS          | MARK DELETED       | myGroup1                                                          | mark ALTER_% is deleted                                                                       | _regress_emaj_adm2
 ROLLBACK_GROUPS          | NOTICE             | Rollback id 4                                                     | Rollback id = 4.                                                                              | _regress_emaj_adm2
 ROLLBACK_GROUPS          | NOTICE             | Rollback id 4                                                     | 0 / 8 tables effectively processed.                                                           | _regress_emaj_adm2
 ROLLBACK_GROUPS          | NOTICE             | Rollback id 4                                                     | 0 / 3 sequences effectively processed.                                                        | _regress_emaj_adm2
 ROLLBACK_GROUPS          | WARNING            | Rollback id 4                                                     | The table myschema1."myTbl3" has been left unchanged (not in group anymore since <timestamp>) | _regress_emaj_adm2
 ROLLBACK_GROUPS          | END                | myGroup1,myGroup2                                                 | Rollback_id 4                                                                                 | _regress_emaj_adm2
 UNPROTECT_MARK_GROUP     |                    | myGroup1                                                          | Mark M3 ; status 1                                                                            | _regress_emaj_adm2
 ROLLBACK_GROUP           | BEGIN              | myGroup1                                                          | Logged rollback to mark M2 (timestamp)                                                        | _regress_emaj_adm2
 DBLINK_OPEN_CNX          |                    | rlbk#1                                                            | Status = -5 ('dblink_user_password' parameter not set)                                        | _regress_emaj_adm2
 LOCK_GROUP               | BEGIN              | myGroup1                                                          | Rollback session #1                                                                           | _regress_emaj_adm2
 LOCK_GROUP               | END                | myGroup1                                                          | Rollback session #1: 4 tables locked, 0 deadlock(s)                                           | _regress_emaj_adm2
 ROLLBACK_GROUP           | TIME STAMP SET     | 23                                                                |                                                                                               | _regress_emaj_adm2
 SET_MARK_GROUP           | BEGIN              | myGroup1                                                          | RLBK_5_START                                                                                  | _regress_emaj_adm2
 SET_MARK_GROUP           | END                | myGroup1                                                          | RLBK_5_START                                                                                  | _regress_emaj_adm2
 ROLLBACK_TABLE           | BEGIN              | myschema1.mytbl4                                                  | All log rows where emaj_gid > 29 and <= 84, in session_replication_role = replica mode        | _regress_emaj_adm2
 ROLLBACK_TABLE           | END                | myschema1.mytbl4                                                  | 6 rolled back primary keys                                                                    | _regress_emaj_adm2
 ROLLBACK_TABLE           | BEGIN              | myschema1.mytbl1                                                  | All log rows where emaj_gid > 29 and <= 84, in session_replication_role = replica mode        | _regress_emaj_adm2
 ROLLBACK_TABLE           | END                | myschema1.mytbl1                                                  | 5 rolled back primary keys                                                                    | _regress_emaj_adm2
 ROLLBACK_TABLE           | BEGIN              | myschema1.mytbl2                                                  | All log rows where emaj_gid > 29 and <= 84, in session_replication_role = replica mode        | _regress_emaj_adm2
 ROLLBACK_TABLE           | END                | myschema1.mytbl2                                                  | 1 rolled back primary keys                                                                    | _regress_emaj_adm2
 ROLLBACK_TABLE           | BEGIN              | myschema1.mytbl2b                                                 | All log rows where emaj_gid > 29 and <= 84                                                    | _regress_emaj_adm2
 ROLLBACK_TABLE           | END                | myschema1.mytbl2b                                                 | 1 rolled back primary keys                                                                    | _regress_emaj_adm2
 ROLLBACK_GROUP           | TIME STAMP SET     | 24                                                                |                                                                                               | _regress_emaj_adm2
 SET_MARK_GROUP           | BEGIN              | myGroup1                                                          | RLBK_5_DONE                                                                                   | _regress_emaj_adm2
 SET_MARK_GROUP           | END                | myGroup1                                                          | RLBK_5_DONE                                                                                   | _regress_emaj_adm2
 ROLLBACK_GROUP           | NOTICE             | Rollback id 5                                                     | Rollback id = 5.                                                                              | _regress_emaj_adm2
 ROLLBACK_GROUP           | NOTICE             | Rollback id 5                                                     | 4 / 4 tables effectively processed.                                                           | _regress_emaj_adm2
 ROLLBACK_GROUP           | NOTICE             | Rollback id 5                                                     | 0 / 1 sequences effectively processed.                                                        | _regress_emaj_adm2
 ROLLBACK_GROUP           | WARNING            | Rollback id 5                                                     | The table myschema1."myTbl3" has been left unchanged (not in group anymore since <timestamp>) | _regress_emaj_adm2
 ROLLBACK_GROUP           | END                | myGroup1                                                          | Rollback_id 5                                                                                 | _regress_emaj_adm2
 RENAME_MARK_GROUP        | BEGIN              | myGroup1                                                          | EMAJ_LAST_MARK                                                                                | _regress_emaj_adm2
 RENAME_MARK_GROUP        | END                | myGroup1                                                          | RLBK_5_DONE renamed End_rollback_to_M2                                                        | _regress_emaj_adm2
 CONSOLIDATE_RLBK_GROUP   | BEGIN              | myGroup1                                                          | Erase all between marks M2 and End_rollback_to_M2                                             | _regress_emaj_adm2
 CONSOLIDATE_RLBK_GROUP   | END                | myGroup1                                                          | 4 tables and 1 sequences processed ; 3 marks deleted                                          | _regress_emaj_adm2
 SET_MARK_GROUP           | BEGIN              | myGroup1                                                          | M4                                                                                            | _regress_emaj_adm2
 LOCK_GROUP               | BEGIN              | myGroup1                                                          |                                                                                               | _regress_emaj_adm2
 LOCK_GROUP               | END                | myGroup1                                                          | 4 tables locked, 0 deadlock(s)                                                                | _regress_emaj_adm2
 SET_MARK_GROUP           | TIME STAMP SET     | 25                                                                |                                                                                               | _regress_emaj_adm2
 SET_MARK_GROUP           | END                | myGroup1                                                          | M4                                                                                            | _regress_emaj_adm2
 SET_MARK_GROUP           | BEGIN              | myGroup1                                                          | M5                                                                                            | _regress_emaj_adm2
 LOCK_GROUP               | BEGIN              | myGroup1                                                          |                                                                                               | _regress_emaj_adm2
 LOCK_GROUP               | END                | myGroup1                                                          | 4 tables locked, 0 deadlock(s)                                                                | _regress_emaj_adm2
 SET_MARK_GROUP           | TIME STAMP SET     | 26                                                                |                                                                                               | _regress_emaj_adm2
 SET_MARK_GROUP           | END                | myGroup1                                                          | M5                                                                                            | _regress_emaj_adm2
 SET_MARK_GROUP           | BEGIN              | myGroup1                                                          | M6                                                                                            | _regress_emaj_adm2
 LOCK_GROUP               | BEGIN              | myGroup1                                                          |                                                                                               | _regress_emaj_adm2
 LOCK_GROUP               | END                | myGroup1                                                          | 4 tables locked, 0 deadlock(s)                                                                | _regress_emaj_adm2
 SET_MARK_GROUP           | TIME STAMP SET     | 27                                                                |                                                                                               | _regress_emaj_adm2
 SET_MARK_GROUP           | END                | myGroup1                                                          | M6                                                                                            | _regress_emaj_adm2
 ROLLBACK_GROUP           | BEGIN              | myGroup2                                                          | Logged rollback to mark M2 (timestamp)                                                        | _regress_emaj_adm2
 DBLINK_OPEN_CNX          |                    | rlbk#1                                                            | Status = -5 ('dblink_user_password' parameter not set)                                        | _regress_emaj_adm2
 LOCK_GROUP               | BEGIN              | myGroup2                                                          | Rollback session #1                                                                           | _regress_emaj_adm2
 LOCK_GROUP               | END                | myGroup2                                                          | Rollback session #1: 4 tables locked, 0 deadlock(s)                                           | _regress_emaj_adm2
 ROLLBACK_GROUP           | TIME STAMP SET     | 28                                                                |                                                                                               | _regress_emaj_adm2
 SET_MARK_GROUP           | BEGIN              | myGroup2                                                          | RLBK_6_START                                                                                  | _regress_emaj_adm2
 SET_MARK_GROUP           | END                | myGroup2                                                          | RLBK_6_START                                                                                  | _regress_emaj_adm2
 ROLLBACK_SEQUENCE        |                    | myschema2.myseq1                                                  | RESTART 1001 MAXVALUE 2000 CYCLE                                                              | _regress_emaj_adm2
 ROLLBACK_TABLE           | BEGIN              | myschema2.mytbl4                                                  | All log rows where emaj_gid > 76 and <= 107, in session_replication_role = replica mode       | _regress_emaj_adm2
 ROLLBACK_TABLE           | END                | myschema2.mytbl4                                                  | 2 rolled back primary keys                                                                    | _regress_emaj_adm2
 ROLLBACK_GROUP           | TIME STAMP SET     | 29                                                                |                                                                                               | _regress_emaj_adm2
 SET_MARK_GROUP           | BEGIN              | myGroup2                                                          | RLBK_6_DONE                                                                                   | _regress_emaj_adm2
 SET_MARK_GROUP           | END                | myGroup2                                                          | RLBK_6_DONE                                                                                   | _regress_emaj_adm2
 ROLLBACK_GROUP           | NOTICE             | Rollback id 6                                                     | Rollback id = 6.                                                                              | _regress_emaj_adm2
 ROLLBACK_GROUP           | NOTICE             | Rollback id 6                                                     | 1 / 4 tables effectively processed.                                                           | _regress_emaj_adm2
 ROLLBACK_GROUP           | NOTICE             | Rollback id 6                                                     | 1 / 2 sequences effectively processed.                                                        | _regress_emaj_adm2
 ROLLBACK_GROUP           | END                | myGroup2                                                          | Rollback_id 6                                                                                 | _regress_emaj_adm2
 ROLLBACK_GROUP           | BEGIN              | myGroup2                                                          | Unlogged rollback to mark M3 (timestamp)                                                      | _regress_emaj_adm2
 DBLINK_OPEN_CNX          |                    | rlbk#1                                                            | Status = -5 ('dblink_user_password' parameter not set)                                        | _regress_emaj_adm2
 LOCK_GROUP               | BEGIN              | myGroup2                                                          | Rollback session #1                                                                           | _regress_emaj_adm2
 LOCK_GROUP               | END                | myGroup2                                                          | Rollback session #1: 4 tables locked, 0 deadlock(s)                                           | _regress_emaj_adm2
 ROLLBACK_GROUP           | TIME STAMP SET     | 30                                                                |                                                                                               | _regress_emaj_adm2
 ROLLBACK_SEQUENCE        |                    | myschema2.myseq1                                                  | RESTART 1004 MAXVALUE 9223372036854775807 NO CYCLE                                            | _regress_emaj_adm2
 ROLLBACK_TABLE           | BEGIN              | myschema2.mytbl4                                                  | All log rows where emaj_gid > 80 and <= 109, in session_replication_role = replica mode       | _regress_emaj_adm2
 ROLLBACK_TABLE           | END                | myschema2.mytbl4                                                  | 2 rolled back primary keys                                                                    | _regress_emaj_adm2
 ROLLBACK_GROUP           | MARK DELETED       | myGroup2                                                          | mark RLBK_M2_%_START is deleted                                                               | _regress_emaj_adm2
 ROLLBACK_GROUP           | MARK DELETED       | myGroup2                                                          | mark RLBK_M2_%_DONE is deleted                                                                | _regress_emaj_adm2
 ROLLBACK_GROUP           | MARK DELETED       | myGroup2                                                          | mark RLBK_M3_%_START is deleted                                                               | _regress_emaj_adm2
 ROLLBACK_GROUP           | MARK DELETED       | myGroup2                                                          | mark RLBK_M3_%_DONE is deleted                                                                | _regress_emaj_adm2
 ROLLBACK_GROUP           | MARK DELETED       | myGroup2                                                          | mark Common is deleted                                                                        | _regress_emaj_adm2
 ROLLBACK_GROUP           | MARK DELETED       | myGroup2                                                          | mark RLBK_6_START is deleted                                                                  | _regress_emaj_adm2
 ROLLBACK_GROUP           | MARK DELETED       | myGroup2                                                          | mark RLBK_6_DONE is deleted                                                                   | _regress_emaj_adm2
 ROLLBACK_GROUP           | NOTICE             | Rollback id 7                                                     | Rollback id = 7.                                                                              | _regress_emaj_adm2
 ROLLBACK_GROUP           | NOTICE             | Rollback id 7                                                     | 1 / 4 tables effectively processed.                                                           | _regress_emaj_adm2
 ROLLBACK_GROUP           | NOTICE             | Rollback id 7                                                     | 1 / 2 sequences effectively processed.                                                        | _regress_emaj_adm2
 ROLLBACK_GROUP           | END                | myGroup2                                                          | Rollback_id 7                                                                                 | _regress_emaj_adm2
 ROLLBACK_GROUP           | BEGIN              | myGroup1                                                          | Unlogged rollback to mark M5 (timestamp)                                                      | _regress_emaj_adm2
 DBLINK_OPEN_CNX          |                    | rlbk#1                                                            | Status = -5 ('dblink_user_password' parameter not set)                                        | _regress_emaj_adm2
 LOCK_GROUP               | BEGIN              | myGroup1                                                          | Rollback session #1                                                                           | _regress_emaj_adm2
 LOCK_GROUP               | END                | myGroup1                                                          | Rollback session #1: 4 tables locked, 0 deadlock(s)                                           | _regress_emaj_adm2
 ROLLBACK_GROUP           | TIME STAMP SET     | 31                                                                |                                                                                               | _regress_emaj_adm2
 ROLLBACK_TABLE           | BEGIN              | myschema1.mytbl4                                                  | All log rows where emaj_gid > 107 and <= 119, in session_replication_role = replica mode      | _regress_emaj_adm2
 ROLLBACK_TABLE           | END                | myschema1.mytbl4                                                  | 3 rolled back primary keys                                                                    | _regress_emaj_adm2
 ROLLBACK_TABLE           | BEGIN              | myschema1.mytbl2                                                  | All log rows where emaj_gid > 107 and <= 119, in session_replication_role = replica mode      | _regress_emaj_adm2
 ROLLBACK_TABLE           | END                | myschema1.mytbl2                                                  | 4 rolled back primary keys                                                                    | _regress_emaj_adm2
 ROLLBACK_TABLE           | BEGIN              | myschema1.mytbl1                                                  | All log rows where emaj_gid > 107 and <= 119, in session_replication_role = replica mode      | _regress_emaj_adm2
 ROLLBACK_TABLE           | END                | myschema1.mytbl1                                                  | 1 rolled back primary keys                                                                    | _regress_emaj_adm2
 ROLLBACK_GROUP           | MARK DELETED       | myGroup1                                                          | mark M6 is deleted                                                                            | _regress_emaj_adm2
 ROLLBACK_GROUP           | NOTICE             | Rollback id 8                                                     | Rollback id = 8.                                                                              | _regress_emaj_adm2
 ROLLBACK_GROUP           | NOTICE             | Rollback id 8                                                     | 3 / 4 tables effectively processed.                                                           | _regress_emaj_adm2
 ROLLBACK_GROUP           | NOTICE             | Rollback id 8                                                     | 0 / 1 sequences effectively processed.                                                        | _regress_emaj_adm2
 ROLLBACK_GROUP           | END                | myGroup1                                                          | Rollback_id 8                                                                                 | _regress_emaj_adm2
 ROLLBACK_GROUP           | BEGIN              | myGroup1                                                          | Logged rollback to mark M4 (timestamp)                                                        | _regress_emaj_adm2
 DBLINK_OPEN_CNX          |                    | rlbk#1                                                            | Status = -5 ('dblink_user_password' parameter not set)                                        | _regress_emaj_adm2
 LOCK_GROUP               | BEGIN              | myGroup1                                                          | Rollback session #1                                                                           | _regress_emaj_adm2
 LOCK_GROUP               | END                | myGroup1                                                          | Rollback session #1: 4 tables locked, 0 deadlock(s)                                           | _regress_emaj_adm2
 ROLLBACK_GROUP           | TIME STAMP SET     | 32                                                                |                                                                                               | _regress_emaj_adm2
 SET_MARK_GROUP           | BEGIN              | myGroup1                                                          | RLBK_9_START                                                                                  | _regress_emaj_adm2
 SET_MARK_GROUP           | END                | myGroup1                                                          | RLBK_9_START                                                                                  | _regress_emaj_adm2
 ROLLBACK_TABLE           | BEGIN              | myschema1.mytbl4                                                  | All log rows where emaj_gid > 107 and <= 122, in session_replication_role = replica mode      | _regress_emaj_adm2
 ROLLBACK_TABLE           | END                | myschema1.mytbl4                                                  | 2 rolled back primary keys                                                                    | _regress_emaj_adm2
 ROLLBACK_TABLE           | BEGIN              | myschema1.mytbl1                                                  | All log rows where emaj_gid > 107 and <= 122, in session_replication_role = replica mode      | _regress_emaj_adm2
 ROLLBACK_TABLE           | END                | myschema1.mytbl1                                                  | 1 rolled back primary keys                                                                    | _regress_emaj_adm2
 ROLLBACK_GROUP           | TIME STAMP SET     | 33                                                                |                                                                                               | _regress_emaj_adm2
 SET_MARK_GROUP           | BEGIN              | myGroup1                                                          | RLBK_9_DONE                                                                                   | _regress_emaj_adm2
 SET_MARK_GROUP           | END                | myGroup1                                                          | RLBK_9_DONE                                                                                   | _regress_emaj_adm2
 ROLLBACK_GROUP           | NOTICE             | Rollback id 9                                                     | Rollback id = 9.                                                                              | _regress_emaj_adm2
 ROLLBACK_GROUP           | NOTICE             | Rollback id 9                                                     | 2 / 4 tables effectively processed.                                                           | _regress_emaj_adm2
 ROLLBACK_GROUP           | NOTICE             | Rollback id 9                                                     | 0 / 1 sequences effectively processed.                                                        | _regress_emaj_adm2
 ROLLBACK_GROUP           | END                | myGroup1                                                          | Rollback_id 9                                                                                 | _regress_emaj_adm2
 GEN_SQL_GROUP            | BEGIN              | myGroup1                                                          | From mark M1 to current state with tables/sequences filtering                                 | _regress_emaj_adm2
 GEN_SQL_GROUP            | END                | myGroup1                                                          | 36 generated statements - script not exported                                                 | _regress_emaj_adm2
 RENAME_MARK_GROUP        | BEGIN              | myGroup1                                                          | RLBK_9_START                                                                                  | _regress_emaj_adm2
 RENAME_MARK_GROUP        | END                | myGroup1                                                          | RLBK_9_START renamed Before logged rollback to M4                                             | _regress_emaj_adm2
 DELETE_MARK_GROUP        | BEGIN              | myGroup1                                                          | RLBK_9_DONE                                                                                   | _regress_emaj_adm2
 DELETE_MARK_GROUP        | END                | myGroup1                                                          | RLBK_9_DONE                                                                                   | _regress_emaj_adm2
 DELETE_MARK_GROUP        | BEGIN              | myGroup1                                                          | M1                                                                                            | _regress_emaj_adm2
 DELETE_MARK_GROUP        | END                | myGroup1                                                          | M1                                                                                            | _regress_emaj_adm2
 DELETE_BEFORE_MARK_GROUP | BEGIN              | myGroup1                                                          | M4                                                                                            | _regress_emaj_adm2
 DELETE_BEFORE_MARK_GROUP | END                | myGroup1                                                          | 2 marks deleted ; M4 is now the initial mark                                                  | _regress_emaj_adm2
 START_GROUP              | BEGIN              | myGroup6                                                          | With logs reset                                                                               | _regress_emaj_adm2
 LOCK_GROUP               | BEGIN              | myGroup6                                                          |                                                                                               | _regress_emaj_adm2
 LOCK_GROUP               | END                | myGroup6                                                          | 3 tables locked, 0 deadlock(s)                                                                | _regress_emaj_adm2
 START_GROUP              | TIME STAMP SET     | 34                                                                |                                                                                               | _regress_emaj_adm2
 SET_MARK_GROUP           | BEGIN              | myGroup6                                                          | Start G6                                                                                      | _regress_emaj_adm2
 SET_MARK_GROUP           | END                | myGroup6                                                          | Start G6                                                                                      | _regress_emaj_adm2
 START_GROUP              | END                | myGroup6                                                          | 3 tables/sequences processed                                                                  | _regress_emaj_adm2
 ROLLBACK_GROUP           | BEGIN              | myGroup6                                                          | Unlogged rollback to mark Start G6 (timestamp)                                                | _regress_emaj_adm2
 DBLINK_OPEN_CNX          |                    | rlbk#1                                                            | Status = -5 ('dblink_user_password' parameter not set)                                        | _regress_emaj_adm2
 LOCK_GROUP               | BEGIN              | myGroup6                                                          | Rollback session #1                                                                           | _regress_emaj_adm2
 LOCK_GROUP               | END                | myGroup6                                                          | Rollback session #1: 3 tables locked, 0 deadlock(s)                                           | _regress_emaj_adm2
 ROLLBACK_GROUP           | TIME STAMP SET     | 35                                                                |                                                                                               | _regress_emaj_adm2
 ROLLBACK_TABLE           | BEGIN              | myschema6.table_with_51_characters_long_name_____0_________0a     | All log rows where emaj_gid > 125 and <= 131                                                  | _regress_emaj_adm2
 ROLLBACK_TABLE           | END                | myschema6.table_with_51_characters_long_name_____0_________0a     | 4 rolled back primary keys                                                                    | _regress_emaj_adm2
 ROLLBACK_GROUP           | NOTICE             | Rollback id 10                                                    | Rollback id = 10.                                                                             | _regress_emaj_adm2
 ROLLBACK_GROUP           | NOTICE             | Rollback id 10                                                    | 1 / 3 tables effectively processed.                                                           | _regress_emaj_adm2
 ROLLBACK_GROUP           | END                | myGroup6                                                          | Rollback_id 10                                                                                | _regress_emaj_adm2
 STOP_GROUP               | BEGIN              | myGroup6                                                          | Without logs reset                                                                            | _regress_emaj_adm2
 LOCK_GROUP               | BEGIN              | myGroup6                                                          |                                                                                               | _regress_emaj_adm2
 LOCK_GROUP               | END                | myGroup6                                                          | 3 tables locked, 0 deadlock(s)                                                                | _regress_emaj_adm2
 STOP_GROUP               | TIME STAMP SET     | 36                                                                |                                                                                               | _regress_emaj_adm2
 SET_MARK_GROUP           | BEGIN              | myGroup6                                                          | STOP_%                                                                                        | _regress_emaj_adm2
 SET_MARK_GROUP           | END                | myGroup6                                                          | STOP_%                                                                                        | _regress_emaj_adm2
 STOP_GROUP               | END                | myGroup6                                                          | 3 tables/sequences processed                                                                  | _regress_emaj_adm2
 DROP_GROUP               | BEGIN              | myGroup6                                                          |                                                                                               | _regress_emaj_adm2
 DROP_GROUP               | TIME STAMP SET     | 37                                                                |                                                                                               | _regress_emaj_adm2
 DROP_GROUP               | LOG_SCHEMA DROPPED | emaj_myschema6                                                    |                                                                                               | _regress_emaj_adm2
 DROP_GROUP               | END                | myGroup6                                                          | 3 tables/sequences processed                                                                  | _regress_emaj_adm2
(313 rows)

--
-- Set sequence restart value.
TRUNCATE emaj.emaj_hist;
SELECT public.handle_emaj_sequences(30000);
 handle_emaj_sequences 
-----------------------
 
(1 row)

-- The groups are left in their current state for the parallel rollback test.
-- Perform some updates to prepare the parallel rollback test.
-- Set a mark for both groups.
SET session_authorization TO _regress_emaj_adm2;
SELECT emaj.emaj_set_mark_groups(ARRAY['myGroup1', 'myGroup2'], 'Multi-1');
 emaj_set_mark_groups 
----------------------
                   11
(1 row)

--
RESET session_authorization;
SELECT count(*) FROM mySchema1.myTbl4;
 count 
-------
     0
(1 row)

SELECT count(*) FROM mySchema1.myTbl1;
 count 
-------
    20
(1 row)

SELECT count(*) FROM mySchema1.myTbl2;
 count 
-------
     3
(1 row)

SELECT count(*) FROM mySchema1."myTbl3";
 count 
-------
    10
(1 row)

SELECT count(*) FROM mySchema1.myTbl2b;
 count 
-------
     3
(1 row)

SELECT count(*) FROM mySchema2.myTbl4;
 count 
-------
     2
(1 row)

SELECT count(*) FROM mySchema2.myTbl1;
 count 
-------
    10
(1 row)

SELECT count(*) FROM mySchema2.myTbl2;
 count 
-------
     2
(1 row)

SELECT count(*) FROM mySchema2."myTbl3";
 count 
-------
    10
(1 row)

DELETE FROM mySchema1.myTbl4;
DELETE FROM mySchema1.myTbl1;
DELETE FROM mySchema1.myTbl2;
DELETE FROM mySchema1."myTbl3";
DELETE FROM mySchema1.myTbl2b;
DELETE FROM mySchema2.myTbl4;
DELETE FROM mySchema2.myTbl1;
DELETE FROM mySchema2.myTbl2;
DELETE FROM mySchema2."myTbl3";
ALTER SEQUENCE mySchema2.mySeq1 restart 9999;
