-- adm2.sql : complex scenario executed by an emaj_adm role. 
--            Follows adm1.sql, and includes more specific test cases
--
-----------------------------
-- Step 8 : use of multi-group functions, start_group(s) without log reset and use deleted marks
-----------------------------
-- stop both groups
select emaj.emaj_stop_groups(array['myGroup1','myGroup2']);
 emaj_stop_groups 
------------------
               14
(1 row)

-- start both groups
select emaj.emaj_start_groups(array['myGroup1','myGroup2'],'Multi-1', false);
 emaj_start_groups 
-------------------
                14
(1 row)

-- set a mark for both groups
select emaj.emaj_set_mark_groups(array['myGroup1','myGroup2'],'Multi-2');
 emaj_set_mark_groups 
----------------------
                   14
(1 row)

-- logged rollback to Multi-1
select emaj.emaj_logged_rollback_groups(array['myGroup1','myGroup2'],'Multi-1');
 emaj_logged_rollback_groups 
-----------------------------
                           3
(1 row)

-- rollback to Multi-2
select emaj.emaj_rollback_groups(array['myGroup1','myGroup2'],'Multi-2');
 emaj_rollback_groups 
----------------------
                    3
(1 row)

-- rollback and stop to Multi-1
select emaj.emaj_rollback_groups(array['myGroup1','myGroup2'],'Multi-1');
 emaj_rollback_groups 
----------------------
                    3
(1 row)

select emaj.emaj_stop_groups(array['myGroup1','myGroup2'],'Stop after rollback');
 emaj_stop_groups 
------------------
               14
(1 row)

-- try to start both groups, but with an old deleted mark name
select emaj.emaj_start_groups(array['myGroup1','myGroup2'],'Multi-1', false);
ERROR:  _check_new_mark: Group myGroup1 already contains a mark named Multi-1.
CONTEXT:  SQL statement "SELECT emaj._check_new_mark(v_mark, v_groupNames)"
PL/pgSQL function emaj._start_groups(text[],text,boolean,boolean) line 49 at SQL statement
SQL statement "SELECT emaj._start_groups(emaj._check_group_names_array(v_groupNames), v_mark, true, v_resetLog)"
PL/pgSQL function emaj.emaj_start_groups(text[],text,boolean) line 16 at SQL statement
-- really start both groups
select emaj.emaj_start_groups(array['myGroup1','myGroup2'],'Multi-1b', false);
 emaj_start_groups 
-------------------
                14
(1 row)

-- set again a mark for both groups
select emaj.emaj_set_mark_groups(array['myGroup1','myGroup2'],'Multi-2');
 emaj_set_mark_groups 
----------------------
                   14
(1 row)

-- delete the mark for only 1 group and get detailed statistics for the other group
select emaj.emaj_delete_mark_group('myGroup1','Multi-2');
 emaj_delete_mark_group 
------------------------
                      1
(1 row)

-- use this mark for the other group before delete it
select * from emaj.emaj_detailed_log_stat_group('myGroup2','Multi-2',NULL);
 stat_group | stat_schema | stat_table | stat_role | stat_verb | stat_rows 
------------+-------------+------------+-----------+-----------+-----------
(0 rows)

select emaj.emaj_rollback_group('myGroup2','Multi-2');
 emaj_rollback_group 
---------------------
                   2
(1 row)

select emaj.emaj_delete_mark_group('myGroup2','Multi-2');
 emaj_delete_mark_group 
------------------------
                      1
(1 row)

-- get statistics using deleted marks
select * from emaj.emaj_detailed_log_stat_group('myGroup2','M1','M2');
 stat_group | stat_schema | stat_table | stat_role | stat_verb | stat_rows 
------------+-------------+------------+-----------+-----------+-----------
 myGroup2   | myschema2   | mytbl1     | postgres  | DELETE    |         1
 myGroup2   | myschema2   | mytbl1     | postgres  | INSERT    |        11
 myGroup2   | myschema2   | mytbl1     | postgres  | UPDATE    |         3
 myGroup2   | myschema2   | mytbl2     | postgres  | INSERT    |         2
 myGroup2   | myschema2   | myTbl3     | postgres  | INSERT    |        10
 myGroup2   | myschema2   | mytbl5     | postgres  | INSERT    |         2
 myGroup2   | myschema2   | mytbl5     | postgres  | UPDATE    |         1
 myGroup2   | myschema2   | mytbl6     | postgres  | INSERT    |         8
 myGroup2   | myschema2   | mytbl6     | postgres  | UPDATE    |         3
(9 rows)

-- delete intermediate deleted marks
select emaj.emaj_delete_mark_group('myGroup1','Multi-1');
 emaj_delete_mark_group 
------------------------
                      1
(1 row)

select emaj.emaj_delete_mark_group('myGroup2','Multi-1');
 emaj_delete_mark_group 
------------------------
                      1
(1 row)

-- ... and reuse mark names for parallel rollback test
select emaj.emaj_rename_mark_group('myGroup1','Multi-1b','Multi-1');
 emaj_rename_mark_group 
------------------------
 
(1 row)

select emaj.emaj_rename_mark_group('myGroup2','Multi-1b','Multi-1');
 emaj_rename_mark_group 
------------------------
 
(1 row)

-- rename a deleted mark
select emaj.emaj_rename_mark_group('myGroup2','M2','Deleted M2');
 emaj_rename_mark_group 
------------------------
 
(1 row)

-- use emaj_get_previous_mark_group and delete an initial deleted mark
select emaj.emaj_delete_before_mark_group('myGroup2',
      (select emaj.emaj_get_previous_mark_group('myGroup2',
             (select mark_datetime from emaj.emaj_mark where mark_group = 'myGroup2' and mark_name = 'M3')+'0.000001 SECOND'::interval)));
 emaj_delete_before_mark_group 
-------------------------------
                             2
(1 row)

-- comment a deleted mark
select emaj.emaj_comment_mark_group('myGroup2','M3','This mark is deleted');
 emaj_comment_mark_group 
-------------------------
 
(1 row)

-- try to get rollback duration on a deleted mark
select emaj.emaj_estimate_rollback_duration('myGroup2','M3');
ERROR:  emaj_estimate_rollback_duration: mark M3 for group myGroup2 is not in ACTIVE state.
-- try to rollback on a deleted mark
select emaj.emaj_rollback_group('myGroup2','M3');
ERROR:  _rlbk_groups_step1: mark M3 for group myGroup2 is not in ACTIVE state.
CONTEXT:  SQL statement "SELECT emaj._rlbk_groups_step1(v_groupNames, v_mark, v_unloggedRlbk, 1, v_multiGroup)"
PL/pgSQL function emaj._rlbk_groups(text[],text,boolean,boolean,boolean) line 20 at SQL statement
PL/pgSQL function emaj.emaj_rollback_group(text,text) line 8 at RETURN
-----------------------------
-- Checking step 8
-----------------------------
-- emaj tables
select mark_id, mark_group, regexp_replace(mark_name,E'\\d\\d\.\\d\\d\\.\\d\\d\\.\\d\\d\\d','%','g'), mark_global_seq, mark_state, mark_comment, mark_last_seq_hole_id, mark_last_sequence_id, mark_log_rows_before_next from emaj.emaj_mark order by mark_id;
 mark_id | mark_group |        regexp_replace        | mark_global_seq | mark_state |     mark_comment     | mark_last_seq_hole_id | mark_last_sequence_id | mark_log_rows_before_next 
---------+------------+------------------------------+-----------------+------------+----------------------+-----------------------+-----------------------+---------------------------
      97 | myGroup2   | M3                           |           11920 | DELETED    | This mark is deleted |                    10 |                   658 |                         0
     102 | myGroup1   | M4                           |           11949 | DELETED    |                      |                    12 |                   696 |                        10
     103 | myGroup1   | M5                           |           11959 | DELETED    |                      |                    12 |                   702 |                         3
     107 | myGroup1   | Before logged rollback to M4 |           11989 | DELETED    |                      |                    17 |                   730 |                        18
     109 | myGroup1   | STOP_%                       |           12007 | DELETED    |                      |                    17 |                   750 |                         0
     110 | myGroup2   | STOP_%                       |           12007 | DELETED    |                      |                    17 |                   750 |                         0
     119 | myGroup1   | Stop after rollback          |           12007 | DELETED    |                      |                    17 |                   820 |                          
     120 | myGroup2   | Stop after rollback          |           12007 | DELETED    |                      |                    17 |                   820 |                          
     121 | myGroup1   | Multi-1                      |           12007 | ACTIVE     |                      |                    17 |                   834 |                          
     122 | myGroup2   | Multi-1                      |           12007 | ACTIVE     |                      |                    17 |                   834 |                          
(10 rows)

select sequ_id,sequ_schema, sequ_name, regexp_replace(sequ_mark,E'\\d\\d\.\\d\\d\\.\\d\\d\\.\\d\\d\\d','%','g'), sequ_last_val, sequ_is_called from emaj.emaj_sequence order by sequ_id;
 sequ_id | sequ_schema |         sequ_name         |        regexp_replace        | sequ_last_val | sequ_is_called 
---------+-------------+---------------------------+------------------------------+---------------+----------------
     638 | emajC       | myschema1_myTbl3_log_seq  | M3                           |            10 | t
     641 | emaj        | myschema1_mytbl2_log_seq  | M3                           |             2 | t
     642 | emajb       | myschema1_mytbl2b_log_seq | M3                           |             1 | f
     651 | myschema2   | myseq1                    | M3                           |          1003 | t
     652 | emaj        | myschema2_mytbl1_log_seq  | M3                           |            15 | t
     653 | emaj        | myschema2_mytbl2_log_seq  | M3                           |             2 | t
     654 | emajC       | myschema2_myTbl3_log_seq  | M3                           |            10 | t
     655 | myschema2   | myTbl3_col31_seq          | M3                           |            20 | t
     656 | emaj        | myschema2_mytbl4_log_seq  | M3                           |             4 | t
     657 | emaj        | myschema2_mytbl5_log_seq  | M3                           |             4 | t
     658 | emaj        | myschema2_mytbl6_log_seq  | M3                           |            14 | t
     660 | emaj        | myschema2_mytbl1_log_seq  | RLBK_M2_%_START              |            15 | t
     661 | emaj        | myschema2_mytbl2_log_seq  | RLBK_M2_%_START              |             2 | t
     662 | emajC       | myschema2_myTbl3_log_seq  | RLBK_M2_%_START              |            10 | t
     668 | emaj        | myschema2_mytbl1_log_seq  | RLBK_M2_%_DONE               |            15 | t
     669 | emaj        | myschema2_mytbl2_log_seq  | RLBK_M2_%_DONE               |             2 | t
     670 | emajC       | myschema2_myTbl3_log_seq  | RLBK_M2_%_DONE               |            10 | t
     676 | emaj        | myschema2_mytbl1_log_seq  | RLBK_M3_%_START              |            15 | t
     677 | emaj        | myschema2_mytbl2_log_seq  | RLBK_M3_%_START              |             2 | t
     678 | emajC       | myschema2_myTbl3_log_seq  | RLBK_M3_%_START              |            10 | t
     684 | emaj        | myschema2_mytbl1_log_seq  | RLBK_M3_%_DONE               |            15 | t
     685 | emaj        | myschema2_mytbl2_log_seq  | RLBK_M3_%_DONE               |             2 | t
     686 | emajC       | myschema2_myTbl3_log_seq  | RLBK_M3_%_DONE               |            10 | t
     691 | myschema1   | myTbl3_col31_seq          | M4                           |            20 | t
     692 | emajC       | myschema1_myTbl3_log_seq  | M4                           |            10 | t
     693 | emaj        | myschema1_mytbl1_log_seq  | M4                           |            30 | t
     694 | emaj        | myschema1_mytbl4_log_seq  | M4                           |             8 | t
     695 | emaj        | myschema1_mytbl2_log_seq  | M4                           |             3 | t
     696 | emajb       | myschema1_mytbl2b_log_seq | M4                           |             1 | f
     697 | myschema1   | myTbl3_col31_seq          | M5                           |            20 | t
     698 | emajC       | myschema1_myTbl3_log_seq  | M5                           |            20 | t
     699 | emaj        | myschema1_mytbl1_log_seq  | M5                           |            30 | t
     700 | emaj        | myschema1_mytbl4_log_seq  | M5                           |             8 | t
     701 | emaj        | myschema1_mytbl2_log_seq  | M5                           |             3 | t
     702 | emajb       | myschema1_mytbl2b_log_seq | M5                           |             1 | f
     704 | emajC       | myschema1_myTbl3_log_seq  | M6                           |            20 | t
     707 | emaj        | myschema1_mytbl2_log_seq  | M6                           |             3 | t
     708 | emajb       | myschema1_mytbl2b_log_seq | M6                           |             1 | f
     710 | emaj        | myschema2_mytbl1_log_seq  | RLBK_M2_%_START              |            15 | t
     711 | emaj        | myschema2_mytbl2_log_seq  | RLBK_M2_%_START              |             2 | t
     712 | emajC       | myschema2_myTbl3_log_seq  | RLBK_M2_%_START              |            10 | t
     718 | emaj        | myschema2_mytbl1_log_seq  | RLBK_M2_%_DONE               |            15 | t
     719 | emaj        | myschema2_mytbl2_log_seq  | RLBK_M2_%_DONE               |             2 | t
     720 | emajC       | myschema2_myTbl3_log_seq  | RLBK_M2_%_DONE               |            10 | t
     725 | myschema1   | myTbl3_col31_seq          | Before logged rollback to M4 |            20 | t
     726 | emajC       | myschema1_myTbl3_log_seq  | Before logged rollback to M4 |            20 | t
     727 | emaj        | myschema1_mytbl1_log_seq  | Before logged rollback to M4 |            32 | t
     728 | emaj        | myschema1_mytbl4_log_seq  | Before logged rollback to M4 |            12 | t
     729 | emaj        | myschema1_mytbl2_log_seq  | Before logged rollback to M4 |             3 | t
     730 | emajb       | myschema1_mytbl2b_log_seq | Before logged rollback to M4 |             1 | f
     737 | myschema1   | myTbl3_col31_seq          | STOP_%                       |            20 | t
     738 | emajC       | myschema1_myTbl3_log_seq  | STOP_%                       |            35 | t
     739 | emaj        | myschema1_mytbl1_log_seq  | STOP_%                       |            33 | t
     740 | emaj        | myschema1_mytbl4_log_seq  | STOP_%                       |            14 | t
     741 | emaj        | myschema1_mytbl2_log_seq  | STOP_%                       |             3 | t
     742 | emajb       | myschema1_mytbl2b_log_seq | STOP_%                       |             1 | f
     743 | myschema2   | myseq1                    | STOP_%                       |          1004 | f
     744 | emaj        | myschema2_mytbl1_log_seq  | STOP_%                       |            15 | t
     745 | emaj        | myschema2_mytbl2_log_seq  | STOP_%                       |             2 | t
     746 | emajC       | myschema2_myTbl3_log_seq  | STOP_%                       |            10 | t
     747 | myschema2   | myTbl3_col31_seq          | STOP_%                       |            20 | t
     748 | emaj        | myschema2_mytbl4_log_seq  | STOP_%                       |            24 | t
     749 | emaj        | myschema2_mytbl5_log_seq  | STOP_%                       |             9 | t
     750 | emaj        | myschema2_mytbl6_log_seq  | STOP_%                       |            29 | t
     766 | emajC       | myschema1_myTbl3_log_seq  | Multi-2                      |            35 | t
     767 | emaj        | myschema1_mytbl1_log_seq  | Multi-2                      |            33 | t
     768 | emaj        | myschema1_mytbl4_log_seq  | Multi-2                      |            14 | t
     769 | emaj        | myschema1_mytbl2_log_seq  | Multi-2                      |             3 | t
     770 | emajb       | myschema1_mytbl2b_log_seq | Multi-2                      |             1 | f
     772 | emaj        | myschema2_mytbl1_log_seq  | Multi-2                      |            15 | t
     773 | emaj        | myschema2_mytbl2_log_seq  | Multi-2                      |             2 | t
     774 | emajC       | myschema2_myTbl3_log_seq  | Multi-2                      |            10 | t
     776 | emaj        | myschema2_mytbl4_log_seq  | Multi-2                      |            24 | t
     777 | emaj        | myschema2_mytbl5_log_seq  | Multi-2                      |             9 | t
     778 | emaj        | myschema2_mytbl6_log_seq  | Multi-2                      |            29 | t
     780 | emajC       | myschema1_myTbl3_log_seq  | RLBK_Multi-1_%_START         |            35 | t
     781 | emaj        | myschema1_mytbl1_log_seq  | RLBK_Multi-1_%_START         |            33 | t
     782 | emaj        | myschema1_mytbl4_log_seq  | RLBK_Multi-1_%_START         |            14 | t
     783 | emaj        | myschema1_mytbl2_log_seq  | RLBK_Multi-1_%_START         |             3 | t
     784 | emajb       | myschema1_mytbl2b_log_seq | RLBK_Multi-1_%_START         |             1 | f
     786 | emaj        | myschema2_mytbl1_log_seq  | RLBK_Multi-1_%_START         |            15 | t
     787 | emaj        | myschema2_mytbl2_log_seq  | RLBK_Multi-1_%_START         |             2 | t
     788 | emajC       | myschema2_myTbl3_log_seq  | RLBK_Multi-1_%_START         |            10 | t
     790 | emaj        | myschema2_mytbl4_log_seq  | RLBK_Multi-1_%_START         |            24 | t
     791 | emaj        | myschema2_mytbl5_log_seq  | RLBK_Multi-1_%_START         |             9 | t
     792 | emaj        | myschema2_mytbl6_log_seq  | RLBK_Multi-1_%_START         |            29 | t
     794 | emajC       | myschema1_myTbl3_log_seq  | RLBK_Multi-1_%_DONE          |            35 | t
     795 | emaj        | myschema1_mytbl1_log_seq  | RLBK_Multi-1_%_DONE          |            33 | t
     796 | emaj        | myschema1_mytbl4_log_seq  | RLBK_Multi-1_%_DONE          |            14 | t
     797 | emaj        | myschema1_mytbl2_log_seq  | RLBK_Multi-1_%_DONE          |             3 | t
     798 | emajb       | myschema1_mytbl2b_log_seq | RLBK_Multi-1_%_DONE          |             1 | f
     800 | emaj        | myschema2_mytbl1_log_seq  | RLBK_Multi-1_%_DONE          |            15 | t
     801 | emaj        | myschema2_mytbl2_log_seq  | RLBK_Multi-1_%_DONE          |             2 | t
     802 | emajC       | myschema2_myTbl3_log_seq  | RLBK_Multi-1_%_DONE          |            10 | t
     804 | emaj        | myschema2_mytbl4_log_seq  | RLBK_Multi-1_%_DONE          |            24 | t
     805 | emaj        | myschema2_mytbl5_log_seq  | RLBK_Multi-1_%_DONE          |             9 | t
     806 | emaj        | myschema2_mytbl6_log_seq  | RLBK_Multi-1_%_DONE          |            29 | t
     807 | myschema1   | myTbl3_col31_seq          | Stop after rollback          |            20 | t
     808 | emajC       | myschema1_myTbl3_log_seq  | Stop after rollback          |            35 | t
     809 | emaj        | myschema1_mytbl1_log_seq  | Stop after rollback          |            33 | t
     810 | emaj        | myschema1_mytbl4_log_seq  | Stop after rollback          |            14 | t
     811 | emaj        | myschema1_mytbl2_log_seq  | Stop after rollback          |             3 | t
     812 | emajb       | myschema1_mytbl2b_log_seq | Stop after rollback          |             1 | f
     813 | myschema2   | myseq1                    | Stop after rollback          |          1004 | f
     814 | emaj        | myschema2_mytbl1_log_seq  | Stop after rollback          |            15 | t
     815 | emaj        | myschema2_mytbl2_log_seq  | Stop after rollback          |             2 | t
     816 | emajC       | myschema2_myTbl3_log_seq  | Stop after rollback          |            10 | t
     817 | myschema2   | myTbl3_col31_seq          | Stop after rollback          |            20 | t
     818 | emaj        | myschema2_mytbl4_log_seq  | Stop after rollback          |            24 | t
     819 | emaj        | myschema2_mytbl5_log_seq  | Stop after rollback          |             9 | t
     820 | emaj        | myschema2_mytbl6_log_seq  | Stop after rollback          |            29 | t
     821 | myschema1   | myTbl3_col31_seq          | Multi-1                      |            20 | t
     822 | emajC       | myschema1_myTbl3_log_seq  | Multi-1                      |            35 | t
     823 | emaj        | myschema1_mytbl1_log_seq  | Multi-1                      |            33 | t
     824 | emaj        | myschema1_mytbl4_log_seq  | Multi-1                      |            14 | t
     825 | emaj        | myschema1_mytbl2_log_seq  | Multi-1                      |             3 | t
     826 | emajb       | myschema1_mytbl2b_log_seq | Multi-1                      |             1 | f
     827 | myschema2   | myseq1                    | Multi-1                      |          1004 | f
     828 | emaj        | myschema2_mytbl1_log_seq  | Multi-1                      |            15 | t
     829 | emaj        | myschema2_mytbl2_log_seq  | Multi-1                      |             2 | t
     830 | emajC       | myschema2_myTbl3_log_seq  | Multi-1                      |            10 | t
     831 | myschema2   | myTbl3_col31_seq          | Multi-1                      |            20 | t
     832 | emaj        | myschema2_mytbl4_log_seq  | Multi-1                      |            24 | t
     833 | emaj        | myschema2_mytbl5_log_seq  | Multi-1                      |             9 | t
     834 | emaj        | myschema2_mytbl6_log_seq  | Multi-1                      |            29 | t
(125 rows)

select sqhl_id, sqhl_schema, sqhl_table, sqhl_hole_size from emaj.emaj_seq_hole order by sqhl_id;
 sqhl_id | sqhl_schema | sqhl_table | sqhl_hole_size 
---------+-------------+------------+----------------
      13 | myschema2   | mytbl4     |             20
      14 | myschema2   | mytbl5     |              5
      15 | myschema2   | mytbl6     |             15
      16 | myschema1   | mytbl1     |              1
      17 | myschema1   | mytbl4     |              2
(5 rows)

-- log tables
select col11, col12, col13, emaj_verb, emaj_tuple, emaj_gid from emaj.mySchema1_myTbl1_log order by emaj_gid, emaj_tuple desc;
 col11 |   col12    | col13 | emaj_verb | emaj_tuple | emaj_gid 
-------+------------+-------+-----------+------------+----------
     1 | Step 6     | \x01  | INS       | NEW        |    11987
     1 | Step 6     | \x01  | DEL       | OLD        |    12000
(2 rows)

select col21, col22, col23, emaj_verb, emaj_tuple, emaj_gid from emaj.mySchema1_myTbl2_log order by emaj_gid, emaj_tuple desc;
 col21 | col22 | col23 | emaj_verb | emaj_tuple | emaj_gid 
-------+-------+-------+-----------+------------+----------
(0 rows)

select col20, col21, emaj_verb, emaj_tuple, emaj_gid from emajb.mySchema1_myTbl2b_log order by emaj_gid, emaj_tuple desc;
 col20 | col21 | emaj_verb | emaj_tuple | emaj_gid 
-------+-------+-----------+------------+----------
(0 rows)

select col31, col33, emaj_verb, emaj_tuple, emaj_gid from "emajC"."myschema1_myTbl3_log" order by emaj_gid, emaj_tuple desc;
 col31 | col33 | emaj_verb | emaj_tuple | emaj_gid 
-------+-------+-----------+------------+----------
    11 | 10.00 | UPD       | OLD        |    11950
    11 |  5.00 | UPD       | NEW        |    11950
    12 | 10.00 | UPD       | OLD        |    11951
    12 |  5.00 | UPD       | NEW        |    11951
    13 | 10.00 | UPD       | OLD        |    11952
    13 |  5.00 | UPD       | NEW        |    11952
    14 | 10.00 | UPD       | OLD        |    11953
    14 |  5.00 | UPD       | NEW        |    11953
    15 | 10.00 | UPD       | OLD        |    11954
    15 |  5.00 | UPD       | NEW        |    11954
    16 | 10.00 | UPD       | OLD        |    11955
    16 |  5.00 | UPD       | NEW        |    11955
    17 | 10.00 | UPD       | OLD        |    11956
    17 |  5.00 | UPD       | NEW        |    11956
    18 | 10.00 | UPD       | OLD        |    11957
    18 |  5.00 | UPD       | NEW        |    11957
    19 | 10.00 | UPD       | OLD        |    11958
    19 |  5.00 | UPD       | NEW        |    11958
    20 | 10.00 | UPD       | OLD        |    11959
    20 |  5.00 | UPD       | NEW        |    11959
    20 |  5.00 | UPD       | OLD        |    11990
    20 | 10.00 | UPD       | NEW        |    11990
    19 |  5.00 | UPD       | OLD        |    11991
    19 | 10.00 | UPD       | NEW        |    11991
    18 |  5.00 | UPD       | OLD        |    11992
    18 | 10.00 | UPD       | NEW        |    11992
    17 |  5.00 | UPD       | OLD        |    11993
    17 | 10.00 | UPD       | NEW        |    11993
    16 |  5.00 | UPD       | OLD        |    11994
    16 | 10.00 | UPD       | NEW        |    11994
    15 |  5.00 | UPD       | OLD        |    11995
    15 | 10.00 | UPD       | NEW        |    11995
    14 |  5.00 | UPD       | OLD        |    11996
    14 | 10.00 | UPD       | NEW        |    11996
    13 |  5.00 | UPD       | OLD        |    11997
    13 | 10.00 | UPD       | NEW        |    11997
    12 |  5.00 | UPD       | OLD        |    11998
    12 | 10.00 | UPD       | NEW        |    11998
    11 |  5.00 | UPD       | OLD        |    11999
    11 | 10.00 | UPD       | NEW        |    11999
    14 | 10.00 | DEL       | OLD        |    12003
    15 | 10.00 | DEL       | OLD        |    12004
    16 | 10.00 | DEL       | OLD        |    12005
    17 | 10.00 | DEL       | OLD        |    12006
    18 | 10.00 | DEL       | OLD        |    12007
(45 rows)

select col41, col42, col43, col44, col45, emaj_verb, emaj_tuple, emaj_gid from emaj.mySchema1_myTbl4_log order by emaj_gid, emaj_tuple desc;
 col41 | col42 | col43 | col44 |   col45    | emaj_verb | emaj_tuple | emaj_gid 
-------+-------+-------+-------+------------+-----------+------------+----------
    11 |       |     1 |     1 | Step 6     | INS       | NEW        |    11988
    12 |       |     1 |     1 | Step 6     | INS       | NEW        |    11989
    12 |       |     1 |     1 | Step 6     | DEL       | OLD        |    12001
    11 |       |     1 |     1 | Step 6     | DEL       | OLD        |    12002
(4 rows)

select col11, col12, col13, emaj_verb, emaj_tuple, emaj_gid from emaj.mySchema2_myTbl1_log order by emaj_gid, emaj_tuple desc;
 col11 | col12 | col13 | emaj_verb | emaj_tuple | emaj_gid 
-------+-------+-------+-----------+------------+----------
(0 rows)

select col21, col22, col23, emaj_verb, emaj_tuple, emaj_gid from emaj.mySchema2_myTbl2_log order by emaj_gid, emaj_tuple desc;
 col21 | col22 | col23 | emaj_verb | emaj_tuple | emaj_gid 
-------+-------+-------+-----------+------------+----------
(0 rows)

select col31, col33, emaj_verb, emaj_tuple, emaj_gid from "emajC"."myschema2_myTbl3_log" order by emaj_gid, emaj_tuple desc;
 col31 | col33 | emaj_verb | emaj_tuple | emaj_gid 
-------+-------+-----------+------------+----------
(0 rows)

select col41, col42, col43, col44, col45, emaj_verb, emaj_tuple, emaj_gid from emaj.mySchema2_myTbl4_log order by emaj_gid, emaj_tuple desc;
 col41 | col42 | col43 | col44 | col45 | emaj_verb | emaj_tuple | emaj_gid 
-------+-------+-------+-------+-------+-----------+------------+----------
(0 rows)

select col51, col52, col53, col54, emaj_verb, emaj_tuple, emaj_gid from emaj.mySchema2_myTbl5_log order by emaj_gid, emaj_tuple desc;
 col51 | col52 | col53 | col54 | emaj_verb | emaj_tuple | emaj_gid 
-------+-------+-------+-------+-----------+------------+----------
(0 rows)

select col61, col62, col63, col64, col65, col66, emaj_verb, emaj_tuple, emaj_gid from emaj.mySchema2_myTbl6_log order by emaj_gid, emaj_tuple desc;
 col61 | col62 | col63 | col64 | col65 | col66 | emaj_verb | emaj_tuple | emaj_gid 
-------+-------+-------+-------+-------+-------+-----------+------------+----------
(0 rows)

-----------------------------
-- Step 9 : test the emaj_alter_group function with non rollbackable phil's group#3, group
-----------------------------
set role emaj_regression_tests_adm_user;
select emaj.emaj_create_group('phil''s group#3",',false);
NOTICE:  table "phil's schema3_myTbl2\_log" does not exist, skipping
CONTEXT:  SQL statement "DROP TABLE IF EXISTS emaj."phil's schema3_myTbl2\_log""
PL/pgSQL function emaj._create_tbl(text,text,text,text,text,boolean) line 84 at EXECUTE statement
SQL statement "SELECT emaj._create_tbl(r_tblsq.grpdef_schema, r_tblsq.grpdef_tblseq, v_logSchema, coalesce(r_tblsq.grpdef_log_dat_tsp, v_defTsp), coalesce(r_tblsq.grpdef_log_idx_tsp, v_defTsp), v_isRollbackable)"
PL/pgSQL function emaj.emaj_create_group(text,boolean) line 88 at PERFORM
NOTICE:  trigger "phil's schema3_myTbl2\_emaj_log_trg" for table "phil's schema3.myTbl2\" does not exist, skipping
CONTEXT:  SQL statement "DROP TRIGGER IF EXISTS "phil's schema3_myTbl2\_emaj_log_trg" ON "phil's schema3"."myTbl2\""
PL/pgSQL function emaj._create_tbl(text,text,text,text,text,boolean) line 149 at EXECUTE statement
SQL statement "SELECT emaj._create_tbl(r_tblsq.grpdef_schema, r_tblsq.grpdef_tblseq, v_logSchema, coalesce(r_tblsq.grpdef_log_dat_tsp, v_defTsp), coalesce(r_tblsq.grpdef_log_idx_tsp, v_defTsp), v_isRollbackable)"
PL/pgSQL function emaj.emaj_create_group(text,boolean) line 88 at PERFORM
NOTICE:  trigger "phil's schema3_myTbl2\_emaj_trunc_trg" for table "phil's schema3.myTbl2\" does not exist, skipping
CONTEXT:  SQL statement "DROP TRIGGER IF EXISTS "phil's schema3_myTbl2\_emaj_trunc_trg" ON "phil's schema3"."myTbl2\""
PL/pgSQL function emaj._create_tbl(text,text,text,text,text,boolean) line 157 at EXECUTE statement
SQL statement "SELECT emaj._create_tbl(r_tblsq.grpdef_schema, r_tblsq.grpdef_tblseq, v_logSchema, coalesce(r_tblsq.grpdef_log_dat_tsp, v_defTsp), coalesce(r_tblsq.grpdef_log_idx_tsp, v_defTsp), v_isRollbackable)"
PL/pgSQL function emaj.emaj_create_group(text,boolean) line 88 at PERFORM
NOTICE:  table "phil's schema3_phil's tbl1_log" does not exist, skipping
CONTEXT:  SQL statement "DROP TABLE IF EXISTS "emaj #'3"."phil's schema3_phil's tbl1_log""
PL/pgSQL function emaj._create_tbl(text,text,text,text,text,boolean) line 84 at EXECUTE statement
SQL statement "SELECT emaj._create_tbl(r_tblsq.grpdef_schema, r_tblsq.grpdef_tblseq, v_logSchema, coalesce(r_tblsq.grpdef_log_dat_tsp, v_defTsp), coalesce(r_tblsq.grpdef_log_idx_tsp, v_defTsp), v_isRollbackable)"
PL/pgSQL function emaj.emaj_create_group(text,boolean) line 88 at PERFORM
NOTICE:  trigger "phil's schema3_phil's tbl1_emaj_log_trg" for table "phil's schema3.phil's tbl1" does not exist, skipping
CONTEXT:  SQL statement "DROP TRIGGER IF EXISTS "phil's schema3_phil's tbl1_emaj_log_trg" ON "phil's schema3"."phil's tbl1""
PL/pgSQL function emaj._create_tbl(text,text,text,text,text,boolean) line 149 at EXECUTE statement
SQL statement "SELECT emaj._create_tbl(r_tblsq.grpdef_schema, r_tblsq.grpdef_tblseq, v_logSchema, coalesce(r_tblsq.grpdef_log_dat_tsp, v_defTsp), coalesce(r_tblsq.grpdef_log_idx_tsp, v_defTsp), v_isRollbackable)"
PL/pgSQL function emaj.emaj_create_group(text,boolean) line 88 at PERFORM
NOTICE:  trigger "phil's schema3_phil's tbl1_emaj_trunc_trg" for table "phil's schema3.phil's tbl1" does not exist, skipping
CONTEXT:  SQL statement "DROP TRIGGER IF EXISTS "phil's schema3_phil's tbl1_emaj_trunc_trg" ON "phil's schema3"."phil's tbl1""
PL/pgSQL function emaj._create_tbl(text,text,text,text,text,boolean) line 157 at EXECUTE statement
SQL statement "SELECT emaj._create_tbl(r_tblsq.grpdef_schema, r_tblsq.grpdef_tblseq, v_logSchema, coalesce(r_tblsq.grpdef_log_dat_tsp, v_defTsp), coalesce(r_tblsq.grpdef_log_idx_tsp, v_defTsp), v_isRollbackable)"
PL/pgSQL function emaj.emaj_create_group(text,boolean) line 88 at PERFORM
 emaj_create_group 
-------------------
                 3
(1 row)

reset role;
alter table "phil's schema3"."phil's tbl1" alter column "phil's col12" type char(11);
set role emaj_regression_tests_adm_user;
update emaj.emaj_group_def set grpdef_priority = 1 where grpdef_schema = 'phil''s schema3' and grpdef_tblseq = E'myTbl2\\';
select emaj.emaj_alter_group('phil''s group#3",');
NOTICE:  table "phil's schema3_phil's tbl1_log" does not exist, skipping
CONTEXT:  SQL statement "DROP TABLE IF EXISTS "emaj #'3"."phil's schema3_phil's tbl1_log""
PL/pgSQL function emaj._create_tbl(text,text,text,text,text,boolean) line 84 at EXECUTE statement
SQL statement "SELECT emaj._create_tbl(r_tblsq.grpdef_schema, r_tblsq.grpdef_tblseq, v_logSchema, coalesce(r_tblsq.grpdef_log_dat_tsp, v_defTsp), coalesce(r_tblsq.grpdef_log_idx_tsp, v_defTsp), v_isRollbackable)"
PL/pgSQL function emaj.emaj_alter_group(text) line 199 at PERFORM
NOTICE:  trigger "phil's schema3_phil's tbl1_emaj_log_trg" for table "phil's schema3.phil's tbl1" does not exist, skipping
CONTEXT:  SQL statement "DROP TRIGGER IF EXISTS "phil's schema3_phil's tbl1_emaj_log_trg" ON "phil's schema3"."phil's tbl1""
PL/pgSQL function emaj._create_tbl(text,text,text,text,text,boolean) line 149 at EXECUTE statement
SQL statement "SELECT emaj._create_tbl(r_tblsq.grpdef_schema, r_tblsq.grpdef_tblseq, v_logSchema, coalesce(r_tblsq.grpdef_log_dat_tsp, v_defTsp), coalesce(r_tblsq.grpdef_log_idx_tsp, v_defTsp), v_isRollbackable)"
PL/pgSQL function emaj.emaj_alter_group(text) line 199 at PERFORM
NOTICE:  trigger "phil's schema3_phil's tbl1_emaj_trunc_trg" for table "phil's schema3.phil's tbl1" does not exist, skipping
CONTEXT:  SQL statement "DROP TRIGGER IF EXISTS "phil's schema3_phil's tbl1_emaj_trunc_trg" ON "phil's schema3"."phil's tbl1""
PL/pgSQL function emaj._create_tbl(text,text,text,text,text,boolean) line 157 at EXECUTE statement
SQL statement "SELECT emaj._create_tbl(r_tblsq.grpdef_schema, r_tblsq.grpdef_tblseq, v_logSchema, coalesce(r_tblsq.grpdef_log_dat_tsp, v_defTsp), coalesce(r_tblsq.grpdef_log_idx_tsp, v_defTsp), v_isRollbackable)"
PL/pgSQL function emaj.emaj_alter_group(text) line 199 at PERFORM
 emaj_alter_group 
------------------
                2
(1 row)

--select rel_priority from emaj.emaj_relation where rel_schema = 'phil''s schema3' and rel_tblseq = 'phil''s tbl1';
select emaj.emaj_start_group('phil''s group#3",','M1_after_alter_group');
 emaj_start_group 
------------------
                3
(1 row)

select emaj.emaj_stop_group('phil''s group#3",');
 emaj_stop_group 
-----------------
               3
(1 row)

reset role;
alter table "phil's schema3"."phil's tbl1" alter column "phil's col12" type char(10);
set role emaj_regression_tests_adm_user;
update emaj.emaj_group_def set grpdef_priority = NULL where grpdef_schema = 'phil''s schema3' and grpdef_tblseq = E'myTbl2\\';
select emaj.emaj_alter_group('phil''s group#3",');
NOTICE:  table "phil's schema3_phil's tbl1_log" does not exist, skipping
CONTEXT:  SQL statement "DROP TABLE IF EXISTS "emaj #'3"."phil's schema3_phil's tbl1_log""
PL/pgSQL function emaj._create_tbl(text,text,text,text,text,boolean) line 84 at EXECUTE statement
SQL statement "SELECT emaj._create_tbl(r_tblsq.grpdef_schema, r_tblsq.grpdef_tblseq, v_logSchema, coalesce(r_tblsq.grpdef_log_dat_tsp, v_defTsp), coalesce(r_tblsq.grpdef_log_idx_tsp, v_defTsp), v_isRollbackable)"
PL/pgSQL function emaj.emaj_alter_group(text) line 199 at PERFORM
NOTICE:  trigger "phil's schema3_phil's tbl1_emaj_log_trg" for table "phil's schema3.phil's tbl1" does not exist, skipping
CONTEXT:  SQL statement "DROP TRIGGER IF EXISTS "phil's schema3_phil's tbl1_emaj_log_trg" ON "phil's schema3"."phil's tbl1""
PL/pgSQL function emaj._create_tbl(text,text,text,text,text,boolean) line 149 at EXECUTE statement
SQL statement "SELECT emaj._create_tbl(r_tblsq.grpdef_schema, r_tblsq.grpdef_tblseq, v_logSchema, coalesce(r_tblsq.grpdef_log_dat_tsp, v_defTsp), coalesce(r_tblsq.grpdef_log_idx_tsp, v_defTsp), v_isRollbackable)"
PL/pgSQL function emaj.emaj_alter_group(text) line 199 at PERFORM
NOTICE:  trigger "phil's schema3_phil's tbl1_emaj_trunc_trg" for table "phil's schema3.phil's tbl1" does not exist, skipping
CONTEXT:  SQL statement "DROP TRIGGER IF EXISTS "phil's schema3_phil's tbl1_emaj_trunc_trg" ON "phil's schema3"."phil's tbl1""
PL/pgSQL function emaj._create_tbl(text,text,text,text,text,boolean) line 157 at EXECUTE statement
SQL statement "SELECT emaj._create_tbl(r_tblsq.grpdef_schema, r_tblsq.grpdef_tblseq, v_logSchema, coalesce(r_tblsq.grpdef_log_dat_tsp, v_defTsp), coalesce(r_tblsq.grpdef_log_idx_tsp, v_defTsp), v_isRollbackable)"
PL/pgSQL function emaj.emaj_alter_group(text) line 199 at PERFORM
 emaj_alter_group 
------------------
                2
(1 row)

select emaj.emaj_drop_group('phil''s group#3",');
 emaj_drop_group 
-----------------
               3
(1 row)

-----------------------------
-- Step 10 : for phil''s group#3", recreate the group as rollbackable, update tables, 
--           rename a mark, then delete 2 marks then delete all before a mark 
-----------------------------
-- prepare phil's group#3, group
--
reset role;
alter table "phil's schema3"."myTbl2\" add primary key (col21);
NOTICE:  ALTER TABLE / ADD PRIMARY KEY will create implicit index "myTbl2\_pkey" for table "myTbl2\"
set role emaj_regression_tests_adm_user;
select emaj.emaj_create_group('phil''s group#3",',true);
NOTICE:  table "phil's schema3_myTbl2\_log" does not exist, skipping
CONTEXT:  SQL statement "DROP TABLE IF EXISTS emaj."phil's schema3_myTbl2\_log""
PL/pgSQL function emaj._create_tbl(text,text,text,text,text,boolean) line 84 at EXECUTE statement
SQL statement "SELECT emaj._create_tbl(r_tblsq.grpdef_schema, r_tblsq.grpdef_tblseq, v_logSchema, coalesce(r_tblsq.grpdef_log_dat_tsp, v_defTsp), coalesce(r_tblsq.grpdef_log_idx_tsp, v_defTsp), v_isRollbackable)"
PL/pgSQL function emaj.emaj_create_group(text,boolean) line 88 at PERFORM
NOTICE:  trigger "phil's schema3_myTbl2\_emaj_log_trg" for table "phil's schema3.myTbl2\" does not exist, skipping
CONTEXT:  SQL statement "DROP TRIGGER IF EXISTS "phil's schema3_myTbl2\_emaj_log_trg" ON "phil's schema3"."myTbl2\""
PL/pgSQL function emaj._create_tbl(text,text,text,text,text,boolean) line 149 at EXECUTE statement
SQL statement "SELECT emaj._create_tbl(r_tblsq.grpdef_schema, r_tblsq.grpdef_tblseq, v_logSchema, coalesce(r_tblsq.grpdef_log_dat_tsp, v_defTsp), coalesce(r_tblsq.grpdef_log_idx_tsp, v_defTsp), v_isRollbackable)"
PL/pgSQL function emaj.emaj_create_group(text,boolean) line 88 at PERFORM
NOTICE:  trigger "phil's schema3_myTbl2\_emaj_trunc_trg" for table "phil's schema3.myTbl2\" does not exist, skipping
CONTEXT:  SQL statement "DROP TRIGGER IF EXISTS "phil's schema3_myTbl2\_emaj_trunc_trg" ON "phil's schema3"."myTbl2\""
PL/pgSQL function emaj._create_tbl(text,text,text,text,text,boolean) line 157 at EXECUTE statement
SQL statement "SELECT emaj._create_tbl(r_tblsq.grpdef_schema, r_tblsq.grpdef_tblseq, v_logSchema, coalesce(r_tblsq.grpdef_log_dat_tsp, v_defTsp), coalesce(r_tblsq.grpdef_log_idx_tsp, v_defTsp), v_isRollbackable)"
PL/pgSQL function emaj.emaj_create_group(text,boolean) line 88 at PERFORM
NOTICE:  table "phil's schema3_phil's tbl1_log" does not exist, skipping
CONTEXT:  SQL statement "DROP TABLE IF EXISTS "emaj #'3"."phil's schema3_phil's tbl1_log""
PL/pgSQL function emaj._create_tbl(text,text,text,text,text,boolean) line 84 at EXECUTE statement
SQL statement "SELECT emaj._create_tbl(r_tblsq.grpdef_schema, r_tblsq.grpdef_tblseq, v_logSchema, coalesce(r_tblsq.grpdef_log_dat_tsp, v_defTsp), coalesce(r_tblsq.grpdef_log_idx_tsp, v_defTsp), v_isRollbackable)"
PL/pgSQL function emaj.emaj_create_group(text,boolean) line 88 at PERFORM
NOTICE:  trigger "phil's schema3_phil's tbl1_emaj_log_trg" for table "phil's schema3.phil's tbl1" does not exist, skipping
CONTEXT:  SQL statement "DROP TRIGGER IF EXISTS "phil's schema3_phil's tbl1_emaj_log_trg" ON "phil's schema3"."phil's tbl1""
PL/pgSQL function emaj._create_tbl(text,text,text,text,text,boolean) line 149 at EXECUTE statement
SQL statement "SELECT emaj._create_tbl(r_tblsq.grpdef_schema, r_tblsq.grpdef_tblseq, v_logSchema, coalesce(r_tblsq.grpdef_log_dat_tsp, v_defTsp), coalesce(r_tblsq.grpdef_log_idx_tsp, v_defTsp), v_isRollbackable)"
PL/pgSQL function emaj.emaj_create_group(text,boolean) line 88 at PERFORM
NOTICE:  trigger "phil's schema3_phil's tbl1_emaj_trunc_trg" for table "phil's schema3.phil's tbl1" does not exist, skipping
CONTEXT:  SQL statement "DROP TRIGGER IF EXISTS "phil's schema3_phil's tbl1_emaj_trunc_trg" ON "phil's schema3"."phil's tbl1""
PL/pgSQL function emaj._create_tbl(text,text,text,text,text,boolean) line 157 at EXECUTE statement
SQL statement "SELECT emaj._create_tbl(r_tblsq.grpdef_schema, r_tblsq.grpdef_tblseq, v_logSchema, coalesce(r_tblsq.grpdef_log_dat_tsp, v_defTsp), coalesce(r_tblsq.grpdef_log_idx_tsp, v_defTsp), v_isRollbackable)"
PL/pgSQL function emaj.emaj_create_group(text,boolean) line 88 at PERFORM
WARNING:  _check_fk_groups: Foreign key mytbl2_col21_fkey, from table phil's schema3.myTbl2\, references phil's schema3.mytbl4 that is outside groups (phil's group#3",).
CONTEXT:  SQL statement "SELECT emaj._check_fk_groups (array[v_groupName])"
PL/pgSQL function emaj.emaj_create_group(text,boolean) line 112 at PERFORM
WARNING:  _check_fk_groups: table phil's schema3.phil's tbl1 is referenced by foreign key mytbl4_col44_fkey from table phil's schema3.mytbl4 that is outside groups (phil's group#3",).
CONTEXT:  SQL statement "SELECT emaj._check_fk_groups (array[v_groupName])"
PL/pgSQL function emaj.emaj_create_group(text,boolean) line 112 at PERFORM
 emaj_create_group 
-------------------
                 3
(1 row)

select emaj.emaj_start_group('phil''s group#3",','M1_rollbackable');
WARNING:  _check_fk_groups: Foreign key mytbl2_col21_fkey, from table phil's schema3.myTbl2\, references phil's schema3.mytbl4 that is outside groups (phil's group#3",).
CONTEXT:  SQL statement "SELECT emaj._check_fk_groups(array[v_groupNames[v_i]])"
PL/pgSQL function emaj._start_groups(text[],text,boolean,boolean) line 46 at PERFORM
SQL statement "SELECT emaj._start_groups(array[v_groupName], v_mark, false, v_resetLog)"
PL/pgSQL function emaj.emaj_start_group(text,text,boolean) line 17 at SQL statement
PL/pgSQL function emaj.emaj_start_group(text,text) line 6 at RETURN
WARNING:  _check_fk_groups: table phil's schema3.phil's tbl1 is referenced by foreign key mytbl4_col44_fkey from table phil's schema3.mytbl4 that is outside groups (phil's group#3",).
CONTEXT:  SQL statement "SELECT emaj._check_fk_groups(array[v_groupNames[v_i]])"
PL/pgSQL function emaj._start_groups(text[],text,boolean,boolean) line 46 at PERFORM
SQL statement "SELECT emaj._start_groups(array[v_groupName], v_mark, false, v_resetLog)"
PL/pgSQL function emaj.emaj_start_group(text,text,boolean) line 17 at SQL statement
PL/pgSQL function emaj.emaj_start_group(text,text) line 6 at RETURN
 emaj_start_group 
------------------
                3
(1 row)

--
set search_path="phil's schema3";
--
insert into "phil's tbl1" select i, 'AB''C', E'\\014'::bytea from generate_series (1,31) as i;
update "phil's tbl1" set "phil\s col13" = E'\\034'::bytea where "phil's col11" <= 3;
update "phil's tbl1" set "phil\s col13" = E'\\034'''::bytea where "phil's col11" between 18 and 22;
insert into myTbl4 (col41) values (1);
insert into myTbl4 (col41) values (2);
insert into "myTbl2\" values (1,'ABC','2010-12-31');
delete from "phil's tbl1" where "phil's col11" > 20;
insert into "myTbl2\" values (2,'DEF',NULL);
select nextval(E'"phil''s schema3"."phil''s seq\\1"');
 nextval 
---------
    1000
(1 row)

--
select emaj.emaj_set_mark_group('phil''s group#3",','M2_rollbackable');
 emaj_set_mark_group 
---------------------
                   3
(1 row)

select emaj.emaj_set_mark_group('phil''s group#3",','M2_again!');
 emaj_set_mark_group 
---------------------
                   3
(1 row)

--
delete from "phil's tbl1" where "phil's col11" = 10;
update "phil's tbl1" set "phil's col12" = 'DEF' where "phil's col11" <= 2;
select nextval(E'"phil''s schema3"."phil''s seq\\1"');
 nextval 
---------
    1001
(1 row)

--
select emaj.emaj_set_mark_groups(array['phil''s group#3",'],'phil''s mark #1');
 emaj_set_mark_groups 
----------------------
                    3
(1 row)

select emaj.emaj_comment_mark_group('phil''s group#3",','phil''s mark #1','Third mark set');
 emaj_comment_mark_group 
-------------------------
 
(1 row)

--
select emaj.emaj_rename_mark_group('phil''s group#3",','phil''s mark #1','phil''s mark #3');
 emaj_rename_mark_group 
------------------------
 
(1 row)

-- 
select emaj.emaj_delete_mark_group('phil''s group#3",','M2_again!');
 emaj_delete_mark_group 
------------------------
                      1
(1 row)

--
select * from emaj.emaj_log_stat_group('phil''s group#3",','','');
    stat_group    |  stat_schema   | stat_table  | stat_rows 
------------------+----------------+-------------+-----------
 phil's group#3", | phil's schema3 | myTbl2\     |         2
 phil's group#3", | phil's schema3 | phil's tbl1 |        53
(2 rows)

select * from emaj.emaj_detailed_log_stat_group('phil''s group#3",','phil''s mark #3','');
 stat_group | stat_schema | stat_table | stat_role | stat_verb | stat_rows 
------------+-------------+------------+-----------+-----------+-----------
(0 rows)

--
select emaj.emaj_logged_rollback_group('phil''s group#3",','phil''s mark #3');
WARNING:  _check_fk_groups: Foreign key mytbl2_col21_fkey, from table phil's schema3.myTbl2\, references phil's schema3.mytbl4 that is outside groups (phil's group#3",).
CONTEXT:  SQL statement "SELECT emaj._check_fk_groups(v_groupNames)"
PL/pgSQL function emaj._rlbk_groups_step1(text[],text,boolean,integer,boolean) line 74 at PERFORM
SQL statement "SELECT emaj._rlbk_groups_step1(v_groupNames, v_mark, v_unloggedRlbk, 1, v_multiGroup)"
PL/pgSQL function emaj._rlbk_groups(text[],text,boolean,boolean,boolean) line 20 at SQL statement
PL/pgSQL function emaj.emaj_logged_rollback_group(text,text) line 12 at RETURN
WARNING:  _check_fk_groups: table phil's schema3.phil's tbl1 is referenced by foreign key mytbl4_col44_fkey from table phil's schema3.mytbl4 that is outside groups (phil's group#3",).
CONTEXT:  SQL statement "SELECT emaj._check_fk_groups(v_groupNames)"
PL/pgSQL function emaj._rlbk_groups_step1(text[],text,boolean,integer,boolean) line 74 at PERFORM
SQL statement "SELECT emaj._rlbk_groups_step1(v_groupNames, v_mark, v_unloggedRlbk, 1, v_multiGroup)"
PL/pgSQL function emaj._rlbk_groups(text[],text,boolean,boolean,boolean) line 20 at SQL statement
PL/pgSQL function emaj.emaj_logged_rollback_group(text,text) line 12 at RETURN
 emaj_logged_rollback_group 
----------------------------
                          1
(1 row)

select emaj.emaj_rollback_group('phil''s group#3",','phil''s mark #3');
WARNING:  _check_fk_groups: Foreign key mytbl2_col21_fkey, from table phil's schema3.myTbl2\, references phil's schema3.mytbl4 that is outside groups (phil's group#3",).
CONTEXT:  SQL statement "SELECT emaj._check_fk_groups(v_groupNames)"
PL/pgSQL function emaj._rlbk_groups_step1(text[],text,boolean,integer,boolean) line 74 at PERFORM
SQL statement "SELECT emaj._rlbk_groups_step1(v_groupNames, v_mark, v_unloggedRlbk, 1, v_multiGroup)"
PL/pgSQL function emaj._rlbk_groups(text[],text,boolean,boolean,boolean) line 20 at SQL statement
PL/pgSQL function emaj.emaj_rollback_group(text,text) line 8 at RETURN
WARNING:  _check_fk_groups: table phil's schema3.phil's tbl1 is referenced by foreign key mytbl4_col44_fkey from table phil's schema3.mytbl4 that is outside groups (phil's group#3",).
CONTEXT:  SQL statement "SELECT emaj._check_fk_groups(v_groupNames)"
PL/pgSQL function emaj._rlbk_groups_step1(text[],text,boolean,integer,boolean) line 74 at PERFORM
SQL statement "SELECT emaj._rlbk_groups_step1(v_groupNames, v_mark, v_unloggedRlbk, 1, v_multiGroup)"
PL/pgSQL function emaj._rlbk_groups(text[],text,boolean,boolean,boolean) line 20 at SQL statement
PL/pgSQL function emaj.emaj_rollback_group(text,text) line 8 at RETURN
 emaj_rollback_group 
---------------------
                   1
(1 row)

-----------------------------
-- Checking step 10
-----------------------------
-- emaj tables
select mark_id, mark_group, regexp_replace(mark_name,E'\\d\\d\.\\d\\d\\.\\d\\d\\.\\d\\d\\d','%','g'), mark_global_seq, mark_state, mark_comment, mark_last_seq_hole_id, mark_last_sequence_id, mark_log_rows_before_next from emaj.emaj_mark order by mark_id;
 mark_id |    mark_group    |        regexp_replace        | mark_global_seq | mark_state |     mark_comment     | mark_last_seq_hole_id | mark_last_sequence_id | mark_log_rows_before_next 
---------+------------------+------------------------------+-----------------+------------+----------------------+-----------------------+-----------------------+---------------------------
      97 | myGroup2         | M3                           |           11920 | DELETED    | This mark is deleted |                    10 |                   658 |                         0
     102 | myGroup1         | M4                           |           11949 | DELETED    |                      |                    12 |                   696 |                        10
     103 | myGroup1         | M5                           |           11959 | DELETED    |                      |                    12 |                   702 |                         3
     107 | myGroup1         | Before logged rollback to M4 |           11989 | DELETED    |                      |                    17 |                   730 |                        18
     109 | myGroup1         | STOP_%                       |           12007 | DELETED    |                      |                    17 |                   750 |                         0
     110 | myGroup2         | STOP_%                       |           12007 | DELETED    |                      |                    17 |                   750 |                         0
     119 | myGroup1         | Stop after rollback          |           12007 | DELETED    |                      |                    17 |                   820 |                          
     120 | myGroup2         | Stop after rollback          |           12007 | DELETED    |                      |                    17 |                   820 |                          
     121 | myGroup1         | Multi-1                      |           12007 | ACTIVE     |                      |                    17 |                   834 |                          
     122 | myGroup2         | Multi-1                      |           12007 | ACTIVE     |                      |                    17 |                   834 |                          
     127 | phil's group#3", | M1_rollbackable              |           12007 | ACTIVE     |                      |                    17 |                   857 |                        52
     128 | phil's group#3", | M2_rollbackable              |           12059 | ACTIVE     |                      |                    17 |                   860 |                         3
     130 | phil's group#3", | phil's mark #3               |           12062 | ACTIVE     | Third mark set       |                    17 |                   866 |                          
(13 rows)

select sequ_id,sequ_schema, sequ_name, regexp_replace(sequ_mark,E'\\d\\d\.\\d\\d\\.\\d\\d\\.\\d\\d\\d','%','g'), sequ_last_val, sequ_is_called from emaj.emaj_sequence order by sequ_id;
 sequ_id |  sequ_schema   |             sequ_name              |        regexp_replace        | sequ_last_val | sequ_is_called 
---------+----------------+------------------------------------+------------------------------+---------------+----------------
     638 | emajC          | myschema1_myTbl3_log_seq           | M3                           |            10 | t
     641 | emaj           | myschema1_mytbl2_log_seq           | M3                           |             2 | t
     642 | emajb          | myschema1_mytbl2b_log_seq          | M3                           |             1 | f
     651 | myschema2      | myseq1                             | M3                           |          1003 | t
     652 | emaj           | myschema2_mytbl1_log_seq           | M3                           |            15 | t
     653 | emaj           | myschema2_mytbl2_log_seq           | M3                           |             2 | t
     654 | emajC          | myschema2_myTbl3_log_seq           | M3                           |            10 | t
     655 | myschema2      | myTbl3_col31_seq                   | M3                           |            20 | t
     656 | emaj           | myschema2_mytbl4_log_seq           | M3                           |             4 | t
     657 | emaj           | myschema2_mytbl5_log_seq           | M3                           |             4 | t
     658 | emaj           | myschema2_mytbl6_log_seq           | M3                           |            14 | t
     660 | emaj           | myschema2_mytbl1_log_seq           | RLBK_M2_%_START              |            15 | t
     661 | emaj           | myschema2_mytbl2_log_seq           | RLBK_M2_%_START              |             2 | t
     662 | emajC          | myschema2_myTbl3_log_seq           | RLBK_M2_%_START              |            10 | t
     668 | emaj           | myschema2_mytbl1_log_seq           | RLBK_M2_%_DONE               |            15 | t
     669 | emaj           | myschema2_mytbl2_log_seq           | RLBK_M2_%_DONE               |             2 | t
     670 | emajC          | myschema2_myTbl3_log_seq           | RLBK_M2_%_DONE               |            10 | t
     676 | emaj           | myschema2_mytbl1_log_seq           | RLBK_M3_%_START              |            15 | t
     677 | emaj           | myschema2_mytbl2_log_seq           | RLBK_M3_%_START              |             2 | t
     678 | emajC          | myschema2_myTbl3_log_seq           | RLBK_M3_%_START              |            10 | t
     684 | emaj           | myschema2_mytbl1_log_seq           | RLBK_M3_%_DONE               |            15 | t
     685 | emaj           | myschema2_mytbl2_log_seq           | RLBK_M3_%_DONE               |             2 | t
     686 | emajC          | myschema2_myTbl3_log_seq           | RLBK_M3_%_DONE               |            10 | t
     691 | myschema1      | myTbl3_col31_seq                   | M4                           |            20 | t
     692 | emajC          | myschema1_myTbl3_log_seq           | M4                           |            10 | t
     693 | emaj           | myschema1_mytbl1_log_seq           | M4                           |            30 | t
     694 | emaj           | myschema1_mytbl4_log_seq           | M4                           |             8 | t
     695 | emaj           | myschema1_mytbl2_log_seq           | M4                           |             3 | t
     696 | emajb          | myschema1_mytbl2b_log_seq          | M4                           |             1 | f
     697 | myschema1      | myTbl3_col31_seq                   | M5                           |            20 | t
     698 | emajC          | myschema1_myTbl3_log_seq           | M5                           |            20 | t
     699 | emaj           | myschema1_mytbl1_log_seq           | M5                           |            30 | t
     700 | emaj           | myschema1_mytbl4_log_seq           | M5                           |             8 | t
     701 | emaj           | myschema1_mytbl2_log_seq           | M5                           |             3 | t
     702 | emajb          | myschema1_mytbl2b_log_seq          | M5                           |             1 | f
     704 | emajC          | myschema1_myTbl3_log_seq           | M6                           |            20 | t
     707 | emaj           | myschema1_mytbl2_log_seq           | M6                           |             3 | t
     708 | emajb          | myschema1_mytbl2b_log_seq          | M6                           |             1 | f
     710 | emaj           | myschema2_mytbl1_log_seq           | RLBK_M2_%_START              |            15 | t
     711 | emaj           | myschema2_mytbl2_log_seq           | RLBK_M2_%_START              |             2 | t
     712 | emajC          | myschema2_myTbl3_log_seq           | RLBK_M2_%_START              |            10 | t
     718 | emaj           | myschema2_mytbl1_log_seq           | RLBK_M2_%_DONE               |            15 | t
     719 | emaj           | myschema2_mytbl2_log_seq           | RLBK_M2_%_DONE               |             2 | t
     720 | emajC          | myschema2_myTbl3_log_seq           | RLBK_M2_%_DONE               |            10 | t
     725 | myschema1      | myTbl3_col31_seq                   | Before logged rollback to M4 |            20 | t
     726 | emajC          | myschema1_myTbl3_log_seq           | Before logged rollback to M4 |            20 | t
     727 | emaj           | myschema1_mytbl1_log_seq           | Before logged rollback to M4 |            32 | t
     728 | emaj           | myschema1_mytbl4_log_seq           | Before logged rollback to M4 |            12 | t
     729 | emaj           | myschema1_mytbl2_log_seq           | Before logged rollback to M4 |             3 | t
     730 | emajb          | myschema1_mytbl2b_log_seq          | Before logged rollback to M4 |             1 | f
     737 | myschema1      | myTbl3_col31_seq                   | STOP_%                       |            20 | t
     738 | emajC          | myschema1_myTbl3_log_seq           | STOP_%                       |            35 | t
     739 | emaj           | myschema1_mytbl1_log_seq           | STOP_%                       |            33 | t
     740 | emaj           | myschema1_mytbl4_log_seq           | STOP_%                       |            14 | t
     741 | emaj           | myschema1_mytbl2_log_seq           | STOP_%                       |             3 | t
     742 | emajb          | myschema1_mytbl2b_log_seq          | STOP_%                       |             1 | f
     743 | myschema2      | myseq1                             | STOP_%                       |          1004 | f
     744 | emaj           | myschema2_mytbl1_log_seq           | STOP_%                       |            15 | t
     745 | emaj           | myschema2_mytbl2_log_seq           | STOP_%                       |             2 | t
     746 | emajC          | myschema2_myTbl3_log_seq           | STOP_%                       |            10 | t
     747 | myschema2      | myTbl3_col31_seq                   | STOP_%                       |            20 | t
     748 | emaj           | myschema2_mytbl4_log_seq           | STOP_%                       |            24 | t
     749 | emaj           | myschema2_mytbl5_log_seq           | STOP_%                       |             9 | t
     750 | emaj           | myschema2_mytbl6_log_seq           | STOP_%                       |            29 | t
     766 | emajC          | myschema1_myTbl3_log_seq           | Multi-2                      |            35 | t
     767 | emaj           | myschema1_mytbl1_log_seq           | Multi-2                      |            33 | t
     768 | emaj           | myschema1_mytbl4_log_seq           | Multi-2                      |            14 | t
     769 | emaj           | myschema1_mytbl2_log_seq           | Multi-2                      |             3 | t
     770 | emajb          | myschema1_mytbl2b_log_seq          | Multi-2                      |             1 | f
     772 | emaj           | myschema2_mytbl1_log_seq           | Multi-2                      |            15 | t
     773 | emaj           | myschema2_mytbl2_log_seq           | Multi-2                      |             2 | t
     774 | emajC          | myschema2_myTbl3_log_seq           | Multi-2                      |            10 | t
     776 | emaj           | myschema2_mytbl4_log_seq           | Multi-2                      |            24 | t
     777 | emaj           | myschema2_mytbl5_log_seq           | Multi-2                      |             9 | t
     778 | emaj           | myschema2_mytbl6_log_seq           | Multi-2                      |            29 | t
     780 | emajC          | myschema1_myTbl3_log_seq           | RLBK_Multi-1_%_START         |            35 | t
     781 | emaj           | myschema1_mytbl1_log_seq           | RLBK_Multi-1_%_START         |            33 | t
     782 | emaj           | myschema1_mytbl4_log_seq           | RLBK_Multi-1_%_START         |            14 | t
     783 | emaj           | myschema1_mytbl2_log_seq           | RLBK_Multi-1_%_START         |             3 | t
     784 | emajb          | myschema1_mytbl2b_log_seq          | RLBK_Multi-1_%_START         |             1 | f
     786 | emaj           | myschema2_mytbl1_log_seq           | RLBK_Multi-1_%_START         |            15 | t
     787 | emaj           | myschema2_mytbl2_log_seq           | RLBK_Multi-1_%_START         |             2 | t
     788 | emajC          | myschema2_myTbl3_log_seq           | RLBK_Multi-1_%_START         |            10 | t
     790 | emaj           | myschema2_mytbl4_log_seq           | RLBK_Multi-1_%_START         |            24 | t
     791 | emaj           | myschema2_mytbl5_log_seq           | RLBK_Multi-1_%_START         |             9 | t
     792 | emaj           | myschema2_mytbl6_log_seq           | RLBK_Multi-1_%_START         |            29 | t
     794 | emajC          | myschema1_myTbl3_log_seq           | RLBK_Multi-1_%_DONE          |            35 | t
     795 | emaj           | myschema1_mytbl1_log_seq           | RLBK_Multi-1_%_DONE          |            33 | t
     796 | emaj           | myschema1_mytbl4_log_seq           | RLBK_Multi-1_%_DONE          |            14 | t
     797 | emaj           | myschema1_mytbl2_log_seq           | RLBK_Multi-1_%_DONE          |             3 | t
     798 | emajb          | myschema1_mytbl2b_log_seq          | RLBK_Multi-1_%_DONE          |             1 | f
     800 | emaj           | myschema2_mytbl1_log_seq           | RLBK_Multi-1_%_DONE          |            15 | t
     801 | emaj           | myschema2_mytbl2_log_seq           | RLBK_Multi-1_%_DONE          |             2 | t
     802 | emajC          | myschema2_myTbl3_log_seq           | RLBK_Multi-1_%_DONE          |            10 | t
     804 | emaj           | myschema2_mytbl4_log_seq           | RLBK_Multi-1_%_DONE          |            24 | t
     805 | emaj           | myschema2_mytbl5_log_seq           | RLBK_Multi-1_%_DONE          |             9 | t
     806 | emaj           | myschema2_mytbl6_log_seq           | RLBK_Multi-1_%_DONE          |            29 | t
     807 | myschema1      | myTbl3_col31_seq                   | Stop after rollback          |            20 | t
     808 | emajC          | myschema1_myTbl3_log_seq           | Stop after rollback          |            35 | t
     809 | emaj           | myschema1_mytbl1_log_seq           | Stop after rollback          |            33 | t
     810 | emaj           | myschema1_mytbl4_log_seq           | Stop after rollback          |            14 | t
     811 | emaj           | myschema1_mytbl2_log_seq           | Stop after rollback          |             3 | t
     812 | emajb          | myschema1_mytbl2b_log_seq          | Stop after rollback          |             1 | f
     813 | myschema2      | myseq1                             | Stop after rollback          |          1004 | f
     814 | emaj           | myschema2_mytbl1_log_seq           | Stop after rollback          |            15 | t
     815 | emaj           | myschema2_mytbl2_log_seq           | Stop after rollback          |             2 | t
     816 | emajC          | myschema2_myTbl3_log_seq           | Stop after rollback          |            10 | t
     817 | myschema2      | myTbl3_col31_seq                   | Stop after rollback          |            20 | t
     818 | emaj           | myschema2_mytbl4_log_seq           | Stop after rollback          |            24 | t
     819 | emaj           | myschema2_mytbl5_log_seq           | Stop after rollback          |             9 | t
     820 | emaj           | myschema2_mytbl6_log_seq           | Stop after rollback          |            29 | t
     821 | myschema1      | myTbl3_col31_seq                   | Multi-1                      |            20 | t
     822 | emajC          | myschema1_myTbl3_log_seq           | Multi-1                      |            35 | t
     823 | emaj           | myschema1_mytbl1_log_seq           | Multi-1                      |            33 | t
     824 | emaj           | myschema1_mytbl4_log_seq           | Multi-1                      |            14 | t
     825 | emaj           | myschema1_mytbl2_log_seq           | Multi-1                      |             3 | t
     826 | emajb          | myschema1_mytbl2b_log_seq          | Multi-1                      |             1 | f
     827 | myschema2      | myseq1                             | Multi-1                      |          1004 | f
     828 | emaj           | myschema2_mytbl1_log_seq           | Multi-1                      |            15 | t
     829 | emaj           | myschema2_mytbl2_log_seq           | Multi-1                      |             2 | t
     830 | emajC          | myschema2_myTbl3_log_seq           | Multi-1                      |            10 | t
     831 | myschema2      | myTbl3_col31_seq                   | Multi-1                      |            20 | t
     832 | emaj           | myschema2_mytbl4_log_seq           | Multi-1                      |            24 | t
     833 | emaj           | myschema2_mytbl5_log_seq           | Multi-1                      |             9 | t
     834 | emaj           | myschema2_mytbl6_log_seq           | Multi-1                      |            29 | t
     855 | emaj           | phil's schema3_myTbl2\_log_seq     | M1_rollbackable              |             1 | f
     856 | phil's schema3 | phil's seq\1                       | M1_rollbackable              |          1000 | f
     857 | emaj #'3       | phil's schema3_phil's tbl1_log_seq | M1_rollbackable              |             1 | f
     858 | emaj           | phil's schema3_myTbl2\_log_seq     | M2_rollbackable              |             2 | t
     859 | phil's schema3 | phil's seq\1                       | M2_rollbackable              |          1000 | t
     860 | emaj #'3       | phil's schema3_phil's tbl1_log_seq | M2_rollbackable              |            50 | t
     864 | emaj           | phil's schema3_myTbl2\_log_seq     | phil's mark #3               |             2 | t
     865 | phil's schema3 | phil's seq\1                       | phil's mark #3               |          1001 | t
     866 | emaj #'3       | phil's schema3_phil's tbl1_log_seq | phil's mark #3               |            53 | t
     867 | emaj           | phil's schema3_myTbl2\_log_seq     | RLBK_phil's mark #3_%_START  |             2 | t
     869 | emaj #'3       | phil's schema3_phil's tbl1_log_seq | RLBK_phil's mark #3_%_START  |            53 | t
     870 | emaj           | phil's schema3_myTbl2\_log_seq     | RLBK_phil's mark #3_%_DONE   |             2 | t
     872 | emaj #'3       | phil's schema3_phil's tbl1_log_seq | RLBK_phil's mark #3_%_DONE   |            53 | t
(138 rows)

select * from emaj.emaj_fk order by fk_groups, fk_session, fk_name;
 fk_groups | fk_session | fk_name | fk_schema | fk_table | fk_action | fk_def 
-----------+------------+---------+-----------+----------+-----------+--------
(0 rows)

select sqhl_id, sqhl_schema, sqhl_table, sqhl_hole_size from emaj.emaj_seq_hole order by sqhl_id;
 sqhl_id | sqhl_schema | sqhl_table | sqhl_hole_size 
---------+-------------+------------+----------------
      13 | myschema2   | mytbl4     |             20
      14 | myschema2   | mytbl5     |              5
      15 | myschema2   | mytbl6     |             15
      16 | myschema1   | mytbl1     |              1
      17 | myschema1   | mytbl4     |              2
(5 rows)

select rlbk_operation, rlbk_schema, rlbk_tbl_fk, rlbk_nb_rows from emaj.emaj_rlbk_stat
  order by rlbk_schema, rlbk_tbl_fk, rlbk_datetime, rlbk_operation;
  rlbk_operation  | rlbk_schema |    rlbk_tbl_fk    | rlbk_nb_rows 
------------------+-------------+-------------------+--------------
 del_log          | myschema1   | mytbl1            |            3
 rlbk             | myschema1   | mytbl1            |            3
 del_log          | myschema1   | mytbl1            |            1
 rlbk             | myschema1   | mytbl1            |            1
 rlbk             | myschema1   | mytbl1            |            1
 rlbk             | myschema1   | myTbl3            |           10
 del_log          | myschema1   | mytbl4            |            8
 rlbk             | myschema1   | mytbl4            |            8
 del_log          | myschema1   | mytbl4            |            2
 rlbk             | myschema1   | mytbl4            |            2
 rlbk             | myschema1   | mytbl4            |            2
 set_fk_immediate | myschema1   | mytbl4_col43_fkey |            8
 set_fk_immediate | myschema1   | mytbl4_col43_fkey |            2
 set_fk_immediate | myschema1   | mytbl4_col43_fkey |            2
 add_fk           | myschema1   | mytbl4_col44_fkey |            0
 add_fk           | myschema1   | mytbl4_col44_fkey |            0
 add_fk           | myschema1   | mytbl4_col44_fkey |            0
 rlbk             | myschema2   | mytbl4            |            4
 rlbk             | myschema2   | mytbl4            |            4
 rlbk             | myschema2   | mytbl4            |           12
 del_log          | myschema2   | mytbl4            |           20
 rlbk             | myschema2   | mytbl4            |           20
 set_fk_immediate | myschema2   | mytbl4_col43_fkey |            4
 set_fk_immediate | myschema2   | mytbl4_col43_fkey |            4
 set_fk_immediate | myschema2   | mytbl4_col43_fkey |           12
 set_fk_immediate | myschema2   | mytbl4_col43_fkey |           20
 add_fk           | myschema2   | mytbl4_col44_fkey |            2
 add_fk           | myschema2   | mytbl4_col44_fkey |            2
 add_fk           | myschema2   | mytbl4_col44_fkey |            2
 add_fk           | myschema2   | mytbl4_col44_fkey |            2
 rlbk             | myschema2   | mytbl5            |            1
 rlbk             | myschema2   | mytbl5            |            1
 rlbk             | myschema2   | mytbl5            |            3
 del_log          | myschema2   | mytbl5            |            5
 rlbk             | myschema2   | mytbl5            |            5
 rlbk             | myschema2   | mytbl6            |            3
 rlbk             | myschema2   | mytbl6            |            3
 rlbk             | myschema2   | mytbl6            |            9
 del_log          | myschema2   | mytbl6            |           15
 rlbk             | myschema2   | mytbl6            |           15
(40 rows)

-- user tables
select * from "phil's schema3"."phil's tbl1" order by "phil's col11","phil's col12";
 phil's col11 | phil's col12 | phil\s col13 
--------------+--------------+--------------
            1 | DEF          | \x1c
            2 | DEF          | \x1c
            3 | AB'C         | \x1c
            4 | AB'C         | \x0c
            5 | AB'C         | \x0c
            6 | AB'C         | \x0c
            7 | AB'C         | \x0c
            8 | AB'C         | \x0c
            9 | AB'C         | \x0c
           11 | AB'C         | \x0c
           12 | AB'C         | \x0c
           13 | AB'C         | \x0c
           14 | AB'C         | \x0c
           15 | AB'C         | \x0c
           16 | AB'C         | \x0c
           17 | AB'C         | \x0c
           18 | AB'C         | \x1c27
           19 | AB'C         | \x1c27
           20 | AB'C         | \x1c27
(19 rows)

select * from "phil's schema3"."myTbl2\" order by col21;
 col21 | col22 |   col23    
-------+-------+------------
     1 | ABC   | 12-31-2010
     2 | DEF   | 
(2 rows)

-- log tables
select "phil's col11", "phil's col12", "phil\s col13", emaj_verb, emaj_tuple, emaj_gid from "emaj #'3"."phil's schema3_phil's tbl1_log" order by emaj_gid, emaj_tuple desc;
 phil's col11 | phil's col12 | phil\s col13 | emaj_verb | emaj_tuple | emaj_gid 
--------------+--------------+--------------+-----------+------------+----------
            1 | AB'C         | \x0c         | INS       | NEW        |    12008
            2 | AB'C         | \x0c         | INS       | NEW        |    12009
            3 | AB'C         | \x0c         | INS       | NEW        |    12010
            4 | AB'C         | \x0c         | INS       | NEW        |    12011
            5 | AB'C         | \x0c         | INS       | NEW        |    12012
            6 | AB'C         | \x0c         | INS       | NEW        |    12013
            7 | AB'C         | \x0c         | INS       | NEW        |    12014
            8 | AB'C         | \x0c         | INS       | NEW        |    12015
            9 | AB'C         | \x0c         | INS       | NEW        |    12016
           10 | AB'C         | \x0c         | INS       | NEW        |    12017
           11 | AB'C         | \x0c         | INS       | NEW        |    12018
           12 | AB'C         | \x0c         | INS       | NEW        |    12019
           13 | AB'C         | \x0c         | INS       | NEW        |    12020
           14 | AB'C         | \x0c         | INS       | NEW        |    12021
           15 | AB'C         | \x0c         | INS       | NEW        |    12022
           16 | AB'C         | \x0c         | INS       | NEW        |    12023
           17 | AB'C         | \x0c         | INS       | NEW        |    12024
           18 | AB'C         | \x0c         | INS       | NEW        |    12025
           19 | AB'C         | \x0c         | INS       | NEW        |    12026
           20 | AB'C         | \x0c         | INS       | NEW        |    12027
           21 | AB'C         | \x0c         | INS       | NEW        |    12028
           22 | AB'C         | \x0c         | INS       | NEW        |    12029
           23 | AB'C         | \x0c         | INS       | NEW        |    12030
           24 | AB'C         | \x0c         | INS       | NEW        |    12031
           25 | AB'C         | \x0c         | INS       | NEW        |    12032
           26 | AB'C         | \x0c         | INS       | NEW        |    12033
           27 | AB'C         | \x0c         | INS       | NEW        |    12034
           28 | AB'C         | \x0c         | INS       | NEW        |    12035
           29 | AB'C         | \x0c         | INS       | NEW        |    12036
           30 | AB'C         | \x0c         | INS       | NEW        |    12037
           31 | AB'C         | \x0c         | INS       | NEW        |    12038
            1 | AB'C         | \x0c         | UPD       | OLD        |    12039
            1 | AB'C         | \x1c         | UPD       | NEW        |    12039
            2 | AB'C         | \x0c         | UPD       | OLD        |    12040
            2 | AB'C         | \x1c         | UPD       | NEW        |    12040
            3 | AB'C         | \x0c         | UPD       | OLD        |    12041
            3 | AB'C         | \x1c         | UPD       | NEW        |    12041
           18 | AB'C         | \x0c         | UPD       | OLD        |    12042
           18 | AB'C         | \x1c27       | UPD       | NEW        |    12042
           19 | AB'C         | \x0c         | UPD       | OLD        |    12043
           19 | AB'C         | \x1c27       | UPD       | NEW        |    12043
           20 | AB'C         | \x0c         | UPD       | OLD        |    12044
           20 | AB'C         | \x1c27       | UPD       | NEW        |    12044
           21 | AB'C         | \x0c         | UPD       | OLD        |    12045
           21 | AB'C         | \x1c27       | UPD       | NEW        |    12045
           22 | AB'C         | \x0c         | UPD       | OLD        |    12046
           22 | AB'C         | \x1c27       | UPD       | NEW        |    12046
           23 | AB'C         | \x0c         | DEL       | OLD        |    12048
           24 | AB'C         | \x0c         | DEL       | OLD        |    12049
           25 | AB'C         | \x0c         | DEL       | OLD        |    12050
           26 | AB'C         | \x0c         | DEL       | OLD        |    12051
           27 | AB'C         | \x0c         | DEL       | OLD        |    12052
           28 | AB'C         | \x0c         | DEL       | OLD        |    12053
           29 | AB'C         | \x0c         | DEL       | OLD        |    12054
           30 | AB'C         | \x0c         | DEL       | OLD        |    12055
           31 | AB'C         | \x0c         | DEL       | OLD        |    12056
           21 | AB'C         | \x1c27       | DEL       | OLD        |    12057
           22 | AB'C         | \x1c27       | DEL       | OLD        |    12058
           10 | AB'C         | \x0c         | DEL       | OLD        |    12060
            1 | AB'C         | \x1c         | UPD       | OLD        |    12061
            1 | DEF          | \x1c         | UPD       | NEW        |    12061
            2 | AB'C         | \x1c         | UPD       | OLD        |    12062
            2 | DEF          | \x1c         | UPD       | NEW        |    12062
(63 rows)

select col21, col22, col23, emaj_verb, emaj_tuple, emaj_gid from emaj."phil's schema3_myTbl2\_log" order by emaj_gid, emaj_tuple desc;
 col21 | col22 |   col23    | emaj_verb | emaj_tuple | emaj_gid 
-------+-------+------------+-----------+------------+----------
     1 | ABC   | 12-31-2010 | INS       | NEW        |    12047
     2 | DEF   |            | INS       | NEW        |    12059
(2 rows)

-----------------------------
-- Step 11 : for myGroup1, in a transaction, update tables and rollback the transaction, 
--           then rollback to previous mark 
-----------------------------
set search_path=myschema1;
--
begin transaction;
  delete from mytbl1;
rollback;
--
select emaj.emaj_rollback_group('myGroup1','EMAJ_LAST_MARK');
 emaj_rollback_group 
---------------------
                   2
(1 row)

-----------------------------
-- Checking step 11
-----------------------------
-- emaj tables
select sqhl_id, sqhl_schema, sqhl_table, sqhl_hole_size from emaj.emaj_seq_hole order by sqhl_id;
 sqhl_id | sqhl_schema | sqhl_table | sqhl_hole_size 
---------+-------------+------------+----------------
      13 | myschema2   | mytbl4     |             20
      14 | myschema2   | mytbl5     |              5
      15 | myschema2   | mytbl6     |             15
      16 | myschema1   | mytbl1     |              1
      17 | myschema1   | mytbl4     |              2
      18 | myschema1   | mytbl1     |             20
(6 rows)

select rlbk_operation, rlbk_schema, rlbk_tbl_fk, rlbk_nb_rows from emaj.emaj_rlbk_stat
  order by rlbk_schema, rlbk_tbl_fk, rlbk_datetime, rlbk_operation;
  rlbk_operation  | rlbk_schema |    rlbk_tbl_fk    | rlbk_nb_rows 
------------------+-------------+-------------------+--------------
 del_log          | myschema1   | mytbl1            |            3
 rlbk             | myschema1   | mytbl1            |            3
 del_log          | myschema1   | mytbl1            |            1
 rlbk             | myschema1   | mytbl1            |            1
 rlbk             | myschema1   | mytbl1            |            1
 rlbk             | myschema1   | myTbl3            |           10
 del_log          | myschema1   | mytbl4            |            8
 rlbk             | myschema1   | mytbl4            |            8
 del_log          | myschema1   | mytbl4            |            2
 rlbk             | myschema1   | mytbl4            |            2
 rlbk             | myschema1   | mytbl4            |            2
 set_fk_immediate | myschema1   | mytbl4_col43_fkey |            8
 set_fk_immediate | myschema1   | mytbl4_col43_fkey |            2
 set_fk_immediate | myschema1   | mytbl4_col43_fkey |            2
 add_fk           | myschema1   | mytbl4_col44_fkey |            0
 add_fk           | myschema1   | mytbl4_col44_fkey |            0
 add_fk           | myschema1   | mytbl4_col44_fkey |            0
 add_fk           | myschema1   | mytbl4_col44_fkey |            0
 rlbk             | myschema2   | mytbl4            |            4
 rlbk             | myschema2   | mytbl4            |            4
 rlbk             | myschema2   | mytbl4            |           12
 del_log          | myschema2   | mytbl4            |           20
 rlbk             | myschema2   | mytbl4            |           20
 set_fk_immediate | myschema2   | mytbl4_col43_fkey |            4
 set_fk_immediate | myschema2   | mytbl4_col43_fkey |            4
 set_fk_immediate | myschema2   | mytbl4_col43_fkey |           12
 set_fk_immediate | myschema2   | mytbl4_col43_fkey |           20
 add_fk           | myschema2   | mytbl4_col44_fkey |            2
 add_fk           | myschema2   | mytbl4_col44_fkey |            2
 add_fk           | myschema2   | mytbl4_col44_fkey |            2
 add_fk           | myschema2   | mytbl4_col44_fkey |            2
 rlbk             | myschema2   | mytbl5            |            1
 rlbk             | myschema2   | mytbl5            |            1
 rlbk             | myschema2   | mytbl5            |            3
 del_log          | myschema2   | mytbl5            |            5
 rlbk             | myschema2   | mytbl5            |            5
 rlbk             | myschema2   | mytbl6            |            3
 rlbk             | myschema2   | mytbl6            |            3
 rlbk             | myschema2   | mytbl6            |            9
 del_log          | myschema2   | mytbl6            |           15
 rlbk             | myschema2   | mytbl6            |           15
(41 rows)

-----------------------------
-- Step 12 : tests snaps and script generation functions
-----------------------------
-- first add some updates for tables with unusual types (arrays, geometric)
set search_path=myschema2;
insert into myTbl5 values (10,'{"abc","def","ghi"}','{1,2,3}',NULL);
insert into myTbl5 values (20,array['abc','def','ghi'],array[3,4,5],array['2000/02/01'::date,'2000/02/28'::date]);
update myTbl5 set col54 = '{"2010/11/28","2010/12/03"}' where col54 is null;
insert into myTbl6 select i+10, point(i,1.3), '((0,0),(2,2))', circle(point(5,5),i),'((-2,-2),(3,0),(1,4))','10.20.30.40/27' from generate_series (1,8) as i;
update myTbl6 set col64 = '<(5,6),3.5>', col65 = null where col61 <= 13;
-- reset directory for snaps
\! rm -R /tmp/emaj_test/snaps
\! mkdir /tmp/emaj_test/snaps
-- ... and snap the all groups
select emaj.emaj_snap_group('myGroup1','/tmp/emaj_test/snaps','CSV HEADER');
 emaj_snap_group 
-----------------
               6
(1 row)

select emaj.emaj_snap_group('myGroup2','/tmp/emaj_test/snaps','CSV HEADER');
 emaj_snap_group 
-----------------
               8
(1 row)

select emaj.emaj_snap_group('phil''s group#3",','/tmp/emaj_test/snaps','CSV HEADER');
 emaj_snap_group 
-----------------
               3
(1 row)

\! ls /tmp/emaj_test/snaps
_INFO
myschema1_mytbl1.snap
myschema1_mytbl2b.snap
myschema1_mytbl2.snap
myschema1_myTbl3_col31_seq.snap
myschema1_myTbl3.snap
myschema1_mytbl4.snap
myschema2_myseq1.snap
myschema2_mytbl1.snap
myschema2_mytbl2.snap
myschema2_myTbl3_col31_seq.snap
myschema2_myTbl3.snap
myschema2_mytbl4.snap
myschema2_mytbl5.snap
myschema2_mytbl6.snap
phil's schema3_myTbl2\.snap
phil's schema3_phil's seq\1.snap
phil's schema3_phil's tbl1.snap
-- reset directory for emaj_generate_sql tests
\! rm -R /tmp/emaj_test/sql_scripts
\! mkdir /tmp/emaj_test/sql_scripts
--select * from emaj.emaj_mark order by mark_group, mark_id;
-- generate sql script for each active group (and check the result with detailed log statistics + number of sequences)
select emaj.emaj_generate_sql('myGroup1', 'Multi-1', NULL, '/tmp/emaj_test/sql_scripts/myGroup1.sql');
NOTICE:  table "emaj_temp_script" does not exist, skipping
CONTEXT:  SQL statement "DROP TABLE IF EXISTS emaj_temp_script"
PL/pgSQL function emaj.emaj_generate_sql(text,text,text,text) line 122 at SQL statement
 emaj_generate_sql 
-------------------
                 1
(1 row)

select coalesce(sum(stat_rows),0) + 1 as check from emaj.emaj_detailed_log_stat_group('myGroup1', 'Multi-1', NULL);
 check 
-------
     1
(1 row)

select emaj.emaj_generate_sql('myGroup2', 'Multi-1', NULL, '/tmp/emaj_test/sql_scripts/myGroup2.sql');
 emaj_generate_sql 
-------------------
                21
(1 row)

select sum(stat_rows) + 2 as check from emaj.emaj_detailed_log_stat_group('myGroup2', 'Multi-1', NULL);
 check 
-------
    21
(1 row)

select emaj.emaj_generate_sql('phil''s group#3",', 'M1_rollbackable', NULL, '/tmp/emaj_test/sql_scripts/Group3.sql');
 emaj_generate_sql 
-------------------
                56
(1 row)

select sum(stat_rows) + 1 as check from emaj.emaj_detailed_log_stat_group('phil''s group#3",', 'M1_rollbackable', NULL);
 check 
-------
    56
(1 row)

-- process \\ in script files
\! find /tmp/emaj_test/sql_scripts -name '*.sql' -type f -print0 | xargs -0 sed -i_s -s 's/\\\\/\\/g'
-- comment transaction commands for the need of the current test
\! find /tmp/emaj_test/sql_scripts -name '*.sql' -type f -print0 | xargs -0 sed -i -s 's/^BEGIN/--BEGIN/;s/^COMMIT/--COMMIT/'
-- mask timestamp in initial comment
\! find /tmp/emaj_test/sql_scripts -name '*.sql' -type f -print0 | xargs -0 sed -i -s 's/at .* by/at [ts] by/'
\! ls /tmp/emaj_test/sql_scripts
Group3.sql
Group3.sql_s
myGroup1.sql
myGroup1.sql_s
myGroup2.sql
myGroup2.sql_s
-- reset directory for second set of snaps
\! rm -R /tmp/emaj_test/snaps2
\! mkdir /tmp/emaj_test/snaps2
-- in a single transaction and as superuser:
--   rollback groups, replay updates with generated scripts, snap groups again and cancel the transaction
reset role;
begin;
  select emaj.emaj_rollback_group('myGroup1','Multi-1');
 emaj_rollback_group 
---------------------
                   1
(1 row)

  select emaj.emaj_rollback_group('myGroup2','Multi-1');
 emaj_rollback_group 
---------------------
                   4
(1 row)

  select emaj.emaj_rollback_group('phil''s group#3",','M1_rollbackable');
WARNING:  _check_fk_groups: Foreign key mytbl2_col21_fkey, from table phil's schema3.myTbl2\, references phil's schema3.mytbl4 that is outside groups (phil's group#3",).
CONTEXT:  SQL statement "SELECT emaj._check_fk_groups(v_groupNames)"
PL/pgSQL function emaj._rlbk_groups_step1(text[],text,boolean,integer,boolean) line 74 at PERFORM
SQL statement "SELECT emaj._rlbk_groups_step1(v_groupNames, v_mark, v_unloggedRlbk, 1, v_multiGroup)"
PL/pgSQL function emaj._rlbk_groups(text[],text,boolean,boolean,boolean) line 20 at SQL statement
PL/pgSQL function emaj.emaj_rollback_group(text,text) line 8 at RETURN
WARNING:  _check_fk_groups: table phil's schema3.phil's tbl1 is referenced by foreign key mytbl4_col44_fkey from table phil's schema3.mytbl4 that is outside groups (phil's group#3",).
CONTEXT:  SQL statement "SELECT emaj._check_fk_groups(v_groupNames)"
PL/pgSQL function emaj._rlbk_groups_step1(text[],text,boolean,integer,boolean) line 74 at PERFORM
SQL statement "SELECT emaj._rlbk_groups_step1(v_groupNames, v_mark, v_unloggedRlbk, 1, v_multiGroup)"
PL/pgSQL function emaj._rlbk_groups(text[],text,boolean,boolean,boolean) line 20 at SQL statement
PL/pgSQL function emaj.emaj_rollback_group(text,text) line 8 at RETURN
 emaj_rollback_group 
---------------------
                   3
(1 row)

\i /tmp/emaj_test/sql_scripts/myGroup1.sql
-- file generated at [ts] by the emaj_generate_sql() function, for tables group myGroup1, processing logs between mark Multi-1 and the current situation
SET standard_conforming_strings = ON;
--BEGIN TRANSACTION;
ALTER SEQUENCE myschema1."myTbl3_col31_seq" RESTART 21 START 1 INCREMENT 1 MAXVALUE 9223372036854775807 MINVALUE 1 CACHE 1 NO CYCLE;
--COMMIT;
RESET standard_conforming_strings;
\i /tmp/emaj_test/sql_scripts/myGroup2.sql
-- file generated at [ts] by the emaj_generate_sql() function, for tables group myGroup2, processing logs between mark Multi-1 and the current situation
SET standard_conforming_strings = ON;
--BEGIN TRANSACTION;
INSERT INTO myschema2.mytbl5 VALUES (10, '{abc,def,ghi}', '{1,2,3}', NULL);
INSERT INTO myschema2.mytbl5 VALUES (20, '{abc,def,ghi}', '{3,4,5}', '{02-01-2000,02-28-2000}');
UPDATE ONLY myschema2.mytbl5 SET col51 = 10, col52 = '{abc,def,ghi}', col53 = '{1,2,3}', col54 = '{11-28-2010,12-03-2010}' WHERE col51 = 10;
INSERT INTO myschema2.mytbl6 VALUES (11, '(1,1.3)', '(2,2),(0,0)', '<(5,5),1>', '((-2,-2),(3,0),(1,4))', '10.20.30.40/27');
INSERT INTO myschema2.mytbl6 VALUES (12, '(2,1.3)', '(2,2),(0,0)', '<(5,5),2>', '((-2,-2),(3,0),(1,4))', '10.20.30.40/27');
INSERT INTO myschema2.mytbl6 VALUES (13, '(3,1.3)', '(2,2),(0,0)', '<(5,5),3>', '((-2,-2),(3,0),(1,4))', '10.20.30.40/27');
INSERT INTO myschema2.mytbl6 VALUES (14, '(4,1.3)', '(2,2),(0,0)', '<(5,5),4>', '((-2,-2),(3,0),(1,4))', '10.20.30.40/27');
INSERT INTO myschema2.mytbl6 VALUES (15, '(5,1.3)', '(2,2),(0,0)', '<(5,5),5>', '((-2,-2),(3,0),(1,4))', '10.20.30.40/27');
INSERT INTO myschema2.mytbl6 VALUES (16, '(6,1.3)', '(2,2),(0,0)', '<(5,5),6>', '((-2,-2),(3,0),(1,4))', '10.20.30.40/27');
INSERT INTO myschema2.mytbl6 VALUES (17, '(7,1.3)', '(2,2),(0,0)', '<(5,5),7>', '((-2,-2),(3,0),(1,4))', '10.20.30.40/27');
INSERT INTO myschema2.mytbl6 VALUES (18, '(8,1.3)', '(2,2),(0,0)', '<(5,5),8>', '((-2,-2),(3,0),(1,4))', '10.20.30.40/27');
UPDATE ONLY myschema2.mytbl6 SET col61 = 4, col62 = '(4,1.3)', col63 = '(2,2),(0,0)', col64 = '<(5,6),3.5>', col65 = NULL, col66 = '10.20.30.40/27' WHERE col61 = 4;
UPDATE ONLY myschema2.mytbl6 SET col61 = 5, col62 = '(5,1.3)', col63 = '(2,2),(0,0)', col64 = '<(5,6),3.5>', col65 = NULL, col66 = '10.20.30.40/27' WHERE col61 = 5;
UPDATE ONLY myschema2.mytbl6 SET col61 = 6, col62 = '(6,1.3)', col63 = '(2,2),(0,0)', col64 = '<(5,6),3.5>', col65 = NULL, col66 = '10.20.30.40/27' WHERE col61 = 6;
UPDATE ONLY myschema2.mytbl6 SET col61 = 7, col62 = '(7,1.3)', col63 = '(2,2),(0,0)', col64 = '<(5,6),3.5>', col65 = NULL, col66 = '10.20.30.40/27' WHERE col61 = 7;
UPDATE ONLY myschema2.mytbl6 SET col61 = 8, col62 = '(8,1.3)', col63 = '(2,2),(0,0)', col64 = '<(5,6),3.5>', col65 = NULL, col66 = '10.20.30.40/27' WHERE col61 = 8;
UPDATE ONLY myschema2.mytbl6 SET col61 = 11, col62 = '(1,1.3)', col63 = '(2,2),(0,0)', col64 = '<(5,6),3.5>', col65 = NULL, col66 = '10.20.30.40/27' WHERE col61 = 11;
UPDATE ONLY myschema2.mytbl6 SET col61 = 12, col62 = '(2,1.3)', col63 = '(2,2),(0,0)', col64 = '<(5,6),3.5>', col65 = NULL, col66 = '10.20.30.40/27' WHERE col61 = 12;
UPDATE ONLY myschema2.mytbl6 SET col61 = 13, col62 = '(3,1.3)', col63 = '(2,2),(0,0)', col64 = '<(5,6),3.5>', col65 = NULL, col66 = '10.20.30.40/27' WHERE col61 = 13;
ALTER SEQUENCE myschema2.myseq1 RESTART 1004 START 1000 INCREMENT 1 MAXVALUE 9223372036854775807 MINVALUE 1000 CACHE 1 NO CYCLE;
ALTER SEQUENCE myschema2."myTbl3_col31_seq" RESTART 21 START 1 INCREMENT 1 MAXVALUE 9223372036854775807 MINVALUE 1 CACHE 1 NO CYCLE;
--COMMIT;
RESET standard_conforming_strings;
\i /tmp/emaj_test/sql_scripts/Group3.sql
-- file generated at [ts] by the emaj_generate_sql() function, for tables group phil's group#3",, processing logs between mark M1_rollbackable and the current situation
SET standard_conforming_strings = ON;
--BEGIN TRANSACTION;
INSERT INTO "phil's schema3"."phil's tbl1" VALUES (1, 'AB''C', E'\\x0c');
INSERT INTO "phil's schema3"."phil's tbl1" VALUES (2, 'AB''C', E'\\x0c');
INSERT INTO "phil's schema3"."phil's tbl1" VALUES (3, 'AB''C', E'\\x0c');
INSERT INTO "phil's schema3"."phil's tbl1" VALUES (4, 'AB''C', E'\\x0c');
INSERT INTO "phil's schema3"."phil's tbl1" VALUES (5, 'AB''C', E'\\x0c');
INSERT INTO "phil's schema3"."phil's tbl1" VALUES (6, 'AB''C', E'\\x0c');
INSERT INTO "phil's schema3"."phil's tbl1" VALUES (7, 'AB''C', E'\\x0c');
INSERT INTO "phil's schema3"."phil's tbl1" VALUES (8, 'AB''C', E'\\x0c');
INSERT INTO "phil's schema3"."phil's tbl1" VALUES (9, 'AB''C', E'\\x0c');
INSERT INTO "phil's schema3"."phil's tbl1" VALUES (10, 'AB''C', E'\\x0c');
INSERT INTO "phil's schema3"."phil's tbl1" VALUES (11, 'AB''C', E'\\x0c');
INSERT INTO "phil's schema3"."phil's tbl1" VALUES (12, 'AB''C', E'\\x0c');
INSERT INTO "phil's schema3"."phil's tbl1" VALUES (13, 'AB''C', E'\\x0c');
INSERT INTO "phil's schema3"."phil's tbl1" VALUES (14, 'AB''C', E'\\x0c');
INSERT INTO "phil's schema3"."phil's tbl1" VALUES (15, 'AB''C', E'\\x0c');
INSERT INTO "phil's schema3"."phil's tbl1" VALUES (16, 'AB''C', E'\\x0c');
INSERT INTO "phil's schema3"."phil's tbl1" VALUES (17, 'AB''C', E'\\x0c');
INSERT INTO "phil's schema3"."phil's tbl1" VALUES (18, 'AB''C', E'\\x0c');
INSERT INTO "phil's schema3"."phil's tbl1" VALUES (19, 'AB''C', E'\\x0c');
INSERT INTO "phil's schema3"."phil's tbl1" VALUES (20, 'AB''C', E'\\x0c');
INSERT INTO "phil's schema3"."phil's tbl1" VALUES (21, 'AB''C', E'\\x0c');
INSERT INTO "phil's schema3"."phil's tbl1" VALUES (22, 'AB''C', E'\\x0c');
INSERT INTO "phil's schema3"."phil's tbl1" VALUES (23, 'AB''C', E'\\x0c');
INSERT INTO "phil's schema3"."phil's tbl1" VALUES (24, 'AB''C', E'\\x0c');
INSERT INTO "phil's schema3"."phil's tbl1" VALUES (25, 'AB''C', E'\\x0c');
INSERT INTO "phil's schema3"."phil's tbl1" VALUES (26, 'AB''C', E'\\x0c');
INSERT INTO "phil's schema3"."phil's tbl1" VALUES (27, 'AB''C', E'\\x0c');
INSERT INTO "phil's schema3"."phil's tbl1" VALUES (28, 'AB''C', E'\\x0c');
INSERT INTO "phil's schema3"."phil's tbl1" VALUES (29, 'AB''C', E'\\x0c');
INSERT INTO "phil's schema3"."phil's tbl1" VALUES (30, 'AB''C', E'\\x0c');
INSERT INTO "phil's schema3"."phil's tbl1" VALUES (31, 'AB''C', E'\\x0c');
UPDATE ONLY "phil's schema3"."phil's tbl1" SET "phil's col11" = 1, "phil's col12" = 'AB''C', "phil\s col13" = E'\\x1c' WHERE "phil's col11" = 1 AND "phil's col12" = 'AB''C';
UPDATE ONLY "phil's schema3"."phil's tbl1" SET "phil's col11" = 2, "phil's col12" = 'AB''C', "phil\s col13" = E'\\x1c' WHERE "phil's col11" = 2 AND "phil's col12" = 'AB''C';
UPDATE ONLY "phil's schema3"."phil's tbl1" SET "phil's col11" = 3, "phil's col12" = 'AB''C', "phil\s col13" = E'\\x1c' WHERE "phil's col11" = 3 AND "phil's col12" = 'AB''C';
UPDATE ONLY "phil's schema3"."phil's tbl1" SET "phil's col11" = 18, "phil's col12" = 'AB''C', "phil\s col13" = E'\\x1c27' WHERE "phil's col11" = 18 AND "phil's col12" = 'AB''C';
UPDATE ONLY "phil's schema3"."phil's tbl1" SET "phil's col11" = 19, "phil's col12" = 'AB''C', "phil\s col13" = E'\\x1c27' WHERE "phil's col11" = 19 AND "phil's col12" = 'AB''C';
UPDATE ONLY "phil's schema3"."phil's tbl1" SET "phil's col11" = 20, "phil's col12" = 'AB''C', "phil\s col13" = E'\\x1c27' WHERE "phil's col11" = 20 AND "phil's col12" = 'AB''C';
UPDATE ONLY "phil's schema3"."phil's tbl1" SET "phil's col11" = 21, "phil's col12" = 'AB''C', "phil\s col13" = E'\\x1c27' WHERE "phil's col11" = 21 AND "phil's col12" = 'AB''C';
UPDATE ONLY "phil's schema3"."phil's tbl1" SET "phil's col11" = 22, "phil's col12" = 'AB''C', "phil\s col13" = E'\\x1c27' WHERE "phil's col11" = 22 AND "phil's col12" = 'AB''C';
INSERT INTO "phil's schema3"."myTbl2\" VALUES (1, 'ABC', '12-31-2010');
DELETE FROM ONLY "phil's schema3"."phil's tbl1" WHERE "phil's col11" = 23 AND "phil's col12" = 'AB''C';
DELETE FROM ONLY "phil's schema3"."phil's tbl1" WHERE "phil's col11" = 24 AND "phil's col12" = 'AB''C';
DELETE FROM ONLY "phil's schema3"."phil's tbl1" WHERE "phil's col11" = 25 AND "phil's col12" = 'AB''C';
DELETE FROM ONLY "phil's schema3"."phil's tbl1" WHERE "phil's col11" = 26 AND "phil's col12" = 'AB''C';
DELETE FROM ONLY "phil's schema3"."phil's tbl1" WHERE "phil's col11" = 27 AND "phil's col12" = 'AB''C';
DELETE FROM ONLY "phil's schema3"."phil's tbl1" WHERE "phil's col11" = 28 AND "phil's col12" = 'AB''C';
DELETE FROM ONLY "phil's schema3"."phil's tbl1" WHERE "phil's col11" = 29 AND "phil's col12" = 'AB''C';
DELETE FROM ONLY "phil's schema3"."phil's tbl1" WHERE "phil's col11" = 30 AND "phil's col12" = 'AB''C';
DELETE FROM ONLY "phil's schema3"."phil's tbl1" WHERE "phil's col11" = 31 AND "phil's col12" = 'AB''C';
DELETE FROM ONLY "phil's schema3"."phil's tbl1" WHERE "phil's col11" = 21 AND "phil's col12" = 'AB''C';
DELETE FROM ONLY "phil's schema3"."phil's tbl1" WHERE "phil's col11" = 22 AND "phil's col12" = 'AB''C';
INSERT INTO "phil's schema3"."myTbl2\" VALUES (2, 'DEF', NULL);
DELETE FROM ONLY "phil's schema3"."phil's tbl1" WHERE "phil's col11" = 10 AND "phil's col12" = 'AB''C';
UPDATE ONLY "phil's schema3"."phil's tbl1" SET "phil's col11" = 1, "phil's col12" = 'DEF', "phil\s col13" = E'\\x1c' WHERE "phil's col11" = 1 AND "phil's col12" = 'AB''C';
UPDATE ONLY "phil's schema3"."phil's tbl1" SET "phil's col11" = 2, "phil's col12" = 'DEF', "phil\s col13" = E'\\x1c' WHERE "phil's col11" = 2 AND "phil's col12" = 'AB''C';
ALTER SEQUENCE "phil's schema3"."phil's seq\1" RESTART 1002 START 1000 INCREMENT 1 MAXVALUE 2000 MINVALUE 1000 CACHE 1 CYCLE;
--COMMIT;
RESET standard_conforming_strings;
  select emaj.emaj_snap_group('myGroup1','/tmp/emaj_test/snaps2','CSV HEADER');
 emaj_snap_group 
-----------------
               6
(1 row)

  select emaj.emaj_snap_group('myGroup2','/tmp/emaj_test/snaps2','CSV HEADER');
 emaj_snap_group 
-----------------
               8
(1 row)

  select emaj.emaj_snap_group('phil''s group#3",','/tmp/emaj_test/snaps2','CSV HEADER');
 emaj_snap_group 
-----------------
               3
(1 row)

rollback;
-- mask timestamp in _INFO files
\! sed -i_s -s 's/at .*/at [ts]/' /tmp/emaj_test/snaps/_INFO /tmp/emaj_test/snaps2/_INFO
-- and compare both snaps sets
-- sequences are detected as different because of :
-- - the effect of RESTART on is_called and next_val attributes
-- - internal log_cnt value being reset
\! diff --exclude _INFO_s /tmp/emaj_test/snaps /tmp/emaj_test/snaps2
diff --exclude _INFO_s /tmp/emaj_test/snaps/myschema1_myTbl3_col31_seq.snap /tmp/emaj_test/snaps2/myschema1_myTbl3_col31_seq.snap
2c2
< myTbl3_col31_seq,20,1,1,9223372036854775807,1,1,f,t
---
> myTbl3_col31_seq,21,1,1,9223372036854775807,1,1,f,f
diff --exclude _INFO_s /tmp/emaj_test/snaps/myschema2_myTbl3_col31_seq.snap /tmp/emaj_test/snaps2/myschema2_myTbl3_col31_seq.snap
2c2
< myTbl3_col31_seq,20,1,1,9223372036854775807,1,1,f,t
---
> myTbl3_col31_seq,21,1,1,9223372036854775807,1,1,f,f
diff --exclude _INFO_s /tmp/emaj_test/snaps/phil's schema3_phil's seq\1.snap /tmp/emaj_test/snaps2/phil's schema3_phil's seq\1.snap
2c2
< phil's seq\1,1001,1000,1,2000,1000,1,t,t
---
> phil's seq\1,1002,1000,1,2000,1000,1,t,f
set role emaj_regression_tests_adm_user;
-----------------------------
-- test end: check and reset history
-----------------------------
select hist_id, hist_function, hist_event, hist_object, regexp_replace(regexp_replace(hist_wording,E'\\d\\d\.\\d\\d\\.\\d\\d\\.\\d\\d\\d','%','g'),E'\\[.+\\]','(timestamp)','g'), hist_user from emaj.emaj_hist order by hist_id;
 hist_id |      hist_function       |        hist_event        |           hist_object           |                                        regexp_replace                                        | hist_user 
---------+--------------------------+--------------------------+---------------------------------+----------------------------------------------------------------------------------------------+-----------
    8000 | STOP_GROUP               | BEGIN                    | myGroup1                        |                                                                                              | postgres
    8001 | STOP_GROUP               | END                      | myGroup1                        | 0 tables/sequences processed                                                                 | postgres
    8002 | DROP_GROUP               | BEGIN                    | myGroup1                        |                                                                                              | postgres
    8003 | DROP_GROUP               | SECONDARY SCHEMA DROPPED | emajb                           |                                                                                              | postgres
    8004 | DROP_GROUP               | END                      | myGroup1                        | 6 tables/sequences processed                                                                 | postgres
    8005 | FORCE_DROP_GROUP         | BEGIN                    | myGroup2                        |                                                                                              | postgres
    8006 | FORCE_DROP_GROUP         | SECONDARY SCHEMA DROPPED | "emajC"                         |                                                                                              | postgres
    8007 | FORCE_DROP_GROUP         | END                      | myGroup2                        | 8 tables/sequences processed                                                                 | postgres
    8008 | STOP_GROUP               | BEGIN                    | phil's group#3",                |                                                                                              | postgres
    8009 | LOCK_GROUP               | BEGIN                    | phil's group#3",                |                                                                                              | postgres
    8010 | LOCK_GROUP               | END                      | phil's group#3",                | 2 tables locked, 0 deadlock(s)                                                               | postgres
    8011 | SET_MARK_GROUP           | BEGIN                    | phil's group#3",                | Simple stop mark                                                                             | postgres
    8012 | SET_MARK_GROUP           | END                      | phil's group#3",                | Simple stop mark                                                                             | postgres
    8013 | STOP_GROUP               | END                      | phil's group#3",                | 3 tables/sequences processed                                                                 | postgres
    8014 | DROP_GROUP               | BEGIN                    | phil's group#3",                |                                                                                              | postgres
    8015 | DROP_GROUP               | SECONDARY SCHEMA DROPPED | "emaj #'3"                      |                                                                                              | postgres
    8016 | DROP_GROUP               | END                      | phil's group#3",                | 3 tables/sequences processed                                                                 | postgres
    8017 | CREATE_GROUP             | BEGIN                    | myGroup1                        | rollbackable                                                                                 | postgres
    8018 | CREATE_GROUP             | SECONDARY SCHEMA CREATED | emajb                           |                                                                                              | postgres
    8019 | CREATE_GROUP             | SECONDARY SCHEMA CREATED | "emajC"                         |                                                                                              | postgres
    8020 | CREATE_GROUP             | END                      | myGroup1                        | 6 tables/sequences processed                                                                 | postgres
    8021 | COMMENT_GROUP            |                          | myGroup1                        |                                                                                              | postgres
    8022 | CREATE_GROUP             | BEGIN                    | myGroup2                        | rollbackable                                                                                 | postgres
    8023 | CREATE_GROUP             | END                      | myGroup2                        | 8 tables/sequences processed                                                                 | postgres
    8024 | START_GROUP              | BEGIN                    | myGroup1                        | With log reset                                                                               | postgres
    8025 | LOCK_GROUP               | BEGIN                    | myGroup1                        |                                                                                              | postgres
    8026 | LOCK_GROUP               | END                      | myGroup1                        | 5 tables locked, 0 deadlock(s)                                                               | postgres
    8027 | SET_MARK_GROUP           | BEGIN                    | myGroup1                        | M1                                                                                           | postgres
    8028 | SET_MARK_GROUP           | END                      | myGroup1                        | M1                                                                                           | postgres
    8029 | START_GROUP              | END                      | myGroup1                        | 6 tables/sequences processed                                                                 | postgres
    8030 | START_GROUP              | BEGIN                    | myGroup2                        | With log reset                                                                               | postgres
    8031 | LOCK_GROUP               | BEGIN                    | myGroup2                        |                                                                                              | postgres
    8032 | LOCK_GROUP               | END                      | myGroup2                        | 6 tables locked, 0 deadlock(s)                                                               | postgres
    8033 | SET_MARK_GROUP           | BEGIN                    | myGroup2                        | M1                                                                                           | postgres
    8034 | SET_MARK_GROUP           | END                      | myGroup2                        | M1                                                                                           | postgres
    8035 | START_GROUP              | END                      | myGroup2                        | 8 tables/sequences processed                                                                 | postgres
    8036 | SET_MARK_GROUP           | BEGIN                    | myGroup1                        |                                                                                              | postgres
    8037 | LOCK_GROUP               | BEGIN                    | myGroup1                        |                                                                                              | postgres
    8038 | LOCK_GROUP               | END                      | myGroup1                        | 5 tables locked, 0 deadlock(s)                                                               | postgres
    8039 | SET_MARK_GROUP           | END                      | myGroup1                        | M2                                                                                           | postgres
    8040 | SET_MARK_GROUP           | BEGIN                    | myGroup1                        |                                                                                              | postgres
    8041 | LOCK_GROUP               | BEGIN                    | myGroup1                        |                                                                                              | postgres
    8042 | LOCK_GROUP               | END                      | myGroup1                        | 5 tables locked, 0 deadlock(s)                                                               | postgres
    8043 | SET_MARK_GROUP           | END                      | myGroup1                        | M3                                                                                           | postgres
    8044 | COMMENT_MARK_GROUP       |                          | myGroup1                        | Mark M3                                                                                      | postgres
    8045 | SET_MARK_GROUP           | BEGIN                    | myGroup2                        |                                                                                              | postgres
    8046 | LOCK_GROUP               | BEGIN                    | myGroup2                        |                                                                                              | postgres
    8047 | LOCK_GROUP               | END                      | myGroup2                        | 6 tables locked, 0 deadlock(s)                                                               | postgres
    8048 | SET_MARK_GROUP           | END                      | myGroup2                        | M2                                                                                           | postgres
    8049 | SET_MARK_GROUP           | BEGIN                    | myGroup2                        |                                                                                              | postgres
    8050 | LOCK_GROUP               | BEGIN                    | myGroup2                        |                                                                                              | postgres
    8051 | LOCK_GROUP               | END                      | myGroup2                        | 6 tables locked, 0 deadlock(s)                                                               | postgres
    8052 | SET_MARK_GROUP           | END                      | myGroup2                        | M3                                                                                           | postgres
    8053 | ROLLBACK_GROUP           | BEGIN                    | myGroup2                        | Logged rollback to mark M2 (timestamp)                                                       | postgres
    8054 | LOCK_SESSION             | BEGIN                    | myGroup2                        | Session #1                                                                                   | postgres
    8055 | LOCK_SESSION             | END                      | myGroup2                        | Session #1 : 6 tables locked, 0 deadlock(s)                                                  | postgres
    8056 | SET_MARK_GROUP           | BEGIN                    | myGroup2                        | RLBK_M2_%_START                                                                              | postgres
    8057 | SET_MARK_GROUP           | END                      | myGroup2                        | RLBK_M2_%_START                                                                              | postgres
    8058 | ROLLBACK_TABLE           | BEGIN                    | myschema2.mytbl4                | All log rows with emaj_gid > 11912                                                           | postgres
    8059 | ROLLBACK_TABLE           | END                      | myschema2.mytbl4                | 4 rollbacked rows                                                                            | postgres
    8060 | ROLLBACK_TABLE           | BEGIN                    | myschema2.mytbl5                | All log rows with emaj_gid > 11912                                                           | postgres
    8061 | ROLLBACK_TABLE           | END                      | myschema2.mytbl5                | 1 rollbacked rows                                                                            | postgres
    8062 | ROLLBACK_TABLE           | BEGIN                    | myschema2.mytbl6                | All log rows with emaj_gid > 11912                                                           | postgres
    8063 | ROLLBACK_TABLE           | END                      | myschema2.mytbl6                | 3 rollbacked rows                                                                            | postgres
    8064 | ROLLBACK_SEQUENCE        |                          | myschema2.myseq1                | RESTART 1001 MAXVALUE 2000 CYCLE                                                             | postgres
    8065 | ROLLBACK_SEQUENCE        |                          | myschema2."myTbl3_col31_seq"    |                                                                                              | postgres
    8066 | SET_MARK_GROUP           | BEGIN                    | myGroup2                        | RLBK_M2_%_DONE                                                                               | postgres
    8067 | SET_MARK_GROUP           | END                      | myGroup2                        | RLBK_M2_%_DONE                                                                               | postgres
    8068 | ROLLBACK_GROUP           | END                      | myGroup2                        | 3 tables and 2 sequences effectively processed                                               | postgres
    8069 | ROLLBACK_GROUP           | BEGIN                    | myGroup2                        | Logged rollback to mark M3 (timestamp)                                                       | postgres
    8070 | LOCK_SESSION             | BEGIN                    | myGroup2                        | Session #1                                                                                   | postgres
    8071 | LOCK_SESSION             | END                      | myGroup2                        | Session #1 : 6 tables locked, 0 deadlock(s)                                                  | postgres
    8072 | SET_MARK_GROUP           | BEGIN                    | myGroup2                        | RLBK_M3_%_START                                                                              | postgres
    8073 | SET_MARK_GROUP           | END                      | myGroup2                        | RLBK_M3_%_START                                                                              | postgres
    8074 | ROLLBACK_TABLE           | BEGIN                    | myschema2.mytbl4                | All log rows with emaj_gid > 11920                                                           | postgres
    8075 | ROLLBACK_TABLE           | END                      | myschema2.mytbl4                | 4 rollbacked rows                                                                            | postgres
    8076 | ROLLBACK_TABLE           | BEGIN                    | myschema2.mytbl5                | All log rows with emaj_gid > 11920                                                           | postgres
    8077 | ROLLBACK_TABLE           | END                      | myschema2.mytbl5                | 1 rollbacked rows                                                                            | postgres
    8078 | ROLLBACK_TABLE           | BEGIN                    | myschema2.mytbl6                | All log rows with emaj_gid > 11920                                                           | postgres
    8079 | ROLLBACK_TABLE           | END                      | myschema2.mytbl6                | 3 rollbacked rows                                                                            | postgres
    8080 | ROLLBACK_SEQUENCE        |                          | myschema2.myseq1                | RESTART 1004 MAXVALUE 9223372036854775807 NO  CYCLE                                          | postgres
    8081 | ROLLBACK_SEQUENCE        |                          | myschema2."myTbl3_col31_seq"    |                                                                                              | postgres
    8082 | SET_MARK_GROUP           | BEGIN                    | myGroup2                        | RLBK_M3_%_DONE                                                                               | postgres
    8083 | SET_MARK_GROUP           | END                      | myGroup2                        | RLBK_M3_%_DONE                                                                               | postgres
    8084 | ROLLBACK_GROUP           | END                      | myGroup2                        | 3 tables and 2 sequences effectively processed                                               | postgres
    8085 | ROLLBACK_GROUP           | BEGIN                    | myGroup1                        | Unlogged rollback to mark M2 (timestamp)                                                     | postgres
    8086 | LOCK_SESSION             | BEGIN                    | myGroup1                        | Session #1                                                                                   | postgres
    8087 | LOCK_SESSION             | END                      | myGroup1                        | Session #1 : 5 tables locked, 0 deadlock(s)                                                  | postgres
    8088 | ROLLBACK_TABLE           | BEGIN                    | myschema1.mytbl1                | All log rows with emaj_gid > 11860                                                           | postgres
    8089 | ROLLBACK_TABLE           | END                      | myschema1.mytbl1                | 3 rollbacked rows                                                                            | postgres
    8090 | ROLLBACK_TABLE           | BEGIN                    | myschema1.mytbl4                | All log rows with emaj_gid > 11860                                                           | postgres
    8091 | ROLLBACK_TABLE           | END                      | myschema1.mytbl4                | 8 rollbacked rows                                                                            | postgres
    8092 | ROLLBACK_GROUP           | MARK DELETED             | myGroup1                        | mark M3 has been deleted                                                                     | postgres
    8093 | ROLLBACK_SEQUENCE        |                          | myschema1."myTbl3_col31_seq"    |                                                                                              | postgres
    8094 | ROLLBACK_GROUP           | END                      | myGroup1                        | 2 tables and 1 sequences effectively processed                                               | postgres
    8095 | SET_MARK_GROUP           | BEGIN                    | myGroup1                        |                                                                                              | postgres
    8096 | LOCK_GROUP               | BEGIN                    | myGroup1                        |                                                                                              | postgres
    8097 | LOCK_GROUP               | END                      | myGroup1                        | 5 tables locked, 0 deadlock(s)                                                               | postgres
    8098 | SET_MARK_GROUP           | END                      | myGroup1                        | M4                                                                                           | postgres
    8099 | SET_MARK_GROUP           | BEGIN                    | myGroup1                        |                                                                                              | postgres
    8100 | LOCK_GROUP               | BEGIN                    | myGroup1                        |                                                                                              | postgres
    8101 | LOCK_GROUP               | END                      | myGroup1                        | 5 tables locked, 0 deadlock(s)                                                               | postgres
    8102 | SET_MARK_GROUP           | END                      | myGroup1                        | M5                                                                                           | postgres
    8103 | SET_MARK_GROUP           | BEGIN                    | myGroup1                        |                                                                                              | postgres
    8104 | LOCK_GROUP               | BEGIN                    | myGroup1                        |                                                                                              | postgres
    8105 | LOCK_GROUP               | END                      | myGroup1                        | 5 tables locked, 0 deadlock(s)                                                               | postgres
    8106 | SET_MARK_GROUP           | END                      | myGroup1                        | M6                                                                                           | postgres
    8107 | ROLLBACK_GROUP           | BEGIN                    | myGroup2                        | Logged rollback to mark M2 (timestamp)                                                       | postgres
    8108 | LOCK_SESSION             | BEGIN                    | myGroup2                        | Session #1                                                                                   | postgres
    8109 | LOCK_SESSION             | END                      | myGroup2                        | Session #1 : 6 tables locked, 0 deadlock(s)                                                  | postgres
    8110 | SET_MARK_GROUP           | BEGIN                    | myGroup2                        | RLBK_M2_%_START                                                                              | postgres
    8111 | SET_MARK_GROUP           | END                      | myGroup2                        | RLBK_M2_%_START                                                                              | postgres
    8112 | ROLLBACK_TABLE           | BEGIN                    | myschema2.mytbl4                | All log rows with emaj_gid > 11912                                                           | postgres
    8113 | ROLLBACK_TABLE           | END                      | myschema2.mytbl4                | 12 rollbacked rows                                                                           | postgres
    8114 | ROLLBACK_TABLE           | BEGIN                    | myschema2.mytbl5                | All log rows with emaj_gid > 11912                                                           | postgres
    8115 | ROLLBACK_TABLE           | END                      | myschema2.mytbl5                | 3 rollbacked rows                                                                            | postgres
    8116 | ROLLBACK_TABLE           | BEGIN                    | myschema2.mytbl6                | All log rows with emaj_gid > 11912                                                           | postgres
    8117 | ROLLBACK_TABLE           | END                      | myschema2.mytbl6                | 9 rollbacked rows                                                                            | postgres
    8118 | ROLLBACK_SEQUENCE        |                          | myschema2.myseq1                | RESTART 1001 MAXVALUE 2000 CYCLE                                                             | postgres
    8119 | ROLLBACK_SEQUENCE        |                          | myschema2."myTbl3_col31_seq"    |                                                                                              | postgres
    8120 | SET_MARK_GROUP           | BEGIN                    | myGroup2                        | RLBK_M2_%_DONE                                                                               | postgres
    8121 | SET_MARK_GROUP           | END                      | myGroup2                        | RLBK_M2_%_DONE                                                                               | postgres
    8122 | ROLLBACK_GROUP           | END                      | myGroup2                        | 3 tables and 2 sequences effectively processed                                               | postgres
    8123 | ROLLBACK_GROUP           | BEGIN                    | myGroup2                        | Unlogged rollback to mark M3 (timestamp)                                                     | postgres
    8124 | LOCK_SESSION             | BEGIN                    | myGroup2                        | Session #1                                                                                   | postgres
    8125 | LOCK_SESSION             | END                      | myGroup2                        | Session #1 : 6 tables locked, 0 deadlock(s)                                                  | postgres
    8126 | ROLLBACK_TABLE           | BEGIN                    | myschema2.mytbl4                | All log rows with emaj_gid > 11920                                                           | postgres
    8127 | ROLLBACK_TABLE           | END                      | myschema2.mytbl4                | 20 rollbacked rows                                                                           | postgres
    8128 | ROLLBACK_TABLE           | BEGIN                    | myschema2.mytbl5                | All log rows with emaj_gid > 11920                                                           | postgres
    8129 | ROLLBACK_TABLE           | END                      | myschema2.mytbl5                | 5 rollbacked rows                                                                            | postgres
    8130 | ROLLBACK_TABLE           | BEGIN                    | myschema2.mytbl6                | All log rows with emaj_gid > 11920                                                           | postgres
    8131 | ROLLBACK_TABLE           | END                      | myschema2.mytbl6                | 15 rollbacked rows                                                                           | postgres
    8132 | ROLLBACK_GROUP           | MARK DELETED             | myGroup2                        | mark RLBK_M2_%_START has been deleted                                                        | postgres
    8133 | ROLLBACK_GROUP           | MARK DELETED             | myGroup2                        | mark RLBK_M2_%_DONE has been deleted                                                         | postgres
    8134 | ROLLBACK_GROUP           | MARK DELETED             | myGroup2                        | mark RLBK_M3_%_START has been deleted                                                        | postgres
    8135 | ROLLBACK_GROUP           | MARK DELETED             | myGroup2                        | mark RLBK_M3_%_DONE has been deleted                                                         | postgres
    8136 | ROLLBACK_GROUP           | MARK DELETED             | myGroup2                        | mark RLBK_M2_%_START has been deleted                                                        | postgres
    8137 | ROLLBACK_GROUP           | MARK DELETED             | myGroup2                        | mark RLBK_M2_%_DONE has been deleted                                                         | postgres
    8138 | ROLLBACK_SEQUENCE        |                          | myschema2.myseq1                | RESTART 1004 MAXVALUE 9223372036854775807 NO  CYCLE                                          | postgres
    8139 | ROLLBACK_SEQUENCE        |                          | myschema2."myTbl3_col31_seq"    |                                                                                              | postgres
    8140 | ROLLBACK_GROUP           | END                      | myGroup2                        | 3 tables and 2 sequences effectively processed                                               | postgres
    8141 | ROLLBACK_GROUP           | BEGIN                    | myGroup1                        | Unlogged rollback to mark M5 (timestamp)                                                     | postgres
    8142 | LOCK_SESSION             | BEGIN                    | myGroup1                        | Session #1                                                                                   | postgres
    8143 | LOCK_SESSION             | END                      | myGroup1                        | Session #1 : 5 tables locked, 0 deadlock(s)                                                  | postgres
    8144 | ROLLBACK_TABLE           | BEGIN                    | myschema1.mytbl1                | All log rows with emaj_gid > 11959                                                           | postgres
    8145 | ROLLBACK_TABLE           | END                      | myschema1.mytbl1                | 1 rollbacked rows                                                                            | postgres
    8146 | ROLLBACK_TABLE           | BEGIN                    | myschema1.mytbl4                | All log rows with emaj_gid > 11959                                                           | postgres
    8147 | ROLLBACK_TABLE           | END                      | myschema1.mytbl4                | 2 rollbacked rows                                                                            | postgres
    8148 | ROLLBACK_GROUP           | MARK DELETED             | myGroup1                        | mark M6 has been deleted                                                                     | postgres
    8149 | ROLLBACK_SEQUENCE        |                          | myschema1."myTbl3_col31_seq"    |                                                                                              | postgres
    8150 | ROLLBACK_GROUP           | END                      | myGroup1                        | 2 tables and 1 sequences effectively processed                                               | postgres
    8151 | ROLLBACK_GROUP           | BEGIN                    | myGroup1                        | Logged rollback to mark M4 (timestamp)                                                       | postgres
    8152 | LOCK_SESSION             | BEGIN                    | myGroup1                        | Session #1                                                                                   | postgres
    8153 | LOCK_SESSION             | END                      | myGroup1                        | Session #1 : 5 tables locked, 0 deadlock(s)                                                  | postgres
    8154 | SET_MARK_GROUP           | BEGIN                    | myGroup1                        | RLBK_M4_%_START                                                                              | postgres
    8155 | SET_MARK_GROUP           | END                      | myGroup1                        | RLBK_M4_%_START                                                                              | postgres
    8156 | ROLLBACK_TABLE           | BEGIN                    | myschema1."myTbl3"              | All log rows with emaj_gid > 11949                                                           | postgres
    8157 | ROLLBACK_TABLE           | END                      | myschema1."myTbl3"              | 10 rollbacked rows                                                                           | postgres
    8158 | ROLLBACK_TABLE           | BEGIN                    | myschema1.mytbl1                | All log rows with emaj_gid > 11949                                                           | postgres
    8159 | ROLLBACK_TABLE           | END                      | myschema1.mytbl1                | 1 rollbacked rows                                                                            | postgres
    8160 | ROLLBACK_TABLE           | BEGIN                    | myschema1.mytbl4                | All log rows with emaj_gid > 11949                                                           | postgres
    8161 | ROLLBACK_TABLE           | END                      | myschema1.mytbl4                | 2 rollbacked rows                                                                            | postgres
    8162 | ROLLBACK_SEQUENCE        |                          | myschema1."myTbl3_col31_seq"    |                                                                                              | postgres
    8163 | SET_MARK_GROUP           | BEGIN                    | myGroup1                        | RLBK_M4_%_DONE                                                                               | postgres
    8164 | SET_MARK_GROUP           | END                      | myGroup1                        | RLBK_M4_%_DONE                                                                               | postgres
    8165 | ROLLBACK_GROUP           | END                      | myGroup1                        | 3 tables and 1 sequences effectively processed                                               | postgres
    8166 | RENAME_MARK_GROUP        | BEGIN                    | myGroup1                        | RLBK_M4_%_START                                                                              | postgres
    8167 | RENAME_MARK_GROUP        | END                      | myGroup1                        | RLBK_M4_%_START renamed Before logged rollback to M4                                         | postgres
    8168 | DELETE_MARK_GROUP        | BEGIN                    | myGroup1                        | RLBK_M4_%_DONE                                                                               | postgres
    8169 | DELETE_MARK_GROUP        | END                      | myGroup1                        | RLBK_M4_%_DONE                                                                               | postgres
    8170 | DELETE_MARK_GROUP        | BEGIN                    | myGroup1                        | M1                                                                                           | postgres
    8171 | DELETE_MARK_GROUP        | END                      | myGroup1                        | M1                                                                                           | postgres
    8172 | DELETE_BEFORE_MARK_GROUP | BEGIN                    | myGroup1                        | M4                                                                                           | postgres
    8173 | DELETE_BEFORE_MARK_GROUP | END                      | myGroup1                        | 1 marks deleted ; M4 is now the initial mark                                                 | postgres
    8178 | STOP_GROUPS              | BEGIN                    | myGroup1,myGroup2               |                                                                                              | postgres
    8179 | LOCK_GROUPS              | BEGIN                    | myGroup1,myGroup2               |                                                                                              | postgres
    8180 | LOCK_GROUPS              | END                      | myGroup1,myGroup2               | 11 tables locked, 0 deadlock(s)                                                              | postgres
    8181 | SET_MARK_GROUPS          | BEGIN                    | myGroup1,myGroup2               | STOP_%                                                                                       | postgres
    8182 | SET_MARK_GROUPS          | END                      | myGroup1,myGroup2               | STOP_%                                                                                       | postgres
    8183 | STOP_GROUPS              | END                      | myGroup1,myGroup2               | 14 tables/sequences processed                                                                | postgres
    8184 | START_GROUPS             | BEGIN                    | myGroup1,myGroup2               | Without log reset                                                                            | postgres
    8185 | LOCK_GROUPS              | BEGIN                    | myGroup1,myGroup2               |                                                                                              | postgres
    8186 | LOCK_GROUPS              | END                      | myGroup1,myGroup2               | 11 tables locked, 0 deadlock(s)                                                              | postgres
    8187 | SET_MARK_GROUPS          | BEGIN                    | myGroup1,myGroup2               | Multi-1                                                                                      | postgres
    8188 | SET_MARK_GROUPS          | END                      | myGroup1,myGroup2               | Multi-1                                                                                      | postgres
    8189 | START_GROUPS             | END                      | myGroup1,myGroup2               | 14 tables/sequences processed                                                                | postgres
    8190 | SET_MARK_GROUPS          | BEGIN                    | myGroup1,myGroup2               | Multi-2                                                                                      | postgres
    8191 | LOCK_GROUPS              | BEGIN                    | myGroup1,myGroup2               |                                                                                              | postgres
    8192 | LOCK_GROUPS              | END                      | myGroup1,myGroup2               | 11 tables locked, 0 deadlock(s)                                                              | postgres
    8193 | SET_MARK_GROUPS          | END                      | myGroup1,myGroup2               | Multi-2                                                                                      | postgres
    8194 | ROLLBACK_GROUPS          | BEGIN                    | myGroup1,myGroup2               | Logged rollback to mark Multi-1 (timestamp)                                                  | postgres
    8195 | LOCK_SESSIONS            | BEGIN                    | myGroup1,myGroup2               | Session #1                                                                                   | postgres
    8196 | LOCK_SESSIONS            | END                      | myGroup1,myGroup2               | Session #1 : 11 tables locked, 0 deadlock(s)                                                 | postgres
    8197 | SET_MARK_GROUPS          | BEGIN                    | myGroup1,myGroup2               | RLBK_Multi-1_%_START                                                                         | postgres
    8198 | SET_MARK_GROUPS          | END                      | myGroup1,myGroup2               | RLBK_Multi-1_%_START                                                                         | postgres
    8199 | ROLLBACK_SEQUENCE        |                          | myschema1."myTbl3_col31_seq"    |                                                                                              | postgres
    8200 | ROLLBACK_SEQUENCE        |                          | myschema2.myseq1                |                                                                                              | postgres
    8201 | ROLLBACK_SEQUENCE        |                          | myschema2."myTbl3_col31_seq"    |                                                                                              | postgres
    8202 | SET_MARK_GROUPS          | BEGIN                    | myGroup1,myGroup2               | RLBK_Multi-1_%_DONE                                                                          | postgres
    8203 | SET_MARK_GROUPS          | END                      | myGroup1,myGroup2               | RLBK_Multi-1_%_DONE                                                                          | postgres
    8204 | ROLLBACK_GROUPS          | END                      | myGroup1,myGroup2               | 0 tables and 3 sequences effectively processed                                               | postgres
    8205 | ROLLBACK_GROUPS          | BEGIN                    | myGroup1,myGroup2               | Unlogged rollback to mark Multi-2 (timestamp)                                                | postgres
    8206 | LOCK_SESSIONS            | BEGIN                    | myGroup1,myGroup2               | Session #1                                                                                   | postgres
    8207 | LOCK_SESSIONS            | END                      | myGroup1,myGroup2               | Session #1 : 11 tables locked, 0 deadlock(s)                                                 | postgres
    8208 | ROLLBACK_GROUPS          | MARK DELETED             | myGroup1                        | mark RLBK_Multi-1_%_START has been deleted                                                   | postgres
    8209 | ROLLBACK_GROUPS          | MARK DELETED             | myGroup2                        | mark RLBK_Multi-1_%_START has been deleted                                                   | postgres
    8210 | ROLLBACK_GROUPS          | MARK DELETED             | myGroup1                        | mark RLBK_Multi-1_%_DONE has been deleted                                                    | postgres
    8211 | ROLLBACK_GROUPS          | MARK DELETED             | myGroup2                        | mark RLBK_Multi-1_%_DONE has been deleted                                                    | postgres
    8212 | ROLLBACK_SEQUENCE        |                          | myschema1."myTbl3_col31_seq"    |                                                                                              | postgres
    8213 | ROLLBACK_SEQUENCE        |                          | myschema2.myseq1                |                                                                                              | postgres
    8214 | ROLLBACK_SEQUENCE        |                          | myschema2."myTbl3_col31_seq"    |                                                                                              | postgres
    8215 | ROLLBACK_GROUPS          | END                      | myGroup1,myGroup2               | 0 tables and 3 sequences effectively processed                                               | postgres
    8216 | ROLLBACK_GROUPS          | BEGIN                    | myGroup1,myGroup2               | Unlogged rollback to mark Multi-1 (timestamp)                                                | postgres
    8217 | LOCK_SESSIONS            | BEGIN                    | myGroup1,myGroup2               | Session #1                                                                                   | postgres
    8218 | LOCK_SESSIONS            | END                      | myGroup1,myGroup2               | Session #1 : 11 tables locked, 0 deadlock(s)                                                 | postgres
    8219 | ROLLBACK_GROUPS          | MARK DELETED             | myGroup1                        | mark Multi-2 has been deleted                                                                | postgres
    8220 | ROLLBACK_GROUPS          | MARK DELETED             | myGroup2                        | mark Multi-2 has been deleted                                                                | postgres
    8221 | ROLLBACK_SEQUENCE        |                          | myschema1."myTbl3_col31_seq"    |                                                                                              | postgres
    8222 | ROLLBACK_SEQUENCE        |                          | myschema2.myseq1                |                                                                                              | postgres
    8223 | ROLLBACK_SEQUENCE        |                          | myschema2."myTbl3_col31_seq"    |                                                                                              | postgres
    8224 | ROLLBACK_GROUPS          | END                      | myGroup1,myGroup2               | 0 tables and 3 sequences effectively processed                                               | postgres
    8225 | STOP_GROUPS              | BEGIN                    | myGroup1,myGroup2               |                                                                                              | postgres
    8226 | LOCK_GROUPS              | BEGIN                    | myGroup1,myGroup2               |                                                                                              | postgres
    8227 | LOCK_GROUPS              | END                      | myGroup1,myGroup2               | 11 tables locked, 0 deadlock(s)                                                              | postgres
    8228 | SET_MARK_GROUPS          | BEGIN                    | myGroup1,myGroup2               | Stop after rollback                                                                          | postgres
    8229 | SET_MARK_GROUPS          | END                      | myGroup1,myGroup2               | Stop after rollback                                                                          | postgres
    8230 | STOP_GROUPS              | END                      | myGroup1,myGroup2               | 14 tables/sequences processed                                                                | postgres
    8232 | START_GROUPS             | BEGIN                    | myGroup1,myGroup2               | Without log reset                                                                            | postgres
    8233 | LOCK_GROUPS              | BEGIN                    | myGroup1,myGroup2               |                                                                                              | postgres
    8234 | LOCK_GROUPS              | END                      | myGroup1,myGroup2               | 11 tables locked, 0 deadlock(s)                                                              | postgres
    8235 | SET_MARK_GROUPS          | BEGIN                    | myGroup1,myGroup2               | Multi-1b                                                                                     | postgres
    8236 | SET_MARK_GROUPS          | END                      | myGroup1,myGroup2               | Multi-1b                                                                                     | postgres
    8237 | START_GROUPS             | END                      | myGroup1,myGroup2               | 14 tables/sequences processed                                                                | postgres
    8238 | SET_MARK_GROUPS          | BEGIN                    | myGroup1,myGroup2               | Multi-2                                                                                      | postgres
    8239 | LOCK_GROUPS              | BEGIN                    | myGroup1,myGroup2               |                                                                                              | postgres
    8240 | LOCK_GROUPS              | END                      | myGroup1,myGroup2               | 11 tables locked, 0 deadlock(s)                                                              | postgres
    8241 | SET_MARK_GROUPS          | END                      | myGroup1,myGroup2               | Multi-2                                                                                      | postgres
    8242 | DELETE_MARK_GROUP        | BEGIN                    | myGroup1                        | Multi-2                                                                                      | postgres
    8243 | DELETE_MARK_GROUP        | END                      | myGroup1                        | Multi-2                                                                                      | postgres
    8244 | ROLLBACK_GROUP           | BEGIN                    | myGroup2                        | Unlogged rollback to mark Multi-2 (timestamp)                                                | postgres
    8245 | LOCK_SESSION             | BEGIN                    | myGroup2                        | Session #1                                                                                   | postgres
    8246 | LOCK_SESSION             | END                      | myGroup2                        | Session #1 : 6 tables locked, 0 deadlock(s)                                                  | postgres
    8247 | ROLLBACK_SEQUENCE        |                          | myschema2.myseq1                |                                                                                              | postgres
    8248 | ROLLBACK_SEQUENCE        |                          | myschema2."myTbl3_col31_seq"    |                                                                                              | postgres
    8249 | ROLLBACK_GROUP           | END                      | myGroup2                        | 0 tables and 2 sequences effectively processed                                               | postgres
    8250 | DELETE_MARK_GROUP        | BEGIN                    | myGroup2                        | Multi-2                                                                                      | postgres
    8251 | DELETE_MARK_GROUP        | END                      | myGroup2                        | Multi-2                                                                                      | postgres
    8252 | DELETE_MARK_GROUP        | BEGIN                    | myGroup1                        | Multi-1                                                                                      | postgres
    8253 | DELETE_MARK_GROUP        | END                      | myGroup1                        | Multi-1                                                                                      | postgres
    8254 | DELETE_MARK_GROUP        | BEGIN                    | myGroup2                        | Multi-1                                                                                      | postgres
    8255 | DELETE_MARK_GROUP        | END                      | myGroup2                        | Multi-1                                                                                      | postgres
    8256 | RENAME_MARK_GROUP        | BEGIN                    | myGroup1                        | Multi-1b                                                                                     | postgres
    8257 | RENAME_MARK_GROUP        | END                      | myGroup1                        | Multi-1b renamed Multi-1                                                                     | postgres
    8258 | RENAME_MARK_GROUP        | BEGIN                    | myGroup2                        | Multi-1b                                                                                     | postgres
    8259 | RENAME_MARK_GROUP        | END                      | myGroup2                        | Multi-1b renamed Multi-1                                                                     | postgres
    8260 | RENAME_MARK_GROUP        | BEGIN                    | myGroup2                        | M2                                                                                           | postgres
    8261 | RENAME_MARK_GROUP        | END                      | myGroup2                        | M2 renamed Deleted M2                                                                        | postgres
    8262 | DELETE_BEFORE_MARK_GROUP | BEGIN                    | myGroup2                        | M3                                                                                           | postgres
    8263 | DELETE_BEFORE_MARK_GROUP | END                      | myGroup2                        | 2 marks deleted ; M3 is now the initial mark                                                 | postgres
    8264 | COMMENT_MARK_GROUP       |                          | myGroup2                        | Mark M3                                                                                      | postgres
    8265 | CREATE_GROUP             | BEGIN                    | phil's group#3",                | audit_only                                                                                   | postgres
    8266 | CREATE_GROUP             | SECONDARY SCHEMA CREATED | "emaj #'3"                      |                                                                                              | postgres
    8267 | CREATE_GROUP             | END                      | phil's group#3",                | 3 tables/sequences processed                                                                 | postgres
    8268 | ALTER_GROUP              | BEGIN                    | phil's group#3",                |                                                                                              | postgres
    8269 | ALTER_GROUP              | SECONDARY SCHEMA DROPPED | "emaj #'3"                      |                                                                                              | postgres
    8270 | ALTER_GROUP              | SECONDARY SCHEMA CREATED | "emaj #'3"                      |                                                                                              | postgres
    8271 | ALTER_GROUP              | END                      | phil's group#3",                | 2 tables/sequences effectively processed                                                     | postgres
    8272 | START_GROUP              | BEGIN                    | phil's group#3",                | With log reset                                                                               | postgres
    8273 | LOCK_GROUP               | BEGIN                    | phil's group#3",                |                                                                                              | postgres
    8274 | LOCK_GROUP               | END                      | phil's group#3",                | 2 tables locked, 0 deadlock(s)                                                               | postgres
    8275 | SET_MARK_GROUP           | BEGIN                    | phil's group#3",                | M1_after_alter_group                                                                         | postgres
    8276 | SET_MARK_GROUP           | END                      | phil's group#3",                | M1_after_alter_group                                                                         | postgres
    8277 | START_GROUP              | END                      | phil's group#3",                | 3 tables/sequences processed                                                                 | postgres
    8278 | STOP_GROUP               | BEGIN                    | phil's group#3",                |                                                                                              | postgres
    8279 | LOCK_GROUP               | BEGIN                    | phil's group#3",                |                                                                                              | postgres
    8280 | LOCK_GROUP               | END                      | phil's group#3",                | 2 tables locked, 0 deadlock(s)                                                               | postgres
    8281 | SET_MARK_GROUP           | BEGIN                    | phil's group#3",                | STOP_%                                                                                       | postgres
    8282 | SET_MARK_GROUP           | END                      | phil's group#3",                | STOP_%                                                                                       | postgres
    8283 | STOP_GROUP               | END                      | phil's group#3",                | 3 tables/sequences processed                                                                 | postgres
    8284 | ALTER_GROUP              | BEGIN                    | phil's group#3",                |                                                                                              | postgres
    8285 | ALTER_GROUP              | SECONDARY SCHEMA DROPPED | "emaj #'3"                      |                                                                                              | postgres
    8286 | ALTER_GROUP              | SECONDARY SCHEMA CREATED | "emaj #'3"                      |                                                                                              | postgres
    8287 | ALTER_GROUP              | END                      | phil's group#3",                | 2 tables/sequences effectively processed                                                     | postgres
    8288 | DROP_GROUP               | BEGIN                    | phil's group#3",                |                                                                                              | postgres
    8289 | DROP_GROUP               | SECONDARY SCHEMA DROPPED | "emaj #'3"                      |                                                                                              | postgres
    8290 | DROP_GROUP               | END                      | phil's group#3",                | 3 tables/sequences processed                                                                 | postgres
    8291 | CREATE_GROUP             | BEGIN                    | phil's group#3",                | rollbackable                                                                                 | postgres
    8292 | CREATE_GROUP             | SECONDARY SCHEMA CREATED | "emaj #'3"                      |                                                                                              | postgres
    8293 | CREATE_GROUP             | END                      | phil's group#3",                | 3 tables/sequences processed                                                                 | postgres
    8294 | START_GROUP              | BEGIN                    | phil's group#3",                | With log reset                                                                               | postgres
    8295 | LOCK_GROUP               | BEGIN                    | phil's group#3",                |                                                                                              | postgres
    8296 | LOCK_GROUP               | END                      | phil's group#3",                | 2 tables locked, 0 deadlock(s)                                                               | postgres
    8297 | SET_MARK_GROUP           | BEGIN                    | phil's group#3",                | M1_rollbackable                                                                              | postgres
    8298 | SET_MARK_GROUP           | END                      | phil's group#3",                | M1_rollbackable                                                                              | postgres
    8299 | START_GROUP              | END                      | phil's group#3",                | 3 tables/sequences processed                                                                 | postgres
    8300 | SET_MARK_GROUP           | BEGIN                    | phil's group#3",                |                                                                                              | postgres
    8301 | LOCK_GROUP               | BEGIN                    | phil's group#3",                |                                                                                              | postgres
    8302 | LOCK_GROUP               | END                      | phil's group#3",                | 2 tables locked, 0 deadlock(s)                                                               | postgres
    8303 | SET_MARK_GROUP           | END                      | phil's group#3",                | M2_rollbackable                                                                              | postgres
    8304 | SET_MARK_GROUP           | BEGIN                    | phil's group#3",                |                                                                                              | postgres
    8305 | LOCK_GROUP               | BEGIN                    | phil's group#3",                |                                                                                              | postgres
    8306 | LOCK_GROUP               | END                      | phil's group#3",                | 2 tables locked, 0 deadlock(s)                                                               | postgres
    8307 | SET_MARK_GROUP           | END                      | phil's group#3",                | M2_again!                                                                                    | postgres
    8308 | SET_MARK_GROUPS          | BEGIN                    | phil's group#3",                | phil's mark #1                                                                               | postgres
    8309 | LOCK_GROUPS              | BEGIN                    | phil's group#3",                |                                                                                              | postgres
    8310 | LOCK_GROUPS              | END                      | phil's group#3",                | 2 tables locked, 0 deadlock(s)                                                               | postgres
    8311 | SET_MARK_GROUPS          | END                      | phil's group#3",                | phil's mark #1                                                                               | postgres
    8312 | COMMENT_MARK_GROUP       |                          | phil's group#3",                | Mark phil's mark #1                                                                          | postgres
    8313 | RENAME_MARK_GROUP        | BEGIN                    | phil's group#3",                | phil's mark #1                                                                               | postgres
    8314 | RENAME_MARK_GROUP        | END                      | phil's group#3",                | phil's mark #1 renamed phil's mark #3                                                        | postgres
    8315 | DELETE_MARK_GROUP        | BEGIN                    | phil's group#3",                | M2_again!                                                                                    | postgres
    8316 | DELETE_MARK_GROUP        | END                      | phil's group#3",                | M2_again!                                                                                    | postgres
    8317 | ROLLBACK_GROUP           | BEGIN                    | phil's group#3",                | Logged rollback to mark phil's mark #3 (timestamp)                                           | postgres
    8318 | LOCK_SESSION             | BEGIN                    | phil's group#3",                | Session #1                                                                                   | postgres
    8319 | LOCK_SESSION             | END                      | phil's group#3",                | Session #1 : 2 tables locked, 0 deadlock(s)                                                  | postgres
    8320 | SET_MARK_GROUP           | BEGIN                    | phil's group#3",                | RLBK_phil's mark #3_%_START                                                                  | postgres
    8321 | SET_MARK_GROUP           | END                      | phil's group#3",                | RLBK_phil's mark #3_%_START                                                                  | postgres
    8322 | ROLLBACK_SEQUENCE        |                          | "phil's schema3"."phil's seq\1" |                                                                                              | postgres
    8323 | SET_MARK_GROUP           | BEGIN                    | phil's group#3",                | RLBK_phil's mark #3_%_DONE                                                                   | postgres
    8324 | SET_MARK_GROUP           | END                      | phil's group#3",                | RLBK_phil's mark #3_%_DONE                                                                   | postgres
    8325 | ROLLBACK_GROUP           | END                      | phil's group#3",                | 0 tables and 1 sequences effectively processed                                               | postgres
    8326 | ROLLBACK_GROUP           | BEGIN                    | phil's group#3",                | Unlogged rollback to mark phil's mark #3 (timestamp)                                         | postgres
    8327 | LOCK_SESSION             | BEGIN                    | phil's group#3",                | Session #1                                                                                   | postgres
    8328 | LOCK_SESSION             | END                      | phil's group#3",                | Session #1 : 2 tables locked, 0 deadlock(s)                                                  | postgres
    8329 | ROLLBACK_GROUP           | MARK DELETED             | phil's group#3",                | mark RLBK_phil's mark #3_%_START has been deleted                                            | postgres
    8330 | ROLLBACK_GROUP           | MARK DELETED             | phil's group#3",                | mark RLBK_phil's mark #3_%_DONE has been deleted                                             | postgres
    8331 | ROLLBACK_SEQUENCE        |                          | "phil's schema3"."phil's seq\1" |                                                                                              | postgres
    8332 | ROLLBACK_GROUP           | END                      | phil's group#3",                | 0 tables and 1 sequences effectively processed                                               | postgres
    8333 | ROLLBACK_GROUP           | BEGIN                    | myGroup1                        | Unlogged rollback to mark Multi-1 (timestamp)                                                | postgres
    8334 | LOCK_SESSION             | BEGIN                    | myGroup1                        | Session #1                                                                                   | postgres
    8335 | LOCK_SESSION             | END                      | myGroup1                        | Session #1 : 5 tables locked, 0 deadlock(s)                                                  | postgres
    8336 | ROLLBACK_TABLE           | BEGIN                    | myschema1.mytbl1                | All log rows with emaj_gid > 12007                                                           | postgres
    8337 | ROLLBACK_TABLE           | END                      | myschema1.mytbl1                | 0 rollbacked rows                                                                            | postgres
    8338 | ROLLBACK_SEQUENCE        |                          | myschema1."myTbl3_col31_seq"    |                                                                                              | postgres
    8339 | ROLLBACK_GROUP           | END                      | myGroup1                        | 1 tables and 1 sequences effectively processed                                               | postgres
    8340 | SNAP_GROUP               | BEGIN                    | myGroup1                        | /tmp/emaj_test/snaps                                                                         | postgres
    8341 | SNAP_GROUP               | END                      | myGroup1                        | 6 tables/sequences processed                                                                 | postgres
    8342 | SNAP_GROUP               | BEGIN                    | myGroup2                        | /tmp/emaj_test/snaps                                                                         | postgres
    8343 | SNAP_GROUP               | END                      | myGroup2                        | 8 tables/sequences processed                                                                 | postgres
    8344 | SNAP_GROUP               | BEGIN                    | phil's group#3",                | /tmp/emaj_test/snaps                                                                         | postgres
    8345 | SNAP_GROUP               | END                      | phil's group#3",                | 3 tables/sequences processed                                                                 | postgres
    8346 | GENERATE_SQL             | BEGIN                    | myGroup1                        | From mark Multi-1 to current situation towards /tmp/emaj_test/sql_scripts/myGroup1.sql       | postgres
    8347 | GENERATE_SQL             | END                      | myGroup1                        | 1 generated statements                                                                       | postgres
    8348 | GENERATE_SQL             | BEGIN                    | myGroup2                        | From mark Multi-1 to current situation towards /tmp/emaj_test/sql_scripts/myGroup2.sql       | postgres
    8349 | GENERATE_SQL             | END                      | myGroup2                        | 21 generated statements                                                                      | postgres
    8350 | GENERATE_SQL             | BEGIN                    | phil's group#3",                | From mark M1_rollbackable to current situation towards /tmp/emaj_test/sql_scripts/Group3.sql | postgres
    8351 | GENERATE_SQL             | END                      | phil's group#3",                | 56 generated statements                                                                      | postgres
(347 rows)

--
reset role;
truncate emaj.emaj_hist;
alter sequence emaj.emaj_hist_hist_id_seq restart 10000;
-- the groups are left in their current state for the parallel rollback test.
-- perform some updates to prepare the parallel rollback test
select count(*) from mySchema1.myTbl4;
 count 
-------
     0
(1 row)

select count(*) from mySchema1.myTbl1;
 count 
-------
    20
(1 row)

select count(*) from mySchema1.myTbl2; 
 count 
-------
     3
(1 row)

select count(*) from mySchema1."myTbl3";
 count 
-------
     5
(1 row)

select count(*) from mySchema1.myTbl2b;
 count 
-------
     0
(1 row)

select count(*) from mySchema2.myTbl4;
 count 
-------
     2
(1 row)

select count(*) from mySchema2.myTbl1;
 count 
-------
    10
(1 row)

select count(*) from mySchema2.myTbl2; 
 count 
-------
     2
(1 row)

select count(*) from mySchema2."myTbl3";
 count 
-------
    10
(1 row)

select count(*) from mySchema2.myTbl5;
 count 
-------
     3
(1 row)

select count(*) from mySchema2.myTbl6;
 count 
-------
    13
(1 row)

delete from mySchema1.myTbl4;
delete from mySchema1.myTbl1;
delete from mySchema1.myTbl2; 
delete from mySchema1."myTbl3";
delete from mySchema1.myTbl2b;
delete from mySchema2.myTbl4;
delete from mySchema2.myTbl1;
delete from mySchema2.myTbl2; 
delete from mySchema2."myTbl3";
delete from mySchema2.myTbl5;
delete from mySchema2.myTbl6;
alter sequence mySchema2.mySeq1 restart 9999;
