-- rollback.sql : test updates log, emaj_rollback_group(), emaj_logged_rollback_group(),
--                emaj_rollback_groups(), emaj_logged_rollback_groups(),
--                emaj_cleanup_rollback_state(), emaj_rollback_activity(),
--                emaj_consolidate_rollback_group() and emaj_get_consolidable_rollbacks() functions.
--
-- set sequence restart value
alter sequence emaj.emaj_hist_hist_id_seq restart 3000;
alter sequence emaj.emaj_time_stamp_time_id_seq restart 3000;
alter sequence emaj.emaj_mark_mark_id_seq restart 3000;
-----------------------------
-- rollback nothing tests
-----------------------------
-- group or groups is NULL
select emaj.emaj_rollback_group(NULL,NULL);
ERROR:  _check_group_names: No group to process.
CONTEXT:  SQL statement "SELECT emaj._check_group_names(v_groupNames := v_groupNames, v_mayBeNull := v_multiGroup, v_lockGroups := FALSE, v_checkList := '')"
PL/pgSQL function emaj._rlbk_groups(text[],text,boolean,boolean,boolean) line 14 at SQL statement
SQL statement "SELECT rlbk_message::INT FROM emaj._rlbk_groups(array[v_groupName], v_mark, FALSE, FALSE, NULL) WHERE rlbk_severity = 'Notice'"
PL/pgSQL function emaj.emaj_rollback_group(text,text) line 7 at RETURN
select emaj.emaj_logged_rollback_group(NULL,NULL);
ERROR:  _check_group_names: No group to process.
CONTEXT:  SQL statement "SELECT emaj._check_group_names(v_groupNames := v_groupNames, v_mayBeNull := v_multiGroup, v_lockGroups := FALSE, v_checkList := '')"
PL/pgSQL function emaj._rlbk_groups(text[],text,boolean,boolean,boolean) line 14 at SQL statement
SQL statement "SELECT rlbk_message::INT FROM emaj._rlbk_groups(array[v_groupName], v_mark, TRUE, FALSE, NULL) WHERE rlbk_severity = 'Notice'"
PL/pgSQL function emaj.emaj_logged_rollback_group(text,text) line 11 at RETURN
select emaj.emaj_rollback_groups(NULL,NULL);
WARNING:  _check_group_names: No group to process.
CONTEXT:  SQL statement "SELECT emaj._check_group_names(v_groupNames := v_groupNames, v_mayBeNull := v_multiGroup, v_lockGroups := FALSE, v_checkList := '')"
PL/pgSQL function emaj._rlbk_groups(text[],text,boolean,boolean,boolean) line 14 at SQL statement
SQL statement "SELECT rlbk_message::INT FROM emaj._rlbk_groups(v_groupNames, v_mark, FALSE, TRUE, NULL) WHERE rlbk_severity = 'Notice'"
PL/pgSQL function emaj.emaj_rollback_groups(text[],text) line 7 at RETURN
 emaj_rollback_groups 
----------------------
                    0
(1 row)

select emaj.emaj_logged_rollback_groups(NULL,NULL);
WARNING:  _check_group_names: No group to process.
CONTEXT:  SQL statement "SELECT emaj._check_group_names(v_groupNames := v_groupNames, v_mayBeNull := v_multiGroup, v_lockGroups := FALSE, v_checkList := '')"
PL/pgSQL function emaj._rlbk_groups(text[],text,boolean,boolean,boolean) line 14 at SQL statement
SQL statement "SELECT rlbk_message::INT FROM emaj._rlbk_groups(v_groupNames, v_mark, TRUE, TRUE, NULL) WHERE rlbk_severity = 'Notice'"
PL/pgSQL function emaj.emaj_logged_rollback_groups(text[],text) line 11 at RETURN
 emaj_logged_rollback_groups 
-----------------------------
                           0
(1 row)

-- group is unknown in emaj_group_def
select emaj.emaj_rollback_group('unknownGroup',NULL);
ERROR:  _check_group_names: The group "unknownGroup" does not exist.
CONTEXT:  SQL statement "SELECT emaj._check_group_names(v_groupNames := v_groupNames, v_mayBeNull := v_multiGroup, v_lockGroups := FALSE, v_checkList := '')"
PL/pgSQL function emaj._rlbk_groups(text[],text,boolean,boolean,boolean) line 14 at SQL statement
SQL statement "SELECT rlbk_message::INT FROM emaj._rlbk_groups(array[v_groupName], v_mark, FALSE, FALSE, NULL) WHERE rlbk_severity = 'Notice'"
PL/pgSQL function emaj.emaj_rollback_group(text,text) line 7 at RETURN
select emaj.emaj_logged_rollback_group('unknownGroup',NULL);
ERROR:  _check_group_names: The group "unknownGroup" does not exist.
CONTEXT:  SQL statement "SELECT emaj._check_group_names(v_groupNames := v_groupNames, v_mayBeNull := v_multiGroup, v_lockGroups := FALSE, v_checkList := '')"
PL/pgSQL function emaj._rlbk_groups(text[],text,boolean,boolean,boolean) line 14 at SQL statement
SQL statement "SELECT rlbk_message::INT FROM emaj._rlbk_groups(array[v_groupName], v_mark, TRUE, FALSE, NULL) WHERE rlbk_severity = 'Notice'"
PL/pgSQL function emaj.emaj_logged_rollback_group(text,text) line 11 at RETURN
select emaj.emaj_rollback_groups('{"unknownGroup"}',NULL);
ERROR:  _check_group_names: The group "unknownGroup" does not exist.
CONTEXT:  SQL statement "SELECT emaj._check_group_names(v_groupNames := v_groupNames, v_mayBeNull := v_multiGroup, v_lockGroups := FALSE, v_checkList := '')"
PL/pgSQL function emaj._rlbk_groups(text[],text,boolean,boolean,boolean) line 14 at SQL statement
SQL statement "SELECT rlbk_message::INT FROM emaj._rlbk_groups(v_groupNames, v_mark, FALSE, TRUE, NULL) WHERE rlbk_severity = 'Notice'"
PL/pgSQL function emaj.emaj_rollback_groups(text[],text) line 7 at RETURN
select emaj.emaj_logged_rollback_groups('{"unknownGroup","myGroup1"}',NULL);
ERROR:  _check_group_names: The group "unknownGroup" does not exist.
CONTEXT:  SQL statement "SELECT emaj._check_group_names(v_groupNames := v_groupNames, v_mayBeNull := v_multiGroup, v_lockGroups := FALSE, v_checkList := '')"
PL/pgSQL function emaj._rlbk_groups(text[],text,boolean,boolean,boolean) line 14 at SQL statement
SQL statement "SELECT rlbk_message::INT FROM emaj._rlbk_groups(v_groupNames, v_mark, TRUE, TRUE, NULL) WHERE rlbk_severity = 'Notice'"
PL/pgSQL function emaj.emaj_logged_rollback_groups(text[],text) line 11 at RETURN
begin;
  select emaj.emaj_start_group('myGroup1','');
 emaj_start_group 
------------------
                7
(1 row)

  select emaj.emaj_rollback_groups('{"myGroup1","unknownGroup"}','EMAJ_LAST_MARK');
ERROR:  _check_group_names: The group "unknownGroup" does not exist.
CONTEXT:  SQL statement "SELECT emaj._check_group_names(v_groupNames := v_groupNames, v_mayBeNull := v_multiGroup, v_lockGroups := FALSE, v_checkList := '')"
PL/pgSQL function emaj._rlbk_groups(text[],text,boolean,boolean,boolean) line 14 at SQL statement
SQL statement "SELECT rlbk_message::INT FROM emaj._rlbk_groups(v_groupNames, v_mark, FALSE, TRUE, NULL) WHERE rlbk_severity = 'Notice'"
PL/pgSQL function emaj.emaj_rollback_groups(text[],text) line 7 at RETURN
rollback;
-- group not in logging state
select emaj.emaj_rollback_group('myGroup1','EMAJ_LAST_MARK');
ERROR:  _check_group_names: The group "myGroup1" is not in LOGGING state.
CONTEXT:  SQL statement "SELECT emaj._check_group_names(v_groupNames := v_groupNames, v_mayBeNull := FALSE, v_lockGroups := TRUE, v_checkList := 'LOGGING,ROLLBACKABLE,UNPROTECTED')"
PL/pgSQL function emaj._rlbk_check(text[],text,boolean,boolean) line 16 at SQL statement
SQL statement "SELECT emaj._rlbk_check(v_groupNames, v_mark, v_isAlterGroupAllowed, FALSE)"
PL/pgSQL function emaj._rlbk_init(text[],text,boolean,integer,boolean,boolean) line 22 at SQL statement
SQL statement "SELECT emaj._rlbk_init(v_groupNames, v_mark, v_isLoggedRlbk, 1, v_multiGroup, v_isAlterGroupAllowed)"
PL/pgSQL function emaj._rlbk_groups(text[],text,boolean,boolean,boolean) line 22 at SQL statement
SQL statement "SELECT rlbk_message::INT FROM emaj._rlbk_groups(array[v_groupName], v_mark, FALSE, FALSE, NULL) WHERE rlbk_severity = 'Notice'"
PL/pgSQL function emaj.emaj_rollback_group(text,text) line 7 at RETURN
select emaj.emaj_rollback_group('myGroup2','EMAJ_LAST_MARK');
ERROR:  _check_group_names: The group "myGroup2" is not in LOGGING state.
CONTEXT:  SQL statement "SELECT emaj._check_group_names(v_groupNames := v_groupNames, v_mayBeNull := FALSE, v_lockGroups := TRUE, v_checkList := 'LOGGING,ROLLBACKABLE,UNPROTECTED')"
PL/pgSQL function emaj._rlbk_check(text[],text,boolean,boolean) line 16 at SQL statement
SQL statement "SELECT emaj._rlbk_check(v_groupNames, v_mark, v_isAlterGroupAllowed, FALSE)"
PL/pgSQL function emaj._rlbk_init(text[],text,boolean,integer,boolean,boolean) line 22 at SQL statement
SQL statement "SELECT emaj._rlbk_init(v_groupNames, v_mark, v_isLoggedRlbk, 1, v_multiGroup, v_isAlterGroupAllowed)"
PL/pgSQL function emaj._rlbk_groups(text[],text,boolean,boolean,boolean) line 22 at SQL statement
SQL statement "SELECT rlbk_message::INT FROM emaj._rlbk_groups(array[v_groupName], v_mark, FALSE, FALSE, NULL) WHERE rlbk_severity = 'Notice'"
PL/pgSQL function emaj.emaj_rollback_group(text,text) line 7 at RETURN
select emaj.emaj_logged_rollback_group('myGroup1','EMAJ_LAST_MARK');
ERROR:  _check_group_names: The group "myGroup1" is not in LOGGING state.
CONTEXT:  SQL statement "SELECT emaj._check_group_names(v_groupNames := v_groupNames, v_mayBeNull := FALSE, v_lockGroups := TRUE, v_checkList := 'LOGGING,ROLLBACKABLE,UNPROTECTED')"
PL/pgSQL function emaj._rlbk_check(text[],text,boolean,boolean) line 16 at SQL statement
SQL statement "SELECT emaj._rlbk_check(v_groupNames, v_mark, v_isAlterGroupAllowed, FALSE)"
PL/pgSQL function emaj._rlbk_init(text[],text,boolean,integer,boolean,boolean) line 22 at SQL statement
SQL statement "SELECT emaj._rlbk_init(v_groupNames, v_mark, v_isLoggedRlbk, 1, v_multiGroup, v_isAlterGroupAllowed)"
PL/pgSQL function emaj._rlbk_groups(text[],text,boolean,boolean,boolean) line 22 at SQL statement
SQL statement "SELECT rlbk_message::INT FROM emaj._rlbk_groups(array[v_groupName], v_mark, TRUE, FALSE, NULL) WHERE rlbk_severity = 'Notice'"
PL/pgSQL function emaj.emaj_logged_rollback_group(text,text) line 11 at RETURN
select emaj.emaj_logged_rollback_group('myGroup2','EMAJ_LAST_MARK');
ERROR:  _check_group_names: The group "myGroup2" is not in LOGGING state.
CONTEXT:  SQL statement "SELECT emaj._check_group_names(v_groupNames := v_groupNames, v_mayBeNull := FALSE, v_lockGroups := TRUE, v_checkList := 'LOGGING,ROLLBACKABLE,UNPROTECTED')"
PL/pgSQL function emaj._rlbk_check(text[],text,boolean,boolean) line 16 at SQL statement
SQL statement "SELECT emaj._rlbk_check(v_groupNames, v_mark, v_isAlterGroupAllowed, FALSE)"
PL/pgSQL function emaj._rlbk_init(text[],text,boolean,integer,boolean,boolean) line 22 at SQL statement
SQL statement "SELECT emaj._rlbk_init(v_groupNames, v_mark, v_isLoggedRlbk, 1, v_multiGroup, v_isAlterGroupAllowed)"
PL/pgSQL function emaj._rlbk_groups(text[],text,boolean,boolean,boolean) line 22 at SQL statement
SQL statement "SELECT rlbk_message::INT FROM emaj._rlbk_groups(array[v_groupName], v_mark, TRUE, FALSE, NULL) WHERE rlbk_severity = 'Notice'"
PL/pgSQL function emaj.emaj_logged_rollback_group(text,text) line 11 at RETURN
select emaj.emaj_rollback_groups('{"myGroup1","myGroup2"}',NULL);
ERROR:  _check_group_names: The groups "myGroup1, myGroup2" are not in LOGGING state.
CONTEXT:  SQL statement "SELECT emaj._check_group_names(v_groupNames := v_groupNames, v_mayBeNull := FALSE, v_lockGroups := TRUE, v_checkList := 'LOGGING,ROLLBACKABLE,UNPROTECTED')"
PL/pgSQL function emaj._rlbk_check(text[],text,boolean,boolean) line 16 at SQL statement
SQL statement "SELECT emaj._rlbk_check(v_groupNames, v_mark, v_isAlterGroupAllowed, FALSE)"
PL/pgSQL function emaj._rlbk_init(text[],text,boolean,integer,boolean,boolean) line 22 at SQL statement
SQL statement "SELECT emaj._rlbk_init(v_groupNames, v_mark, v_isLoggedRlbk, 1, v_multiGroup, v_isAlterGroupAllowed)"
PL/pgSQL function emaj._rlbk_groups(text[],text,boolean,boolean,boolean) line 22 at SQL statement
SQL statement "SELECT rlbk_message::INT FROM emaj._rlbk_groups(v_groupNames, v_mark, FALSE, TRUE, NULL) WHERE rlbk_severity = 'Notice'"
PL/pgSQL function emaj.emaj_rollback_groups(text[],text) line 7 at RETURN
begin;
  select emaj.emaj_start_group('myGroup1','');
 emaj_start_group 
------------------
                7
(1 row)

  select emaj.emaj_logged_rollback_groups('{"myGroup1","myGroup2"}','EMAJ_LAST_MARK');
ERROR:  _check_group_names: The group "myGroup2" is not in LOGGING state.
CONTEXT:  SQL statement "SELECT emaj._check_group_names(v_groupNames := v_groupNames, v_mayBeNull := FALSE, v_lockGroups := TRUE, v_checkList := 'LOGGING,ROLLBACKABLE,UNPROTECTED')"
PL/pgSQL function emaj._rlbk_check(text[],text,boolean,boolean) line 16 at SQL statement
SQL statement "SELECT emaj._rlbk_check(v_groupNames, v_mark, v_isAlterGroupAllowed, FALSE)"
PL/pgSQL function emaj._rlbk_init(text[],text,boolean,integer,boolean,boolean) line 22 at SQL statement
SQL statement "SELECT emaj._rlbk_init(v_groupNames, v_mark, v_isLoggedRlbk, 1, v_multiGroup, v_isAlterGroupAllowed)"
PL/pgSQL function emaj._rlbk_groups(text[],text,boolean,boolean,boolean) line 22 at SQL statement
SQL statement "SELECT rlbk_message::INT FROM emaj._rlbk_groups(v_groupNames, v_mark, TRUE, TRUE, NULL) WHERE rlbk_severity = 'Notice'"
PL/pgSQL function emaj.emaj_logged_rollback_groups(text[],text) line 11 at RETURN
rollback;
-- start groups and set some marks
select emaj.emaj_start_group('myGroup1','Mark11');
 emaj_start_group 
------------------
                7
(1 row)

select emaj.emaj_start_group('myGroup2','Mark21');
WARNING:  _check_fk_groups: The foreign key "mytbl6_col61_fkey" on the table "myschema2.mytbl6" references the table "myschema2.mytbl7" that is outside the groups (myGroup2).
CONTEXT:  SQL statement "SELECT emaj._check_fk_groups(v_groupNames)"
PL/pgSQL function emaj._start_groups(text[],text,boolean,boolean) line 25 at PERFORM
PL/pgSQL function emaj.emaj_start_group(text,text,boolean) line 12 at RETURN
WARNING:  _check_fk_groups: The table "myschema2.mytbl6" is referenced by the foreign key "mytbl8_col81_fkey" on the table "myschema2.mytbl8" that is outside the groups (myGroup2).
CONTEXT:  SQL statement "SELECT emaj._check_fk_groups(v_groupNames)"
PL/pgSQL function emaj._start_groups(text[],text,boolean,boolean) line 25 at PERFORM
PL/pgSQL function emaj.emaj_start_group(text,text,boolean) line 12 at RETURN
 emaj_start_group 
------------------
                8
(1 row)

select emaj.emaj_set_mark_group('myGroup1','Different_Mark');
 emaj_set_mark_group 
---------------------
                   7
(1 row)

select emaj.emaj_set_mark_group('myGroup2','Different_Mark');
 emaj_set_mark_group 
---------------------
                   8
(1 row)

-- log tables are empty
select count(*) from emaj.myschema1_mytbl1_log;
 count 
-------
     0
(1 row)

select count(*) from emaj.myschema1_mytbl2_log;
 count 
-------
     0
(1 row)

select count(*) from emajb.myschema1_mytbl2b_log;
 count 
-------
     0
(1 row)

select count(*) from "emajC"."myschema1_myTbl3_log";
 count 
-------
     0
(1 row)

select count(*) from emaj.myschema1_mytbl4_log;
 count 
-------
     0
(1 row)

select count(*) from emaj.myschema2_mytbl1_log;
 count 
-------
     0
(1 row)

select count(*) from emaj.myschema2_mytbl2_log;
 count 
-------
     0
(1 row)

select count(*) from "emajC"."myschema2_myTbl3_log";
 count 
-------
     0
(1 row)

select count(*) from emaj.myschema2_mytbl4_log;
 count 
-------
     0
(1 row)

-- protected group
select emaj.emaj_protect_group('myGroup1');
 emaj_protect_group 
--------------------
                  1
(1 row)

select emaj.emaj_protect_group('myGroup2');
 emaj_protect_group 
--------------------
                  1
(1 row)

select emaj.emaj_rollback_group('myGroup1','EMAJ_LAST_MARK');
ERROR:  _check_group_names: The group "myGroup1" is currently protected against rollback operations.
CONTEXT:  SQL statement "SELECT emaj._check_group_names(v_groupNames := v_groupNames, v_mayBeNull := FALSE, v_lockGroups := TRUE, v_checkList := 'LOGGING,ROLLBACKABLE,UNPROTECTED')"
PL/pgSQL function emaj._rlbk_check(text[],text,boolean,boolean) line 16 at SQL statement
SQL statement "SELECT emaj._rlbk_check(v_groupNames, v_mark, v_isAlterGroupAllowed, FALSE)"
PL/pgSQL function emaj._rlbk_init(text[],text,boolean,integer,boolean,boolean) line 22 at SQL statement
SQL statement "SELECT emaj._rlbk_init(v_groupNames, v_mark, v_isLoggedRlbk, 1, v_multiGroup, v_isAlterGroupAllowed)"
PL/pgSQL function emaj._rlbk_groups(text[],text,boolean,boolean,boolean) line 22 at SQL statement
SQL statement "SELECT rlbk_message::INT FROM emaj._rlbk_groups(array[v_groupName], v_mark, FALSE, FALSE, NULL) WHERE rlbk_severity = 'Notice'"
PL/pgSQL function emaj.emaj_rollback_group(text,text) line 7 at RETURN
select emaj.emaj_logged_rollback_groups('{"myGroup2","myGroup1"}',NULL);
ERROR:  _check_group_names: The groups "myGroup1, myGroup2" are currently protected against rollback operations.
CONTEXT:  SQL statement "SELECT emaj._check_group_names(v_groupNames := v_groupNames, v_mayBeNull := FALSE, v_lockGroups := TRUE, v_checkList := 'LOGGING,ROLLBACKABLE,UNPROTECTED')"
PL/pgSQL function emaj._rlbk_check(text[],text,boolean,boolean) line 16 at SQL statement
SQL statement "SELECT emaj._rlbk_check(v_groupNames, v_mark, v_isAlterGroupAllowed, FALSE)"
PL/pgSQL function emaj._rlbk_init(text[],text,boolean,integer,boolean,boolean) line 22 at SQL statement
SQL statement "SELECT emaj._rlbk_init(v_groupNames, v_mark, v_isLoggedRlbk, 1, v_multiGroup, v_isAlterGroupAllowed)"
PL/pgSQL function emaj._rlbk_groups(text[],text,boolean,boolean,boolean) line 22 at SQL statement
SQL statement "SELECT rlbk_message::INT FROM emaj._rlbk_groups(v_groupNames, v_mark, TRUE, TRUE, NULL) WHERE rlbk_severity = 'Notice'"
PL/pgSQL function emaj.emaj_logged_rollback_groups(text[],text) line 11 at RETURN
select emaj.emaj_unprotect_group('myGroup1');
 emaj_unprotect_group 
----------------------
                    1
(1 row)

select emaj.emaj_unprotect_group('myGroup2');
 emaj_unprotect_group 
----------------------
                    1
(1 row)

select emaj.emaj_rollback_group('myGroup1','EMAJ_LAST_MARK');
 emaj_rollback_group 
---------------------
                   2
(1 row)

-- unknown mark name
select emaj.emaj_rollback_group('myGroup1',NULL);
ERROR:  _check_mark_name: The mark "<NULL>" does not exist for the group "myGroup1".
CONTEXT:  SQL statement "SELECT emaj._check_mark_name(v_groupNames := v_groupNames, v_mark := v_mark, v_checkList := 'ACTIVE')"
PL/pgSQL function emaj._rlbk_check(text[],text,boolean,boolean) line 20 at SQL statement
SQL statement "SELECT emaj._rlbk_check(v_groupNames, v_mark, v_isAlterGroupAllowed, FALSE)"
PL/pgSQL function emaj._rlbk_init(text[],text,boolean,integer,boolean,boolean) line 22 at SQL statement
SQL statement "SELECT emaj._rlbk_init(v_groupNames, v_mark, v_isLoggedRlbk, 1, v_multiGroup, v_isAlterGroupAllowed)"
PL/pgSQL function emaj._rlbk_groups(text[],text,boolean,boolean,boolean) line 22 at SQL statement
SQL statement "SELECT rlbk_message::INT FROM emaj._rlbk_groups(array[v_groupName], v_mark, FALSE, FALSE, NULL) WHERE rlbk_severity = 'Notice'"
PL/pgSQL function emaj.emaj_rollback_group(text,text) line 7 at RETURN
select emaj.emaj_rollback_group('myGroup1','DummyMark');
ERROR:  _check_mark_name: The mark "DummyMark" does not exist for the group "myGroup1".
CONTEXT:  SQL statement "SELECT emaj._check_mark_name(v_groupNames := v_groupNames, v_mark := v_mark, v_checkList := 'ACTIVE')"
PL/pgSQL function emaj._rlbk_check(text[],text,boolean,boolean) line 20 at SQL statement
SQL statement "SELECT emaj._rlbk_check(v_groupNames, v_mark, v_isAlterGroupAllowed, FALSE)"
PL/pgSQL function emaj._rlbk_init(text[],text,boolean,integer,boolean,boolean) line 22 at SQL statement
SQL statement "SELECT emaj._rlbk_init(v_groupNames, v_mark, v_isLoggedRlbk, 1, v_multiGroup, v_isAlterGroupAllowed)"
PL/pgSQL function emaj._rlbk_groups(text[],text,boolean,boolean,boolean) line 22 at SQL statement
SQL statement "SELECT rlbk_message::INT FROM emaj._rlbk_groups(array[v_groupName], v_mark, FALSE, FALSE, NULL) WHERE rlbk_severity = 'Notice'"
PL/pgSQL function emaj.emaj_rollback_group(text,text) line 7 at RETURN
select emaj.emaj_logged_rollback_group('myGroup1',NULL);
ERROR:  _check_mark_name: The mark "<NULL>" does not exist for the group "myGroup1".
CONTEXT:  SQL statement "SELECT emaj._check_mark_name(v_groupNames := v_groupNames, v_mark := v_mark, v_checkList := 'ACTIVE')"
PL/pgSQL function emaj._rlbk_check(text[],text,boolean,boolean) line 20 at SQL statement
SQL statement "SELECT emaj._rlbk_check(v_groupNames, v_mark, v_isAlterGroupAllowed, FALSE)"
PL/pgSQL function emaj._rlbk_init(text[],text,boolean,integer,boolean,boolean) line 22 at SQL statement
SQL statement "SELECT emaj._rlbk_init(v_groupNames, v_mark, v_isLoggedRlbk, 1, v_multiGroup, v_isAlterGroupAllowed)"
PL/pgSQL function emaj._rlbk_groups(text[],text,boolean,boolean,boolean) line 22 at SQL statement
SQL statement "SELECT rlbk_message::INT FROM emaj._rlbk_groups(array[v_groupName], v_mark, TRUE, FALSE, NULL) WHERE rlbk_severity = 'Notice'"
PL/pgSQL function emaj.emaj_logged_rollback_group(text,text) line 11 at RETURN
select emaj.emaj_logged_rollback_group('myGroup1','DummyMark');
ERROR:  _check_mark_name: The mark "DummyMark" does not exist for the group "myGroup1".
CONTEXT:  SQL statement "SELECT emaj._check_mark_name(v_groupNames := v_groupNames, v_mark := v_mark, v_checkList := 'ACTIVE')"
PL/pgSQL function emaj._rlbk_check(text[],text,boolean,boolean) line 20 at SQL statement
SQL statement "SELECT emaj._rlbk_check(v_groupNames, v_mark, v_isAlterGroupAllowed, FALSE)"
PL/pgSQL function emaj._rlbk_init(text[],text,boolean,integer,boolean,boolean) line 22 at SQL statement
SQL statement "SELECT emaj._rlbk_init(v_groupNames, v_mark, v_isLoggedRlbk, 1, v_multiGroup, v_isAlterGroupAllowed)"
PL/pgSQL function emaj._rlbk_groups(text[],text,boolean,boolean,boolean) line 22 at SQL statement
SQL statement "SELECT rlbk_message::INT FROM emaj._rlbk_groups(array[v_groupName], v_mark, TRUE, FALSE, NULL) WHERE rlbk_severity = 'Notice'"
PL/pgSQL function emaj.emaj_logged_rollback_group(text,text) line 11 at RETURN
select emaj.emaj_rollback_groups('{"myGroup1","myGroup2",""}',NULL);
ERROR:  _check_mark_name: The mark "<NULL>" does not exist for the groups "myGroup1, myGroup2".
CONTEXT:  SQL statement "SELECT emaj._check_mark_name(v_groupNames := v_groupNames, v_mark := v_mark, v_checkList := 'ACTIVE')"
PL/pgSQL function emaj._rlbk_check(text[],text,boolean,boolean) line 20 at SQL statement
SQL statement "SELECT emaj._rlbk_check(v_groupNames, v_mark, v_isAlterGroupAllowed, FALSE)"
PL/pgSQL function emaj._rlbk_init(text[],text,boolean,integer,boolean,boolean) line 22 at SQL statement
SQL statement "SELECT emaj._rlbk_init(v_groupNames, v_mark, v_isLoggedRlbk, 1, v_multiGroup, v_isAlterGroupAllowed)"
PL/pgSQL function emaj._rlbk_groups(text[],text,boolean,boolean,boolean) line 22 at SQL statement
SQL statement "SELECT rlbk_message::INT FROM emaj._rlbk_groups(v_groupNames, v_mark, FALSE, TRUE, NULL) WHERE rlbk_severity = 'Notice'"
PL/pgSQL function emaj.emaj_rollback_groups(text[],text) line 7 at RETURN
select emaj.emaj_rollback_groups('{"myGroup1","myGroup2",NULL}',NULL);
ERROR:  _check_mark_name: The mark "<NULL>" does not exist for the groups "myGroup1, myGroup2".
CONTEXT:  SQL statement "SELECT emaj._check_mark_name(v_groupNames := v_groupNames, v_mark := v_mark, v_checkList := 'ACTIVE')"
PL/pgSQL function emaj._rlbk_check(text[],text,boolean,boolean) line 20 at SQL statement
SQL statement "SELECT emaj._rlbk_check(v_groupNames, v_mark, v_isAlterGroupAllowed, FALSE)"
PL/pgSQL function emaj._rlbk_init(text[],text,boolean,integer,boolean,boolean) line 22 at SQL statement
SQL statement "SELECT emaj._rlbk_init(v_groupNames, v_mark, v_isLoggedRlbk, 1, v_multiGroup, v_isAlterGroupAllowed)"
PL/pgSQL function emaj._rlbk_groups(text[],text,boolean,boolean,boolean) line 22 at SQL statement
SQL statement "SELECT rlbk_message::INT FROM emaj._rlbk_groups(v_groupNames, v_mark, FALSE, TRUE, NULL) WHERE rlbk_severity = 'Notice'"
PL/pgSQL function emaj.emaj_rollback_groups(text[],text) line 7 at RETURN
select emaj.emaj_rollback_groups('{"myGroup1","myGroup2"}','DummyMark');
ERROR:  _check_mark_name: The mark "DummyMark" does not exist for the groups "myGroup1, myGroup2".
CONTEXT:  SQL statement "SELECT emaj._check_mark_name(v_groupNames := v_groupNames, v_mark := v_mark, v_checkList := 'ACTIVE')"
PL/pgSQL function emaj._rlbk_check(text[],text,boolean,boolean) line 20 at SQL statement
SQL statement "SELECT emaj._rlbk_check(v_groupNames, v_mark, v_isAlterGroupAllowed, FALSE)"
PL/pgSQL function emaj._rlbk_init(text[],text,boolean,integer,boolean,boolean) line 22 at SQL statement
SQL statement "SELECT emaj._rlbk_init(v_groupNames, v_mark, v_isLoggedRlbk, 1, v_multiGroup, v_isAlterGroupAllowed)"
PL/pgSQL function emaj._rlbk_groups(text[],text,boolean,boolean,boolean) line 22 at SQL statement
SQL statement "SELECT rlbk_message::INT FROM emaj._rlbk_groups(v_groupNames, v_mark, FALSE, TRUE, NULL) WHERE rlbk_severity = 'Notice'"
PL/pgSQL function emaj.emaj_rollback_groups(text[],text) line 7 at RETURN
select emaj.emaj_logged_rollback_groups('{"myGroup1","myGroup2","myGroup2"}',NULL);
ERROR:  _check_mark_name: The mark "<NULL>" does not exist for the groups "myGroup1, myGroup2".
CONTEXT:  SQL statement "SELECT emaj._check_mark_name(v_groupNames := v_groupNames, v_mark := v_mark, v_checkList := 'ACTIVE')"
PL/pgSQL function emaj._rlbk_check(text[],text,boolean,boolean) line 20 at SQL statement
SQL statement "SELECT emaj._rlbk_check(v_groupNames, v_mark, v_isAlterGroupAllowed, FALSE)"
PL/pgSQL function emaj._rlbk_init(text[],text,boolean,integer,boolean,boolean) line 22 at SQL statement
SQL statement "SELECT emaj._rlbk_init(v_groupNames, v_mark, v_isLoggedRlbk, 1, v_multiGroup, v_isAlterGroupAllowed)"
PL/pgSQL function emaj._rlbk_groups(text[],text,boolean,boolean,boolean) line 22 at SQL statement
SQL statement "SELECT rlbk_message::INT FROM emaj._rlbk_groups(v_groupNames, v_mark, TRUE, TRUE, NULL) WHERE rlbk_severity = 'Notice'"
PL/pgSQL function emaj.emaj_logged_rollback_groups(text[],text) line 11 at RETURN
select emaj.emaj_logged_rollback_groups('{"myGroup1","myGroup2"}','Mark11');
ERROR:  _check_mark_name: The mark "Mark11" does not exist for the group "myGroup2".
CONTEXT:  SQL statement "SELECT emaj._check_mark_name(v_groupNames := v_groupNames, v_mark := v_mark, v_checkList := 'ACTIVE')"
PL/pgSQL function emaj._rlbk_check(text[],text,boolean,boolean) line 20 at SQL statement
SQL statement "SELECT emaj._rlbk_check(v_groupNames, v_mark, v_isAlterGroupAllowed, FALSE)"
PL/pgSQL function emaj._rlbk_init(text[],text,boolean,integer,boolean,boolean) line 22 at SQL statement
SQL statement "SELECT emaj._rlbk_init(v_groupNames, v_mark, v_isLoggedRlbk, 1, v_multiGroup, v_isAlterGroupAllowed)"
PL/pgSQL function emaj._rlbk_groups(text[],text,boolean,boolean,boolean) line 22 at SQL statement
SQL statement "SELECT rlbk_message::INT FROM emaj._rlbk_groups(v_groupNames, v_mark, TRUE, TRUE, NULL) WHERE rlbk_severity = 'Notice'"
PL/pgSQL function emaj.emaj_logged_rollback_groups(text[],text) line 11 at RETURN
-- mark name referencing different points in time
select emaj.emaj_rollback_groups('{"myGroup1","myGroup2"}','Different_Mark');
ERROR:  _check_mark_name: The mark "Different_Mark" does not represent the same point in time for all groups.
CONTEXT:  SQL statement "SELECT emaj._check_mark_name(v_groupNames := v_groupNames, v_mark := v_mark, v_checkList := 'ACTIVE')"
PL/pgSQL function emaj._rlbk_check(text[],text,boolean,boolean) line 20 at SQL statement
SQL statement "SELECT emaj._rlbk_check(v_groupNames, v_mark, v_isAlterGroupAllowed, FALSE)"
PL/pgSQL function emaj._rlbk_init(text[],text,boolean,integer,boolean,boolean) line 22 at SQL statement
SQL statement "SELECT emaj._rlbk_init(v_groupNames, v_mark, v_isLoggedRlbk, 1, v_multiGroup, v_isAlterGroupAllowed)"
PL/pgSQL function emaj._rlbk_groups(text[],text,boolean,boolean,boolean) line 22 at SQL statement
SQL statement "SELECT rlbk_message::INT FROM emaj._rlbk_groups(v_groupNames, v_mark, FALSE, TRUE, NULL) WHERE rlbk_severity = 'Notice'"
PL/pgSQL function emaj.emaj_rollback_groups(text[],text) line 7 at RETURN
select emaj.emaj_rollback_groups('{"myGroup1","myGroup2"}','EMAJ_LAST_MARK');
ERROR:  _check_mark_name: The EMAJ_LAST_MARK does not represent the same point in time for all groups.
CONTEXT:  SQL statement "SELECT emaj._check_mark_name(v_groupNames := v_groupNames, v_mark := v_mark, v_checkList := 'ACTIVE')"
PL/pgSQL function emaj._rlbk_check(text[],text,boolean,boolean) line 20 at SQL statement
SQL statement "SELECT emaj._rlbk_check(v_groupNames, v_mark, v_isAlterGroupAllowed, FALSE)"
PL/pgSQL function emaj._rlbk_init(text[],text,boolean,integer,boolean,boolean) line 22 at SQL statement
SQL statement "SELECT emaj._rlbk_init(v_groupNames, v_mark, v_isLoggedRlbk, 1, v_multiGroup, v_isAlterGroupAllowed)"
PL/pgSQL function emaj._rlbk_groups(text[],text,boolean,boolean,boolean) line 22 at SQL statement
SQL statement "SELECT rlbk_message::INT FROM emaj._rlbk_groups(v_groupNames, v_mark, FALSE, TRUE, NULL) WHERE rlbk_severity = 'Notice'"
PL/pgSQL function emaj.emaj_rollback_groups(text[],text) line 7 at RETURN
-- attempt to rollback 'audit_only' groups
select emaj.emaj_create_group('auditOnlyEmptyGroup',false,true);
 emaj_create_group 
-------------------
                 0
(1 row)

select emaj.emaj_rollback_group('phil''s group#3",','EMAJ_LAST_MARK');
ERROR:  _check_group_names: The group "phil's group#3"," has been created as AUDIT_ONLY.
CONTEXT:  SQL statement "SELECT emaj._check_group_names(v_groupNames := v_groupNames, v_mayBeNull := FALSE, v_lockGroups := TRUE, v_checkList := 'LOGGING,ROLLBACKABLE,UNPROTECTED')"
PL/pgSQL function emaj._rlbk_check(text[],text,boolean,boolean) line 16 at SQL statement
SQL statement "SELECT emaj._rlbk_check(v_groupNames, v_mark, v_isAlterGroupAllowed, FALSE)"
PL/pgSQL function emaj._rlbk_init(text[],text,boolean,integer,boolean,boolean) line 22 at SQL statement
SQL statement "SELECT emaj._rlbk_init(v_groupNames, v_mark, v_isLoggedRlbk, 1, v_multiGroup, v_isAlterGroupAllowed)"
PL/pgSQL function emaj._rlbk_groups(text[],text,boolean,boolean,boolean) line 22 at SQL statement
SQL statement "SELECT rlbk_message::INT FROM emaj._rlbk_groups(array[v_groupName], v_mark, FALSE, FALSE, NULL) WHERE rlbk_severity = 'Notice'"
PL/pgSQL function emaj.emaj_rollback_group(text,text) line 7 at RETURN
select emaj.emaj_logged_rollback_groups(array['phil''s group#3",','auditOnlyEmptyGroup'],'M1_audit_only');
ERROR:  _check_group_names: The groups "phil's group#3",, auditOnlyEmptyGroup" have been created as AUDIT_ONLY.
CONTEXT:  SQL statement "SELECT emaj._check_group_names(v_groupNames := v_groupNames, v_mayBeNull := FALSE, v_lockGroups := TRUE, v_checkList := 'LOGGING,ROLLBACKABLE,UNPROTECTED')"
PL/pgSQL function emaj._rlbk_check(text[],text,boolean,boolean) line 16 at SQL statement
SQL statement "SELECT emaj._rlbk_check(v_groupNames, v_mark, v_isAlterGroupAllowed, FALSE)"
PL/pgSQL function emaj._rlbk_init(text[],text,boolean,integer,boolean,boolean) line 22 at SQL statement
SQL statement "SELECT emaj._rlbk_init(v_groupNames, v_mark, v_isLoggedRlbk, 1, v_multiGroup, v_isAlterGroupAllowed)"
PL/pgSQL function emaj._rlbk_groups(text[],text,boolean,boolean,boolean) line 22 at SQL statement
SQL statement "SELECT rlbk_message::INT FROM emaj._rlbk_groups(v_groupNames, v_mark, TRUE, TRUE, NULL) WHERE rlbk_severity = 'Notice'"
PL/pgSQL function emaj.emaj_logged_rollback_groups(text[],text) line 11 at RETURN
select emaj.emaj_drop_group('auditOnlyEmptyGroup');
 emaj_drop_group 
-----------------
               0
(1 row)

-- attempt to rollback to a stop mark
begin;
  select emaj.emaj_stop_group('myGroup1');
 emaj_stop_group 
-----------------
               7
(1 row)

  select emaj.emaj_start_group('myGroup1','StartMark',false);
 emaj_start_group 
------------------
                7
(1 row)

  select emaj.emaj_rename_mark_group('myGroup1',(select emaj.emaj_get_previous_mark_group('myGroup1','StartMark')), 'GeneratedStopMark');
 emaj_rename_mark_group 
------------------------
 
(1 row)

  select emaj.emaj_rollback_group('myGroup1','GeneratedStopMark');
ERROR:  _check_mark_name: For the group "myGroup1", the mark "GeneratedStopMark" is DELETED.
CONTEXT:  SQL statement "SELECT emaj._check_mark_name(v_groupNames := v_groupNames, v_mark := v_mark, v_checkList := 'ACTIVE')"
PL/pgSQL function emaj._rlbk_check(text[],text,boolean,boolean) line 20 at SQL statement
SQL statement "SELECT emaj._rlbk_check(v_groupNames, v_mark, v_isAlterGroupAllowed, FALSE)"
PL/pgSQL function emaj._rlbk_init(text[],text,boolean,integer,boolean,boolean) line 22 at SQL statement
SQL statement "SELECT emaj._rlbk_init(v_groupNames, v_mark, v_isLoggedRlbk, 1, v_multiGroup, v_isAlterGroupAllowed)"
PL/pgSQL function emaj._rlbk_groups(text[],text,boolean,boolean,boolean) line 22 at SQL statement
SQL statement "SELECT rlbk_message::INT FROM emaj._rlbk_groups(array[v_groupName], v_mark, FALSE, FALSE, NULL) WHERE rlbk_severity = 'Notice'"
PL/pgSQL function emaj.emaj_rollback_group(text,text) line 7 at RETURN
rollback;
-- attempt to rollback over protected marks
begin;
  select emaj.emaj_set_mark_group('myGroup1','Protected Mark 1');
 emaj_set_mark_group 
---------------------
                   7
(1 row)

  select emaj.emaj_protect_mark_group('myGroup1','Protected Mark 1');
 emaj_protect_mark_group 
-------------------------
                       1
(1 row)

  select emaj.emaj_set_mark_group('myGroup1','Protected Mark 2');
 emaj_set_mark_group 
---------------------
                   7
(1 row)

  select emaj.emaj_protect_mark_group('myGroup1','Protected Mark 2');
 emaj_protect_mark_group 
-------------------------
                       1
(1 row)

  select emaj.emaj_rollback_group('myGroup1','Mark11');
ERROR:  _rlbk_check: Protected marks (Protected Mark 1, Protected Mark 2) for the group "myGroup1" block the rollback to the mark "Mark11".
CONTEXT:  SQL statement "SELECT emaj._rlbk_check(v_groupNames, v_mark, v_isAlterGroupAllowed, FALSE)"
PL/pgSQL function emaj._rlbk_init(text[],text,boolean,integer,boolean,boolean) line 22 at SQL statement
SQL statement "SELECT emaj._rlbk_init(v_groupNames, v_mark, v_isLoggedRlbk, 1, v_multiGroup, v_isAlterGroupAllowed)"
PL/pgSQL function emaj._rlbk_groups(text[],text,boolean,boolean,boolean) line 22 at SQL statement
SQL statement "SELECT rlbk_message::INT FROM emaj._rlbk_groups(array[v_groupName], v_mark, FALSE, FALSE, NULL) WHERE rlbk_severity = 'Notice'"
PL/pgSQL function emaj.emaj_rollback_group(text,text) line 7 at RETURN
rollback;
-- attempt to rollback several groups over one single-mark protected marks
begin;
  select emaj.emaj_set_mark_groups('{"myGroup1","myGroup2"}','Common Mark 1');
 emaj_set_mark_groups 
----------------------
                   15
(1 row)

  select emaj.emaj_set_mark_group('myGroup1','Protected Mark 1');
 emaj_set_mark_group 
---------------------
                   7
(1 row)

  select emaj.emaj_protect_mark_group('myGroup1','Protected Mark 1');
 emaj_protect_mark_group 
-------------------------
                       1
(1 row)

  select emaj.emaj_rollback_groups('{"myGroup1","myGroup2"}','Common Mark 1');
ERROR:  _rlbk_check: Protected marks (Protected Mark 1) for the group "myGroup1" block the rollback to the mark "Common Mark 1".
CONTEXT:  SQL statement "SELECT emaj._rlbk_check(v_groupNames, v_mark, v_isAlterGroupAllowed, FALSE)"
PL/pgSQL function emaj._rlbk_init(text[],text,boolean,integer,boolean,boolean) line 22 at SQL statement
SQL statement "SELECT emaj._rlbk_init(v_groupNames, v_mark, v_isLoggedRlbk, 1, v_multiGroup, v_isAlterGroupAllowed)"
PL/pgSQL function emaj._rlbk_groups(text[],text,boolean,boolean,boolean) line 22 at SQL statement
SQL statement "SELECT rlbk_message::INT FROM emaj._rlbk_groups(v_groupNames, v_mark, FALSE, TRUE, NULL) WHERE rlbk_severity = 'Notice'"
PL/pgSQL function emaj.emaj_rollback_groups(text[],text) line 7 at RETURN
rollback;
-- attempt to logged-rollback over a protected mark
begin;
  select emaj.emaj_protect_mark_group('myGroup1','EMAJ_LAST_MARK');
 emaj_protect_mark_group 
-------------------------
                       1
(1 row)

  select emaj.emaj_logged_rollback_group('myGroup1','Mark11');
ERROR:  _rlbk_check: Protected marks (Different_Mark) for the group "myGroup1" block the rollback to the mark "Mark11".
CONTEXT:  SQL statement "SELECT emaj._rlbk_check(v_groupNames, v_mark, v_isAlterGroupAllowed, FALSE)"
PL/pgSQL function emaj._rlbk_init(text[],text,boolean,integer,boolean,boolean) line 22 at SQL statement
SQL statement "SELECT emaj._rlbk_init(v_groupNames, v_mark, v_isLoggedRlbk, 1, v_multiGroup, v_isAlterGroupAllowed)"
PL/pgSQL function emaj._rlbk_groups(text[],text,boolean,boolean,boolean) line 22 at SQL statement
SQL statement "SELECT rlbk_message::INT FROM emaj._rlbk_groups(array[v_groupName], v_mark, TRUE, FALSE, NULL) WHERE rlbk_severity = 'Notice'"
PL/pgSQL function emaj.emaj_logged_rollback_group(text,text) line 11 at RETURN
rollback;
-- rollback to a protected mark
begin;
  select emaj.emaj_protect_mark_group('myGroup1','EMAJ_LAST_MARK');
 emaj_protect_mark_group 
-------------------------
                       1
(1 row)

  select emaj.emaj_rollback_group('myGroup1','EMAJ_LAST_MARK');
 emaj_rollback_group 
---------------------
                   2
(1 row)

rollback;
-- missing application table and mono-group rollback
begin;
  drop table mySchema2."myTbl3" cascade;
  select emaj.emaj_rollback_group('myGroup2','Mark21');
ERROR:  _verify_groups (1): In group "myGroup2", the table "myschema2"."myTbl3" does not exist any more. You may use "SELECT * FROM emaj.emaj_verify_all()" to look for other issues.
CONTEXT:  SQL statement "SELECT 0 FROM emaj._verify_groups(v_groupNames, TRUE)"
PL/pgSQL function emaj._rlbk_init(text[],text,boolean,integer,boolean,boolean) line 25 at PERFORM
SQL statement "SELECT emaj._rlbk_init(v_groupNames, v_mark, v_isLoggedRlbk, 1, v_multiGroup, v_isAlterGroupAllowed)"
PL/pgSQL function emaj._rlbk_groups(text[],text,boolean,boolean,boolean) line 22 at SQL statement
SQL statement "SELECT rlbk_message::INT FROM emaj._rlbk_groups(array[v_groupName], v_mark, FALSE, FALSE, NULL) WHERE rlbk_severity = 'Notice'"
PL/pgSQL function emaj.emaj_rollback_group(text,text) line 7 at RETURN
rollback;
begin;
  drop table mySchema2."myTbl3" cascade;
  select emaj.emaj_logged_rollback_group('myGroup2','Mark21');
ERROR:  _verify_groups (1): In group "myGroup2", the table "myschema2"."myTbl3" does not exist any more. You may use "SELECT * FROM emaj.emaj_verify_all()" to look for other issues.
CONTEXT:  SQL statement "SELECT 0 FROM emaj._verify_groups(v_groupNames, TRUE)"
PL/pgSQL function emaj._rlbk_init(text[],text,boolean,integer,boolean,boolean) line 25 at PERFORM
SQL statement "SELECT emaj._rlbk_init(v_groupNames, v_mark, v_isLoggedRlbk, 1, v_multiGroup, v_isAlterGroupAllowed)"
PL/pgSQL function emaj._rlbk_groups(text[],text,boolean,boolean,boolean) line 22 at SQL statement
SQL statement "SELECT rlbk_message::INT FROM emaj._rlbk_groups(array[v_groupName], v_mark, TRUE, FALSE, NULL) WHERE rlbk_severity = 'Notice'"
PL/pgSQL function emaj.emaj_logged_rollback_group(text,text) line 11 at RETURN
rollback;
-- internal error when the row corresponding to an application sequence to rollback is missing in emaj_sequence
begin;
  delete from emaj.emaj_sequence where sequ_schema = 'myschema2' and sequ_name = 'myseq1';
  select emaj.emaj_rollback_group('myGroup2','Mark21');
WARNING:  _check_fk_groups: The foreign key "mytbl6_col61_fkey" on the table "myschema2.mytbl6" references the table "myschema2.mytbl7" that is outside the groups (myGroup2).
CONTEXT:  SQL statement "SELECT emaj._check_fk_groups(v_groupNames)"
PL/pgSQL function emaj._rlbk_init(text[],text,boolean,integer,boolean,boolean) line 67 at PERFORM
SQL statement "SELECT emaj._rlbk_init(v_groupNames, v_mark, v_isLoggedRlbk, 1, v_multiGroup, v_isAlterGroupAllowed)"
PL/pgSQL function emaj._rlbk_groups(text[],text,boolean,boolean,boolean) line 22 at SQL statement
SQL statement "SELECT rlbk_message::INT FROM emaj._rlbk_groups(array[v_groupName], v_mark, FALSE, FALSE, NULL) WHERE rlbk_severity = 'Notice'"
PL/pgSQL function emaj.emaj_rollback_group(text,text) line 7 at RETURN
WARNING:  _check_fk_groups: The table "myschema2.mytbl6" is referenced by the foreign key "mytbl8_col81_fkey" on the table "myschema2.mytbl8" that is outside the groups (myGroup2).
CONTEXT:  SQL statement "SELECT emaj._check_fk_groups(v_groupNames)"
PL/pgSQL function emaj._rlbk_init(text[],text,boolean,integer,boolean,boolean) line 67 at PERFORM
SQL statement "SELECT emaj._rlbk_init(v_groupNames, v_mark, v_isLoggedRlbk, 1, v_multiGroup, v_isAlterGroupAllowed)"
PL/pgSQL function emaj._rlbk_groups(text[],text,boolean,boolean,boolean) line 22 at SQL statement
SQL statement "SELECT rlbk_message::INT FROM emaj._rlbk_groups(array[v_groupName], v_mark, FALSE, FALSE, NULL) WHERE rlbk_severity = 'Notice'"
PL/pgSQL function emaj.emaj_rollback_group(text,text) line 7 at RETURN
ERROR:  _rlbk_seq: No mark at time id "3003" can be found for the sequence "myschema2.myseq1".
CONTEXT:  SQL statement "SELECT emaj._rlbk_seq(t.*, v_markTimeId)
      FROM (SELECT * FROM emaj.emaj_relation
              WHERE upper_inf(rel_time_range) AND rel_group = ANY (v_groupNames) AND rel_kind = 'S'
              ORDER BY rel_priority, rel_schema, rel_tblseq) as t"
PL/pgSQL function emaj._rlbk_end(integer,boolean) line 125 at PERFORM
PL/pgSQL function emaj._rlbk_groups(text[],text,boolean,boolean,boolean) line 30 at RETURN QUERY
SQL statement "SELECT rlbk_message::INT FROM emaj._rlbk_groups(array[v_groupName], v_mark, FALSE, FALSE, NULL) WHERE rlbk_severity = 'Notice'"
PL/pgSQL function emaj.emaj_rollback_group(text,text) line 7 at RETURN
rollback;
-- should be OK, with different cases of dblink status
-- hide dblink_connect functions
alter function public.dblink_connect_u(text,text) rename to renamed_dblink_connect_u;
alter function public.dblink_connect_u(text) rename to renamed_dblink_connect_u;
select emaj.emaj_rollback_group('myGroup1','EMAJ_LAST_MARK');
 emaj_rollback_group 
---------------------
                   2
(1 row)

select emaj.emaj_rollback_group('myGroup2','Mark21');
WARNING:  _check_fk_groups: The foreign key "mytbl6_col61_fkey" on the table "myschema2.mytbl6" references the table "myschema2.mytbl7" that is outside the groups (myGroup2).
CONTEXT:  SQL statement "SELECT emaj._check_fk_groups(v_groupNames)"
PL/pgSQL function emaj._rlbk_init(text[],text,boolean,integer,boolean,boolean) line 67 at PERFORM
SQL statement "SELECT emaj._rlbk_init(v_groupNames, v_mark, v_isLoggedRlbk, 1, v_multiGroup, v_isAlterGroupAllowed)"
PL/pgSQL function emaj._rlbk_groups(text[],text,boolean,boolean,boolean) line 22 at SQL statement
SQL statement "SELECT rlbk_message::INT FROM emaj._rlbk_groups(array[v_groupName], v_mark, FALSE, FALSE, NULL) WHERE rlbk_severity = 'Notice'"
PL/pgSQL function emaj.emaj_rollback_group(text,text) line 7 at RETURN
WARNING:  _check_fk_groups: The table "myschema2.mytbl6" is referenced by the foreign key "mytbl8_col81_fkey" on the table "myschema2.mytbl8" that is outside the groups (myGroup2).
CONTEXT:  SQL statement "SELECT emaj._check_fk_groups(v_groupNames)"
PL/pgSQL function emaj._rlbk_init(text[],text,boolean,integer,boolean,boolean) line 67 at PERFORM
SQL statement "SELECT emaj._rlbk_init(v_groupNames, v_mark, v_isLoggedRlbk, 1, v_multiGroup, v_isAlterGroupAllowed)"
PL/pgSQL function emaj._rlbk_groups(text[],text,boolean,boolean,boolean) line 22 at SQL statement
SQL statement "SELECT rlbk_message::INT FROM emaj._rlbk_groups(array[v_groupName], v_mark, FALSE, FALSE, NULL) WHERE rlbk_severity = 'Notice'"
PL/pgSQL function emaj.emaj_rollback_group(text,text) line 7 at RETURN
 emaj_rollback_group 
---------------------
                   2
(1 row)

alter function public.renamed_dblink_connect_u(text,text) rename to dblink_connect_u;
alter function public.renamed_dblink_connect_u(text) rename to dblink_connect_u;
-- dblink_connect not in path
set search_path='emaj';
select emaj.emaj_logged_rollback_group('myGroup1','EMAJ_LAST_MARK');
 emaj_logged_rollback_group 
----------------------------
                          2
(1 row)

select emaj.emaj_logged_rollback_group('myGroup2','Mark21');
WARNING:  _check_fk_groups: The foreign key "mytbl6_col61_fkey" on the table "myschema2.mytbl6" references the table "myschema2.mytbl7" that is outside the groups (myGroup2).
CONTEXT:  SQL statement "SELECT emaj._check_fk_groups(v_groupNames)"
PL/pgSQL function emaj._rlbk_init(text[],text,boolean,integer,boolean,boolean) line 67 at PERFORM
SQL statement "SELECT emaj._rlbk_init(v_groupNames, v_mark, v_isLoggedRlbk, 1, v_multiGroup, v_isAlterGroupAllowed)"
PL/pgSQL function emaj._rlbk_groups(text[],text,boolean,boolean,boolean) line 22 at SQL statement
SQL statement "SELECT rlbk_message::INT FROM emaj._rlbk_groups(array[v_groupName], v_mark, TRUE, FALSE, NULL) WHERE rlbk_severity = 'Notice'"
PL/pgSQL function emaj.emaj_logged_rollback_group(text,text) line 11 at RETURN
WARNING:  _check_fk_groups: The table "myschema2.mytbl6" is referenced by the foreign key "mytbl8_col81_fkey" on the table "myschema2.mytbl8" that is outside the groups (myGroup2).
CONTEXT:  SQL statement "SELECT emaj._check_fk_groups(v_groupNames)"
PL/pgSQL function emaj._rlbk_init(text[],text,boolean,integer,boolean,boolean) line 67 at PERFORM
SQL statement "SELECT emaj._rlbk_init(v_groupNames, v_mark, v_isLoggedRlbk, 1, v_multiGroup, v_isAlterGroupAllowed)"
PL/pgSQL function emaj._rlbk_groups(text[],text,boolean,boolean,boolean) line 22 at SQL statement
SQL statement "SELECT rlbk_message::INT FROM emaj._rlbk_groups(array[v_groupName], v_mark, TRUE, FALSE, NULL) WHERE rlbk_severity = 'Notice'"
PL/pgSQL function emaj.emaj_logged_rollback_group(text,text) line 11 at RETURN
 emaj_logged_rollback_group 
----------------------------
                          2
(1 row)

reset search_path;
select emaj.emaj_set_mark_groups('{"myGroup1","myGroup2"}','Mark1B');
 emaj_set_mark_groups 
----------------------
                   15
(1 row)

-- no user/password defined in emaj_param
select emaj.emaj_rollback_groups('{"myGroup1","myGroup2"}','EMAJ_LAST_MARK');
WARNING:  _check_fk_groups: The foreign key "mytbl6_col61_fkey" on the table "myschema2.mytbl6" references the table "myschema2.mytbl7" that is outside the groups (myGroup1,myGroup2).
CONTEXT:  SQL statement "SELECT emaj._check_fk_groups(v_groupNames)"
PL/pgSQL function emaj._rlbk_init(text[],text,boolean,integer,boolean,boolean) line 67 at PERFORM
SQL statement "SELECT emaj._rlbk_init(v_groupNames, v_mark, v_isLoggedRlbk, 1, v_multiGroup, v_isAlterGroupAllowed)"
PL/pgSQL function emaj._rlbk_groups(text[],text,boolean,boolean,boolean) line 22 at SQL statement
SQL statement "SELECT rlbk_message::INT FROM emaj._rlbk_groups(v_groupNames, v_mark, FALSE, TRUE, NULL) WHERE rlbk_severity = 'Notice'"
PL/pgSQL function emaj.emaj_rollback_groups(text[],text) line 7 at RETURN
WARNING:  _check_fk_groups: The table "myschema2.mytbl6" is referenced by the foreign key "mytbl8_col81_fkey" on the table "myschema2.mytbl8" that is outside the groups (myGroup1,myGroup2).
CONTEXT:  SQL statement "SELECT emaj._check_fk_groups(v_groupNames)"
PL/pgSQL function emaj._rlbk_init(text[],text,boolean,integer,boolean,boolean) line 67 at PERFORM
SQL statement "SELECT emaj._rlbk_init(v_groupNames, v_mark, v_isLoggedRlbk, 1, v_multiGroup, v_isAlterGroupAllowed)"
PL/pgSQL function emaj._rlbk_groups(text[],text,boolean,boolean,boolean) line 22 at SQL statement
SQL statement "SELECT rlbk_message::INT FROM emaj._rlbk_groups(v_groupNames, v_mark, FALSE, TRUE, NULL) WHERE rlbk_severity = 'Notice'"
PL/pgSQL function emaj.emaj_rollback_groups(text[],text) line 7 at RETURN
 emaj_rollback_groups 
----------------------
                    4
(1 row)

-- bad user/password defined in emaj_param
insert into emaj.emaj_param (param_key, param_value_text) 
  values ('dblink_user_password','user=<user> password=<password>');
select emaj.emaj_rollback_groups('{"myGroup1","myGroup2"}','Mark1B');
WARNING:  _check_fk_groups: The foreign key "mytbl6_col61_fkey" on the table "myschema2.mytbl6" references the table "myschema2.mytbl7" that is outside the groups (myGroup1,myGroup2).
CONTEXT:  SQL statement "SELECT emaj._check_fk_groups(v_groupNames)"
PL/pgSQL function emaj._rlbk_init(text[],text,boolean,integer,boolean,boolean) line 67 at PERFORM
SQL statement "SELECT emaj._rlbk_init(v_groupNames, v_mark, v_isLoggedRlbk, 1, v_multiGroup, v_isAlterGroupAllowed)"
PL/pgSQL function emaj._rlbk_groups(text[],text,boolean,boolean,boolean) line 22 at SQL statement
SQL statement "SELECT rlbk_message::INT FROM emaj._rlbk_groups(v_groupNames, v_mark, FALSE, TRUE, NULL) WHERE rlbk_severity = 'Notice'"
PL/pgSQL function emaj.emaj_rollback_groups(text[],text) line 7 at RETURN
WARNING:  _check_fk_groups: The table "myschema2.mytbl6" is referenced by the foreign key "mytbl8_col81_fkey" on the table "myschema2.mytbl8" that is outside the groups (myGroup1,myGroup2).
CONTEXT:  SQL statement "SELECT emaj._check_fk_groups(v_groupNames)"
PL/pgSQL function emaj._rlbk_init(text[],text,boolean,integer,boolean,boolean) line 67 at PERFORM
SQL statement "SELECT emaj._rlbk_init(v_groupNames, v_mark, v_isLoggedRlbk, 1, v_multiGroup, v_isAlterGroupAllowed)"
PL/pgSQL function emaj._rlbk_groups(text[],text,boolean,boolean,boolean) line 22 at SQL statement
SQL statement "SELECT rlbk_message::INT FROM emaj._rlbk_groups(v_groupNames, v_mark, FALSE, TRUE, NULL) WHERE rlbk_severity = 'Notice'"
PL/pgSQL function emaj.emaj_rollback_groups(text[],text) line 7 at RETURN
 emaj_rollback_groups 
----------------------
                    4
(1 row)

-- transaction not in READ COMMITTED isolation level => the dblink connection is not possible
begin;
  set transaction isolation level repeatable read;
  select emaj.emaj_logged_rollback_groups('{"myGroup1","myGroup2"}','EMAJ_LAST_MARK');
WARNING:  _check_fk_groups: The foreign key "mytbl6_col61_fkey" on the table "myschema2.mytbl6" references the table "myschema2.mytbl7" that is outside the groups (myGroup1,myGroup2).
CONTEXT:  SQL statement "SELECT emaj._check_fk_groups(v_groupNames)"
PL/pgSQL function emaj._rlbk_init(text[],text,boolean,integer,boolean,boolean) line 67 at PERFORM
SQL statement "SELECT emaj._rlbk_init(v_groupNames, v_mark, v_isLoggedRlbk, 1, v_multiGroup, v_isAlterGroupAllowed)"
PL/pgSQL function emaj._rlbk_groups(text[],text,boolean,boolean,boolean) line 22 at SQL statement
SQL statement "SELECT rlbk_message::INT FROM emaj._rlbk_groups(v_groupNames, v_mark, TRUE, TRUE, NULL) WHERE rlbk_severity = 'Notice'"
PL/pgSQL function emaj.emaj_logged_rollback_groups(text[],text) line 11 at RETURN
WARNING:  _check_fk_groups: The table "myschema2.mytbl6" is referenced by the foreign key "mytbl8_col81_fkey" on the table "myschema2.mytbl8" that is outside the groups (myGroup1,myGroup2).
CONTEXT:  SQL statement "SELECT emaj._check_fk_groups(v_groupNames)"
PL/pgSQL function emaj._rlbk_init(text[],text,boolean,integer,boolean,boolean) line 67 at PERFORM
SQL statement "SELECT emaj._rlbk_init(v_groupNames, v_mark, v_isLoggedRlbk, 1, v_multiGroup, v_isAlterGroupAllowed)"
PL/pgSQL function emaj._rlbk_groups(text[],text,boolean,boolean,boolean) line 22 at SQL statement
SQL statement "SELECT rlbk_message::INT FROM emaj._rlbk_groups(v_groupNames, v_mark, TRUE, TRUE, NULL) WHERE rlbk_severity = 'Notice'"
PL/pgSQL function emaj.emaj_logged_rollback_groups(text[],text) line 11 at RETURN
 emaj_logged_rollback_groups 
-----------------------------
                           4
(1 row)

commit;
-- dblink connection should now be ok (missing right on dblink functions is tested in adm1.sql)
update emaj.emaj_param set param_value_text = 'user=postgres password=postgres' 
  where param_key = 'dblink_user_password';
select emaj.emaj_logged_rollback_groups('{"myGroup1","myGroup2"}','Mark1B');
WARNING:  _check_fk_groups: The foreign key "mytbl6_col61_fkey" on the table "myschema2.mytbl6" references the table "myschema2.mytbl7" that is outside the groups (myGroup1,myGroup2).
CONTEXT:  SQL statement "SELECT emaj._check_fk_groups(v_groupNames)"
PL/pgSQL function emaj._rlbk_init(text[],text,boolean,integer,boolean,boolean) line 67 at PERFORM
SQL statement "SELECT emaj._rlbk_init(v_groupNames, v_mark, v_isLoggedRlbk, 1, v_multiGroup, v_isAlterGroupAllowed)"
PL/pgSQL function emaj._rlbk_groups(text[],text,boolean,boolean,boolean) line 22 at SQL statement
SQL statement "SELECT rlbk_message::INT FROM emaj._rlbk_groups(v_groupNames, v_mark, TRUE, TRUE, NULL) WHERE rlbk_severity = 'Notice'"
PL/pgSQL function emaj.emaj_logged_rollback_groups(text[],text) line 11 at RETURN
WARNING:  _check_fk_groups: The table "myschema2.mytbl6" is referenced by the foreign key "mytbl8_col81_fkey" on the table "myschema2.mytbl8" that is outside the groups (myGroup1,myGroup2).
CONTEXT:  SQL statement "SELECT emaj._check_fk_groups(v_groupNames)"
PL/pgSQL function emaj._rlbk_init(text[],text,boolean,integer,boolean,boolean) line 67 at PERFORM
SQL statement "SELECT emaj._rlbk_init(v_groupNames, v_mark, v_isLoggedRlbk, 1, v_multiGroup, v_isAlterGroupAllowed)"
PL/pgSQL function emaj._rlbk_groups(text[],text,boolean,boolean,boolean) line 22 at SQL statement
SQL statement "SELECT rlbk_message::INT FROM emaj._rlbk_groups(v_groupNames, v_mark, TRUE, TRUE, NULL) WHERE rlbk_severity = 'Notice'"
PL/pgSQL function emaj.emaj_logged_rollback_groups(text[],text) line 11 at RETURN
 emaj_logged_rollback_groups 
-----------------------------
                           4
(1 row)

-- missing application table and multi-groups rollback
begin;
  drop table mySchema2."myTbl3" cascade;
  select emaj.emaj_rollback_groups('{"myGroup1","myGroup2"}','Mark1B');
ERROR:  _verify_groups (1): In group "myGroup2", the table "myschema2"."myTbl3" does not exist any more. You may use "SELECT * FROM emaj.emaj_verify_all()" to look for other issues.
CONTEXT:  SQL statement "SELECT 0 FROM emaj._verify_groups(v_groupNames, TRUE)"
PL/pgSQL function emaj._rlbk_init(text[],text,boolean,integer,boolean,boolean) line 25 at PERFORM
SQL statement "SELECT emaj._rlbk_init(v_groupNames, v_mark, v_isLoggedRlbk, 1, v_multiGroup, v_isAlterGroupAllowed)"
PL/pgSQL function emaj._rlbk_groups(text[],text,boolean,boolean,boolean) line 22 at SQL statement
SQL statement "SELECT rlbk_message::INT FROM emaj._rlbk_groups(v_groupNames, v_mark, FALSE, TRUE, NULL) WHERE rlbk_severity = 'Notice'"
PL/pgSQL function emaj.emaj_rollback_groups(text[],text) line 7 at RETURN
rollback;
begin;
  drop table mySchema2."myTbl3" cascade;
  select emaj.emaj_logged_rollback_groups('{"myGroup1","myGroup2"}','Mark1B');
ERROR:  _verify_groups (1): In group "myGroup2", the table "myschema2"."myTbl3" does not exist any more. You may use "SELECT * FROM emaj.emaj_verify_all()" to look for other issues.
CONTEXT:  SQL statement "SELECT 0 FROM emaj._verify_groups(v_groupNames, TRUE)"
PL/pgSQL function emaj._rlbk_init(text[],text,boolean,integer,boolean,boolean) line 25 at PERFORM
SQL statement "SELECT emaj._rlbk_init(v_groupNames, v_mark, v_isLoggedRlbk, 1, v_multiGroup, v_isAlterGroupAllowed)"
PL/pgSQL function emaj._rlbk_groups(text[],text,boolean,boolean,boolean) line 22 at SQL statement
SQL statement "SELECT rlbk_message::INT FROM emaj._rlbk_groups(v_groupNames, v_mark, TRUE, TRUE, NULL) WHERE rlbk_severity = 'Notice'"
PL/pgSQL function emaj.emaj_logged_rollback_groups(text[],text) line 11 at RETURN
rollback;
-- restart groups
select emaj.emaj_stop_groups('{"myGroup1","myGroup2"}');
 emaj_stop_groups 
------------------
               15
(1 row)

select emaj.emaj_start_group('myGroup1','Mark11');
 emaj_start_group 
------------------
                7
(1 row)

select emaj.emaj_start_group('myGroup2','Mark21');
WARNING:  _check_fk_groups: The foreign key "mytbl6_col61_fkey" on the table "myschema2.mytbl6" references the table "myschema2.mytbl7" that is outside the groups (myGroup2).
CONTEXT:  SQL statement "SELECT emaj._check_fk_groups(v_groupNames)"
PL/pgSQL function emaj._start_groups(text[],text,boolean,boolean) line 25 at PERFORM
PL/pgSQL function emaj.emaj_start_group(text,text,boolean) line 12 at RETURN
WARNING:  _check_fk_groups: The table "myschema2.mytbl6" is referenced by the foreign key "mytbl8_col81_fkey" on the table "myschema2.mytbl8" that is outside the groups (myGroup2).
CONTEXT:  SQL statement "SELECT emaj._check_fk_groups(v_groupNames)"
PL/pgSQL function emaj._start_groups(text[],text,boolean,boolean) line 25 at PERFORM
PL/pgSQL function emaj.emaj_start_group(text,text,boolean) line 12 at RETURN
 emaj_start_group 
------------------
                8
(1 row)

-----------------------------
-- log phase #1 with 2 unlogged rollbacks
-----------------------------
-- Populate application tables
set search_path=public,myschema1;
-- inserts/updates/deletes in myTbl1, myTbl2 and myTbl2b (via trigger)
insert into myTbl1 select i, 'ABC', E'\\014'::bytea from generate_series (1,11) as i;
begin transaction;
  update myTbl1 set col13=E'\\034'::bytea where col11 <= 3;
  insert into myTbl2 values (1,'ABC',current_date);
commit;
delete from myTbl1 where col11 > 10;
insert into myTbl2 values (2,'DEF',NULL);
insert into myTbl2 values (3,'GHI',NULL);
update myTbl2 set col22 = NULL WHERE col23 IS NULL;
delete from myTbl2 where col21 = 3 and col22 is NULL;
select count(*) from mytbl1;
 count 
-------
    10
(1 row)

select count(*) from mytbl2;
 count 
-------
     2
(1 row)

select count(*) from mytbl2b;
 count 
-------
     6
(1 row)

select count(*) from "myTbl3";
 count 
-------
     0
(1 row)

select count(*) from myTbl4;
 count 
-------
     0
(1 row)

-- set a mark
select emaj.emaj_set_mark_group('myGroup1','Mark12');
 emaj_set_mark_group 
---------------------
                   7
(1 row)

select mark_id, mark_group, regexp_replace(mark_name,E'\\d\\d\.\\d\\d\\.\\d\\d\\.\\d\\d\\d','%','g'), mark_time_id, mark_is_deleted, mark_is_rlbk_protected, mark_comment, mark_log_rows_before_next, mark_logged_rlbk_target_mark from emaj.emaj_mark order by mark_id;
 mark_id |    mark_group    | regexp_replace | mark_time_id | mark_is_deleted | mark_is_rlbk_protected |              mark_comment              | mark_log_rows_before_next | mark_logged_rlbk_target_mark 
---------+------------------+----------------+--------------+-----------------+------------------------+----------------------------------------+---------------------------+------------------------------
    2006 | emptyGroup       | SM2            |         2006 | f               | f                      | a comment on a mark for an empty group |                         0 | Mark1
    2021 | emptyGroup       | EGM3           |         2016 | f               | f                      |                                        |                         0 | 
    2022 | emptyGroup       | EGM4           |         2017 | f               | f                      |                                        |                           | 
    2023 | phil's group#3", | Mark4          |         2018 | f               | f                      |                                        |                           | 
    3029 | myGroup1         | Mark11         |         3030 | f               | f                      |                                        |                        27 | 
    3030 | myGroup2         | Mark21         |         3031 | f               | f                      |                                        |                           | 
    3031 | myGroup1         | Mark12         |         3032 | f               | f                      |                                        |                           | 
(7 rows)

select sequ_schema, sequ_name, sequ_time_id, sequ_last_val, sequ_is_called from emaj.emaj_sequence order by sequ_time_id, sequ_schema, sequ_name;
  sequ_schema   |             sequ_name              | sequ_time_id | sequ_last_val | sequ_is_called 
----------------+------------------------------------+--------------+---------------+----------------
 emaj           | phil's schema3_myTbl2\_log_seq     |         2018 |             1 | f
 emaj #'3       | phil's schema3_phil's tbl1_log_seq |         2018 |             1 | f
 phil's schema3 | myTbl2\_col21_seq                  |         2018 |             1 | f
 phil's schema3 | phil's seq\1                       |         2018 |          1000 | f
 emaj           | myschema1_mytbl1_log_seq           |         3030 |             1 | f
 emaj           | myschema1_mytbl2_log_seq           |         3030 |             1 | f
 emaj           | myschema1_mytbl4_log_seq           |         3030 |             1 | f
 emajb          | myschema1_mytbl2b_log_seq          |         3030 |             1 | f
 emajC          | myschema1_myTbl3_log_seq           |         3030 |             1 | f
 myschema1      | mytbl2b_col20_seq                  |         3030 |             1 | f
 myschema1      | myTbl3_col31_seq                   |         3030 |             1 | f
 emaj           | myschema2_mytbl1_log_seq           |         3031 |             1 | f
 emaj           | myschema2_mytbl2_log_seq           |         3031 |             1 | f
 emaj           | myschema2_mytbl4_log_seq           |         3031 |             1 | f
 emaj           | myschema2_mytbl6_log_seq           |         3031 |             1 | f
 emaj           | otherPrefix4mytbl5_log_seq         |         3031 |             1 | f
 emajC          | myschema2_myTbl3_log_seq           |         3031 |             1 | f
 myschema2      | myseq1                             |         3031 |          1000 | f
 myschema2      | myTbl3_col31_seq                   |         3031 |             1 | f
 emaj           | myschema1_mytbl1_log_seq           |         3032 |            15 | t
 emaj           | myschema1_mytbl2_log_seq           |         3032 |             6 | t
 emaj           | myschema1_mytbl4_log_seq           |         3032 |             1 | f
 emajb          | myschema1_mytbl2b_log_seq          |         3032 |             6 | t
 emajC          | myschema1_myTbl3_log_seq           |         3032 |             1 | f
 myschema1      | mytbl2b_col20_seq                  |         3032 |             6 | t
 myschema1      | myTbl3_col31_seq                   |         3032 |             1 | f
(26 rows)

-- inserts/updates/deletes in myTbl3 and myTbl4
insert into "myTbl3" (col33) select generate_series(1000,1039,4)/100;
insert into myTbl4 values (1,'FK...',1,1,'ABC');
update myTbl4 set col43 = NULL where col41 = 1;
select count(*) from "myTbl3";
 count 
-------
    10
(1 row)

select count(*) from myTbl4;
 count 
-------
     1
(1 row)

-- set a mark
select emaj.emaj_set_mark_group('myGroup1','Mark13');
 emaj_set_mark_group 
---------------------
                   7
(1 row)

select mark_id, mark_group, regexp_replace(mark_name,E'\\d\\d\.\\d\\d\\.\\d\\d\\.\\d\\d\\d','%','g'), mark_time_id, mark_is_deleted, mark_is_rlbk_protected, mark_comment, mark_log_rows_before_next, mark_logged_rlbk_target_mark from emaj.emaj_mark order by mark_id;
 mark_id |    mark_group    | regexp_replace | mark_time_id | mark_is_deleted | mark_is_rlbk_protected |              mark_comment              | mark_log_rows_before_next | mark_logged_rlbk_target_mark 
---------+------------------+----------------+--------------+-----------------+------------------------+----------------------------------------+---------------------------+------------------------------
    2006 | emptyGroup       | SM2            |         2006 | f               | f                      | a comment on a mark for an empty group |                         0 | Mark1
    2021 | emptyGroup       | EGM3           |         2016 | f               | f                      |                                        |                         0 | 
    2022 | emptyGroup       | EGM4           |         2017 | f               | f                      |                                        |                           | 
    2023 | phil's group#3", | Mark4          |         2018 | f               | f                      |                                        |                           | 
    3029 | myGroup1         | Mark11         |         3030 | f               | f                      |                                        |                        27 | 
    3030 | myGroup2         | Mark21         |         3031 | f               | f                      |                                        |                           | 
    3031 | myGroup1         | Mark12         |         3032 | f               | f                      |                                        |                        12 | 
    3032 | myGroup1         | Mark13         |         3033 | f               | f                      |                                        |                           | 
(8 rows)

select sequ_schema, sequ_name, sequ_time_id, sequ_last_val, sequ_is_called from emaj.emaj_sequence order by sequ_time_id, sequ_schema, sequ_name;
  sequ_schema   |             sequ_name              | sequ_time_id | sequ_last_val | sequ_is_called 
----------------+------------------------------------+--------------+---------------+----------------
 emaj           | phil's schema3_myTbl2\_log_seq     |         2018 |             1 | f
 emaj #'3       | phil's schema3_phil's tbl1_log_seq |         2018 |             1 | f
 phil's schema3 | myTbl2\_col21_seq                  |         2018 |             1 | f
 phil's schema3 | phil's seq\1                       |         2018 |          1000 | f
 emaj           | myschema1_mytbl1_log_seq           |         3030 |             1 | f
 emaj           | myschema1_mytbl2_log_seq           |         3030 |             1 | f
 emaj           | myschema1_mytbl4_log_seq           |         3030 |             1 | f
 emajb          | myschema1_mytbl2b_log_seq          |         3030 |             1 | f
 emajC          | myschema1_myTbl3_log_seq           |         3030 |             1 | f
 myschema1      | mytbl2b_col20_seq                  |         3030 |             1 | f
 myschema1      | myTbl3_col31_seq                   |         3030 |             1 | f
 emaj           | myschema2_mytbl1_log_seq           |         3031 |             1 | f
 emaj           | myschema2_mytbl2_log_seq           |         3031 |             1 | f
 emaj           | myschema2_mytbl4_log_seq           |         3031 |             1 | f
 emaj           | myschema2_mytbl6_log_seq           |         3031 |             1 | f
 emaj           | otherPrefix4mytbl5_log_seq         |         3031 |             1 | f
 emajC          | myschema2_myTbl3_log_seq           |         3031 |             1 | f
 myschema2      | myseq1                             |         3031 |          1000 | f
 myschema2      | myTbl3_col31_seq                   |         3031 |             1 | f
 emaj           | myschema1_mytbl1_log_seq           |         3032 |            15 | t
 emaj           | myschema1_mytbl2_log_seq           |         3032 |             6 | t
 emaj           | myschema1_mytbl4_log_seq           |         3032 |             1 | f
 emajb          | myschema1_mytbl2b_log_seq          |         3032 |             6 | t
 emajC          | myschema1_myTbl3_log_seq           |         3032 |             1 | f
 myschema1      | mytbl2b_col20_seq                  |         3032 |             6 | t
 myschema1      | myTbl3_col31_seq                   |         3032 |             1 | f
 emaj           | myschema1_mytbl1_log_seq           |         3033 |            15 | t
 emaj           | myschema1_mytbl2_log_seq           |         3033 |             6 | t
 emaj           | myschema1_mytbl4_log_seq           |         3033 |             2 | t
 emajb          | myschema1_mytbl2b_log_seq          |         3033 |             6 | t
 emajC          | myschema1_myTbl3_log_seq           |         3033 |            10 | t
 myschema1      | mytbl2b_col20_seq                  |         3033 |             6 | t
 myschema1      | myTbl3_col31_seq                   |         3033 |            10 | t
(33 rows)

select col11, col12, col13, emaj_verb, emaj_tuple, emaj_gid from emaj.myschema1_mytbl1_log order by emaj_gid, emaj_tuple desc;
 col11 |   col12    | col13 | emaj_verb | emaj_tuple | emaj_gid 
-------+------------+-------+-----------+------------+----------
     1 | ABC        | \x0c  | INS       | NEW        |        3
     2 | ABC        | \x0c  | INS       | NEW        |        4
     3 | ABC        | \x0c  | INS       | NEW        |        5
     4 | ABC        | \x0c  | INS       | NEW        |        6
     5 | ABC        | \x0c  | INS       | NEW        |        7
     6 | ABC        | \x0c  | INS       | NEW        |        8
     7 | ABC        | \x0c  | INS       | NEW        |        9
     8 | ABC        | \x0c  | INS       | NEW        |       10
     9 | ABC        | \x0c  | INS       | NEW        |       11
    10 | ABC        | \x0c  | INS       | NEW        |       12
    11 | ABC        | \x0c  | INS       | NEW        |       13
     1 | ABC        | \x0c  | UPD       | OLD        |       14
     1 | ABC        | \x1c  | UPD       | NEW        |       14
     2 | ABC        | \x0c  | UPD       | OLD        |       15
     2 | ABC        | \x1c  | UPD       | NEW        |       15
     3 | ABC        | \x0c  | UPD       | OLD        |       16
     3 | ABC        | \x1c  | UPD       | NEW        |       16
    11 | ABC        | \x0c  | DEL       | OLD        |       19
(18 rows)

select col21, col22, emaj_verb, emaj_tuple, emaj_gid from emaj.myschema1_mytbl2_log order by emaj_gid, emaj_tuple desc;
 col21 | col22 | emaj_verb | emaj_tuple | emaj_gid 
-------+-------+-----------+------------+----------
     1 | ABC   | INS       | NEW        |       17
     2 | DEF   | INS       | NEW        |       20
     3 | GHI   | INS       | NEW        |       22
     2 | DEF   | UPD       | OLD        |       24
     2 |       | UPD       | NEW        |       24
     3 | GHI   | UPD       | OLD        |       26
     3 |       | UPD       | NEW        |       26
     3 |       | DEL       | OLD        |       28
(8 rows)

select col20, col21, emaj_verb, emaj_tuple, emaj_gid from emajb.myschema1_mytbl2b_log order by emaj_gid, emaj_tuple desc;
 col20 | col21 | emaj_verb | emaj_tuple | emaj_gid 
-------+-------+-----------+------------+----------
     1 |     1 | INS       | NEW        |       18
     2 |     2 | INS       | NEW        |       21
     3 |     3 | INS       | NEW        |       23
     4 |     2 | INS       | NEW        |       25
     5 |     3 | INS       | NEW        |       27
     6 |     3 | INS       | NEW        |       29
(6 rows)

select col31, col33, emaj_verb, emaj_tuple, emaj_gid from "emajC"."myschema1_myTbl3_log" order by emaj_gid, emaj_tuple desc;
 col31 | col33 | emaj_verb | emaj_tuple | emaj_gid 
-------+-------+-----------+------------+----------
     1 | 10.00 | INS       | NEW        |       30
     2 | 10.00 | INS       | NEW        |       31
     3 | 10.00 | INS       | NEW        |       32
     4 | 10.00 | INS       | NEW        |       33
     5 | 10.00 | INS       | NEW        |       34
     6 | 10.00 | INS       | NEW        |       35
     7 | 10.00 | INS       | NEW        |       36
     8 | 10.00 | INS       | NEW        |       37
     9 | 10.00 | INS       | NEW        |       38
    10 | 10.00 | INS       | NEW        |       39
(10 rows)

select col41, col42, col43, col44, col45, emaj_verb, emaj_tuple, emaj_gid from emaj.myschema1_myTbl4_log order by emaj_gid, emaj_tuple desc;
 col41 | col42 | col43 | col44 |   col45    | emaj_verb | emaj_tuple | emaj_gid 
-------+-------+-------+-------+------------+-----------+------------+----------
     1 | FK... |     1 |     1 | ABC        | INS       | NEW        |       40
     1 | FK... |     1 |     1 | ABC        | UPD       | OLD        |       41
     1 | FK... |       |     1 | ABC        | UPD       | NEW        |       41
(3 rows)

-- rollback #1
alter table mySchema1.myTbl2 disable trigger myTbl2trg;
select emaj.emaj_rollback_group('myGroup1','Mark12');
 emaj_rollback_group 
---------------------
                   4
(1 row)

alter table mySchema1.myTbl2 enable trigger myTbl2trg;
-- check impact
select mark_id, mark_group, regexp_replace(mark_name,E'\\d\\d\.\\d\\d\\.\\d\\d\\.\\d\\d\\d','%','g'), mark_time_id, mark_is_deleted, mark_is_rlbk_protected, mark_comment, mark_log_rows_before_next, mark_logged_rlbk_target_mark from emaj.emaj_mark order by mark_id;
 mark_id |    mark_group    | regexp_replace | mark_time_id | mark_is_deleted | mark_is_rlbk_protected |              mark_comment              | mark_log_rows_before_next | mark_logged_rlbk_target_mark 
---------+------------------+----------------+--------------+-----------------+------------------------+----------------------------------------+---------------------------+------------------------------
    2006 | emptyGroup       | SM2            |         2006 | f               | f                      | a comment on a mark for an empty group |                         0 | Mark1
    2021 | emptyGroup       | EGM3           |         2016 | f               | f                      |                                        |                         0 | 
    2022 | emptyGroup       | EGM4           |         2017 | f               | f                      |                                        |                           | 
    2023 | phil's group#3", | Mark4          |         2018 | f               | f                      |                                        |                           | 
    3029 | myGroup1         | Mark11         |         3030 | f               | f                      |                                        |                        27 | 
    3030 | myGroup2         | Mark21         |         3031 | f               | f                      |                                        |                           | 
    3031 | myGroup1         | Mark12         |         3032 | f               | f                      |                                        |                           | 
(7 rows)

select sequ_schema, sequ_name, sequ_time_id, sequ_last_val, sequ_is_called from emaj.emaj_sequence order by sequ_time_id, sequ_schema, sequ_name;
  sequ_schema   |             sequ_name              | sequ_time_id | sequ_last_val | sequ_is_called 
----------------+------------------------------------+--------------+---------------+----------------
 emaj           | phil's schema3_myTbl2\_log_seq     |         2018 |             1 | f
 emaj #'3       | phil's schema3_phil's tbl1_log_seq |         2018 |             1 | f
 phil's schema3 | myTbl2\_col21_seq                  |         2018 |             1 | f
 phil's schema3 | phil's seq\1                       |         2018 |          1000 | f
 emaj           | myschema1_mytbl1_log_seq           |         3030 |             1 | f
 emaj           | myschema1_mytbl2_log_seq           |         3030 |             1 | f
 emaj           | myschema1_mytbl4_log_seq           |         3030 |             1 | f
 emajb          | myschema1_mytbl2b_log_seq          |         3030 |             1 | f
 emajC          | myschema1_myTbl3_log_seq           |         3030 |             1 | f
 myschema1      | mytbl2b_col20_seq                  |         3030 |             1 | f
 myschema1      | myTbl3_col31_seq                   |         3030 |             1 | f
 emaj           | myschema2_mytbl1_log_seq           |         3031 |             1 | f
 emaj           | myschema2_mytbl2_log_seq           |         3031 |             1 | f
 emaj           | myschema2_mytbl4_log_seq           |         3031 |             1 | f
 emaj           | myschema2_mytbl6_log_seq           |         3031 |             1 | f
 emaj           | otherPrefix4mytbl5_log_seq         |         3031 |             1 | f
 emajC          | myschema2_myTbl3_log_seq           |         3031 |             1 | f
 myschema2      | myseq1                             |         3031 |          1000 | f
 myschema2      | myTbl3_col31_seq                   |         3031 |             1 | f
 emaj           | myschema1_mytbl1_log_seq           |         3032 |            15 | t
 emaj           | myschema1_mytbl2_log_seq           |         3032 |             6 | t
 emaj           | myschema1_mytbl4_log_seq           |         3032 |             1 | f
 emajb          | myschema1_mytbl2b_log_seq          |         3032 |             6 | t
 emajC          | myschema1_myTbl3_log_seq           |         3032 |             1 | f
 myschema1      | mytbl2b_col20_seq                  |         3032 |             6 | t
 myschema1      | myTbl3_col31_seq                   |         3032 |             1 | f
(26 rows)

select sqhl_schema, sqhl_table, sqhl_begin_time_id, sqhl_end_time_id, sqhl_hole_size from emaj.emaj_seq_hole order by 1,2,3;
 sqhl_schema | sqhl_table | sqhl_begin_time_id | sqhl_end_time_id | sqhl_hole_size 
-------------+------------+--------------------+------------------+----------------
 myschema1   | myTbl3     |               3032 |             3034 |             10
 myschema1   | mytbl4     |               3032 |             3034 |              2
(2 rows)

select col31, col33, emaj_verb, emaj_tuple, emaj_gid from "emajC"."myschema1_myTbl3_log" order by emaj_gid, emaj_tuple desc;
 col31 | col33 | emaj_verb | emaj_tuple | emaj_gid 
-------+-------+-----------+------------+----------
(0 rows)

select col41, col42, col43, col44, col45, emaj_verb, emaj_tuple, emaj_gid from emaj.myschema1_myTbl4_log order by emaj_gid, emaj_tuple desc;
 col41 | col42 | col43 | col44 | col45 | emaj_verb | emaj_tuple | emaj_gid 
-------+-------+-------+-------+-------+-----------+------------+----------
(0 rows)

select col31, col33 from myschema1."myTbl3" order by col31;
 col31 | col33 
-------+-------
(0 rows)

select col41, col42, col43, col44, col45 from myschema1.myTbl4 order by col41;
 col41 | col42 | col43 | col44 | col45 
-------+-------+-------+-------+-------
(0 rows)

-- rollback #2 (and stop)
alter table mySchema1.myTbl2 disable trigger myTbl2trg;
select emaj.emaj_rollback_group('myGroup1','Mark11');
 emaj_rollback_group 
---------------------
                   5
(1 row)

alter table mySchema1.myTbl2 enable trigger myTbl2trg;
select emaj.emaj_stop_group('myGroup1');
 emaj_stop_group 
-----------------
               7
(1 row)

-- check impact
select mark_id, mark_group, regexp_replace(mark_name,E'\\d\\d\.\\d\\d\\.\\d\\d\\.\\d\\d\\d','%','g'), mark_time_id, mark_is_deleted, mark_is_rlbk_protected, mark_comment, mark_log_rows_before_next, mark_logged_rlbk_target_mark from emaj.emaj_mark order by mark_id;
 mark_id |    mark_group    | regexp_replace | mark_time_id | mark_is_deleted | mark_is_rlbk_protected |              mark_comment              | mark_log_rows_before_next | mark_logged_rlbk_target_mark 
---------+------------------+----------------+--------------+-----------------+------------------------+----------------------------------------+---------------------------+------------------------------
    2006 | emptyGroup       | SM2            |         2006 | f               | f                      | a comment on a mark for an empty group |                         0 | Mark1
    2021 | emptyGroup       | EGM3           |         2016 | f               | f                      |                                        |                         0 | 
    2022 | emptyGroup       | EGM4           |         2017 | f               | f                      |                                        |                           | 
    2023 | phil's group#3", | Mark4          |         2018 | f               | f                      |                                        |                           | 
    3029 | myGroup1         | Mark11         |         3030 | t               | f                      |                                        |                         0 | 
    3030 | myGroup2         | Mark21         |         3031 | f               | f                      |                                        |                           | 
    3033 | myGroup1         | STOP_%         |         3036 | t               | f                      |                                        |                         0 | 
(7 rows)

select sequ_schema, sequ_name, sequ_time_id, sequ_last_val, sequ_is_called from emaj.emaj_sequence order by sequ_time_id, sequ_schema, sequ_name;
  sequ_schema   |             sequ_name              | sequ_time_id | sequ_last_val | sequ_is_called 
----------------+------------------------------------+--------------+---------------+----------------
 emaj           | phil's schema3_myTbl2\_log_seq     |         2018 |             1 | f
 emaj #'3       | phil's schema3_phil's tbl1_log_seq |         2018 |             1 | f
 phil's schema3 | myTbl2\_col21_seq                  |         2018 |             1 | f
 phil's schema3 | phil's seq\1                       |         2018 |          1000 | f
 emaj           | myschema1_mytbl1_log_seq           |         3030 |             1 | f
 emaj           | myschema1_mytbl2_log_seq           |         3030 |             1 | f
 emaj           | myschema1_mytbl4_log_seq           |         3030 |             1 | f
 emajb          | myschema1_mytbl2b_log_seq          |         3030 |             1 | f
 emajC          | myschema1_myTbl3_log_seq           |         3030 |             1 | f
 myschema1      | mytbl2b_col20_seq                  |         3030 |             1 | f
 myschema1      | myTbl3_col31_seq                   |         3030 |             1 | f
 emaj           | myschema2_mytbl1_log_seq           |         3031 |             1 | f
 emaj           | myschema2_mytbl2_log_seq           |         3031 |             1 | f
 emaj           | myschema2_mytbl4_log_seq           |         3031 |             1 | f
 emaj           | myschema2_mytbl6_log_seq           |         3031 |             1 | f
 emaj           | otherPrefix4mytbl5_log_seq         |         3031 |             1 | f
 emajC          | myschema2_myTbl3_log_seq           |         3031 |             1 | f
 myschema2      | myseq1                             |         3031 |          1000 | f
 myschema2      | myTbl3_col31_seq                   |         3031 |             1 | f
 emaj           | myschema1_mytbl1_log_seq           |         3036 |            15 | t
 emaj           | myschema1_mytbl2_log_seq           |         3036 |             6 | t
 emaj           | myschema1_mytbl4_log_seq           |         3036 |             2 | t
 emajb          | myschema1_mytbl2b_log_seq          |         3036 |             6 | t
 emajC          | myschema1_myTbl3_log_seq           |         3036 |            10 | t
 myschema1      | mytbl2b_col20_seq                  |         3036 |             1 | f
 myschema1      | myTbl3_col31_seq                   |         3036 |             1 | f
(26 rows)

select sqhl_schema, sqhl_table, sqhl_begin_time_id, sqhl_end_time_id, sqhl_hole_size from emaj.emaj_seq_hole order by 1,2,3;
 sqhl_schema | sqhl_table | sqhl_begin_time_id | sqhl_end_time_id | sqhl_hole_size 
-------------+------------+--------------------+------------------+----------------
 myschema1   | mytbl1     |               3030 |             3035 |             15
 myschema1   | mytbl2     |               3030 |             3035 |              6
 myschema1   | mytbl2b    |               3030 |             3035 |              6
 myschema1   | myTbl3     |               3032 |             3034 |             10
 myschema1   | mytbl4     |               3032 |             3034 |              2
(5 rows)

select col11, col12, col13, emaj_verb, emaj_tuple, emaj_gid from emaj.myschema1_myTbl1_log order by emaj_gid, emaj_tuple desc;
 col11 | col12 | col13 | emaj_verb | emaj_tuple | emaj_gid 
-------+-------+-------+-----------+------------+----------
(0 rows)

select col21, col22, emaj_verb, emaj_tuple, emaj_gid from emaj.myschema1_myTbl2_log order by emaj_gid, emaj_tuple desc;
 col21 | col22 | emaj_verb | emaj_tuple | emaj_gid 
-------+-------+-----------+------------+----------
(0 rows)

select col20, col21, emaj_verb, emaj_tuple, emaj_gid from emajb.myschema1_myTbl2b_log order by emaj_gid, emaj_tuple desc;
 col20 | col21 | emaj_verb | emaj_tuple | emaj_gid 
-------+-------+-----------+------------+----------
(0 rows)

select col11, col12, col13 from myschema1.myTbl1 order by col11, col12;
 col11 | col12 | col13 
-------+-------+-------
(0 rows)

select col21, col22 from myschema1.myTbl2 order by col21;
 col21 | col22 
-------+-------
(0 rows)

select col20, col21 from myschema1.myTbl2b order by col20;
 col20 | col21 
-------+-------
(0 rows)

-- restart group
select emaj.emaj_start_group('myGroup1','Mark11');
 emaj_start_group 
------------------
                7
(1 row)

-- check the logs are empty again
select count(*) from emaj.myschema1_mytbl1_log;
 count 
-------
     0
(1 row)

select count(*) from emaj.myschema1_mytbl2_log;
 count 
-------
     0
(1 row)

select count(*) from emajb.myschema1_mytbl2b_log;
 count 
-------
     0
(1 row)

select count(*) from "emajC"."myschema1_myTbl3_log";
 count 
-------
     0
(1 row)

select count(*) from emaj.myschema1_mytbl4_log;
 count 
-------
     0
(1 row)

-----------------------------
-- log phase #2 with 2 logged rollbacks
-----------------------------
-- Populate application tables
set search_path=public,myschema1;
-- inserts/updates/deletes in myTbl1, myTbl2 and myTbl2b (via trigger)
insert into myTbl1 select i, 'ABC', E'\\014'::bytea from generate_series (1,11) as i;
begin transaction;
  update myTbl1 set col13=E'\\034'::bytea where col11 <= 3;
  insert into myTbl2 values (1,'ABC',current_date);
commit;
delete from myTbl1 where col11 > 10;
insert into myTbl2 values (2,'DEF',NULL);
select count(*) from mytbl1;
 count 
-------
    10
(1 row)

select count(*) from mytbl2;
 count 
-------
     2
(1 row)

select count(*) from mytbl2b;
 count 
-------
     2
(1 row)

-- set a mark
select emaj.emaj_set_mark_group('myGroup1','Mark12');
 emaj_set_mark_group 
---------------------
                   7
(1 row)

-- inserts/updates/deletes in myTbl3 and myTbl4
insert into "myTbl3" (col33) select generate_series(1000,1039,4)/100;
insert into myTbl4 values (1,'FK...',1,1,'ABC');
select count(*) from "myTbl3";
 count 
-------
    10
(1 row)

select count(*) from myTbl4;
 count 
-------
     1
(1 row)

-- set a mark
select emaj.emaj_set_mark_group('myGroup1','Mark13');
 emaj_set_mark_group 
---------------------
                   7
(1 row)

select mark_id, mark_group, regexp_replace(mark_name,E'\\d\\d\.\\d\\d\\.\\d\\d\\.\\d\\d\\d','%','g'),mark_time_id, mark_is_deleted, mark_is_rlbk_protected, mark_comment, mark_log_rows_before_next, mark_logged_rlbk_target_mark from emaj.emaj_mark order by mark_id;
 mark_id |    mark_group    | regexp_replace | mark_time_id | mark_is_deleted | mark_is_rlbk_protected |              mark_comment              | mark_log_rows_before_next | mark_logged_rlbk_target_mark 
---------+------------------+----------------+--------------+-----------------+------------------------+----------------------------------------+---------------------------+------------------------------
    2006 | emptyGroup       | SM2            |         2006 | f               | f                      | a comment on a mark for an empty group |                         0 | Mark1
    2021 | emptyGroup       | EGM3           |         2016 | f               | f                      |                                        |                         0 | 
    2022 | emptyGroup       | EGM4           |         2017 | f               | f                      |                                        |                           | 
    2023 | phil's group#3", | Mark4          |         2018 | f               | f                      |                                        |                           | 
    3030 | myGroup2         | Mark21         |         3031 | f               | f                      |                                        |                           | 
    3034 | myGroup1         | Mark11         |         3037 | f               | f                      |                                        |                        19 | 
    3035 | myGroup1         | Mark12         |         3038 | f               | f                      |                                        |                        11 | 
    3036 | myGroup1         | Mark13         |         3039 | f               | f                      |                                        |                           | 
(8 rows)

select sequ_schema, sequ_name, sequ_time_id, sequ_last_val, sequ_is_called from emaj.emaj_sequence order by sequ_time_id, sequ_schema, sequ_name;
  sequ_schema   |             sequ_name              | sequ_time_id | sequ_last_val | sequ_is_called 
----------------+------------------------------------+--------------+---------------+----------------
 emaj           | phil's schema3_myTbl2\_log_seq     |         2018 |             1 | f
 emaj #'3       | phil's schema3_phil's tbl1_log_seq |         2018 |             1 | f
 phil's schema3 | myTbl2\_col21_seq                  |         2018 |             1 | f
 phil's schema3 | phil's seq\1                       |         2018 |          1000 | f
 emaj           | myschema2_mytbl1_log_seq           |         3031 |             1 | f
 emaj           | myschema2_mytbl2_log_seq           |         3031 |             1 | f
 emaj           | myschema2_mytbl4_log_seq           |         3031 |             1 | f
 emaj           | myschema2_mytbl6_log_seq           |         3031 |             1 | f
 emaj           | otherPrefix4mytbl5_log_seq         |         3031 |             1 | f
 emajC          | myschema2_myTbl3_log_seq           |         3031 |             1 | f
 myschema2      | myseq1                             |         3031 |          1000 | f
 myschema2      | myTbl3_col31_seq                   |         3031 |             1 | f
 emaj           | myschema1_mytbl1_log_seq           |         3037 |            15 | t
 emaj           | myschema1_mytbl2_log_seq           |         3037 |             6 | t
 emaj           | myschema1_mytbl4_log_seq           |         3037 |             2 | t
 emajb          | myschema1_mytbl2b_log_seq          |         3037 |             6 | t
 emajC          | myschema1_myTbl3_log_seq           |         3037 |            10 | t
 myschema1      | mytbl2b_col20_seq                  |         3037 |             1 | f
 myschema1      | myTbl3_col31_seq                   |         3037 |             1 | f
 emaj           | myschema1_mytbl1_log_seq           |         3038 |            30 | t
 emaj           | myschema1_mytbl2_log_seq           |         3038 |             8 | t
 emaj           | myschema1_mytbl4_log_seq           |         3038 |             2 | t
 emajb          | myschema1_mytbl2b_log_seq          |         3038 |             8 | t
 emajC          | myschema1_myTbl3_log_seq           |         3038 |            10 | t
 myschema1      | mytbl2b_col20_seq                  |         3038 |             2 | t
 myschema1      | myTbl3_col31_seq                   |         3038 |             1 | f
 emaj           | myschema1_mytbl1_log_seq           |         3039 |            30 | t
 emaj           | myschema1_mytbl2_log_seq           |         3039 |             8 | t
 emaj           | myschema1_mytbl4_log_seq           |         3039 |             3 | t
 emajb          | myschema1_mytbl2b_log_seq          |         3039 |             8 | t
 emajC          | myschema1_myTbl3_log_seq           |         3039 |            20 | t
 myschema1      | mytbl2b_col20_seq                  |         3039 |             2 | t
 myschema1      | myTbl3_col31_seq                   |         3039 |            10 | t
(33 rows)

select col11, col12, col13, emaj_verb, emaj_tuple, emaj_gid from emaj.myschema1_mytbl1_log order by emaj_gid, emaj_tuple desc;
 col11 |   col12    | col13 | emaj_verb | emaj_tuple | emaj_gid 
-------+------------+-------+-----------+------------+----------
     1 | ABC        | \x0c  | INS       | NEW        |       42
     2 | ABC        | \x0c  | INS       | NEW        |       43
     3 | ABC        | \x0c  | INS       | NEW        |       44
     4 | ABC        | \x0c  | INS       | NEW        |       45
     5 | ABC        | \x0c  | INS       | NEW        |       46
     6 | ABC        | \x0c  | INS       | NEW        |       47
     7 | ABC        | \x0c  | INS       | NEW        |       48
     8 | ABC        | \x0c  | INS       | NEW        |       49
     9 | ABC        | \x0c  | INS       | NEW        |       50
    10 | ABC        | \x0c  | INS       | NEW        |       51
    11 | ABC        | \x0c  | INS       | NEW        |       52
     1 | ABC        | \x0c  | UPD       | OLD        |       53
     1 | ABC        | \x1c  | UPD       | NEW        |       53
     2 | ABC        | \x0c  | UPD       | OLD        |       54
     2 | ABC        | \x1c  | UPD       | NEW        |       54
     3 | ABC        | \x0c  | UPD       | OLD        |       55
     3 | ABC        | \x1c  | UPD       | NEW        |       55
    11 | ABC        | \x0c  | DEL       | OLD        |       58
(18 rows)

select col21, col22, emaj_verb, emaj_tuple, emaj_gid from emaj.myschema1_mytbl2_log order by emaj_gid, emaj_tuple desc;
 col21 | col22 | emaj_verb | emaj_tuple | emaj_gid 
-------+-------+-----------+------------+----------
     1 | ABC   | INS       | NEW        |       56
     2 | DEF   | INS       | NEW        |       59
(2 rows)

select col20, col21, emaj_verb, emaj_tuple, emaj_gid from emajb.myschema1_mytbl2b_log order by emaj_gid, emaj_tuple desc;
 col20 | col21 | emaj_verb | emaj_tuple | emaj_gid 
-------+-------+-----------+------------+----------
     1 |     1 | INS       | NEW        |       57
     2 |     2 | INS       | NEW        |       60
(2 rows)

select col31, col33, emaj_verb, emaj_tuple, emaj_gid from "emajC"."myschema1_myTbl3_log" order by emaj_gid, emaj_tuple desc;
 col31 | col33 | emaj_verb | emaj_tuple | emaj_gid 
-------+-------+-----------+------------+----------
     1 | 10.00 | INS       | NEW        |       61
     2 | 10.00 | INS       | NEW        |       62
     3 | 10.00 | INS       | NEW        |       63
     4 | 10.00 | INS       | NEW        |       64
     5 | 10.00 | INS       | NEW        |       65
     6 | 10.00 | INS       | NEW        |       66
     7 | 10.00 | INS       | NEW        |       67
     8 | 10.00 | INS       | NEW        |       68
     9 | 10.00 | INS       | NEW        |       69
    10 | 10.00 | INS       | NEW        |       70
(10 rows)

select col41, col42, col43, col44, col45, emaj_verb, emaj_tuple, emaj_gid from emaj.myschema1_myTbl4_log order by emaj_gid, emaj_tuple desc;
 col41 | col42 | col43 | col44 |   col45    | emaj_verb | emaj_tuple | emaj_gid 
-------+-------+-------+-------+------------+-----------+------------+----------
     1 | FK... |     1 |     1 | ABC        | INS       | NEW        |       71
(1 row)

-- logged rollback #1
alter table mySchema1.myTbl2 disable trigger myTbl2trg;
select emaj.emaj_logged_rollback_group('myGroup1','Mark12');
 emaj_logged_rollback_group 
----------------------------
                          4
(1 row)

alter table mySchema1.myTbl2 enable trigger myTbl2trg;
-- check impact
select mark_id, mark_group, regexp_replace(mark_name,E'\\d\\d\.\\d\\d\\.\\d\\d\\.\\d\\d\\d','%','g'), mark_time_id, mark_is_deleted, mark_is_rlbk_protected, mark_comment, mark_log_rows_before_next, mark_logged_rlbk_target_mark from emaj.emaj_mark order by mark_id;
 mark_id |    mark_group    |   regexp_replace    | mark_time_id | mark_is_deleted | mark_is_rlbk_protected |              mark_comment              | mark_log_rows_before_next | mark_logged_rlbk_target_mark 
---------+------------------+---------------------+--------------+-----------------+------------------------+----------------------------------------+---------------------------+------------------------------
    2006 | emptyGroup       | SM2                 |         2006 | f               | f                      | a comment on a mark for an empty group |                         0 | Mark1
    2021 | emptyGroup       | EGM3                |         2016 | f               | f                      |                                        |                         0 | 
    2022 | emptyGroup       | EGM4                |         2017 | f               | f                      |                                        |                           | 
    2023 | phil's group#3", | Mark4               |         2018 | f               | f                      |                                        |                           | 
    3030 | myGroup2         | Mark21              |         3031 | f               | f                      |                                        |                           | 
    3034 | myGroup1         | Mark11              |         3037 | f               | f                      |                                        |                        19 | 
    3035 | myGroup1         | Mark12              |         3038 | f               | f                      |                                        |                        11 | 
    3036 | myGroup1         | Mark13              |         3039 | f               | f                      |                                        |                         0 | 
    3037 | myGroup1         | RLBK_Mark12_%_START |         3040 | f               | f                      |                                        |                        11 | 
    3038 | myGroup1         | RLBK_Mark12_%_DONE  |         3041 | f               | f                      |                                        |                           | Mark12
(10 rows)

select sequ_schema, sequ_name, sequ_time_id, sequ_last_val, sequ_is_called from emaj.emaj_sequence order by sequ_time_id, sequ_schema, sequ_name;
  sequ_schema   |             sequ_name              | sequ_time_id | sequ_last_val | sequ_is_called 
----------------+------------------------------------+--------------+---------------+----------------
 emaj           | phil's schema3_myTbl2\_log_seq     |         2018 |             1 | f
 emaj #'3       | phil's schema3_phil's tbl1_log_seq |         2018 |             1 | f
 phil's schema3 | myTbl2\_col21_seq                  |         2018 |             1 | f
 phil's schema3 | phil's seq\1                       |         2018 |          1000 | f
 emaj           | myschema2_mytbl1_log_seq           |         3031 |             1 | f
 emaj           | myschema2_mytbl2_log_seq           |         3031 |             1 | f
 emaj           | myschema2_mytbl4_log_seq           |         3031 |             1 | f
 emaj           | myschema2_mytbl6_log_seq           |         3031 |             1 | f
 emaj           | otherPrefix4mytbl5_log_seq         |         3031 |             1 | f
 emajC          | myschema2_myTbl3_log_seq           |         3031 |             1 | f
 myschema2      | myseq1                             |         3031 |          1000 | f
 myschema2      | myTbl3_col31_seq                   |         3031 |             1 | f
 emaj           | myschema1_mytbl1_log_seq           |         3037 |            15 | t
 emaj           | myschema1_mytbl2_log_seq           |         3037 |             6 | t
 emaj           | myschema1_mytbl4_log_seq           |         3037 |             2 | t
 emajb          | myschema1_mytbl2b_log_seq          |         3037 |             6 | t
 emajC          | myschema1_myTbl3_log_seq           |         3037 |            10 | t
 myschema1      | mytbl2b_col20_seq                  |         3037 |             1 | f
 myschema1      | myTbl3_col31_seq                   |         3037 |             1 | f
 emaj           | myschema1_mytbl1_log_seq           |         3038 |            30 | t
 emaj           | myschema1_mytbl2_log_seq           |         3038 |             8 | t
 emaj           | myschema1_mytbl4_log_seq           |         3038 |             2 | t
 emajb          | myschema1_mytbl2b_log_seq          |         3038 |             8 | t
 emajC          | myschema1_myTbl3_log_seq           |         3038 |            10 | t
 myschema1      | mytbl2b_col20_seq                  |         3038 |             2 | t
 myschema1      | myTbl3_col31_seq                   |         3038 |             1 | f
 emaj           | myschema1_mytbl1_log_seq           |         3039 |            30 | t
 emaj           | myschema1_mytbl2_log_seq           |         3039 |             8 | t
 emaj           | myschema1_mytbl4_log_seq           |         3039 |             3 | t
 emajb          | myschema1_mytbl2b_log_seq          |         3039 |             8 | t
 emajC          | myschema1_myTbl3_log_seq           |         3039 |            20 | t
 myschema1      | mytbl2b_col20_seq                  |         3039 |             2 | t
 myschema1      | myTbl3_col31_seq                   |         3039 |            10 | t
 emaj           | myschema1_mytbl1_log_seq           |         3040 |            30 | t
 emaj           | myschema1_mytbl2_log_seq           |         3040 |             8 | t
 emaj           | myschema1_mytbl4_log_seq           |         3040 |             3 | t
 emajb          | myschema1_mytbl2b_log_seq          |         3040 |             8 | t
 emajC          | myschema1_myTbl3_log_seq           |         3040 |            20 | t
 myschema1      | mytbl2b_col20_seq                  |         3040 |             2 | t
 myschema1      | myTbl3_col31_seq                   |         3040 |            10 | t
 emaj           | myschema1_mytbl1_log_seq           |         3041 |            30 | t
 emaj           | myschema1_mytbl2_log_seq           |         3041 |             8 | t
 emaj           | myschema1_mytbl4_log_seq           |         3041 |             4 | t
 emajb          | myschema1_mytbl2b_log_seq          |         3041 |             8 | t
 emajC          | myschema1_myTbl3_log_seq           |         3041 |            30 | t
 myschema1      | mytbl2b_col20_seq                  |         3041 |             2 | t
 myschema1      | myTbl3_col31_seq                   |         3041 |             1 | f
(47 rows)

select sqhl_schema, sqhl_table, sqhl_begin_time_id, sqhl_end_time_id, sqhl_hole_size from emaj.emaj_seq_hole order by 1,2,3;
 sqhl_schema | sqhl_table | sqhl_begin_time_id | sqhl_end_time_id | sqhl_hole_size 
-------------+------------+--------------------+------------------+----------------
(0 rows)

select col31, col33, emaj_verb, emaj_tuple, emaj_gid from "emajC"."myschema1_myTbl3_log" order by emaj_gid, emaj_tuple desc;
 col31 | col33 | emaj_verb | emaj_tuple | emaj_gid 
-------+-------+-----------+------------+----------
     1 | 10.00 | INS       | NEW        |       61
     2 | 10.00 | INS       | NEW        |       62
     3 | 10.00 | INS       | NEW        |       63
     4 | 10.00 | INS       | NEW        |       64
     5 | 10.00 | INS       | NEW        |       65
     6 | 10.00 | INS       | NEW        |       66
     7 | 10.00 | INS       | NEW        |       67
     8 | 10.00 | INS       | NEW        |       68
     9 | 10.00 | INS       | NEW        |       69
    10 | 10.00 | INS       | NEW        |       70
     6 | 10.00 | DEL       | OLD        |       72
     4 | 10.00 | DEL       | OLD        |       73
     5 | 10.00 | DEL       | OLD        |       74
     8 | 10.00 | DEL       | OLD        |       75
     1 | 10.00 | DEL       | OLD        |       76
     2 | 10.00 | DEL       | OLD        |       77
     9 | 10.00 | DEL       | OLD        |       78
     3 | 10.00 | DEL       | OLD        |       79
     7 | 10.00 | DEL       | OLD        |       80
    10 | 10.00 | DEL       | OLD        |       81
(20 rows)

select col41, col42, col43, col44, col45, emaj_verb, emaj_tuple, emaj_gid from emaj.myschema1_myTbl4_log order by emaj_gid, emaj_tuple desc;
 col41 | col42 | col43 | col44 |   col45    | emaj_verb | emaj_tuple | emaj_gid 
-------+-------+-------+-------+------------+-----------+------------+----------
     1 | FK... |     1 |     1 | ABC        | INS       | NEW        |       71
     1 | FK... |     1 |     1 | ABC        | DEL       | OLD        |       82
(2 rows)

select col31, col33 from myschema1."myTbl3" order by col31;
 col31 | col33 
-------+-------
(0 rows)

select col41, col42, col43, col44, col45 from myschema1.myTbl4 order by col41;
 col41 | col42 | col43 | col44 | col45 
-------+-------+-------+-------+-------
(0 rows)

-- logged rollback #2
alter table mySchema1.myTbl2 disable trigger myTbl2trg;
select emaj.emaj_logged_rollback_group('myGroup1','Mark11');
 emaj_logged_rollback_group 
----------------------------
                          7
(1 row)

alter table mySchema1.myTbl2 enable trigger myTbl2trg;
-- check impact
select mark_id, mark_group, regexp_replace(mark_name,E'\\d\\d\.\\d\\d\\.\\d\\d\\.\\d\\d\\d','%','g'), mark_time_id, mark_is_deleted, mark_is_rlbk_protected, mark_comment, mark_log_rows_before_next, mark_logged_rlbk_target_mark from emaj.emaj_mark order by mark_id;
 mark_id |    mark_group    |   regexp_replace    | mark_time_id | mark_is_deleted | mark_is_rlbk_protected |              mark_comment              | mark_log_rows_before_next | mark_logged_rlbk_target_mark 
---------+------------------+---------------------+--------------+-----------------+------------------------+----------------------------------------+---------------------------+------------------------------
    2006 | emptyGroup       | SM2                 |         2006 | f               | f                      | a comment on a mark for an empty group |                         0 | Mark1
    2021 | emptyGroup       | EGM3                |         2016 | f               | f                      |                                        |                         0 | 
    2022 | emptyGroup       | EGM4                |         2017 | f               | f                      |                                        |                           | 
    2023 | phil's group#3", | Mark4               |         2018 | f               | f                      |                                        |                           | 
    3030 | myGroup2         | Mark21              |         3031 | f               | f                      |                                        |                           | 
    3034 | myGroup1         | Mark11              |         3037 | f               | f                      |                                        |                        19 | 
    3035 | myGroup1         | Mark12              |         3038 | f               | f                      |                                        |                        11 | 
    3036 | myGroup1         | Mark13              |         3039 | f               | f                      |                                        |                         0 | 
    3037 | myGroup1         | RLBK_Mark12_%_START |         3040 | f               | f                      |                                        |                        11 | 
    3038 | myGroup1         | RLBK_Mark12_%_DONE  |         3041 | f               | f                      |                                        |                         0 | Mark12
    3039 | myGroup1         | RLBK_Mark11_%_START |         3042 | f               | f                      |                                        |                        14 | 
    3040 | myGroup1         | RLBK_Mark11_%_DONE  |         3043 | f               | f                      |                                        |                           | Mark11
(12 rows)

select sequ_schema, sequ_name, sequ_time_id, sequ_last_val, sequ_is_called from emaj.emaj_sequence order by sequ_time_id, sequ_schema, sequ_name;
  sequ_schema   |             sequ_name              | sequ_time_id | sequ_last_val | sequ_is_called 
----------------+------------------------------------+--------------+---------------+----------------
 emaj           | phil's schema3_myTbl2\_log_seq     |         2018 |             1 | f
 emaj #'3       | phil's schema3_phil's tbl1_log_seq |         2018 |             1 | f
 phil's schema3 | myTbl2\_col21_seq                  |         2018 |             1 | f
 phil's schema3 | phil's seq\1                       |         2018 |          1000 | f
 emaj           | myschema2_mytbl1_log_seq           |         3031 |             1 | f
 emaj           | myschema2_mytbl2_log_seq           |         3031 |             1 | f
 emaj           | myschema2_mytbl4_log_seq           |         3031 |             1 | f
 emaj           | myschema2_mytbl6_log_seq           |         3031 |             1 | f
 emaj           | otherPrefix4mytbl5_log_seq         |         3031 |             1 | f
 emajC          | myschema2_myTbl3_log_seq           |         3031 |             1 | f
 myschema2      | myseq1                             |         3031 |          1000 | f
 myschema2      | myTbl3_col31_seq                   |         3031 |             1 | f
 emaj           | myschema1_mytbl1_log_seq           |         3037 |            15 | t
 emaj           | myschema1_mytbl2_log_seq           |         3037 |             6 | t
 emaj           | myschema1_mytbl4_log_seq           |         3037 |             2 | t
 emajb          | myschema1_mytbl2b_log_seq          |         3037 |             6 | t
 emajC          | myschema1_myTbl3_log_seq           |         3037 |            10 | t
 myschema1      | mytbl2b_col20_seq                  |         3037 |             1 | f
 myschema1      | myTbl3_col31_seq                   |         3037 |             1 | f
 emaj           | myschema1_mytbl1_log_seq           |         3038 |            30 | t
 emaj           | myschema1_mytbl2_log_seq           |         3038 |             8 | t
 emaj           | myschema1_mytbl4_log_seq           |         3038 |             2 | t
 emajb          | myschema1_mytbl2b_log_seq          |         3038 |             8 | t
 emajC          | myschema1_myTbl3_log_seq           |         3038 |            10 | t
 myschema1      | mytbl2b_col20_seq                  |         3038 |             2 | t
 myschema1      | myTbl3_col31_seq                   |         3038 |             1 | f
 emaj           | myschema1_mytbl1_log_seq           |         3039 |            30 | t
 emaj           | myschema1_mytbl2_log_seq           |         3039 |             8 | t
 emaj           | myschema1_mytbl4_log_seq           |         3039 |             3 | t
 emajb          | myschema1_mytbl2b_log_seq          |         3039 |             8 | t
 emajC          | myschema1_myTbl3_log_seq           |         3039 |            20 | t
 myschema1      | mytbl2b_col20_seq                  |         3039 |             2 | t
 myschema1      | myTbl3_col31_seq                   |         3039 |            10 | t
 emaj           | myschema1_mytbl1_log_seq           |         3040 |            30 | t
 emaj           | myschema1_mytbl2_log_seq           |         3040 |             8 | t
 emaj           | myschema1_mytbl4_log_seq           |         3040 |             3 | t
 emajb          | myschema1_mytbl2b_log_seq          |         3040 |             8 | t
 emajC          | myschema1_myTbl3_log_seq           |         3040 |            20 | t
 myschema1      | mytbl2b_col20_seq                  |         3040 |             2 | t
 myschema1      | myTbl3_col31_seq                   |         3040 |            10 | t
 emaj           | myschema1_mytbl1_log_seq           |         3041 |            30 | t
 emaj           | myschema1_mytbl2_log_seq           |         3041 |             8 | t
 emaj           | myschema1_mytbl4_log_seq           |         3041 |             4 | t
 emajb          | myschema1_mytbl2b_log_seq          |         3041 |             8 | t
 emajC          | myschema1_myTbl3_log_seq           |         3041 |            30 | t
 myschema1      | mytbl2b_col20_seq                  |         3041 |             2 | t
 myschema1      | myTbl3_col31_seq                   |         3041 |             1 | f
 emaj           | myschema1_mytbl1_log_seq           |         3042 |            30 | t
 emaj           | myschema1_mytbl2_log_seq           |         3042 |             8 | t
 emaj           | myschema1_mytbl4_log_seq           |         3042 |             4 | t
 emajb          | myschema1_mytbl2b_log_seq          |         3042 |             8 | t
 emajC          | myschema1_myTbl3_log_seq           |         3042 |            30 | t
 myschema1      | mytbl2b_col20_seq                  |         3042 |             2 | t
 myschema1      | myTbl3_col31_seq                   |         3042 |             1 | f
 emaj           | myschema1_mytbl1_log_seq           |         3043 |            40 | t
 emaj           | myschema1_mytbl2_log_seq           |         3043 |            10 | t
 emaj           | myschema1_mytbl4_log_seq           |         3043 |             4 | t
 emajb          | myschema1_mytbl2b_log_seq          |         3043 |            10 | t
 emajC          | myschema1_myTbl3_log_seq           |         3043 |            30 | t
 myschema1      | mytbl2b_col20_seq                  |         3043 |             1 | f
 myschema1      | myTbl3_col31_seq                   |         3043 |             1 | f
(61 rows)

select sqhl_schema, sqhl_table, sqhl_begin_time_id, sqhl_end_time_id, sqhl_hole_size from emaj.emaj_seq_hole order by 1,2,3;
 sqhl_schema | sqhl_table | sqhl_begin_time_id | sqhl_end_time_id | sqhl_hole_size 
-------------+------------+--------------------+------------------+----------------
(0 rows)

select col11, col12, col13, emaj_verb, emaj_tuple, emaj_gid from emaj.myschema1_myTbl1_log order by emaj_gid, emaj_tuple desc;
 col11 |   col12    | col13 | emaj_verb | emaj_tuple | emaj_gid 
-------+------------+-------+-----------+------------+----------
     1 | ABC        | \x0c  | INS       | NEW        |       42
     2 | ABC        | \x0c  | INS       | NEW        |       43
     3 | ABC        | \x0c  | INS       | NEW        |       44
     4 | ABC        | \x0c  | INS       | NEW        |       45
     5 | ABC        | \x0c  | INS       | NEW        |       46
     6 | ABC        | \x0c  | INS       | NEW        |       47
     7 | ABC        | \x0c  | INS       | NEW        |       48
     8 | ABC        | \x0c  | INS       | NEW        |       49
     9 | ABC        | \x0c  | INS       | NEW        |       50
    10 | ABC        | \x0c  | INS       | NEW        |       51
    11 | ABC        | \x0c  | INS       | NEW        |       52
     1 | ABC        | \x0c  | UPD       | OLD        |       53
     1 | ABC        | \x1c  | UPD       | NEW        |       53
     2 | ABC        | \x0c  | UPD       | OLD        |       54
     2 | ABC        | \x1c  | UPD       | NEW        |       54
     3 | ABC        | \x0c  | UPD       | OLD        |       55
     3 | ABC        | \x1c  | UPD       | NEW        |       55
    11 | ABC        | \x0c  | DEL       | OLD        |       58
     1 | ABC        | \x1c  | DEL       | OLD        |       83
     2 | ABC        | \x1c  | DEL       | OLD        |       84
     3 | ABC        | \x1c  | DEL       | OLD        |       85
     4 | ABC        | \x0c  | DEL       | OLD        |       86
     5 | ABC        | \x0c  | DEL       | OLD        |       87
     6 | ABC        | \x0c  | DEL       | OLD        |       88
     7 | ABC        | \x0c  | DEL       | OLD        |       89
     8 | ABC        | \x0c  | DEL       | OLD        |       90
     9 | ABC        | \x0c  | DEL       | OLD        |       91
    10 | ABC        | \x0c  | DEL       | OLD        |       92
(28 rows)

select col21, col22, emaj_verb, emaj_tuple, emaj_gid from emaj.myschema1_myTbl2_log order by emaj_gid, emaj_tuple desc;
 col21 | col22 | emaj_verb | emaj_tuple | emaj_gid 
-------+-------+-----------+------------+----------
     1 | ABC   | INS       | NEW        |       56
     2 | DEF   | INS       | NEW        |       59
     1 | ABC   | DEL       | OLD        |       93
     2 | DEF   | DEL       | OLD        |       94
(4 rows)

select col20, col21, emaj_verb, emaj_tuple, emaj_gid from emajb.myschema1_myTbl2b_log order by emaj_gid, emaj_tuple desc;
 col20 | col21 | emaj_verb | emaj_tuple | emaj_gid 
-------+-------+-----------+------------+----------
     1 |     1 | INS       | NEW        |       57
     2 |     2 | INS       | NEW        |       60
     1 |     1 | DEL       | OLD        |       95
     2 |     2 | DEL       | OLD        |       96
(4 rows)

select col11, col12, col13 from myschema1.myTbl1 order by col11, col12;
 col11 | col12 | col13 
-------+-------+-------
(0 rows)

select col21, col22 from myschema1.myTbl2 order by col21;
 col21 | col22 
-------+-------
(0 rows)

select col20, col21 from myschema1.myTbl2b order by col20;
 col20 | col21 
-------+-------
(0 rows)

-----------------------------
-- unlogged rollback of logged rollbacks #3
-----------------------------
alter table mySchema1.myTbl2 disable trigger myTbl2trg;
select emaj.emaj_rollback_group('myGroup1','Mark13');
 emaj_rollback_group 
---------------------
                   7
(1 row)

alter table mySchema1.myTbl2 enable trigger myTbl2trg;
-- check impact
select mark_id, mark_group, regexp_replace(mark_name,E'\\d\\d\.\\d\\d\\.\\d\\d\\.\\d\\d\\d','%','g'), mark_time_id, mark_is_deleted, mark_is_rlbk_protected, mark_comment, mark_log_rows_before_next, mark_logged_rlbk_target_mark from emaj.emaj_mark order by mark_id;
 mark_id |    mark_group    | regexp_replace | mark_time_id | mark_is_deleted | mark_is_rlbk_protected |              mark_comment              | mark_log_rows_before_next | mark_logged_rlbk_target_mark 
---------+------------------+----------------+--------------+-----------------+------------------------+----------------------------------------+---------------------------+------------------------------
    2006 | emptyGroup       | SM2            |         2006 | f               | f                      | a comment on a mark for an empty group |                         0 | Mark1
    2021 | emptyGroup       | EGM3           |         2016 | f               | f                      |                                        |                         0 | 
    2022 | emptyGroup       | EGM4           |         2017 | f               | f                      |                                        |                           | 
    2023 | phil's group#3", | Mark4          |         2018 | f               | f                      |                                        |                           | 
    3030 | myGroup2         | Mark21         |         3031 | f               | f                      |                                        |                           | 
    3034 | myGroup1         | Mark11         |         3037 | f               | f                      |                                        |                        19 | 
    3035 | myGroup1         | Mark12         |         3038 | f               | f                      |                                        |                        11 | 
    3036 | myGroup1         | Mark13         |         3039 | f               | f                      |                                        |                           | 
(8 rows)

select sequ_schema, sequ_name, sequ_time_id, sequ_last_val, sequ_is_called from emaj.emaj_sequence order by sequ_time_id, sequ_schema, sequ_name;
  sequ_schema   |             sequ_name              | sequ_time_id | sequ_last_val | sequ_is_called 
----------------+------------------------------------+--------------+---------------+----------------
 emaj           | phil's schema3_myTbl2\_log_seq     |         2018 |             1 | f
 emaj #'3       | phil's schema3_phil's tbl1_log_seq |         2018 |             1 | f
 phil's schema3 | myTbl2\_col21_seq                  |         2018 |             1 | f
 phil's schema3 | phil's seq\1                       |         2018 |          1000 | f
 emaj           | myschema2_mytbl1_log_seq           |         3031 |             1 | f
 emaj           | myschema2_mytbl2_log_seq           |         3031 |             1 | f
 emaj           | myschema2_mytbl4_log_seq           |         3031 |             1 | f
 emaj           | myschema2_mytbl6_log_seq           |         3031 |             1 | f
 emaj           | otherPrefix4mytbl5_log_seq         |         3031 |             1 | f
 emajC          | myschema2_myTbl3_log_seq           |         3031 |             1 | f
 myschema2      | myseq1                             |         3031 |          1000 | f
 myschema2      | myTbl3_col31_seq                   |         3031 |             1 | f
 emaj           | myschema1_mytbl1_log_seq           |         3037 |            15 | t
 emaj           | myschema1_mytbl2_log_seq           |         3037 |             6 | t
 emaj           | myschema1_mytbl4_log_seq           |         3037 |             2 | t
 emajb          | myschema1_mytbl2b_log_seq          |         3037 |             6 | t
 emajC          | myschema1_myTbl3_log_seq           |         3037 |            10 | t
 myschema1      | mytbl2b_col20_seq                  |         3037 |             1 | f
 myschema1      | myTbl3_col31_seq                   |         3037 |             1 | f
 emaj           | myschema1_mytbl1_log_seq           |         3038 |            30 | t
 emaj           | myschema1_mytbl2_log_seq           |         3038 |             8 | t
 emaj           | myschema1_mytbl4_log_seq           |         3038 |             2 | t
 emajb          | myschema1_mytbl2b_log_seq          |         3038 |             8 | t
 emajC          | myschema1_myTbl3_log_seq           |         3038 |            10 | t
 myschema1      | mytbl2b_col20_seq                  |         3038 |             2 | t
 myschema1      | myTbl3_col31_seq                   |         3038 |             1 | f
 emaj           | myschema1_mytbl1_log_seq           |         3039 |            30 | t
 emaj           | myschema1_mytbl2_log_seq           |         3039 |             8 | t
 emaj           | myschema1_mytbl4_log_seq           |         3039 |             3 | t
 emajb          | myschema1_mytbl2b_log_seq          |         3039 |             8 | t
 emajC          | myschema1_myTbl3_log_seq           |         3039 |            20 | t
 myschema1      | mytbl2b_col20_seq                  |         3039 |             2 | t
 myschema1      | myTbl3_col31_seq                   |         3039 |            10 | t
(33 rows)

select sqhl_schema, sqhl_table, sqhl_begin_time_id, sqhl_end_time_id, sqhl_hole_size from emaj.emaj_seq_hole order by 1,2,3;
 sqhl_schema | sqhl_table | sqhl_begin_time_id | sqhl_end_time_id | sqhl_hole_size 
-------------+------------+--------------------+------------------+----------------
 myschema1   | mytbl1     |               3039 |             3044 |             10
 myschema1   | mytbl2     |               3039 |             3044 |              2
 myschema1   | mytbl2b    |               3039 |             3044 |              2
 myschema1   | myTbl3     |               3039 |             3044 |             10
 myschema1   | mytbl4     |               3039 |             3044 |              1
(5 rows)

select col11, col12, col13, emaj_verb, emaj_tuple, emaj_gid from emaj.myschema1_myTbl1_log order by emaj_gid, emaj_tuple desc;
 col11 |   col12    | col13 | emaj_verb | emaj_tuple | emaj_gid 
-------+------------+-------+-----------+------------+----------
     1 | ABC        | \x0c  | INS       | NEW        |       42
     2 | ABC        | \x0c  | INS       | NEW        |       43
     3 | ABC        | \x0c  | INS       | NEW        |       44
     4 | ABC        | \x0c  | INS       | NEW        |       45
     5 | ABC        | \x0c  | INS       | NEW        |       46
     6 | ABC        | \x0c  | INS       | NEW        |       47
     7 | ABC        | \x0c  | INS       | NEW        |       48
     8 | ABC        | \x0c  | INS       | NEW        |       49
     9 | ABC        | \x0c  | INS       | NEW        |       50
    10 | ABC        | \x0c  | INS       | NEW        |       51
    11 | ABC        | \x0c  | INS       | NEW        |       52
     1 | ABC        | \x0c  | UPD       | OLD        |       53
     1 | ABC        | \x1c  | UPD       | NEW        |       53
     2 | ABC        | \x0c  | UPD       | OLD        |       54
     2 | ABC        | \x1c  | UPD       | NEW        |       54
     3 | ABC        | \x0c  | UPD       | OLD        |       55
     3 | ABC        | \x1c  | UPD       | NEW        |       55
    11 | ABC        | \x0c  | DEL       | OLD        |       58
(18 rows)

select col21, col22, emaj_verb, emaj_tuple, emaj_gid from emaj.myschema1_myTbl2_log order by emaj_gid, emaj_tuple desc;
 col21 | col22 | emaj_verb | emaj_tuple | emaj_gid 
-------+-------+-----------+------------+----------
     1 | ABC   | INS       | NEW        |       56
     2 | DEF   | INS       | NEW        |       59
(2 rows)

select col20, col21, emaj_verb, emaj_tuple, emaj_gid from emajb.myschema1_myTbl2b_log order by emaj_gid, emaj_tuple desc;
 col20 | col21 | emaj_verb | emaj_tuple | emaj_gid 
-------+-------+-----------+------------+----------
     1 |     1 | INS       | NEW        |       57
     2 |     2 | INS       | NEW        |       60
(2 rows)

select col11, col12, col13 from myschema1.myTbl1 order by col11, col12;
 col11 |   col12    | col13 
-------+------------+-------
     1 | ABC        | \x1c
     2 | ABC        | \x1c
     3 | ABC        | \x1c
     4 | ABC        | \x0c
     5 | ABC        | \x0c
     6 | ABC        | \x0c
     7 | ABC        | \x0c
     8 | ABC        | \x0c
     9 | ABC        | \x0c
    10 | ABC        | \x0c
(10 rows)

select col21, col22 from myschema1.myTbl2 order by col21;
 col21 | col22 
-------+-------
     1 | ABC
     2 | DEF
(2 rows)

select col20, col21 from myschema1.myTbl2b order by col20;
 col20 | col21 
-------+-------
     1 |     1
     2 |     2
(2 rows)

-----------------------------
-- rollback an empty group
-----------------------------
select emaj.emaj_rollback_group('emptyGroup','EGM4');
 emaj_rollback_group 
---------------------
                   0
(1 row)

select emaj.emaj_logged_rollback_group('emptyGroup','EGM3');
 emaj_logged_rollback_group 
----------------------------
                          0
(1 row)

-----------------------------
-- test use of partitionned tables
-----------------------------
select emaj.emaj_start_group('myGroup4','myGroup4_start');
 emaj_start_group 
------------------
                5
(1 row)

insert into myschema4.myTblM values ('2001-09-11',0,'abc'),('2011-09-11',10,'def'),('2021-09-11',20,'ghi');
insert into myschema4.myTblP values (-1,'abc'),(0,'def'),(1,'ghi');
select emaj.emaj_set_mark_group('myGroup4','mark1');
 emaj_set_mark_group 
---------------------
                   5
(1 row)

delete from myschema4.myTblM;
update myschema4.myTblP set col2 = 'DEF' where col1 = 0;
select emaj.emaj_logged_rollback_group('myGroup4','mark1');
 emaj_logged_rollback_group 
----------------------------
                          3
(1 row)

select col1, col2, col3, emaj_verb, emaj_tuple, emaj_gid from emaj.myschema4_mytblm_log;
    col1    | col2 | col3 | emaj_verb | emaj_tuple | emaj_gid 
------------+------+------+-----------+------------+----------
 09-11-2021 |   20 | ghi  | INS       | NEW        |       99
 09-11-2021 |   20 | ghi  | DEL       | OLD        |      100
 09-11-2021 |   20 | ghi  | INS       | NEW        |      105
(3 rows)

select col1, col2, col3, emaj_verb, emaj_tuple, emaj_gid from emaj.myschema4_mytblc1_log;
    col1    | col2 | col3 | emaj_verb | emaj_tuple | emaj_gid 
------------+------+------+-----------+------------+----------
 09-11-2001 |    0 | abc  | INS       | NEW        |       97
 09-11-2001 |    0 | abc  | DEL       | OLD        |      101
 09-11-2001 |    0 | abc  | INS       | NEW        |      103
(3 rows)

select col1, col2, col3, emaj_verb, emaj_tuple, emaj_gid from emaj.myschema4_mytblc2_log;
    col1    | col2 | col3 | emaj_verb | emaj_tuple | emaj_gid 
------------+------+------+-----------+------------+----------
 09-11-2011 |   10 | def  | INS       | NEW        |       98
 09-11-2011 |   10 | def  | DEL       | OLD        |      102
 09-11-2011 |   10 | def  | INS       | NEW        |      104
(3 rows)

select col1, col2, emaj_verb, emaj_tuple, emaj_gid from emaj.myschema4_mypartp1_log;          -- empty in pg 9.6-
 col1 | col2 | emaj_verb | emaj_tuple | emaj_gid 
------+------+-----------+------------+----------
(0 rows)

select col1, col2, emaj_verb, emaj_tuple, emaj_gid from emaj.myschema4_mypartp2_log;          -- empty in pg 9.6-
 col1 | col2 | emaj_verb | emaj_tuple | emaj_gid 
------+------+-----------+------------+----------
(0 rows)

-- use the functions dedicated to the ppa plugin
-- for an equivalent of "select * from emaj.emaj_rollback_group('myGroup4','myGroup4_start',true);"
select * from emaj._rlbk_async(emaj._rlbk_init(array['myGroup4'], 'myGroup4_start', false, 1, false, true), false);
 rlbk_severity |            rlbk_message             
---------------+-------------------------------------
 Notice        | 3 / 5 tables effectively processed.
(1 row)

-- and check the result
select rlbk_id, rlbk_groups, rlbk_mark, rlbk_time_id, rlbk_is_logged, rlbk_is_alter_group_allowed, rlbk_nb_session, rlbk_nb_table, rlbk_nb_sequence, 
       rlbk_eff_nb_table, rlbk_status, rlbk_messages
 from emaj.emaj_rlbk order by rlbk_id desc limit 1;
 rlbk_id | rlbk_groups |   rlbk_mark    | rlbk_time_id | rlbk_is_logged | rlbk_is_alter_group_allowed | rlbk_nb_session | rlbk_nb_table | rlbk_nb_sequence | rlbk_eff_nb_table | rlbk_status |                  rlbk_messages                  
---------+-------------+----------------+--------------+----------------+-----------------------------+-----------------+---------------+------------------+-------------------+-------------+-------------------------------------------------
      20 | {myGroup4}  | myGroup4_start |         3052 | f              | t                           |               1 |             5 |                0 |                 3 | COMPLETED   | {"Notice: 3 / 5 tables effectively processed."}
(1 row)

-----------------------------
-- test emaj_rollback_activity()
-----------------------------
-- insert necessary rows into rollback tables in order to test various cases of emaj_rollback_activity() reports.
-- these tests ares performed inside transactions that are then rolled back.
begin;
-- 1 rollback operation in EXECUTING state, but no rollback steps have started yet
  insert into emaj.emaj_time_stamp (time_id, time_tx_timestamp) values (-1, now()-'0.1 seconds'::interval);
  insert into emaj.emaj_time_stamp (time_id, time_clock_timestamp) values (-2, '2000-01-01 01:00:00');
  insert into emaj.emaj_rlbk (rlbk_id, rlbk_groups, rlbk_mark, rlbk_mark_time_id, rlbk_time_id, rlbk_is_logged, rlbk_is_alter_group_allowed, 
             rlbk_nb_session, rlbk_nb_table, rlbk_nb_sequence, rlbk_eff_nb_table, rlbk_status)
    values (1232,array['group1232'],'mark1232',-2,-1,true,false,
             1,5,4,3,'EXECUTING');
  insert into emaj.emaj_rlbk_plan (rlbp_rlbk_id, rlbp_step, rlbp_schema, rlbp_table, rlbp_fkey,
             rlbp_estimated_duration, rlbp_estimated_quantity, rlbp_start_datetime, rlbp_duration)
    values (1232, 'RLBK_TABLE','schema','t1','','50 seconds'::interval,null,null,null),
           (1232, 'RLBK_TABLE','schema','t2','','30 seconds'::interval,null,null,null),
           (1232, 'RLBK_TABLE','schema','t3','','20 seconds'::interval,null,null,null),
           (1232, 'CTRL+DBLINK','',     '',  '','0.3 second'::interval,3,   null,null);
  select rlbk_id, rlbk_status, rlbk_remaining, rlbk_completion_pct from emaj._rollback_activity();
 rlbk_id | rlbk_status |  rlbk_remaining   | rlbk_completion_pct 
---------+-------------+-------------------+---------------------
    1232 | EXECUTING   | @ 1 min 40.3 secs |                   0
(1 row)

-- the first RLBK_TABLE has started, but the elapse of the step is not yet > estimated duration 
  update emaj.emaj_time_stamp set time_tx_timestamp = now() - '11 seconds'::interval where time_id = -1;
  update emaj.emaj_rlbk_plan set rlbp_start_datetime = now() - '11 seconds'::interval
    where rlbp_rlbk_id = 1232 and rlbp_table = 't1';
  select rlbk_id, rlbk_status, rlbk_remaining, rlbk_completion_pct from emaj._rollback_activity();
 rlbk_id | rlbk_status |  rlbk_remaining   | rlbk_completion_pct 
---------+-------------+-------------------+---------------------
    1232 | EXECUTING   | @ 1 min 29.2 secs |                  11
(1 row)

  select 1.0 - ((20.0 + 30.0)+(50.0 - 11.0) + 2*0.3/3) / (11.1 + (20.0 + 30.0)+(50.0 - 11.0) + 2*0.3/3); -- the completion % should be 11%
        ?column?        
------------------------
 0.11066799601196410768
(1 row)

-- the first RLBK_TABLE is completed, and the step duration < the estimated duration 
  update emaj.emaj_time_stamp set time_tx_timestamp = now() - '45.1 seconds'::interval where time_id = -1;
  update emaj.emaj_rlbk_plan set rlbp_start_datetime = now() - '45 seconds'::interval,
                                 rlbp_duration = '45 seconds'::interval
    where rlbp_rlbk_id = 1232 and rlbp_table = 't1';
  select rlbk_id, rlbk_status, rlbk_remaining, rlbk_completion_pct from emaj._rollback_activity();
 rlbk_id | rlbk_status | rlbk_remaining | rlbk_completion_pct 
---------+-------------+----------------+---------------------
    1232 | EXECUTING   | @ 50.2 secs    |                  47
(1 row)

  select 1.0 - (20.0 + 30.0 + 2*0.3/3) / (45.1 + (20.0 + 30.0) + 2*0.3/3);  -- the completion % should be 47%
        ?column?        
------------------------
 0.47324239244491080797
(1 row)

-- the second RLBK_TABLE has started, but the elapse of the step is not yet > estimated duration 
  update emaj.emaj_time_stamp set time_tx_timestamp = now() - '73.1 seconds'::interval where time_id = -1;
  update emaj.emaj_rlbk_plan set rlbp_start_datetime = now() - '28 seconds'::interval
    where rlbp_rlbk_id = 1232 and rlbp_table = 't2';
  select rlbk_id, rlbk_status, rlbk_remaining, rlbk_completion_pct from emaj._rollback_activity();
 rlbk_id | rlbk_status | rlbk_remaining | rlbk_completion_pct 
---------+-------------+----------------+---------------------
    1232 | EXECUTING   | @ 22.1 secs    |                  77
(1 row)

  select 1.0 - (20.0 + (30.0 - 28.0) + 1*0.3/3) / (73.1 + (20.0 + (30.0 - 28.0) + 1*0.3/3));  -- the completion % should be 77%
        ?column?        
------------------------
 0.76785714285714285714
(1 row)

-- the second RLBK_TABLE has started, but the elapse of the step is already > estimated duration 
  update emaj.emaj_time_stamp set time_tx_timestamp = now() - '85.1 seconds'::interval where time_id = -1;
  update emaj.emaj_rlbk_plan set rlbp_start_datetime = now() - '40 seconds'::interval
    where rlbp_rlbk_id = 1232 and rlbp_table = 't2';
  select rlbk_id, rlbk_status, rlbk_remaining, rlbk_completion_pct from emaj._rollback_activity();
 rlbk_id | rlbk_status | rlbk_remaining | rlbk_completion_pct 
---------+-------------+----------------+---------------------
    1232 | EXECUTING   | @ 20.1 secs    |                  81
(1 row)

  select 1.0 - (20.0 + 1*0.3/3) / (85.1 + (20.0 + 1*0.3/3));  -- the completion % should be 81%
        ?column?        
------------------------
 0.80893536121673003802
(1 row)

-- the second RLBK_TABLE has started, but the elapse of the step is already > estimated duration 
  update emaj.emaj_time_stamp set time_tx_timestamp = now() - '105.1 seconds'::interval where time_id = -1;
  update emaj.emaj_rlbk_plan set rlbp_start_datetime = now() - '60 seconds'::interval
    where rlbp_rlbk_id = 1232 and rlbp_table = 't2';
  select rlbk_id, rlbk_status, rlbk_remaining, rlbk_completion_pct from emaj._rollback_activity();
 rlbk_id | rlbk_status | rlbk_remaining | rlbk_completion_pct 
---------+-------------+----------------+---------------------
    1232 | EXECUTING   | @ 20.1 secs    |                  84
(1 row)

  select 1.0 - (20.0 + 1*0.3/3) / (105.1 + (20.0 + 1*0.3/3 ));  -- the completion % should be 84%
        ?column?        
------------------------
 0.83945686900958466454
(1 row)

-- the second RLBK_TABLE is completed, and the step duration > the estimated duration 
  update emaj.emaj_time_stamp set time_tx_timestamp = now() - '110.1 seconds'::interval where time_id = -1;
  update emaj.emaj_rlbk_plan set rlbp_start_datetime = now() - '65 seconds'::interval,
                                 rlbp_duration = '65 seconds'::interval
    where rlbp_rlbk_id = 1232 and rlbp_table = 't2';
  select rlbk_id, rlbk_status, rlbk_remaining, rlbk_completion_pct from emaj._rollback_activity();
 rlbk_id | rlbk_status | rlbk_remaining | rlbk_completion_pct 
---------+-------------+----------------+---------------------
    1232 | EXECUTING   | @ 20.1 secs    |                  85
(1 row)

  select 1.0 - (20.0 + 1*0.3/3) / (110.1 + (20.0 + 1*0.3/3));  -- the completion % should be 85%
        ?column?        
------------------------
 0.84562211981566820276
(1 row)

-- the third RLBK_TABLE has started, and is almost completed 
  update emaj.emaj_time_stamp set time_tx_timestamp = now() - '124.1 seconds'::interval where time_id = -1;
  update emaj.emaj_rlbk_plan set rlbp_start_datetime = now() - '19 seconds'::interval
    where rlbp_rlbk_id = 1232 and rlbp_table = 't3';
  select rlbk_id, rlbk_status, rlbk_remaining, rlbk_completion_pct from emaj._rollback_activity();
 rlbk_id | rlbk_status | rlbk_remaining | rlbk_completion_pct 
---------+-------------+----------------+---------------------
    1232 | EXECUTING   | @ 1 sec        |                  99
(1 row)

  select 1.0 - ((20.0 - 19.0)) / (124.1 + (20.0 - 19.0));  -- the completion % should be 99%
        ?column?        
------------------------
 0.99200639488409272582
(1 row)

rollback;
begin;
-- 1 rollback operation in LOCKING state and without step other than LOCK_TABLE
  insert into emaj.emaj_time_stamp (time_id, time_tx_timestamp) values (-1, now()-'2 minutes'::interval);
  insert into emaj.emaj_time_stamp (time_id, time_clock_timestamp) values (-2, '2000-01-01 01:00:00');
  insert into emaj.emaj_rlbk (rlbk_id, rlbk_groups, rlbk_mark, rlbk_mark_time_id, rlbk_time_id, rlbk_is_logged, rlbk_is_alter_group_allowed, 
             rlbk_nb_session, rlbk_nb_table, rlbk_nb_sequence, rlbk_eff_nb_table, rlbk_status)
    values (1233,array['group1233'],'mark1233',-2,-1,true,false,
             1,5,4,3,'LOCKING');
  insert into emaj.emaj_rlbk_plan (rlbp_rlbk_id, rlbp_step, rlbp_schema, rlbp_table, rlbp_fkey,
             rlbp_estimated_duration, rlbp_start_datetime, rlbp_duration)
    values (1233, 'LOCK_TABLE','schema','t1','',null,null,null),
           (1233, 'LOCK_TABLE','schema','t2','',null,null,null),
           (1233, 'LOCK_TABLE','schema','t3','',null,null,null);
  select rlbk_id, rlbk_status, rlbk_elapse, rlbk_remaining, rlbk_completion_pct from emaj._rollback_activity();
 rlbk_id | rlbk_status | rlbk_elapse | rlbk_remaining | rlbk_completion_pct 
---------+-------------+-------------+----------------+---------------------
    1233 | LOCKING     | @ 2 mins    | @ 0            |                   0
(1 row)

-- the rollback operation in LOCKING state now has RLBK_TABLE steps
  insert into emaj.emaj_rlbk_plan (rlbp_rlbk_id, rlbp_step, rlbp_schema, rlbp_table, rlbp_fkey,
             rlbp_estimated_duration, rlbp_start_datetime, rlbp_duration)
    values (1233, 'RLBK_TABLE','schema','t1','','0:20:00'::interval,null,null),
           (1233, 'RLBK_TABLE','schema','t2','','0:02:00'::interval,null,null),
           (1233, 'RLBK_TABLE','schema','t3','','0:00:20'::interval,null,null);
  select rlbk_id, rlbk_status, rlbk_elapse, rlbk_remaining, rlbk_completion_pct from emaj._rollback_activity();
 rlbk_id | rlbk_status | rlbk_elapse |  rlbk_remaining   | rlbk_completion_pct 
---------+-------------+-------------+-------------------+---------------------
    1233 | LOCKING     | @ 2 mins    | @ 22 mins 20 secs |                   0
(1 row)

-- +1 rollback operation in PLANNING state
  insert into emaj.emaj_time_stamp (time_id, time_tx_timestamp) values (-3, now()-'1 minute'::interval);
  insert into emaj.emaj_rlbk (rlbk_id, rlbk_groups, rlbk_mark, rlbk_mark_time_id, rlbk_time_id, rlbk_is_logged, rlbk_is_alter_group_allowed, 
             rlbk_nb_session, rlbk_nb_table, rlbk_nb_sequence, rlbk_eff_nb_table, rlbk_status)
    values (1234,array['group1234'],'mark1234',-2,-3,true,false,
             1,5,4,3,'PLANNING');
  select rlbk_id, rlbk_groups, rlbk_mark, rlbk_mark_datetime, rlbk_is_logged, rlbk_nb_session, rlbk_nb_table,
         rlbk_nb_sequence, rlbk_eff_nb_table, rlbk_status, rlbk_elapse, rlbk_remaining, rlbk_completion_pct 
    from emaj._rollback_activity();
 rlbk_id | rlbk_groups | rlbk_mark |      rlbk_mark_datetime      | rlbk_is_logged | rlbk_nb_session | rlbk_nb_table | rlbk_nb_sequence | rlbk_eff_nb_table | rlbk_status | rlbk_elapse |  rlbk_remaining   | rlbk_completion_pct 
---------+-------------+-----------+------------------------------+----------------+-----------------+---------------+------------------+-------------------+-------------+-------------+-------------------+---------------------
    1233 | {group1233} | mark1233  | Sat Jan 01 01:00:00 2000 PST | t              |               1 |             5 |                4 |                 3 | LOCKING     | @ 2 mins    | @ 22 mins 20 secs |                   0
    1234 | {group1234} | mark1234  | Sat Jan 01 01:00:00 2000 PST | t              |               1 |             5 |                4 |                 3 | PLANNING    | @ 1 min     |                   |                   0
(2 rows)

rollback;
-----------------------------
-- test emaj_consolidate_rollback_group() and emaj_get_consolidable_rollbacks()
-----------------------------
-- group is NULL or unknown
select emaj.emaj_consolidate_rollback_group(NULL,NULL);
ERROR:  _check_group_names: No group to process.
CONTEXT:  SQL statement "SELECT emaj._check_group_names(v_groupNames := ARRAY[v_groupName], v_mayBeNull := FALSE, v_lockGroups := TRUE, v_checkList := '')"
PL/pgSQL function emaj.emaj_consolidate_rollback_group(text,text) line 15 at PERFORM
select emaj.emaj_consolidate_rollback_group('unknownGroup',NULL);
ERROR:  _check_group_names: The group "unknownGroup" does not exist.
CONTEXT:  SQL statement "SELECT emaj._check_group_names(v_groupNames := ARRAY[v_groupName], v_mayBeNull := FALSE, v_lockGroups := TRUE, v_checkList := '')"
PL/pgSQL function emaj.emaj_consolidate_rollback_group(text,text) line 15 at PERFORM
-- mark is unknown
select emaj.emaj_consolidate_rollback_group('myGroup1',NULL);
ERROR:  _check_mark_name: The mark "<NULL>" does not exist for the group "myGroup1".
CONTEXT:  SQL statement "SELECT emaj._check_mark_name(v_groupNames := ARRAY[v_groupName], v_mark := v_endRlbkMark, v_checkList := '')"
PL/pgSQL function emaj.emaj_consolidate_rollback_group(text,text) line 17 at SQL statement
select emaj.emaj_consolidate_rollback_group('myGroup1','unknown mark');
ERROR:  _check_mark_name: The mark "unknown mark" does not exist for the group "myGroup1".
CONTEXT:  SQL statement "SELECT emaj._check_mark_name(v_groupNames := ARRAY[v_groupName], v_mark := v_endRlbkMark, v_checkList := '')"
PL/pgSQL function emaj.emaj_consolidate_rollback_group(text,text) line 17 at SQL statement
-- mark is known but is not an end rollback mark
select emaj.emaj_consolidate_rollback_group('myGroup1','Mark12');
ERROR:  emaj_consolidate_rollback_group: The mark "Mark12" for the group "myGroup1" is not an end rollback mark.
-- mark is an end rollback mark but the rollback target mark is invalid
begin;
  update emaj.emaj_mark set mark_logged_rlbk_target_mark = 'dummy' where mark_name = 'Mark12';
  select emaj.emaj_consolidate_rollback_group('myGroup1','Mark12');
ERROR:  emaj_consolidate_rollback_group: The rollback target mark "dummy" for the group "myGroup1" has not been found.
rollback;
-- should be ok
set search_path=public,myschema1;
-- rollback without log rows to delete
select emaj.emaj_set_mark_group('myGroup1','Conso_M1');
 emaj_set_mark_group 
---------------------
                   7
(1 row)

select emaj.emaj_logged_rollback_group('myGroup1','Conso_M1');
 emaj_logged_rollback_group 
----------------------------
                          2
(1 row)

select emaj.emaj_consolidate_rollback_group('myGroup1','EMAJ_LAST_MARK');
 emaj_consolidate_rollback_group 
---------------------------------
                               2
(1 row)

-- mark Conso_M1, updates, mark Conso_M2, updates, logged rlbk back to Conso_M1, updates, rename both marks, consolidate, check and cancel
select emaj.emaj_set_mark_group('myGroup1','Conso_M2');
 emaj_set_mark_group 
---------------------
                   7
(1 row)

insert into myTbl1 select i, 'Test', 'Conso' from generate_series (1000,1011) as i;
insert into myTbl2 values (1000,'TC1',NULL);
delete from myTbl1 where col11 > 1010;
select emaj.emaj_set_mark_group('myGroup1','Conso_M3');
 emaj_set_mark_group 
---------------------
                   7
(1 row)

update myTbl2 set col22 = 'TC2' WHERE col22 ='TC1';
select emaj.emaj_logged_rollback_group('myGroup1','Conso_M2');
 emaj_logged_rollback_group 
----------------------------
                          5
(1 row)

insert into myTbl2 values (1000,'TC3',NULL);
select emaj.emaj_rename_mark_group('myGroup1','Conso_M2','Renamed_conso_M2');
 emaj_rename_mark_group 
------------------------
 
(1 row)

select emaj.emaj_rename_mark_group('myGroup1','EMAJ_LAST_MARK','Renamed_last_mark');
 emaj_rename_mark_group 
------------------------
 
(1 row)

select cons_group, cons_target_rlbk_mark_name, cons_target_rlbk_mark_id, 
       regexp_replace(cons_end_rlbk_mark_name,E'\\d\\d\.\\d\\d\\.\\d\\d\\.\\d\\d\\d','%','g'), cons_end_rlbk_mark_id, cons_rows, cons_marks 
  from emaj.emaj_get_consolidable_rollbacks();
 cons_group | cons_target_rlbk_mark_name | cons_target_rlbk_mark_id |    regexp_replace    | cons_end_rlbk_mark_id | cons_rows | cons_marks 
------------+----------------------------+--------------------------+----------------------+-----------------------+-----------+------------
 emptyGroup | EGM3                       |                     2021 | RLBK_EGM3_%_DONE     |                  3042 |         0 |          2
 myGroup1   | Conso_M1                   |                     3047 | RLBK_Conso_M1_%_DONE |                  3049 |         0 |          0
 myGroup1   | Renamed_conso_M2           |                     3050 | Renamed_last_mark    |                  3053 |        32 |          2
(3 rows)

select emaj.emaj_consolidate_rollback_group('myGroup1','Renamed_last_mark');
 emaj_consolidate_rollback_group 
---------------------------------
                               5
(1 row)

select cons_group, cons_target_rlbk_mark_name, cons_target_rlbk_mark_id, 
       regexp_replace(cons_end_rlbk_mark_name,E'\\d\\d\.\\d\\d\\.\\d\\d\\.\\d\\d\\d','%','g'), cons_end_rlbk_mark_id, cons_rows, cons_marks
  from emaj.emaj_get_consolidable_rollbacks();
 cons_group | cons_target_rlbk_mark_name | cons_target_rlbk_mark_id |    regexp_replace    | cons_end_rlbk_mark_id | cons_rows | cons_marks 
------------+----------------------------+--------------------------+----------------------+-----------------------+-----------+------------
 emptyGroup | EGM3                       |                     2021 | RLBK_EGM3_%_DONE     |                  3042 |         0 |          2
 myGroup1   | Conso_M1                   |                     3047 | RLBK_Conso_M1_%_DONE |                  3049 |         0 |          0
 myGroup1   | Renamed_conso_M2           |                     3050 | Renamed_last_mark    |                  3053 |         0 |          0
(3 rows)

-- consolidate a rollback already consolidated
select emaj.emaj_consolidate_rollback_group('myGroup1','Renamed_last_mark');
 emaj_consolidate_rollback_group 
---------------------------------
                               2
(1 row)

select mark_id, mark_group, regexp_replace(mark_name,E'\\d\\d\.\\d\\d\\.\\d\\d\\.\\d\\d\\d','%','g'), mark_time_id, mark_is_deleted, mark_is_rlbk_protected, mark_comment, mark_log_rows_before_next, mark_logged_rlbk_target_mark from emaj.emaj_mark where mark_group = 'myGroup1' order by mark_id;
 mark_id | mark_group |    regexp_replace    | mark_time_id | mark_is_deleted | mark_is_rlbk_protected | mark_comment | mark_log_rows_before_next | mark_logged_rlbk_target_mark 
---------+------------+----------------------+--------------+-----------------+------------------------+--------------+---------------------------+------------------------------
    3034 | myGroup1   | Mark11               |         3037 | f               | f                      |              |                        19 | 
    3035 | myGroup1   | Mark12               |         3038 | f               | f                      |              |                        11 | 
    3036 | myGroup1   | Mark13               |         3039 | f               | f                      |              |                         0 | 
    3047 | myGroup1   | Conso_M1             |         3053 | f               | f                      |              |                         0 | 
    3049 | myGroup1   | RLBK_Conso_M1_%_DONE |         3055 | f               | f                      |              |                         0 | Conso_M1
    3050 | myGroup1   | Renamed_conso_M2     |         3056 | f               | f                      |              |                         0 | 
    3053 | myGroup1   | Renamed_last_mark    |         3059 | f               | f                      |              |                           | Renamed_conso_M2
(7 rows)

select sequ_schema, sequ_name, sequ_time_id, sequ_last_val, sequ_is_called from emaj.emaj_sequence where sequ_name like 'myschema1%' order by sequ_time_id, sequ_schema, sequ_name;
 sequ_schema |         sequ_name         | sequ_time_id | sequ_last_val | sequ_is_called 
-------------+---------------------------+--------------+---------------+----------------
 emaj        | myschema1_mytbl1_log_seq  |         3037 |            15 | t
 emaj        | myschema1_mytbl2_log_seq  |         3037 |             6 | t
 emaj        | myschema1_mytbl4_log_seq  |         3037 |             2 | t
 emajb       | myschema1_mytbl2b_log_seq |         3037 |             6 | t
 emajC       | myschema1_myTbl3_log_seq  |         3037 |            10 | t
 emaj        | myschema1_mytbl1_log_seq  |         3038 |            30 | t
 emaj        | myschema1_mytbl2_log_seq  |         3038 |             8 | t
 emaj        | myschema1_mytbl4_log_seq  |         3038 |             2 | t
 emajb       | myschema1_mytbl2b_log_seq |         3038 |             8 | t
 emajC       | myschema1_myTbl3_log_seq  |         3038 |            10 | t
 emaj        | myschema1_mytbl1_log_seq  |         3039 |            30 | t
 emaj        | myschema1_mytbl2_log_seq  |         3039 |             8 | t
 emaj        | myschema1_mytbl4_log_seq  |         3039 |             3 | t
 emajb       | myschema1_mytbl2b_log_seq |         3039 |             8 | t
 emajC       | myschema1_myTbl3_log_seq  |         3039 |            20 | t
 emaj        | myschema1_mytbl1_log_seq  |         3053 |            40 | t
 emaj        | myschema1_mytbl2_log_seq  |         3053 |            10 | t
 emaj        | myschema1_mytbl4_log_seq  |         3053 |             4 | t
 emajb       | myschema1_mytbl2b_log_seq |         3053 |            10 | t
 emajC       | myschema1_myTbl3_log_seq  |         3053 |            30 | t
 emaj        | myschema1_mytbl1_log_seq  |         3055 |            40 | t
 emaj        | myschema1_mytbl2_log_seq  |         3055 |            10 | t
 emaj        | myschema1_mytbl4_log_seq  |         3055 |             4 | t
 emajb       | myschema1_mytbl2b_log_seq |         3055 |            10 | t
 emajC       | myschema1_myTbl3_log_seq  |         3055 |            30 | t
 emaj        | myschema1_mytbl1_log_seq  |         3056 |            40 | t
 emaj        | myschema1_mytbl2_log_seq  |         3056 |            10 | t
 emaj        | myschema1_mytbl4_log_seq  |         3056 |             4 | t
 emajb       | myschema1_mytbl2b_log_seq |         3056 |            10 | t
 emajC       | myschema1_myTbl3_log_seq  |         3056 |            30 | t
 emaj        | myschema1_mytbl1_log_seq  |         3059 |            64 | t
 emaj        | myschema1_mytbl2_log_seq  |         3059 |            13 | t
 emaj        | myschema1_mytbl4_log_seq  |         3059 |             4 | t
 emajb       | myschema1_mytbl2b_log_seq |         3059 |            15 | t
 emajC       | myschema1_myTbl3_log_seq  |         3059 |            30 | t
(35 rows)

select sqhl_schema, sqhl_table, sqhl_begin_time_id, sqhl_end_time_id, sqhl_hole_size from emaj.emaj_seq_hole where sqhl_schema = 'myschema1' order by 1,2,3;
 sqhl_schema | sqhl_table | sqhl_begin_time_id | sqhl_end_time_id | sqhl_hole_size 
-------------+------------+--------------------+------------------+----------------
 myschema1   | mytbl1     |               3039 |             3044 |             10
 myschema1   | mytbl1     |               3056 |             3059 |             24
 myschema1   | mytbl2     |               3039 |             3044 |              2
 myschema1   | mytbl2     |               3056 |             3059 |              3
 myschema1   | mytbl2b    |               3039 |             3044 |              2
 myschema1   | mytbl2b    |               3056 |             3059 |              5
 myschema1   | myTbl3     |               3039 |             3044 |             10
 myschema1   | mytbl4     |               3039 |             3044 |              1
(8 rows)

select emaj.emaj_rollback_group('myGroup1','Conso_M1');
 emaj_rollback_group 
---------------------
                   4
(1 row)

-- consolidate a stopped (and empty) group
begin;
  select emaj.emaj_rename_mark_group('emptyGroup','EMAJ_LAST_MARK','end_rlbk_mark');
 emaj_rename_mark_group 
------------------------
 
(1 row)

  select emaj.emaj_stop_group('emptyGroup','stop');
 emaj_stop_group 
-----------------
               0
(1 row)

  select * from emaj.emaj_get_consolidable_rollbacks();
 cons_group | cons_target_rlbk_mark_name | cons_target_rlbk_mark_id | cons_end_rlbk_mark_name | cons_end_rlbk_mark_id | cons_rows | cons_marks 
------------+----------------------------+--------------------------+-------------------------+-----------------------+-----------+------------
 emptyGroup | EGM3                       |                     2021 | end_rlbk_mark           |                  3042 |         0 |          2
(1 row)

  select emaj.emaj_consolidate_rollback_group('emptyGroup','end_rlbk_mark');
 emaj_consolidate_rollback_group 
---------------------------------
                               0
(1 row)

  select * from emaj.emaj_mark where mark_group = 'emptyGroup' order by mark_id;
 mark_group |   mark_name   | mark_id | mark_time_id | mark_is_deleted | mark_is_rlbk_protected |              mark_comment              | mark_log_rows_before_next | mark_logged_rlbk_target_mark 
------------+---------------+---------+--------------+-----------------+------------------------+----------------------------------------+---------------------------+------------------------------
 emptyGroup | SM2           |    2006 |         2006 | t               | f                      | a comment on a mark for an empty group |                         0 | Mark1
 emptyGroup | EGM3          |    2021 |         2016 | t               | f                      |                                        |                         0 | 
 emptyGroup | end_rlbk_mark |    3042 |         3047 | t               | f                      |                                        |                         0 | EGM3
 emptyGroup | stop          |    3054 |         3061 | t               | f                      |                                        |                         0 | 
(4 rows)

rollback;
-- check that dropping the group deletes rows from emaj_sequence and emaj_seq_hole
begin;
  select emaj.emaj_stop_group('myGroup1');
 emaj_stop_group 
-----------------
               7
(1 row)

  select emaj.emaj_drop_group('myGroup1');
 emaj_drop_group 
-----------------
               7
(1 row)

  select sequ_schema, sequ_name, sequ_time_id, sequ_last_val, sequ_is_called from emaj.emaj_sequence where sequ_name like 'myschema1%' order by sequ_time_id, sequ_schema, sequ_name;
 sequ_schema | sequ_name | sequ_time_id | sequ_last_val | sequ_is_called 
-------------+-----------+--------------+---------------+----------------
(0 rows)

  select sqhl_schema, sqhl_table, sqhl_begin_time_id, sqhl_end_time_id, sqhl_hole_size from emaj.emaj_seq_hole where sqhl_schema = 'myschema1' order by 1,2,3;
 sqhl_schema | sqhl_table | sqhl_begin_time_id | sqhl_end_time_id | sqhl_hole_size 
-------------+------------+--------------------+------------------+----------------
(0 rows)

rollback;
-----------------------------
-- test emaj_cleanup_rollback_state()
-----------------------------
-- rollback a transaction with an E-Maj rollback to generate an ABORTED rollback event
begin;
  select emaj.emaj_rollback_group('myGroup4','myGroup4_start');
 emaj_rollback_group 
---------------------
                   0
(1 row)

rollback;
select rlbk_id, rlbk_status, rlbk_begin_hist_id, rlbk_nb_session from emaj.emaj_rlbk
  where rlbk_status in ('PLANNING', 'LOCKING', 'EXECUTING', 'COMPLETED') order by rlbk_id;
 rlbk_id | rlbk_status | rlbk_begin_hist_id | rlbk_nb_session 
---------+-------------+--------------------+-----------------
      22 | COMPLETED   |               3445 |               1
      23 | COMPLETED   |               3473 |               1
      24 | COMPLETED   |               3513 |               1
(3 rows)

select emaj.emaj_cleanup_rollback_state();
 emaj_cleanup_rollback_state 
-----------------------------
                           3
(1 row)

-----------------------------
-- check rollback tables
-----------------------------
select rlbk_id, rlbk_groups, rlbk_mark, rlbk_time_id, rlbk_is_logged, rlbk_is_alter_group_allowed, rlbk_nb_session, rlbk_nb_table, rlbk_nb_sequence, 
       rlbk_eff_nb_table, rlbk_status, rlbk_begin_hist_id, rlbk_is_dblink_used,
       case when rlbk_end_datetime is null then 'null' else '[ts]' end as "end_datetime", rlbk_messages
  from emaj.emaj_rlbk order by rlbk_id;
 rlbk_id |     rlbk_groups     |   rlbk_mark    | rlbk_time_id | rlbk_is_logged | rlbk_is_alter_group_allowed | rlbk_nb_session | rlbk_nb_table | rlbk_nb_sequence | rlbk_eff_nb_table | rlbk_status | rlbk_begin_hist_id | rlbk_is_dblink_used | end_datetime |                                   rlbk_messages                                   
---------+---------------------+----------------+--------------+----------------+-----------------------------+-----------------+---------------+------------------+-------------------+-------------+--------------------+---------------------+--------------+-----------------------------------------------------------------------------------
       1 | {myGroup1}          | Different_Mark |         3006 | f              |                             |               1 |             5 |                2 |                 0 | COMMITTED   |               3036 | f                   | [ts]         | {"Notice: 0 / 5 tables effectively processed.","Notice: 2 sequences processed."}
       4 | {myGroup1}          | Different_Mark |         3016 | f              |                             |               1 |             5 |                2 |                 0 | COMMITTED   |               3098 | f                   | [ts]         | {"Notice: 0 / 5 tables effectively processed.","Notice: 2 sequences processed."}
       5 | {myGroup2}          | Mark21         |         3017 | f              |                             |               1 |             6 |                2 |                 0 | COMMITTED   |               3107 | f                   | [ts]         | {"Notice: 0 / 6 tables effectively processed.","Notice: 2 sequences processed."}
       6 | {myGroup1}          | Different_Mark |         3018 | t              |                             |               1 |             5 |                2 |                 0 | COMMITTED   |               3117 | f                   | [ts]         | {"Notice: 0 / 5 tables effectively processed.","Notice: 2 sequences processed."}
       7 | {myGroup2}          | Mark21         |         3020 | t              |                             |               1 |             6 |                2 |                 0 | COMMITTED   |               3130 | f                   | [ts]         | {"Notice: 0 / 6 tables effectively processed.","Notice: 2 sequences processed."}
       8 | {myGroup1,myGroup2} | Mark1B         |         3023 | f              |                             |               1 |            11 |                4 |                 0 | COMMITTED   |               3147 | f                   | [ts]         | {"Notice: 0 / 11 tables effectively processed.","Notice: 4 sequences processed."}
       9 | {myGroup1,myGroup2} | Mark1B         |         3024 | f              |                             |               1 |            11 |                4 |                 0 | COMMITTED   |               3158 | f                   | [ts]         | {"Notice: 0 / 11 tables effectively processed.","Notice: 4 sequences processed."}
      10 | {myGroup1,myGroup2} | Mark1B         |         3025 | t              |                             |               1 |            11 |                4 |                 0 | COMMITTED   |               3169 | f                   | [ts]         | {"Notice: 0 / 11 tables effectively processed.","Notice: 4 sequences processed."}
      11 | {myGroup1,myGroup2} | Mark1B         |         3027 | t              |                             |               1 |            11 |                4 |                 0 | COMMITTED   |               3184 | t                   | [ts]         | {"Notice: 0 / 11 tables effectively processed.","Notice: 4 sequences processed."}
      12 | {myGroup1}          | Mark12         |         3034 | f              |                             |               1 |             5 |                2 |                 2 | COMMITTED   |               3227 | t                   | [ts]         | {"Notice: 2 / 5 tables effectively processed.","Notice: 2 sequences processed."}
      13 | {myGroup1}          | Mark11         |         3035 | f              |                             |               1 |             5 |                2 |                 3 | COMMITTED   |               3242 | t                   | [ts]         | {"Notice: 3 / 5 tables effectively processed.","Notice: 2 sequences processed."}
      14 | {myGroup1}          | Mark12         |         3040 | t              |                             |               1 |             5 |                2 |                 2 | COMMITTED   |               3281 | t                   | [ts]         | {"Notice: 2 / 5 tables effectively processed.","Notice: 2 sequences processed."}
      15 | {myGroup1}          | Mark11         |         3042 | t              |                             |               1 |             5 |                2 |                 5 | COMMITTED   |               3299 | t                   | [ts]         | {"Notice: 5 / 5 tables effectively processed.","Notice: 2 sequences processed."}
      16 | {myGroup1}          | Mark13         |         3044 | f              |                             |               1 |             5 |                2 |                 5 | COMMITTED   |               3324 | t                   | [ts]         | {"Notice: 5 / 5 tables effectively processed.","Notice: 2 sequences processed."}
      17 | {emptyGroup}        | EGM4           |         3045 | f              |                             |               1 |             0 |                0 |                 0 | COMMITTED   |               3348 | t                   | [ts]         | {"Notice: 0 / 0 tables effectively processed."}
      18 | {emptyGroup}        | EGM3           |         3046 | t              |                             |               1 |             0 |                0 |                 0 | COMMITTED   |               3355 | t                   | [ts]         | {"Notice: 0 / 0 tables effectively processed."}
      19 | {myGroup4}          | mark1          |         3050 | t              |                             |               1 |             5 |                0 |                 3 | COMMITTED   |               3380 | t                   | [ts]         | {"Notice: 3 / 5 tables effectively processed."}
      20 | {myGroup4}          | myGroup4_start |         3052 | f              | t                           |               1 |             5 |                0 |                 3 | COMMITTED   |               3397 | t                   | [ts]         | {"Notice: 3 / 5 tables effectively processed."}
      21 | {myGroup1}          | Conso_M1       |         3054 | t              |                             |               1 |             5 |                2 |                 0 | COMMITTED   |               3420 | t                   | [ts]         | {"Notice: 0 / 5 tables effectively processed.","Notice: 2 sequences processed."}
      22 | {myGroup1}          | Conso_M2       |         3058 | t              |                             |               1 |             5 |                2 |                 3 | COMMITTED   |               3445 | t                   | [ts]         | {"Notice: 3 / 5 tables effectively processed.","Notice: 2 sequences processed."}
      23 | {myGroup1}          | Conso_M1       |         3060 | f              |                             |               1 |             5 |                2 |                 2 | COMMITTED   |               3473 | t                   | [ts]         | {"Notice: 2 / 5 tables effectively processed.","Notice: 2 sequences processed."}
      24 | {myGroup4}          | myGroup4_start |         3063 | f              |                             |               1 |             5 |                0 |                 0 | ABORTED     |               3513 | t                   | [ts]         | {"Notice: 0 / 5 tables effectively processed."}
(22 rows)

select rlbs_rlbk_id, rlbs_session, 
       case when rlbs_end_datetime is null then 'null' else '[ts]' end as "end_datetime"
  from emaj.emaj_rlbk_session order by rlbs_rlbk_id, rlbs_session;
 rlbs_rlbk_id | rlbs_session | end_datetime 
--------------+--------------+--------------
            1 |            1 | [ts]
            4 |            1 | [ts]
            5 |            1 | [ts]
            6 |            1 | [ts]
            7 |            1 | [ts]
            8 |            1 | [ts]
            9 |            1 | [ts]
           10 |            1 | [ts]
           11 |            1 | [ts]
           12 |            1 | [ts]
           13 |            1 | [ts]
           14 |            1 | [ts]
           15 |            1 | [ts]
           16 |            1 | [ts]
           17 |            1 | [ts]
           18 |            1 | [ts]
           19 |            1 | [ts]
           20 |            1 | [ts]
           21 |            1 | [ts]
           22 |            1 | [ts]
           23 |            1 | [ts]
           24 |            1 | [ts]
(22 rows)

select rlbp_rlbk_id, rlbp_step, rlbp_schema, rlbp_table, rlbp_fkey, rlbp_batch_number, rlbp_session,
       rlbp_fkey_def, rlbp_estimated_quantity, rlbp_estimate_method, rlbp_quantity
  from emaj.emaj_rlbk_plan order by rlbp_rlbk_id, rlbp_step, rlbp_schema, rlbp_table, rlbp_fkey;
 rlbp_rlbk_id |  rlbp_step  | rlbp_schema | rlbp_table |     rlbp_fkey     | rlbp_batch_number | rlbp_session |                                                              rlbp_fkey_def                                                              | rlbp_estimated_quantity | rlbp_estimate_method | rlbp_quantity 
--------------+-------------+-------------+------------+-------------------+-------------------+--------------+-----------------------------------------------------------------------------------------------------------------------------------------+-------------------------+----------------------+---------------
           12 | DIS_LOG_TRG | myschema1   | myTbl3     |                   |                 1 |            1 |                                                                                                                                         |                         |                    3 |              
           12 | DIS_LOG_TRG | myschema1   | mytbl4     |                   |                 2 |            1 |                                                                                                                                         |                         |                    3 |              
           12 | DROP_FK     | myschema1   | mytbl4     | mytbl4_col44_fkey |                 2 |            1 |                                                                                                                                         |                         |                    3 |              
           12 | SET_FK_DEF  | myschema1   | mytbl4     | mytbl4_col43_fkey |                 2 |            1 |                                                                                                                                         |                         |                    3 |              
           12 | RLBK_TABLE  | myschema1   | myTbl3     |                   |                 1 |            1 |                                                                                                                                         |                      10 |                    3 |            10
           12 | RLBK_TABLE  | myschema1   | mytbl4     |                   |                 2 |            1 |                                                                                                                                         |                       2 |                    3 |             1
           12 | DELETE_LOG  | myschema1   | myTbl3     |                   |                 1 |            1 |                                                                                                                                         |                      10 |                    3 |            10
           12 | DELETE_LOG  | myschema1   | mytbl4     |                   |                 2 |            1 |                                                                                                                                         |                       2 |                    3 |             3
           12 | SET_FK_IMM  | myschema1   | mytbl4     | mytbl4_col43_fkey |                 2 |            1 |                                                                                                                                         |                       2 |                    3 |              
           12 | ADD_FK      | myschema1   | mytbl4     | mytbl4_col44_fkey |                 2 |            1 | FOREIGN KEY (col44, col45) REFERENCES myschema1.mytbl1(col11, col12) ON UPDATE SET NULL ON DELETE CASCADE DEFERRABLE INITIALLY DEFERRED |                       0 |                    3 |              
           12 | ENA_LOG_TRG | myschema1   | myTbl3     |                   |                 1 |            1 |                                                                                                                                         |                         |                    3 |              
           12 | ENA_LOG_TRG | myschema1   | mytbl4     |                   |                 2 |            1 |                                                                                                                                         |                         |                    3 |              
           12 | CTRL+DBLINK |             |            |                   |                   |              |                                                                                                                                         |                      12 |                    3 |              
           13 | DIS_LOG_TRG | myschema1   | mytbl1     |                   |                 1 |            1 |                                                                                                                                         |                         |                    2 |              
           13 | DIS_LOG_TRG | myschema1   | mytbl2     |                   |                 1 |            1 |                                                                                                                                         |                         |                    2 |              
           13 | DIS_LOG_TRG | myschema1   | mytbl2b    |                   |                 2 |            1 |                                                                                                                                         |                         |                    2 |              
           13 | DROP_FK     | myschema1   | mytbl4     | mytbl4_col44_fkey |                 1 |            1 |                                                                                                                                         |                         |                    2 |              
           13 | SET_FK_DEF  | myschema1   | mytbl4     | mytbl4_col43_fkey |                 1 |            1 |                                                                                                                                         |                         |                    2 |              
           13 | RLBK_TABLE  | myschema1   | mytbl1     |                   |                 1 |            1 |                                                                                                                                         |                      15 |                    3 |            11
           13 | RLBK_TABLE  | myschema1   | mytbl2     |                   |                 1 |            1 |                                                                                                                                         |                       6 |                    3 |             3
           13 | RLBK_TABLE  | myschema1   | mytbl2b    |                   |                 2 |            1 |                                                                                                                                         |                       6 |                    3 |             6
           13 | DELETE_LOG  | myschema1   | mytbl1     |                   |                 1 |            1 |                                                                                                                                         |                      15 |                    3 |            18
           13 | DELETE_LOG  | myschema1   | mytbl2     |                   |                 1 |            1 |                                                                                                                                         |                       6 |                    3 |             8
           13 | DELETE_LOG  | myschema1   | mytbl2b    |                   |                 2 |            1 |                                                                                                                                         |                       6 |                    3 |             6
           13 | SET_FK_IMM  | myschema1   | mytbl4     | mytbl4_col43_fkey |                 1 |            1 |                                                                                                                                         |                       6 |                    2 |              
           13 | ADD_FK      | myschema1   | mytbl4     | mytbl4_col44_fkey |                 1 |            1 | FOREIGN KEY (col44, col45) REFERENCES myschema1.mytbl1(col11, col12) ON UPDATE SET NULL ON DELETE CASCADE DEFERRABLE INITIALLY DEFERRED |                       0 |                    3 |              
           13 | ENA_LOG_TRG | myschema1   | mytbl1     |                   |                 1 |            1 |                                                                                                                                         |                         |                    2 |              
           13 | ENA_LOG_TRG | myschema1   | mytbl2     |                   |                 1 |            1 |                                                                                                                                         |                         |                    2 |              
           13 | ENA_LOG_TRG | myschema1   | mytbl2b    |                   |                 2 |            1 |                                                                                                                                         |                         |                    2 |              
           13 | CTRL+DBLINK |             |            |                   |                   |              |                                                                                                                                         |                      16 |                    2 |              
           14 | DROP_FK     | myschema1   | mytbl4     | mytbl4_col44_fkey |                 2 |            1 |                                                                                                                                         |                         |                    2 |              
           14 | SET_FK_DEF  | myschema1   | mytbl4     | mytbl4_col43_fkey |                 2 |            1 |                                                                                                                                         |                         |                    2 |              
           14 | RLBK_TABLE  | myschema1   | myTbl3     |                   |                 1 |            1 |                                                                                                                                         |                      10 |                    1 |            10
           14 | RLBK_TABLE  | myschema1   | mytbl4     |                   |                 2 |            1 |                                                                                                                                         |                       1 |                    1 |             1
           14 | SET_FK_IMM  | myschema1   | mytbl4     | mytbl4_col43_fkey |                 2 |            1 |                                                                                                                                         |                       1 |                    2 |              
           14 | ADD_FK      | myschema1   | mytbl4     | mytbl4_col44_fkey |                 2 |            1 | FOREIGN KEY (col44, col45) REFERENCES myschema1.mytbl1(col11, col12) ON UPDATE SET NULL ON DELETE CASCADE DEFERRABLE INITIALLY DEFERRED |                       0 |                    3 |              
           14 | CTRL+DBLINK |             |            |                   |                   |              |                                                                                                                                         |                       6 |                    2 |              
           15 | DROP_FK     | myschema1   | mytbl4     | mytbl4_col44_fkey |                 2 |            1 |                                                                                                                                         |                         |                    2 |              
           15 | SET_FK_DEF  | myschema1   | mytbl4     | mytbl4_col43_fkey |                 2 |            1 |                                                                                                                                         |                         |                    2 |              
           15 | RLBK_TABLE  | myschema1   | mytbl1     |                   |                 2 |            1 |                                                                                                                                         |                      15 |                    1 |            11
           15 | RLBK_TABLE  | myschema1   | mytbl2     |                   |                 2 |            1 |                                                                                                                                         |                       2 |                    1 |             2
           15 | RLBK_TABLE  | myschema1   | mytbl2b    |                   |                 3 |            1 |                                                                                                                                         |                       2 |                    1 |             2
           15 | RLBK_TABLE  | myschema1   | myTbl3     |                   |                 1 |            1 |                                                                                                                                         |                      20 |                    1 |            10
           15 | RLBK_TABLE  | myschema1   | mytbl4     |                   |                 2 |            1 |                                                                                                                                         |                       2 |                    1 |             1
           15 | SET_FK_IMM  | myschema1   | mytbl4     | mytbl4_col43_fkey |                 2 |            1 |                                                                                                                                         |                       4 |                    2 |              
           15 | ADD_FK      | myschema1   | mytbl4     | mytbl4_col44_fkey |                 2 |            1 | FOREIGN KEY (col44, col45) REFERENCES myschema1.mytbl1(col11, col12) ON UPDATE SET NULL ON DELETE CASCADE DEFERRABLE INITIALLY DEFERRED |                       0 |                    3 |              
           15 | CTRL+DBLINK |             |            |                   |                   |              |                                                                                                                                         |                       9 |                    2 |              
           16 | DIS_LOG_TRG | myschema1   | mytbl1     |                   |                 1 |            1 |                                                                                                                                         |                         |                    2 |              
           16 | DIS_LOG_TRG | myschema1   | mytbl2     |                   |                 1 |            1 |                                                                                                                                         |                         |                    2 |              
           16 | DIS_LOG_TRG | myschema1   | mytbl2b    |                   |                 3 |            1 |                                                                                                                                         |                         |                    2 |              
           16 | DIS_LOG_TRG | myschema1   | myTbl3     |                   |                 2 |            1 |                                                                                                                                         |                         |                    2 |              
           16 | DIS_LOG_TRG | myschema1   | mytbl4     |                   |                 1 |            1 |                                                                                                                                         |                         |                    2 |              
           16 | DROP_FK     | myschema1   | mytbl4     | mytbl4_col44_fkey |                 1 |            1 |                                                                                                                                         |                         |                    2 |              
           16 | SET_FK_DEF  | myschema1   | mytbl4     | mytbl4_col43_fkey |                 1 |            1 |                                                                                                                                         |                         |                    2 |              
           16 | RLBK_TABLE  | myschema1   | mytbl1     |                   |                 1 |            1 |                                                                                                                                         |                      10 |                    1 |            10
           16 | RLBK_TABLE  | myschema1   | mytbl2     |                   |                 1 |            1 |                                                                                                                                         |                       2 |                    1 |             2
           16 | RLBK_TABLE  | myschema1   | mytbl2b    |                   |                 3 |            1 |                                                                                                                                         |                       2 |                    1 |             2
           16 | RLBK_TABLE  | myschema1   | myTbl3     |                   |                 2 |            1 |                                                                                                                                         |                      10 |                    1 |            10
           16 | RLBK_TABLE  | myschema1   | mytbl4     |                   |                 1 |            1 |                                                                                                                                         |                       1 |                    1 |             1
           16 | DELETE_LOG  | myschema1   | mytbl1     |                   |                 1 |            1 |                                                                                                                                         |                      10 |                    1 |            10
           16 | DELETE_LOG  | myschema1   | mytbl2     |                   |                 1 |            1 |                                                                                                                                         |                       2 |                    1 |             2
           16 | DELETE_LOG  | myschema1   | mytbl2b    |                   |                 3 |            1 |                                                                                                                                         |                       2 |                    1 |             2
           16 | DELETE_LOG  | myschema1   | myTbl3     |                   |                 2 |            1 |                                                                                                                                         |                      10 |                    1 |            10
           16 | DELETE_LOG  | myschema1   | mytbl4     |                   |                 1 |            1 |                                                                                                                                         |                       1 |                    1 |             1
           16 | SET_FK_IMM  | myschema1   | mytbl4     | mytbl4_col43_fkey |                 1 |            1 |                                                                                                                                         |                       3 |                    2 |              
           16 | ADD_FK      | myschema1   | mytbl4     | mytbl4_col44_fkey |                 1 |            1 | FOREIGN KEY (col44, col45) REFERENCES myschema1.mytbl1(col11, col12) ON UPDATE SET NULL ON DELETE CASCADE DEFERRABLE INITIALLY DEFERRED |                       0 |                    3 |              
           16 | ENA_LOG_TRG | myschema1   | mytbl1     |                   |                 1 |            1 |                                                                                                                                         |                         |                    2 |              
           16 | ENA_LOG_TRG | myschema1   | mytbl2     |                   |                 1 |            1 |                                                                                                                                         |                         |                    2 |              
           16 | ENA_LOG_TRG | myschema1   | mytbl2b    |                   |                 3 |            1 |                                                                                                                                         |                         |                    2 |              
           16 | ENA_LOG_TRG | myschema1   | myTbl3     |                   |                 2 |            1 |                                                                                                                                         |                         |                    2 |              
           16 | ENA_LOG_TRG | myschema1   | mytbl4     |                   |                 1 |            1 |                                                                                                                                         |                         |                    2 |              
           16 | CTRL+DBLINK |             |            |                   |                   |              |                                                                                                                                         |                      24 |                    2 |              
           19 | RLBK_TABLE  | myschema4   | mytblc1    |                   |                 1 |            1 |                                                                                                                                         |                       1 |                    3 |             1
           19 | RLBK_TABLE  | myschema4   | mytblc2    |                   |                 2 |            1 |                                                                                                                                         |                       1 |                    3 |             1
           19 | RLBK_TABLE  | myschema4   | mytblm     |                   |                 3 |            1 |                                                                                                                                         |                       1 |                    3 |             1
           19 | CTRL+DBLINK |             |            |                   |                   |              |                                                                                                                                         |                       3 |                    2 |              
           20 | DIS_LOG_TRG | myschema4   | mytblc1    |                   |                 1 |            1 |                                                                                                                                         |                         |                    2 |              
           20 | DIS_LOG_TRG | myschema4   | mytblc2    |                   |                 2 |            1 |                                                                                                                                         |                         |                    2 |              
           20 | DIS_LOG_TRG | myschema4   | mytblm     |                   |                 3 |            1 |                                                                                                                                         |                         |                    2 |              
           20 | RLBK_TABLE  | myschema4   | mytblc1    |                   |                 1 |            1 |                                                                                                                                         |                       3 |                    1 |             1
           20 | RLBK_TABLE  | myschema4   | mytblc2    |                   |                 2 |            1 |                                                                                                                                         |                       3 |                    1 |             1
           20 | RLBK_TABLE  | myschema4   | mytblm     |                   |                 3 |            1 |                                                                                                                                         |                       3 |                    1 |             1
           20 | DELETE_LOG  | myschema4   | mytblc1    |                   |                 1 |            1 |                                                                                                                                         |                       3 |                    3 |             3
           20 | DELETE_LOG  | myschema4   | mytblc2    |                   |                 2 |            1 |                                                                                                                                         |                       3 |                    3 |             3
           20 | DELETE_LOG  | myschema4   | mytblm     |                   |                 3 |            1 |                                                                                                                                         |                       3 |                    3 |             3
           20 | ENA_LOG_TRG | myschema4   | mytblc1    |                   |                 1 |            1 |                                                                                                                                         |                         |                    2 |              
           20 | ENA_LOG_TRG | myschema4   | mytblc2    |                   |                 2 |            1 |                                                                                                                                         |                         |                    2 |              
           20 | ENA_LOG_TRG | myschema4   | mytblm     |                   |                 3 |            1 |                                                                                                                                         |                         |                    2 |              
           20 | CTRL+DBLINK |             |            |                   |                   |              |                                                                                                                                         |                      12 |                    2 |              
           22 | DROP_FK     | myschema1   | mytbl4     | mytbl4_col44_fkey |                 1 |            1 |                                                                                                                                         |                         |                    2 |              
           22 | SET_FK_DEF  | myschema1   | mytbl4     | mytbl4_col43_fkey |                 1 |            1 |                                                                                                                                         |                         |                    2 |              
           22 | RLBK_TABLE  | myschema1   | mytbl1     |                   |                 1 |            1 |                                                                                                                                         |                      13 |                    1 |            12
           22 | RLBK_TABLE  | myschema1   | mytbl2     |                   |                 1 |            1 |                                                                                                                                         |                       2 |                    1 |             1
           22 | RLBK_TABLE  | myschema1   | mytbl2b    |                   |                 2 |            1 |                                                                                                                                         |                       2 |                    1 |             2
           22 | SET_FK_IMM  | myschema1   | mytbl4     | mytbl4_col43_fkey |                 1 |            1 |                                                                                                                                         |                       2 |                    2 |              
           22 | ADD_FK      | myschema1   | mytbl4     | mytbl4_col44_fkey |                 1 |            1 | FOREIGN KEY (col44, col45) REFERENCES myschema1.mytbl1(col11, col12) ON UPDATE SET NULL ON DELETE CASCADE DEFERRABLE INITIALLY DEFERRED |                       0 |                    3 |              
           22 | CTRL+DBLINK |             |            |                   |                   |              |                                                                                                                                         |                       7 |                    2 |              
           23 | DIS_LOG_TRG | myschema1   | mytbl2     |                   |                 1 |            1 |                                                                                                                                         |                         |                    2 |              
           23 | DIS_LOG_TRG | myschema1   | mytbl2b    |                   |                 2 |            1 |                                                                                                                                         |                         |                    2 |              
           23 | SET_FK_DEF  | myschema1   | mytbl4     | mytbl4_col43_fkey |                 1 |            1 |                                                                                                                                         |                         |                    2 |              
           23 | RLBK_TABLE  | myschema1   | mytbl2     |                   |                 1 |            1 |                                                                                                                                         |                       1 |                    1 |             1
           23 | RLBK_TABLE  | myschema1   | mytbl2b    |                   |                 2 |            1 |                                                                                                                                         |                       1 |                    1 |             1
           23 | DELETE_LOG  | myschema1   | mytbl2     |                   |                 1 |            1 |                                                                                                                                         |                       1 |                    1 |             1
           23 | DELETE_LOG  | myschema1   | mytbl2b    |                   |                 2 |            1 |                                                                                                                                         |                       1 |                    1 |             2
           23 | SET_FK_IMM  | myschema1   | mytbl4     | mytbl4_col43_fkey |                 1 |            1 |                                                                                                                                         |                       1 |                    2 |              
           23 | ENA_LOG_TRG | myschema1   | mytbl2     |                   |                 1 |            1 |                                                                                                                                         |                         |                    2 |              
           23 | ENA_LOG_TRG | myschema1   | mytbl2b    |                   |                 2 |            1 |                                                                                                                                         |                         |                    2 |              
           23 | CTRL+DBLINK |             |            |                   |                   |              |                                                                                                                                         |                      10 |                    2 |              
(108 rows)

select rlbt_step, rlbt_schema, rlbt_table, rlbt_fkey, rlbt_rlbk_id, rlbt_quantity from emaj.emaj_rlbk_stat
  order by rlbt_rlbk_id, rlbt_step, rlbt_schema, rlbt_table, rlbt_fkey;
  rlbt_step  | rlbt_schema | rlbt_table |     rlbt_fkey     | rlbt_rlbk_id | rlbt_quantity 
-------------+-------------+------------+-------------------+--------------+---------------
 DIS_LOG_TRG |             |            |                   |           12 |             2
 DROP_FK     |             |            |                   |           12 |             1
 SET_FK_DEF  |             |            |                   |           12 |             1
 RLBK_TABLE  | myschema1   | myTbl3     |                   |           12 |            10
 RLBK_TABLE  | myschema1   | mytbl4     |                   |           12 |             2
 DELETE_LOG  | myschema1   | myTbl3     |                   |           12 |            10
 DELETE_LOG  | myschema1   | mytbl4     |                   |           12 |             2
 SET_FK_IMM  | myschema1   | mytbl4     | mytbl4_col43_fkey |           12 |             2
 ADD_FK      | myschema1   | mytbl4     | mytbl4_col44_fkey |           12 |             0
 ENA_LOG_TRG |             |            |                   |           12 |             2
 CTRL+DBLINK |             |            |                   |           12 |            12
 DIS_LOG_TRG |             |            |                   |           13 |             3
 DROP_FK     |             |            |                   |           13 |             1
 SET_FK_DEF  |             |            |                   |           13 |             1
 RLBK_TABLE  | myschema1   | mytbl1     |                   |           13 |            15
 RLBK_TABLE  | myschema1   | mytbl2     |                   |           13 |             6
 RLBK_TABLE  | myschema1   | mytbl2b    |                   |           13 |             6
 DELETE_LOG  | myschema1   | mytbl1     |                   |           13 |            15
 DELETE_LOG  | myschema1   | mytbl2     |                   |           13 |             6
 DELETE_LOG  | myschema1   | mytbl2b    |                   |           13 |             6
 SET_FK_IMM  | myschema1   | mytbl4     | mytbl4_col43_fkey |           13 |             6
 ADD_FK      | myschema1   | mytbl4     | mytbl4_col44_fkey |           13 |             0
 ENA_LOG_TRG |             |            |                   |           13 |             3
 CTRL+DBLINK |             |            |                   |           13 |            16
 DROP_FK     |             |            |                   |           14 |             1
 SET_FK_DEF  |             |            |                   |           14 |             1
 RLBK_TABLE  | myschema1   | myTbl3     |                   |           14 |            10
 RLBK_TABLE  | myschema1   | mytbl4     |                   |           14 |             1
 SET_FK_IMM  | myschema1   | mytbl4     | mytbl4_col43_fkey |           14 |             1
 ADD_FK      | myschema1   | mytbl4     | mytbl4_col44_fkey |           14 |             0
 CTRL+DBLINK |             |            |                   |           14 |             6
 DROP_FK     |             |            |                   |           15 |             1
 SET_FK_DEF  |             |            |                   |           15 |             1
 RLBK_TABLE  | myschema1   | mytbl1     |                   |           15 |            15
 RLBK_TABLE  | myschema1   | mytbl2     |                   |           15 |             2
 RLBK_TABLE  | myschema1   | mytbl2b    |                   |           15 |             2
 RLBK_TABLE  | myschema1   | myTbl3     |                   |           15 |            20
 RLBK_TABLE  | myschema1   | mytbl4     |                   |           15 |             2
 SET_FK_IMM  | myschema1   | mytbl4     | mytbl4_col43_fkey |           15 |             4
 ADD_FK      | myschema1   | mytbl4     | mytbl4_col44_fkey |           15 |             0
 CTRL+DBLINK |             |            |                   |           15 |             9
 DIS_LOG_TRG |             |            |                   |           16 |             5
 DROP_FK     |             |            |                   |           16 |             1
 SET_FK_DEF  |             |            |                   |           16 |             1
 RLBK_TABLE  | myschema1   | mytbl1     |                   |           16 |            10
 RLBK_TABLE  | myschema1   | mytbl2     |                   |           16 |             2
 RLBK_TABLE  | myschema1   | mytbl2b    |                   |           16 |             2
 RLBK_TABLE  | myschema1   | myTbl3     |                   |           16 |            10
 RLBK_TABLE  | myschema1   | mytbl4     |                   |           16 |             1
 DELETE_LOG  | myschema1   | mytbl1     |                   |           16 |            10
 DELETE_LOG  | myschema1   | mytbl2     |                   |           16 |             2
 DELETE_LOG  | myschema1   | mytbl2b    |                   |           16 |             2
 DELETE_LOG  | myschema1   | myTbl3     |                   |           16 |            10
 DELETE_LOG  | myschema1   | mytbl4     |                   |           16 |             1
 SET_FK_IMM  | myschema1   | mytbl4     | mytbl4_col43_fkey |           16 |             3
 ADD_FK      | myschema1   | mytbl4     | mytbl4_col44_fkey |           16 |             0
 ENA_LOG_TRG |             |            |                   |           16 |             5
 CTRL+DBLINK |             |            |                   |           16 |            24
 RLBK_TABLE  | myschema4   | mytblc1    |                   |           19 |             1
 RLBK_TABLE  | myschema4   | mytblc2    |                   |           19 |             1
 RLBK_TABLE  | myschema4   | mytblm     |                   |           19 |             1
 CTRL+DBLINK |             |            |                   |           19 |             3
 DIS_LOG_TRG |             |            |                   |           20 |             3
 RLBK_TABLE  | myschema4   | mytblc1    |                   |           20 |             3
 RLBK_TABLE  | myschema4   | mytblc2    |                   |           20 |             3
 RLBK_TABLE  | myschema4   | mytblm     |                   |           20 |             3
 DELETE_LOG  | myschema4   | mytblc1    |                   |           20 |             3
 DELETE_LOG  | myschema4   | mytblc2    |                   |           20 |             3
 DELETE_LOG  | myschema4   | mytblm     |                   |           20 |             3
 ENA_LOG_TRG |             |            |                   |           20 |             3
 CTRL+DBLINK |             |            |                   |           20 |            12
 DROP_FK     |             |            |                   |           22 |             1
 SET_FK_DEF  |             |            |                   |           22 |             1
 RLBK_TABLE  | myschema1   | mytbl1     |                   |           22 |            13
 RLBK_TABLE  | myschema1   | mytbl2     |                   |           22 |             2
 RLBK_TABLE  | myschema1   | mytbl2b    |                   |           22 |             2
 SET_FK_IMM  | myschema1   | mytbl4     | mytbl4_col43_fkey |           22 |             2
 ADD_FK      | myschema1   | mytbl4     | mytbl4_col44_fkey |           22 |             0
 CTRL+DBLINK |             |            |                   |           22 |             7
 DIS_LOG_TRG |             |            |                   |           23 |             2
 SET_FK_DEF  |             |            |                   |           23 |             1
 RLBK_TABLE  | myschema1   | mytbl2     |                   |           23 |             1
 RLBK_TABLE  | myschema1   | mytbl2b    |                   |           23 |             1
 DELETE_LOG  | myschema1   | mytbl2     |                   |           23 |             1
 DELETE_LOG  | myschema1   | mytbl2b    |                   |           23 |             1
 SET_FK_IMM  | myschema1   | mytbl4     | mytbl4_col43_fkey |           23 |             1
 ENA_LOG_TRG |             |            |                   |           23 |             2
 CTRL+DBLINK |             |            |                   |           23 |            10
(88 rows)

-----------------------------
-- test end: reset history and force sequences id
-----------------------------
select time_id, time_last_emaj_gid, time_event from emaj.emaj_time_stamp where time_id >= 3000 order by time_id;
 time_id | time_last_emaj_gid | time_event 
---------+--------------------+------------
    3002 |                  2 | M
    3003 |                  2 | M
    3004 |                  2 | M
    3005 |                  2 | M
    3006 |                  2 | R
    3007 |                  2 | C
    3016 |                  2 | R
    3017 |                  2 | R
    3018 |                  2 | R
    3019 |                  2 | M
    3020 |                  2 | R
    3021 |                  2 | M
    3022 |                  2 | M
    3023 |                  2 | R
    3024 |                  2 | R
    3025 |                  2 | R
    3026 |                  2 | M
    3027 |                  2 | R
    3028 |                  2 | M
    3029 |                  2 | M
    3030 |                  2 | M
    3031 |                  2 | M
    3032 |                 29 | M
    3033 |                 41 | M
    3034 |                 41 | R
    3035 |                 41 | R
    3036 |                 41 | M
    3037 |                 41 | M
    3038 |                 60 | M
    3039 |                 71 | M
    3040 |                 71 | R
    3041 |                 82 | M
    3042 |                 82 | R
    3043 |                 96 | M
    3044 |                 96 | R
    3045 |                 96 | R
    3046 |                 96 | R
    3047 |                 96 | M
    3048 |                 96 | M
    3049 |                 99 | M
    3050 |                102 | R
    3051 |                105 | M
    3052 |                105 | R
    3053 |                105 | M
    3054 |                105 | R
    3055 |                105 | M
    3056 |                105 | M
    3057 |                120 | M
    3058 |                122 | R
    3059 |                137 | M
    3060 |                139 | R
    3063 |                140 | R
(52 rows)

select hist_id, hist_function, hist_event, hist_object, regexp_replace(regexp_replace(hist_wording,E'\\d\\d\.\\d\\d\\.\\d\\d\\.\\d\\d\\d','%','g'),E'\\[.+\\]','(timestamp)','g'), hist_user from 
  (select * from emaj.emaj_hist where hist_id >= 3000 order by hist_id) as t;
 hist_id |     hist_function      |  hist_event  |         hist_object          |                         regexp_replace                         | hist_user 
---------+------------------------+--------------+------------------------------+----------------------------------------------------------------+-----------
    3012 | START_GROUP            | BEGIN        | myGroup1                     | With log reset                                                 | postgres
    3013 | LOCK_GROUP             | BEGIN        | myGroup1                     |                                                                | postgres
    3014 | LOCK_GROUP             | END          | myGroup1                     | 5 tables locked, 0 deadlock(s)                                 | postgres
    3015 | SET_MARK_GROUP         | BEGIN        | myGroup1                     | Mark11                                                         | postgres
    3016 | SET_MARK_GROUP         | END          | myGroup1                     | Mark11                                                         | postgres
    3017 | START_GROUP            | END          | myGroup1                     | 7 tables/sequences processed                                   | postgres
    3018 | START_GROUP            | BEGIN        | myGroup2                     | With log reset                                                 | postgres
    3019 | LOCK_GROUP             | BEGIN        | myGroup2                     |                                                                | postgres
    3020 | LOCK_GROUP             | END          | myGroup2                     | 6 tables locked, 0 deadlock(s)                                 | postgres
    3021 | SET_MARK_GROUP         | BEGIN        | myGroup2                     | Mark21                                                         | postgres
    3022 | SET_MARK_GROUP         | END          | myGroup2                     | Mark21                                                         | postgres
    3023 | START_GROUP            | END          | myGroup2                     | 8 tables/sequences processed                                   | postgres
    3024 | SET_MARK_GROUP         | BEGIN        | myGroup1                     |                                                                | postgres
    3025 | LOCK_GROUP             | BEGIN        | myGroup1                     |                                                                | postgres
    3026 | LOCK_GROUP             | END          | myGroup1                     | 5 tables locked, 0 deadlock(s)                                 | postgres
    3027 | SET_MARK_GROUP         | END          | myGroup1                     | Different_Mark                                                 | postgres
    3028 | SET_MARK_GROUP         | BEGIN        | myGroup2                     |                                                                | postgres
    3029 | LOCK_GROUP             | BEGIN        | myGroup2                     |                                                                | postgres
    3030 | LOCK_GROUP             | END          | myGroup2                     | 6 tables locked, 0 deadlock(s)                                 | postgres
    3031 | SET_MARK_GROUP         | END          | myGroup2                     | Different_Mark                                                 | postgres
    3032 | PROTECT_GROUP          |              | myGroup1                     | Status 1                                                       | postgres
    3033 | PROTECT_GROUP          |              | myGroup2                     | Status 1                                                       | postgres
    3034 | UNPROTECT_GROUP        |              | myGroup1                     | Status 1                                                       | postgres
    3035 | UNPROTECT_GROUP        |              | myGroup2                     | Status 1                                                       | postgres
    3036 | ROLLBACK_GROUP         | BEGIN        | myGroup1                     | Unlogged rollback to mark Different_Mark (timestamp)           | postgres
    3037 | DBLINK_OPEN_CNX        |              | rlbk#1                       | Status = -5                                                    | postgres
    3038 | LOCK_GROUP             | BEGIN        | myGroup1                     | Rollback session #1                                            | postgres
    3039 | LOCK_GROUP             | END          | myGroup1                     | Rollback session #1: 5 tables locked, 0 deadlock(s)            | postgres
    3040 | ROLLBACK_SEQUENCE      |              | myschema1."myTbl3_col31_seq" |                                                                | postgres
    3041 | ROLLBACK_SEQUENCE      |              | myschema1.mytbl2b_col20_seq  |                                                                | postgres
    3042 | ROLLBACK_GROUP         | NOTICE       | Rollback id 1                | 0 / 5 tables effectively processed.                            | postgres
    3043 | ROLLBACK_GROUP         | NOTICE       | Rollback id 1                | 2 sequences processed.                                         | postgres
    3044 | ROLLBACK_GROUP         | END          | myGroup1                     | Rollback_id 1, 0 tables and 2 sequences effectively processed  | postgres
    3045 | CREATE_GROUP           | BEGIN        | auditOnlyEmptyGroup          | audit_only                                                     | postgres
    3046 | CREATE_GROUP           | END          | auditOnlyEmptyGroup          | 0 tables/sequences processed                                   | postgres
    3047 | DROP_GROUP             | BEGIN        | auditOnlyEmptyGroup          |                                                                | postgres
    3048 | DROP_GROUP             | END          | auditOnlyEmptyGroup          | 0 tables/sequences processed                                   | postgres
    3098 | ROLLBACK_GROUP         | BEGIN        | myGroup1                     | Unlogged rollback to mark Different_Mark (timestamp)           | postgres
    3099 | DBLINK_OPEN_CNX        |              | rlbk#1                       | Status = -1                                                    | postgres
    3100 | LOCK_GROUP             | BEGIN        | myGroup1                     | Rollback session #1                                            | postgres
    3101 | LOCK_GROUP             | END          | myGroup1                     | Rollback session #1: 5 tables locked, 0 deadlock(s)            | postgres
    3102 | ROLLBACK_SEQUENCE      |              | myschema1."myTbl3_col31_seq" |                                                                | postgres
    3103 | ROLLBACK_SEQUENCE      |              | myschema1.mytbl2b_col20_seq  |                                                                | postgres
    3104 | ROLLBACK_GROUP         | NOTICE       | Rollback id 4                | 0 / 5 tables effectively processed.                            | postgres
    3105 | ROLLBACK_GROUP         | NOTICE       | Rollback id 4                | 2 sequences processed.                                         | postgres
    3106 | ROLLBACK_GROUP         | END          | myGroup1                     | Rollback_id 4, 0 tables and 2 sequences effectively processed  | postgres
    3107 | ROLLBACK_GROUP         | BEGIN        | myGroup2                     | Unlogged rollback to mark Mark21 (timestamp)                   | postgres
    3108 | DBLINK_OPEN_CNX        |              | rlbk#1                       | Status = -1                                                    | postgres
    3109 | LOCK_GROUP             | BEGIN        | myGroup2                     | Rollback session #1                                            | postgres
    3110 | LOCK_GROUP             | END          | myGroup2                     | Rollback session #1: 6 tables locked, 0 deadlock(s)            | postgres
    3111 | ROLLBACK_GROUP         | MARK DELETED | myGroup2                     | mark Different_Mark is deleted                                 | postgres
    3112 | ROLLBACK_SEQUENCE      |              | myschema2.myseq1             |                                                                | postgres
    3113 | ROLLBACK_SEQUENCE      |              | myschema2."myTbl3_col31_seq" |                                                                | postgres
    3114 | ROLLBACK_GROUP         | NOTICE       | Rollback id 5                | 0 / 6 tables effectively processed.                            | postgres
    3115 | ROLLBACK_GROUP         | NOTICE       | Rollback id 5                | 2 sequences processed.                                         | postgres
    3116 | ROLLBACK_GROUP         | END          | myGroup2                     | Rollback_id 5, 0 tables and 2 sequences effectively processed  | postgres
    3117 | ROLLBACK_GROUP         | BEGIN        | myGroup1                     | Logged rollback to mark Different_Mark (timestamp)             | postgres
    3118 | DBLINK_OPEN_CNX        |              | rlbk#1                       | Status = -2                                                    | postgres
    3119 | LOCK_GROUP             | BEGIN        | myGroup1                     | Rollback session #1                                            | postgres
    3120 | LOCK_GROUP             | END          | myGroup1                     | Rollback session #1: 5 tables locked, 0 deadlock(s)            | postgres
    3121 | SET_MARK_GROUP         | BEGIN        | myGroup1                     | RLBK_Different_Mark_%_START                                    | postgres
    3122 | SET_MARK_GROUP         | END          | myGroup1                     | RLBK_Different_Mark_%_START                                    | postgres
    3123 | ROLLBACK_SEQUENCE      |              | myschema1."myTbl3_col31_seq" |                                                                | postgres
    3124 | ROLLBACK_SEQUENCE      |              | myschema1.mytbl2b_col20_seq  |                                                                | postgres
    3125 | SET_MARK_GROUP         | BEGIN        | myGroup1                     | RLBK_Different_Mark_%_DONE                                     | postgres
    3126 | SET_MARK_GROUP         | END          | myGroup1                     | RLBK_Different_Mark_%_DONE                                     | postgres
    3127 | ROLLBACK_GROUP         | NOTICE       | Rollback id 6                | 0 / 5 tables effectively processed.                            | postgres
    3128 | ROLLBACK_GROUP         | NOTICE       | Rollback id 6                | 2 sequences processed.                                         | postgres
    3129 | ROLLBACK_GROUP         | END          | myGroup1                     | Rollback_id 6, 0 tables and 2 sequences effectively processed  | postgres
    3130 | ROLLBACK_GROUP         | BEGIN        | myGroup2                     | Logged rollback to mark Mark21 (timestamp)                     | postgres
    3131 | DBLINK_OPEN_CNX        |              | rlbk#1                       | Status = -2                                                    | postgres
    3132 | LOCK_GROUP             | BEGIN        | myGroup2                     | Rollback session #1                                            | postgres
    3133 | LOCK_GROUP             | END          | myGroup2                     | Rollback session #1: 6 tables locked, 0 deadlock(s)            | postgres
    3134 | SET_MARK_GROUP         | BEGIN        | myGroup2                     | RLBK_Mark21_%_START                                            | postgres
    3135 | SET_MARK_GROUP         | END          | myGroup2                     | RLBK_Mark21_%_START                                            | postgres
    3136 | ROLLBACK_SEQUENCE      |              | myschema2.myseq1             |                                                                | postgres
    3137 | ROLLBACK_SEQUENCE      |              | myschema2."myTbl3_col31_seq" |                                                                | postgres
    3138 | SET_MARK_GROUP         | BEGIN        | myGroup2                     | RLBK_Mark21_%_DONE                                             | postgres
    3139 | SET_MARK_GROUP         | END          | myGroup2                     | RLBK_Mark21_%_DONE                                             | postgres
    3140 | ROLLBACK_GROUP         | NOTICE       | Rollback id 7                | 0 / 6 tables effectively processed.                            | postgres
    3141 | ROLLBACK_GROUP         | NOTICE       | Rollback id 7                | 2 sequences processed.                                         | postgres
    3142 | ROLLBACK_GROUP         | END          | myGroup2                     | Rollback_id 7, 0 tables and 2 sequences effectively processed  | postgres
    3143 | SET_MARK_GROUPS        | BEGIN        | myGroup1,myGroup2            | Mark1B                                                         | postgres
    3144 | LOCK_GROUPS            | BEGIN        | myGroup1,myGroup2            |                                                                | postgres
    3145 | LOCK_GROUPS            | END          | myGroup1,myGroup2            | 11 tables locked, 0 deadlock(s)                                | postgres
    3146 | SET_MARK_GROUPS        | END          | myGroup1,myGroup2            | Mark1B                                                         | postgres
    3147 | ROLLBACK_GROUPS        | BEGIN        | myGroup1,myGroup2            | Unlogged rollback to mark Mark1B (timestamp)                   | postgres
    3148 | DBLINK_OPEN_CNX        |              | rlbk#1                       | Status = -5                                                    | postgres
    3149 | LOCK_GROUP             | BEGIN        | myGroup1,myGroup2            | Rollback session #1                                            | postgres
    3150 | LOCK_GROUP             | END          | myGroup1,myGroup2            | Rollback session #1: 11 tables locked, 0 deadlock(s)           | postgres
    3151 | ROLLBACK_SEQUENCE      |              | myschema1."myTbl3_col31_seq" |                                                                | postgres
    3152 | ROLLBACK_SEQUENCE      |              | myschema1.mytbl2b_col20_seq  |                                                                | postgres
    3153 | ROLLBACK_SEQUENCE      |              | myschema2.myseq1             |                                                                | postgres
    3154 | ROLLBACK_SEQUENCE      |              | myschema2."myTbl3_col31_seq" |                                                                | postgres
    3155 | ROLLBACK_GROUPS        | NOTICE       | Rollback id 8                | 0 / 11 tables effectively processed.                           | postgres
    3156 | ROLLBACK_GROUPS        | NOTICE       | Rollback id 8                | 4 sequences processed.                                         | postgres
    3157 | ROLLBACK_GROUPS        | END          | myGroup1,myGroup2            | Rollback_id 8, 0 tables and 4 sequences effectively processed  | postgres
    3158 | ROLLBACK_GROUPS        | BEGIN        | myGroup1,myGroup2            | Unlogged rollback to mark Mark1B (timestamp)                   | postgres
    3159 | DBLINK_OPEN_CNX        |              | rlbk#1                       | Status = -6                                                    | postgres
    3160 | LOCK_GROUP             | BEGIN        | myGroup1,myGroup2            | Rollback session #1                                            | postgres
    3161 | LOCK_GROUP             | END          | myGroup1,myGroup2            | Rollback session #1: 11 tables locked, 0 deadlock(s)           | postgres
    3162 | ROLLBACK_SEQUENCE      |              | myschema1."myTbl3_col31_seq" |                                                                | postgres
    3163 | ROLLBACK_SEQUENCE      |              | myschema1.mytbl2b_col20_seq  |                                                                | postgres
    3164 | ROLLBACK_SEQUENCE      |              | myschema2.myseq1             |                                                                | postgres
    3165 | ROLLBACK_SEQUENCE      |              | myschema2."myTbl3_col31_seq" |                                                                | postgres
    3166 | ROLLBACK_GROUPS        | NOTICE       | Rollback id 9                | 0 / 11 tables effectively processed.                           | postgres
    3167 | ROLLBACK_GROUPS        | NOTICE       | Rollback id 9                | 4 sequences processed.                                         | postgres
    3168 | ROLLBACK_GROUPS        | END          | myGroup1,myGroup2            | Rollback_id 9, 0 tables and 4 sequences effectively processed  | postgres
    3169 | ROLLBACK_GROUPS        | BEGIN        | myGroup1,myGroup2            | Logged rollback to mark Mark1B (timestamp)                     | postgres
    3170 | DBLINK_OPEN_CNX        |              | rlbk#1                       | Status = -4                                                    | postgres
    3171 | LOCK_GROUP             | BEGIN        | myGroup1,myGroup2            | Rollback session #1                                            | postgres
    3172 | LOCK_GROUP             | END          | myGroup1,myGroup2            | Rollback session #1: 11 tables locked, 0 deadlock(s)           | postgres
    3173 | SET_MARK_GROUPS        | BEGIN        | myGroup1,myGroup2            | RLBK_Mark1B_%_START                                            | postgres
    3174 | SET_MARK_GROUPS        | END          | myGroup1,myGroup2            | RLBK_Mark1B_%_START                                            | postgres
    3175 | ROLLBACK_SEQUENCE      |              | myschema1."myTbl3_col31_seq" |                                                                | postgres
    3176 | ROLLBACK_SEQUENCE      |              | myschema1.mytbl2b_col20_seq  |                                                                | postgres
    3177 | ROLLBACK_SEQUENCE      |              | myschema2.myseq1             |                                                                | postgres
    3178 | ROLLBACK_SEQUENCE      |              | myschema2."myTbl3_col31_seq" |                                                                | postgres
    3179 | SET_MARK_GROUPS        | BEGIN        | myGroup1,myGroup2            | RLBK_Mark1B_%_DONE                                             | postgres
    3180 | SET_MARK_GROUPS        | END          | myGroup1,myGroup2            | RLBK_Mark1B_%_DONE                                             | postgres
    3181 | ROLLBACK_GROUPS        | NOTICE       | Rollback id 10               | 0 / 11 tables effectively processed.                           | postgres
    3182 | ROLLBACK_GROUPS        | NOTICE       | Rollback id 10               | 4 sequences processed.                                         | postgres
    3183 | ROLLBACK_GROUPS        | END          | myGroup1,myGroup2            | Rollback_id 10, 0 tables and 4 sequences effectively processed | postgres
    3184 | ROLLBACK_GROUPS        | BEGIN        | myGroup1,myGroup2            | Logged rollback to mark Mark1B (timestamp)                     | postgres
    3185 | DBLINK_OPEN_CNX        |              | rlbk#1                       | Status = 1                                                     | postgres
    3186 | LOCK_GROUP             | BEGIN        | myGroup1,myGroup2            | Rollback session #1                                            | postgres
    3187 | LOCK_GROUP             | END          | myGroup1,myGroup2            | Rollback session #1: 11 tables locked, 0 deadlock(s)           | postgres
    3188 | SET_MARK_GROUPS        | BEGIN        | myGroup1,myGroup2            | RLBK_Mark1B_%_START                                            | postgres
    3189 | SET_MARK_GROUPS        | END          | myGroup1,myGroup2            | RLBK_Mark1B_%_START                                            | postgres
    3190 | ROLLBACK_SEQUENCE      |              | myschema1."myTbl3_col31_seq" |                                                                | postgres
    3191 | ROLLBACK_SEQUENCE      |              | myschema1.mytbl2b_col20_seq  |                                                                | postgres
    3192 | ROLLBACK_SEQUENCE      |              | myschema2.myseq1             |                                                                | postgres
    3193 | ROLLBACK_SEQUENCE      |              | myschema2."myTbl3_col31_seq" |                                                                | postgres
    3194 | SET_MARK_GROUPS        | BEGIN        | myGroup1,myGroup2            | RLBK_Mark1B_%_DONE                                             | postgres
    3195 | SET_MARK_GROUPS        | END          | myGroup1,myGroup2            | RLBK_Mark1B_%_DONE                                             | postgres
    3196 | ROLLBACK_GROUPS        | NOTICE       | Rollback id 11               | 0 / 11 tables effectively processed.                           | postgres
    3197 | ROLLBACK_GROUPS        | NOTICE       | Rollback id 11               | 4 sequences processed.                                         | postgres
    3198 | DBLINK_CLOSE_CNX       |              | rlbk#1                       |                                                                | postgres
    3199 | ROLLBACK_GROUPS        | END          | myGroup1,myGroup2            | Rollback_id 11, 0 tables and 4 sequences effectively processed | postgres
    3200 | STOP_GROUPS            | BEGIN        | myGroup1,myGroup2            |                                                                | postgres
    3201 | LOCK_GROUPS            | BEGIN        | myGroup1,myGroup2            |                                                                | postgres
    3202 | LOCK_GROUPS            | END          | myGroup1,myGroup2            | 11 tables locked, 0 deadlock(s)                                | postgres
    3203 | SET_MARK_GROUPS        | BEGIN        | myGroup1,myGroup2            | STOP_%                                                         | postgres
    3204 | CLEANUP_RLBK_STATE     |              | Rollback id 11               | set to COMMITTED                                               | postgres
    3205 | SET_MARK_GROUPS        | END          | myGroup1,myGroup2            | STOP_%                                                         | postgres
    3206 | STOP_GROUPS            | END          | myGroup1,myGroup2            | 15 tables/sequences processed                                  | postgres
    3207 | START_GROUP            | BEGIN        | myGroup1                     | With log reset                                                 | postgres
    3208 | LOCK_GROUP             | BEGIN        | myGroup1                     |                                                                | postgres
    3209 | LOCK_GROUP             | END          | myGroup1                     | 5 tables locked, 0 deadlock(s)                                 | postgres
    3210 | SET_MARK_GROUP         | BEGIN        | myGroup1                     | Mark11                                                         | postgres
    3211 | SET_MARK_GROUP         | END          | myGroup1                     | Mark11                                                         | postgres
    3212 | START_GROUP            | END          | myGroup1                     | 7 tables/sequences processed                                   | postgres
    3213 | START_GROUP            | BEGIN        | myGroup2                     | With log reset                                                 | postgres
    3214 | LOCK_GROUP             | BEGIN        | myGroup2                     |                                                                | postgres
    3215 | LOCK_GROUP             | END          | myGroup2                     | 6 tables locked, 0 deadlock(s)                                 | postgres
    3216 | SET_MARK_GROUP         | BEGIN        | myGroup2                     | Mark21                                                         | postgres
    3217 | SET_MARK_GROUP         | END          | myGroup2                     | Mark21                                                         | postgres
    3218 | START_GROUP            | END          | myGroup2                     | 8 tables/sequences processed                                   | postgres
    3219 | SET_MARK_GROUP         | BEGIN        | myGroup1                     |                                                                | postgres
    3220 | LOCK_GROUP             | BEGIN        | myGroup1                     |                                                                | postgres
    3221 | LOCK_GROUP             | END          | myGroup1                     | 5 tables locked, 0 deadlock(s)                                 | postgres
    3222 | SET_MARK_GROUP         | END          | myGroup1                     | Mark12                                                         | postgres
    3223 | SET_MARK_GROUP         | BEGIN        | myGroup1                     |                                                                | postgres
    3224 | LOCK_GROUP             | BEGIN        | myGroup1                     |                                                                | postgres
    3225 | LOCK_GROUP             | END          | myGroup1                     | 5 tables locked, 0 deadlock(s)                                 | postgres
    3226 | SET_MARK_GROUP         | END          | myGroup1                     | Mark13                                                         | postgres
    3227 | ROLLBACK_GROUP         | BEGIN        | myGroup1                     | Unlogged rollback to mark Mark12 (timestamp)                   | postgres
    3228 | DBLINK_OPEN_CNX        |              | rlbk#1                       | Status = 1                                                     | postgres
    3229 | LOCK_GROUP             | BEGIN        | myGroup1                     | Rollback session #1                                            | postgres
    3230 | LOCK_GROUP             | END          | myGroup1                     | Rollback session #1: 5 tables locked, 0 deadlock(s)            | postgres
    3231 | ROLLBACK_TABLE         | BEGIN        | myschema1."myTbl3"           | All log rows with emaj_gid > 29 and <= 41                      | postgres
    3232 | ROLLBACK_TABLE         | END          | myschema1."myTbl3"           | 10 rolled back primary keys                                    | postgres
    3233 | ROLLBACK_TABLE         | BEGIN        | myschema1.mytbl4             | All log rows with emaj_gid > 29 and <= 41                      | postgres
    3234 | ROLLBACK_TABLE         | END          | myschema1.mytbl4             | 1 rolled back primary keys                                     | postgres
    3235 | ROLLBACK_GROUP         | MARK DELETED | myGroup1                     | mark Mark13 is deleted                                         | postgres
    3236 | ROLLBACK_SEQUENCE      |              | myschema1."myTbl3_col31_seq" | RESTART 1                                                      | postgres
    3237 | ROLLBACK_SEQUENCE      |              | myschema1.mytbl2b_col20_seq  |                                                                | postgres
    3238 | ROLLBACK_GROUP         | NOTICE       | Rollback id 12               | 2 / 5 tables effectively processed.                            | postgres
    3239 | ROLLBACK_GROUP         | NOTICE       | Rollback id 12               | 2 sequences processed.                                         | postgres
    3240 | DBLINK_CLOSE_CNX       |              | rlbk#1                       |                                                                | postgres
    3241 | ROLLBACK_GROUP         | END          | myGroup1                     | Rollback_id 12, 2 tables and 2 sequences effectively processed | postgres
    3242 | ROLLBACK_GROUP         | BEGIN        | myGroup1                     | Unlogged rollback to mark Mark11 (timestamp)                   | postgres
    3243 | DBLINK_OPEN_CNX        |              | rlbk#1                       | Status = 1                                                     | postgres
    3244 | LOCK_GROUP             | BEGIN        | myGroup1                     | Rollback session #1                                            | postgres
    3245 | LOCK_GROUP             | END          | myGroup1                     | Rollback session #1: 5 tables locked, 0 deadlock(s)            | postgres
    3246 | ROLLBACK_TABLE         | BEGIN        | myschema1.mytbl1             | All log rows with emaj_gid > 2 and <= 41                       | postgres
    3247 | ROLLBACK_TABLE         | END          | myschema1.mytbl1             | 11 rolled back primary keys                                    | postgres
    3248 | ROLLBACK_TABLE         | BEGIN        | myschema1.mytbl2             | All log rows with emaj_gid > 2 and <= 41                       | postgres
    3249 | ROLLBACK_TABLE         | END          | myschema1.mytbl2             | 3 rolled back primary keys                                     | postgres
    3250 | ROLLBACK_TABLE         | BEGIN        | myschema1.mytbl2b            | All log rows with emaj_gid > 2 and <= 41                       | postgres
    3251 | ROLLBACK_TABLE         | END          | myschema1.mytbl2b            | 6 rolled back primary keys                                     | postgres
    3252 | ROLLBACK_GROUP         | MARK DELETED | myGroup1                     | mark Mark12 is deleted                                         | postgres
    3253 | ROLLBACK_SEQUENCE      |              | myschema1."myTbl3_col31_seq" |                                                                | postgres
    3254 | ROLLBACK_SEQUENCE      |              | myschema1.mytbl2b_col20_seq  | RESTART 1                                                      | postgres
    3255 | ROLLBACK_GROUP         | NOTICE       | Rollback id 13               | 3 / 5 tables effectively processed.                            | postgres
    3256 | ROLLBACK_GROUP         | NOTICE       | Rollback id 13               | 2 sequences processed.                                         | postgres
    3257 | DBLINK_CLOSE_CNX       |              | rlbk#1                       |                                                                | postgres
    3258 | ROLLBACK_GROUP         | END          | myGroup1                     | Rollback_id 13, 3 tables and 2 sequences effectively processed | postgres
    3259 | STOP_GROUP             | BEGIN        | myGroup1                     |                                                                | postgres
    3260 | LOCK_GROUP             | BEGIN        | myGroup1                     |                                                                | postgres
    3261 | LOCK_GROUP             | END          | myGroup1                     | 5 tables locked, 0 deadlock(s)                                 | postgres
    3262 | SET_MARK_GROUP         | BEGIN        | myGroup1                     | STOP_%                                                         | postgres
    3263 | CLEANUP_RLBK_STATE     |              | Rollback id 12               | set to COMMITTED                                               | postgres
    3264 | CLEANUP_RLBK_STATE     |              | Rollback id 13               | set to COMMITTED                                               | postgres
    3265 | SET_MARK_GROUP         | END          | myGroup1                     | STOP_%                                                         | postgres
    3266 | STOP_GROUP             | END          | myGroup1                     | 7 tables/sequences processed                                   | postgres
    3267 | START_GROUP            | BEGIN        | myGroup1                     | With log reset                                                 | postgres
    3268 | LOCK_GROUP             | BEGIN        | myGroup1                     |                                                                | postgres
    3269 | LOCK_GROUP             | END          | myGroup1                     | 5 tables locked, 0 deadlock(s)                                 | postgres
    3270 | SET_MARK_GROUP         | BEGIN        | myGroup1                     | Mark11                                                         | postgres
    3271 | SET_MARK_GROUP         | END          | myGroup1                     | Mark11                                                         | postgres
    3272 | START_GROUP            | END          | myGroup1                     | 7 tables/sequences processed                                   | postgres
    3273 | SET_MARK_GROUP         | BEGIN        | myGroup1                     |                                                                | postgres
    3274 | LOCK_GROUP             | BEGIN        | myGroup1                     |                                                                | postgres
    3275 | LOCK_GROUP             | END          | myGroup1                     | 5 tables locked, 0 deadlock(s)                                 | postgres
    3276 | SET_MARK_GROUP         | END          | myGroup1                     | Mark12                                                         | postgres
    3277 | SET_MARK_GROUP         | BEGIN        | myGroup1                     |                                                                | postgres
    3278 | LOCK_GROUP             | BEGIN        | myGroup1                     |                                                                | postgres
    3279 | LOCK_GROUP             | END          | myGroup1                     | 5 tables locked, 0 deadlock(s)                                 | postgres
    3280 | SET_MARK_GROUP         | END          | myGroup1                     | Mark13                                                         | postgres
    3281 | ROLLBACK_GROUP         | BEGIN        | myGroup1                     | Logged rollback to mark Mark12 (timestamp)                     | postgres
    3282 | DBLINK_OPEN_CNX        |              | rlbk#1                       | Status = 1                                                     | postgres
    3283 | LOCK_GROUP             | BEGIN        | myGroup1                     | Rollback session #1                                            | postgres
    3284 | LOCK_GROUP             | END          | myGroup1                     | Rollback session #1: 5 tables locked, 0 deadlock(s)            | postgres
    3285 | SET_MARK_GROUP         | BEGIN        | myGroup1                     | RLBK_Mark12_%_START                                            | postgres
    3286 | SET_MARK_GROUP         | END          | myGroup1                     | RLBK_Mark12_%_START                                            | postgres
    3287 | ROLLBACK_TABLE         | BEGIN        | myschema1."myTbl3"           | All log rows with emaj_gid > 60 and <= 71                      | postgres
    3288 | ROLLBACK_TABLE         | END          | myschema1."myTbl3"           | 10 rolled back primary keys                                    | postgres
    3289 | ROLLBACK_TABLE         | BEGIN        | myschema1.mytbl4             | All log rows with emaj_gid > 60 and <= 71                      | postgres
    3290 | ROLLBACK_TABLE         | END          | myschema1.mytbl4             | 1 rolled back primary keys                                     | postgres
    3291 | ROLLBACK_SEQUENCE      |              | myschema1."myTbl3_col31_seq" | RESTART 1                                                      | postgres
    3292 | ROLLBACK_SEQUENCE      |              | myschema1.mytbl2b_col20_seq  |                                                                | postgres
    3293 | SET_MARK_GROUP         | BEGIN        | myGroup1                     | RLBK_Mark12_%_DONE                                             | postgres
    3294 | SET_MARK_GROUP         | END          | myGroup1                     | RLBK_Mark12_%_DONE                                             | postgres
    3295 | ROLLBACK_GROUP         | NOTICE       | Rollback id 14               | 2 / 5 tables effectively processed.                            | postgres
    3296 | ROLLBACK_GROUP         | NOTICE       | Rollback id 14               | 2 sequences processed.                                         | postgres
    3297 | DBLINK_CLOSE_CNX       |              | rlbk#1                       |                                                                | postgres
    3298 | ROLLBACK_GROUP         | END          | myGroup1                     | Rollback_id 14, 2 tables and 2 sequences effectively processed | postgres
    3299 | ROLLBACK_GROUP         | BEGIN        | myGroup1                     | Logged rollback to mark Mark11 (timestamp)                     | postgres
    3300 | DBLINK_OPEN_CNX        |              | rlbk#1                       | Status = 1                                                     | postgres
    3301 | LOCK_GROUP             | BEGIN        | myGroup1                     | Rollback session #1                                            | postgres
    3302 | LOCK_GROUP             | END          | myGroup1                     | Rollback session #1: 5 tables locked, 0 deadlock(s)            | postgres
    3303 | SET_MARK_GROUP         | BEGIN        | myGroup1                     | RLBK_Mark11_%_START                                            | postgres
    3304 | CLEANUP_RLBK_STATE     |              | Rollback id 14               | set to COMMITTED                                               | postgres
    3305 | SET_MARK_GROUP         | END          | myGroup1                     | RLBK_Mark11_%_START                                            | postgres
    3306 | ROLLBACK_TABLE         | BEGIN        | myschema1."myTbl3"           | All log rows with emaj_gid > 41 and <= 82                      | postgres
    3307 | ROLLBACK_TABLE         | END          | myschema1."myTbl3"           | 10 rolled back primary keys                                    | postgres
    3308 | ROLLBACK_TABLE         | BEGIN        | myschema1.mytbl1             | All log rows with emaj_gid > 41 and <= 82                      | postgres
    3309 | ROLLBACK_TABLE         | END          | myschema1.mytbl1             | 11 rolled back primary keys                                    | postgres
    3310 | ROLLBACK_TABLE         | BEGIN        | myschema1.mytbl2             | All log rows with emaj_gid > 41 and <= 82                      | postgres
    3311 | ROLLBACK_TABLE         | END          | myschema1.mytbl2             | 2 rolled back primary keys                                     | postgres
    3312 | ROLLBACK_TABLE         | BEGIN        | myschema1.mytbl4             | All log rows with emaj_gid > 41 and <= 82                      | postgres
    3313 | ROLLBACK_TABLE         | END          | myschema1.mytbl4             | 1 rolled back primary keys                                     | postgres
    3314 | ROLLBACK_TABLE         | BEGIN        | myschema1.mytbl2b            | All log rows with emaj_gid > 41 and <= 82                      | postgres
    3315 | ROLLBACK_TABLE         | END          | myschema1.mytbl2b            | 2 rolled back primary keys                                     | postgres
    3316 | ROLLBACK_SEQUENCE      |              | myschema1."myTbl3_col31_seq" |                                                                | postgres
    3317 | ROLLBACK_SEQUENCE      |              | myschema1.mytbl2b_col20_seq  | RESTART 1                                                      | postgres
    3318 | SET_MARK_GROUP         | BEGIN        | myGroup1                     | RLBK_Mark11_%_DONE                                             | postgres
    3319 | SET_MARK_GROUP         | END          | myGroup1                     | RLBK_Mark11_%_DONE                                             | postgres
    3320 | ROLLBACK_GROUP         | NOTICE       | Rollback id 15               | 5 / 5 tables effectively processed.                            | postgres
    3321 | ROLLBACK_GROUP         | NOTICE       | Rollback id 15               | 2 sequences processed.                                         | postgres
    3322 | DBLINK_CLOSE_CNX       |              | rlbk#1                       |                                                                | postgres
    3323 | ROLLBACK_GROUP         | END          | myGroup1                     | Rollback_id 15, 5 tables and 2 sequences effectively processed | postgres
    3324 | ROLLBACK_GROUP         | BEGIN        | myGroup1                     | Unlogged rollback to mark Mark13 (timestamp)                   | postgres
    3325 | DBLINK_OPEN_CNX        |              | rlbk#1                       | Status = 1                                                     | postgres
    3326 | LOCK_GROUP             | BEGIN        | myGroup1                     | Rollback session #1                                            | postgres
    3327 | LOCK_GROUP             | END          | myGroup1                     | Rollback session #1: 5 tables locked, 0 deadlock(s)            | postgres
    3328 | ROLLBACK_TABLE         | BEGIN        | myschema1.mytbl1             | All log rows with emaj_gid > 71 and <= 96                      | postgres
    3329 | ROLLBACK_TABLE         | END          | myschema1.mytbl1             | 10 rolled back primary keys                                    | postgres
    3330 | ROLLBACK_TABLE         | BEGIN        | myschema1.mytbl2             | All log rows with emaj_gid > 71 and <= 96                      | postgres
    3331 | ROLLBACK_TABLE         | END          | myschema1.mytbl2             | 2 rolled back primary keys                                     | postgres
    3332 | ROLLBACK_TABLE         | BEGIN        | myschema1.mytbl4             | All log rows with emaj_gid > 71 and <= 96                      | postgres
    3333 | ROLLBACK_TABLE         | END          | myschema1.mytbl4             | 1 rolled back primary keys                                     | postgres
    3334 | ROLLBACK_TABLE         | BEGIN        | myschema1."myTbl3"           | All log rows with emaj_gid > 71 and <= 96                      | postgres
    3335 | ROLLBACK_TABLE         | END          | myschema1."myTbl3"           | 10 rolled back primary keys                                    | postgres
    3336 | ROLLBACK_TABLE         | BEGIN        | myschema1.mytbl2b            | All log rows with emaj_gid > 71 and <= 96                      | postgres
    3337 | ROLLBACK_TABLE         | END          | myschema1.mytbl2b            | 2 rolled back primary keys                                     | postgres
    3338 | ROLLBACK_GROUP         | MARK DELETED | myGroup1                     | mark RLBK_Mark12_%_START is deleted                            | postgres
    3339 | ROLLBACK_GROUP         | MARK DELETED | myGroup1                     | mark RLBK_Mark12_%_DONE is deleted                             | postgres
    3340 | ROLLBACK_GROUP         | MARK DELETED | myGroup1                     | mark RLBK_Mark11_%_START is deleted                            | postgres
    3341 | ROLLBACK_GROUP         | MARK DELETED | myGroup1                     | mark RLBK_Mark11_%_DONE is deleted                             | postgres
    3342 | ROLLBACK_SEQUENCE      |              | myschema1."myTbl3_col31_seq" | RESTART 11                                                     | postgres
    3343 | ROLLBACK_SEQUENCE      |              | myschema1.mytbl2b_col20_seq  | RESTART 3                                                      | postgres
    3344 | ROLLBACK_GROUP         | NOTICE       | Rollback id 16               | 5 / 5 tables effectively processed.                            | postgres
    3345 | ROLLBACK_GROUP         | NOTICE       | Rollback id 16               | 2 sequences processed.                                         | postgres
    3346 | DBLINK_CLOSE_CNX       |              | rlbk#1                       |                                                                | postgres
    3347 | ROLLBACK_GROUP         | END          | myGroup1                     | Rollback_id 16, 5 tables and 2 sequences effectively processed | postgres
    3348 | ROLLBACK_GROUP         | BEGIN        | emptyGroup                   | Unlogged rollback to mark EGM4 (timestamp)                     | postgres
    3349 | DBLINK_OPEN_CNX        |              | rlbk#1                       | Status = 1                                                     | postgres
    3350 | LOCK_GROUP             | BEGIN        | emptyGroup                   | Rollback session #1                                            | postgres
    3351 | LOCK_GROUP             | END          | emptyGroup                   | Rollback session #1: 0 tables locked, 0 deadlock(s)            | postgres
    3352 | ROLLBACK_GROUP         | NOTICE       | Rollback id 17               | 0 / 0 tables effectively processed.                            | postgres
    3353 | DBLINK_CLOSE_CNX       |              | rlbk#1                       |                                                                | postgres
    3354 | ROLLBACK_GROUP         | END          | emptyGroup                   | Rollback_id 17, 0 tables and 0 sequences effectively processed | postgres
    3355 | ROLLBACK_GROUP         | BEGIN        | emptyGroup                   | Logged rollback to mark EGM3 (timestamp)                       | postgres
    3356 | DBLINK_OPEN_CNX        |              | rlbk#1                       | Status = 1                                                     | postgres
    3357 | LOCK_GROUP             | BEGIN        | emptyGroup                   | Rollback session #1                                            | postgres
    3358 | LOCK_GROUP             | END          | emptyGroup                   | Rollback session #1: 0 tables locked, 0 deadlock(s)            | postgres
    3359 | SET_MARK_GROUP         | BEGIN        | emptyGroup                   | RLBK_EGM3_%_START                                              | postgres
    3360 | CLEANUP_RLBK_STATE     |              | Rollback id 15               | set to COMMITTED                                               | postgres
    3361 | CLEANUP_RLBK_STATE     |              | Rollback id 16               | set to COMMITTED                                               | postgres
    3362 | CLEANUP_RLBK_STATE     |              | Rollback id 17               | set to COMMITTED                                               | postgres
    3363 | SET_MARK_GROUP         | END          | emptyGroup                   | RLBK_EGM3_%_START                                              | postgres
    3364 | SET_MARK_GROUP         | BEGIN        | emptyGroup                   | RLBK_EGM3_%_DONE                                               | postgres
    3365 | SET_MARK_GROUP         | END          | emptyGroup                   | RLBK_EGM3_%_DONE                                               | postgres
    3366 | ROLLBACK_GROUP         | NOTICE       | Rollback id 18               | 0 / 0 tables effectively processed.                            | postgres
    3367 | DBLINK_CLOSE_CNX       |              | rlbk#1                       |                                                                | postgres
    3368 | ROLLBACK_GROUP         | END          | emptyGroup                   | Rollback_id 18, 0 tables and 0 sequences effectively processed | postgres
    3369 | START_GROUP            | BEGIN        | myGroup4                     | With log reset                                                 | postgres
    3370 | LOCK_GROUP             | BEGIN        | myGroup4                     |                                                                | postgres
    3371 | LOCK_GROUP             | END          | myGroup4                     | 5 tables locked, 0 deadlock(s)                                 | postgres
    3372 | SET_MARK_GROUP         | BEGIN        | myGroup4                     | myGroup4_start                                                 | postgres
    3373 | CLEANUP_RLBK_STATE     |              | Rollback id 18               | set to COMMITTED                                               | postgres
    3374 | SET_MARK_GROUP         | END          | myGroup4                     | myGroup4_start                                                 | postgres
    3375 | START_GROUP            | END          | myGroup4                     | 5 tables/sequences processed                                   | postgres
    3376 | SET_MARK_GROUP         | BEGIN        | myGroup4                     |                                                                | postgres
    3377 | LOCK_GROUP             | BEGIN        | myGroup4                     |                                                                | postgres
    3378 | LOCK_GROUP             | END          | myGroup4                     | 5 tables locked, 0 deadlock(s)                                 | postgres
    3379 | SET_MARK_GROUP         | END          | myGroup4                     | mark1                                                          | postgres
    3380 | ROLLBACK_GROUP         | BEGIN        | myGroup4                     | Logged rollback to mark mark1 (timestamp)                      | postgres
    3381 | DBLINK_OPEN_CNX        |              | rlbk#1                       | Status = 1                                                     | postgres
    3382 | LOCK_GROUP             | BEGIN        | myGroup4                     | Rollback session #1                                            | postgres
    3383 | LOCK_GROUP             | END          | myGroup4                     | Rollback session #1: 5 tables locked, 0 deadlock(s)            | postgres
    3384 | SET_MARK_GROUP         | BEGIN        | myGroup4                     | RLBK_mark1_%_START                                             | postgres
    3385 | SET_MARK_GROUP         | END          | myGroup4                     | RLBK_mark1_%_START                                             | postgres
    3386 | ROLLBACK_TABLE         | BEGIN        | myschema4.mytblc1            | All log rows with emaj_gid > 99 and <= 102                     | postgres
    3387 | ROLLBACK_TABLE         | END          | myschema4.mytblc1            | 1 rolled back primary keys                                     | postgres
    3388 | ROLLBACK_TABLE         | BEGIN        | myschema4.mytblc2            | All log rows with emaj_gid > 99 and <= 102                     | postgres
    3389 | ROLLBACK_TABLE         | END          | myschema4.mytblc2            | 1 rolled back primary keys                                     | postgres
    3390 | ROLLBACK_TABLE         | BEGIN        | myschema4.mytblm             | All log rows with emaj_gid > 99 and <= 102                     | postgres
    3391 | ROLLBACK_TABLE         | END          | myschema4.mytblm             | 1 rolled back primary keys                                     | postgres
    3392 | SET_MARK_GROUP         | BEGIN        | myGroup4                     | RLBK_mark1_%_DONE                                              | postgres
    3393 | SET_MARK_GROUP         | END          | myGroup4                     | RLBK_mark1_%_DONE                                              | postgres
    3394 | ROLLBACK_GROUP         | NOTICE       | Rollback id 19               | 3 / 5 tables effectively processed.                            | postgres
    3395 | DBLINK_CLOSE_CNX       |              | rlbk#1                       |                                                                | postgres
    3396 | ROLLBACK_GROUP         | END          | myGroup4                     | Rollback_id 19, 3 tables and 0 sequences effectively processed | postgres
    3397 | ROLLBACK_GROUP         | BEGIN        | myGroup4                     | Unlogged rollback to mark myGroup4_start (timestamp)           | postgres
    3398 | DBLINK_OPEN_CNX        |              | rlbk#1                       | Status = 1                                                     | postgres
    3399 | LOCK_GROUP             | BEGIN        | myGroup4                     | Rollback session #1                                            | postgres
    3400 | LOCK_GROUP             | END          | myGroup4                     | Rollback session #1: 5 tables locked, 0 deadlock(s)            | postgres
    3401 | ROLLBACK_TABLE         | BEGIN        | myschema4.mytblc1            | All log rows with emaj_gid > 96 and <= 105                     | postgres
    3402 | ROLLBACK_TABLE         | END          | myschema4.mytblc1            | 1 rolled back primary keys                                     | postgres
    3403 | ROLLBACK_TABLE         | BEGIN        | myschema4.mytblc2            | All log rows with emaj_gid > 96 and <= 105                     | postgres
    3404 | ROLLBACK_TABLE         | END          | myschema4.mytblc2            | 1 rolled back primary keys                                     | postgres
    3405 | ROLLBACK_TABLE         | BEGIN        | myschema4.mytblm             | All log rows with emaj_gid > 96 and <= 105                     | postgres
    3406 | ROLLBACK_TABLE         | END          | myschema4.mytblm             | 1 rolled back primary keys                                     | postgres
    3407 | ROLLBACK_GROUP         | MARK DELETED | myGroup4                     | mark mark1 is deleted                                          | postgres
    3408 | ROLLBACK_GROUP         | MARK DELETED | myGroup4                     | mark RLBK_mark1_%_START is deleted                             | postgres
    3409 | ROLLBACK_GROUP         | MARK DELETED | myGroup4                     | mark RLBK_mark1_%_DONE is deleted                              | postgres
    3410 | ROLLBACK_GROUP         | NOTICE       | Rollback id 20               | 3 / 5 tables effectively processed.                            | postgres
    3411 | DBLINK_CLOSE_CNX       |              | rlbk#1                       |                                                                | postgres
    3412 | ROLLBACK_GROUP         | END          | myGroup4                     | Rollback_id 20, 3 tables and 0 sequences effectively processed | postgres
    3414 | SET_MARK_GROUP         | BEGIN        | myGroup1                     |                                                                | postgres
    3415 | LOCK_GROUP             | BEGIN        | myGroup1                     |                                                                | postgres
    3416 | LOCK_GROUP             | END          | myGroup1                     | 5 tables locked, 0 deadlock(s)                                 | postgres
    3417 | CLEANUP_RLBK_STATE     |              | Rollback id 19               | set to COMMITTED                                               | postgres
    3418 | CLEANUP_RLBK_STATE     |              | Rollback id 20               | set to COMMITTED                                               | postgres
    3419 | SET_MARK_GROUP         | END          | myGroup1                     | Conso_M1                                                       | postgres
    3420 | ROLLBACK_GROUP         | BEGIN        | myGroup1                     | Logged rollback to mark Conso_M1 (timestamp)                   | postgres
    3421 | DBLINK_OPEN_CNX        |              | rlbk#1                       | Status = 1                                                     | postgres
    3422 | LOCK_GROUP             | BEGIN        | myGroup1                     | Rollback session #1                                            | postgres
    3423 | LOCK_GROUP             | END          | myGroup1                     | Rollback session #1: 5 tables locked, 0 deadlock(s)            | postgres
    3424 | SET_MARK_GROUP         | BEGIN        | myGroup1                     | RLBK_Conso_M1_%_START                                          | postgres
    3425 | SET_MARK_GROUP         | END          | myGroup1                     | RLBK_Conso_M1_%_START                                          | postgres
    3426 | ROLLBACK_SEQUENCE      |              | myschema1."myTbl3_col31_seq" |                                                                | postgres
    3427 | ROLLBACK_SEQUENCE      |              | myschema1.mytbl2b_col20_seq  |                                                                | postgres
    3428 | SET_MARK_GROUP         | BEGIN        | myGroup1                     | RLBK_Conso_M1_%_DONE                                           | postgres
    3429 | SET_MARK_GROUP         | END          | myGroup1                     | RLBK_Conso_M1_%_DONE                                           | postgres
    3430 | ROLLBACK_GROUP         | NOTICE       | Rollback id 21               | 0 / 5 tables effectively processed.                            | postgres
    3431 | ROLLBACK_GROUP         | NOTICE       | Rollback id 21               | 2 sequences processed.                                         | postgres
    3432 | DBLINK_CLOSE_CNX       |              | rlbk#1                       |                                                                | postgres
    3433 | ROLLBACK_GROUP         | END          | myGroup1                     | Rollback_id 21, 0 tables and 2 sequences effectively processed | postgres
    3434 | CONSOLIDATE_RLBK_GROUP | BEGIN        | myGroup1                     | Erase all between marks Conso_M1 and RLBK_Conso_M1_%_DONE      | postgres
    3435 | CONSOLIDATE_RLBK_GROUP | END          | myGroup1                     | 0 tables and 2 sequences processed ; 1 marks deleted           | postgres
    3436 | SET_MARK_GROUP         | BEGIN        | myGroup1                     |                                                                | postgres
    3437 | LOCK_GROUP             | BEGIN        | myGroup1                     |                                                                | postgres
    3438 | LOCK_GROUP             | END          | myGroup1                     | 5 tables locked, 0 deadlock(s)                                 | postgres
    3439 | CLEANUP_RLBK_STATE     |              | Rollback id 21               | set to COMMITTED                                               | postgres
    3440 | SET_MARK_GROUP         | END          | myGroup1                     | Conso_M2                                                       | postgres
    3441 | SET_MARK_GROUP         | BEGIN        | myGroup1                     |                                                                | postgres
    3442 | LOCK_GROUP             | BEGIN        | myGroup1                     |                                                                | postgres
    3443 | LOCK_GROUP             | END          | myGroup1                     | 5 tables locked, 0 deadlock(s)                                 | postgres
    3444 | SET_MARK_GROUP         | END          | myGroup1                     | Conso_M3                                                       | postgres
    3445 | ROLLBACK_GROUP         | BEGIN        | myGroup1                     | Logged rollback to mark Conso_M2 (timestamp)                   | postgres
    3446 | DBLINK_OPEN_CNX        |              | rlbk#1                       | Status = 1                                                     | postgres
    3447 | LOCK_GROUP             | BEGIN        | myGroup1                     | Rollback session #1                                            | postgres
    3448 | LOCK_GROUP             | END          | myGroup1                     | Rollback session #1: 5 tables locked, 0 deadlock(s)            | postgres
    3449 | SET_MARK_GROUP         | BEGIN        | myGroup1                     | RLBK_Conso_M2_%_START                                          | postgres
    3450 | SET_MARK_GROUP         | END          | myGroup1                     | RLBK_Conso_M2_%_START                                          | postgres
    3451 | ROLLBACK_TABLE         | BEGIN        | myschema1.mytbl1             | All log rows with emaj_gid > 105 and <= 122                    | postgres
    3452 | ROLLBACK_TABLE         | END          | myschema1.mytbl1             | 12 rolled back primary keys                                    | postgres
    3453 | ROLLBACK_TABLE         | BEGIN        | myschema1.mytbl2             | All log rows with emaj_gid > 105 and <= 122                    | postgres
    3454 | ROLLBACK_TABLE         | END          | myschema1.mytbl2             | 1 rolled back primary keys                                     | postgres
    3455 | ROLLBACK_TABLE         | BEGIN        | myschema1.mytbl2b            | All log rows with emaj_gid > 105 and <= 122                    | postgres
    3456 | ROLLBACK_TABLE         | END          | myschema1.mytbl2b            | 2 rolled back primary keys                                     | postgres
    3457 | ROLLBACK_SEQUENCE      |              | myschema1."myTbl3_col31_seq" |                                                                | postgres
    3458 | ROLLBACK_SEQUENCE      |              | myschema1.mytbl2b_col20_seq  | RESTART 3                                                      | postgres
    3459 | SET_MARK_GROUP         | BEGIN        | myGroup1                     | RLBK_Conso_M2_%_DONE                                           | postgres
    3460 | SET_MARK_GROUP         | END          | myGroup1                     | RLBK_Conso_M2_%_DONE                                           | postgres
    3461 | ROLLBACK_GROUP         | NOTICE       | Rollback id 22               | 3 / 5 tables effectively processed.                            | postgres
    3462 | ROLLBACK_GROUP         | NOTICE       | Rollback id 22               | 2 sequences processed.                                         | postgres
    3463 | DBLINK_CLOSE_CNX       |              | rlbk#1                       |                                                                | postgres
    3464 | ROLLBACK_GROUP         | END          | myGroup1                     | Rollback_id 22, 3 tables and 2 sequences effectively processed | postgres
    3465 | RENAME_MARK_GROUP      | BEGIN        | myGroup1                     | Conso_M2                                                       | postgres
    3466 | RENAME_MARK_GROUP      | END          | myGroup1                     | Conso_M2 renamed Renamed_conso_M2                              | postgres
    3467 | RENAME_MARK_GROUP      | BEGIN        | myGroup1                     | EMAJ_LAST_MARK                                                 | postgres
    3468 | RENAME_MARK_GROUP      | END          | myGroup1                     | RLBK_Conso_M2_%_DONE renamed Renamed_last_mark                 | postgres
    3469 | CONSOLIDATE_RLBK_GROUP | BEGIN        | myGroup1                     | Erase all between marks Renamed_conso_M2 and Renamed_last_mark | postgres
    3470 | CONSOLIDATE_RLBK_GROUP | END          | myGroup1                     | 3 tables and 2 sequences processed ; 2 marks deleted           | postgres
    3471 | CONSOLIDATE_RLBK_GROUP | BEGIN        | myGroup1                     | Erase all between marks Renamed_conso_M2 and Renamed_last_mark | postgres
    3472 | CONSOLIDATE_RLBK_GROUP | END          | myGroup1                     | 0 tables and 2 sequences processed ; 0 marks deleted           | postgres
    3473 | ROLLBACK_GROUP         | BEGIN        | myGroup1                     | Unlogged rollback to mark Conso_M1 (timestamp)                 | postgres
    3474 | DBLINK_OPEN_CNX        |              | rlbk#1                       | Status = 1                                                     | postgres
    3475 | LOCK_GROUP             | BEGIN        | myGroup1                     | Rollback session #1                                            | postgres
    3476 | LOCK_GROUP             | END          | myGroup1                     | Rollback session #1: 5 tables locked, 0 deadlock(s)            | postgres
    3477 | ROLLBACK_TABLE         | BEGIN        | myschema1.mytbl2             | All log rows with emaj_gid > 105 and <= 139                    | postgres
    3478 | ROLLBACK_TABLE         | END          | myschema1.mytbl2             | 1 rolled back primary keys                                     | postgres
    3479 | ROLLBACK_TABLE         | BEGIN        | myschema1.mytbl2b            | All log rows with emaj_gid > 105 and <= 139                    | postgres
    3480 | ROLLBACK_TABLE         | END          | myschema1.mytbl2b            | 1 rolled back primary keys                                     | postgres
    3481 | ROLLBACK_GROUP         | MARK DELETED | myGroup1                     | mark RLBK_Conso_M1_%_DONE is deleted                           | postgres
    3482 | ROLLBACK_GROUP         | MARK DELETED | myGroup1                     | mark Renamed_conso_M2 is deleted                               | postgres
    3483 | ROLLBACK_GROUP         | MARK DELETED | myGroup1                     | mark Renamed_last_mark is deleted                              | postgres
    3484 | ROLLBACK_SEQUENCE      |              | myschema1."myTbl3_col31_seq" |                                                                | postgres
    3485 | ROLLBACK_SEQUENCE      |              | myschema1.mytbl2b_col20_seq  | RESTART 3                                                      | postgres
    3486 | ROLLBACK_GROUP         | NOTICE       | Rollback id 23               | 2 / 5 tables effectively processed.                            | postgres
    3487 | ROLLBACK_GROUP         | NOTICE       | Rollback id 23               | 2 sequences processed.                                         | postgres
    3488 | DBLINK_CLOSE_CNX       |              | rlbk#1                       |                                                                | postgres
    3489 | ROLLBACK_GROUP         | END          | myGroup1                     | Rollback_id 23, 2 tables and 2 sequences effectively processed | postgres
    3520 | CLEANUP_RLBK_STATE     |              | Rollback id 22               | set to COMMITTED                                               | postgres
    3521 | CLEANUP_RLBK_STATE     |              | Rollback id 23               | set to COMMITTED                                               | postgres
    3522 | CLEANUP_RLBK_STATE     |              | Rollback id 24               | set to ABORTED                                                 | postgres
(431 rows)

