-- adm2.sql : complex scenario executed by an emaj_adm role. 
--            Follows adm1.sql, and includes more specific test cases
--
-- define and create the temp file directory to be used by the script
\setenv EMAJTESTTMPDIR '/tmp/emaj_'`echo $PGVER`'/adm2'
\set EMAJTESTTMPDIR `echo $EMAJTESTTMPDIR`
\! mkdir -p $EMAJTESTTMPDIR
set role emaj_regression_tests_adm_user;
-- before going on, save and reload parameters
select emaj.emaj_import_parameters_configuration(emaj.emaj_export_parameters_configuration());
 emaj_import_parameters_configuration 
--------------------------------------
                                    3
(1 row)

-----------------------------
-- Step 8 : use of multi-group functions, start_group(s) without log reset and use deleted marks
-----------------------------
-- stop both groups
select emaj.emaj_stop_groups(array['myGroup1','myGroup2']);
 emaj_stop_groups 
------------------
               15
(1 row)

-- start both groups
select emaj.emaj_start_groups(array['myGroup1','myGroup2'],'Multi-1', false);
WARNING:  _check_fk_groups: The foreign key "mytbl6_col61_fkey" on the table "myschema2.mytbl6" references the table "myschema2.mytbl7" that is outside the groups (myGroup1,myGroup2).
WARNING:  _check_fk_groups: The table "myschema2.mytbl6" is referenced by the foreign key "mytbl8_col81_fkey" on the table "myschema2.mytbl8" that is outside the groups (myGroup1,myGroup2).
 emaj_start_groups 
-------------------
                15
(1 row)

-- set a mark for both groups
select emaj.emaj_set_mark_groups(array['myGroup1','myGroup2'],'Multi-2');
 emaj_set_mark_groups 
----------------------
                   15
(1 row)

-- logged rollback to Multi-1
select * from emaj.emaj_logged_rollback_groups(array['myGroup1','myGroup2'],'Multi-1',false) order by 1,2;
 rlbk_severity |             rlbk_message             
---------------+--------------------------------------
 Notice        | 0 / 11 tables effectively processed.
 Notice        | 4 sequences processed.
(2 rows)

-- rollback to Multi-2
select * from emaj.emaj_rollback_groups(array['myGroup1','myGroup2'],'Multi-2',false) order by 1,2;
 rlbk_severity |             rlbk_message             
---------------+--------------------------------------
 Notice        | 0 / 11 tables effectively processed.
 Notice        | 4 sequences processed.
(2 rows)

-- rollback and stop to Multi-1
select * from emaj.emaj_rollback_groups(array['myGroup1','myGroup2'],'Multi-1',false) order by 1,2;
 rlbk_severity |             rlbk_message             
---------------+--------------------------------------
 Notice        | 0 / 11 tables effectively processed.
 Notice        | 4 sequences processed.
(2 rows)

select emaj.emaj_stop_groups(array['myGroup1','myGroup2'],'Stop after rollback');
 emaj_stop_groups 
------------------
               15
(1 row)

-- try to start both groups, but with an old deleted mark name
select emaj.emaj_start_groups(array['myGroup1','myGroup2'],'Multi-1', false);
WARNING:  _check_fk_groups: The foreign key "mytbl6_col61_fkey" on the table "myschema2.mytbl6" references the table "myschema2.mytbl7" that is outside the groups (myGroup1,myGroup2).
WARNING:  _check_fk_groups: The table "myschema2.mytbl6" is referenced by the foreign key "mytbl8_col81_fkey" on the table "myschema2.mytbl8" that is outside the groups (myGroup1,myGroup2).
ERROR:  _check_new_mark: The groups "myGroup1, myGroup2" already contain a mark named "Multi-1".
CONTEXT:  PL/pgSQL function emaj._check_new_mark(text[],text) line 31 at RAISE
SQL statement "SELECT emaj._check_new_mark(v_groupNames, v_mark)"
PL/pgSQL function emaj._start_groups(text[],text,boolean,boolean) line 44 at SQL statement
PL/pgSQL function emaj.emaj_start_groups(text[],text,boolean) line 11 at RETURN
-- really start both groups
select emaj.emaj_start_groups(array['myGroup1','myGroup2'],'Multi-1b', false);
WARNING:  _check_fk_groups: The foreign key "mytbl6_col61_fkey" on the table "myschema2.mytbl6" references the table "myschema2.mytbl7" that is outside the groups (myGroup1,myGroup2).
WARNING:  _check_fk_groups: The table "myschema2.mytbl6" is referenced by the foreign key "mytbl8_col81_fkey" on the table "myschema2.mytbl8" that is outside the groups (myGroup1,myGroup2).
 emaj_start_groups 
-------------------
                15
(1 row)

-- try to rollback several groups to a deleted common mark
select * from emaj.emaj_rollback_groups(array['myGroup1','myGroup2'],'Multi-1', false);
ERROR:  _check_mark_name: For the groups "myGroup1, myGroup2", the mark "Multi-1" is DELETED.
CONTEXT:  PL/pgSQL function emaj._check_mark_name(text[],text,text) line 84 at RAISE
SQL statement "SELECT emaj._check_mark_name(v_groupNames := v_groupNames, v_mark := v_mark, v_checkList := 'ACTIVE')"
PL/pgSQL function emaj._rlbk_check(text[],text,boolean,boolean) line 21 at SQL statement
SQL statement "SELECT emaj._rlbk_check(v_groupNames, v_mark, v_isAlterGroupAllowed, FALSE)"
PL/pgSQL function emaj._rlbk_init(text[],text,boolean,integer,boolean,boolean) line 23 at SQL statement
SQL statement "SELECT emaj._rlbk_init(v_groupNames, v_mark, v_isLoggedRlbk, 1, v_multiGroup, v_isAlterGroupAllowed)"
PL/pgSQL function emaj._rlbk_groups(text[],text,boolean,boolean,boolean) line 26 at SQL statement
PL/pgSQL function emaj.emaj_rollback_groups(text[],text,boolean) line 8 at RETURN QUERY
-- set again a mark for both groups
select emaj.emaj_set_mark_groups(array['myGroup1','myGroup2'],'Multi-2');
 emaj_set_mark_groups 
----------------------
                   15
(1 row)

-- delete the mark for only 1 group and get detailed statistics for the other group
select emaj.emaj_delete_mark_group('myGroup1','Multi-2');
 emaj_delete_mark_group 
------------------------
                      1
(1 row)

-- use this mark for the other group before delete it
select * from emaj.emaj_detailed_log_stat_group('myGroup2','Multi-2',NULL);
 stat_group | stat_schema | stat_table | stat_first_mark | stat_first_mark_datetime | stat_last_mark | stat_last_mark_datetime | stat_role | stat_verb | stat_rows 
------------+-------------+------------+-----------------+--------------------------+----------------+-------------------------+-----------+-----------+-----------
(0 rows)

select * from emaj.emaj_rollback_group('myGroup2','Multi-2',false) order by 1,2;
 rlbk_severity |            rlbk_message             
---------------+-------------------------------------
 Notice        | 0 / 6 tables effectively processed.
 Notice        | 2 sequences processed.
(2 rows)

select emaj.emaj_delete_mark_group('myGroup2','Multi-2');
 emaj_delete_mark_group 
------------------------
                      1
(1 row)

-- get statistics using deleted marks
select stat_group, stat_schema, stat_table, stat_first_mark, stat_last_mark, stat_role, stat_verb, stat_rows
  from emaj.emaj_detailed_log_stat_group('myGroup2','M1','M2');
 stat_group | stat_schema | stat_table | stat_first_mark | stat_last_mark | stat_role | stat_verb | stat_rows 
------------+-------------+------------+-----------------+----------------+-----------+-----------+-----------
 myGroup2   | myschema2   | myTbl3     | M1              | M2             | postgres  | INSERT    |        10
 myGroup2   | myschema2   | mytbl1     | M1              | M2             | postgres  | DELETE    |         1
 myGroup2   | myschema2   | mytbl1     | M1              | M2             | postgres  | INSERT    |        11
 myGroup2   | myschema2   | mytbl1     | M1              | M2             | postgres  | UPDATE    |         3
 myGroup2   | myschema2   | mytbl2     | M1              | M2             | postgres  | INSERT    |         2
 myGroup2   | myschema2   | mytbl5     | M1              | M2             | postgres  | INSERT    |         2
 myGroup2   | myschema2   | mytbl5     | M1              | M2             | postgres  | UPDATE    |         1
 myGroup2   | myschema2   | mytbl6     | M1              | M2             | postgres  | INSERT    |         8
 myGroup2   | myschema2   | mytbl6     | M1              | M2             | postgres  | UPDATE    |         3
(9 rows)

-- delete intermediate deleted marks
select emaj.emaj_delete_mark_group('myGroup1','Multi-1');
 emaj_delete_mark_group 
------------------------
                      1
(1 row)

select emaj.emaj_delete_mark_group('myGroup2','Multi-1');
 emaj_delete_mark_group 
------------------------
                      1
(1 row)

-- ... and reuse mark names for parallel rollback test
select emaj.emaj_rename_mark_group('myGroup1','Multi-1b','Multi-1');
 emaj_rename_mark_group 
------------------------
 
(1 row)

select emaj.emaj_rename_mark_group('myGroup2','Multi-1b','Multi-1');
 emaj_rename_mark_group 
------------------------
 
(1 row)

-- rename a deleted mark
select emaj.emaj_rename_mark_group('myGroup2','M2','Deleted M2');
 emaj_rename_mark_group 
------------------------
 
(1 row)

-- use emaj_get_previous_mark_group and delete an initial deleted mark
select emaj.emaj_delete_before_mark_group('myGroup2',
      (select emaj.emaj_get_previous_mark_group('myGroup2',
             (select time_clock_timestamp from emaj.emaj_mark, emaj.emaj_time_stamp where time_id = mark_time_id and mark_group = 'myGroup2' and mark_group = 'myGroup2' and mark_name = 'M3')+'0.000001 SECOND'::interval)));
 emaj_delete_before_mark_group 
-------------------------------
                             2
(1 row)

-- comment a deleted mark
select emaj.emaj_comment_mark_group('myGroup2','M3','This mark is deleted');
 emaj_comment_mark_group 
-------------------------
 
(1 row)

-- try to get a rollback duration estimate on a deleted mark
select emaj.emaj_estimate_rollback_group('myGroup2','M3',TRUE);
ERROR:  _check_mark_name: For the group "myGroup2", the mark "M3" is DELETED.
CONTEXT:  PL/pgSQL function emaj._check_mark_name(text[],text,text) line 81 at RAISE
SQL statement "SELECT emaj._check_mark_name(v_groupNames := v_groupNames, v_mark := v_mark, v_checkList := 'ACTIVE')"
PL/pgSQL function emaj._rlbk_check(text[],text,boolean,boolean) line 21 at SQL statement
SQL statement "SELECT emaj._rlbk_check(v_groupNames, v_mark, TRUE, TRUE)"
PL/pgSQL function emaj._estimate_rollback_groups(text[],boolean,text,boolean) line 24 at SQL statement
PL/pgSQL function emaj.emaj_estimate_rollback_group(text,text,boolean) line 7 at RETURN
-- try to rollback on a deleted mark
select * from emaj.emaj_rollback_group('myGroup2','M3',false) order by 1,2;
ERROR:  _check_mark_name: For the group "myGroup2", the mark "M3" is DELETED.
CONTEXT:  PL/pgSQL function emaj._check_mark_name(text[],text,text) line 81 at RAISE
SQL statement "SELECT emaj._check_mark_name(v_groupNames := v_groupNames, v_mark := v_mark, v_checkList := 'ACTIVE')"
PL/pgSQL function emaj._rlbk_check(text[],text,boolean,boolean) line 21 at SQL statement
SQL statement "SELECT emaj._rlbk_check(v_groupNames, v_mark, v_isAlterGroupAllowed, FALSE)"
PL/pgSQL function emaj._rlbk_init(text[],text,boolean,integer,boolean,boolean) line 23 at SQL statement
SQL statement "SELECT emaj._rlbk_init(v_groupNames, v_mark, v_isLoggedRlbk, 1, v_multiGroup, v_isAlterGroupAllowed)"
PL/pgSQL function emaj._rlbk_groups(text[],text,boolean,boolean,boolean) line 26 at SQL statement
PL/pgSQL function emaj.emaj_rollback_group(text,text,boolean) line 7 at RETURN QUERY
-----------------------------
-- Checking step 8
-----------------------------
-- emaj tables
select mark_group, regexp_replace(mark_name,E'\\d\\d\.\\d\\d\\.\\d\\d\\.\\d\\d\\d\\d','%','g'), mark_time_id, mark_is_deleted, mark_is_rlbk_protected, mark_comment, mark_log_rows_before_next, mark_logged_rlbk_target_mark from emaj.emaj_mark order by mark_time_id, mark_group;
 mark_group |        regexp_replace        | mark_time_id | mark_is_deleted | mark_is_rlbk_protected |     mark_comment     | mark_log_rows_before_next | mark_logged_rlbk_target_mark 
------------+------------------------------+--------------+-----------------+------------------------+----------------------+---------------------------+------------------------------
 myGroup2   | M3                           |        10020 | t               | f                      | This mark is deleted |                         0 | 
 myGroup1   | M4                           |        10026 | t               | f                      |                      |                        10 | 
 myGroup1   | M5                           |        10027 | t               | f                      |                      |                         3 | 
 myGroup1   | Before logged rollback to M4 |        10033 | t               | f                      |                      |                        28 | 
 myGroup1   | STOP_%                       |        10035 | t               | f                      |                      |                         0 | 
 myGroup2   | STOP_%                       |        10035 | t               | f                      |                      |                         0 | 
 myGroup1   | Stop after rollback          |        10042 | t               | f                      |                      |                         0 | 
 myGroup2   | Stop after rollback          |        10042 | t               | f                      |                      |                         0 | 
 myGroup1   | Multi-1                      |        10043 | f               | f                      |                      |                           | 
 myGroup2   | Multi-1                      |        10043 | f               | f                      |                      |                           | 
(10 rows)

select sequ_schema, sequ_name, sequ_time_id, sequ_last_val, sequ_is_called from emaj.emaj_sequence order by sequ_time_id, sequ_schema, sequ_name;
 sequ_schema |     sequ_name     | sequ_time_id | sequ_last_val | sequ_is_called 
-------------+-------------------+--------------+---------------+----------------
 myschema2   | myTbl3_col31_seq  |        10020 |            20 | t
 myschema2   | myseq1            |        10020 |          1003 | t
 myschema1   | myTbl3_col31_seq  |        10026 |            20 | t
 myschema1   | mytbl2b_col20_seq |        10026 |             5 | t
 myschema1   | myTbl3_col31_seq  |        10027 |            20 | t
 myschema1   | mytbl2b_col20_seq |        10027 |             5 | t
 myschema1   | myTbl3_col31_seq  |        10033 |            20 | t
 myschema1   | mytbl2b_col20_seq |        10033 |             5 | t
 myschema1   | myTbl3_col31_seq  |        10035 |            20 | t
 myschema1   | mytbl2b_col20_seq |        10035 |             5 | t
 myschema2   | myTbl3_col31_seq  |        10035 |            20 | t
 myschema2   | myseq1            |        10035 |          1004 | f
 myschema1   | myTbl3_col31_seq  |        10042 |            20 | t
 myschema1   | mytbl2b_col20_seq |        10042 |             5 | t
 myschema2   | myTbl3_col31_seq  |        10042 |            20 | t
 myschema2   | myseq1            |        10042 |          1004 | f
 myschema1   | myTbl3_col31_seq  |        10043 |            20 | t
 myschema1   | mytbl2b_col20_seq |        10043 |             5 | t
 myschema2   | myTbl3_col31_seq  |        10043 |            20 | t
 myschema2   | myseq1            |        10043 |          1004 | f
(20 rows)

select tbl_schema, tbl_name, tbl_time_id, tbl_tuples, tbl_pages, tbl_log_seq_last_val from emaj.emaj_table order by tbl_time_id, tbl_schema, tbl_name;
 tbl_schema | tbl_name | tbl_time_id | tbl_tuples | tbl_pages | tbl_log_seq_last_val 
------------+----------+-------------+------------+-----------+----------------------
 myschema2  | myTbl3   |       10020 |          0 |         0 |                   10
 myschema2  | mytbl1   |       10020 |          0 |         0 |                   15
 myschema2  | mytbl2   |       10020 |          0 |         0 |                    2
 myschema2  | mytbl4   |       10020 |          0 |         0 |                    4
 myschema2  | mytbl5   |       10020 |          0 |         0 |                    4
 myschema2  | mytbl6   |       10020 |          1 |         1 |                   14
 myschema1  | myTbl3   |       10026 |          0 |         0 |                   10
 myschema1  | mytbl1   |       10026 |          0 |         0 |                   30
 myschema1  | mytbl2   |       10026 |          0 |         0 |                    3
 myschema1  | mytbl2b  |       10026 |          0 |         0 |                    3
 myschema1  | mytbl4   |       10026 |          0 |         0 |                    8
 myschema1  | myTbl3   |       10027 |          0 |         0 |                   20
 myschema1  | mytbl1   |       10027 |          0 |         0 |                   30
 myschema1  | mytbl2   |       10027 |          0 |         0 |                    3
 myschema1  | mytbl2b  |       10027 |          0 |         0 |                    3
 myschema1  | mytbl4   |       10027 |          0 |         0 |                    8
 myschema1  | myTbl3   |       10033 |          0 |         0 |                   20
 myschema1  | mytbl1   |       10033 |          0 |         0 |                   32
 myschema1  | mytbl2   |       10033 |          0 |         0 |                    3
 myschema1  | mytbl2b  |       10033 |          0 |         0 |                    3
 myschema1  | mytbl4   |       10033 |          0 |         0 |                   12
 myschema1  | myTbl3   |       10035 |          0 |         0 |                   45
 myschema1  | mytbl1   |       10035 |          0 |         0 |                   33
 myschema1  | mytbl2   |       10035 |          0 |         0 |                    3
 myschema1  | mytbl2b  |       10035 |          0 |         0 |                    3
 myschema1  | mytbl4   |       10035 |          0 |         0 |                   14
 myschema2  | myTbl3   |       10035 |          0 |         0 |                   10
 myschema2  | mytbl1   |       10035 |          0 |         0 |                   15
 myschema2  | mytbl2   |       10035 |          0 |         0 |                    2
 myschema2  | mytbl4   |       10035 |          2 |         1 |                   10
 myschema2  | mytbl5   |       10035 |          0 |         0 |                    7
 myschema2  | mytbl6   |       10035 |          1 |         1 |                   23
 myschema1  | myTbl3   |       10042 |          0 |         0 |                   45
 myschema1  | mytbl1   |       10042 |          0 |         0 |                   33
 myschema1  | mytbl2   |       10042 |          0 |         0 |                    3
 myschema1  | mytbl2b  |       10042 |          0 |         0 |                    3
 myschema1  | mytbl4   |       10042 |          0 |         0 |                   14
 myschema2  | myTbl3   |       10042 |          0 |         0 |                   10
 myschema2  | mytbl1   |       10042 |          0 |         0 |                   15
 myschema2  | mytbl2   |       10042 |          0 |         0 |                    2
 myschema2  | mytbl4   |       10042 |          2 |         1 |                   10
 myschema2  | mytbl5   |       10042 |          0 |         0 |                    7
 myschema2  | mytbl6   |       10042 |          1 |         1 |                   23
 myschema1  | myTbl3   |       10043 |          0 |         0 |                   45
 myschema1  | mytbl1   |       10043 |          0 |         0 |                   33
 myschema1  | mytbl2   |       10043 |          0 |         0 |                    3
 myschema1  | mytbl2b  |       10043 |          0 |         0 |                    3
 myschema1  | mytbl4   |       10043 |          0 |         0 |                   14
 myschema2  | myTbl3   |       10043 |          0 |         0 |                   10
 myschema2  | mytbl1   |       10043 |          0 |         0 |                   15
 myschema2  | mytbl2   |       10043 |          0 |         0 |                    2
 myschema2  | mytbl4   |       10043 |          2 |         1 |                   10
 myschema2  | mytbl5   |       10043 |          0 |         0 |                    7
 myschema2  | mytbl6   |       10043 |          1 |         1 |                   23
(54 rows)

select sqhl_schema, sqhl_table, sqhl_begin_time_id, sqhl_end_time_id, sqhl_hole_size from emaj.emaj_seq_hole order by 1,2,3;
 sqhl_schema | sqhl_table | sqhl_begin_time_id | sqhl_end_time_id | sqhl_hole_size 
-------------+------------+--------------------+------------------+----------------
 myschema1   | mytbl1     |              10027 |            10032 |              1
 myschema1   | mytbl4     |              10027 |            10032 |              2
 myschema2   | mytbl4     |              10020 |            10031 |              6
 myschema2   | mytbl5     |              10020 |            10031 |              3
 myschema2   | mytbl6     |              10020 |            10031 |              9
(5 rows)

-- log tables
select col11, col12, col13, emaj_verb, emaj_tuple, emaj_gid from emaj_mySchema1.myTbl1_log order by emaj_gid, emaj_tuple desc;
 col11 |   col12    | col13 | emaj_verb | emaj_tuple | emaj_gid 
-------+------------+-------+-----------+------------+----------
     1 | Step 6     | \x01  | INS       | NEW        |   100134
     1 | Step 6     | \x01  | DEL       | OLD        |   100157
(2 rows)

select col21, col22, col23, emaj_verb, emaj_tuple, emaj_gid from emaj_mySchema1.myTbl2_log order by emaj_gid, emaj_tuple desc;
 col21 | col22 | col23 | emaj_verb | emaj_tuple | emaj_gid 
-------+-------+-------+-----------+------------+----------
(0 rows)

select col20, col21, col22, col23, emaj_verb, emaj_tuple, emaj_gid from emaj_mySchema1.myTbl2b_log order by emaj_gid, emaj_tuple desc;
 col20 | col21 | col22 | col23 | emaj_verb | emaj_tuple | emaj_gid 
-------+-------+-------+-------+-----------+------------+----------
(0 rows)

select col31, col33, emaj_verb, emaj_tuple, emaj_gid from emaj_myschema1."myTbl3_log" order by emaj_gid, emaj_tuple desc;
 col31 | col33 | emaj_verb | emaj_tuple | emaj_gid 
-------+-------+-----------+------------+----------
    11 | 10.00 | UPD       | OLD        |   100115
    11 |  5.00 | UPD       | NEW        |   100115
    12 | 10.00 | UPD       | OLD        |   100116
    12 |  5.00 | UPD       | NEW        |   100116
    13 | 10.00 | UPD       | OLD        |   100117
    13 |  5.00 | UPD       | NEW        |   100117
    14 | 10.00 | UPD       | OLD        |   100118
    14 |  5.00 | UPD       | NEW        |   100118
    15 | 10.00 | UPD       | OLD        |   100119
    15 |  5.00 | UPD       | NEW        |   100119
    16 | 10.00 | UPD       | OLD        |   100120
    16 |  5.00 | UPD       | NEW        |   100120
    17 | 10.00 | UPD       | OLD        |   100121
    17 |  5.00 | UPD       | NEW        |   100121
    18 | 10.00 | UPD       | OLD        |   100122
    18 |  5.00 | UPD       | NEW        |   100122
    19 | 10.00 | UPD       | OLD        |   100123
    19 |  5.00 | UPD       | NEW        |   100123
    20 | 10.00 | UPD       | OLD        |   100124
    20 |  5.00 | UPD       | NEW        |   100124
    11 |  5.00 | DEL       | OLD        |   100137
    12 |  5.00 | DEL       | OLD        |   100138
    13 |  5.00 | DEL       | OLD        |   100139
    14 |  5.00 | DEL       | OLD        |   100140
    15 |  5.00 | DEL       | OLD        |   100141
    16 |  5.00 | DEL       | OLD        |   100142
    17 |  5.00 | DEL       | OLD        |   100143
    18 |  5.00 | DEL       | OLD        |   100144
    19 |  5.00 | DEL       | OLD        |   100145
    20 |  5.00 | DEL       | OLD        |   100146
    11 | 10.00 | INS       | NEW        |   100147
    12 | 10.00 | INS       | NEW        |   100148
    13 | 10.00 | INS       | NEW        |   100149
    14 | 10.00 | INS       | NEW        |   100150
    15 | 10.00 | INS       | NEW        |   100151
    16 | 10.00 | INS       | NEW        |   100152
    17 | 10.00 | INS       | NEW        |   100153
    18 | 10.00 | INS       | NEW        |   100154
    19 | 10.00 | INS       | NEW        |   100155
    20 | 10.00 | INS       | NEW        |   100156
    14 | 10.00 | DEL       | OLD        |   100160
    15 | 10.00 | DEL       | OLD        |   100161
    16 | 10.00 | DEL       | OLD        |   100162
    17 | 10.00 | DEL       | OLD        |   100163
    18 | 10.00 | DEL       | OLD        |   100164
(45 rows)

select col41, col42, col43, col44, col45, emaj_verb, emaj_tuple, emaj_gid from emaj_mySchema1.myTbl4_log order by emaj_gid, emaj_tuple desc;
 col41 | col42 | col43 | col44 | col45  | emaj_verb | emaj_tuple | emaj_gid 
-------+-------+-------+-------+--------+-----------+------------+----------
    11 |       |     1 |     1 | Step 6 | INS       | NEW        |   100135
    12 |       |     1 |     1 | Step 6 | INS       | NEW        |   100136
    11 |       |     1 |     1 | Step 6 | DEL       | OLD        |   100158
    12 |       |     1 |     1 | Step 6 | DEL       | OLD        |   100159
(4 rows)

select col11, col12, col13, emaj_verb, emaj_tuple, emaj_gid from emaj_mySchema2.myTbl1_log order by emaj_gid, emaj_tuple desc;
 col11 | col12 | col13 | emaj_verb | emaj_tuple | emaj_gid 
-------+-------+-------+-----------+------------+----------
(0 rows)

select col21, col22, col23, emaj_verb, emaj_tuple, emaj_gid from emaj_mySchema2.myTbl2_log order by emaj_gid, emaj_tuple desc;
 col21 | col22 | col23 | emaj_verb | emaj_tuple | emaj_gid 
-------+-------+-------+-----------+------------+----------
(0 rows)

select col31, col33, emaj_verb, emaj_tuple, emaj_gid from emaj_myschema2."myTbl3_log" order by emaj_gid, emaj_tuple desc;
 col31 | col33 | emaj_verb | emaj_tuple | emaj_gid 
-------+-------+-----------+------------+----------
(0 rows)

select col41, col42, col43, col44, col45, emaj_verb, emaj_tuple, emaj_gid from emaj_myschema2.mytbl4_log order by emaj_gid, emaj_tuple desc;
 col41 | col42 | col43 | col44 | col45 | emaj_verb | emaj_tuple | emaj_gid 
-------+-------+-------+-------+-------+-----------+------------+----------
(0 rows)

select col51, col52, col53, col54, emaj_verb, emaj_tuple, emaj_gid from emaj_myschema2.mytbl5_log order by emaj_gid, emaj_tuple desc;
 col51 | col52 | col53 | col54 | emaj_verb | emaj_tuple | emaj_gid 
-------+-------+-------+-------+-----------+------------+----------
(0 rows)

select col61, col62, col63, col64, col65, col66, emaj_verb, emaj_tuple, emaj_gid from emaj_mySchema2.myTbl6_log order by emaj_gid, emaj_tuple desc;
 col61 | col62 | col63 | col64 | col65 | col66 | emaj_verb | emaj_tuple | emaj_gid 
-------+-------+-------+-------+-------+-------+-----------+------------+----------
(0 rows)

-----------------------------
-- Step 9 : deleted step
-----------------------------
-----------------------------
-- Step 10 : for phil''s group#3", recreate the group as rollbackable, update tables, 
--           rename a mark, then delete 2 marks then delete all before a mark 
-----------------------------
-- prepare phil's group#3, group
--
reset role;
alter table "phil's schema3"."myTbl2\" add primary key (col21);
set role emaj_regression_tests_adm_user;
select emaj.emaj_create_group('phil''s group#3",');
 emaj_create_group 
-------------------
                 1
(1 row)

select emaj.emaj_assign_tables('phil''s schema3','.*','mytbl4','phil''s group#3",');
NOTICE:  table "myTbl2\_log" does not exist, skipping
NOTICE:  trigger "emaj_log_trg" for relation "phil's schema3.myTbl2\" does not exist, skipping
NOTICE:  trigger "emaj_trunc_trg" for relation "phil's schema3.myTbl2\" does not exist, skipping
NOTICE:  table "phil's tbl1_log" does not exist, skipping
NOTICE:  trigger "emaj_log_trg" for relation "phil's schema3.phil's tbl1" does not exist, skipping
NOTICE:  trigger "emaj_trunc_trg" for relation "phil's schema3.phil's tbl1" does not exist, skipping
 emaj_assign_tables 
--------------------
                  2
(1 row)

select emaj.emaj_assign_sequences('phil''s schema3','.*',null,'phil''s group#3",');
 emaj_assign_sequences 
-----------------------
                     2
(1 row)

select emaj.emaj_start_group('phil''s group#3",','M1_rollbackable');
WARNING:  _check_fk_groups: The foreign key "mytbl2_col21_fkey" on the table "phil's schema3.myTbl2\" references the table "phil's schema3.mytbl4" that is outside the groups (phil's group#3",).
WARNING:  _check_fk_groups: The table "phil's schema3.phil's tbl1" is referenced by the foreign key "mytbl4_col44_fkey" on the table "phil's schema3.mytbl4" that is outside the groups (phil's group#3",).
 emaj_start_group 
------------------
                4
(1 row)

--
set search_path=public,"phil's schema3";
--
insert into "phil's tbl1" select i, 'AB''C', E'\\014'::bytea from generate_series (1,31) as i;
update "phil's tbl1" set "phil\s col13" = E'\\034'::bytea where "phil's col11" <= 3;
update "phil's tbl1" set "phil\s col13" = E'\\034'''::bytea where "phil's col11" between 18 and 22;
insert into myTbl4 (col41) values (1);
insert into myTbl4 (col41) values (2);
insert into "myTbl2\" values (1,'ABC','2010-12-31');
delete from "phil's tbl1" where "phil's col11" > 20;
insert into "myTbl2\" values (2,'DEF',NULL);
select nextval(E'"phil''s schema3"."phil''s seq\\1"');
 nextval 
---------
    1000
(1 row)

--
select emaj.emaj_set_mark_group('phil''s group#3",','M2_rollbackable');
 emaj_set_mark_group 
---------------------
                   4
(1 row)

select emaj.emaj_set_mark_group('phil''s group#3",','M2_again!');
 emaj_set_mark_group 
---------------------
                   4
(1 row)

--
delete from "phil's tbl1" where "phil's col11" = 10;
update "phil's tbl1" set "phil's col12" = 'DEF' where "phil's col11" <= 2;
select nextval(E'"phil''s schema3"."phil''s seq\\1"');
 nextval 
---------
    1001
(1 row)

--
select emaj.emaj_set_mark_groups(array['phil''s group#3",'],'phil''s mark #1');
 emaj_set_mark_groups 
----------------------
                    4
(1 row)

select emaj.emaj_comment_mark_group('phil''s group#3",','phil''s mark #1','Third mark set');
 emaj_comment_mark_group 
-------------------------
 
(1 row)

--
select emaj.emaj_rename_mark_group('phil''s group#3",','phil''s mark #1','phil''s mark #3');
 emaj_rename_mark_group 
------------------------
 
(1 row)

-- 
select emaj.emaj_delete_mark_group('phil''s group#3",','M2_again!');
 emaj_delete_mark_group 
------------------------
                      1
(1 row)

--
select stat_group, stat_schema, stat_table, stat_first_mark, stat_last_mark, stat_rows from emaj.emaj_log_stat_group('phil''s group#3",','','');
    stat_group    |  stat_schema   | stat_table  | stat_first_mark | stat_last_mark | stat_rows 
------------------+----------------+-------------+-----------------+----------------+-----------
 phil's group#3", | phil's schema3 | myTbl2\     | M1_rollbackable |                |         2
 phil's group#3", | phil's schema3 | phil's tbl1 | M1_rollbackable |                |        53
(2 rows)

select stat_group, stat_schema, stat_table, stat_first_mark, stat_last_mark, stat_role, stat_verb, stat_rows
  from emaj.emaj_detailed_log_stat_group('phil''s group#3",','phil''s mark #3','');
 stat_group | stat_schema | stat_table | stat_first_mark | stat_last_mark | stat_role | stat_verb | stat_rows 
------------+-------------+------------+-----------------+----------------+-----------+-----------+-----------
(0 rows)

--
select * from emaj.emaj_logged_rollback_group('phil''s group#3",','phil''s mark #3',false) order by 1,2;
 rlbk_severity |            rlbk_message             
---------------+-------------------------------------
 Notice        | 0 / 2 tables effectively processed.
 Notice        | 2 sequences processed.
(2 rows)

select * from emaj.emaj_rollback_group('phil''s group#3",','phil''s mark #3',false) order by 1,2;
 rlbk_severity |            rlbk_message             
---------------+-------------------------------------
 Notice        | 0 / 2 tables effectively processed.
 Notice        | 2 sequences processed.
(2 rows)

-----------------------------
-- Checking step 10
-----------------------------
-- emaj tables
select mark_group, regexp_replace(mark_name,E'\\d\\d\.\\d\\d\\.\\d\\d\\.\\d\\d\\d\\d','%','g'), mark_time_id, mark_is_deleted, mark_is_rlbk_protected, mark_comment, mark_log_rows_before_next, mark_logged_rlbk_target_mark from emaj.emaj_mark order by mark_time_id, mark_group;
    mark_group    |        regexp_replace        | mark_time_id | mark_is_deleted | mark_is_rlbk_protected |     mark_comment     | mark_log_rows_before_next | mark_logged_rlbk_target_mark 
------------------+------------------------------+--------------+-----------------+------------------------+----------------------+---------------------------+------------------------------
 myGroup2         | M3                           |        10020 | t               | f                      | This mark is deleted |                         0 | 
 myGroup1         | M4                           |        10026 | t               | f                      |                      |                        10 | 
 myGroup1         | M5                           |        10027 | t               | f                      |                      |                         3 | 
 myGroup1         | Before logged rollback to M4 |        10033 | t               | f                      |                      |                        28 | 
 myGroup1         | STOP_%                       |        10035 | t               | f                      |                      |                         0 | 
 myGroup2         | STOP_%                       |        10035 | t               | f                      |                      |                         0 | 
 myGroup1         | Stop after rollback          |        10042 | t               | f                      |                      |                         0 | 
 myGroup2         | Stop after rollback          |        10042 | t               | f                      |                      |                         0 | 
 myGroup1         | Multi-1                      |        10043 | f               | f                      |                      |                         0 | 
 myGroup2         | Multi-1                      |        10043 | f               | f                      |                      |                         0 | 
 phil's group#3", | M1_rollbackable              |        10049 | f               | f                      |                      |                        52 | 
 phil's group#3", | M2_rollbackable              |        10050 | f               | f                      |                      |                         3 | 
 phil's group#3", | phil's mark #3               |        10052 | f               | f                      | Third mark set       |                           | 
(13 rows)

select sequ_schema, sequ_name, sequ_time_id, sequ_last_val, sequ_is_called from emaj.emaj_sequence order by sequ_time_id, sequ_schema, sequ_name;
  sequ_schema   |     sequ_name     | sequ_time_id | sequ_last_val | sequ_is_called 
----------------+-------------------+--------------+---------------+----------------
 myschema2      | myTbl3_col31_seq  |        10020 |            20 | t
 myschema2      | myseq1            |        10020 |          1003 | t
 myschema1      | myTbl3_col31_seq  |        10026 |            20 | t
 myschema1      | mytbl2b_col20_seq |        10026 |             5 | t
 myschema1      | myTbl3_col31_seq  |        10027 |            20 | t
 myschema1      | mytbl2b_col20_seq |        10027 |             5 | t
 myschema1      | myTbl3_col31_seq  |        10033 |            20 | t
 myschema1      | mytbl2b_col20_seq |        10033 |             5 | t
 myschema1      | myTbl3_col31_seq  |        10035 |            20 | t
 myschema1      | mytbl2b_col20_seq |        10035 |             5 | t
 myschema2      | myTbl3_col31_seq  |        10035 |            20 | t
 myschema2      | myseq1            |        10035 |          1004 | f
 myschema1      | myTbl3_col31_seq  |        10042 |            20 | t
 myschema1      | mytbl2b_col20_seq |        10042 |             5 | t
 myschema2      | myTbl3_col31_seq  |        10042 |            20 | t
 myschema2      | myseq1            |        10042 |          1004 | f
 myschema1      | myTbl3_col31_seq  |        10043 |            20 | t
 myschema1      | mytbl2b_col20_seq |        10043 |             5 | t
 myschema2      | myTbl3_col31_seq  |        10043 |            20 | t
 myschema2      | myseq1            |        10043 |          1004 | f
 phil's schema3 | myTbl2\_col21_seq |        10049 |             1 | f
 phil's schema3 | phil's seq\1      |        10049 |          1000 | f
 phil's schema3 | myTbl2\_col21_seq |        10050 |             1 | f
 phil's schema3 | phil's seq\1      |        10050 |          1000 | t
 phil's schema3 | myTbl2\_col21_seq |        10052 |             1 | f
 phil's schema3 | phil's seq\1      |        10052 |          1001 | t
(26 rows)

select tbl_schema, tbl_name, tbl_time_id, tbl_log_seq_last_val from emaj.emaj_table order by tbl_time_id, tbl_schema, tbl_name;
   tbl_schema   |  tbl_name   | tbl_time_id | tbl_log_seq_last_val 
----------------+-------------+-------------+----------------------
 myschema2      | myTbl3      |       10020 |                   10
 myschema2      | mytbl1      |       10020 |                   15
 myschema2      | mytbl2      |       10020 |                    2
 myschema2      | mytbl4      |       10020 |                    4
 myschema2      | mytbl5      |       10020 |                    4
 myschema2      | mytbl6      |       10020 |                   14
 myschema1      | myTbl3      |       10026 |                   10
 myschema1      | mytbl1      |       10026 |                   30
 myschema1      | mytbl2      |       10026 |                    3
 myschema1      | mytbl2b     |       10026 |                    3
 myschema1      | mytbl4      |       10026 |                    8
 myschema1      | myTbl3      |       10027 |                   20
 myschema1      | mytbl1      |       10027 |                   30
 myschema1      | mytbl2      |       10027 |                    3
 myschema1      | mytbl2b     |       10027 |                    3
 myschema1      | mytbl4      |       10027 |                    8
 myschema1      | myTbl3      |       10033 |                   20
 myschema1      | mytbl1      |       10033 |                   32
 myschema1      | mytbl2      |       10033 |                    3
 myschema1      | mytbl2b     |       10033 |                    3
 myschema1      | mytbl4      |       10033 |                   12
 myschema1      | myTbl3      |       10035 |                   45
 myschema1      | mytbl1      |       10035 |                   33
 myschema1      | mytbl2      |       10035 |                    3
 myschema1      | mytbl2b     |       10035 |                    3
 myschema1      | mytbl4      |       10035 |                   14
 myschema2      | myTbl3      |       10035 |                   10
 myschema2      | mytbl1      |       10035 |                   15
 myschema2      | mytbl2      |       10035 |                    2
 myschema2      | mytbl4      |       10035 |                   10
 myschema2      | mytbl5      |       10035 |                    7
 myschema2      | mytbl6      |       10035 |                   23
 myschema1      | myTbl3      |       10042 |                   45
 myschema1      | mytbl1      |       10042 |                   33
 myschema1      | mytbl2      |       10042 |                    3
 myschema1      | mytbl2b     |       10042 |                    3
 myschema1      | mytbl4      |       10042 |                   14
 myschema2      | myTbl3      |       10042 |                   10
 myschema2      | mytbl1      |       10042 |                   15
 myschema2      | mytbl2      |       10042 |                    2
 myschema2      | mytbl4      |       10042 |                   10
 myschema2      | mytbl5      |       10042 |                    7
 myschema2      | mytbl6      |       10042 |                   23
 myschema1      | myTbl3      |       10043 |                   45
 myschema1      | mytbl1      |       10043 |                   33
 myschema1      | mytbl2      |       10043 |                    3
 myschema1      | mytbl2b     |       10043 |                    3
 myschema1      | mytbl4      |       10043 |                   14
 myschema2      | myTbl3      |       10043 |                   10
 myschema2      | mytbl1      |       10043 |                   15
 myschema2      | mytbl2      |       10043 |                    2
 myschema2      | mytbl4      |       10043 |                   10
 myschema2      | mytbl5      |       10043 |                    7
 myschema2      | mytbl6      |       10043 |                   23
 phil's schema3 | myTbl2\     |       10049 |                    0
 phil's schema3 | phil's tbl1 |       10049 |                    0
 phil's schema3 | myTbl2\     |       10050 |                    2
 phil's schema3 | phil's tbl1 |       10050 |                   50
 phil's schema3 | myTbl2\     |       10052 |                    2
 phil's schema3 | phil's tbl1 |       10052 |                   53
(60 rows)

select sqhl_schema, sqhl_table, sqhl_begin_time_id, sqhl_end_time_id, sqhl_hole_size from emaj.emaj_seq_hole order by 1,2,3;
 sqhl_schema | sqhl_table | sqhl_begin_time_id | sqhl_end_time_id | sqhl_hole_size 
-------------+------------+--------------------+------------------+----------------
 myschema1   | mytbl1     |              10027 |            10032 |              1
 myschema1   | mytbl4     |              10027 |            10032 |              2
 myschema2   | mytbl4     |              10020 |            10031 |              6
 myschema2   | mytbl5     |              10020 |            10031 |              3
 myschema2   | mytbl6     |              10020 |            10031 |              9
(5 rows)

select rlbt_rlbk_id, rlbt_step, rlbt_schema, rlbt_table, rlbt_object, rlbt_quantity from emaj.emaj_rlbk_stat
  order by rlbt_rlbk_id, rlbt_step, rlbt_schema, rlbt_table, rlbt_object;
 rlbt_rlbk_id |  rlbt_step  | rlbt_schema | rlbt_table |    rlbt_object    | rlbt_quantity 
--------------+-------------+-------------+------------+-------------------+---------------
         6018 | RLBK_TABLE  | myschema2   | myTbl3     |                   |             2
         6018 | CTRL+DBLINK |             |            |                   |             1
         6019 | DIS_LOG_TRG |             |            |                   |             1
         6019 | RLBK_TABLE  | myschema2   | myTbl3     |                   |             6
         6019 | DELETE_LOG  | myschema2   | myTbl3     |                   |             6
         6019 | ENA_LOG_TRG |             |            |                   |             1
         6019 | CTRL+DBLINK |             |            |                   |             4
        10000 | DROP_FK     |             |            |                   |             1
        10000 | SET_FK_DEF  |             |            |                   |             2
        10000 | RLBK_TABLE  | myschema2   | mytbl4     |                   |             4
        10000 | RLBK_TABLE  | myschema2   | mytbl5     |                   |             1
        10000 | RLBK_TABLE  | myschema2   | mytbl6     |                   |             3
        10000 | SET_FK_IMM  | myschema2   | mytbl4     | mytbl4_col43_fkey |             4
        10000 | SET_FK_IMM  | myschema2   | mytbl6     | mytbl6_col61_fkey |             3
        10000 | SET_FK_IMM  | myschema2   | mytbl8     | mytbl8_col81_fkey |             3
        10000 | ADD_FK      | myschema2   | mytbl4     | mytbl4_col44_fkey |             2
        10000 | CTRL-DBLINK |             |            |                   |            10
        10001 | DROP_FK     |             |            |                   |             1
        10001 | SET_FK_DEF  |             |            |                   |             2
        10001 | RLBK_TABLE  | myschema2   | mytbl4     |                   |             2
        10001 | RLBK_TABLE  | myschema2   | mytbl5     |                   |             1
        10001 | RLBK_TABLE  | myschema2   | mytbl6     |                   |             3
        10001 | SET_FK_IMM  | myschema2   | mytbl4     | mytbl4_col43_fkey |             2
        10001 | SET_FK_IMM  | myschema2   | mytbl6     | mytbl6_col61_fkey |             3
        10001 | SET_FK_IMM  | myschema2   | mytbl8     | mytbl8_col81_fkey |             3
        10001 | ADD_FK      | myschema2   | mytbl4     | mytbl4_col44_fkey |             2
        10001 | CTRL-DBLINK |             |            |                   |            10
        10002 | DIS_LOG_TRG |             |            |                   |             2
        10002 | DROP_FK     |             |            |                   |             1
        10002 | SET_FK_DEF  |             |            |                   |             1
        10002 | RLBK_TABLE  | myschema1   | mytbl1     |                   |             3
        10002 | RLBK_TABLE  | myschema1   | mytbl4     |                   |             8
        10002 | DELETE_LOG  | myschema1   | mytbl1     |                   |             3
        10002 | DELETE_LOG  | myschema1   | mytbl4     |                   |             8
        10002 | SET_FK_IMM  | myschema1   | mytbl4     | mytbl4_col43_fkey |             8
        10002 | ADD_FK      | myschema1   | mytbl4     | mytbl4_col44_fkey |             0
        10002 | ENA_LOG_TRG |             |            |                   |             2
        10002 | CTRL+DBLINK |             |            |                   |            12
        10003 | DROP_FK     |             |            |                   |             1
        10003 | SET_FK_DEF  |             |            |                   |             2
        10003 | RLBK_TABLE  | myschema2   | mytbl4     |                   |             8
        10003 | RLBK_TABLE  | myschema2   | mytbl5     |                   |             3
        10003 | RLBK_TABLE  | myschema2   | mytbl6     |                   |             9
        10003 | SET_FK_IMM  | myschema2   | mytbl4     | mytbl4_col43_fkey |             8
        10003 | SET_FK_IMM  | myschema2   | mytbl6     | mytbl6_col61_fkey |             9
        10003 | SET_FK_IMM  | myschema2   | mytbl8     | mytbl8_col81_fkey |             9
        10003 | ADD_FK      | myschema2   | mytbl4     | mytbl4_col44_fkey |             2
        10003 | CTRL+DBLINK |             |            |                   |            10
        10004 | DIS_LOG_TRG |             |            |                   |             3
        10004 | DROP_FK     |             |            |                   |             1
        10004 | SET_FK_DEF  |             |            |                   |             2
        10004 | RLBK_TABLE  | myschema2   | mytbl4     |                   |             6
        10004 | RLBK_TABLE  | myschema2   | mytbl5     |                   |             3
        10004 | RLBK_TABLE  | myschema2   | mytbl6     |                   |             9
        10004 | DELETE_LOG  | myschema2   | mytbl4     |                   |             6
        10004 | DELETE_LOG  | myschema2   | mytbl5     |                   |             3
        10004 | DELETE_LOG  | myschema2   | mytbl6     |                   |             9
        10004 | SET_FK_IMM  | myschema2   | mytbl4     | mytbl4_col43_fkey |             6
        10004 | SET_FK_IMM  | myschema2   | mytbl6     | mytbl6_col61_fkey |             9
        10004 | SET_FK_IMM  | myschema2   | mytbl8     | mytbl8_col81_fkey |             9
        10004 | ADD_FK      | myschema2   | mytbl4     | mytbl4_col44_fkey |             2
        10004 | ENA_LOG_TRG |             |            |                   |             3
        10004 | CTRL+DBLINK |             |            |                   |            19
        10005 | DIS_LOG_TRG |             |            |                   |             2
        10005 | DROP_FK     |             |            |                   |             1
        10005 | SET_FK_DEF  |             |            |                   |             1
        10005 | RLBK_TABLE  | myschema1   | mytbl1     |                   |             1
        10005 | RLBK_TABLE  | myschema1   | mytbl4     |                   |             2
        10005 | DELETE_LOG  | myschema1   | mytbl1     |                   |             1
        10005 | DELETE_LOG  | myschema1   | mytbl4     |                   |             2
        10005 | SET_FK_IMM  | myschema1   | mytbl4     | mytbl4_col43_fkey |             2
        10005 | ADD_FK      | myschema1   | mytbl4     | mytbl4_col44_fkey |             0
        10005 | ENA_LOG_TRG |             |            |                   |             2
        10005 | CTRL+DBLINK |             |            |                   |            12
        10006 | DROP_FK     |             |            |                   |             1
        10006 | SET_FK_DEF  |             |            |                   |             1
        10006 | RLBK_TABLE  | myschema1   | myTbl3     |                   |            10
        10006 | RLBK_TABLE  | myschema1   | mytbl1     |                   |             1
        10006 | RLBK_TABLE  | myschema1   | mytbl4     |                   |             2
        10006 | SET_FK_IMM  | myschema1   | mytbl4     | mytbl4_col43_fkey |             2
        10006 | ADD_FK      | myschema1   | mytbl4     | mytbl4_col44_fkey |             0
        10006 | CTRL+DBLINK |             |            |                   |             7
(82 rows)

-- user tables
select * from "phil's schema3"."phil's tbl1" order by "phil's col11","phil's col12";
 phil's col11 | phil's col12 | phil\s col13 
--------------+--------------+--------------
            1 | DEF          | \x1c
            2 | DEF          | \x1c
            3 | AB'C         | \x1c
            4 | AB'C         | \x0c
            5 | AB'C         | \x0c
            6 | AB'C         | \x0c
            7 | AB'C         | \x0c
            8 | AB'C         | \x0c
            9 | AB'C         | \x0c
           11 | AB'C         | \x0c
           12 | AB'C         | \x0c
           13 | AB'C         | \x0c
           14 | AB'C         | \x0c
           15 | AB'C         | \x0c
           16 | AB'C         | \x0c
           17 | AB'C         | \x0c
           18 | AB'C         | \x1c27
           19 | AB'C         | \x1c27
           20 | AB'C         | \x1c27
(19 rows)

select * from "phil's schema3"."myTbl2\" order by col21;
 col21 | col22 |   col23    
-------+-------+------------
     1 | ABC   | 12-31-2010
     2 | DEF   | 
(2 rows)

-- log tables
select "phil's col11", "phil's col12", "phil\s col13", emaj_verb, emaj_tuple, emaj_gid from "emaj_phil's schema3"."phil's tbl1_log" order by emaj_gid, emaj_tuple desc;
 phil's col11 | phil's col12 | phil\s col13 | emaj_verb | emaj_tuple | emaj_gid 
--------------+--------------+--------------+-----------+------------+----------
            1 | AB'C         | \x0c         | INS       | NEW        |   100165
            2 | AB'C         | \x0c         | INS       | NEW        |   100166
            3 | AB'C         | \x0c         | INS       | NEW        |   100167
            4 | AB'C         | \x0c         | INS       | NEW        |   100168
            5 | AB'C         | \x0c         | INS       | NEW        |   100169
            6 | AB'C         | \x0c         | INS       | NEW        |   100170
            7 | AB'C         | \x0c         | INS       | NEW        |   100171
            8 | AB'C         | \x0c         | INS       | NEW        |   100172
            9 | AB'C         | \x0c         | INS       | NEW        |   100173
           10 | AB'C         | \x0c         | INS       | NEW        |   100174
           11 | AB'C         | \x0c         | INS       | NEW        |   100175
           12 | AB'C         | \x0c         | INS       | NEW        |   100176
           13 | AB'C         | \x0c         | INS       | NEW        |   100177
           14 | AB'C         | \x0c         | INS       | NEW        |   100178
           15 | AB'C         | \x0c         | INS       | NEW        |   100179
           16 | AB'C         | \x0c         | INS       | NEW        |   100180
           17 | AB'C         | \x0c         | INS       | NEW        |   100181
           18 | AB'C         | \x0c         | INS       | NEW        |   100182
           19 | AB'C         | \x0c         | INS       | NEW        |   100183
           20 | AB'C         | \x0c         | INS       | NEW        |   100184
           21 | AB'C         | \x0c         | INS       | NEW        |   100185
           22 | AB'C         | \x0c         | INS       | NEW        |   100186
           23 | AB'C         | \x0c         | INS       | NEW        |   100187
           24 | AB'C         | \x0c         | INS       | NEW        |   100188
           25 | AB'C         | \x0c         | INS       | NEW        |   100189
           26 | AB'C         | \x0c         | INS       | NEW        |   100190
           27 | AB'C         | \x0c         | INS       | NEW        |   100191
           28 | AB'C         | \x0c         | INS       | NEW        |   100192
           29 | AB'C         | \x0c         | INS       | NEW        |   100193
           30 | AB'C         | \x0c         | INS       | NEW        |   100194
           31 | AB'C         | \x0c         | INS       | NEW        |   100195
            1 | AB'C         | \x0c         | UPD       | OLD        |   100196
            1 | AB'C         | \x1c         | UPD       | NEW        |   100196
            2 | AB'C         | \x0c         | UPD       | OLD        |   100197
            2 | AB'C         | \x1c         | UPD       | NEW        |   100197
            3 | AB'C         | \x0c         | UPD       | OLD        |   100198
            3 | AB'C         | \x1c         | UPD       | NEW        |   100198
           18 | AB'C         | \x0c         | UPD       | OLD        |   100199
           18 | AB'C         | \x1c27       | UPD       | NEW        |   100199
           19 | AB'C         | \x0c         | UPD       | OLD        |   100200
           19 | AB'C         | \x1c27       | UPD       | NEW        |   100200
           20 | AB'C         | \x0c         | UPD       | OLD        |   100201
           20 | AB'C         | \x1c27       | UPD       | NEW        |   100201
           21 | AB'C         | \x0c         | UPD       | OLD        |   100202
           21 | AB'C         | \x1c27       | UPD       | NEW        |   100202
           22 | AB'C         | \x0c         | UPD       | OLD        |   100203
           22 | AB'C         | \x1c27       | UPD       | NEW        |   100203
           23 | AB'C         | \x0c         | DEL       | OLD        |   100205
           24 | AB'C         | \x0c         | DEL       | OLD        |   100206
           25 | AB'C         | \x0c         | DEL       | OLD        |   100207
           26 | AB'C         | \x0c         | DEL       | OLD        |   100208
           27 | AB'C         | \x0c         | DEL       | OLD        |   100209
           28 | AB'C         | \x0c         | DEL       | OLD        |   100210
           29 | AB'C         | \x0c         | DEL       | OLD        |   100211
           30 | AB'C         | \x0c         | DEL       | OLD        |   100212
           31 | AB'C         | \x0c         | DEL       | OLD        |   100213
           21 | AB'C         | \x1c27       | DEL       | OLD        |   100214
           22 | AB'C         | \x1c27       | DEL       | OLD        |   100215
           10 | AB'C         | \x0c         | DEL       | OLD        |   100217
            1 | AB'C         | \x1c         | UPD       | OLD        |   100218
            1 | DEF          | \x1c         | UPD       | NEW        |   100218
            2 | AB'C         | \x1c         | UPD       | OLD        |   100219
            2 | DEF          | \x1c         | UPD       | NEW        |   100219
(63 rows)

select col21, col22, col23, emaj_verb, emaj_tuple, emaj_gid from "emaj_phil's schema3"."myTbl2\_log" order by emaj_gid, emaj_tuple desc;
 col21 | col22 |   col23    | emaj_verb | emaj_tuple | emaj_gid 
-------+-------+------------+-----------+------------+----------
     1 | ABC   | 12-31-2010 | INS       | NEW        |   100204
     2 | DEF   |            | INS       | NEW        |   100216
(2 rows)

-----------------------------
-- Step 11 : for myGroup1, in a transaction, update tables and rollback the transaction, 
--           then rollback to previous mark 
-----------------------------
set search_path=public,myschema1;
--
begin transaction;
  delete from mytbl1;
rollback;
--
select * from emaj.emaj_rollback_group('myGroup1','EMAJ_LAST_MARK',false) order by 1,2;
 rlbk_severity |            rlbk_message             
---------------+-------------------------------------
 Notice        | 1 / 5 tables effectively processed.
 Notice        | 2 sequences processed.
(2 rows)

-----------------------------
-- Checking step 11
-----------------------------
-- emaj tables
select sqhl_schema, sqhl_table, sqhl_begin_time_id, sqhl_end_time_id, sqhl_hole_size from emaj.emaj_seq_hole order by 1,2,3;
 sqhl_schema | sqhl_table | sqhl_begin_time_id | sqhl_end_time_id | sqhl_hole_size 
-------------+------------+--------------------+------------------+----------------
 myschema1   | mytbl1     |              10027 |            10032 |              1
 myschema1   | mytbl1     |              10043 |            10056 |             20
 myschema1   | mytbl4     |              10027 |            10032 |              2
 myschema2   | mytbl4     |              10020 |            10031 |              6
 myschema2   | mytbl5     |              10020 |            10031 |              3
 myschema2   | mytbl6     |              10020 |            10031 |              9
(6 rows)

select rlbt_rlbk_id, rlbt_step, rlbt_schema, rlbt_table, rlbt_object, rlbt_quantity from emaj.emaj_rlbk_stat
  order by rlbt_rlbk_id, rlbt_step, rlbt_schema, rlbt_table, rlbt_object;
 rlbt_rlbk_id |  rlbt_step  | rlbt_schema | rlbt_table |    rlbt_object    | rlbt_quantity 
--------------+-------------+-------------+------------+-------------------+---------------
         6018 | RLBK_TABLE  | myschema2   | myTbl3     |                   |             2
         6018 | CTRL+DBLINK |             |            |                   |             1
         6019 | DIS_LOG_TRG |             |            |                   |             1
         6019 | RLBK_TABLE  | myschema2   | myTbl3     |                   |             6
         6019 | DELETE_LOG  | myschema2   | myTbl3     |                   |             6
         6019 | ENA_LOG_TRG |             |            |                   |             1
         6019 | CTRL+DBLINK |             |            |                   |             4
        10000 | DROP_FK     |             |            |                   |             1
        10000 | SET_FK_DEF  |             |            |                   |             2
        10000 | RLBK_TABLE  | myschema2   | mytbl4     |                   |             4
        10000 | RLBK_TABLE  | myschema2   | mytbl5     |                   |             1
        10000 | RLBK_TABLE  | myschema2   | mytbl6     |                   |             3
        10000 | SET_FK_IMM  | myschema2   | mytbl4     | mytbl4_col43_fkey |             4
        10000 | SET_FK_IMM  | myschema2   | mytbl6     | mytbl6_col61_fkey |             3
        10000 | SET_FK_IMM  | myschema2   | mytbl8     | mytbl8_col81_fkey |             3
        10000 | ADD_FK      | myschema2   | mytbl4     | mytbl4_col44_fkey |             2
        10000 | CTRL-DBLINK |             |            |                   |            10
        10001 | DROP_FK     |             |            |                   |             1
        10001 | SET_FK_DEF  |             |            |                   |             2
        10001 | RLBK_TABLE  | myschema2   | mytbl4     |                   |             2
        10001 | RLBK_TABLE  | myschema2   | mytbl5     |                   |             1
        10001 | RLBK_TABLE  | myschema2   | mytbl6     |                   |             3
        10001 | SET_FK_IMM  | myschema2   | mytbl4     | mytbl4_col43_fkey |             2
        10001 | SET_FK_IMM  | myschema2   | mytbl6     | mytbl6_col61_fkey |             3
        10001 | SET_FK_IMM  | myschema2   | mytbl8     | mytbl8_col81_fkey |             3
        10001 | ADD_FK      | myschema2   | mytbl4     | mytbl4_col44_fkey |             2
        10001 | CTRL-DBLINK |             |            |                   |            10
        10002 | DIS_LOG_TRG |             |            |                   |             2
        10002 | DROP_FK     |             |            |                   |             1
        10002 | SET_FK_DEF  |             |            |                   |             1
        10002 | RLBK_TABLE  | myschema1   | mytbl1     |                   |             3
        10002 | RLBK_TABLE  | myschema1   | mytbl4     |                   |             8
        10002 | DELETE_LOG  | myschema1   | mytbl1     |                   |             3
        10002 | DELETE_LOG  | myschema1   | mytbl4     |                   |             8
        10002 | SET_FK_IMM  | myschema1   | mytbl4     | mytbl4_col43_fkey |             8
        10002 | ADD_FK      | myschema1   | mytbl4     | mytbl4_col44_fkey |             0
        10002 | ENA_LOG_TRG |             |            |                   |             2
        10002 | CTRL+DBLINK |             |            |                   |            12
        10003 | DROP_FK     |             |            |                   |             1
        10003 | SET_FK_DEF  |             |            |                   |             2
        10003 | RLBK_TABLE  | myschema2   | mytbl4     |                   |             8
        10003 | RLBK_TABLE  | myschema2   | mytbl5     |                   |             3
        10003 | RLBK_TABLE  | myschema2   | mytbl6     |                   |             9
        10003 | SET_FK_IMM  | myschema2   | mytbl4     | mytbl4_col43_fkey |             8
        10003 | SET_FK_IMM  | myschema2   | mytbl6     | mytbl6_col61_fkey |             9
        10003 | SET_FK_IMM  | myschema2   | mytbl8     | mytbl8_col81_fkey |             9
        10003 | ADD_FK      | myschema2   | mytbl4     | mytbl4_col44_fkey |             2
        10003 | CTRL+DBLINK |             |            |                   |            10
        10004 | DIS_LOG_TRG |             |            |                   |             3
        10004 | DROP_FK     |             |            |                   |             1
        10004 | SET_FK_DEF  |             |            |                   |             2
        10004 | RLBK_TABLE  | myschema2   | mytbl4     |                   |             6
        10004 | RLBK_TABLE  | myschema2   | mytbl5     |                   |             3
        10004 | RLBK_TABLE  | myschema2   | mytbl6     |                   |             9
        10004 | DELETE_LOG  | myschema2   | mytbl4     |                   |             6
        10004 | DELETE_LOG  | myschema2   | mytbl5     |                   |             3
        10004 | DELETE_LOG  | myschema2   | mytbl6     |                   |             9
        10004 | SET_FK_IMM  | myschema2   | mytbl4     | mytbl4_col43_fkey |             6
        10004 | SET_FK_IMM  | myschema2   | mytbl6     | mytbl6_col61_fkey |             9
        10004 | SET_FK_IMM  | myschema2   | mytbl8     | mytbl8_col81_fkey |             9
        10004 | ADD_FK      | myschema2   | mytbl4     | mytbl4_col44_fkey |             2
        10004 | ENA_LOG_TRG |             |            |                   |             3
        10004 | CTRL+DBLINK |             |            |                   |            19
        10005 | DIS_LOG_TRG |             |            |                   |             2
        10005 | DROP_FK     |             |            |                   |             1
        10005 | SET_FK_DEF  |             |            |                   |             1
        10005 | RLBK_TABLE  | myschema1   | mytbl1     |                   |             1
        10005 | RLBK_TABLE  | myschema1   | mytbl4     |                   |             2
        10005 | DELETE_LOG  | myschema1   | mytbl1     |                   |             1
        10005 | DELETE_LOG  | myschema1   | mytbl4     |                   |             2
        10005 | SET_FK_IMM  | myschema1   | mytbl4     | mytbl4_col43_fkey |             2
        10005 | ADD_FK      | myschema1   | mytbl4     | mytbl4_col44_fkey |             0
        10005 | ENA_LOG_TRG |             |            |                   |             2
        10005 | CTRL+DBLINK |             |            |                   |            12
        10006 | DROP_FK     |             |            |                   |             1
        10006 | SET_FK_DEF  |             |            |                   |             1
        10006 | RLBK_TABLE  | myschema1   | myTbl3     |                   |            10
        10006 | RLBK_TABLE  | myschema1   | mytbl1     |                   |             1
        10006 | RLBK_TABLE  | myschema1   | mytbl4     |                   |             2
        10006 | SET_FK_IMM  | myschema1   | mytbl4     | mytbl4_col43_fkey |             2
        10006 | ADD_FK      | myschema1   | mytbl4     | mytbl4_col44_fkey |             0
        10006 | CTRL+DBLINK |             |            |                   |             7
        10013 | DIS_LOG_TRG |             |            |                   |             1
        10013 | DROP_FK     |             |            |                   |             1
        10013 | RLBK_TABLE  | myschema1   | mytbl1     |                   |            20
        10013 | DELETE_LOG  | myschema1   | mytbl1     |                   |            20
        10013 | ADD_FK      | myschema1   | mytbl4     | mytbl4_col44_fkey |             0
        10013 | ENA_LOG_TRG |             |            |                   |             1
        10013 | CTRL+DBLINK |             |            |                   |             6
(89 rows)

-----------------------------
-- Step 12 : tests snaps and script generation functions
-----------------------------
-- first perform changes in a table with generated columns
set search_path=public,myschema1;
insert into mytbl2b (col21) values (10),(11);
update mytbl2b set col21 = 12 where col21 = 11;
delete from mytbl2b where col21 >= 10;
-- add some updates for tables with unusual types (arrays, geometric)
set search_path=public,myschema2;
insert into myTbl5 values (10,'{"abc","def","ghi"}','{1,2,3}',NULL,'{}');
insert into myTbl5 values (20,array['abc','def','ghi'],array[3,4,5],array['2000/02/01'::date,'2000/02/28'::date],'{"id":1000, "c1":"abc"}');
update myTbl5 set col54 = '{"2010/11/28","2010/12/03"}', col55 = '{"id":1001, "c2":"def"}' where col54 is null;
insert into myTbl6 select i+10, point(i,1.3), '((0,0),(2,2))', circle(point(5,5),i),'((-2,-2),(3,0),(1,4))','10.20.30.40/27' from generate_series (1,8) as i;
update myTbl6 set col64 = '<(5,6),3.5>', col65 = null where col61 <= 13;
-- also add rows with unusual text content
insert into mytbl2 values (10, E'row 1 \r... and row 2 with a '' (quote) character',null);
insert into mytbl2 values (11, E'row 1 with a true \\ character\r... and row 2 with two \\n true and a '' (quote) characters',null);
-- and manupulate NULL characters
insert into mytbl1 values (200, E'Start\tEnd ', E'A\\000B'::BYTEA);
update mytbl1 set col12 = E' Start\tEnd' where col11 = 200;
delete from mytbl1 where col13 = E'A\\000B'::BYTEA;
-- also apply some changes in sequence characteristics
reset role;
alter sequence myschema2.myseq1 minvalue 1 maxvalue 100 increment 10 start 21 restart 11 cache 2 cycle;
set role emaj_regression_tests_adm_user;
-- create the directory for the first snaps set
\! mkdir -p $EMAJTESTTMPDIR/snaps1
-- ... and snap the all groups
select emaj.emaj_snap_group('myGroup1',:'EMAJTESTTMPDIR' || '/snaps1','CSV HEADER');
 emaj_snap_group 
-----------------
               7
(1 row)

select emaj.emaj_snap_group('myGroup2',:'EMAJTESTTMPDIR' || '/snaps1','CSV HEADER');
 emaj_snap_group 
-----------------
               8
(1 row)

select emaj.emaj_snap_group('phil''s group#3",',:'EMAJTESTTMPDIR' || '/snaps1','CSV HEADER');
 emaj_snap_group 
-----------------
               4
(1 row)

\! ls $EMAJTESTTMPDIR/snaps1
_INFO
myschema1_myTbl3.snap
myschema1_myTbl3_col31_seq.snap
myschema1_mytbl1.snap
myschema1_mytbl2.snap
myschema1_mytbl2b.snap
myschema1_mytbl2b_col20_seq.snap
myschema1_mytbl4.snap
myschema2_myTbl3.snap
myschema2_myTbl3_col31_seq.snap
myschema2_myseq1.snap
myschema2_mytbl1.snap
myschema2_mytbl2.snap
myschema2_mytbl4.snap
myschema2_mytbl5.snap
myschema2_mytbl6.snap
phil's_schema3_myTbl2_.snap
phil's_schema3_myTbl2__col21_seq.snap
phil's_schema3_phil's_seq_1.snap
phil's_schema3_phil's_tbl1.snap
-- generate a sql script for each active group (and check the result with detailed log statistics + number of sequences)
select emaj.emaj_gen_sql_group('myGroup1', 'Multi-1', NULL, :'EMAJTESTTMPDIR' || '/myGroup1.sql');
NOTICE:  table "emaj_temp_script" does not exist, skipping
 emaj_gen_sql_group 
--------------------
                  6
(1 row)

select coalesce(sum(stat_rows),0) + 2 as check from emaj.emaj_detailed_log_stat_group('myGroup1', 'Multi-1', NULL);
 check 
-------
     7
(1 row)

select emaj.emaj_gen_sql_group('myGroup2', 'Multi-1', NULL, :'EMAJTESTTMPDIR' || '/myGroup2.sql', array[
     'myschema2.mytbl1','myschema2.mytbl2','myschema2.myTbl3','myschema2.mytbl4',
     'myschema2.mytbl5','myschema2.mytbl6','myschema2.myseq1','myschema2.myTbl3_col31_seq']);
NOTICE:  table "emaj_temp_script" does not exist, skipping
 emaj_gen_sql_group 
--------------------
                 26
(1 row)

select sum(stat_rows) + 2 as check from emaj.emaj_detailed_log_stat_group('myGroup2', 'Multi-1', NULL);
 check 
-------
    27
(1 row)

select emaj.emaj_gen_sql_group('phil''s group#3",', 'M1_rollbackable', NULL, :'EMAJTESTTMPDIR' || '/Group3.sql');
NOTICE:  table "emaj_temp_script" does not exist, skipping
 emaj_gen_sql_group 
--------------------
                 56
(1 row)

select sum(stat_rows) + 2 as check from emaj.emaj_detailed_log_stat_group('phil''s group#3",', 'M1_rollbackable', NULL);
 check 
-------
    57
(1 row)

-- generate another sql script for myGroup1 but with a manual export and check both scripts are the same
select emaj.emaj_gen_sql_group('myGroup1', 'Multi-1', NULL, NULL);
NOTICE:  table "emaj_temp_script" does not exist, skipping
 emaj_gen_sql_group 
--------------------
                  6
(1 row)

\setenv FILE1 :EMAJTESTTMPDIR'/myGroup1_2.sql'
\copy (select * from emaj_sql_script) to program 'cat >$FILE1'
-- mask timestamp in initial comment and compare
\! find $EMAJTESTTMPDIR -name '*.sql' -type f -print0 | xargs -0 sed -i -s 's/at .*$/at [ts]$/'
\! diff $EMAJTESTTMPDIR/myGroup1.sql $EMAJTESTTMPDIR/myGroup1_2.sql
-- process \\ characters in script files
\! find $EMAJTESTTMPDIR -name '*.sql' -type f -print0 | xargs -0 sed -i_s -s 's/\\\\/\\/g'
-- comment transaction commands for the need of the current test
\! find $EMAJTESTTMPDIR -name '*.sql' -type f -print0 | xargs -0 sed -i -s 's/^BEGIN/--BEGIN/;s/^COMMIT/--COMMIT/'
-- mask timestamp in initial comment
\! find $EMAJTESTTMPDIR -name '*.sql' -type f -print0 | xargs -0 sed -i -s 's/at .*$/at [ts]$/'
\! ls $EMAJTESTTMPDIR
Group3.sql
Group3.sql_s
myGroup1.sql
myGroup1.sql_s
myGroup1_2.sql
myGroup1_2.sql_s
myGroup2.sql
myGroup2.sql_s
snaps1
-- create the directory for the second snaps set
\! mkdir $EMAJTESTTMPDIR/snaps2
-- in a single transaction and as superuser:
--   rollback groups, replay updates with generated scripts, snap groups again and cancel the transaction
reset role;
begin;
  select * from emaj.emaj_rollback_group('myGroup1','Multi-1',false) order by 1,2;
 rlbk_severity |            rlbk_message             
---------------+-------------------------------------
 Notice        | 1 / 5 tables effectively processed.
 Notice        | 2 sequences processed.
(2 rows)

  select * from emaj.emaj_rollback_group('myGroup2','Multi-1',false) order by 1,2;
 rlbk_severity |            rlbk_message             
---------------+-------------------------------------
 Notice        | 2 sequences processed.
 Notice        | 4 / 6 tables effectively processed.
(2 rows)

  select * from emaj.emaj_rollback_group('phil''s group#3",','M1_rollbackable',false) order by 1,2;
 rlbk_severity |            rlbk_message             
---------------+-------------------------------------
 Notice        | 2 / 2 tables effectively processed.
 Notice        | 2 sequences processed.
(2 rows)

  \! cat $EMAJTESTTMPDIR/myGroup1.sql
-- SQL script generated by E-Maj at [ts]$
--    for tables group(s): myGroup1
--    processing logs between mark Multi-1 and the current situation
SET standard_conforming_strings = OFF;
SET escape_string_warning = OFF;
SET datestyle = 'ISO, YMD';
--BEGIN TRANSACTION;
INSERT INTO myschema1.mytbl2b VALUES (6, 10, NULL, 'true');
INSERT INTO myschema1.mytbl2b VALUES (7, 11, NULL, 'true');
UPDATE ONLY myschema1.mytbl2b SET col20 = 7, col21 = 12, col22 = NULL, col23 = 'true' WHERE col20 = 7;
DELETE FROM ONLY myschema1.mytbl2b WHERE col20 = 6;
DELETE FROM ONLY myschema1.mytbl2b WHERE col20 = 7;
ALTER SEQUENCE myschema1.mytbl2b_col20_seq  RESTART 8;
--COMMIT;
RESET standard_conforming_strings;
RESET escape_string_warning;
RESET datestyle;
\set FILE1 :EMAJTESTTMPDIR '/myGroup1.sql'
\i :FILE1
-- SQL script generated by E-Maj at [ts]$
--    for tables group(s): myGroup1
--    processing logs between mark Multi-1 and the current situation
SET standard_conforming_strings = OFF;
SET escape_string_warning = OFF;
SET datestyle = 'ISO, YMD';
--BEGIN TRANSACTION;
INSERT INTO myschema1.mytbl2b VALUES (6, 10, NULL, 'true');
INSERT INTO myschema1.mytbl2b VALUES (7, 11, NULL, 'true');
UPDATE ONLY myschema1.mytbl2b SET col20 = 7, col21 = 12, col22 = NULL, col23 = 'true' WHERE col20 = 7;
DELETE FROM ONLY myschema1.mytbl2b WHERE col20 = 6;
DELETE FROM ONLY myschema1.mytbl2b WHERE col20 = 7;
ALTER SEQUENCE myschema1.mytbl2b_col20_seq  RESTART 8;
--COMMIT;
RESET standard_conforming_strings;
RESET escape_string_warning;
RESET datestyle;
\set FILE2 :EMAJTESTTMPDIR '/myGroup2.sql'
\i :FILE2
-- SQL script generated by E-Maj at [ts]$
--    for tables group(s): myGroup2
--    processing logs between mark Multi-1 and the current situation
--    only for the following tables/sequences: myschema2.myTbl3,myschema2.myTbl3_col31_seq,myschema2.myseq1,myschema2.mytbl1,myschema2.mytbl2,myschema2.mytbl4,myschema2.mytbl5,myschema2.mytbl6
SET standard_conforming_strings = OFF;
SET escape_string_warning = OFF;
SET datestyle = 'ISO, YMD';
--BEGIN TRANSACTION;
INSERT INTO myschema2.mytbl5 VALUES (10, '{abc,def,ghi}', '{1,2,3}', NULL, '{}');
INSERT INTO myschema2.mytbl5 VALUES (20, '{abc,def,ghi}', '{3,4,5}', '{2000-02-01,2000-02-28}', '{"id":1000, "c1":"abc"}');
UPDATE ONLY myschema2.mytbl5 SET col51 = 10, col52 = '{abc,def,ghi}', col53 = '{1,2,3}', col54 = '{2010-11-28,2010-12-03}', col55 = '{"id":1001, "c2":"def"}' WHERE col51 = 10;
INSERT INTO myschema2.mytbl6 VALUES (11, '(1,1.3)', '(2,2),(0,0)', '<(5,5),1>', '((-2,-2),(3,0),(1,4))', '10.20.30.40/27');
INSERT INTO myschema2.mytbl6 VALUES (12, '(2,1.3)', '(2,2),(0,0)', '<(5,5),2>', '((-2,-2),(3,0),(1,4))', '10.20.30.40/27');
INSERT INTO myschema2.mytbl6 VALUES (13, '(3,1.3)', '(2,2),(0,0)', '<(5,5),3>', '((-2,-2),(3,0),(1,4))', '10.20.30.40/27');
INSERT INTO myschema2.mytbl6 VALUES (14, '(4,1.3)', '(2,2),(0,0)', '<(5,5),4>', '((-2,-2),(3,0),(1,4))', '10.20.30.40/27');
INSERT INTO myschema2.mytbl6 VALUES (15, '(5,1.3)', '(2,2),(0,0)', '<(5,5),5>', '((-2,-2),(3,0),(1,4))', '10.20.30.40/27');
INSERT INTO myschema2.mytbl6 VALUES (16, '(6,1.3)', '(2,2),(0,0)', '<(5,5),6>', '((-2,-2),(3,0),(1,4))', '10.20.30.40/27');
INSERT INTO myschema2.mytbl6 VALUES (17, '(7,1.3)', '(2,2),(0,0)', '<(5,5),7>', '((-2,-2),(3,0),(1,4))', '10.20.30.40/27');
INSERT INTO myschema2.mytbl6 VALUES (18, '(8,1.3)', '(2,2),(0,0)', '<(5,5),8>', '((-2,-2),(3,0),(1,4))', '10.20.30.40/27');
UPDATE ONLY myschema2.mytbl6 SET col61 = 0, col62 = NULL, col63 = NULL, col64 = '<(5,6),3.5>', col65 = NULL, col66 = NULL WHERE col61 = 0;
UPDATE ONLY myschema2.mytbl6 SET col61 = 4, col62 = '(4,1.3)', col63 = '(2,2),(0,0)', col64 = '<(5,6),3.5>', col65 = NULL, col66 = '10.20.30.40/27' WHERE col61 = 4;
UPDATE ONLY myschema2.mytbl6 SET col61 = 5, col62 = '(5,1.3)', col63 = '(2,2),(0,0)', col64 = '<(5,6),3.5>', col65 = NULL, col66 = '10.20.30.40/27' WHERE col61 = 5;
UPDATE ONLY myschema2.mytbl6 SET col61 = 6, col62 = '(6,1.3)', col63 = '(2,2),(0,0)', col64 = '<(5,6),3.5>', col65 = NULL, col66 = '10.20.30.40/27' WHERE col61 = 6;
UPDATE ONLY myschema2.mytbl6 SET col61 = 7, col62 = '(7,1.3)', col63 = '(2,2),(0,0)', col64 = '<(5,6),3.5>', col65 = NULL, col66 = '10.20.30.40/27' WHERE col61 = 7;
UPDATE ONLY myschema2.mytbl6 SET col61 = 8, col62 = '(8,1.3)', col63 = '(2,2),(0,0)', col64 = '<(5,6),3.5>', col65 = NULL, col66 = '10.20.30.40/27' WHERE col61 = 8;
UPDATE ONLY myschema2.mytbl6 SET col61 = 11, col62 = '(1,1.3)', col63 = '(2,2),(0,0)', col64 = '<(5,6),3.5>', col65 = NULL, col66 = '10.20.30.40/27' WHERE col61 = 11;
UPDATE ONLY myschema2.mytbl6 SET col61 = 12, col62 = '(2,1.3)', col63 = '(2,2),(0,0)', col64 = '<(5,6),3.5>', col65 = NULL, col66 = '10.20.30.40/27' WHERE col61 = 12;
UPDATE ONLY myschema2.mytbl6 SET col61 = 13, col62 = '(3,1.3)', col63 = '(2,2),(0,0)', col64 = '<(5,6),3.5>', col65 = NULL, col66 = '10.20.30.40/27' WHERE col61 = 13;
INSERT INTO myschema2.mytbl2 VALUES (10, 'row 1 \r... and row 2 with a '' (quote) character', NULL);
INSERT INTO myschema2.mytbl2 VALUES (11, E'row 1 with a true \\ character\r... and row 2 with two \\n true and a '' (quote) characters', NULL);
INSERT INTO myschema2.mytbl1 VALUES (200, 'Start\tEnd', E'\\x410042');
UPDATE ONLY myschema2.mytbl1 SET col11 = 200, col12 = ' Start\tEnd', col13 = E'\\x410042' WHERE col11 = 200 AND col12 = 'Start\tEnd';
DELETE FROM ONLY myschema2.mytbl1 WHERE col11 = 200 AND col12 = ' Start\tEnd';
ALTER SEQUENCE myschema2.myseq1  RESTART 11 START 21 INCREMENT 10 MINVALUE 1 MAXVALUE 100 CACHE 2 CYCLE ;
--COMMIT;
RESET standard_conforming_strings;
RESET escape_string_warning;
RESET datestyle;
\set FILE3 :EMAJTESTTMPDIR '/Group3.sql'
\i :FILE3
-- SQL script generated by E-Maj at [ts]$
--    for tables group(s): phil's group#3",
--    processing logs between mark M1_rollbackable and the current situation
SET standard_conforming_strings = OFF;
SET escape_string_warning = OFF;
SET datestyle = 'ISO, YMD';
--BEGIN TRANSACTION;
INSERT INTO "phil's schema3"."phil's tbl1" VALUES (1, 'AB''C', E'\\x0c');
INSERT INTO "phil's schema3"."phil's tbl1" VALUES (2, 'AB''C', E'\\x0c');
INSERT INTO "phil's schema3"."phil's tbl1" VALUES (3, 'AB''C', E'\\x0c');
INSERT INTO "phil's schema3"."phil's tbl1" VALUES (4, 'AB''C', E'\\x0c');
INSERT INTO "phil's schema3"."phil's tbl1" VALUES (5, 'AB''C', E'\\x0c');
INSERT INTO "phil's schema3"."phil's tbl1" VALUES (6, 'AB''C', E'\\x0c');
INSERT INTO "phil's schema3"."phil's tbl1" VALUES (7, 'AB''C', E'\\x0c');
INSERT INTO "phil's schema3"."phil's tbl1" VALUES (8, 'AB''C', E'\\x0c');
INSERT INTO "phil's schema3"."phil's tbl1" VALUES (9, 'AB''C', E'\\x0c');
INSERT INTO "phil's schema3"."phil's tbl1" VALUES (10, 'AB''C', E'\\x0c');
INSERT INTO "phil's schema3"."phil's tbl1" VALUES (11, 'AB''C', E'\\x0c');
INSERT INTO "phil's schema3"."phil's tbl1" VALUES (12, 'AB''C', E'\\x0c');
INSERT INTO "phil's schema3"."phil's tbl1" VALUES (13, 'AB''C', E'\\x0c');
INSERT INTO "phil's schema3"."phil's tbl1" VALUES (14, 'AB''C', E'\\x0c');
INSERT INTO "phil's schema3"."phil's tbl1" VALUES (15, 'AB''C', E'\\x0c');
INSERT INTO "phil's schema3"."phil's tbl1" VALUES (16, 'AB''C', E'\\x0c');
INSERT INTO "phil's schema3"."phil's tbl1" VALUES (17, 'AB''C', E'\\x0c');
INSERT INTO "phil's schema3"."phil's tbl1" VALUES (18, 'AB''C', E'\\x0c');
INSERT INTO "phil's schema3"."phil's tbl1" VALUES (19, 'AB''C', E'\\x0c');
INSERT INTO "phil's schema3"."phil's tbl1" VALUES (20, 'AB''C', E'\\x0c');
INSERT INTO "phil's schema3"."phil's tbl1" VALUES (21, 'AB''C', E'\\x0c');
INSERT INTO "phil's schema3"."phil's tbl1" VALUES (22, 'AB''C', E'\\x0c');
INSERT INTO "phil's schema3"."phil's tbl1" VALUES (23, 'AB''C', E'\\x0c');
INSERT INTO "phil's schema3"."phil's tbl1" VALUES (24, 'AB''C', E'\\x0c');
INSERT INTO "phil's schema3"."phil's tbl1" VALUES (25, 'AB''C', E'\\x0c');
INSERT INTO "phil's schema3"."phil's tbl1" VALUES (26, 'AB''C', E'\\x0c');
INSERT INTO "phil's schema3"."phil's tbl1" VALUES (27, 'AB''C', E'\\x0c');
INSERT INTO "phil's schema3"."phil's tbl1" VALUES (28, 'AB''C', E'\\x0c');
INSERT INTO "phil's schema3"."phil's tbl1" VALUES (29, 'AB''C', E'\\x0c');
INSERT INTO "phil's schema3"."phil's tbl1" VALUES (30, 'AB''C', E'\\x0c');
INSERT INTO "phil's schema3"."phil's tbl1" VALUES (31, 'AB''C', E'\\x0c');
UPDATE ONLY "phil's schema3"."phil's tbl1" SET "phil's col11" = 1, "phil's col12" = 'AB''C', "phil\s col13" = E'\\x1c' WHERE "phil's col11" = 1 AND "phil's col12" = 'AB''C';
UPDATE ONLY "phil's schema3"."phil's tbl1" SET "phil's col11" = 2, "phil's col12" = 'AB''C', "phil\s col13" = E'\\x1c' WHERE "phil's col11" = 2 AND "phil's col12" = 'AB''C';
UPDATE ONLY "phil's schema3"."phil's tbl1" SET "phil's col11" = 3, "phil's col12" = 'AB''C', "phil\s col13" = E'\\x1c' WHERE "phil's col11" = 3 AND "phil's col12" = 'AB''C';
UPDATE ONLY "phil's schema3"."phil's tbl1" SET "phil's col11" = 18, "phil's col12" = 'AB''C', "phil\s col13" = E'\\x1c27' WHERE "phil's col11" = 18 AND "phil's col12" = 'AB''C';
UPDATE ONLY "phil's schema3"."phil's tbl1" SET "phil's col11" = 19, "phil's col12" = 'AB''C', "phil\s col13" = E'\\x1c27' WHERE "phil's col11" = 19 AND "phil's col12" = 'AB''C';
UPDATE ONLY "phil's schema3"."phil's tbl1" SET "phil's col11" = 20, "phil's col12" = 'AB''C', "phil\s col13" = E'\\x1c27' WHERE "phil's col11" = 20 AND "phil's col12" = 'AB''C';
UPDATE ONLY "phil's schema3"."phil's tbl1" SET "phil's col11" = 21, "phil's col12" = 'AB''C', "phil\s col13" = E'\\x1c27' WHERE "phil's col11" = 21 AND "phil's col12" = 'AB''C';
UPDATE ONLY "phil's schema3"."phil's tbl1" SET "phil's col11" = 22, "phil's col12" = 'AB''C', "phil\s col13" = E'\\x1c27' WHERE "phil's col11" = 22 AND "phil's col12" = 'AB''C';
INSERT INTO "phil's schema3"."myTbl2\" VALUES (1, 'ABC', '2010-12-31');
DELETE FROM ONLY "phil's schema3"."phil's tbl1" WHERE "phil's col11" = 23 AND "phil's col12" = 'AB''C';
DELETE FROM ONLY "phil's schema3"."phil's tbl1" WHERE "phil's col11" = 24 AND "phil's col12" = 'AB''C';
DELETE FROM ONLY "phil's schema3"."phil's tbl1" WHERE "phil's col11" = 25 AND "phil's col12" = 'AB''C';
DELETE FROM ONLY "phil's schema3"."phil's tbl1" WHERE "phil's col11" = 26 AND "phil's col12" = 'AB''C';
DELETE FROM ONLY "phil's schema3"."phil's tbl1" WHERE "phil's col11" = 27 AND "phil's col12" = 'AB''C';
DELETE FROM ONLY "phil's schema3"."phil's tbl1" WHERE "phil's col11" = 28 AND "phil's col12" = 'AB''C';
DELETE FROM ONLY "phil's schema3"."phil's tbl1" WHERE "phil's col11" = 29 AND "phil's col12" = 'AB''C';
DELETE FROM ONLY "phil's schema3"."phil's tbl1" WHERE "phil's col11" = 30 AND "phil's col12" = 'AB''C';
DELETE FROM ONLY "phil's schema3"."phil's tbl1" WHERE "phil's col11" = 31 AND "phil's col12" = 'AB''C';
DELETE FROM ONLY "phil's schema3"."phil's tbl1" WHERE "phil's col11" = 21 AND "phil's col12" = 'AB''C';
DELETE FROM ONLY "phil's schema3"."phil's tbl1" WHERE "phil's col11" = 22 AND "phil's col12" = 'AB''C';
INSERT INTO "phil's schema3"."myTbl2\" VALUES (2, 'DEF', NULL);
DELETE FROM ONLY "phil's schema3"."phil's tbl1" WHERE "phil's col11" = 10 AND "phil's col12" = 'AB''C';
UPDATE ONLY "phil's schema3"."phil's tbl1" SET "phil's col11" = 1, "phil's col12" = 'DEF', "phil\s col13" = E'\\x1c' WHERE "phil's col11" = 1 AND "phil's col12" = 'AB''C';
UPDATE ONLY "phil's schema3"."phil's tbl1" SET "phil's col11" = 2, "phil's col12" = 'DEF', "phil\s col13" = E'\\x1c' WHERE "phil's col11" = 2 AND "phil's col12" = 'AB''C';
ALTER SEQUENCE "phil's schema3"."phil's seq\1"  RESTART 1002;
--COMMIT;
RESET standard_conforming_strings;
RESET escape_string_warning;
RESET datestyle;
  select emaj.emaj_snap_group('myGroup1',:'EMAJTESTTMPDIR' || '/snaps2','CSV HEADER');
 emaj_snap_group 
-----------------
               7
(1 row)

  select emaj.emaj_snap_group('myGroup2',:'EMAJTESTTMPDIR' || '/snaps2','CSV HEADER');
 emaj_snap_group 
-----------------
               8
(1 row)

  select emaj.emaj_snap_group('phil''s group#3",',:'EMAJTESTTMPDIR' || '/snaps2','CSV HEADER');
 emaj_snap_group 
-----------------
               4
(1 row)

rollback;
-- mask timestamp in _INFO files
\! sed -i_s -s 's/at .*/at [ts]/' $EMAJTESTTMPDIR/snaps1/_INFO $EMAJTESTTMPDIR/snaps2/_INFO
-- and compare both snaps sets
-- sequences are detected as different because of :
-- - the effect of RESTART on is_called and next_val attributes
-- - internal log_cnt value being reset
\! diff --exclude _INFO_s $EMAJTESTTMPDIR/snaps1 $EMAJTESTTMPDIR/snaps2
diff --exclude _INFO_s /tmp/emaj_96/adm2/snaps1/myschema1_mytbl2b_col20_seq.snap /tmp/emaj_96/adm2/snaps2/myschema1_mytbl2b_col20_seq.snap
2c2
< mytbl2b_col20_seq,7,1,1,9223372036854775807,1,1,f,t
---
> mytbl2b_col20_seq,8,1,1,9223372036854775807,1,1,f,f
diff --exclude _INFO_s /tmp/emaj_96/adm2/snaps1/phil's_schema3_phil's_seq_1.snap /tmp/emaj_96/adm2/snaps2/phil's_schema3_phil's_seq_1.snap
2c2
< phil's seq\1,1001,1000,1,2000,1000,1,t,t
---
> phil's seq\1,1002,1000,1,2000,1000,1,t,f
-- reset the sequence myschema2.myseq1 to its previous characteristics
reset role;
alter sequence myschema2.myseq1 restart 1004 start 1000 increment 1 maxvalue 9223372036854775807 minvalue 1000 cache 1 no cycle;
set role emaj_regression_tests_adm_user;
-----------------------------
-- Step 13 : test use of a table with a very long name (63 characters long)
-----------------------------
select emaj.emaj_stop_group('phil''s group#3",');
 emaj_stop_group 
-----------------
               4
(1 row)

-- remove the "phil's tbl1" table, rename it and reassign it to its group
select emaj.emaj_remove_table('phil''s schema3','phil''s tbl1');
 emaj_remove_table 
-------------------
                 1
(1 row)

reset role;
alter table "phil's schema3"."phil's tbl1" rename to table_with_very_looooooooooooooooooooooooooooooooooooooong_name;
set role emaj_regression_tests_adm_user;
select emaj.emaj_assign_table('phil''s schema3', 'table_with_very_looooooooooooooooooooooooooooooooooooooong_name', 'phil''s group#3",');
NOTICE:  table "table_with_very_looooooooooooooooooooooooooooooooo#1_log" does not exist, skipping
NOTICE:  trigger "emaj_log_trg" for relation "phil's schema3.table_with_very_looooooooooooooooooooooooooooooooooooooong_name" does not exist, skipping
NOTICE:  trigger "emaj_trunc_trg" for relation "phil's schema3.table_with_very_looooooooooooooooooooooooooooooooooooooong_name" does not exist, skipping
 emaj_assign_table 
-------------------
                 1
(1 row)

-- use the table and its group
select emaj.emaj_start_group('phil''s group#3",','M1_after_table_rename');
WARNING:  _check_fk_groups: The foreign key "mytbl2_col21_fkey" on the table "phil's schema3.myTbl2\" references the table "phil's schema3.mytbl4" that is outside the groups (phil's group#3",).
WARNING:  _check_fk_groups: The table "phil's schema3.table_with_very_looooooooooooooooooooooooooooooooooooooong_name" is referenced by the foreign key "mytbl4_col44_fkey" on the table "phil's schema3.mytbl4" that is outside the groups (phil's group#3",).
 emaj_start_group 
------------------
                4
(1 row)

update "phil's schema3".table_with_very_looooooooooooooooooooooooooooooooooooooong_name set "phil's col12" = 'GHI' where "phil's col11" between 6 and 9;
select emaj.emaj_set_mark_group('phil''s group#3",','M2');
 emaj_set_mark_group 
---------------------
                   4
(1 row)

delete from "phil's schema3".table_with_very_looooooooooooooooooooooooooooooooooooooong_name where "phil's col11" > 18;
select * from emaj.emaj_rollback_group('phil''s group#3",','M1_after_table_rename',false) order by 1,2;
 rlbk_severity |            rlbk_message             
---------------+-------------------------------------
 Notice        | 1 / 2 tables effectively processed.
 Notice        | 2 sequences processed.
(2 rows)

select emaj.emaj_stop_group('phil''s group#3",');
 emaj_stop_group 
-----------------
               4
(1 row)

select emaj.emaj_drop_group('phil''s group#3",');
 emaj_drop_group 
-----------------
               4
(1 row)

--
reset role;
alter table "phil's schema3".table_with_very_looooooooooooooooooooooooooooooooooooooong_name rename to "phil's tbl1";
-----------------------------
-- Step 14 : test use of groups or marks protection
-----------------------------
set role emaj_regression_tests_adm_user;
-- try to rollback a protected group
select emaj.emaj_protect_group('myGroup2');
 emaj_protect_group 
--------------------
                  1
(1 row)

select * from emaj.emaj_rollback_group('myGroup2','M3',false) order by 1,2;
ERROR:  _check_group_names: The group "myGroup2" is currently protected against rollback operations.
CONTEXT:  PL/pgSQL function emaj._check_group_names(text[],boolean,boolean,text) line 100 at RAISE
SQL statement "SELECT emaj._check_group_names(v_groupNames := v_groupNames, v_mayBeNull := FALSE, v_lockGroups := TRUE,
                                     v_checkList := 'LOGGING,ROLLBACKABLE,UNPROTECTED')"
PL/pgSQL function emaj._rlbk_check(text[],text,boolean,boolean) line 16 at SQL statement
SQL statement "SELECT emaj._rlbk_check(v_groupNames, v_mark, v_isAlterGroupAllowed, FALSE)"
PL/pgSQL function emaj._rlbk_init(text[],text,boolean,integer,boolean,boolean) line 23 at SQL statement
SQL statement "SELECT emaj._rlbk_init(v_groupNames, v_mark, v_isLoggedRlbk, 1, v_multiGroup, v_isAlterGroupAllowed)"
PL/pgSQL function emaj._rlbk_groups(text[],text,boolean,boolean,boolean) line 26 at SQL statement
PL/pgSQL function emaj.emaj_rollback_group(text,text,boolean) line 7 at RETURN QUERY
select emaj.emaj_unprotect_group('myGroup2');
 emaj_unprotect_group 
----------------------
                    1
(1 row)

-- try to rollback over a protected mark
select emaj.emaj_set_mark_group('myGroup1','Mark_to_protect');
 emaj_set_mark_group 
---------------------
                   7
(1 row)

select emaj.emaj_protect_mark_group('myGroup1','Mark_to_protect');
 emaj_protect_mark_group 
-------------------------
                       1
(1 row)

select * from emaj.emaj_rollback_group('myGroup1','Multi-1',false) order by 1,2;
ERROR:  _rlbk_check: Protected marks (Mark_to_protect) for the group "myGroup1" block the rollback to the mark "Multi-1".
CONTEXT:  PL/pgSQL function emaj._rlbk_check(text[],text,boolean,boolean) line 41 at RAISE
SQL statement "SELECT emaj._rlbk_check(v_groupNames, v_mark, v_isAlterGroupAllowed, FALSE)"
PL/pgSQL function emaj._rlbk_init(text[],text,boolean,integer,boolean,boolean) line 23 at SQL statement
SQL statement "SELECT emaj._rlbk_init(v_groupNames, v_mark, v_isLoggedRlbk, 1, v_multiGroup, v_isAlterGroupAllowed)"
PL/pgSQL function emaj._rlbk_groups(text[],text,boolean,boolean,boolean) line 26 at SQL statement
PL/pgSQL function emaj.emaj_rollback_group(text,text,boolean) line 7 at RETURN QUERY
select emaj.emaj_unprotect_mark_group('myGroup1','Mark_to_protect');
 emaj_unprotect_mark_group 
---------------------------
                         1
(1 row)

select emaj.emaj_delete_mark_group('myGroup1','Mark_to_protect');
 emaj_delete_mark_group 
------------------------
                      1
(1 row)

-----------------------------
-- Step 15 : test complex use of rollbacks consolidations
-----------------------------
set search_path=public,myschema1;
-- 2 consolidations of 2 logged rollbacks
-- Multi-1 MC1 MC2 RMC1S RMC1D      MC3 MC4 MC5 RMC3S RMC3D
--         ^       lrg(MC1)         ^           lrg(MC3)
--         xxxxxxxxxxxxxxx conso(RMC1D)
-- 	       	                        xxxxxxxxxxxxxxxxxxx conso(RMC3D)
select emaj.emaj_set_mark_group('myGroup1','MC1');
 emaj_set_mark_group 
---------------------
                   7
(1 row)

insert into myTbl1 select i, 'Test', 'Conso' from generate_series (2000,2012) as i;
insert into myTbl2 values (2000,'TC1',NULL);
delete from myTbl1 where col11 > 2010;
select emaj.emaj_set_mark_group('myGroup1','MC2');
 emaj_set_mark_group 
---------------------
                   7
(1 row)

update myTbl2 set col22 = 'TC2' WHERE col22 ='TC1';
select * from emaj.emaj_logged_rollback_group('myGroup1','MC1',false) order by 1,2;
 rlbk_severity |            rlbk_message             
---------------+-------------------------------------
 Notice        | 2 sequences processed.
 Notice        | 3 / 5 tables effectively processed.
(2 rows)

insert into myTbl2 values (2000,'TC3',NULL);
select emaj.emaj_rename_mark_group('myGroup1','EMAJ_LAST_MARK','RLBK_MC1_DONE');
 emaj_rename_mark_group 
------------------------
 
(1 row)

select emaj.emaj_set_mark_group('myGroup1','MC3');
 emaj_set_mark_group 
---------------------
                   7
(1 row)

insert into "myTbl3" (col33) select generate_series(2000,2039,4)/100;
insert into myTbl4 values (2000,'FK...',1,10,'ABC');
update myTbl4 set col43 = NULL where col41 = 2000;
select emaj.emaj_set_mark_group('myGroup1','MC4');
 emaj_set_mark_group 
---------------------
                   7
(1 row)

select emaj.emaj_set_mark_group('myGroup1','MC5');
 emaj_set_mark_group 
---------------------
                   7
(1 row)

select * from emaj.emaj_logged_rollback_group('myGroup1','MC3',false) order by 1,2;
 rlbk_severity |            rlbk_message             
---------------+-------------------------------------
 Notice        | 2 / 5 tables effectively processed.
 Notice        | 2 sequences processed.
(2 rows)

select cons_group, regexp_replace(cons_end_rlbk_mark_name,E'\\d\\d\.\\d\\d\\.\\d\\d\\.\\d\\d\\d\\d','%','g'), 
       cons_target_rlbk_mark_name, cons_end_rlbk_mark_time_id, cons_target_rlbk_mark_time_id, cons_rows, cons_marks, cons_marks
  from emaj.emaj_get_consolidable_rollbacks();
 cons_group | regexp_replace  | cons_target_rlbk_mark_name | cons_end_rlbk_mark_time_id | cons_target_rlbk_mark_time_id | cons_rows | cons_marks | cons_marks 
------------+-----------------+----------------------------+----------------------------+-------------------------------+-----------+------------+------------
 myGroup1   | RLBK_MC1_DONE   | MC1                        |                      10072 |                         10069 |        33 |          2 |          2
 myGroup1   | RLBK_MC3_%_DONE | MC3                        |                      10077 |                         10073 |        23 |          3 |          3
(2 rows)

  
-- consolidate both logged rollback at once
select cons_target_rlbk_mark_name, regexp_replace(cons_end_rlbk_mark_name,E'\\d\\d\.\\d\\d\\.\\d\\d\\.\\d\\d\\d\\d','%','g'), 
       emaj.emaj_consolidate_rollback_group(cons_group, cons_end_rlbk_mark_name)
  from emaj.emaj_get_consolidable_rollbacks() where cons_group = 'myGroup1';
 cons_target_rlbk_mark_name | regexp_replace  | emaj_consolidate_rollback_group 
----------------------------+-----------------+---------------------------------
 MC1                        | RLBK_MC1_DONE   |                               5
 MC3                        | RLBK_MC3_%_DONE |                               4
(2 rows)

select cons_group, regexp_replace(cons_end_rlbk_mark_name,E'\\d\\d\.\\d\\d\\.\\d\\d\\.\\d\\d\\d\\d','%','g'), 
       cons_target_rlbk_mark_name, cons_end_rlbk_mark_time_id, cons_target_rlbk_mark_time_id, cons_rows, cons_marks
  from emaj.emaj_get_consolidable_rollbacks();
 cons_group | regexp_replace  | cons_target_rlbk_mark_name | cons_end_rlbk_mark_time_id | cons_target_rlbk_mark_time_id | cons_rows | cons_marks 
------------+-----------------+----------------------------+----------------------------+-------------------------------+-----------+------------
 myGroup1   | RLBK_MC1_DONE   | MC1                        |                      10072 |                         10069 |         0 |          0
 myGroup1   | RLBK_MC3_%_DONE | MC3                        |                      10077 |                         10073 |         0 |          0
(2 rows)

select stat_group, stat_schema, stat_table, stat_first_mark, stat_last_mark, stat_role, stat_verb, stat_rows
  from emaj.emaj_detailed_log_stat_group('myGroup1','Multi-1',NULL);
 stat_group | stat_schema | stat_table | stat_first_mark | stat_last_mark | stat_role | stat_verb | stat_rows 
------------+-------------+------------+-----------------+----------------+-----------+-----------+-----------
 myGroup1   | myschema1   | mytbl2     | Multi-1         |                | postgres  | INSERT    |         1
 myGroup1   | myschema1   | mytbl2b    | Multi-1         |                | postgres  | DELETE    |         2
 myGroup1   | myschema1   | mytbl2b    | Multi-1         |                | postgres  | INSERT    |         3
 myGroup1   | myschema1   | mytbl2b    | Multi-1         |                | postgres  | UPDATE    |         1
(4 rows)

-- 2 consolidations of 2 nested logged rollbacks
-- MC6 MC7 MC8  RMC8S RMC8D M9 RMC6S RMC6D
--         ^    lrg(MC8)
--         xxxxxxxxxxxx conso(RMC8D)
-- ^                           lrb(MC6)
-- xxxxxxxxxxxxxxxxxxxxxxxxxxxxxxxxxxx conso(RMC6D)
select emaj.emaj_set_mark_group('myGroup1','MC6');
 emaj_set_mark_group 
---------------------
                   7
(1 row)

insert into myTbl1 select i, 'Test', 'Conso' from generate_series (2000,2012) as i;
insert into myTbl2 values (3000,'TC6',NULL);
delete from myTbl1 where col11 > 2010;
select emaj.emaj_set_mark_group('myGroup1','MC7');
 emaj_set_mark_group 
---------------------
                   7
(1 row)

update myTbl2 set col22 = 'TC7' WHERE col22 ='TC6';
select emaj.emaj_set_mark_group('myGroup1','MC8');
 emaj_set_mark_group 
---------------------
                   7
(1 row)

insert into myTbl2 values (3001,'TC8',NULL);
select * from emaj.emaj_logged_rollback_group('myGroup1','MC8',false) order by 1,2;
 rlbk_severity |            rlbk_message             
---------------+-------------------------------------
 Notice        | 2 / 5 tables effectively processed.
 Notice        | 2 sequences processed.
(2 rows)

select emaj.emaj_consolidate_rollback_group('myGroup1','EMAJ_LAST_MARK');
 emaj_consolidate_rollback_group 
---------------------------------
                               4
(1 row)

select emaj.emaj_set_mark_group('myGroup1','MC9');
 emaj_set_mark_group 
---------------------
                   7
(1 row)

insert into "myTbl3" (col33) select generate_series(2000,2039,4)/100;
insert into myTbl4 values (2000,'FK...',1,10,'ABC');
update myTbl4 set col43 = NULL where col41 = 2000;
select * from emaj.emaj_logged_rollback_group('myGroup1','MC6',false) order by 1,2;
 rlbk_severity |            rlbk_message             
---------------+-------------------------------------
 Notice        | 2 sequences processed.
 Notice        | 5 / 5 tables effectively processed.
(2 rows)

select emaj.emaj_consolidate_rollback_group('myGroup1','EMAJ_LAST_MARK');
 emaj_consolidate_rollback_group 
---------------------------------
                               7
(1 row)

select stat_group, stat_schema, stat_table, stat_first_mark, stat_last_mark, stat_role, stat_verb, stat_rows
  from emaj.emaj_detailed_log_stat_group('myGroup1','Multi-1',NULL);
 stat_group | stat_schema | stat_table | stat_first_mark | stat_last_mark | stat_role | stat_verb | stat_rows 
------------+-------------+------------+-----------------+----------------+-----------+-----------+-----------
 myGroup1   | myschema1   | mytbl2     | Multi-1         |                | postgres  | INSERT    |         1
 myGroup1   | myschema1   | mytbl2b    | Multi-1         |                | postgres  | DELETE    |         2
 myGroup1   | myschema1   | mytbl2b    | Multi-1         |                | postgres  | INSERT    |         3
 myGroup1   | myschema1   | mytbl2b    | Multi-1         |                | postgres  | UPDATE    |         1
(4 rows)

-- consolidation of 2 logged rollbacks referencing the same mark
-- MC10  RMC10S RMC10D M11 RMC10S RMC10D
-- ^     lrg(MC10)
-- ^                       lrb(MC10)
-- xxxxxxxxxxxxxxxxxxxxxxxxxxxxxxx conso(RMC10D)
select emaj.emaj_set_mark_group('myGroup1','MC10');
 emaj_set_mark_group 
---------------------
                   7
(1 row)

insert into myTbl1 select i, 'Test', 'Conso' from generate_series (3000,3010) as i;
delete from myTbl1 where col11 > 3005;
select * from emaj.emaj_logged_rollback_group('myGroup1','MC10',false) order by 1,2;
 rlbk_severity |            rlbk_message             
---------------+-------------------------------------
 Notice        | 1 / 5 tables effectively processed.
 Notice        | 2 sequences processed.
(2 rows)

update myTbl2 set col22 = 'TC7' WHERE col22 ='TC6';
select emaj.emaj_set_mark_group('myGroup1','MC11');
 emaj_set_mark_group 
---------------------
                   7
(1 row)

insert into myTbl4 values (3000,'FK...',1,10,'ABC');
update myTbl4 set col43 = NULL where col41 = 3000;
select * from emaj.emaj_logged_rollback_group('myGroup1','MC10',false) order by 1,2;
 rlbk_severity |            rlbk_message             
---------------+-------------------------------------
 Notice        | 2 / 5 tables effectively processed.
 Notice        | 2 sequences processed.
(2 rows)

select emaj.emaj_consolidate_rollback_group('myGroup1','EMAJ_LAST_MARK');
 emaj_consolidate_rollback_group 
---------------------------------
                               4
(1 row)

select stat_group, stat_schema, stat_table, stat_first_mark, stat_last_mark, stat_role, stat_verb, stat_rows
  from emaj.emaj_detailed_log_stat_group('myGroup1','Multi-1',NULL);
 stat_group | stat_schema | stat_table | stat_first_mark | stat_last_mark | stat_role | stat_verb | stat_rows 
------------+-------------+------------+-----------------+----------------+-----------+-----------+-----------
 myGroup1   | myschema1   | mytbl2     | Multi-1         |                | postgres  | INSERT    |         1
 myGroup1   | myschema1   | mytbl2b    | Multi-1         |                | postgres  | DELETE    |         2
 myGroup1   | myschema1   | mytbl2b    | Multi-1         |                | postgres  | INSERT    |         3
 myGroup1   | myschema1   | mytbl2b    | Multi-1         |                | postgres  | UPDATE    |         1
(4 rows)

-- consolidation of 1 from 2 overlapping logged rollbacks
-- MC15 MC16 RMC15S RMC15D MC17 RMC16S RMC16D
-- ^         lrg(MC15)
--      ^                       lrg(MC16)
-- xxxxxxxxxxxxxxxxx conso(RMC15D)
select emaj.emaj_set_mark_group('myGroup1','MC15');
 emaj_set_mark_group 
---------------------
                   7
(1 row)

insert into myTbl1 select i, 'Test', 'Conso' from generate_series (4000,4012) as i;
insert into myTbl2 values (4000,'TC15',NULL);
delete from myTbl1 where col11 > 4010;
select emaj.emaj_set_mark_group('myGroup1','MC16');
 emaj_set_mark_group 
---------------------
                   7
(1 row)

update myTbl2 set col22 = 'TC16' WHERE col22 ='TC15';
select * from emaj.emaj_logged_rollback_group('myGroup1','MC15',false) order by 1,2;
 rlbk_severity |            rlbk_message             
---------------+-------------------------------------
 Notice        | 2 sequences processed.
 Notice        | 3 / 5 tables effectively processed.
(2 rows)

select emaj.emaj_rename_mark_group('myGroup1','EMAJ_LAST_MARK','RLBK_MC15_DONE');
 emaj_rename_mark_group 
------------------------
 
(1 row)

select emaj.emaj_set_mark_group('myGroup1','MC17');
 emaj_set_mark_group 
---------------------
                   7
(1 row)

insert into myTbl2 values (4001,'TC15',NULL);
select * from emaj.emaj_logged_rollback_group('myGroup1','MC16',false) order by 1,2;
 rlbk_severity |            rlbk_message             
---------------+-------------------------------------
 Notice        | 2 sequences processed.
 Notice        | 3 / 5 tables effectively processed.
(2 rows)

select emaj.emaj_consolidate_rollback_group('myGroup1','RLBK_MC15_DONE');
 emaj_consolidate_rollback_group 
---------------------------------
                               5
(1 row)

select stat_group, stat_schema, stat_table, stat_first_mark, stat_last_mark, stat_role, stat_verb, stat_rows
  from emaj.emaj_detailed_log_stat_group('myGroup1','Multi-1',NULL);
 stat_group | stat_schema | stat_table | stat_first_mark | stat_last_mark | stat_role | stat_verb | stat_rows 
------------+-------------+------------+-----------------+----------------+-----------+-----------+-----------
 myGroup1   | myschema1   | mytbl1     | Multi-1         |                | postgres  | INSERT    |        11
 myGroup1   | myschema1   | mytbl2     | Multi-1         |                | postgres  | DELETE    |         1
 myGroup1   | myschema1   | mytbl2     | Multi-1         |                | postgres  | INSERT    |         3
 myGroup1   | myschema1   | mytbl2b    | Multi-1         |                | postgres  | DELETE    |         3
 myGroup1   | myschema1   | mytbl2b    | Multi-1         |                | postgres  | INSERT    |         5
 myGroup1   | myschema1   | mytbl2b    | Multi-1         |                | postgres  | UPDATE    |         1
(6 rows)

select * from myTbl1 order by col11;
 col11 |   col12    |    col13     
-------+------------+--------------
     2 | ABC        | \x1c
     3 | ABC        | \x1c
     4 | ABC        | \x0c
     5 | ABC        | \x0c
     6 | ABC        | \x0c
     7 | ABC        | \x0c
     8 | ABC        | \x0c
     9 | ABC        | \x0c
    10 | ABC        | \x0c
   100 | DEF        | \x00
   101 | DEF        | \x00
   102 | DEF        | \x00
   103 | DEF        | \x00
   104 | DEF        | \x00
   105 | DEF        | \x00
   106 | DEF        | \x00
   107 | DEF        | \x00
   108 | DEF        | \x00
   109 | DEF        | \x00
   110 | DEF        | \x00
  4000 | Test       | \x436f6e736f
  4001 | Test       | \x436f6e736f
  4002 | Test       | \x436f6e736f
  4003 | Test       | \x436f6e736f
  4004 | Test       | \x436f6e736f
  4005 | Test       | \x436f6e736f
  4006 | Test       | \x436f6e736f
  4007 | Test       | \x436f6e736f
  4008 | Test       | \x436f6e736f
  4009 | Test       | \x436f6e736f
  4010 | Test       | \x436f6e736f
(31 rows)

select * from myTbl2 order by col21;
 col21 | col22 |   col23    
-------+-------+------------
     1 | ABC   | 12-31-2010
     2 | DEF   | 
     3 | GHI   | 01-02-2010
  2000 | TC3   | 
  4000 | TC15  | 
(5 rows)

select mark_group, regexp_replace(mark_name,E'\\d\\d\.\\d\\d\\.\\d\\d\\.\\d\\d\\d\\d','%','g'), mark_time_id, mark_is_deleted, mark_is_rlbk_protected, mark_comment, mark_log_rows_before_next, mark_logged_rlbk_target_mark from emaj.emaj_mark where mark_group = 'myGroup1' order by mark_time_id, mark_group;
 mark_group |        regexp_replace        | mark_time_id | mark_is_deleted | mark_is_rlbk_protected | mark_comment | mark_log_rows_before_next | mark_logged_rlbk_target_mark 
------------+------------------------------+--------------+-----------------+------------------------+--------------+---------------------------+------------------------------
 myGroup1   | M4                           |        10026 | t               | f                      |              |                        10 | 
 myGroup1   | M5                           |        10027 | t               | f                      |              |                         3 | 
 myGroup1   | Before logged rollback to M4 |        10033 | t               | f                      |              |                        28 | 
 myGroup1   | STOP_%                       |        10035 | t               | f                      |              |                         0 | 
 myGroup1   | Stop after rollback          |        10042 | t               | f                      |              |                         0 | 
 myGroup1   | Multi-1                      |        10043 | f               | f                      |              |                        10 | 
 myGroup1   | MC1                          |        10069 | f               | f                      |              |                         0 | 
 myGroup1   | RLBK_MC1_DONE                |        10072 | f               | f                      |              |                         2 | MC1
 myGroup1   | MC3                          |        10073 | f               | f                      |              |                         0 | 
 myGroup1   | RLBK_MC3_%_DONE              |        10077 | f               | f                      |              |                         0 | MC3
 myGroup1   | MC6                          |        10078 | f               | f                      |              |                         0 | 
 myGroup1   | RLBK_MC6_%_DONE              |        10085 | f               | f                      |              |                         0 | MC6
 myGroup1   | MC10                         |        10086 | f               | f                      |              |                         0 | 
 myGroup1   | RLBK_MC10_%_DONE             |        10091 | f               | f                      |              |                         0 | MC10
 myGroup1   | MC15                         |        10092 | f               | f                      |              |                         0 | 
 myGroup1   | RLBK_MC15_DONE               |        10095 | f               | f                      |              |                         0 | MC15
 myGroup1   | MC17                         |        10096 | f               | f                      |              |                         2 | 
 myGroup1   | RLBK_MC16_%_START            |        10097 | f               | f                      |              |                        15 | 
 myGroup1   | RLBK_MC16_%_DONE             |        10098 | f               | f                      |              |                           | 
(19 rows)

select sequ_schema, sequ_name, sequ_time_id, sequ_last_val, sequ_is_called from emaj.emaj_sequence where sequ_schema = 'emaj_myschema1' order by sequ_time_id, sequ_schema, sequ_name;
 sequ_schema | sequ_name | sequ_time_id | sequ_last_val | sequ_is_called 
-------------+-----------+--------------+---------------+----------------
(0 rows)

select tbl_schema, tbl_name, tbl_time_id, tbl_log_seq_last_val from emaj.emaj_table where tbl_schema = 'myschema1' order by tbl_time_id, tbl_schema, tbl_name;
 tbl_schema | tbl_name | tbl_time_id | tbl_log_seq_last_val 
------------+----------+-------------+----------------------
 myschema1  | myTbl3   |       10026 |                   10
 myschema1  | mytbl1   |       10026 |                   30
 myschema1  | mytbl2   |       10026 |                    3
 myschema1  | mytbl2b  |       10026 |                    3
 myschema1  | mytbl4   |       10026 |                    8
 myschema1  | myTbl3   |       10027 |                   20
 myschema1  | mytbl1   |       10027 |                   30
 myschema1  | mytbl2   |       10027 |                    3
 myschema1  | mytbl2b  |       10027 |                    3
 myschema1  | mytbl4   |       10027 |                    8
 myschema1  | myTbl3   |       10033 |                   20
 myschema1  | mytbl1   |       10033 |                   32
 myschema1  | mytbl2   |       10033 |                    3
 myschema1  | mytbl2b  |       10033 |                    3
 myschema1  | mytbl4   |       10033 |                   12
 myschema1  | myTbl3   |       10035 |                   45
 myschema1  | mytbl1   |       10035 |                   33
 myschema1  | mytbl2   |       10035 |                    3
 myschema1  | mytbl2b  |       10035 |                    3
 myschema1  | mytbl4   |       10035 |                   14
 myschema1  | myTbl3   |       10042 |                   45
 myschema1  | mytbl1   |       10042 |                   33
 myschema1  | mytbl2   |       10042 |                    3
 myschema1  | mytbl2b  |       10042 |                    3
 myschema1  | mytbl4   |       10042 |                   14
 myschema1  | myTbl3   |       10043 |                   45
 myschema1  | mytbl1   |       10043 |                   33
 myschema1  | mytbl2   |       10043 |                    3
 myschema1  | mytbl2b  |       10043 |                    3
 myschema1  | mytbl4   |       10043 |                   14
 myschema1  | myTbl3   |       10069 |                   45
 myschema1  | mytbl1   |       10069 |                   53
 myschema1  | mytbl2   |       10069 |                    3
 myschema1  | mytbl2b  |       10069 |                   13
 myschema1  | mytbl4   |       10069 |                   14
 myschema1  | myTbl3   |       10072 |                   45
 myschema1  | mytbl1   |       10072 |                   79
 myschema1  | mytbl2   |       10072 |                    6
 myschema1  | mytbl2b  |       10072 |                   17
 myschema1  | mytbl4   |       10072 |                   14
 myschema1  | myTbl3   |       10073 |                   45
 myschema1  | mytbl1   |       10073 |                   79
 myschema1  | mytbl2   |       10073 |                    7
 myschema1  | mytbl2b  |       10073 |                   18
 myschema1  | mytbl4   |       10073 |                   14
 myschema1  | myTbl3   |       10077 |                   65
 myschema1  | mytbl1   |       10077 |                   79
 myschema1  | mytbl2   |       10077 |                    7
 myschema1  | mytbl2b  |       10077 |                   18
 myschema1  | mytbl4   |       10077 |                   17
 myschema1  | myTbl3   |       10078 |                   65
 myschema1  | mytbl1   |       10078 |                   79
 myschema1  | mytbl2   |       10078 |                    7
 myschema1  | mytbl2b  |       10078 |                   18
 myschema1  | mytbl4   |       10078 |                   17
 myschema1  | myTbl3   |       10085 |                   85
 myschema1  | mytbl1   |       10085 |                  105
 myschema1  | mytbl2   |       10085 |                   12
 myschema1  | mytbl2b  |       10085 |                   24
 myschema1  | mytbl4   |       10085 |                   20
 myschema1  | myTbl3   |       10086 |                   85
 myschema1  | mytbl1   |       10086 |                  105
 myschema1  | mytbl2   |       10086 |                   12
 myschema1  | mytbl2b  |       10086 |                   24
 myschema1  | mytbl4   |       10086 |                   20
 myschema1  | myTbl3   |       10091 |                   85
 myschema1  | mytbl1   |       10091 |                  127
 myschema1  | mytbl2   |       10091 |                   12
 myschema1  | mytbl2b  |       10091 |                   24
 myschema1  | mytbl4   |       10091 |                   23
 myschema1  | myTbl3   |       10092 |                   85
 myschema1  | mytbl1   |       10092 |                  127
 myschema1  | mytbl2   |       10092 |                   12
 myschema1  | mytbl2b  |       10092 |                   24
 myschema1  | mytbl4   |       10092 |                   23
 myschema1  | myTbl3   |       10095 |                   85
 myschema1  | mytbl1   |       10095 |                  153
 myschema1  | mytbl2   |       10095 |                   15
 myschema1  | mytbl2b  |       10095 |                   28
 myschema1  | mytbl4   |       10095 |                   23
 myschema1  | myTbl3   |       10096 |                   85
 myschema1  | mytbl1   |       10096 |                  153
 myschema1  | mytbl2   |       10096 |                   15
 myschema1  | mytbl2b  |       10096 |                   28
 myschema1  | mytbl4   |       10096 |                   23
 myschema1  | myTbl3   |       10097 |                   85
 myschema1  | mytbl1   |       10097 |                  153
 myschema1  | mytbl2   |       10097 |                   16
 myschema1  | mytbl2b  |       10097 |                   29
 myschema1  | mytbl4   |       10097 |                   23
 myschema1  | myTbl3   |       10098 |                   85
 myschema1  | mytbl1   |       10098 |                  164
 myschema1  | mytbl2   |       10098 |                   18
 myschema1  | mytbl2b  |       10098 |                   31
 myschema1  | mytbl4   |       10098 |                   23
(95 rows)

select sqhl_schema, sqhl_table, sqhl_begin_time_id, sqhl_end_time_id, sqhl_hole_size from emaj.emaj_seq_hole where sqhl_schema = 'myschema1' order by 1,2,3;
 sqhl_schema | sqhl_table | sqhl_begin_time_id | sqhl_end_time_id | sqhl_hole_size 
-------------+------------+--------------------+------------------+----------------
 myschema1   | myTbl3     |              10073 |            10077 |             20
 myschema1   | myTbl3     |              10078 |            10085 |             20
 myschema1   | mytbl1     |              10027 |            10032 |              1
 myschema1   | mytbl1     |              10043 |            10056 |             20
 myschema1   | mytbl1     |              10069 |            10072 |             26
 myschema1   | mytbl1     |              10078 |            10085 |             26
 myschema1   | mytbl1     |              10086 |            10091 |             22
 myschema1   | mytbl1     |              10092 |            10095 |             26
 myschema1   | mytbl2     |              10069 |            10072 |              3
 myschema1   | mytbl2     |              10078 |            10085 |              5
 myschema1   | mytbl2     |              10092 |            10095 |              3
 myschema1   | mytbl2b    |              10069 |            10072 |              4
 myschema1   | mytbl2b    |              10078 |            10085 |              6
 myschema1   | mytbl2b    |              10092 |            10095 |              4
 myschema1   | mytbl4     |              10027 |            10032 |              2
 myschema1   | mytbl4     |              10073 |            10077 |              3
 myschema1   | mytbl4     |              10078 |            10085 |              3
 myschema1   | mytbl4     |              10086 |            10091 |              3
(18 rows)

select * from emaj.emaj_rollback_group('myGroup1','Multi-1',false) order by 1,2;
 rlbk_severity |            rlbk_message             
---------------+-------------------------------------
 Notice        | 2 sequences processed.
 Notice        | 3 / 5 tables effectively processed.
(2 rows)

-- remove the temp directory
\! rm -R $EMAJTESTTMPDIR
