-- alterLogging.sql : test emaj_alter_group() and emaj_alter_groups() functions with groups in LOGGING state
--
-- It follows alter.sql that tests the same functions but with groups in IDLE state.
-- It uses the same tables and groups, and the same sequences range
-- It includes the final checks for both alter.sql and alterLogging.sql scenarios
select emaj.emaj_start_groups('{"myGroup1","myGroup2"}','Mk1');
WARNING:  _check_fk_groups: The foreign key "mytbl6_col61_fkey" on the table "myschema2.mytbl6" references the table "myschema2.mytbl7" that is outside the groups (myGroup1,myGroup2).
WARNING:  _check_fk_groups: The table "myschema2.mytbl6" is referenced by the foreign key "mytbl8_col81_fkey" on the table "myschema2.mytbl8" that is outside the groups (myGroup1,myGroup2).
 emaj_start_groups 
-------------------
                15
(1 row)

-----------------------------
-- change attributes in emaj_group_def
-----------------------------
-- change the priority
update emaj.emaj_group_def set grpdef_priority = 30 where grpdef_schema = 'myschema1' and grpdef_tblseq = 'mytbl1';
  -- also test the internal _adjust_group_properties() function, by simulating wrong values for group_has_waiting_changes
update emaj.emaj_group set group_has_waiting_changes = true where group_name = 'emptyGroup';
update emaj.emaj_group set group_has_waiting_changes = false where group_name = 'myGroup1';
select emaj._adjust_group_properties();
 _adjust_group_properties 
--------------------------
                        2
(1 row)

select group_name, group_has_waiting_changes from emaj.emaj_group where group_name = 'myGroup1' or group_name = 'emptyGroup' order by 1;
 group_name | group_has_waiting_changes 
------------+---------------------------
 emptyGroup | f
 myGroup1   | t
(2 rows)

select emaj.emaj_alter_group('myGroup1','Priority Changed');
 emaj_alter_group 
------------------
                7
(1 row)

-- change the log data tablespace and the log index tablespace for different tables
update emaj.emaj_group_def set grpdef_log_dat_tsp = NULL where grpdef_schema = 'myschema1' and grpdef_tblseq = 'mytbl2b';
update emaj.emaj_group_def set grpdef_log_idx_tsp = 'tsplog1' where grpdef_schema = 'myschema2' and grpdef_tblseq = 'mytbl6';
set default_tablespace = tspemaj_renamed;
update emaj.emaj_group set group_has_waiting_changes = false where group_name = 'myGroup1';
select emaj._adjust_group_properties();
 _adjust_group_properties 
--------------------------
                        1
(1 row)

select group_has_waiting_changes from emaj.emaj_group where group_name = 'myGroup1';
 group_has_waiting_changes 
---------------------------
 t
(1 row)

select emaj.emaj_alter_groups('{"myGroup1","myGroup2"}','Attributes_changed');
WARNING:  _check_fk_groups: The foreign key "mytbl6_col61_fkey" on the table "myschema2.mytbl6" references the table "myschema2.mytbl7" that is outside the groups (myGroup1,myGroup2).
WARNING:  _check_fk_groups: The table "myschema2.mytbl6" is referenced by the foreign key "mytbl8_col81_fkey" on the table "myschema2.mytbl8" that is outside the groups (myGroup1,myGroup2).
 emaj_alter_groups 
-------------------
                15
(1 row)

reset default_tablespace;
-- perform some operations: set an intermediate mark, update myTbl3 and rollback
select emaj.emaj_set_mark_groups('{"myGroup1","myGroup2"}','Mk2');
 emaj_set_mark_groups 
----------------------
                   15
(1 row)

insert into myschema1."myTbl3" values (11, now(), 11.0);
update myschema2."myTbl3" set col33 = 11.0 where col31 = 10;
select emaj.emaj_rollback_groups('{"myGroup1","myGroup2"}','Mk2');
WARNING:  _check_fk_groups: The foreign key "mytbl6_col61_fkey" on the table "myschema2.mytbl6" references the table "myschema2.mytbl7" that is outside the groups (myGroup1,myGroup2).
WARNING:  _check_fk_groups: The table "myschema2.mytbl6" is referenced by the foreign key "mytbl8_col81_fkey" on the table "myschema2.mytbl8" that is outside the groups (myGroup1,myGroup2).
 emaj_rollback_groups 
----------------------
                    6
(1 row)

-- change the priority back
update emaj.emaj_group_def set grpdef_priority = 20 where grpdef_schema = 'myschema1' and grpdef_tblseq = 'mytbl1';
select emaj.emaj_alter_groups(array['myGroup1','myGroup2']);
WARNING:  _check_fk_groups: The foreign key "mytbl6_col61_fkey" on the table "myschema2.mytbl6" references the table "myschema2.mytbl7" that is outside the groups (myGroup1,myGroup2).
WARNING:  _check_fk_groups: The table "myschema2.mytbl6" is referenced by the foreign key "mytbl8_col81_fkey" on the table "myschema2.mytbl8" that is outside the groups (myGroup1,myGroup2).
 emaj_alter_groups 
-------------------
                15
(1 row)

-- change the other attributes back
update emaj.emaj_group_def set grpdef_log_dat_tsp = 'tsp log''2' where grpdef_schema = 'myschema1' and grpdef_tblseq = 'mytbl2b';
update emaj.emaj_group_def set grpdef_log_idx_tsp = NULL where grpdef_schema = 'myschema2' and grpdef_tblseq = 'mytbl6';
select emaj.emaj_alter_groups('{"myGroup1","myGroup2"}');
WARNING:  _check_fk_groups: The foreign key "mytbl6_col61_fkey" on the table "myschema2.mytbl6" references the table "myschema2.mytbl7" that is outside the groups (myGroup1,myGroup2).
WARNING:  _check_fk_groups: The table "myschema2.mytbl6" is referenced by the foreign key "mytbl8_col81_fkey" on the table "myschema2.mytbl8" that is outside the groups (myGroup1,myGroup2).
 emaj_alter_groups 
-------------------
                15
(1 row)

-----------------------------
-- add sequences
-----------------------------
-- add myschema2.mySeq2 to the myGroup2 group
-- first perform changes and set marks
select emaj.emaj_set_mark_group('myGroup2','ADD_SEQ test');
 emaj_set_mark_group 
---------------------
                   8
(1 row)

select nextval('myschema2.myseq2');
 nextval 
---------
       1
(1 row)

select emaj.emaj_set_mark_group('myGroup2','Before ADD_SEQ');
 emaj_set_mark_group 
---------------------
                   8
(1 row)

select nextval('myschema2.myseq2');
 nextval 
---------
       2
(1 row)

-- then add the sequence to the group
insert into emaj.emaj_group_def values ('myGroup2','myschema2','myseq2');
update emaj.emaj_group set group_has_waiting_changes = false where group_name = 'myGroup2';
select emaj._adjust_group_properties();
 _adjust_group_properties 
--------------------------
                        1
(1 row)

select group_name, group_last_alter_time_id, group_has_waiting_changes, group_nb_table, group_nb_sequence
  from emaj.emaj_group where group_name = 'myGroup2';
 group_name | group_last_alter_time_id | group_has_waiting_changes | group_nb_table | group_nb_sequence 
------------+--------------------------+---------------------------+----------------+-------------------
 myGroup2   |                     6055 | t                         |              6 |                 2
(1 row)

--select emaj.emaj_alter_group('myGroup2', 'Alter to add myseq2');
select emaj.emaj_assign_sequence('myschema2', 'myseq2', 'myGroup2', null, 'Alter to add myseq2');
 emaj_assign_sequence 
----------------------
                    1
(1 row)

select group_name, group_last_alter_time_id, group_has_waiting_changes, group_nb_table, group_nb_sequence
  from emaj.emaj_group where group_name = 'myGroup2';
 group_name | group_last_alter_time_id | group_has_waiting_changes | group_nb_table | group_nb_sequence 
------------+--------------------------+---------------------------+----------------+-------------------
 myGroup2   |                     6058 | t                         |              6 |                 3
(1 row)

select * from emaj.emaj_relation where rel_schema = 'myschema2' and rel_tblseq = 'myseq2' order by rel_time_range;
 rel_schema | rel_tblseq | rel_time_range | rel_group | rel_kind | rel_priority | rel_log_schema | rel_log_table | rel_log_dat_tsp | rel_log_index | rel_log_idx_tsp | rel_log_sequence | rel_log_function | rel_sql_columns | rel_sql_pk_columns | rel_sql_pk_eq_conditions | rel_log_seq_last_value | rel_emaj_verb_attnum 
------------+------------+----------------+-----------+----------+--------------+----------------+---------------+-----------------+---------------+-----------------+------------------+------------------+-----------------+--------------------+--------------------------+------------------------+----------------------
 myschema2  | myseq2     | [6058,)        | myGroup2  | S        |              |                |               |                 |               |                 |                  |                  |                 |                    |                          |                        |                     
(1 row)

select * from emaj.emaj_sequence where sequ_name = 'myseq2';
 sequ_schema | sequ_name | sequ_time_id | sequ_last_val | sequ_start_val | sequ_increment |    sequ_max_val     | sequ_min_val | sequ_cache_val | sequ_is_cycled | sequ_is_called 
-------------+-----------+--------------+---------------+----------------+----------------+---------------------+--------------+----------------+----------------+----------------
 myschema2   | myseq2    |         6058 |             2 |              1 |              1 | 9223372036854775807 |            1 |              1 | f              | t
(1 row)

-- perform some other updates
select nextval('myschema2.myseq2');
 nextval 
---------
       3
(1 row)

select emaj.emaj_set_mark_group('myGroup2','After ADD_SEQ');
 emaj_set_mark_group 
---------------------
                   9
(1 row)

select nextval('myschema2.myseq2');
 nextval 
---------
       4
(1 row)

select nextval('myschema2.myseq2');
 nextval 
---------
       5
(1 row)

--testing snap and sql generation
\! mkdir -p /tmp/emaj_test/alter
\! rm -Rf /tmp/emaj_test/alter/*
  select emaj.emaj_snap_group('myGroup2','/tmp/emaj_test/alter','');
 emaj_snap_group 
-----------------
               9
(1 row)

\! cat /tmp/emaj_test/alter/myschema2_myseq2.snap
myseq2	5	1	1	9223372036854775807	1	1	f	t
\! rm -R /tmp/emaj_test/alter/*
  select emaj.emaj_snap_log_group('myGroup2',NULL,'After ADD_SEQ','/tmp/emaj_test/alter',NULL);
 emaj_snap_log_group 
---------------------
                   9
(1 row)

\! grep myseq2 /tmp/emaj_test/alter/myGroup2_sequences_at_Mk1
\! grep myseq2 /tmp/emaj_test/alter/myGroup2_sequences_at_After_ADD_SEQ
myschema2	myseq2	6059	3	1	1	9223372036854775807	1	1	f	t
\! rm -R /tmp/emaj_test/alter/*
  select emaj.emaj_gen_sql_group('myGroup2', 'Before ADD_SEQ', NULL, '/tmp/emaj_test/alter/myFile');
 emaj_gen_sql_group 
--------------------
                  2
(1 row)

\! grep myseq2 /tmp/emaj_test/alter/myFile
  select emaj.emaj_gen_sql_group('myGroup2', 'Before ADD_SEQ', NULL, '/tmp/emaj_test/alter/myFile',array['myschema2.myseq2']);
ERROR:  _gen_sql_groups: 1 table/sequence (myschema2.myseq2) did not belong to any of the selected tables groups at Before ADD_SEQ mark time.
CONTEXT:  PL/pgSQL function emaj._gen_sql_groups(text[],boolean,text,text,text,text[]) line 96 at RAISE
PL/pgSQL function emaj.emaj_gen_sql_group(text,text,text,text,text[]) line 13 at RETURN
\! rm -R /tmp/emaj_test/alter/*
-- testing mark deletions
begin;
  -- testing delete a single mark set after the sequence addition
  select emaj.emaj_delete_mark_group('myGroup2','After ADD_SEQ');
 emaj_delete_mark_group 
------------------------
                      1
(1 row)

  select 'Should not exist' from emaj.emaj_mark where mark_group = 'myGroup2' and mark_name = 'After ADD_SEQ';
 ?column? 
----------
(0 rows)

  -- testing delete all marks up to a mark set after the alter_group
  select emaj.emaj_delete_before_mark_group('myGroup2','EMAJ_LAST_MARK');
 emaj_delete_before_mark_group 
-------------------------------
                             7
(1 row)

  select * from emaj.emaj_mark where mark_group = 'myGroup2';
 mark_group |      mark_name      | mark_time_id | mark_is_deleted | mark_is_rlbk_protected | mark_comment | mark_log_rows_before_next | mark_logged_rlbk_target_mark 
------------+---------------------+--------------+-----------------+------------------------+--------------+---------------------------+------------------------------
 myGroup2   | Alter to add myseq2 |         6058 | f               | f                      |              |                           | 
(1 row)

  select * from emaj.emaj_sequence where sequ_name = 'myseq2' order by sequ_time_id;
 sequ_schema | sequ_name | sequ_time_id | sequ_last_val | sequ_start_val | sequ_increment |    sequ_max_val     | sequ_min_val | sequ_cache_val | sequ_is_cycled | sequ_is_called 
-------------+-----------+--------------+---------------+----------------+----------------+---------------------+--------------+----------------+----------------+----------------
 myschema2   | myseq2    |         6058 |             2 |              1 |              1 | 9223372036854775807 |            1 |              1 | f              | t
(1 row)

rollback;
begin;
  -- testing the alter_group mark deletion
  select mark_time_id from emaj.emaj_mark where mark_group = 'myGroup2' and mark_name = 'Alter to add myseq2';
 mark_time_id 
--------------
         6058
(1 row)

  select emaj.emaj_delete_mark_group('myGroup2','Alter to add myseq2');
 emaj_delete_mark_group 
------------------------
                      1
(1 row)

  select * from emaj.emaj_sequence where sequ_name = 'myseq2' order by sequ_time_id limit 1;
 sequ_schema | sequ_name | sequ_time_id | sequ_last_val | sequ_start_val | sequ_increment |    sequ_max_val     | sequ_min_val | sequ_cache_val | sequ_is_cycled | sequ_is_called 
-------------+-----------+--------------+---------------+----------------+----------------+---------------------+--------------+----------------+----------------+----------------
 myschema2   | myseq2    |         6058 |             2 |              1 |              1 | 9223372036854775807 |            1 |              1 | f              | t
(1 row)

rollback;
-- test sequences at bounds following a rollback targeting a mark set before an ADD_SEQ
begin;
  delete from emaj.emaj_param where param_key = 'dblink_user_password';
  select mark_time_id from emaj.emaj_mark where mark_group = 'myGroup2' and mark_name = 'Alter to add myseq2';
 mark_time_id 
--------------
         6058
(1 row)

-- beware, the sequence changes generated by the E-Maj rollback will not be rollback by the transaction rollback
  select rlbk_severity, regexp_replace(rlbk_message,E'\\d\\d\\d\\d/\\d\\d\\/\\d\\d\\ \\d\\d\\:\\d\\d:\\d\\d .*?\\)','<timestamp>)','g')
    from emaj.emaj_rollback_group('myGroup2','Before ADD_SEQ',true);
WARNING:  _check_fk_groups: The foreign key "mytbl6_col61_fkey" on the table "myschema2.mytbl6" references the table "myschema2.mytbl7" that is outside the groups (myGroup2).
WARNING:  _check_fk_groups: The table "myschema2.mytbl6" is referenced by the foreign key "mytbl8_col81_fkey" on the table "myschema2.mytbl8" that is outside the groups (myGroup2).
 rlbk_severity |                                               regexp_replace                                               
---------------+------------------------------------------------------------------------------------------------------------
 Notice        | 0 / 6 tables effectively processed.
 Notice        | 3 sequences processed.
 Warning       | The sequence myschema2.myseq2 has only been rolled back to its latest group attachment state (<timestamp>)
(3 rows)

  select * from emaj.emaj_sequence where sequ_schema = 'myschema2' and sequ_name = 'myseq2';
 sequ_schema | sequ_name | sequ_time_id | sequ_last_val | sequ_start_val | sequ_increment |    sequ_max_val     | sequ_min_val | sequ_cache_val | sequ_is_cycled | sequ_is_called 
-------------+-----------+--------------+---------------+----------------+----------------+---------------------+--------------+----------------+----------------+----------------
 myschema2   | myseq2    |         6058 |             2 |              1 |              1 | 9223372036854775807 |            1 |              1 | f              | t
(1 row)

rollback;
-- estimate and then perform a logged rollback to reach a mark prior the ADD_SEQ operation and check
select * from emaj.emaj_estimate_rollback_group('myGroup2','Before ADD_SEQ',true);
 emaj_estimate_rollback_group 
------------------------------
 @ 0.009 secs
(1 row)

select rlbk_severity, regexp_replace(rlbk_message,E'\\d\\d\\d\\d/\\d\\d\\/\\d\\d\\ \\d\\d\\:\\d\\d:\\d\\d .*?\\)','<timestamp>)','g')
  from emaj.emaj_logged_rollback_group('myGroup2','Before ADD_SEQ',true);
WARNING:  _check_fk_groups: The foreign key "mytbl6_col61_fkey" on the table "myschema2.mytbl6" references the table "myschema2.mytbl7" that is outside the groups (myGroup2).
WARNING:  _check_fk_groups: The table "myschema2.mytbl6" is referenced by the foreign key "mytbl8_col81_fkey" on the table "myschema2.mytbl8" that is outside the groups (myGroup2).
 rlbk_severity |                                               regexp_replace                                               
---------------+------------------------------------------------------------------------------------------------------------
 Notice        | 0 / 6 tables effectively processed.
 Notice        | 3 sequences processed.
 Warning       | The sequence myschema2.myseq2 has only been rolled back to its latest group attachment state (<timestamp>)
(3 rows)

select * from myschema2.myseq2;
 last_value | log_cnt | is_called 
------------+---------+-----------
          3 |       0 | f
(1 row)

select * from emaj.emaj_sequence where sequ_name = 'myseq2' order by sequ_time_id;
 sequ_schema | sequ_name | sequ_time_id | sequ_last_val | sequ_start_val | sequ_increment |    sequ_max_val     | sequ_min_val | sequ_cache_val | sequ_is_cycled | sequ_is_called 
-------------+-----------+--------------+---------------+----------------+----------------+---------------------+--------------+----------------+----------------+----------------
 myschema2   | myseq2    |         6058 |             2 |              1 |              1 | 9223372036854775807 |            1 |              1 | f              | t
 myschema2   | myseq2    |         6059 |             3 |              1 |              1 | 9223372036854775807 |            1 |              1 | f              | t
 myschema2   | myseq2    |         6061 |             5 |              1 |              1 | 9223372036854775807 |            1 |              1 | f              | t
 myschema2   | myseq2    |         6062 |             3 |              1 |              1 | 9223372036854775807 |            1 |              1 | f              | f
(4 rows)

-- consolidate this logged rollback
select emaj.emaj_rename_mark_group('myGroup2','EMAJ_LAST_MARK','Logged_Rlbk_End');
 emaj_rename_mark_group 
------------------------
 
(1 row)

select mark_time_id from emaj.emaj_mark where mark_group = 'myGroup2' and mark_name = 'Alter to add myseq2';
 mark_time_id 
--------------
         6058
(1 row)

select * from emaj.emaj_get_consolidable_rollbacks() where cons_group = 'myGroup2'; -- should report 1 row to consolidate
 cons_group | cons_target_rlbk_mark_name | cons_target_rlbk_mark_time_id | cons_end_rlbk_mark_name | cons_end_rlbk_mark_time_id | cons_rows | cons_marks 
------------+----------------------------+-------------------------------+-------------------------+----------------------------+-----------+------------
 myGroup2   | Before ADD_SEQ             |                          6057 | Logged_Rlbk_End         |                       6062 |         0 |          3
(1 row)

select * from emaj.emaj_consolidate_rollback_group('myGroup2', 'Logged_Rlbk_End');
 emaj_consolidate_rollback_group 
---------------------------------
                               3
(1 row)

select * from emaj.emaj_sequence where sequ_schema = 'myschema2' and sequ_name = 'myseq2' order by sequ_schema, sequ_name, sequ_time_id;
 sequ_schema | sequ_name | sequ_time_id | sequ_last_val | sequ_start_val | sequ_increment |    sequ_max_val     | sequ_min_val | sequ_cache_val | sequ_is_cycled | sequ_is_called 
-------------+-----------+--------------+---------------+----------------+----------------+---------------------+--------------+----------------+----------------+----------------
 myschema2   | myseq2    |         6058 |             2 |              1 |              1 | 9223372036854775807 |            1 |              1 | f              | t
 myschema2   | myseq2    |         6062 |             3 |              1 |              1 | 9223372036854775807 |            1 |              1 | f              | f
(2 rows)

-- remove mySeq2 from the group, then re-add it
delete from emaj.emaj_group_def where grpdef_schema = 'myschema2' and grpdef_tblseq = 'myseq2';
select emaj.emaj_alter_group('myGroup2', 'Alter to remove myseq2');
WARNING:  _check_fk_groups: The foreign key "mytbl6_col61_fkey" on the table "myschema2.mytbl6" references the table "myschema2.mytbl7" that is outside the groups (myGroup2).
WARNING:  _check_fk_groups: The table "myschema2.mytbl6" is referenced by the foreign key "mytbl8_col81_fkey" on the table "myschema2.mytbl8" that is outside the groups (myGroup2).
 emaj_alter_group 
------------------
                8
(1 row)

insert into emaj.emaj_group_def values ('myGroup2','myschema2','myseq2');
select emaj.emaj_alter_group('myGroup2', 'Alter to re-add myseq2');
WARNING:  _check_fk_groups: The foreign key "mytbl6_col61_fkey" on the table "myschema2.mytbl6" references the table "myschema2.mytbl7" that is outside the groups (myGroup2).
WARNING:  _check_fk_groups: The table "myschema2.mytbl6" is referenced by the foreign key "mytbl8_col81_fkey" on the table "myschema2.mytbl8" that is outside the groups (myGroup2).
 emaj_alter_group 
------------------
                9
(1 row)

select * from emaj.emaj_relation where rel_schema = 'myschema2' and rel_tblseq = 'myseq2' order by rel_time_range;
 rel_schema | rel_tblseq | rel_time_range | rel_group | rel_kind | rel_priority | rel_log_schema | rel_log_table | rel_log_dat_tsp | rel_log_index | rel_log_idx_tsp | rel_log_sequence | rel_log_function | rel_sql_columns | rel_sql_pk_columns | rel_sql_pk_eq_conditions | rel_log_seq_last_value | rel_emaj_verb_attnum 
------------+------------+----------------+-----------+----------+--------------+----------------+---------------+-----------------+---------------+-----------------+------------------+------------------+-----------------+--------------------+--------------------------+------------------------+----------------------
 myschema2  | myseq2     | [6058,6063)    | myGroup2  | S        |              |                |               |                 |               |                 |                  |                  |                 |                    |                          |                        |                     
 myschema2  | myseq2     | [6064,)        | myGroup2  | S        |              |                |               |                 |               |                 |                  |                  |                 |                    |                          |                        |                     
(2 rows)

-- finaly remove mySeq2 from the group
delete from emaj.emaj_group_def where grpdef_schema = 'myschema2' and grpdef_tblseq = 'myseq2';
select emaj.emaj_alter_group('myGroup2', 'Alter to really remove myseq2');
WARNING:  _check_fk_groups: The foreign key "mytbl6_col61_fkey" on the table "myschema2.mytbl6" references the table "myschema2.mytbl7" that is outside the groups (myGroup2).
WARNING:  _check_fk_groups: The table "myschema2.mytbl6" is referenced by the foreign key "mytbl8_col81_fkey" on the table "myschema2.mytbl8" that is outside the groups (myGroup2).
 emaj_alter_group 
------------------
                8
(1 row)

-- and perform a full rollback (that do not process mySeq2)
select rlbk_severity, regexp_replace(rlbk_message,E'\\d\\d\\d\\d/\\d\\d\\/\\d\\d\\ \\d\\d\\:\\d\\d:\\d\\d .*?\\)','<timestamp>)','g')
  from emaj.emaj_rollback_group('myGroup2', 'ADD_SEQ test',true);
WARNING:  _check_fk_groups: The foreign key "mytbl6_col61_fkey" on the table "myschema2.mytbl6" references the table "myschema2.mytbl7" that is outside the groups (myGroup2).
WARNING:  _check_fk_groups: The table "myschema2.mytbl6" is referenced by the foreign key "mytbl8_col81_fkey" on the table "myschema2.mytbl8" that is outside the groups (myGroup2).
 rlbk_severity |                                         regexp_replace                                         
---------------+------------------------------------------------------------------------------------------------
 Notice        | 0 / 6 tables effectively processed.
 Notice        | 2 sequences processed.
 Warning       | The sequence myschema2.myseq2 has been left unchanged (not in group anymore since <timestamp>)
(3 rows)

select * from myschema2.myseq2;
 last_value | log_cnt | is_called 
------------+---------+-----------
          3 |       0 | f
(1 row)

-- verify that all time range bounds of emaj_relation has its corresponding row into emaj_sequence
select * from emaj.emaj_sequence where sequ_schema = 'myschema2' and sequ_name = 'myseq2' and sequ_time_id in
  (select lower(rel_time_range) from emaj.emaj_relation where rel_schema = 'myschema2' and rel_tblseq = 'myseq2' union 
   select upper(rel_time_range) from emaj.emaj_relation where rel_schema = 'myschema2' and rel_tblseq = 'myseq2')
  order by sequ_time_id;
 sequ_schema | sequ_name | sequ_time_id | sequ_last_val | sequ_start_val | sequ_increment |    sequ_max_val     | sequ_min_val | sequ_cache_val | sequ_is_cycled | sequ_is_called 
-------------+-----------+--------------+---------------+----------------+----------------+---------------------+--------------+----------------+----------------+----------------
 myschema2   | myseq2    |         6058 |             2 |              1 |              1 | 9223372036854775807 |            1 |              1 | f              | t
 myschema2   | myseq2    |         6063 |             3 |              1 |              1 | 9223372036854775807 |            1 |              1 | f              | f
 myschema2   | myseq2    |         6064 |             3 |              1 |              1 | 9223372036854775807 |            1 |              1 | f              | f
 myschema2   | myseq2    |         6065 |             3 |              1 |              1 | 9223372036854775807 |            1 |              1 | f              | f
(4 rows)

-----------------------------
-- remove sequences
-----------------------------
select emaj.emaj_set_mark_group('myGroup1','Mk2b');
 emaj_set_mark_group 
---------------------
                   7
(1 row)

select emaj.emaj_set_mark_group('myGroup1','Before_remove');
 emaj_set_mark_group 
---------------------
                   7
(1 row)

update emaj.emaj_group_def set grpdef_group = 'temporarily_removed' where grpdef_schema = 'myschema1' and grpdef_tblseq = 'myTbl3_col31_seq';
select group_name, group_last_alter_time_id, group_has_waiting_changes, group_nb_table, group_nb_sequence
  from emaj.emaj_group where group_name = 'myGroup1';
 group_name | group_last_alter_time_id | group_has_waiting_changes | group_nb_table | group_nb_sequence 
------------+--------------------------+---------------------------+----------------+-------------------
 myGroup1   |                     6055 | t                         |              5 |                 2
(1 row)

--select emaj.emaj_alter_group('myGroup1','Sequence_removed');
select emaj.emaj_remove_sequence('myschema1', 'myTbl3_col31_seq', 'Sequence_removed');
 emaj_remove_sequence 
----------------------
                    1
(1 row)

select group_name, group_last_alter_time_id, group_has_waiting_changes, group_nb_table, group_nb_sequence
  from emaj.emaj_group where group_name = 'myGroup1';
 group_name | group_last_alter_time_id | group_has_waiting_changes | group_nb_table | group_nb_sequence 
------------+--------------------------+---------------------------+----------------+-------------------
 myGroup1   |                     6069 | t                         |              5 |                 1
(1 row)

select * from emaj.emaj_relation where rel_schema = 'myschema1' and rel_tblseq = 'myTbl3_col31_seq' order by rel_time_range;
 rel_schema |    rel_tblseq    | rel_time_range | rel_group | rel_kind | rel_priority | rel_log_schema | rel_log_table | rel_log_dat_tsp | rel_log_index | rel_log_idx_tsp | rel_log_sequence | rel_log_function | rel_sql_columns | rel_sql_pk_columns | rel_sql_pk_eq_conditions | rel_log_seq_last_value | rel_emaj_verb_attnum 
------------+------------------+----------------+-----------+----------+--------------+----------------+---------------+-----------------+---------------+-----------------+------------------+------------------+-----------------+--------------------+--------------------------+------------------------+----------------------
 myschema1  | myTbl3_col31_seq | [6042,6069)    | myGroup1  | S        |            1 |                |               |                 |               |                 |                  |                  |                 |                    |                          |                        |                     
(1 row)

select * from emaj.emaj_verify_all();
  emaj_verify_all  
-------------------
 No error detected
(1 row)

--testing snap and sql generation
\! rm -Rf /tmp/emaj_test/alter/*
select emaj.emaj_snap_group('myGroup1','/tmp/emaj_test/alter','');
 emaj_snap_group 
-----------------
               6
(1 row)

\! ls /tmp/emaj_test/alter
_INFO
myschema1_myTbl3.snap
myschema1_mytbl1.snap
myschema1_mytbl2.snap
myschema1_mytbl2b.snap
myschema1_mytbl2b_col20_seq.snap
myschema1_mytbl4.snap
\! rm -R /tmp/emaj_test/alter/*
select emaj.emaj_snap_log_group('myGroup1','Mk1',NULL,'/tmp/emaj_test/alter',NULL);
 emaj_snap_log_group 
---------------------
                   8
(1 row)

-- sequences at begin bound
\! cat /tmp/emaj_test/alter/myGroup1_sequences_at_Mk1
myschema1	myTbl3_col31_seq	6049	11	1	1	2147483647	1	1	f	f
myschema1	mytbl2b_col20_seq	6049	3	1	1	2147483647	1	1	f	f
-- sequences at end bound
\! find /tmp/emaj_test/alter/ -regex '.*/myGroup1_sequences_at_[0123456789].*' | xargs cat
myschema1	mytbl2b_col20_seq	6070	3	1	1	2147483647	1	1	f	f
\! rm -R /tmp/emaj_test/alter/*
select emaj.emaj_set_mark_group('myGroup1','After_remove');
 emaj_set_mark_group 
---------------------
                   6
(1 row)

-- testing sql script generation
select emaj.emaj_gen_sql_group('myGroup1', NULL, 'EMAJ_LAST_MARK', '/tmp/emaj_test/alter/myFile',array['myschema1.myTbl3_col31_seq']);
 emaj_gen_sql_group 
--------------------
                  1
(1 row)

\! grep -v 'generated by E-Maj at' /tmp/emaj_test/alter/myFile
--    for tables group(s): myGroup1
--    processing logs between mark Mk1 and mark After_remove
--    only for the following tables/sequences: myschema1.myTbl3_col31_seq
SET standard_conforming_strings = OFF;
SET escape_string_warning = OFF;
BEGIN TRANSACTION;
ALTER SEQUENCE myschema1."myTbl3_col31_seq" RESTART 11 START 1 INCREMENT 1 MAXVALUE 2147483647 MINVALUE 1 CACHE 1 NO CYCLE;
COMMIT;
RESET standard_conforming_strings;
RESET escape_string_warning;
\! rm -R /tmp/emaj_test/alter/*
begin;
  -- testing the alter_group mark deletion
  select emaj.emaj_delete_mark_group('myGroup1','Sequence_removed');
 emaj_delete_mark_group 
------------------------
                      1
(1 row)

  select * from emaj.emaj_relation where rel_schema = 'myschema1' and rel_tblseq = 'myTbl3_col31_seq' order by rel_time_range;
 rel_schema |    rel_tblseq    | rel_time_range | rel_group | rel_kind | rel_priority | rel_log_schema | rel_log_table | rel_log_dat_tsp | rel_log_index | rel_log_idx_tsp | rel_log_sequence | rel_log_function | rel_sql_columns | rel_sql_pk_columns | rel_sql_pk_eq_conditions | rel_log_seq_last_value | rel_emaj_verb_attnum 
------------+------------------+----------------+-----------+----------+--------------+----------------+---------------+-----------------+---------------+-----------------+------------------+------------------+-----------------+--------------------+--------------------------+------------------------+----------------------
 myschema1  | myTbl3_col31_seq | [6042,6069)    | myGroup1  | S        |            1 |                |               |                 |               |                 |                  |                  |                 |                    |                          |                        |                     
(1 row)

  select mark_group, regexp_replace(mark_name,E'\\d\\d\.\\d\\d\\.\\d\\d\\.\\d\\d\\d\\d','%','g'), mark_time_id,
    mark_is_deleted, mark_is_rlbk_protected, mark_comment, mark_log_rows_before_next, mark_logged_rlbk_target_mark
    from emaj.emaj_mark where mark_group = 'myGroup1' order by mark_time_id desc limit 2;
 mark_group | regexp_replace | mark_time_id | mark_is_deleted | mark_is_rlbk_protected | mark_comment | mark_log_rows_before_next | mark_logged_rlbk_target_mark 
------------+----------------+--------------+-----------------+------------------------+--------------+---------------------------+------------------------------
 myGroup1   | After_remove   |         6071 | f               | f                      |              |                           | 
 myGroup1   | Before_remove  |         6068 | f               | f                      |              |                         0 | 
(2 rows)

rollback;
begin;
  -- testing delete a single mark set before the sequence removal
  select emaj.emaj_delete_mark_group('myGroup1','Before_remove');
 emaj_delete_mark_group 
------------------------
                      1
(1 row)

  select * from emaj.emaj_sequence where sequ_schema = 'myschema1'
    and sequ_time_id not in (select distinct mark_time_id from emaj.emaj_mark where mark_group = 'myGroup1');
 sequ_schema | sequ_name | sequ_time_id | sequ_last_val | sequ_start_val | sequ_increment | sequ_max_val | sequ_min_val | sequ_cache_val | sequ_is_cycled | sequ_is_called 
-------------+-----------+--------------+---------------+----------------+----------------+--------------+--------------+----------------+----------------+----------------
(0 rows)

  -- testing rollback
  select rlbk_severity, regexp_replace(rlbk_message,E'\\d\\d\\d\\d/\\d\\d\\/\\d\\d\\ \\d\\d\\:\\d\\d:\\d\\d .*?\\)','<timestamp>)','g')
    from emaj.emaj_logged_rollback_group('myGroup1','Mk2b',true) order by 1,2;
 rlbk_severity |                                               regexp_replace                                               
---------------+------------------------------------------------------------------------------------------------------------
 Notice        | 0 / 5 tables effectively processed.
 Notice        | 1 sequences processed.
 Warning       | The sequence myschema1."myTbl3_col31_seq" has been left unchanged (not in group anymore since <timestamp>)
(3 rows)

  select * from emaj.emaj_rollback_group('myGroup1','Mk2b',true) order by 1,2;
 rlbk_severity |            rlbk_message             
---------------+-------------------------------------
 Notice        | 0 / 5 tables effectively processed.
 Notice        | 1 sequences processed.
(2 rows)

  savepoint svp1;
  -- testing group's reset
    select emaj.emaj_stop_group('myGroup1');
 emaj_stop_group 
-----------------
               6
(1 row)

    select * from emaj.emaj_relation where rel_group = 'myGroup1' and not upper_inf(rel_time_range) order by 1,2,3;
 rel_schema |    rel_tblseq    | rel_time_range | rel_group | rel_kind | rel_priority | rel_log_schema | rel_log_table | rel_log_dat_tsp | rel_log_index | rel_log_idx_tsp | rel_log_sequence | rel_log_function | rel_sql_columns | rel_sql_pk_columns | rel_sql_pk_eq_conditions | rel_log_seq_last_value | rel_emaj_verb_attnum 
------------+------------------+----------------+-----------+----------+--------------+----------------+---------------+-----------------+---------------+-----------------+------------------+------------------+-----------------+--------------------+--------------------------+------------------------+----------------------
 myschema1  | myTbl3_col31_seq | [6042,6069)    | myGroup1  | S        |            1 |                |               |                 |               |                 |                  |                  |                 |                    |                          |                        |                     
(1 row)

    select emaj.emaj_reset_group('myGroup1');
 emaj_reset_group 
------------------
                6
(1 row)

    select * from emaj.emaj_relation where rel_group = 'myGroup1' and not upper_inf(rel_time_range) order by 1,2,3;
 rel_schema | rel_tblseq | rel_time_range | rel_group | rel_kind | rel_priority | rel_log_schema | rel_log_table | rel_log_dat_tsp | rel_log_index | rel_log_idx_tsp | rel_log_sequence | rel_log_function | rel_sql_columns | rel_sql_pk_columns | rel_sql_pk_eq_conditions | rel_log_seq_last_value | rel_emaj_verb_attnum 
------------+------------+----------------+-----------+----------+--------------+----------------+---------------+-----------------+---------------+-----------------+------------------+------------------+-----------------+--------------------+--------------------------+------------------------+----------------------
(0 rows)

  rollback to svp1;
  -- testing marks deletion
  select emaj.emaj_set_mark_group('myGroup1','Mk2d');
 emaj_set_mark_group 
---------------------
                   6
(1 row)

  select emaj.emaj_delete_before_mark_group('myGroup1','Mk2b');
 emaj_delete_before_mark_group 
-------------------------------
                             6
(1 row)

  select * from emaj.emaj_relation where rel_group = 'myGroup1' and not upper_inf(rel_time_range) order by 1,2,3;
 rel_schema |    rel_tblseq    | rel_time_range | rel_group | rel_kind | rel_priority | rel_log_schema | rel_log_table | rel_log_dat_tsp | rel_log_index | rel_log_idx_tsp | rel_log_sequence | rel_log_function | rel_sql_columns | rel_sql_pk_columns | rel_sql_pk_eq_conditions | rel_log_seq_last_value | rel_emaj_verb_attnum 
------------+------------------+----------------+-----------+----------+--------------+----------------+---------------+-----------------+---------------+-----------------+------------------+------------------+-----------------+--------------------+--------------------------+------------------------+----------------------
 myschema1  | myTbl3_col31_seq | [6042,6069)    | myGroup1  | S        |            1 |                |               |                 |               |                 |                  |                  |                 |                    |                          |                        |                     
(1 row)

  select emaj.emaj_delete_before_mark_group('myGroup1','Mk2d');
 emaj_delete_before_mark_group 
-------------------------------
                             1
(1 row)

  select * from emaj.emaj_relation where rel_group = 'myGroup1' and not upper_inf(rel_time_range) order by 1,2,3;
 rel_schema | rel_tblseq | rel_time_range | rel_group | rel_kind | rel_priority | rel_log_schema | rel_log_table | rel_log_dat_tsp | rel_log_index | rel_log_idx_tsp | rel_log_sequence | rel_log_function | rel_sql_columns | rel_sql_pk_columns | rel_sql_pk_eq_conditions | rel_log_seq_last_value | rel_emaj_verb_attnum 
------------+------------+----------------+-----------+----------+--------------+----------------+---------------+-----------------+---------------+-----------------+------------------+------------------+-----------------+--------------------+--------------------------+------------------------+----------------------
(0 rows)

  -- testing the sequence drop
  drop sequence mySchema1."myTbl3_col31_seq" cascade;
NOTICE:  drop cascades to default value for column col31 of table myschema1."myTbl3"
rollback;
-- re-add the removed sequence
update emaj.emaj_group_def set grpdef_group = 'myGroup1' where grpdef_group = 'temporarily_removed';
select emaj.emaj_alter_group('myGroup1', 'sequence re-added to myGroup1');
 emaj_alter_group 
------------------
                7
(1 row)

select emaj.emaj_cleanup_rollback_state();
 emaj_cleanup_rollback_state 
-----------------------------
                           0
(1 row)

-----------------------------
-- add tables
-----------------------------
-- add myschema2.mytbl7 to the myGroup2 group
-- first perform updates and set marks
select emaj.emaj_set_mark_group('myGroup2','ADD_TBL test');
 emaj_set_mark_group 
---------------------
                   8
(1 row)

insert into myschema2.mytbl7 values (1),(2),(3);
select emaj.emaj_set_mark_group('myGroup2','Before ADD_TBL');
 emaj_set_mark_group 
---------------------
                   8
(1 row)

delete from myschema2.mytbl7 where col71 = 3;
-- then add the table to the group
insert into emaj.emaj_group_def values ('myGroup2','myschema2','mytbl7');
--select emaj.emaj_alter_group('myGroup2', 'Alter to add mytbl7');
select emaj.emaj_assign_table('myschema2', 'mytbl7', 'myGroup2', null, 'Alter to add mytbl7');
NOTICE:  table "mytbl7_log" does not exist, skipping
NOTICE:  trigger "emaj_log_trg" for relation "myschema2.mytbl7" does not exist, skipping
NOTICE:  trigger "emaj_trunc_trg" for relation "myschema2.mytbl7" does not exist, skipping
WARNING:  _check_fk_groups: The table "myschema2.mytbl6" is referenced by the foreign key "mytbl8_col81_fkey" on the table "myschema2.mytbl8" that is outside the groups (myGroup2).
 emaj_assign_table 
-------------------
                 1
(1 row)

select group_name, group_last_alter_time_id, group_has_waiting_changes, group_nb_table, group_nb_sequence
  from emaj.emaj_group where group_name = 'myGroup2';
 group_name | group_last_alter_time_id | group_has_waiting_changes | group_nb_table | group_nb_sequence 
------------+--------------------------+---------------------------+----------------+-------------------
 myGroup2   |                     6080 | t                         |              7 |                 2
(1 row)

select * from emaj.emaj_relation where rel_schema = 'myschema2' and rel_tblseq = 'mytbl7' order by rel_time_range;
 rel_schema | rel_tblseq | rel_time_range | rel_group | rel_kind | rel_priority | rel_log_schema | rel_log_table | rel_log_dat_tsp | rel_log_index  | rel_log_idx_tsp | rel_log_sequence | rel_log_function | rel_sql_columns | rel_sql_pk_columns | rel_sql_pk_eq_conditions | rel_log_seq_last_value | rel_emaj_verb_attnum 
------------+------------+----------------+-----------+----------+--------------+----------------+---------------+-----------------+----------------+-----------------+------------------+------------------+-----------------+--------------------+--------------------------+------------------------+----------------------
 myschema2  | mytbl7     | [6080,)        | myGroup2  | r        |              | emaj_myschema2 | mytbl7_log    |                 | mytbl7_log_idx |                 | mytbl7_log_seq   | mytbl7_log_fnct  | tbl.col71       | col71              | tbl.col71 = keys.col71   |                        |                    2
(1 row)

-- perform some other updates
insert into myschema2.mytbl7 values (4),(5);
-- remove the alter group mark just after the alter operation and then get statistics and set a mark
begin;
  select emaj.emaj_delete_mark_group('myGroup2','Alter to add mytbl7');
 emaj_delete_mark_group 
------------------------
                      1
(1 row)

  select stat_group, stat_schema, stat_table, stat_first_mark, stat_last_mark, stat_rows 
    from emaj.emaj_log_stat_group('myGroup2','Before ADD_TBL',NULL);
 stat_group | stat_schema | stat_table | stat_first_mark | stat_last_mark | stat_rows 
------------+-------------+------------+-----------------+----------------+-----------
 myGroup2   | myschema2   | myTbl3     | Before ADD_TBL  |                |         0
 myGroup2   | myschema2   | mytbl1     | Before ADD_TBL  |                |         0
 myGroup2   | myschema2   | mytbl2     | Before ADD_TBL  |                |         0
 myGroup2   | myschema2   | mytbl4     | Before ADD_TBL  |                |         0
 myGroup2   | myschema2   | mytbl5     | Before ADD_TBL  |                |         0
 myGroup2   | myschema2   | mytbl6     | Before ADD_TBL  |                |         0
 myGroup2   | myschema2   | mytbl7     | [deleted mark]  |                |         2
(7 rows)

  select emaj.emaj_set_mark_group('myGroup2','Just after ADD_TBL');
 emaj_set_mark_group 
---------------------
                   9
(1 row)

  select mark_log_rows_before_next from emaj.emaj_mark where mark_name = 'Before ADD_TBL';
 mark_log_rows_before_next 
---------------------------
                         2
(1 row)

rollback;
-- set marks and look at statistics
select emaj.emaj_set_mark_group('myGroup2','Just after ADD_TBL');
 emaj_set_mark_group 
---------------------
                   9
(1 row)

update myschema2.mytbl7 set col71 = 6 where col71 = 2;
select col71, emaj_verb, emaj_tuple from emaj_myschema2.mytbl7_log order by emaj_gid;
 col71 | emaj_verb | emaj_tuple 
-------+-----------+------------
     4 | INS       | NEW
     5 | INS       | NEW
     2 | UPD       | OLD
     6 | UPD       | NEW
(4 rows)

select stat_group, stat_schema, stat_table, stat_first_mark, stat_last_mark, stat_rows
  from emaj.emaj_log_stat_group('myGroup2','ADD_TBL test',NULL);
 stat_group | stat_schema | stat_table |   stat_first_mark   | stat_last_mark | stat_rows 
------------+-------------+------------+---------------------+----------------+-----------
 myGroup2   | myschema2   | myTbl3     | ADD_TBL test        |                |         0
 myGroup2   | myschema2   | mytbl1     | ADD_TBL test        |                |         0
 myGroup2   | myschema2   | mytbl2     | ADD_TBL test        |                |         0
 myGroup2   | myschema2   | mytbl4     | ADD_TBL test        |                |         0
 myGroup2   | myschema2   | mytbl5     | ADD_TBL test        |                |         0
 myGroup2   | myschema2   | mytbl6     | ADD_TBL test        |                |         0
 myGroup2   | myschema2   | mytbl7     | Alter to add mytbl7 |                |         3
(7 rows)

select emaj.emaj_set_mark_group('myGroup2','After ADD_TBL');
 emaj_set_mark_group 
---------------------
                   9
(1 row)

select stat_group, stat_schema, stat_table, stat_first_mark, stat_last_mark, stat_role, stat_verb, stat_rows
  from emaj.emaj_detailed_log_stat_group('myGroup2','ADD_TBL test','After ADD_TBL');
 stat_group | stat_schema | stat_table |   stat_first_mark   | stat_last_mark | stat_role | stat_verb | stat_rows 
------------+-------------+------------+---------------------+----------------+-----------+-----------+-----------
 myGroup2   | myschema2   | mytbl7     | Alter to add mytbl7 | After ADD_TBL  | postgres  | INSERT    |         2
 myGroup2   | myschema2   | mytbl7     | Alter to add mytbl7 | After ADD_TBL  | postgres  | UPDATE    |         1
(2 rows)

--testing snap and sql generation
\! rm -Rf /tmp/emaj_test/alter/*
  select emaj.emaj_snap_group('myGroup2','/tmp/emaj_test/alter','');
 emaj_snap_group 
-----------------
               9
(1 row)

\! ls /tmp/emaj_test/alter
_INFO
myschema2_myTbl3.snap
myschema2_myTbl3_col31_seq.snap
myschema2_myseq1.snap
myschema2_mytbl1.snap
myschema2_mytbl2.snap
myschema2_mytbl4.snap
myschema2_mytbl5.snap
myschema2_mytbl6.snap
myschema2_mytbl7.snap
\! rm -R /tmp/emaj_test/alter/*
  select emaj.emaj_snap_log_group('myGroup2',NULL,'After ADD_TBL','/tmp/emaj_test/alter',NULL);
 emaj_snap_log_group 
---------------------
                  10
(1 row)

\! ls /tmp/emaj_test/alter/myschema2*
/tmp/emaj_test/alter/myschema2_myTbl3_log.snap
/tmp/emaj_test/alter/myschema2_mytbl1_log.snap
/tmp/emaj_test/alter/myschema2_mytbl2_log.snap
/tmp/emaj_test/alter/myschema2_mytbl4_log.snap
/tmp/emaj_test/alter/myschema2_mytbl5_log.snap
/tmp/emaj_test/alter/myschema2_mytbl6_log.snap
/tmp/emaj_test/alter/myschema2_mytbl7_log.snap
\! rm -R /tmp/emaj_test/alter/*
  select emaj.emaj_gen_sql_group('myGroup2', 'Before ADD_TBL', NULL, '/tmp/emaj_test/alter/myFile',array['myschema2.mytbl7']);
ERROR:  _gen_sql_groups: 1 table/sequence (myschema2.mytbl7) did not belong to any of the selected tables groups at Before ADD_TBL mark time.
CONTEXT:  PL/pgSQL function emaj._gen_sql_groups(text[],boolean,text,text,text,text[]) line 96 at RAISE
PL/pgSQL function emaj.emaj_gen_sql_group(text,text,text,text,text[]) line 13 at RETURN
-- testing mark deletions
begin;
  -- testing delete a single mark set after the table addition
  select emaj.emaj_delete_mark_group('myGroup2','After ADD_TBL');
 emaj_delete_mark_group 
------------------------
                      1
(1 row)

  select 'Should not exist' from emaj.emaj_mark where mark_group = 'myGroup2' and mark_name = 'After ADD_TBL';
 ?column? 
----------
(0 rows)

  -- testing delete all marks up to a mark set after the alter_group
  select emaj.emaj_delete_before_mark_group('myGroup2','EMAJ_LAST_MARK');
 emaj_delete_before_mark_group 
-------------------------------
                             9
(1 row)

  select * from emaj.emaj_mark where mark_group = 'myGroup2';
 mark_group |     mark_name      | mark_time_id | mark_is_deleted | mark_is_rlbk_protected | mark_comment | mark_log_rows_before_next | mark_logged_rlbk_target_mark 
------------+--------------------+--------------+-----------------+------------------------+--------------+---------------------------+------------------------------
 myGroup2   | Just after ADD_TBL |         6082 | f               | f                      |              |                           | 
(1 row)

  select * from emaj.emaj_sequence where sequ_name = 'mytbl7_log_seq' order by sequ_time_id;
  sequ_schema   |   sequ_name    | sequ_time_id | sequ_last_val | sequ_start_val | sequ_increment |    sequ_max_val     | sequ_min_val | sequ_cache_val | sequ_is_cycled | sequ_is_called 
----------------+----------------+--------------+---------------+----------------+----------------+---------------------+--------------+----------------+----------------+----------------
 emaj_myschema2 | mytbl7_log_seq |         6080 |             1 |              1 |              1 | 9223372036854775807 |            1 |              1 | f              | f
 emaj_myschema2 | mytbl7_log_seq |         6082 |             2 |              1 |              1 | 9223372036854775807 |            1 |              1 | f              | t
(2 rows)

rollback;
begin;
  -- testing the alter_group mark deletion
  select mark_time_id from emaj.emaj_mark where mark_group = 'myGroup2' and mark_name = 'Alter to add mytbl7';
 mark_time_id 
--------------
         6080
(1 row)

  select emaj.emaj_delete_mark_group('myGroup2','Alter to add mytbl7');
 emaj_delete_mark_group 
------------------------
                      1
(1 row)

  select * from emaj.emaj_sequence where sequ_name = 'mytbl7_log_seq' order by sequ_time_id limit 1;
  sequ_schema   |   sequ_name    | sequ_time_id | sequ_last_val | sequ_start_val | sequ_increment |    sequ_max_val     | sequ_min_val | sequ_cache_val | sequ_is_cycled | sequ_is_called 
----------------+----------------+--------------+---------------+----------------+----------------+---------------------+--------------+----------------+----------------+----------------
 emaj_myschema2 | mytbl7_log_seq |         6080 |             1 |              1 |              1 | 9223372036854775807 |            1 |              1 | f              | f
(1 row)

rollback;
-- test sequences and holes at bounds following a rollback targeting a mark set before an ADD_TBL
begin;
  delete from emaj.emaj_param where param_key = 'dblink_user_password';
  select mark_time_id from emaj.emaj_mark where mark_group = 'myGroup2' and mark_name = 'Alter to add mytbl7';
 mark_time_id 
--------------
         6080
(1 row)

  select rlbk_severity, regexp_replace(rlbk_message,E'\\d\\d\\d\\d/\\d\\d\\/\\d\\d\\ \\d\\d\\:\\d\\d:\\d\\d .*?\\)','<timestamp>)','g')
    from emaj.emaj_rollback_group('myGroup2','Before ADD_TBL',true);
WARNING:  _check_fk_groups: The table "myschema2.mytbl6" is referenced by the foreign key "mytbl8_col81_fkey" on the table "myschema2.mytbl8" that is outside the groups (myGroup2).
 rlbk_severity |                                          regexp_replace                                           
---------------+---------------------------------------------------------------------------------------------------
 Notice        | 1 / 7 tables effectively processed.
 Notice        | 2 sequences processed.
 Warning       | The table myschema2.mytbl7 has only been rolled back to its latest group attachment (<timestamp>)
(3 rows)

  select * from emaj.emaj_sequence where sequ_schema = 'emaj_myschema2' and sequ_name = 'mytbl7_log_seq' order by sequ_time_id;
  sequ_schema   |   sequ_name    | sequ_time_id | sequ_last_val | sequ_start_val | sequ_increment |    sequ_max_val     | sequ_min_val | sequ_cache_val | sequ_is_cycled | sequ_is_called 
----------------+----------------+--------------+---------------+----------------+----------------+---------------------+--------------+----------------+----------------+----------------
 emaj_myschema2 | mytbl7_log_seq |         6080 |             1 |              1 |              1 | 9223372036854775807 |            1 |              1 | f              | f
(1 row)

  select * from emaj.emaj_seq_hole where sqhl_schema = 'myschema2' and sqhl_table = 'mytbl7';
 sqhl_schema | sqhl_table | sqhl_begin_time_id | sqhl_end_time_id | sqhl_hole_size 
-------------+------------+--------------------+------------------+----------------
 myschema2   | mytbl7     |               6080 |             6084 |              3
(1 row)

  select stat_group, stat_schema, stat_table, stat_first_mark, stat_first_mark_gid, stat_last_mark, stat_last_mark_gid, stat_rows 
    from emaj._log_stat_groups('{"myGroup2"}',false,'ADD_TBL test',NULL);
 stat_group | stat_schema | stat_table | stat_first_mark | stat_first_mark_gid | stat_last_mark | stat_last_mark_gid | stat_rows 
------------+-------------+------------+-----------------+---------------------+----------------+--------------------+-----------
 myGroup2   | myschema2   | myTbl3     | ADD_TBL test    |               11869 |                |                    |         0
 myGroup2   | myschema2   | mytbl1     | ADD_TBL test    |               11869 |                |                    |         0
 myGroup2   | myschema2   | mytbl2     | ADD_TBL test    |               11869 |                |                    |         0
 myGroup2   | myschema2   | mytbl4     | ADD_TBL test    |               11869 |                |                    |         0
 myGroup2   | myschema2   | mytbl5     | ADD_TBL test    |               11869 |                |                    |         0
 myGroup2   | myschema2   | mytbl6     | ADD_TBL test    |               11869 |                |                    |         0
 myGroup2   | myschema2   | mytbl7     | [deleted mark]  |               11869 |                |                    |         0
(7 rows)

rollback;
-- estimate and then perform a logged rollback to reach a mark prior the ADD_TBL operation and check
select * from emaj.emaj_estimate_rollback_group('myGroup2','Before ADD_TBL',true);
 emaj_estimate_rollback_group 
------------------------------
 @ 0.028815 secs
(1 row)

select rlbk_severity, regexp_replace(rlbk_message,E'\\d\\d\\d\\d/\\d\\d\\/\\d\\d\\ \\d\\d\\:\\d\\d:\\d\\d .*?\\)','<timestamp>)','g')
  from emaj.emaj_logged_rollback_group('myGroup2','Before ADD_TBL',true);
WARNING:  _check_fk_groups: The table "myschema2.mytbl6" is referenced by the foreign key "mytbl8_col81_fkey" on the table "myschema2.mytbl8" that is outside the groups (myGroup2).
 rlbk_severity |                                          regexp_replace                                           
---------------+---------------------------------------------------------------------------------------------------
 Notice        | 1 / 7 tables effectively processed.
 Notice        | 2 sequences processed.
 Warning       | The table myschema2.mytbl7 has only been rolled back to its latest group attachment (<timestamp>)
(3 rows)

select col71, emaj_verb, emaj_tuple from emaj_myschema2.mytbl7_log order by emaj_gid;
 col71 | emaj_verb | emaj_tuple 
-------+-----------+------------
     4 | INS       | NEW
     5 | INS       | NEW
     2 | UPD       | OLD
     6 | UPD       | NEW
     4 | DEL       | OLD
     5 | DEL       | OLD
     6 | DEL       | OLD
     2 | INS       | NEW
(8 rows)

select * from myschema2.mytbl7 order by col71;
 col71 
-------
     1
     2
(2 rows)

-- consolidate this logged rollback
select emaj.emaj_rename_mark_group('myGroup2','EMAJ_LAST_MARK','Logged_Rlbk_End');
 emaj_rename_mark_group 
------------------------
 
(1 row)

select mark_time_id from emaj.emaj_mark where mark_group = 'myGroup2' and mark_name = 'Alter to add mytbl7';
 mark_time_id 
--------------
         6080
(1 row)

select * from emaj.emaj_get_consolidable_rollbacks() where cons_group = 'myGroup2'; -- should report 1 row to consolidate
 cons_group | cons_target_rlbk_mark_name | cons_target_rlbk_mark_time_id | cons_end_rlbk_mark_name | cons_end_rlbk_mark_time_id | cons_rows | cons_marks 
------------+----------------------------+-------------------------------+-------------------------+----------------------------+-----------+------------
 myGroup2   | Before ADD_TBL             |                          6079 | Logged_Rlbk_End         |                       6086 |         7 |          4
(1 row)

select * from emaj.emaj_consolidate_rollback_group('myGroup2', 'Logged_Rlbk_End');
 emaj_consolidate_rollback_group 
---------------------------------
                               3
(1 row)

select * from emaj.emaj_sequence where sequ_schema = 'emaj_myschema2' and sequ_name = 'mytbl7_log_seq' order by sequ_time_id;
  sequ_schema   |   sequ_name    | sequ_time_id | sequ_last_val | sequ_start_val | sequ_increment |    sequ_max_val     | sequ_min_val | sequ_cache_val | sequ_is_cycled | sequ_is_called 
----------------+----------------+--------------+---------------+----------------+----------------+---------------------+--------------+----------------+----------------+----------------
 emaj_myschema2 | mytbl7_log_seq |         6080 |             1 |              1 |              1 | 9223372036854775807 |            1 |              1 | f              | f
 emaj_myschema2 | mytbl7_log_seq |         6086 |             7 |              1 |              1 | 9223372036854775807 |            1 |              1 | f              | t
(2 rows)

-- perform some other updates
insert into myschema2.myTbl7 values (7),(8),(9);
-- verify the group and detect the lack of the new log table
begin;
  select emaj.emaj_disable_protection_by_event_triggers();
 emaj_disable_protection_by_event_triggers 
-------------------------------------------
                                         3
(1 row)

  drop table emaj_myschema2.mytbl7_log;
  select * from emaj.emaj_verify_all();
                                                                emaj_verify_all                                                                
-----------------------------------------------------------------------------------------------------------------------------------------------
 Warning: Some E-Maj event triggers exist but are disabled. You may enable them using the emaj_enable_protection_by_event_triggers() function.
 In group "myGroup2", the log table "emaj_myschema2"."mytbl7_log" is not found.
 1 tables groups need to be altered to match their configuration definition or to be repaired
(3 rows)

  select emaj.emaj_enable_protection_by_event_triggers();
 emaj_enable_protection_by_event_triggers 
------------------------------------------
                                        3
(1 row)

rollback;
-- remove myTbl7 from the group, then re-add it
delete from emaj.emaj_group_def where grpdef_schema = 'myschema2' and grpdef_tblseq = 'mytbl7';
select emaj.emaj_alter_group('myGroup2', 'Alter to remove mytbl7');
WARNING:  _check_fk_groups: The foreign key "mytbl6_col61_fkey" on the table "myschema2.mytbl6" references the table "myschema2.mytbl7" that is outside the groups (myGroup2).
WARNING:  _check_fk_groups: The table "myschema2.mytbl6" is referenced by the foreign key "mytbl8_col81_fkey" on the table "myschema2.mytbl8" that is outside the groups (myGroup2).
 emaj_alter_group 
------------------
                8
(1 row)

insert into emaj.emaj_group_def values ('myGroup2','myschema2','mytbl7');
select emaj.emaj_alter_group('myGroup2', 'Alter to re-add mytbl7');
NOTICE:  table "mytbl7_log" does not exist, skipping
NOTICE:  trigger "emaj_log_trg" for relation "myschema2.mytbl7" does not exist, skipping
NOTICE:  trigger "emaj_trunc_trg" for relation "myschema2.mytbl7" does not exist, skipping
WARNING:  _check_fk_groups: The table "myschema2.mytbl6" is referenced by the foreign key "mytbl8_col81_fkey" on the table "myschema2.mytbl8" that is outside the groups (myGroup2).
 emaj_alter_group 
------------------
                9
(1 row)

select * from emaj.emaj_relation where rel_schema = 'myschema2' and rel_tblseq = 'mytbl7' order by rel_time_range;
 rel_schema | rel_tblseq | rel_time_range | rel_group | rel_kind | rel_priority | rel_log_schema | rel_log_table | rel_log_dat_tsp |  rel_log_index   | rel_log_idx_tsp | rel_log_sequence | rel_log_function | rel_sql_columns | rel_sql_pk_columns | rel_sql_pk_eq_conditions | rel_log_seq_last_value | rel_emaj_verb_attnum 
------------+------------+----------------+-----------+----------+--------------+----------------+---------------+-----------------+------------------+-----------------+------------------+------------------+-----------------+--------------------+--------------------------+------------------------+----------------------
 myschema2  | mytbl7     | [6080,6087)    | myGroup2  | r        |              | emaj_myschema2 | mytbl7_log_1  |                 | mytbl7_log_idx_1 |                 | mytbl7_log_seq   |                  |                 |                    |                          |                     10 |                    2
 myschema2  | mytbl7     | [6088,)        | myGroup2  | r        |              | emaj_myschema2 | mytbl7_log    |                 | mytbl7_log_idx   |                 | mytbl7_log_seq   | mytbl7_log_fnct  | tbl.col71       | col71              | tbl.col71 = keys.col71   |                        |                    2
(2 rows)

delete from myschema2.myTbl7 where col71 = 9;
-- get statistics, using directly internal functions as done by web clients
select stat_group, stat_schema, stat_table, stat_log_schema, stat_log_table,
       stat_first_mark, stat_first_mark_gid, stat_last_mark, stat_last_mark_gid, stat_rows 
  from emaj._log_stat_groups('{"myGroup2"}',false,'ADD_TBL test',NULL);
 stat_group | stat_schema | stat_table | stat_log_schema | stat_log_table |    stat_first_mark     | stat_first_mark_gid |     stat_last_mark     | stat_last_mark_gid | stat_rows 
------------+-------------+------------+-----------------+----------------+------------------------+---------------------+------------------------+--------------------+-----------
 myGroup2   | myschema2   | myTbl3     | emaj_myschema2  | myTbl3_log     | ADD_TBL test           |               11869 |                        |                    |         0
 myGroup2   | myschema2   | mytbl1     | emaj_myschema2  | mytbl1_log     | ADD_TBL test           |               11869 |                        |                    |         0
 myGroup2   | myschema2   | mytbl2     | emaj_myschema2  | mytbl2_log     | ADD_TBL test           |               11869 |                        |                    |         0
 myGroup2   | myschema2   | mytbl4     | emaj_myschema2  | mytbl4_log     | ADD_TBL test           |               11869 |                        |                    |         0
 myGroup2   | myschema2   | mytbl5     | emaj_myschema2  | mytbl5_log     | ADD_TBL test           |               11869 |                        |                    |         0
 myGroup2   | myschema2   | mytbl6     | emaj_myschema2  | mytbl6_log     | ADD_TBL test           |               11869 |                        |                    |         0
 myGroup2   | myschema2   | mytbl7     | emaj_myschema2  | mytbl7_log_1   | [deleted mark]         |               11869 | Alter to remove mytbl7 |              11879 |         3
 myGroup2   | myschema2   | mytbl7     | emaj_myschema2  | mytbl7_log     | Alter to re-add mytbl7 |               11879 |                        |                    |         1
(8 rows)

select stat_group, stat_schema, stat_table, stat_log_schema, stat_log_table,
       stat_first_mark, stat_first_mark_gid, stat_last_mark, stat_last_mark_gid, stat_role, stat_verb, stat_rows 
  from emaj._detailed_log_stat_groups('{"myGroup2"}',false,'ADD_TBL test',NULL);
 stat_group | stat_schema | stat_table | stat_log_schema | stat_log_table |    stat_first_mark     | stat_first_mark_gid |     stat_last_mark     | stat_last_mark_gid | stat_role | stat_verb | stat_rows 
------------+-------------+------------+-----------------+----------------+------------------------+---------------------+------------------------+--------------------+-----------+-----------+-----------
 myGroup2   | myschema2   | mytbl7     | emaj_myschema2  | mytbl7_log_1   | [deleted mark]         |               11869 | Alter to remove mytbl7 |              11879 | postgres  | INSERT    |         3
 myGroup2   | myschema2   | mytbl7     | emaj_myschema2  | mytbl7_log     | Alter to re-add mytbl7 |               11879 |                        |                    | postgres  | DELETE    |         1
(2 rows)

-- snap the logs
select emaj.emaj_snap_log_group('myGroup2',NULL,NULL,'/tmp/emaj_test/alter',NULL);
 emaj_snap_log_group 
---------------------
                  11
(1 row)

\! ls /tmp/emaj_test/alter/myschema2_mytbl7_log*
/tmp/emaj_test/alter/myschema2_mytbl7_log.snap
/tmp/emaj_test/alter/myschema2_mytbl7_log_1.snap
\! rm -R /tmp/emaj_test/alter/*
-- and finaly remove myTbl7 from the group
delete from emaj.emaj_group_def where grpdef_schema = 'myschema2' and grpdef_tblseq = 'mytbl7';
select emaj.emaj_alter_group('myGroup2', 'Alter to really remove mytbl7');
WARNING:  _check_fk_groups: The foreign key "mytbl6_col61_fkey" on the table "myschema2.mytbl6" references the table "myschema2.mytbl7" that is outside the groups (myGroup2).
WARNING:  _check_fk_groups: The table "myschema2.mytbl6" is referenced by the foreign key "mytbl8_col81_fkey" on the table "myschema2.mytbl8" that is outside the groups (myGroup2).
 emaj_alter_group 
------------------
                8
(1 row)

-- and perform a full rollback (that do not process myTbl7)
select rlbk_severity, regexp_replace(rlbk_message,E'\\d\\d\\d\\d/\\d\\d\\/\\d\\d\\ \\d\\d\\:\\d\\d:\\d\\d .*?\\)','<timestamp>)','g')
  from emaj.emaj_rollback_group('myGroup2', 'ADD_TBL test',true);
WARNING:  _check_fk_groups: The foreign key "mytbl6_col61_fkey" on the table "myschema2.mytbl6" references the table "myschema2.mytbl7" that is outside the groups (myGroup2).
WARNING:  _check_fk_groups: The table "myschema2.mytbl6" is referenced by the foreign key "mytbl8_col81_fkey" on the table "myschema2.mytbl8" that is outside the groups (myGroup2).
 rlbk_severity |                                       regexp_replace                                        
---------------+---------------------------------------------------------------------------------------------
 Notice        | 0 / 6 tables effectively processed.
 Notice        | 2 sequences processed.
 Warning       | The table myschema2.mytbl7 has been left unchanged (not in group anymore since <timestamp>)
(3 rows)

select * from myschema2.mytbl7 order by col71;
 col71 
-------
     1
     2
     7
     8
(4 rows)

-----------------------------
-- remove tables
-----------------------------
insert into myschema1."myTbl3" (col33) values (1.);
select emaj.emaj_set_mark_group('myGroup1','Mk2c');
 emaj_set_mark_group 
---------------------
                   7
(1 row)

insert into myschema1."myTbl3" (col33) values (1.);
update emaj.emaj_group_def set grpdef_group = 'temporarily_removed'
  where grpdef_group = 'myGroup1' and grpdef_schema = 'myschema1' and (grpdef_tblseq = 'myTbl3' or grpdef_tblseq = 'mytbl2b');
update emaj.emaj_group set group_has_waiting_changes = false where group_name = 'myGroup1';
select emaj._adjust_group_properties();
 _adjust_group_properties 
--------------------------
                        1
(1 row)

select group_has_waiting_changes from emaj.emaj_group where group_name = 'myGroup1';
 group_has_waiting_changes 
---------------------------
 t
(1 row)

--select emaj.emaj_alter_group('myGroup1', '2 tables removed from myGroup1');
select emaj.emaj_remove_tables('myschema1', '^(myTbl3|mytbl2b)$', null, '2 tables removed from myGroup1');
 emaj_remove_tables 
--------------------
                  2
(1 row)

select group_name, group_last_alter_time_id, group_has_waiting_changes, group_nb_table, group_nb_sequence
  from emaj.emaj_group where group_name = 'myGroup1';
 group_name | group_last_alter_time_id | group_has_waiting_changes | group_nb_table | group_nb_sequence 
------------+--------------------------+---------------------------+----------------+-------------------
 myGroup1   |                     6093 | t                         |              3 |                 2
(1 row)

select * from emaj.emaj_relation where rel_schema = 'myschema1' and (rel_tblseq = 'myTbl3' or rel_tblseq = 'mytbl2b') order by 1,2,3;
 rel_schema | rel_tblseq | rel_time_range | rel_group | rel_kind | rel_priority | rel_log_schema | rel_log_table | rel_log_dat_tsp |   rel_log_index   | rel_log_idx_tsp | rel_log_sequence | rel_log_function | rel_sql_columns | rel_sql_pk_columns | rel_sql_pk_eq_conditions | rel_log_seq_last_value | rel_emaj_verb_attnum 
------------+------------+----------------+-----------+----------+--------------+----------------+---------------+-----------------+-------------------+-----------------+------------------+------------------+-----------------+--------------------+--------------------------+------------------------+----------------------
 myschema1  | myTbl3     | [6042,6093)    | myGroup1  | r        |           10 | emaj_myschema1 | myTbl3_log_1  | tsplog1         | myTbl3_log_idx_1  |                 | myTbl3_log_seq   |                  |                 |                    |                          |                      3 |                    4
 myschema1  | mytbl2b    | [6042,6093)    | myGroup1  | r        |              | emaj_myschema1 | mytbl2b_log_1 | tsp log'2       | mytbl2b_log_idx_1 | tsp log'2       | mytbl2b_log_seq  |                  |                 |                    |                          |                      0 |                    3
(2 rows)

delete from myschema1."myTbl3" where col33 = 1.;
select count(*) from emaj_myschema1."myTbl3_log_1";
 count 
-------
     2
(1 row)

select * from emaj.emaj_verify_all();
  emaj_verify_all  
-------------------
 No error detected
(1 row)

-- test statistics following a rollback targeting a mark set before a REMOVE_TBL
begin;
  delete from emaj.emaj_param where param_key = 'dblink_user_password';
  select rlbk_severity, regexp_replace(rlbk_message,E'\\d\\d\\d\\d/\\d\\d\\/\\d\\d\\ \\d\\d\\:\\d\\d:\\d\\d .*?\\)','<timestamp>)','g')
    from emaj.emaj_rollback_group('myGroup1','Mk2c',true);
 rlbk_severity |                                        regexp_replace                                         
---------------+-----------------------------------------------------------------------------------------------
 Notice        | 0 / 3 tables effectively processed.
 Notice        | 2 sequences processed.
 Warning       | The table myschema1."myTbl3" has been left unchanged (not in group anymore since <timestamp>)
 Warning       | The table myschema1.mytbl2b has been left unchanged (not in group anymore since <timestamp>)
(4 rows)

  select stat_group, stat_schema, stat_table, stat_first_mark, stat_last_mark, stat_rows
    from emaj.emaj_log_stat_group('myGroup1','Mk2b',NULL) order by 1,2,3,4;
 stat_group | stat_schema | stat_table | stat_first_mark | stat_last_mark | stat_rows 
------------+-------------+------------+-----------------+----------------+-----------
 myGroup1   | myschema1   | myTbl3     | Mk2b            | [deleted mark] |         2
 myGroup1   | myschema1   | mytbl1     | Mk2b            |                |         0
 myGroup1   | myschema1   | mytbl2     | Mk2b            |                |         0
 myGroup1   | myschema1   | mytbl2b    | Mk2b            | [deleted mark] |         0
 myGroup1   | myschema1   | mytbl4     | Mk2b            |                |         0
(5 rows)

rollback;
-- get statistics, using directly internal functions as done by web clients
select stat_group, stat_schema, stat_table, stat_first_mark, stat_first_mark_gid, stat_last_mark, stat_last_mark_gid, stat_rows 
  from emaj._log_stat_groups('{"myGroup1"}',false,NULL,NULL);
 stat_group | stat_schema | stat_table | stat_first_mark | stat_first_mark_gid |         stat_last_mark         | stat_last_mark_gid | stat_rows 
------------+-------------+------------+-----------------+---------------------+--------------------------------+--------------------+-----------
 myGroup1   | myschema1   | myTbl3     | Mk1             |               11867 | 2 tables removed from myGroup1 |              11882 |         2
 myGroup1   | myschema1   | mytbl1     | Mk1             |               11867 |                                |                    |         0
 myGroup1   | myschema1   | mytbl2     | Mk1             |               11867 |                                |                    |         0
 myGroup1   | myschema1   | mytbl2b    | Mk1             |               11867 | 2 tables removed from myGroup1 |              11882 |         0
 myGroup1   | myschema1   | mytbl4     | Mk1             |               11867 |                                |                    |         0
(5 rows)

select stat_group, stat_schema, stat_table, stat_first_mark, stat_first_mark_gid, stat_last_mark, stat_last_mark_gid, stat_role, stat_verb, stat_rows 
  from emaj._detailed_log_stat_groups('{"myGroup1"}',false,NULL,NULL);
 stat_group | stat_schema | stat_table | stat_first_mark | stat_first_mark_gid |         stat_last_mark         | stat_last_mark_gid | stat_role | stat_verb | stat_rows 
------------+-------------+------------+-----------------+---------------------+--------------------------------+--------------------+-----------+-----------+-----------
 myGroup1   | myschema1   | myTbl3     | Mk1             |               11867 | 2 tables removed from myGroup1 |              11882 | postgres  | INSERT    |         2
(1 row)

--testing snap and sql generation
\! rm -Rf /tmp/emaj_test/alter/*
select emaj.emaj_snap_group('myGroup1','/tmp/emaj_test/alter','');
 emaj_snap_group 
-----------------
               5
(1 row)

\! ls /tmp/emaj_test/alter
_INFO
myschema1_myTbl3_col31_seq.snap
myschema1_mytbl1.snap
myschema1_mytbl2.snap
myschema1_mytbl2b_col20_seq.snap
myschema1_mytbl4.snap
\! rm -R /tmp/emaj_test/alter/*
select emaj.emaj_snap_log_group('myGroup1',NULL,NULL,'/tmp/emaj_test/alter',NULL);
 emaj_snap_log_group 
---------------------
                   8
(1 row)

\! ls /tmp/emaj_test/alter/myschema1*
/tmp/emaj_test/alter/myschema1_myTbl3_log_1.snap
/tmp/emaj_test/alter/myschema1_mytbl1_log.snap
/tmp/emaj_test/alter/myschema1_mytbl2_log.snap
/tmp/emaj_test/alter/myschema1_mytbl2b_log_1.snap
/tmp/emaj_test/alter/myschema1_mytbl4_log.snap
\! rm -R /tmp/emaj_test/alter/*
  select emaj.emaj_gen_sql_group('myGroup1', NULL, NULL, '/tmp/emaj_test/alter/myFile',array['myschema1.myTbl3']);
 emaj_gen_sql_group 
--------------------
                  2
(1 row)

\! rm -R /tmp/emaj_test/alter/*
-- test marks deletions
begin;
-- testing delete a single mark set before the table removal
  select emaj.emaj_delete_mark_group('myGroup1','Mk2c');
 emaj_delete_mark_group 
------------------------
                      1
(1 row)

  select * from emaj.emaj_mark where mark_group = 'myGroup1' and mark_name = 'Mk2b';
 mark_group | mark_name | mark_time_id | mark_is_deleted | mark_is_rlbk_protected | mark_comment | mark_log_rows_before_next | mark_logged_rlbk_target_mark 
------------+-----------+--------------+-----------------+------------------------+--------------+---------------------------+------------------------------
 myGroup1   | Mk2b      |         6067 | f               | f                      |              |                         0 | 
(1 row)

-- testing marks deletion (delete all marks before the alter_group)
  select emaj.emaj_delete_before_mark_group('myGroup1','EMAJ_LAST_MARK');
 emaj_delete_before_mark_group 
-------------------------------
                            11
(1 row)

  select 'should not exist' from pg_class, pg_namespace 
    where relnamespace = pg_namespace.oid and nspname = 'emaj_myschema1' and relname in ('myTbl3_log','mytbl2b_log');
 ?column? 
----------
(0 rows)

  select * from emaj.emaj_relation where rel_schema = 'myschema1' and rel_tblseq in ('myTbl3','mytbl2b') order by rel_time_range;
 rel_schema | rel_tblseq | rel_time_range | rel_group | rel_kind | rel_priority | rel_log_schema | rel_log_table | rel_log_dat_tsp | rel_log_index | rel_log_idx_tsp | rel_log_sequence | rel_log_function | rel_sql_columns | rel_sql_pk_columns | rel_sql_pk_eq_conditions | rel_log_seq_last_value | rel_emaj_verb_attnum 
------------+------------+----------------+-----------+----------+--------------+----------------+---------------+-----------------+---------------+-----------------+------------------+------------------+-----------------+--------------------+--------------------------+------------------------+----------------------
(0 rows)

  select * from emaj.emaj_rel_hist where relh_schema = 'myschema1' and relh_tblseq in ('myTbl3','mytbl2b') order by 1,2,3;
 relh_schema | relh_tblseq | relh_time_range | relh_group | relh_kind 
-------------+-------------+-----------------+------------+-----------
 myschema1   | myTbl3      | [1000,6001)     | myGroup1   | r
 myschema1   | myTbl3      | [6007,6015)     | myGroup1   | r
 myschema1   | myTbl3      | [6017,6041)     | myGroup1   | r
 myschema1   | myTbl3      | [6042,6093)     | myGroup1   | r
 myschema1   | mytbl2b     | [1000,6001)     | myGroup1   | r
 myschema1   | mytbl2b     | [6007,6015)     | myGroup1   | r
 myschema1   | mytbl2b     | [6017,6041)     | myGroup1   | r
 myschema1   | mytbl2b     | [6042,6093)     | myGroup1   | r
(8 rows)

rollback;
begin;
-- testing the alter_group mark deletion
  select mark_group, mark_name, mark_time_id, mark_is_deleted, mark_is_rlbk_protected, mark_comment, mark_log_rows_before_next,
         mark_logged_rlbk_target_mark
    from emaj.emaj_mark where mark_group = 'myGroup1' order by mark_time_id desc limit 2;
 mark_group |           mark_name            | mark_time_id | mark_is_deleted | mark_is_rlbk_protected | mark_comment | mark_log_rows_before_next | mark_logged_rlbk_target_mark 
------------+--------------------------------+--------------+-----------------+------------------------+--------------+---------------------------+------------------------------
 myGroup1   | 2 tables removed from myGroup1 |         6093 | f               | f                      |              |                           | 
 myGroup1   | Mk2c                           |         6092 | f               | f                      |              |                         1 | 
(2 rows)

    
  select emaj.emaj_delete_mark_group('myGroup1','2 tables removed from myGroup1');
 emaj_delete_mark_group 
------------------------
                      1
(1 row)

  select * from emaj.emaj_relation where rel_schema = 'myschema1' and (rel_tblseq = 'myTbl3' or rel_tblseq = 'mytbl2b') order by rel_tblseq;
 rel_schema | rel_tblseq | rel_time_range | rel_group | rel_kind | rel_priority | rel_log_schema | rel_log_table | rel_log_dat_tsp |   rel_log_index   | rel_log_idx_tsp | rel_log_sequence | rel_log_function | rel_sql_columns | rel_sql_pk_columns | rel_sql_pk_eq_conditions | rel_log_seq_last_value | rel_emaj_verb_attnum 
------------+------------+----------------+-----------+----------+--------------+----------------+---------------+-----------------+-------------------+-----------------+------------------+------------------+-----------------+--------------------+--------------------------+------------------------+----------------------
 myschema1  | myTbl3     | [6042,6093)    | myGroup1  | r        |           10 | emaj_myschema1 | myTbl3_log_1  | tsplog1         | myTbl3_log_idx_1  |                 | myTbl3_log_seq   |                  |                 |                    |                          |                      3 |                    4
 myschema1  | mytbl2b    | [6042,6093)    | myGroup1  | r        |              | emaj_myschema1 | mytbl2b_log_1 | tsp log'2       | mytbl2b_log_idx_1 | tsp log'2       | mytbl2b_log_seq  |                  |                 |                    |                          |                      0 |                    3
(2 rows)

  select * from emaj.emaj_sequence where 
    sequ_name in ('mytbl2b_log_seq', 'myTbl3_log_seq') order by sequ_time_id desc, sequ_name limit 2;
  sequ_schema   |    sequ_name    | sequ_time_id | sequ_last_val | sequ_start_val | sequ_increment |    sequ_max_val     | sequ_min_val | sequ_cache_val | sequ_is_cycled | sequ_is_called 
----------------+-----------------+--------------+---------------+----------------+----------------+---------------------+--------------+----------------+----------------+----------------
 emaj_myschema1 | myTbl3_log_seq  |         6093 |             3 |              1 |              1 | 9223372036854775807 |            1 |              1 | f              | t
 emaj_myschema1 | mytbl2b_log_seq |         6093 |             1 |              1 |              1 | 9223372036854775807 |            1 |              1 | f              | f
(2 rows)

  select * from emaj.emaj_mark where mark_group = 'myGroup1' and mark_name = '2 tables removed from myGroup1';
 mark_group | mark_name | mark_time_id | mark_is_deleted | mark_is_rlbk_protected | mark_comment | mark_log_rows_before_next | mark_logged_rlbk_target_mark 
------------+-----------+--------------+-----------------+------------------------+--------------+---------------------------+------------------------------
(0 rows)

rollback;
begin;
-- testing marks deletion (other cases)
  select emaj.emaj_set_mark_group('myGroup1','Mk2d');
 emaj_set_mark_group 
---------------------
                   5
(1 row)

  select emaj.emaj_delete_before_mark_group('myGroup1','Mk2b');
 emaj_delete_before_mark_group 
-------------------------------
                             6
(1 row)

  select * from emaj.emaj_relation where rel_group = 'myGroup1' and not upper_inf(rel_time_range) order by 1,2,3;
 rel_schema |    rel_tblseq    | rel_time_range | rel_group | rel_kind | rel_priority | rel_log_schema | rel_log_table | rel_log_dat_tsp |   rel_log_index   | rel_log_idx_tsp | rel_log_sequence | rel_log_function | rel_sql_columns | rel_sql_pk_columns | rel_sql_pk_eq_conditions | rel_log_seq_last_value | rel_emaj_verb_attnum 
------------+------------------+----------------+-----------+----------+--------------+----------------+---------------+-----------------+-------------------+-----------------+------------------+------------------+-----------------+--------------------+--------------------------+------------------------+----------------------
 myschema1  | myTbl3           | [6042,6093)    | myGroup1  | r        |           10 | emaj_myschema1 | myTbl3_log_1  | tsplog1         | myTbl3_log_idx_1  |                 | myTbl3_log_seq   |                  |                 |                    |                          |                      3 |                    4
 myschema1  | myTbl3_col31_seq | [6042,6069)    | myGroup1  | S        |            1 |                |               |                 |                   |                 |                  |                  |                 |                    |                          |                        |                     
 myschema1  | mytbl2b          | [6042,6093)    | myGroup1  | r        |              | emaj_myschema1 | mytbl2b_log_1 | tsp log'2       | mytbl2b_log_idx_1 | tsp log'2       | mytbl2b_log_seq  |                  |                 |                    |                          |                      0 |                    3
(3 rows)

  select * from emaj.emaj_rel_hist where relh_schema = 'myschema1' and relh_tblseq = 'mytbl2b' order by 1,2,3;
 relh_schema | relh_tblseq | relh_time_range | relh_group | relh_kind 
-------------+-------------+-----------------+------------+-----------
 myschema1   | mytbl2b     | [1000,6001)     | myGroup1   | r
 myschema1   | mytbl2b     | [6007,6015)     | myGroup1   | r
 myschema1   | mytbl2b     | [6017,6041)     | myGroup1   | r
(3 rows)

  select 'found' from pg_class, pg_namespace where relnamespace = pg_namespace.oid and relname = 'mytbl2b_log_1' and nspname = 'emaj_myschema1';
 ?column? 
----------
 found
(1 row)

  select emaj.emaj_delete_before_mark_group('myGroup1','Mk2d');
 emaj_delete_before_mark_group 
-------------------------------
                             7
(1 row)

  select 'should not exist' from pg_class, pg_namespace where relnamespace = pg_namespace.oid and relname = 'mytbl2b_log' and nspname = 'emaj_myschema1';
 ?column? 
----------
(0 rows)

  select * from emaj.emaj_relation where rel_group = 'myGroup1' and not upper_inf(rel_time_range) order by 1,2,3;
 rel_schema | rel_tblseq | rel_time_range | rel_group | rel_kind | rel_priority | rel_log_schema | rel_log_table | rel_log_dat_tsp | rel_log_index | rel_log_idx_tsp | rel_log_sequence | rel_log_function | rel_sql_columns | rel_sql_pk_columns | rel_sql_pk_eq_conditions | rel_log_seq_last_value | rel_emaj_verb_attnum 
------------+------------+----------------+-----------+----------+--------------+----------------+---------------+-----------------+---------------+-----------------+------------------+------------------+-----------------+--------------------+--------------------------+------------------------+----------------------
(0 rows)

  select * from emaj.emaj_rel_hist where relh_schema = 'myschema1' and relh_tblseq = 'mytbl2b' order by 1,2,3;
 relh_schema | relh_tblseq | relh_time_range | relh_group | relh_kind 
-------------+-------------+-----------------+------------+-----------
 myschema1   | mytbl2b     | [1000,6001)     | myGroup1   | r
 myschema1   | mytbl2b     | [6007,6015)     | myGroup1   | r
 myschema1   | mytbl2b     | [6017,6041)     | myGroup1   | r
 myschema1   | mytbl2b     | [6042,6093)     | myGroup1   | r
(4 rows)

rollback;
-- testing rollback and consolidation
insert into myschema1.mytbl1 values (100, 'Alter_logg', E'\\000'::bytea);
select rlbk_severity, regexp_replace(rlbk_message,E'\\d\\d\\d\\d/\\d\\d\\/\\d\\d\\ \\d\\d\\:\\d\\d:\\d\\d .*?\\)','<timestamp>)','g')
  from emaj.emaj_logged_rollback_group('myGroup1','Mk2b',true) order by 1,2;
 rlbk_severity |                                                     regexp_replace                                                     
---------------+------------------------------------------------------------------------------------------------------------------------
 Notice        | 1 / 3 tables effectively processed.
 Notice        | 2 sequences processed.
 Warning       | The sequence myschema1."myTbl3_col31_seq" has only been rolled back to its latest group attachment state (<timestamp>)
 Warning       | The table myschema1."myTbl3" has been left unchanged (not in group anymore since <timestamp>)
 Warning       | The table myschema1.mytbl2b has been left unchanged (not in group anymore since <timestamp>)
(5 rows)

select emaj.emaj_rename_mark_group('myGroup1','EMAJ_LAST_MARK','Logged_Rlbk_End');
 emaj_rename_mark_group 
------------------------
 
(1 row)

update emaj.emaj_group_def set grpdef_group = 'temporarily_removed'
  where grpdef_group = 'myGroup1' and grpdef_schema = 'myschema1' and grpdef_tblseq = 'mytbl1';
select emaj.emaj_alter_group('myGroup1','2nd remove_tbl');
WARNING:  _check_fk_groups: The foreign key "mytbl4_col44_fkey" on the table "myschema1.mytbl4" references the table "myschema1.mytbl1" that is outside the groups (myGroup1).
 emaj_alter_group 
------------------
                4
(1 row)

select * from emaj.emaj_get_consolidable_rollbacks() where cons_group = 'myGroup1';
 cons_group | cons_target_rlbk_mark_name | cons_target_rlbk_mark_time_id | cons_end_rlbk_mark_name | cons_end_rlbk_mark_time_id | cons_rows | cons_marks 
------------+----------------------------+-------------------------------+-------------------------+----------------------------+-----------+------------
 myGroup1   | Mk2b                       |                          6067 | Logged_Rlbk_End         |                       6098 |         2 |          7
(1 row)

select * from emaj.emaj_consolidate_rollback_group('myGroup1', 'Logged_Rlbk_End');
 emaj_consolidate_rollback_group 
---------------------------------
                               3
(1 row)

select count(*) from emaj_myschema1.mytbl1_log_1;   -- the log table should be empty
 count 
-------
     0
(1 row)

select rlbk_severity, regexp_replace(rlbk_message,E'\\d\\d\\d\\d/\\d\\d\\/\\d\\d\\ \\d\\d\\:\\d\\d:\\d\\d .*?\\)','<timestamp>)','g')
  from emaj.emaj_rollback_group('myGroup1','Mk2b',true) order by 1,2;
WARNING:  _check_fk_groups: The foreign key "mytbl4_col44_fkey" on the table "myschema1.mytbl4" references the table "myschema1.mytbl1" that is outside the groups (myGroup1).
 rlbk_severity |                                       regexp_replace                                        
---------------+---------------------------------------------------------------------------------------------
 Notice        | 0 / 2 tables effectively processed.
 Notice        | 2 sequences processed.
 Warning       | The table myschema1.mytbl1 has been left unchanged (not in group anymore since <timestamp>)
(3 rows)

-- testing group's reset
begin;
  select emaj.emaj_stop_group('myGroup1');
 emaj_stop_group 
-----------------
               4
(1 row)

  select emaj.emaj_reset_group('myGroup1');
 emaj_reset_group 
------------------
                4
(1 row)

  select * from emaj.emaj_rel_hist where relh_schema = 'myschema1' and upper(relh_time_range) > 6050 order by 1,2,3;
 relh_schema |   relh_tblseq    | relh_time_range | relh_group | relh_kind 
-------------+------------------+-----------------+------------+-----------
 myschema1   | myTbl3           | [6042,6093)     | myGroup1   | r
 myschema1   | myTbl3_col31_seq | [6042,6069)     | myGroup1   | S
 myschema1   | mytbl1           | [6038,6099)     | myGroup1   | r
 myschema1   | mytbl2b          | [6042,6093)     | myGroup1   | r
(4 rows)

rollback;
-- testing group's stop and start
begin;
  select emaj.emaj_stop_group('myGroup1');
 emaj_stop_group 
-----------------
               4
(1 row)

  select emaj.emaj_start_group('myGroup1');
WARNING:  _check_fk_groups: The foreign key "mytbl4_col44_fkey" on the table "myschema1.mytbl4" references the table "myschema1.mytbl1" that is outside the groups (myGroup1).
 emaj_start_group 
------------------
                4
(1 row)

  select * from emaj.emaj_relation where rel_group = 'myGroup1' and not upper_inf(rel_time_range) order by 1,2,3;
 rel_schema | rel_tblseq | rel_time_range | rel_group | rel_kind | rel_priority | rel_log_schema | rel_log_table | rel_log_dat_tsp | rel_log_index | rel_log_idx_tsp | rel_log_sequence | rel_log_function | rel_sql_columns | rel_sql_pk_columns | rel_sql_pk_eq_conditions | rel_log_seq_last_value | rel_emaj_verb_attnum 
------------+------------+----------------+-----------+----------+--------------+----------------+---------------+-----------------+---------------+-----------------+------------------+------------------+-----------------+--------------------+--------------------------+------------------------+----------------------
(0 rows)

  select 'should not exist' from pg_class, pg_namespace where relnamespace = pg_namespace.oid and relname = 'mytbl2b_log' and nspname = 'emaj_myschema1';
 ?column? 
----------
(0 rows)

rollback;
-- testing the table drop (remove first the sequence linked to the table, otherwise an event triger fires)
begin;
  delete from emaj.emaj_group_def where grpdef_schema = 'myschema1' and grpdef_tblseq = 'myTbl3_col31_seq';
  select emaj.emaj_alter_group('myGroup1','alter_before_drop_mytbl3');
WARNING:  _check_fk_groups: The foreign key "mytbl4_col44_fkey" on the table "myschema1.mytbl4" references the table "myschema1.mytbl1" that is outside the groups (myGroup1).
 emaj_alter_group 
------------------
                3
(1 row)

  drop table mySchema1."myTbl3";
rollback;
-- testing an ALTER TABLE leading to a table rewrite
begin;
  alter table mySchema1."myTbl3" alter column col33 type decimal (10,1);
rollback;
-- re-add all removed tables
update emaj.emaj_group_def set grpdef_group = 'myGroup1' where grpdef_group = 'temporarily_removed';
select emaj.emaj_alter_group('myGroup1', 'tables re-added to myGroup1');
NOTICE:  table "myTbl3_log" does not exist, skipping
NOTICE:  trigger "emaj_log_trg" for relation "myschema1.myTbl3" does not exist, skipping
NOTICE:  trigger "emaj_trunc_trg" for relation "myschema1.myTbl3" does not exist, skipping
NOTICE:  table "mytbl1_log" does not exist, skipping
NOTICE:  trigger "emaj_log_trg" for relation "myschema1.mytbl1" does not exist, skipping
NOTICE:  trigger "emaj_trunc_trg" for relation "myschema1.mytbl1" does not exist, skipping
NOTICE:  table "mytbl2b_log" does not exist, skipping
NOTICE:  trigger "emaj_log_trg" for relation "myschema1.mytbl2b" does not exist, skipping
NOTICE:  trigger "emaj_trunc_trg" for relation "myschema1.mytbl2b" does not exist, skipping
 emaj_alter_group 
------------------
                7
(1 row)

select emaj.emaj_cleanup_rollback_state();
 emaj_cleanup_rollback_state 
-----------------------------
                           0
(1 row)

-- set an intermediate mark
select emaj.emaj_set_mark_groups('{"myGroup1","myGroup2"}','Mk3');
 emaj_set_mark_groups 
----------------------
                   15
(1 row)

select mark_group, regexp_replace(mark_name,E'\\d\\d\.\\d\\d\\.\\d\\d\\.\\d\\d\\d\\d','%','g'), mark_time_id, mark_is_deleted,
       mark_is_rlbk_protected, mark_comment, mark_log_rows_before_next, mark_logged_rlbk_target_mark
  from emaj.emaj_mark order by mark_time_id, mark_group;
 mark_group |       regexp_replace        | mark_time_id | mark_is_deleted | mark_is_rlbk_protected | mark_comment | mark_log_rows_before_next | mark_logged_rlbk_target_mark 
------------+-----------------------------+--------------+-----------------+------------------------+--------------+---------------------------+------------------------------
 myGroup1   | Mk1                         |         6049 | f               | f                      |              |                         0 | 
 myGroup2   | Mk1                         |         6049 | f               | f                      |              |                         0 | 
 myGroup1   | Priority Changed            |         6050 | f               | f                      |              |                         0 | 
 myGroup1   | Attributes_changed          |         6051 | f               | f                      |              |                         0 | 
 myGroup2   | Attributes_changed          |         6051 | f               | f                      |              |                         0 | 
 myGroup1   | Mk2                         |         6052 | f               | f                      |              |                         0 | 
 myGroup2   | Mk2                         |         6052 | f               | f                      |              |                         0 | 
 myGroup1   | ALTER_%                     |         6054 | f               | f                      |              |                         0 | 
 myGroup2   | ALTER_%                     |         6054 | f               | f                      |              |                         0 | 
 myGroup1   | ALTER_%                     |         6055 | f               | f                      |              |                         0 | 
 myGroup2   | ALTER_%                     |         6055 | f               | f                      |              |                         0 | 
 myGroup2   | ADD_SEQ test                |         6056 | f               | f                      |              |                         0 | 
 myGroup1   | Mk2b                        |         6067 | f               | f                      |              |                         0 | 
 myGroup2   | ADD_TBL test                |         6078 | f               | f                      |              |                         0 | 
 myGroup1   | tables re-added to myGroup1 |         6105 | f               | f                      |              |                         0 | 
 myGroup1   | Mk3                         |         6106 | f               | f                      |              |                           | 
 myGroup2   | Mk3                         |         6106 | f               | f                      |              |                           | 
(17 rows)

-- estimate a rollback crossing alter group operations
delete from emaj.emaj_rlbk_stat;    -- to avoid unstable results in estimates
select emaj.emaj_estimate_rollback_groups('{"myGroup1","myGroup2"}','Mk1',false);
 emaj_estimate_rollback_groups 
-------------------------------
 @ 0.015 secs
(1 row)

-- execute a rollback not crossing any alter group operation
select * from emaj.emaj_rollback_groups('{"myGroup1","myGroup2"}','Mk3',false) order by 1,2;
WARNING:  _check_fk_groups: The foreign key "mytbl6_col61_fkey" on the table "myschema2.mytbl6" references the table "myschema2.mytbl7" that is outside the groups (myGroup1,myGroup2).
WARNING:  _check_fk_groups: The table "myschema2.mytbl6" is referenced by the foreign key "mytbl8_col81_fkey" on the table "myschema2.mytbl8" that is outside the groups (myGroup1,myGroup2).
 rlbk_severity |             rlbk_message             
---------------+--------------------------------------
 Notice        | 0 / 11 tables effectively processed.
 Notice        | 4 sequences processed.
(2 rows)

-- execute rollbacks crossing alter group operations
select emaj.emaj_logged_rollback_groups('{"myGroup1","myGroup2"}','Mk2');
ERROR:  _rlbk_check: This rollback operation would cross some previously executed alter group operations, which is not allowed by the current function parameters.
CONTEXT:  PL/pgSQL function emaj._rlbk_check(text[],text,boolean,boolean) line 47 at RAISE
SQL statement "SELECT emaj._rlbk_check(v_groupNames, v_mark, v_isAlterGroupAllowed, FALSE)"
PL/pgSQL function emaj._rlbk_init(text[],text,boolean,integer,boolean,boolean) line 23 at SQL statement
SQL statement "SELECT emaj._rlbk_init(v_groupNames, v_mark, v_isLoggedRlbk, 1, v_multiGroup, v_isAlterGroupAllowed)"
PL/pgSQL function emaj._rlbk_groups(text[],text,boolean,boolean,boolean) line 25 at SQL statement
SQL statement "SELECT rlbk_message::INT FROM emaj._rlbk_groups(v_groupNames, v_mark, TRUE, TRUE, NULL) WHERE rlbk_severity = 'Notice'"
PL/pgSQL function emaj.emaj_logged_rollback_groups(text[],text) line 11 at RETURN
select * from emaj.emaj_logged_rollback_groups('{"myGroup1","myGroup2"}','Mk2',false) order by 1,2;
ERROR:  _rlbk_check: This rollback operation would cross some previously executed alter group operations, which is not allowed by the current function parameters.
CONTEXT:  PL/pgSQL function emaj._rlbk_check(text[],text,boolean,boolean) line 47 at RAISE
SQL statement "SELECT emaj._rlbk_check(v_groupNames, v_mark, v_isAlterGroupAllowed, FALSE)"
PL/pgSQL function emaj._rlbk_init(text[],text,boolean,integer,boolean,boolean) line 23 at SQL statement
SQL statement "SELECT emaj._rlbk_init(v_groupNames, v_mark, v_isLoggedRlbk, 1, v_multiGroup, v_isAlterGroupAllowed)"
PL/pgSQL function emaj._rlbk_groups(text[],text,boolean,boolean,boolean) line 25 at SQL statement
PL/pgSQL function emaj.emaj_logged_rollback_groups(text[],text,boolean) line 12 at RETURN QUERY
select rlbk_severity, regexp_replace(rlbk_message,E'\\d\\d\\d\\d/\\d\\d\\/\\d\\d\\ \\d\\d\\:\\d\\d:\\d\\d .*?\\)','<timestamp>)','g')
  from emaj.emaj_logged_rollback_groups('{"myGroup1","myGroup2"}','Mk2',true) order by 1,2;
WARNING:  _check_fk_groups: The foreign key "mytbl6_col61_fkey" on the table "myschema2.mytbl6" references the table "myschema2.mytbl7" that is outside the groups (myGroup1,myGroup2).
WARNING:  _check_fk_groups: The table "myschema2.mytbl6" is referenced by the foreign key "mytbl8_col81_fkey" on the table "myschema2.mytbl8" that is outside the groups (myGroup1,myGroup2).
 rlbk_severity |                                           regexp_replace                                            
---------------+-----------------------------------------------------------------------------------------------------
 Notice        | 0 / 11 tables effectively processed.
 Notice        | 4 sequences processed.
 Warning       | Tables group change not rolled back: E-Maj priority for myschema1.mytbl1
 Warning       | Tables group change not rolled back: log data tablespace for myschema1.mytbl2b
 Warning       | Tables group change not rolled back: log index tablespace for myschema2.mytbl6
 Warning       | The table myschema1."myTbl3" has only been rolled back to its latest group attachment (<timestamp>)
 Warning       | The table myschema1.mytbl1 has only been rolled back to its latest group attachment (<timestamp>)
 Warning       | The table myschema1.mytbl2b has only been rolled back to its latest group attachment (<timestamp>)
(8 rows)

select * from emaj.emaj_rollback_groups('{"myGroup1","myGroup2"}','Mk2',false) order by 1,2;
WARNING:  _check_fk_groups: The foreign key "mytbl6_col61_fkey" on the table "myschema2.mytbl6" references the table "myschema2.mytbl7" that is outside the groups (myGroup1,myGroup2).
WARNING:  _check_fk_groups: The table "myschema2.mytbl6" is referenced by the foreign key "mytbl8_col81_fkey" on the table "myschema2.mytbl8" that is outside the groups (myGroup1,myGroup2).
 rlbk_severity |             rlbk_message             
---------------+--------------------------------------
 Notice        | 0 / 11 tables effectively processed.
 Notice        | 4 sequences processed.
(2 rows)

select * from emaj.emaj_rollback_groups('{"myGroup1","myGroup2"}','Mk1',true) order by 1,2;
WARNING:  _check_fk_groups: The foreign key "mytbl6_col61_fkey" on the table "myschema2.mytbl6" references the table "myschema2.mytbl7" that is outside the groups (myGroup1,myGroup2).
WARNING:  _check_fk_groups: The table "myschema2.mytbl6" is referenced by the foreign key "mytbl8_col81_fkey" on the table "myschema2.mytbl8" that is outside the groups (myGroup1,myGroup2).
 rlbk_severity |                                  rlbk_message                                  
---------------+--------------------------------------------------------------------------------
 Notice        | 0 / 11 tables effectively processed.
 Notice        | 4 sequences processed.
 Warning       | Tables group change not rolled back: E-Maj priority for myschema1.mytbl1
 Warning       | Tables group change not rolled back: log data tablespace for myschema1.mytbl2b
 Warning       | Tables group change not rolled back: log index tablespace for myschema2.mytbl6
(5 rows)

-- execute additional rollback not crossing alter operations anymore
select * from emaj.emaj_logged_rollback_groups('{"myGroup1","myGroup2"}','Mk1',false) order by 1,2;
WARNING:  _check_fk_groups: The foreign key "mytbl6_col61_fkey" on the table "myschema2.mytbl6" references the table "myschema2.mytbl7" that is outside the groups (myGroup1,myGroup2).
WARNING:  _check_fk_groups: The table "myschema2.mytbl6" is referenced by the foreign key "mytbl8_col81_fkey" on the table "myschema2.mytbl8" that is outside the groups (myGroup1,myGroup2).
 rlbk_severity |             rlbk_message             
---------------+--------------------------------------
 Notice        | 0 / 11 tables effectively processed.
 Notice        | 4 sequences processed.
(2 rows)

select * from emaj.emaj_rollback_groups('{"myGroup1","myGroup2"}','Mk1',false) order by 1,2;
WARNING:  _check_fk_groups: The foreign key "mytbl6_col61_fkey" on the table "myschema2.mytbl6" references the table "myschema2.mytbl7" that is outside the groups (myGroup1,myGroup2).
WARNING:  _check_fk_groups: The table "myschema2.mytbl6" is referenced by the foreign key "mytbl8_col81_fkey" on the table "myschema2.mytbl8" that is outside the groups (myGroup1,myGroup2).
 rlbk_severity |             rlbk_message             
---------------+--------------------------------------
 Notice        | 0 / 11 tables effectively processed.
 Notice        | 4 sequences processed.
(2 rows)

-- empty logging groups
begin;
  delete from emaj.emaj_group_def where grpdef_group IN ('myGroup1','myGroup2');
  select emaj.emaj_alter_groups('{"myGroup1","myGroup2"}','empty groups');
 emaj_alter_groups 
-------------------
                 0
(1 row)

  select * from emaj.emaj_relation where rel_group IN ('myGroup1','myGroup2') order by rel_schema, rel_tblseq, rel_time_range;
 rel_schema |    rel_tblseq     | rel_time_range | rel_group | rel_kind | rel_priority | rel_log_schema | rel_log_table | rel_log_dat_tsp |   rel_log_index   | rel_log_idx_tsp | rel_log_sequence | rel_log_function | rel_sql_columns | rel_sql_pk_columns | rel_sql_pk_eq_conditions | rel_log_seq_last_value | rel_emaj_verb_attnum 
------------+-------------------+----------------+-----------+----------+--------------+----------------+---------------+-----------------+-------------------+-----------------+------------------+------------------+-----------------+--------------------+--------------------------+------------------------+----------------------
 myschema1  | myTbl3            | [6042,6093)    | myGroup1  | r        |           10 | emaj_myschema1 | myTbl3_log_1  | tsplog1         | myTbl3_log_idx_1  |                 | myTbl3_log_seq   |                  |                 |                    |                          |                      3 |                    4
 myschema1  | myTbl3            | [6105,6115)    | myGroup1  | r        |           10 | emaj_myschema1 | myTbl3_log_2  | tsplog1         | myTbl3_log_idx_2  |                 | myTbl3_log_seq   |                  |                 |                    |                          |                      3 |                    4
 myschema1  | myTbl3_col31_seq  | [6042,6069)    | myGroup1  | S        |            1 |                |               |                 |                   |                 |                  |                  |                 |                    |                          |                        |                     
 myschema1  | myTbl3_col31_seq  | [6077,6115)    | myGroup1  | S        |            1 |                |               |                 |                   |                 |                  |                  |                 |                    |                          |                        |                     
 myschema1  | mytbl1            | [6038,6099)    | myGroup1  | r        |           20 | emaj_myschema1 | mytbl1_log_1  |                 | mytbl1_log_idx_1  |                 | mytbl1_log_seq   |                  |                 |                    |                          |                      2 |                    4
 myschema1  | mytbl1            | [6105,6115)    | myGroup1  | r        |           20 | emaj_myschema1 | mytbl1_log_2  |                 | mytbl1_log_idx_2  |                 | mytbl1_log_seq   |                  |                 |                    |                          |                      2 |                    4
 myschema1  | mytbl2            | [6007,6115)    | myGroup1  | r        |              | emaj_myschema1 | mytbl2_log_1  | tsplog1         | mytbl2_log_idx_1  | tsplog1         | mytbl2_log_seq   |                  |                 |                    |                          |                      0 |                    4
 myschema1  | mytbl2b           | [6042,6093)    | myGroup1  | r        |              | emaj_myschema1 | mytbl2b_log_1 | tsp log'2       | mytbl2b_log_idx_1 | tsp log'2       | mytbl2b_log_seq  |                  |                 |                    |                          |                      0 |                    3
 myschema1  | mytbl2b           | [6105,6115)    | myGroup1  | r        |              | emaj_myschema1 | mytbl2b_log_2 | tsp log'2       | mytbl2b_log_idx_2 | tsp log'2       | mytbl2b_log_seq  |                  |                 |                    |                          |                      0 |                    3
 myschema1  | mytbl2b_col20_seq | [6007,6115)    | myGroup1  | S        |              |                |               |                 |                   |                 |                  |                  |                 |                    |                          |                        |                     
 myschema1  | mytbl4            | [6017,6115)    | myGroup1  | r        |           20 | emaj_myschema1 | mytbl4_log_1  | tsplog1         | mytbl4_log_idx_1  | tsp log'2       | mytbl4_log_seq   |                  |                 |                    |                          |                      0 |                    6
 myschema2  | myTbl3            | [6046,6115)    | myGroup2  | r        |              | emaj_myschema2 | myTbl3_log_1  |                 | myTbl3_log_idx_1  |                 | myTbl3_log_seq   |                  |                 |                    |                          |                      1 |                    4
 myschema2  | myTbl3_col31_seq  | [6046,6115)    | myGroup2  | S        |              |                |               |                 |                   |                 |                  |                  |                 |                    |                          |                        |                     
 myschema2  | myseq1            | [6008,6115)    | myGroup2  | S        |              |                |               |                 |                   |                 |                  |                  |                 |                    |                          |                        |                     
 myschema2  | myseq2            | [6058,6063)    | myGroup2  | S        |              |                |               |                 |                   |                 |                  |                  |                 |                    |                          |                        |                     
 myschema2  | myseq2            | [6064,6065)    | myGroup2  | S        |              |                |               |                 |                   |                 |                  |                  |                 |                    |                          |                        |                     
 myschema2  | mytbl1            | [6008,6115)    | myGroup2  | r        |              | emaj_myschema2 | mytbl1_log_1  |                 | mytbl1_log_idx_1  |                 | mytbl1_log_seq   |                  |                 |                    |                          |                      0 |                    4
 myschema2  | mytbl2            | [6008,6115)    | myGroup2  | r        |              | emaj_myschema2 | mytbl2_log_1  |                 | mytbl2_log_idx_1  |                 | mytbl2_log_seq   |                  |                 |                    |                          |                      0 |                    4
 myschema2  | mytbl4            | [6042,6115)    | myGroup2  | r        |              | emaj_myschema2 | mytbl4_log_1  |                 | mytbl4_log_idx_1  |                 | mytbl4_log_seq   |                  |                 |                    |                          |                      0 |                    6
 myschema2  | mytbl5            | [6008,6115)    | myGroup2  | r        |              | emaj_myschema2 | mytbl5_log_1  |                 | mytbl5_log_idx_1  |                 | mytbl5_log_seq   |                  |                 |                    |                          |                      0 |                    6
 myschema2  | mytbl6            | [6008,6115)    | myGroup2  | r        |              | emaj_myschema2 | mytbl6_log_1  |                 | mytbl6_log_idx_1  |                 | mytbl6_log_seq   |                  |                 |                    |                          |                      0 |                    7
 myschema2  | mytbl7            | [6080,6087)    | myGroup2  | r        |              | emaj_myschema2 | mytbl7_log_1  |                 | mytbl7_log_idx_1  |                 | mytbl7_log_seq   |                  |                 |                    |                          |                     10 |                    2
 myschema2  | mytbl7            | [6088,6090)    | myGroup2  | r        |              | emaj_myschema2 | mytbl7_log_2  |                 | mytbl7_log_idx_2  |                 | mytbl7_log_seq   |                  |                 |                    |                          |                     11 |                    2
(23 rows)

-- add one table and sequence to the empty groups
  insert into emaj.emaj_group_def values ('myGroup1','myschema1','mytbl1',20);
-- TODO: uncomment the next line once it will be possible to add a sequence to a logging group
--  insert into emaj.emaj_group_def values ('myGroup2','myschema2','myseq1');
  select emaj.emaj_alter_groups('{"myGroup1","myGroup2"}','add a single table');
NOTICE:  table "mytbl1_log" does not exist, skipping
NOTICE:  trigger "emaj_log_trg" for relation "myschema1.mytbl1" does not exist, skipping
NOTICE:  trigger "emaj_trunc_trg" for relation "myschema1.mytbl1" does not exist, skipping
WARNING:  _check_fk_groups: The table "myschema1.mytbl1" is referenced by the foreign key "mytbl4_col44_fkey" on the table "myschema1.mytbl4" that is outside the groups (myGroup1,myGroup2).
 emaj_alter_groups 
-------------------
                 1
(1 row)

  select * from emaj.emaj_relation
    where (rel_schema = 'myschema1' and rel_tblseq = 'mytbl1') or (rel_schema = 'myschema2' and rel_tblseq = 'myseq1')
    order by rel_schema, rel_tblseq, rel_time_range;
 rel_schema | rel_tblseq | rel_time_range | rel_group | rel_kind | rel_priority | rel_log_schema | rel_log_table | rel_log_dat_tsp |  rel_log_index   | rel_log_idx_tsp | rel_log_sequence | rel_log_function |        rel_sql_columns        | rel_sql_pk_columns |             rel_sql_pk_eq_conditions              | rel_log_seq_last_value | rel_emaj_verb_attnum 
------------+------------+----------------+-----------+----------+--------------+----------------+---------------+-----------------+------------------+-----------------+------------------+------------------+-------------------------------+--------------------+---------------------------------------------------+------------------------+----------------------
 myschema1  | mytbl1     | [6038,6099)    | myGroup1  | r        |           20 | emaj_myschema1 | mytbl1_log_1  |                 | mytbl1_log_idx_1 |                 | mytbl1_log_seq   |                  |                               |                    |                                                   |                      2 |                    4
 myschema1  | mytbl1     | [6105,6115)    | myGroup1  | r        |           20 | emaj_myschema1 | mytbl1_log_2  |                 | mytbl1_log_idx_2 |                 | mytbl1_log_seq   |                  |                               |                    |                                                   |                      2 |                    4
 myschema1  | mytbl1     | [6116,)        | myGroup1  | r        |           20 | emaj_myschema1 | mytbl1_log    |                 | mytbl1_log_idx   |                 | mytbl1_log_seq   | mytbl1_log_fnct  | tbl.col11,tbl.col12,tbl.col13 | col11,col12        | tbl.col11 = keys.col11 AND tbl.col12 = keys.col12 |                        |                    4
 myschema2  | myseq1     | [6008,6115)    | myGroup2  | S        |              |                |               |                 |                  |                 |                  |                  |                               |                    |                                                   |                        |                     
(4 rows)

rollback;
-----------------------------
-- change the group ownership of a table and a sequence (and some other attributes)
-----------------------------
update emaj.emaj_group_def set grpdef_group = 'myGroup1'
  where grpdef_group = 'myGroup2' and grpdef_schema = 'myschema2' and grpdef_tblseq = 'myTbl3_col31_seq';
update emaj.emaj_group_def set grpdef_group = 'myGroup1', grpdef_log_dat_tsp = 'tsplog1', grpdef_log_idx_tsp = 'tsplog1'
  where grpdef_group = 'myGroup2' and grpdef_schema = 'myschema2' and grpdef_tblseq = 'myTbl3';
-- case when the source group is idle and the destination group is logging
begin;
  select emaj.emaj_stop_group('myGroup2');
 emaj_stop_group 
-----------------
               8
(1 row)

  select emaj.emaj_alter_groups('{"myGroup1","myGroup2"}', 'move to myGroup1 while logging');
WARNING:  _check_fk_groups: The foreign key "mytbl6_col61_fkey" on the table "myschema2.mytbl6" references the table "myschema2.mytbl7" that is outside the groups (myGroup1,myGroup2).
WARNING:  _check_fk_groups: The table "myschema2.mytbl6" is referenced by the foreign key "mytbl8_col81_fkey" on the table "myschema2.mytbl8" that is outside the groups (myGroup1,myGroup2).
 emaj_alter_groups 
-------------------
                15
(1 row)

  select * from emaj.emaj_alter_plan where altr_time_id = (select max(altr_time_id) from emaj.emaj_alter_plan) order by 1,2,3,4,5;
 altr_time_id |        altr_step         | altr_schema |   altr_tblseq    | altr_group | altr_priority | altr_group_is_logging | altr_new_group | altr_new_group_is_logging | altr_rlbk_id 
--------------+--------------------------+-------------+------------------+------------+---------------+-----------------------+----------------+---------------------------+--------------
         6118 | RESET_GROUP              |             |                  | myGroup2   |               | f                     |                |                           |             
         6118 | CHANGE_TBL_LOG_DATA_TSP  | myschema2   | myTbl3           | myGroup2   |               | f                     | myGroup1       | t                         |             
         6118 | CHANGE_TBL_LOG_INDEX_TSP | myschema2   | myTbl3           | myGroup2   |               | f                     | myGroup1       | t                         |             
         6118 | MOVE_TBL                 | myschema2   | myTbl3           | myGroup2   |               | f                     | myGroup1       | t                         |             
         6118 | MOVE_SEQ                 | myschema2   | myTbl3_col31_seq | myGroup2   |               | f                     | myGroup1       | t                         |             
(5 rows)

  select hist_function, hist_event, hist_object, hist_wording from emaj.emaj_hist 
    where hist_function = 'ALTER_GROUPS' order by hist_id desc limit 8;
 hist_function |          hist_event          |         hist_object          |                 hist_wording                  
---------------+------------------------------+------------------------------+-----------------------------------------------
 ALTER_GROUPS  | END                          | myGroup1,myGroup2            | Timestamp Id : 6118
 ALTER_GROUPS  | SEQUENCE MOVED               | myschema2."myTbl3_col31_seq" | From the group myGroup2 to the group myGroup1
 ALTER_GROUPS  | TABLE MOVED                  | myschema2."myTbl3"           | From group myGroup2 to group myGroup1
 ALTER_GROUPS  | LOG INDEX TABLESPACE CHANGED | myschema2."myTbl3"           | Default tablespace => tsplog1
 ALTER_GROUPS  | LOG DATA TABLESPACE CHANGED  | myschema2."myTbl3"           | Default tablespace => tsplog1
 ALTER_GROUPS  | BEGIN                        | myGroup1,myGroup2            | 
 ALTER_GROUPS  | END                          | myGroup1,myGroup2            | Timestamp Id : 6055
 ALTER_GROUPS  | LOG INDEX TABLESPACE CHANGED | myschema2.mytbl6             | tsplog1 => Default tablespace
(8 rows)

rollback;
-- case when both groups are logging
-- should not work, because myGroup2 is missing in the groups list and both groups are in LOGGING state
select emaj.emaj_alter_group('myGroup1', 'move to myGroup1');
WARNING:  _alter_groups: in the group "myGroup1", the table or sequence myschema2."myTbl3" already belongs to the group "myGroup2".
WARNING:  _alter_groups: in the group "myGroup1", the table or sequence myschema2."myTbl3_col31_seq" already belongs to the group "myGroup2".
ERROR:  _alter_groups: One or several errors have been detected in the emaj_group_def table content.
CONTEXT:  PL/pgSQL function emaj._alter_groups(text[],boolean,text) line 31 at RAISE
PL/pgSQL function emaj.emaj_alter_group(text,text) line 6 at RETURN
-- should be OK
-- generates updates before the group change
select emaj.emaj_set_mark_groups('{"myGroup1","myGroup2"}','before move');
 emaj_set_mark_groups 
----------------------
                   15
(1 row)

update myschema2."myTbl3" set col32 = col32 + '1 day' where col31 >= 8;
select emaj.emaj_alter_groups('{"myGroup1","myGroup2"}', 'move to myGroup1');
WARNING:  _check_fk_groups: The foreign key "mytbl6_col61_fkey" on the table "myschema2.mytbl6" references the table "myschema2.mytbl7" that is outside the groups (myGroup1,myGroup2).
WARNING:  _check_fk_groups: The table "myschema2.mytbl6" is referenced by the foreign key "mytbl8_col81_fkey" on the table "myschema2.mytbl8" that is outside the groups (myGroup1,myGroup2).
 emaj_alter_groups 
-------------------
                15
(1 row)

select * from emaj.emaj_relation where rel_schema = 'myschema2' and (rel_tblseq = 'myTbl3' or rel_tblseq = 'myTbl3_col31_seq') order by 1,2,3,4;
 rel_schema |    rel_tblseq    | rel_time_range | rel_group | rel_kind | rel_priority | rel_log_schema | rel_log_table | rel_log_dat_tsp | rel_log_index  | rel_log_idx_tsp | rel_log_sequence | rel_log_function |        rel_sql_columns        | rel_sql_pk_columns | rel_sql_pk_eq_conditions | rel_log_seq_last_value | rel_emaj_verb_attnum 
------------+------------------+----------------+-----------+----------+--------------+----------------+---------------+-----------------+----------------+-----------------+------------------+------------------+-------------------------------+--------------------+--------------------------+------------------------+----------------------
 myschema2  | myTbl3           | [6046,6120)    | myGroup2  | r        |              | emaj_myschema2 | myTbl3_log    | tsplog1         | myTbl3_log_idx | tsplog1         | myTbl3_log_seq   | myTbl3_log_fnct  | tbl.col31,tbl.col32,tbl.col33 | col31              | tbl.col31 = keys.col31   |                        |                    4
 myschema2  | myTbl3           | [6120,)        | myGroup1  | r        |              | emaj_myschema2 | myTbl3_log    | tsplog1         | myTbl3_log_idx | tsplog1         | myTbl3_log_seq   | myTbl3_log_fnct  | tbl.col31,tbl.col32,tbl.col33 | col31              | tbl.col31 = keys.col31   |                        |                    4
 myschema2  | myTbl3_col31_seq | [6046,6120)    | myGroup2  | S        |              |                |               |                 |                |                 |                  |                  |                               |                    |                          |                        |                     
 myschema2  | myTbl3_col31_seq | [6120,)        | myGroup1  | S        |              |                |               |                 |                |                 |                  |                  |                               |                    |                          |                        |                     
(4 rows)

-- perform various tasks on the groups
select emaj.emaj_set_mark_groups('{"myGroup1","myGroup2"}','after move');
 emaj_set_mark_groups 
----------------------
                   15
(1 row)

update myschema2."myTbl3" set col33 = 12.0 where col31 >= 9;
select  stat_group, stat_schema, stat_table, stat_first_mark, stat_last_mark, stat_rows
  from emaj.emaj_log_stat_groups('{"myGroup1","myGroup2"}', 'before move', NULL)
  where stat_schema = 'myschema2' and stat_table = 'myTbl3';
 stat_group | stat_schema | stat_table | stat_first_mark  |  stat_last_mark  | stat_rows 
------------+-------------+------------+------------------+------------------+-----------
 myGroup2   | myschema2   | myTbl3     | before move      | move to myGroup1 |         3
 myGroup1   | myschema2   | myTbl3     | move to myGroup1 |                  |         2
(2 rows)

select  stat_group, stat_schema, stat_table, stat_first_mark, stat_last_mark, stat_verb, stat_role, stat_rows
  from emaj.emaj_detailed_log_stat_groups('{"myGroup1","myGroup2"}', 'before move', NULL) where stat_schema = 'myschema2' and stat_table = 'myTbl3';
 stat_group | stat_schema | stat_table | stat_first_mark  |  stat_last_mark  | stat_verb | stat_role | stat_rows 
------------+-------------+------------+------------------+------------------+-----------+-----------+-----------
 myGroup2   | myschema2   | myTbl3     | before move      | move to myGroup1 | UPDATE    | postgres  |         3
 myGroup1   | myschema2   | myTbl3     | move to myGroup1 |                  | UPDATE    | postgres  |         2
(2 rows)

-- generate a sql script crossing the move (before rollback)
select emaj.emaj_gen_sql_groups('{"myGroup1","myGroup2"}', 'before move', NULL, '/tmp/emaj_test/alter/myFile',
  array['myschema2.myTbl3','myschema2.myTbl3_col31_seq']);
 emaj_gen_sql_groups 
---------------------
                   4
(1 row)

\! rm /tmp/emaj_test/alter/*
-- rollback to a mark set after the group change
select * from emaj.emaj_logged_rollback_groups('{"myGroup1","myGroup2"}','after move');
WARNING:  _check_fk_groups: The foreign key "mytbl6_col61_fkey" on the table "myschema2.mytbl6" references the table "myschema2.mytbl7" that is outside the groups (myGroup1,myGroup2).
WARNING:  _check_fk_groups: The table "myschema2.mytbl6" is referenced by the foreign key "mytbl8_col81_fkey" on the table "myschema2.mytbl8" that is outside the groups (myGroup1,myGroup2).
 emaj_logged_rollback_groups 
-----------------------------
                           5
(1 row)

-- rollback to a mark set before the group change
select rlbk_severity, regexp_replace(rlbk_message,E'\\d\\d\\d\\d/\\d\\d\\/\\d\\d\\ \\d\\d\\:\\d\\d:\\d\\d .*?\\)','<timestamp>)','g')
  from emaj.emaj_rollback_groups('{"myGroup1","myGroup2"}','before move',true);
WARNING:  _check_fk_groups: The foreign key "mytbl6_col61_fkey" on the table "myschema2.mytbl6" references the table "myschema2.mytbl7" that is outside the groups (myGroup1,myGroup2).
WARNING:  _check_fk_groups: The table "myschema2.mytbl6" is referenced by the foreign key "mytbl8_col81_fkey" on the table "myschema2.mytbl8" that is outside the groups (myGroup1,myGroup2).
 rlbk_severity |                                                     regexp_replace                                                     
---------------+------------------------------------------------------------------------------------------------------------------------
 Notice        | 1 / 11 tables effectively processed.
 Notice        | 4 sequences processed.
 Warning       | Tables group change not rolled back: log data tablespace for myschema2."myTbl3"
 Warning       | Tables group change not rolled back: log index tablespace for myschema2."myTbl3"
 Warning       | The table myschema2."myTbl3" has only been rolled back to its latest group attachment (<timestamp>)
 Warning       | The sequence myschema2."myTbl3_col31_seq" has only been rolled back to its latest group attachment state (<timestamp>)
(6 rows)

-- generate a sql script crossing the move (after rollback)
select emaj.emaj_gen_sql_group('myGroup1', 'before move', NULL, '/tmp/emaj_test/alter/myFile',
  array['myschema2.myTbl3','myschema2.myTbl3_col31_seq']);
ERROR:  _gen_sql_groups: 2 tables/sequences (myschema2.myTbl3, myschema2.myTbl3_col31_seq) did not belong to any of the selected tables groups at before move mark time.
CONTEXT:  PL/pgSQL function emaj._gen_sql_groups(text[],boolean,text,text,text,text[]) line 99 at RAISE
PL/pgSQL function emaj.emaj_gen_sql_group(text,text,text,text,text[]) line 13 at RETURN
select emaj.emaj_gen_sql_groups('{"myGroup1","myGroup2"}', 'before move', NULL, '/tmp/emaj_test/alter/myFile',
  array['myschema2.myTbl3','myschema2.myTbl3_col31_seq']);
 emaj_gen_sql_groups 
---------------------
                   4
(1 row)

\! rm -R /tmp/emaj_test
-- revert the emaj_group_def change and apply with a destination group in idle state
update emaj.emaj_group_def set grpdef_group = 'myGroup2'
  where grpdef_group = 'myGroup1' and grpdef_schema = 'myschema2' and grpdef_tblseq = 'myTbl3_col31_seq';
update emaj.emaj_group_def set grpdef_group = 'myGroup2', grpdef_log_dat_tsp = NULL, grpdef_log_idx_tsp = NULL
  where grpdef_group = 'myGroup1' and grpdef_schema = 'myschema2' and grpdef_tblseq = 'myTbl3';
select emaj.emaj_stop_group('myGroup2');
 emaj_stop_group 
-----------------
               6
(1 row)

select emaj.emaj_alter_groups('{"myGroup1","myGroup2"}', 'back to idle myGroup2');
WARNING:  _check_fk_groups: The foreign key "mytbl6_col61_fkey" on the table "myschema2.mytbl6" references the table "myschema2.mytbl7" that is outside the groups (myGroup1,myGroup2).
WARNING:  _check_fk_groups: The table "myschema2.mytbl6" is referenced by the foreign key "mytbl8_col81_fkey" on the table "myschema2.mytbl8" that is outside the groups (myGroup1,myGroup2).
 emaj_alter_groups 
-------------------
                15
(1 row)

-----------------------------
-- remove and add tables and sequences without updating emaj_group_def
-----------------------------
select emaj.emaj_start_group('myGroup2','Start');
WARNING:  _check_fk_groups: The foreign key "mytbl6_col61_fkey" on the table "myschema2.mytbl6" references the table "myschema2.mytbl7" that is outside the groups (myGroup2).
WARNING:  _check_fk_groups: The table "myschema2.mytbl6" is referenced by the foreign key "mytbl8_col81_fkey" on the table "myschema2.mytbl8" that is outside the groups (myGroup2).
 emaj_start_group 
------------------
                8
(1 row)

insert into myschema2.mytbl1 values (100, 'Started', E'\\000'::bytea);
select nextval('myschema2.myseq1');
 nextval 
---------
    1000
(1 row)

-- remove and assign somes tables and sequences in a single transaction
begin;
  select emaj.emaj_remove_tables('myschema2','{"mytbl1","mytbl2","myTbl3"}'::text[],'REMOVE_3_TABLES');
 emaj_remove_tables 
--------------------
                  3
(1 row)

  select emaj.emaj_remove_sequence('myschema2','myseq1','REMOVE_1_SEQUENCES');
 emaj_remove_sequence 
----------------------
                    1
(1 row)

  select emaj.emaj_assign_tables('myschema2','{"mytbl1","mytbl2","myTbl3"}'::text[],'myGroup2',null,'ASSIGN_3_TABLES');
NOTICE:  table "myTbl3_log" does not exist, skipping
NOTICE:  trigger "emaj_log_trg" for relation "myschema2.myTbl3" does not exist, skipping
NOTICE:  trigger "emaj_trunc_trg" for relation "myschema2.myTbl3" does not exist, skipping
NOTICE:  table "mytbl1_log" does not exist, skipping
NOTICE:  trigger "emaj_log_trg" for relation "myschema2.mytbl1" does not exist, skipping
NOTICE:  trigger "emaj_trunc_trg" for relation "myschema2.mytbl1" does not exist, skipping
NOTICE:  table "mytbl2_log" does not exist, skipping
NOTICE:  trigger "emaj_log_trg" for relation "myschema2.mytbl2" does not exist, skipping
NOTICE:  trigger "emaj_trunc_trg" for relation "myschema2.mytbl2" does not exist, skipping
WARNING:  _check_fk_groups: The foreign key "mytbl6_col61_fkey" on the table "myschema2.mytbl6" references the table "myschema2.mytbl7" that is outside the groups (myGroup2).
WARNING:  _check_fk_groups: The table "myschema2.mytbl6" is referenced by the foreign key "mytbl8_col81_fkey" on the table "myschema2.mytbl8" that is outside the groups (myGroup2).
 emaj_assign_tables 
--------------------
                  3
(1 row)

  select emaj.emaj_assign_sequences('myschema2','{"myseq1","myseq2"}'::text[],'myGroup2',null,'ASSIGN_2_SEQUENCES');
 emaj_assign_sequences 
-----------------------
                     2
(1 row)

  insert into myschema2.mytbl1 values (110, 'Assigned', E'\\000'::bytea);
  select nextval('myschema2.myseq1');
 nextval 
---------
    1001
(1 row)

  -- what if some (all but the emaj sequence) emaj components are missing at remove_table time ?
  select emaj.emaj_disable_protection_by_event_triggers();
 emaj_disable_protection_by_event_triggers 
-------------------------------------------
                                         3
(1 row)

  drop table emaj_myschema2.mytbl1_log;
  drop function emaj_myschema2.mytbl1_log_fnct() cascade;
NOTICE:  drop cascades to trigger emaj_log_trg on table myschema2.mytbl1
  select emaj.emaj_enable_protection_by_event_triggers();
 emaj_enable_protection_by_event_triggers 
------------------------------------------
                                        3
(1 row)

  select emaj.emaj_remove_tables('myschema2','{"mytbl1","mytbl2","myTbl3"}');
NOTICE:  relation "mytbl1_log" does not exist, skipping
NOTICE:  relation "mytbl1_log_idx" does not exist, skipping
NOTICE:  trigger "emaj_log_trg" for relation "myschema2.mytbl1" does not exist, skipping
NOTICE:  function emaj_myschema2.mytbl1_log_fnct() does not exist, skipping
 emaj_remove_tables 
--------------------
                  3
(1 row)

  select emaj.emaj_remove_sequences('myschema2','{"myseq1","myseq2"}');
 emaj_remove_sequences 
-----------------------
                     2
(1 row)

  select emaj.emaj_assign_tables('myschema2','{"mytbl1","mytbl2","myTbl3"}','myGroup2',
                                 '{"priority":1, "log_data_tablespace":"tsplog1", "log_index_tablespace":"tsplog1"}'::jsonb);
NOTICE:  table "myTbl3_log" does not exist, skipping
NOTICE:  trigger "emaj_log_trg" for relation "myschema2.myTbl3" does not exist, skipping
NOTICE:  trigger "emaj_trunc_trg" for relation "myschema2.myTbl3" does not exist, skipping
NOTICE:  table "mytbl1_log" does not exist, skipping
NOTICE:  trigger "emaj_log_trg" for relation "myschema2.mytbl1" does not exist, skipping
NOTICE:  trigger "emaj_trunc_trg" for relation "myschema2.mytbl1" does not exist, skipping
NOTICE:  table "mytbl2_log" does not exist, skipping
NOTICE:  trigger "emaj_log_trg" for relation "myschema2.mytbl2" does not exist, skipping
NOTICE:  trigger "emaj_trunc_trg" for relation "myschema2.mytbl2" does not exist, skipping
WARNING:  _check_fk_groups: The foreign key "mytbl6_col61_fkey" on the table "myschema2.mytbl6" references the table "myschema2.mytbl7" that is outside the groups (myGroup2).
WARNING:  _check_fk_groups: The table "myschema2.mytbl6" is referenced by the foreign key "mytbl8_col81_fkey" on the table "myschema2.mytbl8" that is outside the groups (myGroup2).
 emaj_assign_tables 
--------------------
                  3
(1 row)

  select emaj.emaj_assign_sequences('myschema2','{"myseq1","myseq2"}','myGroup2');
 emaj_assign_sequences 
-----------------------
                     2
(1 row)

commit;
-- alter a table in a logging group
select emaj.emaj_remove_table('myschema1','mytbl4');
 emaj_remove_table 
-------------------
                 1
(1 row)

alter table myschema1.mytbl4 alter column col45 type varchar(15);
select emaj.emaj_assign_table('myschema1','mytbl4','myGroup1');
NOTICE:  table "mytbl4_log" does not exist, skipping
NOTICE:  trigger "emaj_log_trg" for relation "myschema1.mytbl4" does not exist, skipping
NOTICE:  trigger "emaj_trunc_trg" for relation "myschema1.mytbl4" does not exist, skipping
 emaj_assign_table 
-------------------
                 1
(1 row)

begin;
  select emaj.emaj_remove_table('myschema1','mytbl4');
 emaj_remove_table 
-------------------
                 1
(1 row)

  alter table myschema1.mytbl4 alter column col45 type varchar(10);
  select emaj.emaj_assign_table('myschema1','mytbl4','myGroup1');
NOTICE:  table "mytbl4_log" does not exist, skipping
NOTICE:  trigger "emaj_log_trg" for relation "myschema1.mytbl4" does not exist, skipping
NOTICE:  trigger "emaj_trunc_trg" for relation "myschema1.mytbl4" does not exist, skipping
 emaj_assign_table 
-------------------
                 1
(1 row)

commit;
-- checks
select count(*) from emaj.emaj_mark where mark_group = 'myGroup2' and (mark_name like 'REMOVE%' or mark_name like 'ASSIGN%');
 count 
-------
     8
(1 row)

select * from emaj.emaj_relation where rel_schema = 'myschema2' and rel_tblseq in ('mytbl1','mytbl2','myTbl3','myseq1','myseq2')
  order by rel_schema, rel_tblseq, rel_time_range;
 rel_schema | rel_tblseq | rel_time_range | rel_group | rel_kind | rel_priority | rel_log_schema | rel_log_table | rel_log_dat_tsp |  rel_log_index   | rel_log_idx_tsp | rel_log_sequence | rel_log_function |        rel_sql_columns        | rel_sql_pk_columns |             rel_sql_pk_eq_conditions              | rel_log_seq_last_value | rel_emaj_verb_attnum 
------------+------------+----------------+-----------+----------+--------------+----------------+---------------+-----------------+------------------+-----------------+------------------+------------------+-------------------------------+--------------------+---------------------------------------------------+------------------------+----------------------
 myschema2  | myTbl3     | [6120,6126)    | myGroup1  | r        |              | emaj_myschema2 | myTbl3_log    |                 | myTbl3_log_idx   |                 | myTbl3_log_seq   | myTbl3_log_fnct  | tbl.col31,tbl.col32,tbl.col33 | col31              | tbl.col31 = keys.col31                            |                        |                    4
 myschema2  | myTbl3     | [6126,6128)    | myGroup2  | r        |              | emaj_myschema2 | myTbl3_log_1  |                 | myTbl3_log_idx_1 |                 | myTbl3_log_seq   |                  |                               |                    |                                                   |                     10 |                    4
 myschema2  | myTbl3     | [6130,6132)    | myGroup2  | r        |              | emaj_myschema2 | myTbl3_log_2  |                 | myTbl3_log_idx_2 |                 | myTbl3_log_seq   |                  |                               |                    |                                                   |                     10 |                    4
 myschema2  | myTbl3     | [6134,)        | myGroup2  | r        |            1 | emaj_myschema2 | myTbl3_log    | tsplog1         | myTbl3_log_idx   | tsplog1         | myTbl3_log_seq   | myTbl3_log_fnct  | tbl.col31,tbl.col32,tbl.col33 | col31              | tbl.col31 = keys.col31                            |                        |                    4
 myschema2  | myseq1     | [6008,6129)    | myGroup2  | S        |              |                |               |                 |                  |                 |                  |                  |                               |                    |                                                   |                        |                     
 myschema2  | myseq1     | [6131,6133)    | myGroup2  | S        |              |                |               |                 |                  |                 |                  |                  |                               |                    |                                                   |                        |                     
 myschema2  | myseq1     | [6135,)        | myGroup2  | S        |              |                |               |                 |                  |                 |                  |                  |                               |                    |                                                   |                        |                     
 myschema2  | myseq2     | [6131,6133)    | myGroup2  | S        |              |                |               |                 |                  |                 |                  |                  |                               |                    |                                                   |                        |                     
 myschema2  | myseq2     | [6135,)        | myGroup2  | S        |              |                |               |                 |                  |                 |                  |                  |                               |                    |                                                   |                        |                     
 myschema2  | mytbl1     | [6008,6128)    | myGroup2  | r        |              | emaj_myschema2 | mytbl1_log_1  |                 | mytbl1_log_idx_1 |                 | mytbl1_log_seq   |                  |                               |                    |                                                   |                      1 |                    4
 myschema2  | mytbl1     | [6130,6132)    | myGroup2  | r        |              | emaj_myschema2 | mytbl1_log_2  |                 | mytbl1_log_idx_2 |                 | mytbl1_log_seq   |                  |                               |                    |                                                   |                      2 |                    4
 myschema2  | mytbl1     | [6134,)        | myGroup2  | r        |            1 | emaj_myschema2 | mytbl1_log    | tsplog1         | mytbl1_log_idx   | tsplog1         | mytbl1_log_seq   | mytbl1_log_fnct  | tbl.col11,tbl.col12,tbl.col13 | col11,col12        | tbl.col11 = keys.col11 AND tbl.col12 = keys.col12 |                        |                    4
 myschema2  | mytbl2     | [6008,6128)    | myGroup2  | r        |              | emaj_myschema2 | mytbl2_log_1  |                 | mytbl2_log_idx_1 |                 | mytbl2_log_seq   |                  |                               |                    |                                                   |                      0 |                    4
 myschema2  | mytbl2     | [6130,6132)    | myGroup2  | r        |              | emaj_myschema2 | mytbl2_log_2  |                 | mytbl2_log_idx_2 |                 | mytbl2_log_seq   |                  |                               |                    |                                                   |                      0 |                    4
 myschema2  | mytbl2     | [6134,)        | myGroup2  | r        |            1 | emaj_myschema2 | mytbl2_log    | tsplog1         | mytbl2_log_idx   | tsplog1         | mytbl2_log_seq   | mytbl2_log_fnct  | tbl.col21,tbl.col22,tbl.col23 | col21              | tbl.col21 = keys.col21                            |                        |                    4
(15 rows)

select sequ_schema, sequ_name, sequ_time_id, sequ_last_val, sequ_is_called from emaj.emaj_sequence
  where sequ_schema = 'emaj_myschema2' and sequ_name = 'mytbl1_log_seq' order by sequ_name, sequ_time_id;
  sequ_schema   |   sequ_name    | sequ_time_id | sequ_last_val | sequ_is_called 
----------------+----------------+--------------+---------------+----------------
 emaj_myschema2 | mytbl1_log_seq |         6127 |             1 | f
 emaj_myschema2 | mytbl1_log_seq |         6128 |             1 | t
 emaj_myschema2 | mytbl1_log_seq |         6130 |             2 | f
 emaj_myschema2 | mytbl1_log_seq |         6131 |             2 | f
 emaj_myschema2 | mytbl1_log_seq |         6132 |             2 | t
 emaj_myschema2 | mytbl1_log_seq |         6134 |             3 | f
 emaj_myschema2 | mytbl1_log_seq |         6135 |             3 | f
(7 rows)

select sequ_schema, sequ_name, sequ_time_id, sequ_last_val, sequ_is_called from emaj.emaj_sequence
  where sequ_schema = 'myschema2' and sequ_name like 'myseq%' order by sequ_name, sequ_time_id;
 sequ_schema | sequ_name | sequ_time_id | sequ_last_val | sequ_is_called 
-------------+-----------+--------------+---------------+----------------
 myschema2   | myseq1    |         6127 |          1000 | f
 myschema2   | myseq1    |         6128 |          1000 | t
 myschema2   | myseq1    |         6129 |          1000 | t
 myschema2   | myseq1    |         6131 |          1000 | t
 myschema2   | myseq1    |         6132 |          1001 | t
 myschema2   | myseq1    |         6133 |          1001 | t
 myschema2   | myseq1    |         6135 |          1001 | t
 myschema2   | myseq2    |         6131 |             3 | f
 myschema2   | myseq2    |         6132 |             3 | f
 myschema2   | myseq2    |         6133 |             3 | f
 myschema2   | myseq2    |         6135 |             3 | f
(11 rows)

-----------------------------
-- test end: check
-----------------------------
select emaj.emaj_force_drop_group('myGroup1');
 emaj_force_drop_group 
-----------------------
                     7
(1 row)

select emaj.emaj_force_drop_group('myGroup2');
NOTICE:  table "myTbl3_log" does not exist, skipping
NOTICE:  table "mytbl1_log_2" does not exist, skipping
 emaj_force_drop_group 
-----------------------
                     9
(1 row)

select emaj.emaj_force_drop_group('myGroup4');
 emaj_force_drop_group 
-----------------------
                     5
(1 row)

select nspname from pg_namespace where nspname like 'emaj%' order by nspname;
 nspname 
---------
 emaj
(1 row)

select sch_name from emaj.emaj_schema order by 1;
 sch_name 
----------
 emaj
(1 row)

select hist_function, hist_event, hist_object,
       regexp_replace(regexp_replace(regexp_replace(hist_wording,
            E'\\d\\d\.\\d\\d\\.\\d\\d\\.\\d\\d\\d\\d','%','g'),
            E'\\d\\d\\d\\d/\\d\\d\\/\\d\\d\\ \\d\\d\\:\\d\\d:\\d\\d .*?\\)','<timestamp>)','g'),
            E'\\[.+\\]','(timestamp)','g'), 
       hist_user 
  from emaj.emaj_hist where hist_id > 6000 order by hist_id;
      hist_function      |          hist_event          |         hist_object          |                                                     regexp_replace                                                     | hist_user 
-------------------------+------------------------------+------------------------------+------------------------------------------------------------------------------------------------------------------------+-----------
 LOCK_GROUP              | BEGIN                        | myGroup1                     |                                                                                                                        | postgres
 LOCK_GROUP              | END                          | myGroup1                     | 5 tables locked, 0 deadlock(s)                                                                                         | postgres
 SET_MARK_GROUP          | BEGIN                        | myGroup1                     | STOP_%                                                                                                                 | postgres
 SET_MARK_GROUP          | END                          | myGroup1                     | STOP_%                                                                                                                 | postgres
 STOP_GROUP              | END                          | myGroup1                     | 7 tables/sequences processed                                                                                           | postgres
 RESET_GROUP             | BEGIN                        | myGroup1                     |                                                                                                                        | postgres
 RESET_GROUP             | END                          | myGroup1                     | 7 tables/sequences processed                                                                                           | postgres
 DROP_GROUP              | BEGIN                        | myGroup1                     |                                                                                                                        | postgres
 DROP_GROUP              | LOG_SCHEMA DROPPED           | emaj_myschema1               |                                                                                                                        | postgres
 DROP_GROUP              | END                          | myGroup1                     | 7 tables/sequences processed                                                                                           | postgres
 FORCE_DROP_GROUP        | BEGIN                        | myGroup2                     |                                                                                                                        | postgres
 FORCE_DROP_GROUP        | LOG_SCHEMA DROPPED           | emaj_myschema2               |                                                                                                                        | postgres
 FORCE_DROP_GROUP        | END                          | myGroup2                     | 8 tables/sequences processed                                                                                           | postgres
 STOP_GROUP              | BEGIN                        | phil's group#3",             |                                                                                                                        | postgres
 LOCK_GROUP              | BEGIN                        | phil's group#3",             |                                                                                                                        | postgres
 LOCK_GROUP              | END                          | phil's group#3",             | 2 tables locked, 0 deadlock(s)                                                                                         | postgres
 SET_MARK_GROUP          | BEGIN                        | phil's group#3",             | Simple stop mark                                                                                                       | postgres
 SET_MARK_GROUP          | END                          | phil's group#3",             | Simple stop mark                                                                                                       | postgres
 STOP_GROUP              | END                          | phil's group#3",             | 4 tables/sequences processed                                                                                           | postgres
 DROP_GROUP              | BEGIN                        | phil's group#3",             |                                                                                                                        | postgres
 DROP_GROUP              | LOG_SCHEMA DROPPED           | "emaj_phil's schema3"        |                                                                                                                        | postgres
 DROP_GROUP              | END                          | phil's group#3",             | 4 tables/sequences processed                                                                                           | postgres
 FORCE_STOP_GROUP        | BEGIN                        | myGroup4                     |                                                                                                                        | postgres
 LOCK_GROUP              | BEGIN                        | myGroup4                     |                                                                                                                        | postgres
 LOCK_GROUP              | END                          | myGroup4                     | 5 tables locked, 0 deadlock(s)                                                                                         | postgres
 FORCE_STOP_GROUP        | END                          | myGroup4                     | 5 tables/sequences processed                                                                                           | postgres
 DROP_GROUP              | BEGIN                        | myGroup4                     |                                                                                                                        | postgres
 DROP_GROUP              | LOG_SCHEMA DROPPED           | emaj_myschema4               |                                                                                                                        | postgres
 DROP_GROUP              | END                          | myGroup4                     | 5 tables/sequences processed                                                                                           | postgres
 FORCE_STOP_GROUP        | BEGIN                        | emptyGroup                   |                                                                                                                        | postgres
 LOCK_GROUP              | BEGIN                        | emptyGroup                   |                                                                                                                        | postgres
 LOCK_GROUP              | END                          | emptyGroup                   | 0 tables locked, 0 deadlock(s)                                                                                         | postgres
 FORCE_STOP_GROUP        | END                          | emptyGroup                   | 0 tables/sequences processed                                                                                           | postgres
 DROP_GROUP              | BEGIN                        | emptyGroup                   |                                                                                                                        | postgres
 DROP_GROUP              | END                          | emptyGroup                   | 0 tables/sequences processed                                                                                           | postgres
 CREATE_GROUP            | BEGIN                        | myGroup1                     | rollbackable                                                                                                           | postgres
 CREATE_GROUP            | LOG_SCHEMA CREATED           | emaj_myschema1               |                                                                                                                        | postgres
 CREATE_GROUP            | END                          | myGroup1                     | 7 tables/sequences processed                                                                                           | postgres
 CREATE_GROUP            | BEGIN                        | myGroup2                     | rollbackable                                                                                                           | postgres
 CREATE_GROUP            | LOG_SCHEMA CREATED           | emaj_myschema2               |                                                                                                                        | postgres
 CREATE_GROUP            | END                          | myGroup2                     | 8 tables/sequences processed                                                                                           | postgres
 CREATE_GROUP            | BEGIN                        | emptyGroup                   | rollbackable                                                                                                           | postgres
 CREATE_GROUP            | END                          | emptyGroup                   | 0 tables/sequences processed                                                                                           | postgres
 CREATE_GROUP            | BEGIN                        | myGroup4                     | rollbackable                                                                                                           | postgres
 CREATE_GROUP            | LOG_SCHEMA CREATED           | emaj_myschema4               |                                                                                                                        | postgres
 CREATE_GROUP            | END                          | myGroup4                     | 5 tables/sequences processed                                                                                           | postgres
 ALTER_GROUP             | BEGIN                        | emptyGroup                   |                                                                                                                        | postgres
 ALTER_GROUP             | END                          | emptyGroup                   | Timestamp Id : 6013                                                                                                    | postgres
 ALTER_GROUP             | BEGIN                        | myGroup1                     |                                                                                                                        | postgres
 ALTER_GROUP             | END                          | myGroup1                     | Timestamp Id : 6014                                                                                                    | postgres
 ALTER_GROUP             | BEGIN                        | myGroup1                     |                                                                                                                        | postgres
 ALTER_GROUP             | TABLE REMOVED                | myschema1."myTbl3"           | From the group myGroup1                                                                                                | postgres
 ALTER_GROUP             | TABLE REMOVED                | myschema1.mytbl4             | From the group myGroup1                                                                                                | postgres
 ALTER_GROUP             | TABLE REMOVED                | myschema1.mytbl2b            | From the group myGroup1                                                                                                | postgres
 ALTER_GROUP             | END                          | myGroup1                     | Timestamp Id : 6015                                                                                                    | postgres
 ALTER_GROUP             | BEGIN                        | myGroup1                     |                                                                                                                        | postgres
 ALTER_GROUP             | SEQUENCE REMOVED             | myschema1."myTbl3_col31_seq" | From the group myGroup1                                                                                                | postgres
 ALTER_GROUP             | END                          | myGroup1                     | Timestamp Id : 6016                                                                                                    | postgres
 ALTER_GROUP             | BEGIN                        | myGroup1                     |                                                                                                                        | postgres
 ALTER_GROUP             | TABLE ADDED                  | myschema1."myTbl3"           | To the group myGroup1                                                                                                  | postgres
 ALTER_GROUP             | TABLE ADDED                  | myschema1.mytbl4             | To the group myGroup1                                                                                                  | postgres
 ALTER_GROUP             | TABLE ADDED                  | myschema1.mytbl2b            | To the group myGroup1                                                                                                  | postgres
 ALTER_GROUP             | END                          | myGroup1                     | Timestamp Id : 6017                                                                                                    | postgres
 ALTER_GROUP             | BEGIN                        | myGroup1                     |                                                                                                                        | postgres
 ALTER_GROUP             | SEQUENCE ADDED               | myschema1."myTbl3_col31_seq" | To the group myGroup1                                                                                                  | postgres
 ALTER_GROUP             | END                          | myGroup1                     | Timestamp Id : 6018                                                                                                    | postgres
 ALTER_GROUP             | BEGIN                        | myGroup1                     |                                                                                                                        | postgres
 ALTER_GROUP             | LOG DATA TABLESPACE CHANGED  | myschema1.mytbl2b            | tsp log'2 => Default tablespace                                                                                        | postgres
 ALTER_GROUP             | END                          | myGroup1                     | Timestamp Id : 6019                                                                                                    | postgres
 ALTER_GROUP             | BEGIN                        | myGroup1                     |                                                                                                                        | postgres
 ALTER_GROUP             | LOG DATA TABLESPACE CHANGED  | myschema1.mytbl2b            | Default tablespace => tsp log'2                                                                                        | postgres
 ALTER_GROUP             | END                          | myGroup1                     | Timestamp Id : 6020                                                                                                    | postgres
 ALTER_GROUP             | BEGIN                        | myGroup1                     |                                                                                                                        | postgres
 ALTER_GROUP             | LOG DATA TABLESPACE CHANGED  | myschema1."myTbl3"           | tsplog1 => tsp log'2                                                                                                   | postgres
 ALTER_GROUP             | LOG DATA TABLESPACE CHANGED  | myschema1.mytbl1             | Default tablespace => tsplog1                                                                                          | postgres
 ALTER_GROUP             | LOG DATA TABLESPACE CHANGED  | myschema1.mytbl4             | tsplog1 => tsp log'2                                                                                                   | postgres
 ALTER_GROUP             | LOG DATA TABLESPACE CHANGED  | myschema1.mytbl2             | tsplog1 => tsp log'2                                                                                                   | postgres
 ALTER_GROUP             | LOG DATA TABLESPACE CHANGED  | myschema1.mytbl2b            | tsp log'2 => Default tablespace                                                                                        | postgres
 ALTER_GROUP             | END                          | myGroup1                     | Timestamp Id : 6021                                                                                                    | postgres
 ALTER_GROUP             | BEGIN                        | myGroup1                     |                                                                                                                        | postgres
 ALTER_GROUP             | LOG DATA TABLESPACE CHANGED  | myschema1."myTbl3"           | tsp log'2 => tsplog1                                                                                                   | postgres
 ALTER_GROUP             | LOG DATA TABLESPACE CHANGED  | myschema1.mytbl1             | tsplog1 => Default tablespace                                                                                          | postgres
 ALTER_GROUP             | LOG DATA TABLESPACE CHANGED  | myschema1.mytbl4             | tsp log'2 => tsplog1                                                                                                   | postgres
 ALTER_GROUP             | LOG DATA TABLESPACE CHANGED  | myschema1.mytbl2             | tsp log'2 => tsplog1                                                                                                   | postgres
 ALTER_GROUP             | LOG DATA TABLESPACE CHANGED  | myschema1.mytbl2b            | Default tablespace => tsp log'2                                                                                        | postgres
 ALTER_GROUP             | END                          | myGroup1                     | Timestamp Id : 6022                                                                                                    | postgres
 ALTER_GROUP             | BEGIN                        | myGroup1                     |                                                                                                                        | postgres
 ALTER_GROUP             | LOG INDEX TABLESPACE CHANGED | myschema1.mytbl2b            | tsp log'2 => Default tablespace                                                                                        | postgres
 ALTER_GROUP             | END                          | myGroup1                     | Timestamp Id : 6023                                                                                                    | postgres
 ALTER_GROUP             | BEGIN                        | myGroup1                     |                                                                                                                        | postgres
 ALTER_GROUP             | LOG INDEX TABLESPACE CHANGED | myschema1.mytbl2b            | Default tablespace => tsp log'2                                                                                        | postgres
 ALTER_GROUP             | END                          | myGroup1                     | Timestamp Id : 6024                                                                                                    | postgres
 ALTER_GROUP             | BEGIN                        | myGroup1                     |                                                                                                                        | postgres
 ALTER_GROUP             | END                          | myGroup1                     | Timestamp Id : 6025                                                                                                    | postgres
 ALTER_GROUP             | BEGIN                        | myGroup1                     |                                                                                                                        | postgres
 ALTER_GROUP             | END                          | myGroup1                     | Timestamp Id : 6026                                                                                                    | postgres
 ALTER_GROUP             | BEGIN                        | myGroup1                     |                                                                                                                        | postgres
 ALTER_GROUP             | END                          | myGroup1                     | Timestamp Id : 6027                                                                                                    | postgres
 ALTER_GROUP             | BEGIN                        | myGroup1                     |                                                                                                                        | postgres
 ALTER_GROUP             | END                          | myGroup1                     | Timestamp Id : 6028                                                                                                    | postgres
 ALTER_GROUP             | BEGIN                        | myGroup1                     |                                                                                                                        | postgres
 ALTER_GROUP             | END                          | myGroup1                     | Timestamp Id : 6029                                                                                                    | postgres
 ALTER_GROUP             | BEGIN                        | myGroup1                     |                                                                                                                        | postgres
 ALTER_GROUP             | END                          | myGroup1                     | Timestamp Id : 6030                                                                                                    | postgres
 ALTER_GROUP             | BEGIN                        | myGroup1                     |                                                                                                                        | postgres
 ALTER_GROUP             | END                          | myGroup1                     | Timestamp Id : 6031                                                                                                    | postgres
 ALTER_GROUP             | BEGIN                        | myGroup1                     |                                                                                                                        | postgres
 ALTER_GROUP             | END                          | myGroup1                     | Timestamp Id : 6032                                                                                                    | postgres
 ALTER_GROUP             | BEGIN                        | myGroup1                     |                                                                                                                        | postgres
 ALTER_GROUP             | TABLE REMOVED                | myschema1.mytbl1             | From the group myGroup1                                                                                                | postgres
 ALTER_GROUP             | TABLE ADDED                  | myschema1.mytbl1_new_name    | To the group myGroup1                                                                                                  | postgres
 ALTER_GROUP             | END                          | myGroup1                     | Timestamp Id : 6033                                                                                                    | postgres
 ALTER_GROUP             | BEGIN                        | myGroup1                     |                                                                                                                        | postgres
 ALTER_GROUP             | LOG_SCHEMA CREATED           | emaj_public                  |                                                                                                                        | postgres
 ALTER_GROUP             | TABLE REMOVED                | myschema1.mytbl1_new_name    | From the group myGroup1                                                                                                | postgres
 ALTER_GROUP             | TABLE ADDED                  | public.mytbl1_new_name       | To the group myGroup1                                                                                                  | postgres
 ALTER_GROUP             | END                          | myGroup1                     | Timestamp Id : 6034                                                                                                    | postgres
 ALTER_GROUP             | BEGIN                        | myGroup1                     |                                                                                                                        | postgres
 ALTER_GROUP             | TABLE REMOVED                | public.mytbl1_new_name       | From the group myGroup1                                                                                                | postgres
 ALTER_GROUP             | TABLE ADDED                  | myschema1.mytbl1             | To the group myGroup1                                                                                                  | postgres
 ALTER_GROUP             | LOG_SCHEMA DROPPED           | emaj_public                  |                                                                                                                        | postgres
 ALTER_GROUP             | END                          | myGroup1                     | Timestamp Id : 6035                                                                                                    | postgres
 DISABLE_PROTECTION      | EVENT TRIGGERS DISABLED      |                              | emaj_protection_trg, emaj_sql_drop_trg, emaj_table_rewrite_trg                                                         | postgres
 ALTER_GROUP             | BEGIN                        | myGroup1                     |                                                                                                                        | postgres
 ALTER_GROUP             | END                          | myGroup1                     | Timestamp Id : 6036                                                                                                    | postgres
 ALTER_GROUP             | BEGIN                        | myGroup1                     |                                                                                                                        | postgres
 ALTER_GROUP             | END                          | myGroup1                     | Timestamp Id : 6037                                                                                                    | postgres
 ALTER_GROUP             | BEGIN                        | myGroup1                     |                                                                                                                        | postgres
 ALTER_GROUP             | END                          | myGroup1                     | Timestamp Id : 6038                                                                                                    | postgres
 ENABLE_PROTECTION       | EVENT TRIGGERS ENABLED       |                              | emaj_protection_trg, emaj_sql_drop_trg, emaj_table_rewrite_trg                                                         | postgres
 ALTER_GROUPS            | BEGIN                        |                              |                                                                                                                        | postgres
 ALTER_GROUPS            | END                          |                              |                                                                                                                        | postgres
 ALTER_GROUPS            | BEGIN                        | myGroup1,myGroup2            |                                                                                                                        | postgres
 ALTER_GROUPS            | TABLE REMOVED                | myschema1."myTbl3"           | From the group myGroup1                                                                                                | postgres
 ALTER_GROUPS            | TABLE REMOVED                | myschema1.mytbl2b            | From the group myGroup1                                                                                                | postgres
 ALTER_GROUPS            | TABLE REMOVED                | myschema2.mytbl4             | From the group myGroup2                                                                                                | postgres
 ALTER_GROUPS            | SEQUENCE REMOVED             | myschema1."myTbl3_col31_seq" | From the group myGroup1                                                                                                | postgres
 ALTER_GROUPS            | END                          | myGroup1,myGroup2            | Timestamp Id : 6041                                                                                                    | postgres
 ALTER_GROUPS            | BEGIN                        | myGroup1,myGroup2            |                                                                                                                        | postgres
 ALTER_GROUPS            | TABLE ADDED                  | myschema1."myTbl3"           | To the group myGroup1                                                                                                  | postgres
 ALTER_GROUPS            | TABLE ADDED                  | myschema1.mytbl2b            | To the group myGroup1                                                                                                  | postgres
 ALTER_GROUPS            | TABLE ADDED                  | myschema2.mytbl4             | To the group myGroup2                                                                                                  | postgres
 ALTER_GROUPS            | SEQUENCE ADDED               | myschema1."myTbl3_col31_seq" | To the group myGroup1                                                                                                  | postgres
 ALTER_GROUPS            | END                          | myGroup1,myGroup2            | Timestamp Id : 6042                                                                                                    | postgres
 ALTER_GROUPS            | BEGIN                        | myGroup1,myGroup2            |                                                                                                                        | postgres
 ALTER_GROUPS            | LOG DATA TABLESPACE CHANGED  | myschema1.mytbl2b            | tsp log'2 => Default tablespace                                                                                        | postgres
 ALTER_GROUPS            | LOG INDEX TABLESPACE CHANGED | myschema2.mytbl6             | Default tablespace => tsplog1                                                                                          | postgres
 ALTER_GROUPS            | END                          | myGroup1,myGroup2            | Timestamp Id : 6043                                                                                                    | postgres
 ALTER_GROUPS            | BEGIN                        | myGroup1,myGroup2            |                                                                                                                        | postgres
 ALTER_GROUPS            | LOG DATA TABLESPACE CHANGED  | myschema1.mytbl2b            | Default tablespace => tsp log'2                                                                                        | postgres
 ALTER_GROUPS            | LOG INDEX TABLESPACE CHANGED | myschema2.mytbl6             | tsplog1 => Default tablespace                                                                                          | postgres
 ALTER_GROUPS            | END                          | myGroup1,myGroup2            | Timestamp Id : 6044                                                                                                    | postgres
 ALTER_GROUPS            | BEGIN                        | myGroup1,myGroup2            |                                                                                                                        | postgres
 ALTER_GROUPS            | TABLE MOVED                  | myschema2."myTbl3"           | From group myGroup2 to group myGroup1                                                                                  | postgres
 ALTER_GROUPS            | SEQUENCE MOVED               | myschema2."myTbl3_col31_seq" | From the group myGroup2 to the group myGroup1                                                                          | postgres
 ALTER_GROUPS            | END                          | myGroup1,myGroup2            | Timestamp Id : 6045                                                                                                    | postgres
 ALTER_GROUPS            | BEGIN                        | myGroup1,myGroup2            |                                                                                                                        | postgres
 ALTER_GROUPS            | TABLE MOVED                  | myschema2."myTbl3"           | From group myGroup1 to group myGroup2                                                                                  | postgres
 ALTER_GROUPS            | SEQUENCE MOVED               | myschema2."myTbl3_col31_seq" | From the group myGroup1 to the group myGroup2                                                                          | postgres
 ALTER_GROUPS            | END                          | myGroup1,myGroup2            | Timestamp Id : 6046                                                                                                    | postgres
 START_GROUPS            | BEGIN                        | myGroup1,myGroup2            | With log reset                                                                                                         | postgres
 LOCK_GROUPS             | BEGIN                        | myGroup1,myGroup2            |                                                                                                                        | postgres
 LOCK_GROUPS             | END                          | myGroup1,myGroup2            | 11 tables locked, 0 deadlock(s)                                                                                        | postgres
 SET_MARK_GROUPS         | BEGIN                        | myGroup1,myGroup2            | Mk1                                                                                                                    | postgres
 SET_MARK_GROUPS         | END                          | myGroup1,myGroup2            | Mk1                                                                                                                    | postgres
 START_GROUPS            | END                          | myGroup1,myGroup2            | 15 tables/sequences processed                                                                                          | postgres
 ADJUST_GROUP_PROPERTIES |                              | emptyGroup                   | Set the group_has_waiting_changes column to false                                                                      | postgres
 ADJUST_GROUP_PROPERTIES |                              | myGroup1                     | Set the group_has_waiting_changes column to true                                                                       | postgres
 ALTER_GROUP             | BEGIN                        | myGroup1                     |                                                                                                                        | postgres
 LOCK_GROUP              | BEGIN                        | myGroup1                     |                                                                                                                        | postgres
 LOCK_GROUP              | END                          | myGroup1                     | 5 tables locked, 0 deadlock(s)                                                                                         | postgres
 SET_MARK_GROUP          | BEGIN                        | myGroup1                     | Priority Changed                                                                                                       | postgres
 SET_MARK_GROUP          | END                          | myGroup1                     | Priority Changed                                                                                                       | postgres
 ALTER_GROUP             | END                          | myGroup1                     | Timestamp Id : 6050                                                                                                    | postgres
 ADJUST_GROUP_PROPERTIES |                              | myGroup1                     | Set the group_has_waiting_changes column to true                                                                       | postgres
 ALTER_GROUPS            | BEGIN                        | myGroup1,myGroup2            |                                                                                                                        | postgres
 LOCK_GROUPS             | BEGIN                        | myGroup1,myGroup2            |                                                                                                                        | postgres
 LOCK_GROUPS             | END                          | myGroup1,myGroup2            | 11 tables locked, 0 deadlock(s)                                                                                        | postgres
 SET_MARK_GROUPS         | BEGIN                        | myGroup1,myGroup2            | Attributes_changed                                                                                                     | postgres
 SET_MARK_GROUPS         | END                          | myGroup1,myGroup2            | Attributes_changed                                                                                                     | postgres
 ALTER_GROUPS            | LOG DATA TABLESPACE CHANGED  | myschema1.mytbl2b            | tsp log'2 => Default tablespace                                                                                        | postgres
 ALTER_GROUPS            | LOG INDEX TABLESPACE CHANGED | myschema2.mytbl6             | Default tablespace => tsplog1                                                                                          | postgres
 ALTER_GROUPS            | END                          | myGroup1,myGroup2            | Timestamp Id : 6051                                                                                                    | postgres
 SET_MARK_GROUPS         | BEGIN                        | myGroup1,myGroup2            | Mk2                                                                                                                    | postgres
 LOCK_GROUPS             | BEGIN                        | myGroup1,myGroup2            |                                                                                                                        | postgres
 LOCK_GROUPS             | END                          | myGroup1,myGroup2            | 11 tables locked, 0 deadlock(s)                                                                                        | postgres
 SET_MARK_GROUPS         | END                          | myGroup1,myGroup2            | Mk2                                                                                                                    | postgres
 ROLLBACK_GROUPS         | BEGIN                        | myGroup1,myGroup2            | Unlogged rollback to mark Mk2 (timestamp)                                                                              | postgres
 DBLINK_OPEN_CNX         |                              | rlbk#1                       | Status = 1                                                                                                             | postgres
 LOCK_GROUP              | BEGIN                        | myGroup1,myGroup2            | Rollback session #1                                                                                                    | postgres
 LOCK_GROUP              | END                          | myGroup1,myGroup2            | Rollback session #1: 11 tables locked, 0 deadlock(s)                                                                   | postgres
 ROLLBACK_TABLE          | BEGIN                        | myschema1."myTbl3"           | All log rows with emaj_gid > 11867 and <= 11869                                                                        | postgres
 ROLLBACK_TABLE          | END                          | myschema1."myTbl3"           | 1 rolled back primary keys                                                                                             | postgres
 ROLLBACK_TABLE          | BEGIN                        | myschema2."myTbl3"           | All log rows with emaj_gid > 11867 and <= 11869                                                                        | postgres
 ROLLBACK_TABLE          | END                          | myschema2."myTbl3"           | 1 rolled back primary keys                                                                                             | postgres
 ROLLBACK_SEQUENCE       |                              | myschema1."myTbl3_col31_seq" |                                                                                                                        | postgres
 ROLLBACK_SEQUENCE       |                              | myschema1.mytbl2b_col20_seq  |                                                                                                                        | postgres
 ROLLBACK_SEQUENCE       |                              | myschema2."myTbl3_col31_seq" |                                                                                                                        | postgres
 ROLLBACK_SEQUENCE       |                              | myschema2.myseq1             |                                                                                                                        | postgres
 ROLLBACK_GROUPS         | NOTICE                       | Rollback id 6000             | 2 / 11 tables effectively processed.                                                                                   | postgres
 ROLLBACK_GROUPS         | NOTICE                       | Rollback id 6000             | 4 sequences processed.                                                                                                 | postgres
 DBLINK_CLOSE_CNX        |                              | rlbk#1                       |                                                                                                                        | postgres
 ROLLBACK_GROUPS         | END                          | myGroup1,myGroup2            | Rollback_id 6000, 2 tables and 4 sequences effectively processed                                                       | postgres
 ALTER_GROUPS            | BEGIN                        | myGroup1,myGroup2            |                                                                                                                        | postgres
 LOCK_GROUPS             | BEGIN                        | myGroup1,myGroup2            |                                                                                                                        | postgres
 LOCK_GROUPS             | END                          | myGroup1,myGroup2            | 11 tables locked, 0 deadlock(s)                                                                                        | postgres
 SET_MARK_GROUPS         | BEGIN                        | myGroup1,myGroup2            | ALTER_%                                                                                                                | postgres
 CLEANUP_RLBK_STATE      |                              | Rollback id 6000             | set to COMMITTED                                                                                                       | postgres
 SET_MARK_GROUPS         | END                          | myGroup1,myGroup2            | ALTER_%                                                                                                                | postgres
 ALTER_GROUPS            | END                          | myGroup1,myGroup2            | Timestamp Id : 6054                                                                                                    | postgres
 ALTER_GROUPS            | BEGIN                        | myGroup1,myGroup2            |                                                                                                                        | postgres
 LOCK_GROUPS             | BEGIN                        | myGroup1,myGroup2            |                                                                                                                        | postgres
 LOCK_GROUPS             | END                          | myGroup1,myGroup2            | 11 tables locked, 0 deadlock(s)                                                                                        | postgres
 SET_MARK_GROUPS         | BEGIN                        | myGroup1,myGroup2            | ALTER_%                                                                                                                | postgres
 SET_MARK_GROUPS         | END                          | myGroup1,myGroup2            | ALTER_%                                                                                                                | postgres
 ALTER_GROUPS            | LOG DATA TABLESPACE CHANGED  | myschema1.mytbl2b            | Default tablespace => tsp log'2                                                                                        | postgres
 ALTER_GROUPS            | LOG INDEX TABLESPACE CHANGED | myschema2.mytbl6             | tsplog1 => Default tablespace                                                                                          | postgres
 ALTER_GROUPS            | END                          | myGroup1,myGroup2            | Timestamp Id : 6055                                                                                                    | postgres
 SET_MARK_GROUP          | BEGIN                        | myGroup2                     |                                                                                                                        | postgres
 LOCK_GROUP              | BEGIN                        | myGroup2                     |                                                                                                                        | postgres
 LOCK_GROUP              | END                          | myGroup2                     | 6 tables locked, 0 deadlock(s)                                                                                         | postgres
 SET_MARK_GROUP          | END                          | myGroup2                     | ADD_SEQ test                                                                                                           | postgres
 SET_MARK_GROUP          | BEGIN                        | myGroup2                     |                                                                                                                        | postgres
 LOCK_GROUP              | BEGIN                        | myGroup2                     |                                                                                                                        | postgres
 LOCK_GROUP              | END                          | myGroup2                     | 6 tables locked, 0 deadlock(s)                                                                                         | postgres
 SET_MARK_GROUP          | END                          | myGroup2                     | Before ADD_SEQ                                                                                                         | postgres
 ADJUST_GROUP_PROPERTIES |                              | myGroup2                     | Set the group_has_waiting_changes column to true                                                                       | postgres
 ASSIGN_SEQUENCE         | BEGIN                        |                              |                                                                                                                        | postgres
 LOCK_GROUP              | BEGIN                        | myGroup2                     |                                                                                                                        | postgres
 LOCK_GROUP              | END                          | myGroup2                     | 6 tables locked, 0 deadlock(s)                                                                                         | postgres
 SET_MARK_GROUP          | BEGIN                        | myGroup2                     | Alter to add myseq2                                                                                                    | postgres
 SET_MARK_GROUP          | END                          | myGroup2                     | Alter to add myseq2                                                                                                    | postgres
 ASSIGN_SEQUENCE         | SEQUENCE ADDED               | myschema2.myseq2             | To the logging group myGroup2                                                                                          | postgres
 ASSIGN_SEQUENCE         | END                          |                              | 1 sequences assigned to the group myGroup2                                                                             | postgres
 SET_MARK_GROUP          | BEGIN                        | myGroup2                     |                                                                                                                        | postgres
 LOCK_GROUP              | BEGIN                        | myGroup2                     |                                                                                                                        | postgres
 LOCK_GROUP              | END                          | myGroup2                     | 6 tables locked, 0 deadlock(s)                                                                                         | postgres
 SET_MARK_GROUP          | END                          | myGroup2                     | After ADD_SEQ                                                                                                          | postgres
 SNAP_GROUP              | BEGIN                        | myGroup2                     | /tmp/emaj_test/alter                                                                                                   | postgres
 SNAP_GROUP              | END                          | myGroup2                     | 9 tables/sequences processed                                                                                           | postgres
 SNAP_LOG_GROUP          | BEGIN                        | myGroup2                     | From initial mark to mark After ADD_SEQ towards /tmp/emaj_test/alter                                                   | postgres
 SNAP_LOG_GROUP          | END                          | myGroup2                     | 9 generated files                                                                                                      | postgres
 GEN_SQL_GROUP           | BEGIN                        | myGroup2                     | From mark Before ADD_SEQ to current situation towards /tmp/emaj_test/alter/myFile                                      | postgres
 GEN_SQL_GROUP           | END                          | myGroup2                     | 2 generated statements                                                                                                 | postgres
 ROLLBACK_GROUP          | BEGIN                        | myGroup2                     | Logged rollback to mark Before ADD_SEQ (timestamp)                                                                     | postgres
 DBLINK_OPEN_CNX         |                              | rlbk#1                       | Status = 1                                                                                                             | postgres
 LOCK_GROUP              | BEGIN                        | myGroup2                     | Rollback session #1                                                                                                    | postgres
 LOCK_GROUP              | END                          | myGroup2                     | Rollback session #1: 6 tables locked, 0 deadlock(s)                                                                    | postgres
 SET_MARK_GROUP          | BEGIN                        | myGroup2                     | RLBK_Before ADD_SEQ_%_START                                                                                            | postgres
 SET_MARK_GROUP          | END                          | myGroup2                     | RLBK_Before ADD_SEQ_%_START                                                                                            | postgres
 ROLLBACK_SEQUENCE       |                              | myschema2."myTbl3_col31_seq" |                                                                                                                        | postgres
 ROLLBACK_SEQUENCE       |                              | myschema2.myseq1             |                                                                                                                        | postgres
 ROLLBACK_SEQUENCE       |                              | myschema2.myseq2             | RESTART 3                                                                                                              | postgres
 SET_MARK_GROUP          | BEGIN                        | myGroup2                     | RLBK_Before ADD_SEQ_%_DONE                                                                                             | postgres
 SET_MARK_GROUP          | END                          | myGroup2                     | RLBK_Before ADD_SEQ_%_DONE                                                                                             | postgres
 ROLLBACK_GROUP          | NOTICE                       | Rollback id 6002             | 0 / 6 tables effectively processed.                                                                                    | postgres
 ROLLBACK_GROUP          | NOTICE                       | Rollback id 6002             | 3 sequences processed.                                                                                                 | postgres
 ROLLBACK_GROUP          | WARNING                      | Rollback id 6002             | The sequence myschema2.myseq2 has only been rolled back to its latest group attachment state (<timestamp>)             | postgres
 DBLINK_CLOSE_CNX        |                              | rlbk#1                       |                                                                                                                        | postgres
 ROLLBACK_GROUP          | END                          | myGroup2                     | Rollback_id 6002, 0 tables and 3 sequences effectively processed                                                       | postgres
 RENAME_MARK_GROUP       | BEGIN                        | myGroup2                     | EMAJ_LAST_MARK                                                                                                         | postgres
 RENAME_MARK_GROUP       | END                          | myGroup2                     | RLBK_Before ADD_SEQ_%_DONE renamed Logged_Rlbk_End                                                                     | postgres
 CONSOLIDATE_RLBK_GROUP  | BEGIN                        | myGroup2                     | Erase all between marks Before ADD_SEQ and Logged_Rlbk_End                                                             | postgres
 CONSOLIDATE_RLBK_GROUP  | END                          | myGroup2                     | 0 tables and 3 sequences processed ; 3 marks deleted                                                                   | postgres
 ALTER_GROUP             | BEGIN                        | myGroup2                     |                                                                                                                        | postgres
 LOCK_GROUP              | BEGIN                        | myGroup2                     |                                                                                                                        | postgres
 LOCK_GROUP              | END                          | myGroup2                     | 6 tables locked, 0 deadlock(s)                                                                                         | postgres
 SET_MARK_GROUP          | BEGIN                        | myGroup2                     | Alter to remove myseq2                                                                                                 | postgres
 CLEANUP_RLBK_STATE      |                              | Rollback id 6002             | set to COMMITTED                                                                                                       | postgres
 SET_MARK_GROUP          | END                          | myGroup2                     | Alter to remove myseq2                                                                                                 | postgres
 ALTER_GROUP             | SEQUENCE REMOVED             | myschema2.myseq2             | From the group myGroup2                                                                                                | postgres
 ALTER_GROUP             | END                          | myGroup2                     | Timestamp Id : 6063                                                                                                    | postgres
 ALTER_GROUP             | BEGIN                        | myGroup2                     |                                                                                                                        | postgres
 LOCK_GROUP              | BEGIN                        | myGroup2                     |                                                                                                                        | postgres
 LOCK_GROUP              | END                          | myGroup2                     | 6 tables locked, 0 deadlock(s)                                                                                         | postgres
 SET_MARK_GROUP          | BEGIN                        | myGroup2                     | Alter to re-add myseq2                                                                                                 | postgres
 SET_MARK_GROUP          | END                          | myGroup2                     | Alter to re-add myseq2                                                                                                 | postgres
 ALTER_GROUP             | SEQUENCE ADDED               | myschema2.myseq2             | To the group myGroup2                                                                                                  | postgres
 ALTER_GROUP             | END                          | myGroup2                     | Timestamp Id : 6064                                                                                                    | postgres
 ALTER_GROUP             | BEGIN                        | myGroup2                     |                                                                                                                        | postgres
 LOCK_GROUP              | BEGIN                        | myGroup2                     |                                                                                                                        | postgres
 LOCK_GROUP              | END                          | myGroup2                     | 6 tables locked, 0 deadlock(s)                                                                                         | postgres
 SET_MARK_GROUP          | BEGIN                        | myGroup2                     | Alter to really remove myseq2                                                                                          | postgres
 SET_MARK_GROUP          | END                          | myGroup2                     | Alter to really remove myseq2                                                                                          | postgres
 ALTER_GROUP             | SEQUENCE REMOVED             | myschema2.myseq2             | From the group myGroup2                                                                                                | postgres
 ALTER_GROUP             | END                          | myGroup2                     | Timestamp Id : 6065                                                                                                    | postgres
 ROLLBACK_GROUP          | BEGIN                        | myGroup2                     | Unlogged rollback to mark ADD_SEQ test (timestamp)                                                                     | postgres
 DBLINK_OPEN_CNX         |                              | rlbk#1                       | Status = 1                                                                                                             | postgres
 LOCK_GROUP              | BEGIN                        | myGroup2                     | Rollback session #1                                                                                                    | postgres
 LOCK_GROUP              | END                          | myGroup2                     | Rollback session #1: 6 tables locked, 0 deadlock(s)                                                                    | postgres
 ROLLBACK_GROUP          | MARK DELETED                 | myGroup2                     | mark Before ADD_SEQ is deleted                                                                                         | postgres
 ROLLBACK_GROUP          | MARK DELETED                 | myGroup2                     | mark Logged_Rlbk_End is deleted                                                                                        | postgres
 ROLLBACK_GROUP          | MARK DELETED                 | myGroup2                     | mark Alter to remove myseq2 is deleted                                                                                 | postgres
 ROLLBACK_GROUP          | MARK DELETED                 | myGroup2                     | mark Alter to re-add myseq2 is deleted                                                                                 | postgres
 ROLLBACK_GROUP          | MARK DELETED                 | myGroup2                     | mark Alter to really remove myseq2 is deleted                                                                          | postgres
 ROLLBACK_SEQUENCE       |                              | myschema2."myTbl3_col31_seq" |                                                                                                                        | postgres
 ROLLBACK_SEQUENCE       |                              | myschema2.myseq1             |                                                                                                                        | postgres
 ROLLBACK_GROUP          | NOTICE                       | Rollback id 6003             | 0 / 6 tables effectively processed.                                                                                    | postgres
 ROLLBACK_GROUP          | NOTICE                       | Rollback id 6003             | 2 sequences processed.                                                                                                 | postgres
 ROLLBACK_GROUP          | WARNING                      | Rollback id 6003             | The sequence myschema2.myseq2 has been left unchanged (not in group anymore since <timestamp>)                         | postgres
 DBLINK_CLOSE_CNX        |                              | rlbk#1                       |                                                                                                                        | postgres
 ROLLBACK_GROUP          | END                          | myGroup2                     | Rollback_id 6003, 0 tables and 2 sequences effectively processed                                                       | postgres
 SET_MARK_GROUP          | BEGIN                        | myGroup1                     |                                                                                                                        | postgres
 LOCK_GROUP              | BEGIN                        | myGroup1                     |                                                                                                                        | postgres
 LOCK_GROUP              | END                          | myGroup1                     | 5 tables locked, 0 deadlock(s)                                                                                         | postgres
 CLEANUP_RLBK_STATE      |                              | Rollback id 6003             | set to COMMITTED                                                                                                       | postgres
 SET_MARK_GROUP          | END                          | myGroup1                     | Mk2b                                                                                                                   | postgres
 SET_MARK_GROUP          | BEGIN                        | myGroup1                     |                                                                                                                        | postgres
 LOCK_GROUP              | BEGIN                        | myGroup1                     |                                                                                                                        | postgres
 LOCK_GROUP              | END                          | myGroup1                     | 5 tables locked, 0 deadlock(s)                                                                                         | postgres
 SET_MARK_GROUP          | END                          | myGroup1                     | Before_remove                                                                                                          | postgres
 REMOVE_SEQUENCE         | BEGIN                        |                              |                                                                                                                        | postgres
 LOCK_GROUP              | BEGIN                        | myGroup1                     |                                                                                                                        | postgres
 LOCK_GROUP              | END                          | myGroup1                     | 5 tables locked, 0 deadlock(s)                                                                                         | postgres
 SET_MARK_GROUP          | BEGIN                        | myGroup1                     | Sequence_removed                                                                                                       | postgres
 SET_MARK_GROUP          | END                          | myGroup1                     | Sequence_removed                                                                                                       | postgres
 REMOVE_SEQUENCE         | SEQUENCE REMOVED             | myschema1."myTbl3_col31_seq" | From the logging group myGroup1                                                                                        | postgres
 REMOVE_SEQUENCE         | END                          |                              | 1 sequences removed from their groups                                                                                  | postgres
 ADJUST_GROUP_PROPERTIES |                              | myGroup1                     | Set the group_has_waiting_changes column to false                                                                      | postgres
 SNAP_GROUP              | BEGIN                        | myGroup1                     | /tmp/emaj_test/alter                                                                                                   | postgres
 SNAP_GROUP              | END                          | myGroup1                     | 6 tables/sequences processed                                                                                           | postgres
 SNAP_LOG_GROUP          | BEGIN                        | myGroup1                     | From mark Mk1 to current situation towards /tmp/emaj_test/alter                                                        | postgres
 SNAP_LOG_GROUP          | END                          | myGroup1                     | 8 generated files                                                                                                      | postgres
 SET_MARK_GROUP          | BEGIN                        | myGroup1                     |                                                                                                                        | postgres
 LOCK_GROUP              | BEGIN                        | myGroup1                     |                                                                                                                        | postgres
 LOCK_GROUP              | END                          | myGroup1                     | 5 tables locked, 0 deadlock(s)                                                                                         | postgres
 SET_MARK_GROUP          | END                          | myGroup1                     | After_remove                                                                                                           | postgres
 GEN_SQL_GROUP           | BEGIN                        | myGroup1                     | From initial mark to mark EMAJ_LAST_MARK towards /tmp/emaj_test/alter/myFile with tables/sequences filtering           | postgres
 GEN_SQL_GROUP           | END                          | myGroup1                     | 1 generated statements                                                                                                 | postgres
 ALTER_GROUP             | BEGIN                        | myGroup1                     |                                                                                                                        | postgres
 LOCK_GROUP              | BEGIN                        | myGroup1                     |                                                                                                                        | postgres
 LOCK_GROUP              | END                          | myGroup1                     | 5 tables locked, 0 deadlock(s)                                                                                         | postgres
 SET_MARK_GROUP          | BEGIN                        | myGroup1                     | sequence re-added to myGroup1                                                                                          | postgres
 CLEANUP_RLBK_STATE      |                              | Rollback id 6004             | set to ABORTED                                                                                                         | postgres
 CLEANUP_RLBK_STATE      |                              | Rollback id 6005             | set to ABORTED                                                                                                         | postgres
 SET_MARK_GROUP          | END                          | myGroup1                     | sequence re-added to myGroup1                                                                                          | postgres
 ALTER_GROUP             | SEQUENCE ADDED               | myschema1."myTbl3_col31_seq" | To the group myGroup1                                                                                                  | postgres
 ALTER_GROUP             | END                          | myGroup1                     | Timestamp Id : 6077                                                                                                    | postgres
 SET_MARK_GROUP          | BEGIN                        | myGroup2                     |                                                                                                                        | postgres
 LOCK_GROUP              | BEGIN                        | myGroup2                     |                                                                                                                        | postgres
 LOCK_GROUP              | END                          | myGroup2                     | 6 tables locked, 0 deadlock(s)                                                                                         | postgres
 SET_MARK_GROUP          | END                          | myGroup2                     | ADD_TBL test                                                                                                           | postgres
 SET_MARK_GROUP          | BEGIN                        | myGroup2                     |                                                                                                                        | postgres
 LOCK_GROUP              | BEGIN                        | myGroup2                     |                                                                                                                        | postgres
 LOCK_GROUP              | END                          | myGroup2                     | 6 tables locked, 0 deadlock(s)                                                                                         | postgres
 SET_MARK_GROUP          | END                          | myGroup2                     | Before ADD_TBL                                                                                                         | postgres
 ASSIGN_TABLE            | BEGIN                        |                              |                                                                                                                        | postgres
 LOCK_GROUP              | BEGIN                        | myGroup2                     |                                                                                                                        | postgres
 LOCK_GROUP              | END                          | myGroup2                     | 6 tables locked, 0 deadlock(s)                                                                                         | postgres
 SET_MARK_GROUP          | BEGIN                        | myGroup2                     | Alter to add mytbl7                                                                                                    | postgres
 SET_MARK_GROUP          | END                          | myGroup2                     | Alter to add mytbl7                                                                                                    | postgres
 ASSIGN_TABLE            | TABLE ADDED                  | myschema2.mytbl7             | To the logging group myGroup2                                                                                          | postgres
 ASSIGN_TABLE            | END                          |                              | 1 tables assigned to the group myGroup2                                                                                | postgres
 SET_MARK_GROUP          | BEGIN                        | myGroup2                     |                                                                                                                        | postgres
 LOCK_GROUP              | BEGIN                        | myGroup2                     |                                                                                                                        | postgres
 LOCK_GROUP              | END                          | myGroup2                     | 7 tables locked, 0 deadlock(s)                                                                                         | postgres
 SET_MARK_GROUP          | END                          | myGroup2                     | Just after ADD_TBL                                                                                                     | postgres
 SET_MARK_GROUP          | BEGIN                        | myGroup2                     |                                                                                                                        | postgres
 LOCK_GROUP              | BEGIN                        | myGroup2                     |                                                                                                                        | postgres
 LOCK_GROUP              | END                          | myGroup2                     | 7 tables locked, 0 deadlock(s)                                                                                         | postgres
 SET_MARK_GROUP          | END                          | myGroup2                     | After ADD_TBL                                                                                                          | postgres
 SNAP_GROUP              | BEGIN                        | myGroup2                     | /tmp/emaj_test/alter                                                                                                   | postgres
 SNAP_GROUP              | END                          | myGroup2                     | 9 tables/sequences processed                                                                                           | postgres
 SNAP_LOG_GROUP          | BEGIN                        | myGroup2                     | From initial mark to mark After ADD_TBL towards /tmp/emaj_test/alter                                                   | postgres
 SNAP_LOG_GROUP          | END                          | myGroup2                     | 10 generated files                                                                                                     | postgres
 ROLLBACK_GROUP          | BEGIN                        | myGroup2                     | Logged rollback to mark Before ADD_TBL (timestamp)                                                                     | postgres
 DBLINK_OPEN_CNX         |                              | rlbk#1                       | Status = 1                                                                                                             | postgres
 LOCK_GROUP              | BEGIN                        | myGroup2                     | Rollback session #1                                                                                                    | postgres
 LOCK_GROUP              | END                          | myGroup2                     | Rollback session #1: 7 tables locked, 0 deadlock(s)                                                                    | postgres
 SET_MARK_GROUP          | BEGIN                        | myGroup2                     | RLBK_Before ADD_TBL_%_START                                                                                            | postgres
 SET_MARK_GROUP          | END                          | myGroup2                     | RLBK_Before ADD_TBL_%_START                                                                                            | postgres
 ROLLBACK_TABLE          | BEGIN                        | myschema2.mytbl7             | All log rows with emaj_gid > 11869 and <= 11872                                                                        | postgres
 ROLLBACK_TABLE          | END                          | myschema2.mytbl7             | 4 rolled back primary keys                                                                                             | postgres
 ROLLBACK_SEQUENCE       |                              | myschema2."myTbl3_col31_seq" |                                                                                                                        | postgres
 ROLLBACK_SEQUENCE       |                              | myschema2.myseq1             |                                                                                                                        | postgres
 SET_MARK_GROUP          | BEGIN                        | myGroup2                     | RLBK_Before ADD_TBL_%_DONE                                                                                             | postgres
 SET_MARK_GROUP          | END                          | myGroup2                     | RLBK_Before ADD_TBL_%_DONE                                                                                             | postgres
 ROLLBACK_GROUP          | NOTICE                       | Rollback id 6007             | 1 / 7 tables effectively processed.                                                                                    | postgres
 ROLLBACK_GROUP          | NOTICE                       | Rollback id 6007             | 2 sequences processed.                                                                                                 | postgres
 ROLLBACK_GROUP          | WARNING                      | Rollback id 6007             | The table myschema2.mytbl7 has only been rolled back to its latest group attachment (<timestamp>)                      | postgres
 DBLINK_CLOSE_CNX        |                              | rlbk#1                       |                                                                                                                        | postgres
 ROLLBACK_GROUP          | END                          | myGroup2                     | Rollback_id 6007, 1 tables and 2 sequences effectively processed                                                       | postgres
 RENAME_MARK_GROUP       | BEGIN                        | myGroup2                     | EMAJ_LAST_MARK                                                                                                         | postgres
 RENAME_MARK_GROUP       | END                          | myGroup2                     | RLBK_Before ADD_TBL_%_DONE renamed Logged_Rlbk_End                                                                     | postgres
 CONSOLIDATE_RLBK_GROUP  | BEGIN                        | myGroup2                     | Erase all between marks Before ADD_TBL and Logged_Rlbk_End                                                             | postgres
 CONSOLIDATE_RLBK_GROUP  | END                          | myGroup2                     | 1 tables and 2 sequences processed ; 4 marks deleted                                                                   | postgres
 ALTER_GROUP             | BEGIN                        | myGroup2                     |                                                                                                                        | postgres
 LOCK_GROUP              | BEGIN                        | myGroup2                     |                                                                                                                        | postgres
 LOCK_GROUP              | END                          | myGroup2                     | 7 tables locked, 0 deadlock(s)                                                                                         | postgres
 SET_MARK_GROUP          | BEGIN                        | myGroup2                     | Alter to remove mytbl7                                                                                                 | postgres
 CLEANUP_RLBK_STATE      |                              | Rollback id 6007             | set to COMMITTED                                                                                                       | postgres
 SET_MARK_GROUP          | END                          | myGroup2                     | Alter to remove mytbl7                                                                                                 | postgres
 ALTER_GROUP             | TABLE REMOVED                | myschema2.mytbl7             | From the group myGroup2                                                                                                | postgres
 ALTER_GROUP             | END                          | myGroup2                     | Timestamp Id : 6087                                                                                                    | postgres
 ALTER_GROUP             | BEGIN                        | myGroup2                     |                                                                                                                        | postgres
 LOCK_GROUP              | BEGIN                        | myGroup2                     |                                                                                                                        | postgres
 LOCK_GROUP              | END                          | myGroup2                     | 6 tables locked, 0 deadlock(s)                                                                                         | postgres
 SET_MARK_GROUP          | BEGIN                        | myGroup2                     | Alter to re-add mytbl7                                                                                                 | postgres
 SET_MARK_GROUP          | END                          | myGroup2                     | Alter to re-add mytbl7                                                                                                 | postgres
 ALTER_GROUP             | TABLE ADDED                  | myschema2.mytbl7             | To the group myGroup2                                                                                                  | postgres
 ALTER_GROUP             | END                          | myGroup2                     | Timestamp Id : 6088                                                                                                    | postgres
 SNAP_LOG_GROUP          | BEGIN                        | myGroup2                     | From initial mark to current situation towards /tmp/emaj_test/alter                                                    | postgres
 SNAP_LOG_GROUP          | END                          | myGroup2                     | 11 generated files                                                                                                     | postgres
 ALTER_GROUP             | BEGIN                        | myGroup2                     |                                                                                                                        | postgres
 LOCK_GROUP              | BEGIN                        | myGroup2                     |                                                                                                                        | postgres
 LOCK_GROUP              | END                          | myGroup2                     | 7 tables locked, 0 deadlock(s)                                                                                         | postgres
 SET_MARK_GROUP          | BEGIN                        | myGroup2                     | Alter to really remove mytbl7                                                                                          | postgres
 SET_MARK_GROUP          | END                          | myGroup2                     | Alter to really remove mytbl7                                                                                          | postgres
 ALTER_GROUP             | TABLE REMOVED                | myschema2.mytbl7             | From the group myGroup2                                                                                                | postgres
 ALTER_GROUP             | END                          | myGroup2                     | Timestamp Id : 6090                                                                                                    | postgres
 ROLLBACK_GROUP          | BEGIN                        | myGroup2                     | Unlogged rollback to mark ADD_TBL test (timestamp)                                                                     | postgres
 DBLINK_OPEN_CNX         |                              | rlbk#1                       | Status = 1                                                                                                             | postgres
 LOCK_GROUP              | BEGIN                        | myGroup2                     | Rollback session #1                                                                                                    | postgres
 LOCK_GROUP              | END                          | myGroup2                     | Rollback session #1: 6 tables locked, 0 deadlock(s)                                                                    | postgres
 ROLLBACK_GROUP          | MARK DELETED                 | myGroup2                     | mark Before ADD_TBL is deleted                                                                                         | postgres
 ROLLBACK_GROUP          | MARK DELETED                 | myGroup2                     | mark Logged_Rlbk_End is deleted                                                                                        | postgres
 ROLLBACK_GROUP          | MARK DELETED                 | myGroup2                     | mark Alter to remove mytbl7 is deleted                                                                                 | postgres
 ROLLBACK_GROUP          | MARK DELETED                 | myGroup2                     | mark Alter to re-add mytbl7 is deleted                                                                                 | postgres
 ROLLBACK_GROUP          | MARK DELETED                 | myGroup2                     | mark Alter to really remove mytbl7 is deleted                                                                          | postgres
 ROLLBACK_SEQUENCE       |                              | myschema2."myTbl3_col31_seq" |                                                                                                                        | postgres
 ROLLBACK_SEQUENCE       |                              | myschema2.myseq1             |                                                                                                                        | postgres
 ROLLBACK_GROUP          | NOTICE                       | Rollback id 6008             | 0 / 6 tables effectively processed.                                                                                    | postgres
 ROLLBACK_GROUP          | NOTICE                       | Rollback id 6008             | 2 sequences processed.                                                                                                 | postgres
 ROLLBACK_GROUP          | WARNING                      | Rollback id 6008             | The table myschema2.mytbl7 has been left unchanged (not in group anymore since <timestamp>)                            | postgres
 DBLINK_CLOSE_CNX        |                              | rlbk#1                       |                                                                                                                        | postgres
 ROLLBACK_GROUP          | END                          | myGroup2                     | Rollback_id 6008, 0 tables and 2 sequences effectively processed                                                       | postgres
 SET_MARK_GROUP          | BEGIN                        | myGroup1                     |                                                                                                                        | postgres
 LOCK_GROUP              | BEGIN                        | myGroup1                     |                                                                                                                        | postgres
 LOCK_GROUP              | END                          | myGroup1                     | 5 tables locked, 0 deadlock(s)                                                                                         | postgres
 CLEANUP_RLBK_STATE      |                              | Rollback id 6008             | set to COMMITTED                                                                                                       | postgres
 SET_MARK_GROUP          | END                          | myGroup1                     | Mk2c                                                                                                                   | postgres
 ADJUST_GROUP_PROPERTIES |                              | myGroup1                     | Set the group_has_waiting_changes column to true                                                                       | postgres
 REMOVE_TABLES           | BEGIN                        |                              |                                                                                                                        | postgres
 LOCK_GROUP              | BEGIN                        | myGroup1,myGroup1            |                                                                                                                        | postgres
 LOCK_GROUP              | END                          | myGroup1,myGroup1            | 5 tables locked, 0 deadlock(s)                                                                                         | postgres
 SET_MARK_GROUP          | BEGIN                        | myGroup1,myGroup1            | 2 tables removed from myGroup1                                                                                         | postgres
 SET_MARK_GROUP          | END                          | myGroup1,myGroup1            | 2 tables removed from myGroup1                                                                                         | postgres
 REMOVE_TABLES           | TABLE REMOVED                | myschema1."myTbl3"           | From the logging group myGroup1                                                                                        | postgres
 REMOVE_TABLES           | TABLE REMOVED                | myschema1.mytbl2b            | From the logging group myGroup1                                                                                        | postgres
 REMOVE_TABLES           | END                          |                              | 2 tables removed from their groups                                                                                     | postgres
 ADJUST_GROUP_PROPERTIES |                              | myGroup1                     | Set the group_has_waiting_changes column to false                                                                      | postgres
 SNAP_GROUP              | BEGIN                        | myGroup1                     | /tmp/emaj_test/alter                                                                                                   | postgres
 SNAP_GROUP              | END                          | myGroup1                     | 5 tables/sequences processed                                                                                           | postgres
 SNAP_LOG_GROUP          | BEGIN                        | myGroup1                     | From initial mark to current situation towards /tmp/emaj_test/alter                                                    | postgres
 SNAP_LOG_GROUP          | END                          | myGroup1                     | 8 generated files                                                                                                      | postgres
 GEN_SQL_GROUP           | BEGIN                        | myGroup1                     | From initial mark to current situation towards /tmp/emaj_test/alter/myFile with tables/sequences filtering             | postgres
 GEN_SQL_GROUP           | END                          | myGroup1                     | 2 generated statements                                                                                                 | postgres
 ROLLBACK_GROUP          | BEGIN                        | myGroup1                     | Logged rollback to mark Mk2b (timestamp)                                                                               | postgres
 DBLINK_OPEN_CNX         |                              | rlbk#1                       | Status = 1                                                                                                             | postgres
 LOCK_GROUP              | BEGIN                        | myGroup1                     | Rollback session #1                                                                                                    | postgres
 LOCK_GROUP              | END                          | myGroup1                     | Rollback session #1: 3 tables locked, 0 deadlock(s)                                                                    | postgres
 SET_MARK_GROUP          | BEGIN                        | myGroup1                     | RLBK_Mk2b_%_START                                                                                                      | postgres
 SET_MARK_GROUP          | END                          | myGroup1                     | RLBK_Mk2b_%_START                                                                                                      | postgres
 ROLLBACK_TABLE          | BEGIN                        | myschema1.mytbl1             | All log rows with emaj_gid > 11869 and <= 11883                                                                        | postgres
 ROLLBACK_TABLE          | END                          | myschema1.mytbl1             | 1 rolled back primary keys                                                                                             | postgres
 ROLLBACK_SEQUENCE       |                              | myschema1."myTbl3_col31_seq" | RESTART 11                                                                                                             | postgres
 ROLLBACK_SEQUENCE       |                              | myschema1.mytbl2b_col20_seq  |                                                                                                                        | postgres
 SET_MARK_GROUP          | BEGIN                        | myGroup1                     | RLBK_Mk2b_%_DONE                                                                                                       | postgres
 SET_MARK_GROUP          | END                          | myGroup1                     | RLBK_Mk2b_%_DONE                                                                                                       | postgres
 ROLLBACK_GROUP          | NOTICE                       | Rollback id 6010             | 1 / 3 tables effectively processed.                                                                                    | postgres
 ROLLBACK_GROUP          | NOTICE                       | Rollback id 6010             | 2 sequences processed.                                                                                                 | postgres
 ROLLBACK_GROUP          | WARNING                      | Rollback id 6010             | The sequence myschema1."myTbl3_col31_seq" has only been rolled back to its latest group attachment state (<timestamp>) | postgres
 ROLLBACK_GROUP          | WARNING                      | Rollback id 6010             | The table myschema1."myTbl3" has been left unchanged (not in group anymore since <timestamp>)                          | postgres
 ROLLBACK_GROUP          | WARNING                      | Rollback id 6010             | The table myschema1.mytbl2b has been left unchanged (not in group anymore since <timestamp>)                           | postgres
 DBLINK_CLOSE_CNX        |                              | rlbk#1                       |                                                                                                                        | postgres
 ROLLBACK_GROUP          | END                          | myGroup1                     | Rollback_id 6010, 1 tables and 2 sequences effectively processed                                                       | postgres
 RENAME_MARK_GROUP       | BEGIN                        | myGroup1                     | EMAJ_LAST_MARK                                                                                                         | postgres
 RENAME_MARK_GROUP       | END                          | myGroup1                     | RLBK_Mk2b_%_DONE renamed Logged_Rlbk_End                                                                               | postgres
 ALTER_GROUP             | BEGIN                        | myGroup1                     |                                                                                                                        | postgres
 LOCK_GROUP              | BEGIN                        | myGroup1                     |                                                                                                                        | postgres
 LOCK_GROUP              | END                          | myGroup1                     | 3 tables locked, 0 deadlock(s)                                                                                         | postgres
 SET_MARK_GROUP          | BEGIN                        | myGroup1                     | 2nd remove_tbl                                                                                                         | postgres
 CLEANUP_RLBK_STATE      |                              | Rollback id 6010             | set to COMMITTED                                                                                                       | postgres
 SET_MARK_GROUP          | END                          | myGroup1                     | 2nd remove_tbl                                                                                                         | postgres
 ALTER_GROUP             | TABLE REMOVED                | myschema1.mytbl1             | From the group myGroup1                                                                                                | postgres
 ALTER_GROUP             | END                          | myGroup1                     | Timestamp Id : 6099                                                                                                    | postgres
 CONSOLIDATE_RLBK_GROUP  | BEGIN                        | myGroup1                     | Erase all between marks Mk2b and Logged_Rlbk_End                                                                       | postgres
 CONSOLIDATE_RLBK_GROUP  | END                          | myGroup1                     | 1 tables and 2 sequences processed ; 7 marks deleted                                                                   | postgres
 ROLLBACK_GROUP          | BEGIN                        | myGroup1                     | Unlogged rollback to mark Mk2b (timestamp)                                                                             | postgres
 DBLINK_OPEN_CNX         |                              | rlbk#1                       | Status = 1                                                                                                             | postgres
 LOCK_GROUP              | BEGIN                        | myGroup1                     | Rollback session #1                                                                                                    | postgres
 LOCK_GROUP              | END                          | myGroup1                     | Rollback session #1: 2 tables locked, 0 deadlock(s)                                                                    | postgres
 ROLLBACK_GROUP          | MARK DELETED                 | myGroup1                     | mark Logged_Rlbk_End is deleted                                                                                        | postgres
 ROLLBACK_GROUP          | MARK DELETED                 | myGroup1                     | mark 2nd remove_tbl is deleted                                                                                         | postgres
 ROLLBACK_SEQUENCE       |                              | myschema1."myTbl3_col31_seq" |                                                                                                                        | postgres
 ROLLBACK_SEQUENCE       |                              | myschema1.mytbl2b_col20_seq  |                                                                                                                        | postgres
 ROLLBACK_GROUP          | NOTICE                       | Rollback id 6011             | 0 / 2 tables effectively processed.                                                                                    | postgres
 ROLLBACK_GROUP          | NOTICE                       | Rollback id 6011             | 2 sequences processed.                                                                                                 | postgres
 ROLLBACK_GROUP          | WARNING                      | Rollback id 6011             | The table myschema1.mytbl1 has been left unchanged (not in group anymore since <timestamp>)                            | postgres
 DBLINK_CLOSE_CNX        |                              | rlbk#1                       |                                                                                                                        | postgres
 ROLLBACK_GROUP          | END                          | myGroup1                     | Rollback_id 6011, 0 tables and 2 sequences effectively processed                                                       | postgres
 ALTER_GROUP             | BEGIN                        | myGroup1                     |                                                                                                                        | postgres
 LOCK_GROUP              | BEGIN                        | myGroup1                     |                                                                                                                        | postgres
 LOCK_GROUP              | END                          | myGroup1                     | 2 tables locked, 0 deadlock(s)                                                                                         | postgres
 SET_MARK_GROUP          | BEGIN                        | myGroup1                     | tables re-added to myGroup1                                                                                            | postgres
 CLEANUP_RLBK_STATE      |                              | Rollback id 6011             | set to COMMITTED                                                                                                       | postgres
 SET_MARK_GROUP          | END                          | myGroup1                     | tables re-added to myGroup1                                                                                            | postgres
 ALTER_GROUP             | TABLE ADDED                  | myschema1."myTbl3"           | To the group myGroup1                                                                                                  | postgres
 ALTER_GROUP             | TABLE ADDED                  | myschema1.mytbl1             | To the group myGroup1                                                                                                  | postgres
 ALTER_GROUP             | TABLE ADDED                  | myschema1.mytbl2b            | To the group myGroup1                                                                                                  | postgres
 ALTER_GROUP             | END                          | myGroup1                     | Timestamp Id : 6105                                                                                                    | postgres
 SET_MARK_GROUPS         | BEGIN                        | myGroup1,myGroup2            | Mk3                                                                                                                    | postgres
 LOCK_GROUPS             | BEGIN                        | myGroup1,myGroup2            |                                                                                                                        | postgres
 LOCK_GROUPS             | END                          | myGroup1,myGroup2            | 11 tables locked, 0 deadlock(s)                                                                                        | postgres
 SET_MARK_GROUPS         | END                          | myGroup1,myGroup2            | Mk3                                                                                                                    | postgres
 ROLLBACK_GROUPS         | BEGIN                        | myGroup1,myGroup2            | Unlogged rollback to mark Mk3 (timestamp)                                                                              | postgres
 DBLINK_OPEN_CNX         |                              | rlbk#1                       | Status = 1                                                                                                             | postgres
 LOCK_GROUP              | BEGIN                        | myGroup1,myGroup2            | Rollback session #1                                                                                                    | postgres
 LOCK_GROUP              | END                          | myGroup1,myGroup2            | Rollback session #1: 11 tables locked, 0 deadlock(s)                                                                   | postgres
 ROLLBACK_SEQUENCE       |                              | myschema1."myTbl3_col31_seq" |                                                                                                                        | postgres
 ROLLBACK_SEQUENCE       |                              | myschema1.mytbl2b_col20_seq  |                                                                                                                        | postgres
 ROLLBACK_SEQUENCE       |                              | myschema2."myTbl3_col31_seq" |                                                                                                                        | postgres
 ROLLBACK_SEQUENCE       |                              | myschema2.myseq1             |                                                                                                                        | postgres
 ROLLBACK_GROUPS         | NOTICE                       | Rollback id 6012             | 0 / 11 tables effectively processed.                                                                                   | postgres
 ROLLBACK_GROUPS         | NOTICE                       | Rollback id 6012             | 4 sequences processed.                                                                                                 | postgres
 DBLINK_CLOSE_CNX        |                              | rlbk#1                       |                                                                                                                        | postgres
 ROLLBACK_GROUPS         | END                          | myGroup1,myGroup2            | Rollback_id 6012, 0 tables and 4 sequences effectively processed                                                       | postgres
 ROLLBACK_GROUPS         | BEGIN                        | myGroup1,myGroup2            | Logged rollback to mark Mk2 (timestamp)                                                                                | postgres
 DBLINK_OPEN_CNX         |                              | rlbk#1                       | Status = 1                                                                                                             | postgres
 LOCK_GROUP              | BEGIN                        | myGroup1,myGroup2            | Rollback session #1                                                                                                    | postgres
 LOCK_GROUP              | END                          | myGroup1,myGroup2            | Rollback session #1: 11 tables locked, 0 deadlock(s)                                                                   | postgres
 SET_MARK_GROUPS         | BEGIN                        | myGroup1,myGroup2            | RLBK_Mk2_%_START                                                                                                       | postgres
 CLEANUP_RLBK_STATE      |                              | Rollback id 6012             | set to COMMITTED                                                                                                       | postgres
 SET_MARK_GROUPS         | END                          | myGroup1,myGroup2            | RLBK_Mk2_%_START                                                                                                       | postgres
 ROLLBACK_SEQUENCE       |                              | myschema1."myTbl3_col31_seq" |                                                                                                                        | postgres
 ROLLBACK_SEQUENCE       |                              | myschema1.mytbl2b_col20_seq  |                                                                                                                        | postgres
 ROLLBACK_SEQUENCE       |                              | myschema2."myTbl3_col31_seq" |                                                                                                                        | postgres
 ROLLBACK_SEQUENCE       |                              | myschema2.myseq1             |                                                                                                                        | postgres
 SET_MARK_GROUPS         | BEGIN                        | myGroup1,myGroup2            | RLBK_Mk2_%_DONE                                                                                                        | postgres
 SET_MARK_GROUPS         | END                          | myGroup1,myGroup2            | RLBK_Mk2_%_DONE                                                                                                        | postgres
 ROLLBACK_GROUPS         | NOTICE                       | Rollback id 6013             | 0 / 11 tables effectively processed.                                                                                   | postgres
 ROLLBACK_GROUPS         | NOTICE                       | Rollback id 6013             | 4 sequences processed.                                                                                                 | postgres
 ROLLBACK_GROUPS         | WARNING                      | Rollback id 6013             | Tables group change not rolled back: E-Maj priority for myschema1.mytbl1                                               | postgres
 ROLLBACK_GROUPS         | WARNING                      | Rollback id 6013             | Tables group change not rolled back: log data tablespace for myschema1.mytbl2b                                         | postgres
 ROLLBACK_GROUPS         | WARNING                      | Rollback id 6013             | Tables group change not rolled back: log index tablespace for myschema2.mytbl6                                         | postgres
 ROLLBACK_GROUPS         | WARNING                      | Rollback id 6013             | The table myschema1."myTbl3" has only been rolled back to its latest group attachment (<timestamp>)                    | postgres
 ROLLBACK_GROUPS         | WARNING                      | Rollback id 6013             | The table myschema1.mytbl1 has only been rolled back to its latest group attachment (<timestamp>)                      | postgres
 ROLLBACK_GROUPS         | WARNING                      | Rollback id 6013             | The table myschema1.mytbl2b has only been rolled back to its latest group attachment (<timestamp>)                     | postgres
 DBLINK_CLOSE_CNX        |                              | rlbk#1                       |                                                                                                                        | postgres
 ROLLBACK_GROUPS         | END                          | myGroup1,myGroup2            | Rollback_id 6013, 0 tables and 4 sequences effectively processed                                                       | postgres
 ROLLBACK_GROUPS         | BEGIN                        | myGroup1,myGroup2            | Unlogged rollback to mark Mk2 (timestamp)                                                                              | postgres
 DBLINK_OPEN_CNX         |                              | rlbk#1                       | Status = 1                                                                                                             | postgres
 LOCK_GROUP              | BEGIN                        | myGroup1,myGroup2            | Rollback session #1                                                                                                    | postgres
 LOCK_GROUP              | END                          | myGroup1,myGroup2            | Rollback session #1: 11 tables locked, 0 deadlock(s)                                                                   | postgres
 ROLLBACK_GROUPS         | MARK DELETED                 | myGroup1                     | mark ALTER_% is deleted                                                                                                | postgres
 ROLLBACK_GROUPS         | MARK DELETED                 | myGroup2                     | mark ALTER_% is deleted                                                                                                | postgres
 ROLLBACK_GROUPS         | MARK DELETED                 | myGroup1                     | mark ALTER_% is deleted                                                                                                | postgres
 ROLLBACK_GROUPS         | MARK DELETED                 | myGroup2                     | mark ALTER_% is deleted                                                                                                | postgres
 ROLLBACK_GROUPS         | MARK DELETED                 | myGroup2                     | mark ADD_SEQ test is deleted                                                                                           | postgres
 ROLLBACK_GROUPS         | MARK DELETED                 | myGroup1                     | mark Mk2b is deleted                                                                                                   | postgres
 ROLLBACK_GROUPS         | MARK DELETED                 | myGroup2                     | mark ADD_TBL test is deleted                                                                                           | postgres
 ROLLBACK_GROUPS         | MARK DELETED                 | myGroup1                     | mark tables re-added to myGroup1 is deleted                                                                            | postgres
 ROLLBACK_GROUPS         | MARK DELETED                 | myGroup1                     | mark Mk3 is deleted                                                                                                    | postgres
 ROLLBACK_GROUPS         | MARK DELETED                 | myGroup2                     | mark Mk3 is deleted                                                                                                    | postgres
 ROLLBACK_GROUPS         | MARK DELETED                 | myGroup1                     | mark RLBK_Mk2_%_START is deleted                                                                                       | postgres
 ROLLBACK_GROUPS         | MARK DELETED                 | myGroup2                     | mark RLBK_Mk2_%_START is deleted                                                                                       | postgres
 ROLLBACK_GROUPS         | MARK DELETED                 | myGroup1                     | mark RLBK_Mk2_%_DONE is deleted                                                                                        | postgres
 ROLLBACK_GROUPS         | MARK DELETED                 | myGroup2                     | mark RLBK_Mk2_%_DONE is deleted                                                                                        | postgres
 ROLLBACK_SEQUENCE       |                              | myschema1."myTbl3_col31_seq" |                                                                                                                        | postgres
 ROLLBACK_SEQUENCE       |                              | myschema1.mytbl2b_col20_seq  |                                                                                                                        | postgres
 ROLLBACK_SEQUENCE       |                              | myschema2."myTbl3_col31_seq" |                                                                                                                        | postgres
 ROLLBACK_SEQUENCE       |                              | myschema2.myseq1             |                                                                                                                        | postgres
 ROLLBACK_GROUPS         | NOTICE                       | Rollback id 6014             | 0 / 11 tables effectively processed.                                                                                   | postgres
 ROLLBACK_GROUPS         | NOTICE                       | Rollback id 6014             | 4 sequences processed.                                                                                                 | postgres
 DBLINK_CLOSE_CNX        |                              | rlbk#1                       |                                                                                                                        | postgres
 ROLLBACK_GROUPS         | END                          | myGroup1,myGroup2            | Rollback_id 6014, 0 tables and 4 sequences effectively processed                                                       | postgres
 ROLLBACK_GROUPS         | BEGIN                        | myGroup1,myGroup2            | Unlogged rollback to mark Mk1 (timestamp)                                                                              | postgres
 DBLINK_OPEN_CNX         |                              | rlbk#1                       | Status = 1                                                                                                             | postgres
 LOCK_GROUP              | BEGIN                        | myGroup1,myGroup2            | Rollback session #1                                                                                                    | postgres
 LOCK_GROUP              | END                          | myGroup1,myGroup2            | Rollback session #1: 11 tables locked, 0 deadlock(s)                                                                   | postgres
 ROLLBACK_GROUPS         | MARK DELETED                 | myGroup1                     | mark Priority Changed is deleted                                                                                       | postgres
 ROLLBACK_GROUPS         | MARK DELETED                 | myGroup1                     | mark Attributes_changed is deleted                                                                                     | postgres
 ROLLBACK_GROUPS         | MARK DELETED                 | myGroup2                     | mark Attributes_changed is deleted                                                                                     | postgres
 ROLLBACK_GROUPS         | MARK DELETED                 | myGroup1                     | mark Mk2 is deleted                                                                                                    | postgres
 ROLLBACK_GROUPS         | MARK DELETED                 | myGroup2                     | mark Mk2 is deleted                                                                                                    | postgres
 ROLLBACK_SEQUENCE       |                              | myschema1."myTbl3_col31_seq" |                                                                                                                        | postgres
 ROLLBACK_SEQUENCE       |                              | myschema1.mytbl2b_col20_seq  |                                                                                                                        | postgres
 ROLLBACK_SEQUENCE       |                              | myschema2."myTbl3_col31_seq" |                                                                                                                        | postgres
 ROLLBACK_SEQUENCE       |                              | myschema2.myseq1             |                                                                                                                        | postgres
 ROLLBACK_GROUPS         | NOTICE                       | Rollback id 6015             | 0 / 11 tables effectively processed.                                                                                   | postgres
 ROLLBACK_GROUPS         | NOTICE                       | Rollback id 6015             | 4 sequences processed.                                                                                                 | postgres
 ROLLBACK_GROUPS         | WARNING                      | Rollback id 6015             | Tables group change not rolled back: E-Maj priority for myschema1.mytbl1                                               | postgres
 ROLLBACK_GROUPS         | WARNING                      | Rollback id 6015             | Tables group change not rolled back: log data tablespace for myschema1.mytbl2b                                         | postgres
 ROLLBACK_GROUPS         | WARNING                      | Rollback id 6015             | Tables group change not rolled back: log index tablespace for myschema2.mytbl6                                         | postgres
 DBLINK_CLOSE_CNX        |                              | rlbk#1                       |                                                                                                                        | postgres
 ROLLBACK_GROUPS         | END                          | myGroup1,myGroup2            | Rollback_id 6015, 0 tables and 4 sequences effectively processed                                                       | postgres
 ROLLBACK_GROUPS         | BEGIN                        | myGroup1,myGroup2            | Logged rollback to mark Mk1 (timestamp)                                                                                | postgres
 DBLINK_OPEN_CNX         |                              | rlbk#1                       | Status = 1                                                                                                             | postgres
 LOCK_GROUP              | BEGIN                        | myGroup1,myGroup2            | Rollback session #1                                                                                                    | postgres
 LOCK_GROUP              | END                          | myGroup1,myGroup2            | Rollback session #1: 11 tables locked, 0 deadlock(s)                                                                   | postgres
 SET_MARK_GROUPS         | BEGIN                        | myGroup1,myGroup2            | RLBK_Mk1_%_START                                                                                                       | postgres
 CLEANUP_RLBK_STATE      |                              | Rollback id 6013             | set to COMMITTED                                                                                                       | postgres
 CLEANUP_RLBK_STATE      |                              | Rollback id 6014             | set to COMMITTED                                                                                                       | postgres
 CLEANUP_RLBK_STATE      |                              | Rollback id 6015             | set to COMMITTED                                                                                                       | postgres
 SET_MARK_GROUPS         | END                          | myGroup1,myGroup2            | RLBK_Mk1_%_START                                                                                                       | postgres
 ROLLBACK_SEQUENCE       |                              | myschema1."myTbl3_col31_seq" |                                                                                                                        | postgres
 ROLLBACK_SEQUENCE       |                              | myschema1.mytbl2b_col20_seq  |                                                                                                                        | postgres
 ROLLBACK_SEQUENCE       |                              | myschema2."myTbl3_col31_seq" |                                                                                                                        | postgres
 ROLLBACK_SEQUENCE       |                              | myschema2.myseq1             |                                                                                                                        | postgres
 SET_MARK_GROUPS         | BEGIN                        | myGroup1,myGroup2            | RLBK_Mk1_%_DONE                                                                                                        | postgres
 SET_MARK_GROUPS         | END                          | myGroup1,myGroup2            | RLBK_Mk1_%_DONE                                                                                                        | postgres
 ROLLBACK_GROUPS         | NOTICE                       | Rollback id 6016             | 0 / 11 tables effectively processed.                                                                                   | postgres
 ROLLBACK_GROUPS         | NOTICE                       | Rollback id 6016             | 4 sequences processed.                                                                                                 | postgres
 DBLINK_CLOSE_CNX        |                              | rlbk#1                       |                                                                                                                        | postgres
 ROLLBACK_GROUPS         | END                          | myGroup1,myGroup2            | Rollback_id 6016, 0 tables and 4 sequences effectively processed                                                       | postgres
 ROLLBACK_GROUPS         | BEGIN                        | myGroup1,myGroup2            | Unlogged rollback to mark Mk1 (timestamp)                                                                              | postgres
 DBLINK_OPEN_CNX         |                              | rlbk#1                       | Status = 1                                                                                                             | postgres
 LOCK_GROUP              | BEGIN                        | myGroup1,myGroup2            | Rollback session #1                                                                                                    | postgres
 LOCK_GROUP              | END                          | myGroup1,myGroup2            | Rollback session #1: 11 tables locked, 0 deadlock(s)                                                                   | postgres
 ROLLBACK_GROUPS         | MARK DELETED                 | myGroup1                     | mark RLBK_Mk1_%_START is deleted                                                                                       | postgres
 ROLLBACK_GROUPS         | MARK DELETED                 | myGroup2                     | mark RLBK_Mk1_%_START is deleted                                                                                       | postgres
 ROLLBACK_GROUPS         | MARK DELETED                 | myGroup1                     | mark RLBK_Mk1_%_DONE is deleted                                                                                        | postgres
 ROLLBACK_GROUPS         | MARK DELETED                 | myGroup2                     | mark RLBK_Mk1_%_DONE is deleted                                                                                        | postgres
 ROLLBACK_SEQUENCE       |                              | myschema1."myTbl3_col31_seq" |                                                                                                                        | postgres
 ROLLBACK_SEQUENCE       |                              | myschema1.mytbl2b_col20_seq  |                                                                                                                        | postgres
 ROLLBACK_SEQUENCE       |                              | myschema2."myTbl3_col31_seq" |                                                                                                                        | postgres
 ROLLBACK_SEQUENCE       |                              | myschema2.myseq1             |                                                                                                                        | postgres
 ROLLBACK_GROUPS         | NOTICE                       | Rollback id 6017             | 0 / 11 tables effectively processed.                                                                                   | postgres
 ROLLBACK_GROUPS         | NOTICE                       | Rollback id 6017             | 4 sequences processed.                                                                                                 | postgres
 DBLINK_CLOSE_CNX        |                              | rlbk#1                       |                                                                                                                        | postgres
 ROLLBACK_GROUPS         | END                          | myGroup1,myGroup2            | Rollback_id 6017, 0 tables and 4 sequences effectively processed                                                       | postgres
 SET_MARK_GROUPS         | BEGIN                        | myGroup1,myGroup2            | before move                                                                                                            | postgres
 LOCK_GROUPS             | BEGIN                        | myGroup1,myGroup2            |                                                                                                                        | postgres
 LOCK_GROUPS             | END                          | myGroup1,myGroup2            | 11 tables locked, 0 deadlock(s)                                                                                        | postgres
 CLEANUP_RLBK_STATE      |                              | Rollback id 6016             | set to COMMITTED                                                                                                       | postgres
 CLEANUP_RLBK_STATE      |                              | Rollback id 6017             | set to COMMITTED                                                                                                       | postgres
 SET_MARK_GROUPS         | END                          | myGroup1,myGroup2            | before move                                                                                                            | postgres
 ALTER_GROUPS            | BEGIN                        | myGroup1,myGroup2            |                                                                                                                        | postgres
 LOCK_GROUPS             | BEGIN                        | myGroup1,myGroup2            |                                                                                                                        | postgres
 LOCK_GROUPS             | END                          | myGroup1,myGroup2            | 11 tables locked, 0 deadlock(s)                                                                                        | postgres
 SET_MARK_GROUPS         | BEGIN                        | myGroup1,myGroup2            | move to myGroup1                                                                                                       | postgres
 SET_MARK_GROUPS         | END                          | myGroup1,myGroup2            | move to myGroup1                                                                                                       | postgres
 ALTER_GROUPS            | LOG DATA TABLESPACE CHANGED  | myschema2."myTbl3"           | Default tablespace => tsplog1                                                                                          | postgres
 ALTER_GROUPS            | LOG INDEX TABLESPACE CHANGED | myschema2."myTbl3"           | Default tablespace => tsplog1                                                                                          | postgres
 ALTER_GROUPS            | TABLE MOVED                  | myschema2."myTbl3"           | From group myGroup2 to group myGroup1                                                                                  | postgres
 ALTER_GROUPS            | SEQUENCE MOVED               | myschema2."myTbl3_col31_seq" | From the group myGroup2 to the group myGroup1                                                                          | postgres
 ALTER_GROUPS            | END                          | myGroup1,myGroup2            | Timestamp Id : 6120                                                                                                    | postgres
 SET_MARK_GROUPS         | BEGIN                        | myGroup1,myGroup2            | after move                                                                                                             | postgres
 LOCK_GROUPS             | BEGIN                        | myGroup1,myGroup2            |                                                                                                                        | postgres
 LOCK_GROUPS             | END                          | myGroup1,myGroup2            | 11 tables locked, 0 deadlock(s)                                                                                        | postgres
 SET_MARK_GROUPS         | END                          | myGroup1,myGroup2            | after move                                                                                                             | postgres
 GEN_SQL_GROUPS          | BEGIN                        | myGroup1,myGroup2            | From mark before move to current situation towards /tmp/emaj_test/alter/myFile with tables/sequences filtering         | postgres
 GEN_SQL_GROUPS          | END                          | myGroup1,myGroup2            | 4 generated statements                                                                                                 | postgres
 ROLLBACK_GROUPS         | BEGIN                        | myGroup1,myGroup2            | Logged rollback to mark after move (timestamp)                                                                         | postgres
 DBLINK_OPEN_CNX         |                              | rlbk#1                       | Status = 1                                                                                                             | postgres
 LOCK_GROUP              | BEGIN                        | myGroup1,myGroup2            | Rollback session #1                                                                                                    | postgres
 LOCK_GROUP              | END                          | myGroup1,myGroup2            | Rollback session #1: 11 tables locked, 0 deadlock(s)                                                                   | postgres
 SET_MARK_GROUPS         | BEGIN                        | myGroup1,myGroup2            | RLBK_after move_%_START                                                                                                | postgres
 SET_MARK_GROUPS         | END                          | myGroup1,myGroup2            | RLBK_after move_%_START                                                                                                | postgres
 ROLLBACK_TABLE          | BEGIN                        | myschema2."myTbl3"           | All log rows with emaj_gid > 11887 and <= 11889                                                                        | postgres
 ROLLBACK_TABLE          | END                          | myschema2."myTbl3"           | 2 rolled back primary keys                                                                                             | postgres
 ROLLBACK_SEQUENCE       |                              | myschema1."myTbl3_col31_seq" |                                                                                                                        | postgres
 ROLLBACK_SEQUENCE       |                              | myschema1.mytbl2b_col20_seq  |                                                                                                                        | postgres
 ROLLBACK_SEQUENCE       |                              | myschema2."myTbl3_col31_seq" |                                                                                                                        | postgres
 ROLLBACK_SEQUENCE       |                              | myschema2.myseq1             |                                                                                                                        | postgres
 SET_MARK_GROUPS         | BEGIN                        | myGroup1,myGroup2            | RLBK_after move_%_DONE                                                                                                 | postgres
 SET_MARK_GROUPS         | END                          | myGroup1,myGroup2            | RLBK_after move_%_DONE                                                                                                 | postgres
 ROLLBACK_GROUPS         | NOTICE                       | Rollback id 6018             | 1 / 11 tables effectively processed.                                                                                   | postgres
 ROLLBACK_GROUPS         | NOTICE                       | Rollback id 6018             | 4 sequences processed.                                                                                                 | postgres
 DBLINK_CLOSE_CNX        |                              | rlbk#1                       |                                                                                                                        | postgres
 ROLLBACK_GROUPS         | END                          | myGroup1,myGroup2            | Rollback_id 6018, 1 tables and 4 sequences effectively processed                                                       | postgres
 ROLLBACK_GROUPS         | BEGIN                        | myGroup1,myGroup2            | Unlogged rollback to mark before move (timestamp)                                                                      | postgres
 DBLINK_OPEN_CNX         |                              | rlbk#1                       | Status = 1                                                                                                             | postgres
 LOCK_GROUP              | BEGIN                        | myGroup1,myGroup2            | Rollback session #1                                                                                                    | postgres
 LOCK_GROUP              | END                          | myGroup1,myGroup2            | Rollback session #1: 11 tables locked, 0 deadlock(s)                                                                   | postgres
 ROLLBACK_TABLE          | BEGIN                        | myschema2."myTbl3"           | All log rows with emaj_gid > 11887 and <= 11893                                                                        | postgres
 ROLLBACK_TABLE          | END                          | myschema2."myTbl3"           | 2 rolled back primary keys                                                                                             | postgres
 ROLLBACK_GROUPS         | MARK DELETED                 | myGroup1                     | mark move to myGroup1 is deleted                                                                                       | postgres
 ROLLBACK_GROUPS         | MARK DELETED                 | myGroup2                     | mark move to myGroup1 is deleted                                                                                       | postgres
 ROLLBACK_GROUPS         | MARK DELETED                 | myGroup1                     | mark after move is deleted                                                                                             | postgres
 ROLLBACK_GROUPS         | MARK DELETED                 | myGroup2                     | mark after move is deleted                                                                                             | postgres
 ROLLBACK_GROUPS         | MARK DELETED                 | myGroup1                     | mark RLBK_after move_%_START is deleted                                                                                | postgres
 ROLLBACK_GROUPS         | MARK DELETED                 | myGroup2                     | mark RLBK_after move_%_START is deleted                                                                                | postgres
 ROLLBACK_GROUPS         | MARK DELETED                 | myGroup1                     | mark RLBK_after move_%_DONE is deleted                                                                                 | postgres
 ROLLBACK_GROUPS         | MARK DELETED                 | myGroup2                     | mark RLBK_after move_%_DONE is deleted                                                                                 | postgres
 ROLLBACK_SEQUENCE       |                              | myschema1."myTbl3_col31_seq" |                                                                                                                        | postgres
 ROLLBACK_SEQUENCE       |                              | myschema1.mytbl2b_col20_seq  |                                                                                                                        | postgres
 ROLLBACK_SEQUENCE       |                              | myschema2."myTbl3_col31_seq" |                                                                                                                        | postgres
 ROLLBACK_SEQUENCE       |                              | myschema2.myseq1             |                                                                                                                        | postgres
 ROLLBACK_GROUPS         | NOTICE                       | Rollback id 6019             | 1 / 11 tables effectively processed.                                                                                   | postgres
 ROLLBACK_GROUPS         | NOTICE                       | Rollback id 6019             | 4 sequences processed.                                                                                                 | postgres
 ROLLBACK_GROUPS         | WARNING                      | Rollback id 6019             | Tables group change not rolled back: log data tablespace for myschema2."myTbl3"                                        | postgres
 ROLLBACK_GROUPS         | WARNING                      | Rollback id 6019             | Tables group change not rolled back: log index tablespace for myschema2."myTbl3"                                       | postgres
 ROLLBACK_GROUPS         | WARNING                      | Rollback id 6019             | The table myschema2."myTbl3" has only been rolled back to its latest group attachment (<timestamp>)                    | postgres
 ROLLBACK_GROUPS         | WARNING                      | Rollback id 6019             | The sequence myschema2."myTbl3_col31_seq" has only been rolled back to its latest group attachment state (<timestamp>) | postgres
 DBLINK_CLOSE_CNX        |                              | rlbk#1                       |                                                                                                                        | postgres
 ROLLBACK_GROUPS         | END                          | myGroup1,myGroup2            | Rollback_id 6019, 1 tables and 4 sequences effectively processed                                                       | postgres
 GEN_SQL_GROUPS          | BEGIN                        | myGroup1,myGroup2            | From mark before move to current situation towards /tmp/emaj_test/alter/myFile with tables/sequences filtering         | postgres
 GEN_SQL_GROUPS          | END                          | myGroup1,myGroup2            | 4 generated statements                                                                                                 | postgres
 STOP_GROUP              | BEGIN                        | myGroup2                     |                                                                                                                        | postgres
 LOCK_GROUP              | BEGIN                        | myGroup2                     |                                                                                                                        | postgres
 LOCK_GROUP              | END                          | myGroup2                     | 5 tables locked, 0 deadlock(s)                                                                                         | postgres
 SET_MARK_GROUP          | BEGIN                        | myGroup2                     | STOP_%                                                                                                                 | postgres
 CLEANUP_RLBK_STATE      |                              | Rollback id 6018             | set to COMMITTED                                                                                                       | postgres
 CLEANUP_RLBK_STATE      |                              | Rollback id 6019             | set to COMMITTED                                                                                                       | postgres
 SET_MARK_GROUP          | END                          | myGroup2                     | STOP_%                                                                                                                 | postgres
 STOP_GROUP              | END                          | myGroup2                     | 6 tables/sequences processed                                                                                           | postgres
 ALTER_GROUPS            | BEGIN                        | myGroup1,myGroup2            |                                                                                                                        | postgres
 LOCK_GROUPS             | BEGIN                        | myGroup1                     |                                                                                                                        | postgres
 LOCK_GROUPS             | END                          | myGroup1                     | 6 tables locked, 0 deadlock(s)                                                                                         | postgres
 SET_MARK_GROUPS         | BEGIN                        | myGroup1                     | back to idle myGroup2                                                                                                  | postgres
 SET_MARK_GROUPS         | END                          | myGroup1                     | back to idle myGroup2                                                                                                  | postgres
 ALTER_GROUPS            | LOG DATA TABLESPACE CHANGED  | myschema2."myTbl3"           | tsplog1 => Default tablespace                                                                                          | postgres
 ALTER_GROUPS            | LOG INDEX TABLESPACE CHANGED | myschema2."myTbl3"           | tsplog1 => Default tablespace                                                                                          | postgres
 ALTER_GROUPS            | TABLE MOVED                  | myschema2."myTbl3"           | From group myGroup1 to group myGroup2                                                                                  | postgres
 ALTER_GROUPS            | SEQUENCE MOVED               | myschema2."myTbl3_col31_seq" | From the group myGroup1 to the group myGroup2                                                                          | postgres
 ALTER_GROUPS            | END                          | myGroup1,myGroup2            | Timestamp Id : 6126                                                                                                    | postgres
 START_GROUP             | BEGIN                        | myGroup2                     | With log reset                                                                                                         | postgres
 LOCK_GROUP              | BEGIN                        | myGroup2                     |                                                                                                                        | postgres
 LOCK_GROUP              | END                          | myGroup2                     | 6 tables locked, 0 deadlock(s)                                                                                         | postgres
 SET_MARK_GROUP          | BEGIN                        | myGroup2                     | Start                                                                                                                  | postgres
 SET_MARK_GROUP          | END                          | myGroup2                     | Start                                                                                                                  | postgres
 START_GROUP             | END                          | myGroup2                     | 8 tables/sequences processed                                                                                           | postgres
 REMOVE_TABLES           | BEGIN                        |                              |                                                                                                                        | postgres
 LOCK_GROUP              | BEGIN                        | myGroup2,myGroup2,myGroup2   |                                                                                                                        | postgres
 LOCK_GROUP              | END                          | myGroup2,myGroup2,myGroup2   | 6 tables locked, 0 deadlock(s)                                                                                         | postgres
 SET_MARK_GROUP          | BEGIN                        | myGroup2,myGroup2,myGroup2   | REMOVE_3_TABLES                                                                                                        | postgres
 SET_MARK_GROUP          | END                          | myGroup2,myGroup2,myGroup2   | REMOVE_3_TABLES                                                                                                        | postgres
 REMOVE_TABLES           | TABLE REMOVED                | myschema2."myTbl3"           | From the logging group myGroup2                                                                                        | postgres
 REMOVE_TABLES           | TABLE REMOVED                | myschema2.mytbl1             | From the logging group myGroup2                                                                                        | postgres
 REMOVE_TABLES           | TABLE REMOVED                | myschema2.mytbl2             | From the logging group myGroup2                                                                                        | postgres
 REMOVE_TABLES           | END                          |                              | 3 tables removed from their groups                                                                                     | postgres
 REMOVE_SEQUENCE         | BEGIN                        |                              |                                                                                                                        | postgres
 LOCK_GROUP              | BEGIN                        | myGroup2                     |                                                                                                                        | postgres
 LOCK_GROUP              | END                          | myGroup2                     | 3 tables locked, 0 deadlock(s)                                                                                         | postgres
 SET_MARK_GROUP          | BEGIN                        | myGroup2                     | REMOVE_1_SEQUENCES                                                                                                     | postgres
 SET_MARK_GROUP          | END                          | myGroup2                     | REMOVE_1_SEQUENCES                                                                                                     | postgres
 REMOVE_SEQUENCE         | SEQUENCE REMOVED             | myschema2.myseq1             | From the logging group myGroup2                                                                                        | postgres
 REMOVE_SEQUENCE         | END                          |                              | 1 sequences removed from their groups                                                                                  | postgres
 ASSIGN_TABLES           | BEGIN                        |                              |                                                                                                                        | postgres
 LOCK_GROUP              | BEGIN                        | myGroup2                     |                                                                                                                        | postgres
 LOCK_GROUP              | END                          | myGroup2                     | 3 tables locked, 0 deadlock(s)                                                                                         | postgres
 SET_MARK_GROUP          | BEGIN                        | myGroup2                     | ASSIGN_3_TABLES                                                                                                        | postgres
 SET_MARK_GROUP          | END                          | myGroup2                     | ASSIGN_3_TABLES                                                                                                        | postgres
 ASSIGN_TABLES           | TABLE ADDED                  | myschema2."myTbl3"           | To the logging group myGroup2                                                                                          | postgres
 ASSIGN_TABLES           | TABLE ADDED                  | myschema2.mytbl1             | To the logging group myGroup2                                                                                          | postgres
 ASSIGN_TABLES           | TABLE ADDED                  | myschema2.mytbl2             | To the logging group myGroup2                                                                                          | postgres
 ASSIGN_TABLES           | END                          |                              | 3 tables assigned to the group myGroup2                                                                                | postgres
 ASSIGN_SEQUENCES        | BEGIN                        |                              |                                                                                                                        | postgres
 LOCK_GROUP              | BEGIN                        | myGroup2                     |                                                                                                                        | postgres
 LOCK_GROUP              | END                          | myGroup2                     | 6 tables locked, 0 deadlock(s)                                                                                         | postgres
 SET_MARK_GROUP          | BEGIN                        | myGroup2                     | ASSIGN_2_SEQUENCES                                                                                                     | postgres
 SET_MARK_GROUP          | END                          | myGroup2                     | ASSIGN_2_SEQUENCES                                                                                                     | postgres
 ASSIGN_SEQUENCES        | SEQUENCE ADDED               | myschema2.myseq1             | To the logging group myGroup2                                                                                          | postgres
 ASSIGN_SEQUENCES        | SEQUENCE ADDED               | myschema2.myseq2             | To the logging group myGroup2                                                                                          | postgres
 ASSIGN_SEQUENCES        | END                          |                              | 2 sequences assigned to the group myGroup2                                                                             | postgres
 DISABLE_PROTECTION      | EVENT TRIGGERS DISABLED      |                              | emaj_protection_trg, emaj_sql_drop_trg, emaj_table_rewrite_trg                                                         | postgres
 ENABLE_PROTECTION       | EVENT TRIGGERS ENABLED       |                              | emaj_protection_trg, emaj_sql_drop_trg, emaj_table_rewrite_trg                                                         | postgres
 REMOVE_TABLES           | BEGIN                        |                              |                                                                                                                        | postgres
 LOCK_GROUP              | BEGIN                        | myGroup2,myGroup2,myGroup2   |                                                                                                                        | postgres
 LOCK_GROUP              | END                          | myGroup2,myGroup2,myGroup2   | 6 tables locked, 0 deadlock(s)                                                                                         | postgres
 SET_MARK_GROUP          | BEGIN                        | myGroup2,myGroup2,myGroup2   | REMOVE_%                                                                                                               | postgres
 SET_MARK_GROUP          | END                          | myGroup2,myGroup2,myGroup2   | REMOVE_%                                                                                                               | postgres
 REMOVE_TABLES           | TABLE REMOVED                | myschema2."myTbl3"           | From the logging group myGroup2                                                                                        | postgres
 REMOVE_TABLES           | TABLE REMOVED                | myschema2.mytbl1             | From the logging group myGroup2                                                                                        | postgres
 REMOVE_TABLES           | TABLE REMOVED                | myschema2.mytbl2             | From the logging group myGroup2                                                                                        | postgres
 REMOVE_TABLES           | END                          |                              | 3 tables removed from their groups                                                                                     | postgres
 REMOVE_SEQUENCES        | BEGIN                        |                              |                                                                                                                        | postgres
 LOCK_GROUP              | BEGIN                        | myGroup2,myGroup2            |                                                                                                                        | postgres
 LOCK_GROUP              | END                          | myGroup2,myGroup2            | 3 tables locked, 0 deadlock(s)                                                                                         | postgres
 SET_MARK_GROUP          | BEGIN                        | myGroup2,myGroup2            | REMOVE_%                                                                                                               | postgres
 SET_MARK_GROUP          | END                          | myGroup2,myGroup2            | REMOVE_%                                                                                                               | postgres
 REMOVE_SEQUENCES        | SEQUENCE REMOVED             | myschema2.myseq1             | From the logging group myGroup2                                                                                        | postgres
 REMOVE_SEQUENCES        | SEQUENCE REMOVED             | myschema2.myseq2             | From the logging group myGroup2                                                                                        | postgres
 REMOVE_SEQUENCES        | END                          |                              | 2 sequences removed from their groups                                                                                  | postgres
 ASSIGN_TABLES           | BEGIN                        |                              |                                                                                                                        | postgres
 LOCK_GROUP              | BEGIN                        | myGroup2                     |                                                                                                                        | postgres
 LOCK_GROUP              | END                          | myGroup2                     | 3 tables locked, 0 deadlock(s)                                                                                         | postgres
 SET_MARK_GROUP          | BEGIN                        | myGroup2                     | ASSIGN_%                                                                                                               | postgres
 SET_MARK_GROUP          | END                          | myGroup2                     | ASSIGN_%                                                                                                               | postgres
 ASSIGN_TABLES           | TABLE ADDED                  | myschema2."myTbl3"           | To the logging group myGroup2                                                                                          | postgres
 ASSIGN_TABLES           | TABLE ADDED                  | myschema2.mytbl1             | To the logging group myGroup2                                                                                          | postgres
 ASSIGN_TABLES           | TABLE ADDED                  | myschema2.mytbl2             | To the logging group myGroup2                                                                                          | postgres
 ASSIGN_TABLES           | END                          |                              | 3 tables assigned to the group myGroup2                                                                                | postgres
 ASSIGN_SEQUENCES        | BEGIN                        |                              |                                                                                                                        | postgres
 LOCK_GROUP              | BEGIN                        | myGroup2                     |                                                                                                                        | postgres
 LOCK_GROUP              | END                          | myGroup2                     | 6 tables locked, 0 deadlock(s)                                                                                         | postgres
 SET_MARK_GROUP          | BEGIN                        | myGroup2                     | ASSIGN_%                                                                                                               | postgres
 SET_MARK_GROUP          | END                          | myGroup2                     | ASSIGN_%                                                                                                               | postgres
 ASSIGN_SEQUENCES        | SEQUENCE ADDED               | myschema2.myseq1             | To the logging group myGroup2                                                                                          | postgres
 ASSIGN_SEQUENCES        | SEQUENCE ADDED               | myschema2.myseq2             | To the logging group myGroup2                                                                                          | postgres
 ASSIGN_SEQUENCES        | END                          |                              | 2 sequences assigned to the group myGroup2                                                                             | postgres
 REMOVE_TABLE            | BEGIN                        |                              |                                                                                                                        | postgres
 LOCK_GROUP              | BEGIN                        | myGroup1                     |                                                                                                                        | postgres
 LOCK_GROUP              | END                          | myGroup1                     | 5 tables locked, 0 deadlock(s)                                                                                         | postgres
 SET_MARK_GROUP          | BEGIN                        | myGroup1                     | REMOVE_%                                                                                                               | postgres
 SET_MARK_GROUP          | END                          | myGroup1                     | REMOVE_%                                                                                                               | postgres
 REMOVE_TABLE            | TABLE REMOVED                | myschema1.mytbl4             | From the logging group myGroup1                                                                                        | postgres
 REMOVE_TABLE            | END                          |                              | 1 tables removed from their groups                                                                                     | postgres
 ASSIGN_TABLE            | BEGIN                        |                              |                                                                                                                        | postgres
 LOCK_GROUP              | BEGIN                        | myGroup1                     |                                                                                                                        | postgres
 LOCK_GROUP              | END                          | myGroup1                     | 4 tables locked, 0 deadlock(s)                                                                                         | postgres
 SET_MARK_GROUP          | BEGIN                        | myGroup1                     | ASSIGN_%                                                                                                               | postgres
 SET_MARK_GROUP          | END                          | myGroup1                     | ASSIGN_%                                                                                                               | postgres
 ASSIGN_TABLE            | TABLE ADDED                  | myschema1.mytbl4             | To the logging group myGroup1                                                                                          | postgres
 ASSIGN_TABLE            | END                          |                              | 1 tables assigned to the group myGroup1                                                                                | postgres
 REMOVE_TABLE            | BEGIN                        |                              |                                                                                                                        | postgres
 LOCK_GROUP              | BEGIN                        | myGroup1                     |                                                                                                                        | postgres
 LOCK_GROUP              | END                          | myGroup1                     | 5 tables locked, 0 deadlock(s)                                                                                         | postgres
 SET_MARK_GROUP          | BEGIN                        | myGroup1                     | REMOVE_%                                                                                                               | postgres
 SET_MARK_GROUP          | END                          | myGroup1                     | REMOVE_%                                                                                                               | postgres
 REMOVE_TABLE            | TABLE REMOVED                | myschema1.mytbl4             | From the logging group myGroup1                                                                                        | postgres
 REMOVE_TABLE            | END                          |                              | 1 tables removed from their groups                                                                                     | postgres
 ASSIGN_TABLE            | BEGIN                        |                              |                                                                                                                        | postgres
 LOCK_GROUP              | BEGIN                        | myGroup1                     |                                                                                                                        | postgres
 LOCK_GROUP              | END                          | myGroup1                     | 4 tables locked, 0 deadlock(s)                                                                                         | postgres
 SET_MARK_GROUP          | BEGIN                        | myGroup1                     | ASSIGN_%                                                                                                               | postgres
 SET_MARK_GROUP          | END                          | myGroup1                     | ASSIGN_%                                                                                                               | postgres
 ASSIGN_TABLE            | TABLE ADDED                  | myschema1.mytbl4             | To the logging group myGroup1                                                                                          | postgres
 ASSIGN_TABLE            | END                          |                              | 1 tables assigned to the group myGroup1                                                                                | postgres
 FORCE_DROP_GROUP        | BEGIN                        | myGroup1                     |                                                                                                                        | postgres
 FORCE_DROP_GROUP        | LOG_SCHEMA DROPPED           | emaj_myschema1               |                                                                                                                        | postgres
 FORCE_DROP_GROUP        | END                          | myGroup1                     | 7 tables/sequences processed                                                                                           | postgres
 FORCE_DROP_GROUP        | BEGIN                        | myGroup2                     |                                                                                                                        | postgres
 FORCE_DROP_GROUP        | LOG_SCHEMA DROPPED           | emaj_myschema2               |                                                                                                                        | postgres
 FORCE_DROP_GROUP        | END                          | myGroup2                     | 9 tables/sequences processed                                                                                           | postgres
 FORCE_DROP_GROUP        | BEGIN                        | myGroup4                     |                                                                                                                        | postgres
 FORCE_DROP_GROUP        | LOG_SCHEMA DROPPED           | emaj_myschema4               |                                                                                                                        | postgres
 FORCE_DROP_GROUP        | END                          | myGroup4                     | 5 tables/sequences processed                                                                                           | postgres
(819 rows)

select time_id, time_last_emaj_gid, time_event from emaj.emaj_time_stamp where time_id > 6000 order by time_id;
 time_id | time_last_emaj_gid | time_event 
---------+--------------------+------------
    6001 |              11867 | D
    6002 |              11867 | D
    6003 |              11867 | M
    6004 |              11867 | D
    6005 |              11867 | D
    6006 |              11867 | D
    6007 |              11867 | C
    6008 |              11867 | C
    6009 |              11867 | C
    6010 |              11867 | C
    6013 |              11867 | A
    6014 |              11867 | A
    6015 |              11867 | A
    6016 |              11867 | A
    6017 |              11867 | A
    6018 |              11867 | A
    6019 |              11867 | A
    6020 |              11867 | A
    6021 |              11867 | A
    6022 |              11867 | A
    6023 |              11867 | A
    6024 |              11867 | A
    6025 |              11867 | A
    6026 |              11867 | A
    6027 |              11867 | A
    6028 |              11867 | A
    6029 |              11867 | A
    6030 |              11867 | A
    6031 |              11867 | A
    6032 |              11867 | A
    6033 |              11867 | A
    6034 |              11867 | A
    6035 |              11867 | A
    6036 |              11867 | A
    6037 |              11867 | A
    6038 |              11867 | A
    6041 |              11867 | A
    6042 |              11867 | A
    6043 |              11867 | A
    6044 |              11867 | A
    6045 |              11867 | A
    6046 |              11867 | A
    6049 |              11867 | M
    6050 |              11867 | A
    6051 |              11867 | A
    6052 |              11867 | M
    6053 |              11869 | R
    6054 |              11869 | A
    6055 |              11869 | A
    6056 |              11869 | M
    6057 |              11869 | M
    6058 |              11869 | A
    6059 |              11869 | M
    6061 |              11869 | R
    6062 |              11869 | M
    6063 |              11869 | A
    6064 |              11869 | A
    6065 |              11869 | A
    6066 |              11869 | R
    6067 |              11869 | M
    6068 |              11869 | M
    6069 |              11869 | A
    6070 |              11869 | S
    6071 |              11869 | M
    6072 |              11869 | R
    6074 |              11869 | R
    6077 |              11869 | A
    6078 |              11869 | M
    6079 |              11869 | M
    6080 |              11869 | A
    6082 |              11871 | M
    6083 |              11872 | M
    6085 |              11872 | R
    6086 |              11876 | M
    6087 |              11879 | A
    6088 |              11879 | A
    6089 |              11880 | S
    6090 |              11880 | A
    6091 |              11880 | R
    6092 |              11881 | M
    6093 |              11882 | A
    6095 |              11882 | S
    6097 |              11883 | R
    6098 |              11884 | M
    6099 |              11884 | A
    6100 |              11884 | R
    6105 |              11884 | A
    6106 |              11884 | M
    6107 |              11884 | R
    6108 |              11884 | R
    6109 |              11884 | M
    6110 |              11884 | R
    6111 |              11884 | R
    6112 |              11884 | R
    6113 |              11884 | M
    6114 |              11884 | R
    6119 |              11884 | M
    6120 |              11887 | A
    6121 |              11887 | M
    6122 |              11889 | R
    6123 |              11893 | M
    6124 |              11893 | R
    6125 |              11893 | M
    6126 |              11893 | A
    6127 |              11893 | M
    6128 |              11894 | A
    6129 |              11894 | A
    6130 |              11894 | A
    6131 |              11894 | A
    6132 |              11895 | A
    6133 |              11895 | A
    6134 |              11895 | A
    6135 |              11895 | A
    6136 |              11895 | A
    6137 |              11895 | A
    6138 |              11895 | A
    6139 |              11895 | A
    6140 |              11895 | D
    6141 |              11895 | D
    6142 |              11895 | D
(120 rows)

select * from emaj.emaj_alter_plan order by 1,2,3,4,5;
 altr_time_id |        altr_step         | altr_schema |   altr_tblseq    | altr_group | altr_priority | altr_group_is_logging | altr_new_group | altr_new_group_is_logging | altr_rlbk_id 
--------------+--------------------------+-------------+------------------+------------+---------------+-----------------------+----------------+---------------------------+--------------
         6013 | RESET_GROUP              |             |                  | emptyGroup |               | f                     |                |                           |             
         6014 | RESET_GROUP              |             |                  | myGroup1   |               | f                     |                |                           |             
         6015 | REMOVE_TBL               | myschema1   | myTbl3           | myGroup1   |            10 | f                     |                |                           |             
         6015 | REMOVE_TBL               | myschema1   | mytbl2b          | myGroup1   |               | f                     |                |                           |             
         6015 | REMOVE_TBL               | myschema1   | mytbl4           | myGroup1   |            20 | f                     |                |                           |             
         6015 | RESET_GROUP              |             |                  | myGroup1   |               | f                     |                |                           |             
         6016 | REMOVE_SEQ               | myschema1   | myTbl3_col31_seq | myGroup1   |             1 | f                     |                |                           |             
         6016 | RESET_GROUP              |             |                  | myGroup1   |               | f                     |                |                           |             
         6017 | RESET_GROUP              |             |                  | myGroup1   |               | f                     |                |                           |             
         6017 | ADD_TBL                  | myschema1   | myTbl3           | myGroup1   |            10 | f                     |                |                           |             
         6017 | ADD_TBL                  | myschema1   | mytbl2b          | myGroup1   |               | f                     |                |                           |             
         6017 | ADD_TBL                  | myschema1   | mytbl4           | myGroup1   |            20 | f                     |                |                           |             
         6018 | RESET_GROUP              |             |                  | myGroup1   |               | f                     |                |                           |             
         6018 | ADD_SEQ                  | myschema1   | myTbl3_col31_seq | myGroup1   |             1 | f                     |                |                           |             
         6019 | RESET_GROUP              |             |                  | myGroup1   |               | f                     |                |                           |             
         6019 | CHANGE_TBL_LOG_DATA_TSP  | myschema1   | mytbl2b          | myGroup1   |               | f                     |                |                           |             
         6020 | RESET_GROUP              |             |                  | myGroup1   |               | f                     |                |                           |             
         6020 | CHANGE_TBL_LOG_DATA_TSP  | myschema1   | mytbl2b          | myGroup1   |               | f                     |                |                           |             
         6021 | RESET_GROUP              |             |                  | myGroup1   |               | f                     |                |                           |             
         6021 | CHANGE_TBL_LOG_DATA_TSP  | myschema1   | myTbl3           | myGroup1   |            10 | f                     |                |                           |             
         6021 | CHANGE_TBL_LOG_DATA_TSP  | myschema1   | mytbl1           | myGroup1   |            20 | f                     |                |                           |             
         6021 | CHANGE_TBL_LOG_DATA_TSP  | myschema1   | mytbl2           | myGroup1   |               | f                     |                |                           |             
         6021 | CHANGE_TBL_LOG_DATA_TSP  | myschema1   | mytbl2b          | myGroup1   |               | f                     |                |                           |             
         6021 | CHANGE_TBL_LOG_DATA_TSP  | myschema1   | mytbl4           | myGroup1   |            20 | f                     |                |                           |             
         6022 | RESET_GROUP              |             |                  | myGroup1   |               | f                     |                |                           |             
         6022 | CHANGE_TBL_LOG_DATA_TSP  | myschema1   | myTbl3           | myGroup1   |            10 | f                     |                |                           |             
         6022 | CHANGE_TBL_LOG_DATA_TSP  | myschema1   | mytbl1           | myGroup1   |            20 | f                     |                |                           |             
         6022 | CHANGE_TBL_LOG_DATA_TSP  | myschema1   | mytbl2           | myGroup1   |               | f                     |                |                           |             
         6022 | CHANGE_TBL_LOG_DATA_TSP  | myschema1   | mytbl2b          | myGroup1   |               | f                     |                |                           |             
         6022 | CHANGE_TBL_LOG_DATA_TSP  | myschema1   | mytbl4           | myGroup1   |            20 | f                     |                |                           |             
         6023 | RESET_GROUP              |             |                  | myGroup1   |               | f                     |                |                           |             
         6023 | CHANGE_TBL_LOG_INDEX_TSP | myschema1   | mytbl2b          | myGroup1   |               | f                     |                |                           |             
         6024 | RESET_GROUP              |             |                  | myGroup1   |               | f                     |                |                           |             
         6024 | CHANGE_TBL_LOG_INDEX_TSP | myschema1   | mytbl2b          | myGroup1   |               | f                     |                |                           |             
         6025 | RESET_GROUP              |             |                  | myGroup1   |               | f                     |                |                           |             
         6025 | CHANGE_REL_PRIORITY      | myschema1   | mytbl1           | myGroup1   |            30 | f                     |                |                           |             
         6026 | RESET_GROUP              |             |                  | myGroup1   |               | f                     |                |                           |             
         6026 | CHANGE_REL_PRIORITY      | myschema1   | mytbl1           | myGroup1   |               | f                     |                |                           |             
         6027 | RESET_GROUP              |             |                  | myGroup1   |               | f                     |                |                           |             
         6027 | CHANGE_REL_PRIORITY      | myschema1   | mytbl1           | myGroup1   |            20 | f                     |                |                           |             
         6028 | REPAIR_TBL               | myschema1   | mytbl1           | myGroup1   |            20 | f                     |                |                           |             
         6028 | RESET_GROUP              |             |                  | myGroup1   |               | f                     |                |                           |             
         6029 | REPAIR_TBL               | myschema1   | mytbl1           | myGroup1   |            20 | f                     |                |                           |             
         6029 | RESET_GROUP              |             |                  | myGroup1   |               | f                     |                |                           |             
         6030 | REPAIR_TBL               | myschema1   | mytbl1           | myGroup1   |            20 | f                     |                |                           |             
         6030 | RESET_GROUP              |             |                  | myGroup1   |               | f                     |                |                           |             
         6031 | RESET_GROUP              |             |                  | myGroup1   |               | f                     |                |                           |             
         6032 | REPAIR_TBL               | myschema1   | mytbl1           | myGroup1   |            20 | f                     |                |                           |             
         6032 | RESET_GROUP              |             |                  | myGroup1   |               | f                     |                |                           |             
         6033 | REMOVE_TBL               | myschema1   | mytbl1           | myGroup1   |            20 | f                     |                |                           |             
         6033 | RESET_GROUP              |             |                  | myGroup1   |               | f                     |                |                           |             
         6033 | ADD_TBL                  | myschema1   | mytbl1_new_name  | myGroup1   |            20 | f                     |                |                           |             
         6034 | REMOVE_TBL               | myschema1   | mytbl1_new_name  | myGroup1   |            20 | f                     |                |                           |             
         6034 | RESET_GROUP              |             |                  | myGroup1   |               | f                     |                |                           |             
         6034 | ADD_TBL                  | public      | mytbl1_new_name  | myGroup1   |            20 | f                     |                |                           |             
         6035 | REMOVE_TBL               | public      | mytbl1_new_name  | myGroup1   |            20 | f                     |                |                           |             
         6035 | RESET_GROUP              |             |                  | myGroup1   |               | f                     |                |                           |             
         6035 | ADD_TBL                  | myschema1   | mytbl1           | myGroup1   |            20 | f                     |                |                           |             
         6036 | REPAIR_TBL               | myschema1   | mytbl1           | myGroup1   |            20 | f                     |                |                           |             
         6036 | RESET_GROUP              |             |                  | myGroup1   |               | f                     |                |                           |             
         6037 | REPAIR_TBL               | myschema1   | mytbl1           | myGroup1   |            20 | f                     |                |                           |             
         6037 | RESET_GROUP              |             |                  | myGroup1   |               | f                     |                |                           |             
         6038 | REPAIR_TBL               | myschema1   | mytbl1           | myGroup1   |            20 | f                     |                |                           |             
         6038 | RESET_GROUP              |             |                  | myGroup1   |               | f                     |                |                           |             
         6041 | REMOVE_TBL               | myschema1   | myTbl3           | myGroup1   |            10 | f                     |                |                           |             
         6041 | REMOVE_TBL               | myschema1   | mytbl2b          | myGroup1   |               | f                     |                |                           |             
         6041 | REMOVE_TBL               | myschema2   | mytbl4           | myGroup2   |               | f                     |                |                           |             
         6041 | REMOVE_SEQ               | myschema1   | myTbl3_col31_seq | myGroup1   |             1 | f                     |                |                           |             
         6041 | RESET_GROUP              |             |                  | myGroup1   |               | f                     |                |                           |             
         6041 | RESET_GROUP              |             |                  | myGroup2   |               | f                     |                |                           |             
         6042 | RESET_GROUP              |             |                  | myGroup1   |               | f                     |                |                           |             
         6042 | RESET_GROUP              |             |                  | myGroup2   |               | f                     |                |                           |             
         6042 | ADD_TBL                  | myschema1   | myTbl3           | myGroup1   |            10 | f                     |                |                           |             
         6042 | ADD_TBL                  | myschema1   | mytbl2b          | myGroup1   |               | f                     |                |                           |             
         6042 | ADD_TBL                  | myschema2   | mytbl4           | myGroup2   |               | f                     |                |                           |             
         6042 | ADD_SEQ                  | myschema1   | myTbl3_col31_seq | myGroup1   |             1 | f                     |                |                           |             
         6043 | RESET_GROUP              |             |                  | myGroup1   |               | f                     |                |                           |             
         6043 | RESET_GROUP              |             |                  | myGroup2   |               | f                     |                |                           |             
         6043 | CHANGE_TBL_LOG_DATA_TSP  | myschema1   | mytbl2b          | myGroup1   |               | f                     |                |                           |             
         6043 | CHANGE_TBL_LOG_INDEX_TSP | myschema2   | mytbl6           | myGroup2   |               | f                     |                |                           |             
         6043 | CHANGE_REL_PRIORITY      | myschema1   | mytbl1           | myGroup1   |            30 | f                     |                |                           |             
         6044 | RESET_GROUP              |             |                  | myGroup1   |               | f                     |                |                           |             
         6044 | RESET_GROUP              |             |                  | myGroup2   |               | f                     |                |                           |             
         6044 | CHANGE_TBL_LOG_DATA_TSP  | myschema1   | mytbl2b          | myGroup1   |               | f                     |                |                           |             
         6044 | CHANGE_TBL_LOG_INDEX_TSP | myschema2   | mytbl6           | myGroup2   |               | f                     |                |                           |             
         6044 | CHANGE_REL_PRIORITY      | myschema1   | mytbl1           | myGroup1   |            20 | f                     |                |                           |             
         6045 | RESET_GROUP              |             |                  | myGroup1   |               | f                     |                |                           |             
         6045 | RESET_GROUP              |             |                  | myGroup2   |               | f                     |                |                           |             
         6045 | MOVE_TBL                 | myschema2   | myTbl3           | myGroup2   |               | f                     | myGroup1       | f                         |             
         6045 | MOVE_SEQ                 | myschema2   | myTbl3_col31_seq | myGroup2   |               | f                     | myGroup1       | f                         |             
         6046 | RESET_GROUP              |             |                  | myGroup1   |               | f                     |                |                           |             
         6046 | RESET_GROUP              |             |                  | myGroup2   |               | f                     |                |                           |             
         6046 | MOVE_TBL                 | myschema2   | myTbl3           | myGroup1   |               | f                     | myGroup2       | f                         |             
         6046 | MOVE_SEQ                 | myschema2   | myTbl3_col31_seq | myGroup1   |               | f                     | myGroup2       | f                         |             
         6050 | CHANGE_REL_PRIORITY      | myschema1   | mytbl1           | myGroup1   |            30 | t                     |                |                           |         6015
         6051 | CHANGE_TBL_LOG_DATA_TSP  | myschema1   | mytbl2b          | myGroup1   |               | t                     |                |                           |         6015
         6051 | CHANGE_TBL_LOG_INDEX_TSP | myschema2   | mytbl6           | myGroup2   |               | t                     |                |                           |         6015
         6054 | CHANGE_REL_PRIORITY      | myschema1   | mytbl1           | myGroup1   |            20 | t                     |                |                           |         6013
         6055 | CHANGE_TBL_LOG_DATA_TSP  | myschema1   | mytbl2b          | myGroup1   |               | t                     |                |                           |         6013
         6055 | CHANGE_TBL_LOG_INDEX_TSP | myschema2   | mytbl6           | myGroup2   |               | t                     |                |                           |         6013
         6058 | ADD_SEQ                  | myschema2   | myseq2           | myGroup2   |               | t                     |                |                           |         6002
         6063 | REMOVE_SEQ               | myschema2   | myseq2           | myGroup2   |               | t                     |                |                           |         6003
         6064 | ADD_SEQ                  | myschema2   | myseq2           | myGroup2   |               | t                     |                |                           |         6003
         6065 | REMOVE_SEQ               | myschema2   | myseq2           | myGroup2   |               | t                     |                |                           |         6003
         6069 | REMOVE_SEQ               | myschema1   | myTbl3_col31_seq | myGroup1   |               | t                     |                |                           |         6010
         6077 | ADD_SEQ                  | myschema1   | myTbl3_col31_seq | myGroup1   |             1 | t                     |                |                           |         6010
         6080 | ADD_TBL                  | myschema2   | mytbl7           | myGroup2   |               | t                     |                |                           |         6007
         6087 | REMOVE_TBL               | myschema2   | mytbl7           | myGroup2   |               | t                     |                |                           |         6008
         6088 | ADD_TBL                  | myschema2   | mytbl7           | myGroup2   |               | t                     |                |                           |         6008
         6090 | REMOVE_TBL               | myschema2   | mytbl7           | myGroup2   |               | t                     |                |                           |         6008
         6093 | REMOVE_TBL               | myschema1   | myTbl3           | myGroup1   |               | t                     |                |                           |         6010
         6093 | REMOVE_TBL               | myschema1   | mytbl2b          | myGroup1   |               | t                     |                |                           |         6010
         6099 | REMOVE_TBL               | myschema1   | mytbl1           | myGroup1   |            20 | t                     |                |                           |         6011
         6105 | ADD_TBL                  | myschema1   | myTbl3           | myGroup1   |            10 | t                     |                |                           |         6013
         6105 | ADD_TBL                  | myschema1   | mytbl1           | myGroup1   |            20 | t                     |                |                           |         6013
         6105 | ADD_TBL                  | myschema1   | mytbl2b          | myGroup1   |               | t                     |                |                           |         6013
         6120 | CHANGE_TBL_LOG_DATA_TSP  | myschema2   | myTbl3           | myGroup2   |               | t                     | myGroup1       | t                         |         6019
         6120 | CHANGE_TBL_LOG_INDEX_TSP | myschema2   | myTbl3           | myGroup2   |               | t                     | myGroup1       | t                         |         6019
         6120 | MOVE_TBL                 | myschema2   | myTbl3           | myGroup2   |               | t                     | myGroup1       | t                         |         6019
         6120 | MOVE_SEQ                 | myschema2   | myTbl3_col31_seq | myGroup2   |               | t                     | myGroup1       | t                         |         6019
         6126 | RESET_GROUP              |             |                  | myGroup2   |               | f                     |                |                           |             
         6126 | CHANGE_TBL_LOG_DATA_TSP  | myschema2   | myTbl3           | myGroup1   |               | t                     | myGroup2       | f                         |             
         6126 | CHANGE_TBL_LOG_INDEX_TSP | myschema2   | myTbl3           | myGroup1   |               | t                     | myGroup2       | f                         |             
         6126 | MOVE_TBL                 | myschema2   | myTbl3           | myGroup1   |               | t                     | myGroup2       | f                         |             
         6126 | MOVE_SEQ                 | myschema2   | myTbl3_col31_seq | myGroup1   |               | t                     | myGroup2       | f                         |             
         6128 | REMOVE_TBL               | myschema2   | myTbl3           | myGroup2   |               | t                     |                |                           |             
         6128 | REMOVE_TBL               | myschema2   | mytbl1           | myGroup2   |               | t                     |                |                           |             
         6128 | REMOVE_TBL               | myschema2   | mytbl2           | myGroup2   |               | t                     |                |                           |             
         6129 | REMOVE_SEQ               | myschema2   | myseq1           | myGroup2   |               | t                     |                |                           |             
         6130 | ADD_TBL                  | myschema2   | myTbl3           | myGroup2   |               | t                     |                |                           |             
         6130 | ADD_TBL                  | myschema2   | mytbl1           | myGroup2   |               | t                     |                |                           |             
         6130 | ADD_TBL                  | myschema2   | mytbl2           | myGroup2   |               | t                     |                |                           |             
         6131 | ADD_SEQ                  | myschema2   | myseq1           | myGroup2   |               | t                     |                |                           |             
         6131 | ADD_SEQ                  | myschema2   | myseq2           | myGroup2   |               | t                     |                |                           |             
         6132 | REMOVE_TBL               | myschema2   | myTbl3           | myGroup2   |               | t                     |                |                           |             
         6132 | REMOVE_TBL               | myschema2   | mytbl1           | myGroup2   |               | t                     |                |                           |             
         6132 | REMOVE_TBL               | myschema2   | mytbl2           | myGroup2   |               | t                     |                |                           |             
         6133 | REMOVE_SEQ               | myschema2   | myseq1           | myGroup2   |               | t                     |                |                           |             
         6133 | REMOVE_SEQ               | myschema2   | myseq2           | myGroup2   |               | t                     |                |                           |             
         6134 | ADD_TBL                  | myschema2   | myTbl3           | myGroup2   |               | t                     |                |                           |             
         6134 | ADD_TBL                  | myschema2   | mytbl1           | myGroup2   |               | t                     |                |                           |             
         6134 | ADD_TBL                  | myschema2   | mytbl2           | myGroup2   |               | t                     |                |                           |             
         6135 | ADD_SEQ                  | myschema2   | myseq1           | myGroup2   |               | t                     |                |                           |             
         6135 | ADD_SEQ                  | myschema2   | myseq2           | myGroup2   |               | t                     |                |                           |             
         6136 | REMOVE_TBL               | myschema1   | mytbl4           | myGroup1   |               | t                     |                |                           |             
         6137 | ADD_TBL                  | myschema1   | mytbl4           | myGroup1   |               | t                     |                |                           |             
         6138 | REMOVE_TBL               | myschema1   | mytbl4           | myGroup1   |               | t                     |                |                           |             
         6139 | ADD_TBL                  | myschema1   | mytbl4           | myGroup1   |               | t                     |                |                           |             
(148 rows)

truncate emaj.emaj_hist;
