-- client.sql: Test client tools
--------------------------------------------------------------
--
-- Parallel Rollback clients
--
--------------------------------------------------------------
--------------------------------------------
-- Prepare data for emajParallelRollback.php
--------------------------------------------
-- set sequence restart value
truncate emaj.emaj_hist;
select public.handle_emaj_sequences(20000);
 handle_emaj_sequences 
-----------------------
 
(1 row)

delete from mySchema1.myTbl4;
delete from mySchema1.myTbl1;
delete from mySchema1.myTbl2; 
delete from mySchema1."myTbl3";
delete from mySchema1.myTbl2b;
delete from mySchema2.myTbl4;
delete from mySchema2.myTbl1;
delete from mySchema2.myTbl2; 
delete from mySchema2."myTbl3";
delete from mySchema2.myTbl5;
delete from mySchema2.myTbl6 where col61 <> 0;
alter sequence mySchema2.mySeq1 restart 9999;
--------------------------------------------
-- Call emajParallelRollback.php
--------------------------------------------
-- parallel rollback, but with disabled dblink connection
delete from emaj.emaj_param where param_key = 'dblink_user_password';
\! ${EMAJ_DIR}/client/emajParallelRollback.php -h localhost -d regression -g "myGroup1,myGroup2" -m Multi-1 -s 3 -l -a
 E-Maj (version <devel>) - launching parallel rollbacks
-----------------------------------------------------------
PHP Warning:  pg_query(): Query failed: ERROR:  _rlbk_init: Cannot use several sessions without dblink connection capability. (Status of the dblink connection attempt = -5 - see E-Maj documentation)
CONTEXT:  PL/pgSQL function emaj._rlbk_init(text[],text,boolean,integer,boolean,boolean,text) line 54 at RAISE in /home/postgres/proj/emaj/client/emajParallelRollback.php on line 146
Calling the _rlbk_init() function failed.

insert into emaj.emaj_param (param_key, param_value_text) 
  values ('dblink_user_password','user=postgres password=postgres');
-- unlogged rollback for 2 groups in strict mode, after having performed a group configuration change
select emaj.emaj_modify_table('myschema1', 'mytbl1', '{"priority": 2}'::jsonb);
 emaj_modify_table 
-------------------
                 1
(1 row)

\! ${EMAJ_DIR}/client/emajParallelRollback.php -h localhost -d regression -g "myGroup1,myGroup2" -m Multi-1 -s 3 -l
 E-Maj (version <devel>) - launching parallel rollbacks
-----------------------------------------------------------
PHP Warning:  pg_query(): Query failed: ERROR:  _rlbk_check: This rollback operation would cross some previous structure group change operations, which is not allowed by the current function parameters.
CONTEXT:  PL/pgSQL function emaj._rlbk_check(text[],text,boolean,boolean) line 59 at RAISE
SQL statement "SELECT emaj._rlbk_check(p_groupNames, p_mark, p_isAlterGroupAllowed, FALSE)"
PL/pgSQL function emaj._rlbk_init(text[],text,boolean,integer,boolean,boolean,text) line 25 at SQL statement in /home/postgres/proj/emaj/client/emajParallelRollback.php on line 146
Calling the _rlbk_init() function failed.

-- unlogged rollback for 2 groups in unstrict mode
\! ${EMAJ_DIR}/client/emajParallelRollback.php -h localhost -d regression -g "myGroup1,myGroup2" -m Multi-1 -s 3 -l -a
 E-Maj (version <devel>) - launching parallel rollbacks
-----------------------------------------------------------
==> Logged rollback to mark 'Multi-1' is now in progress with 3 sessions...
==> Logged rollback completed.
    Notice: Rollback id = 20000.
    Notice: 10 / 11 tables effectively processed.
    Notice: 3 / 4 sequences effectively processed.
    Warning: Tables group change not rolled back: ignored triggers list for myschema1.mytbl2
    Warning: Tables group change not rolled back: E-Maj priority for myschema1.mytbl1
-- logged rollback for a single group and a single session
\! ${EMAJ_DIR}/client/emajParallelRollback.php -h localhost -d regression -g myGroup1 -m Multi-1 -s 1 -a -c "Revert aborted ABC chain"
 E-Maj (version <devel>) - launching parallel rollbacks
-----------------------------------------------------------
==> Rollback to mark 'Multi-1' is now in progress with 1 sessions...
==> Rollback completed.
    Notice: Rollback id = 20001.
    Notice: 4 / 5 tables effectively processed.
    Notice: 2 / 2 sequences effectively processed.
    Warning: Tables group change not rolled back: ignored triggers list for myschema1.mytbl2
    Warning: Tables group change not rolled back: E-Maj priority for myschema1.mytbl1
--------------------------------------------
-- Prepare data for emajParallelRollback.pl
--------------------------------------------
-- set sequence restart value
truncate emaj.emaj_hist;
alter sequence emaj.emaj_hist_hist_id_seq restart 20200;
alter sequence emaj.emaj_time_stamp_time_id_seq restart 20200;
alter sequence emaj.emaj_rlbk_rlbk_id_seq restart 20200;
delete from mySchema1.myTbl4;
delete from mySchema1.myTbl1;
delete from mySchema1.myTbl2; 
delete from mySchema1."myTbl3";
delete from mySchema1.myTbl2b;
delete from mySchema2.myTbl4;
delete from mySchema2.myTbl1;
delete from mySchema2.myTbl2; 
delete from mySchema2."myTbl3";
delete from mySchema2.myTbl5;
delete from mySchema2.myTbl6 where col61 <> 0;
alter sequence mySchema2.mySeq1 restart 9999;
--------------------------------------------
-- Call emajParallelRollback.pl
--------------------------------------------
-- parallel rollback, but with disabled dblink connection
delete from emaj.emaj_param where param_key = 'dblink_user_password';
\! ${EMAJ_DIR}/client/emajParallelRollback.pl -h localhost -d regression -g "myGroup1,myGroup2" -m Multi-1 -s 3 -l -a
Calling the _rlbk_init() function failed.
ERROR:  _rlbk_init: Cannot use several sessions without dblink connection capability. (Status of the dblink connection attempt = -5 - see E-Maj documentation)
CONTEXT:  PL/pgSQL function emaj._rlbk_init(text[],text,boolean,integer,boolean,boolean,text) line 54 at RAISE
 E-Maj (version <devel>) - launching parallel rollbacks
-----------------------------------------------------------
insert into emaj.emaj_param (param_key, param_value_text) 
  values ('dblink_user_password','user=postgres password=postgres');
-- unlogged rollback for 2 groups in strict mode, after having performed a group configuration change
select emaj.emaj_modify_table('myschema1', 'mytbl1', '{"priority": 1}'::jsonb);
 emaj_modify_table 
-------------------
                 1
(1 row)

\! ${EMAJ_DIR}/client/emajParallelRollback.pl -h localhost -d regression -g "myGroup1,myGroup2" -m Multi-1 -s 3 -l
Calling the _rlbk_init() function failed.
ERROR:  _rlbk_check: This rollback operation would cross some previous structure group change operations, which is not allowed by the current function parameters.
CONTEXT:  PL/pgSQL function emaj._rlbk_check(text[],text,boolean,boolean) line 59 at RAISE
SQL statement "SELECT emaj._rlbk_check(p_groupNames, p_mark, p_isAlterGroupAllowed, FALSE)"
PL/pgSQL function emaj._rlbk_init(text[],text,boolean,integer,boolean,boolean,text) line 25 at SQL statement
 E-Maj (version <devel>) - launching parallel rollbacks
-----------------------------------------------------------
-- unlogged rollback for 2 groups in unstrict mode
\! ${EMAJ_DIR}/client/emajParallelRollback.pl -h localhost -d regression -g "myGroup1,myGroup2" -m Multi-1 -s 3 -l -a
 E-Maj (version <devel>) - launching parallel rollbacks
-----------------------------------------------------------
==> Logged rollback to mark 'Multi-1' is now in progress with 3 sessions...
==> Logged rollback completed.
    Notice: Rollback id = 20200.
    Notice: 10 / 11 tables effectively processed.
    Notice: 3 / 4 sequences effectively processed.
    Warning: Tables group change not rolled back: ignored triggers list for myschema1.mytbl2
    Warning: Tables group change not rolled back: E-Maj priority for myschema1.mytbl1
-- logged rollback for a single group and a single session
\! ${EMAJ_DIR}/client/emajParallelRollback.pl -h localhost -d regression -g myGroup1 -m Multi-1 -s 1 -a -c "Revert aborted DEF chain"
 E-Maj (version <devel>) - launching parallel rollbacks
-----------------------------------------------------------
==> Rollback to mark 'Multi-1' is now in progress with 1 sessions...
==> Rollback completed.
    Notice: Rollback id = 20201.
    Notice: 4 / 5 tables effectively processed.
    Notice: 2 / 2 sequences effectively processed.
    Warning: Tables group change not rolled back: ignored triggers list for myschema1.mytbl2
    Warning: Tables group change not rolled back: E-Maj priority for myschema1.mytbl1
--------------------------------------------------------------
--
-- Rollback monitor clients
--
--------------------------------------------------------------
--------------------------------------------
-- Prepare data for both emajRollbackMonitor.php and emajRollbackMonitor.pl
--------------------------------------------
-- 1st rollback, in EXECUTING state
insert into emaj.emaj_time_stamp (time_id, time_tx_timestamp) overriding system value
  values (-1, now()-'110.1 seconds'::interval);
insert into emaj.emaj_time_stamp (time_id, time_clock_timestamp) overriding system value
  values (-2, '2000-01-01 01:00:00');
insert into emaj.emaj_rlbk (rlbk_id, rlbk_groups, rlbk_mark, rlbk_mark_time_id, rlbk_time_id, rlbk_is_logged, rlbk_is_alter_group_allowed, rlbk_nb_session, 
           rlbk_nb_table, rlbk_nb_sequence, rlbk_eff_nb_table, rlbk_eff_nb_sequence, rlbk_start_datetime, rlbk_end_planning_datetime, rlbk_end_locking_datetime, rlbk_status)
  values (20101,array['group20101'],'mark20101',-2,-1,true,false,1,
           5,4,3,1,now()-'110.1 seconds'::interval,now()-'110.0 seconds'::interval,now()-'109.8 seconds'::interval,'EXECUTING');
insert into emaj.emaj_rlbk_plan (rlbp_rlbk_id, rlbp_step, rlbp_schema, rlbp_table, rlbp_object,
           rlbp_estimated_duration, rlbp_start_datetime, rlbp_duration)
  values (20101, 'RLBK_TABLE','schema','t1','','50 seconds'::interval,null,null),
         (20101, 'RLBK_TABLE','schema','t2','','30 seconds'::interval,null,null),
         (20101, 'RLBK_TABLE','schema','t3','','20 seconds'::interval,null,null);
-- the first RLBK_TABLE is completed, and the step duration < the estimated duration 
update emaj.emaj_rlbk_plan set rlbp_start_datetime = now() - '45 seconds'::interval,
                               rlbp_duration = '45 seconds'::interval
  where rlbp_rlbk_id = 20101 and rlbp_table = 't1';
-- the second RLBK_TABLE is completed, and the step duration > the estimated duration 
update emaj.emaj_rlbk_plan set rlbp_start_datetime = now() - '65 seconds'::interval,
                               rlbp_duration = '65 seconds'::interval
  where rlbp_rlbk_id = 20101 and rlbp_table = 't2';
-- 2nd rollback, in LOCKING state with RLBK_TABLE steps
insert into emaj.emaj_time_stamp (time_id, time_tx_timestamp) overriding system value
  values (-3, now()-'2 minutes'::interval);
insert into emaj.emaj_rlbk (rlbk_id, rlbk_groups, rlbk_mark, rlbk_mark_time_id, rlbk_time_id, rlbk_is_logged, rlbk_is_alter_group_allowed, rlbk_nb_session, 
           rlbk_nb_table, rlbk_nb_sequence, rlbk_eff_nb_table, rlbk_eff_nb_sequence, rlbk_start_datetime, rlbk_end_planning_datetime, rlbk_status)
  values (20102,array['group20102'],'mark20102',-2,-3,true,false,1,
           5,4,3,NULL,now()-'2 minutes'::interval,now()-'1 minute 59.8 seconds'::interval,'LOCKING');
insert into emaj.emaj_rlbk_plan (rlbp_rlbk_id, rlbp_step, rlbp_schema, rlbp_table, rlbp_object,
           rlbp_estimated_duration, rlbp_start_datetime, rlbp_duration)
  values (20102, 'LOCK_TABLE','schema','t1','',null,null,null),
         (20102, 'LOCK_TABLE','schema','t2','',null,null,null),
         (20102, 'LOCK_TABLE','schema','t3','',null,null,null),
         (20102, 'RLBK_TABLE','schema','t1','','0:20:00'::interval,null,null),
         (20102, 'RLBK_TABLE','schema','t2','','0:02:00'::interval,null,null),
         (20102, 'RLBK_TABLE','schema','t3','','0:00:20'::interval,null,null);
-- 3rd rollback, in PLANNING state
insert into emaj.emaj_time_stamp (time_id, time_tx_timestamp) overriding system value
  values (-4, now()-'1 minute'::interval);
insert into emaj.emaj_rlbk (rlbk_id, rlbk_groups, rlbk_mark, rlbk_mark_time_id, rlbk_time_id, rlbk_is_logged, rlbk_is_alter_group_allowed, rlbk_nb_session,
           rlbk_nb_table, rlbk_nb_sequence, rlbk_eff_nb_table, rlbk_eff_nb_sequence, rlbk_start_datetime,rlbk_status)
  values (20103,array['group20103'],'mark20103',-2,-4,true,false,1,
           5,4,3,NULL,now()-'1 minute'::interval,'PLANNING');
--------------------------------------------
-- call emajRollbackMonitor.php using an emaj_viewer role
--------------------------------------------
\! ${EMAJ_DIR}/client/emajRollbackMonitor.php -h localhost -d regression -U emaj_regression_tests_viewer_user -i 0.1 -n 2 -l 2 -a 12 -v -r
 E-Maj (version <devel>) - Monitoring rollbacks activity
---------------------------------------------------------------
[current date and time]
** rollback 20200 started at [rollback start time] for groups {myGroup1,myGroup2}
   status: COMMITTED ; ended at [rollback end time]
   rollback to mark: "Multi-1" set at [mark time]
   3 session(s) to process 10/11 table(s) and 3/4 sequence(s)
** rollback 20201 started at [rollback start time] for groups {myGroup1}
   status: COMMITTED ; ended at [rollback end time]
   rollback to mark: "Multi-1" set at [mark time]
   1 session(s) to process 4/5 table(s) and 2/2 sequence(s)
-> rollback 20101 started at [rollback start time] for groups {group20101}
   status: EXECUTING ; completion 85 %; @ 20 secs remaining
   rollback to mark: mark20101 set at [mark time]
   1 session(s) to process 3/5 table(s) and 1/4 sequence(s)
-> rollback 20102 started at [rollback start time] for groups {group20102}
   status: LOCKING ; completion 0 %; @ 22 mins 20 secs remaining
   rollback to mark: mark20102 set at [mark time]
   1 session(s) to process 3/5 table(s) and ?/4 sequence(s)
-> rollback 20103 started at [rollback start time] for groups {group20103}
   status: PLANNING ; completion 0 %
   rollback to mark: mark20103 set at [mark time]
   1 session(s) to process 3/5 table(s) and ?/4 sequence(s)
[current date and time]
** rollback 20200 started at [rollback start time] for groups {myGroup1,myGroup2}
   status: COMMITTED ; ended at [rollback end time]
   rollback to mark: "Multi-1" set at [mark time]
   3 session(s) to process 10/11 table(s) and 3/4 sequence(s)
** rollback 20201 started at [rollback start time] for groups {myGroup1}
   status: COMMITTED ; ended at [rollback end time]
   rollback to mark: "Multi-1" set at [mark time]
   1 session(s) to process 4/5 table(s) and 2/2 sequence(s)
-> rollback 20101 started at [rollback start time] for groups {group20101}
   status: EXECUTING ; completion 85 %; @ 20 secs remaining
   rollback to mark: mark20101 set at [mark time]
   1 session(s) to process 3/5 table(s) and 1/4 sequence(s)
-> rollback 20102 started at [rollback start time] for groups {group20102}
   status: LOCKING ; completion 0 %; @ 22 mins 20 secs remaining
   rollback to mark: mark20102 set at [mark time]
   1 session(s) to process 3/5 table(s) and ?/4 sequence(s)
-> rollback 20103 started at [rollback start time] for groups {group20103}
   status: PLANNING ; completion 0 %
   rollback to mark: mark20103 set at [mark time]
   1 session(s) to process 3/5 table(s) and ?/4 sequence(s)
--------------------------------------------
-- call emajRollbackMonitor.pl using an emaj_viewer role
--------------------------------------------
\! ${EMAJ_DIR}/client/emajRollbackMonitor.pl -h localhost -d regression -U emaj_regression_tests_viewer_user -i 0.1 -n 2 -l 2 -a 12 -v -r
 E-Maj (version <devel>) - Monitoring rollbacks activity
-----------------------------------------------------------
[current date and time]
** rollback 20200 started at [rollback start time] for groups {myGroup1,myGroup2} 
   status: COMMITTED ; ended at [rollback end time] 
   rollback to mark: "Multi-1" set at [mark time]
   3 session(s) to process 10/11 table(s) and 3/4 sequence(s)
** rollback 20201 started at [rollback start time] for groups {myGroup1} 
   status: COMMITTED ; ended at [rollback end time] 
   rollback to mark: "Multi-1" set at [mark time]
   1 session(s) to process 4/5 table(s) and 2/2 sequence(s)
-> rollback 20101 started at [rollback start time] for groups {group20101}
   status: EXECUTING ; completion 85 %; @ 20 secs remaining
   rollback to mark: mark20101 set at [mark time]
   1 session(s) to process 3/5 table(s) and 1/4 sequence(s)
-> rollback 20102 started at [rollback start time] for groups {group20102}
   status: LOCKING ; completion 0 %; @ 22 mins 20 secs remaining
   rollback to mark: mark20102 set at [mark time]
   1 session(s) to process 3/5 table(s) and ?/4 sequence(s)
-> rollback 20103 started at [rollback start time] for groups {group20103}
   status: PLANNING ; completion 0 %
   rollback to mark: mark20103 set at [mark time]
   1 session(s) to process 3/5 table(s) and ?/4 sequence(s)
[current date and time]
** rollback 20200 started at [rollback start time] for groups {myGroup1,myGroup2} 
   status: COMMITTED ; ended at [rollback end time] 
   rollback to mark: "Multi-1" set at [mark time]
   3 session(s) to process 10/11 table(s) and 3/4 sequence(s)
** rollback 20201 started at [rollback start time] for groups {myGroup1} 
   status: COMMITTED ; ended at [rollback end time] 
   rollback to mark: "Multi-1" set at [mark time]
   1 session(s) to process 4/5 table(s) and 2/2 sequence(s)
-> rollback 20101 started at [rollback start time] for groups {group20101}
   status: EXECUTING ; completion 85 %; @ 20 secs remaining
   rollback to mark: mark20101 set at [mark time]
   1 session(s) to process 3/5 table(s) and 1/4 sequence(s)
-> rollback 20102 started at [rollback start time] for groups {group20102}
   status: LOCKING ; completion 0 %; @ 22 mins 20 secs remaining
   rollback to mark: mark20102 set at [mark time]
   1 session(s) to process 3/5 table(s) and ?/4 sequence(s)
-> rollback 20103 started at [rollback start time] for groups {group20103}
   status: PLANNING ; completion 0 %
   rollback to mark: mark20103 set at [mark time]
   1 session(s) to process 3/5 table(s) and ?/4 sequence(s)
--------------------------------------------------------------
--
-- emajStat client
--
--------------------------------------------------------------
-- Rename the latest mark of myGroup2 for output stability
select emaj.emaj_rename_mark_group('myGroup2','EMAJ_LAST_MARK','latest_mark');
 emaj_rename_mark_group 
------------------------
 
(1 row)

-- 2 displays with an emaj_viewer role with various options
\! ${EMAJ_DIR}/client/emajStat.pl -h localhost -d regression -U emaj_regression_tests_viewer_user --regression-test --no-cls --interval 0.1 --iter 2 --include-group '1|2' --max-table 5 --exclude-sequence 'col31' --max-relation-name-length 23
 E-Maj (version <devel>) - Monitoring logged changes on database regression (@127.0.0.1:5411)
----------------------------------------------------------------------------------------------
[current date and time] - Logging: groups=2/3 tables=11/11 sequences=4/4 -
  Group name + Latest mark                       + Changes since mark + Changes since prev.
    myGroup1 | Multi-1     ([latest mark date and time]) | 359 ([cps])
    myGroup2 | latest_mark ([latest mark date and time]) |   0 ([cps])
  Table name          + Group    + Changes since mark + Changes since prev.
    myschema1.mytbl1  | myGroup1 | 211 ([cps])
    myschema1.myTbl3  | myGroup1 |  60 ([cps])
    myschema1.mytbl2b | myGroup1 |  52 ([cps])
    myschema1.mytbl2  | myGroup1 |  27 ([cps])
    myschema1.mytbl4  | myGroup1 |   9 ([cps])
  Sequence name             + Group    + Changes since mark + Changes since prev.
    myschema1.mytbl2b_col20 | myGroup1 |  0 ([cps])
    myschema2.myseq1        | myGroup2 | -1 ([cps])
[current date and time] - Logging: groups=2/3 tables=11/11 sequences=4/4 - Changes since [refresh duration] sec: 0 ([global cps] c/s)
  Group name + Latest mark                       + Changes since mark + Changes since prev.
    myGroup1 | Multi-1     ([latest mark date and time]) | 359 ([cps]) | 0 ([cps])
    myGroup2 | latest_mark ([latest mark date and time]) |   0 ([cps]) | 0 ([cps])
  Table name          + Group    + Changes since mark + Changes since prev.
    myschema1.mytbl1  | myGroup1 | 211 ([cps]) | 0 ([cps])
    myschema1.myTbl3  | myGroup1 |  60 ([cps]) | 0 ([cps])
    myschema1.mytbl2b | myGroup1 |  52 ([cps]) | 0 ([cps])
    myschema1.mytbl2  | myGroup1 |  27 ([cps]) | 0 ([cps])
    myschema1.mytbl4  | myGroup1 |   9 ([cps]) | 0 ([cps])
  Sequence name             + Group    + Changes since mark + Changes since prev.
    myschema1.mytbl2b_col20 | myGroup1 |  0 ([cps]) | 0 ([cps])
    myschema2.myseq1        | myGroup2 | -1 ([cps]) | 0 ([cps])
