-- adm2.sql : complex scenario executed by an emaj_adm role. 
--            Follows adm1.sql, and includes more specific test cases
--
-----------------------------
-- Step 8 : use of multi-group functions, start_group(s) without log reset and use deleted marks
-----------------------------
-- stop both groups
select emaj.emaj_stop_groups(array['myGroup1','myGroup2']);
 emaj_stop_groups 
------------------
               14
(1 row)

-- start both groups
select emaj.emaj_start_groups(array['myGroup1','myGroup2'],'Multi-1', false);
 emaj_start_groups 
-------------------
                14
(1 row)

-- set a mark for both groups
select emaj.emaj_set_mark_groups(array['myGroup1','myGroup2'],'Multi-2');
 emaj_set_mark_groups 
----------------------
                   14
(1 row)

-- logged rollback to Multi-1
select emaj.emaj_logged_rollback_groups(array['myGroup1','myGroup2'],'Multi-1');
 emaj_logged_rollback_groups 
-----------------------------
                           3
(1 row)

-- rollback to Multi-2
select emaj.emaj_rollback_groups(array['myGroup1','myGroup2'],'Multi-2');
 emaj_rollback_groups 
----------------------
                    3
(1 row)

-- rollback and stop to Multi-1
select emaj.emaj_rollback_groups(array['myGroup1','myGroup2'],'Multi-1');
 emaj_rollback_groups 
----------------------
                    3
(1 row)

select emaj.emaj_stop_groups(array['myGroup1','myGroup2'],'Stop after rollback');
 emaj_stop_groups 
------------------
               14
(1 row)

-- try to start both groups, but with an old deleted mark name
select emaj.emaj_start_groups(array['myGroup1','myGroup2'],'Multi-1', false);
ERROR:  _check_new_mark: Group myGroup1 already contains a mark named Multi-1.
CONTEXT:  SQL statement "SELECT emaj._check_new_mark(v_mark, v_groupNames)"
PL/pgSQL function "_start_groups" line 49 at SQL statement
SQL statement "SELECT emaj._start_groups(emaj._check_group_names_array(v_groupNames), v_mark, true, v_resetLog)"
PL/pgSQL function "emaj_start_groups" line 16 at SQL statement
-- really start both groups
select emaj.emaj_start_groups(array['myGroup1','myGroup2'],'Multi-1b', false);
 emaj_start_groups 
-------------------
                14
(1 row)

-- set again a mark for both groups
select emaj.emaj_set_mark_groups(array['myGroup1','myGroup2'],'Multi-2');
 emaj_set_mark_groups 
----------------------
                   14
(1 row)

-- delete the mark for only 1 group and get detailed statistics for the other group
select emaj.emaj_delete_mark_group('myGroup1','Multi-2');
 emaj_delete_mark_group 
------------------------
                      1
(1 row)

-- use this mark for the other group before delete it
select * from emaj.emaj_detailed_log_stat_group('myGroup2','Multi-2',NULL);
 stat_group | stat_schema | stat_table | stat_role | stat_verb | stat_rows 
------------+-------------+------------+-----------+-----------+-----------
(0 rows)

select emaj.emaj_rollback_group('myGroup2','Multi-2');
 emaj_rollback_group 
---------------------
                   2
(1 row)

select emaj.emaj_delete_mark_group('myGroup2','Multi-2');
 emaj_delete_mark_group 
------------------------
                      1
(1 row)

-- get statistics using deleted marks
select * from emaj.emaj_detailed_log_stat_group('myGroup2','M1','M2');
 stat_group | stat_schema | stat_table | stat_role | stat_verb | stat_rows 
------------+-------------+------------+-----------+-----------+-----------
 myGroup2   | myschema2   | mytbl1     | postgres  | DELETE    |         1
 myGroup2   | myschema2   | mytbl1     | postgres  | INSERT    |        11
 myGroup2   | myschema2   | mytbl1     | postgres  | UPDATE    |         3
 myGroup2   | myschema2   | mytbl2     | postgres  | INSERT    |         2
 myGroup2   | myschema2   | myTbl3     | postgres  | INSERT    |        10
 myGroup2   | myschema2   | mytbl5     | postgres  | INSERT    |         2
 myGroup2   | myschema2   | mytbl5     | postgres  | UPDATE    |         1
 myGroup2   | myschema2   | mytbl6     | postgres  | INSERT    |         8
 myGroup2   | myschema2   | mytbl6     | postgres  | UPDATE    |         3
(9 rows)

-- delete intermediate deleted marks
select emaj.emaj_delete_mark_group('myGroup1','Multi-1');
 emaj_delete_mark_group 
------------------------
                      1
(1 row)

select emaj.emaj_delete_mark_group('myGroup2','Multi-1');
 emaj_delete_mark_group 
------------------------
                      1
(1 row)

-- ... and reuse mark names for parallel rollback test
select emaj.emaj_rename_mark_group('myGroup1','Multi-1b','Multi-1');
 emaj_rename_mark_group 
------------------------
 
(1 row)

select emaj.emaj_rename_mark_group('myGroup2','Multi-1b','Multi-1');
 emaj_rename_mark_group 
------------------------
 
(1 row)

-- rename a deleted mark
select emaj.emaj_rename_mark_group('myGroup2','M2','Deleted M2');
 emaj_rename_mark_group 
------------------------
 
(1 row)

-- use emaj_get_previous_mark_group and delete an initial deleted mark
select emaj.emaj_delete_before_mark_group('myGroup2',
      (select emaj.emaj_get_previous_mark_group('myGroup2',
             (select mark_datetime from emaj.emaj_mark where mark_group = 'myGroup2' and mark_name = 'M3')+'0.000001 SECOND'::interval)));
 emaj_delete_before_mark_group 
-------------------------------
                             2
(1 row)

-- comment a deleted mark
select emaj.emaj_comment_mark_group('myGroup2','M3','This mark is deleted');
 emaj_comment_mark_group 
-------------------------
 
(1 row)

-- try to get rollback duration on a deleted mark
select emaj.emaj_estimate_rollback_duration('myGroup2','M3');
ERROR:  emaj_estimate_rollback_duration: mark M3 for group myGroup2 is not in ACTIVE state.
-- try to rollback on a deleted mark
select emaj.emaj_rollback_group('myGroup2','M3');
ERROR:  _rlbk_groups_step1: mark M3 for group myGroup2 is not in ACTIVE state.
CONTEXT:  SQL statement "SELECT emaj._rlbk_groups_step1(v_groupNames, v_mark, v_unloggedRlbk, 1, v_multiGroup)"
PL/pgSQL function "_rlbk_groups" line 20 at SQL statement
PL/pgSQL function "emaj_rollback_group" line 8 at RETURN
-----------------------------
-- Checking step 8
-----------------------------
-- emaj tables
select mark_id, mark_group, regexp_replace(mark_name,E'\\d\\d\.\\d\\d\\.\\d\\d\\.\\d\\d\\d','%','g'), mark_global_seq, mark_state, mark_comment, mark_last_seq_hole_id, mark_last_sequence_id, mark_log_rows_before_next from emaj.emaj_mark order by mark_id;
 mark_id | mark_group |        regexp_replace        | mark_global_seq | mark_state |     mark_comment     | mark_last_seq_hole_id | mark_last_sequence_id | mark_log_rows_before_next 
---------+------------+------------------------------+-----------------+------------+----------------------+-----------------------+-----------------------+---------------------------
     606 | myGroup2   | M3                           |           11920 | DELETED    | This mark is deleted |                   599 |                   645 |                         0
     611 | myGroup1   | M4                           |           11949 | DELETED    |                      |                   601 |                   683 |                        10
     612 | myGroup1   | M5                           |           11959 | DELETED    |                      |                   601 |                   689 |                         3
     616 | myGroup1   | Before logged rollback to M4 |           11989 | DELETED    |                      |                   606 |                   717 |                        18
     618 | myGroup1   | STOP_%                       |           12007 | DELETED    |                      |                   606 |                   737 |                         0
     619 | myGroup2   | STOP_%                       |           12007 | DELETED    |                      |                   606 |                   737 |                         0
     628 | myGroup1   | Stop after rollback          |           12007 | DELETED    |                      |                   606 |                   807 |                         0
     629 | myGroup2   | Stop after rollback          |           12007 | DELETED    |                      |                   606 |                   807 |                         0
     630 | myGroup1   | Multi-1                      |           12007 | ACTIVE     |                      |                   606 |                   821 |                          
     631 | myGroup2   | Multi-1                      |           12007 | ACTIVE     |                      |                   606 |                   821 |                          
(10 rows)

select sequ_id,sequ_schema, sequ_name, regexp_replace(sequ_mark,E'\\d\\d\.\\d\\d\\.\\d\\d\\.\\d\\d\\d','%','g'), sequ_last_val, sequ_is_called from emaj.emaj_sequence order by sequ_id;
 sequ_id | sequ_schema |         sequ_name         |        regexp_replace        | sequ_last_val | sequ_is_called 
---------+-------------+---------------------------+------------------------------+---------------+----------------
     625 | emajC       | myschema1_myTbl3_log_seq  | M3                           |            10 | t
     628 | emaj        | myschema1_mytbl2_log_seq  | M3                           |             2 | t
     629 | emajb       | myschema1_mytbl2b_log_seq | M3                           |             1 | f
     638 | myschema2   | myseq1                    | M3                           |          1003 | t
     639 | myschema2   | myTbl3_col31_seq          | M3                           |            20 | t
     640 | emaj        | myschema2_mytbl1_log_seq  | M3                           |            15 | t
     641 | emaj        | myschema2_mytbl2_log_seq  | M3                           |             2 | t
     642 | emajC       | myschema2_myTbl3_log_seq  | M3                           |            10 | t
     643 | emaj        | myschema2_mytbl4_log_seq  | M3                           |             4 | t
     644 | emaj        | myschema2_mytbl5_log_seq  | M3                           |             4 | t
     645 | emaj        | myschema2_mytbl6_log_seq  | M3                           |            14 | t
     648 | emaj        | myschema2_mytbl1_log_seq  | RLBK_M2_%_START              |            15 | t
     649 | emaj        | myschema2_mytbl2_log_seq  | RLBK_M2_%_START              |             2 | t
     650 | emajC       | myschema2_myTbl3_log_seq  | RLBK_M2_%_START              |            10 | t
     656 | emaj        | myschema2_mytbl1_log_seq  | RLBK_M2_%_DONE               |            15 | t
     657 | emaj        | myschema2_mytbl2_log_seq  | RLBK_M2_%_DONE               |             2 | t
     658 | emajC       | myschema2_myTbl3_log_seq  | RLBK_M2_%_DONE               |            10 | t
     664 | emaj        | myschema2_mytbl1_log_seq  | RLBK_M3_%_START              |            15 | t
     665 | emaj        | myschema2_mytbl2_log_seq  | RLBK_M3_%_START              |             2 | t
     666 | emajC       | myschema2_myTbl3_log_seq  | RLBK_M3_%_START              |            10 | t
     672 | emaj        | myschema2_mytbl1_log_seq  | RLBK_M3_%_DONE               |            15 | t
     673 | emaj        | myschema2_mytbl2_log_seq  | RLBK_M3_%_DONE               |             2 | t
     674 | emajC       | myschema2_myTbl3_log_seq  | RLBK_M3_%_DONE               |            10 | t
     678 | myschema1   | myTbl3_col31_seq          | M4                           |            20 | t
     679 | emajC       | myschema1_myTbl3_log_seq  | M4                           |            10 | t
     680 | emaj        | myschema1_mytbl1_log_seq  | M4                           |            30 | t
     681 | emaj        | myschema1_mytbl4_log_seq  | M4                           |             8 | t
     682 | emaj        | myschema1_mytbl2_log_seq  | M4                           |             3 | t
     683 | emajb       | myschema1_mytbl2b_log_seq | M4                           |             1 | f
     684 | myschema1   | myTbl3_col31_seq          | M5                           |            20 | t
     685 | emajC       | myschema1_myTbl3_log_seq  | M5                           |            20 | t
     686 | emaj        | myschema1_mytbl1_log_seq  | M5                           |            30 | t
     687 | emaj        | myschema1_mytbl4_log_seq  | M5                           |             8 | t
     688 | emaj        | myschema1_mytbl2_log_seq  | M5                           |             3 | t
     689 | emajb       | myschema1_mytbl2b_log_seq | M5                           |             1 | f
     691 | emajC       | myschema1_myTbl3_log_seq  | M6                           |            20 | t
     694 | emaj        | myschema1_mytbl2_log_seq  | M6                           |             3 | t
     695 | emajb       | myschema1_mytbl2b_log_seq | M6                           |             1 | f
     698 | emaj        | myschema2_mytbl1_log_seq  | RLBK_M2_%_START              |            15 | t
     699 | emaj        | myschema2_mytbl2_log_seq  | RLBK_M2_%_START              |             2 | t
     700 | emajC       | myschema2_myTbl3_log_seq  | RLBK_M2_%_START              |            10 | t
     706 | emaj        | myschema2_mytbl1_log_seq  | RLBK_M2_%_DONE               |            15 | t
     707 | emaj        | myschema2_mytbl2_log_seq  | RLBK_M2_%_DONE               |             2 | t
     708 | emajC       | myschema2_myTbl3_log_seq  | RLBK_M2_%_DONE               |            10 | t
     712 | myschema1   | myTbl3_col31_seq          | Before logged rollback to M4 |            20 | t
     713 | emajC       | myschema1_myTbl3_log_seq  | Before logged rollback to M4 |            20 | t
     714 | emaj        | myschema1_mytbl1_log_seq  | Before logged rollback to M4 |            32 | t
     715 | emaj        | myschema1_mytbl4_log_seq  | Before logged rollback to M4 |            12 | t
     716 | emaj        | myschema1_mytbl2_log_seq  | Before logged rollback to M4 |             3 | t
     717 | emajb       | myschema1_mytbl2b_log_seq | Before logged rollback to M4 |             1 | f
     724 | myschema1   | myTbl3_col31_seq          | STOP_%                       |            20 | t
     725 | myschema2   | myseq1                    | STOP_%                       |          1004 | f
     726 | myschema2   | myTbl3_col31_seq          | STOP_%                       |            20 | t
     727 | emajC       | myschema1_myTbl3_log_seq  | STOP_%                       |            35 | t
     728 | emaj        | myschema1_mytbl1_log_seq  | STOP_%                       |            33 | t
     729 | emaj        | myschema1_mytbl4_log_seq  | STOP_%                       |            14 | t
     730 | emaj        | myschema1_mytbl2_log_seq  | STOP_%                       |             3 | t
     731 | emajb       | myschema1_mytbl2b_log_seq | STOP_%                       |             1 | f
     732 | emaj        | myschema2_mytbl1_log_seq  | STOP_%                       |            15 | t
     733 | emaj        | myschema2_mytbl2_log_seq  | STOP_%                       |             2 | t
     734 | emajC       | myschema2_myTbl3_log_seq  | STOP_%                       |            10 | t
     735 | emaj        | myschema2_mytbl4_log_seq  | STOP_%                       |            24 | t
     736 | emaj        | myschema2_mytbl5_log_seq  | STOP_%                       |             9 | t
     737 | emaj        | myschema2_mytbl6_log_seq  | STOP_%                       |            29 | t
     755 | emajC       | myschema1_myTbl3_log_seq  | Multi-2                      |            35 | t
     756 | emaj        | myschema1_mytbl1_log_seq  | Multi-2                      |            33 | t
     757 | emaj        | myschema1_mytbl4_log_seq  | Multi-2                      |            14 | t
     758 | emaj        | myschema1_mytbl2_log_seq  | Multi-2                      |             3 | t
     759 | emajb       | myschema1_mytbl2b_log_seq | Multi-2                      |             1 | f
     760 | emaj        | myschema2_mytbl1_log_seq  | Multi-2                      |            15 | t
     761 | emaj        | myschema2_mytbl2_log_seq  | Multi-2                      |             2 | t
     762 | emajC       | myschema2_myTbl3_log_seq  | Multi-2                      |            10 | t
     763 | emaj        | myschema2_mytbl4_log_seq  | Multi-2                      |            24 | t
     764 | emaj        | myschema2_mytbl5_log_seq  | Multi-2                      |             9 | t
     765 | emaj        | myschema2_mytbl6_log_seq  | Multi-2                      |            29 | t
     769 | emajC       | myschema1_myTbl3_log_seq  | RLBK_Multi-1_%_START         |            35 | t
     770 | emaj        | myschema1_mytbl1_log_seq  | RLBK_Multi-1_%_START         |            33 | t
     771 | emaj        | myschema1_mytbl4_log_seq  | RLBK_Multi-1_%_START         |            14 | t
     772 | emaj        | myschema1_mytbl2_log_seq  | RLBK_Multi-1_%_START         |             3 | t
     773 | emajb       | myschema1_mytbl2b_log_seq | RLBK_Multi-1_%_START         |             1 | f
     774 | emaj        | myschema2_mytbl1_log_seq  | RLBK_Multi-1_%_START         |            15 | t
     775 | emaj        | myschema2_mytbl2_log_seq  | RLBK_Multi-1_%_START         |             2 | t
     776 | emajC       | myschema2_myTbl3_log_seq  | RLBK_Multi-1_%_START         |            10 | t
     777 | emaj        | myschema2_mytbl4_log_seq  | RLBK_Multi-1_%_START         |            24 | t
     778 | emaj        | myschema2_mytbl5_log_seq  | RLBK_Multi-1_%_START         |             9 | t
     779 | emaj        | myschema2_mytbl6_log_seq  | RLBK_Multi-1_%_START         |            29 | t
     783 | emajC       | myschema1_myTbl3_log_seq  | RLBK_Multi-1_%_DONE          |            35 | t
     784 | emaj        | myschema1_mytbl1_log_seq  | RLBK_Multi-1_%_DONE          |            33 | t
     785 | emaj        | myschema1_mytbl4_log_seq  | RLBK_Multi-1_%_DONE          |            14 | t
     786 | emaj        | myschema1_mytbl2_log_seq  | RLBK_Multi-1_%_DONE          |             3 | t
     787 | emajb       | myschema1_mytbl2b_log_seq | RLBK_Multi-1_%_DONE          |             1 | f
     788 | emaj        | myschema2_mytbl1_log_seq  | RLBK_Multi-1_%_DONE          |            15 | t
     789 | emaj        | myschema2_mytbl2_log_seq  | RLBK_Multi-1_%_DONE          |             2 | t
     790 | emajC       | myschema2_myTbl3_log_seq  | RLBK_Multi-1_%_DONE          |            10 | t
     791 | emaj        | myschema2_mytbl4_log_seq  | RLBK_Multi-1_%_DONE          |            24 | t
     792 | emaj        | myschema2_mytbl5_log_seq  | RLBK_Multi-1_%_DONE          |             9 | t
     793 | emaj        | myschema2_mytbl6_log_seq  | RLBK_Multi-1_%_DONE          |            29 | t
     794 | myschema1   | myTbl3_col31_seq          | Stop after rollback          |            20 | t
     795 | myschema2   | myseq1                    | Stop after rollback          |          1004 | f
     796 | myschema2   | myTbl3_col31_seq          | Stop after rollback          |            20 | t
     797 | emajC       | myschema1_myTbl3_log_seq  | Stop after rollback          |            35 | t
     798 | emaj        | myschema1_mytbl1_log_seq  | Stop after rollback          |            33 | t
     799 | emaj        | myschema1_mytbl4_log_seq  | Stop after rollback          |            14 | t
     800 | emaj        | myschema1_mytbl2_log_seq  | Stop after rollback          |             3 | t
     801 | emajb       | myschema1_mytbl2b_log_seq | Stop after rollback          |             1 | f
     802 | emaj        | myschema2_mytbl1_log_seq  | Stop after rollback          |            15 | t
     803 | emaj        | myschema2_mytbl2_log_seq  | Stop after rollback          |             2 | t
     804 | emajC       | myschema2_myTbl3_log_seq  | Stop after rollback          |            10 | t
     805 | emaj        | myschema2_mytbl4_log_seq  | Stop after rollback          |            24 | t
     806 | emaj        | myschema2_mytbl5_log_seq  | Stop after rollback          |             9 | t
     807 | emaj        | myschema2_mytbl6_log_seq  | Stop after rollback          |            29 | t
     808 | myschema1   | myTbl3_col31_seq          | Multi-1                      |            20 | t
     809 | myschema2   | myseq1                    | Multi-1                      |          1004 | f
     810 | myschema2   | myTbl3_col31_seq          | Multi-1                      |            20 | t
     811 | emajC       | myschema1_myTbl3_log_seq  | Multi-1                      |            35 | t
     812 | emaj        | myschema1_mytbl1_log_seq  | Multi-1                      |            33 | t
     813 | emaj        | myschema1_mytbl4_log_seq  | Multi-1                      |            14 | t
     814 | emaj        | myschema1_mytbl2_log_seq  | Multi-1                      |             3 | t
     815 | emajb       | myschema1_mytbl2b_log_seq | Multi-1                      |             1 | f
     816 | emaj        | myschema2_mytbl1_log_seq  | Multi-1                      |            15 | t
     817 | emaj        | myschema2_mytbl2_log_seq  | Multi-1                      |             2 | t
     818 | emajC       | myschema2_myTbl3_log_seq  | Multi-1                      |            10 | t
     819 | emaj        | myschema2_mytbl4_log_seq  | Multi-1                      |            24 | t
     820 | emaj        | myschema2_mytbl5_log_seq  | Multi-1                      |             9 | t
     821 | emaj        | myschema2_mytbl6_log_seq  | Multi-1                      |            29 | t
(125 rows)

select sqhl_id, sqhl_schema, sqhl_table, sqhl_hole_size from emaj.emaj_seq_hole order by sqhl_id;
 sqhl_id | sqhl_schema | sqhl_table | sqhl_hole_size 
---------+-------------+------------+----------------
     602 | myschema2   | mytbl4     |             20
     603 | myschema2   | mytbl5     |              5
     604 | myschema2   | mytbl6     |             15
     605 | myschema1   | mytbl1     |              1
     606 | myschema1   | mytbl4     |              2
(5 rows)

-- log tables
select col11, col12, col13, emaj_verb, emaj_tuple, emaj_gid from emaj.mySchema1_myTbl1_log order by emaj_gid, emaj_tuple desc;
 col11 |   col12    | col13 | emaj_verb | emaj_tuple | emaj_gid 
-------+------------+-------+-----------+------------+----------
     1 | Step 6     | \x01  | INS       | NEW        |    11987
     1 | Step 6     | \x01  | DEL       | OLD        |    12000
(2 rows)

select col21, col22, col23, emaj_verb, emaj_tuple, emaj_gid from emaj.mySchema1_myTbl2_log order by emaj_gid, emaj_tuple desc;
 col21 | col22 | col23 | emaj_verb | emaj_tuple | emaj_gid 
-------+-------+-------+-----------+------------+----------
(0 rows)

select col20, col21, emaj_verb, emaj_tuple, emaj_gid from emajb.mySchema1_myTbl2b_log order by emaj_gid, emaj_tuple desc;
 col20 | col21 | emaj_verb | emaj_tuple | emaj_gid 
-------+-------+-----------+------------+----------
(0 rows)

select col31, col33, emaj_verb, emaj_tuple, emaj_gid from "emajC"."myschema1_myTbl3_log" order by emaj_gid, emaj_tuple desc;
 col31 | col33 | emaj_verb | emaj_tuple | emaj_gid 
-------+-------+-----------+------------+----------
    11 | 10.00 | UPD       | OLD        |    11950
    11 |  5.00 | UPD       | NEW        |    11950
    12 | 10.00 | UPD       | OLD        |    11951
    12 |  5.00 | UPD       | NEW        |    11951
    13 | 10.00 | UPD       | OLD        |    11952
    13 |  5.00 | UPD       | NEW        |    11952
    14 | 10.00 | UPD       | OLD        |    11953
    14 |  5.00 | UPD       | NEW        |    11953
    15 | 10.00 | UPD       | OLD        |    11954
    15 |  5.00 | UPD       | NEW        |    11954
    16 | 10.00 | UPD       | OLD        |    11955
    16 |  5.00 | UPD       | NEW        |    11955
    17 | 10.00 | UPD       | OLD        |    11956
    17 |  5.00 | UPD       | NEW        |    11956
    18 | 10.00 | UPD       | OLD        |    11957
    18 |  5.00 | UPD       | NEW        |    11957
    19 | 10.00 | UPD       | OLD        |    11958
    19 |  5.00 | UPD       | NEW        |    11958
    20 | 10.00 | UPD       | OLD        |    11959
    20 |  5.00 | UPD       | NEW        |    11959
    20 |  5.00 | UPD       | OLD        |    11990
    20 | 10.00 | UPD       | NEW        |    11990
    19 |  5.00 | UPD       | OLD        |    11991
    19 | 10.00 | UPD       | NEW        |    11991
    18 |  5.00 | UPD       | OLD        |    11992
    18 | 10.00 | UPD       | NEW        |    11992
    17 |  5.00 | UPD       | OLD        |    11993
    17 | 10.00 | UPD       | NEW        |    11993
    16 |  5.00 | UPD       | OLD        |    11994
    16 | 10.00 | UPD       | NEW        |    11994
    15 |  5.00 | UPD       | OLD        |    11995
    15 | 10.00 | UPD       | NEW        |    11995
    14 |  5.00 | UPD       | OLD        |    11996
    14 | 10.00 | UPD       | NEW        |    11996
    13 |  5.00 | UPD       | OLD        |    11997
    13 | 10.00 | UPD       | NEW        |    11997
    12 |  5.00 | UPD       | OLD        |    11998
    12 | 10.00 | UPD       | NEW        |    11998
    11 |  5.00 | UPD       | OLD        |    11999
    11 | 10.00 | UPD       | NEW        |    11999
    14 | 10.00 | DEL       | OLD        |    12003
    15 | 10.00 | DEL       | OLD        |    12004
    16 | 10.00 | DEL       | OLD        |    12005
    17 | 10.00 | DEL       | OLD        |    12006
    18 | 10.00 | DEL       | OLD        |    12007
(45 rows)

select col41, col42, col43, col44, col45, emaj_verb, emaj_tuple, emaj_gid from emaj.mySchema1_myTbl4_log order by emaj_gid, emaj_tuple desc;
 col41 | col42 | col43 | col44 |   col45    | emaj_verb | emaj_tuple | emaj_gid 
-------+-------+-------+-------+------------+-----------+------------+----------
    11 |       |     1 |     1 | Step 6     | INS       | NEW        |    11988
    12 |       |     1 |     1 | Step 6     | INS       | NEW        |    11989
    12 |       |     1 |     1 | Step 6     | DEL       | OLD        |    12001
    11 |       |     1 |     1 | Step 6     | DEL       | OLD        |    12002
(4 rows)

select col11, col12, col13, emaj_verb, emaj_tuple, emaj_gid from emaj.mySchema2_myTbl1_log order by emaj_gid, emaj_tuple desc;
 col11 | col12 | col13 | emaj_verb | emaj_tuple | emaj_gid 
-------+-------+-------+-----------+------------+----------
(0 rows)

select col21, col22, col23, emaj_verb, emaj_tuple, emaj_gid from emaj.mySchema2_myTbl2_log order by emaj_gid, emaj_tuple desc;
 col21 | col22 | col23 | emaj_verb | emaj_tuple | emaj_gid 
-------+-------+-------+-----------+------------+----------
(0 rows)

select col31, col33, emaj_verb, emaj_tuple, emaj_gid from "emajC"."myschema2_myTbl3_log" order by emaj_gid, emaj_tuple desc;
 col31 | col33 | emaj_verb | emaj_tuple | emaj_gid 
-------+-------+-----------+------------+----------
(0 rows)

select col41, col42, col43, col44, col45, emaj_verb, emaj_tuple, emaj_gid from emaj.mySchema2_myTbl4_log order by emaj_gid, emaj_tuple desc;
 col41 | col42 | col43 | col44 | col45 | emaj_verb | emaj_tuple | emaj_gid 
-------+-------+-------+-------+-------+-----------+------------+----------
(0 rows)

select col51, col52, col53, col54, emaj_verb, emaj_tuple, emaj_gid from emaj.mySchema2_myTbl5_log order by emaj_gid, emaj_tuple desc;
 col51 | col52 | col53 | col54 | emaj_verb | emaj_tuple | emaj_gid 
-------+-------+-------+-------+-----------+------------+----------
(0 rows)

select col61, col62, col63, col64, col65, col66, emaj_verb, emaj_tuple, emaj_gid from emaj.mySchema2_myTbl6_log order by emaj_gid, emaj_tuple desc;
 col61 | col62 | col63 | col64 | col65 | col66 | emaj_verb | emaj_tuple | emaj_gid 
-------+-------+-------+-------+-------+-------+-----------+------------+----------
(0 rows)

-----------------------------
-- Step 9 : test the emaj_alter_group function with non rollbackable phil's group#3, group
-----------------------------
set role emaj_regression_tests_adm_user;
select emaj.emaj_create_group('phil''s group#3",',false);
NOTICE:  table "phil's schema3_myTbl2\_log" does not exist, skipping
CONTEXT:  SQL statement "DROP TABLE IF EXISTS emaj."phil's schema3_myTbl2\_log""
PL/pgSQL function "_create_tbl" line 84 at EXECUTE statement
SQL statement "SELECT emaj._create_tbl(r_tblsq.grpdef_schema, r_tblsq.grpdef_tblseq, v_logSchema, coalesce(r_tblsq.grpdef_log_dat_tsp, v_defTsp), coalesce(r_tblsq.grpdef_log_idx_tsp, v_defTsp), v_isRollbackable)"
PL/pgSQL function "emaj_create_group" line 88 at PERFORM
NOTICE:  trigger "phil's schema3_myTbl2\_emaj_log_trg" for table "myTbl2\" does not exist, skipping
CONTEXT:  SQL statement "DROP TRIGGER IF EXISTS "phil's schema3_myTbl2\_emaj_log_trg" ON "phil's schema3"."myTbl2\""
PL/pgSQL function "_create_tbl" line 149 at EXECUTE statement
SQL statement "SELECT emaj._create_tbl(r_tblsq.grpdef_schema, r_tblsq.grpdef_tblseq, v_logSchema, coalesce(r_tblsq.grpdef_log_dat_tsp, v_defTsp), coalesce(r_tblsq.grpdef_log_idx_tsp, v_defTsp), v_isRollbackable)"
PL/pgSQL function "emaj_create_group" line 88 at PERFORM
NOTICE:  trigger "phil's schema3_myTbl2\_emaj_trunc_trg" for table "myTbl2\" does not exist, skipping
CONTEXT:  SQL statement "DROP TRIGGER IF EXISTS "phil's schema3_myTbl2\_emaj_trunc_trg" ON "phil's schema3"."myTbl2\""
PL/pgSQL function "_create_tbl" line 157 at EXECUTE statement
SQL statement "SELECT emaj._create_tbl(r_tblsq.grpdef_schema, r_tblsq.grpdef_tblseq, v_logSchema, coalesce(r_tblsq.grpdef_log_dat_tsp, v_defTsp), coalesce(r_tblsq.grpdef_log_idx_tsp, v_defTsp), v_isRollbackable)"
PL/pgSQL function "emaj_create_group" line 88 at PERFORM
NOTICE:  table "phil's schema3_phil's tbl1_log" does not exist, skipping
CONTEXT:  SQL statement "DROP TABLE IF EXISTS "emaj #'3"."phil's schema3_phil's tbl1_log""
PL/pgSQL function "_create_tbl" line 84 at EXECUTE statement
SQL statement "SELECT emaj._create_tbl(r_tblsq.grpdef_schema, r_tblsq.grpdef_tblseq, v_logSchema, coalesce(r_tblsq.grpdef_log_dat_tsp, v_defTsp), coalesce(r_tblsq.grpdef_log_idx_tsp, v_defTsp), v_isRollbackable)"
PL/pgSQL function "emaj_create_group" line 88 at PERFORM
NOTICE:  trigger "phil's schema3_phil's tbl1_emaj_log_trg" for table "phil's tbl1" does not exist, skipping
CONTEXT:  SQL statement "DROP TRIGGER IF EXISTS "phil's schema3_phil's tbl1_emaj_log_trg" ON "phil's schema3"."phil's tbl1""
PL/pgSQL function "_create_tbl" line 149 at EXECUTE statement
SQL statement "SELECT emaj._create_tbl(r_tblsq.grpdef_schema, r_tblsq.grpdef_tblseq, v_logSchema, coalesce(r_tblsq.grpdef_log_dat_tsp, v_defTsp), coalesce(r_tblsq.grpdef_log_idx_tsp, v_defTsp), v_isRollbackable)"
PL/pgSQL function "emaj_create_group" line 88 at PERFORM
NOTICE:  trigger "phil's schema3_phil's tbl1_emaj_trunc_trg" for table "phil's tbl1" does not exist, skipping
CONTEXT:  SQL statement "DROP TRIGGER IF EXISTS "phil's schema3_phil's tbl1_emaj_trunc_trg" ON "phil's schema3"."phil's tbl1""
PL/pgSQL function "_create_tbl" line 157 at EXECUTE statement
SQL statement "SELECT emaj._create_tbl(r_tblsq.grpdef_schema, r_tblsq.grpdef_tblseq, v_logSchema, coalesce(r_tblsq.grpdef_log_dat_tsp, v_defTsp), coalesce(r_tblsq.grpdef_log_idx_tsp, v_defTsp), v_isRollbackable)"
PL/pgSQL function "emaj_create_group" line 88 at PERFORM
 emaj_create_group 
-------------------
                 4
(1 row)

reset role;
alter table "phil's schema3"."phil's tbl1" alter column "phil's col12" type char(11);
set role emaj_regression_tests_adm_user;
update emaj.emaj_group_def set grpdef_priority = 1 where grpdef_schema = 'phil''s schema3' and grpdef_tblseq = E'myTbl2\\';
select emaj.emaj_alter_group('phil''s group#3",');
NOTICE:  table "phil's schema3_phil's tbl1_log" does not exist, skipping
CONTEXT:  SQL statement "DROP TABLE IF EXISTS "emaj #'3"."phil's schema3_phil's tbl1_log""
PL/pgSQL function "_create_tbl" line 84 at EXECUTE statement
SQL statement "SELECT emaj._create_tbl(r_tblsq.grpdef_schema, r_tblsq.grpdef_tblseq, v_logSchema, coalesce(r_tblsq.grpdef_log_dat_tsp, v_defTsp), coalesce(r_tblsq.grpdef_log_idx_tsp, v_defTsp), v_isRollbackable)"
PL/pgSQL function "emaj_alter_group" line 202 at PERFORM
NOTICE:  trigger "phil's schema3_phil's tbl1_emaj_log_trg" for table "phil's tbl1" does not exist, skipping
CONTEXT:  SQL statement "DROP TRIGGER IF EXISTS "phil's schema3_phil's tbl1_emaj_log_trg" ON "phil's schema3"."phil's tbl1""
PL/pgSQL function "_create_tbl" line 149 at EXECUTE statement
SQL statement "SELECT emaj._create_tbl(r_tblsq.grpdef_schema, r_tblsq.grpdef_tblseq, v_logSchema, coalesce(r_tblsq.grpdef_log_dat_tsp, v_defTsp), coalesce(r_tblsq.grpdef_log_idx_tsp, v_defTsp), v_isRollbackable)"
PL/pgSQL function "emaj_alter_group" line 202 at PERFORM
NOTICE:  trigger "phil's schema3_phil's tbl1_emaj_trunc_trg" for table "phil's tbl1" does not exist, skipping
CONTEXT:  SQL statement "DROP TRIGGER IF EXISTS "phil's schema3_phil's tbl1_emaj_trunc_trg" ON "phil's schema3"."phil's tbl1""
PL/pgSQL function "_create_tbl" line 157 at EXECUTE statement
SQL statement "SELECT emaj._create_tbl(r_tblsq.grpdef_schema, r_tblsq.grpdef_tblseq, v_logSchema, coalesce(r_tblsq.grpdef_log_dat_tsp, v_defTsp), coalesce(r_tblsq.grpdef_log_idx_tsp, v_defTsp), v_isRollbackable)"
PL/pgSQL function "emaj_alter_group" line 202 at PERFORM
 emaj_alter_group 
------------------
                2
(1 row)

--select rel_priority from emaj.emaj_relation where rel_schema = 'phil''s schema3' and rel_tblseq = 'phil''s tbl1';
select emaj.emaj_start_group('phil''s group#3",','M1_after_alter_group');
 emaj_start_group 
------------------
                4
(1 row)

select emaj.emaj_stop_group('phil''s group#3",');
 emaj_stop_group 
-----------------
               4
(1 row)

reset role;
alter table "phil's schema3"."phil's tbl1" alter column "phil's col12" type char(10);
set role emaj_regression_tests_adm_user;
update emaj.emaj_group_def set grpdef_priority = NULL where grpdef_schema = 'phil''s schema3' and grpdef_tblseq = E'myTbl2\\';
select emaj.emaj_alter_group('phil''s group#3",');
NOTICE:  table "phil's schema3_phil's tbl1_log" does not exist, skipping
CONTEXT:  SQL statement "DROP TABLE IF EXISTS "emaj #'3"."phil's schema3_phil's tbl1_log""
PL/pgSQL function "_create_tbl" line 84 at EXECUTE statement
SQL statement "SELECT emaj._create_tbl(r_tblsq.grpdef_schema, r_tblsq.grpdef_tblseq, v_logSchema, coalesce(r_tblsq.grpdef_log_dat_tsp, v_defTsp), coalesce(r_tblsq.grpdef_log_idx_tsp, v_defTsp), v_isRollbackable)"
PL/pgSQL function "emaj_alter_group" line 202 at PERFORM
NOTICE:  trigger "phil's schema3_phil's tbl1_emaj_log_trg" for table "phil's tbl1" does not exist, skipping
CONTEXT:  SQL statement "DROP TRIGGER IF EXISTS "phil's schema3_phil's tbl1_emaj_log_trg" ON "phil's schema3"."phil's tbl1""
PL/pgSQL function "_create_tbl" line 149 at EXECUTE statement
SQL statement "SELECT emaj._create_tbl(r_tblsq.grpdef_schema, r_tblsq.grpdef_tblseq, v_logSchema, coalesce(r_tblsq.grpdef_log_dat_tsp, v_defTsp), coalesce(r_tblsq.grpdef_log_idx_tsp, v_defTsp), v_isRollbackable)"
PL/pgSQL function "emaj_alter_group" line 202 at PERFORM
NOTICE:  trigger "phil's schema3_phil's tbl1_emaj_trunc_trg" for table "phil's tbl1" does not exist, skipping
CONTEXT:  SQL statement "DROP TRIGGER IF EXISTS "phil's schema3_phil's tbl1_emaj_trunc_trg" ON "phil's schema3"."phil's tbl1""
PL/pgSQL function "_create_tbl" line 157 at EXECUTE statement
SQL statement "SELECT emaj._create_tbl(r_tblsq.grpdef_schema, r_tblsq.grpdef_tblseq, v_logSchema, coalesce(r_tblsq.grpdef_log_dat_tsp, v_defTsp), coalesce(r_tblsq.grpdef_log_idx_tsp, v_defTsp), v_isRollbackable)"
PL/pgSQL function "emaj_alter_group" line 202 at PERFORM
 emaj_alter_group 
------------------
                2
(1 row)

select emaj.emaj_drop_group('phil''s group#3",');
 emaj_drop_group 
-----------------
               4
(1 row)

-----------------------------
-- Step 10 : for phil''s group#3", recreate the group as rollbackable, update tables, 
--           rename a mark, then delete 2 marks then delete all before a mark 
-----------------------------
-- prepare phil's group#3, group
--
reset role;
alter table "phil's schema3"."myTbl2\" add primary key (col21);
NOTICE:  ALTER TABLE / ADD PRIMARY KEY will create implicit index "myTbl2\_pkey" for table "myTbl2\"
set role emaj_regression_tests_adm_user;
select emaj.emaj_create_group('phil''s group#3",',true);
NOTICE:  table "phil's schema3_myTbl2\_log" does not exist, skipping
CONTEXT:  SQL statement "DROP TABLE IF EXISTS emaj."phil's schema3_myTbl2\_log""
PL/pgSQL function "_create_tbl" line 84 at EXECUTE statement
SQL statement "SELECT emaj._create_tbl(r_tblsq.grpdef_schema, r_tblsq.grpdef_tblseq, v_logSchema, coalesce(r_tblsq.grpdef_log_dat_tsp, v_defTsp), coalesce(r_tblsq.grpdef_log_idx_tsp, v_defTsp), v_isRollbackable)"
PL/pgSQL function "emaj_create_group" line 88 at PERFORM
NOTICE:  trigger "phil's schema3_myTbl2\_emaj_log_trg" for table "myTbl2\" does not exist, skipping
CONTEXT:  SQL statement "DROP TRIGGER IF EXISTS "phil's schema3_myTbl2\_emaj_log_trg" ON "phil's schema3"."myTbl2\""
PL/pgSQL function "_create_tbl" line 149 at EXECUTE statement
SQL statement "SELECT emaj._create_tbl(r_tblsq.grpdef_schema, r_tblsq.grpdef_tblseq, v_logSchema, coalesce(r_tblsq.grpdef_log_dat_tsp, v_defTsp), coalesce(r_tblsq.grpdef_log_idx_tsp, v_defTsp), v_isRollbackable)"
PL/pgSQL function "emaj_create_group" line 88 at PERFORM
NOTICE:  trigger "phil's schema3_myTbl2\_emaj_trunc_trg" for table "myTbl2\" does not exist, skipping
CONTEXT:  SQL statement "DROP TRIGGER IF EXISTS "phil's schema3_myTbl2\_emaj_trunc_trg" ON "phil's schema3"."myTbl2\""
PL/pgSQL function "_create_tbl" line 157 at EXECUTE statement
SQL statement "SELECT emaj._create_tbl(r_tblsq.grpdef_schema, r_tblsq.grpdef_tblseq, v_logSchema, coalesce(r_tblsq.grpdef_log_dat_tsp, v_defTsp), coalesce(r_tblsq.grpdef_log_idx_tsp, v_defTsp), v_isRollbackable)"
PL/pgSQL function "emaj_create_group" line 88 at PERFORM
NOTICE:  table "phil's schema3_phil's tbl1_log" does not exist, skipping
CONTEXT:  SQL statement "DROP TABLE IF EXISTS "emaj #'3"."phil's schema3_phil's tbl1_log""
PL/pgSQL function "_create_tbl" line 84 at EXECUTE statement
SQL statement "SELECT emaj._create_tbl(r_tblsq.grpdef_schema, r_tblsq.grpdef_tblseq, v_logSchema, coalesce(r_tblsq.grpdef_log_dat_tsp, v_defTsp), coalesce(r_tblsq.grpdef_log_idx_tsp, v_defTsp), v_isRollbackable)"
PL/pgSQL function "emaj_create_group" line 88 at PERFORM
NOTICE:  trigger "phil's schema3_phil's tbl1_emaj_log_trg" for table "phil's tbl1" does not exist, skipping
CONTEXT:  SQL statement "DROP TRIGGER IF EXISTS "phil's schema3_phil's tbl1_emaj_log_trg" ON "phil's schema3"."phil's tbl1""
PL/pgSQL function "_create_tbl" line 149 at EXECUTE statement
SQL statement "SELECT emaj._create_tbl(r_tblsq.grpdef_schema, r_tblsq.grpdef_tblseq, v_logSchema, coalesce(r_tblsq.grpdef_log_dat_tsp, v_defTsp), coalesce(r_tblsq.grpdef_log_idx_tsp, v_defTsp), v_isRollbackable)"
PL/pgSQL function "emaj_create_group" line 88 at PERFORM
NOTICE:  trigger "phil's schema3_phil's tbl1_emaj_trunc_trg" for table "phil's tbl1" does not exist, skipping
CONTEXT:  SQL statement "DROP TRIGGER IF EXISTS "phil's schema3_phil's tbl1_emaj_trunc_trg" ON "phil's schema3"."phil's tbl1""
PL/pgSQL function "_create_tbl" line 157 at EXECUTE statement
SQL statement "SELECT emaj._create_tbl(r_tblsq.grpdef_schema, r_tblsq.grpdef_tblseq, v_logSchema, coalesce(r_tblsq.grpdef_log_dat_tsp, v_defTsp), coalesce(r_tblsq.grpdef_log_idx_tsp, v_defTsp), v_isRollbackable)"
PL/pgSQL function "emaj_create_group" line 88 at PERFORM
WARNING:  _check_fk_groups: Foreign key mytbl2_col21_fkey, from table phil's schema3.myTbl2\, references phil's schema3.mytbl4 that is outside groups (phil's group#3",).
CONTEXT:  SQL statement "SELECT emaj._check_fk_groups (array[v_groupName])"
PL/pgSQL function "emaj_create_group" line 114 at PERFORM
WARNING:  _check_fk_groups: table phil's schema3.phil's tbl1 is referenced by foreign key mytbl4_col44_fkey from table phil's schema3.mytbl4 that is outside groups (phil's group#3",).
CONTEXT:  SQL statement "SELECT emaj._check_fk_groups (array[v_groupName])"
PL/pgSQL function "emaj_create_group" line 114 at PERFORM
 emaj_create_group 
-------------------
                 4
(1 row)

select emaj.emaj_start_group('phil''s group#3",','M1_rollbackable');
WARNING:  _check_fk_groups: Foreign key mytbl2_col21_fkey, from table phil's schema3.myTbl2\, references phil's schema3.mytbl4 that is outside groups (phil's group#3",).
CONTEXT:  SQL statement "SELECT emaj._check_fk_groups(array[v_groupNames[v_i]])"
PL/pgSQL function "_start_groups" line 46 at PERFORM
SQL statement "SELECT emaj._start_groups(array[v_groupName], v_mark, false, v_resetLog)"
PL/pgSQL function "emaj_start_group" line 17 at SQL statement
PL/pgSQL function "emaj_start_group" line 6 at RETURN
WARNING:  _check_fk_groups: table phil's schema3.phil's tbl1 is referenced by foreign key mytbl4_col44_fkey from table phil's schema3.mytbl4 that is outside groups (phil's group#3",).
CONTEXT:  SQL statement "SELECT emaj._check_fk_groups(array[v_groupNames[v_i]])"
PL/pgSQL function "_start_groups" line 46 at PERFORM
SQL statement "SELECT emaj._start_groups(array[v_groupName], v_mark, false, v_resetLog)"
PL/pgSQL function "emaj_start_group" line 17 at SQL statement
PL/pgSQL function "emaj_start_group" line 6 at RETURN
 emaj_start_group 
------------------
                4
(1 row)

--
set search_path="phil's schema3";
--
insert into "phil's tbl1" select i, 'AB''C', E'\\014'::bytea from generate_series (1,31) as i;
update "phil's tbl1" set "phil\s col13" = E'\\034'::bytea where "phil's col11" <= 3;
update "phil's tbl1" set "phil\s col13" = E'\\034'''::bytea where "phil's col11" between 18 and 22;
insert into myTbl4 (col41) values (1);
insert into myTbl4 (col41) values (2);
insert into "myTbl2\" values (1,'ABC','2010-12-31');
delete from "phil's tbl1" where "phil's col11" > 20;
insert into "myTbl2\" values (2,'DEF',NULL);
select nextval(E'"phil''s schema3"."phil''s seq\\1"');
 nextval 
---------
    1000
(1 row)

--
select emaj.emaj_set_mark_group('phil''s group#3",','M2_rollbackable');
 emaj_set_mark_group 
---------------------
                   4
(1 row)

select emaj.emaj_set_mark_group('phil''s group#3",','M2_again!');
 emaj_set_mark_group 
---------------------
                   4
(1 row)

--
delete from "phil's tbl1" where "phil's col11" = 10;
update "phil's tbl1" set "phil's col12" = 'DEF' where "phil's col11" <= 2;
select nextval(E'"phil''s schema3"."phil''s seq\\1"');
 nextval 
---------
    1001
(1 row)

--
select emaj.emaj_set_mark_groups(array['phil''s group#3",'],'phil''s mark #1');
 emaj_set_mark_groups 
----------------------
                    4
(1 row)

select emaj.emaj_comment_mark_group('phil''s group#3",','phil''s mark #1','Third mark set');
 emaj_comment_mark_group 
-------------------------
 
(1 row)

--
select emaj.emaj_rename_mark_group('phil''s group#3",','phil''s mark #1','phil''s mark #3');
 emaj_rename_mark_group 
------------------------
 
(1 row)

-- 
select emaj.emaj_delete_mark_group('phil''s group#3",','M2_again!');
 emaj_delete_mark_group 
------------------------
                      1
(1 row)

--
select * from emaj.emaj_log_stat_group('phil''s group#3",','','');
    stat_group    |  stat_schema   | stat_table  | stat_rows 
------------------+----------------+-------------+-----------
 phil's group#3", | phil's schema3 | myTbl2\     |         2
 phil's group#3", | phil's schema3 | phil's tbl1 |        53
(2 rows)

select * from emaj.emaj_detailed_log_stat_group('phil''s group#3",','phil''s mark #3','');
 stat_group | stat_schema | stat_table | stat_role | stat_verb | stat_rows 
------------+-------------+------------+-----------+-----------+-----------
(0 rows)

--
select emaj.emaj_logged_rollback_group('phil''s group#3",','phil''s mark #3');
WARNING:  _check_fk_groups: Foreign key mytbl2_col21_fkey, from table phil's schema3.myTbl2\, references phil's schema3.mytbl4 that is outside groups (phil's group#3",).
CONTEXT:  SQL statement "SELECT emaj._check_fk_groups(v_groupNames)"
PL/pgSQL function "_rlbk_groups_step1" line 74 at PERFORM
SQL statement "SELECT emaj._rlbk_groups_step1(v_groupNames, v_mark, v_unloggedRlbk, 1, v_multiGroup)"
PL/pgSQL function "_rlbk_groups" line 20 at SQL statement
PL/pgSQL function "emaj_logged_rollback_group" line 12 at RETURN
WARNING:  _check_fk_groups: table phil's schema3.phil's tbl1 is referenced by foreign key mytbl4_col44_fkey from table phil's schema3.mytbl4 that is outside groups (phil's group#3",).
CONTEXT:  SQL statement "SELECT emaj._check_fk_groups(v_groupNames)"
PL/pgSQL function "_rlbk_groups_step1" line 74 at PERFORM
SQL statement "SELECT emaj._rlbk_groups_step1(v_groupNames, v_mark, v_unloggedRlbk, 1, v_multiGroup)"
PL/pgSQL function "_rlbk_groups" line 20 at SQL statement
PL/pgSQL function "emaj_logged_rollback_group" line 12 at RETURN
 emaj_logged_rollback_group 
----------------------------
                          2
(1 row)

select emaj.emaj_rollback_group('phil''s group#3",','phil''s mark #3');
WARNING:  _check_fk_groups: Foreign key mytbl2_col21_fkey, from table phil's schema3.myTbl2\, references phil's schema3.mytbl4 that is outside groups (phil's group#3",).
CONTEXT:  SQL statement "SELECT emaj._check_fk_groups(v_groupNames)"
PL/pgSQL function "_rlbk_groups_step1" line 74 at PERFORM
SQL statement "SELECT emaj._rlbk_groups_step1(v_groupNames, v_mark, v_unloggedRlbk, 1, v_multiGroup)"
PL/pgSQL function "_rlbk_groups" line 20 at SQL statement
PL/pgSQL function "emaj_rollback_group" line 8 at RETURN
WARNING:  _check_fk_groups: table phil's schema3.phil's tbl1 is referenced by foreign key mytbl4_col44_fkey from table phil's schema3.mytbl4 that is outside groups (phil's group#3",).
CONTEXT:  SQL statement "SELECT emaj._check_fk_groups(v_groupNames)"
PL/pgSQL function "_rlbk_groups_step1" line 74 at PERFORM
SQL statement "SELECT emaj._rlbk_groups_step1(v_groupNames, v_mark, v_unloggedRlbk, 1, v_multiGroup)"
PL/pgSQL function "_rlbk_groups" line 20 at SQL statement
PL/pgSQL function "emaj_rollback_group" line 8 at RETURN
 emaj_rollback_group 
---------------------
                   2
(1 row)

-----------------------------
-- Checking step 10
-----------------------------
-- emaj tables
select mark_id, mark_group, regexp_replace(mark_name,E'\\d\\d\.\\d\\d\\.\\d\\d\\.\\d\\d\\d','%','g'), mark_global_seq, mark_state, mark_comment, mark_last_seq_hole_id, mark_last_sequence_id, mark_log_rows_before_next from emaj.emaj_mark order by mark_id;
 mark_id |    mark_group    |        regexp_replace        | mark_global_seq | mark_state |     mark_comment     | mark_last_seq_hole_id | mark_last_sequence_id | mark_log_rows_before_next 
---------+------------------+------------------------------+-----------------+------------+----------------------+-----------------------+-----------------------+---------------------------
     606 | myGroup2         | M3                           |           11920 | DELETED    | This mark is deleted |                   599 |                   645 |                         0
     611 | myGroup1         | M4                           |           11949 | DELETED    |                      |                   601 |                   683 |                        10
     612 | myGroup1         | M5                           |           11959 | DELETED    |                      |                   601 |                   689 |                         3
     616 | myGroup1         | Before logged rollback to M4 |           11989 | DELETED    |                      |                   606 |                   717 |                        18
     618 | myGroup1         | STOP_%                       |           12007 | DELETED    |                      |                   606 |                   737 |                         0
     619 | myGroup2         | STOP_%                       |           12007 | DELETED    |                      |                   606 |                   737 |                         0
     628 | myGroup1         | Stop after rollback          |           12007 | DELETED    |                      |                   606 |                   807 |                         0
     629 | myGroup2         | Stop after rollback          |           12007 | DELETED    |                      |                   606 |                   807 |                         0
     630 | myGroup1         | Multi-1                      |           12007 | ACTIVE     |                      |                   606 |                   821 |                          
     631 | myGroup2         | Multi-1                      |           12007 | ACTIVE     |                      |                   606 |                   821 |                          
     636 | phil's group#3", | M1_rollbackable              |           12007 | ACTIVE     |                      |                   606 |                   847 |                        52
     637 | phil's group#3", | M2_rollbackable              |           12059 | ACTIVE     |                      |                   606 |                   851 |                         3
     639 | phil's group#3", | phil's mark #3               |           12062 | ACTIVE     | Third mark set       |                   606 |                   859 |                          
(13 rows)

select sequ_id,sequ_schema, sequ_name, regexp_replace(sequ_mark,E'\\d\\d\.\\d\\d\\.\\d\\d\\.\\d\\d\\d','%','g'), sequ_last_val, sequ_is_called from emaj.emaj_sequence order by sequ_id;
 sequ_id |  sequ_schema   |             sequ_name              |        regexp_replace        | sequ_last_val | sequ_is_called 
---------+----------------+------------------------------------+------------------------------+---------------+----------------
     625 | emajC          | myschema1_myTbl3_log_seq           | M3                           |            10 | t
     628 | emaj           | myschema1_mytbl2_log_seq           | M3                           |             2 | t
     629 | emajb          | myschema1_mytbl2b_log_seq          | M3                           |             1 | f
     638 | myschema2      | myseq1                             | M3                           |          1003 | t
     639 | myschema2      | myTbl3_col31_seq                   | M3                           |            20 | t
     640 | emaj           | myschema2_mytbl1_log_seq           | M3                           |            15 | t
     641 | emaj           | myschema2_mytbl2_log_seq           | M3                           |             2 | t
     642 | emajC          | myschema2_myTbl3_log_seq           | M3                           |            10 | t
     643 | emaj           | myschema2_mytbl4_log_seq           | M3                           |             4 | t
     644 | emaj           | myschema2_mytbl5_log_seq           | M3                           |             4 | t
     645 | emaj           | myschema2_mytbl6_log_seq           | M3                           |            14 | t
     648 | emaj           | myschema2_mytbl1_log_seq           | RLBK_M2_%_START              |            15 | t
     649 | emaj           | myschema2_mytbl2_log_seq           | RLBK_M2_%_START              |             2 | t
     650 | emajC          | myschema2_myTbl3_log_seq           | RLBK_M2_%_START              |            10 | t
     656 | emaj           | myschema2_mytbl1_log_seq           | RLBK_M2_%_DONE               |            15 | t
     657 | emaj           | myschema2_mytbl2_log_seq           | RLBK_M2_%_DONE               |             2 | t
     658 | emajC          | myschema2_myTbl3_log_seq           | RLBK_M2_%_DONE               |            10 | t
     664 | emaj           | myschema2_mytbl1_log_seq           | RLBK_M3_%_START              |            15 | t
     665 | emaj           | myschema2_mytbl2_log_seq           | RLBK_M3_%_START              |             2 | t
     666 | emajC          | myschema2_myTbl3_log_seq           | RLBK_M3_%_START              |            10 | t
     672 | emaj           | myschema2_mytbl1_log_seq           | RLBK_M3_%_DONE               |            15 | t
     673 | emaj           | myschema2_mytbl2_log_seq           | RLBK_M3_%_DONE               |             2 | t
     674 | emajC          | myschema2_myTbl3_log_seq           | RLBK_M3_%_DONE               |            10 | t
     678 | myschema1      | myTbl3_col31_seq                   | M4                           |            20 | t
     679 | emajC          | myschema1_myTbl3_log_seq           | M4                           |            10 | t
     680 | emaj           | myschema1_mytbl1_log_seq           | M4                           |            30 | t
     681 | emaj           | myschema1_mytbl4_log_seq           | M4                           |             8 | t
     682 | emaj           | myschema1_mytbl2_log_seq           | M4                           |             3 | t
     683 | emajb          | myschema1_mytbl2b_log_seq          | M4                           |             1 | f
     684 | myschema1      | myTbl3_col31_seq                   | M5                           |            20 | t
     685 | emajC          | myschema1_myTbl3_log_seq           | M5                           |            20 | t
     686 | emaj           | myschema1_mytbl1_log_seq           | M5                           |            30 | t
     687 | emaj           | myschema1_mytbl4_log_seq           | M5                           |             8 | t
     688 | emaj           | myschema1_mytbl2_log_seq           | M5                           |             3 | t
     689 | emajb          | myschema1_mytbl2b_log_seq          | M5                           |             1 | f
     691 | emajC          | myschema1_myTbl3_log_seq           | M6                           |            20 | t
     694 | emaj           | myschema1_mytbl2_log_seq           | M6                           |             3 | t
     695 | emajb          | myschema1_mytbl2b_log_seq          | M6                           |             1 | f
     698 | emaj           | myschema2_mytbl1_log_seq           | RLBK_M2_%_START              |            15 | t
     699 | emaj           | myschema2_mytbl2_log_seq           | RLBK_M2_%_START              |             2 | t
     700 | emajC          | myschema2_myTbl3_log_seq           | RLBK_M2_%_START              |            10 | t
     706 | emaj           | myschema2_mytbl1_log_seq           | RLBK_M2_%_DONE               |            15 | t
     707 | emaj           | myschema2_mytbl2_log_seq           | RLBK_M2_%_DONE               |             2 | t
     708 | emajC          | myschema2_myTbl3_log_seq           | RLBK_M2_%_DONE               |            10 | t
     712 | myschema1      | myTbl3_col31_seq                   | Before logged rollback to M4 |            20 | t
     713 | emajC          | myschema1_myTbl3_log_seq           | Before logged rollback to M4 |            20 | t
     714 | emaj           | myschema1_mytbl1_log_seq           | Before logged rollback to M4 |            32 | t
     715 | emaj           | myschema1_mytbl4_log_seq           | Before logged rollback to M4 |            12 | t
     716 | emaj           | myschema1_mytbl2_log_seq           | Before logged rollback to M4 |             3 | t
     717 | emajb          | myschema1_mytbl2b_log_seq          | Before logged rollback to M4 |             1 | f
     724 | myschema1      | myTbl3_col31_seq                   | STOP_%                       |            20 | t
     725 | myschema2      | myseq1                             | STOP_%                       |          1004 | f
     726 | myschema2      | myTbl3_col31_seq                   | STOP_%                       |            20 | t
     727 | emajC          | myschema1_myTbl3_log_seq           | STOP_%                       |            35 | t
     728 | emaj           | myschema1_mytbl1_log_seq           | STOP_%                       |            33 | t
     729 | emaj           | myschema1_mytbl4_log_seq           | STOP_%                       |            14 | t
     730 | emaj           | myschema1_mytbl2_log_seq           | STOP_%                       |             3 | t
     731 | emajb          | myschema1_mytbl2b_log_seq          | STOP_%                       |             1 | f
     732 | emaj           | myschema2_mytbl1_log_seq           | STOP_%                       |            15 | t
     733 | emaj           | myschema2_mytbl2_log_seq           | STOP_%                       |             2 | t
     734 | emajC          | myschema2_myTbl3_log_seq           | STOP_%                       |            10 | t
     735 | emaj           | myschema2_mytbl4_log_seq           | STOP_%                       |            24 | t
     736 | emaj           | myschema2_mytbl5_log_seq           | STOP_%                       |             9 | t
     737 | emaj           | myschema2_mytbl6_log_seq           | STOP_%                       |            29 | t
     755 | emajC          | myschema1_myTbl3_log_seq           | Multi-2                      |            35 | t
     756 | emaj           | myschema1_mytbl1_log_seq           | Multi-2                      |            33 | t
     757 | emaj           | myschema1_mytbl4_log_seq           | Multi-2                      |            14 | t
     758 | emaj           | myschema1_mytbl2_log_seq           | Multi-2                      |             3 | t
     759 | emajb          | myschema1_mytbl2b_log_seq          | Multi-2                      |             1 | f
     760 | emaj           | myschema2_mytbl1_log_seq           | Multi-2                      |            15 | t
     761 | emaj           | myschema2_mytbl2_log_seq           | Multi-2                      |             2 | t
     762 | emajC          | myschema2_myTbl3_log_seq           | Multi-2                      |            10 | t
     763 | emaj           | myschema2_mytbl4_log_seq           | Multi-2                      |            24 | t
     764 | emaj           | myschema2_mytbl5_log_seq           | Multi-2                      |             9 | t
     765 | emaj           | myschema2_mytbl6_log_seq           | Multi-2                      |            29 | t
     769 | emajC          | myschema1_myTbl3_log_seq           | RLBK_Multi-1_%_START         |            35 | t
     770 | emaj           | myschema1_mytbl1_log_seq           | RLBK_Multi-1_%_START         |            33 | t
     771 | emaj           | myschema1_mytbl4_log_seq           | RLBK_Multi-1_%_START         |            14 | t
     772 | emaj           | myschema1_mytbl2_log_seq           | RLBK_Multi-1_%_START         |             3 | t
     773 | emajb          | myschema1_mytbl2b_log_seq          | RLBK_Multi-1_%_START         |             1 | f
     774 | emaj           | myschema2_mytbl1_log_seq           | RLBK_Multi-1_%_START         |            15 | t
     775 | emaj           | myschema2_mytbl2_log_seq           | RLBK_Multi-1_%_START         |             2 | t
     776 | emajC          | myschema2_myTbl3_log_seq           | RLBK_Multi-1_%_START         |            10 | t
     777 | emaj           | myschema2_mytbl4_log_seq           | RLBK_Multi-1_%_START         |            24 | t
     778 | emaj           | myschema2_mytbl5_log_seq           | RLBK_Multi-1_%_START         |             9 | t
     779 | emaj           | myschema2_mytbl6_log_seq           | RLBK_Multi-1_%_START         |            29 | t
     783 | emajC          | myschema1_myTbl3_log_seq           | RLBK_Multi-1_%_DONE          |            35 | t
     784 | emaj           | myschema1_mytbl1_log_seq           | RLBK_Multi-1_%_DONE          |            33 | t
     785 | emaj           | myschema1_mytbl4_log_seq           | RLBK_Multi-1_%_DONE          |            14 | t
     786 | emaj           | myschema1_mytbl2_log_seq           | RLBK_Multi-1_%_DONE          |             3 | t
     787 | emajb          | myschema1_mytbl2b_log_seq          | RLBK_Multi-1_%_DONE          |             1 | f
     788 | emaj           | myschema2_mytbl1_log_seq           | RLBK_Multi-1_%_DONE          |            15 | t
     789 | emaj           | myschema2_mytbl2_log_seq           | RLBK_Multi-1_%_DONE          |             2 | t
     790 | emajC          | myschema2_myTbl3_log_seq           | RLBK_Multi-1_%_DONE          |            10 | t
     791 | emaj           | myschema2_mytbl4_log_seq           | RLBK_Multi-1_%_DONE          |            24 | t
     792 | emaj           | myschema2_mytbl5_log_seq           | RLBK_Multi-1_%_DONE          |             9 | t
     793 | emaj           | myschema2_mytbl6_log_seq           | RLBK_Multi-1_%_DONE          |            29 | t
     794 | myschema1      | myTbl3_col31_seq                   | Stop after rollback          |            20 | t
     795 | myschema2      | myseq1                             | Stop after rollback          |          1004 | f
     796 | myschema2      | myTbl3_col31_seq                   | Stop after rollback          |            20 | t
     797 | emajC          | myschema1_myTbl3_log_seq           | Stop after rollback          |            35 | t
     798 | emaj           | myschema1_mytbl1_log_seq           | Stop after rollback          |            33 | t
     799 | emaj           | myschema1_mytbl4_log_seq           | Stop after rollback          |            14 | t
     800 | emaj           | myschema1_mytbl2_log_seq           | Stop after rollback          |             3 | t
     801 | emajb          | myschema1_mytbl2b_log_seq          | Stop after rollback          |             1 | f
     802 | emaj           | myschema2_mytbl1_log_seq           | Stop after rollback          |            15 | t
     803 | emaj           | myschema2_mytbl2_log_seq           | Stop after rollback          |             2 | t
     804 | emajC          | myschema2_myTbl3_log_seq           | Stop after rollback          |            10 | t
     805 | emaj           | myschema2_mytbl4_log_seq           | Stop after rollback          |            24 | t
     806 | emaj           | myschema2_mytbl5_log_seq           | Stop after rollback          |             9 | t
     807 | emaj           | myschema2_mytbl6_log_seq           | Stop after rollback          |            29 | t
     808 | myschema1      | myTbl3_col31_seq                   | Multi-1                      |            20 | t
     809 | myschema2      | myseq1                             | Multi-1                      |          1004 | f
     810 | myschema2      | myTbl3_col31_seq                   | Multi-1                      |            20 | t
     811 | emajC          | myschema1_myTbl3_log_seq           | Multi-1                      |            35 | t
     812 | emaj           | myschema1_mytbl1_log_seq           | Multi-1                      |            33 | t
     813 | emaj           | myschema1_mytbl4_log_seq           | Multi-1                      |            14 | t
     814 | emaj           | myschema1_mytbl2_log_seq           | Multi-1                      |             3 | t
     815 | emajb          | myschema1_mytbl2b_log_seq          | Multi-1                      |             1 | f
     816 | emaj           | myschema2_mytbl1_log_seq           | Multi-1                      |            15 | t
     817 | emaj           | myschema2_mytbl2_log_seq           | Multi-1                      |             2 | t
     818 | emajC          | myschema2_myTbl3_log_seq           | Multi-1                      |            10 | t
     819 | emaj           | myschema2_mytbl4_log_seq           | Multi-1                      |            24 | t
     820 | emaj           | myschema2_mytbl5_log_seq           | Multi-1                      |             9 | t
     821 | emaj           | myschema2_mytbl6_log_seq           | Multi-1                      |            29 | t
     844 | phil's schema3 | myTbl2\_col21_seq                  | M1_rollbackable              |             1 | f
     845 | phil's schema3 | phil's seq\1                       | M1_rollbackable              |          1000 | f
     846 | emaj           | phil's schema3_myTbl2\_log_seq     | M1_rollbackable              |             1 | f
     847 | emaj #'3       | phil's schema3_phil's tbl1_log_seq | M1_rollbackable              |             1 | f
     848 | phil's schema3 | myTbl2\_col21_seq                  | M2_rollbackable              |             1 | f
     849 | phil's schema3 | phil's seq\1                       | M2_rollbackable              |          1000 | t
     850 | emaj           | phil's schema3_myTbl2\_log_seq     | M2_rollbackable              |             2 | t
     851 | emaj #'3       | phil's schema3_phil's tbl1_log_seq | M2_rollbackable              |            50 | t
     856 | phil's schema3 | myTbl2\_col21_seq                  | phil's mark #3               |             1 | f
     857 | phil's schema3 | phil's seq\1                       | phil's mark #3               |          1001 | t
     858 | emaj           | phil's schema3_myTbl2\_log_seq     | phil's mark #3               |             2 | t
     859 | emaj #'3       | phil's schema3_phil's tbl1_log_seq | phil's mark #3               |            53 | t
     862 | emaj           | phil's schema3_myTbl2\_log_seq     | RLBK_phil's mark #3_%_START  |             2 | t
     863 | emaj #'3       | phil's schema3_phil's tbl1_log_seq | RLBK_phil's mark #3_%_START  |            53 | t
     866 | emaj           | phil's schema3_myTbl2\_log_seq     | RLBK_phil's mark #3_%_DONE   |             2 | t
     867 | emaj #'3       | phil's schema3_phil's tbl1_log_seq | RLBK_phil's mark #3_%_DONE   |            53 | t
(141 rows)

select * from emaj.emaj_fk order by fk_groups, fk_session, fk_name;
 fk_groups | fk_session | fk_name | fk_schema | fk_table | fk_action | fk_def 
-----------+------------+---------+-----------+----------+-----------+--------
(0 rows)

select sqhl_id, sqhl_schema, sqhl_table, sqhl_hole_size from emaj.emaj_seq_hole order by sqhl_id;
 sqhl_id | sqhl_schema | sqhl_table | sqhl_hole_size 
---------+-------------+------------+----------------
     602 | myschema2   | mytbl4     |             20
     603 | myschema2   | mytbl5     |              5
     604 | myschema2   | mytbl6     |             15
     605 | myschema1   | mytbl1     |              1
     606 | myschema1   | mytbl4     |              2
(5 rows)

select rlbk_operation, rlbk_schema, rlbk_tbl_fk, rlbk_nb_rows from emaj.emaj_rlbk_stat
  order by rlbk_schema, rlbk_tbl_fk, rlbk_datetime, rlbk_operation;
  rlbk_operation  | rlbk_schema |    rlbk_tbl_fk    | rlbk_nb_rows 
------------------+-------------+-------------------+--------------
 del_log          | myschema1   | mytbl1            |            3
 rlbk             | myschema1   | mytbl1            |            3
 del_log          | myschema1   | mytbl1            |            1
 rlbk             | myschema1   | mytbl1            |            1
 rlbk             | myschema1   | mytbl1            |            1
 rlbk             | myschema1   | myTbl3            |           10
 del_log          | myschema1   | mytbl4            |            8
 rlbk             | myschema1   | mytbl4            |            8
 del_log          | myschema1   | mytbl4            |            2
 rlbk             | myschema1   | mytbl4            |            2
 rlbk             | myschema1   | mytbl4            |            2
 set_fk_immediate | myschema1   | mytbl4_col43_fkey |            8
 set_fk_immediate | myschema1   | mytbl4_col43_fkey |            2
 set_fk_immediate | myschema1   | mytbl4_col43_fkey |            2
 add_fk           | myschema1   | mytbl4_col44_fkey |            0
 add_fk           | myschema1   | mytbl4_col44_fkey |            0
 add_fk           | myschema1   | mytbl4_col44_fkey |            0
 rlbk             | myschema2   | mytbl4            |            4
 rlbk             | myschema2   | mytbl4            |            4
 rlbk             | myschema2   | mytbl4            |           12
 del_log          | myschema2   | mytbl4            |           20
 rlbk             | myschema2   | mytbl4            |           20
 set_fk_immediate | myschema2   | mytbl4_col43_fkey |            4
 set_fk_immediate | myschema2   | mytbl4_col43_fkey |            4
 set_fk_immediate | myschema2   | mytbl4_col43_fkey |           12
 set_fk_immediate | myschema2   | mytbl4_col43_fkey |           20
 add_fk           | myschema2   | mytbl4_col44_fkey |            2
 add_fk           | myschema2   | mytbl4_col44_fkey |            2
 add_fk           | myschema2   | mytbl4_col44_fkey |            2
 add_fk           | myschema2   | mytbl4_col44_fkey |            2
 rlbk             | myschema2   | mytbl5            |            1
 rlbk             | myschema2   | mytbl5            |            1
 rlbk             | myschema2   | mytbl5            |            3
 del_log          | myschema2   | mytbl5            |            5
 rlbk             | myschema2   | mytbl5            |            5
 rlbk             | myschema2   | mytbl6            |            3
 rlbk             | myschema2   | mytbl6            |            3
 rlbk             | myschema2   | mytbl6            |            9
 del_log          | myschema2   | mytbl6            |           15
 rlbk             | myschema2   | mytbl6            |           15
(40 rows)

-- user tables
select * from "phil's schema3"."phil's tbl1" order by "phil's col11","phil's col12";
 phil's col11 | phil's col12 | phil\s col13 
--------------+--------------+--------------
            1 | DEF          | \x1c
            2 | DEF          | \x1c
            3 | AB'C         | \x1c
            4 | AB'C         | \x0c
            5 | AB'C         | \x0c
            6 | AB'C         | \x0c
            7 | AB'C         | \x0c
            8 | AB'C         | \x0c
            9 | AB'C         | \x0c
           11 | AB'C         | \x0c
           12 | AB'C         | \x0c
           13 | AB'C         | \x0c
           14 | AB'C         | \x0c
           15 | AB'C         | \x0c
           16 | AB'C         | \x0c
           17 | AB'C         | \x0c
           18 | AB'C         | \x1c27
           19 | AB'C         | \x1c27
           20 | AB'C         | \x1c27
(19 rows)

select * from "phil's schema3"."myTbl2\" order by col21;
 col21 | col22 |   col23    
-------+-------+------------
     1 | ABC   | 12-31-2010
     2 | DEF   | 
(2 rows)

-- log tables
select "phil's col11", "phil's col12", "phil\s col13", emaj_verb, emaj_tuple, emaj_gid from "emaj #'3"."phil's schema3_phil's tbl1_log" order by emaj_gid, emaj_tuple desc;
 phil's col11 | phil's col12 | phil\s col13 | emaj_verb | emaj_tuple | emaj_gid 
--------------+--------------+--------------+-----------+------------+----------
            1 | AB'C         | \x0c         | INS       | NEW        |    12008
            2 | AB'C         | \x0c         | INS       | NEW        |    12009
            3 | AB'C         | \x0c         | INS       | NEW        |    12010
            4 | AB'C         | \x0c         | INS       | NEW        |    12011
            5 | AB'C         | \x0c         | INS       | NEW        |    12012
            6 | AB'C         | \x0c         | INS       | NEW        |    12013
            7 | AB'C         | \x0c         | INS       | NEW        |    12014
            8 | AB'C         | \x0c         | INS       | NEW        |    12015
            9 | AB'C         | \x0c         | INS       | NEW        |    12016
           10 | AB'C         | \x0c         | INS       | NEW        |    12017
           11 | AB'C         | \x0c         | INS       | NEW        |    12018
           12 | AB'C         | \x0c         | INS       | NEW        |    12019
           13 | AB'C         | \x0c         | INS       | NEW        |    12020
           14 | AB'C         | \x0c         | INS       | NEW        |    12021
           15 | AB'C         | \x0c         | INS       | NEW        |    12022
           16 | AB'C         | \x0c         | INS       | NEW        |    12023
           17 | AB'C         | \x0c         | INS       | NEW        |    12024
           18 | AB'C         | \x0c         | INS       | NEW        |    12025
           19 | AB'C         | \x0c         | INS       | NEW        |    12026
           20 | AB'C         | \x0c         | INS       | NEW        |    12027
           21 | AB'C         | \x0c         | INS       | NEW        |    12028
           22 | AB'C         | \x0c         | INS       | NEW        |    12029
           23 | AB'C         | \x0c         | INS       | NEW        |    12030
           24 | AB'C         | \x0c         | INS       | NEW        |    12031
           25 | AB'C         | \x0c         | INS       | NEW        |    12032
           26 | AB'C         | \x0c         | INS       | NEW        |    12033
           27 | AB'C         | \x0c         | INS       | NEW        |    12034
           28 | AB'C         | \x0c         | INS       | NEW        |    12035
           29 | AB'C         | \x0c         | INS       | NEW        |    12036
           30 | AB'C         | \x0c         | INS       | NEW        |    12037
           31 | AB'C         | \x0c         | INS       | NEW        |    12038
            1 | AB'C         | \x0c         | UPD       | OLD        |    12039
            1 | AB'C         | \x1c         | UPD       | NEW        |    12039
            2 | AB'C         | \x0c         | UPD       | OLD        |    12040
            2 | AB'C         | \x1c         | UPD       | NEW        |    12040
            3 | AB'C         | \x0c         | UPD       | OLD        |    12041
            3 | AB'C         | \x1c         | UPD       | NEW        |    12041
           18 | AB'C         | \x0c         | UPD       | OLD        |    12042
           18 | AB'C         | \x1c27       | UPD       | NEW        |    12042
           19 | AB'C         | \x0c         | UPD       | OLD        |    12043
           19 | AB'C         | \x1c27       | UPD       | NEW        |    12043
           20 | AB'C         | \x0c         | UPD       | OLD        |    12044
           20 | AB'C         | \x1c27       | UPD       | NEW        |    12044
           21 | AB'C         | \x0c         | UPD       | OLD        |    12045
           21 | AB'C         | \x1c27       | UPD       | NEW        |    12045
           22 | AB'C         | \x0c         | UPD       | OLD        |    12046
           22 | AB'C         | \x1c27       | UPD       | NEW        |    12046
           23 | AB'C         | \x0c         | DEL       | OLD        |    12048
           24 | AB'C         | \x0c         | DEL       | OLD        |    12049
           25 | AB'C         | \x0c         | DEL       | OLD        |    12050
           26 | AB'C         | \x0c         | DEL       | OLD        |    12051
           27 | AB'C         | \x0c         | DEL       | OLD        |    12052
           28 | AB'C         | \x0c         | DEL       | OLD        |    12053
           29 | AB'C         | \x0c         | DEL       | OLD        |    12054
           30 | AB'C         | \x0c         | DEL       | OLD        |    12055
           31 | AB'C         | \x0c         | DEL       | OLD        |    12056
           21 | AB'C         | \x1c27       | DEL       | OLD        |    12057
           22 | AB'C         | \x1c27       | DEL       | OLD        |    12058
           10 | AB'C         | \x0c         | DEL       | OLD        |    12060
            1 | AB'C         | \x1c         | UPD       | OLD        |    12061
            1 | DEF          | \x1c         | UPD       | NEW        |    12061
            2 | AB'C         | \x1c         | UPD       | OLD        |    12062
            2 | DEF          | \x1c         | UPD       | NEW        |    12062
(63 rows)

select col21, col22, col23, emaj_verb, emaj_tuple, emaj_gid from emaj."phil's schema3_myTbl2\_log" order by emaj_gid, emaj_tuple desc;
 col21 | col22 |   col23    | emaj_verb | emaj_tuple | emaj_gid 
-------+-------+------------+-----------+------------+----------
     1 | ABC   | 12-31-2010 | INS       | NEW        |    12047
     2 | DEF   |            | INS       | NEW        |    12059
(2 rows)

-----------------------------
-- Step 11 : for myGroup1, in a transaction, update tables and rollback the transaction, 
--           then rollback to previous mark 
-----------------------------
set search_path=myschema1;
--
begin transaction;
  delete from mytbl1;
rollback;
--
select emaj.emaj_rollback_group('myGroup1','EMAJ_LAST_MARK');
 emaj_rollback_group 
---------------------
                   2
(1 row)

-----------------------------
-- Checking step 11
-----------------------------
-- emaj tables
select sqhl_id, sqhl_schema, sqhl_table, sqhl_hole_size from emaj.emaj_seq_hole order by sqhl_id;
 sqhl_id | sqhl_schema | sqhl_table | sqhl_hole_size 
---------+-------------+------------+----------------
     602 | myschema2   | mytbl4     |             20
     603 | myschema2   | mytbl5     |              5
     604 | myschema2   | mytbl6     |             15
     605 | myschema1   | mytbl1     |              1
     606 | myschema1   | mytbl4     |              2
     607 | myschema1   | mytbl1     |             20
(6 rows)

select rlbk_operation, rlbk_schema, rlbk_tbl_fk, rlbk_nb_rows from emaj.emaj_rlbk_stat
  order by rlbk_schema, rlbk_tbl_fk, rlbk_datetime, rlbk_operation;
  rlbk_operation  | rlbk_schema |    rlbk_tbl_fk    | rlbk_nb_rows 
------------------+-------------+-------------------+--------------
 del_log          | myschema1   | mytbl1            |            3
 rlbk             | myschema1   | mytbl1            |            3
 del_log          | myschema1   | mytbl1            |            1
 rlbk             | myschema1   | mytbl1            |            1
 rlbk             | myschema1   | mytbl1            |            1
 rlbk             | myschema1   | myTbl3            |           10
 del_log          | myschema1   | mytbl4            |            8
 rlbk             | myschema1   | mytbl4            |            8
 del_log          | myschema1   | mytbl4            |            2
 rlbk             | myschema1   | mytbl4            |            2
 rlbk             | myschema1   | mytbl4            |            2
 set_fk_immediate | myschema1   | mytbl4_col43_fkey |            8
 set_fk_immediate | myschema1   | mytbl4_col43_fkey |            2
 set_fk_immediate | myschema1   | mytbl4_col43_fkey |            2
 add_fk           | myschema1   | mytbl4_col44_fkey |            0
 add_fk           | myschema1   | mytbl4_col44_fkey |            0
 add_fk           | myschema1   | mytbl4_col44_fkey |            0
 add_fk           | myschema1   | mytbl4_col44_fkey |            0
 rlbk             | myschema2   | mytbl4            |            4
 rlbk             | myschema2   | mytbl4            |            4
 rlbk             | myschema2   | mytbl4            |           12
 del_log          | myschema2   | mytbl4            |           20
 rlbk             | myschema2   | mytbl4            |           20
 set_fk_immediate | myschema2   | mytbl4_col43_fkey |            4
 set_fk_immediate | myschema2   | mytbl4_col43_fkey |            4
 set_fk_immediate | myschema2   | mytbl4_col43_fkey |           12
 set_fk_immediate | myschema2   | mytbl4_col43_fkey |           20
 add_fk           | myschema2   | mytbl4_col44_fkey |            2
 add_fk           | myschema2   | mytbl4_col44_fkey |            2
 add_fk           | myschema2   | mytbl4_col44_fkey |            2
 add_fk           | myschema2   | mytbl4_col44_fkey |            2
 rlbk             | myschema2   | mytbl5            |            1
 rlbk             | myschema2   | mytbl5            |            1
 rlbk             | myschema2   | mytbl5            |            3
 del_log          | myschema2   | mytbl5            |            5
 rlbk             | myschema2   | mytbl5            |            5
 rlbk             | myschema2   | mytbl6            |            3
 rlbk             | myschema2   | mytbl6            |            3
 rlbk             | myschema2   | mytbl6            |            9
 del_log          | myschema2   | mytbl6            |           15
 rlbk             | myschema2   | mytbl6            |           15
(41 rows)

-----------------------------
-- Step 12 : tests snaps and script generation functions
-----------------------------
-- first add some updates for tables with unusual types (arrays, geometric)
set search_path=myschema2;
insert into myTbl5 values (10,'{"abc","def","ghi"}','{1,2,3}',NULL);
insert into myTbl5 values (20,array['abc','def','ghi'],array[3,4,5],array['2000/02/01'::date,'2000/02/28'::date]);
update myTbl5 set col54 = '{"2010/11/28","2010/12/03"}' where col54 is null;
insert into myTbl6 select i+10, point(i,1.3), '((0,0),(2,2))', circle(point(5,5),i),'((-2,-2),(3,0),(1,4))','10.20.30.40/27' from generate_series (1,8) as i;
update myTbl6 set col64 = '<(5,6),3.5>', col65 = null where col61 <= 13;
-- reset directory for snaps
\! rm -R /tmp/emaj_test/snaps
\! mkdir /tmp/emaj_test/snaps
-- ... and snap the all groups
select emaj.emaj_snap_group('myGroup1','/tmp/emaj_test/snaps','CSV HEADER');
 emaj_snap_group 
-----------------
               6
(1 row)

select emaj.emaj_snap_group('myGroup2','/tmp/emaj_test/snaps','CSV HEADER');
 emaj_snap_group 
-----------------
               8
(1 row)

select emaj.emaj_snap_group('phil''s group#3",','/tmp/emaj_test/snaps','CSV HEADER');
 emaj_snap_group 
-----------------
               4
(1 row)

\! ls /tmp/emaj_test/snaps
_INFO
myschema1_mytbl1.snap
myschema1_mytbl2b.snap
myschema1_mytbl2.snap
myschema1_myTbl3_col31_seq.snap
myschema1_myTbl3.snap
myschema1_mytbl4.snap
myschema2_myseq1.snap
myschema2_mytbl1.snap
myschema2_mytbl2.snap
myschema2_myTbl3_col31_seq.snap
myschema2_myTbl3.snap
myschema2_mytbl4.snap
myschema2_mytbl5.snap
myschema2_mytbl6.snap
phil's schema3_myTbl2\_col21_seq.snap
phil's schema3_myTbl2\.snap
phil's schema3_phil's seq\1.snap
phil's schema3_phil's tbl1.snap
-- reset directory for emaj_generate_sql tests
\! rm -R /tmp/emaj_test/sql_scripts
\! mkdir /tmp/emaj_test/sql_scripts
--select * from emaj.emaj_mark order by mark_group, mark_id;
-- generate sql script for each active group (and check the result with detailed log statistics + number of sequences)
select emaj.emaj_generate_sql('myGroup1', 'Multi-1', NULL, '/tmp/emaj_test/sql_scripts/myGroup1.sql');
NOTICE:  table "emaj_temp_script" does not exist, skipping
CONTEXT:  SQL statement "DROP TABLE IF EXISTS emaj_temp_script"
PL/pgSQL function "emaj_generate_sql" line 122 at SQL statement
 emaj_generate_sql 
-------------------
                 1
(1 row)

select coalesce(sum(stat_rows),0) + 1 as check from emaj.emaj_detailed_log_stat_group('myGroup1', 'Multi-1', NULL);
 check 
-------
     1
(1 row)

select emaj.emaj_generate_sql('myGroup2', 'Multi-1', NULL, '/tmp/emaj_test/sql_scripts/myGroup2.sql');
 emaj_generate_sql 
-------------------
                21
(1 row)

select sum(stat_rows) + 2 as check from emaj.emaj_detailed_log_stat_group('myGroup2', 'Multi-1', NULL);
 check 
-------
    21
(1 row)

select emaj.emaj_generate_sql('phil''s group#3",', 'M1_rollbackable', NULL, '/tmp/emaj_test/sql_scripts/Group3.sql');
 emaj_generate_sql 
-------------------
                57
(1 row)

select sum(stat_rows) + 1 as check from emaj.emaj_detailed_log_stat_group('phil''s group#3",', 'M1_rollbackable', NULL);
 check 
-------
    56
(1 row)

-- process \\ in script files
\! find /tmp/emaj_test/sql_scripts -name '*.sql' -type f -print0 | xargs -0 sed -i_s -s 's/\\\\/\\/g'
-- comment transaction commands for the need of the current test
\! find /tmp/emaj_test/sql_scripts -name '*.sql' -type f -print0 | xargs -0 sed -i -s 's/^BEGIN/--BEGIN/;s/^COMMIT/--COMMIT/'
-- mask timestamp in initial comment
\! find /tmp/emaj_test/sql_scripts -name '*.sql' -type f -print0 | xargs -0 sed -i -s 's/at .* by/at [ts] by/'
\! ls /tmp/emaj_test/sql_scripts
Group3.sql
Group3.sql_s
myGroup1.sql
myGroup1.sql_s
myGroup2.sql
myGroup2.sql_s
-- reset directory for second set of snaps
\! rm -R /tmp/emaj_test/snaps2
\! mkdir /tmp/emaj_test/snaps2
-- in a single transaction and as superuser:
--   rollback groups, replay updates with generated scripts, snap groups again and cancel the transaction
reset role;
begin;
  select emaj.emaj_rollback_group('myGroup1','Multi-1');
 emaj_rollback_group 
---------------------
                   1
(1 row)

  select emaj.emaj_rollback_group('myGroup2','Multi-1');
 emaj_rollback_group 
---------------------
                   4
(1 row)

  select emaj.emaj_rollback_group('phil''s group#3",','M1_rollbackable');
WARNING:  _check_fk_groups: Foreign key mytbl2_col21_fkey, from table phil's schema3.myTbl2\, references phil's schema3.mytbl4 that is outside groups (phil's group#3",).
CONTEXT:  SQL statement "SELECT emaj._check_fk_groups(v_groupNames)"
PL/pgSQL function "_rlbk_groups_step1" line 74 at PERFORM
SQL statement "SELECT emaj._rlbk_groups_step1(v_groupNames, v_mark, v_unloggedRlbk, 1, v_multiGroup)"
PL/pgSQL function "_rlbk_groups" line 20 at SQL statement
PL/pgSQL function "emaj_rollback_group" line 8 at RETURN
WARNING:  _check_fk_groups: table phil's schema3.phil's tbl1 is referenced by foreign key mytbl4_col44_fkey from table phil's schema3.mytbl4 that is outside groups (phil's group#3",).
CONTEXT:  SQL statement "SELECT emaj._check_fk_groups(v_groupNames)"
PL/pgSQL function "_rlbk_groups_step1" line 74 at PERFORM
SQL statement "SELECT emaj._rlbk_groups_step1(v_groupNames, v_mark, v_unloggedRlbk, 1, v_multiGroup)"
PL/pgSQL function "_rlbk_groups" line 20 at SQL statement
PL/pgSQL function "emaj_rollback_group" line 8 at RETURN
 emaj_rollback_group 
---------------------
                   4
(1 row)

\i /tmp/emaj_test/sql_scripts/myGroup1.sql
-- file generated at [ts] by the emaj_generate_sql() function, for tables group myGroup1, processing logs between mark Multi-1 and the current situation
SET standard_conforming_strings = ON;
--BEGIN TRANSACTION;
ALTER SEQUENCE myschema1."myTbl3_col31_seq" RESTART 21 START 1 INCREMENT 1 MAXVALUE 9223372036854775807 MINVALUE 1 CACHE 1 NO CYCLE;
--COMMIT;
RESET standard_conforming_strings;
\i /tmp/emaj_test/sql_scripts/myGroup2.sql
-- file generated at [ts] by the emaj_generate_sql() function, for tables group myGroup2, processing logs between mark Multi-1 and the current situation
SET standard_conforming_strings = ON;
--BEGIN TRANSACTION;
INSERT INTO myschema2.mytbl5 VALUES (10, '{abc,def,ghi}', '{1,2,3}', NULL);
INSERT INTO myschema2.mytbl5 VALUES (20, '{abc,def,ghi}', '{3,4,5}', '{02-01-2000,02-28-2000}');
UPDATE ONLY myschema2.mytbl5 SET col51 = 10, col52 = '{abc,def,ghi}', col53 = '{1,2,3}', col54 = '{11-28-2010,12-03-2010}' WHERE col51 = 10;
INSERT INTO myschema2.mytbl6 VALUES (11, '(1,1.3)', '(2,2),(0,0)', '<(5,5),1>', '((-2,-2),(3,0),(1,4))', '10.20.30.40/27');
INSERT INTO myschema2.mytbl6 VALUES (12, '(2,1.3)', '(2,2),(0,0)', '<(5,5),2>', '((-2,-2),(3,0),(1,4))', '10.20.30.40/27');
INSERT INTO myschema2.mytbl6 VALUES (13, '(3,1.3)', '(2,2),(0,0)', '<(5,5),3>', '((-2,-2),(3,0),(1,4))', '10.20.30.40/27');
INSERT INTO myschema2.mytbl6 VALUES (14, '(4,1.3)', '(2,2),(0,0)', '<(5,5),4>', '((-2,-2),(3,0),(1,4))', '10.20.30.40/27');
INSERT INTO myschema2.mytbl6 VALUES (15, '(5,1.3)', '(2,2),(0,0)', '<(5,5),5>', '((-2,-2),(3,0),(1,4))', '10.20.30.40/27');
INSERT INTO myschema2.mytbl6 VALUES (16, '(6,1.3)', '(2,2),(0,0)', '<(5,5),6>', '((-2,-2),(3,0),(1,4))', '10.20.30.40/27');
INSERT INTO myschema2.mytbl6 VALUES (17, '(7,1.3)', '(2,2),(0,0)', '<(5,5),7>', '((-2,-2),(3,0),(1,4))', '10.20.30.40/27');
INSERT INTO myschema2.mytbl6 VALUES (18, '(8,1.3)', '(2,2),(0,0)', '<(5,5),8>', '((-2,-2),(3,0),(1,4))', '10.20.30.40/27');
UPDATE ONLY myschema2.mytbl6 SET col61 = 4, col62 = '(4,1.3)', col63 = '(2,2),(0,0)', col64 = '<(5,6),3.5>', col65 = NULL, col66 = '10.20.30.40/27' WHERE col61 = 4;
UPDATE ONLY myschema2.mytbl6 SET col61 = 5, col62 = '(5,1.3)', col63 = '(2,2),(0,0)', col64 = '<(5,6),3.5>', col65 = NULL, col66 = '10.20.30.40/27' WHERE col61 = 5;
UPDATE ONLY myschema2.mytbl6 SET col61 = 6, col62 = '(6,1.3)', col63 = '(2,2),(0,0)', col64 = '<(5,6),3.5>', col65 = NULL, col66 = '10.20.30.40/27' WHERE col61 = 6;
UPDATE ONLY myschema2.mytbl6 SET col61 = 7, col62 = '(7,1.3)', col63 = '(2,2),(0,0)', col64 = '<(5,6),3.5>', col65 = NULL, col66 = '10.20.30.40/27' WHERE col61 = 7;
UPDATE ONLY myschema2.mytbl6 SET col61 = 8, col62 = '(8,1.3)', col63 = '(2,2),(0,0)', col64 = '<(5,6),3.5>', col65 = NULL, col66 = '10.20.30.40/27' WHERE col61 = 8;
UPDATE ONLY myschema2.mytbl6 SET col61 = 11, col62 = '(1,1.3)', col63 = '(2,2),(0,0)', col64 = '<(5,6),3.5>', col65 = NULL, col66 = '10.20.30.40/27' WHERE col61 = 11;
UPDATE ONLY myschema2.mytbl6 SET col61 = 12, col62 = '(2,1.3)', col63 = '(2,2),(0,0)', col64 = '<(5,6),3.5>', col65 = NULL, col66 = '10.20.30.40/27' WHERE col61 = 12;
UPDATE ONLY myschema2.mytbl6 SET col61 = 13, col62 = '(3,1.3)', col63 = '(2,2),(0,0)', col64 = '<(5,6),3.5>', col65 = NULL, col66 = '10.20.30.40/27' WHERE col61 = 13;
ALTER SEQUENCE myschema2.myseq1 RESTART 1004 START 1000 INCREMENT 1 MAXVALUE 9223372036854775807 MINVALUE 1000 CACHE 1 NO CYCLE;
ALTER SEQUENCE myschema2."myTbl3_col31_seq" RESTART 21 START 1 INCREMENT 1 MAXVALUE 9223372036854775807 MINVALUE 1 CACHE 1 NO CYCLE;
--COMMIT;
RESET standard_conforming_strings;
\i /tmp/emaj_test/sql_scripts/Group3.sql
-- file generated at [ts] by the emaj_generate_sql() function, for tables group phil's group#3",, processing logs between mark M1_rollbackable and the current situation
SET standard_conforming_strings = ON;
--BEGIN TRANSACTION;
INSERT INTO "phil's schema3"."phil's tbl1" VALUES (1, 'AB''C', E'\\x0c');
INSERT INTO "phil's schema3"."phil's tbl1" VALUES (2, 'AB''C', E'\\x0c');
INSERT INTO "phil's schema3"."phil's tbl1" VALUES (3, 'AB''C', E'\\x0c');
INSERT INTO "phil's schema3"."phil's tbl1" VALUES (4, 'AB''C', E'\\x0c');
INSERT INTO "phil's schema3"."phil's tbl1" VALUES (5, 'AB''C', E'\\x0c');
INSERT INTO "phil's schema3"."phil's tbl1" VALUES (6, 'AB''C', E'\\x0c');
INSERT INTO "phil's schema3"."phil's tbl1" VALUES (7, 'AB''C', E'\\x0c');
INSERT INTO "phil's schema3"."phil's tbl1" VALUES (8, 'AB''C', E'\\x0c');
INSERT INTO "phil's schema3"."phil's tbl1" VALUES (9, 'AB''C', E'\\x0c');
INSERT INTO "phil's schema3"."phil's tbl1" VALUES (10, 'AB''C', E'\\x0c');
INSERT INTO "phil's schema3"."phil's tbl1" VALUES (11, 'AB''C', E'\\x0c');
INSERT INTO "phil's schema3"."phil's tbl1" VALUES (12, 'AB''C', E'\\x0c');
INSERT INTO "phil's schema3"."phil's tbl1" VALUES (13, 'AB''C', E'\\x0c');
INSERT INTO "phil's schema3"."phil's tbl1" VALUES (14, 'AB''C', E'\\x0c');
INSERT INTO "phil's schema3"."phil's tbl1" VALUES (15, 'AB''C', E'\\x0c');
INSERT INTO "phil's schema3"."phil's tbl1" VALUES (16, 'AB''C', E'\\x0c');
INSERT INTO "phil's schema3"."phil's tbl1" VALUES (17, 'AB''C', E'\\x0c');
INSERT INTO "phil's schema3"."phil's tbl1" VALUES (18, 'AB''C', E'\\x0c');
INSERT INTO "phil's schema3"."phil's tbl1" VALUES (19, 'AB''C', E'\\x0c');
INSERT INTO "phil's schema3"."phil's tbl1" VALUES (20, 'AB''C', E'\\x0c');
INSERT INTO "phil's schema3"."phil's tbl1" VALUES (21, 'AB''C', E'\\x0c');
INSERT INTO "phil's schema3"."phil's tbl1" VALUES (22, 'AB''C', E'\\x0c');
INSERT INTO "phil's schema3"."phil's tbl1" VALUES (23, 'AB''C', E'\\x0c');
INSERT INTO "phil's schema3"."phil's tbl1" VALUES (24, 'AB''C', E'\\x0c');
INSERT INTO "phil's schema3"."phil's tbl1" VALUES (25, 'AB''C', E'\\x0c');
INSERT INTO "phil's schema3"."phil's tbl1" VALUES (26, 'AB''C', E'\\x0c');
INSERT INTO "phil's schema3"."phil's tbl1" VALUES (27, 'AB''C', E'\\x0c');
INSERT INTO "phil's schema3"."phil's tbl1" VALUES (28, 'AB''C', E'\\x0c');
INSERT INTO "phil's schema3"."phil's tbl1" VALUES (29, 'AB''C', E'\\x0c');
INSERT INTO "phil's schema3"."phil's tbl1" VALUES (30, 'AB''C', E'\\x0c');
INSERT INTO "phil's schema3"."phil's tbl1" VALUES (31, 'AB''C', E'\\x0c');
UPDATE ONLY "phil's schema3"."phil's tbl1" SET "phil's col11" = 1, "phil's col12" = 'AB''C', "phil\s col13" = E'\\x1c' WHERE "phil's col11" = 1 AND "phil's col12" = 'AB''C';
UPDATE ONLY "phil's schema3"."phil's tbl1" SET "phil's col11" = 2, "phil's col12" = 'AB''C', "phil\s col13" = E'\\x1c' WHERE "phil's col11" = 2 AND "phil's col12" = 'AB''C';
UPDATE ONLY "phil's schema3"."phil's tbl1" SET "phil's col11" = 3, "phil's col12" = 'AB''C', "phil\s col13" = E'\\x1c' WHERE "phil's col11" = 3 AND "phil's col12" = 'AB''C';
UPDATE ONLY "phil's schema3"."phil's tbl1" SET "phil's col11" = 18, "phil's col12" = 'AB''C', "phil\s col13" = E'\\x1c27' WHERE "phil's col11" = 18 AND "phil's col12" = 'AB''C';
UPDATE ONLY "phil's schema3"."phil's tbl1" SET "phil's col11" = 19, "phil's col12" = 'AB''C', "phil\s col13" = E'\\x1c27' WHERE "phil's col11" = 19 AND "phil's col12" = 'AB''C';
UPDATE ONLY "phil's schema3"."phil's tbl1" SET "phil's col11" = 20, "phil's col12" = 'AB''C', "phil\s col13" = E'\\x1c27' WHERE "phil's col11" = 20 AND "phil's col12" = 'AB''C';
UPDATE ONLY "phil's schema3"."phil's tbl1" SET "phil's col11" = 21, "phil's col12" = 'AB''C', "phil\s col13" = E'\\x1c27' WHERE "phil's col11" = 21 AND "phil's col12" = 'AB''C';
UPDATE ONLY "phil's schema3"."phil's tbl1" SET "phil's col11" = 22, "phil's col12" = 'AB''C', "phil\s col13" = E'\\x1c27' WHERE "phil's col11" = 22 AND "phil's col12" = 'AB''C';
INSERT INTO "phil's schema3"."myTbl2\" VALUES (1, 'ABC', '12-31-2010');
DELETE FROM ONLY "phil's schema3"."phil's tbl1" WHERE "phil's col11" = 23 AND "phil's col12" = 'AB''C';
DELETE FROM ONLY "phil's schema3"."phil's tbl1" WHERE "phil's col11" = 24 AND "phil's col12" = 'AB''C';
DELETE FROM ONLY "phil's schema3"."phil's tbl1" WHERE "phil's col11" = 25 AND "phil's col12" = 'AB''C';
DELETE FROM ONLY "phil's schema3"."phil's tbl1" WHERE "phil's col11" = 26 AND "phil's col12" = 'AB''C';
DELETE FROM ONLY "phil's schema3"."phil's tbl1" WHERE "phil's col11" = 27 AND "phil's col12" = 'AB''C';
DELETE FROM ONLY "phil's schema3"."phil's tbl1" WHERE "phil's col11" = 28 AND "phil's col12" = 'AB''C';
DELETE FROM ONLY "phil's schema3"."phil's tbl1" WHERE "phil's col11" = 29 AND "phil's col12" = 'AB''C';
DELETE FROM ONLY "phil's schema3"."phil's tbl1" WHERE "phil's col11" = 30 AND "phil's col12" = 'AB''C';
DELETE FROM ONLY "phil's schema3"."phil's tbl1" WHERE "phil's col11" = 31 AND "phil's col12" = 'AB''C';
DELETE FROM ONLY "phil's schema3"."phil's tbl1" WHERE "phil's col11" = 21 AND "phil's col12" = 'AB''C';
DELETE FROM ONLY "phil's schema3"."phil's tbl1" WHERE "phil's col11" = 22 AND "phil's col12" = 'AB''C';
INSERT INTO "phil's schema3"."myTbl2\" VALUES (2, 'DEF', NULL);
DELETE FROM ONLY "phil's schema3"."phil's tbl1" WHERE "phil's col11" = 10 AND "phil's col12" = 'AB''C';
UPDATE ONLY "phil's schema3"."phil's tbl1" SET "phil's col11" = 1, "phil's col12" = 'DEF', "phil\s col13" = E'\\x1c' WHERE "phil's col11" = 1 AND "phil's col12" = 'AB''C';
UPDATE ONLY "phil's schema3"."phil's tbl1" SET "phil's col11" = 2, "phil's col12" = 'DEF', "phil\s col13" = E'\\x1c' WHERE "phil's col11" = 2 AND "phil's col12" = 'AB''C';
ALTER SEQUENCE "phil's schema3"."myTbl2\_col21_seq" RESTART 1 START 1 INCREMENT 1 MAXVALUE 9223372036854775807 MINVALUE 1 CACHE 1 NO CYCLE;
ALTER SEQUENCE "phil's schema3"."phil's seq\1" RESTART 1002 START 1000 INCREMENT 1 MAXVALUE 2000 MINVALUE 1000 CACHE 1 CYCLE;
--COMMIT;
RESET standard_conforming_strings;
  select emaj.emaj_snap_group('myGroup1','/tmp/emaj_test/snaps2','CSV HEADER');
 emaj_snap_group 
-----------------
               6
(1 row)

  select emaj.emaj_snap_group('myGroup2','/tmp/emaj_test/snaps2','CSV HEADER');
 emaj_snap_group 
-----------------
               8
(1 row)

  select emaj.emaj_snap_group('phil''s group#3",','/tmp/emaj_test/snaps2','CSV HEADER');
 emaj_snap_group 
-----------------
               4
(1 row)

rollback;
-- mask timestamp in _INFO files
\! sed -i_s -s 's/at .*/at [ts]/' /tmp/emaj_test/snaps/_INFO /tmp/emaj_test/snaps2/_INFO
-- and compare both snaps sets
-- sequences are detected as different because of :
-- - the effect of RESTART on is_called and next_val attributes
-- - internal log_cnt value being reset
\! diff --exclude _INFO_s /tmp/emaj_test/snaps /tmp/emaj_test/snaps2
diff --exclude _INFO_s /tmp/emaj_test/snaps/myschema1_myTbl3_col31_seq.snap /tmp/emaj_test/snaps2/myschema1_myTbl3_col31_seq.snap
2c2
< myTbl3_col31_seq,20,1,1,9223372036854775807,1,1,f,t
---
> myTbl3_col31_seq,21,1,1,9223372036854775807,1,1,f,f
diff --exclude _INFO_s /tmp/emaj_test/snaps/myschema2_myTbl3_col31_seq.snap /tmp/emaj_test/snaps2/myschema2_myTbl3_col31_seq.snap
2c2
< myTbl3_col31_seq,20,1,1,9223372036854775807,1,1,f,t
---
> myTbl3_col31_seq,21,1,1,9223372036854775807,1,1,f,f
diff --exclude _INFO_s /tmp/emaj_test/snaps/phil's schema3_phil's seq\1.snap /tmp/emaj_test/snaps2/phil's schema3_phil's seq\1.snap
2c2
< phil's seq\1,1001,1000,1,2000,1000,1,t,t
---
> phil's seq\1,1002,1000,1,2000,1000,1,t,f
set role emaj_regression_tests_adm_user;
-----------------------------
-- test end: check, reset history and force sequences id
-----------------------------
select hist_id, hist_function, hist_event, hist_object, regexp_replace(regexp_replace(hist_wording,E'\\d\\d\.\\d\\d\\.\\d\\d\\.\\d\\d\\d','%','g'),E'\\[.+\\]','(timestamp)','g'), hist_user from emaj.emaj_hist order by hist_id;
 hist_id |      hist_function       |   hist_event   |             hist_object              |                                        regexp_replace                                        | hist_user 
---------+--------------------------+----------------+--------------------------------------+----------------------------------------------------------------------------------------------+-----------
    6000 | STOP_GROUP               | BEGIN          | myGroup1                             |                                                                                              | postgres
    6001 | STOP_GROUP               | END            | myGroup1                             | 0 tables/sequences processed                                                                 | postgres
    6002 | RESET_GROUP              | BEGIN          | myGroup1                             |                                                                                              | postgres
    6003 | RESET_GROUP              | END            | myGroup1                             | 6 tables/sequences processed                                                                 | postgres
    6004 | DROP_GROUP               | BEGIN          | myGroup1                             |                                                                                              | postgres
    6005 | DROP_GROUP               | SCHEMA DROPPED | emajb                                |                                                                                              | postgres
    6006 | DROP_GROUP               | END            | myGroup1                             | 6 tables/sequences processed                                                                 | postgres
    6007 | FORCE_DROP_GROUP         | BEGIN          | myGroup2                             |                                                                                              | postgres
    6008 | FORCE_DROP_GROUP         | SCHEMA DROPPED | "emajC"                              |                                                                                              | postgres
    6009 | FORCE_DROP_GROUP         | END            | myGroup2                             | 8 tables/sequences processed                                                                 | postgres
    6010 | STOP_GROUP               | BEGIN          | phil's group#3",                     |                                                                                              | postgres
    6011 | LOCK_GROUP               | BEGIN          | phil's group#3",                     |                                                                                              | postgres
    6012 | LOCK_GROUP               | END            | phil's group#3",                     | 2 tables locked, 0 deadlock(s)                                                               | postgres
    6013 | SET_MARK_GROUP           | BEGIN          | phil's group#3",                     | Simple stop mark                                                                             | postgres
    6014 | SET_MARK_GROUP           | END            | phil's group#3",                     | Simple stop mark                                                                             | postgres
    6015 | STOP_GROUP               | END            | phil's group#3",                     | 4 tables/sequences processed                                                                 | postgres
    6016 | DROP_GROUP               | BEGIN          | phil's group#3",                     |                                                                                              | postgres
    6017 | DROP_GROUP               | SCHEMA DROPPED | "emaj #'3"                           |                                                                                              | postgres
    6018 | DROP_GROUP               | END            | phil's group#3",                     | 4 tables/sequences processed                                                                 | postgres
    6019 | CREATE_GROUP             | BEGIN          | myGroup1                             | rollbackable                                                                                 | postgres
    6020 | CREATE_GROUP             | SCHEMA CREATED | emajb                                |                                                                                              | postgres
    6021 | CREATE_GROUP             | SCHEMA CREATED | "emajC"                              |                                                                                              | postgres
    6022 | CREATE_GROUP             | END            | myGroup1                             | 6 tables/sequences processed                                                                 | postgres
    6023 | COMMENT_GROUP            |                | myGroup1                             |                                                                                              | postgres
    6024 | CREATE_GROUP             | BEGIN          | myGroup2                             | rollbackable                                                                                 | postgres
    6025 | CREATE_GROUP             | END            | myGroup2                             | 8 tables/sequences processed                                                                 | postgres
    6026 | START_GROUP              | BEGIN          | myGroup1                             | With log reset                                                                               | postgres
    6027 | LOCK_GROUP               | BEGIN          | myGroup1                             |                                                                                              | postgres
    6028 | LOCK_GROUP               | END            | myGroup1                             | 5 tables locked, 0 deadlock(s)                                                               | postgres
    6029 | SET_MARK_GROUP           | BEGIN          | myGroup1                             | M1                                                                                           | postgres
    6030 | SET_MARK_GROUP           | END            | myGroup1                             | M1                                                                                           | postgres
    6031 | START_GROUP              | END            | myGroup1                             | 6 tables/sequences processed                                                                 | postgres
    6032 | START_GROUP              | BEGIN          | myGroup2                             | With log reset                                                                               | postgres
    6033 | LOCK_GROUP               | BEGIN          | myGroup2                             |                                                                                              | postgres
    6034 | LOCK_GROUP               | END            | myGroup2                             | 6 tables locked, 0 deadlock(s)                                                               | postgres
    6035 | SET_MARK_GROUP           | BEGIN          | myGroup2                             | M1                                                                                           | postgres
    6036 | SET_MARK_GROUP           | END            | myGroup2                             | M1                                                                                           | postgres
    6037 | START_GROUP              | END            | myGroup2                             | 8 tables/sequences processed                                                                 | postgres
    6038 | SET_MARK_GROUP           | BEGIN          | myGroup1                             |                                                                                              | postgres
    6039 | LOCK_GROUP               | BEGIN          | myGroup1                             |                                                                                              | postgres
    6040 | LOCK_GROUP               | END            | myGroup1                             | 5 tables locked, 0 deadlock(s)                                                               | postgres
    6041 | SET_MARK_GROUP           | END            | myGroup1                             | M2                                                                                           | postgres
    6042 | SET_MARK_GROUP           | BEGIN          | myGroup1                             |                                                                                              | postgres
    6043 | LOCK_GROUP               | BEGIN          | myGroup1                             |                                                                                              | postgres
    6044 | LOCK_GROUP               | END            | myGroup1                             | 5 tables locked, 0 deadlock(s)                                                               | postgres
    6045 | SET_MARK_GROUP           | END            | myGroup1                             | M3                                                                                           | postgres
    6046 | COMMENT_MARK_GROUP       |                | myGroup1                             | Mark M3                                                                                      | postgres
    6047 | SET_MARK_GROUP           | BEGIN          | myGroup2                             |                                                                                              | postgres
    6048 | LOCK_GROUP               | BEGIN          | myGroup2                             |                                                                                              | postgres
    6049 | LOCK_GROUP               | END            | myGroup2                             | 6 tables locked, 0 deadlock(s)                                                               | postgres
    6050 | SET_MARK_GROUP           | END            | myGroup2                             | M2                                                                                           | postgres
    6051 | SET_MARK_GROUP           | BEGIN          | myGroup2                             |                                                                                              | postgres
    6052 | LOCK_GROUP               | BEGIN          | myGroup2                             |                                                                                              | postgres
    6053 | LOCK_GROUP               | END            | myGroup2                             | 6 tables locked, 0 deadlock(s)                                                               | postgres
    6054 | SET_MARK_GROUP           | END            | myGroup2                             | M3                                                                                           | postgres
    6055 | ROLLBACK_GROUP           | BEGIN          | myGroup2                             | Logged rollback to mark M2 (timestamp)                                                       | postgres
    6056 | LOCK_SESSION             | BEGIN          | myGroup2                             | Session #1                                                                                   | postgres
    6057 | LOCK_SESSION             | END            | myGroup2                             | Session #1 : 6 tables locked, 0 deadlock(s)                                                  | postgres
    6058 | SET_MARK_GROUP           | BEGIN          | myGroup2                             | RLBK_M2_%_START                                                                              | postgres
    6059 | SET_MARK_GROUP           | END            | myGroup2                             | RLBK_M2_%_START                                                                              | postgres
    6060 | ROLLBACK_TABLE           | BEGIN          | myschema2.mytbl4                     | All log rows with emaj_gid > 11912                                                           | postgres
    6061 | ROLLBACK_TABLE           | END            | myschema2.mytbl4                     | 4 rollbacked rows                                                                            | postgres
    6062 | ROLLBACK_TABLE           | BEGIN          | myschema2.mytbl5                     | All log rows with emaj_gid > 11912                                                           | postgres
    6063 | ROLLBACK_TABLE           | END            | myschema2.mytbl5                     | 1 rollbacked rows                                                                            | postgres
    6064 | ROLLBACK_TABLE           | BEGIN          | myschema2.mytbl6                     | All log rows with emaj_gid > 11912                                                           | postgres
    6065 | ROLLBACK_TABLE           | END            | myschema2.mytbl6                     | 3 rollbacked rows                                                                            | postgres
    6066 | ROLLBACK_SEQUENCE        |                | myschema2.myseq1                     | RESTART 1001 MAXVALUE 2000 CYCLE                                                             | postgres
    6067 | ROLLBACK_SEQUENCE        |                | myschema2."myTbl3_col31_seq"         |                                                                                              | postgres
    6068 | SET_MARK_GROUP           | BEGIN          | myGroup2                             | RLBK_M2_%_DONE                                                                               | postgres
    6069 | SET_MARK_GROUP           | END            | myGroup2                             | RLBK_M2_%_DONE                                                                               | postgres
    6070 | ROLLBACK_GROUP           | END            | myGroup2                             | 3 tables and 2 sequences effectively processed                                               | postgres
    6071 | ROLLBACK_GROUP           | BEGIN          | myGroup2                             | Logged rollback to mark M3 (timestamp)                                                       | postgres
    6072 | LOCK_SESSION             | BEGIN          | myGroup2                             | Session #1                                                                                   | postgres
    6073 | LOCK_SESSION             | END            | myGroup2                             | Session #1 : 6 tables locked, 0 deadlock(s)                                                  | postgres
    6074 | SET_MARK_GROUP           | BEGIN          | myGroup2                             | RLBK_M3_%_START                                                                              | postgres
    6075 | SET_MARK_GROUP           | END            | myGroup2                             | RLBK_M3_%_START                                                                              | postgres
    6076 | ROLLBACK_TABLE           | BEGIN          | myschema2.mytbl4                     | All log rows with emaj_gid > 11920                                                           | postgres
    6077 | ROLLBACK_TABLE           | END            | myschema2.mytbl4                     | 4 rollbacked rows                                                                            | postgres
    6078 | ROLLBACK_TABLE           | BEGIN          | myschema2.mytbl5                     | All log rows with emaj_gid > 11920                                                           | postgres
    6079 | ROLLBACK_TABLE           | END            | myschema2.mytbl5                     | 1 rollbacked rows                                                                            | postgres
    6080 | ROLLBACK_TABLE           | BEGIN          | myschema2.mytbl6                     | All log rows with emaj_gid > 11920                                                           | postgres
    6081 | ROLLBACK_TABLE           | END            | myschema2.mytbl6                     | 3 rollbacked rows                                                                            | postgres
    6082 | ROLLBACK_SEQUENCE        |                | myschema2.myseq1                     | RESTART 1004 MAXVALUE 9223372036854775807 NO  CYCLE                                          | postgres
    6083 | ROLLBACK_SEQUENCE        |                | myschema2."myTbl3_col31_seq"         |                                                                                              | postgres
    6084 | SET_MARK_GROUP           | BEGIN          | myGroup2                             | RLBK_M3_%_DONE                                                                               | postgres
    6085 | SET_MARK_GROUP           | END            | myGroup2                             | RLBK_M3_%_DONE                                                                               | postgres
    6086 | ROLLBACK_GROUP           | END            | myGroup2                             | 3 tables and 2 sequences effectively processed                                               | postgres
    6087 | ROLLBACK_GROUP           | BEGIN          | myGroup1                             | Unlogged rollback to mark M2 (timestamp)                                                     | postgres
    6088 | LOCK_SESSION             | BEGIN          | myGroup1                             | Session #1                                                                                   | postgres
    6089 | LOCK_SESSION             | END            | myGroup1                             | Session #1 : 5 tables locked, 0 deadlock(s)                                                  | postgres
    6090 | ROLLBACK_TABLE           | BEGIN          | myschema1.mytbl1                     | All log rows with emaj_gid > 11860                                                           | postgres
    6091 | ROLLBACK_TABLE           | END            | myschema1.mytbl1                     | 3 rollbacked rows                                                                            | postgres
    6092 | ROLLBACK_TABLE           | BEGIN          | myschema1.mytbl4                     | All log rows with emaj_gid > 11860                                                           | postgres
    6093 | ROLLBACK_TABLE           | END            | myschema1.mytbl4                     | 8 rollbacked rows                                                                            | postgres
    6094 | ROLLBACK_GROUP           | MARK DELETED   | myGroup1                             | mark M3 has been deleted                                                                     | postgres
    6095 | ROLLBACK_SEQUENCE        |                | myschema1."myTbl3_col31_seq"         |                                                                                              | postgres
    6096 | ROLLBACK_GROUP           | END            | myGroup1                             | 2 tables and 1 sequences effectively processed                                               | postgres
    6097 | SET_MARK_GROUP           | BEGIN          | myGroup1                             |                                                                                              | postgres
    6098 | LOCK_GROUP               | BEGIN          | myGroup1                             |                                                                                              | postgres
    6099 | LOCK_GROUP               | END            | myGroup1                             | 5 tables locked, 0 deadlock(s)                                                               | postgres
    6100 | SET_MARK_GROUP           | END            | myGroup1                             | M4                                                                                           | postgres
    6101 | SET_MARK_GROUP           | BEGIN          | myGroup1                             |                                                                                              | postgres
    6102 | LOCK_GROUP               | BEGIN          | myGroup1                             |                                                                                              | postgres
    6103 | LOCK_GROUP               | END            | myGroup1                             | 5 tables locked, 0 deadlock(s)                                                               | postgres
    6104 | SET_MARK_GROUP           | END            | myGroup1                             | M5                                                                                           | postgres
    6105 | SET_MARK_GROUP           | BEGIN          | myGroup1                             |                                                                                              | postgres
    6106 | LOCK_GROUP               | BEGIN          | myGroup1                             |                                                                                              | postgres
    6107 | LOCK_GROUP               | END            | myGroup1                             | 5 tables locked, 0 deadlock(s)                                                               | postgres
    6108 | SET_MARK_GROUP           | END            | myGroup1                             | M6                                                                                           | postgres
    6109 | ROLLBACK_GROUP           | BEGIN          | myGroup2                             | Logged rollback to mark M2 (timestamp)                                                       | postgres
    6110 | LOCK_SESSION             | BEGIN          | myGroup2                             | Session #1                                                                                   | postgres
    6111 | LOCK_SESSION             | END            | myGroup2                             | Session #1 : 6 tables locked, 0 deadlock(s)                                                  | postgres
    6112 | SET_MARK_GROUP           | BEGIN          | myGroup2                             | RLBK_M2_%_START                                                                              | postgres
    6113 | SET_MARK_GROUP           | END            | myGroup2                             | RLBK_M2_%_START                                                                              | postgres
    6114 | ROLLBACK_TABLE           | BEGIN          | myschema2.mytbl4                     | All log rows with emaj_gid > 11912                                                           | postgres
    6115 | ROLLBACK_TABLE           | END            | myschema2.mytbl4                     | 12 rollbacked rows                                                                           | postgres
    6116 | ROLLBACK_TABLE           | BEGIN          | myschema2.mytbl5                     | All log rows with emaj_gid > 11912                                                           | postgres
    6117 | ROLLBACK_TABLE           | END            | myschema2.mytbl5                     | 3 rollbacked rows                                                                            | postgres
    6118 | ROLLBACK_TABLE           | BEGIN          | myschema2.mytbl6                     | All log rows with emaj_gid > 11912                                                           | postgres
    6119 | ROLLBACK_TABLE           | END            | myschema2.mytbl6                     | 9 rollbacked rows                                                                            | postgres
    6120 | ROLLBACK_SEQUENCE        |                | myschema2.myseq1                     | RESTART 1001 MAXVALUE 2000 CYCLE                                                             | postgres
    6121 | ROLLBACK_SEQUENCE        |                | myschema2."myTbl3_col31_seq"         |                                                                                              | postgres
    6122 | SET_MARK_GROUP           | BEGIN          | myGroup2                             | RLBK_M2_%_DONE                                                                               | postgres
    6123 | SET_MARK_GROUP           | END            | myGroup2                             | RLBK_M2_%_DONE                                                                               | postgres
    6124 | ROLLBACK_GROUP           | END            | myGroup2                             | 3 tables and 2 sequences effectively processed                                               | postgres
    6125 | ROLLBACK_GROUP           | BEGIN          | myGroup2                             | Unlogged rollback to mark M3 (timestamp)                                                     | postgres
    6126 | LOCK_SESSION             | BEGIN          | myGroup2                             | Session #1                                                                                   | postgres
    6127 | LOCK_SESSION             | END            | myGroup2                             | Session #1 : 6 tables locked, 0 deadlock(s)                                                  | postgres
    6128 | ROLLBACK_TABLE           | BEGIN          | myschema2.mytbl4                     | All log rows with emaj_gid > 11920                                                           | postgres
    6129 | ROLLBACK_TABLE           | END            | myschema2.mytbl4                     | 20 rollbacked rows                                                                           | postgres
    6130 | ROLLBACK_TABLE           | BEGIN          | myschema2.mytbl5                     | All log rows with emaj_gid > 11920                                                           | postgres
    6131 | ROLLBACK_TABLE           | END            | myschema2.mytbl5                     | 5 rollbacked rows                                                                            | postgres
    6132 | ROLLBACK_TABLE           | BEGIN          | myschema2.mytbl6                     | All log rows with emaj_gid > 11920                                                           | postgres
    6133 | ROLLBACK_TABLE           | END            | myschema2.mytbl6                     | 15 rollbacked rows                                                                           | postgres
    6134 | ROLLBACK_GROUP           | MARK DELETED   | myGroup2                             | mark RLBK_M2_%_START has been deleted                                                        | postgres
    6135 | ROLLBACK_GROUP           | MARK DELETED   | myGroup2                             | mark RLBK_M2_%_DONE has been deleted                                                         | postgres
    6136 | ROLLBACK_GROUP           | MARK DELETED   | myGroup2                             | mark RLBK_M3_%_START has been deleted                                                        | postgres
    6137 | ROLLBACK_GROUP           | MARK DELETED   | myGroup2                             | mark RLBK_M3_%_DONE has been deleted                                                         | postgres
    6138 | ROLLBACK_GROUP           | MARK DELETED   | myGroup2                             | mark RLBK_M2_%_START has been deleted                                                        | postgres
    6139 | ROLLBACK_GROUP           | MARK DELETED   | myGroup2                             | mark RLBK_M2_%_DONE has been deleted                                                         | postgres
    6140 | ROLLBACK_SEQUENCE        |                | myschema2.myseq1                     | RESTART 1004 MAXVALUE 9223372036854775807 NO  CYCLE                                          | postgres
    6141 | ROLLBACK_SEQUENCE        |                | myschema2."myTbl3_col31_seq"         |                                                                                              | postgres
    6142 | ROLLBACK_GROUP           | END            | myGroup2                             | 3 tables and 2 sequences effectively processed                                               | postgres
    6143 | ROLLBACK_GROUP           | BEGIN          | myGroup1                             | Unlogged rollback to mark M5 (timestamp)                                                     | postgres
    6144 | LOCK_SESSION             | BEGIN          | myGroup1                             | Session #1                                                                                   | postgres
    6145 | LOCK_SESSION             | END            | myGroup1                             | Session #1 : 5 tables locked, 0 deadlock(s)                                                  | postgres
    6146 | ROLLBACK_TABLE           | BEGIN          | myschema1.mytbl1                     | All log rows with emaj_gid > 11959                                                           | postgres
    6147 | ROLLBACK_TABLE           | END            | myschema1.mytbl1                     | 1 rollbacked rows                                                                            | postgres
    6148 | ROLLBACK_TABLE           | BEGIN          | myschema1.mytbl4                     | All log rows with emaj_gid > 11959                                                           | postgres
    6149 | ROLLBACK_TABLE           | END            | myschema1.mytbl4                     | 2 rollbacked rows                                                                            | postgres
    6150 | ROLLBACK_GROUP           | MARK DELETED   | myGroup1                             | mark M6 has been deleted                                                                     | postgres
    6151 | ROLLBACK_SEQUENCE        |                | myschema1."myTbl3_col31_seq"         |                                                                                              | postgres
    6152 | ROLLBACK_GROUP           | END            | myGroup1                             | 2 tables and 1 sequences effectively processed                                               | postgres
    6153 | ROLLBACK_GROUP           | BEGIN          | myGroup1                             | Logged rollback to mark M4 (timestamp)                                                       | postgres
    6154 | LOCK_SESSION             | BEGIN          | myGroup1                             | Session #1                                                                                   | postgres
    6155 | LOCK_SESSION             | END            | myGroup1                             | Session #1 : 5 tables locked, 0 deadlock(s)                                                  | postgres
    6156 | SET_MARK_GROUP           | BEGIN          | myGroup1                             | RLBK_M4_%_START                                                                              | postgres
    6157 | SET_MARK_GROUP           | END            | myGroup1                             | RLBK_M4_%_START                                                                              | postgres
    6158 | ROLLBACK_TABLE           | BEGIN          | myschema1."myTbl3"                   | All log rows with emaj_gid > 11949                                                           | postgres
    6159 | ROLLBACK_TABLE           | END            | myschema1."myTbl3"                   | 10 rollbacked rows                                                                           | postgres
    6160 | ROLLBACK_TABLE           | BEGIN          | myschema1.mytbl1                     | All log rows with emaj_gid > 11949                                                           | postgres
    6161 | ROLLBACK_TABLE           | END            | myschema1.mytbl1                     | 1 rollbacked rows                                                                            | postgres
    6162 | ROLLBACK_TABLE           | BEGIN          | myschema1.mytbl4                     | All log rows with emaj_gid > 11949                                                           | postgres
    6163 | ROLLBACK_TABLE           | END            | myschema1.mytbl4                     | 2 rollbacked rows                                                                            | postgres
    6164 | ROLLBACK_SEQUENCE        |                | myschema1."myTbl3_col31_seq"         |                                                                                              | postgres
    6165 | SET_MARK_GROUP           | BEGIN          | myGroup1                             | RLBK_M4_%_DONE                                                                               | postgres
    6166 | SET_MARK_GROUP           | END            | myGroup1                             | RLBK_M4_%_DONE                                                                               | postgres
    6167 | ROLLBACK_GROUP           | END            | myGroup1                             | 3 tables and 1 sequences effectively processed                                               | postgres
    6168 | RENAME_MARK_GROUP        | BEGIN          | myGroup1                             | RLBK_M4_%_START                                                                              | postgres
    6169 | RENAME_MARK_GROUP        | END            | myGroup1                             | RLBK_M4_%_START renamed Before logged rollback to M4                                         | postgres
    6170 | DELETE_MARK_GROUP        | BEGIN          | myGroup1                             | RLBK_M4_%_DONE                                                                               | postgres
    6171 | DELETE_MARK_GROUP        | END            | myGroup1                             | RLBK_M4_%_DONE                                                                               | postgres
    6172 | DELETE_MARK_GROUP        | BEGIN          | myGroup1                             | M1                                                                                           | postgres
    6173 | DELETE_MARK_GROUP        | END            | myGroup1                             | M1                                                                                           | postgres
    6174 | DELETE_BEFORE_MARK_GROUP | BEGIN          | myGroup1                             | M4                                                                                           | postgres
    6175 | DELETE_BEFORE_MARK_GROUP | END            | myGroup1                             | 1 marks deleted ; M4 is now the initial mark                                                 | postgres
    6179 | STOP_GROUPS              | BEGIN          | myGroup1,myGroup2                    |                                                                                              | postgres
    6180 | LOCK_GROUPS              | BEGIN          | myGroup1,myGroup2                    |                                                                                              | postgres
    6181 | LOCK_GROUPS              | END            | myGroup1,myGroup2                    | 11 tables locked, 0 deadlock(s)                                                              | postgres
    6182 | SET_MARK_GROUPS          | BEGIN          | myGroup1,myGroup2                    | STOP_%                                                                                       | postgres
    6183 | SET_MARK_GROUPS          | END            | myGroup1,myGroup2                    | STOP_%                                                                                       | postgres
    6184 | STOP_GROUPS              | END            | myGroup1,myGroup2                    | 14 tables/sequences processed                                                                | postgres
    6185 | START_GROUPS             | BEGIN          | myGroup1,myGroup2                    | Without log reset                                                                            | postgres
    6186 | LOCK_GROUPS              | BEGIN          | myGroup1,myGroup2                    |                                                                                              | postgres
    6187 | LOCK_GROUPS              | END            | myGroup1,myGroup2                    | 11 tables locked, 0 deadlock(s)                                                              | postgres
    6188 | SET_MARK_GROUPS          | BEGIN          | myGroup1,myGroup2                    | Multi-1                                                                                      | postgres
    6189 | SET_MARK_GROUPS          | END            | myGroup1,myGroup2                    | Multi-1                                                                                      | postgres
    6190 | START_GROUPS             | END            | myGroup1,myGroup2                    | 14 tables/sequences processed                                                                | postgres
    6191 | SET_MARK_GROUPS          | BEGIN          | myGroup1,myGroup2                    | Multi-2                                                                                      | postgres
    6192 | LOCK_GROUPS              | BEGIN          | myGroup1,myGroup2                    |                                                                                              | postgres
    6193 | LOCK_GROUPS              | END            | myGroup1,myGroup2                    | 11 tables locked, 0 deadlock(s)                                                              | postgres
    6194 | SET_MARK_GROUPS          | END            | myGroup1,myGroup2                    | Multi-2                                                                                      | postgres
    6195 | ROLLBACK_GROUPS          | BEGIN          | myGroup1,myGroup2                    | Logged rollback to mark Multi-1 (timestamp)                                                  | postgres
    6196 | LOCK_SESSIONS            | BEGIN          | myGroup1,myGroup2                    | Session #1                                                                                   | postgres
    6197 | LOCK_SESSIONS            | END            | myGroup1,myGroup2                    | Session #1 : 11 tables locked, 0 deadlock(s)                                                 | postgres
    6198 | SET_MARK_GROUPS          | BEGIN          | myGroup1,myGroup2                    | RLBK_Multi-1_%_START                                                                         | postgres
    6199 | SET_MARK_GROUPS          | END            | myGroup1,myGroup2                    | RLBK_Multi-1_%_START                                                                         | postgres
    6200 | ROLLBACK_SEQUENCE        |                | myschema1."myTbl3_col31_seq"         |                                                                                              | postgres
    6201 | ROLLBACK_SEQUENCE        |                | myschema2.myseq1                     |                                                                                              | postgres
    6202 | ROLLBACK_SEQUENCE        |                | myschema2."myTbl3_col31_seq"         |                                                                                              | postgres
    6203 | SET_MARK_GROUPS          | BEGIN          | myGroup1,myGroup2                    | RLBK_Multi-1_%_DONE                                                                          | postgres
    6204 | SET_MARK_GROUPS          | END            | myGroup1,myGroup2                    | RLBK_Multi-1_%_DONE                                                                          | postgres
    6205 | ROLLBACK_GROUPS          | END            | myGroup1,myGroup2                    | 0 tables and 3 sequences effectively processed                                               | postgres
    6206 | ROLLBACK_GROUPS          | BEGIN          | myGroup1,myGroup2                    | Unlogged rollback to mark Multi-2 (timestamp)                                                | postgres
    6207 | LOCK_SESSIONS            | BEGIN          | myGroup1,myGroup2                    | Session #1                                                                                   | postgres
    6208 | LOCK_SESSIONS            | END            | myGroup1,myGroup2                    | Session #1 : 11 tables locked, 0 deadlock(s)                                                 | postgres
    6209 | ROLLBACK_GROUPS          | MARK DELETED   | myGroup1                             | mark RLBK_Multi-1_%_START has been deleted                                                   | postgres
    6210 | ROLLBACK_GROUPS          | MARK DELETED   | myGroup2                             | mark RLBK_Multi-1_%_START has been deleted                                                   | postgres
    6211 | ROLLBACK_GROUPS          | MARK DELETED   | myGroup1                             | mark RLBK_Multi-1_%_DONE has been deleted                                                    | postgres
    6212 | ROLLBACK_GROUPS          | MARK DELETED   | myGroup2                             | mark RLBK_Multi-1_%_DONE has been deleted                                                    | postgres
    6213 | ROLLBACK_SEQUENCE        |                | myschema1."myTbl3_col31_seq"         |                                                                                              | postgres
    6214 | ROLLBACK_SEQUENCE        |                | myschema2.myseq1                     |                                                                                              | postgres
    6215 | ROLLBACK_SEQUENCE        |                | myschema2."myTbl3_col31_seq"         |                                                                                              | postgres
    6216 | ROLLBACK_GROUPS          | END            | myGroup1,myGroup2                    | 0 tables and 3 sequences effectively processed                                               | postgres
    6217 | ROLLBACK_GROUPS          | BEGIN          | myGroup1,myGroup2                    | Unlogged rollback to mark Multi-1 (timestamp)                                                | postgres
    6218 | LOCK_SESSIONS            | BEGIN          | myGroup1,myGroup2                    | Session #1                                                                                   | postgres
    6219 | LOCK_SESSIONS            | END            | myGroup1,myGroup2                    | Session #1 : 11 tables locked, 0 deadlock(s)                                                 | postgres
    6220 | ROLLBACK_GROUPS          | MARK DELETED   | myGroup1                             | mark Multi-2 has been deleted                                                                | postgres
    6221 | ROLLBACK_GROUPS          | MARK DELETED   | myGroup2                             | mark Multi-2 has been deleted                                                                | postgres
    6222 | ROLLBACK_SEQUENCE        |                | myschema1."myTbl3_col31_seq"         |                                                                                              | postgres
    6223 | ROLLBACK_SEQUENCE        |                | myschema2.myseq1                     |                                                                                              | postgres
    6224 | ROLLBACK_SEQUENCE        |                | myschema2."myTbl3_col31_seq"         |                                                                                              | postgres
    6225 | ROLLBACK_GROUPS          | END            | myGroup1,myGroup2                    | 0 tables and 3 sequences effectively processed                                               | postgres
    6226 | STOP_GROUPS              | BEGIN          | myGroup1,myGroup2                    |                                                                                              | postgres
    6227 | LOCK_GROUPS              | BEGIN          | myGroup1,myGroup2                    |                                                                                              | postgres
    6228 | LOCK_GROUPS              | END            | myGroup1,myGroup2                    | 11 tables locked, 0 deadlock(s)                                                              | postgres
    6229 | SET_MARK_GROUPS          | BEGIN          | myGroup1,myGroup2                    | Stop after rollback                                                                          | postgres
    6230 | SET_MARK_GROUPS          | END            | myGroup1,myGroup2                    | Stop after rollback                                                                          | postgres
    6231 | STOP_GROUPS              | END            | myGroup1,myGroup2                    | 14 tables/sequences processed                                                                | postgres
    6233 | START_GROUPS             | BEGIN          | myGroup1,myGroup2                    | Without log reset                                                                            | postgres
    6234 | LOCK_GROUPS              | BEGIN          | myGroup1,myGroup2                    |                                                                                              | postgres
    6235 | LOCK_GROUPS              | END            | myGroup1,myGroup2                    | 11 tables locked, 0 deadlock(s)                                                              | postgres
    6236 | SET_MARK_GROUPS          | BEGIN          | myGroup1,myGroup2                    | Multi-1b                                                                                     | postgres
    6237 | SET_MARK_GROUPS          | END            | myGroup1,myGroup2                    | Multi-1b                                                                                     | postgres
    6238 | START_GROUPS             | END            | myGroup1,myGroup2                    | 14 tables/sequences processed                                                                | postgres
    6239 | SET_MARK_GROUPS          | BEGIN          | myGroup1,myGroup2                    | Multi-2                                                                                      | postgres
    6240 | LOCK_GROUPS              | BEGIN          | myGroup1,myGroup2                    |                                                                                              | postgres
    6241 | LOCK_GROUPS              | END            | myGroup1,myGroup2                    | 11 tables locked, 0 deadlock(s)                                                              | postgres
    6242 | SET_MARK_GROUPS          | END            | myGroup1,myGroup2                    | Multi-2                                                                                      | postgres
    6243 | DELETE_MARK_GROUP        | BEGIN          | myGroup1                             | Multi-2                                                                                      | postgres
    6244 | DELETE_MARK_GROUP        | END            | myGroup1                             | Multi-2                                                                                      | postgres
    6245 | ROLLBACK_GROUP           | BEGIN          | myGroup2                             | Unlogged rollback to mark Multi-2 (timestamp)                                                | postgres
    6246 | LOCK_SESSION             | BEGIN          | myGroup2                             | Session #1                                                                                   | postgres
    6247 | LOCK_SESSION             | END            | myGroup2                             | Session #1 : 6 tables locked, 0 deadlock(s)                                                  | postgres
    6248 | ROLLBACK_SEQUENCE        |                | myschema2.myseq1                     |                                                                                              | postgres
    6249 | ROLLBACK_SEQUENCE        |                | myschema2."myTbl3_col31_seq"         |                                                                                              | postgres
    6250 | ROLLBACK_GROUP           | END            | myGroup2                             | 0 tables and 2 sequences effectively processed                                               | postgres
    6251 | DELETE_MARK_GROUP        | BEGIN          | myGroup2                             | Multi-2                                                                                      | postgres
    6252 | DELETE_MARK_GROUP        | END            | myGroup2                             | Multi-2                                                                                      | postgres
    6253 | DELETE_MARK_GROUP        | BEGIN          | myGroup1                             | Multi-1                                                                                      | postgres
    6254 | DELETE_MARK_GROUP        | END            | myGroup1                             | Multi-1                                                                                      | postgres
    6255 | DELETE_MARK_GROUP        | BEGIN          | myGroup2                             | Multi-1                                                                                      | postgres
    6256 | DELETE_MARK_GROUP        | END            | myGroup2                             | Multi-1                                                                                      | postgres
    6257 | RENAME_MARK_GROUP        | BEGIN          | myGroup1                             | Multi-1b                                                                                     | postgres
    6258 | RENAME_MARK_GROUP        | END            | myGroup1                             | Multi-1b renamed Multi-1                                                                     | postgres
    6259 | RENAME_MARK_GROUP        | BEGIN          | myGroup2                             | Multi-1b                                                                                     | postgres
    6260 | RENAME_MARK_GROUP        | END            | myGroup2                             | Multi-1b renamed Multi-1                                                                     | postgres
    6261 | RENAME_MARK_GROUP        | BEGIN          | myGroup2                             | M2                                                                                           | postgres
    6262 | RENAME_MARK_GROUP        | END            | myGroup2                             | M2 renamed Deleted M2                                                                        | postgres
    6263 | DELETE_BEFORE_MARK_GROUP | BEGIN          | myGroup2                             | M3                                                                                           | postgres
    6264 | DELETE_BEFORE_MARK_GROUP | END            | myGroup2                             | 2 marks deleted ; M3 is now the initial mark                                                 | postgres
    6265 | COMMENT_MARK_GROUP       |                | myGroup2                             | Mark M3                                                                                      | postgres
    6266 | CREATE_GROUP             | BEGIN          | phil's group#3",                     | audit_only                                                                                   | postgres
    6267 | CREATE_GROUP             | SCHEMA CREATED | "emaj #'3"                           |                                                                                              | postgres
    6268 | CREATE_GROUP             | END            | phil's group#3",                     | 4 tables/sequences processed                                                                 | postgres
    6269 | ALTER_GROUP              | BEGIN          | phil's group#3",                     |                                                                                              | postgres
    6270 | ALTER_GROUP              | SCHEMA DROPPED | "emaj #'3"                           |                                                                                              | postgres
    6271 | ALTER_GROUP              | SCHEMA CREATED | "emaj #'3"                           |                                                                                              | postgres
    6272 | ALTER_GROUP              | END            | phil's group#3",                     | 2 tables/sequences effectively processed                                                     | postgres
    6273 | START_GROUP              | BEGIN          | phil's group#3",                     | With log reset                                                                               | postgres
    6274 | LOCK_GROUP               | BEGIN          | phil's group#3",                     |                                                                                              | postgres
    6275 | LOCK_GROUP               | END            | phil's group#3",                     | 2 tables locked, 0 deadlock(s)                                                               | postgres
    6276 | SET_MARK_GROUP           | BEGIN          | phil's group#3",                     | M1_after_alter_group                                                                         | postgres
    6277 | SET_MARK_GROUP           | END            | phil's group#3",                     | M1_after_alter_group                                                                         | postgres
    6278 | START_GROUP              | END            | phil's group#3",                     | 4 tables/sequences processed                                                                 | postgres
    6279 | STOP_GROUP               | BEGIN          | phil's group#3",                     |                                                                                              | postgres
    6280 | LOCK_GROUP               | BEGIN          | phil's group#3",                     |                                                                                              | postgres
    6281 | LOCK_GROUP               | END            | phil's group#3",                     | 2 tables locked, 0 deadlock(s)                                                               | postgres
    6282 | SET_MARK_GROUP           | BEGIN          | phil's group#3",                     | STOP_%                                                                                       | postgres
    6283 | SET_MARK_GROUP           | END            | phil's group#3",                     | STOP_%                                                                                       | postgres
    6284 | STOP_GROUP               | END            | phil's group#3",                     | 4 tables/sequences processed                                                                 | postgres
    6285 | ALTER_GROUP              | BEGIN          | phil's group#3",                     |                                                                                              | postgres
    6286 | ALTER_GROUP              | SCHEMA DROPPED | "emaj #'3"                           |                                                                                              | postgres
    6287 | ALTER_GROUP              | SCHEMA CREATED | "emaj #'3"                           |                                                                                              | postgres
    6288 | ALTER_GROUP              | END            | phil's group#3",                     | 2 tables/sequences effectively processed                                                     | postgres
    6289 | DROP_GROUP               | BEGIN          | phil's group#3",                     |                                                                                              | postgres
    6290 | DROP_GROUP               | SCHEMA DROPPED | "emaj #'3"                           |                                                                                              | postgres
    6291 | DROP_GROUP               | END            | phil's group#3",                     | 4 tables/sequences processed                                                                 | postgres
    6292 | CREATE_GROUP             | BEGIN          | phil's group#3",                     | rollbackable                                                                                 | postgres
    6293 | CREATE_GROUP             | SCHEMA CREATED | "emaj #'3"                           |                                                                                              | postgres
    6294 | CREATE_GROUP             | END            | phil's group#3",                     | 4 tables/sequences processed                                                                 | postgres
    6295 | START_GROUP              | BEGIN          | phil's group#3",                     | With log reset                                                                               | postgres
    6296 | LOCK_GROUP               | BEGIN          | phil's group#3",                     |                                                                                              | postgres
    6297 | LOCK_GROUP               | END            | phil's group#3",                     | 2 tables locked, 0 deadlock(s)                                                               | postgres
    6298 | SET_MARK_GROUP           | BEGIN          | phil's group#3",                     | M1_rollbackable                                                                              | postgres
    6299 | SET_MARK_GROUP           | END            | phil's group#3",                     | M1_rollbackable                                                                              | postgres
    6300 | START_GROUP              | END            | phil's group#3",                     | 4 tables/sequences processed                                                                 | postgres
    6301 | SET_MARK_GROUP           | BEGIN          | phil's group#3",                     |                                                                                              | postgres
    6302 | LOCK_GROUP               | BEGIN          | phil's group#3",                     |                                                                                              | postgres
    6303 | LOCK_GROUP               | END            | phil's group#3",                     | 2 tables locked, 0 deadlock(s)                                                               | postgres
    6304 | SET_MARK_GROUP           | END            | phil's group#3",                     | M2_rollbackable                                                                              | postgres
    6305 | SET_MARK_GROUP           | BEGIN          | phil's group#3",                     |                                                                                              | postgres
    6306 | LOCK_GROUP               | BEGIN          | phil's group#3",                     |                                                                                              | postgres
    6307 | LOCK_GROUP               | END            | phil's group#3",                     | 2 tables locked, 0 deadlock(s)                                                               | postgres
    6308 | SET_MARK_GROUP           | END            | phil's group#3",                     | M2_again!                                                                                    | postgres
    6309 | SET_MARK_GROUPS          | BEGIN          | phil's group#3",                     | phil's mark #1                                                                               | postgres
    6310 | LOCK_GROUPS              | BEGIN          | phil's group#3",                     |                                                                                              | postgres
    6311 | LOCK_GROUPS              | END            | phil's group#3",                     | 2 tables locked, 0 deadlock(s)                                                               | postgres
    6312 | SET_MARK_GROUPS          | END            | phil's group#3",                     | phil's mark #1                                                                               | postgres
    6313 | COMMENT_MARK_GROUP       |                | phil's group#3",                     | Mark phil's mark #1                                                                          | postgres
    6314 | RENAME_MARK_GROUP        | BEGIN          | phil's group#3",                     | phil's mark #1                                                                               | postgres
    6315 | RENAME_MARK_GROUP        | END            | phil's group#3",                     | phil's mark #1 renamed phil's mark #3                                                        | postgres
    6316 | DELETE_MARK_GROUP        | BEGIN          | phil's group#3",                     | M2_again!                                                                                    | postgres
    6317 | DELETE_MARK_GROUP        | END            | phil's group#3",                     | M2_again!                                                                                    | postgres
    6318 | ROLLBACK_GROUP           | BEGIN          | phil's group#3",                     | Logged rollback to mark phil's mark #3 (timestamp)                                           | postgres
    6319 | LOCK_SESSION             | BEGIN          | phil's group#3",                     | Session #1                                                                                   | postgres
    6320 | LOCK_SESSION             | END            | phil's group#3",                     | Session #1 : 2 tables locked, 0 deadlock(s)                                                  | postgres
    6321 | SET_MARK_GROUP           | BEGIN          | phil's group#3",                     | RLBK_phil's mark #3_%_START                                                                  | postgres
    6322 | SET_MARK_GROUP           | END            | phil's group#3",                     | RLBK_phil's mark #3_%_START                                                                  | postgres
    6323 | ROLLBACK_SEQUENCE        |                | "phil's schema3"."myTbl2\_col21_seq" |                                                                                              | postgres
    6324 | ROLLBACK_SEQUENCE        |                | "phil's schema3"."phil's seq\1"      |                                                                                              | postgres
    6325 | SET_MARK_GROUP           | BEGIN          | phil's group#3",                     | RLBK_phil's mark #3_%_DONE                                                                   | postgres
    6326 | SET_MARK_GROUP           | END            | phil's group#3",                     | RLBK_phil's mark #3_%_DONE                                                                   | postgres
    6327 | ROLLBACK_GROUP           | END            | phil's group#3",                     | 0 tables and 2 sequences effectively processed                                               | postgres
    6328 | ROLLBACK_GROUP           | BEGIN          | phil's group#3",                     | Unlogged rollback to mark phil's mark #3 (timestamp)                                         | postgres
    6329 | LOCK_SESSION             | BEGIN          | phil's group#3",                     | Session #1                                                                                   | postgres
    6330 | LOCK_SESSION             | END            | phil's group#3",                     | Session #1 : 2 tables locked, 0 deadlock(s)                                                  | postgres
    6331 | ROLLBACK_GROUP           | MARK DELETED   | phil's group#3",                     | mark RLBK_phil's mark #3_%_START has been deleted                                            | postgres
    6332 | ROLLBACK_GROUP           | MARK DELETED   | phil's group#3",                     | mark RLBK_phil's mark #3_%_DONE has been deleted                                             | postgres
    6333 | ROLLBACK_SEQUENCE        |                | "phil's schema3"."myTbl2\_col21_seq" |                                                                                              | postgres
    6334 | ROLLBACK_SEQUENCE        |                | "phil's schema3"."phil's seq\1"      |                                                                                              | postgres
    6335 | ROLLBACK_GROUP           | END            | phil's group#3",                     | 0 tables and 2 sequences effectively processed                                               | postgres
    6336 | ROLLBACK_GROUP           | BEGIN          | myGroup1                             | Unlogged rollback to mark Multi-1 (timestamp)                                                | postgres
    6337 | LOCK_SESSION             | BEGIN          | myGroup1                             | Session #1                                                                                   | postgres
    6338 | LOCK_SESSION             | END            | myGroup1                             | Session #1 : 5 tables locked, 0 deadlock(s)                                                  | postgres
    6339 | ROLLBACK_TABLE           | BEGIN          | myschema1.mytbl1                     | All log rows with emaj_gid > 12007                                                           | postgres
    6340 | ROLLBACK_TABLE           | END            | myschema1.mytbl1                     | 0 rollbacked rows                                                                            | postgres
    6341 | ROLLBACK_SEQUENCE        |                | myschema1."myTbl3_col31_seq"         |                                                                                              | postgres
    6342 | ROLLBACK_GROUP           | END            | myGroup1                             | 1 tables and 1 sequences effectively processed                                               | postgres
    6343 | SNAP_GROUP               | BEGIN          | myGroup1                             | /tmp/emaj_test/snaps                                                                         | postgres
    6344 | SNAP_GROUP               | END            | myGroup1                             | 6 tables/sequences processed                                                                 | postgres
    6345 | SNAP_GROUP               | BEGIN          | myGroup2                             | /tmp/emaj_test/snaps                                                                         | postgres
    6346 | SNAP_GROUP               | END            | myGroup2                             | 8 tables/sequences processed                                                                 | postgres
    6347 | SNAP_GROUP               | BEGIN          | phil's group#3",                     | /tmp/emaj_test/snaps                                                                         | postgres
    6348 | SNAP_GROUP               | END            | phil's group#3",                     | 4 tables/sequences processed                                                                 | postgres
    6349 | GENERATE_SQL             | BEGIN          | myGroup1                             | From mark Multi-1 to current situation towards /tmp/emaj_test/sql_scripts/myGroup1.sql       | postgres
    6350 | GENERATE_SQL             | END            | myGroup1                             | 1 generated statements                                                                       | postgres
    6351 | GENERATE_SQL             | BEGIN          | myGroup2                             | From mark Multi-1 to current situation towards /tmp/emaj_test/sql_scripts/myGroup2.sql       | postgres
    6352 | GENERATE_SQL             | END            | myGroup2                             | 21 generated statements                                                                      | postgres
    6353 | GENERATE_SQL             | BEGIN          | phil's group#3",                     | From mark M1_rollbackable to current situation towards /tmp/emaj_test/sql_scripts/Group3.sql | postgres
    6354 | GENERATE_SQL             | END            | phil's group#3",                     | 57 generated statements                                                                      | postgres
(351 rows)

--
reset role;
truncate emaj.emaj_hist;
alter sequence emaj.emaj_hist_hist_id_seq restart 10000;
alter sequence emaj.emaj_mark_mark_id_seq restart 1000;
alter sequence emaj.emaj_sequence_sequ_id_seq restart 1000;
alter sequence emaj.emaj_seq_hole_sqhl_id_seq restart 1000;
-- the groups are left in their current state for the parallel rollback test.
-- perform some updates to prepare the parallel rollback test
select count(*) from mySchema1.myTbl4;
 count 
-------
     0
(1 row)

select count(*) from mySchema1.myTbl1;
 count 
-------
    20
(1 row)

select count(*) from mySchema1.myTbl2; 
 count 
-------
     3
(1 row)

select count(*) from mySchema1."myTbl3";
 count 
-------
     5
(1 row)

select count(*) from mySchema1.myTbl2b;
 count 
-------
     0
(1 row)

select count(*) from mySchema2.myTbl4;
 count 
-------
     2
(1 row)

select count(*) from mySchema2.myTbl1;
 count 
-------
    10
(1 row)

select count(*) from mySchema2.myTbl2; 
 count 
-------
     2
(1 row)

select count(*) from mySchema2."myTbl3";
 count 
-------
    10
(1 row)

select count(*) from mySchema2.myTbl5;
 count 
-------
     3
(1 row)

select count(*) from mySchema2.myTbl6;
 count 
-------
    13
(1 row)

delete from mySchema1.myTbl4;
delete from mySchema1.myTbl1;
delete from mySchema1.myTbl2; 
delete from mySchema1."myTbl3";
delete from mySchema1.myTbl2b;
delete from mySchema2.myTbl4;
delete from mySchema2.myTbl1;
delete from mySchema2.myTbl2; 
delete from mySchema2."myTbl3";
delete from mySchema2.myTbl5;
delete from mySchema2.myTbl6;
alter sequence mySchema2.mySeq1 restart 9999;
