-- afterMigLoggingGroup.sql : complex scenario executed by an emaj_adm role
-- The E-Maj version is changed while groups are in logging state
-- This script is the part of operations performed after the migration
--
-----------------------------
-- Step 1 : check the E-Maj installation
-----------------------------
select * from emaj.emaj_verify_all();
  emaj_verify_all  
-------------------
 No error detected
(1 row)

-----------------------------
-- Step 2 : for myGroup1, update tables, then unprotect and rollback then update tables again then set 3 marks
-----------------------------
set search_path=myschema1;
--
update "myTbl3" set col33 = col33 / 2;
--
alter table mySchema1.myTbl2 disable trigger myTbl2trg;
select emaj.emaj_rollback_group('myGroup1','M2');
ERROR:  _rlbk_check: Group "myGroup1" is currently protected against rollback.
CONTEXT:  SQL statement "SELECT emaj._rlbk_check(v_groupNames, v_mark)"
PL/pgSQL function "_rlbk_init" line 25 at SQL statement
SQL statement "SELECT emaj._rlbk_init(v_groupNames, v_mark, v_isLoggedRlbk, 1, v_multiGroup)"
PL/pgSQL function "_rlbk_groups" line 20 at SQL statement
PL/pgSQL function "emaj_rollback_group" line 7 at RETURN
select emaj.emaj_unprotect_group('myGroup1');
 emaj_unprotect_group 
----------------------
                    1
(1 row)

select emaj.emaj_rollback_group('myGroup1','M2');
ERROR:  _rlbk_check: protected marks (M3) for group "myGroup1" block the rollback to mark "M2".
CONTEXT:  SQL statement "SELECT emaj._rlbk_check(v_groupNames, v_mark)"
PL/pgSQL function "_rlbk_init" line 25 at SQL statement
SQL statement "SELECT emaj._rlbk_init(v_groupNames, v_mark, v_isLoggedRlbk, 1, v_multiGroup)"
PL/pgSQL function "_rlbk_groups" line 20 at SQL statement
PL/pgSQL function "emaj_rollback_group" line 7 at RETURN
select emaj.emaj_unprotect_mark_group('myGroup1','M3');
 emaj_unprotect_mark_group 
---------------------------
                         1
(1 row)

select emaj.emaj_rollback_group('myGroup1','M2');
 emaj_rollback_group 
---------------------
                   4
(1 row)

alter table mySchema1.myTbl2 enable trigger myTbl2trg;
--
insert into myTbl1 select i, 'DEF', E'\\000'::bytea from generate_series (100,110) as i;
insert into myTbl2 values (3,'GHI','2010-01-02');
delete from myTbl1 where col11 = 1;
--
select emaj.emaj_set_mark_group('myGroup1','M4');
 emaj_set_mark_group 
---------------------
                   6
(1 row)

--
update "myTbl3" set col33 = col33 / 2;
--
select emaj.emaj_set_mark_group('myGroup1','M5');
 emaj_set_mark_group 
---------------------
                   6
(1 row)

--
update myTbl1 set col11 = 99 where col11 = 1;
--
select emaj.emaj_set_mark_group('myGroup1','M6');
 emaj_set_mark_group 
---------------------
                   6
(1 row)

-----------------------------
-- Step 3 : for myGroup2, logged rollback again then unlogged rollback 
-----------------------------
select emaj.emaj_logged_rollback_group('myGroup2','M2');
 emaj_logged_rollback_group 
----------------------------
                          3
(1 row)

--
select emaj.emaj_rollback_group('myGroup2','M3');
 emaj_rollback_group 
---------------------
                   3
(1 row)

-----------------------------
-- Step 4 : for myGroup1, update tables, rollback, other updates, then logged rollback
-----------------------------
set search_path=myschema1;
--
insert into myTbl1 values (1, 'Step 6', E'\\000'::bytea);
insert into myTbl4 values (11,'FK...',1,1,'Step 6');
insert into myTbl4 values (12,'FK...',1,1,'Step 6');
--
alter table mySchema1.myTbl2 disable trigger myTbl2trg;
select emaj.emaj_rollback_group('myGroup1','M5');
 emaj_rollback_group 
---------------------
                   3
(1 row)

alter table mySchema1.myTbl2 enable trigger myTbl2trg;
--
insert into myTbl1 values (1, 'Step 6', E'\\001'::bytea);
copy myTbl4 from stdin;
--
alter table mySchema1.myTbl2 disable trigger myTbl2trg;
select emaj.emaj_logged_rollback_group('myGroup1','M4');
 emaj_logged_rollback_group 
----------------------------
                          4
(1 row)

alter table mySchema1.myTbl2 enable trigger myTbl2trg;
-----------------------------
-- Step 5 : for myGroup1, update tables, rename a mark, then delete 2 marks then delete all before a mark 
-----------------------------
set search_path=myschema1;
--
delete from "myTbl3" where col31 between 14 and 18;
--
select emaj.emaj_rename_mark_group('myGroup1',mark_name,'Before logged rollback to M4') from emaj.emaj_mark where mark_name like 'RLBK_M4_%_START';
 emaj_rename_mark_group 
------------------------
 
(1 row)

-- 
select emaj.emaj_delete_mark_group('myGroup1',mark_name) from emaj.emaj_mark where mark_name like 'RLBK_M4_%_DONE';
 emaj_delete_mark_group 
------------------------
                      1
(1 row)

select emaj.emaj_delete_mark_group('myGroup1','M1');
 emaj_delete_mark_group 
------------------------
                      1
(1 row)

--
select emaj.emaj_delete_before_mark_group('myGroup1','M4');
 emaj_delete_before_mark_group 
-------------------------------
                             1
(1 row)

-----------------------------
-- test end: check and reset history
-----------------------------
select time_id, time_last_emaj_gid, time_event from emaj.emaj_time_stamp order by time_id;
 time_id | time_last_emaj_gid | time_event 
---------+--------------------+------------
       1 |                    | C
       2 |                    | C
       3 |                    | C
       4 |                  0 | M
       5 |                  0 | M
       6 |                  0 | M
       7 |                 29 | M
       8 |                 40 | M
       9 |                    | R
      10 |                    | R
      11 |                 77 | M
      12 |                 81 | M
      13 |                    | R
      14 |                 81 | M
      15 |                 83 | M
      16 |                    | R
      17 |                 83 | M
      18 |                 85 | M
      19 |                 95 | R
      20 |                109 | M
      21 |                119 | M
      22 |                119 | M
      23 |                119 | R
      24 |                121 | M
      25 |                121 | R
      26 |                124 | R
      27 |                127 | R
      28 |                150 | M
(28 rows)

select hist_id, hist_function, hist_event, hist_object, regexp_replace(regexp_replace(hist_wording,E'\\d\\d\.\\d\\d\\.\\d\\d\\.\\d\\d\\d','%','g'),E'\\[.+\\]','(timestamp)','g'), hist_user from 
  (select * from emaj.emaj_hist order by hist_id) as t;
 hist_id |      hist_function       |  hist_event  |         hist_object          |                        regexp_replace                         | hist_user 
---------+--------------------------+--------------+------------------------------+---------------------------------------------------------------+-----------
       1 | EMAJ_INSTALL             |              | E-Maj 1.3.0                  | Initialisation completed                                      | postgres
       2 | EMAJ_INSTALL             |              | E-Maj 1.3.0                  | E-Maj transformed into an EXTENSION                           | postgres
       3 | CREATE_GROUP             | BEGIN        | myGroup1                     | rollbackable                                                  | postgres
       4 | CREATE_GROUP             | END          | myGroup1                     | 6 tables/sequences processed                                  | postgres
       5 | CREATE_GROUP             | BEGIN        | myGroup2                     | rollbackable                                                  | postgres
       6 | CREATE_GROUP             | END          | myGroup2                     | 6 tables/sequences processed                                  | postgres
       7 | CREATE_GROUP             | BEGIN        | phil's group#3",             | audit_only                                                    | postgres
       8 | CREATE_GROUP             | END          | phil's group#3",             | 3 tables/sequences processed                                  | postgres
       9 | START_GROUP              | BEGIN        | myGroup1                     | With log reset                                                | postgres
      10 | LOCK_GROUP               | BEGIN        | myGroup1                     |                                                               | postgres
      11 | LOCK_GROUP               | END          | myGroup1                     | 5 tables locked, 0 deadlock(s)                                | postgres
      12 | SET_MARK_GROUP           | BEGIN        | myGroup1                     | M1                                                            | postgres
      13 | SET_MARK_GROUP           | END          | myGroup1                     | M1                                                            | postgres
      14 | START_GROUP              | END          | myGroup1                     | 6 tables/sequences processed                                  | postgres
      15 | START_GROUP              | BEGIN        | myGroup2                     | With log reset                                                | postgres
      16 | LOCK_GROUP               | BEGIN        | myGroup2                     |                                                               | postgres
      17 | LOCK_GROUP               | END          | myGroup2                     | 4 tables locked, 0 deadlock(s)                                | postgres
      18 | SET_MARK_GROUP           | BEGIN        | myGroup2                     | M1                                                            | postgres
      19 | SET_MARK_GROUP           | END          | myGroup2                     | M1                                                            | postgres
      20 | START_GROUP              | END          | myGroup2                     | 6 tables/sequences processed                                  | postgres
      21 | START_GROUP              | BEGIN        | phil's group#3",             | With log reset                                                | postgres
      22 | LOCK_GROUP               | BEGIN        | phil's group#3",             |                                                               | postgres
      23 | LOCK_GROUP               | END          | phil's group#3",             | 2 tables locked, 0 deadlock(s)                                | postgres
      24 | SET_MARK_GROUP           | BEGIN        | phil's group#3",             | M1                                                            | postgres
      25 | SET_MARK_GROUP           | END          | phil's group#3",             | M1                                                            | postgres
      26 | START_GROUP              | END          | phil's group#3",             | 3 tables/sequences processed                                  | postgres
      27 | SET_MARK_GROUP           | BEGIN        | myGroup1                     |                                                               | postgres
      28 | LOCK_GROUP               | BEGIN        | myGroup1                     |                                                               | postgres
      29 | LOCK_GROUP               | END          | myGroup1                     | 5 tables locked, 0 deadlock(s)                                | postgres
      30 | SET_MARK_GROUP           | END          | myGroup1                     | M2                                                            | postgres
      31 | SET_MARK_GROUP           | BEGIN        | myGroup1                     |                                                               | postgres
      32 | LOCK_GROUP               | BEGIN        | myGroup1                     |                                                               | postgres
      33 | LOCK_GROUP               | END          | myGroup1                     | 5 tables locked, 0 deadlock(s)                                | postgres
      34 | SET_MARK_GROUP           | END          | myGroup1                     | M3                                                            | postgres
      35 | COMMENT_MARK_GROUP       |              | myGroup1                     | Mark M3                                                       | postgres
      36 | ROLLBACK_GROUP           | BEGIN        | myGroup1                     | Unlogged rollback to mark M3 (timestamp)                      | postgres
      37 | DBLINK_OPEN_CNX          |              | rlbk#1                       | Status = -2                                                   | postgres
      38 | LOCK_GROUP               | BEGIN        | myGroup1                     | Rollback session #1                                           | postgres
      39 | LOCK_GROUP               | END          | myGroup1                     | Rollback session #1: 5 tables locked, 0 deadlock(s)           | postgres
      40 | ROLLBACK_TABLE           | BEGIN        | myschema1.mytbl1             | All log rows with emaj_gid > 40                               | postgres
      41 | ROLLBACK_TABLE           | END          | myschema1.mytbl1             | 6 rolled back primary keys                                    | postgres
      42 | ROLLBACK_SEQUENCE        |              | myschema1."myTbl3_col31_seq" |                                                               | postgres
      43 | ROLLBACK_GROUP           | END          | myGroup1                     | Rollback_id 1, 1 tables and 1 sequences effectively processed | postgres
      44 | ROLLBACK_GROUP           | BEGIN        | myGroup1                     | Unlogged rollback to mark M3 (timestamp)                      | postgres
      45 | DBLINK_OPEN_CNX          |              | rlbk#1                       | Status = -2                                                   | postgres
      46 | LOCK_GROUP               | BEGIN        | myGroup1                     | Rollback session #1                                           | postgres
      47 | LOCK_GROUP               | END          | myGroup1                     | Rollback session #1: 5 tables locked, 0 deadlock(s)           | postgres
      48 | ROLLBACK_TABLE           | BEGIN        | myschema1.mytbl2             | All log rows with emaj_gid > 40                               | postgres
      49 | ROLLBACK_TABLE           | END          | myschema1.mytbl2             | 1 rolled back primary keys                                    | postgres
      50 | ROLLBACK_TABLE           | BEGIN        | myschema1.mytbl4             | All log rows with emaj_gid > 40                               | postgres
      51 | ROLLBACK_TABLE           | END          | myschema1.mytbl4             | 1 rolled back primary keys                                    | postgres
      52 | ROLLBACK_TABLE           | BEGIN        | myschema1.mytbl2b            | All log rows with emaj_gid > 40                               | postgres
      53 | ROLLBACK_TABLE           | END          | myschema1.mytbl2b            | 2 rolled back primary keys                                    | postgres
      54 | ROLLBACK_SEQUENCE        |              | myschema1."myTbl3_col31_seq" |                                                               | postgres
      55 | ROLLBACK_GROUP           | END          | myGroup1                     | Rollback_id 2, 3 tables and 1 sequences effectively processed | postgres
      56 | PROTECT_MARK_GROUP       |              | myGroup1                     | Mark M3 ; status 1                                            | postgres
      57 | PROTECT_GROUP            |              | myGroup1                     | Status 1                                                      | postgres
      58 | SET_MARK_GROUP           | BEGIN        | myGroup2                     |                                                               | postgres
      59 | LOCK_GROUP               | BEGIN        | myGroup2                     |                                                               | postgres
      60 | LOCK_GROUP               | END          | myGroup2                     | 4 tables locked, 0 deadlock(s)                                | postgres
      61 | SET_MARK_GROUP           | END          | myGroup2                     | M2                                                            | postgres
      62 | SET_MARK_GROUP           | BEGIN        | myGroup2                     |                                                               | postgres
      63 | LOCK_GROUP               | BEGIN        | myGroup2                     |                                                               | postgres
      64 | LOCK_GROUP               | END          | myGroup2                     | 4 tables locked, 0 deadlock(s)                                | postgres
      65 | SET_MARK_GROUP           | END          | myGroup2                     | M3                                                            | postgres
      66 | ROLLBACK_GROUP           | BEGIN        | myGroup2                     | Logged rollback to mark M2 (timestamp)                        | postgres
      67 | DBLINK_OPEN_CNX          |              | rlbk#1                       | Status = -2                                                   | postgres
      68 | LOCK_GROUP               | BEGIN        | myGroup2                     | Rollback session #1                                           | postgres
      69 | LOCK_GROUP               | END          | myGroup2                     | Rollback session #1: 4 tables locked, 0 deadlock(s)           | postgres
      70 | SET_MARK_GROUP           | BEGIN        | myGroup2                     | RLBK_M2_%_START                                               | postgres
      71 | SET_MARK_GROUP           | END          | myGroup2                     | RLBK_M2_%_START                                               | postgres
      72 | ROLLBACK_TABLE           | BEGIN        | myschema2.mytbl4             | All log rows with emaj_gid > 77                               | postgres
      73 | ROLLBACK_TABLE           | END          | myschema2.mytbl4             | 2 rolled back primary keys                                    | postgres
      74 | ROLLBACK_SEQUENCE        |              | myschema2.myseq1             | RESTART 1001 MAXVALUE 2000 CYCLE                              | postgres
      75 | ROLLBACK_SEQUENCE        |              | myschema2."myTbl3_col31_seq" |                                                               | postgres
      76 | SET_MARK_GROUP           | BEGIN        | myGroup2                     | RLBK_M2_%_DONE                                                | postgres
      77 | SET_MARK_GROUP           | END          | myGroup2                     | RLBK_M2_%_DONE                                                | postgres
      78 | ROLLBACK_GROUP           | END          | myGroup2                     | Rollback_id 3, 1 tables and 2 sequences effectively processed | postgres
      79 | ROLLBACK_GROUP           | BEGIN        | myGroup2                     | Logged rollback to mark M3 (timestamp)                        | postgres
      80 | DBLINK_OPEN_CNX          |              | rlbk#1                       | Status = -2                                                   | postgres
      81 | LOCK_GROUP               | BEGIN        | myGroup2                     | Rollback session #1                                           | postgres
      82 | LOCK_GROUP               | END          | myGroup2                     | Rollback session #1: 4 tables locked, 0 deadlock(s)           | postgres
      83 | SET_MARK_GROUP           | BEGIN        | myGroup2                     | RLBK_M3_%_START                                               | postgres
      84 | SET_MARK_GROUP           | END          | myGroup2                     | RLBK_M3_%_START                                               | postgres
      85 | ROLLBACK_TABLE           | BEGIN        | myschema2.mytbl4             | All log rows with emaj_gid > 81                               | postgres
      86 | ROLLBACK_TABLE           | END          | myschema2.mytbl4             | 2 rolled back primary keys                                    | postgres
      87 | ROLLBACK_SEQUENCE        |              | myschema2.myseq1             | RESTART 1004 MAXVALUE 9223372036854775807 NO  CYCLE           | postgres
      88 | ROLLBACK_SEQUENCE        |              | myschema2."myTbl3_col31_seq" |                                                               | postgres
      89 | SET_MARK_GROUP           | BEGIN        | myGroup2                     | RLBK_M3_%_DONE                                                | postgres
      90 | SET_MARK_GROUP           | END          | myGroup2                     | RLBK_M3_%_DONE                                                | postgres
      91 | ROLLBACK_GROUP           | END          | myGroup2                     | Rollback_id 4, 1 tables and 2 sequences effectively processed | postgres
      92 | EMAJ_INSTALL             |              | E-Maj 2.0.0                  | Upgrade from 1.3.0 completed                                  | postgres
      93 | UNPROTECT_GROUP          |              | myGroup1                     | Status 1                                                      | postgres
      94 | UNPROTECT_MARK_GROUP     |              | myGroup1                     | Mark M3 ; status 1                                            | postgres
      95 | ROLLBACK_GROUP           | BEGIN        | myGroup1                     | Unlogged rollback to mark M2 (timestamp)                      | postgres
      96 | DBLINK_OPEN_CNX          |              | rlbk#1                       | Status = -2                                                   | postgres
      97 | LOCK_GROUP               | BEGIN        | myGroup1                     | Rollback session #1                                           | postgres
      98 | LOCK_GROUP               | END          | myGroup1                     | Rollback session #1: 5 tables locked, 0 deadlock(s)           | postgres
      99 | ROLLBACK_TABLE           | BEGIN        | myschema1."myTbl3"           | All log rows with emaj_gid > 29                               | postgres
     100 | ROLLBACK_TABLE           | END          | myschema1."myTbl3"           | 10 rolled back primary keys                                   | postgres
     101 | ROLLBACK_TABLE           | BEGIN        | myschema1.mytbl1             | All log rows with emaj_gid > 29                               | postgres
     102 | ROLLBACK_TABLE           | END          | myschema1.mytbl1             | 5 rolled back primary keys                                    | postgres
     103 | ROLLBACK_TABLE           | BEGIN        | myschema1.mytbl4             | All log rows with emaj_gid > 29                               | postgres
     104 | ROLLBACK_TABLE           | END          | myschema1.mytbl4             | 3 rolled back primary keys                                    | postgres
     105 | ROLLBACK_GROUP           | MARK DELETED | myGroup1                     | mark M3 is deleted                                            | postgres
     106 | ROLLBACK_SEQUENCE        |              | myschema1."myTbl3_col31_seq" |                                                               | postgres
     107 | ROLLBACK_GROUP           | END          | myGroup1                     | Rollback_id 5, 3 tables and 1 sequences effectively processed | postgres
     108 | SET_MARK_GROUP           | BEGIN        | myGroup1                     |                                                               | postgres
     109 | LOCK_GROUP               | BEGIN        | myGroup1                     |                                                               | postgres
     110 | LOCK_GROUP               | END          | myGroup1                     | 5 tables locked, 0 deadlock(s)                                | postgres
     111 | SET_MARK_GROUP           | END          | myGroup1                     | M4                                                            | postgres
     112 | SET_MARK_GROUP           | BEGIN        | myGroup1                     |                                                               | postgres
     113 | LOCK_GROUP               | BEGIN        | myGroup1                     |                                                               | postgres
     114 | LOCK_GROUP               | END          | myGroup1                     | 5 tables locked, 0 deadlock(s)                                | postgres
     115 | SET_MARK_GROUP           | END          | myGroup1                     | M5                                                            | postgres
     116 | SET_MARK_GROUP           | BEGIN        | myGroup1                     |                                                               | postgres
     117 | LOCK_GROUP               | BEGIN        | myGroup1                     |                                                               | postgres
     118 | LOCK_GROUP               | END          | myGroup1                     | 5 tables locked, 0 deadlock(s)                                | postgres
     119 | SET_MARK_GROUP           | END          | myGroup1                     | M6                                                            | postgres
     120 | ROLLBACK_GROUP           | BEGIN        | myGroup2                     | Logged rollback to mark M2 (timestamp)                        | postgres
     121 | DBLINK_OPEN_CNX          |              | rlbk#1                       | Status = -2                                                   | postgres
     122 | LOCK_GROUP               | BEGIN        | myGroup2                     | Rollback session #1                                           | postgres
     123 | LOCK_GROUP               | END          | myGroup2                     | Rollback session #1: 4 tables locked, 0 deadlock(s)           | postgres
     124 | SET_MARK_GROUP           | BEGIN        | myGroup2                     | RLBK_M2_%_START                                               | postgres
     125 | SET_MARK_GROUP           | END          | myGroup2                     | RLBK_M2_%_START                                               | postgres
     126 | ROLLBACK_TABLE           | BEGIN        | myschema2.mytbl4             | All log rows with emaj_gid > 77                               | postgres
     127 | ROLLBACK_TABLE           | END          | myschema2.mytbl4             | 2 rolled back primary keys                                    | postgres
     128 | ROLLBACK_SEQUENCE        |              | myschema2.myseq1             | RESTART 1001 MAXVALUE 2000 CYCLE                              | postgres
     129 | ROLLBACK_SEQUENCE        |              | myschema2."myTbl3_col31_seq" |                                                               | postgres
     130 | SET_MARK_GROUP           | BEGIN        | myGroup2                     | RLBK_M2_%_DONE                                                | postgres
     131 | SET_MARK_GROUP           | END          | myGroup2                     | RLBK_M2_%_DONE                                                | postgres
     132 | ROLLBACK_GROUP           | END          | myGroup2                     | Rollback_id 6, 1 tables and 2 sequences effectively processed | postgres
     133 | ROLLBACK_GROUP           | BEGIN        | myGroup2                     | Unlogged rollback to mark M3 (timestamp)                      | postgres
     134 | DBLINK_OPEN_CNX          |              | rlbk#1                       | Status = -2                                                   | postgres
     135 | LOCK_GROUP               | BEGIN        | myGroup2                     | Rollback session #1                                           | postgres
     136 | LOCK_GROUP               | END          | myGroup2                     | Rollback session #1: 4 tables locked, 0 deadlock(s)           | postgres
     137 | ROLLBACK_TABLE           | BEGIN        | myschema2.mytbl4             | All log rows with emaj_gid > 81                               | postgres
     138 | ROLLBACK_TABLE           | END          | myschema2.mytbl4             | 2 rolled back primary keys                                    | postgres
     139 | ROLLBACK_GROUP           | MARK DELETED | myGroup2                     | mark RLBK_M2_%_START is deleted                               | postgres
     140 | ROLLBACK_GROUP           | MARK DELETED | myGroup2                     | mark RLBK_M2_%_DONE is deleted                                | postgres
     141 | ROLLBACK_GROUP           | MARK DELETED | myGroup2                     | mark RLBK_M3_%_START is deleted                               | postgres
     142 | ROLLBACK_GROUP           | MARK DELETED | myGroup2                     | mark RLBK_M3_%_DONE is deleted                                | postgres
     143 | ROLLBACK_GROUP           | MARK DELETED | myGroup2                     | mark RLBK_M2_%_START is deleted                               | postgres
     144 | ROLLBACK_GROUP           | MARK DELETED | myGroup2                     | mark RLBK_M2_%_DONE is deleted                                | postgres
     145 | ROLLBACK_SEQUENCE        |              | myschema2.myseq1             | RESTART 1004 MAXVALUE 9223372036854775807 NO  CYCLE           | postgres
     146 | ROLLBACK_SEQUENCE        |              | myschema2."myTbl3_col31_seq" |                                                               | postgres
     147 | ROLLBACK_GROUP           | END          | myGroup2                     | Rollback_id 7, 1 tables and 2 sequences effectively processed | postgres
     148 | ROLLBACK_GROUP           | BEGIN        | myGroup1                     | Unlogged rollback to mark M5 (timestamp)                      | postgres
     149 | DBLINK_OPEN_CNX          |              | rlbk#1                       | Status = -2                                                   | postgres
     150 | LOCK_GROUP               | BEGIN        | myGroup1                     | Rollback session #1                                           | postgres
     151 | LOCK_GROUP               | END          | myGroup1                     | Rollback session #1: 5 tables locked, 0 deadlock(s)           | postgres
     152 | ROLLBACK_TABLE           | BEGIN        | myschema1.mytbl1             | All log rows with emaj_gid > 119                              | postgres
     153 | ROLLBACK_TABLE           | END          | myschema1.mytbl1             | 1 rolled back primary keys                                    | postgres
     154 | ROLLBACK_TABLE           | BEGIN        | myschema1.mytbl4             | All log rows with emaj_gid > 119                              | postgres
     155 | ROLLBACK_TABLE           | END          | myschema1.mytbl4             | 2 rolled back primary keys                                    | postgres
     156 | ROLLBACK_GROUP           | MARK DELETED | myGroup1                     | mark M6 is deleted                                            | postgres
     157 | ROLLBACK_SEQUENCE        |              | myschema1."myTbl3_col31_seq" |                                                               | postgres
     158 | ROLLBACK_GROUP           | END          | myGroup1                     | Rollback_id 8, 2 tables and 1 sequences effectively processed | postgres
     159 | ROLLBACK_GROUP           | BEGIN        | myGroup1                     | Logged rollback to mark M4 (timestamp)                        | postgres
     160 | DBLINK_OPEN_CNX          |              | rlbk#1                       | Status = -2                                                   | postgres
     161 | LOCK_GROUP               | BEGIN        | myGroup1                     | Rollback session #1                                           | postgres
     162 | LOCK_GROUP               | END          | myGroup1                     | Rollback session #1: 5 tables locked, 0 deadlock(s)           | postgres
     163 | SET_MARK_GROUP           | BEGIN        | myGroup1                     | RLBK_M4_%_START                                               | postgres
     164 | SET_MARK_GROUP           | END          | myGroup1                     | RLBK_M4_%_START                                               | postgres
     165 | ROLLBACK_TABLE           | BEGIN        | myschema1."myTbl3"           | All log rows with emaj_gid > 109                              | postgres
     166 | ROLLBACK_TABLE           | END          | myschema1."myTbl3"           | 10 rolled back primary keys                                   | postgres
     167 | ROLLBACK_TABLE           | BEGIN        | myschema1.mytbl1             | All log rows with emaj_gid > 109                              | postgres
     168 | ROLLBACK_TABLE           | END          | myschema1.mytbl1             | 1 rolled back primary keys                                    | postgres
     169 | ROLLBACK_TABLE           | BEGIN        | myschema1.mytbl4             | All log rows with emaj_gid > 109                              | postgres
     170 | ROLLBACK_TABLE           | END          | myschema1.mytbl4             | 2 rolled back primary keys                                    | postgres
     171 | ROLLBACK_SEQUENCE        |              | myschema1."myTbl3_col31_seq" |                                                               | postgres
     172 | SET_MARK_GROUP           | BEGIN        | myGroup1                     | RLBK_M4_%_DONE                                                | postgres
     173 | SET_MARK_GROUP           | END          | myGroup1                     | RLBK_M4_%_DONE                                                | postgres
     174 | ROLLBACK_GROUP           | END          | myGroup1                     | Rollback_id 9, 3 tables and 1 sequences effectively processed | postgres
     175 | RENAME_MARK_GROUP        | BEGIN        | myGroup1                     | RLBK_M4_%_START                                               | postgres
     176 | RENAME_MARK_GROUP        | END          | myGroup1                     | RLBK_M4_%_START renamed Before logged rollback to M4          | postgres
     177 | DELETE_MARK_GROUP        | BEGIN        | myGroup1                     | RLBK_M4_%_DONE                                                | postgres
     178 | DELETE_MARK_GROUP        | END          | myGroup1                     | RLBK_M4_%_DONE                                                | postgres
     179 | DELETE_MARK_GROUP        | BEGIN        | myGroup1                     | M1                                                            | postgres
     180 | DELETE_MARK_GROUP        | END          | myGroup1                     | M1                                                            | postgres
     181 | DELETE_BEFORE_MARK_GROUP | BEGIN        | myGroup1                     | M4                                                            | postgres
     182 | DELETE_BEFORE_MARK_GROUP | END          | myGroup1                     | 1 marks deleted ; M4 is now the initial mark                  | postgres
(182 rows)

--
reset role;
truncate emaj.emaj_hist;
alter sequence emaj.emaj_hist_hist_id_seq restart 10000;
-- the groups are left in their current state for the parallel rollback test.
-- perform some updates to prepare the parallel rollback test
-- set a mark for both groups
select emaj.emaj_set_mark_groups(array['myGroup1','myGroup2'],'Multi-1');
 emaj_set_mark_groups 
----------------------
                   12
(1 row)

select count(*) from mySchema1.myTbl4;
 count 
-------
     0
(1 row)

select count(*) from mySchema1.myTbl1;
 count 
-------
    20
(1 row)

select count(*) from mySchema1.myTbl2; 
 count 
-------
     3
(1 row)

select count(*) from mySchema1."myTbl3";
 count 
-------
    10
(1 row)

select count(*) from mySchema1.myTbl2b;
 count 
-------
     3
(1 row)

select count(*) from mySchema2.myTbl4;
 count 
-------
     2
(1 row)

select count(*) from mySchema2.myTbl1;
 count 
-------
    10
(1 row)

select count(*) from mySchema2.myTbl2; 
 count 
-------
     2
(1 row)

select count(*) from mySchema2."myTbl3";
 count 
-------
    10
(1 row)

delete from mySchema1.myTbl4;
delete from mySchema1.myTbl1;
delete from mySchema1.myTbl2; 
delete from mySchema1."myTbl3";
delete from mySchema1.myTbl2b;
delete from mySchema2.myTbl4;
delete from mySchema2.myTbl1;
delete from mySchema2.myTbl2; 
delete from mySchema2."myTbl3";
alter sequence mySchema2.mySeq1 restart 9999;
-- but disable the application trigger
alter table mySchema1.myTbl2 disable trigger myTbl2trg;
