-- rollback.sql : test updates log, emaj_rollback_group(), emaj_logged_rollback_group(),
--                emaj_rollback_groups(), emaj_logged_rollback_groups(),
--                emaj_cleanup_rollback_state(), emaj_rollback_activity(),
--                emaj_consolidate_rollback_group() and emaj_get_consolidable_rollbacks() functions.
--
-----------------------------
-- rollback nothing tests
-----------------------------
-- group or groups is NULL
select emaj.emaj_rollback_group(NULL,NULL);
ERROR:  _rlbk_check: group "<NULL>" has not been created.
CONTEXT:  SQL statement "SELECT emaj._rlbk_check(v_groupNames, v_mark)"
PL/pgSQL function "_rlbk_init" line 24 at SQL statement
SQL statement "SELECT emaj._rlbk_init(v_groupNames, v_mark, v_isLoggedRlbk, 1, v_multiGroup)"
PL/pgSQL function "_rlbk_groups" line 20 at SQL statement
PL/pgSQL function "emaj_rollback_group" line 7 at RETURN
select emaj.emaj_logged_rollback_group(NULL,NULL);
ERROR:  _rlbk_check: group "<NULL>" has not been created.
CONTEXT:  SQL statement "SELECT emaj._rlbk_check(v_groupNames, v_mark)"
PL/pgSQL function "_rlbk_init" line 24 at SQL statement
SQL statement "SELECT emaj._rlbk_init(v_groupNames, v_mark, v_isLoggedRlbk, 1, v_multiGroup)"
PL/pgSQL function "_rlbk_groups" line 20 at SQL statement
PL/pgSQL function "emaj_logged_rollback_group" line 11 at RETURN
select emaj.emaj_rollback_groups(NULL,NULL);
WARNING:  _check_names_array: No group name to process.
CONTEXT:  PL/pgSQL function "emaj_rollback_groups" line 7 at RETURN
 emaj_rollback_groups 
----------------------
                    0
(1 row)

select emaj.emaj_logged_rollback_groups(NULL,NULL);
WARNING:  _check_names_array: No group name to process.
CONTEXT:  PL/pgSQL function "emaj_logged_rollback_groups" line 11 at RETURN
 emaj_logged_rollback_groups 
-----------------------------
                           0
(1 row)

-- group is unknown in emaj_group_def
select emaj.emaj_rollback_group('unknownGroup',NULL);
ERROR:  _rlbk_check: group "unknownGroup" has not been created.
CONTEXT:  SQL statement "SELECT emaj._rlbk_check(v_groupNames, v_mark)"
PL/pgSQL function "_rlbk_init" line 24 at SQL statement
SQL statement "SELECT emaj._rlbk_init(v_groupNames, v_mark, v_isLoggedRlbk, 1, v_multiGroup)"
PL/pgSQL function "_rlbk_groups" line 20 at SQL statement
PL/pgSQL function "emaj_rollback_group" line 7 at RETURN
select emaj.emaj_logged_rollback_group('unknownGroup',NULL);
ERROR:  _rlbk_check: group "unknownGroup" has not been created.
CONTEXT:  SQL statement "SELECT emaj._rlbk_check(v_groupNames, v_mark)"
PL/pgSQL function "_rlbk_init" line 24 at SQL statement
SQL statement "SELECT emaj._rlbk_init(v_groupNames, v_mark, v_isLoggedRlbk, 1, v_multiGroup)"
PL/pgSQL function "_rlbk_groups" line 20 at SQL statement
PL/pgSQL function "emaj_logged_rollback_group" line 11 at RETURN
select emaj.emaj_rollback_groups('{"unknownGroup"}',NULL);
ERROR:  _rlbk_check: group "unknownGroup" has not been created.
CONTEXT:  SQL statement "SELECT emaj._rlbk_check(v_groupNames, v_mark)"
PL/pgSQL function "_rlbk_init" line 24 at SQL statement
SQL statement "SELECT emaj._rlbk_init(v_groupNames, v_mark, v_isLoggedRlbk, 1, v_multiGroup)"
PL/pgSQL function "_rlbk_groups" line 20 at SQL statement
PL/pgSQL function "emaj_rollback_groups" line 7 at RETURN
select emaj.emaj_logged_rollback_groups('{"unknownGroup","myGroup1"}',NULL);
ERROR:  _rlbk_check: group "unknownGroup" has not been created.
CONTEXT:  SQL statement "SELECT emaj._rlbk_check(v_groupNames, v_mark)"
PL/pgSQL function "_rlbk_init" line 24 at SQL statement
SQL statement "SELECT emaj._rlbk_init(v_groupNames, v_mark, v_isLoggedRlbk, 1, v_multiGroup)"
PL/pgSQL function "_rlbk_groups" line 20 at SQL statement
PL/pgSQL function "emaj_logged_rollback_groups" line 11 at RETURN
begin;
  select emaj.emaj_start_group('myGroup1','');
 emaj_start_group 
------------------
                6
(1 row)

  select emaj.emaj_rollback_groups('{"myGroup1","unknownGroup"}','EMAJ_LAST_MARK');
ERROR:  _rlbk_check: group "unknownGroup" has not been created.
CONTEXT:  SQL statement "SELECT emaj._rlbk_check(v_groupNames, v_mark)"
PL/pgSQL function "_rlbk_init" line 24 at SQL statement
SQL statement "SELECT emaj._rlbk_init(v_groupNames, v_mark, v_isLoggedRlbk, 1, v_multiGroup)"
PL/pgSQL function "_rlbk_groups" line 20 at SQL statement
PL/pgSQL function "emaj_rollback_groups" line 7 at RETURN
rollback;
-- group not in logging state
select emaj.emaj_rollback_group('myGroup1','EMAJ_LAST_MARK');
ERROR:  _rlbk_check: Group "myGroup1" is not in LOGGING state.
CONTEXT:  SQL statement "SELECT emaj._rlbk_check(v_groupNames, v_mark)"
PL/pgSQL function "_rlbk_init" line 24 at SQL statement
SQL statement "SELECT emaj._rlbk_init(v_groupNames, v_mark, v_isLoggedRlbk, 1, v_multiGroup)"
PL/pgSQL function "_rlbk_groups" line 20 at SQL statement
PL/pgSQL function "emaj_rollback_group" line 7 at RETURN
select emaj.emaj_rollback_group('myGroup2','EMAJ_LAST_MARK');
ERROR:  _rlbk_check: Group "myGroup2" is not in LOGGING state.
CONTEXT:  SQL statement "SELECT emaj._rlbk_check(v_groupNames, v_mark)"
PL/pgSQL function "_rlbk_init" line 24 at SQL statement
SQL statement "SELECT emaj._rlbk_init(v_groupNames, v_mark, v_isLoggedRlbk, 1, v_multiGroup)"
PL/pgSQL function "_rlbk_groups" line 20 at SQL statement
PL/pgSQL function "emaj_rollback_group" line 7 at RETURN
select emaj.emaj_logged_rollback_group('myGroup1','EMAJ_LAST_MARK');
ERROR:  _rlbk_check: Group "myGroup1" is not in LOGGING state.
CONTEXT:  SQL statement "SELECT emaj._rlbk_check(v_groupNames, v_mark)"
PL/pgSQL function "_rlbk_init" line 24 at SQL statement
SQL statement "SELECT emaj._rlbk_init(v_groupNames, v_mark, v_isLoggedRlbk, 1, v_multiGroup)"
PL/pgSQL function "_rlbk_groups" line 20 at SQL statement
PL/pgSQL function "emaj_logged_rollback_group" line 11 at RETURN
select emaj.emaj_logged_rollback_group('myGroup2','EMAJ_LAST_MARK');
ERROR:  _rlbk_check: Group "myGroup2" is not in LOGGING state.
CONTEXT:  SQL statement "SELECT emaj._rlbk_check(v_groupNames, v_mark)"
PL/pgSQL function "_rlbk_init" line 24 at SQL statement
SQL statement "SELECT emaj._rlbk_init(v_groupNames, v_mark, v_isLoggedRlbk, 1, v_multiGroup)"
PL/pgSQL function "_rlbk_groups" line 20 at SQL statement
PL/pgSQL function "emaj_logged_rollback_group" line 11 at RETURN
select emaj.emaj_rollback_groups('{"myGroup1","myGroup2"}',NULL);
ERROR:  _rlbk_check: Group "myGroup1" is not in LOGGING state.
CONTEXT:  SQL statement "SELECT emaj._rlbk_check(v_groupNames, v_mark)"
PL/pgSQL function "_rlbk_init" line 24 at SQL statement
SQL statement "SELECT emaj._rlbk_init(v_groupNames, v_mark, v_isLoggedRlbk, 1, v_multiGroup)"
PL/pgSQL function "_rlbk_groups" line 20 at SQL statement
PL/pgSQL function "emaj_rollback_groups" line 7 at RETURN
begin;
  select emaj.emaj_start_group('myGroup1','');
 emaj_start_group 
------------------
                6
(1 row)

  select emaj.emaj_logged_rollback_groups('{"myGroup1","myGroup2"}','EMAJ_LAST_MARK');
ERROR:  _rlbk_check: Group "myGroup2" is not in LOGGING state.
CONTEXT:  SQL statement "SELECT emaj._rlbk_check(v_groupNames, v_mark)"
PL/pgSQL function "_rlbk_init" line 24 at SQL statement
SQL statement "SELECT emaj._rlbk_init(v_groupNames, v_mark, v_isLoggedRlbk, 1, v_multiGroup)"
PL/pgSQL function "_rlbk_groups" line 20 at SQL statement
PL/pgSQL function "emaj_logged_rollback_groups" line 11 at RETURN
rollback;
-- start groups and set some marks
select emaj.emaj_start_group('myGroup1','Mark11');
 emaj_start_group 
------------------
                6
(1 row)

select emaj.emaj_start_group('myGroup2','Mark21');
WARNING:  _check_fk_groups: Foreign key "mytbl6_col61_fkey", from table "myschema2.mytbl6", references "myschema2.mytbl7" that is outside groups (myGroup2).
CONTEXT:  SQL statement "SELECT emaj._check_fk_groups(v_groupNames)"
PL/pgSQL function "_start_groups" line 36 at PERFORM
SQL statement "SELECT emaj._start_groups(array[v_groupName], v_mark, false, v_resetLog)"
PL/pgSQL function "emaj_start_group" line 17 at SQL statement
WARNING:  _check_fk_groups: table "myschema2.mytbl6" is referenced by foreign key "mytbl8_col81_fkey" from table "myschema2.mytbl8" that is outside groups (myGroup2).
CONTEXT:  SQL statement "SELECT emaj._check_fk_groups(v_groupNames)"
PL/pgSQL function "_start_groups" line 36 at PERFORM
SQL statement "SELECT emaj._start_groups(array[v_groupName], v_mark, false, v_resetLog)"
PL/pgSQL function "emaj_start_group" line 17 at SQL statement
 emaj_start_group 
------------------
                8
(1 row)

select emaj.emaj_set_mark_group('myGroup1','Different_Mark');
 emaj_set_mark_group 
---------------------
                   6
(1 row)

select emaj.emaj_set_mark_group('myGroup2','Different_Mark');
 emaj_set_mark_group 
---------------------
                   8
(1 row)

-- log tables are empty
select count(*) from emaj.myschema1_mytbl1_log;
 count 
-------
     0
(1 row)

select count(*) from emaj.myschema1_mytbl2_log;
 count 
-------
     0
(1 row)

select count(*) from emajb.myschema1_mytbl2b_log;
 count 
-------
     0
(1 row)

select count(*) from "emajC"."myschema1_myTbl3_log";
 count 
-------
     0
(1 row)

select count(*) from emaj.myschema1_mytbl4_log;
 count 
-------
     0
(1 row)

select count(*) from emaj.myschema2_mytbl1_log;
 count 
-------
     0
(1 row)

select count(*) from emaj.myschema2_mytbl2_log;
 count 
-------
     0
(1 row)

select count(*) from "emajC"."myschema2_myTbl3_log";
 count 
-------
     0
(1 row)

select count(*) from emaj.myschema2_mytbl4_log;
 count 
-------
     0
(1 row)

-- protected group
select emaj.emaj_protect_group('myGroup1');
 emaj_protect_group 
--------------------
                  1
(1 row)

select emaj.emaj_protect_group('myGroup2');
 emaj_protect_group 
--------------------
                  1
(1 row)

select emaj.emaj_rollback_group('myGroup1','EMAJ_LAST_MARK');
ERROR:  _rlbk_check: Group "myGroup1" is currently protected against rollback.
CONTEXT:  SQL statement "SELECT emaj._rlbk_check(v_groupNames, v_mark)"
PL/pgSQL function "_rlbk_init" line 24 at SQL statement
SQL statement "SELECT emaj._rlbk_init(v_groupNames, v_mark, v_isLoggedRlbk, 1, v_multiGroup)"
PL/pgSQL function "_rlbk_groups" line 20 at SQL statement
PL/pgSQL function "emaj_rollback_group" line 7 at RETURN
select emaj.emaj_logged_rollback_groups('{"myGroup2","myGroup1"}',NULL);
ERROR:  _rlbk_check: Group "myGroup2" is currently protected against rollback.
CONTEXT:  SQL statement "SELECT emaj._rlbk_check(v_groupNames, v_mark)"
PL/pgSQL function "_rlbk_init" line 24 at SQL statement
SQL statement "SELECT emaj._rlbk_init(v_groupNames, v_mark, v_isLoggedRlbk, 1, v_multiGroup)"
PL/pgSQL function "_rlbk_groups" line 20 at SQL statement
PL/pgSQL function "emaj_logged_rollback_groups" line 11 at RETURN
select emaj.emaj_unprotect_group('myGroup1');
 emaj_unprotect_group 
----------------------
                    1
(1 row)

select emaj.emaj_unprotect_group('myGroup2');
 emaj_unprotect_group 
----------------------
                    1
(1 row)

select emaj.emaj_rollback_group('myGroup1','EMAJ_LAST_MARK');
 emaj_rollback_group 
---------------------
                   1
(1 row)

-- unknown mark name
select emaj.emaj_rollback_group('myGroup1',NULL);
ERROR:  _rlbk_check: No mark "<NULL>" exists for group "myGroup1".
CONTEXT:  SQL statement "SELECT emaj._rlbk_check(v_groupNames, v_mark)"
PL/pgSQL function "_rlbk_init" line 24 at SQL statement
SQL statement "SELECT emaj._rlbk_init(v_groupNames, v_mark, v_isLoggedRlbk, 1, v_multiGroup)"
PL/pgSQL function "_rlbk_groups" line 20 at SQL statement
PL/pgSQL function "emaj_rollback_group" line 7 at RETURN
select emaj.emaj_rollback_group('myGroup1','DummyMark');
ERROR:  _rlbk_check: No mark "DummyMark" exists for group "myGroup1".
CONTEXT:  SQL statement "SELECT emaj._rlbk_check(v_groupNames, v_mark)"
PL/pgSQL function "_rlbk_init" line 24 at SQL statement
SQL statement "SELECT emaj._rlbk_init(v_groupNames, v_mark, v_isLoggedRlbk, 1, v_multiGroup)"
PL/pgSQL function "_rlbk_groups" line 20 at SQL statement
PL/pgSQL function "emaj_rollback_group" line 7 at RETURN
select emaj.emaj_logged_rollback_group('myGroup1',NULL);
ERROR:  _rlbk_check: No mark "<NULL>" exists for group "myGroup1".
CONTEXT:  SQL statement "SELECT emaj._rlbk_check(v_groupNames, v_mark)"
PL/pgSQL function "_rlbk_init" line 24 at SQL statement
SQL statement "SELECT emaj._rlbk_init(v_groupNames, v_mark, v_isLoggedRlbk, 1, v_multiGroup)"
PL/pgSQL function "_rlbk_groups" line 20 at SQL statement
PL/pgSQL function "emaj_logged_rollback_group" line 11 at RETURN
select emaj.emaj_logged_rollback_group('myGroup1','DummyMark');
ERROR:  _rlbk_check: No mark "DummyMark" exists for group "myGroup1".
CONTEXT:  SQL statement "SELECT emaj._rlbk_check(v_groupNames, v_mark)"
PL/pgSQL function "_rlbk_init" line 24 at SQL statement
SQL statement "SELECT emaj._rlbk_init(v_groupNames, v_mark, v_isLoggedRlbk, 1, v_multiGroup)"
PL/pgSQL function "_rlbk_groups" line 20 at SQL statement
PL/pgSQL function "emaj_logged_rollback_group" line 11 at RETURN
select emaj.emaj_rollback_groups('{"myGroup1","myGroup2",""}',NULL);
WARNING:  _check_names_array: a group name is NULL or empty.
CONTEXT:  PL/pgSQL function "emaj_rollback_groups" line 7 at RETURN
ERROR:  _rlbk_check: No mark "<NULL>" exists for group "myGroup1".
CONTEXT:  SQL statement "SELECT emaj._rlbk_check(v_groupNames, v_mark)"
PL/pgSQL function "_rlbk_init" line 24 at SQL statement
SQL statement "SELECT emaj._rlbk_init(v_groupNames, v_mark, v_isLoggedRlbk, 1, v_multiGroup)"
PL/pgSQL function "_rlbk_groups" line 20 at SQL statement
PL/pgSQL function "emaj_rollback_groups" line 7 at RETURN
select emaj.emaj_rollback_groups('{"myGroup1","myGroup2",NULL}',NULL);
WARNING:  _check_names_array: a group name is NULL or empty.
CONTEXT:  PL/pgSQL function "emaj_rollback_groups" line 7 at RETURN
ERROR:  _rlbk_check: No mark "<NULL>" exists for group "myGroup1".
CONTEXT:  SQL statement "SELECT emaj._rlbk_check(v_groupNames, v_mark)"
PL/pgSQL function "_rlbk_init" line 24 at SQL statement
SQL statement "SELECT emaj._rlbk_init(v_groupNames, v_mark, v_isLoggedRlbk, 1, v_multiGroup)"
PL/pgSQL function "_rlbk_groups" line 20 at SQL statement
PL/pgSQL function "emaj_rollback_groups" line 7 at RETURN
select emaj.emaj_rollback_groups('{"myGroup1","myGroup2"}','DummyMark');
ERROR:  _rlbk_check: No mark "DummyMark" exists for group "myGroup1".
CONTEXT:  SQL statement "SELECT emaj._rlbk_check(v_groupNames, v_mark)"
PL/pgSQL function "_rlbk_init" line 24 at SQL statement
SQL statement "SELECT emaj._rlbk_init(v_groupNames, v_mark, v_isLoggedRlbk, 1, v_multiGroup)"
PL/pgSQL function "_rlbk_groups" line 20 at SQL statement
PL/pgSQL function "emaj_rollback_groups" line 7 at RETURN
select emaj.emaj_logged_rollback_groups('{"myGroup1","myGroup2","myGroup2"}',NULL);
WARNING:  _check_names_array: duplicate group name "myGroup2".
CONTEXT:  PL/pgSQL function "emaj_logged_rollback_groups" line 11 at RETURN
ERROR:  _rlbk_check: No mark "<NULL>" exists for group "myGroup1".
CONTEXT:  SQL statement "SELECT emaj._rlbk_check(v_groupNames, v_mark)"
PL/pgSQL function "_rlbk_init" line 24 at SQL statement
SQL statement "SELECT emaj._rlbk_init(v_groupNames, v_mark, v_isLoggedRlbk, 1, v_multiGroup)"
PL/pgSQL function "_rlbk_groups" line 20 at SQL statement
PL/pgSQL function "emaj_logged_rollback_groups" line 11 at RETURN
select emaj.emaj_logged_rollback_groups('{"myGroup1","myGroup2"}','Mark11');
ERROR:  _rlbk_check: No mark "Mark11" exists for group "myGroup2".
CONTEXT:  SQL statement "SELECT emaj._rlbk_check(v_groupNames, v_mark)"
PL/pgSQL function "_rlbk_init" line 24 at SQL statement
SQL statement "SELECT emaj._rlbk_init(v_groupNames, v_mark, v_isLoggedRlbk, 1, v_multiGroup)"
PL/pgSQL function "_rlbk_groups" line 20 at SQL statement
PL/pgSQL function "emaj_logged_rollback_groups" line 11 at RETURN
-- mark name referencing different points in time
select emaj.emaj_rollback_groups('{"myGroup1","myGroup2"}','Different_Mark');
ERROR:  _rlbk_check: Mark "Different_Mark" does not represent the same point in time for all groups.
CONTEXT:  SQL statement "SELECT emaj._rlbk_check(v_groupNames, v_mark)"
PL/pgSQL function "_rlbk_init" line 24 at SQL statement
SQL statement "SELECT emaj._rlbk_init(v_groupNames, v_mark, v_isLoggedRlbk, 1, v_multiGroup)"
PL/pgSQL function "_rlbk_groups" line 20 at SQL statement
PL/pgSQL function "emaj_rollback_groups" line 7 at RETURN
-- attempt to rollback an 'audit_only' group
select emaj.emaj_rollback_group('phil''s group#3",','EMAJ_LAST_MARK');
ERROR:  _rlbk_check: Group "phil's group#3"," has been created for audit only purpose.
CONTEXT:  SQL statement "SELECT emaj._rlbk_check(v_groupNames, v_mark)"
PL/pgSQL function "_rlbk_init" line 24 at SQL statement
SQL statement "SELECT emaj._rlbk_init(v_groupNames, v_mark, v_isLoggedRlbk, 1, v_multiGroup)"
PL/pgSQL function "_rlbk_groups" line 20 at SQL statement
PL/pgSQL function "emaj_rollback_group" line 7 at RETURN
select emaj.emaj_logged_rollback_group('phil''s group#3",','M1_audit_only');
ERROR:  _rlbk_check: Group "phil's group#3"," has been created for audit only purpose.
CONTEXT:  SQL statement "SELECT emaj._rlbk_check(v_groupNames, v_mark)"
PL/pgSQL function "_rlbk_init" line 24 at SQL statement
SQL statement "SELECT emaj._rlbk_init(v_groupNames, v_mark, v_isLoggedRlbk, 1, v_multiGroup)"
PL/pgSQL function "_rlbk_groups" line 20 at SQL statement
PL/pgSQL function "emaj_logged_rollback_group" line 11 at RETURN
-- attempt to rollback to a stop mark
begin;
  select emaj.emaj_stop_group('myGroup1');
 emaj_stop_group 
-----------------
               6
(1 row)

  select emaj.emaj_start_group('myGroup1','StartMark',false);
 emaj_start_group 
------------------
                6
(1 row)

  select emaj.emaj_rename_mark_group('myGroup1',(select emaj.emaj_get_previous_mark_group('myGroup1','StartMark')), 'GeneratedStopMark');
 emaj_rename_mark_group 
------------------------
 
(1 row)

  select emaj.emaj_rollback_group('myGroup1','GeneratedStopMark');
ERROR:  _rlbk_check: mark "GeneratedStopMark" for group "myGroup1" is not usable for rollback.
CONTEXT:  SQL statement "SELECT emaj._rlbk_check(v_groupNames, v_mark)"
PL/pgSQL function "_rlbk_init" line 24 at SQL statement
SQL statement "SELECT emaj._rlbk_init(v_groupNames, v_mark, v_isLoggedRlbk, 1, v_multiGroup)"
PL/pgSQL function "_rlbk_groups" line 20 at SQL statement
PL/pgSQL function "emaj_rollback_group" line 7 at RETURN
rollback;
-- attempt to rollback over protected marks
begin;
  select emaj.emaj_set_mark_group('myGroup1','Protected Mark 1');
 emaj_set_mark_group 
---------------------
                   6
(1 row)

  select emaj.emaj_protect_mark_group('myGroup1','Protected Mark 1');
 emaj_protect_mark_group 
-------------------------
                       1
(1 row)

  select emaj.emaj_set_mark_group('myGroup1','Protected Mark 2');
 emaj_set_mark_group 
---------------------
                   6
(1 row)

  select emaj.emaj_protect_mark_group('myGroup1','Protected Mark 2');
 emaj_protect_mark_group 
-------------------------
                       1
(1 row)

  select emaj.emaj_rollback_group('myGroup1','Mark11');
ERROR:  _rlbk_check: protected marks (Protected Mark 1, Protected Mark 2) for group "myGroup1" block the rollback to mark "Mark11".
CONTEXT:  SQL statement "SELECT emaj._rlbk_check(v_groupNames, v_mark)"
PL/pgSQL function "_rlbk_init" line 24 at SQL statement
SQL statement "SELECT emaj._rlbk_init(v_groupNames, v_mark, v_isLoggedRlbk, 1, v_multiGroup)"
PL/pgSQL function "_rlbk_groups" line 20 at SQL statement
PL/pgSQL function "emaj_rollback_group" line 7 at RETURN
rollback;
-- attempt to rollback several groups over one single-mark protected marks
begin;
  select emaj.emaj_set_mark_groups('{"myGroup1","myGroup2"}','Common Mark 1');
 emaj_set_mark_groups 
----------------------
                   14
(1 row)

  select emaj.emaj_set_mark_group('myGroup1','Protected Mark 1');
 emaj_set_mark_group 
---------------------
                   6
(1 row)

  select emaj.emaj_protect_mark_group('myGroup1','Protected Mark 1');
 emaj_protect_mark_group 
-------------------------
                       1
(1 row)

  select emaj.emaj_rollback_groups('{"myGroup1","myGroup2"}','Common Mark 1');
ERROR:  _rlbk_check: protected marks (Protected Mark 1) for group "myGroup1" block the rollback to mark "Common Mark 1".
CONTEXT:  SQL statement "SELECT emaj._rlbk_check(v_groupNames, v_mark)"
PL/pgSQL function "_rlbk_init" line 24 at SQL statement
SQL statement "SELECT emaj._rlbk_init(v_groupNames, v_mark, v_isLoggedRlbk, 1, v_multiGroup)"
PL/pgSQL function "_rlbk_groups" line 20 at SQL statement
PL/pgSQL function "emaj_rollback_groups" line 7 at RETURN
rollback;
-- attempt to logged-rollback over a protected mark
begin;
  select emaj.emaj_protect_mark_group('myGroup1','EMAJ_LAST_MARK');
 emaj_protect_mark_group 
-------------------------
                       1
(1 row)

  select emaj.emaj_logged_rollback_group('myGroup1','Mark11');
ERROR:  _rlbk_check: protected marks (Different_Mark) for group "myGroup1" block the rollback to mark "Mark11".
CONTEXT:  SQL statement "SELECT emaj._rlbk_check(v_groupNames, v_mark)"
PL/pgSQL function "_rlbk_init" line 24 at SQL statement
SQL statement "SELECT emaj._rlbk_init(v_groupNames, v_mark, v_isLoggedRlbk, 1, v_multiGroup)"
PL/pgSQL function "_rlbk_groups" line 20 at SQL statement
PL/pgSQL function "emaj_logged_rollback_group" line 11 at RETURN
rollback;
-- rollback to a protected mark
begin;
  select emaj.emaj_protect_mark_group('myGroup1','EMAJ_LAST_MARK');
 emaj_protect_mark_group 
-------------------------
                       1
(1 row)

  select emaj.emaj_rollback_group('myGroup1','EMAJ_LAST_MARK');
 emaj_rollback_group 
---------------------
                   1
(1 row)

rollback;
-- missing application table and mono-group rollback
begin;
  drop table mySchema2."myTbl3" cascade;
  select emaj.emaj_rollback_group('myGroup2','Mark21');
ERROR:  _verify_groups (1): In group "myGroup2", the table "myschema2"."myTbl3" does not exist any more. You may use "SELECT * FROM emaj.emaj_verify_all()" to look for other issues.
CONTEXT:  SQL statement "SELECT 0 FROM emaj._verify_groups(v_groupNames, true)"
PL/pgSQL function "_rlbk_init" line 26 at PERFORM
SQL statement "SELECT emaj._rlbk_init(v_groupNames, v_mark, v_isLoggedRlbk, 1, v_multiGroup)"
PL/pgSQL function "_rlbk_groups" line 20 at SQL statement
PL/pgSQL function "emaj_rollback_group" line 7 at RETURN
rollback;
begin;
  drop table mySchema2."myTbl3" cascade;
  select emaj.emaj_logged_rollback_group('myGroup2','Mark21');
ERROR:  _verify_groups (1): In group "myGroup2", the table "myschema2"."myTbl3" does not exist any more. You may use "SELECT * FROM emaj.emaj_verify_all()" to look for other issues.
CONTEXT:  SQL statement "SELECT 0 FROM emaj._verify_groups(v_groupNames, true)"
PL/pgSQL function "_rlbk_init" line 26 at PERFORM
SQL statement "SELECT emaj._rlbk_init(v_groupNames, v_mark, v_isLoggedRlbk, 1, v_multiGroup)"
PL/pgSQL function "_rlbk_groups" line 20 at SQL statement
PL/pgSQL function "emaj_logged_rollback_group" line 11 at RETURN
rollback;
-- internal error when the row corresponding to an application sequence to rollback is missing in emaj_sequence
begin;
  delete from emaj.emaj_sequence where sequ_schema = 'myschema2' and sequ_name = 'myseq1';
  select emaj.emaj_rollback_group('myGroup2','Mark21');
WARNING:  _check_fk_groups: Foreign key "mytbl6_col61_fkey", from table "myschema2.mytbl6", references "myschema2.mytbl7" that is outside groups (myGroup2).
CONTEXT:  SQL statement "SELECT emaj._check_fk_groups(v_groupNames)"
PL/pgSQL function "_rlbk_init" line 68 at PERFORM
SQL statement "SELECT emaj._rlbk_init(v_groupNames, v_mark, v_isLoggedRlbk, 1, v_multiGroup)"
PL/pgSQL function "_rlbk_groups" line 20 at SQL statement
PL/pgSQL function "emaj_rollback_group" line 7 at RETURN
WARNING:  _check_fk_groups: table "myschema2.mytbl6" is referenced by foreign key "mytbl8_col81_fkey" from table "myschema2.mytbl8" that is outside groups (myGroup2).
CONTEXT:  SQL statement "SELECT emaj._check_fk_groups(v_groupNames)"
PL/pgSQL function "_rlbk_init" line 68 at PERFORM
SQL statement "SELECT emaj._rlbk_init(v_groupNames, v_mark, v_isLoggedRlbk, 1, v_multiGroup)"
PL/pgSQL function "_rlbk_groups" line 20 at SQL statement
PL/pgSQL function "emaj_rollback_group" line 7 at RETURN
ERROR:  _rlbk_seq: Mark at time id "403" not found for sequence "myschema2.myseq1".
CONTEXT:  SQL statement "SELECT emaj._rlbk_seq(t.*, v_markTimeId)
      FROM (SELECT * FROM emaj.emaj_relation
              WHERE rel_group = ANY (v_groupNames) AND rel_kind = 'S'
              ORDER BY rel_priority, rel_schema, rel_tblseq) as t"
PL/pgSQL function "_rlbk_end" line 122 at PERFORM
SQL statement "SELECT emaj._rlbk_end(v_rlbkId, v_multiGroup)"
PL/pgSQL function "_rlbk_groups" line 28 at SQL statement
PL/pgSQL function "emaj_rollback_group" line 7 at RETURN
rollback;
-- should be OK, with different cases of dblink status
-- hide dblink_connect functions
alter function public.dblink_connect_u(text,text) rename to renamed_dblink_connect_u;
alter function public.dblink_connect_u(text) rename to renamed_dblink_connect_u;
select emaj.emaj_rollback_group('myGroup1','EMAJ_LAST_MARK');
 emaj_rollback_group 
---------------------
                   1
(1 row)

select emaj.emaj_rollback_group('myGroup2','Mark21');
WARNING:  _check_fk_groups: Foreign key "mytbl6_col61_fkey", from table "myschema2.mytbl6", references "myschema2.mytbl7" that is outside groups (myGroup2).
CONTEXT:  SQL statement "SELECT emaj._check_fk_groups(v_groupNames)"
PL/pgSQL function "_rlbk_init" line 68 at PERFORM
SQL statement "SELECT emaj._rlbk_init(v_groupNames, v_mark, v_isLoggedRlbk, 1, v_multiGroup)"
PL/pgSQL function "_rlbk_groups" line 20 at SQL statement
PL/pgSQL function "emaj_rollback_group" line 7 at RETURN
WARNING:  _check_fk_groups: table "myschema2.mytbl6" is referenced by foreign key "mytbl8_col81_fkey" from table "myschema2.mytbl8" that is outside groups (myGroup2).
CONTEXT:  SQL statement "SELECT emaj._check_fk_groups(v_groupNames)"
PL/pgSQL function "_rlbk_init" line 68 at PERFORM
SQL statement "SELECT emaj._rlbk_init(v_groupNames, v_mark, v_isLoggedRlbk, 1, v_multiGroup)"
PL/pgSQL function "_rlbk_groups" line 20 at SQL statement
PL/pgSQL function "emaj_rollback_group" line 7 at RETURN
 emaj_rollback_group 
---------------------
                   2
(1 row)

alter function public.renamed_dblink_connect_u(text,text) rename to dblink_connect_u;
alter function public.renamed_dblink_connect_u(text) rename to dblink_connect_u;
-- dblink_connect not in path
set search_path='emaj';
select emaj.emaj_logged_rollback_group('myGroup1','EMAJ_LAST_MARK');
 emaj_logged_rollback_group 
----------------------------
                          1
(1 row)

select emaj.emaj_logged_rollback_group('myGroup2','Mark21');
WARNING:  _check_fk_groups: Foreign key "mytbl6_col61_fkey", from table "myschema2.mytbl6", references "myschema2.mytbl7" that is outside groups (myGroup2).
CONTEXT:  SQL statement "SELECT emaj._check_fk_groups(v_groupNames)"
PL/pgSQL function "_rlbk_init" line 68 at PERFORM
SQL statement "SELECT emaj._rlbk_init(v_groupNames, v_mark, v_isLoggedRlbk, 1, v_multiGroup)"
PL/pgSQL function "_rlbk_groups" line 20 at SQL statement
PL/pgSQL function "emaj_logged_rollback_group" line 11 at RETURN
WARNING:  _check_fk_groups: table "myschema2.mytbl6" is referenced by foreign key "mytbl8_col81_fkey" from table "myschema2.mytbl8" that is outside groups (myGroup2).
CONTEXT:  SQL statement "SELECT emaj._check_fk_groups(v_groupNames)"
PL/pgSQL function "_rlbk_init" line 68 at PERFORM
SQL statement "SELECT emaj._rlbk_init(v_groupNames, v_mark, v_isLoggedRlbk, 1, v_multiGroup)"
PL/pgSQL function "_rlbk_groups" line 20 at SQL statement
PL/pgSQL function "emaj_logged_rollback_group" line 11 at RETURN
 emaj_logged_rollback_group 
----------------------------
                          2
(1 row)

reset search_path;
select emaj.emaj_set_mark_groups('{"myGroup1","myGroup2"}','Mark1B');
 emaj_set_mark_groups 
----------------------
                   14
(1 row)

-- no user/password defined in emaj_param
select emaj.emaj_rollback_groups('{"myGroup1","myGroup2"}','EMAJ_LAST_MARK');
WARNING:  _check_fk_groups: Foreign key "mytbl6_col61_fkey", from table "myschema2.mytbl6", references "myschema2.mytbl7" that is outside groups (myGroup1,myGroup2).
CONTEXT:  SQL statement "SELECT emaj._check_fk_groups(v_groupNames)"
PL/pgSQL function "_rlbk_init" line 68 at PERFORM
SQL statement "SELECT emaj._rlbk_init(v_groupNames, v_mark, v_isLoggedRlbk, 1, v_multiGroup)"
PL/pgSQL function "_rlbk_groups" line 20 at SQL statement
PL/pgSQL function "emaj_rollback_groups" line 7 at RETURN
WARNING:  _check_fk_groups: table "myschema2.mytbl6" is referenced by foreign key "mytbl8_col81_fkey" from table "myschema2.mytbl8" that is outside groups (myGroup1,myGroup2).
CONTEXT:  SQL statement "SELECT emaj._check_fk_groups(v_groupNames)"
PL/pgSQL function "_rlbk_init" line 68 at PERFORM
SQL statement "SELECT emaj._rlbk_init(v_groupNames, v_mark, v_isLoggedRlbk, 1, v_multiGroup)"
PL/pgSQL function "_rlbk_groups" line 20 at SQL statement
PL/pgSQL function "emaj_rollback_groups" line 7 at RETURN
 emaj_rollback_groups 
----------------------
                    3
(1 row)

-- bad user/password defined in emaj_param
insert into emaj.emaj_param (param_key, param_value_text) 
  values ('dblink_user_password','user=<user> password=<password>');
select emaj.emaj_rollback_groups('{"myGroup1","myGroup2"}','Mark1B');
WARNING:  _check_fk_groups: Foreign key "mytbl6_col61_fkey", from table "myschema2.mytbl6", references "myschema2.mytbl7" that is outside groups (myGroup1,myGroup2).
CONTEXT:  SQL statement "SELECT emaj._check_fk_groups(v_groupNames)"
PL/pgSQL function "_rlbk_init" line 68 at PERFORM
SQL statement "SELECT emaj._rlbk_init(v_groupNames, v_mark, v_isLoggedRlbk, 1, v_multiGroup)"
PL/pgSQL function "_rlbk_groups" line 20 at SQL statement
PL/pgSQL function "emaj_rollback_groups" line 7 at RETURN
WARNING:  _check_fk_groups: table "myschema2.mytbl6" is referenced by foreign key "mytbl8_col81_fkey" from table "myschema2.mytbl8" that is outside groups (myGroup1,myGroup2).
CONTEXT:  SQL statement "SELECT emaj._check_fk_groups(v_groupNames)"
PL/pgSQL function "_rlbk_init" line 68 at PERFORM
SQL statement "SELECT emaj._rlbk_init(v_groupNames, v_mark, v_isLoggedRlbk, 1, v_multiGroup)"
PL/pgSQL function "_rlbk_groups" line 20 at SQL statement
PL/pgSQL function "emaj_rollback_groups" line 7 at RETURN
 emaj_rollback_groups 
----------------------
                    3
(1 row)

-- transaction not in READ COMMITTED isolation level => the dblink connection is not possible
begin;
  set transaction isolation level repeatable read;
  select emaj.emaj_logged_rollback_groups('{"myGroup1","myGroup2"}','EMAJ_LAST_MARK');
WARNING:  _check_fk_groups: Foreign key "mytbl6_col61_fkey", from table "myschema2.mytbl6", references "myschema2.mytbl7" that is outside groups (myGroup1,myGroup2).
CONTEXT:  SQL statement "SELECT emaj._check_fk_groups(v_groupNames)"
PL/pgSQL function "_rlbk_init" line 68 at PERFORM
SQL statement "SELECT emaj._rlbk_init(v_groupNames, v_mark, v_isLoggedRlbk, 1, v_multiGroup)"
PL/pgSQL function "_rlbk_groups" line 20 at SQL statement
PL/pgSQL function "emaj_logged_rollback_groups" line 11 at RETURN
WARNING:  _check_fk_groups: table "myschema2.mytbl6" is referenced by foreign key "mytbl8_col81_fkey" from table "myschema2.mytbl8" that is outside groups (myGroup1,myGroup2).
CONTEXT:  SQL statement "SELECT emaj._check_fk_groups(v_groupNames)"
PL/pgSQL function "_rlbk_init" line 68 at PERFORM
SQL statement "SELECT emaj._rlbk_init(v_groupNames, v_mark, v_isLoggedRlbk, 1, v_multiGroup)"
PL/pgSQL function "_rlbk_groups" line 20 at SQL statement
PL/pgSQL function "emaj_logged_rollback_groups" line 11 at RETURN
 emaj_logged_rollback_groups 
-----------------------------
                           3
(1 row)

commit;
-- dblink connection should now be ok (missing right on dblink functions is tested in adm1.sql)
update emaj.emaj_param set param_value_text = 'user=postgres password=postgres' 
  where param_key = 'dblink_user_password';
select emaj.emaj_logged_rollback_groups('{"myGroup1","myGroup2"}','Mark1B');
WARNING:  _check_fk_groups: Foreign key "mytbl6_col61_fkey", from table "myschema2.mytbl6", references "myschema2.mytbl7" that is outside groups (myGroup1,myGroup2).
CONTEXT:  SQL statement "SELECT emaj._check_fk_groups(v_groupNames)"
PL/pgSQL function "_rlbk_init" line 68 at PERFORM
SQL statement "SELECT emaj._rlbk_init(v_groupNames, v_mark, v_isLoggedRlbk, 1, v_multiGroup)"
PL/pgSQL function "_rlbk_groups" line 20 at SQL statement
PL/pgSQL function "emaj_logged_rollback_groups" line 11 at RETURN
WARNING:  _check_fk_groups: table "myschema2.mytbl6" is referenced by foreign key "mytbl8_col81_fkey" from table "myschema2.mytbl8" that is outside groups (myGroup1,myGroup2).
CONTEXT:  SQL statement "SELECT emaj._check_fk_groups(v_groupNames)"
PL/pgSQL function "_rlbk_init" line 68 at PERFORM
SQL statement "SELECT emaj._rlbk_init(v_groupNames, v_mark, v_isLoggedRlbk, 1, v_multiGroup)"
PL/pgSQL function "_rlbk_groups" line 20 at SQL statement
PL/pgSQL function "emaj_logged_rollback_groups" line 11 at RETURN
 emaj_logged_rollback_groups 
-----------------------------
                           3
(1 row)

-- missing application table and multi-groups rollback
begin;
  drop table mySchema2."myTbl3" cascade;
  select emaj.emaj_rollback_groups('{"myGroup1","myGroup2"}','Mark1B');
ERROR:  _verify_groups (1): In group "myGroup2", the table "myschema2"."myTbl3" does not exist any more. You may use "SELECT * FROM emaj.emaj_verify_all()" to look for other issues.
CONTEXT:  SQL statement "SELECT 0 FROM emaj._verify_groups(v_groupNames, true)"
PL/pgSQL function "_rlbk_init" line 26 at PERFORM
SQL statement "SELECT emaj._rlbk_init(v_groupNames, v_mark, v_isLoggedRlbk, 1, v_multiGroup)"
PL/pgSQL function "_rlbk_groups" line 20 at SQL statement
PL/pgSQL function "emaj_rollback_groups" line 7 at RETURN
rollback;
begin;
  drop table mySchema2."myTbl3" cascade;
  select emaj.emaj_logged_rollback_groups('{"myGroup1","myGroup2"}','Mark1B');
ERROR:  _verify_groups (1): In group "myGroup2", the table "myschema2"."myTbl3" does not exist any more. You may use "SELECT * FROM emaj.emaj_verify_all()" to look for other issues.
CONTEXT:  SQL statement "SELECT 0 FROM emaj._verify_groups(v_groupNames, true)"
PL/pgSQL function "_rlbk_init" line 26 at PERFORM
SQL statement "SELECT emaj._rlbk_init(v_groupNames, v_mark, v_isLoggedRlbk, 1, v_multiGroup)"
PL/pgSQL function "_rlbk_groups" line 20 at SQL statement
PL/pgSQL function "emaj_logged_rollback_groups" line 11 at RETURN
rollback;
-- restart groups
select emaj.emaj_stop_groups('{"myGroup1","myGroup2"}');
 emaj_stop_groups 
------------------
               14
(1 row)

select emaj.emaj_start_group('myGroup1','Mark11');
 emaj_start_group 
------------------
                6
(1 row)

select emaj.emaj_start_group('myGroup2','Mark21');
WARNING:  _check_fk_groups: Foreign key "mytbl6_col61_fkey", from table "myschema2.mytbl6", references "myschema2.mytbl7" that is outside groups (myGroup2).
CONTEXT:  SQL statement "SELECT emaj._check_fk_groups(v_groupNames)"
PL/pgSQL function "_start_groups" line 36 at PERFORM
SQL statement "SELECT emaj._start_groups(array[v_groupName], v_mark, false, v_resetLog)"
PL/pgSQL function "emaj_start_group" line 17 at SQL statement
WARNING:  _check_fk_groups: table "myschema2.mytbl6" is referenced by foreign key "mytbl8_col81_fkey" from table "myschema2.mytbl8" that is outside groups (myGroup2).
CONTEXT:  SQL statement "SELECT emaj._check_fk_groups(v_groupNames)"
PL/pgSQL function "_start_groups" line 36 at PERFORM
SQL statement "SELECT emaj._start_groups(array[v_groupName], v_mark, false, v_resetLog)"
PL/pgSQL function "emaj_start_group" line 17 at SQL statement
 emaj_start_group 
------------------
                8
(1 row)

-----------------------------
-- log phase #1 with 2 unlogged rollbacks
-----------------------------
-- Populate application tables
set search_path=public,myschema1;
-- inserts/updates/deletes in myTbl1, myTbl2 and myTbl2b (via trigger)
insert into myTbl1 select i, 'ABC', E'\\014'::bytea from generate_series (1,11) as i;
begin transaction;
  update myTbl1 set col13=E'\\034'::bytea where col11 <= 3;
  insert into myTbl2 values (1,'ABC',current_date);
commit;
delete from myTbl1 where col11 > 10;
insert into myTbl2 values (2,'DEF',NULL);
insert into myTbl2 values (3,'GHI',NULL);
update myTbl2 set col22 = NULL WHERE col23 IS NULL;
delete from myTbl2 where col21 = 3 and col22 is NULL;
select count(*) from mytbl1;
 count 
-------
    10
(1 row)

select count(*) from mytbl2;
 count 
-------
     2
(1 row)

select count(*) from mytbl2b;
 count 
-------
     6
(1 row)

select count(*) from "myTbl3";
 count 
-------
     0
(1 row)

select count(*) from myTbl4;
 count 
-------
     0
(1 row)

-- set a mark
select emaj.emaj_set_mark_group('myGroup1','Mark12');
 emaj_set_mark_group 
---------------------
                   6
(1 row)

select mark_id, mark_group, regexp_replace(mark_name,E'\\d\\d\.\\d\\d\\.\\d\\d\\.\\d\\d\\d','%','g'), mark_time_id, mark_is_deleted, mark_is_rlbk_protected, mark_comment, mark_log_rows_before_next, mark_logged_rlbk_target_mark from emaj.emaj_mark order by mark_id;
 mark_id |    mark_group    | regexp_replace | mark_time_id | mark_is_deleted | mark_is_rlbk_protected | mark_comment | mark_log_rows_before_next | mark_logged_rlbk_target_mark 
---------+------------------+----------------+--------------+-----------------+------------------------+--------------+---------------------------+------------------------------
     302 | emptyGroup       | MarkInit       |          302 | f               | f                      |              |                           | 
     321 | phil's group#3", | Mark4          |          316 | f               | f                      |              |                           | 
     429 | myGroup1         | Mark11         |          429 | f               | f                      |              |                        27 | 
     430 | myGroup2         | Mark21         |          430 | f               | f                      |              |                           | 
     431 | myGroup1         | Mark12         |          431 | f               | f                      |              |                           | 
(5 rows)

select sequ_schema, sequ_name, sequ_time_id, sequ_last_val, sequ_is_called from emaj.emaj_sequence order by sequ_time_id, sequ_schema, sequ_name;
  sequ_schema   |             sequ_name              | sequ_time_id | sequ_last_val | sequ_is_called 
----------------+------------------------------------+--------------+---------------+----------------
 emaj           | phil's schema3_myTbl2\_log_seq     |          316 |             1 | f
 emaj #'3       | phil's schema3_phil's tbl1_log_seq |          316 |             1 | f
 phil's schema3 | myTbl2\_col21_seq                  |          316 |             1 | f
 phil's schema3 | phil's seq\1                       |          316 |          1000 | f
 emaj           | myschema1_mytbl1_log_seq           |          429 |             1 | f
 emaj           | myschema1_mytbl2_log_seq           |          429 |             1 | f
 emaj           | myschema1_mytbl4_log_seq           |          429 |             1 | f
 emajb          | myschema1_mytbl2b_log_seq          |          429 |             1 | f
 emajC          | myschema1_myTbl3_log_seq           |          429 |             1 | f
 myschema1      | myTbl3_col31_seq                   |          429 |             1 | f
 emaj           | myschema2_mytbl1_log_seq           |          430 |             1 | f
 emaj           | myschema2_mytbl2_log_seq           |          430 |             1 | f
 emaj           | myschema2_mytbl4_log_seq           |          430 |             1 | f
 emaj           | myschema2_mytbl6_log_seq           |          430 |             1 | f
 emaj           | otherPrefix4mytbl5_log_seq         |          430 |             1 | f
 emajC          | myschema2_myTbl3_log_seq           |          430 |             1 | f
 myschema2      | myseq1                             |          430 |          1000 | f
 myschema2      | myTbl3_col31_seq                   |          430 |             1 | f
 emaj           | myschema1_mytbl1_log_seq           |          431 |            15 | t
 emaj           | myschema1_mytbl2_log_seq           |          431 |             6 | t
 emaj           | myschema1_mytbl4_log_seq           |          431 |             1 | f
 emajb          | myschema1_mytbl2b_log_seq          |          431 |             6 | t
 emajC          | myschema1_myTbl3_log_seq           |          431 |             1 | f
 myschema1      | myTbl3_col31_seq                   |          431 |             1 | f
(24 rows)

-- inserts/updates/deletes in myTbl3 and myTbl4
insert into "myTbl3" (col33) select generate_series(1000,1039,4)/100;
insert into myTbl4 values (1,'FK...',1,1,'ABC');
update myTbl4 set col43 = NULL where col41 = 1;
select count(*) from "myTbl3";
 count 
-------
    10
(1 row)

select count(*) from myTbl4;
 count 
-------
     1
(1 row)

-- set a mark
select emaj.emaj_set_mark_group('myGroup1','Mark13');
 emaj_set_mark_group 
---------------------
                   6
(1 row)

select mark_id, mark_group, regexp_replace(mark_name,E'\\d\\d\.\\d\\d\\.\\d\\d\\.\\d\\d\\d','%','g'), mark_time_id, mark_is_deleted, mark_is_rlbk_protected, mark_comment, mark_log_rows_before_next, mark_logged_rlbk_target_mark from emaj.emaj_mark order by mark_id;
 mark_id |    mark_group    | regexp_replace | mark_time_id | mark_is_deleted | mark_is_rlbk_protected | mark_comment | mark_log_rows_before_next | mark_logged_rlbk_target_mark 
---------+------------------+----------------+--------------+-----------------+------------------------+--------------+---------------------------+------------------------------
     302 | emptyGroup       | MarkInit       |          302 | f               | f                      |              |                           | 
     321 | phil's group#3", | Mark4          |          316 | f               | f                      |              |                           | 
     429 | myGroup1         | Mark11         |          429 | f               | f                      |              |                        27 | 
     430 | myGroup2         | Mark21         |          430 | f               | f                      |              |                           | 
     431 | myGroup1         | Mark12         |          431 | f               | f                      |              |                        12 | 
     432 | myGroup1         | Mark13         |          432 | f               | f                      |              |                           | 
(6 rows)

select sequ_schema, sequ_name, sequ_time_id, sequ_last_val, sequ_is_called from emaj.emaj_sequence order by sequ_time_id, sequ_schema, sequ_name;
  sequ_schema   |             sequ_name              | sequ_time_id | sequ_last_val | sequ_is_called 
----------------+------------------------------------+--------------+---------------+----------------
 emaj           | phil's schema3_myTbl2\_log_seq     |          316 |             1 | f
 emaj #'3       | phil's schema3_phil's tbl1_log_seq |          316 |             1 | f
 phil's schema3 | myTbl2\_col21_seq                  |          316 |             1 | f
 phil's schema3 | phil's seq\1                       |          316 |          1000 | f
 emaj           | myschema1_mytbl1_log_seq           |          429 |             1 | f
 emaj           | myschema1_mytbl2_log_seq           |          429 |             1 | f
 emaj           | myschema1_mytbl4_log_seq           |          429 |             1 | f
 emajb          | myschema1_mytbl2b_log_seq          |          429 |             1 | f
 emajC          | myschema1_myTbl3_log_seq           |          429 |             1 | f
 myschema1      | myTbl3_col31_seq                   |          429 |             1 | f
 emaj           | myschema2_mytbl1_log_seq           |          430 |             1 | f
 emaj           | myschema2_mytbl2_log_seq           |          430 |             1 | f
 emaj           | myschema2_mytbl4_log_seq           |          430 |             1 | f
 emaj           | myschema2_mytbl6_log_seq           |          430 |             1 | f
 emaj           | otherPrefix4mytbl5_log_seq         |          430 |             1 | f
 emajC          | myschema2_myTbl3_log_seq           |          430 |             1 | f
 myschema2      | myseq1                             |          430 |          1000 | f
 myschema2      | myTbl3_col31_seq                   |          430 |             1 | f
 emaj           | myschema1_mytbl1_log_seq           |          431 |            15 | t
 emaj           | myschema1_mytbl2_log_seq           |          431 |             6 | t
 emaj           | myschema1_mytbl4_log_seq           |          431 |             1 | f
 emajb          | myschema1_mytbl2b_log_seq          |          431 |             6 | t
 emajC          | myschema1_myTbl3_log_seq           |          431 |             1 | f
 myschema1      | myTbl3_col31_seq                   |          431 |             1 | f
 emaj           | myschema1_mytbl1_log_seq           |          432 |            15 | t
 emaj           | myschema1_mytbl2_log_seq           |          432 |             6 | t
 emaj           | myschema1_mytbl4_log_seq           |          432 |             2 | t
 emajb          | myschema1_mytbl2b_log_seq          |          432 |             6 | t
 emajC          | myschema1_myTbl3_log_seq           |          432 |            10 | t
 myschema1      | myTbl3_col31_seq                   |          432 |            10 | t
(30 rows)

select col11, col12, col13, emaj_verb, emaj_tuple, emaj_gid from emaj.myschema1_mytbl1_log order by emaj_gid, emaj_tuple desc;
 col11 |   col12    | col13 | emaj_verb | emaj_tuple | emaj_gid 
-------+------------+-------+-----------+------------+----------
     1 | ABC        | \x0c  | INS       | NEW        |        3
     2 | ABC        | \x0c  | INS       | NEW        |        4
     3 | ABC        | \x0c  | INS       | NEW        |        5
     4 | ABC        | \x0c  | INS       | NEW        |        6
     5 | ABC        | \x0c  | INS       | NEW        |        7
     6 | ABC        | \x0c  | INS       | NEW        |        8
     7 | ABC        | \x0c  | INS       | NEW        |        9
     8 | ABC        | \x0c  | INS       | NEW        |       10
     9 | ABC        | \x0c  | INS       | NEW        |       11
    10 | ABC        | \x0c  | INS       | NEW        |       12
    11 | ABC        | \x0c  | INS       | NEW        |       13
     1 | ABC        | \x0c  | UPD       | OLD        |       14
     1 | ABC        | \x1c  | UPD       | NEW        |       14
     2 | ABC        | \x0c  | UPD       | OLD        |       15
     2 | ABC        | \x1c  | UPD       | NEW        |       15
     3 | ABC        | \x0c  | UPD       | OLD        |       16
     3 | ABC        | \x1c  | UPD       | NEW        |       16
    11 | ABC        | \x0c  | DEL       | OLD        |       19
(18 rows)

select col21, col22, emaj_verb, emaj_tuple, emaj_gid from emaj.myschema1_mytbl2_log order by emaj_gid, emaj_tuple desc;
 col21 | col22 | emaj_verb | emaj_tuple | emaj_gid 
-------+-------+-----------+------------+----------
     1 | ABC   | INS       | NEW        |       17
     2 | DEF   | INS       | NEW        |       20
     3 | GHI   | INS       | NEW        |       22
     2 | DEF   | UPD       | OLD        |       24
     2 |       | UPD       | NEW        |       24
     3 | GHI   | UPD       | OLD        |       26
     3 |       | UPD       | NEW        |       26
     3 |       | DEL       | OLD        |       28
(8 rows)

select col20, col21, emaj_verb, emaj_tuple, emaj_gid from emajb.myschema1_mytbl2b_log order by emaj_gid, emaj_tuple desc;
 col20 | col21 | emaj_verb | emaj_tuple | emaj_gid 
-------+-------+-----------+------------+----------
     1 |     1 | INS       | NEW        |       18
     2 |     2 | INS       | NEW        |       21
     3 |     3 | INS       | NEW        |       23
     4 |     2 | INS       | NEW        |       25
     5 |     3 | INS       | NEW        |       27
     6 |     3 | INS       | NEW        |       29
(6 rows)

select col31, col33, emaj_verb, emaj_tuple, emaj_gid from "emajC"."myschema1_myTbl3_log" order by emaj_gid, emaj_tuple desc;
 col31 | col33 | emaj_verb | emaj_tuple | emaj_gid 
-------+-------+-----------+------------+----------
     1 | 10.00 | INS       | NEW        |       30
     2 | 10.00 | INS       | NEW        |       31
     3 | 10.00 | INS       | NEW        |       32
     4 | 10.00 | INS       | NEW        |       33
     5 | 10.00 | INS       | NEW        |       34
     6 | 10.00 | INS       | NEW        |       35
     7 | 10.00 | INS       | NEW        |       36
     8 | 10.00 | INS       | NEW        |       37
     9 | 10.00 | INS       | NEW        |       38
    10 | 10.00 | INS       | NEW        |       39
(10 rows)

select col41, col42, col43, col44, col45, emaj_verb, emaj_tuple, emaj_gid from emaj.myschema1_myTbl4_log order by emaj_gid, emaj_tuple desc;
 col41 | col42 | col43 | col44 |   col45    | emaj_verb | emaj_tuple | emaj_gid 
-------+-------+-------+-------+------------+-----------+------------+----------
     1 | FK... |     1 |     1 | ABC        | INS       | NEW        |       40
     1 | FK... |     1 |     1 | ABC        | UPD       | OLD        |       41
     1 | FK... |       |     1 | ABC        | UPD       | NEW        |       41
(3 rows)

-- rollback #1
alter table mySchema1.myTbl2 disable trigger myTbl2trg;
select emaj.emaj_rollback_group('myGroup1','Mark12');
 emaj_rollback_group 
---------------------
                   3
(1 row)

alter table mySchema1.myTbl2 enable trigger myTbl2trg;
-- check impact
select mark_id, mark_group, regexp_replace(mark_name,E'\\d\\d\.\\d\\d\\.\\d\\d\\.\\d\\d\\d','%','g'), mark_time_id, mark_is_deleted, mark_is_rlbk_protected, mark_comment, mark_log_rows_before_next, mark_logged_rlbk_target_mark from emaj.emaj_mark order by mark_id;
 mark_id |    mark_group    | regexp_replace | mark_time_id | mark_is_deleted | mark_is_rlbk_protected | mark_comment | mark_log_rows_before_next | mark_logged_rlbk_target_mark 
---------+------------------+----------------+--------------+-----------------+------------------------+--------------+---------------------------+------------------------------
     302 | emptyGroup       | MarkInit       |          302 | f               | f                      |              |                           | 
     321 | phil's group#3", | Mark4          |          316 | f               | f                      |              |                           | 
     429 | myGroup1         | Mark11         |          429 | f               | f                      |              |                        27 | 
     430 | myGroup2         | Mark21         |          430 | f               | f                      |              |                           | 
     431 | myGroup1         | Mark12         |          431 | f               | f                      |              |                           | 
(5 rows)

select sequ_schema, sequ_name, sequ_time_id, sequ_last_val, sequ_is_called from emaj.emaj_sequence order by sequ_time_id, sequ_schema, sequ_name;
  sequ_schema   |             sequ_name              | sequ_time_id | sequ_last_val | sequ_is_called 
----------------+------------------------------------+--------------+---------------+----------------
 emaj           | phil's schema3_myTbl2\_log_seq     |          316 |             1 | f
 emaj #'3       | phil's schema3_phil's tbl1_log_seq |          316 |             1 | f
 phil's schema3 | myTbl2\_col21_seq                  |          316 |             1 | f
 phil's schema3 | phil's seq\1                       |          316 |          1000 | f
 emaj           | myschema1_mytbl1_log_seq           |          429 |             1 | f
 emaj           | myschema1_mytbl2_log_seq           |          429 |             1 | f
 emaj           | myschema1_mytbl4_log_seq           |          429 |             1 | f
 emajb          | myschema1_mytbl2b_log_seq          |          429 |             1 | f
 emajC          | myschema1_myTbl3_log_seq           |          429 |             1 | f
 myschema1      | myTbl3_col31_seq                   |          429 |             1 | f
 emaj           | myschema2_mytbl1_log_seq           |          430 |             1 | f
 emaj           | myschema2_mytbl2_log_seq           |          430 |             1 | f
 emaj           | myschema2_mytbl4_log_seq           |          430 |             1 | f
 emaj           | myschema2_mytbl6_log_seq           |          430 |             1 | f
 emaj           | otherPrefix4mytbl5_log_seq         |          430 |             1 | f
 emajC          | myschema2_myTbl3_log_seq           |          430 |             1 | f
 myschema2      | myseq1                             |          430 |          1000 | f
 myschema2      | myTbl3_col31_seq                   |          430 |             1 | f
 emaj           | myschema1_mytbl1_log_seq           |          431 |            15 | t
 emaj           | myschema1_mytbl2_log_seq           |          431 |             6 | t
 emaj           | myschema1_mytbl4_log_seq           |          431 |             1 | f
 emajb          | myschema1_mytbl2b_log_seq          |          431 |             6 | t
 emajC          | myschema1_myTbl3_log_seq           |          431 |             1 | f
 myschema1      | myTbl3_col31_seq                   |          431 |             1 | f
(24 rows)

select sqhl_schema, sqhl_table, sqhl_begin_time_id, sqhl_end_time_id, sqhl_hole_size from emaj.emaj_seq_hole order by 1,2,3;
 sqhl_schema | sqhl_table | sqhl_begin_time_id | sqhl_end_time_id | sqhl_hole_size 
-------------+------------+--------------------+------------------+----------------
 myschema1   | myTbl3     |                431 |              433 |             10
 myschema1   | mytbl4     |                431 |              433 |              2
(2 rows)

select col31, col33, emaj_verb, emaj_tuple, emaj_gid from "emajC"."myschema1_myTbl3_log" order by emaj_gid, emaj_tuple desc;
 col31 | col33 | emaj_verb | emaj_tuple | emaj_gid 
-------+-------+-----------+------------+----------
(0 rows)

select col41, col42, col43, col44, col45, emaj_verb, emaj_tuple, emaj_gid from emaj.myschema1_myTbl4_log order by emaj_gid, emaj_tuple desc;
 col41 | col42 | col43 | col44 | col45 | emaj_verb | emaj_tuple | emaj_gid 
-------+-------+-------+-------+-------+-----------+------------+----------
(0 rows)

select col31, col33 from myschema1."myTbl3" order by col31;
 col31 | col33 
-------+-------
(0 rows)

select col41, col42, col43, col44, col45 from myschema1.myTbl4 order by col41;
 col41 | col42 | col43 | col44 | col45 
-------+-------+-------+-------+-------
(0 rows)

-- rollback #2 (and stop)
alter table mySchema1.myTbl2 disable trigger myTbl2trg;
select emaj.emaj_rollback_group('myGroup1','Mark11');
 emaj_rollback_group 
---------------------
                   4
(1 row)

alter table mySchema1.myTbl2 enable trigger myTbl2trg;
select emaj.emaj_stop_group('myGroup1');
 emaj_stop_group 
-----------------
               6
(1 row)

-- check impact
select mark_id, mark_group, regexp_replace(mark_name,E'\\d\\d\.\\d\\d\\.\\d\\d\\.\\d\\d\\d','%','g'), mark_time_id, mark_is_deleted, mark_is_rlbk_protected, mark_comment, mark_log_rows_before_next, mark_logged_rlbk_target_mark from emaj.emaj_mark order by mark_id;
 mark_id |    mark_group    | regexp_replace | mark_time_id | mark_is_deleted | mark_is_rlbk_protected | mark_comment | mark_log_rows_before_next | mark_logged_rlbk_target_mark 
---------+------------------+----------------+--------------+-----------------+------------------------+--------------+---------------------------+------------------------------
     302 | emptyGroup       | MarkInit       |          302 | f               | f                      |              |                           | 
     321 | phil's group#3", | Mark4          |          316 | f               | f                      |              |                           | 
     429 | myGroup1         | Mark11         |          429 | t               | f                      |              |                         0 | 
     430 | myGroup2         | Mark21         |          430 | f               | f                      |              |                           | 
     433 | myGroup1         | STOP_%         |          435 | t               | f                      |              |                         0 | 
(5 rows)

select sequ_schema, sequ_name, sequ_time_id, sequ_last_val, sequ_is_called from emaj.emaj_sequence order by sequ_time_id, sequ_schema, sequ_name;
  sequ_schema   |             sequ_name              | sequ_time_id | sequ_last_val | sequ_is_called 
----------------+------------------------------------+--------------+---------------+----------------
 emaj           | phil's schema3_myTbl2\_log_seq     |          316 |             1 | f
 emaj #'3       | phil's schema3_phil's tbl1_log_seq |          316 |             1 | f
 phil's schema3 | myTbl2\_col21_seq                  |          316 |             1 | f
 phil's schema3 | phil's seq\1                       |          316 |          1000 | f
 emaj           | myschema1_mytbl1_log_seq           |          429 |             1 | f
 emaj           | myschema1_mytbl2_log_seq           |          429 |             1 | f
 emaj           | myschema1_mytbl4_log_seq           |          429 |             1 | f
 emajb          | myschema1_mytbl2b_log_seq          |          429 |             1 | f
 emajC          | myschema1_myTbl3_log_seq           |          429 |             1 | f
 myschema1      | myTbl3_col31_seq                   |          429 |             1 | f
 emaj           | myschema2_mytbl1_log_seq           |          430 |             1 | f
 emaj           | myschema2_mytbl2_log_seq           |          430 |             1 | f
 emaj           | myschema2_mytbl4_log_seq           |          430 |             1 | f
 emaj           | myschema2_mytbl6_log_seq           |          430 |             1 | f
 emaj           | otherPrefix4mytbl5_log_seq         |          430 |             1 | f
 emajC          | myschema2_myTbl3_log_seq           |          430 |             1 | f
 myschema2      | myseq1                             |          430 |          1000 | f
 myschema2      | myTbl3_col31_seq                   |          430 |             1 | f
 emaj           | myschema1_mytbl1_log_seq           |          435 |            15 | t
 emaj           | myschema1_mytbl2_log_seq           |          435 |             6 | t
 emaj           | myschema1_mytbl4_log_seq           |          435 |             2 | t
 emajb          | myschema1_mytbl2b_log_seq          |          435 |             6 | t
 emajC          | myschema1_myTbl3_log_seq           |          435 |            10 | t
 myschema1      | myTbl3_col31_seq                   |          435 |             1 | f
(24 rows)

select sqhl_schema, sqhl_table, sqhl_begin_time_id, sqhl_end_time_id, sqhl_hole_size from emaj.emaj_seq_hole order by 1,2,3;
 sqhl_schema | sqhl_table | sqhl_begin_time_id | sqhl_end_time_id | sqhl_hole_size 
-------------+------------+--------------------+------------------+----------------
 myschema1   | mytbl1     |                429 |              434 |             15
 myschema1   | mytbl2     |                429 |              434 |              6
 myschema1   | mytbl2b    |                429 |              434 |              6
 myschema1   | myTbl3     |                431 |              433 |             10
 myschema1   | mytbl4     |                431 |              433 |              2
(5 rows)

select col11, col12, col13, emaj_verb, emaj_tuple, emaj_gid from emaj.myschema1_myTbl1_log order by emaj_gid, emaj_tuple desc;
 col11 | col12 | col13 | emaj_verb | emaj_tuple | emaj_gid 
-------+-------+-------+-----------+------------+----------
(0 rows)

select col21, col22, emaj_verb, emaj_tuple, emaj_gid from emaj.myschema1_myTbl2_log order by emaj_gid, emaj_tuple desc;
 col21 | col22 | emaj_verb | emaj_tuple | emaj_gid 
-------+-------+-----------+------------+----------
(0 rows)

select col20, col21, emaj_verb, emaj_tuple, emaj_gid from emajb.myschema1_myTbl2b_log order by emaj_gid, emaj_tuple desc;
 col20 | col21 | emaj_verb | emaj_tuple | emaj_gid 
-------+-------+-----------+------------+----------
(0 rows)

select col11, col12, col13 from myschema1.myTbl1 order by col11, col12;
 col11 | col12 | col13 
-------+-------+-------
(0 rows)

select col21, col22 from myschema1.myTbl2 order by col21;
 col21 | col22 
-------+-------
(0 rows)

select col20, col21 from myschema1.myTbl2b order by col20;
 col20 | col21 
-------+-------
(0 rows)

-- restart group
select emaj.emaj_start_group('myGroup1','Mark11');
 emaj_start_group 
------------------
                6
(1 row)

-- check the logs are empty again
select count(*) from emaj.myschema1_mytbl1_log;
 count 
-------
     0
(1 row)

select count(*) from emaj.myschema1_mytbl2_log;
 count 
-------
     0
(1 row)

select count(*) from emajb.myschema1_mytbl2b_log;
 count 
-------
     0
(1 row)

select count(*) from "emajC"."myschema1_myTbl3_log";
 count 
-------
     0
(1 row)

select count(*) from emaj.myschema1_mytbl4_log;
 count 
-------
     0
(1 row)

-----------------------------
-- log phase #2 with 2 logged rollbacks
-----------------------------
-- Populate application tables
set search_path=public,myschema1;
-- inserts/updates/deletes in myTbl1, myTbl2 and myTbl2b (via trigger)
insert into myTbl1 select i, 'ABC', E'\\014'::bytea from generate_series (1,11) as i;
begin transaction;
  update myTbl1 set col13=E'\\034'::bytea where col11 <= 3;
  insert into myTbl2 values (1,'ABC',current_date);
commit;
delete from myTbl1 where col11 > 10;
insert into myTbl2 values (2,'DEF',NULL);
select count(*) from mytbl1;
 count 
-------
    10
(1 row)

select count(*) from mytbl2;
 count 
-------
     2
(1 row)

select count(*) from mytbl2b;
 count 
-------
     2
(1 row)

-- set a mark
select emaj.emaj_set_mark_group('myGroup1','Mark12');
 emaj_set_mark_group 
---------------------
                   6
(1 row)

-- inserts/updates/deletes in myTbl3 and myTbl4
insert into "myTbl3" (col33) select generate_series(1000,1039,4)/100;
insert into myTbl4 values (1,'FK...',1,1,'ABC');
select count(*) from "myTbl3";
 count 
-------
    10
(1 row)

select count(*) from myTbl4;
 count 
-------
     1
(1 row)

-- set a mark
select emaj.emaj_set_mark_group('myGroup1','Mark13');
 emaj_set_mark_group 
---------------------
                   6
(1 row)

select mark_id, mark_group, regexp_replace(mark_name,E'\\d\\d\.\\d\\d\\.\\d\\d\\.\\d\\d\\d','%','g'),mark_time_id, mark_is_deleted, mark_is_rlbk_protected, mark_comment, mark_log_rows_before_next, mark_logged_rlbk_target_mark from emaj.emaj_mark order by mark_id;
 mark_id |    mark_group    | regexp_replace | mark_time_id | mark_is_deleted | mark_is_rlbk_protected | mark_comment | mark_log_rows_before_next | mark_logged_rlbk_target_mark 
---------+------------------+----------------+--------------+-----------------+------------------------+--------------+---------------------------+------------------------------
     302 | emptyGroup       | MarkInit       |          302 | f               | f                      |              |                           | 
     321 | phil's group#3", | Mark4          |          316 | f               | f                      |              |                           | 
     430 | myGroup2         | Mark21         |          430 | f               | f                      |              |                           | 
     434 | myGroup1         | Mark11         |          436 | f               | f                      |              |                        19 | 
     435 | myGroup1         | Mark12         |          437 | f               | f                      |              |                        11 | 
     436 | myGroup1         | Mark13         |          438 | f               | f                      |              |                           | 
(6 rows)

select sequ_schema, sequ_name, sequ_time_id, sequ_last_val, sequ_is_called from emaj.emaj_sequence order by sequ_time_id, sequ_schema, sequ_name;
  sequ_schema   |             sequ_name              | sequ_time_id | sequ_last_val | sequ_is_called 
----------------+------------------------------------+--------------+---------------+----------------
 emaj           | phil's schema3_myTbl2\_log_seq     |          316 |             1 | f
 emaj #'3       | phil's schema3_phil's tbl1_log_seq |          316 |             1 | f
 phil's schema3 | myTbl2\_col21_seq                  |          316 |             1 | f
 phil's schema3 | phil's seq\1                       |          316 |          1000 | f
 emaj           | myschema2_mytbl1_log_seq           |          430 |             1 | f
 emaj           | myschema2_mytbl2_log_seq           |          430 |             1 | f
 emaj           | myschema2_mytbl4_log_seq           |          430 |             1 | f
 emaj           | myschema2_mytbl6_log_seq           |          430 |             1 | f
 emaj           | otherPrefix4mytbl5_log_seq         |          430 |             1 | f
 emajC          | myschema2_myTbl3_log_seq           |          430 |             1 | f
 myschema2      | myseq1                             |          430 |          1000 | f
 myschema2      | myTbl3_col31_seq                   |          430 |             1 | f
 emaj           | myschema1_mytbl1_log_seq           |          436 |             1 | f
 emaj           | myschema1_mytbl2_log_seq           |          436 |             1 | f
 emaj           | myschema1_mytbl4_log_seq           |          436 |             1 | f
 emajb          | myschema1_mytbl2b_log_seq          |          436 |             1 | f
 emajC          | myschema1_myTbl3_log_seq           |          436 |             1 | f
 myschema1      | myTbl3_col31_seq                   |          436 |             1 | f
 emaj           | myschema1_mytbl1_log_seq           |          437 |            15 | t
 emaj           | myschema1_mytbl2_log_seq           |          437 |             2 | t
 emaj           | myschema1_mytbl4_log_seq           |          437 |             1 | f
 emajb          | myschema1_mytbl2b_log_seq          |          437 |             2 | t
 emajC          | myschema1_myTbl3_log_seq           |          437 |             1 | f
 myschema1      | myTbl3_col31_seq                   |          437 |             1 | f
 emaj           | myschema1_mytbl1_log_seq           |          438 |            15 | t
 emaj           | myschema1_mytbl2_log_seq           |          438 |             2 | t
 emaj           | myschema1_mytbl4_log_seq           |          438 |             1 | t
 emajb          | myschema1_mytbl2b_log_seq          |          438 |             2 | t
 emajC          | myschema1_myTbl3_log_seq           |          438 |            10 | t
 myschema1      | myTbl3_col31_seq                   |          438 |            10 | t
(30 rows)

select col11, col12, col13, emaj_verb, emaj_tuple, emaj_gid from emaj.myschema1_mytbl1_log order by emaj_gid, emaj_tuple desc;
 col11 |   col12    | col13 | emaj_verb | emaj_tuple | emaj_gid 
-------+------------+-------+-----------+------------+----------
     1 | ABC        | \x0c  | INS       | NEW        |       42
     2 | ABC        | \x0c  | INS       | NEW        |       43
     3 | ABC        | \x0c  | INS       | NEW        |       44
     4 | ABC        | \x0c  | INS       | NEW        |       45
     5 | ABC        | \x0c  | INS       | NEW        |       46
     6 | ABC        | \x0c  | INS       | NEW        |       47
     7 | ABC        | \x0c  | INS       | NEW        |       48
     8 | ABC        | \x0c  | INS       | NEW        |       49
     9 | ABC        | \x0c  | INS       | NEW        |       50
    10 | ABC        | \x0c  | INS       | NEW        |       51
    11 | ABC        | \x0c  | INS       | NEW        |       52
     1 | ABC        | \x0c  | UPD       | OLD        |       53
     1 | ABC        | \x1c  | UPD       | NEW        |       53
     2 | ABC        | \x0c  | UPD       | OLD        |       54
     2 | ABC        | \x1c  | UPD       | NEW        |       54
     3 | ABC        | \x0c  | UPD       | OLD        |       55
     3 | ABC        | \x1c  | UPD       | NEW        |       55
    11 | ABC        | \x0c  | DEL       | OLD        |       58
(18 rows)

select col21, col22, emaj_verb, emaj_tuple, emaj_gid from emaj.myschema1_mytbl2_log order by emaj_gid, emaj_tuple desc;
 col21 | col22 | emaj_verb | emaj_tuple | emaj_gid 
-------+-------+-----------+------------+----------
     1 | ABC   | INS       | NEW        |       56
     2 | DEF   | INS       | NEW        |       59
(2 rows)

select col20, col21, emaj_verb, emaj_tuple, emaj_gid from emajb.myschema1_mytbl2b_log order by emaj_gid, emaj_tuple desc;
 col20 | col21 | emaj_verb | emaj_tuple | emaj_gid 
-------+-------+-----------+------------+----------
     7 |     1 | INS       | NEW        |       57
     8 |     2 | INS       | NEW        |       60
(2 rows)

select col31, col33, emaj_verb, emaj_tuple, emaj_gid from "emajC"."myschema1_myTbl3_log" order by emaj_gid, emaj_tuple desc;
 col31 | col33 | emaj_verb | emaj_tuple | emaj_gid 
-------+-------+-----------+------------+----------
     1 | 10.00 | INS       | NEW        |       61
     2 | 10.00 | INS       | NEW        |       62
     3 | 10.00 | INS       | NEW        |       63
     4 | 10.00 | INS       | NEW        |       64
     5 | 10.00 | INS       | NEW        |       65
     6 | 10.00 | INS       | NEW        |       66
     7 | 10.00 | INS       | NEW        |       67
     8 | 10.00 | INS       | NEW        |       68
     9 | 10.00 | INS       | NEW        |       69
    10 | 10.00 | INS       | NEW        |       70
(10 rows)

select col41, col42, col43, col44, col45, emaj_verb, emaj_tuple, emaj_gid from emaj.myschema1_myTbl4_log order by emaj_gid, emaj_tuple desc;
 col41 | col42 | col43 | col44 |   col45    | emaj_verb | emaj_tuple | emaj_gid 
-------+-------+-------+-------+------------+-----------+------------+----------
     1 | FK... |     1 |     1 | ABC        | INS       | NEW        |       71
(1 row)

-- logged rollback #1
alter table mySchema1.myTbl2 disable trigger myTbl2trg;
select emaj.emaj_logged_rollback_group('myGroup1','Mark12');
 emaj_logged_rollback_group 
----------------------------
                          3
(1 row)

alter table mySchema1.myTbl2 enable trigger myTbl2trg;
-- check impact
select mark_id, mark_group, regexp_replace(mark_name,E'\\d\\d\.\\d\\d\\.\\d\\d\\.\\d\\d\\d','%','g'), mark_time_id, mark_is_deleted, mark_is_rlbk_protected, mark_comment, mark_log_rows_before_next, mark_logged_rlbk_target_mark from emaj.emaj_mark order by mark_id;
 mark_id |    mark_group    |   regexp_replace    | mark_time_id | mark_is_deleted | mark_is_rlbk_protected | mark_comment | mark_log_rows_before_next | mark_logged_rlbk_target_mark 
---------+------------------+---------------------+--------------+-----------------+------------------------+--------------+---------------------------+------------------------------
     302 | emptyGroup       | MarkInit            |          302 | f               | f                      |              |                           | 
     321 | phil's group#3", | Mark4               |          316 | f               | f                      |              |                           | 
     430 | myGroup2         | Mark21              |          430 | f               | f                      |              |                           | 
     434 | myGroup1         | Mark11              |          436 | f               | f                      |              |                        19 | 
     435 | myGroup1         | Mark12              |          437 | f               | f                      |              |                        11 | 
     436 | myGroup1         | Mark13              |          438 | f               | f                      |              |                         0 | 
     437 | myGroup1         | RLBK_Mark12_%_START |          439 | f               | f                      |              |                        11 | 
     438 | myGroup1         | RLBK_Mark12_%_DONE  |          440 | f               | f                      |              |                           | Mark12
(8 rows)

select sequ_schema, sequ_name, sequ_time_id, sequ_last_val, sequ_is_called from emaj.emaj_sequence order by sequ_time_id, sequ_schema, sequ_name;
  sequ_schema   |             sequ_name              | sequ_time_id | sequ_last_val | sequ_is_called 
----------------+------------------------------------+--------------+---------------+----------------
 emaj           | phil's schema3_myTbl2\_log_seq     |          316 |             1 | f
 emaj #'3       | phil's schema3_phil's tbl1_log_seq |          316 |             1 | f
 phil's schema3 | myTbl2\_col21_seq                  |          316 |             1 | f
 phil's schema3 | phil's seq\1                       |          316 |          1000 | f
 emaj           | myschema2_mytbl1_log_seq           |          430 |             1 | f
 emaj           | myschema2_mytbl2_log_seq           |          430 |             1 | f
 emaj           | myschema2_mytbl4_log_seq           |          430 |             1 | f
 emaj           | myschema2_mytbl6_log_seq           |          430 |             1 | f
 emaj           | otherPrefix4mytbl5_log_seq         |          430 |             1 | f
 emajC          | myschema2_myTbl3_log_seq           |          430 |             1 | f
 myschema2      | myseq1                             |          430 |          1000 | f
 myschema2      | myTbl3_col31_seq                   |          430 |             1 | f
 emaj           | myschema1_mytbl1_log_seq           |          436 |             1 | f
 emaj           | myschema1_mytbl2_log_seq           |          436 |             1 | f
 emaj           | myschema1_mytbl4_log_seq           |          436 |             1 | f
 emajb          | myschema1_mytbl2b_log_seq          |          436 |             1 | f
 emajC          | myschema1_myTbl3_log_seq           |          436 |             1 | f
 myschema1      | myTbl3_col31_seq                   |          436 |             1 | f
 emaj           | myschema1_mytbl1_log_seq           |          437 |            15 | t
 emaj           | myschema1_mytbl2_log_seq           |          437 |             2 | t
 emaj           | myschema1_mytbl4_log_seq           |          437 |             1 | f
 emajb          | myschema1_mytbl2b_log_seq          |          437 |             2 | t
 emajC          | myschema1_myTbl3_log_seq           |          437 |             1 | f
 myschema1      | myTbl3_col31_seq                   |          437 |             1 | f
 emaj           | myschema1_mytbl1_log_seq           |          438 |            15 | t
 emaj           | myschema1_mytbl2_log_seq           |          438 |             2 | t
 emaj           | myschema1_mytbl4_log_seq           |          438 |             1 | t
 emajb          | myschema1_mytbl2b_log_seq          |          438 |             2 | t
 emajC          | myschema1_myTbl3_log_seq           |          438 |            10 | t
 myschema1      | myTbl3_col31_seq                   |          438 |            10 | t
 emaj           | myschema1_mytbl1_log_seq           |          439 |            15 | t
 emaj           | myschema1_mytbl2_log_seq           |          439 |             2 | t
 emaj           | myschema1_mytbl4_log_seq           |          439 |             1 | t
 emajb          | myschema1_mytbl2b_log_seq          |          439 |             2 | t
 emajC          | myschema1_myTbl3_log_seq           |          439 |            10 | t
 myschema1      | myTbl3_col31_seq                   |          439 |            10 | t
 emaj           | myschema1_mytbl1_log_seq           |          440 |            15 | t
 emaj           | myschema1_mytbl2_log_seq           |          440 |             2 | t
 emaj           | myschema1_mytbl4_log_seq           |          440 |             2 | t
 emajb          | myschema1_mytbl2b_log_seq          |          440 |             2 | t
 emajC          | myschema1_myTbl3_log_seq           |          440 |            20 | t
 myschema1      | myTbl3_col31_seq                   |          440 |             1 | f
(42 rows)

select sqhl_schema, sqhl_table, sqhl_begin_time_id, sqhl_end_time_id, sqhl_hole_size from emaj.emaj_seq_hole order by 1,2,3;
 sqhl_schema | sqhl_table | sqhl_begin_time_id | sqhl_end_time_id | sqhl_hole_size 
-------------+------------+--------------------+------------------+----------------
(0 rows)

select col31, col33, emaj_verb, emaj_tuple, emaj_gid from "emajC"."myschema1_myTbl3_log" order by emaj_gid, emaj_tuple desc;
 col31 | col33 | emaj_verb | emaj_tuple | emaj_gid 
-------+-------+-----------+------------+----------
     1 | 10.00 | INS       | NEW        |       61
     2 | 10.00 | INS       | NEW        |       62
     3 | 10.00 | INS       | NEW        |       63
     4 | 10.00 | INS       | NEW        |       64
     5 | 10.00 | INS       | NEW        |       65
     6 | 10.00 | INS       | NEW        |       66
     7 | 10.00 | INS       | NEW        |       67
     8 | 10.00 | INS       | NEW        |       68
     9 | 10.00 | INS       | NEW        |       69
    10 | 10.00 | INS       | NEW        |       70
     6 | 10.00 | DEL       | OLD        |       72
     4 | 10.00 | DEL       | OLD        |       73
     5 | 10.00 | DEL       | OLD        |       74
     8 | 10.00 | DEL       | OLD        |       75
     1 | 10.00 | DEL       | OLD        |       76
     2 | 10.00 | DEL       | OLD        |       77
     9 | 10.00 | DEL       | OLD        |       78
     3 | 10.00 | DEL       | OLD        |       79
     7 | 10.00 | DEL       | OLD        |       80
    10 | 10.00 | DEL       | OLD        |       81
(20 rows)

select col41, col42, col43, col44, col45, emaj_verb, emaj_tuple, emaj_gid from emaj.myschema1_myTbl4_log order by emaj_gid, emaj_tuple desc;
 col41 | col42 | col43 | col44 |   col45    | emaj_verb | emaj_tuple | emaj_gid 
-------+-------+-------+-------+------------+-----------+------------+----------
     1 | FK... |     1 |     1 | ABC        | INS       | NEW        |       71
     1 | FK... |     1 |     1 | ABC        | DEL       | OLD        |       82
(2 rows)

select col31, col33 from myschema1."myTbl3" order by col31;
 col31 | col33 
-------+-------
(0 rows)

select col41, col42, col43, col44, col45 from myschema1.myTbl4 order by col41;
 col41 | col42 | col43 | col44 | col45 
-------+-------+-------+-------+-------
(0 rows)

-- logged rollback #2
alter table mySchema1.myTbl2 disable trigger myTbl2trg;
select emaj.emaj_logged_rollback_group('myGroup1','Mark11');
 emaj_logged_rollback_group 
----------------------------
                          6
(1 row)

alter table mySchema1.myTbl2 enable trigger myTbl2trg;
-- check impact
select mark_id, mark_group, regexp_replace(mark_name,E'\\d\\d\.\\d\\d\\.\\d\\d\\.\\d\\d\\d','%','g'), mark_time_id, mark_is_deleted, mark_is_rlbk_protected, mark_comment, mark_log_rows_before_next, mark_logged_rlbk_target_mark from emaj.emaj_mark order by mark_id;
 mark_id |    mark_group    |   regexp_replace    | mark_time_id | mark_is_deleted | mark_is_rlbk_protected | mark_comment | mark_log_rows_before_next | mark_logged_rlbk_target_mark 
---------+------------------+---------------------+--------------+-----------------+------------------------+--------------+---------------------------+------------------------------
     302 | emptyGroup       | MarkInit            |          302 | f               | f                      |              |                           | 
     321 | phil's group#3", | Mark4               |          316 | f               | f                      |              |                           | 
     430 | myGroup2         | Mark21              |          430 | f               | f                      |              |                           | 
     434 | myGroup1         | Mark11              |          436 | f               | f                      |              |                        19 | 
     435 | myGroup1         | Mark12              |          437 | f               | f                      |              |                        11 | 
     436 | myGroup1         | Mark13              |          438 | f               | f                      |              |                         0 | 
     437 | myGroup1         | RLBK_Mark12_%_START |          439 | f               | f                      |              |                        11 | 
     438 | myGroup1         | RLBK_Mark12_%_DONE  |          440 | f               | f                      |              |                         0 | Mark12
     439 | myGroup1         | RLBK_Mark11_%_START |          441 | f               | f                      |              |                        14 | 
     440 | myGroup1         | RLBK_Mark11_%_DONE  |          442 | f               | f                      |              |                           | Mark11
(10 rows)

select sequ_schema, sequ_name, sequ_time_id, sequ_last_val, sequ_is_called from emaj.emaj_sequence order by sequ_time_id, sequ_schema, sequ_name;
  sequ_schema   |             sequ_name              | sequ_time_id | sequ_last_val | sequ_is_called 
----------------+------------------------------------+--------------+---------------+----------------
 emaj           | phil's schema3_myTbl2\_log_seq     |          316 |             1 | f
 emaj #'3       | phil's schema3_phil's tbl1_log_seq |          316 |             1 | f
 phil's schema3 | myTbl2\_col21_seq                  |          316 |             1 | f
 phil's schema3 | phil's seq\1                       |          316 |          1000 | f
 emaj           | myschema2_mytbl1_log_seq           |          430 |             1 | f
 emaj           | myschema2_mytbl2_log_seq           |          430 |             1 | f
 emaj           | myschema2_mytbl4_log_seq           |          430 |             1 | f
 emaj           | myschema2_mytbl6_log_seq           |          430 |             1 | f
 emaj           | otherPrefix4mytbl5_log_seq         |          430 |             1 | f
 emajC          | myschema2_myTbl3_log_seq           |          430 |             1 | f
 myschema2      | myseq1                             |          430 |          1000 | f
 myschema2      | myTbl3_col31_seq                   |          430 |             1 | f
 emaj           | myschema1_mytbl1_log_seq           |          436 |             1 | f
 emaj           | myschema1_mytbl2_log_seq           |          436 |             1 | f
 emaj           | myschema1_mytbl4_log_seq           |          436 |             1 | f
 emajb          | myschema1_mytbl2b_log_seq          |          436 |             1 | f
 emajC          | myschema1_myTbl3_log_seq           |          436 |             1 | f
 myschema1      | myTbl3_col31_seq                   |          436 |             1 | f
 emaj           | myschema1_mytbl1_log_seq           |          437 |            15 | t
 emaj           | myschema1_mytbl2_log_seq           |          437 |             2 | t
 emaj           | myschema1_mytbl4_log_seq           |          437 |             1 | f
 emajb          | myschema1_mytbl2b_log_seq          |          437 |             2 | t
 emajC          | myschema1_myTbl3_log_seq           |          437 |             1 | f
 myschema1      | myTbl3_col31_seq                   |          437 |             1 | f
 emaj           | myschema1_mytbl1_log_seq           |          438 |            15 | t
 emaj           | myschema1_mytbl2_log_seq           |          438 |             2 | t
 emaj           | myschema1_mytbl4_log_seq           |          438 |             1 | t
 emajb          | myschema1_mytbl2b_log_seq          |          438 |             2 | t
 emajC          | myschema1_myTbl3_log_seq           |          438 |            10 | t
 myschema1      | myTbl3_col31_seq                   |          438 |            10 | t
 emaj           | myschema1_mytbl1_log_seq           |          439 |            15 | t
 emaj           | myschema1_mytbl2_log_seq           |          439 |             2 | t
 emaj           | myschema1_mytbl4_log_seq           |          439 |             1 | t
 emajb          | myschema1_mytbl2b_log_seq          |          439 |             2 | t
 emajC          | myschema1_myTbl3_log_seq           |          439 |            10 | t
 myschema1      | myTbl3_col31_seq                   |          439 |            10 | t
 emaj           | myschema1_mytbl1_log_seq           |          440 |            15 | t
 emaj           | myschema1_mytbl2_log_seq           |          440 |             2 | t
 emaj           | myschema1_mytbl4_log_seq           |          440 |             2 | t
 emajb          | myschema1_mytbl2b_log_seq          |          440 |             2 | t
 emajC          | myschema1_myTbl3_log_seq           |          440 |            20 | t
 myschema1      | myTbl3_col31_seq                   |          440 |             1 | f
 emaj           | myschema1_mytbl1_log_seq           |          441 |            15 | t
 emaj           | myschema1_mytbl2_log_seq           |          441 |             2 | t
 emaj           | myschema1_mytbl4_log_seq           |          441 |             2 | t
 emajb          | myschema1_mytbl2b_log_seq          |          441 |             2 | t
 emajC          | myschema1_myTbl3_log_seq           |          441 |            20 | t
 myschema1      | myTbl3_col31_seq                   |          441 |             1 | f
 emaj           | myschema1_mytbl1_log_seq           |          442 |            25 | t
 emaj           | myschema1_mytbl2_log_seq           |          442 |             4 | t
 emaj           | myschema1_mytbl4_log_seq           |          442 |             2 | t
 emajb          | myschema1_mytbl2b_log_seq          |          442 |             4 | t
 emajC          | myschema1_myTbl3_log_seq           |          442 |            20 | t
 myschema1      | myTbl3_col31_seq                   |          442 |             1 | f
(54 rows)

select sqhl_schema, sqhl_table, sqhl_begin_time_id, sqhl_end_time_id, sqhl_hole_size from emaj.emaj_seq_hole order by 1,2,3;
 sqhl_schema | sqhl_table | sqhl_begin_time_id | sqhl_end_time_id | sqhl_hole_size 
-------------+------------+--------------------+------------------+----------------
(0 rows)

select col11, col12, col13, emaj_verb, emaj_tuple, emaj_gid from emaj.myschema1_myTbl1_log order by emaj_gid, emaj_tuple desc;
 col11 |   col12    | col13 | emaj_verb | emaj_tuple | emaj_gid 
-------+------------+-------+-----------+------------+----------
     1 | ABC        | \x0c  | INS       | NEW        |       42
     2 | ABC        | \x0c  | INS       | NEW        |       43
     3 | ABC        | \x0c  | INS       | NEW        |       44
     4 | ABC        | \x0c  | INS       | NEW        |       45
     5 | ABC        | \x0c  | INS       | NEW        |       46
     6 | ABC        | \x0c  | INS       | NEW        |       47
     7 | ABC        | \x0c  | INS       | NEW        |       48
     8 | ABC        | \x0c  | INS       | NEW        |       49
     9 | ABC        | \x0c  | INS       | NEW        |       50
    10 | ABC        | \x0c  | INS       | NEW        |       51
    11 | ABC        | \x0c  | INS       | NEW        |       52
     1 | ABC        | \x0c  | UPD       | OLD        |       53
     1 | ABC        | \x1c  | UPD       | NEW        |       53
     2 | ABC        | \x0c  | UPD       | OLD        |       54
     2 | ABC        | \x1c  | UPD       | NEW        |       54
     3 | ABC        | \x0c  | UPD       | OLD        |       55
     3 | ABC        | \x1c  | UPD       | NEW        |       55
    11 | ABC        | \x0c  | DEL       | OLD        |       58
     1 | ABC        | \x1c  | DEL       | OLD        |       83
     2 | ABC        | \x1c  | DEL       | OLD        |       84
     3 | ABC        | \x1c  | DEL       | OLD        |       85
     4 | ABC        | \x0c  | DEL       | OLD        |       86
     5 | ABC        | \x0c  | DEL       | OLD        |       87
     6 | ABC        | \x0c  | DEL       | OLD        |       88
     7 | ABC        | \x0c  | DEL       | OLD        |       89
     8 | ABC        | \x0c  | DEL       | OLD        |       90
     9 | ABC        | \x0c  | DEL       | OLD        |       91
    10 | ABC        | \x0c  | DEL       | OLD        |       92
(28 rows)

select col21, col22, emaj_verb, emaj_tuple, emaj_gid from emaj.myschema1_myTbl2_log order by emaj_gid, emaj_tuple desc;
 col21 | col22 | emaj_verb | emaj_tuple | emaj_gid 
-------+-------+-----------+------------+----------
     1 | ABC   | INS       | NEW        |       56
     2 | DEF   | INS       | NEW        |       59
     1 | ABC   | DEL       | OLD        |       93
     2 | DEF   | DEL       | OLD        |       94
(4 rows)

select col20, col21, emaj_verb, emaj_tuple, emaj_gid from emajb.myschema1_myTbl2b_log order by emaj_gid, emaj_tuple desc;
 col20 | col21 | emaj_verb | emaj_tuple | emaj_gid 
-------+-------+-----------+------------+----------
     7 |     1 | INS       | NEW        |       57
     8 |     2 | INS       | NEW        |       60
     8 |     2 | DEL       | OLD        |       95
     7 |     1 | DEL       | OLD        |       96
(4 rows)

select col11, col12, col13 from myschema1.myTbl1 order by col11, col12;
 col11 | col12 | col13 
-------+-------+-------
(0 rows)

select col21, col22 from myschema1.myTbl2 order by col21;
 col21 | col22 
-------+-------
(0 rows)

select col20, col21 from myschema1.myTbl2b order by col20;
 col20 | col21 
-------+-------
(0 rows)

-----------------------------
-- unlogged rollback of logged rollbacks #3
-----------------------------
alter table mySchema1.myTbl2 disable trigger myTbl2trg;
select emaj.emaj_rollback_group('myGroup1','Mark13');
 emaj_rollback_group 
---------------------
                   6
(1 row)

alter table mySchema1.myTbl2 enable trigger myTbl2trg;
-- check impact
select mark_id, mark_group, regexp_replace(mark_name,E'\\d\\d\.\\d\\d\\.\\d\\d\\.\\d\\d\\d','%','g'), mark_time_id, mark_is_deleted, mark_is_rlbk_protected, mark_comment, mark_log_rows_before_next, mark_logged_rlbk_target_mark from emaj.emaj_mark order by mark_id;
 mark_id |    mark_group    | regexp_replace | mark_time_id | mark_is_deleted | mark_is_rlbk_protected | mark_comment | mark_log_rows_before_next | mark_logged_rlbk_target_mark 
---------+------------------+----------------+--------------+-----------------+------------------------+--------------+---------------------------+------------------------------
     302 | emptyGroup       | MarkInit       |          302 | f               | f                      |              |                           | 
     321 | phil's group#3", | Mark4          |          316 | f               | f                      |              |                           | 
     430 | myGroup2         | Mark21         |          430 | f               | f                      |              |                           | 
     434 | myGroup1         | Mark11         |          436 | f               | f                      |              |                        19 | 
     435 | myGroup1         | Mark12         |          437 | f               | f                      |              |                        11 | 
     436 | myGroup1         | Mark13         |          438 | f               | f                      |              |                           | 
(6 rows)

select sequ_schema, sequ_name, sequ_time_id, sequ_last_val, sequ_is_called from emaj.emaj_sequence order by sequ_time_id, sequ_schema, sequ_name;
  sequ_schema   |             sequ_name              | sequ_time_id | sequ_last_val | sequ_is_called 
----------------+------------------------------------+--------------+---------------+----------------
 emaj           | phil's schema3_myTbl2\_log_seq     |          316 |             1 | f
 emaj #'3       | phil's schema3_phil's tbl1_log_seq |          316 |             1 | f
 phil's schema3 | myTbl2\_col21_seq                  |          316 |             1 | f
 phil's schema3 | phil's seq\1                       |          316 |          1000 | f
 emaj           | myschema2_mytbl1_log_seq           |          430 |             1 | f
 emaj           | myschema2_mytbl2_log_seq           |          430 |             1 | f
 emaj           | myschema2_mytbl4_log_seq           |          430 |             1 | f
 emaj           | myschema2_mytbl6_log_seq           |          430 |             1 | f
 emaj           | otherPrefix4mytbl5_log_seq         |          430 |             1 | f
 emajC          | myschema2_myTbl3_log_seq           |          430 |             1 | f
 myschema2      | myseq1                             |          430 |          1000 | f
 myschema2      | myTbl3_col31_seq                   |          430 |             1 | f
 emaj           | myschema1_mytbl1_log_seq           |          436 |             1 | f
 emaj           | myschema1_mytbl2_log_seq           |          436 |             1 | f
 emaj           | myschema1_mytbl4_log_seq           |          436 |             1 | f
 emajb          | myschema1_mytbl2b_log_seq          |          436 |             1 | f
 emajC          | myschema1_myTbl3_log_seq           |          436 |             1 | f
 myschema1      | myTbl3_col31_seq                   |          436 |             1 | f
 emaj           | myschema1_mytbl1_log_seq           |          437 |            15 | t
 emaj           | myschema1_mytbl2_log_seq           |          437 |             2 | t
 emaj           | myschema1_mytbl4_log_seq           |          437 |             1 | f
 emajb          | myschema1_mytbl2b_log_seq          |          437 |             2 | t
 emajC          | myschema1_myTbl3_log_seq           |          437 |             1 | f
 myschema1      | myTbl3_col31_seq                   |          437 |             1 | f
 emaj           | myschema1_mytbl1_log_seq           |          438 |            15 | t
 emaj           | myschema1_mytbl2_log_seq           |          438 |             2 | t
 emaj           | myschema1_mytbl4_log_seq           |          438 |             1 | t
 emajb          | myschema1_mytbl2b_log_seq          |          438 |             2 | t
 emajC          | myschema1_myTbl3_log_seq           |          438 |            10 | t
 myschema1      | myTbl3_col31_seq                   |          438 |            10 | t
(30 rows)

select sqhl_schema, sqhl_table, sqhl_begin_time_id, sqhl_end_time_id, sqhl_hole_size from emaj.emaj_seq_hole order by 1,2,3;
 sqhl_schema | sqhl_table | sqhl_begin_time_id | sqhl_end_time_id | sqhl_hole_size 
-------------+------------+--------------------+------------------+----------------
 myschema1   | mytbl1     |                438 |              443 |             10
 myschema1   | mytbl2     |                438 |              443 |              2
 myschema1   | mytbl2b    |                438 |              443 |              2
 myschema1   | myTbl3     |                438 |              443 |             10
 myschema1   | mytbl4     |                438 |              443 |              1
(5 rows)

select col11, col12, col13, emaj_verb, emaj_tuple, emaj_gid from emaj.myschema1_myTbl1_log order by emaj_gid, emaj_tuple desc;
 col11 |   col12    | col13 | emaj_verb | emaj_tuple | emaj_gid 
-------+------------+-------+-----------+------------+----------
     1 | ABC        | \x0c  | INS       | NEW        |       42
     2 | ABC        | \x0c  | INS       | NEW        |       43
     3 | ABC        | \x0c  | INS       | NEW        |       44
     4 | ABC        | \x0c  | INS       | NEW        |       45
     5 | ABC        | \x0c  | INS       | NEW        |       46
     6 | ABC        | \x0c  | INS       | NEW        |       47
     7 | ABC        | \x0c  | INS       | NEW        |       48
     8 | ABC        | \x0c  | INS       | NEW        |       49
     9 | ABC        | \x0c  | INS       | NEW        |       50
    10 | ABC        | \x0c  | INS       | NEW        |       51
    11 | ABC        | \x0c  | INS       | NEW        |       52
     1 | ABC        | \x0c  | UPD       | OLD        |       53
     1 | ABC        | \x1c  | UPD       | NEW        |       53
     2 | ABC        | \x0c  | UPD       | OLD        |       54
     2 | ABC        | \x1c  | UPD       | NEW        |       54
     3 | ABC        | \x0c  | UPD       | OLD        |       55
     3 | ABC        | \x1c  | UPD       | NEW        |       55
    11 | ABC        | \x0c  | DEL       | OLD        |       58
(18 rows)

select col21, col22, emaj_verb, emaj_tuple, emaj_gid from emaj.myschema1_myTbl2_log order by emaj_gid, emaj_tuple desc;
 col21 | col22 | emaj_verb | emaj_tuple | emaj_gid 
-------+-------+-----------+------------+----------
     1 | ABC   | INS       | NEW        |       56
     2 | DEF   | INS       | NEW        |       59
(2 rows)

select col20, col21, emaj_verb, emaj_tuple, emaj_gid from emajb.myschema1_myTbl2b_log order by emaj_gid, emaj_tuple desc;
 col20 | col21 | emaj_verb | emaj_tuple | emaj_gid 
-------+-------+-----------+------------+----------
     7 |     1 | INS       | NEW        |       57
     8 |     2 | INS       | NEW        |       60
(2 rows)

select col11, col12, col13 from myschema1.myTbl1 order by col11, col12;
 col11 |   col12    | col13 
-------+------------+-------
     1 | ABC        | \x1c
     2 | ABC        | \x1c
     3 | ABC        | \x1c
     4 | ABC        | \x0c
     5 | ABC        | \x0c
     6 | ABC        | \x0c
     7 | ABC        | \x0c
     8 | ABC        | \x0c
     9 | ABC        | \x0c
    10 | ABC        | \x0c
(10 rows)

select col21, col22 from myschema1.myTbl2 order by col21;
 col21 | col22 
-------+-------
     1 | ABC
     2 | DEF
(2 rows)

select col20, col21 from myschema1.myTbl2b order by col20;
 col20 | col21 
-------+-------
     7 |     1
     8 |     2
(2 rows)

-----------------------------
-- rollback an empty group
-----------------------------
select emaj.emaj_rollback_group('emptyGroup','MarkInit');
 emaj_rollback_group 
---------------------
                   0
(1 row)

-----------------------------
-- test use of partitionned tables
-----------------------------
select emaj.emaj_start_group('myGroup4','myGroup4_start');
 emaj_start_group 
------------------
                3
(1 row)

insert into myschema4.myTblM values ('2001-09-11',0,'abc'),('2011-09-11',10,'def'),('2021-09-11',20,'ghi');
select emaj.emaj_set_mark_group('myGroup4','mark1');
 emaj_set_mark_group 
---------------------
                   3
(1 row)

delete from myschema4.myTblM;
select emaj.emaj_logged_rollback_group('myGroup4','mark1');
 emaj_logged_rollback_group 
----------------------------
                          3
(1 row)

select col1, col2, col3, emaj_verb, emaj_tuple, emaj_gid from emaj.myschema4_mytblm_log;
    col1    | col2 | col3 | emaj_verb | emaj_tuple | emaj_gid 
------------+------+------+-----------+------------+----------
 09-11-2021 |   20 | ghi  | INS       | NEW        |       99
 09-11-2021 |   20 | ghi  | DEL       | OLD        |      100
 09-11-2021 |   20 | ghi  | INS       | NEW        |      105
(3 rows)

select col1, col2, col3, emaj_verb, emaj_tuple, emaj_gid from emaj.myschema4_mytblc1_log;
    col1    | col2 | col3 | emaj_verb | emaj_tuple | emaj_gid 
------------+------+------+-----------+------------+----------
 09-11-2001 |    0 | abc  | INS       | NEW        |       97
 09-11-2001 |    0 | abc  | DEL       | OLD        |      101
 09-11-2001 |    0 | abc  | INS       | NEW        |      103
(3 rows)

select col1, col2, col3, emaj_verb, emaj_tuple, emaj_gid from emaj.myschema4_mytblc2_log;
    col1    | col2 | col3 | emaj_verb | emaj_tuple | emaj_gid 
------------+------+------+-----------+------------+----------
 09-11-2011 |   10 | def  | INS       | NEW        |       98
 09-11-2011 |   10 | def  | DEL       | OLD        |      102
 09-11-2011 |   10 | def  | INS       | NEW        |      104
(3 rows)

-- use the functions dedicated to the ppa plugin
-- for an equivalent of "select emaj.emaj_rollback_group('myGroup4','myGroup4_start');"
select emaj._rlbk_async(emaj._rlbk_init(array['myGroup4'], 'myGroup4_start', false, 1, false), false);
 _rlbk_async 
-------------
           3
(1 row)

-- and check the result
select rlbk_id, rlbk_groups, rlbk_mark, rlbk_time_id, rlbk_is_logged, rlbk_nb_session, rlbk_nb_table, rlbk_nb_sequence, 
       rlbk_eff_nb_table, rlbk_status, rlbk_msg
 from emaj.emaj_rlbk order by rlbk_id desc limit 1; 
 rlbk_id | rlbk_groups |   rlbk_mark    | rlbk_time_id | rlbk_is_logged | rlbk_nb_session | rlbk_nb_table | rlbk_nb_sequence | rlbk_eff_nb_table | rlbk_status |                         rlbk_msg                          
---------+-------------+----------------+--------------+----------------+-----------------+---------------+------------------+-------------------+-------------+-----------------------------------------------------------
      19 | {myGroup4}  | myGroup4_start |          449 | f              |               1 |             3 |                0 |                 3 | COMPLETED   | Completed: 3 tables and 0 sequences effectively processed
(1 row)

-----------------------------
-- test emaj_rollback_activity()
-----------------------------
-- insert necessary rows into rollback tables in order to test various cases of emaj_rollback_activity() reports.
-- these tests ares performed inside transactions that are then rolled back.
begin;
-- 1 rollback operation in EXECUTING state, but no rollback steps have started yet
  insert into emaj.emaj_time_stamp (time_id, time_tx_timestamp) values (-1, now()-'0.1 seconds'::interval);
  insert into emaj.emaj_time_stamp (time_id, time_clock_timestamp) values (-2, '2000-01-01 01:00:00');
  insert into emaj.emaj_rlbk (rlbk_id, rlbk_groups, rlbk_mark, rlbk_mark_time_id, rlbk_time_id, rlbk_is_logged, rlbk_nb_session, 
             rlbk_nb_table, rlbk_nb_sequence, rlbk_eff_nb_table, rlbk_status)
    values (1232,array['group1232'],'mark1232',-2,-1,true,1,
             5,4,3,'EXECUTING');
  insert into emaj.emaj_rlbk_plan (rlbp_rlbk_id, rlbp_step, rlbp_schema, rlbp_table, rlbp_fkey,
             rlbp_estimated_duration, rlbp_estimated_quantity, rlbp_start_datetime, rlbp_duration)
    values (1232, 'RLBK_TABLE','schema','t1','','50 seconds'::interval,null,null,null),
           (1232, 'RLBK_TABLE','schema','t2','','30 seconds'::interval,null,null,null),
           (1232, 'RLBK_TABLE','schema','t3','','20 seconds'::interval,null,null,null),
           (1232, 'CTRL+DBLINK','',     '',  '','0.3 second'::interval,3,   null,null);
  select rlbk_id, rlbk_status, rlbk_remaining, rlbk_completion_pct from emaj._rollback_activity();
 rlbk_id | rlbk_status |  rlbk_remaining   | rlbk_completion_pct 
---------+-------------+-------------------+---------------------
    1232 | EXECUTING   | @ 1 min 40.3 secs |                   0
(1 row)

-- the first RLBK_TABLE has started, but the elapse of the step is not yet > estimated duration 
  update emaj.emaj_time_stamp set time_tx_timestamp = now() - '11 seconds'::interval where time_id = -1;
  update emaj.emaj_rlbk_plan set rlbp_start_datetime = now() - '11 seconds'::interval
    where rlbp_rlbk_id = 1232 and rlbp_table = 't1';
  select rlbk_id, rlbk_status, rlbk_remaining, rlbk_completion_pct from emaj._rollback_activity();
 rlbk_id | rlbk_status |  rlbk_remaining   | rlbk_completion_pct 
---------+-------------+-------------------+---------------------
    1232 | EXECUTING   | @ 1 min 29.2 secs |                  11
(1 row)

  select 1.0 - ((20.0 + 30.0)+(50.0 - 11.0) + 2*0.3/3) / (11.1 + (20.0 + 30.0)+(50.0 - 11.0) + 2*0.3/3); -- the completion % should be 11%
        ?column?        
------------------------
 0.11066799601196410768
(1 row)

-- the first RLBK_TABLE is completed, and the step duration < the estimated duration 
  update emaj.emaj_time_stamp set time_tx_timestamp = now() - '45.1 seconds'::interval where time_id = -1;
  update emaj.emaj_rlbk_plan set rlbp_start_datetime = now() - '45 seconds'::interval,
                                 rlbp_duration = '45 seconds'::interval
    where rlbp_rlbk_id = 1232 and rlbp_table = 't1';
  select rlbk_id, rlbk_status, rlbk_remaining, rlbk_completion_pct from emaj._rollback_activity();
 rlbk_id | rlbk_status | rlbk_remaining | rlbk_completion_pct 
---------+-------------+----------------+---------------------
    1232 | EXECUTING   | @ 50.2 secs    |                  47
(1 row)

  select 1.0 - (20.0 + 30.0 + 2*0.3/3) / (45.1 + (20.0 + 30.0) + 2*0.3/3);  -- the completion % should be 47%
        ?column?        
------------------------
 0.47324239244491080797
(1 row)

-- the second RLBK_TABLE has started, but the elapse of the step is not yet > estimated duration 
  update emaj.emaj_time_stamp set time_tx_timestamp = now() - '73.1 seconds'::interval where time_id = -1;
  update emaj.emaj_rlbk_plan set rlbp_start_datetime = now() - '28 seconds'::interval
    where rlbp_rlbk_id = 1232 and rlbp_table = 't2';
  select rlbk_id, rlbk_status, rlbk_remaining, rlbk_completion_pct from emaj._rollback_activity();
 rlbk_id | rlbk_status | rlbk_remaining | rlbk_completion_pct 
---------+-------------+----------------+---------------------
    1232 | EXECUTING   | @ 22.1 secs    |                  77
(1 row)

  select 1.0 - (20.0 + (30.0 - 28.0) + 1*0.3/3) / (73.1 + (20.0 + (30.0 - 28.0) + 1*0.3/3));  -- the completion % should be 77%
        ?column?        
------------------------
 0.76785714285714285714
(1 row)

-- the second RLBK_TABLE has started, but the elapse of the step is already > estimated duration 
  update emaj.emaj_time_stamp set time_tx_timestamp = now() - '85.1 seconds'::interval where time_id = -1;
  update emaj.emaj_rlbk_plan set rlbp_start_datetime = now() - '40 seconds'::interval
    where rlbp_rlbk_id = 1232 and rlbp_table = 't2';
  select rlbk_id, rlbk_status, rlbk_remaining, rlbk_completion_pct from emaj._rollback_activity();
 rlbk_id | rlbk_status | rlbk_remaining | rlbk_completion_pct 
---------+-------------+----------------+---------------------
    1232 | EXECUTING   | @ 20.1 secs    |                  81
(1 row)

  select 1.0 - (20.0 + 1*0.3/3) / (85.1 + (20.0 + 1*0.3/3));  -- the completion % should be 81%
        ?column?        
------------------------
 0.80893536121673003802
(1 row)

-- the second RLBK_TABLE has started, but the elapse of the step is already > estimated duration 
  update emaj.emaj_time_stamp set time_tx_timestamp = now() - '105.1 seconds'::interval where time_id = -1;
  update emaj.emaj_rlbk_plan set rlbp_start_datetime = now() - '60 seconds'::interval
    where rlbp_rlbk_id = 1232 and rlbp_table = 't2';
  select rlbk_id, rlbk_status, rlbk_remaining, rlbk_completion_pct from emaj._rollback_activity();
 rlbk_id | rlbk_status | rlbk_remaining | rlbk_completion_pct 
---------+-------------+----------------+---------------------
    1232 | EXECUTING   | @ 20.1 secs    |                  84
(1 row)

  select 1.0 - (20.0 + 1*0.3/3) / (105.1 + (20.0 + 1*0.3/3 ));  -- the completion % should be 84%
        ?column?        
------------------------
 0.83945686900958466454
(1 row)

-- the second RLBK_TABLE is completed, and the step duration > the estimated duration 
  update emaj.emaj_time_stamp set time_tx_timestamp = now() - '110.1 seconds'::interval where time_id = -1;
  update emaj.emaj_rlbk_plan set rlbp_start_datetime = now() - '65 seconds'::interval,
                                 rlbp_duration = '65 seconds'::interval
    where rlbp_rlbk_id = 1232 and rlbp_table = 't2';
  select rlbk_id, rlbk_status, rlbk_remaining, rlbk_completion_pct from emaj._rollback_activity();
 rlbk_id | rlbk_status | rlbk_remaining | rlbk_completion_pct 
---------+-------------+----------------+---------------------
    1232 | EXECUTING   | @ 20.1 secs    |                  85
(1 row)

  select 1.0 - (20.0 + 1*0.3/3) / (110.1 + (20.0 + 1*0.3/3));  -- the completion % should be 85%
        ?column?        
------------------------
 0.84562211981566820276
(1 row)

-- the third RLBK_TABLE has started, and is almost completed 
  update emaj.emaj_time_stamp set time_tx_timestamp = now() - '124.1 seconds'::interval where time_id = -1;
  update emaj.emaj_rlbk_plan set rlbp_start_datetime = now() - '19 seconds'::interval
    where rlbp_rlbk_id = 1232 and rlbp_table = 't3';
  select rlbk_id, rlbk_status, rlbk_remaining, rlbk_completion_pct from emaj._rollback_activity();
 rlbk_id | rlbk_status | rlbk_remaining | rlbk_completion_pct 
---------+-------------+----------------+---------------------
    1232 | EXECUTING   | @ 1 sec        |                  99
(1 row)

  select 1.0 - ((20.0 - 19.0)) / (124.1 + (20.0 - 19.0));  -- the completion % should be 99%
        ?column?        
------------------------
 0.99200639488409272582
(1 row)

rollback;
begin;
-- 1 rollback operation in LOCKING state and without step other than LOCK_TABLE
  insert into emaj.emaj_time_stamp (time_id, time_tx_timestamp) values (-1, now()-'2 minutes'::interval);
  insert into emaj.emaj_time_stamp (time_id, time_clock_timestamp) values (-2, '2000-01-01 01:00:00');
  insert into emaj.emaj_rlbk (rlbk_id, rlbk_groups, rlbk_mark, rlbk_mark_time_id, rlbk_time_id, rlbk_is_logged, rlbk_nb_session, 
             rlbk_nb_table, rlbk_nb_sequence, rlbk_eff_nb_table, rlbk_status)
    values (1233,array['group1233'],'mark1233',-2,-1,true,1,
             5,4,3,'LOCKING');
  insert into emaj.emaj_rlbk_plan (rlbp_rlbk_id, rlbp_step, rlbp_schema, rlbp_table, rlbp_fkey,
             rlbp_estimated_duration, rlbp_start_datetime, rlbp_duration)
    values (1233, 'LOCK_TABLE','schema','t1','',null,null,null),
           (1233, 'LOCK_TABLE','schema','t2','',null,null,null),
           (1233, 'LOCK_TABLE','schema','t3','',null,null,null);
  select rlbk_id, rlbk_status, rlbk_elapse, rlbk_remaining, rlbk_completion_pct from emaj._rollback_activity();
 rlbk_id | rlbk_status | rlbk_elapse | rlbk_remaining | rlbk_completion_pct 
---------+-------------+-------------+----------------+---------------------
    1233 | LOCKING     | @ 2 mins    | @ 0            |                   0
(1 row)

-- the rollback operation in LOCKING state now has RLBK_TABLE steps
  insert into emaj.emaj_rlbk_plan (rlbp_rlbk_id, rlbp_step, rlbp_schema, rlbp_table, rlbp_fkey,
             rlbp_estimated_duration, rlbp_start_datetime, rlbp_duration)
    values (1233, 'RLBK_TABLE','schema','t1','','0:20:00'::interval,null,null),
           (1233, 'RLBK_TABLE','schema','t2','','0:02:00'::interval,null,null),
           (1233, 'RLBK_TABLE','schema','t3','','0:00:20'::interval,null,null);
  select rlbk_id, rlbk_status, rlbk_elapse, rlbk_remaining, rlbk_completion_pct from emaj._rollback_activity();
 rlbk_id | rlbk_status | rlbk_elapse |  rlbk_remaining   | rlbk_completion_pct 
---------+-------------+-------------+-------------------+---------------------
    1233 | LOCKING     | @ 2 mins    | @ 22 mins 20 secs |                   0
(1 row)

-- +1 rollback operation in PLANNING state
  insert into emaj.emaj_time_stamp (time_id, time_tx_timestamp) values (-3, now()-'1 minute'::interval);
  insert into emaj.emaj_rlbk (rlbk_id, rlbk_groups, rlbk_mark, rlbk_mark_time_id, rlbk_time_id, rlbk_is_logged, rlbk_nb_session, 
             rlbk_nb_table, rlbk_nb_sequence, rlbk_eff_nb_table, rlbk_status)
    values (1234,array['group1234'],'mark1234',-2,-3,true,1,
             5,4,3,'PLANNING');
  select rlbk_id, rlbk_groups, rlbk_mark, rlbk_mark_datetime, rlbk_is_logged, rlbk_nb_session, rlbk_nb_table,
         rlbk_nb_sequence, rlbk_eff_nb_table, rlbk_status, rlbk_elapse, rlbk_remaining, rlbk_completion_pct 
    from emaj._rollback_activity();
 rlbk_id | rlbk_groups | rlbk_mark |      rlbk_mark_datetime      | rlbk_is_logged | rlbk_nb_session | rlbk_nb_table | rlbk_nb_sequence | rlbk_eff_nb_table | rlbk_status | rlbk_elapse |  rlbk_remaining   | rlbk_completion_pct 
---------+-------------+-----------+------------------------------+----------------+-----------------+---------------+------------------+-------------------+-------------+-------------+-------------------+---------------------
    1233 | {group1233} | mark1233  | Sat Jan 01 01:00:00 2000 PST | t              |               1 |             5 |                4 |                 3 | LOCKING     | @ 2 mins    | @ 22 mins 20 secs |                   0
    1234 | {group1234} | mark1234  | Sat Jan 01 01:00:00 2000 PST | t              |               1 |             5 |                4 |                 3 | PLANNING    | @ 1 min     |                   |                   0
(2 rows)

rollback;
-----------------------------
-- test emaj_consolidate_rollback_group() and emaj_get_consolidable_rollbacks()
-----------------------------
-- group is NULL or unknown
select emaj.emaj_consolidate_rollback_group(NULL,NULL);
ERROR:  emaj_consolidate_rollback_group: group "<NULL>" has not been created.
select emaj.emaj_consolidate_rollback_group('unknownGroup',NULL);
ERROR:  emaj_consolidate_rollback_group: group "unknownGroup" has not been created.
-- mark is unknown
select emaj.emaj_consolidate_rollback_group('myGroup1',NULL);
ERROR:  emaj_consolidate_rollback_group: mark "<NULL>" does not exist for group "myGroup1".
select emaj.emaj_consolidate_rollback_group('myGroup1','unknown mark');
ERROR:  emaj_consolidate_rollback_group: mark "unknown mark" does not exist for group "myGroup1".
-- mark is known but is not an end rollback mark
select emaj.emaj_consolidate_rollback_group('myGroup1','Mark12');
ERROR:  emaj_consolidate_rollback_group: mark "Mark12" for group "myGroup1" is not an end rollback mark.
-- mark is an end rollback mark but the rollback target mark is invalid
begin;
  update emaj.emaj_mark set mark_logged_rlbk_target_mark = 'dummy' where mark_name = 'Mark12';
  select emaj.emaj_consolidate_rollback_group('myGroup1','Mark12');
ERROR:  emaj_consolidate_rollback_group: rollback target mark "dummy" for group "myGroup1" has not been found.
rollback;
-- should be ok
set search_path=public,myschema1;
-- rollback without log rows to delete
select emaj.emaj_set_mark_group('myGroup1','Conso_M1');
 emaj_set_mark_group 
---------------------
                   6
(1 row)

select emaj.emaj_logged_rollback_group('myGroup1','Conso_M1');
 emaj_logged_rollback_group 
----------------------------
                          1
(1 row)

select emaj.emaj_consolidate_rollback_group('myGroup1','EMAJ_LAST_MARK');
 emaj_consolidate_rollback_group 
---------------------------------
                               1
(1 row)

-- mark Conso_M1, updates, mark Conso_M2, updates, logged rlbk back to Conso_M1, updates, rename both marks, consolidate, check and cancel
select emaj.emaj_set_mark_group('myGroup1','Conso_M2');
 emaj_set_mark_group 
---------------------
                   6
(1 row)

insert into myTbl1 select i, 'Test', 'Conso' from generate_series (1000,1011) as i;
insert into myTbl2 values (1000,'TC1',NULL);
delete from myTbl1 where col11 > 1010;
select emaj.emaj_set_mark_group('myGroup1','Conso_M3');
 emaj_set_mark_group 
---------------------
                   6
(1 row)

update myTbl2 set col22 = 'TC2' WHERE col22 ='TC1';
select emaj.emaj_logged_rollback_group('myGroup1','Conso_M2');
 emaj_logged_rollback_group 
----------------------------
                          4
(1 row)

insert into myTbl2 values (1000,'TC3',NULL);
select emaj.emaj_rename_mark_group('myGroup1','Conso_M2','Renamed_conso_M2');
 emaj_rename_mark_group 
------------------------
 
(1 row)

select emaj.emaj_rename_mark_group('myGroup1','EMAJ_LAST_MARK','Renamed_last_mark');
 emaj_rename_mark_group 
------------------------
 
(1 row)

select cons_group, cons_target_rlbk_mark_name, cons_target_rlbk_mark_id, 
       regexp_replace(cons_end_rlbk_mark_name,E'\\d\\d\.\\d\\d\\.\\d\\d\\.\\d\\d\\d','%','g'), cons_end_rlbk_mark_id, cons_rows, cons_marks 
  from emaj.emaj_get_consolidable_rollbacks();
 cons_group | cons_target_rlbk_mark_name | cons_target_rlbk_mark_id |    regexp_replace    | cons_end_rlbk_mark_id | cons_rows | cons_marks 
------------+----------------------------+--------------------------+----------------------+-----------------------+-----------+------------
 myGroup1   | Conso_M1                   |                      445 | RLBK_Conso_M1_%_DONE |                   447 |         0 |          0
 myGroup1   | Renamed_conso_M2           |                      448 | Renamed_last_mark    |                   451 |        32 |          2
(2 rows)

select emaj.emaj_consolidate_rollback_group('myGroup1','Renamed_last_mark');
 emaj_consolidate_rollback_group 
---------------------------------
                               4
(1 row)

select cons_group, cons_target_rlbk_mark_name, cons_target_rlbk_mark_id, 
       regexp_replace(cons_end_rlbk_mark_name,E'\\d\\d\.\\d\\d\\.\\d\\d\\.\\d\\d\\d','%','g'), cons_end_rlbk_mark_id, cons_rows, cons_marks
  from emaj.emaj_get_consolidable_rollbacks();
 cons_group | cons_target_rlbk_mark_name | cons_target_rlbk_mark_id |    regexp_replace    | cons_end_rlbk_mark_id | cons_rows | cons_marks 
------------+----------------------------+--------------------------+----------------------+-----------------------+-----------+------------
 myGroup1   | Conso_M1                   |                      445 | RLBK_Conso_M1_%_DONE |                   447 |         0 |          0
 myGroup1   | Renamed_conso_M2           |                      448 | Renamed_last_mark    |                   451 |         0 |          0
(2 rows)

-- consolidate a rollback already consolidated
select emaj.emaj_consolidate_rollback_group('myGroup1','Renamed_last_mark');
 emaj_consolidate_rollback_group 
---------------------------------
                               1
(1 row)

select mark_id, mark_group, regexp_replace(mark_name,E'\\d\\d\.\\d\\d\\.\\d\\d\\.\\d\\d\\d','%','g'), mark_time_id, mark_is_deleted, mark_is_rlbk_protected, mark_comment, mark_log_rows_before_next, mark_logged_rlbk_target_mark from emaj.emaj_mark where mark_group = 'myGroup1' order by mark_id;
 mark_id | mark_group |    regexp_replace    | mark_time_id | mark_is_deleted | mark_is_rlbk_protected | mark_comment | mark_log_rows_before_next | mark_logged_rlbk_target_mark 
---------+------------+----------------------+--------------+-----------------+------------------------+--------------+---------------------------+------------------------------
     434 | myGroup1   | Mark11               |          436 | f               | f                      |              |                        19 | 
     435 | myGroup1   | Mark12               |          437 | f               | f                      |              |                        11 | 
     436 | myGroup1   | Mark13               |          438 | f               | f                      |              |                         0 | 
     445 | myGroup1   | Conso_M1             |          450 | f               | f                      |              |                         0 | 
     447 | myGroup1   | RLBK_Conso_M1_%_DONE |          452 | f               | f                      |              |                         0 | Conso_M1
     448 | myGroup1   | Renamed_conso_M2     |          453 | f               | f                      |              |                         0 | 
     451 | myGroup1   | Renamed_last_mark    |          456 | f               | f                      |              |                           | Renamed_conso_M2
(7 rows)

select sequ_schema, sequ_name, sequ_time_id, sequ_last_val, sequ_is_called from emaj.emaj_sequence where sequ_name like 'myschema1%' order by sequ_time_id, sequ_schema, sequ_name;
 sequ_schema |         sequ_name         | sequ_time_id | sequ_last_val | sequ_is_called 
-------------+---------------------------+--------------+---------------+----------------
 emaj        | myschema1_mytbl1_log_seq  |          436 |             1 | f
 emaj        | myschema1_mytbl2_log_seq  |          436 |             1 | f
 emaj        | myschema1_mytbl4_log_seq  |          436 |             1 | f
 emajb       | myschema1_mytbl2b_log_seq |          436 |             1 | f
 emajC       | myschema1_myTbl3_log_seq  |          436 |             1 | f
 emaj        | myschema1_mytbl1_log_seq  |          437 |            15 | t
 emaj        | myschema1_mytbl2_log_seq  |          437 |             2 | t
 emaj        | myschema1_mytbl4_log_seq  |          437 |             1 | f
 emajb       | myschema1_mytbl2b_log_seq |          437 |             2 | t
 emajC       | myschema1_myTbl3_log_seq  |          437 |             1 | f
 emaj        | myschema1_mytbl1_log_seq  |          438 |            15 | t
 emaj        | myschema1_mytbl2_log_seq  |          438 |             2 | t
 emaj        | myschema1_mytbl4_log_seq  |          438 |             1 | t
 emajb       | myschema1_mytbl2b_log_seq |          438 |             2 | t
 emajC       | myschema1_myTbl3_log_seq  |          438 |            10 | t
 emaj        | myschema1_mytbl1_log_seq  |          450 |            25 | t
 emaj        | myschema1_mytbl2_log_seq  |          450 |             4 | t
 emaj        | myschema1_mytbl4_log_seq  |          450 |             2 | t
 emajb       | myschema1_mytbl2b_log_seq |          450 |             4 | t
 emajC       | myschema1_myTbl3_log_seq  |          450 |            20 | t
 emaj        | myschema1_mytbl1_log_seq  |          452 |            25 | t
 emaj        | myschema1_mytbl2_log_seq  |          452 |             4 | t
 emaj        | myschema1_mytbl4_log_seq  |          452 |             2 | t
 emajb       | myschema1_mytbl2b_log_seq |          452 |             4 | t
 emajC       | myschema1_myTbl3_log_seq  |          452 |            20 | t
 emaj        | myschema1_mytbl1_log_seq  |          453 |            25 | t
 emaj        | myschema1_mytbl2_log_seq  |          453 |             4 | t
 emaj        | myschema1_mytbl4_log_seq  |          453 |             2 | t
 emajb       | myschema1_mytbl2b_log_seq |          453 |             4 | t
 emajC       | myschema1_myTbl3_log_seq  |          453 |            20 | t
 emaj        | myschema1_mytbl1_log_seq  |          456 |            49 | t
 emaj        | myschema1_mytbl2_log_seq  |          456 |             7 | t
 emaj        | myschema1_mytbl4_log_seq  |          456 |             2 | t
 emajb       | myschema1_mytbl2b_log_seq |          456 |             9 | t
 emajC       | myschema1_myTbl3_log_seq  |          456 |            20 | t
(35 rows)

select sqhl_schema, sqhl_table, sqhl_begin_time_id, sqhl_end_time_id, sqhl_hole_size from emaj.emaj_seq_hole where sqhl_schema = 'myschema1' order by 1,2,3;
 sqhl_schema | sqhl_table | sqhl_begin_time_id | sqhl_end_time_id | sqhl_hole_size 
-------------+------------+--------------------+------------------+----------------
 myschema1   | mytbl1     |                438 |              443 |             10
 myschema1   | mytbl1     |                453 |              456 |             24
 myschema1   | mytbl2     |                438 |              443 |              2
 myschema1   | mytbl2     |                453 |              456 |              3
 myschema1   | mytbl2b    |                438 |              443 |              2
 myschema1   | mytbl2b    |                453 |              456 |              5
 myschema1   | myTbl3     |                438 |              443 |             10
 myschema1   | mytbl4     |                438 |              443 |              1
(8 rows)

select emaj.emaj_rollback_group('myGroup1','Conso_M1');
 emaj_rollback_group 
---------------------
                   3
(1 row)

-----------------------------
-- test emaj_cleanup_rollback_state()
-----------------------------
-- rollback a transaction with an E-Maj rollback to generate an ABORTED rollback event
begin;
  select emaj.emaj_rollback_group('myGroup4','myGroup4_start');
 emaj_rollback_group 
---------------------
                   0
(1 row)

rollback;
select rlbk_id, rlbk_status, rlbk_begin_hist_id, rlbk_nb_session from emaj.emaj_rlbk
  where rlbk_status in ('PLANNING', 'LOCKING', 'EXECUTING', 'COMPLETED') order by rlbk_id;
 rlbk_id | rlbk_status | rlbk_begin_hist_id | rlbk_nb_session 
---------+-------------+--------------------+-----------------
      21 | COMPLETED   |               4380 |               1
      22 | COMPLETED   |               4405 |               1
      23 | COMPLETED   |               4419 |               1
(3 rows)

select emaj.emaj_cleanup_rollback_state();
 emaj_cleanup_rollback_state 
-----------------------------
                           3
(1 row)

-----------------------------
-- check rollback tables
-----------------------------
select rlbk_id, rlbk_groups, rlbk_mark, rlbk_time_id, rlbk_is_logged, rlbk_nb_session, rlbk_nb_table, rlbk_nb_sequence, 
       rlbk_eff_nb_table, rlbk_status, rlbk_begin_hist_id, rlbk_is_dblink_used,
       case when rlbk_end_datetime is null then 'null' else '[ts]' end as "end_datetime", rlbk_msg
  from emaj.emaj_rlbk order by rlbk_id;
 rlbk_id |     rlbk_groups     |   rlbk_mark    | rlbk_time_id | rlbk_is_logged | rlbk_nb_session | rlbk_nb_table | rlbk_nb_sequence | rlbk_eff_nb_table | rlbk_status | rlbk_begin_hist_id | rlbk_is_dblink_used | end_datetime |                         rlbk_msg                          
---------+---------------------+----------------+--------------+----------------+-----------------+---------------+------------------+-------------------+-------------+--------------------+---------------------+--------------+-----------------------------------------------------------
       1 | {myGroup1}          | Different_Mark |          406 | f              |               1 |             5 |                1 |                 0 | COMMITTED   |               4036 | f                   | [ts]         | Completed: 0 tables and 1 sequences effectively processed
       4 | {myGroup1}          | Different_Mark |          415 | f              |               1 |             5 |                1 |                 0 | COMMITTED   |               4088 | f                   | [ts]         | Completed: 0 tables and 1 sequences effectively processed
       5 | {myGroup2}          | Mark21         |          416 | f              |               1 |             6 |                2 |                 0 | COMMITTED   |               4094 | f                   | [ts]         | Completed: 0 tables and 2 sequences effectively processed
       6 | {myGroup1}          | Different_Mark |          417 | t              |               1 |             5 |                1 |                 0 | COMMITTED   |               4102 | f                   | [ts]         | Completed: 0 tables and 1 sequences effectively processed
       7 | {myGroup2}          | Mark21         |          419 | t              |               1 |             6 |                2 |                 0 | COMMITTED   |               4112 | f                   | [ts]         | Completed: 0 tables and 2 sequences effectively processed
       8 | {myGroup1,myGroup2} | Mark1B         |          422 | f              |               1 |            11 |                3 |                 0 | COMMITTED   |               4127 | f                   | [ts]         | Completed: 0 tables and 3 sequences effectively processed
       9 | {myGroup1,myGroup2} | Mark1B         |          423 | f              |               1 |            11 |                3 |                 0 | COMMITTED   |               4135 | f                   | [ts]         | Completed: 0 tables and 3 sequences effectively processed
      10 | {myGroup1,myGroup2} | Mark1B         |          424 | t              |               1 |            11 |                3 |                 0 | COMMITTED   |               4143 | f                   | [ts]         | Completed: 0 tables and 3 sequences effectively processed
      11 | {myGroup1,myGroup2} | Mark1B         |          426 | t              |               1 |            11 |                3 |                 0 | COMMITTED   |               4155 | t                   | [ts]         | Completed: 0 tables and 3 sequences effectively processed
      12 | {myGroup1}          | Mark12         |          433 | f              |               1 |             5 |                1 |                 2 | COMMITTED   |               4195 | t                   | [ts]         | Completed: 2 tables and 1 sequences effectively processed
      13 | {myGroup1}          | Mark11         |          434 | f              |               1 |             5 |                1 |                 3 | COMMITTED   |               4207 | t                   | [ts]         | Completed: 3 tables and 1 sequences effectively processed
      14 | {myGroup1}          | Mark12         |          439 | t              |               1 |             5 |                1 |                 2 | COMMITTED   |               4243 | t                   | [ts]         | Completed: 2 tables and 1 sequences effectively processed
      15 | {myGroup1}          | Mark11         |          441 | t              |               1 |             5 |                1 |                 5 | COMMITTED   |               4258 | t                   | [ts]         | Completed: 5 tables and 1 sequences effectively processed
      16 | {myGroup1}          | Mark13         |          443 | f              |               1 |             5 |                1 |                 5 | COMMITTED   |               4280 | t                   | [ts]         | Completed: 5 tables and 1 sequences effectively processed
      17 | {emptyGroup}        | MarkInit       |          444 | f              |               1 |             0 |                0 |                 0 | COMMITTED   |               4301 | t                   | [ts]         | Completed: 0 tables and 0 sequences effectively processed
      18 | {myGroup4}          | mark1          |          447 | t              |               1 |             3 |                0 |                 3 | COMMITTED   |               4320 | t                   | [ts]         | Completed: 3 tables and 0 sequences effectively processed
      19 | {myGroup4}          | myGroup4_start |          449 | f              |               1 |             3 |                0 |                 3 | COMMITTED   |               4336 | t                   | [ts]         | Completed: 3 tables and 0 sequences effectively processed
      20 | {myGroup1}          | Conso_M1       |          451 | t              |               1 |             5 |                1 |                 0 | COMMITTED   |               4358 | t                   | [ts]         | Completed: 0 tables and 1 sequences effectively processed
      21 | {myGroup1}          | Conso_M2       |          455 | t              |               1 |             5 |                1 |                 3 | COMMITTED   |               4380 | t                   | [ts]         | Completed: 3 tables and 1 sequences effectively processed
      22 | {myGroup1}          | Conso_M1       |          457 | f              |               1 |             5 |                1 |                 2 | COMMITTED   |               4405 | t                   | [ts]         | Completed: 2 tables and 1 sequences effectively processed
      23 | {myGroup4}          | myGroup4_start |          458 | f              |               1 |             3 |                0 |                 0 | ABORTED     |               4419 | t                   | [ts]         | Completed: 0 tables and 0 sequences effectively processed
(21 rows)

select rlbs_rlbk_id, rlbs_session, 
       case when rlbs_end_datetime is null then 'null' else '[ts]' end as "end_datetime"
  from emaj.emaj_rlbk_session order by rlbs_rlbk_id, rlbs_session;
 rlbs_rlbk_id | rlbs_session | end_datetime 
--------------+--------------+--------------
            1 |            1 | [ts]
            4 |            1 | [ts]
            5 |            1 | [ts]
            6 |            1 | [ts]
            7 |            1 | [ts]
            8 |            1 | [ts]
            9 |            1 | [ts]
           10 |            1 | [ts]
           11 |            1 | [ts]
           12 |            1 | [ts]
           13 |            1 | [ts]
           14 |            1 | [ts]
           15 |            1 | [ts]
           16 |            1 | [ts]
           17 |            1 | [ts]
           18 |            1 | [ts]
           19 |            1 | [ts]
           20 |            1 | [ts]
           21 |            1 | [ts]
           22 |            1 | [ts]
           23 |            1 | [ts]
(21 rows)

select rlbp_rlbk_id, rlbp_step, rlbp_schema, rlbp_table, rlbp_fkey, rlbp_batch_number, rlbp_session,
       rlbp_fkey_def, rlbp_estimated_quantity, rlbp_estimate_method, rlbp_quantity
  from emaj.emaj_rlbk_plan order by rlbp_rlbk_id, rlbp_step, rlbp_schema, rlbp_table, rlbp_fkey;
 rlbp_rlbk_id |  rlbp_step  | rlbp_schema | rlbp_table |     rlbp_fkey     | rlbp_batch_number | rlbp_session |                                                              rlbp_fkey_def                                                              | rlbp_estimated_quantity | rlbp_estimate_method | rlbp_quantity 
--------------+-------------+-------------+------------+-------------------+-------------------+--------------+-----------------------------------------------------------------------------------------------------------------------------------------+-------------------------+----------------------+---------------
           12 | DIS_LOG_TRG | myschema1   | myTbl3     |                   |                 1 |            1 |                                                                                                                                         |                         |                    3 |              
           12 | DIS_LOG_TRG | myschema1   | mytbl4     |                   |                 2 |            1 |                                                                                                                                         |                         |                    3 |              
           12 | DROP_FK     | myschema1   | mytbl4     | mytbl4_col44_fkey |                 2 |            1 |                                                                                                                                         |                         |                    3 |              
           12 | SET_FK_DEF  | myschema1   | mytbl4     | mytbl4_col43_fkey |                 2 |            1 |                                                                                                                                         |                         |                    3 |              
           12 | RLBK_TABLE  | myschema1   | myTbl3     |                   |                 1 |            1 |                                                                                                                                         |                      10 |                    3 |            10
           12 | RLBK_TABLE  | myschema1   | mytbl4     |                   |                 2 |            1 |                                                                                                                                         |                       2 |                    3 |             1
           12 | DELETE_LOG  | myschema1   | myTbl3     |                   |                 1 |            1 |                                                                                                                                         |                      10 |                    3 |            10
           12 | DELETE_LOG  | myschema1   | mytbl4     |                   |                 2 |            1 |                                                                                                                                         |                       2 |                    3 |             3
           12 | SET_FK_IMM  | myschema1   | mytbl4     | mytbl4_col43_fkey |                 2 |            1 |                                                                                                                                         |                       2 |                    3 |              
           12 | ADD_FK      | myschema1   | mytbl4     | mytbl4_col44_fkey |                 2 |            1 | FOREIGN KEY (col44, col45) REFERENCES myschema1.mytbl1(col11, col12) ON UPDATE SET NULL ON DELETE CASCADE DEFERRABLE INITIALLY DEFERRED |                       0 |                    3 |              
           12 | ENA_LOG_TRG | myschema1   | myTbl3     |                   |                 1 |            1 |                                                                                                                                         |                         |                    3 |              
           12 | ENA_LOG_TRG | myschema1   | mytbl4     |                   |                 2 |            1 |                                                                                                                                         |                         |                    3 |              
           12 | CTRL+DBLINK |             |            |                   |                   |              |                                                                                                                                         |                      12 |                    3 |              
           13 | DIS_LOG_TRG | myschema1   | mytbl1     |                   |                 1 |            1 |                                                                                                                                         |                         |                    2 |              
           13 | DIS_LOG_TRG | myschema1   | mytbl2     |                   |                 1 |            1 |                                                                                                                                         |                         |                    2 |              
           13 | DIS_LOG_TRG | myschema1   | mytbl2b    |                   |                 2 |            1 |                                                                                                                                         |                         |                    2 |              
           13 | DROP_FK     | myschema1   | mytbl4     | mytbl4_col44_fkey |                 1 |            1 |                                                                                                                                         |                         |                    2 |              
           13 | SET_FK_DEF  | myschema1   | mytbl4     | mytbl4_col43_fkey |                 1 |            1 |                                                                                                                                         |                         |                    2 |              
           13 | RLBK_TABLE  | myschema1   | mytbl1     |                   |                 1 |            1 |                                                                                                                                         |                      15 |                    3 |            11
           13 | RLBK_TABLE  | myschema1   | mytbl2     |                   |                 1 |            1 |                                                                                                                                         |                       6 |                    3 |             3
           13 | RLBK_TABLE  | myschema1   | mytbl2b    |                   |                 2 |            1 |                                                                                                                                         |                       6 |                    3 |             6
           13 | DELETE_LOG  | myschema1   | mytbl1     |                   |                 1 |            1 |                                                                                                                                         |                      15 |                    3 |            18
           13 | DELETE_LOG  | myschema1   | mytbl2     |                   |                 1 |            1 |                                                                                                                                         |                       6 |                    3 |             8
           13 | DELETE_LOG  | myschema1   | mytbl2b    |                   |                 2 |            1 |                                                                                                                                         |                       6 |                    3 |             6
           13 | SET_FK_IMM  | myschema1   | mytbl4     | mytbl4_col43_fkey |                 1 |            1 |                                                                                                                                         |                       6 |                    2 |              
           13 | ADD_FK      | myschema1   | mytbl4     | mytbl4_col44_fkey |                 1 |            1 | FOREIGN KEY (col44, col45) REFERENCES myschema1.mytbl1(col11, col12) ON UPDATE SET NULL ON DELETE CASCADE DEFERRABLE INITIALLY DEFERRED |                       0 |                    3 |              
           13 | ENA_LOG_TRG | myschema1   | mytbl1     |                   |                 1 |            1 |                                                                                                                                         |                         |                    2 |              
           13 | ENA_LOG_TRG | myschema1   | mytbl2     |                   |                 1 |            1 |                                                                                                                                         |                         |                    2 |              
           13 | ENA_LOG_TRG | myschema1   | mytbl2b    |                   |                 2 |            1 |                                                                                                                                         |                         |                    2 |              
           13 | CTRL+DBLINK |             |            |                   |                   |              |                                                                                                                                         |                      16 |                    2 |              
           14 | DROP_FK     | myschema1   | mytbl4     | mytbl4_col44_fkey |                 2 |            1 |                                                                                                                                         |                         |                    2 |              
           14 | SET_FK_DEF  | myschema1   | mytbl4     | mytbl4_col43_fkey |                 2 |            1 |                                                                                                                                         |                         |                    2 |              
           14 | RLBK_TABLE  | myschema1   | myTbl3     |                   |                 1 |            1 |                                                                                                                                         |                      10 |                    1 |            10
           14 | RLBK_TABLE  | myschema1   | mytbl4     |                   |                 2 |            1 |                                                                                                                                         |                       1 |                    1 |             1
           14 | SET_FK_IMM  | myschema1   | mytbl4     | mytbl4_col43_fkey |                 2 |            1 |                                                                                                                                         |                       1 |                    2 |              
           14 | ADD_FK      | myschema1   | mytbl4     | mytbl4_col44_fkey |                 2 |            1 | FOREIGN KEY (col44, col45) REFERENCES myschema1.mytbl1(col11, col12) ON UPDATE SET NULL ON DELETE CASCADE DEFERRABLE INITIALLY DEFERRED |                       0 |                    3 |              
           14 | CTRL+DBLINK |             |            |                   |                   |              |                                                                                                                                         |                       6 |                    2 |              
           15 | DROP_FK     | myschema1   | mytbl4     | mytbl4_col44_fkey |                 2 |            1 |                                                                                                                                         |                         |                    2 |              
           15 | SET_FK_DEF  | myschema1   | mytbl4     | mytbl4_col43_fkey |                 2 |            1 |                                                                                                                                         |                         |                    2 |              
           15 | RLBK_TABLE  | myschema1   | mytbl1     |                   |                 2 |            1 |                                                                                                                                         |                      15 |                    1 |            11
           15 | RLBK_TABLE  | myschema1   | mytbl2     |                   |                 2 |            1 |                                                                                                                                         |                       2 |                    1 |             2
           15 | RLBK_TABLE  | myschema1   | mytbl2b    |                   |                 3 |            1 |                                                                                                                                         |                       2 |                    1 |             2
           15 | RLBK_TABLE  | myschema1   | myTbl3     |                   |                 1 |            1 |                                                                                                                                         |                      20 |                    1 |            10
           15 | RLBK_TABLE  | myschema1   | mytbl4     |                   |                 2 |            1 |                                                                                                                                         |                       2 |                    1 |             1
           15 | SET_FK_IMM  | myschema1   | mytbl4     | mytbl4_col43_fkey |                 2 |            1 |                                                                                                                                         |                       4 |                    2 |              
           15 | ADD_FK      | myschema1   | mytbl4     | mytbl4_col44_fkey |                 2 |            1 | FOREIGN KEY (col44, col45) REFERENCES myschema1.mytbl1(col11, col12) ON UPDATE SET NULL ON DELETE CASCADE DEFERRABLE INITIALLY DEFERRED |                       0 |                    3 |              
           15 | CTRL+DBLINK |             |            |                   |                   |              |                                                                                                                                         |                       9 |                    2 |              
           16 | DIS_LOG_TRG | myschema1   | mytbl1     |                   |                 1 |            1 |                                                                                                                                         |                         |                    2 |              
           16 | DIS_LOG_TRG | myschema1   | mytbl2     |                   |                 1 |            1 |                                                                                                                                         |                         |                    2 |              
           16 | DIS_LOG_TRG | myschema1   | mytbl2b    |                   |                 3 |            1 |                                                                                                                                         |                         |                    2 |              
           16 | DIS_LOG_TRG | myschema1   | myTbl3     |                   |                 2 |            1 |                                                                                                                                         |                         |                    2 |              
           16 | DIS_LOG_TRG | myschema1   | mytbl4     |                   |                 1 |            1 |                                                                                                                                         |                         |                    2 |              
           16 | DROP_FK     | myschema1   | mytbl4     | mytbl4_col44_fkey |                 1 |            1 |                                                                                                                                         |                         |                    2 |              
           16 | SET_FK_DEF  | myschema1   | mytbl4     | mytbl4_col43_fkey |                 1 |            1 |                                                                                                                                         |                         |                    2 |              
           16 | RLBK_TABLE  | myschema1   | mytbl1     |                   |                 1 |            1 |                                                                                                                                         |                      10 |                    1 |            10
           16 | RLBK_TABLE  | myschema1   | mytbl2     |                   |                 1 |            1 |                                                                                                                                         |                       2 |                    1 |             2
           16 | RLBK_TABLE  | myschema1   | mytbl2b    |                   |                 3 |            1 |                                                                                                                                         |                       2 |                    1 |             2
           16 | RLBK_TABLE  | myschema1   | myTbl3     |                   |                 2 |            1 |                                                                                                                                         |                      10 |                    1 |            10
           16 | RLBK_TABLE  | myschema1   | mytbl4     |                   |                 1 |            1 |                                                                                                                                         |                       1 |                    1 |             1
           16 | DELETE_LOG  | myschema1   | mytbl1     |                   |                 1 |            1 |                                                                                                                                         |                      10 |                    1 |            10
           16 | DELETE_LOG  | myschema1   | mytbl2     |                   |                 1 |            1 |                                                                                                                                         |                       2 |                    1 |             2
           16 | DELETE_LOG  | myschema1   | mytbl2b    |                   |                 3 |            1 |                                                                                                                                         |                       2 |                    1 |             2
           16 | DELETE_LOG  | myschema1   | myTbl3     |                   |                 2 |            1 |                                                                                                                                         |                      10 |                    1 |            10
           16 | DELETE_LOG  | myschema1   | mytbl4     |                   |                 1 |            1 |                                                                                                                                         |                       1 |                    1 |             1
           16 | SET_FK_IMM  | myschema1   | mytbl4     | mytbl4_col43_fkey |                 1 |            1 |                                                                                                                                         |                       3 |                    2 |              
           16 | ADD_FK      | myschema1   | mytbl4     | mytbl4_col44_fkey |                 1 |            1 | FOREIGN KEY (col44, col45) REFERENCES myschema1.mytbl1(col11, col12) ON UPDATE SET NULL ON DELETE CASCADE DEFERRABLE INITIALLY DEFERRED |                       0 |                    3 |              
           16 | ENA_LOG_TRG | myschema1   | mytbl1     |                   |                 1 |            1 |                                                                                                                                         |                         |                    2 |              
           16 | ENA_LOG_TRG | myschema1   | mytbl2     |                   |                 1 |            1 |                                                                                                                                         |                         |                    2 |              
           16 | ENA_LOG_TRG | myschema1   | mytbl2b    |                   |                 3 |            1 |                                                                                                                                         |                         |                    2 |              
           16 | ENA_LOG_TRG | myschema1   | myTbl3     |                   |                 2 |            1 |                                                                                                                                         |                         |                    2 |              
           16 | ENA_LOG_TRG | myschema1   | mytbl4     |                   |                 1 |            1 |                                                                                                                                         |                         |                    2 |              
           16 | CTRL+DBLINK |             |            |                   |                   |              |                                                                                                                                         |                      24 |                    2 |              
           18 | RLBK_TABLE  | myschema4   | mytblc1    |                   |                 1 |            1 |                                                                                                                                         |                       1 |                    3 |             1
           18 | RLBK_TABLE  | myschema4   | mytblc2    |                   |                 2 |            1 |                                                                                                                                         |                       1 |                    3 |             1
           18 | RLBK_TABLE  | myschema4   | mytblm     |                   |                 3 |            1 |                                                                                                                                         |                       1 |                    3 |             1
           18 | CTRL+DBLINK |             |            |                   |                   |              |                                                                                                                                         |                       3 |                    2 |              
           19 | DIS_LOG_TRG | myschema4   | mytblc1    |                   |                 1 |            1 |                                                                                                                                         |                         |                    2 |              
           19 | DIS_LOG_TRG | myschema4   | mytblc2    |                   |                 2 |            1 |                                                                                                                                         |                         |                    2 |              
           19 | DIS_LOG_TRG | myschema4   | mytblm     |                   |                 3 |            1 |                                                                                                                                         |                         |                    2 |              
           19 | RLBK_TABLE  | myschema4   | mytblc1    |                   |                 1 |            1 |                                                                                                                                         |                       3 |                    1 |             1
           19 | RLBK_TABLE  | myschema4   | mytblc2    |                   |                 2 |            1 |                                                                                                                                         |                       3 |                    1 |             1
           19 | RLBK_TABLE  | myschema4   | mytblm     |                   |                 3 |            1 |                                                                                                                                         |                       3 |                    1 |             1
           19 | DELETE_LOG  | myschema4   | mytblc1    |                   |                 1 |            1 |                                                                                                                                         |                       3 |                    3 |             3
           19 | DELETE_LOG  | myschema4   | mytblc2    |                   |                 2 |            1 |                                                                                                                                         |                       3 |                    3 |             3
           19 | DELETE_LOG  | myschema4   | mytblm     |                   |                 3 |            1 |                                                                                                                                         |                       3 |                    3 |             3
           19 | ENA_LOG_TRG | myschema4   | mytblc1    |                   |                 1 |            1 |                                                                                                                                         |                         |                    2 |              
           19 | ENA_LOG_TRG | myschema4   | mytblc2    |                   |                 2 |            1 |                                                                                                                                         |                         |                    2 |              
           19 | ENA_LOG_TRG | myschema4   | mytblm     |                   |                 3 |            1 |                                                                                                                                         |                         |                    2 |              
           19 | CTRL+DBLINK |             |            |                   |                   |              |                                                                                                                                         |                      12 |                    2 |              
           21 | DROP_FK     | myschema1   | mytbl4     | mytbl4_col44_fkey |                 1 |            1 |                                                                                                                                         |                         |                    2 |              
           21 | SET_FK_DEF  | myschema1   | mytbl4     | mytbl4_col43_fkey |                 1 |            1 |                                                                                                                                         |                         |                    2 |              
           21 | RLBK_TABLE  | myschema1   | mytbl1     |                   |                 1 |            1 |                                                                                                                                         |                      13 |                    1 |            12
           21 | RLBK_TABLE  | myschema1   | mytbl2     |                   |                 1 |            1 |                                                                                                                                         |                       2 |                    1 |             1
           21 | RLBK_TABLE  | myschema1   | mytbl2b    |                   |                 2 |            1 |                                                                                                                                         |                       2 |                    1 |             2
           21 | SET_FK_IMM  | myschema1   | mytbl4     | mytbl4_col43_fkey |                 1 |            1 |                                                                                                                                         |                       2 |                    2 |              
           21 | ADD_FK      | myschema1   | mytbl4     | mytbl4_col44_fkey |                 1 |            1 | FOREIGN KEY (col44, col45) REFERENCES myschema1.mytbl1(col11, col12) ON UPDATE SET NULL ON DELETE CASCADE DEFERRABLE INITIALLY DEFERRED |                       0 |                    3 |              
           21 | CTRL+DBLINK |             |            |                   |                   |              |                                                                                                                                         |                       7 |                    2 |              
           22 | DIS_LOG_TRG | myschema1   | mytbl2     |                   |                 1 |            1 |                                                                                                                                         |                         |                    2 |              
           22 | DIS_LOG_TRG | myschema1   | mytbl2b    |                   |                 2 |            1 |                                                                                                                                         |                         |                    2 |              
           22 | SET_FK_DEF  | myschema1   | mytbl4     | mytbl4_col43_fkey |                 1 |            1 |                                                                                                                                         |                         |                    2 |              
           22 | RLBK_TABLE  | myschema1   | mytbl2     |                   |                 1 |            1 |                                                                                                                                         |                       1 |                    1 |             1
           22 | RLBK_TABLE  | myschema1   | mytbl2b    |                   |                 2 |            1 |                                                                                                                                         |                       1 |                    1 |             1
           22 | DELETE_LOG  | myschema1   | mytbl2     |                   |                 1 |            1 |                                                                                                                                         |                       1 |                    1 |             1
           22 | DELETE_LOG  | myschema1   | mytbl2b    |                   |                 2 |            1 |                                                                                                                                         |                       1 |                    1 |             2
           22 | SET_FK_IMM  | myschema1   | mytbl4     | mytbl4_col43_fkey |                 1 |            1 |                                                                                                                                         |                       1 |                    2 |              
           22 | ENA_LOG_TRG | myschema1   | mytbl2     |                   |                 1 |            1 |                                                                                                                                         |                         |                    2 |              
           22 | ENA_LOG_TRG | myschema1   | mytbl2b    |                   |                 2 |            1 |                                                                                                                                         |                         |                    2 |              
           22 | CTRL+DBLINK |             |            |                   |                   |              |                                                                                                                                         |                      10 |                    2 |              
(108 rows)

select rlbt_step, rlbt_schema, rlbt_table, rlbt_fkey, rlbt_rlbk_id, rlbt_quantity from emaj.emaj_rlbk_stat
  order by rlbt_rlbk_id, rlbt_step, rlbt_schema, rlbt_table, rlbt_fkey;
  rlbt_step  | rlbt_schema | rlbt_table |     rlbt_fkey     | rlbt_rlbk_id | rlbt_quantity 
-------------+-------------+------------+-------------------+--------------+---------------
 DIS_LOG_TRG |             |            |                   |           12 |             2
 DROP_FK     |             |            |                   |           12 |             1
 SET_FK_DEF  |             |            |                   |           12 |             1
 RLBK_TABLE  | myschema1   | myTbl3     |                   |           12 |            10
 RLBK_TABLE  | myschema1   | mytbl4     |                   |           12 |             2
 DELETE_LOG  | myschema1   | myTbl3     |                   |           12 |            10
 DELETE_LOG  | myschema1   | mytbl4     |                   |           12 |             2
 SET_FK_IMM  | myschema1   | mytbl4     | mytbl4_col43_fkey |           12 |             2
 ADD_FK      | myschema1   | mytbl4     | mytbl4_col44_fkey |           12 |             0
 ENA_LOG_TRG |             |            |                   |           12 |             2
 CTRL+DBLINK |             |            |                   |           12 |            12
 DIS_LOG_TRG |             |            |                   |           13 |             3
 DROP_FK     |             |            |                   |           13 |             1
 SET_FK_DEF  |             |            |                   |           13 |             1
 RLBK_TABLE  | myschema1   | mytbl1     |                   |           13 |            15
 RLBK_TABLE  | myschema1   | mytbl2     |                   |           13 |             6
 RLBK_TABLE  | myschema1   | mytbl2b    |                   |           13 |             6
 DELETE_LOG  | myschema1   | mytbl1     |                   |           13 |            15
 DELETE_LOG  | myschema1   | mytbl2     |                   |           13 |             6
 DELETE_LOG  | myschema1   | mytbl2b    |                   |           13 |             6
 SET_FK_IMM  | myschema1   | mytbl4     | mytbl4_col43_fkey |           13 |             6
 ADD_FK      | myschema1   | mytbl4     | mytbl4_col44_fkey |           13 |             0
 ENA_LOG_TRG |             |            |                   |           13 |             3
 CTRL+DBLINK |             |            |                   |           13 |            16
 DROP_FK     |             |            |                   |           14 |             1
 SET_FK_DEF  |             |            |                   |           14 |             1
 RLBK_TABLE  | myschema1   | myTbl3     |                   |           14 |            10
 RLBK_TABLE  | myschema1   | mytbl4     |                   |           14 |             1
 SET_FK_IMM  | myschema1   | mytbl4     | mytbl4_col43_fkey |           14 |             1
 ADD_FK      | myschema1   | mytbl4     | mytbl4_col44_fkey |           14 |             0
 CTRL+DBLINK |             |            |                   |           14 |             6
 DROP_FK     |             |            |                   |           15 |             1
 SET_FK_DEF  |             |            |                   |           15 |             1
 RLBK_TABLE  | myschema1   | mytbl1     |                   |           15 |            15
 RLBK_TABLE  | myschema1   | mytbl2     |                   |           15 |             2
 RLBK_TABLE  | myschema1   | mytbl2b    |                   |           15 |             2
 RLBK_TABLE  | myschema1   | myTbl3     |                   |           15 |            20
 RLBK_TABLE  | myschema1   | mytbl4     |                   |           15 |             2
 SET_FK_IMM  | myschema1   | mytbl4     | mytbl4_col43_fkey |           15 |             4
 ADD_FK      | myschema1   | mytbl4     | mytbl4_col44_fkey |           15 |             0
 CTRL+DBLINK |             |            |                   |           15 |             9
 DIS_LOG_TRG |             |            |                   |           16 |             5
 DROP_FK     |             |            |                   |           16 |             1
 SET_FK_DEF  |             |            |                   |           16 |             1
 RLBK_TABLE  | myschema1   | mytbl1     |                   |           16 |            10
 RLBK_TABLE  | myschema1   | mytbl2     |                   |           16 |             2
 RLBK_TABLE  | myschema1   | mytbl2b    |                   |           16 |             2
 RLBK_TABLE  | myschema1   | myTbl3     |                   |           16 |            10
 RLBK_TABLE  | myschema1   | mytbl4     |                   |           16 |             1
 DELETE_LOG  | myschema1   | mytbl1     |                   |           16 |            10
 DELETE_LOG  | myschema1   | mytbl2     |                   |           16 |             2
 DELETE_LOG  | myschema1   | mytbl2b    |                   |           16 |             2
 DELETE_LOG  | myschema1   | myTbl3     |                   |           16 |            10
 DELETE_LOG  | myschema1   | mytbl4     |                   |           16 |             1
 SET_FK_IMM  | myschema1   | mytbl4     | mytbl4_col43_fkey |           16 |             3
 ADD_FK      | myschema1   | mytbl4     | mytbl4_col44_fkey |           16 |             0
 ENA_LOG_TRG |             |            |                   |           16 |             5
 CTRL+DBLINK |             |            |                   |           16 |            24
 RLBK_TABLE  | myschema4   | mytblc1    |                   |           18 |             1
 RLBK_TABLE  | myschema4   | mytblc2    |                   |           18 |             1
 RLBK_TABLE  | myschema4   | mytblm     |                   |           18 |             1
 CTRL+DBLINK |             |            |                   |           18 |             3
 DIS_LOG_TRG |             |            |                   |           19 |             3
 RLBK_TABLE  | myschema4   | mytblc1    |                   |           19 |             3
 RLBK_TABLE  | myschema4   | mytblc2    |                   |           19 |             3
 RLBK_TABLE  | myschema4   | mytblm     |                   |           19 |             3
 DELETE_LOG  | myschema4   | mytblc1    |                   |           19 |             3
 DELETE_LOG  | myschema4   | mytblc2    |                   |           19 |             3
 DELETE_LOG  | myschema4   | mytblm     |                   |           19 |             3
 ENA_LOG_TRG |             |            |                   |           19 |             3
 CTRL+DBLINK |             |            |                   |           19 |            12
 DROP_FK     |             |            |                   |           21 |             1
 SET_FK_DEF  |             |            |                   |           21 |             1
 RLBK_TABLE  | myschema1   | mytbl1     |                   |           21 |            13
 RLBK_TABLE  | myschema1   | mytbl2     |                   |           21 |             2
 RLBK_TABLE  | myschema1   | mytbl2b    |                   |           21 |             2
 SET_FK_IMM  | myschema1   | mytbl4     | mytbl4_col43_fkey |           21 |             2
 ADD_FK      | myschema1   | mytbl4     | mytbl4_col44_fkey |           21 |             0
 CTRL+DBLINK |             |            |                   |           21 |             7
 DIS_LOG_TRG |             |            |                   |           22 |             2
 SET_FK_DEF  |             |            |                   |           22 |             1
 RLBK_TABLE  | myschema1   | mytbl2     |                   |           22 |             1
 RLBK_TABLE  | myschema1   | mytbl2b    |                   |           22 |             1
 DELETE_LOG  | myschema1   | mytbl2     |                   |           22 |             1
 DELETE_LOG  | myschema1   | mytbl2b    |                   |           22 |             1
 SET_FK_IMM  | myschema1   | mytbl4     | mytbl4_col43_fkey |           22 |             1
 ENA_LOG_TRG |             |            |                   |           22 |             2
 CTRL+DBLINK |             |            |                   |           22 |            10
(88 rows)

-----------------------------
-- test end: reset history and force sequences id
-----------------------------
select time_id, time_last_emaj_gid, time_event from emaj.emaj_time_stamp where time_id >= 300 order by time_id;
 time_id | time_last_emaj_gid | time_event 
---------+--------------------+------------
     300 |                  2 | M
     301 |                  2 | M
     302 |                  2 | M
     303 |                  2 | M
     304 |                  2 | M
     305 |                  2 | M
     306 |                  2 | M
     307 |                  2 | M
     308 |                  2 | M
     309 |                  2 | M
     310 |                  2 | M
     311 |                  2 | M
     312 |                  2 | M
     313 |                  2 | M
     314 |                  2 | M
     315 |                  2 | M
     316 |                  2 | M
     317 |                  2 | M
     318 |                  2 | M
     402 |                  2 | M
     403 |                  2 | M
     404 |                  2 | M
     405 |                  2 | M
     406 |                  2 | R
     415 |                  2 | R
     416 |                  2 | R
     417 |                  2 | R
     418 |                  2 | M
     419 |                  2 | R
     420 |                  2 | M
     421 |                  2 | M
     422 |                  2 | R
     423 |                  2 | R
     424 |                  2 | R
     425 |                  2 | M
     426 |                  2 | R
     427 |                  2 | M
     428 |                  2 | M
     429 |                  2 | M
     430 |                  2 | M
     431 |                 29 | M
     432 |                 41 | M
     433 |                 41 | R
     434 |                 41 | R
     435 |                 41 | M
     436 |                 41 | M
     437 |                 60 | M
     438 |                 71 | M
     439 |                 71 | R
     440 |                 82 | M
     441 |                 82 | R
     442 |                 96 | M
     443 |                 96 | R
     444 |                 96 | R
     445 |                 96 | M
     446 |                 99 | M
     447 |                102 | R
     448 |                105 | M
     449 |                105 | R
     450 |                105 | M
     451 |                105 | R
     452 |                105 | M
     453 |                105 | M
     454 |                120 | M
     455 |                122 | R
     456 |                137 | M
     457 |                139 | R
     458 |                140 | R
(68 rows)

select hist_id, hist_function, hist_event, hist_object, regexp_replace(regexp_replace(hist_wording,E'\\d\\d\.\\d\\d\\.\\d\\d\\.\\d\\d\\d','%','g'),E'\\[.+\\]','(timestamp)','g'), hist_user from 
  (select * from emaj.emaj_hist order by hist_id) as t;
 hist_id |     hist_function      |  hist_event  |         hist_object          |                         regexp_replace                         | hist_user 
---------+------------------------+--------------+------------------------------+----------------------------------------------------------------+-----------
    4012 | START_GROUP            | BEGIN        | myGroup1                     | With log reset                                                 | postgres
    4013 | LOCK_GROUP             | BEGIN        | myGroup1                     |                                                                | postgres
    4014 | LOCK_GROUP             | END          | myGroup1                     | 5 tables locked, 0 deadlock(s)                                 | postgres
    4015 | SET_MARK_GROUP         | BEGIN        | myGroup1                     | Mark11                                                         | postgres
    4016 | SET_MARK_GROUP         | END          | myGroup1                     | Mark11                                                         | postgres
    4017 | START_GROUP            | END          | myGroup1                     | 6 tables/sequences processed                                   | postgres
    4018 | START_GROUP            | BEGIN        | myGroup2                     | With log reset                                                 | postgres
    4019 | LOCK_GROUP             | BEGIN        | myGroup2                     |                                                                | postgres
    4020 | LOCK_GROUP             | END          | myGroup2                     | 6 tables locked, 0 deadlock(s)                                 | postgres
    4021 | SET_MARK_GROUP         | BEGIN        | myGroup2                     | Mark21                                                         | postgres
    4022 | SET_MARK_GROUP         | END          | myGroup2                     | Mark21                                                         | postgres
    4023 | START_GROUP            | END          | myGroup2                     | 8 tables/sequences processed                                   | postgres
    4024 | SET_MARK_GROUP         | BEGIN        | myGroup1                     |                                                                | postgres
    4025 | LOCK_GROUP             | BEGIN        | myGroup1                     |                                                                | postgres
    4026 | LOCK_GROUP             | END          | myGroup1                     | 5 tables locked, 0 deadlock(s)                                 | postgres
    4027 | SET_MARK_GROUP         | END          | myGroup1                     | Different_Mark                                                 | postgres
    4028 | SET_MARK_GROUP         | BEGIN        | myGroup2                     |                                                                | postgres
    4029 | LOCK_GROUP             | BEGIN        | myGroup2                     |                                                                | postgres
    4030 | LOCK_GROUP             | END          | myGroup2                     | 6 tables locked, 0 deadlock(s)                                 | postgres
    4031 | SET_MARK_GROUP         | END          | myGroup2                     | Different_Mark                                                 | postgres
    4032 | PROTECT_GROUP          |              | myGroup1                     | Status 1                                                       | postgres
    4033 | PROTECT_GROUP          |              | myGroup2                     | Status 1                                                       | postgres
    4034 | UNPROTECT_GROUP        |              | myGroup1                     | Status 1                                                       | postgres
    4035 | UNPROTECT_GROUP        |              | myGroup2                     | Status 1                                                       | postgres
    4036 | ROLLBACK_GROUP         | BEGIN        | myGroup1                     | Unlogged rollback to mark Different_Mark (timestamp)           | postgres
    4037 | DBLINK_OPEN_CNX        |              | rlbk#1                       | Status = -5                                                    | postgres
    4038 | LOCK_GROUP             | BEGIN        | myGroup1                     | Rollback session #1                                            | postgres
    4039 | LOCK_GROUP             | END          | myGroup1                     | Rollback session #1: 5 tables locked, 0 deadlock(s)            | postgres
    4040 | ROLLBACK_SEQUENCE      |              | myschema1."myTbl3_col31_seq" |                                                                | postgres
    4041 | ROLLBACK_GROUP         | END          | myGroup1                     | Rollback_id 1, 0 tables and 1 sequences effectively processed  | postgres
    4088 | ROLLBACK_GROUP         | BEGIN        | myGroup1                     | Unlogged rollback to mark Different_Mark (timestamp)           | postgres
    4089 | DBLINK_OPEN_CNX        |              | rlbk#1                       | Status = -1                                                    | postgres
    4090 | LOCK_GROUP             | BEGIN        | myGroup1                     | Rollback session #1                                            | postgres
    4091 | LOCK_GROUP             | END          | myGroup1                     | Rollback session #1: 5 tables locked, 0 deadlock(s)            | postgres
    4092 | ROLLBACK_SEQUENCE      |              | myschema1."myTbl3_col31_seq" |                                                                | postgres
    4093 | ROLLBACK_GROUP         | END          | myGroup1                     | Rollback_id 4, 0 tables and 1 sequences effectively processed  | postgres
    4094 | ROLLBACK_GROUP         | BEGIN        | myGroup2                     | Unlogged rollback to mark Mark21 (timestamp)                   | postgres
    4095 | DBLINK_OPEN_CNX        |              | rlbk#1                       | Status = -1                                                    | postgres
    4096 | LOCK_GROUP             | BEGIN        | myGroup2                     | Rollback session #1                                            | postgres
    4097 | LOCK_GROUP             | END          | myGroup2                     | Rollback session #1: 6 tables locked, 0 deadlock(s)            | postgres
    4098 | ROLLBACK_GROUP         | MARK DELETED | myGroup2                     | mark Different_Mark is deleted                                 | postgres
    4099 | ROLLBACK_SEQUENCE      |              | myschema2.myseq1             |                                                                | postgres
    4100 | ROLLBACK_SEQUENCE      |              | myschema2."myTbl3_col31_seq" |                                                                | postgres
    4101 | ROLLBACK_GROUP         | END          | myGroup2                     | Rollback_id 5, 0 tables and 2 sequences effectively processed  | postgres
    4102 | ROLLBACK_GROUP         | BEGIN        | myGroup1                     | Logged rollback to mark Different_Mark (timestamp)             | postgres
    4103 | DBLINK_OPEN_CNX        |              | rlbk#1                       | Status = -2                                                    | postgres
    4104 | LOCK_GROUP             | BEGIN        | myGroup1                     | Rollback session #1                                            | postgres
    4105 | LOCK_GROUP             | END          | myGroup1                     | Rollback session #1: 5 tables locked, 0 deadlock(s)            | postgres
    4106 | SET_MARK_GROUP         | BEGIN        | myGroup1                     | RLBK_Different_Mark_%_START                                    | postgres
    4107 | SET_MARK_GROUP         | END          | myGroup1                     | RLBK_Different_Mark_%_START                                    | postgres
    4108 | ROLLBACK_SEQUENCE      |              | myschema1."myTbl3_col31_seq" |                                                                | postgres
    4109 | SET_MARK_GROUP         | BEGIN        | myGroup1                     | RLBK_Different_Mark_%_DONE                                     | postgres
    4110 | SET_MARK_GROUP         | END          | myGroup1                     | RLBK_Different_Mark_%_DONE                                     | postgres
    4111 | ROLLBACK_GROUP         | END          | myGroup1                     | Rollback_id 6, 0 tables and 1 sequences effectively processed  | postgres
    4112 | ROLLBACK_GROUP         | BEGIN        | myGroup2                     | Logged rollback to mark Mark21 (timestamp)                     | postgres
    4113 | DBLINK_OPEN_CNX        |              | rlbk#1                       | Status = -2                                                    | postgres
    4114 | LOCK_GROUP             | BEGIN        | myGroup2                     | Rollback session #1                                            | postgres
    4115 | LOCK_GROUP             | END          | myGroup2                     | Rollback session #1: 6 tables locked, 0 deadlock(s)            | postgres
    4116 | SET_MARK_GROUP         | BEGIN        | myGroup2                     | RLBK_Mark21_%_START                                            | postgres
    4117 | SET_MARK_GROUP         | END          | myGroup2                     | RLBK_Mark21_%_START                                            | postgres
    4118 | ROLLBACK_SEQUENCE      |              | myschema2.myseq1             |                                                                | postgres
    4119 | ROLLBACK_SEQUENCE      |              | myschema2."myTbl3_col31_seq" |                                                                | postgres
    4120 | SET_MARK_GROUP         | BEGIN        | myGroup2                     | RLBK_Mark21_%_DONE                                             | postgres
    4121 | SET_MARK_GROUP         | END          | myGroup2                     | RLBK_Mark21_%_DONE                                             | postgres
    4122 | ROLLBACK_GROUP         | END          | myGroup2                     | Rollback_id 7, 0 tables and 2 sequences effectively processed  | postgres
    4123 | SET_MARK_GROUPS        | BEGIN        | myGroup1,myGroup2            | Mark1B                                                         | postgres
    4124 | LOCK_GROUPS            | BEGIN        | myGroup1,myGroup2            |                                                                | postgres
    4125 | LOCK_GROUPS            | END          | myGroup1,myGroup2            | 11 tables locked, 0 deadlock(s)                                | postgres
    4126 | SET_MARK_GROUPS        | END          | myGroup1,myGroup2            | Mark1B                                                         | postgres
    4127 | ROLLBACK_GROUPS        | BEGIN        | myGroup1,myGroup2            | Unlogged rollback to mark Mark1B (timestamp)                   | postgres
    4128 | DBLINK_OPEN_CNX        |              | rlbk#1                       | Status = -5                                                    | postgres
    4129 | LOCK_GROUP             | BEGIN        | myGroup1,myGroup2            | Rollback session #1                                            | postgres
    4130 | LOCK_GROUP             | END          | myGroup1,myGroup2            | Rollback session #1: 11 tables locked, 0 deadlock(s)           | postgres
    4131 | ROLLBACK_SEQUENCE      |              | myschema1."myTbl3_col31_seq" |                                                                | postgres
    4132 | ROLLBACK_SEQUENCE      |              | myschema2.myseq1             |                                                                | postgres
    4133 | ROLLBACK_SEQUENCE      |              | myschema2."myTbl3_col31_seq" |                                                                | postgres
    4134 | ROLLBACK_GROUPS        | END          | myGroup1,myGroup2            | Rollback_id 8, 0 tables and 3 sequences effectively processed  | postgres
    4135 | ROLLBACK_GROUPS        | BEGIN        | myGroup1,myGroup2            | Unlogged rollback to mark Mark1B (timestamp)                   | postgres
    4136 | DBLINK_OPEN_CNX        |              | rlbk#1                       | Status = -6                                                    | postgres
    4137 | LOCK_GROUP             | BEGIN        | myGroup1,myGroup2            | Rollback session #1                                            | postgres
    4138 | LOCK_GROUP             | END          | myGroup1,myGroup2            | Rollback session #1: 11 tables locked, 0 deadlock(s)           | postgres
    4139 | ROLLBACK_SEQUENCE      |              | myschema1."myTbl3_col31_seq" |                                                                | postgres
    4140 | ROLLBACK_SEQUENCE      |              | myschema2.myseq1             |                                                                | postgres
    4141 | ROLLBACK_SEQUENCE      |              | myschema2."myTbl3_col31_seq" |                                                                | postgres
    4142 | ROLLBACK_GROUPS        | END          | myGroup1,myGroup2            | Rollback_id 9, 0 tables and 3 sequences effectively processed  | postgres
    4143 | ROLLBACK_GROUPS        | BEGIN        | myGroup1,myGroup2            | Logged rollback to mark Mark1B (timestamp)                     | postgres
    4144 | DBLINK_OPEN_CNX        |              | rlbk#1                       | Status = -4                                                    | postgres
    4145 | LOCK_GROUP             | BEGIN        | myGroup1,myGroup2            | Rollback session #1                                            | postgres
    4146 | LOCK_GROUP             | END          | myGroup1,myGroup2            | Rollback session #1: 11 tables locked, 0 deadlock(s)           | postgres
    4147 | SET_MARK_GROUPS        | BEGIN        | myGroup1,myGroup2            | RLBK_Mark1B_%_START                                            | postgres
    4148 | SET_MARK_GROUPS        | END          | myGroup1,myGroup2            | RLBK_Mark1B_%_START                                            | postgres
    4149 | ROLLBACK_SEQUENCE      |              | myschema1."myTbl3_col31_seq" |                                                                | postgres
    4150 | ROLLBACK_SEQUENCE      |              | myschema2.myseq1             |                                                                | postgres
    4151 | ROLLBACK_SEQUENCE      |              | myschema2."myTbl3_col31_seq" |                                                                | postgres
    4152 | SET_MARK_GROUPS        | BEGIN        | myGroup1,myGroup2            | RLBK_Mark1B_%_DONE                                             | postgres
    4153 | SET_MARK_GROUPS        | END          | myGroup1,myGroup2            | RLBK_Mark1B_%_DONE                                             | postgres
    4154 | ROLLBACK_GROUPS        | END          | myGroup1,myGroup2            | Rollback_id 10, 0 tables and 3 sequences effectively processed | postgres
    4155 | ROLLBACK_GROUPS        | BEGIN        | myGroup1,myGroup2            | Logged rollback to mark Mark1B (timestamp)                     | postgres
    4156 | DBLINK_OPEN_CNX        |              | rlbk#1                       | Status = 1                                                     | postgres
    4157 | LOCK_GROUP             | BEGIN        | myGroup1,myGroup2            | Rollback session #1                                            | postgres
    4158 | LOCK_GROUP             | END          | myGroup1,myGroup2            | Rollback session #1: 11 tables locked, 0 deadlock(s)           | postgres
    4159 | SET_MARK_GROUPS        | BEGIN        | myGroup1,myGroup2            | RLBK_Mark1B_%_START                                            | postgres
    4160 | SET_MARK_GROUPS        | END          | myGroup1,myGroup2            | RLBK_Mark1B_%_START                                            | postgres
    4161 | ROLLBACK_SEQUENCE      |              | myschema1."myTbl3_col31_seq" |                                                                | postgres
    4162 | ROLLBACK_SEQUENCE      |              | myschema2.myseq1             |                                                                | postgres
    4163 | ROLLBACK_SEQUENCE      |              | myschema2."myTbl3_col31_seq" |                                                                | postgres
    4164 | SET_MARK_GROUPS        | BEGIN        | myGroup1,myGroup2            | RLBK_Mark1B_%_DONE                                             | postgres
    4165 | SET_MARK_GROUPS        | END          | myGroup1,myGroup2            | RLBK_Mark1B_%_DONE                                             | postgres
    4166 | ROLLBACK_GROUPS        | END          | myGroup1,myGroup2            | Rollback_id 11, 0 tables and 3 sequences effectively processed | postgres
    4167 | DBLINK_CLOSE_CNX       |              | rlbk#1                       |                                                                | postgres
    4168 | STOP_GROUPS            | BEGIN        | myGroup1,myGroup2            |                                                                | postgres
    4169 | LOCK_GROUPS            | BEGIN        | myGroup1,myGroup2            |                                                                | postgres
    4170 | LOCK_GROUPS            | END          | myGroup1,myGroup2            | 11 tables locked, 0 deadlock(s)                                | postgres
    4171 | SET_MARK_GROUPS        | BEGIN        | myGroup1,myGroup2            | STOP_%                                                         | postgres
    4172 | CLEANUP_RLBK_STATE     |              | rollback id 11               | set to COMMITTED                                               | postgres
    4173 | SET_MARK_GROUPS        | END          | myGroup1,myGroup2            | STOP_%                                                         | postgres
    4174 | STOP_GROUPS            | END          | myGroup1,myGroup2            | 14 tables/sequences processed                                  | postgres
    4175 | START_GROUP            | BEGIN        | myGroup1                     | With log reset                                                 | postgres
    4176 | LOCK_GROUP             | BEGIN        | myGroup1                     |                                                                | postgres
    4177 | LOCK_GROUP             | END          | myGroup1                     | 5 tables locked, 0 deadlock(s)                                 | postgres
    4178 | SET_MARK_GROUP         | BEGIN        | myGroup1                     | Mark11                                                         | postgres
    4179 | SET_MARK_GROUP         | END          | myGroup1                     | Mark11                                                         | postgres
    4180 | START_GROUP            | END          | myGroup1                     | 6 tables/sequences processed                                   | postgres
    4181 | START_GROUP            | BEGIN        | myGroup2                     | With log reset                                                 | postgres
    4182 | LOCK_GROUP             | BEGIN        | myGroup2                     |                                                                | postgres
    4183 | LOCK_GROUP             | END          | myGroup2                     | 6 tables locked, 0 deadlock(s)                                 | postgres
    4184 | SET_MARK_GROUP         | BEGIN        | myGroup2                     | Mark21                                                         | postgres
    4185 | SET_MARK_GROUP         | END          | myGroup2                     | Mark21                                                         | postgres
    4186 | START_GROUP            | END          | myGroup2                     | 8 tables/sequences processed                                   | postgres
    4187 | SET_MARK_GROUP         | BEGIN        | myGroup1                     |                                                                | postgres
    4188 | LOCK_GROUP             | BEGIN        | myGroup1                     |                                                                | postgres
    4189 | LOCK_GROUP             | END          | myGroup1                     | 5 tables locked, 0 deadlock(s)                                 | postgres
    4190 | SET_MARK_GROUP         | END          | myGroup1                     | Mark12                                                         | postgres
    4191 | SET_MARK_GROUP         | BEGIN        | myGroup1                     |                                                                | postgres
    4192 | LOCK_GROUP             | BEGIN        | myGroup1                     |                                                                | postgres
    4193 | LOCK_GROUP             | END          | myGroup1                     | 5 tables locked, 0 deadlock(s)                                 | postgres
    4194 | SET_MARK_GROUP         | END          | myGroup1                     | Mark13                                                         | postgres
    4195 | ROLLBACK_GROUP         | BEGIN        | myGroup1                     | Unlogged rollback to mark Mark12 (timestamp)                   | postgres
    4196 | DBLINK_OPEN_CNX        |              | rlbk#1                       | Status = 1                                                     | postgres
    4197 | LOCK_GROUP             | BEGIN        | myGroup1                     | Rollback session #1                                            | postgres
    4198 | LOCK_GROUP             | END          | myGroup1                     | Rollback session #1: 5 tables locked, 0 deadlock(s)            | postgres
    4199 | ROLLBACK_TABLE         | BEGIN        | myschema1."myTbl3"           | All log rows with emaj_gid > 29 and <= 41                      | postgres
    4200 | ROLLBACK_TABLE         | END          | myschema1."myTbl3"           | 10 rolled back primary keys                                    | postgres
    4201 | ROLLBACK_TABLE         | BEGIN        | myschema1.mytbl4             | All log rows with emaj_gid > 29 and <= 41                      | postgres
    4202 | ROLLBACK_TABLE         | END          | myschema1.mytbl4             | 1 rolled back primary keys                                     | postgres
    4203 | ROLLBACK_GROUP         | MARK DELETED | myGroup1                     | mark Mark13 is deleted                                         | postgres
    4204 | ROLLBACK_SEQUENCE      |              | myschema1."myTbl3_col31_seq" | RESTART 1                                                      | postgres
    4205 | ROLLBACK_GROUP         | END          | myGroup1                     | Rollback_id 12, 2 tables and 1 sequences effectively processed | postgres
    4206 | DBLINK_CLOSE_CNX       |              | rlbk#1                       |                                                                | postgres
    4207 | ROLLBACK_GROUP         | BEGIN        | myGroup1                     | Unlogged rollback to mark Mark11 (timestamp)                   | postgres
    4208 | DBLINK_OPEN_CNX        |              | rlbk#1                       | Status = 1                                                     | postgres
    4209 | LOCK_GROUP             | BEGIN        | myGroup1                     | Rollback session #1                                            | postgres
    4210 | LOCK_GROUP             | END          | myGroup1                     | Rollback session #1: 5 tables locked, 0 deadlock(s)            | postgres
    4211 | ROLLBACK_TABLE         | BEGIN        | myschema1.mytbl1             | All log rows with emaj_gid > 2 and <= 41                       | postgres
    4212 | ROLLBACK_TABLE         | END          | myschema1.mytbl1             | 11 rolled back primary keys                                    | postgres
    4213 | ROLLBACK_TABLE         | BEGIN        | myschema1.mytbl2             | All log rows with emaj_gid > 2 and <= 41                       | postgres
    4214 | ROLLBACK_TABLE         | END          | myschema1.mytbl2             | 3 rolled back primary keys                                     | postgres
    4215 | ROLLBACK_TABLE         | BEGIN        | myschema1.mytbl2b            | All log rows with emaj_gid > 2 and <= 41                       | postgres
    4216 | ROLLBACK_TABLE         | END          | myschema1.mytbl2b            | 6 rolled back primary keys                                     | postgres
    4217 | ROLLBACK_GROUP         | MARK DELETED | myGroup1                     | mark Mark12 is deleted                                         | postgres
    4218 | ROLLBACK_SEQUENCE      |              | myschema1."myTbl3_col31_seq" |                                                                | postgres
    4219 | ROLLBACK_GROUP         | END          | myGroup1                     | Rollback_id 13, 3 tables and 1 sequences effectively processed | postgres
    4220 | DBLINK_CLOSE_CNX       |              | rlbk#1                       |                                                                | postgres
    4221 | STOP_GROUP             | BEGIN        | myGroup1                     |                                                                | postgres
    4222 | LOCK_GROUP             | BEGIN        | myGroup1                     |                                                                | postgres
    4223 | LOCK_GROUP             | END          | myGroup1                     | 5 tables locked, 0 deadlock(s)                                 | postgres
    4224 | SET_MARK_GROUP         | BEGIN        | myGroup1                     | STOP_%                                                         | postgres
    4225 | CLEANUP_RLBK_STATE     |              | rollback id 12               | set to COMMITTED                                               | postgres
    4226 | CLEANUP_RLBK_STATE     |              | rollback id 13               | set to COMMITTED                                               | postgres
    4227 | SET_MARK_GROUP         | END          | myGroup1                     | STOP_%                                                         | postgres
    4228 | STOP_GROUP             | END          | myGroup1                     | 6 tables/sequences processed                                   | postgres
    4229 | START_GROUP            | BEGIN        | myGroup1                     | With log reset                                                 | postgres
    4230 | LOCK_GROUP             | BEGIN        | myGroup1                     |                                                                | postgres
    4231 | LOCK_GROUP             | END          | myGroup1                     | 5 tables locked, 0 deadlock(s)                                 | postgres
    4232 | SET_MARK_GROUP         | BEGIN        | myGroup1                     | Mark11                                                         | postgres
    4233 | SET_MARK_GROUP         | END          | myGroup1                     | Mark11                                                         | postgres
    4234 | START_GROUP            | END          | myGroup1                     | 6 tables/sequences processed                                   | postgres
    4235 | SET_MARK_GROUP         | BEGIN        | myGroup1                     |                                                                | postgres
    4236 | LOCK_GROUP             | BEGIN        | myGroup1                     |                                                                | postgres
    4237 | LOCK_GROUP             | END          | myGroup1                     | 5 tables locked, 0 deadlock(s)                                 | postgres
    4238 | SET_MARK_GROUP         | END          | myGroup1                     | Mark12                                                         | postgres
    4239 | SET_MARK_GROUP         | BEGIN        | myGroup1                     |                                                                | postgres
    4240 | LOCK_GROUP             | BEGIN        | myGroup1                     |                                                                | postgres
    4241 | LOCK_GROUP             | END          | myGroup1                     | 5 tables locked, 0 deadlock(s)                                 | postgres
    4242 | SET_MARK_GROUP         | END          | myGroup1                     | Mark13                                                         | postgres
    4243 | ROLLBACK_GROUP         | BEGIN        | myGroup1                     | Logged rollback to mark Mark12 (timestamp)                     | postgres
    4244 | DBLINK_OPEN_CNX        |              | rlbk#1                       | Status = 1                                                     | postgres
    4245 | LOCK_GROUP             | BEGIN        | myGroup1                     | Rollback session #1                                            | postgres
    4246 | LOCK_GROUP             | END          | myGroup1                     | Rollback session #1: 5 tables locked, 0 deadlock(s)            | postgres
    4247 | SET_MARK_GROUP         | BEGIN        | myGroup1                     | RLBK_Mark12_%_START                                            | postgres
    4248 | SET_MARK_GROUP         | END          | myGroup1                     | RLBK_Mark12_%_START                                            | postgres
    4249 | ROLLBACK_TABLE         | BEGIN        | myschema1."myTbl3"           | All log rows with emaj_gid > 60 and <= 71                      | postgres
    4250 | ROLLBACK_TABLE         | END          | myschema1."myTbl3"           | 10 rolled back primary keys                                    | postgres
    4251 | ROLLBACK_TABLE         | BEGIN        | myschema1.mytbl4             | All log rows with emaj_gid > 60 and <= 71                      | postgres
    4252 | ROLLBACK_TABLE         | END          | myschema1.mytbl4             | 1 rolled back primary keys                                     | postgres
    4253 | ROLLBACK_SEQUENCE      |              | myschema1."myTbl3_col31_seq" | RESTART 1                                                      | postgres
    4254 | SET_MARK_GROUP         | BEGIN        | myGroup1                     | RLBK_Mark12_%_DONE                                             | postgres
    4255 | SET_MARK_GROUP         | END          | myGroup1                     | RLBK_Mark12_%_DONE                                             | postgres
    4256 | ROLLBACK_GROUP         | END          | myGroup1                     | Rollback_id 14, 2 tables and 1 sequences effectively processed | postgres
    4257 | DBLINK_CLOSE_CNX       |              | rlbk#1                       |                                                                | postgres
    4258 | ROLLBACK_GROUP         | BEGIN        | myGroup1                     | Logged rollback to mark Mark11 (timestamp)                     | postgres
    4259 | DBLINK_OPEN_CNX        |              | rlbk#1                       | Status = 1                                                     | postgres
    4260 | LOCK_GROUP             | BEGIN        | myGroup1                     | Rollback session #1                                            | postgres
    4261 | LOCK_GROUP             | END          | myGroup1                     | Rollback session #1: 5 tables locked, 0 deadlock(s)            | postgres
    4262 | SET_MARK_GROUP         | BEGIN        | myGroup1                     | RLBK_Mark11_%_START                                            | postgres
    4263 | CLEANUP_RLBK_STATE     |              | rollback id 14               | set to COMMITTED                                               | postgres
    4264 | SET_MARK_GROUP         | END          | myGroup1                     | RLBK_Mark11_%_START                                            | postgres
    4265 | ROLLBACK_TABLE         | BEGIN        | myschema1."myTbl3"           | All log rows with emaj_gid > 41 and <= 82                      | postgres
    4266 | ROLLBACK_TABLE         | END          | myschema1."myTbl3"           | 10 rolled back primary keys                                    | postgres
    4267 | ROLLBACK_TABLE         | BEGIN        | myschema1.mytbl1             | All log rows with emaj_gid > 41 and <= 82                      | postgres
    4268 | ROLLBACK_TABLE         | END          | myschema1.mytbl1             | 11 rolled back primary keys                                    | postgres
    4269 | ROLLBACK_TABLE         | BEGIN        | myschema1.mytbl2             | All log rows with emaj_gid > 41 and <= 82                      | postgres
    4270 | ROLLBACK_TABLE         | END          | myschema1.mytbl2             | 2 rolled back primary keys                                     | postgres
    4271 | ROLLBACK_TABLE         | BEGIN        | myschema1.mytbl4             | All log rows with emaj_gid > 41 and <= 82                      | postgres
    4272 | ROLLBACK_TABLE         | END          | myschema1.mytbl4             | 1 rolled back primary keys                                     | postgres
    4273 | ROLLBACK_TABLE         | BEGIN        | myschema1.mytbl2b            | All log rows with emaj_gid > 41 and <= 82                      | postgres
    4274 | ROLLBACK_TABLE         | END          | myschema1.mytbl2b            | 2 rolled back primary keys                                     | postgres
    4275 | ROLLBACK_SEQUENCE      |              | myschema1."myTbl3_col31_seq" |                                                                | postgres
    4276 | SET_MARK_GROUP         | BEGIN        | myGroup1                     | RLBK_Mark11_%_DONE                                             | postgres
    4277 | SET_MARK_GROUP         | END          | myGroup1                     | RLBK_Mark11_%_DONE                                             | postgres
    4278 | ROLLBACK_GROUP         | END          | myGroup1                     | Rollback_id 15, 5 tables and 1 sequences effectively processed | postgres
    4279 | DBLINK_CLOSE_CNX       |              | rlbk#1                       |                                                                | postgres
    4280 | ROLLBACK_GROUP         | BEGIN        | myGroup1                     | Unlogged rollback to mark Mark13 (timestamp)                   | postgres
    4281 | DBLINK_OPEN_CNX        |              | rlbk#1                       | Status = 1                                                     | postgres
    4282 | LOCK_GROUP             | BEGIN        | myGroup1                     | Rollback session #1                                            | postgres
    4283 | LOCK_GROUP             | END          | myGroup1                     | Rollback session #1: 5 tables locked, 0 deadlock(s)            | postgres
    4284 | ROLLBACK_TABLE         | BEGIN        | myschema1.mytbl1             | All log rows with emaj_gid > 71 and <= 96                      | postgres
    4285 | ROLLBACK_TABLE         | END          | myschema1.mytbl1             | 10 rolled back primary keys                                    | postgres
    4286 | ROLLBACK_TABLE         | BEGIN        | myschema1.mytbl2             | All log rows with emaj_gid > 71 and <= 96                      | postgres
    4287 | ROLLBACK_TABLE         | END          | myschema1.mytbl2             | 2 rolled back primary keys                                     | postgres
    4288 | ROLLBACK_TABLE         | BEGIN        | myschema1.mytbl4             | All log rows with emaj_gid > 71 and <= 96                      | postgres
    4289 | ROLLBACK_TABLE         | END          | myschema1.mytbl4             | 1 rolled back primary keys                                     | postgres
    4290 | ROLLBACK_TABLE         | BEGIN        | myschema1."myTbl3"           | All log rows with emaj_gid > 71 and <= 96                      | postgres
    4291 | ROLLBACK_TABLE         | END          | myschema1."myTbl3"           | 10 rolled back primary keys                                    | postgres
    4292 | ROLLBACK_TABLE         | BEGIN        | myschema1.mytbl2b            | All log rows with emaj_gid > 71 and <= 96                      | postgres
    4293 | ROLLBACK_TABLE         | END          | myschema1.mytbl2b            | 2 rolled back primary keys                                     | postgres
    4294 | ROLLBACK_GROUP         | MARK DELETED | myGroup1                     | mark RLBK_Mark12_%_START is deleted                            | postgres
    4295 | ROLLBACK_GROUP         | MARK DELETED | myGroup1                     | mark RLBK_Mark12_%_DONE is deleted                             | postgres
    4296 | ROLLBACK_GROUP         | MARK DELETED | myGroup1                     | mark RLBK_Mark11_%_START is deleted                            | postgres
    4297 | ROLLBACK_GROUP         | MARK DELETED | myGroup1                     | mark RLBK_Mark11_%_DONE is deleted                             | postgres
    4298 | ROLLBACK_SEQUENCE      |              | myschema1."myTbl3_col31_seq" | RESTART 11                                                     | postgres
    4299 | ROLLBACK_GROUP         | END          | myGroup1                     | Rollback_id 16, 5 tables and 1 sequences effectively processed | postgres
    4300 | DBLINK_CLOSE_CNX       |              | rlbk#1                       |                                                                | postgres
    4301 | ROLLBACK_GROUP         | BEGIN        | emptyGroup                   | Unlogged rollback to mark MarkInit (timestamp)                 | postgres
    4302 | DBLINK_OPEN_CNX        |              | rlbk#1                       | Status = 1                                                     | postgres
    4303 | LOCK_GROUP             | BEGIN        | emptyGroup                   | Rollback session #1                                            | postgres
    4304 | LOCK_GROUP             | END          | emptyGroup                   | Rollback session #1: 0 tables locked, 0 deadlock(s)            | postgres
    4305 | ROLLBACK_GROUP         | END          | emptyGroup                   | Rollback_id 17, 0 tables and 0 sequences effectively processed | postgres
    4306 | DBLINK_CLOSE_CNX       |              | rlbk#1                       |                                                                | postgres
    4307 | START_GROUP            | BEGIN        | myGroup4                     | With log reset                                                 | postgres
    4308 | LOCK_GROUP             | BEGIN        | myGroup4                     |                                                                | postgres
    4309 | LOCK_GROUP             | END          | myGroup4                     | 3 tables locked, 0 deadlock(s)                                 | postgres
    4310 | SET_MARK_GROUP         | BEGIN        | myGroup4                     | myGroup4_start                                                 | postgres
    4311 | CLEANUP_RLBK_STATE     |              | rollback id 15               | set to COMMITTED                                               | postgres
    4312 | CLEANUP_RLBK_STATE     |              | rollback id 16               | set to COMMITTED                                               | postgres
    4313 | CLEANUP_RLBK_STATE     |              | rollback id 17               | set to COMMITTED                                               | postgres
    4314 | SET_MARK_GROUP         | END          | myGroup4                     | myGroup4_start                                                 | postgres
    4315 | START_GROUP            | END          | myGroup4                     | 3 tables/sequences processed                                   | postgres
    4316 | SET_MARK_GROUP         | BEGIN        | myGroup4                     |                                                                | postgres
    4317 | LOCK_GROUP             | BEGIN        | myGroup4                     |                                                                | postgres
    4318 | LOCK_GROUP             | END          | myGroup4                     | 3 tables locked, 0 deadlock(s)                                 | postgres
    4319 | SET_MARK_GROUP         | END          | myGroup4                     | mark1                                                          | postgres
    4320 | ROLLBACK_GROUP         | BEGIN        | myGroup4                     | Logged rollback to mark mark1 (timestamp)                      | postgres
    4321 | DBLINK_OPEN_CNX        |              | rlbk#1                       | Status = 1                                                     | postgres
    4322 | LOCK_GROUP             | BEGIN        | myGroup4                     | Rollback session #1                                            | postgres
    4323 | LOCK_GROUP             | END          | myGroup4                     | Rollback session #1: 3 tables locked, 0 deadlock(s)            | postgres
    4324 | SET_MARK_GROUP         | BEGIN        | myGroup4                     | RLBK_mark1_%_START                                             | postgres
    4325 | SET_MARK_GROUP         | END          | myGroup4                     | RLBK_mark1_%_START                                             | postgres
    4326 | ROLLBACK_TABLE         | BEGIN        | myschema4.mytblc1            | All log rows with emaj_gid > 99 and <= 102                     | postgres
    4327 | ROLLBACK_TABLE         | END          | myschema4.mytblc1            | 1 rolled back primary keys                                     | postgres
    4328 | ROLLBACK_TABLE         | BEGIN        | myschema4.mytblc2            | All log rows with emaj_gid > 99 and <= 102                     | postgres
    4329 | ROLLBACK_TABLE         | END          | myschema4.mytblc2            | 1 rolled back primary keys                                     | postgres
    4330 | ROLLBACK_TABLE         | BEGIN        | myschema4.mytblm             | All log rows with emaj_gid > 99 and <= 102                     | postgres
    4331 | ROLLBACK_TABLE         | END          | myschema4.mytblm             | 1 rolled back primary keys                                     | postgres
    4332 | SET_MARK_GROUP         | BEGIN        | myGroup4                     | RLBK_mark1_%_DONE                                              | postgres
    4333 | SET_MARK_GROUP         | END          | myGroup4                     | RLBK_mark1_%_DONE                                              | postgres
    4334 | ROLLBACK_GROUP         | END          | myGroup4                     | Rollback_id 18, 3 tables and 0 sequences effectively processed | postgres
    4335 | DBLINK_CLOSE_CNX       |              | rlbk#1                       |                                                                | postgres
    4336 | ROLLBACK_GROUP         | BEGIN        | myGroup4                     | Unlogged rollback to mark myGroup4_start (timestamp)           | postgres
    4337 | DBLINK_OPEN_CNX        |              | rlbk#1                       | Status = 1                                                     | postgres
    4338 | LOCK_GROUP             | BEGIN        | myGroup4                     | Rollback session #1                                            | postgres
    4339 | LOCK_GROUP             | END          | myGroup4                     | Rollback session #1: 3 tables locked, 0 deadlock(s)            | postgres
    4340 | ROLLBACK_TABLE         | BEGIN        | myschema4.mytblc1            | All log rows with emaj_gid > 96 and <= 105                     | postgres
    4341 | ROLLBACK_TABLE         | END          | myschema4.mytblc1            | 1 rolled back primary keys                                     | postgres
    4342 | ROLLBACK_TABLE         | BEGIN        | myschema4.mytblc2            | All log rows with emaj_gid > 96 and <= 105                     | postgres
    4343 | ROLLBACK_TABLE         | END          | myschema4.mytblc2            | 1 rolled back primary keys                                     | postgres
    4344 | ROLLBACK_TABLE         | BEGIN        | myschema4.mytblm             | All log rows with emaj_gid > 96 and <= 105                     | postgres
    4345 | ROLLBACK_TABLE         | END          | myschema4.mytblm             | 1 rolled back primary keys                                     | postgres
    4346 | ROLLBACK_GROUP         | MARK DELETED | myGroup4                     | mark mark1 is deleted                                          | postgres
    4347 | ROLLBACK_GROUP         | MARK DELETED | myGroup4                     | mark RLBK_mark1_%_START is deleted                             | postgres
    4348 | ROLLBACK_GROUP         | MARK DELETED | myGroup4                     | mark RLBK_mark1_%_DONE is deleted                              | postgres
    4349 | ROLLBACK_GROUP         | END          | myGroup4                     | Rollback_id 19, 3 tables and 0 sequences effectively processed | postgres
    4350 | DBLINK_CLOSE_CNX       |              | rlbk#1                       |                                                                | postgres
    4352 | SET_MARK_GROUP         | BEGIN        | myGroup1                     |                                                                | postgres
    4353 | LOCK_GROUP             | BEGIN        | myGroup1                     |                                                                | postgres
    4354 | LOCK_GROUP             | END          | myGroup1                     | 5 tables locked, 0 deadlock(s)                                 | postgres
    4355 | CLEANUP_RLBK_STATE     |              | rollback id 18               | set to COMMITTED                                               | postgres
    4356 | CLEANUP_RLBK_STATE     |              | rollback id 19               | set to COMMITTED                                               | postgres
    4357 | SET_MARK_GROUP         | END          | myGroup1                     | Conso_M1                                                       | postgres
    4358 | ROLLBACK_GROUP         | BEGIN        | myGroup1                     | Logged rollback to mark Conso_M1 (timestamp)                   | postgres
    4359 | DBLINK_OPEN_CNX        |              | rlbk#1                       | Status = 1                                                     | postgres
    4360 | LOCK_GROUP             | BEGIN        | myGroup1                     | Rollback session #1                                            | postgres
    4361 | LOCK_GROUP             | END          | myGroup1                     | Rollback session #1: 5 tables locked, 0 deadlock(s)            | postgres
    4362 | SET_MARK_GROUP         | BEGIN        | myGroup1                     | RLBK_Conso_M1_%_START                                          | postgres
    4363 | SET_MARK_GROUP         | END          | myGroup1                     | RLBK_Conso_M1_%_START                                          | postgres
    4364 | ROLLBACK_SEQUENCE      |              | myschema1."myTbl3_col31_seq" |                                                                | postgres
    4365 | SET_MARK_GROUP         | BEGIN        | myGroup1                     | RLBK_Conso_M1_%_DONE                                           | postgres
    4366 | SET_MARK_GROUP         | END          | myGroup1                     | RLBK_Conso_M1_%_DONE                                           | postgres
    4367 | ROLLBACK_GROUP         | END          | myGroup1                     | Rollback_id 20, 0 tables and 1 sequences effectively processed | postgres
    4368 | DBLINK_CLOSE_CNX       |              | rlbk#1                       |                                                                | postgres
    4369 | CONSOLIDATE_RLBK_GROUP | BEGIN        | myGroup1                     | Erase all between marks Conso_M1 and RLBK_Conso_M1_%_DONE      | postgres
    4370 | CONSOLIDATE_RLBK_GROUP | END          | myGroup1                     | 0 tables and 1 sequences processed ; 1 marks deleted           | postgres
    4371 | SET_MARK_GROUP         | BEGIN        | myGroup1                     |                                                                | postgres
    4372 | LOCK_GROUP             | BEGIN        | myGroup1                     |                                                                | postgres
    4373 | LOCK_GROUP             | END          | myGroup1                     | 5 tables locked, 0 deadlock(s)                                 | postgres
    4374 | CLEANUP_RLBK_STATE     |              | rollback id 20               | set to COMMITTED                                               | postgres
    4375 | SET_MARK_GROUP         | END          | myGroup1                     | Conso_M2                                                       | postgres
    4376 | SET_MARK_GROUP         | BEGIN        | myGroup1                     |                                                                | postgres
    4377 | LOCK_GROUP             | BEGIN        | myGroup1                     |                                                                | postgres
    4378 | LOCK_GROUP             | END          | myGroup1                     | 5 tables locked, 0 deadlock(s)                                 | postgres
    4379 | SET_MARK_GROUP         | END          | myGroup1                     | Conso_M3                                                       | postgres
    4380 | ROLLBACK_GROUP         | BEGIN        | myGroup1                     | Logged rollback to mark Conso_M2 (timestamp)                   | postgres
    4381 | DBLINK_OPEN_CNX        |              | rlbk#1                       | Status = 1                                                     | postgres
    4382 | LOCK_GROUP             | BEGIN        | myGroup1                     | Rollback session #1                                            | postgres
    4383 | LOCK_GROUP             | END          | myGroup1                     | Rollback session #1: 5 tables locked, 0 deadlock(s)            | postgres
    4384 | SET_MARK_GROUP         | BEGIN        | myGroup1                     | RLBK_Conso_M2_%_START                                          | postgres
    4385 | SET_MARK_GROUP         | END          | myGroup1                     | RLBK_Conso_M2_%_START                                          | postgres
    4386 | ROLLBACK_TABLE         | BEGIN        | myschema1.mytbl1             | All log rows with emaj_gid > 105 and <= 122                    | postgres
    4387 | ROLLBACK_TABLE         | END          | myschema1.mytbl1             | 12 rolled back primary keys                                    | postgres
    4388 | ROLLBACK_TABLE         | BEGIN        | myschema1.mytbl2             | All log rows with emaj_gid > 105 and <= 122                    | postgres
    4389 | ROLLBACK_TABLE         | END          | myschema1.mytbl2             | 1 rolled back primary keys                                     | postgres
    4390 | ROLLBACK_TABLE         | BEGIN        | myschema1.mytbl2b            | All log rows with emaj_gid > 105 and <= 122                    | postgres
    4391 | ROLLBACK_TABLE         | END          | myschema1.mytbl2b            | 2 rolled back primary keys                                     | postgres
    4392 | ROLLBACK_SEQUENCE      |              | myschema1."myTbl3_col31_seq" |                                                                | postgres
    4393 | SET_MARK_GROUP         | BEGIN        | myGroup1                     | RLBK_Conso_M2_%_DONE                                           | postgres
    4394 | SET_MARK_GROUP         | END          | myGroup1                     | RLBK_Conso_M2_%_DONE                                           | postgres
    4395 | ROLLBACK_GROUP         | END          | myGroup1                     | Rollback_id 21, 3 tables and 1 sequences effectively processed | postgres
    4396 | DBLINK_CLOSE_CNX       |              | rlbk#1                       |                                                                | postgres
    4397 | RENAME_MARK_GROUP      | BEGIN        | myGroup1                     | Conso_M2                                                       | postgres
    4398 | RENAME_MARK_GROUP      | END          | myGroup1                     | Conso_M2 renamed Renamed_conso_M2                              | postgres
    4399 | RENAME_MARK_GROUP      | BEGIN        | myGroup1                     | EMAJ_LAST_MARK                                                 | postgres
    4400 | RENAME_MARK_GROUP      | END          | myGroup1                     | RLBK_Conso_M2_%_DONE renamed Renamed_last_mark                 | postgres
    4401 | CONSOLIDATE_RLBK_GROUP | BEGIN        | myGroup1                     | Erase all between marks Renamed_conso_M2 and Renamed_last_mark | postgres
    4402 | CONSOLIDATE_RLBK_GROUP | END          | myGroup1                     | 3 tables and 1 sequences processed ; 2 marks deleted           | postgres
    4403 | CONSOLIDATE_RLBK_GROUP | BEGIN        | myGroup1                     | Erase all between marks Renamed_conso_M2 and Renamed_last_mark | postgres
    4404 | CONSOLIDATE_RLBK_GROUP | END          | myGroup1                     | 0 tables and 1 sequences processed ; 0 marks deleted           | postgres
    4405 | ROLLBACK_GROUP         | BEGIN        | myGroup1                     | Unlogged rollback to mark Conso_M1 (timestamp)                 | postgres
    4406 | DBLINK_OPEN_CNX        |              | rlbk#1                       | Status = 1                                                     | postgres
    4407 | LOCK_GROUP             | BEGIN        | myGroup1                     | Rollback session #1                                            | postgres
    4408 | LOCK_GROUP             | END          | myGroup1                     | Rollback session #1: 5 tables locked, 0 deadlock(s)            | postgres
    4409 | ROLLBACK_TABLE         | BEGIN        | myschema1.mytbl2             | All log rows with emaj_gid > 105 and <= 139                    | postgres
    4410 | ROLLBACK_TABLE         | END          | myschema1.mytbl2             | 1 rolled back primary keys                                     | postgres
    4411 | ROLLBACK_TABLE         | BEGIN        | myschema1.mytbl2b            | All log rows with emaj_gid > 105 and <= 139                    | postgres
    4412 | ROLLBACK_TABLE         | END          | myschema1.mytbl2b            | 1 rolled back primary keys                                     | postgres
    4413 | ROLLBACK_GROUP         | MARK DELETED | myGroup1                     | mark RLBK_Conso_M1_%_DONE is deleted                           | postgres
    4414 | ROLLBACK_GROUP         | MARK DELETED | myGroup1                     | mark Renamed_conso_M2 is deleted                               | postgres
    4415 | ROLLBACK_GROUP         | MARK DELETED | myGroup1                     | mark Renamed_last_mark is deleted                              | postgres
    4416 | ROLLBACK_SEQUENCE      |              | myschema1."myTbl3_col31_seq" |                                                                | postgres
    4417 | ROLLBACK_GROUP         | END          | myGroup1                     | Rollback_id 22, 2 tables and 1 sequences effectively processed | postgres
    4418 | DBLINK_CLOSE_CNX       |              | rlbk#1                       |                                                                | postgres
    4425 | CLEANUP_RLBK_STATE     |              | rollback id 21               | set to COMMITTED                                               | postgres
    4426 | CLEANUP_RLBK_STATE     |              | rollback id 22               | set to COMMITTED                                               | postgres
    4427 | CLEANUP_RLBK_STATE     |              | rollback id 23               | set to ABORTED                                                 | postgres
(363 rows)

truncate emaj.emaj_hist;
alter sequence emaj.emaj_hist_hist_id_seq restart 5000;
alter sequence emaj.emaj_time_stamp_time_id_seq restart 500;
alter sequence emaj.emaj_mark_mark_id_seq restart 500;
alter sequence emaj.emaj_rlbk_rlbk_id_seq restart 100;
