-- rollback.sql : test updates log, emaj_rollback_group(), emaj_logged_rollback_group(),
--                emaj_rollback_groups(), and emaj_logged_rollback_groups() functions.
--                also test emaj_cleanup_rollback_state(), and emaj_rollback_activity().
--
-----------------------------
-- rollback nothing tests
-----------------------------
-- group or groups is NULL
select emaj.emaj_rollback_group(NULL,NULL);
ERROR:  _rlbk_check: group <NULL> has not been created.
CONTEXT:  SQL statement "SELECT emaj._rlbk_check( $1 , $2 )"
PL/pgSQL function "_rlbk_init" line 23 at SQL statement
SQL statement "SELECT emaj._rlbk_init( $1 ,  $2 ,  $3 , 1,  $4 )"
PL/pgSQL function "_rlbk_groups" line 19 at SQL statement
PL/pgSQL function "emaj_rollback_group" line 6 at RETURN
select emaj.emaj_logged_rollback_group(NULL,NULL);
ERROR:  _rlbk_check: group <NULL> has not been created.
CONTEXT:  SQL statement "SELECT emaj._rlbk_check( $1 , $2 )"
PL/pgSQL function "_rlbk_init" line 23 at SQL statement
SQL statement "SELECT emaj._rlbk_init( $1 ,  $2 ,  $3 , 1,  $4 )"
PL/pgSQL function "_rlbk_groups" line 19 at SQL statement
PL/pgSQL function "emaj_logged_rollback_group" line 10 at RETURN
select emaj.emaj_rollback_groups(NULL,NULL);
WARNING:  _check_names_array: No group name to process.
CONTEXT:  PL/pgSQL function "emaj_rollback_groups" line 6 at RETURN
 emaj_rollback_groups 
----------------------
                    0
(1 row)

select emaj.emaj_logged_rollback_groups(NULL,NULL);
WARNING:  _check_names_array: No group name to process.
CONTEXT:  PL/pgSQL function "emaj_logged_rollback_groups" line 10 at RETURN
 emaj_logged_rollback_groups 
-----------------------------
                           0
(1 row)

-- group is unknown in emaj_group_def
select emaj.emaj_rollback_group('unknownGroup',NULL);
ERROR:  _rlbk_check: group unknownGroup has not been created.
CONTEXT:  SQL statement "SELECT emaj._rlbk_check( $1 , $2 )"
PL/pgSQL function "_rlbk_init" line 23 at SQL statement
SQL statement "SELECT emaj._rlbk_init( $1 ,  $2 ,  $3 , 1,  $4 )"
PL/pgSQL function "_rlbk_groups" line 19 at SQL statement
PL/pgSQL function "emaj_rollback_group" line 6 at RETURN
select emaj.emaj_logged_rollback_group('unknownGroup',NULL);
ERROR:  _rlbk_check: group unknownGroup has not been created.
CONTEXT:  SQL statement "SELECT emaj._rlbk_check( $1 , $2 )"
PL/pgSQL function "_rlbk_init" line 23 at SQL statement
SQL statement "SELECT emaj._rlbk_init( $1 ,  $2 ,  $3 , 1,  $4 )"
PL/pgSQL function "_rlbk_groups" line 19 at SQL statement
PL/pgSQL function "emaj_logged_rollback_group" line 10 at RETURN
select emaj.emaj_rollback_groups('{"unknownGroup"}',NULL);
ERROR:  _rlbk_check: group unknownGroup has not been created.
CONTEXT:  SQL statement "SELECT emaj._rlbk_check( $1 , $2 )"
PL/pgSQL function "_rlbk_init" line 23 at SQL statement
SQL statement "SELECT emaj._rlbk_init( $1 ,  $2 ,  $3 , 1,  $4 )"
PL/pgSQL function "_rlbk_groups" line 19 at SQL statement
PL/pgSQL function "emaj_rollback_groups" line 6 at RETURN
select emaj.emaj_logged_rollback_groups('{"unknownGroup","myGroup1"}',NULL);
ERROR:  _rlbk_check: group unknownGroup has not been created.
CONTEXT:  SQL statement "SELECT emaj._rlbk_check( $1 , $2 )"
PL/pgSQL function "_rlbk_init" line 23 at SQL statement
SQL statement "SELECT emaj._rlbk_init( $1 ,  $2 ,  $3 , 1,  $4 )"
PL/pgSQL function "_rlbk_groups" line 19 at SQL statement
PL/pgSQL function "emaj_logged_rollback_groups" line 10 at RETURN
begin;
  select emaj.emaj_start_group('myGroup1','');
 emaj_start_group 
------------------
                6
(1 row)

  select emaj.emaj_rollback_groups('{"myGroup1","unknownGroup"}','EMAJ_LAST_MARK');
ERROR:  _rlbk_check: group unknownGroup has not been created.
CONTEXT:  SQL statement "SELECT emaj._rlbk_check( $1 , $2 )"
PL/pgSQL function "_rlbk_init" line 23 at SQL statement
SQL statement "SELECT emaj._rlbk_init( $1 ,  $2 ,  $3 , 1,  $4 )"
PL/pgSQL function "_rlbk_groups" line 19 at SQL statement
PL/pgSQL function "emaj_rollback_groups" line 6 at RETURN
rollback;
-- group not in logging state
select emaj.emaj_rollback_group('myGroup1','EMAJ_LAST_MARK');
ERROR:  _rlbk_check: Group myGroup1 is not in LOGGING state.
CONTEXT:  SQL statement "SELECT emaj._rlbk_check( $1 , $2 )"
PL/pgSQL function "_rlbk_init" line 23 at SQL statement
SQL statement "SELECT emaj._rlbk_init( $1 ,  $2 ,  $3 , 1,  $4 )"
PL/pgSQL function "_rlbk_groups" line 19 at SQL statement
PL/pgSQL function "emaj_rollback_group" line 6 at RETURN
select emaj.emaj_rollback_group('myGroup2','EMAJ_LAST_MARK');
ERROR:  _rlbk_check: Group myGroup2 is not in LOGGING state.
CONTEXT:  SQL statement "SELECT emaj._rlbk_check( $1 , $2 )"
PL/pgSQL function "_rlbk_init" line 23 at SQL statement
SQL statement "SELECT emaj._rlbk_init( $1 ,  $2 ,  $3 , 1,  $4 )"
PL/pgSQL function "_rlbk_groups" line 19 at SQL statement
PL/pgSQL function "emaj_rollback_group" line 6 at RETURN
select emaj.emaj_logged_rollback_group('myGroup1','EMAJ_LAST_MARK');
ERROR:  _rlbk_check: Group myGroup1 is not in LOGGING state.
CONTEXT:  SQL statement "SELECT emaj._rlbk_check( $1 , $2 )"
PL/pgSQL function "_rlbk_init" line 23 at SQL statement
SQL statement "SELECT emaj._rlbk_init( $1 ,  $2 ,  $3 , 1,  $4 )"
PL/pgSQL function "_rlbk_groups" line 19 at SQL statement
PL/pgSQL function "emaj_logged_rollback_group" line 10 at RETURN
select emaj.emaj_logged_rollback_group('myGroup2','EMAJ_LAST_MARK');
ERROR:  _rlbk_check: Group myGroup2 is not in LOGGING state.
CONTEXT:  SQL statement "SELECT emaj._rlbk_check( $1 , $2 )"
PL/pgSQL function "_rlbk_init" line 23 at SQL statement
SQL statement "SELECT emaj._rlbk_init( $1 ,  $2 ,  $3 , 1,  $4 )"
PL/pgSQL function "_rlbk_groups" line 19 at SQL statement
PL/pgSQL function "emaj_logged_rollback_group" line 10 at RETURN
select emaj.emaj_rollback_groups('{"myGroup1","myGroup2"}',NULL);
ERROR:  _rlbk_check: Group myGroup1 is not in LOGGING state.
CONTEXT:  SQL statement "SELECT emaj._rlbk_check( $1 , $2 )"
PL/pgSQL function "_rlbk_init" line 23 at SQL statement
SQL statement "SELECT emaj._rlbk_init( $1 ,  $2 ,  $3 , 1,  $4 )"
PL/pgSQL function "_rlbk_groups" line 19 at SQL statement
PL/pgSQL function "emaj_rollback_groups" line 6 at RETURN
begin;
  select emaj.emaj_start_group('myGroup1','');
 emaj_start_group 
------------------
                6
(1 row)

  select emaj.emaj_logged_rollback_groups('{"myGroup1","myGroup2"}','EMAJ_LAST_MARK');
ERROR:  _rlbk_check: Group myGroup2 is not in LOGGING state.
CONTEXT:  SQL statement "SELECT emaj._rlbk_check( $1 , $2 )"
PL/pgSQL function "_rlbk_init" line 23 at SQL statement
SQL statement "SELECT emaj._rlbk_init( $1 ,  $2 ,  $3 , 1,  $4 )"
PL/pgSQL function "_rlbk_groups" line 19 at SQL statement
PL/pgSQL function "emaj_logged_rollback_groups" line 10 at RETURN
rollback;
-- start groups and set some marks
select emaj.emaj_start_group('myGroup1','Mark11');
 emaj_start_group 
------------------
                6
(1 row)

select emaj.emaj_start_group('myGroup2','Mark21');
WARNING:  _check_fk_groups: Foreign key mytbl6_col61_fkey, from table myschema2.mytbl6, references myschema2.mytbl7 that is outside groups (myGroup2).
CONTEXT:  SQL statement "SELECT  emaj._check_fk_groups(array[ $1 [ $2 ]])"
PL/pgSQL function "_start_groups" line 46 at PERFORM
SQL statement "SELECT emaj._start_groups(array[ $1 ],  $2 , false,  $3 )"
PL/pgSQL function "emaj_start_group" line 16 at SQL statement
PL/pgSQL function "emaj_start_group" line 5 at RETURN
WARNING:  _check_fk_groups: table myschema2.mytbl6 is referenced by foreign key mytbl8_col81_fkey from table myschema2.mytbl8 that is outside groups (myGroup2).
CONTEXT:  SQL statement "SELECT  emaj._check_fk_groups(array[ $1 [ $2 ]])"
PL/pgSQL function "_start_groups" line 46 at PERFORM
SQL statement "SELECT emaj._start_groups(array[ $1 ],  $2 , false,  $3 )"
PL/pgSQL function "emaj_start_group" line 16 at SQL statement
PL/pgSQL function "emaj_start_group" line 5 at RETURN
 emaj_start_group 
------------------
                8
(1 row)

select emaj.emaj_set_mark_group('myGroup1','Different_Mark');
 emaj_set_mark_group 
---------------------
                   6
(1 row)

select emaj.emaj_set_mark_group('myGroup2','Different_Mark');
 emaj_set_mark_group 
---------------------
                   8
(1 row)

-- log tables are empty
select count(*) from emaj.myschema1_mytbl1_log;
 count 
-------
     0
(1 row)

select count(*) from emaj.myschema1_mytbl2_log;
 count 
-------
     0
(1 row)

select count(*) from emajb.myschema1_mytbl2b_log;
 count 
-------
     0
(1 row)

select count(*) from "emajC"."myschema1_myTbl3_log";
 count 
-------
     0
(1 row)

select count(*) from emaj.myschema1_mytbl4_log;
 count 
-------
     0
(1 row)

select count(*) from emaj.myschema2_mytbl1_log;
 count 
-------
     0
(1 row)

select count(*) from emaj.myschema2_mytbl2_log;
 count 
-------
     0
(1 row)

select count(*) from "emajC"."myschema2_myTbl3_log";
 count 
-------
     0
(1 row)

select count(*) from emaj.myschema2_mytbl4_log;
 count 
-------
     0
(1 row)

-- unknown mark name
select emaj.emaj_rollback_group('myGroup1',NULL);
ERROR:  _rlbk_check: No mark <NULL> exists for group myGroup1.
CONTEXT:  SQL statement "SELECT emaj._rlbk_check( $1 , $2 )"
PL/pgSQL function "_rlbk_init" line 23 at SQL statement
SQL statement "SELECT emaj._rlbk_init( $1 ,  $2 ,  $3 , 1,  $4 )"
PL/pgSQL function "_rlbk_groups" line 19 at SQL statement
PL/pgSQL function "emaj_rollback_group" line 6 at RETURN
select emaj.emaj_rollback_group('myGroup1','DummyMark');
ERROR:  _rlbk_check: No mark DummyMark exists for group myGroup1.
CONTEXT:  SQL statement "SELECT emaj._rlbk_check( $1 , $2 )"
PL/pgSQL function "_rlbk_init" line 23 at SQL statement
SQL statement "SELECT emaj._rlbk_init( $1 ,  $2 ,  $3 , 1,  $4 )"
PL/pgSQL function "_rlbk_groups" line 19 at SQL statement
PL/pgSQL function "emaj_rollback_group" line 6 at RETURN
select emaj.emaj_logged_rollback_group('myGroup1',NULL);
ERROR:  _rlbk_check: No mark <NULL> exists for group myGroup1.
CONTEXT:  SQL statement "SELECT emaj._rlbk_check( $1 , $2 )"
PL/pgSQL function "_rlbk_init" line 23 at SQL statement
SQL statement "SELECT emaj._rlbk_init( $1 ,  $2 ,  $3 , 1,  $4 )"
PL/pgSQL function "_rlbk_groups" line 19 at SQL statement
PL/pgSQL function "emaj_logged_rollback_group" line 10 at RETURN
select emaj.emaj_logged_rollback_group('myGroup1','DummyMark');
ERROR:  _rlbk_check: No mark DummyMark exists for group myGroup1.
CONTEXT:  SQL statement "SELECT emaj._rlbk_check( $1 , $2 )"
PL/pgSQL function "_rlbk_init" line 23 at SQL statement
SQL statement "SELECT emaj._rlbk_init( $1 ,  $2 ,  $3 , 1,  $4 )"
PL/pgSQL function "_rlbk_groups" line 19 at SQL statement
PL/pgSQL function "emaj_logged_rollback_group" line 10 at RETURN
select emaj.emaj_rollback_groups('{"myGroup1","myGroup2",""}',NULL);
WARNING:  _check_names_array: a group name is NULL or empty.
CONTEXT:  PL/pgSQL function "emaj_rollback_groups" line 6 at RETURN
ERROR:  _rlbk_check: No mark <NULL> exists for group myGroup1.
CONTEXT:  SQL statement "SELECT emaj._rlbk_check( $1 , $2 )"
PL/pgSQL function "_rlbk_init" line 23 at SQL statement
SQL statement "SELECT emaj._rlbk_init( $1 ,  $2 ,  $3 , 1,  $4 )"
PL/pgSQL function "_rlbk_groups" line 19 at SQL statement
PL/pgSQL function "emaj_rollback_groups" line 6 at RETURN
select emaj.emaj_rollback_groups('{"myGroup1","myGroup2",NULL}',NULL);
WARNING:  _check_names_array: a group name is NULL or empty.
CONTEXT:  PL/pgSQL function "emaj_rollback_groups" line 6 at RETURN
ERROR:  _rlbk_check: No mark <NULL> exists for group myGroup1.
CONTEXT:  SQL statement "SELECT emaj._rlbk_check( $1 , $2 )"
PL/pgSQL function "_rlbk_init" line 23 at SQL statement
SQL statement "SELECT emaj._rlbk_init( $1 ,  $2 ,  $3 , 1,  $4 )"
PL/pgSQL function "_rlbk_groups" line 19 at SQL statement
PL/pgSQL function "emaj_rollback_groups" line 6 at RETURN
select emaj.emaj_rollback_groups('{"myGroup1","myGroup2"}','DummyMark');
ERROR:  _rlbk_check: No mark DummyMark exists for group myGroup1.
CONTEXT:  SQL statement "SELECT emaj._rlbk_check( $1 , $2 )"
PL/pgSQL function "_rlbk_init" line 23 at SQL statement
SQL statement "SELECT emaj._rlbk_init( $1 ,  $2 ,  $3 , 1,  $4 )"
PL/pgSQL function "_rlbk_groups" line 19 at SQL statement
PL/pgSQL function "emaj_rollback_groups" line 6 at RETURN
select emaj.emaj_logged_rollback_groups('{"myGroup1","myGroup2","myGroup2"}',NULL);
WARNING:  _check_names_array: duplicate group name myGroup2.
CONTEXT:  PL/pgSQL function "emaj_logged_rollback_groups" line 10 at RETURN
ERROR:  _rlbk_check: No mark <NULL> exists for group myGroup1.
CONTEXT:  SQL statement "SELECT emaj._rlbk_check( $1 , $2 )"
PL/pgSQL function "_rlbk_init" line 23 at SQL statement
SQL statement "SELECT emaj._rlbk_init( $1 ,  $2 ,  $3 , 1,  $4 )"
PL/pgSQL function "_rlbk_groups" line 19 at SQL statement
PL/pgSQL function "emaj_logged_rollback_groups" line 10 at RETURN
select emaj.emaj_logged_rollback_groups('{"myGroup1","myGroup2"}','Mark11');
ERROR:  _rlbk_check: No mark Mark11 exists for group myGroup2.
CONTEXT:  SQL statement "SELECT emaj._rlbk_check( $1 , $2 )"
PL/pgSQL function "_rlbk_init" line 23 at SQL statement
SQL statement "SELECT emaj._rlbk_init( $1 ,  $2 ,  $3 , 1,  $4 )"
PL/pgSQL function "_rlbk_groups" line 19 at SQL statement
PL/pgSQL function "emaj_logged_rollback_groups" line 10 at RETURN
-- mark name referencing different points in time
select emaj.emaj_rollback_groups('{"myGroup1","myGroup2"}','Different_Mark');
ERROR:  _rlbk_check: Mark Different_Mark does not represent the same point in time for all groups.
CONTEXT:  SQL statement "SELECT emaj._rlbk_check( $1 , $2 )"
PL/pgSQL function "_rlbk_init" line 23 at SQL statement
SQL statement "SELECT emaj._rlbk_init( $1 ,  $2 ,  $3 , 1,  $4 )"
PL/pgSQL function "_rlbk_groups" line 19 at SQL statement
PL/pgSQL function "emaj_rollback_groups" line 6 at RETURN
-- attemp to rollback an 'audit_only' group
select emaj.emaj_rollback_group('phil''s group#3",','EMAJ_LAST_MARK');
ERROR:  _rlbk_check: Group phil's group#3", has been created for audit only purpose.
CONTEXT:  SQL statement "SELECT emaj._rlbk_check( $1 , $2 )"
PL/pgSQL function "_rlbk_init" line 23 at SQL statement
SQL statement "SELECT emaj._rlbk_init( $1 ,  $2 ,  $3 , 1,  $4 )"
PL/pgSQL function "_rlbk_groups" line 19 at SQL statement
PL/pgSQL function "emaj_rollback_group" line 6 at RETURN
select emaj.emaj_logged_rollback_group('phil''s group#3",','M1_audit_only');
ERROR:  _rlbk_check: Group phil's group#3", has been created for audit only purpose.
CONTEXT:  SQL statement "SELECT emaj._rlbk_check( $1 , $2 )"
PL/pgSQL function "_rlbk_init" line 23 at SQL statement
SQL statement "SELECT emaj._rlbk_init( $1 ,  $2 ,  $3 , 1,  $4 )"
PL/pgSQL function "_rlbk_groups" line 19 at SQL statement
PL/pgSQL function "emaj_logged_rollback_group" line 10 at RETURN
-- attemp to rollback to a stop mark
begin;
  select emaj.emaj_stop_group('myGroup1');
 emaj_stop_group 
-----------------
               6
(1 row)

  select emaj.emaj_start_group('myGroup1','StartMark',false);
 emaj_start_group 
------------------
                6
(1 row)

  select emaj.emaj_rename_mark_group('myGroup1',(select emaj.emaj_get_previous_mark_group('myGroup1','StartMark')), 'GeneratedStopMark');
 emaj_rename_mark_group 
------------------------
 
(1 row)

  select emaj.emaj_rollback_group('myGroup1','GeneratedStopMark');
ERROR:  _rlbk_check: mark GeneratedStopMark for group myGroup1 is not usable for rollback.
CONTEXT:  SQL statement "SELECT emaj._rlbk_check( $1 , $2 )"
PL/pgSQL function "_rlbk_init" line 23 at SQL statement
SQL statement "SELECT emaj._rlbk_init( $1 ,  $2 ,  $3 , 1,  $4 )"
PL/pgSQL function "_rlbk_groups" line 19 at SQL statement
PL/pgSQL function "emaj_rollback_group" line 6 at RETURN
rollback;
-- missing application table and mono-group rollback
begin;
  drop table mySchema2."myTbl3" cascade;
  select emaj.emaj_rollback_group('myGroup2','Mark21');
ERROR:  _verify_group: In group "myGroup2", the table "myschema2"."myTbl3" does not exist any more. You may use "SELECT * FROM emaj.emaj_verify_all()" to look for other issues.
CONTEXT:  SQL statement "SELECT  0 FROM emaj._verify_groups( $1 , true)"
PL/pgSQL function "_rlbk_init" line 25 at PERFORM
SQL statement "SELECT emaj._rlbk_init( $1 ,  $2 ,  $3 , 1,  $4 )"
PL/pgSQL function "_rlbk_groups" line 19 at SQL statement
PL/pgSQL function "emaj_rollback_group" line 6 at RETURN
rollback;
begin;
  drop table mySchema2."myTbl3" cascade;
  select emaj.emaj_logged_rollback_group('myGroup2','Mark21');
ERROR:  _verify_group: In group "myGroup2", the table "myschema2"."myTbl3" does not exist any more. You may use "SELECT * FROM emaj.emaj_verify_all()" to look for other issues.
CONTEXT:  SQL statement "SELECT  0 FROM emaj._verify_groups( $1 , true)"
PL/pgSQL function "_rlbk_init" line 25 at PERFORM
SQL statement "SELECT emaj._rlbk_init( $1 ,  $2 ,  $3 , 1,  $4 )"
PL/pgSQL function "_rlbk_groups" line 19 at SQL statement
PL/pgSQL function "emaj_logged_rollback_group" line 10 at RETURN
rollback;
-- should be OK, with different cases of dblink status
-- hide dblink_connect functions
alter function public.dblink_connect_u(text,text) rename to renamed_dblink_connect_u;
alter function public.dblink_connect_u(text) rename to renamed_dblink_connect_u;
select emaj.emaj_rollback_group('myGroup1','EMAJ_LAST_MARK');
 emaj_rollback_group 
---------------------
                   1
(1 row)

select emaj.emaj_rollback_group('myGroup2','Mark21');
WARNING:  _check_fk_groups: Foreign key mytbl6_col61_fkey, from table myschema2.mytbl6, references myschema2.mytbl7 that is outside groups (myGroup2).
CONTEXT:  SQL statement "SELECT  emaj._check_fk_groups( $1 )"
PL/pgSQL function "_rlbk_init" line 65 at PERFORM
SQL statement "SELECT emaj._rlbk_init( $1 ,  $2 ,  $3 , 1,  $4 )"
PL/pgSQL function "_rlbk_groups" line 19 at SQL statement
PL/pgSQL function "emaj_rollback_group" line 6 at RETURN
WARNING:  _check_fk_groups: table myschema2.mytbl6 is referenced by foreign key mytbl8_col81_fkey from table myschema2.mytbl8 that is outside groups (myGroup2).
CONTEXT:  SQL statement "SELECT  emaj._check_fk_groups( $1 )"
PL/pgSQL function "_rlbk_init" line 65 at PERFORM
SQL statement "SELECT emaj._rlbk_init( $1 ,  $2 ,  $3 , 1,  $4 )"
PL/pgSQL function "_rlbk_groups" line 19 at SQL statement
PL/pgSQL function "emaj_rollback_group" line 6 at RETURN
 emaj_rollback_group 
---------------------
                   2
(1 row)

alter function public.renamed_dblink_connect_u(text,text) rename to dblink_connect_u;
alter function public.renamed_dblink_connect_u(text) rename to dblink_connect_u;
-- dblink_connect not in path
set search_path='emaj';
select emaj.emaj_logged_rollback_group('myGroup1','EMAJ_LAST_MARK');
 emaj_logged_rollback_group 
----------------------------
                          1
(1 row)

select emaj.emaj_logged_rollback_group('myGroup2','Mark21');
WARNING:  _check_fk_groups: Foreign key mytbl6_col61_fkey, from table myschema2.mytbl6, references myschema2.mytbl7 that is outside groups (myGroup2).
CONTEXT:  SQL statement "SELECT  emaj._check_fk_groups( $1 )"
PL/pgSQL function "_rlbk_init" line 65 at PERFORM
SQL statement "SELECT emaj._rlbk_init( $1 ,  $2 ,  $3 , 1,  $4 )"
PL/pgSQL function "_rlbk_groups" line 19 at SQL statement
PL/pgSQL function "emaj_logged_rollback_group" line 10 at RETURN
WARNING:  _check_fk_groups: table myschema2.mytbl6 is referenced by foreign key mytbl8_col81_fkey from table myschema2.mytbl8 that is outside groups (myGroup2).
CONTEXT:  SQL statement "SELECT  emaj._check_fk_groups( $1 )"
PL/pgSQL function "_rlbk_init" line 65 at PERFORM
SQL statement "SELECT emaj._rlbk_init( $1 ,  $2 ,  $3 , 1,  $4 )"
PL/pgSQL function "_rlbk_groups" line 19 at SQL statement
PL/pgSQL function "emaj_logged_rollback_group" line 10 at RETURN
 emaj_logged_rollback_group 
----------------------------
                          2
(1 row)

reset search_path;
select emaj.emaj_set_mark_groups('{"myGroup1","myGroup2"}','Mark1B');
 emaj_set_mark_groups 
----------------------
                   14
(1 row)

-- no user/password defined in emaj_param
select emaj.emaj_rollback_groups('{"myGroup1","myGroup2"}','EMAJ_LAST_MARK');
WARNING:  _check_fk_groups: Foreign key mytbl6_col61_fkey, from table myschema2.mytbl6, references myschema2.mytbl7 that is outside groups (myGroup1,myGroup2).
CONTEXT:  SQL statement "SELECT  emaj._check_fk_groups( $1 )"
PL/pgSQL function "_rlbk_init" line 65 at PERFORM
SQL statement "SELECT emaj._rlbk_init( $1 ,  $2 ,  $3 , 1,  $4 )"
PL/pgSQL function "_rlbk_groups" line 19 at SQL statement
PL/pgSQL function "emaj_rollback_groups" line 6 at RETURN
WARNING:  _check_fk_groups: table myschema2.mytbl6 is referenced by foreign key mytbl8_col81_fkey from table myschema2.mytbl8 that is outside groups (myGroup1,myGroup2).
CONTEXT:  SQL statement "SELECT  emaj._check_fk_groups( $1 )"
PL/pgSQL function "_rlbk_init" line 65 at PERFORM
SQL statement "SELECT emaj._rlbk_init( $1 ,  $2 ,  $3 , 1,  $4 )"
PL/pgSQL function "_rlbk_groups" line 19 at SQL statement
PL/pgSQL function "emaj_rollback_groups" line 6 at RETURN
 emaj_rollback_groups 
----------------------
                    3
(1 row)

-- bad user/password defined in emaj_param
insert into emaj.emaj_param (param_key, param_value_text) 
  values ('dblink_user_password','user=<user> password=<password>');
select emaj.emaj_rollback_groups('{"myGroup1","myGroup2"}','Mark1B');
WARNING:  _check_fk_groups: Foreign key mytbl6_col61_fkey, from table myschema2.mytbl6, references myschema2.mytbl7 that is outside groups (myGroup1,myGroup2).
CONTEXT:  SQL statement "SELECT  emaj._check_fk_groups( $1 )"
PL/pgSQL function "_rlbk_init" line 65 at PERFORM
SQL statement "SELECT emaj._rlbk_init( $1 ,  $2 ,  $3 , 1,  $4 )"
PL/pgSQL function "_rlbk_groups" line 19 at SQL statement
PL/pgSQL function "emaj_rollback_groups" line 6 at RETURN
WARNING:  _check_fk_groups: table myschema2.mytbl6 is referenced by foreign key mytbl8_col81_fkey from table myschema2.mytbl8 that is outside groups (myGroup1,myGroup2).
CONTEXT:  SQL statement "SELECT  emaj._check_fk_groups( $1 )"
PL/pgSQL function "_rlbk_init" line 65 at PERFORM
SQL statement "SELECT emaj._rlbk_init( $1 ,  $2 ,  $3 , 1,  $4 )"
PL/pgSQL function "_rlbk_groups" line 19 at SQL statement
PL/pgSQL function "emaj_rollback_groups" line 6 at RETURN
 emaj_rollback_groups 
----------------------
                    3
(1 row)

-- transaction not in READ COMMITTED isolation level => the dblink connection is not possible
begin;
  set transaction isolation level repeatable read;
  select emaj.emaj_logged_rollback_groups('{"myGroup1","myGroup2"}','EMAJ_LAST_MARK');
WARNING:  _check_fk_groups: Foreign key mytbl6_col61_fkey, from table myschema2.mytbl6, references myschema2.mytbl7 that is outside groups (myGroup1,myGroup2).
CONTEXT:  SQL statement "SELECT  emaj._check_fk_groups( $1 )"
PL/pgSQL function "_rlbk_init" line 65 at PERFORM
SQL statement "SELECT emaj._rlbk_init( $1 ,  $2 ,  $3 , 1,  $4 )"
PL/pgSQL function "_rlbk_groups" line 19 at SQL statement
PL/pgSQL function "emaj_logged_rollback_groups" line 10 at RETURN
WARNING:  _check_fk_groups: table myschema2.mytbl6 is referenced by foreign key mytbl8_col81_fkey from table myschema2.mytbl8 that is outside groups (myGroup1,myGroup2).
CONTEXT:  SQL statement "SELECT  emaj._check_fk_groups( $1 )"
PL/pgSQL function "_rlbk_init" line 65 at PERFORM
SQL statement "SELECT emaj._rlbk_init( $1 ,  $2 ,  $3 , 1,  $4 )"
PL/pgSQL function "_rlbk_groups" line 19 at SQL statement
PL/pgSQL function "emaj_logged_rollback_groups" line 10 at RETURN
 emaj_logged_rollback_groups 
-----------------------------
                           3
(1 row)

commit;
-- dblink connection should now be ok (missing right on dblink functions is tested in adm1.sql)
update emaj.emaj_param set param_value_text = 'user=postgres password=postgres' 
  where param_key = 'dblink_user_password';
select emaj.emaj_logged_rollback_groups('{"myGroup1","myGroup2"}','Mark1B');
WARNING:  _check_fk_groups: Foreign key mytbl6_col61_fkey, from table myschema2.mytbl6, references myschema2.mytbl7 that is outside groups (myGroup1,myGroup2).
CONTEXT:  SQL statement "SELECT  emaj._check_fk_groups( $1 )"
PL/pgSQL function "_rlbk_init" line 65 at PERFORM
SQL statement "SELECT emaj._rlbk_init( $1 ,  $2 ,  $3 , 1,  $4 )"
PL/pgSQL function "_rlbk_groups" line 19 at SQL statement
PL/pgSQL function "emaj_logged_rollback_groups" line 10 at RETURN
WARNING:  _check_fk_groups: table myschema2.mytbl6 is referenced by foreign key mytbl8_col81_fkey from table myschema2.mytbl8 that is outside groups (myGroup1,myGroup2).
CONTEXT:  SQL statement "SELECT  emaj._check_fk_groups( $1 )"
PL/pgSQL function "_rlbk_init" line 65 at PERFORM
SQL statement "SELECT emaj._rlbk_init( $1 ,  $2 ,  $3 , 1,  $4 )"
PL/pgSQL function "_rlbk_groups" line 19 at SQL statement
PL/pgSQL function "emaj_logged_rollback_groups" line 10 at RETURN
 emaj_logged_rollback_groups 
-----------------------------
                           3
(1 row)

-- missing application table and multi-groups rollback
begin;
  drop table mySchema2."myTbl3" cascade;
  select emaj.emaj_rollback_groups('{"myGroup1","myGroup2"}','Mark1B');
ERROR:  _verify_group: In group "myGroup2", the table "myschema2"."myTbl3" does not exist any more. You may use "SELECT * FROM emaj.emaj_verify_all()" to look for other issues.
CONTEXT:  SQL statement "SELECT  0 FROM emaj._verify_groups( $1 , true)"
PL/pgSQL function "_rlbk_init" line 25 at PERFORM
SQL statement "SELECT emaj._rlbk_init( $1 ,  $2 ,  $3 , 1,  $4 )"
PL/pgSQL function "_rlbk_groups" line 19 at SQL statement
PL/pgSQL function "emaj_rollback_groups" line 6 at RETURN
rollback;
begin;
  drop table mySchema2."myTbl3" cascade;
  select emaj.emaj_logged_rollback_groups('{"myGroup1","myGroup2"}','Mark1B');
ERROR:  _verify_group: In group "myGroup2", the table "myschema2"."myTbl3" does not exist any more. You may use "SELECT * FROM emaj.emaj_verify_all()" to look for other issues.
CONTEXT:  SQL statement "SELECT  0 FROM emaj._verify_groups( $1 , true)"
PL/pgSQL function "_rlbk_init" line 25 at PERFORM
SQL statement "SELECT emaj._rlbk_init( $1 ,  $2 ,  $3 , 1,  $4 )"
PL/pgSQL function "_rlbk_groups" line 19 at SQL statement
PL/pgSQL function "emaj_logged_rollback_groups" line 10 at RETURN
rollback;
-- restart groups
select emaj.emaj_stop_groups('{"myGroup1","myGroup2"}');
 emaj_stop_groups 
------------------
               14
(1 row)

select emaj.emaj_start_group('myGroup1','Mark11');
 emaj_start_group 
------------------
                6
(1 row)

select emaj.emaj_start_group('myGroup2','Mark21');
WARNING:  _check_fk_groups: Foreign key mytbl6_col61_fkey, from table myschema2.mytbl6, references myschema2.mytbl7 that is outside groups (myGroup2).
CONTEXT:  SQL statement "SELECT  emaj._check_fk_groups(array[ $1 [ $2 ]])"
PL/pgSQL function "_start_groups" line 46 at PERFORM
SQL statement "SELECT emaj._start_groups(array[ $1 ],  $2 , false,  $3 )"
PL/pgSQL function "emaj_start_group" line 16 at SQL statement
PL/pgSQL function "emaj_start_group" line 5 at RETURN
WARNING:  _check_fk_groups: table myschema2.mytbl6 is referenced by foreign key mytbl8_col81_fkey from table myschema2.mytbl8 that is outside groups (myGroup2).
CONTEXT:  SQL statement "SELECT  emaj._check_fk_groups(array[ $1 [ $2 ]])"
PL/pgSQL function "_start_groups" line 46 at PERFORM
SQL statement "SELECT emaj._start_groups(array[ $1 ],  $2 , false,  $3 )"
PL/pgSQL function "emaj_start_group" line 16 at SQL statement
PL/pgSQL function "emaj_start_group" line 5 at RETURN
 emaj_start_group 
------------------
                8
(1 row)

-----------------------------
-- log phase #1 with 2 unlogged rollbacks
-----------------------------
-- Populate application tables
set search_path=public,myschema1;
-- inserts/updates/deletes in myTbl1, myTbl2 and myTbl2b (via trigger)
insert into myTbl1 select i, 'ABC', E'\\014'::bytea from generate_series (1,11) as i;
begin transaction;
  update myTbl1 set col13=E'\\034'::bytea where col11 <= 3;
  insert into myTbl2 values (1,'ABC',current_date);
commit;
delete from myTbl1 where col11 > 10;
insert into myTbl2 values (2,'DEF',NULL);
insert into myTbl2 values (3,'GHI',NULL);
update myTbl2 set col22 = NULL WHERE col23 IS NULL;
delete from myTbl2 where col21 = 3 and col22 is NULL;
select count(*) from mytbl1;
 count 
-------
    10
(1 row)

select count(*) from mytbl2;
 count 
-------
     2
(1 row)

select count(*) from mytbl2b;
 count 
-------
     6
(1 row)

select count(*) from "myTbl3";
 count 
-------
     0
(1 row)

select count(*) from myTbl4;
 count 
-------
     0
(1 row)

-- set a mark
select emaj.emaj_set_mark_group('myGroup1','Mark12');
 emaj_set_mark_group 
---------------------
                   6
(1 row)

select mark_id, mark_group, regexp_replace(mark_name,E'\\d\\d\.\\d\\d\\.\\d\\d\\.\\d\\d\\d','%','g'), mark_global_seq, mark_is_deleted, mark_comment, mark_last_seq_hole_id, mark_last_sequence_id, mark_log_rows_before_next from emaj.emaj_mark order by mark_id;
 mark_id |    mark_group    | regexp_replace | mark_global_seq | mark_is_deleted | mark_comment | mark_last_seq_hole_id | mark_last_sequence_id | mark_log_rows_before_next 
---------+------------------+----------------+-----------------+-----------------+--------------+-----------------------+-----------------------+---------------------------
     316 | phil's group#3", | Mark4          |               2 | f               |              |                   299 |                  3115 |                          
     424 | myGroup1         | Mark11         |               2 | f               |              |                   399 |                  4169 |                        27
     425 | myGroup2         | Mark21         |               2 | f               |              |                   399 |                  4177 |                          
     426 | myGroup1         | Mark12         |              29 | f               |              |                   399 |                  4183 |                          
(4 rows)

select sequ_id,sequ_schema, sequ_name, regexp_replace(sequ_mark,E'\\d\\d\.\\d\\d\\.\\d\\d\\.\\d\\d\\d','%','g'), sequ_last_val, sequ_is_called from emaj.emaj_sequence order by sequ_id;
 sequ_id |  sequ_schema   |             sequ_name              | regexp_replace | sequ_last_val | sequ_is_called 
---------+----------------+------------------------------------+----------------+---------------+----------------
    3112 | phil's schema3 | myTbl2\_col21_seq                  | Mark4          |             1 | f
    3113 | phil's schema3 | phil's seq\1                       | Mark4          |          1000 | f
    3114 | emaj           | phil's schema3_myTbl2\_log_seq     | Mark4          |             1 | f
    3115 | emaj #'3       | phil's schema3_phil's tbl1_log_seq | Mark4          |             1 | f
    4164 | myschema1      | myTbl3_col31_seq                   | Mark11         |             1 | f
    4165 | emajC          | myschema1_myTbl3_log_seq           | Mark11         |             1 | f
    4166 | emaj           | myschema1_mytbl1_log_seq           | Mark11         |             1 | f
    4167 | emaj           | myschema1_mytbl4_log_seq           | Mark11         |             1 | f
    4168 | emaj           | myschema1_mytbl2_log_seq           | Mark11         |             1 | f
    4169 | emajb          | myschema1_mytbl2b_log_seq          | Mark11         |             1 | f
    4170 | myschema2      | myseq1                             | Mark21         |          1000 | f
    4171 | myschema2      | myTbl3_col31_seq                   | Mark21         |             1 | f
    4172 | emaj           | myschema2_mytbl1_log_seq           | Mark21         |             1 | f
    4173 | emaj           | myschema2_mytbl2_log_seq           | Mark21         |             1 | f
    4174 | emajC          | myschema2_myTbl3_log_seq           | Mark21         |             1 | f
    4175 | emaj           | myschema2_mytbl4_log_seq           | Mark21         |             1 | f
    4176 | emaj           | myschema2_mytbl5_log_seq           | Mark21         |             1 | f
    4177 | emaj           | myschema2_mytbl6_log_seq           | Mark21         |             1 | f
    4178 | myschema1      | myTbl3_col31_seq                   | Mark12         |             1 | f
    4179 | emajC          | myschema1_myTbl3_log_seq           | Mark12         |             1 | f
    4180 | emaj           | myschema1_mytbl1_log_seq           | Mark12         |            15 | t
    4181 | emaj           | myschema1_mytbl4_log_seq           | Mark12         |             1 | f
    4182 | emaj           | myschema1_mytbl2_log_seq           | Mark12         |             6 | t
    4183 | emajb          | myschema1_mytbl2b_log_seq          | Mark12         |             6 | t
(24 rows)

-- inserts/updates/deletes in myTbl3 and myTbl4
insert into "myTbl3" (col33) select generate_series(1000,1039,4)/100;
insert into myTbl4 values (1,'FK...',1,1,'ABC');
update myTbl4 set col43 = NULL where col41 = 1;
select count(*) from "myTbl3";
 count 
-------
    10
(1 row)

select count(*) from myTbl4;
 count 
-------
     1
(1 row)

-- set a mark
select emaj.emaj_set_mark_group('myGroup1','Mark13');
 emaj_set_mark_group 
---------------------
                   6
(1 row)

select mark_id, mark_group, regexp_replace(mark_name,E'\\d\\d\.\\d\\d\\.\\d\\d\\.\\d\\d\\d','%','g'), mark_global_seq, mark_is_deleted, mark_comment, mark_last_seq_hole_id, mark_last_sequence_id, mark_log_rows_before_next from emaj.emaj_mark order by mark_id;
 mark_id |    mark_group    | regexp_replace | mark_global_seq | mark_is_deleted | mark_comment | mark_last_seq_hole_id | mark_last_sequence_id | mark_log_rows_before_next 
---------+------------------+----------------+-----------------+-----------------+--------------+-----------------------+-----------------------+---------------------------
     316 | phil's group#3", | Mark4          |               2 | f               |              |                   299 |                  3115 |                          
     424 | myGroup1         | Mark11         |               2 | f               |              |                   399 |                  4169 |                        27
     425 | myGroup2         | Mark21         |               2 | f               |              |                   399 |                  4177 |                          
     426 | myGroup1         | Mark12         |              29 | f               |              |                   399 |                  4183 |                        12
     427 | myGroup1         | Mark13         |              41 | f               |              |                   399 |                  4189 |                          
(5 rows)

select sequ_id,sequ_schema, sequ_name, regexp_replace(sequ_mark,E'\\d\\d\.\\d\\d\\.\\d\\d\\.\\d\\d\\d','%','g'), sequ_last_val, sequ_is_called from emaj.emaj_sequence order by sequ_id;
 sequ_id |  sequ_schema   |             sequ_name              | regexp_replace | sequ_last_val | sequ_is_called 
---------+----------------+------------------------------------+----------------+---------------+----------------
    3112 | phil's schema3 | myTbl2\_col21_seq                  | Mark4          |             1 | f
    3113 | phil's schema3 | phil's seq\1                       | Mark4          |          1000 | f
    3114 | emaj           | phil's schema3_myTbl2\_log_seq     | Mark4          |             1 | f
    3115 | emaj #'3       | phil's schema3_phil's tbl1_log_seq | Mark4          |             1 | f
    4164 | myschema1      | myTbl3_col31_seq                   | Mark11         |             1 | f
    4165 | emajC          | myschema1_myTbl3_log_seq           | Mark11         |             1 | f
    4166 | emaj           | myschema1_mytbl1_log_seq           | Mark11         |             1 | f
    4167 | emaj           | myschema1_mytbl4_log_seq           | Mark11         |             1 | f
    4168 | emaj           | myschema1_mytbl2_log_seq           | Mark11         |             1 | f
    4169 | emajb          | myschema1_mytbl2b_log_seq          | Mark11         |             1 | f
    4170 | myschema2      | myseq1                             | Mark21         |          1000 | f
    4171 | myschema2      | myTbl3_col31_seq                   | Mark21         |             1 | f
    4172 | emaj           | myschema2_mytbl1_log_seq           | Mark21         |             1 | f
    4173 | emaj           | myschema2_mytbl2_log_seq           | Mark21         |             1 | f
    4174 | emajC          | myschema2_myTbl3_log_seq           | Mark21         |             1 | f
    4175 | emaj           | myschema2_mytbl4_log_seq           | Mark21         |             1 | f
    4176 | emaj           | myschema2_mytbl5_log_seq           | Mark21         |             1 | f
    4177 | emaj           | myschema2_mytbl6_log_seq           | Mark21         |             1 | f
    4178 | myschema1      | myTbl3_col31_seq                   | Mark12         |             1 | f
    4179 | emajC          | myschema1_myTbl3_log_seq           | Mark12         |             1 | f
    4180 | emaj           | myschema1_mytbl1_log_seq           | Mark12         |            15 | t
    4181 | emaj           | myschema1_mytbl4_log_seq           | Mark12         |             1 | f
    4182 | emaj           | myschema1_mytbl2_log_seq           | Mark12         |             6 | t
    4183 | emajb          | myschema1_mytbl2b_log_seq          | Mark12         |             6 | t
    4184 | myschema1      | myTbl3_col31_seq                   | Mark13         |            10 | t
    4185 | emajC          | myschema1_myTbl3_log_seq           | Mark13         |            10 | t
    4186 | emaj           | myschema1_mytbl1_log_seq           | Mark13         |            15 | t
    4187 | emaj           | myschema1_mytbl4_log_seq           | Mark13         |             2 | t
    4188 | emaj           | myschema1_mytbl2_log_seq           | Mark13         |             6 | t
    4189 | emajb          | myschema1_mytbl2b_log_seq          | Mark13         |             6 | t
(30 rows)

select col11, col12, col13, emaj_verb, emaj_tuple, emaj_gid from emaj.myschema1_mytbl1_log order by emaj_gid, emaj_tuple desc;
 col11 |   col12    | col13 | emaj_verb | emaj_tuple | emaj_gid 
-------+------------+-------+-----------+------------+----------
     1 | ABC        | \014  | INS       | NEW        |        3
     2 | ABC        | \014  | INS       | NEW        |        4
     3 | ABC        | \014  | INS       | NEW        |        5
     4 | ABC        | \014  | INS       | NEW        |        6
     5 | ABC        | \014  | INS       | NEW        |        7
     6 | ABC        | \014  | INS       | NEW        |        8
     7 | ABC        | \014  | INS       | NEW        |        9
     8 | ABC        | \014  | INS       | NEW        |       10
     9 | ABC        | \014  | INS       | NEW        |       11
    10 | ABC        | \014  | INS       | NEW        |       12
    11 | ABC        | \014  | INS       | NEW        |       13
     1 | ABC        | \014  | UPD       | OLD        |       14
     1 | ABC        | \034  | UPD       | NEW        |       14
     2 | ABC        | \014  | UPD       | OLD        |       15
     2 | ABC        | \034  | UPD       | NEW        |       15
     3 | ABC        | \014  | UPD       | OLD        |       16
     3 | ABC        | \034  | UPD       | NEW        |       16
    11 | ABC        | \014  | DEL       | OLD        |       19
(18 rows)

select col21, col22, emaj_verb, emaj_tuple, emaj_gid from emaj.myschema1_mytbl2_log order by emaj_gid, emaj_tuple desc;
 col21 | col22 | emaj_verb | emaj_tuple | emaj_gid 
-------+-------+-----------+------------+----------
     1 | ABC   | INS       | NEW        |       17
     2 | DEF   | INS       | NEW        |       20
     3 | GHI   | INS       | NEW        |       22
     2 | DEF   | UPD       | OLD        |       24
     2 |       | UPD       | NEW        |       24
     3 | GHI   | UPD       | OLD        |       26
     3 |       | UPD       | NEW        |       26
     3 |       | DEL       | OLD        |       28
(8 rows)

select col20, col21, emaj_verb, emaj_tuple, emaj_gid from emajb.myschema1_mytbl2b_log order by emaj_gid, emaj_tuple desc;
 col20 | col21 | emaj_verb | emaj_tuple | emaj_gid 
-------+-------+-----------+------------+----------
     1 |     1 | INS       | NEW        |       18
     2 |     2 | INS       | NEW        |       21
     3 |     3 | INS       | NEW        |       23
     4 |     2 | INS       | NEW        |       25
     5 |     3 | INS       | NEW        |       27
     6 |     3 | INS       | NEW        |       29
(6 rows)

select col31, col33, emaj_verb, emaj_tuple, emaj_gid from "emajC"."myschema1_myTbl3_log" order by emaj_gid, emaj_tuple desc;
 col31 | col33 | emaj_verb | emaj_tuple | emaj_gid 
-------+-------+-----------+------------+----------
     1 | 10.00 | INS       | NEW        |       30
     2 | 10.00 | INS       | NEW        |       31
     3 | 10.00 | INS       | NEW        |       32
     4 | 10.00 | INS       | NEW        |       33
     5 | 10.00 | INS       | NEW        |       34
     6 | 10.00 | INS       | NEW        |       35
     7 | 10.00 | INS       | NEW        |       36
     8 | 10.00 | INS       | NEW        |       37
     9 | 10.00 | INS       | NEW        |       38
    10 | 10.00 | INS       | NEW        |       39
(10 rows)

select col41, col42, col43, col44, col45, emaj_verb, emaj_tuple, emaj_gid from emaj.myschema1_myTbl4_log order by emaj_gid, emaj_tuple desc;
 col41 | col42 | col43 | col44 |   col45    | emaj_verb | emaj_tuple | emaj_gid 
-------+-------+-------+-------+------------+-----------+------------+----------
     1 | FK... |     1 |     1 | ABC        | INS       | NEW        |       40
     1 | FK... |     1 |     1 | ABC        | UPD       | OLD        |       41
     1 | FK... |       |     1 | ABC        | UPD       | NEW        |       41
(3 rows)

-- rollback #1
alter table mySchema1.myTbl2 disable trigger myTbl2trg;
select emaj.emaj_rollback_group('myGroup1','Mark12');
 emaj_rollback_group 
---------------------
                   3
(1 row)

alter table mySchema1.myTbl2 enable trigger myTbl2trg;
-- check impact
select mark_id, mark_group, regexp_replace(mark_name,E'\\d\\d\.\\d\\d\\.\\d\\d\\.\\d\\d\\d','%','g'), mark_global_seq, mark_is_deleted, mark_comment, mark_last_seq_hole_id, mark_last_sequence_id, mark_log_rows_before_next from emaj.emaj_mark order by mark_id;
 mark_id |    mark_group    | regexp_replace | mark_global_seq | mark_is_deleted | mark_comment | mark_last_seq_hole_id | mark_last_sequence_id | mark_log_rows_before_next 
---------+------------------+----------------+-----------------+-----------------+--------------+-----------------------+-----------------------+---------------------------
     316 | phil's group#3", | Mark4          |               2 | f               |              |                   299 |                  3115 |                          
     424 | myGroup1         | Mark11         |               2 | f               |              |                   399 |                  4169 |                        27
     425 | myGroup2         | Mark21         |               2 | f               |              |                   399 |                  4177 |                          
     426 | myGroup1         | Mark12         |              29 | f               |              |                   399 |                  4183 |                          
(4 rows)

select sequ_id,sequ_schema, sequ_name, regexp_replace(sequ_mark,E'\\d\\d\.\\d\\d\\.\\d\\d\\.\\d\\d\\d','%','g'), sequ_last_val, sequ_is_called from emaj.emaj_sequence order by sequ_id;
 sequ_id |  sequ_schema   |             sequ_name              | regexp_replace | sequ_last_val | sequ_is_called 
---------+----------------+------------------------------------+----------------+---------------+----------------
    3112 | phil's schema3 | myTbl2\_col21_seq                  | Mark4          |             1 | f
    3113 | phil's schema3 | phil's seq\1                       | Mark4          |          1000 | f
    3114 | emaj           | phil's schema3_myTbl2\_log_seq     | Mark4          |             1 | f
    3115 | emaj #'3       | phil's schema3_phil's tbl1_log_seq | Mark4          |             1 | f
    4164 | myschema1      | myTbl3_col31_seq                   | Mark11         |             1 | f
    4165 | emajC          | myschema1_myTbl3_log_seq           | Mark11         |             1 | f
    4166 | emaj           | myschema1_mytbl1_log_seq           | Mark11         |             1 | f
    4167 | emaj           | myschema1_mytbl4_log_seq           | Mark11         |             1 | f
    4168 | emaj           | myschema1_mytbl2_log_seq           | Mark11         |             1 | f
    4169 | emajb          | myschema1_mytbl2b_log_seq          | Mark11         |             1 | f
    4170 | myschema2      | myseq1                             | Mark21         |          1000 | f
    4171 | myschema2      | myTbl3_col31_seq                   | Mark21         |             1 | f
    4172 | emaj           | myschema2_mytbl1_log_seq           | Mark21         |             1 | f
    4173 | emaj           | myschema2_mytbl2_log_seq           | Mark21         |             1 | f
    4174 | emajC          | myschema2_myTbl3_log_seq           | Mark21         |             1 | f
    4175 | emaj           | myschema2_mytbl4_log_seq           | Mark21         |             1 | f
    4176 | emaj           | myschema2_mytbl5_log_seq           | Mark21         |             1 | f
    4177 | emaj           | myschema2_mytbl6_log_seq           | Mark21         |             1 | f
    4178 | myschema1      | myTbl3_col31_seq                   | Mark12         |             1 | f
    4179 | emajC          | myschema1_myTbl3_log_seq           | Mark12         |             1 | f
    4180 | emaj           | myschema1_mytbl1_log_seq           | Mark12         |            15 | t
    4181 | emaj           | myschema1_mytbl4_log_seq           | Mark12         |             1 | f
    4182 | emaj           | myschema1_mytbl2_log_seq           | Mark12         |             6 | t
    4183 | emajb          | myschema1_mytbl2b_log_seq          | Mark12         |             6 | t
    4186 | emaj           | myschema1_mytbl1_log_seq           | Mark13         |            15 | t
    4188 | emaj           | myschema1_mytbl2_log_seq           | Mark13         |             6 | t
    4189 | emajb          | myschema1_mytbl2b_log_seq          | Mark13         |             6 | t
(27 rows)

select sqhl_id, sqhl_schema, sqhl_table, sqhl_hole_size from emaj.emaj_seq_hole order by sqhl_id;
 sqhl_id | sqhl_schema | sqhl_table | sqhl_hole_size 
---------+-------------+------------+----------------
     400 | myschema1   | myTbl3     |             10
     401 | myschema1   | mytbl4     |              2
(2 rows)

select col31, col33, emaj_verb, emaj_tuple, emaj_gid from "emajC"."myschema1_myTbl3_log" order by emaj_gid, emaj_tuple desc;
 col31 | col33 | emaj_verb | emaj_tuple | emaj_gid 
-------+-------+-----------+------------+----------
(0 rows)

select col41, col42, col43, col44, col45, emaj_verb, emaj_tuple, emaj_gid from emaj.myschema1_myTbl4_log order by emaj_gid, emaj_tuple desc;
 col41 | col42 | col43 | col44 | col45 | emaj_verb | emaj_tuple | emaj_gid 
-------+-------+-------+-------+-------+-----------+------------+----------
(0 rows)

select col31, col33 from myschema1."myTbl3" order by col31;
 col31 | col33 
-------+-------
(0 rows)

select col41, col42, col43, col44, col45 from myschema1.myTbl4 order by col41;
 col41 | col42 | col43 | col44 | col45 
-------+-------+-------+-------+-------
(0 rows)

-- rollback #2 (and stop)
alter table mySchema1.myTbl2 disable trigger myTbl2trg;
select emaj.emaj_rollback_group('myGroup1','Mark11');
 emaj_rollback_group 
---------------------
                   4
(1 row)

alter table mySchema1.myTbl2 enable trigger myTbl2trg;
select emaj.emaj_stop_group('myGroup1');
 emaj_stop_group 
-----------------
               6
(1 row)

-- check impact
select mark_id, mark_group, regexp_replace(mark_name,E'\\d\\d\.\\d\\d\\.\\d\\d\\.\\d\\d\\d','%','g'), mark_global_seq, mark_is_deleted, mark_comment, mark_last_seq_hole_id, mark_last_sequence_id, mark_log_rows_before_next from emaj.emaj_mark order by mark_id;
 mark_id |    mark_group    | regexp_replace | mark_global_seq | mark_is_deleted | mark_comment | mark_last_seq_hole_id | mark_last_sequence_id | mark_log_rows_before_next 
---------+------------------+----------------+-----------------+-----------------+--------------+-----------------------+-----------------------+---------------------------
     316 | phil's group#3", | Mark4          |               2 | f               |              |                   299 |                  3115 |                          
     424 | myGroup1         | Mark11         |               2 | t               |              |                   399 |                  4169 |                         0
     425 | myGroup2         | Mark21         |               2 | f               |              |                   399 |                  4177 |                          
     428 | myGroup1         | STOP_%         |              41 | t               |              |                   404 |                  4195 |                         0
(4 rows)

select sequ_id,sequ_schema, sequ_name, regexp_replace(sequ_mark,E'\\d\\d\.\\d\\d\\.\\d\\d\\.\\d\\d\\d','%','g'), sequ_last_val, sequ_is_called from emaj.emaj_sequence order by sequ_id;
 sequ_id |  sequ_schema   |             sequ_name              | regexp_replace | sequ_last_val | sequ_is_called 
---------+----------------+------------------------------------+----------------+---------------+----------------
    3112 | phil's schema3 | myTbl2\_col21_seq                  | Mark4          |             1 | f
    3113 | phil's schema3 | phil's seq\1                       | Mark4          |          1000 | f
    3114 | emaj           | phil's schema3_myTbl2\_log_seq     | Mark4          |             1 | f
    3115 | emaj #'3       | phil's schema3_phil's tbl1_log_seq | Mark4          |             1 | f
    4164 | myschema1      | myTbl3_col31_seq                   | Mark11         |             1 | f
    4165 | emajC          | myschema1_myTbl3_log_seq           | Mark11         |             1 | f
    4166 | emaj           | myschema1_mytbl1_log_seq           | Mark11         |             1 | f
    4167 | emaj           | myschema1_mytbl4_log_seq           | Mark11         |             1 | f
    4168 | emaj           | myschema1_mytbl2_log_seq           | Mark11         |             1 | f
    4169 | emajb          | myschema1_mytbl2b_log_seq          | Mark11         |             1 | f
    4170 | myschema2      | myseq1                             | Mark21         |          1000 | f
    4171 | myschema2      | myTbl3_col31_seq                   | Mark21         |             1 | f
    4172 | emaj           | myschema2_mytbl1_log_seq           | Mark21         |             1 | f
    4173 | emaj           | myschema2_mytbl2_log_seq           | Mark21         |             1 | f
    4174 | emajC          | myschema2_myTbl3_log_seq           | Mark21         |             1 | f
    4175 | emaj           | myschema2_mytbl4_log_seq           | Mark21         |             1 | f
    4176 | emaj           | myschema2_mytbl5_log_seq           | Mark21         |             1 | f
    4177 | emaj           | myschema2_mytbl6_log_seq           | Mark21         |             1 | f
    4179 | emajC          | myschema1_myTbl3_log_seq           | Mark12         |             1 | f
    4181 | emaj           | myschema1_mytbl4_log_seq           | Mark12         |             1 | f
    4190 | myschema1      | myTbl3_col31_seq                   | STOP_%         |             1 | f
    4191 | emajC          | myschema1_myTbl3_log_seq           | STOP_%         |            10 | t
    4192 | emaj           | myschema1_mytbl1_log_seq           | STOP_%         |            15 | t
    4193 | emaj           | myschema1_mytbl4_log_seq           | STOP_%         |             2 | t
    4194 | emaj           | myschema1_mytbl2_log_seq           | STOP_%         |             6 | t
    4195 | emajb          | myschema1_mytbl2b_log_seq          | STOP_%         |             6 | t
(26 rows)

select sqhl_id, sqhl_schema, sqhl_table, sqhl_hole_size from emaj.emaj_seq_hole order by sqhl_id;
 sqhl_id | sqhl_schema | sqhl_table | sqhl_hole_size 
---------+-------------+------------+----------------
     400 | myschema1   | myTbl3     |             10
     401 | myschema1   | mytbl4     |              2
     402 | myschema1   | mytbl1     |             15
     403 | myschema1   | mytbl2     |              6
     404 | myschema1   | mytbl2b    |              6
(5 rows)

select col11, col12, col13, emaj_verb, emaj_tuple, emaj_gid from emaj.myschema1_myTbl1_log order by emaj_gid, emaj_tuple desc;
 col11 | col12 | col13 | emaj_verb | emaj_tuple | emaj_gid 
-------+-------+-------+-----------+------------+----------
(0 rows)

select col21, col22, emaj_verb, emaj_tuple, emaj_gid from emaj.myschema1_myTbl2_log order by emaj_gid, emaj_tuple desc;
 col21 | col22 | emaj_verb | emaj_tuple | emaj_gid 
-------+-------+-----------+------------+----------
(0 rows)

select col20, col21, emaj_verb, emaj_tuple, emaj_gid from emajb.myschema1_myTbl2b_log order by emaj_gid, emaj_tuple desc;
 col20 | col21 | emaj_verb | emaj_tuple | emaj_gid 
-------+-------+-----------+------------+----------
(0 rows)

select col11, col12, col13 from myschema1.myTbl1 order by col11, col12;
 col11 | col12 | col13 
-------+-------+-------
(0 rows)

select col21, col22 from myschema1.myTbl2 order by col21;
 col21 | col22 
-------+-------
(0 rows)

select col20, col21 from myschema1.myTbl2b order by col20;
 col20 | col21 
-------+-------
(0 rows)

-- restart group
select emaj.emaj_start_group('myGroup1','Mark11');
 emaj_start_group 
------------------
                6
(1 row)

-- check the logs are empty again
select count(*) from emaj.myschema1_mytbl1_log;
 count 
-------
     0
(1 row)

select count(*) from emaj.myschema1_mytbl2_log;
 count 
-------
     0
(1 row)

select count(*) from emajb.myschema1_mytbl2b_log;
 count 
-------
     0
(1 row)

select count(*) from "emajC"."myschema1_myTbl3_log";
 count 
-------
     0
(1 row)

select count(*) from emaj.myschema1_mytbl4_log;
 count 
-------
     0
(1 row)

-----------------------------
-- log phase #2 with 2 unlogged rollbacks
-----------------------------
-- Populate application tables
set search_path=public,myschema1;
-- inserts/updates/deletes in myTbl1, myTbl2 and myTbl2b (via trigger)
insert into myTbl1 select i, 'ABC', E'\\014'::bytea from generate_series (1,11) as i;
begin transaction;
  update myTbl1 set col13=E'\\034'::bytea where col11 <= 3;
  insert into myTbl2 values (1,'ABC',current_date);
commit;
delete from myTbl1 where col11 > 10;
insert into myTbl2 values (2,'DEF',NULL);
select count(*) from mytbl1;
 count 
-------
    10
(1 row)

select count(*) from mytbl2;
 count 
-------
     2
(1 row)

select count(*) from mytbl2b;
 count 
-------
     2
(1 row)

-- set a mark
select emaj.emaj_set_mark_group('myGroup1','Mark12');
 emaj_set_mark_group 
---------------------
                   6
(1 row)

-- inserts/updates/deletes in myTbl3 and myTbl4
insert into "myTbl3" (col33) select generate_series(1000,1039,4)/100;
insert into myTbl4 values (1,'FK...',1,1,'ABC');
select count(*) from "myTbl3";
 count 
-------
    10
(1 row)

select count(*) from myTbl4;
 count 
-------
     1
(1 row)

-- set a mark
select emaj.emaj_set_mark_group('myGroup1','Mark13');
 emaj_set_mark_group 
---------------------
                   6
(1 row)

select mark_id, mark_group, regexp_replace(mark_name,E'\\d\\d\.\\d\\d\\.\\d\\d\\.\\d\\d\\d','%','g'), mark_global_seq, mark_is_deleted, mark_comment, mark_last_seq_hole_id, mark_last_sequence_id, mark_log_rows_before_next from emaj.emaj_mark order by mark_id;
 mark_id |    mark_group    | regexp_replace | mark_global_seq | mark_is_deleted | mark_comment | mark_last_seq_hole_id | mark_last_sequence_id | mark_log_rows_before_next 
---------+------------------+----------------+-----------------+-----------------+--------------+-----------------------+-----------------------+---------------------------
     316 | phil's group#3", | Mark4          |               2 | f               |              |                   299 |                  3115 |                          
     425 | myGroup2         | Mark21         |               2 | f               |              |                   399 |                  4177 |                          
     429 | myGroup1         | Mark11         |              41 | f               |              |                   404 |                  4201 |                        19
     430 | myGroup1         | Mark12         |              60 | f               |              |                   404 |                  4207 |                        11
     431 | myGroup1         | Mark13         |              71 | f               |              |                   404 |                  4213 |                          
(5 rows)

select sequ_id,sequ_schema, sequ_name, regexp_replace(sequ_mark,E'\\d\\d\.\\d\\d\\.\\d\\d\\.\\d\\d\\d','%','g'), sequ_last_val, sequ_is_called from emaj.emaj_sequence order by sequ_id;
 sequ_id |  sequ_schema   |             sequ_name              | regexp_replace | sequ_last_val | sequ_is_called 
---------+----------------+------------------------------------+----------------+---------------+----------------
    3112 | phil's schema3 | myTbl2\_col21_seq                  | Mark4          |             1 | f
    3113 | phil's schema3 | phil's seq\1                       | Mark4          |          1000 | f
    3114 | emaj           | phil's schema3_myTbl2\_log_seq     | Mark4          |             1 | f
    3115 | emaj #'3       | phil's schema3_phil's tbl1_log_seq | Mark4          |             1 | f
    4170 | myschema2      | myseq1                             | Mark21         |          1000 | f
    4171 | myschema2      | myTbl3_col31_seq                   | Mark21         |             1 | f
    4172 | emaj           | myschema2_mytbl1_log_seq           | Mark21         |             1 | f
    4173 | emaj           | myschema2_mytbl2_log_seq           | Mark21         |             1 | f
    4174 | emajC          | myschema2_myTbl3_log_seq           | Mark21         |             1 | f
    4175 | emaj           | myschema2_mytbl4_log_seq           | Mark21         |             1 | f
    4176 | emaj           | myschema2_mytbl5_log_seq           | Mark21         |             1 | f
    4177 | emaj           | myschema2_mytbl6_log_seq           | Mark21         |             1 | f
    4196 | myschema1      | myTbl3_col31_seq                   | Mark11         |             1 | f
    4197 | emajC          | myschema1_myTbl3_log_seq           | Mark11         |             1 | f
    4198 | emaj           | myschema1_mytbl1_log_seq           | Mark11         |             1 | f
    4199 | emaj           | myschema1_mytbl4_log_seq           | Mark11         |             1 | f
    4200 | emaj           | myschema1_mytbl2_log_seq           | Mark11         |             1 | f
    4201 | emajb          | myschema1_mytbl2b_log_seq          | Mark11         |             1 | f
    4202 | myschema1      | myTbl3_col31_seq                   | Mark12         |             1 | f
    4203 | emajC          | myschema1_myTbl3_log_seq           | Mark12         |             1 | f
    4204 | emaj           | myschema1_mytbl1_log_seq           | Mark12         |            15 | t
    4205 | emaj           | myschema1_mytbl4_log_seq           | Mark12         |             1 | f
    4206 | emaj           | myschema1_mytbl2_log_seq           | Mark12         |             2 | t
    4207 | emajb          | myschema1_mytbl2b_log_seq          | Mark12         |             2 | t
    4208 | myschema1      | myTbl3_col31_seq                   | Mark13         |            10 | t
    4209 | emajC          | myschema1_myTbl3_log_seq           | Mark13         |            10 | t
    4210 | emaj           | myschema1_mytbl1_log_seq           | Mark13         |            15 | t
    4211 | emaj           | myschema1_mytbl4_log_seq           | Mark13         |             1 | t
    4212 | emaj           | myschema1_mytbl2_log_seq           | Mark13         |             2 | t
    4213 | emajb          | myschema1_mytbl2b_log_seq          | Mark13         |             2 | t
(30 rows)

select col11, col12, col13, emaj_verb, emaj_tuple, emaj_gid from emaj.myschema1_mytbl1_log order by emaj_gid, emaj_tuple desc;
 col11 |   col12    | col13 | emaj_verb | emaj_tuple | emaj_gid 
-------+------------+-------+-----------+------------+----------
     1 | ABC        | \014  | INS       | NEW        |       42
     2 | ABC        | \014  | INS       | NEW        |       43
     3 | ABC        | \014  | INS       | NEW        |       44
     4 | ABC        | \014  | INS       | NEW        |       45
     5 | ABC        | \014  | INS       | NEW        |       46
     6 | ABC        | \014  | INS       | NEW        |       47
     7 | ABC        | \014  | INS       | NEW        |       48
     8 | ABC        | \014  | INS       | NEW        |       49
     9 | ABC        | \014  | INS       | NEW        |       50
    10 | ABC        | \014  | INS       | NEW        |       51
    11 | ABC        | \014  | INS       | NEW        |       52
     1 | ABC        | \014  | UPD       | OLD        |       53
     1 | ABC        | \034  | UPD       | NEW        |       53
     2 | ABC        | \014  | UPD       | OLD        |       54
     2 | ABC        | \034  | UPD       | NEW        |       54
     3 | ABC        | \014  | UPD       | OLD        |       55
     3 | ABC        | \034  | UPD       | NEW        |       55
    11 | ABC        | \014  | DEL       | OLD        |       58
(18 rows)

select col21, col22, emaj_verb, emaj_tuple, emaj_gid from emaj.myschema1_mytbl2_log order by emaj_gid, emaj_tuple desc;
 col21 | col22 | emaj_verb | emaj_tuple | emaj_gid 
-------+-------+-----------+------------+----------
     1 | ABC   | INS       | NEW        |       56
     2 | DEF   | INS       | NEW        |       59
(2 rows)

select col20, col21, emaj_verb, emaj_tuple, emaj_gid from emajb.myschema1_mytbl2b_log order by emaj_gid, emaj_tuple desc;
 col20 | col21 | emaj_verb | emaj_tuple | emaj_gid 
-------+-------+-----------+------------+----------
     7 |     1 | INS       | NEW        |       57
     8 |     2 | INS       | NEW        |       60
(2 rows)

select col31, col33, emaj_verb, emaj_tuple, emaj_gid from "emajC"."myschema1_myTbl3_log" order by emaj_gid, emaj_tuple desc;
 col31 | col33 | emaj_verb | emaj_tuple | emaj_gid 
-------+-------+-----------+------------+----------
     1 | 10.00 | INS       | NEW        |       61
     2 | 10.00 | INS       | NEW        |       62
     3 | 10.00 | INS       | NEW        |       63
     4 | 10.00 | INS       | NEW        |       64
     5 | 10.00 | INS       | NEW        |       65
     6 | 10.00 | INS       | NEW        |       66
     7 | 10.00 | INS       | NEW        |       67
     8 | 10.00 | INS       | NEW        |       68
     9 | 10.00 | INS       | NEW        |       69
    10 | 10.00 | INS       | NEW        |       70
(10 rows)

select col41, col42, col43, col44, col45, emaj_verb, emaj_tuple, emaj_gid from emaj.myschema1_myTbl4_log order by emaj_gid, emaj_tuple desc;
 col41 | col42 | col43 | col44 |   col45    | emaj_verb | emaj_tuple | emaj_gid 
-------+-------+-------+-------+------------+-----------+------------+----------
     1 | FK... |     1 |     1 | ABC        | INS       | NEW        |       71
(1 row)

-- logged rollback #1
alter table mySchema1.myTbl2 disable trigger myTbl2trg;
select emaj.emaj_logged_rollback_group('myGroup1','Mark12');
 emaj_logged_rollback_group 
----------------------------
                          3
(1 row)

alter table mySchema1.myTbl2 enable trigger myTbl2trg;
-- check impact
select mark_id, mark_group, regexp_replace(mark_name,E'\\d\\d\.\\d\\d\\.\\d\\d\\.\\d\\d\\d','%','g'), mark_global_seq, mark_is_deleted, mark_comment, mark_last_seq_hole_id, mark_last_sequence_id, mark_log_rows_before_next from emaj.emaj_mark order by mark_id;
 mark_id |    mark_group    |   regexp_replace    | mark_global_seq | mark_is_deleted | mark_comment | mark_last_seq_hole_id | mark_last_sequence_id | mark_log_rows_before_next 
---------+------------------+---------------------+-----------------+-----------------+--------------+-----------------------+-----------------------+---------------------------
     316 | phil's group#3", | Mark4               |               2 | f               |              |                   299 |                  3115 |                          
     425 | myGroup2         | Mark21              |               2 | f               |              |                   399 |                  4177 |                          
     429 | myGroup1         | Mark11              |              41 | f               |              |                   404 |                  4201 |                        19
     430 | myGroup1         | Mark12              |              60 | f               |              |                   404 |                  4207 |                        11
     431 | myGroup1         | Mark13              |              71 | f               |              |                   404 |                  4213 |                         0
     432 | myGroup1         | RLBK_Mark12_%_START |              71 | f               |              |                   404 |                  4219 |                        11
     433 | myGroup1         | RLBK_Mark12_%_DONE  |              82 | f               |              |                   404 |                  4225 |                          
(7 rows)

select sequ_id,sequ_schema, sequ_name, regexp_replace(sequ_mark,E'\\d\\d\.\\d\\d\\.\\d\\d\\.\\d\\d\\d','%','g'), sequ_last_val, sequ_is_called from emaj.emaj_sequence order by sequ_id;
 sequ_id |  sequ_schema   |             sequ_name              |   regexp_replace    | sequ_last_val | sequ_is_called 
---------+----------------+------------------------------------+---------------------+---------------+----------------
    3112 | phil's schema3 | myTbl2\_col21_seq                  | Mark4               |             1 | f
    3113 | phil's schema3 | phil's seq\1                       | Mark4               |          1000 | f
    3114 | emaj           | phil's schema3_myTbl2\_log_seq     | Mark4               |             1 | f
    3115 | emaj #'3       | phil's schema3_phil's tbl1_log_seq | Mark4               |             1 | f
    4170 | myschema2      | myseq1                             | Mark21              |          1000 | f
    4171 | myschema2      | myTbl3_col31_seq                   | Mark21              |             1 | f
    4172 | emaj           | myschema2_mytbl1_log_seq           | Mark21              |             1 | f
    4173 | emaj           | myschema2_mytbl2_log_seq           | Mark21              |             1 | f
    4174 | emajC          | myschema2_myTbl3_log_seq           | Mark21              |             1 | f
    4175 | emaj           | myschema2_mytbl4_log_seq           | Mark21              |             1 | f
    4176 | emaj           | myschema2_mytbl5_log_seq           | Mark21              |             1 | f
    4177 | emaj           | myschema2_mytbl6_log_seq           | Mark21              |             1 | f
    4196 | myschema1      | myTbl3_col31_seq                   | Mark11              |             1 | f
    4197 | emajC          | myschema1_myTbl3_log_seq           | Mark11              |             1 | f
    4198 | emaj           | myschema1_mytbl1_log_seq           | Mark11              |             1 | f
    4199 | emaj           | myschema1_mytbl4_log_seq           | Mark11              |             1 | f
    4200 | emaj           | myschema1_mytbl2_log_seq           | Mark11              |             1 | f
    4201 | emajb          | myschema1_mytbl2b_log_seq          | Mark11              |             1 | f
    4202 | myschema1      | myTbl3_col31_seq                   | Mark12              |             1 | f
    4203 | emajC          | myschema1_myTbl3_log_seq           | Mark12              |             1 | f
    4204 | emaj           | myschema1_mytbl1_log_seq           | Mark12              |            15 | t
    4205 | emaj           | myschema1_mytbl4_log_seq           | Mark12              |             1 | f
    4206 | emaj           | myschema1_mytbl2_log_seq           | Mark12              |             2 | t
    4207 | emajb          | myschema1_mytbl2b_log_seq          | Mark12              |             2 | t
    4208 | myschema1      | myTbl3_col31_seq                   | Mark13              |            10 | t
    4209 | emajC          | myschema1_myTbl3_log_seq           | Mark13              |            10 | t
    4210 | emaj           | myschema1_mytbl1_log_seq           | Mark13              |            15 | t
    4211 | emaj           | myschema1_mytbl4_log_seq           | Mark13              |             1 | t
    4212 | emaj           | myschema1_mytbl2_log_seq           | Mark13              |             2 | t
    4213 | emajb          | myschema1_mytbl2b_log_seq          | Mark13              |             2 | t
    4214 | myschema1      | myTbl3_col31_seq                   | RLBK_Mark12_%_START |            10 | t
    4215 | emajC          | myschema1_myTbl3_log_seq           | RLBK_Mark12_%_START |            10 | t
    4216 | emaj           | myschema1_mytbl1_log_seq           | RLBK_Mark12_%_START |            15 | t
    4217 | emaj           | myschema1_mytbl4_log_seq           | RLBK_Mark12_%_START |             1 | t
    4218 | emaj           | myschema1_mytbl2_log_seq           | RLBK_Mark12_%_START |             2 | t
    4219 | emajb          | myschema1_mytbl2b_log_seq          | RLBK_Mark12_%_START |             2 | t
    4220 | myschema1      | myTbl3_col31_seq                   | RLBK_Mark12_%_DONE  |             1 | f
    4221 | emajC          | myschema1_myTbl3_log_seq           | RLBK_Mark12_%_DONE  |            20 | t
    4222 | emaj           | myschema1_mytbl1_log_seq           | RLBK_Mark12_%_DONE  |            15 | t
    4223 | emaj           | myschema1_mytbl4_log_seq           | RLBK_Mark12_%_DONE  |             2 | t
    4224 | emaj           | myschema1_mytbl2_log_seq           | RLBK_Mark12_%_DONE  |             2 | t
    4225 | emajb          | myschema1_mytbl2b_log_seq          | RLBK_Mark12_%_DONE  |             2 | t
(42 rows)

select sqhl_id, sqhl_schema, sqhl_table, sqhl_hole_size from emaj.emaj_seq_hole order by sqhl_id;
 sqhl_id | sqhl_schema | sqhl_table | sqhl_hole_size 
---------+-------------+------------+----------------
(0 rows)

select col31, col33, emaj_verb, emaj_tuple, emaj_gid from "emajC"."myschema1_myTbl3_log" order by emaj_gid, emaj_tuple desc;
 col31 | col33 | emaj_verb | emaj_tuple | emaj_gid 
-------+-------+-----------+------------+----------
     1 | 10.00 | INS       | NEW        |       61
     2 | 10.00 | INS       | NEW        |       62
     3 | 10.00 | INS       | NEW        |       63
     4 | 10.00 | INS       | NEW        |       64
     5 | 10.00 | INS       | NEW        |       65
     6 | 10.00 | INS       | NEW        |       66
     7 | 10.00 | INS       | NEW        |       67
     8 | 10.00 | INS       | NEW        |       68
     9 | 10.00 | INS       | NEW        |       69
    10 | 10.00 | INS       | NEW        |       70
     8 | 10.00 | DEL       | OLD        |       72
     3 | 10.00 | DEL       | OLD        |       73
     4 | 10.00 | DEL       | OLD        |       74
     1 | 10.00 | DEL       | OLD        |       75
    10 | 10.00 | DEL       | OLD        |       76
     9 | 10.00 | DEL       | OLD        |       77
     6 | 10.00 | DEL       | OLD        |       78
     2 | 10.00 | DEL       | OLD        |       79
     5 | 10.00 | DEL       | OLD        |       80
     7 | 10.00 | DEL       | OLD        |       81
(20 rows)

select col41, col42, col43, col44, col45, emaj_verb, emaj_tuple, emaj_gid from emaj.myschema1_myTbl4_log order by emaj_gid, emaj_tuple desc;
 col41 | col42 | col43 | col44 |   col45    | emaj_verb | emaj_tuple | emaj_gid 
-------+-------+-------+-------+------------+-----------+------------+----------
     1 | FK... |     1 |     1 | ABC        | INS       | NEW        |       71
     1 | FK... |     1 |     1 | ABC        | DEL       | OLD        |       82
(2 rows)

select col31, col33 from myschema1."myTbl3" order by col31;
 col31 | col33 
-------+-------
(0 rows)

select col41, col42, col43, col44, col45 from myschema1.myTbl4 order by col41;
 col41 | col42 | col43 | col44 | col45 
-------+-------+-------+-------+-------
(0 rows)

-- logged rollback #2
alter table mySchema1.myTbl2 disable trigger myTbl2trg;
select emaj.emaj_logged_rollback_group('myGroup1','Mark11');
 emaj_logged_rollback_group 
----------------------------
                          6
(1 row)

alter table mySchema1.myTbl2 enable trigger myTbl2trg;
-- check impact
select mark_id, mark_group, regexp_replace(mark_name,E'\\d\\d\.\\d\\d\\.\\d\\d\\.\\d\\d\\d','%','g'), mark_global_seq, mark_is_deleted, mark_comment, mark_last_seq_hole_id, mark_last_sequence_id, mark_log_rows_before_next from emaj.emaj_mark order by mark_id;
 mark_id |    mark_group    |   regexp_replace    | mark_global_seq | mark_is_deleted | mark_comment | mark_last_seq_hole_id | mark_last_sequence_id | mark_log_rows_before_next 
---------+------------------+---------------------+-----------------+-----------------+--------------+-----------------------+-----------------------+---------------------------
     316 | phil's group#3", | Mark4               |               2 | f               |              |                   299 |                  3115 |                          
     425 | myGroup2         | Mark21              |               2 | f               |              |                   399 |                  4177 |                          
     429 | myGroup1         | Mark11              |              41 | f               |              |                   404 |                  4201 |                        19
     430 | myGroup1         | Mark12              |              60 | f               |              |                   404 |                  4207 |                        11
     431 | myGroup1         | Mark13              |              71 | f               |              |                   404 |                  4213 |                         0
     432 | myGroup1         | RLBK_Mark12_%_START |              71 | f               |              |                   404 |                  4219 |                        11
     433 | myGroup1         | RLBK_Mark12_%_DONE  |              82 | f               |              |                   404 |                  4225 |                         0
     434 | myGroup1         | RLBK_Mark11_%_START |              82 | f               |              |                   404 |                  4231 |                        14
     435 | myGroup1         | RLBK_Mark11_%_DONE  |              96 | f               |              |                   404 |                  4237 |                          
(9 rows)

select sequ_id,sequ_schema, sequ_name, regexp_replace(sequ_mark,E'\\d\\d\.\\d\\d\\.\\d\\d\\.\\d\\d\\d','%','g'), sequ_last_val, sequ_is_called from emaj.emaj_sequence order by sequ_id;
 sequ_id |  sequ_schema   |             sequ_name              |   regexp_replace    | sequ_last_val | sequ_is_called 
---------+----------------+------------------------------------+---------------------+---------------+----------------
    3112 | phil's schema3 | myTbl2\_col21_seq                  | Mark4               |             1 | f
    3113 | phil's schema3 | phil's seq\1                       | Mark4               |          1000 | f
    3114 | emaj           | phil's schema3_myTbl2\_log_seq     | Mark4               |             1 | f
    3115 | emaj #'3       | phil's schema3_phil's tbl1_log_seq | Mark4               |             1 | f
    4170 | myschema2      | myseq1                             | Mark21              |          1000 | f
    4171 | myschema2      | myTbl3_col31_seq                   | Mark21              |             1 | f
    4172 | emaj           | myschema2_mytbl1_log_seq           | Mark21              |             1 | f
    4173 | emaj           | myschema2_mytbl2_log_seq           | Mark21              |             1 | f
    4174 | emajC          | myschema2_myTbl3_log_seq           | Mark21              |             1 | f
    4175 | emaj           | myschema2_mytbl4_log_seq           | Mark21              |             1 | f
    4176 | emaj           | myschema2_mytbl5_log_seq           | Mark21              |             1 | f
    4177 | emaj           | myschema2_mytbl6_log_seq           | Mark21              |             1 | f
    4196 | myschema1      | myTbl3_col31_seq                   | Mark11              |             1 | f
    4197 | emajC          | myschema1_myTbl3_log_seq           | Mark11              |             1 | f
    4198 | emaj           | myschema1_mytbl1_log_seq           | Mark11              |             1 | f
    4199 | emaj           | myschema1_mytbl4_log_seq           | Mark11              |             1 | f
    4200 | emaj           | myschema1_mytbl2_log_seq           | Mark11              |             1 | f
    4201 | emajb          | myschema1_mytbl2b_log_seq          | Mark11              |             1 | f
    4202 | myschema1      | myTbl3_col31_seq                   | Mark12              |             1 | f
    4203 | emajC          | myschema1_myTbl3_log_seq           | Mark12              |             1 | f
    4204 | emaj           | myschema1_mytbl1_log_seq           | Mark12              |            15 | t
    4205 | emaj           | myschema1_mytbl4_log_seq           | Mark12              |             1 | f
    4206 | emaj           | myschema1_mytbl2_log_seq           | Mark12              |             2 | t
    4207 | emajb          | myschema1_mytbl2b_log_seq          | Mark12              |             2 | t
    4208 | myschema1      | myTbl3_col31_seq                   | Mark13              |            10 | t
    4209 | emajC          | myschema1_myTbl3_log_seq           | Mark13              |            10 | t
    4210 | emaj           | myschema1_mytbl1_log_seq           | Mark13              |            15 | t
    4211 | emaj           | myschema1_mytbl4_log_seq           | Mark13              |             1 | t
    4212 | emaj           | myschema1_mytbl2_log_seq           | Mark13              |             2 | t
    4213 | emajb          | myschema1_mytbl2b_log_seq          | Mark13              |             2 | t
    4214 | myschema1      | myTbl3_col31_seq                   | RLBK_Mark12_%_START |            10 | t
    4215 | emajC          | myschema1_myTbl3_log_seq           | RLBK_Mark12_%_START |            10 | t
    4216 | emaj           | myschema1_mytbl1_log_seq           | RLBK_Mark12_%_START |            15 | t
    4217 | emaj           | myschema1_mytbl4_log_seq           | RLBK_Mark12_%_START |             1 | t
    4218 | emaj           | myschema1_mytbl2_log_seq           | RLBK_Mark12_%_START |             2 | t
    4219 | emajb          | myschema1_mytbl2b_log_seq          | RLBK_Mark12_%_START |             2 | t
    4220 | myschema1      | myTbl3_col31_seq                   | RLBK_Mark12_%_DONE  |             1 | f
    4221 | emajC          | myschema1_myTbl3_log_seq           | RLBK_Mark12_%_DONE  |            20 | t
    4222 | emaj           | myschema1_mytbl1_log_seq           | RLBK_Mark12_%_DONE  |            15 | t
    4223 | emaj           | myschema1_mytbl4_log_seq           | RLBK_Mark12_%_DONE  |             2 | t
    4224 | emaj           | myschema1_mytbl2_log_seq           | RLBK_Mark12_%_DONE  |             2 | t
    4225 | emajb          | myschema1_mytbl2b_log_seq          | RLBK_Mark12_%_DONE  |             2 | t
    4226 | myschema1      | myTbl3_col31_seq                   | RLBK_Mark11_%_START |             1 | f
    4227 | emajC          | myschema1_myTbl3_log_seq           | RLBK_Mark11_%_START |            20 | t
    4228 | emaj           | myschema1_mytbl1_log_seq           | RLBK_Mark11_%_START |            15 | t
    4229 | emaj           | myschema1_mytbl4_log_seq           | RLBK_Mark11_%_START |             2 | t
    4230 | emaj           | myschema1_mytbl2_log_seq           | RLBK_Mark11_%_START |             2 | t
    4231 | emajb          | myschema1_mytbl2b_log_seq          | RLBK_Mark11_%_START |             2 | t
    4232 | myschema1      | myTbl3_col31_seq                   | RLBK_Mark11_%_DONE  |             1 | f
    4233 | emajC          | myschema1_myTbl3_log_seq           | RLBK_Mark11_%_DONE  |            20 | t
    4234 | emaj           | myschema1_mytbl1_log_seq           | RLBK_Mark11_%_DONE  |            25 | t
    4235 | emaj           | myschema1_mytbl4_log_seq           | RLBK_Mark11_%_DONE  |             2 | t
    4236 | emaj           | myschema1_mytbl2_log_seq           | RLBK_Mark11_%_DONE  |             4 | t
    4237 | emajb          | myschema1_mytbl2b_log_seq          | RLBK_Mark11_%_DONE  |             4 | t
(54 rows)

select sqhl_id, sqhl_schema, sqhl_table, sqhl_hole_size from emaj.emaj_seq_hole order by sqhl_id;
 sqhl_id | sqhl_schema | sqhl_table | sqhl_hole_size 
---------+-------------+------------+----------------
(0 rows)

select col11, col12, col13, emaj_verb, emaj_tuple, emaj_gid from emaj.myschema1_myTbl1_log order by emaj_gid, emaj_tuple desc;
 col11 |   col12    | col13 | emaj_verb | emaj_tuple | emaj_gid 
-------+------------+-------+-----------+------------+----------
     1 | ABC        | \014  | INS       | NEW        |       42
     2 | ABC        | \014  | INS       | NEW        |       43
     3 | ABC        | \014  | INS       | NEW        |       44
     4 | ABC        | \014  | INS       | NEW        |       45
     5 | ABC        | \014  | INS       | NEW        |       46
     6 | ABC        | \014  | INS       | NEW        |       47
     7 | ABC        | \014  | INS       | NEW        |       48
     8 | ABC        | \014  | INS       | NEW        |       49
     9 | ABC        | \014  | INS       | NEW        |       50
    10 | ABC        | \014  | INS       | NEW        |       51
    11 | ABC        | \014  | INS       | NEW        |       52
     1 | ABC        | \014  | UPD       | OLD        |       53
     1 | ABC        | \034  | UPD       | NEW        |       53
     2 | ABC        | \014  | UPD       | OLD        |       54
     2 | ABC        | \034  | UPD       | NEW        |       54
     3 | ABC        | \014  | UPD       | OLD        |       55
     3 | ABC        | \034  | UPD       | NEW        |       55
    11 | ABC        | \014  | DEL       | OLD        |       58
     1 | ABC        | \034  | DEL       | OLD        |       83
     2 | ABC        | \034  | DEL       | OLD        |       84
     3 | ABC        | \034  | DEL       | OLD        |       85
     4 | ABC        | \014  | DEL       | OLD        |       86
     5 | ABC        | \014  | DEL       | OLD        |       87
     6 | ABC        | \014  | DEL       | OLD        |       88
     7 | ABC        | \014  | DEL       | OLD        |       89
     8 | ABC        | \014  | DEL       | OLD        |       90
     9 | ABC        | \014  | DEL       | OLD        |       91
    10 | ABC        | \014  | DEL       | OLD        |       92
(28 rows)

select col21, col22, emaj_verb, emaj_tuple, emaj_gid from emaj.myschema1_myTbl2_log order by emaj_gid, emaj_tuple desc;
 col21 | col22 | emaj_verb | emaj_tuple | emaj_gid 
-------+-------+-----------+------------+----------
     1 | ABC   | INS       | NEW        |       56
     2 | DEF   | INS       | NEW        |       59
     1 | ABC   | DEL       | OLD        |       93
     2 | DEF   | DEL       | OLD        |       94
(4 rows)

select col20, col21, emaj_verb, emaj_tuple, emaj_gid from emajb.myschema1_myTbl2b_log order by emaj_gid, emaj_tuple desc;
 col20 | col21 | emaj_verb | emaj_tuple | emaj_gid 
-------+-------+-----------+------------+----------
     7 |     1 | INS       | NEW        |       57
     8 |     2 | INS       | NEW        |       60
     8 |     2 | DEL       | OLD        |       95
     7 |     1 | DEL       | OLD        |       96
(4 rows)

select col11, col12, col13 from myschema1.myTbl1 order by col11, col12;
 col11 | col12 | col13 
-------+-------+-------
(0 rows)

select col21, col22 from myschema1.myTbl2 order by col21;
 col21 | col22 
-------+-------
(0 rows)

select col20, col21 from myschema1.myTbl2b order by col20;
 col20 | col21 
-------+-------
(0 rows)

-----------------------------
-- unlogged rollback of logged rollbacks #3
-----------------------------
alter table mySchema1.myTbl2 disable trigger myTbl2trg;
select emaj.emaj_rollback_group('myGroup1','Mark13');
 emaj_rollback_group 
---------------------
                   6
(1 row)

alter table mySchema1.myTbl2 enable trigger myTbl2trg;
-- check impact
select mark_id, mark_group, regexp_replace(mark_name,E'\\d\\d\.\\d\\d\\.\\d\\d\\.\\d\\d\\d','%','g'), mark_global_seq, mark_is_deleted, mark_comment, mark_last_seq_hole_id, mark_last_sequence_id, mark_log_rows_before_next from emaj.emaj_mark order by mark_id;
 mark_id |    mark_group    | regexp_replace | mark_global_seq | mark_is_deleted | mark_comment | mark_last_seq_hole_id | mark_last_sequence_id | mark_log_rows_before_next 
---------+------------------+----------------+-----------------+-----------------+--------------+-----------------------+-----------------------+---------------------------
     316 | phil's group#3", | Mark4          |               2 | f               |              |                   299 |                  3115 |                          
     425 | myGroup2         | Mark21         |               2 | f               |              |                   399 |                  4177 |                          
     429 | myGroup1         | Mark11         |              41 | f               |              |                   404 |                  4201 |                        19
     430 | myGroup1         | Mark12         |              60 | f               |              |                   404 |                  4207 |                        11
     431 | myGroup1         | Mark13         |              71 | f               |              |                   404 |                  4213 |                          
(5 rows)

select sequ_id,sequ_schema, sequ_name, regexp_replace(sequ_mark,E'\\d\\d\.\\d\\d\\.\\d\\d\\.\\d\\d\\d','%','g'), sequ_last_val, sequ_is_called from emaj.emaj_sequence order by sequ_id;
 sequ_id |  sequ_schema   |             sequ_name              | regexp_replace | sequ_last_val | sequ_is_called 
---------+----------------+------------------------------------+----------------+---------------+----------------
    3112 | phil's schema3 | myTbl2\_col21_seq                  | Mark4          |             1 | f
    3113 | phil's schema3 | phil's seq\1                       | Mark4          |          1000 | f
    3114 | emaj           | phil's schema3_myTbl2\_log_seq     | Mark4          |             1 | f
    3115 | emaj #'3       | phil's schema3_phil's tbl1_log_seq | Mark4          |             1 | f
    4170 | myschema2      | myseq1                             | Mark21         |          1000 | f
    4171 | myschema2      | myTbl3_col31_seq                   | Mark21         |             1 | f
    4172 | emaj           | myschema2_mytbl1_log_seq           | Mark21         |             1 | f
    4173 | emaj           | myschema2_mytbl2_log_seq           | Mark21         |             1 | f
    4174 | emajC          | myschema2_myTbl3_log_seq           | Mark21         |             1 | f
    4175 | emaj           | myschema2_mytbl4_log_seq           | Mark21         |             1 | f
    4176 | emaj           | myschema2_mytbl5_log_seq           | Mark21         |             1 | f
    4177 | emaj           | myschema2_mytbl6_log_seq           | Mark21         |             1 | f
    4196 | myschema1      | myTbl3_col31_seq                   | Mark11         |             1 | f
    4197 | emajC          | myschema1_myTbl3_log_seq           | Mark11         |             1 | f
    4198 | emaj           | myschema1_mytbl1_log_seq           | Mark11         |             1 | f
    4199 | emaj           | myschema1_mytbl4_log_seq           | Mark11         |             1 | f
    4200 | emaj           | myschema1_mytbl2_log_seq           | Mark11         |             1 | f
    4201 | emajb          | myschema1_mytbl2b_log_seq          | Mark11         |             1 | f
    4202 | myschema1      | myTbl3_col31_seq                   | Mark12         |             1 | f
    4203 | emajC          | myschema1_myTbl3_log_seq           | Mark12         |             1 | f
    4204 | emaj           | myschema1_mytbl1_log_seq           | Mark12         |            15 | t
    4205 | emaj           | myschema1_mytbl4_log_seq           | Mark12         |             1 | f
    4206 | emaj           | myschema1_mytbl2_log_seq           | Mark12         |             2 | t
    4207 | emajb          | myschema1_mytbl2b_log_seq          | Mark12         |             2 | t
    4208 | myschema1      | myTbl3_col31_seq                   | Mark13         |            10 | t
    4209 | emajC          | myschema1_myTbl3_log_seq           | Mark13         |            10 | t
    4210 | emaj           | myschema1_mytbl1_log_seq           | Mark13         |            15 | t
    4211 | emaj           | myschema1_mytbl4_log_seq           | Mark13         |             1 | t
    4212 | emaj           | myschema1_mytbl2_log_seq           | Mark13         |             2 | t
    4213 | emajb          | myschema1_mytbl2b_log_seq          | Mark13         |             2 | t
(30 rows)

select sqhl_id, sqhl_schema, sqhl_table, sqhl_hole_size from emaj.emaj_seq_hole order by sqhl_id;
 sqhl_id | sqhl_schema | sqhl_table | sqhl_hole_size 
---------+-------------+------------+----------------
     405 | myschema1   | mytbl1     |             10
     406 | myschema1   | mytbl2     |              2
     407 | myschema1   | mytbl4     |              1
     408 | myschema1   | myTbl3     |             10
     409 | myschema1   | mytbl2b    |              2
(5 rows)

select col11, col12, col13, emaj_verb, emaj_tuple, emaj_gid from emaj.myschema1_myTbl1_log order by emaj_gid, emaj_tuple desc;
 col11 |   col12    | col13 | emaj_verb | emaj_tuple | emaj_gid 
-------+------------+-------+-----------+------------+----------
     1 | ABC        | \014  | INS       | NEW        |       42
     2 | ABC        | \014  | INS       | NEW        |       43
     3 | ABC        | \014  | INS       | NEW        |       44
     4 | ABC        | \014  | INS       | NEW        |       45
     5 | ABC        | \014  | INS       | NEW        |       46
     6 | ABC        | \014  | INS       | NEW        |       47
     7 | ABC        | \014  | INS       | NEW        |       48
     8 | ABC        | \014  | INS       | NEW        |       49
     9 | ABC        | \014  | INS       | NEW        |       50
    10 | ABC        | \014  | INS       | NEW        |       51
    11 | ABC        | \014  | INS       | NEW        |       52
     1 | ABC        | \014  | UPD       | OLD        |       53
     1 | ABC        | \034  | UPD       | NEW        |       53
     2 | ABC        | \014  | UPD       | OLD        |       54
     2 | ABC        | \034  | UPD       | NEW        |       54
     3 | ABC        | \014  | UPD       | OLD        |       55
     3 | ABC        | \034  | UPD       | NEW        |       55
    11 | ABC        | \014  | DEL       | OLD        |       58
(18 rows)

select col21, col22, emaj_verb, emaj_tuple, emaj_gid from emaj.myschema1_myTbl2_log order by emaj_gid, emaj_tuple desc;
 col21 | col22 | emaj_verb | emaj_tuple | emaj_gid 
-------+-------+-----------+------------+----------
     1 | ABC   | INS       | NEW        |       56
     2 | DEF   | INS       | NEW        |       59
(2 rows)

select col20, col21, emaj_verb, emaj_tuple, emaj_gid from emajb.myschema1_myTbl2b_log order by emaj_gid, emaj_tuple desc;
 col20 | col21 | emaj_verb | emaj_tuple | emaj_gid 
-------+-------+-----------+------------+----------
     7 |     1 | INS       | NEW        |       57
     8 |     2 | INS       | NEW        |       60
(2 rows)

select col11, col12, col13 from myschema1.myTbl1 order by col11, col12;
 col11 |   col12    | col13 
-------+------------+-------
     1 | ABC        | \034
     2 | ABC        | \034
     3 | ABC        | \034
     4 | ABC        | \014
     5 | ABC        | \014
     6 | ABC        | \014
     7 | ABC        | \014
     8 | ABC        | \014
     9 | ABC        | \014
    10 | ABC        | \014
(10 rows)

select col21, col22 from myschema1.myTbl2 order by col21;
 col21 | col22 
-------+-------
     1 | ABC
     2 | DEF
(2 rows)

select col20, col21 from myschema1.myTbl2b order by col20;
 col20 | col21 
-------+-------
     7 |     1
     8 |     2
(2 rows)

-----------------------------
-- test use of partitionned tables
-----------------------------
select emaj.emaj_start_group('myGroup4','myGroup4_start');
 emaj_start_group 
------------------
                3
(1 row)

insert into myschema4.myTblM values ('2001-09-11',0,'abc'),('2011-09-11',10,'def'),('2021-09-11',20,'ghi');
select emaj.emaj_set_mark_group('myGroup4','mark1');
 emaj_set_mark_group 
---------------------
                   3
(1 row)

delete from myschema4.myTblM;
select emaj.emaj_logged_rollback_group('myGroup4','mark1');
 emaj_logged_rollback_group 
----------------------------
                          3
(1 row)

select col1, col2, col3, emaj_verb, emaj_tuple, emaj_gid from emaj.myschema4_mytblm_log;
    col1    | col2 | col3 | emaj_verb | emaj_tuple | emaj_gid 
------------+------+------+-----------+------------+----------
 09-11-2021 |   20 | ghi  | INS       | NEW        |       99
 09-11-2021 |   20 | ghi  | DEL       | OLD        |      100
 09-11-2021 |   20 | ghi  | INS       | NEW        |      105
(3 rows)

select col1, col2, col3, emaj_verb, emaj_tuple, emaj_gid from emaj.myschema4_mytblc1_log;
    col1    | col2 | col3 | emaj_verb | emaj_tuple | emaj_gid 
------------+------+------+-----------+------------+----------
 09-11-2001 |    0 | abc  | INS       | NEW        |       97
 09-11-2001 |    0 | abc  | DEL       | OLD        |      101
 09-11-2001 |    0 | abc  | INS       | NEW        |      103
(3 rows)

select col1, col2, col3, emaj_verb, emaj_tuple, emaj_gid from emaj.myschema4_mytblc2_log;
    col1    | col2 | col3 | emaj_verb | emaj_tuple | emaj_gid 
------------+------+------+-----------+------------+----------
 09-11-2011 |   10 | def  | INS       | NEW        |       98
 09-11-2011 |   10 | def  | DEL       | OLD        |      102
 09-11-2011 |   10 | def  | INS       | NEW        |      104
(3 rows)

-- use the functions dedicated to the ppa plugin
-- for an equivalent of "select emaj.emaj_rollback_group('myGroup4','myGroup4_start');"
select emaj._rlbk_async(emaj._rlbk_init(array['myGroup4'], 'myGroup4_start', false, 1, false), false);
 _rlbk_async 
-------------
           3
(1 row)

-- and check the result
select rlbk_id, rlbk_groups, rlbk_mark, rlbk_is_logged, rlbk_nb_session, rlbk_nb_table, rlbk_nb_sequence, 
       rlbk_eff_nb_table, rlbk_status, rlbk_msg
 from emaj.emaj_rlbk order by rlbk_id desc limit 1; 
 rlbk_id | rlbk_groups |   rlbk_mark    | rlbk_is_logged | rlbk_nb_session | rlbk_nb_table | rlbk_nb_sequence | rlbk_eff_nb_table | rlbk_status |                         rlbk_msg                          
---------+-------------+----------------+----------------+-----------------+---------------+------------------+-------------------+-------------+-----------------------------------------------------------
      15 | {myGroup4}  | myGroup4_start | f              |               1 |             3 |                0 |                 3 | COMPLETED   | Completed: 3 tables and 0 sequences effectively processed
(1 row)

-----------------------------
-- test emaj_cleanup_rollback_state()
-----------------------------
-- rollback a transaction with an E-Maj rollback to generate an ABORTED rollback event
begin;
  select emaj.emaj_rollback_group('myGroup4','myGroup4_start');
 emaj_rollback_group 
---------------------
                   0
(1 row)

rollback;
select emaj.emaj_cleanup_rollback_state();
 emaj_cleanup_rollback_state 
-----------------------------
                           3
(1 row)

-----------------------------
-- test emaj_rollback_activity()
-----------------------------
-- insert necessary rows into rollback tables in order to test various cases of emaj_rollback_activity() reports.
-- these tests ares performed inside transactions that are then rolled back.
begin;
-- 1 rollback operation in EXECUTING state, but no rollback steps have started yet
  insert into emaj.emaj_rlbk (rlbk_id, rlbk_groups, rlbk_mark, rlbk_mark_datetime, rlbk_is_logged, rlbk_nb_session, 
             rlbk_nb_table, rlbk_nb_sequence, rlbk_eff_nb_table, rlbk_status, rlbk_start_datetime)
    values (1232,array['group1232'],'mark1232','2000-01-01 01:00:00',true,1,
             5,4,3,'EXECUTING',now()-'0.1 seconds'::interval);
  insert into emaj.emaj_rlbk_plan (rlbp_rlbk_id, rlbp_step, rlbp_schema, rlbp_table, rlbp_fkey,
             rlbp_estimated_duration, rlbp_estimated_quantity, rlbp_start_datetime, rlbp_duration)
    values (1232, 'RLBK_TABLE','schema','t1','','50 seconds'::interval,null,null,null),
           (1232, 'RLBK_TABLE','schema','t2','','30 seconds'::interval,null,null,null),
           (1232, 'RLBK_TABLE','schema','t3','','20 seconds'::interval,null,null,null),
           (1232, 'CTRL+DBLINK','',     '',  '','0.3 second'::interval,3,   null,null);
  select rlbk_id, rlbk_status, rlbk_remaining, rlbk_completion_pct from emaj._rollback_activity();
 rlbk_id | rlbk_status |  rlbk_remaining   | rlbk_completion_pct 
---------+-------------+-------------------+---------------------
    1232 | EXECUTING   | @ 1 min 40.3 secs |                   0
(1 row)

-- the first RLBK_TABLE has started, but the elapse of the step is not yet > estimated duration 
  update emaj.emaj_rlbk set rlbk_start_datetime = now() - '11.1 seconds'::interval where rlbk_id = 1232;
  update emaj.emaj_rlbk_plan set rlbp_start_datetime = now() - '11 seconds'::interval
    where rlbp_rlbk_id = 1232 and rlbp_table = 't1';
  select rlbk_id, rlbk_status, rlbk_remaining, rlbk_completion_pct from emaj._rollback_activity();
 rlbk_id | rlbk_status |  rlbk_remaining   | rlbk_completion_pct 
---------+-------------+-------------------+---------------------
    1232 | EXECUTING   | @ 1 min 29.2 secs |                  11
(1 row)

  select 1.0 - ((20.0 + 30.0)+(50.0 - 11.0) + 2*0.3/3) / (11.1 + (20.0 + 30.0)+(50.0 - 11.0) + 2*0.3/3); -- the completion % should be 11%
        ?column?        
------------------------
 0.11066799601196410768
(1 row)

-- the first RLBK_TABLE is completed, and the step duration < the estimated duration 
  update emaj.emaj_rlbk set rlbk_start_datetime = now() - '45.1 seconds'::interval where rlbk_id = 1232;
  update emaj.emaj_rlbk_plan set rlbp_start_datetime = now() - '45 seconds'::interval,
                                 rlbp_duration = '45 seconds'::interval
    where rlbp_rlbk_id = 1232 and rlbp_table = 't1';
  select rlbk_id, rlbk_status, rlbk_remaining, rlbk_completion_pct from emaj._rollback_activity();
 rlbk_id | rlbk_status | rlbk_remaining | rlbk_completion_pct 
---------+-------------+----------------+---------------------
    1232 | EXECUTING   | @ 50.2 secs    |                  47
(1 row)

  select 1.0 - (20.0 + 30.0 + 2*0.3/3) / (45.1 + (20.0 + 30.0) + 2*0.3/3);  -- the completion % should be 47%
        ?column?        
------------------------
 0.47324239244491080797
(1 row)

-- the second RLBK_TABLE has started, but the elapse of the step is not yet > estimated duration 
  update emaj.emaj_rlbk set rlbk_start_datetime = now() - '73.1 seconds'::interval where rlbk_id = 1232;
  update emaj.emaj_rlbk_plan set rlbp_start_datetime = now() - '28 seconds'::interval
    where rlbp_rlbk_id = 1232 and rlbp_table = 't2';
  select rlbk_id, rlbk_status, rlbk_remaining, rlbk_completion_pct from emaj._rollback_activity();
 rlbk_id | rlbk_status | rlbk_remaining | rlbk_completion_pct 
---------+-------------+----------------+---------------------
    1232 | EXECUTING   | @ 22.1 secs    |                  77
(1 row)

  select 1.0 - (20.0 + (30.0 - 28.0) + 1*0.3/3) / (73.1 + (20.0 + (30.0 - 28.0) + 1*0.3/3));  -- the completion % should be 77%
        ?column?        
------------------------
 0.76785714285714285714
(1 row)

-- the second RLBK_TABLE has started, but the elapse of the step is already > estimated duration 
  update emaj.emaj_rlbk set rlbk_start_datetime = now() - '85.1 seconds'::interval where rlbk_id = 1232;
  update emaj.emaj_rlbk_plan set rlbp_start_datetime = now() - '40 seconds'::interval
    where rlbp_rlbk_id = 1232 and rlbp_table = 't2';
  select rlbk_id, rlbk_status, rlbk_remaining, rlbk_completion_pct from emaj._rollback_activity();
 rlbk_id | rlbk_status | rlbk_remaining | rlbk_completion_pct 
---------+-------------+----------------+---------------------
    1232 | EXECUTING   | @ 20.1 secs    |                  81
(1 row)

  select 1.0 - (20.0 + 1*0.3/3) / (85.1 + (20.0 + 1*0.3/3));  -- the completion % should be 81%
        ?column?        
------------------------
 0.80893536121673003802
(1 row)

-- the second RLBK_TABLE has started, but the elapse of the step is already > estimated duration 
  update emaj.emaj_rlbk set rlbk_start_datetime = now() - '105.1 seconds'::interval where rlbk_id = 1232;
  update emaj.emaj_rlbk_plan set rlbp_start_datetime = now() - '60 seconds'::interval
    where rlbp_rlbk_id = 1232 and rlbp_table = 't2';
  select rlbk_id, rlbk_status, rlbk_remaining, rlbk_completion_pct from emaj._rollback_activity();
 rlbk_id | rlbk_status | rlbk_remaining | rlbk_completion_pct 
---------+-------------+----------------+---------------------
    1232 | EXECUTING   | @ 20.1 secs    |                  84
(1 row)

  select 1.0 - (20.0 + 1*0.3/3) / (105.1 + (20.0 + 1*0.3/3 ));  -- the completion % should be 84%
        ?column?        
------------------------
 0.83945686900958466454
(1 row)

-- the second RLBK_TABLE is completed, and the step duration > the estimated duration 
  update emaj.emaj_rlbk set rlbk_start_datetime = now() - '110.1 seconds'::interval where rlbk_id = 1232;
  update emaj.emaj_rlbk_plan set rlbp_start_datetime = now() - '65 seconds'::interval,
                                 rlbp_duration = '65 seconds'::interval
    where rlbp_rlbk_id = 1232 and rlbp_table = 't2';
  select rlbk_id, rlbk_status, rlbk_remaining, rlbk_completion_pct from emaj._rollback_activity();
 rlbk_id | rlbk_status | rlbk_remaining | rlbk_completion_pct 
---------+-------------+----------------+---------------------
    1232 | EXECUTING   | @ 20.1 secs    |                  85
(1 row)

  select 1.0 - (20.0 + 1*0.3/3) / (110.1 + (20.0 + 1*0.3/3));  -- the completion % should be 85%
        ?column?        
------------------------
 0.84562211981566820276
(1 row)

-- the third RLBK_TABLE has started, and is almost completed 
  update emaj.emaj_rlbk set rlbk_start_datetime = now() - '124.1 seconds'::interval where rlbk_id = 1232;
  update emaj.emaj_rlbk_plan set rlbp_start_datetime = now() - '19 seconds'::interval
    where rlbp_rlbk_id = 1232 and rlbp_table = 't3';
  select rlbk_id, rlbk_status, rlbk_remaining, rlbk_completion_pct from emaj._rollback_activity();
 rlbk_id | rlbk_status | rlbk_remaining | rlbk_completion_pct 
---------+-------------+----------------+---------------------
    1232 | EXECUTING   | @ 1 sec        |                  99
(1 row)

  select 1.0 - ((20.0 - 19.0)) / (124.1 + (20.0 - 19.0));  -- the completion % should be 99%
        ?column?        
------------------------
 0.99200639488409272582
(1 row)

rollback;
begin;
-- 1 rollback operation in LOCKING state and without step other than LOCK_TABLE
  insert into emaj.emaj_rlbk (rlbk_id, rlbk_groups, rlbk_mark, rlbk_mark_datetime, rlbk_is_logged, rlbk_nb_session, 
             rlbk_nb_table, rlbk_nb_sequence, rlbk_eff_nb_table, rlbk_status, rlbk_start_datetime)
    values (1233,array['group1233'],'mark1233','2000-01-01 01:00:00',true,1,
             5,4,3,'LOCKING',now()-'2 minutes'::interval);
  insert into emaj.emaj_rlbk_plan (rlbp_rlbk_id, rlbp_step, rlbp_schema, rlbp_table, rlbp_fkey,
             rlbp_estimated_duration, rlbp_start_datetime, rlbp_duration)
    values (1233, 'LOCK_TABLE','schema','t1','',null,null,null),
           (1233, 'LOCK_TABLE','schema','t2','',null,null,null),
           (1233, 'LOCK_TABLE','schema','t3','',null,null,null);
  select rlbk_id, rlbk_status, rlbk_elapse, rlbk_remaining, rlbk_completion_pct from emaj._rollback_activity();
 rlbk_id | rlbk_status | rlbk_elapse | rlbk_remaining | rlbk_completion_pct 
---------+-------------+-------------+----------------+---------------------
    1233 | LOCKING     | @ 2 mins    | @ 0            |                   0
(1 row)

-- the rollback operation in LOCKING state now has RLBK_TABLE steps
  insert into emaj.emaj_rlbk_plan (rlbp_rlbk_id, rlbp_step, rlbp_schema, rlbp_table, rlbp_fkey,
             rlbp_estimated_duration, rlbp_start_datetime, rlbp_duration)
    values (1233, 'RLBK_TABLE','schema','t1','','0:20:00'::interval,null,null),
           (1233, 'RLBK_TABLE','schema','t2','','0:02:00'::interval,null,null),
           (1233, 'RLBK_TABLE','schema','t3','','0:00:20'::interval,null,null);
  select rlbk_id, rlbk_status, rlbk_elapse, rlbk_remaining, rlbk_completion_pct from emaj._rollback_activity();
 rlbk_id | rlbk_status | rlbk_elapse |  rlbk_remaining   | rlbk_completion_pct 
---------+-------------+-------------+-------------------+---------------------
    1233 | LOCKING     | @ 2 mins    | @ 22 mins 20 secs |                   0
(1 row)

-- +1 rollback operation in PLANNING state
  insert into emaj.emaj_rlbk (rlbk_id, rlbk_groups, rlbk_mark, rlbk_mark_datetime, rlbk_is_logged, rlbk_nb_session, 
             rlbk_nb_table, rlbk_nb_sequence, rlbk_eff_nb_table, rlbk_status, rlbk_start_datetime)
    values (1234,array['group1234'],'mark1234','2000-01-01 01:00:00',true,1,
             5,4,3,'PLANNING',now()-'1 minute'::interval);
  select rlbk_id, rlbk_groups, rlbk_mark, rlbk_mark_datetime, rlbk_is_logged, rlbk_nb_session, rlbk_nb_table,
         rlbk_nb_sequence, rlbk_eff_nb_table, rlbk_status, rlbk_elapse, rlbk_remaining, rlbk_completion_pct 
    from emaj._rollback_activity();
 rlbk_id | rlbk_groups | rlbk_mark |      rlbk_mark_datetime      | rlbk_is_logged | rlbk_nb_session | rlbk_nb_table | rlbk_nb_sequence | rlbk_eff_nb_table | rlbk_status | rlbk_elapse |  rlbk_remaining   | rlbk_completion_pct 
---------+-------------+-----------+------------------------------+----------------+-----------------+---------------+------------------+-------------------+-------------+-------------+-------------------+---------------------
    1233 | {group1233} | mark1233  | Sat Jan 01 01:00:00 2000 PST | t              |               1 |             5 |                4 |                 3 | LOCKING     | @ 2 mins    | @ 22 mins 20 secs |                   0
    1234 | {group1234} | mark1234  | Sat Jan 01 01:00:00 2000 PST | t              |               1 |             5 |                4 |                 3 | PLANNING    | @ 1 min     |                   |                   0
(2 rows)

rollback;
-----------------------------
-- test end: check rollback tables, reset history and force sequences id
-----------------------------
select rlbk_id, rlbk_groups, rlbk_mark, rlbk_is_logged, rlbk_nb_session, rlbk_nb_table, rlbk_nb_sequence, 
       rlbk_eff_nb_table, rlbk_status, rlbk_begin_hist_id, rlbk_is_dblink_used,
       case when rlbk_end_datetime is null then 'null' else '[ts]' end as "end_datetime", rlbk_msg
  from emaj.emaj_rlbk order by rlbk_id;
 rlbk_id |     rlbk_groups     |   rlbk_mark    | rlbk_is_logged | rlbk_nb_session | rlbk_nb_table | rlbk_nb_sequence | rlbk_eff_nb_table | rlbk_status | rlbk_begin_hist_id | rlbk_is_dblink_used | end_datetime |                         rlbk_msg                          
---------+---------------------+----------------+----------------+-----------------+---------------+------------------+-------------------+-------------+--------------------+---------------------+--------------+-----------------------------------------------------------
       1 | {myGroup1}          | Different_Mark | f              |               1 |             5 |                1 |                 0 | COMMITTED   |               4046 | f                   | [ts]         | Completed: 0 tables and 1 sequences effectively processed
       2 | {myGroup2}          | Mark21         | f              |               1 |             6 |                2 |                 0 | COMMITTED   |               4052 | f                   | [ts]         | Completed: 0 tables and 2 sequences effectively processed
       3 | {myGroup1}          | Different_Mark | t              |               1 |             5 |                1 |                 0 | COMMITTED   |               4060 | f                   | [ts]         | Completed: 0 tables and 1 sequences effectively processed
       4 | {myGroup2}          | Mark21         | t              |               1 |             6 |                2 |                 0 | COMMITTED   |               4070 | f                   | [ts]         | Completed: 0 tables and 2 sequences effectively processed
       5 | {myGroup1,myGroup2} | Mark1B         | f              |               1 |            11 |                3 |                 0 | COMMITTED   |               4085 | f                   | [ts]         | Completed: 0 tables and 3 sequences effectively processed
       6 | {myGroup1,myGroup2} | Mark1B         | f              |               1 |            11 |                3 |                 0 | COMMITTED   |               4093 | f                   | [ts]         | Completed: 0 tables and 3 sequences effectively processed
       7 | {myGroup1,myGroup2} | Mark1B         | t              |               1 |            11 |                3 |                 0 | COMMITTED   |               4101 | f                   | [ts]         | Completed: 0 tables and 3 sequences effectively processed
       8 | {myGroup1,myGroup2} | Mark1B         | t              |               1 |            11 |                3 |                 0 | COMMITTED   |               4113 | t                   | [ts]         | Completed: 0 tables and 3 sequences effectively processed
       9 | {myGroup1}          | Mark12         | f              |               1 |             5 |                1 |                 2 | COMMITTED   |               4153 | t                   | [ts]         | Completed: 2 tables and 1 sequences effectively processed
      10 | {myGroup1}          | Mark11         | f              |               1 |             5 |                1 |                 3 | COMMITTED   |               4165 | t                   | [ts]         | Completed: 3 tables and 1 sequences effectively processed
      11 | {myGroup1}          | Mark12         | t              |               1 |             5 |                1 |                 2 | COMMITTED   |               4201 | t                   | [ts]         | Completed: 2 tables and 1 sequences effectively processed
      12 | {myGroup1}          | Mark11         | t              |               1 |             5 |                1 |                 5 | COMMITTED   |               4216 | t                   | [ts]         | Completed: 5 tables and 1 sequences effectively processed
      13 | {myGroup1}          | Mark13         | f              |               1 |             5 |                1 |                 5 | COMMITTED   |               4238 | t                   | [ts]         | Completed: 5 tables and 1 sequences effectively processed
      14 | {myGroup4}          | mark1          | t              |               1 |             3 |                0 |                 3 | COMMITTED   |               4271 | t                   | [ts]         | Completed: 3 tables and 0 sequences effectively processed
      15 | {myGroup4}          | myGroup4_start | f              |               1 |             3 |                0 |                 3 | COMMITTED   |               4287 | t                   | [ts]         | Completed: 3 tables and 0 sequences effectively processed
      16 | {myGroup4}          | myGroup4_start | f              |               1 |             3 |                0 |                 0 | ABORTED     |               4302 | t                   | [ts]         | Completed: 0 tables and 0 sequences effectively processed
(16 rows)

select rlbs_rlbk_id, rlbs_session, 
       case when rlbs_end_datetime is null then 'null' else '[ts]' end as "end_datetime"
  from emaj.emaj_rlbk_session order by rlbs_rlbk_id, rlbs_session;
 rlbs_rlbk_id | rlbs_session | end_datetime 
--------------+--------------+--------------
            1 |            1 | [ts]
            2 |            1 | [ts]
            3 |            1 | [ts]
            4 |            1 | [ts]
            5 |            1 | [ts]
            6 |            1 | [ts]
            7 |            1 | [ts]
            8 |            1 | [ts]
            9 |            1 | [ts]
           10 |            1 | [ts]
           11 |            1 | [ts]
           12 |            1 | [ts]
           13 |            1 | [ts]
           14 |            1 | [ts]
           15 |            1 | [ts]
           16 |            1 | [ts]
(16 rows)

select rlbp_rlbk_id, rlbp_step, rlbp_schema, rlbp_table, rlbp_fkey, rlbp_batch_number, rlbp_session,
       rlbp_fkey_def, rlbp_estimated_quantity, rlbp_estimate_method, rlbp_quantity
  from emaj.emaj_rlbk_plan order by rlbp_rlbk_id, rlbp_step, rlbp_schema, rlbp_table, rlbp_fkey;
 rlbp_rlbk_id |  rlbp_step  | rlbp_schema | rlbp_table |     rlbp_fkey     | rlbp_batch_number | rlbp_session |                                                              rlbp_fkey_def                                                              | rlbp_estimated_quantity | rlbp_estimate_method | rlbp_quantity 
--------------+-------------+-------------+------------+-------------------+-------------------+--------------+-----------------------------------------------------------------------------------------------------------------------------------------+-------------------------+----------------------+---------------
            9 | DIS_LOG_TRG | myschema1   | myTbl3     |                   |                 1 |            1 |                                                                                                                                         |                         |                    3 |              
            9 | DIS_LOG_TRG | myschema1   | mytbl4     |                   |                 2 |            1 |                                                                                                                                         |                         |                    3 |              
            9 | DROP_FK     | myschema1   | mytbl4     | mytbl4_col44_fkey |                 2 |            1 |                                                                                                                                         |                         |                    3 |              
            9 | SET_FK_DEF  | myschema1   | mytbl4     | mytbl4_col43_fkey |                 2 |            1 |                                                                                                                                         |                         |                    3 |              
            9 | RLBK_TABLE  | myschema1   | myTbl3     |                   |                 1 |            1 |                                                                                                                                         |                      10 |                    3 |            10
            9 | RLBK_TABLE  | myschema1   | mytbl4     |                   |                 2 |            1 |                                                                                                                                         |                       2 |                    3 |             1
            9 | DELETE_LOG  | myschema1   | myTbl3     |                   |                 1 |            1 |                                                                                                                                         |                      10 |                    3 |            10
            9 | DELETE_LOG  | myschema1   | mytbl4     |                   |                 2 |            1 |                                                                                                                                         |                       2 |                    3 |             3
            9 | SET_FK_IMM  | myschema1   | mytbl4     | mytbl4_col43_fkey |                 2 |            1 |                                                                                                                                         |                       2 |                    3 |              
            9 | ADD_FK      | myschema1   | mytbl4     | mytbl4_col44_fkey |                 2 |            1 | FOREIGN KEY (col44, col45) REFERENCES myschema1.mytbl1(col11, col12) ON UPDATE SET NULL ON DELETE CASCADE DEFERRABLE INITIALLY DEFERRED |                       0 |                    3 |              
            9 | ENA_LOG_TRG | myschema1   | myTbl3     |                   |                 1 |            1 |                                                                                                                                         |                         |                    3 |              
            9 | ENA_LOG_TRG | myschema1   | mytbl4     |                   |                 2 |            1 |                                                                                                                                         |                         |                    3 |              
            9 | CTRL+DBLINK |             |            |                   |                   |              |                                                                                                                                         |                      12 |                    3 |              
           10 | DIS_LOG_TRG | myschema1   | mytbl1     |                   |                 1 |            1 |                                                                                                                                         |                         |                    2 |              
           10 | DIS_LOG_TRG | myschema1   | mytbl2     |                   |                 1 |            1 |                                                                                                                                         |                         |                    2 |              
           10 | DIS_LOG_TRG | myschema1   | mytbl2b    |                   |                 2 |            1 |                                                                                                                                         |                         |                    2 |              
           10 | DROP_FK     | myschema1   | mytbl4     | mytbl4_col44_fkey |                 1 |            1 |                                                                                                                                         |                         |                    2 |              
           10 | SET_FK_DEF  | myschema1   | mytbl4     | mytbl4_col43_fkey |                 1 |            1 |                                                                                                                                         |                         |                    2 |              
           10 | RLBK_TABLE  | myschema1   | mytbl1     |                   |                 1 |            1 |                                                                                                                                         |                      15 |                    3 |            11
           10 | RLBK_TABLE  | myschema1   | mytbl2     |                   |                 1 |            1 |                                                                                                                                         |                       6 |                    3 |             3
           10 | RLBK_TABLE  | myschema1   | mytbl2b    |                   |                 2 |            1 |                                                                                                                                         |                       6 |                    3 |             6
           10 | DELETE_LOG  | myschema1   | mytbl1     |                   |                 1 |            1 |                                                                                                                                         |                      15 |                    3 |            18
           10 | DELETE_LOG  | myschema1   | mytbl2     |                   |                 1 |            1 |                                                                                                                                         |                       6 |                    3 |             8
           10 | DELETE_LOG  | myschema1   | mytbl2b    |                   |                 2 |            1 |                                                                                                                                         |                       6 |                    3 |             6
           10 | SET_FK_IMM  | myschema1   | mytbl4     | mytbl4_col43_fkey |                 1 |            1 |                                                                                                                                         |                       6 |                    2 |              
           10 | ADD_FK      | myschema1   | mytbl4     | mytbl4_col44_fkey |                 1 |            1 | FOREIGN KEY (col44, col45) REFERENCES myschema1.mytbl1(col11, col12) ON UPDATE SET NULL ON DELETE CASCADE DEFERRABLE INITIALLY DEFERRED |                       0 |                    3 |              
           10 | ENA_LOG_TRG | myschema1   | mytbl1     |                   |                 1 |            1 |                                                                                                                                         |                         |                    2 |              
           10 | ENA_LOG_TRG | myschema1   | mytbl2     |                   |                 1 |            1 |                                                                                                                                         |                         |                    2 |              
           10 | ENA_LOG_TRG | myschema1   | mytbl2b    |                   |                 2 |            1 |                                                                                                                                         |                         |                    2 |              
           10 | CTRL+DBLINK |             |            |                   |                   |              |                                                                                                                                         |                      16 |                    2 |              
           11 | DROP_FK     | myschema1   | mytbl4     | mytbl4_col44_fkey |                 2 |            1 |                                                                                                                                         |                         |                    2 |              
           11 | SET_FK_DEF  | myschema1   | mytbl4     | mytbl4_col43_fkey |                 2 |            1 |                                                                                                                                         |                         |                    2 |              
           11 | RLBK_TABLE  | myschema1   | myTbl3     |                   |                 1 |            1 |                                                                                                                                         |                      10 |                    1 |            10
           11 | RLBK_TABLE  | myschema1   | mytbl4     |                   |                 2 |            1 |                                                                                                                                         |                       1 |                    1 |             1
           11 | SET_FK_IMM  | myschema1   | mytbl4     | mytbl4_col43_fkey |                 2 |            1 |                                                                                                                                         |                       1 |                    2 |              
           11 | ADD_FK      | myschema1   | mytbl4     | mytbl4_col44_fkey |                 2 |            1 | FOREIGN KEY (col44, col45) REFERENCES myschema1.mytbl1(col11, col12) ON UPDATE SET NULL ON DELETE CASCADE DEFERRABLE INITIALLY DEFERRED |                       0 |                    3 |              
           11 | CTRL+DBLINK |             |            |                   |                   |              |                                                                                                                                         |                       6 |                    2 |              
           12 | DROP_FK     | myschema1   | mytbl4     | mytbl4_col44_fkey |                 2 |            1 |                                                                                                                                         |                         |                    2 |              
           12 | SET_FK_DEF  | myschema1   | mytbl4     | mytbl4_col43_fkey |                 2 |            1 |                                                                                                                                         |                         |                    2 |              
           12 | RLBK_TABLE  | myschema1   | mytbl1     |                   |                 2 |            1 |                                                                                                                                         |                      15 |                    1 |            11
           12 | RLBK_TABLE  | myschema1   | mytbl2     |                   |                 2 |            1 |                                                                                                                                         |                       2 |                    1 |             2
           12 | RLBK_TABLE  | myschema1   | mytbl2b    |                   |                 3 |            1 |                                                                                                                                         |                       2 |                    1 |             2
           12 | RLBK_TABLE  | myschema1   | myTbl3     |                   |                 1 |            1 |                                                                                                                                         |                      20 |                    1 |            10
           12 | RLBK_TABLE  | myschema1   | mytbl4     |                   |                 2 |            1 |                                                                                                                                         |                       2 |                    1 |             1
           12 | SET_FK_IMM  | myschema1   | mytbl4     | mytbl4_col43_fkey |                 2 |            1 |                                                                                                                                         |                       4 |                    2 |              
           12 | ADD_FK      | myschema1   | mytbl4     | mytbl4_col44_fkey |                 2 |            1 | FOREIGN KEY (col44, col45) REFERENCES myschema1.mytbl1(col11, col12) ON UPDATE SET NULL ON DELETE CASCADE DEFERRABLE INITIALLY DEFERRED |                       0 |                    3 |              
           12 | CTRL+DBLINK |             |            |                   |                   |              |                                                                                                                                         |                       9 |                    2 |              
           13 | DIS_LOG_TRG | myschema1   | mytbl1     |                   |                 1 |            1 |                                                                                                                                         |                         |                    2 |              
           13 | DIS_LOG_TRG | myschema1   | mytbl2     |                   |                 1 |            1 |                                                                                                                                         |                         |                    2 |              
           13 | DIS_LOG_TRG | myschema1   | mytbl2b    |                   |                 3 |            1 |                                                                                                                                         |                         |                    2 |              
           13 | DIS_LOG_TRG | myschema1   | myTbl3     |                   |                 2 |            1 |                                                                                                                                         |                         |                    2 |              
           13 | DIS_LOG_TRG | myschema1   | mytbl4     |                   |                 1 |            1 |                                                                                                                                         |                         |                    2 |              
           13 | DROP_FK     | myschema1   | mytbl4     | mytbl4_col44_fkey |                 1 |            1 |                                                                                                                                         |                         |                    2 |              
           13 | SET_FK_DEF  | myschema1   | mytbl4     | mytbl4_col43_fkey |                 1 |            1 |                                                                                                                                         |                         |                    2 |              
           13 | RLBK_TABLE  | myschema1   | mytbl1     |                   |                 1 |            1 |                                                                                                                                         |                      10 |                    1 |            10
           13 | RLBK_TABLE  | myschema1   | mytbl2     |                   |                 1 |            1 |                                                                                                                                         |                       2 |                    1 |             2
           13 | RLBK_TABLE  | myschema1   | mytbl2b    |                   |                 3 |            1 |                                                                                                                                         |                       2 |                    1 |             2
           13 | RLBK_TABLE  | myschema1   | myTbl3     |                   |                 2 |            1 |                                                                                                                                         |                      10 |                    1 |            10
           13 | RLBK_TABLE  | myschema1   | mytbl4     |                   |                 1 |            1 |                                                                                                                                         |                       1 |                    1 |             1
           13 | DELETE_LOG  | myschema1   | mytbl1     |                   |                 1 |            1 |                                                                                                                                         |                      10 |                    1 |            10
           13 | DELETE_LOG  | myschema1   | mytbl2     |                   |                 1 |            1 |                                                                                                                                         |                       2 |                    1 |             2
           13 | DELETE_LOG  | myschema1   | mytbl2b    |                   |                 3 |            1 |                                                                                                                                         |                       2 |                    1 |             2
           13 | DELETE_LOG  | myschema1   | myTbl3     |                   |                 2 |            1 |                                                                                                                                         |                      10 |                    1 |            10
           13 | DELETE_LOG  | myschema1   | mytbl4     |                   |                 1 |            1 |                                                                                                                                         |                       1 |                    1 |             1
           13 | SET_FK_IMM  | myschema1   | mytbl4     | mytbl4_col43_fkey |                 1 |            1 |                                                                                                                                         |                       3 |                    2 |              
           13 | ADD_FK      | myschema1   | mytbl4     | mytbl4_col44_fkey |                 1 |            1 | FOREIGN KEY (col44, col45) REFERENCES myschema1.mytbl1(col11, col12) ON UPDATE SET NULL ON DELETE CASCADE DEFERRABLE INITIALLY DEFERRED |                       0 |                    3 |              
           13 | ENA_LOG_TRG | myschema1   | mytbl1     |                   |                 1 |            1 |                                                                                                                                         |                         |                    2 |              
           13 | ENA_LOG_TRG | myschema1   | mytbl2     |                   |                 1 |            1 |                                                                                                                                         |                         |                    2 |              
           13 | ENA_LOG_TRG | myschema1   | mytbl2b    |                   |                 3 |            1 |                                                                                                                                         |                         |                    2 |              
           13 | ENA_LOG_TRG | myschema1   | myTbl3     |                   |                 2 |            1 |                                                                                                                                         |                         |                    2 |              
           13 | ENA_LOG_TRG | myschema1   | mytbl4     |                   |                 1 |            1 |                                                                                                                                         |                         |                    2 |              
           13 | CTRL+DBLINK |             |            |                   |                   |              |                                                                                                                                         |                      24 |                    2 |              
           14 | RLBK_TABLE  | myschema4   | mytblc1    |                   |                 1 |            1 |                                                                                                                                         |                       1 |                    3 |             1
           14 | RLBK_TABLE  | myschema4   | mytblc2    |                   |                 2 |            1 |                                                                                                                                         |                       1 |                    3 |             1
           14 | RLBK_TABLE  | myschema4   | mytblm     |                   |                 3 |            1 |                                                                                                                                         |                       1 |                    3 |             1
           14 | CTRL+DBLINK |             |            |                   |                   |              |                                                                                                                                         |                       3 |                    2 |              
           15 | DIS_LOG_TRG | myschema4   | mytblc1    |                   |                 1 |            1 |                                                                                                                                         |                         |                    2 |              
           15 | DIS_LOG_TRG | myschema4   | mytblc2    |                   |                 2 |            1 |                                                                                                                                         |                         |                    2 |              
           15 | DIS_LOG_TRG | myschema4   | mytblm     |                   |                 3 |            1 |                                                                                                                                         |                         |                    2 |              
           15 | RLBK_TABLE  | myschema4   | mytblc1    |                   |                 1 |            1 |                                                                                                                                         |                       3 |                    1 |             1
           15 | RLBK_TABLE  | myschema4   | mytblc2    |                   |                 2 |            1 |                                                                                                                                         |                       3 |                    1 |             1
           15 | RLBK_TABLE  | myschema4   | mytblm     |                   |                 3 |            1 |                                                                                                                                         |                       3 |                    1 |             1
           15 | DELETE_LOG  | myschema4   | mytblc1    |                   |                 1 |            1 |                                                                                                                                         |                       3 |                    3 |             3
           15 | DELETE_LOG  | myschema4   | mytblc2    |                   |                 2 |            1 |                                                                                                                                         |                       3 |                    3 |             3
           15 | DELETE_LOG  | myschema4   | mytblm     |                   |                 3 |            1 |                                                                                                                                         |                       3 |                    3 |             3
           15 | ENA_LOG_TRG | myschema4   | mytblc1    |                   |                 1 |            1 |                                                                                                                                         |                         |                    2 |              
           15 | ENA_LOG_TRG | myschema4   | mytblc2    |                   |                 2 |            1 |                                                                                                                                         |                         |                    2 |              
           15 | ENA_LOG_TRG | myschema4   | mytblm     |                   |                 3 |            1 |                                                                                                                                         |                         |                    2 |              
           15 | CTRL+DBLINK |             |            |                   |                   |              |                                                                                                                                         |                      12 |                    2 |              
(89 rows)

select rlbt_step, rlbt_schema, rlbt_table, rlbt_fkey, rlbt_rlbk_id, rlbt_quantity from emaj.emaj_rlbk_stat
  order by rlbt_rlbk_id, rlbt_step, rlbt_schema, rlbt_table, rlbt_fkey;
  rlbt_step  | rlbt_schema | rlbt_table |     rlbt_fkey     | rlbt_rlbk_id | rlbt_quantity 
-------------+-------------+------------+-------------------+--------------+---------------
 DIS_LOG_TRG |             |            |                   |            9 |             2
 DROP_FK     |             |            |                   |            9 |             1
 SET_FK_DEF  |             |            |                   |            9 |             1
 RLBK_TABLE  | myschema1   | myTbl3     |                   |            9 |            10
 RLBK_TABLE  | myschema1   | mytbl4     |                   |            9 |             2
 DELETE_LOG  | myschema1   | myTbl3     |                   |            9 |            10
 DELETE_LOG  | myschema1   | mytbl4     |                   |            9 |             2
 SET_FK_IMM  | myschema1   | mytbl4     | mytbl4_col43_fkey |            9 |             2
 ADD_FK      | myschema1   | mytbl4     | mytbl4_col44_fkey |            9 |             0
 ENA_LOG_TRG |             |            |                   |            9 |             2
 CTRL+DBLINK |             |            |                   |            9 |            12
 DIS_LOG_TRG |             |            |                   |           10 |             3
 DROP_FK     |             |            |                   |           10 |             1
 SET_FK_DEF  |             |            |                   |           10 |             1
 RLBK_TABLE  | myschema1   | mytbl1     |                   |           10 |            15
 RLBK_TABLE  | myschema1   | mytbl2     |                   |           10 |             6
 RLBK_TABLE  | myschema1   | mytbl2b    |                   |           10 |             6
 DELETE_LOG  | myschema1   | mytbl1     |                   |           10 |            15
 DELETE_LOG  | myschema1   | mytbl2     |                   |           10 |             6
 DELETE_LOG  | myschema1   | mytbl2b    |                   |           10 |             6
 SET_FK_IMM  | myschema1   | mytbl4     | mytbl4_col43_fkey |           10 |             6
 ADD_FK      | myschema1   | mytbl4     | mytbl4_col44_fkey |           10 |             0
 ENA_LOG_TRG |             |            |                   |           10 |             3
 CTRL+DBLINK |             |            |                   |           10 |            16
 DROP_FK     |             |            |                   |           11 |             1
 SET_FK_DEF  |             |            |                   |           11 |             1
 RLBK_TABLE  | myschema1   | myTbl3     |                   |           11 |            10
 RLBK_TABLE  | myschema1   | mytbl4     |                   |           11 |             1
 SET_FK_IMM  | myschema1   | mytbl4     | mytbl4_col43_fkey |           11 |             1
 ADD_FK      | myschema1   | mytbl4     | mytbl4_col44_fkey |           11 |             0
 CTRL+DBLINK |             |            |                   |           11 |             6
 DROP_FK     |             |            |                   |           12 |             1
 SET_FK_DEF  |             |            |                   |           12 |             1
 RLBK_TABLE  | myschema1   | mytbl1     |                   |           12 |            15
 RLBK_TABLE  | myschema1   | mytbl2     |                   |           12 |             2
 RLBK_TABLE  | myschema1   | mytbl2b    |                   |           12 |             2
 RLBK_TABLE  | myschema1   | myTbl3     |                   |           12 |            20
 RLBK_TABLE  | myschema1   | mytbl4     |                   |           12 |             2
 SET_FK_IMM  | myschema1   | mytbl4     | mytbl4_col43_fkey |           12 |             4
 ADD_FK      | myschema1   | mytbl4     | mytbl4_col44_fkey |           12 |             0
 CTRL+DBLINK |             |            |                   |           12 |             9
 DIS_LOG_TRG |             |            |                   |           13 |             5
 DROP_FK     |             |            |                   |           13 |             1
 SET_FK_DEF  |             |            |                   |           13 |             1
 RLBK_TABLE  | myschema1   | mytbl1     |                   |           13 |            10
 RLBK_TABLE  | myschema1   | mytbl2     |                   |           13 |             2
 RLBK_TABLE  | myschema1   | mytbl2b    |                   |           13 |             2
 RLBK_TABLE  | myschema1   | myTbl3     |                   |           13 |            10
 RLBK_TABLE  | myschema1   | mytbl4     |                   |           13 |             1
 DELETE_LOG  | myschema1   | mytbl1     |                   |           13 |            10
 DELETE_LOG  | myschema1   | mytbl2     |                   |           13 |             2
 DELETE_LOG  | myschema1   | mytbl2b    |                   |           13 |             2
 DELETE_LOG  | myschema1   | myTbl3     |                   |           13 |            10
 DELETE_LOG  | myschema1   | mytbl4     |                   |           13 |             1
 SET_FK_IMM  | myschema1   | mytbl4     | mytbl4_col43_fkey |           13 |             3
 ADD_FK      | myschema1   | mytbl4     | mytbl4_col44_fkey |           13 |             0
 ENA_LOG_TRG |             |            |                   |           13 |             5
 CTRL+DBLINK |             |            |                   |           13 |            24
 RLBK_TABLE  | myschema4   | mytblc1    |                   |           14 |             1
 RLBK_TABLE  | myschema4   | mytblc2    |                   |           14 |             1
 RLBK_TABLE  | myschema4   | mytblm     |                   |           14 |             1
 CTRL+DBLINK |             |            |                   |           14 |             3
 DIS_LOG_TRG |             |            |                   |           15 |             3
 RLBK_TABLE  | myschema4   | mytblc1    |                   |           15 |             3
 RLBK_TABLE  | myschema4   | mytblc2    |                   |           15 |             3
 RLBK_TABLE  | myschema4   | mytblm     |                   |           15 |             3
 DELETE_LOG  | myschema4   | mytblc1    |                   |           15 |             3
 DELETE_LOG  | myschema4   | mytblc2    |                   |           15 |             3
 DELETE_LOG  | myschema4   | mytblm     |                   |           15 |             3
 ENA_LOG_TRG |             |            |                   |           15 |             3
 CTRL+DBLINK |             |            |                   |           15 |            12
(71 rows)

select hist_id, hist_function, hist_event, hist_object, regexp_replace(regexp_replace(hist_wording,E'\\d\\d\.\\d\\d\\.\\d\\d\\.\\d\\d\\d','%','g'),E'\\[.+\\]','(timestamp)','g'), hist_user from 
  (select * from emaj.emaj_hist order by hist_id) as t;
 hist_id |   hist_function    |  hist_event  |         hist_object          |                         regexp_replace                         | hist_user 
---------+--------------------+--------------+------------------------------+----------------------------------------------------------------+-----------
    4012 | START_GROUP        | BEGIN        | myGroup1                     | With log reset                                                 | postgres
    4013 | LOCK_GROUP         | BEGIN        | myGroup1                     |                                                                | postgres
    4014 | LOCK_GROUP         | END          | myGroup1                     | 5 tables locked, 0 deadlock(s)                                 | postgres
    4015 | SET_MARK_GROUP     | BEGIN        | myGroup1                     | Mark11                                                         | postgres
    4016 | SET_MARK_GROUP     | END          | myGroup1                     | Mark11                                                         | postgres
    4017 | START_GROUP        | END          | myGroup1                     | 6 tables/sequences processed                                   | postgres
    4018 | START_GROUP        | BEGIN        | myGroup2                     | With log reset                                                 | postgres
    4019 | LOCK_GROUP         | BEGIN        | myGroup2                     |                                                                | postgres
    4020 | LOCK_GROUP         | END          | myGroup2                     | 6 tables locked, 0 deadlock(s)                                 | postgres
    4021 | SET_MARK_GROUP     | BEGIN        | myGroup2                     | Mark21                                                         | postgres
    4022 | SET_MARK_GROUP     | END          | myGroup2                     | Mark21                                                         | postgres
    4023 | START_GROUP        | END          | myGroup2                     | 8 tables/sequences processed                                   | postgres
    4024 | SET_MARK_GROUP     | BEGIN        | myGroup1                     |                                                                | postgres
    4025 | LOCK_GROUP         | BEGIN        | myGroup1                     |                                                                | postgres
    4026 | LOCK_GROUP         | END          | myGroup1                     | 5 tables locked, 0 deadlock(s)                                 | postgres
    4027 | SET_MARK_GROUP     | END          | myGroup1                     | Different_Mark                                                 | postgres
    4028 | SET_MARK_GROUP     | BEGIN        | myGroup2                     |                                                                | postgres
    4029 | LOCK_GROUP         | BEGIN        | myGroup2                     |                                                                | postgres
    4030 | LOCK_GROUP         | END          | myGroup2                     | 6 tables locked, 0 deadlock(s)                                 | postgres
    4031 | SET_MARK_GROUP     | END          | myGroup2                     | Different_Mark                                                 | postgres
    4046 | ROLLBACK_GROUP     | BEGIN        | myGroup1                     | Unlogged rollback to mark Different_Mark (timestamp)           | postgres
    4047 | DBLINK_OPEN_CNX    |              | rlbk#1                       | Status = -1                                                    | postgres
    4048 | LOCK_GROUP         | BEGIN        | myGroup1                     | Rollback session #1                                            | postgres
    4049 | LOCK_GROUP         | END          | myGroup1                     | Rollback session #1: 5 tables locked, 0 deadlock(s)            | postgres
    4050 | ROLLBACK_SEQUENCE  |              | myschema1."myTbl3_col31_seq" |                                                                | postgres
    4051 | ROLLBACK_GROUP     | END          | myGroup1                     | Rollback_id 1, 0 tables and 1 sequences effectively processed  | postgres
    4052 | ROLLBACK_GROUP     | BEGIN        | myGroup2                     | Unlogged rollback to mark Mark21 (timestamp)                   | postgres
    4053 | DBLINK_OPEN_CNX    |              | rlbk#1                       | Status = -1                                                    | postgres
    4054 | LOCK_GROUP         | BEGIN        | myGroup2                     | Rollback session #1                                            | postgres
    4055 | LOCK_GROUP         | END          | myGroup2                     | Rollback session #1: 6 tables locked, 0 deadlock(s)            | postgres
    4056 | ROLLBACK_GROUP     | MARK DELETED | myGroup2                     | mark Different_Mark is deleted                                 | postgres
    4057 | ROLLBACK_SEQUENCE  |              | myschema2.myseq1             |                                                                | postgres
    4058 | ROLLBACK_SEQUENCE  |              | myschema2."myTbl3_col31_seq" |                                                                | postgres
    4059 | ROLLBACK_GROUP     | END          | myGroup2                     | Rollback_id 2, 0 tables and 2 sequences effectively processed  | postgres
    4060 | ROLLBACK_GROUP     | BEGIN        | myGroup1                     | Logged rollback to mark Different_Mark (timestamp)             | postgres
    4061 | DBLINK_OPEN_CNX    |              | rlbk#1                       | Status = -2                                                    | postgres
    4062 | LOCK_GROUP         | BEGIN        | myGroup1                     | Rollback session #1                                            | postgres
    4063 | LOCK_GROUP         | END          | myGroup1                     | Rollback session #1: 5 tables locked, 0 deadlock(s)            | postgres
    4064 | SET_MARK_GROUP     | BEGIN        | myGroup1                     | RLBK_Different_Mark_%_START                                    | postgres
    4065 | SET_MARK_GROUP     | END          | myGroup1                     | RLBK_Different_Mark_%_START                                    | postgres
    4066 | ROLLBACK_SEQUENCE  |              | myschema1."myTbl3_col31_seq" |                                                                | postgres
    4067 | SET_MARK_GROUP     | BEGIN        | myGroup1                     | RLBK_Different_Mark_%_DONE                                     | postgres
    4068 | SET_MARK_GROUP     | END          | myGroup1                     | RLBK_Different_Mark_%_DONE                                     | postgres
    4069 | ROLLBACK_GROUP     | END          | myGroup1                     | Rollback_id 3, 0 tables and 1 sequences effectively processed  | postgres
    4070 | ROLLBACK_GROUP     | BEGIN        | myGroup2                     | Logged rollback to mark Mark21 (timestamp)                     | postgres
    4071 | DBLINK_OPEN_CNX    |              | rlbk#1                       | Status = -2                                                    | postgres
    4072 | LOCK_GROUP         | BEGIN        | myGroup2                     | Rollback session #1                                            | postgres
    4073 | LOCK_GROUP         | END          | myGroup2                     | Rollback session #1: 6 tables locked, 0 deadlock(s)            | postgres
    4074 | SET_MARK_GROUP     | BEGIN        | myGroup2                     | RLBK_Mark21_%_START                                            | postgres
    4075 | SET_MARK_GROUP     | END          | myGroup2                     | RLBK_Mark21_%_START                                            | postgres
    4076 | ROLLBACK_SEQUENCE  |              | myschema2.myseq1             |                                                                | postgres
    4077 | ROLLBACK_SEQUENCE  |              | myschema2."myTbl3_col31_seq" |                                                                | postgres
    4078 | SET_MARK_GROUP     | BEGIN        | myGroup2                     | RLBK_Mark21_%_DONE                                             | postgres
    4079 | SET_MARK_GROUP     | END          | myGroup2                     | RLBK_Mark21_%_DONE                                             | postgres
    4080 | ROLLBACK_GROUP     | END          | myGroup2                     | Rollback_id 4, 0 tables and 2 sequences effectively processed  | postgres
    4081 | SET_MARK_GROUPS    | BEGIN        | myGroup1,myGroup2            | Mark1B                                                         | postgres
    4082 | LOCK_GROUPS        | BEGIN        | myGroup1,myGroup2            |                                                                | postgres
    4083 | LOCK_GROUPS        | END          | myGroup1,myGroup2            | 11 tables locked, 0 deadlock(s)                                | postgres
    4084 | SET_MARK_GROUPS    | END          | myGroup1,myGroup2            | Mark1B                                                         | postgres
    4085 | ROLLBACK_GROUPS    | BEGIN        | myGroup1,myGroup2            | Unlogged rollback to mark Mark1B (timestamp)                   | postgres
    4086 | DBLINK_OPEN_CNX    |              | rlbk#1                       | Status = -5                                                    | postgres
    4087 | LOCK_GROUP         | BEGIN        | myGroup1,myGroup2            | Rollback session #1                                            | postgres
    4088 | LOCK_GROUP         | END          | myGroup1,myGroup2            | Rollback session #1: 11 tables locked, 0 deadlock(s)           | postgres
    4089 | ROLLBACK_SEQUENCE  |              | myschema1."myTbl3_col31_seq" |                                                                | postgres
    4090 | ROLLBACK_SEQUENCE  |              | myschema2.myseq1             |                                                                | postgres
    4091 | ROLLBACK_SEQUENCE  |              | myschema2."myTbl3_col31_seq" |                                                                | postgres
    4092 | ROLLBACK_GROUPS    | END          | myGroup1,myGroup2            | Rollback_id 5, 0 tables and 3 sequences effectively processed  | postgres
    4093 | ROLLBACK_GROUPS    | BEGIN        | myGroup1,myGroup2            | Unlogged rollback to mark Mark1B (timestamp)                   | postgres
    4094 | DBLINK_OPEN_CNX    |              | rlbk#1                       | Status = -6                                                    | postgres
    4095 | LOCK_GROUP         | BEGIN        | myGroup1,myGroup2            | Rollback session #1                                            | postgres
    4096 | LOCK_GROUP         | END          | myGroup1,myGroup2            | Rollback session #1: 11 tables locked, 0 deadlock(s)           | postgres
    4097 | ROLLBACK_SEQUENCE  |              | myschema1."myTbl3_col31_seq" |                                                                | postgres
    4098 | ROLLBACK_SEQUENCE  |              | myschema2.myseq1             |                                                                | postgres
    4099 | ROLLBACK_SEQUENCE  |              | myschema2."myTbl3_col31_seq" |                                                                | postgres
    4100 | ROLLBACK_GROUPS    | END          | myGroup1,myGroup2            | Rollback_id 6, 0 tables and 3 sequences effectively processed  | postgres
    4101 | ROLLBACK_GROUPS    | BEGIN        | myGroup1,myGroup2            | Logged rollback to mark Mark1B (timestamp)                     | postgres
    4102 | DBLINK_OPEN_CNX    |              | rlbk#1                       | Status = -4                                                    | postgres
    4103 | LOCK_GROUP         | BEGIN        | myGroup1,myGroup2            | Rollback session #1                                            | postgres
    4104 | LOCK_GROUP         | END          | myGroup1,myGroup2            | Rollback session #1: 11 tables locked, 0 deadlock(s)           | postgres
    4105 | SET_MARK_GROUPS    | BEGIN        | myGroup1,myGroup2            | RLBK_Mark1B_%_START                                            | postgres
    4106 | SET_MARK_GROUPS    | END          | myGroup1,myGroup2            | RLBK_Mark1B_%_START                                            | postgres
    4107 | ROLLBACK_SEQUENCE  |              | myschema1."myTbl3_col31_seq" |                                                                | postgres
    4108 | ROLLBACK_SEQUENCE  |              | myschema2.myseq1             |                                                                | postgres
    4109 | ROLLBACK_SEQUENCE  |              | myschema2."myTbl3_col31_seq" |                                                                | postgres
    4110 | SET_MARK_GROUPS    | BEGIN        | myGroup1,myGroup2            | RLBK_Mark1B_%_DONE                                             | postgres
    4111 | SET_MARK_GROUPS    | END          | myGroup1,myGroup2            | RLBK_Mark1B_%_DONE                                             | postgres
    4112 | ROLLBACK_GROUPS    | END          | myGroup1,myGroup2            | Rollback_id 7, 0 tables and 3 sequences effectively processed  | postgres
    4113 | ROLLBACK_GROUPS    | BEGIN        | myGroup1,myGroup2            | Logged rollback to mark Mark1B (timestamp)                     | postgres
    4114 | DBLINK_OPEN_CNX    |              | rlbk#1                       | Status = 1                                                     | postgres
    4115 | LOCK_GROUP         | BEGIN        | myGroup1,myGroup2            | Rollback session #1                                            | postgres
    4116 | LOCK_GROUP         | END          | myGroup1,myGroup2            | Rollback session #1: 11 tables locked, 0 deadlock(s)           | postgres
    4117 | SET_MARK_GROUPS    | BEGIN        | myGroup1,myGroup2            | RLBK_Mark1B_%_START                                            | postgres
    4118 | SET_MARK_GROUPS    | END          | myGroup1,myGroup2            | RLBK_Mark1B_%_START                                            | postgres
    4119 | ROLLBACK_SEQUENCE  |              | myschema1."myTbl3_col31_seq" |                                                                | postgres
    4120 | ROLLBACK_SEQUENCE  |              | myschema2.myseq1             |                                                                | postgres
    4121 | ROLLBACK_SEQUENCE  |              | myschema2."myTbl3_col31_seq" |                                                                | postgres
    4122 | SET_MARK_GROUPS    | BEGIN        | myGroup1,myGroup2            | RLBK_Mark1B_%_DONE                                             | postgres
    4123 | SET_MARK_GROUPS    | END          | myGroup1,myGroup2            | RLBK_Mark1B_%_DONE                                             | postgres
    4124 | ROLLBACK_GROUPS    | END          | myGroup1,myGroup2            | Rollback_id 8, 0 tables and 3 sequences effectively processed  | postgres
    4125 | DBLINK_CLOSE_CNX   |              | rlbk#1                       |                                                                | postgres
    4126 | STOP_GROUPS        | BEGIN        | myGroup1,myGroup2            |                                                                | postgres
    4127 | LOCK_GROUPS        | BEGIN        | myGroup1,myGroup2            |                                                                | postgres
    4128 | LOCK_GROUPS        | END          | myGroup1,myGroup2            | 11 tables locked, 0 deadlock(s)                                | postgres
    4129 | SET_MARK_GROUPS    | BEGIN        | myGroup1,myGroup2            | STOP_%                                                         | postgres
    4130 | CLEANUP_RLBK_STATE |              | rollback id 8                | set to COMMITTED                                               | postgres
    4131 | SET_MARK_GROUPS    | END          | myGroup1,myGroup2            | STOP_%                                                         | postgres
    4132 | STOP_GROUPS        | END          | myGroup1,myGroup2            | 14 tables/sequences processed                                  | postgres
    4133 | START_GROUP        | BEGIN        | myGroup1                     | With log reset                                                 | postgres
    4134 | LOCK_GROUP         | BEGIN        | myGroup1                     |                                                                | postgres
    4135 | LOCK_GROUP         | END          | myGroup1                     | 5 tables locked, 0 deadlock(s)                                 | postgres
    4136 | SET_MARK_GROUP     | BEGIN        | myGroup1                     | Mark11                                                         | postgres
    4137 | SET_MARK_GROUP     | END          | myGroup1                     | Mark11                                                         | postgres
    4138 | START_GROUP        | END          | myGroup1                     | 6 tables/sequences processed                                   | postgres
    4139 | START_GROUP        | BEGIN        | myGroup2                     | With log reset                                                 | postgres
    4140 | LOCK_GROUP         | BEGIN        | myGroup2                     |                                                                | postgres
    4141 | LOCK_GROUP         | END          | myGroup2                     | 6 tables locked, 0 deadlock(s)                                 | postgres
    4142 | SET_MARK_GROUP     | BEGIN        | myGroup2                     | Mark21                                                         | postgres
    4143 | SET_MARK_GROUP     | END          | myGroup2                     | Mark21                                                         | postgres
    4144 | START_GROUP        | END          | myGroup2                     | 8 tables/sequences processed                                   | postgres
    4145 | SET_MARK_GROUP     | BEGIN        | myGroup1                     |                                                                | postgres
    4146 | LOCK_GROUP         | BEGIN        | myGroup1                     |                                                                | postgres
    4147 | LOCK_GROUP         | END          | myGroup1                     | 5 tables locked, 0 deadlock(s)                                 | postgres
    4148 | SET_MARK_GROUP     | END          | myGroup1                     | Mark12                                                         | postgres
    4149 | SET_MARK_GROUP     | BEGIN        | myGroup1                     |                                                                | postgres
    4150 | LOCK_GROUP         | BEGIN        | myGroup1                     |                                                                | postgres
    4151 | LOCK_GROUP         | END          | myGroup1                     | 5 tables locked, 0 deadlock(s)                                 | postgres
    4152 | SET_MARK_GROUP     | END          | myGroup1                     | Mark13                                                         | postgres
    4153 | ROLLBACK_GROUP     | BEGIN        | myGroup1                     | Unlogged rollback to mark Mark12 (timestamp)                   | postgres
    4154 | DBLINK_OPEN_CNX    |              | rlbk#1                       | Status = 1                                                     | postgres
    4155 | LOCK_GROUP         | BEGIN        | myGroup1                     | Rollback session #1                                            | postgres
    4156 | LOCK_GROUP         | END          | myGroup1                     | Rollback session #1: 5 tables locked, 0 deadlock(s)            | postgres
    4157 | ROLLBACK_TABLE     | BEGIN        | myschema1."myTbl3"           | All log rows with emaj_gid > 29                                | postgres
    4158 | ROLLBACK_TABLE     | END          | myschema1."myTbl3"           | 10 rolled back primary keys                                    | postgres
    4159 | ROLLBACK_TABLE     | BEGIN        | myschema1.mytbl4             | All log rows with emaj_gid > 29                                | postgres
    4160 | ROLLBACK_TABLE     | END          | myschema1.mytbl4             | 1 rolled back primary keys                                     | postgres
    4161 | ROLLBACK_GROUP     | MARK DELETED | myGroup1                     | mark Mark13 is deleted                                         | postgres
    4162 | ROLLBACK_SEQUENCE  |              | myschema1."myTbl3_col31_seq" | RESTART 1                                                      | postgres
    4163 | ROLLBACK_GROUP     | END          | myGroup1                     | Rollback_id 9, 2 tables and 1 sequences effectively processed  | postgres
    4164 | DBLINK_CLOSE_CNX   |              | rlbk#1                       |                                                                | postgres
    4165 | ROLLBACK_GROUP     | BEGIN        | myGroup1                     | Unlogged rollback to mark Mark11 (timestamp)                   | postgres
    4166 | DBLINK_OPEN_CNX    |              | rlbk#1                       | Status = 1                                                     | postgres
    4167 | LOCK_GROUP         | BEGIN        | myGroup1                     | Rollback session #1                                            | postgres
    4168 | LOCK_GROUP         | END          | myGroup1                     | Rollback session #1: 5 tables locked, 0 deadlock(s)            | postgres
    4169 | ROLLBACK_TABLE     | BEGIN        | myschema1.mytbl1             | All log rows with emaj_gid > 2                                 | postgres
    4170 | ROLLBACK_TABLE     | END          | myschema1.mytbl1             | 11 rolled back primary keys                                    | postgres
    4171 | ROLLBACK_TABLE     | BEGIN        | myschema1.mytbl2             | All log rows with emaj_gid > 2                                 | postgres
    4172 | ROLLBACK_TABLE     | END          | myschema1.mytbl2             | 3 rolled back primary keys                                     | postgres
    4173 | ROLLBACK_TABLE     | BEGIN        | myschema1.mytbl2b            | All log rows with emaj_gid > 2                                 | postgres
    4174 | ROLLBACK_TABLE     | END          | myschema1.mytbl2b            | 6 rolled back primary keys                                     | postgres
    4175 | ROLLBACK_GROUP     | MARK DELETED | myGroup1                     | mark Mark12 is deleted                                         | postgres
    4176 | ROLLBACK_SEQUENCE  |              | myschema1."myTbl3_col31_seq" |                                                                | postgres
    4177 | ROLLBACK_GROUP     | END          | myGroup1                     | Rollback_id 10, 3 tables and 1 sequences effectively processed | postgres
    4178 | DBLINK_CLOSE_CNX   |              | rlbk#1                       |                                                                | postgres
    4179 | STOP_GROUP         | BEGIN        | myGroup1                     |                                                                | postgres
    4180 | LOCK_GROUP         | BEGIN        | myGroup1                     |                                                                | postgres
    4181 | LOCK_GROUP         | END          | myGroup1                     | 5 tables locked, 0 deadlock(s)                                 | postgres
    4182 | SET_MARK_GROUP     | BEGIN        | myGroup1                     | STOP_%                                                         | postgres
    4183 | CLEANUP_RLBK_STATE |              | rollback id 9                | set to COMMITTED                                               | postgres
    4184 | CLEANUP_RLBK_STATE |              | rollback id 10               | set to COMMITTED                                               | postgres
    4185 | SET_MARK_GROUP     | END          | myGroup1                     | STOP_%                                                         | postgres
    4186 | STOP_GROUP         | END          | myGroup1                     | 6 tables/sequences processed                                   | postgres
    4187 | START_GROUP        | BEGIN        | myGroup1                     | With log reset                                                 | postgres
    4188 | LOCK_GROUP         | BEGIN        | myGroup1                     |                                                                | postgres
    4189 | LOCK_GROUP         | END          | myGroup1                     | 5 tables locked, 0 deadlock(s)                                 | postgres
    4190 | SET_MARK_GROUP     | BEGIN        | myGroup1                     | Mark11                                                         | postgres
    4191 | SET_MARK_GROUP     | END          | myGroup1                     | Mark11                                                         | postgres
    4192 | START_GROUP        | END          | myGroup1                     | 6 tables/sequences processed                                   | postgres
    4193 | SET_MARK_GROUP     | BEGIN        | myGroup1                     |                                                                | postgres
    4194 | LOCK_GROUP         | BEGIN        | myGroup1                     |                                                                | postgres
    4195 | LOCK_GROUP         | END          | myGroup1                     | 5 tables locked, 0 deadlock(s)                                 | postgres
    4196 | SET_MARK_GROUP     | END          | myGroup1                     | Mark12                                                         | postgres
    4197 | SET_MARK_GROUP     | BEGIN        | myGroup1                     |                                                                | postgres
    4198 | LOCK_GROUP         | BEGIN        | myGroup1                     |                                                                | postgres
    4199 | LOCK_GROUP         | END          | myGroup1                     | 5 tables locked, 0 deadlock(s)                                 | postgres
    4200 | SET_MARK_GROUP     | END          | myGroup1                     | Mark13                                                         | postgres
    4201 | ROLLBACK_GROUP     | BEGIN        | myGroup1                     | Logged rollback to mark Mark12 (timestamp)                     | postgres
    4202 | DBLINK_OPEN_CNX    |              | rlbk#1                       | Status = 1                                                     | postgres
    4203 | LOCK_GROUP         | BEGIN        | myGroup1                     | Rollback session #1                                            | postgres
    4204 | LOCK_GROUP         | END          | myGroup1                     | Rollback session #1: 5 tables locked, 0 deadlock(s)            | postgres
    4205 | SET_MARK_GROUP     | BEGIN        | myGroup1                     | RLBK_Mark12_%_START                                            | postgres
    4206 | SET_MARK_GROUP     | END          | myGroup1                     | RLBK_Mark12_%_START                                            | postgres
    4207 | ROLLBACK_TABLE     | BEGIN        | myschema1."myTbl3"           | All log rows with emaj_gid > 60                                | postgres
    4208 | ROLLBACK_TABLE     | END          | myschema1."myTbl3"           | 10 rolled back primary keys                                    | postgres
    4209 | ROLLBACK_TABLE     | BEGIN        | myschema1.mytbl4             | All log rows with emaj_gid > 60                                | postgres
    4210 | ROLLBACK_TABLE     | END          | myschema1.mytbl4             | 1 rolled back primary keys                                     | postgres
    4211 | ROLLBACK_SEQUENCE  |              | myschema1."myTbl3_col31_seq" | RESTART 1                                                      | postgres
    4212 | SET_MARK_GROUP     | BEGIN        | myGroup1                     | RLBK_Mark12_%_DONE                                             | postgres
    4213 | SET_MARK_GROUP     | END          | myGroup1                     | RLBK_Mark12_%_DONE                                             | postgres
    4214 | ROLLBACK_GROUP     | END          | myGroup1                     | Rollback_id 11, 2 tables and 1 sequences effectively processed | postgres
    4215 | DBLINK_CLOSE_CNX   |              | rlbk#1                       |                                                                | postgres
    4216 | ROLLBACK_GROUP     | BEGIN        | myGroup1                     | Logged rollback to mark Mark11 (timestamp)                     | postgres
    4217 | DBLINK_OPEN_CNX    |              | rlbk#1                       | Status = 1                                                     | postgres
    4218 | LOCK_GROUP         | BEGIN        | myGroup1                     | Rollback session #1                                            | postgres
    4219 | LOCK_GROUP         | END          | myGroup1                     | Rollback session #1: 5 tables locked, 0 deadlock(s)            | postgres
    4220 | SET_MARK_GROUP     | BEGIN        | myGroup1                     | RLBK_Mark11_%_START                                            | postgres
    4221 | CLEANUP_RLBK_STATE |              | rollback id 11               | set to COMMITTED                                               | postgres
    4222 | SET_MARK_GROUP     | END          | myGroup1                     | RLBK_Mark11_%_START                                            | postgres
    4223 | ROLLBACK_TABLE     | BEGIN        | myschema1."myTbl3"           | All log rows with emaj_gid > 41                                | postgres
    4224 | ROLLBACK_TABLE     | END          | myschema1."myTbl3"           | 10 rolled back primary keys                                    | postgres
    4225 | ROLLBACK_TABLE     | BEGIN        | myschema1.mytbl1             | All log rows with emaj_gid > 41                                | postgres
    4226 | ROLLBACK_TABLE     | END          | myschema1.mytbl1             | 11 rolled back primary keys                                    | postgres
    4227 | ROLLBACK_TABLE     | BEGIN        | myschema1.mytbl2             | All log rows with emaj_gid > 41                                | postgres
    4228 | ROLLBACK_TABLE     | END          | myschema1.mytbl2             | 2 rolled back primary keys                                     | postgres
    4229 | ROLLBACK_TABLE     | BEGIN        | myschema1.mytbl4             | All log rows with emaj_gid > 41                                | postgres
    4230 | ROLLBACK_TABLE     | END          | myschema1.mytbl4             | 1 rolled back primary keys                                     | postgres
    4231 | ROLLBACK_TABLE     | BEGIN        | myschema1.mytbl2b            | All log rows with emaj_gid > 41                                | postgres
    4232 | ROLLBACK_TABLE     | END          | myschema1.mytbl2b            | 2 rolled back primary keys                                     | postgres
    4233 | ROLLBACK_SEQUENCE  |              | myschema1."myTbl3_col31_seq" |                                                                | postgres
    4234 | SET_MARK_GROUP     | BEGIN        | myGroup1                     | RLBK_Mark11_%_DONE                                             | postgres
    4235 | SET_MARK_GROUP     | END          | myGroup1                     | RLBK_Mark11_%_DONE                                             | postgres
    4236 | ROLLBACK_GROUP     | END          | myGroup1                     | Rollback_id 12, 5 tables and 1 sequences effectively processed | postgres
    4237 | DBLINK_CLOSE_CNX   |              | rlbk#1                       |                                                                | postgres
    4238 | ROLLBACK_GROUP     | BEGIN        | myGroup1                     | Unlogged rollback to mark Mark13 (timestamp)                   | postgres
    4239 | DBLINK_OPEN_CNX    |              | rlbk#1                       | Status = 1                                                     | postgres
    4240 | LOCK_GROUP         | BEGIN        | myGroup1                     | Rollback session #1                                            | postgres
    4241 | LOCK_GROUP         | END          | myGroup1                     | Rollback session #1: 5 tables locked, 0 deadlock(s)            | postgres
    4242 | ROLLBACK_TABLE     | BEGIN        | myschema1.mytbl1             | All log rows with emaj_gid > 71                                | postgres
    4243 | ROLLBACK_TABLE     | END          | myschema1.mytbl1             | 10 rolled back primary keys                                    | postgres
    4244 | ROLLBACK_TABLE     | BEGIN        | myschema1.mytbl2             | All log rows with emaj_gid > 71                                | postgres
    4245 | ROLLBACK_TABLE     | END          | myschema1.mytbl2             | 2 rolled back primary keys                                     | postgres
    4246 | ROLLBACK_TABLE     | BEGIN        | myschema1.mytbl4             | All log rows with emaj_gid > 71                                | postgres
    4247 | ROLLBACK_TABLE     | END          | myschema1.mytbl4             | 1 rolled back primary keys                                     | postgres
    4248 | ROLLBACK_TABLE     | BEGIN        | myschema1."myTbl3"           | All log rows with emaj_gid > 71                                | postgres
    4249 | ROLLBACK_TABLE     | END          | myschema1."myTbl3"           | 10 rolled back primary keys                                    | postgres
    4250 | ROLLBACK_TABLE     | BEGIN        | myschema1.mytbl2b            | All log rows with emaj_gid > 71                                | postgres
    4251 | ROLLBACK_TABLE     | END          | myschema1.mytbl2b            | 2 rolled back primary keys                                     | postgres
    4252 | ROLLBACK_GROUP     | MARK DELETED | myGroup1                     | mark RLBK_Mark12_%_START is deleted                            | postgres
    4253 | ROLLBACK_GROUP     | MARK DELETED | myGroup1                     | mark RLBK_Mark12_%_DONE is deleted                             | postgres
    4254 | ROLLBACK_GROUP     | MARK DELETED | myGroup1                     | mark RLBK_Mark11_%_START is deleted                            | postgres
    4255 | ROLLBACK_GROUP     | MARK DELETED | myGroup1                     | mark RLBK_Mark11_%_DONE is deleted                             | postgres
    4256 | ROLLBACK_SEQUENCE  |              | myschema1."myTbl3_col31_seq" | RESTART 11                                                     | postgres
    4257 | ROLLBACK_GROUP     | END          | myGroup1                     | Rollback_id 13, 5 tables and 1 sequences effectively processed | postgres
    4258 | DBLINK_CLOSE_CNX   |              | rlbk#1                       |                                                                | postgres
    4259 | START_GROUP        | BEGIN        | myGroup4                     | With log reset                                                 | postgres
    4260 | LOCK_GROUP         | BEGIN        | myGroup4                     |                                                                | postgres
    4261 | LOCK_GROUP         | END          | myGroup4                     | 3 tables locked, 0 deadlock(s)                                 | postgres
    4262 | SET_MARK_GROUP     | BEGIN        | myGroup4                     | myGroup4_start                                                 | postgres
    4263 | CLEANUP_RLBK_STATE |              | rollback id 12               | set to COMMITTED                                               | postgres
    4264 | CLEANUP_RLBK_STATE |              | rollback id 13               | set to COMMITTED                                               | postgres
    4265 | SET_MARK_GROUP     | END          | myGroup4                     | myGroup4_start                                                 | postgres
    4266 | START_GROUP        | END          | myGroup4                     | 3 tables/sequences processed                                   | postgres
    4267 | SET_MARK_GROUP     | BEGIN        | myGroup4                     |                                                                | postgres
    4268 | LOCK_GROUP         | BEGIN        | myGroup4                     |                                                                | postgres
    4269 | LOCK_GROUP         | END          | myGroup4                     | 3 tables locked, 0 deadlock(s)                                 | postgres
    4270 | SET_MARK_GROUP     | END          | myGroup4                     | mark1                                                          | postgres
    4271 | ROLLBACK_GROUP     | BEGIN        | myGroup4                     | Logged rollback to mark mark1 (timestamp)                      | postgres
    4272 | DBLINK_OPEN_CNX    |              | rlbk#1                       | Status = 1                                                     | postgres
    4273 | LOCK_GROUP         | BEGIN        | myGroup4                     | Rollback session #1                                            | postgres
    4274 | LOCK_GROUP         | END          | myGroup4                     | Rollback session #1: 3 tables locked, 0 deadlock(s)            | postgres
    4275 | SET_MARK_GROUP     | BEGIN        | myGroup4                     | RLBK_mark1_%_START                                             | postgres
    4276 | SET_MARK_GROUP     | END          | myGroup4                     | RLBK_mark1_%_START                                             | postgres
    4277 | ROLLBACK_TABLE     | BEGIN        | myschema4.mytblc1            | All log rows with emaj_gid > 99                                | postgres
    4278 | ROLLBACK_TABLE     | END          | myschema4.mytblc1            | 1 rolled back primary keys                                     | postgres
    4279 | ROLLBACK_TABLE     | BEGIN        | myschema4.mytblc2            | All log rows with emaj_gid > 99                                | postgres
    4280 | ROLLBACK_TABLE     | END          | myschema4.mytblc2            | 1 rolled back primary keys                                     | postgres
    4281 | ROLLBACK_TABLE     | BEGIN        | myschema4.mytblm             | All log rows with emaj_gid > 99                                | postgres
    4282 | ROLLBACK_TABLE     | END          | myschema4.mytblm             | 1 rolled back primary keys                                     | postgres
    4283 | SET_MARK_GROUP     | BEGIN        | myGroup4                     | RLBK_mark1_%_DONE                                              | postgres
    4284 | SET_MARK_GROUP     | END          | myGroup4                     | RLBK_mark1_%_DONE                                              | postgres
    4285 | ROLLBACK_GROUP     | END          | myGroup4                     | Rollback_id 14, 3 tables and 0 sequences effectively processed | postgres
    4286 | DBLINK_CLOSE_CNX   |              | rlbk#1                       |                                                                | postgres
    4287 | ROLLBACK_GROUP     | BEGIN        | myGroup4                     | Unlogged rollback to mark myGroup4_start (timestamp)           | postgres
    4288 | DBLINK_OPEN_CNX    |              | rlbk#1                       | Status = 1                                                     | postgres
    4289 | LOCK_GROUP         | BEGIN        | myGroup4                     | Rollback session #1                                            | postgres
    4290 | LOCK_GROUP         | END          | myGroup4                     | Rollback session #1: 3 tables locked, 0 deadlock(s)            | postgres
    4291 | ROLLBACK_TABLE     | BEGIN        | myschema4.mytblc1            | All log rows with emaj_gid > 96                                | postgres
    4292 | ROLLBACK_TABLE     | END          | myschema4.mytblc1            | 1 rolled back primary keys                                     | postgres
    4293 | ROLLBACK_TABLE     | BEGIN        | myschema4.mytblc2            | All log rows with emaj_gid > 96                                | postgres
    4294 | ROLLBACK_TABLE     | END          | myschema4.mytblc2            | 1 rolled back primary keys                                     | postgres
    4295 | ROLLBACK_TABLE     | BEGIN        | myschema4.mytblm             | All log rows with emaj_gid > 96                                | postgres
    4296 | ROLLBACK_TABLE     | END          | myschema4.mytblm             | 1 rolled back primary keys                                     | postgres
    4297 | ROLLBACK_GROUP     | MARK DELETED | myGroup4                     | mark mark1 is deleted                                          | postgres
    4298 | ROLLBACK_GROUP     | MARK DELETED | myGroup4                     | mark RLBK_mark1_%_START is deleted                             | postgres
    4299 | ROLLBACK_GROUP     | MARK DELETED | myGroup4                     | mark RLBK_mark1_%_DONE is deleted                              | postgres
    4300 | ROLLBACK_GROUP     | END          | myGroup4                     | Rollback_id 15, 3 tables and 0 sequences effectively processed | postgres
    4301 | DBLINK_CLOSE_CNX   |              | rlbk#1                       |                                                                | postgres
    4308 | CLEANUP_RLBK_STATE |              | rollback id 14               | set to COMMITTED                                               | postgres
    4309 | CLEANUP_RLBK_STATE |              | rollback id 15               | set to COMMITTED                                               | postgres
    4310 | CLEANUP_RLBK_STATE |              | rollback id 16               | set to ABORTED                                                 | postgres
(279 rows)

truncate emaj.emaj_hist;
alter sequence emaj.emaj_hist_hist_id_seq restart 5000;
alter sequence emaj.emaj_mark_mark_id_seq restart 500;
alter sequence emaj.emaj_sequence_sequ_id_seq restart 5000;
alter sequence emaj.emaj_seq_hole_sqhl_id_seq restart 500;
