-- adm2.sql : complex scenario executed by an emaj_adm role. 
--            Follows adm1.sql, and includes more specific test cases
--
set role emaj_regression_tests_adm_user;
-----------------------------
-- Step 8 : use of multi-group functions, start_group(s) without log reset and use deleted marks
-----------------------------
-- stop both groups
select emaj.emaj_stop_groups(array['myGroup1','myGroup2']);
 emaj_stop_groups 
------------------
               14
(1 row)

-- start both groups
select emaj.emaj_start_groups(array['myGroup1','myGroup2'],'Multi-1', false);
WARNING:  _check_fk_groups: Foreign key "mytbl6_col61_fkey", from table "myschema2.mytbl6", references "myschema2.mytbl7" that is outside groups (myGroup1,myGroup2).
CONTEXT:  SQL statement "SELECT emaj._check_fk_groups(v_groupNames)"
PL/pgSQL function emaj._start_groups(text[],text,boolean,boolean) line 36 at PERFORM
SQL statement "SELECT emaj._start_groups(emaj._check_names_array(v_groupNames,'group'), v_mark, true, v_resetLog)"
PL/pgSQL function emaj.emaj_start_groups(text[],text,boolean) line 16 at SQL statement
WARNING:  _check_fk_groups: table "myschema2.mytbl6" is referenced by foreign key "mytbl8_col81_fkey" from table "myschema2.mytbl8" that is outside groups (myGroup1,myGroup2).
CONTEXT:  SQL statement "SELECT emaj._check_fk_groups(v_groupNames)"
PL/pgSQL function emaj._start_groups(text[],text,boolean,boolean) line 36 at PERFORM
SQL statement "SELECT emaj._start_groups(emaj._check_names_array(v_groupNames,'group'), v_mark, true, v_resetLog)"
PL/pgSQL function emaj.emaj_start_groups(text[],text,boolean) line 16 at SQL statement
 emaj_start_groups 
-------------------
                14
(1 row)

-- set a mark for both groups
select emaj.emaj_set_mark_groups(array['myGroup1','myGroup2'],'Multi-2');
 emaj_set_mark_groups 
----------------------
                   14
(1 row)

-- logged rollback to Multi-1
select emaj.emaj_logged_rollback_groups(array['myGroup1','myGroup2'],'Multi-1');
WARNING:  _check_fk_groups: Foreign key "mytbl6_col61_fkey", from table "myschema2.mytbl6", references "myschema2.mytbl7" that is outside groups (myGroup1,myGroup2).
CONTEXT:  SQL statement "SELECT emaj._check_fk_groups(v_groupNames)"
PL/pgSQL function emaj._rlbk_init(text[],text,boolean,integer,boolean) line 68 at PERFORM
SQL statement "SELECT emaj._rlbk_init(v_groupNames, v_mark, v_isLoggedRlbk, 1, v_multiGroup)"
PL/pgSQL function emaj._rlbk_groups(text[],text,boolean,boolean) line 20 at SQL statement
PL/pgSQL function emaj.emaj_logged_rollback_groups(text[],text) line 11 at RETURN
WARNING:  _check_fk_groups: table "myschema2.mytbl6" is referenced by foreign key "mytbl8_col81_fkey" from table "myschema2.mytbl8" that is outside groups (myGroup1,myGroup2).
CONTEXT:  SQL statement "SELECT emaj._check_fk_groups(v_groupNames)"
PL/pgSQL function emaj._rlbk_init(text[],text,boolean,integer,boolean) line 68 at PERFORM
SQL statement "SELECT emaj._rlbk_init(v_groupNames, v_mark, v_isLoggedRlbk, 1, v_multiGroup)"
PL/pgSQL function emaj._rlbk_groups(text[],text,boolean,boolean) line 20 at SQL statement
PL/pgSQL function emaj.emaj_logged_rollback_groups(text[],text) line 11 at RETURN
 emaj_logged_rollback_groups 
-----------------------------
                           3
(1 row)

-- rollback to Multi-2
select emaj.emaj_rollback_groups(array['myGroup1','myGroup2'],'Multi-2');
WARNING:  _check_fk_groups: Foreign key "mytbl6_col61_fkey", from table "myschema2.mytbl6", references "myschema2.mytbl7" that is outside groups (myGroup1,myGroup2).
CONTEXT:  SQL statement "SELECT emaj._check_fk_groups(v_groupNames)"
PL/pgSQL function emaj._rlbk_init(text[],text,boolean,integer,boolean) line 68 at PERFORM
SQL statement "SELECT emaj._rlbk_init(v_groupNames, v_mark, v_isLoggedRlbk, 1, v_multiGroup)"
PL/pgSQL function emaj._rlbk_groups(text[],text,boolean,boolean) line 20 at SQL statement
PL/pgSQL function emaj.emaj_rollback_groups(text[],text) line 7 at RETURN
WARNING:  _check_fk_groups: table "myschema2.mytbl6" is referenced by foreign key "mytbl8_col81_fkey" from table "myschema2.mytbl8" that is outside groups (myGroup1,myGroup2).
CONTEXT:  SQL statement "SELECT emaj._check_fk_groups(v_groupNames)"
PL/pgSQL function emaj._rlbk_init(text[],text,boolean,integer,boolean) line 68 at PERFORM
SQL statement "SELECT emaj._rlbk_init(v_groupNames, v_mark, v_isLoggedRlbk, 1, v_multiGroup)"
PL/pgSQL function emaj._rlbk_groups(text[],text,boolean,boolean) line 20 at SQL statement
PL/pgSQL function emaj.emaj_rollback_groups(text[],text) line 7 at RETURN
 emaj_rollback_groups 
----------------------
                    3
(1 row)

-- rollback and stop to Multi-1
select emaj.emaj_rollback_groups(array['myGroup1','myGroup2'],'Multi-1');
WARNING:  _check_fk_groups: Foreign key "mytbl6_col61_fkey", from table "myschema2.mytbl6", references "myschema2.mytbl7" that is outside groups (myGroup1,myGroup2).
CONTEXT:  SQL statement "SELECT emaj._check_fk_groups(v_groupNames)"
PL/pgSQL function emaj._rlbk_init(text[],text,boolean,integer,boolean) line 68 at PERFORM
SQL statement "SELECT emaj._rlbk_init(v_groupNames, v_mark, v_isLoggedRlbk, 1, v_multiGroup)"
PL/pgSQL function emaj._rlbk_groups(text[],text,boolean,boolean) line 20 at SQL statement
PL/pgSQL function emaj.emaj_rollback_groups(text[],text) line 7 at RETURN
WARNING:  _check_fk_groups: table "myschema2.mytbl6" is referenced by foreign key "mytbl8_col81_fkey" from table "myschema2.mytbl8" that is outside groups (myGroup1,myGroup2).
CONTEXT:  SQL statement "SELECT emaj._check_fk_groups(v_groupNames)"
PL/pgSQL function emaj._rlbk_init(text[],text,boolean,integer,boolean) line 68 at PERFORM
SQL statement "SELECT emaj._rlbk_init(v_groupNames, v_mark, v_isLoggedRlbk, 1, v_multiGroup)"
PL/pgSQL function emaj._rlbk_groups(text[],text,boolean,boolean) line 20 at SQL statement
PL/pgSQL function emaj.emaj_rollback_groups(text[],text) line 7 at RETURN
 emaj_rollback_groups 
----------------------
                    3
(1 row)

select emaj.emaj_stop_groups(array['myGroup1','myGroup2'],'Stop after rollback');
 emaj_stop_groups 
------------------
               14
(1 row)

-- try to start both groups, but with an old deleted mark name
select emaj.emaj_start_groups(array['myGroup1','myGroup2'],'Multi-1', false);
WARNING:  _check_fk_groups: Foreign key "mytbl6_col61_fkey", from table "myschema2.mytbl6", references "myschema2.mytbl7" that is outside groups (myGroup1,myGroup2).
CONTEXT:  SQL statement "SELECT emaj._check_fk_groups(v_groupNames)"
PL/pgSQL function emaj._start_groups(text[],text,boolean,boolean) line 36 at PERFORM
SQL statement "SELECT emaj._start_groups(emaj._check_names_array(v_groupNames,'group'), v_mark, true, v_resetLog)"
PL/pgSQL function emaj.emaj_start_groups(text[],text,boolean) line 16 at SQL statement
WARNING:  _check_fk_groups: table "myschema2.mytbl6" is referenced by foreign key "mytbl8_col81_fkey" from table "myschema2.mytbl8" that is outside groups (myGroup1,myGroup2).
CONTEXT:  SQL statement "SELECT emaj._check_fk_groups(v_groupNames)"
PL/pgSQL function emaj._start_groups(text[],text,boolean,boolean) line 36 at PERFORM
SQL statement "SELECT emaj._start_groups(emaj._check_names_array(v_groupNames,'group'), v_mark, true, v_resetLog)"
PL/pgSQL function emaj.emaj_start_groups(text[],text,boolean) line 16 at SQL statement
ERROR:  _check_new_mark: Group "myGroup1" already contains a mark named "Multi-1".
CONTEXT:  SQL statement "SELECT emaj._check_new_mark(v_mark, v_groupNames)"
PL/pgSQL function emaj._start_groups(text[],text,boolean,boolean) line 45 at SQL statement
SQL statement "SELECT emaj._start_groups(emaj._check_names_array(v_groupNames,'group'), v_mark, true, v_resetLog)"
PL/pgSQL function emaj.emaj_start_groups(text[],text,boolean) line 16 at SQL statement
-- really start both groups
select emaj.emaj_start_groups(array['myGroup1','myGroup2'],'Multi-1b', false);
WARNING:  _check_fk_groups: Foreign key "mytbl6_col61_fkey", from table "myschema2.mytbl6", references "myschema2.mytbl7" that is outside groups (myGroup1,myGroup2).
CONTEXT:  SQL statement "SELECT emaj._check_fk_groups(v_groupNames)"
PL/pgSQL function emaj._start_groups(text[],text,boolean,boolean) line 36 at PERFORM
SQL statement "SELECT emaj._start_groups(emaj._check_names_array(v_groupNames,'group'), v_mark, true, v_resetLog)"
PL/pgSQL function emaj.emaj_start_groups(text[],text,boolean) line 16 at SQL statement
WARNING:  _check_fk_groups: table "myschema2.mytbl6" is referenced by foreign key "mytbl8_col81_fkey" from table "myschema2.mytbl8" that is outside groups (myGroup1,myGroup2).
CONTEXT:  SQL statement "SELECT emaj._check_fk_groups(v_groupNames)"
PL/pgSQL function emaj._start_groups(text[],text,boolean,boolean) line 36 at PERFORM
SQL statement "SELECT emaj._start_groups(emaj._check_names_array(v_groupNames,'group'), v_mark, true, v_resetLog)"
PL/pgSQL function emaj.emaj_start_groups(text[],text,boolean) line 16 at SQL statement
 emaj_start_groups 
-------------------
                14
(1 row)

-- set again a mark for both groups
select emaj.emaj_set_mark_groups(array['myGroup1','myGroup2'],'Multi-2');
 emaj_set_mark_groups 
----------------------
                   14
(1 row)

-- delete the mark for only 1 group and get detailed statistics for the other group
select emaj.emaj_delete_mark_group('myGroup1','Multi-2');
 emaj_delete_mark_group 
------------------------
                      1
(1 row)

-- use this mark for the other group before delete it
select * from emaj.emaj_detailed_log_stat_group('myGroup2','Multi-2',NULL);
 stat_group | stat_schema | stat_table | stat_role | stat_verb | stat_rows 
------------+-------------+------------+-----------+-----------+-----------
(0 rows)

select emaj.emaj_rollback_group('myGroup2','Multi-2');
WARNING:  _check_fk_groups: Foreign key "mytbl6_col61_fkey", from table "myschema2.mytbl6", references "myschema2.mytbl7" that is outside groups (myGroup2).
CONTEXT:  SQL statement "SELECT emaj._check_fk_groups(v_groupNames)"
PL/pgSQL function emaj._rlbk_init(text[],text,boolean,integer,boolean) line 68 at PERFORM
SQL statement "SELECT emaj._rlbk_init(v_groupNames, v_mark, v_isLoggedRlbk, 1, v_multiGroup)"
PL/pgSQL function emaj._rlbk_groups(text[],text,boolean,boolean) line 20 at SQL statement
PL/pgSQL function emaj.emaj_rollback_group(text,text) line 7 at RETURN
WARNING:  _check_fk_groups: table "myschema2.mytbl6" is referenced by foreign key "mytbl8_col81_fkey" from table "myschema2.mytbl8" that is outside groups (myGroup2).
CONTEXT:  SQL statement "SELECT emaj._check_fk_groups(v_groupNames)"
PL/pgSQL function emaj._rlbk_init(text[],text,boolean,integer,boolean) line 68 at PERFORM
SQL statement "SELECT emaj._rlbk_init(v_groupNames, v_mark, v_isLoggedRlbk, 1, v_multiGroup)"
PL/pgSQL function emaj._rlbk_groups(text[],text,boolean,boolean) line 20 at SQL statement
PL/pgSQL function emaj.emaj_rollback_group(text,text) line 7 at RETURN
 emaj_rollback_group 
---------------------
                   2
(1 row)

select emaj.emaj_delete_mark_group('myGroup2','Multi-2');
 emaj_delete_mark_group 
------------------------
                      1
(1 row)

-- get statistics using deleted marks
select * from emaj.emaj_detailed_log_stat_group('myGroup2','M1','M2');
 stat_group | stat_schema | stat_table | stat_role | stat_verb | stat_rows 
------------+-------------+------------+-----------+-----------+-----------
 myGroup2   | myschema2   | mytbl1     | postgres  | DELETE    |         1
 myGroup2   | myschema2   | mytbl1     | postgres  | INSERT    |        11
 myGroup2   | myschema2   | mytbl1     | postgres  | UPDATE    |         3
 myGroup2   | myschema2   | mytbl2     | postgres  | INSERT    |         2
 myGroup2   | myschema2   | myTbl3     | postgres  | INSERT    |        10
 myGroup2   | myschema2   | mytbl5     | postgres  | INSERT    |         2
 myGroup2   | myschema2   | mytbl5     | postgres  | UPDATE    |         1
 myGroup2   | myschema2   | mytbl6     | postgres  | INSERT    |         8
 myGroup2   | myschema2   | mytbl6     | postgres  | UPDATE    |         3
(9 rows)

-- delete intermediate deleted marks
select emaj.emaj_delete_mark_group('myGroup1','Multi-1');
 emaj_delete_mark_group 
------------------------
                      1
(1 row)

select emaj.emaj_delete_mark_group('myGroup2','Multi-1');
 emaj_delete_mark_group 
------------------------
                      1
(1 row)

-- ... and reuse mark names for parallel rollback test
select emaj.emaj_rename_mark_group('myGroup1','Multi-1b','Multi-1');
 emaj_rename_mark_group 
------------------------
 
(1 row)

select emaj.emaj_rename_mark_group('myGroup2','Multi-1b','Multi-1');
 emaj_rename_mark_group 
------------------------
 
(1 row)

-- rename a deleted mark
select emaj.emaj_rename_mark_group('myGroup2','M2','Deleted M2');
 emaj_rename_mark_group 
------------------------
 
(1 row)

-- use emaj_get_previous_mark_group and delete an initial deleted mark
select emaj.emaj_delete_before_mark_group('myGroup2',
      (select emaj.emaj_get_previous_mark_group('myGroup2',
             (select time_clock_timestamp from emaj.emaj_mark, emaj.emaj_time_stamp where time_id = mark_time_id and mark_group = 'myGroup2' and mark_group = 'myGroup2' and mark_name = 'M3')+'0.000001 SECOND'::interval)));
 emaj_delete_before_mark_group 
-------------------------------
                             2
(1 row)

-- comment a deleted mark
select emaj.emaj_comment_mark_group('myGroup2','M3','This mark is deleted');
 emaj_comment_mark_group 
-------------------------
 
(1 row)

-- try to get a rollback duration estimate on a deleted mark
select emaj.emaj_estimate_rollback_group('myGroup2','M3',TRUE);
ERROR:  _rlbk_check: mark "M3" for group "myGroup2" is not usable for rollback.
CONTEXT:  SQL statement "SELECT emaj._rlbk_check(v_groupNames, v_mark)"
PL/pgSQL function emaj._estimate_rollback_groups(text[],text,boolean) line 16 at SQL statement
PL/pgSQL function emaj.emaj_estimate_rollback_group(text,text,boolean) line 8 at RETURN
-- try to rollback on a deleted mark
select emaj.emaj_rollback_group('myGroup2','M3');
ERROR:  _rlbk_check: mark "M3" for group "myGroup2" is not usable for rollback.
CONTEXT:  SQL statement "SELECT emaj._rlbk_check(v_groupNames, v_mark)"
PL/pgSQL function emaj._rlbk_init(text[],text,boolean,integer,boolean) line 24 at SQL statement
SQL statement "SELECT emaj._rlbk_init(v_groupNames, v_mark, v_isLoggedRlbk, 1, v_multiGroup)"
PL/pgSQL function emaj._rlbk_groups(text[],text,boolean,boolean) line 20 at SQL statement
PL/pgSQL function emaj.emaj_rollback_group(text,text) line 7 at RETURN
-----------------------------
-- Checking step 8
-----------------------------
-- emaj tables
select mark_id, mark_group, regexp_replace(mark_name,E'\\d\\d\.\\d\\d\\.\\d\\d\\.\\d\\d\\d','%','g'), mark_time_id, mark_is_deleted, mark_is_rlbk_protected, mark_comment, mark_log_rows_before_next, mark_logged_rlbk_target_mark from emaj.emaj_mark order by mark_id;
 mark_id | mark_group |        regexp_replace        | mark_time_id | mark_is_deleted | mark_is_rlbk_protected |     mark_comment     | mark_log_rows_before_next | mark_logged_rlbk_target_mark 
---------+------------+------------------------------+--------------+-----------------+------------------------+----------------------+---------------------------+------------------------------
     607 | myGroup2   | M3                           |          609 | t               | f                      | This mark is deleted |                         0 | 
     612 | myGroup1   | M4                           |          615 | t               | f                      |                      |                        10 | 
     613 | myGroup1   | M5                           |          616 | t               | f                      |                      |                         3 | 
     617 | myGroup1   | Before logged rollback to M4 |          622 | t               | f                      |                      |                        28 | 
     619 | myGroup1   | STOP_%                       |          624 | t               | f                      |                      |                         0 | 
     620 | myGroup2   | STOP_%                       |          624 | t               | f                      |                      |                         0 | 
     629 | myGroup1   | Stop after rollback          |          631 | t               | f                      |                      |                         0 | 
     630 | myGroup2   | Stop after rollback          |          631 | t               | f                      |                      |                         0 | 
     631 | myGroup1   | Multi-1                      |          632 | f               | f                      |                      |                           | 
     632 | myGroup2   | Multi-1                      |          632 | f               | f                      |                      |                           | 
(10 rows)

select sequ_schema, sequ_name, sequ_time_id, sequ_last_val, sequ_is_called from emaj.emaj_sequence order by sequ_time_id, sequ_schema, sequ_name;
 sequ_schema |         sequ_name          | sequ_time_id | sequ_last_val | sequ_is_called 
-------------+----------------------------+--------------+---------------+----------------
 emaj        | myschema2_mytbl1_log_seq   |          609 |            15 | t
 emaj        | myschema2_mytbl2_log_seq   |          609 |             2 | t
 emaj        | myschema2_mytbl4_log_seq   |          609 |             4 | t
 emaj        | myschema2_mytbl6_log_seq   |          609 |            14 | t
 emaj        | otherPrefix4mytbl5_log_seq |          609 |             4 | t
 emajC       | myschema2_myTbl3_log_seq   |          609 |            10 | t
 myschema2   | myseq1                     |          609 |          1003 | t
 myschema2   | myTbl3_col31_seq           |          609 |            20 | t
 emaj        | myschema1_mytbl1_log_seq   |          615 |            30 | t
 emaj        | myschema1_mytbl2_log_seq   |          615 |             3 | t
 emaj        | myschema1_mytbl4_log_seq   |          615 |             8 | t
 emajb       | myschema1_mytbl2b_log_seq  |          615 |             1 | f
 emajC       | myschema1_myTbl3_log_seq   |          615 |            10 | t
 myschema1   | myTbl3_col31_seq           |          615 |            20 | t
 emaj        | myschema1_mytbl1_log_seq   |          616 |            30 | t
 emaj        | myschema1_mytbl2_log_seq   |          616 |             3 | t
 emaj        | myschema1_mytbl4_log_seq   |          616 |             8 | t
 emajb       | myschema1_mytbl2b_log_seq  |          616 |             1 | f
 emajC       | myschema1_myTbl3_log_seq   |          616 |            20 | t
 myschema1   | myTbl3_col31_seq           |          616 |            20 | t
 emaj        | myschema1_mytbl1_log_seq   |          622 |            32 | t
 emaj        | myschema1_mytbl2_log_seq   |          622 |             3 | t
 emaj        | myschema1_mytbl4_log_seq   |          622 |            12 | t
 emajb       | myschema1_mytbl2b_log_seq  |          622 |             1 | f
 emajC       | myschema1_myTbl3_log_seq   |          622 |            20 | t
 myschema1   | myTbl3_col31_seq           |          622 |            20 | t
 emaj        | myschema1_mytbl1_log_seq   |          624 |            33 | t
 emaj        | myschema1_mytbl2_log_seq   |          624 |             3 | t
 emaj        | myschema1_mytbl4_log_seq   |          624 |            14 | t
 emaj        | myschema2_mytbl1_log_seq   |          624 |            15 | t
 emaj        | myschema2_mytbl2_log_seq   |          624 |             2 | t
 emaj        | myschema2_mytbl4_log_seq   |          624 |            10 | t
 emaj        | myschema2_mytbl6_log_seq   |          624 |            23 | t
 emaj        | otherPrefix4mytbl5_log_seq |          624 |             7 | t
 emajb       | myschema1_mytbl2b_log_seq  |          624 |             1 | f
 emajC       | myschema1_myTbl3_log_seq   |          624 |            45 | t
 emajC       | myschema2_myTbl3_log_seq   |          624 |            10 | t
 myschema1   | myTbl3_col31_seq           |          624 |            20 | t
 myschema2   | myseq1                     |          624 |          1004 | f
 myschema2   | myTbl3_col31_seq           |          624 |            20 | t
 emaj        | myschema1_mytbl1_log_seq   |          631 |            33 | t
 emaj        | myschema1_mytbl2_log_seq   |          631 |             3 | t
 emaj        | myschema1_mytbl4_log_seq   |          631 |            14 | t
 emaj        | myschema2_mytbl1_log_seq   |          631 |            15 | t
 emaj        | myschema2_mytbl2_log_seq   |          631 |             2 | t
 emaj        | myschema2_mytbl4_log_seq   |          631 |            10 | t
 emaj        | myschema2_mytbl6_log_seq   |          631 |            23 | t
 emaj        | otherPrefix4mytbl5_log_seq |          631 |             7 | t
 emajb       | myschema1_mytbl2b_log_seq  |          631 |             1 | f
 emajC       | myschema1_myTbl3_log_seq   |          631 |            45 | t
 emajC       | myschema2_myTbl3_log_seq   |          631 |            10 | t
 myschema1   | myTbl3_col31_seq           |          631 |            20 | t
 myschema2   | myseq1                     |          631 |          1004 | f
 myschema2   | myTbl3_col31_seq           |          631 |            20 | t
 emaj        | myschema1_mytbl1_log_seq   |          632 |            33 | t
 emaj        | myschema1_mytbl2_log_seq   |          632 |             3 | t
 emaj        | myschema1_mytbl4_log_seq   |          632 |            14 | t
 emaj        | myschema2_mytbl1_log_seq   |          632 |            15 | t
 emaj        | myschema2_mytbl2_log_seq   |          632 |             2 | t
 emaj        | myschema2_mytbl4_log_seq   |          632 |            10 | t
 emaj        | myschema2_mytbl6_log_seq   |          632 |            23 | t
 emaj        | otherPrefix4mytbl5_log_seq |          632 |             7 | t
 emajb       | myschema1_mytbl2b_log_seq  |          632 |             1 | f
 emajC       | myschema1_myTbl3_log_seq   |          632 |            45 | t
 emajC       | myschema2_myTbl3_log_seq   |          632 |            10 | t
 myschema1   | myTbl3_col31_seq           |          632 |            20 | t
 myschema2   | myseq1                     |          632 |          1004 | f
 myschema2   | myTbl3_col31_seq           |          632 |            20 | t
(68 rows)

select sqhl_schema, sqhl_table, sqhl_begin_time_id, sqhl_end_time_id, sqhl_hole_size from emaj.emaj_seq_hole order by 1,2,3;
 sqhl_schema | sqhl_table | sqhl_begin_time_id | sqhl_end_time_id | sqhl_hole_size 
-------------+------------+--------------------+------------------+----------------
 myschema1   | mytbl1     |                616 |              621 |              1
 myschema1   | mytbl4     |                616 |              621 |              2
 myschema2   | mytbl4     |                609 |              620 |              6
 myschema2   | mytbl5     |                609 |              620 |              3
 myschema2   | mytbl6     |                609 |              620 |              9
(5 rows)

-- log tables
select col11, col12, col13, emaj_verb, emaj_tuple, emaj_gid from emaj.mySchema1_myTbl1_log order by emaj_gid, emaj_tuple desc;
 col11 |   col12    | col13 | emaj_verb | emaj_tuple | emaj_gid 
-------+------------+-------+-----------+------------+----------
     1 | Step 6     | \x01  | INS       | NEW        |   100131
     1 | Step 6     | \x01  | DEL       | OLD        |   100154
(2 rows)

select col21, col22, col23, emaj_verb, emaj_tuple, emaj_gid from emaj.mySchema1_myTbl2_log order by emaj_gid, emaj_tuple desc;
 col21 | col22 | col23 | emaj_verb | emaj_tuple | emaj_gid 
-------+-------+-------+-----------+------------+----------
(0 rows)

select col20, col21, emaj_verb, emaj_tuple, emaj_gid from emajb.mySchema1_myTbl2b_log order by emaj_gid, emaj_tuple desc;
 col20 | col21 | emaj_verb | emaj_tuple | emaj_gid 
-------+-------+-----------+------------+----------
(0 rows)

select col31, col33, emaj_verb, emaj_tuple, emaj_gid from "emajC"."myschema1_myTbl3_log" order by emaj_gid, emaj_tuple desc;
 col31 | col33 | emaj_verb | emaj_tuple | emaj_gid 
-------+-------+-----------+------------+----------
    11 | 10.00 | UPD       | OLD        |   100112
    11 |  5.00 | UPD       | NEW        |   100112
    12 | 10.00 | UPD       | OLD        |   100113
    12 |  5.00 | UPD       | NEW        |   100113
    13 | 10.00 | UPD       | OLD        |   100114
    13 |  5.00 | UPD       | NEW        |   100114
    14 | 10.00 | UPD       | OLD        |   100115
    14 |  5.00 | UPD       | NEW        |   100115
    15 | 10.00 | UPD       | OLD        |   100116
    15 |  5.00 | UPD       | NEW        |   100116
    16 | 10.00 | UPD       | OLD        |   100117
    16 |  5.00 | UPD       | NEW        |   100117
    17 | 10.00 | UPD       | OLD        |   100118
    17 |  5.00 | UPD       | NEW        |   100118
    18 | 10.00 | UPD       | OLD        |   100119
    18 |  5.00 | UPD       | NEW        |   100119
    19 | 10.00 | UPD       | OLD        |   100120
    19 |  5.00 | UPD       | NEW        |   100120
    20 | 10.00 | UPD       | OLD        |   100121
    20 |  5.00 | UPD       | NEW        |   100121
    14 |  5.00 | DEL       | OLD        |   100134
    18 |  5.00 | DEL       | OLD        |   100135
    20 |  5.00 | DEL       | OLD        |   100136
    12 |  5.00 | DEL       | OLD        |   100137
    13 |  5.00 | DEL       | OLD        |   100138
    17 |  5.00 | DEL       | OLD        |   100139
    19 |  5.00 | DEL       | OLD        |   100140
    15 |  5.00 | DEL       | OLD        |   100141
    16 |  5.00 | DEL       | OLD        |   100142
    11 |  5.00 | DEL       | OLD        |   100143
    14 | 10.00 | INS       | NEW        |   100144
    18 | 10.00 | INS       | NEW        |   100145
    20 | 10.00 | INS       | NEW        |   100146
    12 | 10.00 | INS       | NEW        |   100147
    13 | 10.00 | INS       | NEW        |   100148
    17 | 10.00 | INS       | NEW        |   100149
    19 | 10.00 | INS       | NEW        |   100150
    15 | 10.00 | INS       | NEW        |   100151
    16 | 10.00 | INS       | NEW        |   100152
    11 | 10.00 | INS       | NEW        |   100153
    14 | 10.00 | DEL       | OLD        |   100157
    15 | 10.00 | DEL       | OLD        |   100158
    16 | 10.00 | DEL       | OLD        |   100159
    17 | 10.00 | DEL       | OLD        |   100160
    18 | 10.00 | DEL       | OLD        |   100161
(45 rows)

select col41, col42, col43, col44, col45, emaj_verb, emaj_tuple, emaj_gid from emaj.mySchema1_myTbl4_log order by emaj_gid, emaj_tuple desc;
 col41 | col42 | col43 | col44 |   col45    | emaj_verb | emaj_tuple | emaj_gid 
-------+-------+-------+-------+------------+-----------+------------+----------
    11 |       |     1 |     1 | Step 6     | INS       | NEW        |   100132
    12 |       |     1 |     1 | Step 6     | INS       | NEW        |   100133
    12 |       |     1 |     1 | Step 6     | DEL       | OLD        |   100155
    11 |       |     1 |     1 | Step 6     | DEL       | OLD        |   100156
(4 rows)

select col11, col12, col13, emaj_verb, emaj_tuple, emaj_gid from emaj.mySchema2_myTbl1_log order by emaj_gid, emaj_tuple desc;
 col11 | col12 | col13 | emaj_verb | emaj_tuple | emaj_gid 
-------+-------+-------+-----------+------------+----------
(0 rows)

select col21, col22, col23, emaj_verb, emaj_tuple, emaj_gid from emaj.mySchema2_myTbl2_log order by emaj_gid, emaj_tuple desc;
 col21 | col22 | col23 | emaj_verb | emaj_tuple | emaj_gid 
-------+-------+-------+-----------+------------+----------
(0 rows)

select col31, col33, emaj_verb, emaj_tuple, emaj_gid from "emajC"."myschema2_myTbl3_log" order by emaj_gid, emaj_tuple desc;
 col31 | col33 | emaj_verb | emaj_tuple | emaj_gid 
-------+-------+-----------+------------+----------
(0 rows)

select col41, col42, col43, col44, col45, emaj_verb, emaj_tuple, emaj_gid from emaj.mySchema2_myTbl4_log order by emaj_gid, emaj_tuple desc;
 col41 | col42 | col43 | col44 | col45 | emaj_verb | emaj_tuple | emaj_gid 
-------+-------+-------+-------+-------+-----------+------------+----------
(0 rows)

select col51, col52, col53, col54, emaj_verb, emaj_tuple, emaj_gid from emaj."otherPrefix4mytbl5_log" order by emaj_gid, emaj_tuple desc;
 col51 | col52 | col53 | col54 | emaj_verb | emaj_tuple | emaj_gid 
-------+-------+-------+-------+-----------+------------+----------
(0 rows)

select col61, col62, col63, col64, col65, col66, emaj_verb, emaj_tuple, emaj_gid from emaj.mySchema2_myTbl6_log order by emaj_gid, emaj_tuple desc;
 col61 | col62 | col63 | col64 | col65 | col66 | emaj_verb | emaj_tuple | emaj_gid 
-------+-------+-------+-------+-------+-------+-----------+------------+----------
(0 rows)

-----------------------------
-- Step 9 : test the emaj_alter_group function with non rollbackable phil's group#3, group
-----------------------------
select emaj.emaj_create_group('phil''s group#3",',false);
NOTICE:  table "phil's schema3_myTbl2\_log" does not exist, skipping
CONTEXT:  SQL statement "DROP TABLE IF EXISTS emaj."phil's schema3_myTbl2\_log""
PL/pgSQL function emaj._create_tbl(emaj.emaj_group_def,text,boolean,text) line 69 at EXECUTE
SQL statement "SELECT emaj._create_tbl(r_grpdef, v_groupName, v_isRollbackable, v_defTsp)"
PL/pgSQL function emaj.emaj_create_group(text,boolean) line 68 at PERFORM
NOTICE:  trigger "emaj_log_trg" for relation "phil's schema3.myTbl2\" does not exist, skipping
CONTEXT:  SQL statement "DROP TRIGGER IF EXISTS emaj_log_trg ON "phil's schema3"."myTbl2\""
PL/pgSQL function emaj._create_tbl(emaj.emaj_group_def,text,boolean,text) line 123 at EXECUTE
SQL statement "SELECT emaj._create_tbl(r_grpdef, v_groupName, v_isRollbackable, v_defTsp)"
PL/pgSQL function emaj.emaj_create_group(text,boolean) line 68 at PERFORM
NOTICE:  trigger "emaj_trunc_trg" for relation "phil's schema3.myTbl2\" does not exist, skipping
CONTEXT:  SQL statement "DROP TRIGGER IF EXISTS emaj_trunc_trg ON "phil's schema3"."myTbl2\""
PL/pgSQL function emaj._create_tbl(emaj.emaj_group_def,text,boolean,text) line 130 at EXECUTE
SQL statement "SELECT emaj._create_tbl(r_grpdef, v_groupName, v_isRollbackable, v_defTsp)"
PL/pgSQL function emaj.emaj_create_group(text,boolean) line 68 at PERFORM
NOTICE:  table "phil's schema3_phil's tbl1_log" does not exist, skipping
CONTEXT:  SQL statement "DROP TABLE IF EXISTS "emaj #'3"."phil's schema3_phil's tbl1_log""
PL/pgSQL function emaj._create_tbl(emaj.emaj_group_def,text,boolean,text) line 69 at EXECUTE
SQL statement "SELECT emaj._create_tbl(r_grpdef, v_groupName, v_isRollbackable, v_defTsp)"
PL/pgSQL function emaj.emaj_create_group(text,boolean) line 68 at PERFORM
NOTICE:  trigger "emaj_log_trg" for relation "phil's schema3.phil's tbl1" does not exist, skipping
CONTEXT:  SQL statement "DROP TRIGGER IF EXISTS emaj_log_trg ON "phil's schema3"."phil's tbl1""
PL/pgSQL function emaj._create_tbl(emaj.emaj_group_def,text,boolean,text) line 123 at EXECUTE
SQL statement "SELECT emaj._create_tbl(r_grpdef, v_groupName, v_isRollbackable, v_defTsp)"
PL/pgSQL function emaj.emaj_create_group(text,boolean) line 68 at PERFORM
NOTICE:  trigger "emaj_trunc_trg" for relation "phil's schema3.phil's tbl1" does not exist, skipping
CONTEXT:  SQL statement "DROP TRIGGER IF EXISTS emaj_trunc_trg ON "phil's schema3"."phil's tbl1""
PL/pgSQL function emaj._create_tbl(emaj.emaj_group_def,text,boolean,text) line 130 at EXECUTE
SQL statement "SELECT emaj._create_tbl(r_grpdef, v_groupName, v_isRollbackable, v_defTsp)"
PL/pgSQL function emaj.emaj_create_group(text,boolean) line 68 at PERFORM
 emaj_create_group 
-------------------
                 4
(1 row)

-- disable event triggers for this step to allow an application table structure change
select emaj.emaj_disable_protection_by_event_triggers();
 emaj_disable_protection_by_event_triggers 
-------------------------------------------
                                         3
(1 row)

reset role;
alter table "phil's schema3"."phil's tbl1" alter column "phil's col12" type char(11);
set role emaj_regression_tests_adm_user;
update emaj.emaj_group_def set grpdef_priority = 1 where grpdef_schema = 'phil''s schema3' and grpdef_tblseq = E'myTbl2\\';
select emaj.emaj_alter_group('phil''s group#3",');
NOTICE:  table "phil's schema3_phil's tbl1_log" does not exist, skipping
CONTEXT:  SQL statement "DROP TABLE IF EXISTS "emaj #'3"."phil's schema3_phil's tbl1_log""
PL/pgSQL function emaj._create_tbl(emaj.emaj_group_def,text,boolean,text) line 69 at EXECUTE
SQL statement "SELECT emaj._create_tbl(r_grpdef, v_groupName, v_isRollbackable, v_defTsp)"
PL/pgSQL function emaj.emaj_alter_group(text) line 196 at PERFORM
NOTICE:  trigger "emaj_log_trg" for relation "phil's schema3.phil's tbl1" does not exist, skipping
CONTEXT:  SQL statement "DROP TRIGGER IF EXISTS emaj_log_trg ON "phil's schema3"."phil's tbl1""
PL/pgSQL function emaj._create_tbl(emaj.emaj_group_def,text,boolean,text) line 123 at EXECUTE
SQL statement "SELECT emaj._create_tbl(r_grpdef, v_groupName, v_isRollbackable, v_defTsp)"
PL/pgSQL function emaj.emaj_alter_group(text) line 196 at PERFORM
NOTICE:  trigger "emaj_trunc_trg" for relation "phil's schema3.phil's tbl1" does not exist, skipping
CONTEXT:  SQL statement "DROP TRIGGER IF EXISTS emaj_trunc_trg ON "phil's schema3"."phil's tbl1""
PL/pgSQL function emaj._create_tbl(emaj.emaj_group_def,text,boolean,text) line 130 at EXECUTE
SQL statement "SELECT emaj._create_tbl(r_grpdef, v_groupName, v_isRollbackable, v_defTsp)"
PL/pgSQL function emaj.emaj_alter_group(text) line 196 at PERFORM
 emaj_alter_group 
------------------
                4
(1 row)

select emaj.emaj_start_group('phil''s group#3",','M1_after_alter_group');
 emaj_start_group 
------------------
                4
(1 row)

select emaj.emaj_stop_group('phil''s group#3",');
 emaj_stop_group 
-----------------
               4
(1 row)

reset role;
alter table "phil's schema3"."phil's tbl1" alter column "phil's col12" type char(10);
set role emaj_regression_tests_adm_user;
update emaj.emaj_group_def set grpdef_priority = NULL where grpdef_schema = 'phil''s schema3' and grpdef_tblseq = E'myTbl2\\';
select emaj.emaj_alter_group('phil''s group#3",');
NOTICE:  table "phil's schema3_phil's tbl1_log" does not exist, skipping
CONTEXT:  SQL statement "DROP TABLE IF EXISTS "emaj #'3"."phil's schema3_phil's tbl1_log""
PL/pgSQL function emaj._create_tbl(emaj.emaj_group_def,text,boolean,text) line 69 at EXECUTE
SQL statement "SELECT emaj._create_tbl(r_grpdef, v_groupName, v_isRollbackable, v_defTsp)"
PL/pgSQL function emaj.emaj_alter_group(text) line 196 at PERFORM
NOTICE:  trigger "emaj_log_trg" for relation "phil's schema3.phil's tbl1" does not exist, skipping
CONTEXT:  SQL statement "DROP TRIGGER IF EXISTS emaj_log_trg ON "phil's schema3"."phil's tbl1""
PL/pgSQL function emaj._create_tbl(emaj.emaj_group_def,text,boolean,text) line 123 at EXECUTE
SQL statement "SELECT emaj._create_tbl(r_grpdef, v_groupName, v_isRollbackable, v_defTsp)"
PL/pgSQL function emaj.emaj_alter_group(text) line 196 at PERFORM
NOTICE:  trigger "emaj_trunc_trg" for relation "phil's schema3.phil's tbl1" does not exist, skipping
CONTEXT:  SQL statement "DROP TRIGGER IF EXISTS emaj_trunc_trg ON "phil's schema3"."phil's tbl1""
PL/pgSQL function emaj._create_tbl(emaj.emaj_group_def,text,boolean,text) line 130 at EXECUTE
SQL statement "SELECT emaj._create_tbl(r_grpdef, v_groupName, v_isRollbackable, v_defTsp)"
PL/pgSQL function emaj.emaj_alter_group(text) line 196 at PERFORM
 emaj_alter_group 
------------------
                4
(1 row)

select emaj.emaj_drop_group('phil''s group#3",');
 emaj_drop_group 
-----------------
               4
(1 row)

select emaj.emaj_enable_protection_by_event_triggers();
 emaj_enable_protection_by_event_triggers 
------------------------------------------
                                        3
(1 row)

-----------------------------
-- Step 10 : for phil''s group#3", recreate the group as rollbackable, update tables, 
--           rename a mark, then delete 2 marks then delete all before a mark 
-----------------------------
-- prepare phil's group#3, group
--
reset role;
alter table "phil's schema3"."myTbl2\" add primary key (col21);
set role emaj_regression_tests_adm_user;
select emaj.emaj_create_group('phil''s group#3",',true);
NOTICE:  table "phil's schema3_myTbl2\_log" does not exist, skipping
CONTEXT:  SQL statement "DROP TABLE IF EXISTS emaj."phil's schema3_myTbl2\_log""
PL/pgSQL function emaj._create_tbl(emaj.emaj_group_def,text,boolean,text) line 69 at EXECUTE
SQL statement "SELECT emaj._create_tbl(r_grpdef, v_groupName, v_isRollbackable, v_defTsp)"
PL/pgSQL function emaj.emaj_create_group(text,boolean) line 68 at PERFORM
NOTICE:  trigger "emaj_log_trg" for relation "phil's schema3.myTbl2\" does not exist, skipping
CONTEXT:  SQL statement "DROP TRIGGER IF EXISTS emaj_log_trg ON "phil's schema3"."myTbl2\""
PL/pgSQL function emaj._create_tbl(emaj.emaj_group_def,text,boolean,text) line 123 at EXECUTE
SQL statement "SELECT emaj._create_tbl(r_grpdef, v_groupName, v_isRollbackable, v_defTsp)"
PL/pgSQL function emaj.emaj_create_group(text,boolean) line 68 at PERFORM
NOTICE:  trigger "emaj_trunc_trg" for relation "phil's schema3.myTbl2\" does not exist, skipping
CONTEXT:  SQL statement "DROP TRIGGER IF EXISTS emaj_trunc_trg ON "phil's schema3"."myTbl2\""
PL/pgSQL function emaj._create_tbl(emaj.emaj_group_def,text,boolean,text) line 130 at EXECUTE
SQL statement "SELECT emaj._create_tbl(r_grpdef, v_groupName, v_isRollbackable, v_defTsp)"
PL/pgSQL function emaj.emaj_create_group(text,boolean) line 68 at PERFORM
NOTICE:  table "phil's schema3_phil's tbl1_log" does not exist, skipping
CONTEXT:  SQL statement "DROP TABLE IF EXISTS "emaj #'3"."phil's schema3_phil's tbl1_log""
PL/pgSQL function emaj._create_tbl(emaj.emaj_group_def,text,boolean,text) line 69 at EXECUTE
SQL statement "SELECT emaj._create_tbl(r_grpdef, v_groupName, v_isRollbackable, v_defTsp)"
PL/pgSQL function emaj.emaj_create_group(text,boolean) line 68 at PERFORM
NOTICE:  trigger "emaj_log_trg" for relation "phil's schema3.phil's tbl1" does not exist, skipping
CONTEXT:  SQL statement "DROP TRIGGER IF EXISTS emaj_log_trg ON "phil's schema3"."phil's tbl1""
PL/pgSQL function emaj._create_tbl(emaj.emaj_group_def,text,boolean,text) line 123 at EXECUTE
SQL statement "SELECT emaj._create_tbl(r_grpdef, v_groupName, v_isRollbackable, v_defTsp)"
PL/pgSQL function emaj.emaj_create_group(text,boolean) line 68 at PERFORM
NOTICE:  trigger "emaj_trunc_trg" for relation "phil's schema3.phil's tbl1" does not exist, skipping
CONTEXT:  SQL statement "DROP TRIGGER IF EXISTS emaj_trunc_trg ON "phil's schema3"."phil's tbl1""
PL/pgSQL function emaj._create_tbl(emaj.emaj_group_def,text,boolean,text) line 130 at EXECUTE
SQL statement "SELECT emaj._create_tbl(r_grpdef, v_groupName, v_isRollbackable, v_defTsp)"
PL/pgSQL function emaj.emaj_create_group(text,boolean) line 68 at PERFORM
WARNING:  _check_fk_groups: Foreign key "mytbl2_col21_fkey", from table "phil's schema3.myTbl2\", references "phil's schema3.mytbl4" that is outside groups (phil's group#3",).
CONTEXT:  SQL statement "SELECT emaj._check_fk_groups (array[v_groupName])"
PL/pgSQL function emaj.emaj_create_group(text,boolean) line 88 at PERFORM
WARNING:  _check_fk_groups: table "phil's schema3.phil's tbl1" is referenced by foreign key "mytbl4_col44_fkey" from table "phil's schema3.mytbl4" that is outside groups (phil's group#3",).
CONTEXT:  SQL statement "SELECT emaj._check_fk_groups (array[v_groupName])"
PL/pgSQL function emaj.emaj_create_group(text,boolean) line 88 at PERFORM
 emaj_create_group 
-------------------
                 4
(1 row)

select emaj.emaj_start_group('phil''s group#3",','M1_rollbackable');
WARNING:  _check_fk_groups: Foreign key "mytbl2_col21_fkey", from table "phil's schema3.myTbl2\", references "phil's schema3.mytbl4" that is outside groups (phil's group#3",).
CONTEXT:  SQL statement "SELECT emaj._check_fk_groups(v_groupNames)"
PL/pgSQL function emaj._start_groups(text[],text,boolean,boolean) line 36 at PERFORM
SQL statement "SELECT emaj._start_groups(array[v_groupName], v_mark, false, v_resetLog)"
PL/pgSQL function emaj.emaj_start_group(text,text,boolean) line 17 at SQL statement
WARNING:  _check_fk_groups: table "phil's schema3.phil's tbl1" is referenced by foreign key "mytbl4_col44_fkey" from table "phil's schema3.mytbl4" that is outside groups (phil's group#3",).
CONTEXT:  SQL statement "SELECT emaj._check_fk_groups(v_groupNames)"
PL/pgSQL function emaj._start_groups(text[],text,boolean,boolean) line 36 at PERFORM
SQL statement "SELECT emaj._start_groups(array[v_groupName], v_mark, false, v_resetLog)"
PL/pgSQL function emaj.emaj_start_group(text,text,boolean) line 17 at SQL statement
 emaj_start_group 
------------------
                4
(1 row)

--
set search_path=public,"phil's schema3";
--
insert into "phil's tbl1" select i, 'AB''C', E'\\014'::bytea from generate_series (1,31) as i;
update "phil's tbl1" set "phil\s col13" = E'\\034'::bytea where "phil's col11" <= 3;
update "phil's tbl1" set "phil\s col13" = E'\\034'''::bytea where "phil's col11" between 18 and 22;
insert into myTbl4 (col41) values (1);
insert into myTbl4 (col41) values (2);
insert into "myTbl2\" values (1,'ABC','2010-12-31');
delete from "phil's tbl1" where "phil's col11" > 20;
insert into "myTbl2\" values (2,'DEF',NULL);
select nextval(E'"phil''s schema3"."phil''s seq\\1"');
 nextval 
---------
    1000
(1 row)

--
select emaj.emaj_set_mark_group('phil''s group#3",','M2_rollbackable');
 emaj_set_mark_group 
---------------------
                   4
(1 row)

select emaj.emaj_set_mark_group('phil''s group#3",','M2_again!');
 emaj_set_mark_group 
---------------------
                   4
(1 row)

--
delete from "phil's tbl1" where "phil's col11" = 10;
update "phil's tbl1" set "phil's col12" = 'DEF' where "phil's col11" <= 2;
select nextval(E'"phil''s schema3"."phil''s seq\\1"');
 nextval 
---------
    1001
(1 row)

--
select emaj.emaj_set_mark_groups(array['phil''s group#3",'],'phil''s mark #1');
 emaj_set_mark_groups 
----------------------
                    4
(1 row)

select emaj.emaj_comment_mark_group('phil''s group#3",','phil''s mark #1','Third mark set');
 emaj_comment_mark_group 
-------------------------
 
(1 row)

--
select emaj.emaj_rename_mark_group('phil''s group#3",','phil''s mark #1','phil''s mark #3');
 emaj_rename_mark_group 
------------------------
 
(1 row)

-- 
select emaj.emaj_delete_mark_group('phil''s group#3",','M2_again!');
 emaj_delete_mark_group 
------------------------
                      1
(1 row)

--
select * from emaj.emaj_log_stat_group('phil''s group#3",','','');
    stat_group    |  stat_schema   | stat_table  | stat_rows 
------------------+----------------+-------------+-----------
 phil's group#3", | phil's schema3 | myTbl2\     |         2
 phil's group#3", | phil's schema3 | phil's tbl1 |        53
(2 rows)

select * from emaj.emaj_detailed_log_stat_group('phil''s group#3",','phil''s mark #3','');
 stat_group | stat_schema | stat_table | stat_role | stat_verb | stat_rows 
------------+-------------+------------+-----------+-----------+-----------
(0 rows)

--
select emaj.emaj_logged_rollback_group('phil''s group#3",','phil''s mark #3');
WARNING:  _check_fk_groups: Foreign key "mytbl2_col21_fkey", from table "phil's schema3.myTbl2\", references "phil's schema3.mytbl4" that is outside groups (phil's group#3",).
CONTEXT:  SQL statement "SELECT emaj._check_fk_groups(v_groupNames)"
PL/pgSQL function emaj._rlbk_init(text[],text,boolean,integer,boolean) line 68 at PERFORM
SQL statement "SELECT emaj._rlbk_init(v_groupNames, v_mark, v_isLoggedRlbk, 1, v_multiGroup)"
PL/pgSQL function emaj._rlbk_groups(text[],text,boolean,boolean) line 20 at SQL statement
PL/pgSQL function emaj.emaj_logged_rollback_group(text,text) line 11 at RETURN
WARNING:  _check_fk_groups: table "phil's schema3.phil's tbl1" is referenced by foreign key "mytbl4_col44_fkey" from table "phil's schema3.mytbl4" that is outside groups (phil's group#3",).
CONTEXT:  SQL statement "SELECT emaj._check_fk_groups(v_groupNames)"
PL/pgSQL function emaj._rlbk_init(text[],text,boolean,integer,boolean) line 68 at PERFORM
SQL statement "SELECT emaj._rlbk_init(v_groupNames, v_mark, v_isLoggedRlbk, 1, v_multiGroup)"
PL/pgSQL function emaj._rlbk_groups(text[],text,boolean,boolean) line 20 at SQL statement
PL/pgSQL function emaj.emaj_logged_rollback_group(text,text) line 11 at RETURN
 emaj_logged_rollback_group 
----------------------------
                          2
(1 row)

select emaj.emaj_rollback_group('phil''s group#3",','phil''s mark #3');
WARNING:  _check_fk_groups: Foreign key "mytbl2_col21_fkey", from table "phil's schema3.myTbl2\", references "phil's schema3.mytbl4" that is outside groups (phil's group#3",).
CONTEXT:  SQL statement "SELECT emaj._check_fk_groups(v_groupNames)"
PL/pgSQL function emaj._rlbk_init(text[],text,boolean,integer,boolean) line 68 at PERFORM
SQL statement "SELECT emaj._rlbk_init(v_groupNames, v_mark, v_isLoggedRlbk, 1, v_multiGroup)"
PL/pgSQL function emaj._rlbk_groups(text[],text,boolean,boolean) line 20 at SQL statement
PL/pgSQL function emaj.emaj_rollback_group(text,text) line 7 at RETURN
WARNING:  _check_fk_groups: table "phil's schema3.phil's tbl1" is referenced by foreign key "mytbl4_col44_fkey" from table "phil's schema3.mytbl4" that is outside groups (phil's group#3",).
CONTEXT:  SQL statement "SELECT emaj._check_fk_groups(v_groupNames)"
PL/pgSQL function emaj._rlbk_init(text[],text,boolean,integer,boolean) line 68 at PERFORM
SQL statement "SELECT emaj._rlbk_init(v_groupNames, v_mark, v_isLoggedRlbk, 1, v_multiGroup)"
PL/pgSQL function emaj._rlbk_groups(text[],text,boolean,boolean) line 20 at SQL statement
PL/pgSQL function emaj.emaj_rollback_group(text,text) line 7 at RETURN
 emaj_rollback_group 
---------------------
                   2
(1 row)

-----------------------------
-- Checking step 10
-----------------------------
-- emaj tables
select mark_id, mark_group, regexp_replace(mark_name,E'\\d\\d\.\\d\\d\\.\\d\\d\\.\\d\\d\\d','%','g'), mark_time_id, mark_is_deleted, mark_is_rlbk_protected, mark_comment, mark_log_rows_before_next, mark_logged_rlbk_target_mark from emaj.emaj_mark order by mark_id;
 mark_id |    mark_group    |        regexp_replace        | mark_time_id | mark_is_deleted | mark_is_rlbk_protected |     mark_comment     | mark_log_rows_before_next | mark_logged_rlbk_target_mark 
---------+------------------+------------------------------+--------------+-----------------+------------------------+----------------------+---------------------------+------------------------------
     607 | myGroup2         | M3                           |          609 | t               | f                      | This mark is deleted |                         0 | 
     612 | myGroup1         | M4                           |          615 | t               | f                      |                      |                        10 | 
     613 | myGroup1         | M5                           |          616 | t               | f                      |                      |                         3 | 
     617 | myGroup1         | Before logged rollback to M4 |          622 | t               | f                      |                      |                        28 | 
     619 | myGroup1         | STOP_%                       |          624 | t               | f                      |                      |                         0 | 
     620 | myGroup2         | STOP_%                       |          624 | t               | f                      |                      |                         0 | 
     629 | myGroup1         | Stop after rollback          |          631 | t               | f                      |                      |                         0 | 
     630 | myGroup2         | Stop after rollback          |          631 | t               | f                      |                      |                         0 | 
     631 | myGroup1         | Multi-1                      |          632 | f               | f                      |                      |                           | 
     632 | myGroup2         | Multi-1                      |          632 | f               | f                      |                      |                           | 
     637 | phil's group#3", | M1_rollbackable              |          641 | f               | f                      |                      |                        52 | 
     638 | phil's group#3", | M2_rollbackable              |          642 | f               | f                      |                      |                         3 | 
     640 | phil's group#3", | phil's mark #3               |          644 | f               | f                      | Third mark set       |                           | 
(13 rows)

select sequ_schema, sequ_name, sequ_time_id, sequ_last_val, sequ_is_called from emaj.emaj_sequence order by sequ_time_id, sequ_schema, sequ_name;
  sequ_schema   |             sequ_name              | sequ_time_id | sequ_last_val | sequ_is_called 
----------------+------------------------------------+--------------+---------------+----------------
 emaj           | myschema2_mytbl1_log_seq           |          609 |            15 | t
 emaj           | myschema2_mytbl2_log_seq           |          609 |             2 | t
 emaj           | myschema2_mytbl4_log_seq           |          609 |             4 | t
 emaj           | myschema2_mytbl6_log_seq           |          609 |            14 | t
 emaj           | otherPrefix4mytbl5_log_seq         |          609 |             4 | t
 emajC          | myschema2_myTbl3_log_seq           |          609 |            10 | t
 myschema2      | myseq1                             |          609 |          1003 | t
 myschema2      | myTbl3_col31_seq                   |          609 |            20 | t
 emaj           | myschema1_mytbl1_log_seq           |          615 |            30 | t
 emaj           | myschema1_mytbl2_log_seq           |          615 |             3 | t
 emaj           | myschema1_mytbl4_log_seq           |          615 |             8 | t
 emajb          | myschema1_mytbl2b_log_seq          |          615 |             1 | f
 emajC          | myschema1_myTbl3_log_seq           |          615 |            10 | t
 myschema1      | myTbl3_col31_seq                   |          615 |            20 | t
 emaj           | myschema1_mytbl1_log_seq           |          616 |            30 | t
 emaj           | myschema1_mytbl2_log_seq           |          616 |             3 | t
 emaj           | myschema1_mytbl4_log_seq           |          616 |             8 | t
 emajb          | myschema1_mytbl2b_log_seq          |          616 |             1 | f
 emajC          | myschema1_myTbl3_log_seq           |          616 |            20 | t
 myschema1      | myTbl3_col31_seq                   |          616 |            20 | t
 emaj           | myschema1_mytbl1_log_seq           |          622 |            32 | t
 emaj           | myschema1_mytbl2_log_seq           |          622 |             3 | t
 emaj           | myschema1_mytbl4_log_seq           |          622 |            12 | t
 emajb          | myschema1_mytbl2b_log_seq          |          622 |             1 | f
 emajC          | myschema1_myTbl3_log_seq           |          622 |            20 | t
 myschema1      | myTbl3_col31_seq                   |          622 |            20 | t
 emaj           | myschema1_mytbl1_log_seq           |          624 |            33 | t
 emaj           | myschema1_mytbl2_log_seq           |          624 |             3 | t
 emaj           | myschema1_mytbl4_log_seq           |          624 |            14 | t
 emaj           | myschema2_mytbl1_log_seq           |          624 |            15 | t
 emaj           | myschema2_mytbl2_log_seq           |          624 |             2 | t
 emaj           | myschema2_mytbl4_log_seq           |          624 |            10 | t
 emaj           | myschema2_mytbl6_log_seq           |          624 |            23 | t
 emaj           | otherPrefix4mytbl5_log_seq         |          624 |             7 | t
 emajb          | myschema1_mytbl2b_log_seq          |          624 |             1 | f
 emajC          | myschema1_myTbl3_log_seq           |          624 |            45 | t
 emajC          | myschema2_myTbl3_log_seq           |          624 |            10 | t
 myschema1      | myTbl3_col31_seq                   |          624 |            20 | t
 myschema2      | myseq1                             |          624 |          1004 | f
 myschema2      | myTbl3_col31_seq                   |          624 |            20 | t
 emaj           | myschema1_mytbl1_log_seq           |          631 |            33 | t
 emaj           | myschema1_mytbl2_log_seq           |          631 |             3 | t
 emaj           | myschema1_mytbl4_log_seq           |          631 |            14 | t
 emaj           | myschema2_mytbl1_log_seq           |          631 |            15 | t
 emaj           | myschema2_mytbl2_log_seq           |          631 |             2 | t
 emaj           | myschema2_mytbl4_log_seq           |          631 |            10 | t
 emaj           | myschema2_mytbl6_log_seq           |          631 |            23 | t
 emaj           | otherPrefix4mytbl5_log_seq         |          631 |             7 | t
 emajb          | myschema1_mytbl2b_log_seq          |          631 |             1 | f
 emajC          | myschema1_myTbl3_log_seq           |          631 |            45 | t
 emajC          | myschema2_myTbl3_log_seq           |          631 |            10 | t
 myschema1      | myTbl3_col31_seq                   |          631 |            20 | t
 myschema2      | myseq1                             |          631 |          1004 | f
 myschema2      | myTbl3_col31_seq                   |          631 |            20 | t
 emaj           | myschema1_mytbl1_log_seq           |          632 |            33 | t
 emaj           | myschema1_mytbl2_log_seq           |          632 |             3 | t
 emaj           | myschema1_mytbl4_log_seq           |          632 |            14 | t
 emaj           | myschema2_mytbl1_log_seq           |          632 |            15 | t
 emaj           | myschema2_mytbl2_log_seq           |          632 |             2 | t
 emaj           | myschema2_mytbl4_log_seq           |          632 |            10 | t
 emaj           | myschema2_mytbl6_log_seq           |          632 |            23 | t
 emaj           | otherPrefix4mytbl5_log_seq         |          632 |             7 | t
 emajb          | myschema1_mytbl2b_log_seq          |          632 |             1 | f
 emajC          | myschema1_myTbl3_log_seq           |          632 |            45 | t
 emajC          | myschema2_myTbl3_log_seq           |          632 |            10 | t
 myschema1      | myTbl3_col31_seq                   |          632 |            20 | t
 myschema2      | myseq1                             |          632 |          1004 | f
 myschema2      | myTbl3_col31_seq                   |          632 |            20 | t
 emaj           | phil's schema3_myTbl2\_log_seq     |          641 |             1 | f
 emaj #'3       | phil's schema3_phil's tbl1_log_seq |          641 |             1 | f
 phil's schema3 | myTbl2\_col21_seq                  |          641 |             1 | f
 phil's schema3 | phil's seq\1                       |          641 |          1000 | f
 emaj           | phil's schema3_myTbl2\_log_seq     |          642 |             2 | t
 emaj #'3       | phil's schema3_phil's tbl1_log_seq |          642 |            50 | t
 phil's schema3 | myTbl2\_col21_seq                  |          642 |             1 | f
 phil's schema3 | phil's seq\1                       |          642 |          1000 | t
 emaj           | phil's schema3_myTbl2\_log_seq     |          644 |             2 | t
 emaj #'3       | phil's schema3_phil's tbl1_log_seq |          644 |            53 | t
 phil's schema3 | myTbl2\_col21_seq                  |          644 |             1 | f
 phil's schema3 | phil's seq\1                       |          644 |          1001 | t
(80 rows)

select sqhl_schema, sqhl_table, sqhl_begin_time_id, sqhl_end_time_id, sqhl_hole_size from emaj.emaj_seq_hole order by 1,2,3;
 sqhl_schema | sqhl_table | sqhl_begin_time_id | sqhl_end_time_id | sqhl_hole_size 
-------------+------------+--------------------+------------------+----------------
 myschema1   | mytbl1     |                616 |              621 |              1
 myschema1   | mytbl4     |                616 |              621 |              2
 myschema2   | mytbl4     |                609 |              620 |              6
 myschema2   | mytbl5     |                609 |              620 |              3
 myschema2   | mytbl6     |                609 |              620 |              9
(5 rows)

select rlbt_rlbk_id, rlbt_step, rlbt_schema, rlbt_table, rlbt_fkey, rlbt_quantity from emaj.emaj_rlbk_stat
  order by rlbt_rlbk_id, rlbt_step, rlbt_schema, rlbt_table, rlbt_fkey;
 rlbt_rlbk_id |  rlbt_step  | rlbt_schema | rlbt_table |     rlbt_fkey     | rlbt_quantity 
--------------+-------------+-------------+------------+-------------------+---------------
          100 | DROP_FK     |             |            |                   |             1
          100 | SET_FK_DEF  |             |            |                   |             2
          100 | RLBK_TABLE  | myschema2   | mytbl4     |                   |             4
          100 | RLBK_TABLE  | myschema2   | mytbl5     |                   |             1
          100 | RLBK_TABLE  | myschema2   | mytbl6     |                   |             3
          100 | SET_FK_IMM  | myschema2   | mytbl4     | mytbl4_col43_fkey |             4
          100 | SET_FK_IMM  | myschema2   | mytbl6     | mytbl6_col61_fkey |             3
          100 | SET_FK_IMM  | myschema2   | mytbl8     | mytbl8_col81_fkey |             3
          100 | ADD_FK      | myschema2   | mytbl4     | mytbl4_col44_fkey |             2
          100 | CTRL-DBLINK |             |            |                   |            10
          101 | DROP_FK     |             |            |                   |             1
          101 | SET_FK_DEF  |             |            |                   |             2
          101 | RLBK_TABLE  | myschema2   | mytbl4     |                   |             2
          101 | RLBK_TABLE  | myschema2   | mytbl5     |                   |             1
          101 | RLBK_TABLE  | myschema2   | mytbl6     |                   |             3
          101 | SET_FK_IMM  | myschema2   | mytbl4     | mytbl4_col43_fkey |             2
          101 | SET_FK_IMM  | myschema2   | mytbl6     | mytbl6_col61_fkey |             3
          101 | SET_FK_IMM  | myschema2   | mytbl8     | mytbl8_col81_fkey |             3
          101 | ADD_FK      | myschema2   | mytbl4     | mytbl4_col44_fkey |             2
          101 | CTRL-DBLINK |             |            |                   |            10
          102 | DIS_LOG_TRG |             |            |                   |             2
          102 | DROP_FK     |             |            |                   |             1
          102 | SET_FK_DEF  |             |            |                   |             1
          102 | RLBK_TABLE  | myschema1   | mytbl1     |                   |             3
          102 | RLBK_TABLE  | myschema1   | mytbl4     |                   |             8
          102 | DELETE_LOG  | myschema1   | mytbl1     |                   |             3
          102 | DELETE_LOG  | myschema1   | mytbl4     |                   |             8
          102 | SET_FK_IMM  | myschema1   | mytbl4     | mytbl4_col43_fkey |             8
          102 | ADD_FK      | myschema1   | mytbl4     | mytbl4_col44_fkey |             0
          102 | ENA_LOG_TRG |             |            |                   |             2
          102 | CTRL+DBLINK |             |            |                   |            12
          103 | DROP_FK     |             |            |                   |             1
          103 | SET_FK_DEF  |             |            |                   |             2
          103 | RLBK_TABLE  | myschema2   | mytbl4     |                   |             8
          103 | RLBK_TABLE  | myschema2   | mytbl5     |                   |             3
          103 | RLBK_TABLE  | myschema2   | mytbl6     |                   |             9
          103 | SET_FK_IMM  | myschema2   | mytbl4     | mytbl4_col43_fkey |             8
          103 | SET_FK_IMM  | myschema2   | mytbl6     | mytbl6_col61_fkey |             9
          103 | SET_FK_IMM  | myschema2   | mytbl8     | mytbl8_col81_fkey |             9
          103 | ADD_FK      | myschema2   | mytbl4     | mytbl4_col44_fkey |             2
          103 | CTRL+DBLINK |             |            |                   |            10
          104 | DIS_LOG_TRG |             |            |                   |             3
          104 | DROP_FK     |             |            |                   |             1
          104 | SET_FK_DEF  |             |            |                   |             2
          104 | RLBK_TABLE  | myschema2   | mytbl4     |                   |             6
          104 | RLBK_TABLE  | myschema2   | mytbl5     |                   |             3
          104 | RLBK_TABLE  | myschema2   | mytbl6     |                   |             9
          104 | DELETE_LOG  | myschema2   | mytbl4     |                   |             6
          104 | DELETE_LOG  | myschema2   | mytbl5     |                   |             3
          104 | DELETE_LOG  | myschema2   | mytbl6     |                   |             9
          104 | SET_FK_IMM  | myschema2   | mytbl4     | mytbl4_col43_fkey |             6
          104 | SET_FK_IMM  | myschema2   | mytbl6     | mytbl6_col61_fkey |             9
          104 | SET_FK_IMM  | myschema2   | mytbl8     | mytbl8_col81_fkey |             9
          104 | ADD_FK      | myschema2   | mytbl4     | mytbl4_col44_fkey |             2
          104 | ENA_LOG_TRG |             |            |                   |             3
          104 | CTRL+DBLINK |             |            |                   |            19
          105 | DIS_LOG_TRG |             |            |                   |             2
          105 | DROP_FK     |             |            |                   |             1
          105 | SET_FK_DEF  |             |            |                   |             1
          105 | RLBK_TABLE  | myschema1   | mytbl1     |                   |             1
          105 | RLBK_TABLE  | myschema1   | mytbl4     |                   |             2
          105 | DELETE_LOG  | myschema1   | mytbl1     |                   |             1
          105 | DELETE_LOG  | myschema1   | mytbl4     |                   |             2
          105 | SET_FK_IMM  | myschema1   | mytbl4     | mytbl4_col43_fkey |             2
          105 | ADD_FK      | myschema1   | mytbl4     | mytbl4_col44_fkey |             0
          105 | ENA_LOG_TRG |             |            |                   |             2
          105 | CTRL+DBLINK |             |            |                   |            12
          106 | DROP_FK     |             |            |                   |             1
          106 | SET_FK_DEF  |             |            |                   |             1
          106 | RLBK_TABLE  | myschema1   | mytbl1     |                   |             1
          106 | RLBK_TABLE  | myschema1   | myTbl3     |                   |            10
          106 | RLBK_TABLE  | myschema1   | mytbl4     |                   |             2
          106 | SET_FK_IMM  | myschema1   | mytbl4     | mytbl4_col43_fkey |             2
          106 | ADD_FK      | myschema1   | mytbl4     | mytbl4_col44_fkey |             0
          106 | CTRL+DBLINK |             |            |                   |             7
(75 rows)

-- user tables
select * from "phil's schema3"."phil's tbl1" order by "phil's col11","phil's col12";
 phil's col11 | phil's col12 | phil\s col13 
--------------+--------------+--------------
            1 | DEF          | \x1c
            2 | DEF          | \x1c
            3 | AB'C         | \x1c
            4 | AB'C         | \x0c
            5 | AB'C         | \x0c
            6 | AB'C         | \x0c
            7 | AB'C         | \x0c
            8 | AB'C         | \x0c
            9 | AB'C         | \x0c
           11 | AB'C         | \x0c
           12 | AB'C         | \x0c
           13 | AB'C         | \x0c
           14 | AB'C         | \x0c
           15 | AB'C         | \x0c
           16 | AB'C         | \x0c
           17 | AB'C         | \x0c
           18 | AB'C         | \x1c27
           19 | AB'C         | \x1c27
           20 | AB'C         | \x1c27
(19 rows)

select * from "phil's schema3"."myTbl2\" order by col21;
 col21 | col22 |   col23    
-------+-------+------------
     1 | ABC   | 12-31-2010
     2 | DEF   | 
(2 rows)

-- log tables
select "phil's col11", "phil's col12", "phil\s col13", emaj_verb, emaj_tuple, emaj_gid from "emaj #'3"."phil's schema3_phil's tbl1_log" order by emaj_gid, emaj_tuple desc;
 phil's col11 | phil's col12 | phil\s col13 | emaj_verb | emaj_tuple | emaj_gid 
--------------+--------------+--------------+-----------+------------+----------
            1 | AB'C         | \x0c         | INS       | NEW        |   100162
            2 | AB'C         | \x0c         | INS       | NEW        |   100163
            3 | AB'C         | \x0c         | INS       | NEW        |   100164
            4 | AB'C         | \x0c         | INS       | NEW        |   100165
            5 | AB'C         | \x0c         | INS       | NEW        |   100166
            6 | AB'C         | \x0c         | INS       | NEW        |   100167
            7 | AB'C         | \x0c         | INS       | NEW        |   100168
            8 | AB'C         | \x0c         | INS       | NEW        |   100169
            9 | AB'C         | \x0c         | INS       | NEW        |   100170
           10 | AB'C         | \x0c         | INS       | NEW        |   100171
           11 | AB'C         | \x0c         | INS       | NEW        |   100172
           12 | AB'C         | \x0c         | INS       | NEW        |   100173
           13 | AB'C         | \x0c         | INS       | NEW        |   100174
           14 | AB'C         | \x0c         | INS       | NEW        |   100175
           15 | AB'C         | \x0c         | INS       | NEW        |   100176
           16 | AB'C         | \x0c         | INS       | NEW        |   100177
           17 | AB'C         | \x0c         | INS       | NEW        |   100178
           18 | AB'C         | \x0c         | INS       | NEW        |   100179
           19 | AB'C         | \x0c         | INS       | NEW        |   100180
           20 | AB'C         | \x0c         | INS       | NEW        |   100181
           21 | AB'C         | \x0c         | INS       | NEW        |   100182
           22 | AB'C         | \x0c         | INS       | NEW        |   100183
           23 | AB'C         | \x0c         | INS       | NEW        |   100184
           24 | AB'C         | \x0c         | INS       | NEW        |   100185
           25 | AB'C         | \x0c         | INS       | NEW        |   100186
           26 | AB'C         | \x0c         | INS       | NEW        |   100187
           27 | AB'C         | \x0c         | INS       | NEW        |   100188
           28 | AB'C         | \x0c         | INS       | NEW        |   100189
           29 | AB'C         | \x0c         | INS       | NEW        |   100190
           30 | AB'C         | \x0c         | INS       | NEW        |   100191
           31 | AB'C         | \x0c         | INS       | NEW        |   100192
            1 | AB'C         | \x0c         | UPD       | OLD        |   100193
            1 | AB'C         | \x1c         | UPD       | NEW        |   100193
            2 | AB'C         | \x0c         | UPD       | OLD        |   100194
            2 | AB'C         | \x1c         | UPD       | NEW        |   100194
            3 | AB'C         | \x0c         | UPD       | OLD        |   100195
            3 | AB'C         | \x1c         | UPD       | NEW        |   100195
           18 | AB'C         | \x0c         | UPD       | OLD        |   100196
           18 | AB'C         | \x1c27       | UPD       | NEW        |   100196
           19 | AB'C         | \x0c         | UPD       | OLD        |   100197
           19 | AB'C         | \x1c27       | UPD       | NEW        |   100197
           20 | AB'C         | \x0c         | UPD       | OLD        |   100198
           20 | AB'C         | \x1c27       | UPD       | NEW        |   100198
           21 | AB'C         | \x0c         | UPD       | OLD        |   100199
           21 | AB'C         | \x1c27       | UPD       | NEW        |   100199
           22 | AB'C         | \x0c         | UPD       | OLD        |   100200
           22 | AB'C         | \x1c27       | UPD       | NEW        |   100200
           23 | AB'C         | \x0c         | DEL       | OLD        |   100202
           24 | AB'C         | \x0c         | DEL       | OLD        |   100203
           25 | AB'C         | \x0c         | DEL       | OLD        |   100204
           26 | AB'C         | \x0c         | DEL       | OLD        |   100205
           27 | AB'C         | \x0c         | DEL       | OLD        |   100206
           28 | AB'C         | \x0c         | DEL       | OLD        |   100207
           29 | AB'C         | \x0c         | DEL       | OLD        |   100208
           30 | AB'C         | \x0c         | DEL       | OLD        |   100209
           31 | AB'C         | \x0c         | DEL       | OLD        |   100210
           21 | AB'C         | \x1c27       | DEL       | OLD        |   100211
           22 | AB'C         | \x1c27       | DEL       | OLD        |   100212
           10 | AB'C         | \x0c         | DEL       | OLD        |   100214
            1 | AB'C         | \x1c         | UPD       | OLD        |   100215
            1 | DEF          | \x1c         | UPD       | NEW        |   100215
            2 | AB'C         | \x1c         | UPD       | OLD        |   100216
            2 | DEF          | \x1c         | UPD       | NEW        |   100216
(63 rows)

select col21, col22, col23, emaj_verb, emaj_tuple, emaj_gid from emaj."phil's schema3_myTbl2\_log" order by emaj_gid, emaj_tuple desc;
 col21 | col22 |   col23    | emaj_verb | emaj_tuple | emaj_gid 
-------+-------+------------+-----------+------------+----------
     1 | ABC   | 12-31-2010 | INS       | NEW        |   100201
     2 | DEF   |            | INS       | NEW        |   100213
(2 rows)

-----------------------------
-- Step 11 : for myGroup1, in a transaction, update tables and rollback the transaction, 
--           then rollback to previous mark 
-----------------------------
set search_path=public,myschema1;
--
begin transaction;
  delete from mytbl1;
rollback;
--
select emaj.emaj_rollback_group('myGroup1','EMAJ_LAST_MARK');
 emaj_rollback_group 
---------------------
                   2
(1 row)

-----------------------------
-- Checking step 11
-----------------------------
-- emaj tables
select sqhl_schema, sqhl_table, sqhl_begin_time_id, sqhl_end_time_id, sqhl_hole_size from emaj.emaj_seq_hole order by 1,2,3;
 sqhl_schema | sqhl_table | sqhl_begin_time_id | sqhl_end_time_id | sqhl_hole_size 
-------------+------------+--------------------+------------------+----------------
 myschema1   | mytbl1     |                616 |              621 |              1
 myschema1   | mytbl1     |                632 |              648 |             20
 myschema1   | mytbl4     |                616 |              621 |              2
 myschema2   | mytbl4     |                609 |              620 |              6
 myschema2   | mytbl5     |                609 |              620 |              3
 myschema2   | mytbl6     |                609 |              620 |              9
(6 rows)

select rlbt_rlbk_id, rlbt_step, rlbt_schema, rlbt_table, rlbt_fkey, rlbt_quantity from emaj.emaj_rlbk_stat
  order by rlbt_rlbk_id, rlbt_step, rlbt_schema, rlbt_table, rlbt_fkey;
 rlbt_rlbk_id |  rlbt_step  | rlbt_schema | rlbt_table |     rlbt_fkey     | rlbt_quantity 
--------------+-------------+-------------+------------+-------------------+---------------
          100 | DROP_FK     |             |            |                   |             1
          100 | SET_FK_DEF  |             |            |                   |             2
          100 | RLBK_TABLE  | myschema2   | mytbl4     |                   |             4
          100 | RLBK_TABLE  | myschema2   | mytbl5     |                   |             1
          100 | RLBK_TABLE  | myschema2   | mytbl6     |                   |             3
          100 | SET_FK_IMM  | myschema2   | mytbl4     | mytbl4_col43_fkey |             4
          100 | SET_FK_IMM  | myschema2   | mytbl6     | mytbl6_col61_fkey |             3
          100 | SET_FK_IMM  | myschema2   | mytbl8     | mytbl8_col81_fkey |             3
          100 | ADD_FK      | myschema2   | mytbl4     | mytbl4_col44_fkey |             2
          100 | CTRL-DBLINK |             |            |                   |            10
          101 | DROP_FK     |             |            |                   |             1
          101 | SET_FK_DEF  |             |            |                   |             2
          101 | RLBK_TABLE  | myschema2   | mytbl4     |                   |             2
          101 | RLBK_TABLE  | myschema2   | mytbl5     |                   |             1
          101 | RLBK_TABLE  | myschema2   | mytbl6     |                   |             3
          101 | SET_FK_IMM  | myschema2   | mytbl4     | mytbl4_col43_fkey |             2
          101 | SET_FK_IMM  | myschema2   | mytbl6     | mytbl6_col61_fkey |             3
          101 | SET_FK_IMM  | myschema2   | mytbl8     | mytbl8_col81_fkey |             3
          101 | ADD_FK      | myschema2   | mytbl4     | mytbl4_col44_fkey |             2
          101 | CTRL-DBLINK |             |            |                   |            10
          102 | DIS_LOG_TRG |             |            |                   |             2
          102 | DROP_FK     |             |            |                   |             1
          102 | SET_FK_DEF  |             |            |                   |             1
          102 | RLBK_TABLE  | myschema1   | mytbl1     |                   |             3
          102 | RLBK_TABLE  | myschema1   | mytbl4     |                   |             8
          102 | DELETE_LOG  | myschema1   | mytbl1     |                   |             3
          102 | DELETE_LOG  | myschema1   | mytbl4     |                   |             8
          102 | SET_FK_IMM  | myschema1   | mytbl4     | mytbl4_col43_fkey |             8
          102 | ADD_FK      | myschema1   | mytbl4     | mytbl4_col44_fkey |             0
          102 | ENA_LOG_TRG |             |            |                   |             2
          102 | CTRL+DBLINK |             |            |                   |            12
          103 | DROP_FK     |             |            |                   |             1
          103 | SET_FK_DEF  |             |            |                   |             2
          103 | RLBK_TABLE  | myschema2   | mytbl4     |                   |             8
          103 | RLBK_TABLE  | myschema2   | mytbl5     |                   |             3
          103 | RLBK_TABLE  | myschema2   | mytbl6     |                   |             9
          103 | SET_FK_IMM  | myschema2   | mytbl4     | mytbl4_col43_fkey |             8
          103 | SET_FK_IMM  | myschema2   | mytbl6     | mytbl6_col61_fkey |             9
          103 | SET_FK_IMM  | myschema2   | mytbl8     | mytbl8_col81_fkey |             9
          103 | ADD_FK      | myschema2   | mytbl4     | mytbl4_col44_fkey |             2
          103 | CTRL+DBLINK |             |            |                   |            10
          104 | DIS_LOG_TRG |             |            |                   |             3
          104 | DROP_FK     |             |            |                   |             1
          104 | SET_FK_DEF  |             |            |                   |             2
          104 | RLBK_TABLE  | myschema2   | mytbl4     |                   |             6
          104 | RLBK_TABLE  | myschema2   | mytbl5     |                   |             3
          104 | RLBK_TABLE  | myschema2   | mytbl6     |                   |             9
          104 | DELETE_LOG  | myschema2   | mytbl4     |                   |             6
          104 | DELETE_LOG  | myschema2   | mytbl5     |                   |             3
          104 | DELETE_LOG  | myschema2   | mytbl6     |                   |             9
          104 | SET_FK_IMM  | myschema2   | mytbl4     | mytbl4_col43_fkey |             6
          104 | SET_FK_IMM  | myschema2   | mytbl6     | mytbl6_col61_fkey |             9
          104 | SET_FK_IMM  | myschema2   | mytbl8     | mytbl8_col81_fkey |             9
          104 | ADD_FK      | myschema2   | mytbl4     | mytbl4_col44_fkey |             2
          104 | ENA_LOG_TRG |             |            |                   |             3
          104 | CTRL+DBLINK |             |            |                   |            19
          105 | DIS_LOG_TRG |             |            |                   |             2
          105 | DROP_FK     |             |            |                   |             1
          105 | SET_FK_DEF  |             |            |                   |             1
          105 | RLBK_TABLE  | myschema1   | mytbl1     |                   |             1
          105 | RLBK_TABLE  | myschema1   | mytbl4     |                   |             2
          105 | DELETE_LOG  | myschema1   | mytbl1     |                   |             1
          105 | DELETE_LOG  | myschema1   | mytbl4     |                   |             2
          105 | SET_FK_IMM  | myschema1   | mytbl4     | mytbl4_col43_fkey |             2
          105 | ADD_FK      | myschema1   | mytbl4     | mytbl4_col44_fkey |             0
          105 | ENA_LOG_TRG |             |            |                   |             2
          105 | CTRL+DBLINK |             |            |                   |            12
          106 | DROP_FK     |             |            |                   |             1
          106 | SET_FK_DEF  |             |            |                   |             1
          106 | RLBK_TABLE  | myschema1   | mytbl1     |                   |             1
          106 | RLBK_TABLE  | myschema1   | myTbl3     |                   |            10
          106 | RLBK_TABLE  | myschema1   | mytbl4     |                   |             2
          106 | SET_FK_IMM  | myschema1   | mytbl4     | mytbl4_col43_fkey |             2
          106 | ADD_FK      | myschema1   | mytbl4     | mytbl4_col44_fkey |             0
          106 | CTRL+DBLINK |             |            |                   |             7
          113 | DIS_LOG_TRG |             |            |                   |             1
          113 | DROP_FK     |             |            |                   |             1
          113 | RLBK_TABLE  | myschema1   | mytbl1     |                   |            20
          113 | DELETE_LOG  | myschema1   | mytbl1     |                   |            20
          113 | ADD_FK      | myschema1   | mytbl4     | mytbl4_col44_fkey |             0
          113 | ENA_LOG_TRG |             |            |                   |             1
          113 | CTRL+DBLINK |             |            |                   |             6
(82 rows)

-----------------------------
-- Step 12 : tests snaps and script generation functions
-----------------------------
-- first add some updates for tables with unusual types (arrays, geometric)
set search_path=public,myschema2;
insert into myTbl5 values (10,'{"abc","def","ghi"}','{1,2,3}',NULL);
insert into myTbl5 values (20,array['abc','def','ghi'],array[3,4,5],array['2000/02/01'::date,'2000/02/28'::date]);
update myTbl5 set col54 = '{"2010/11/28","2010/12/03"}' where col54 is null;
insert into myTbl6 select i+10, point(i,1.3), '((0,0),(2,2))', circle(point(5,5),i),'((-2,-2),(3,0),(1,4))','10.20.30.40/27' from generate_series (1,8) as i;
update myTbl6 set col64 = '<(5,6),3.5>', col65 = null where col61 <= 13;
-- reset directory for snaps
\! rm -Rf /tmp/emaj_test/snaps
\! mkdir /tmp/emaj_test/snaps
-- ... and snap the all groups
select emaj.emaj_snap_group('myGroup1','/tmp/emaj_test/snaps','CSV HEADER');
 emaj_snap_group 
-----------------
               6
(1 row)

select emaj.emaj_snap_group('myGroup2','/tmp/emaj_test/snaps','CSV HEADER');
 emaj_snap_group 
-----------------
               8
(1 row)

select emaj.emaj_snap_group('phil''s group#3",','/tmp/emaj_test/snaps','CSV HEADER');
 emaj_snap_group 
-----------------
               4
(1 row)

\! ls /tmp/emaj_test/snaps
_INFO
myschema1_mytbl1.snap
myschema1_mytbl2b.snap
myschema1_mytbl2.snap
myschema1_myTbl3_col31_seq.snap
myschema1_myTbl3.snap
myschema1_mytbl4.snap
myschema2_myseq1.snap
myschema2_mytbl1.snap
myschema2_mytbl2.snap
myschema2_myTbl3_col31_seq.snap
myschema2_myTbl3.snap
myschema2_mytbl4.snap
myschema2_mytbl5.snap
myschema2_mytbl6.snap
phil's schema3_myTbl2\_col21_seq.snap
phil's schema3_myTbl2\.snap
phil's schema3_phil's seq\1.snap
phil's schema3_phil's tbl1.snap
-- reset directory for emaj_gen_sql_group tests
\! rm -Rf /tmp/emaj_test/sql_scripts
\! mkdir /tmp/emaj_test/sql_scripts
-- generate sql script for each active group (and check the result with detailed log statistics + number of sequences)
select emaj.emaj_gen_sql_group('myGroup1', 'Multi-1', NULL, '/tmp/emaj_test/sql_scripts/myGroup1.sql');
 emaj_gen_sql_group 
--------------------
                  1
(1 row)

select coalesce(sum(stat_rows),0) + 1 as check from emaj.emaj_detailed_log_stat_group('myGroup1', 'Multi-1', NULL);
 check 
-------
     1
(1 row)

select emaj.emaj_gen_sql_group('myGroup2', 'Multi-1', NULL, '/tmp/emaj_test/sql_scripts/myGroup2.sql', array[
     'myschema2.mytbl1','myschema2.mytbl2','myschema2.myTbl3','myschema2.mytbl4',
     'myschema2.mytbl5','myschema2.mytbl6','myschema2.myseq1','myschema2.myTbl3_col31_seq']);
 emaj_gen_sql_group 
--------------------
                 22
(1 row)

select sum(stat_rows) + 2 as check from emaj.emaj_detailed_log_stat_group('myGroup2', 'Multi-1', NULL);
 check 
-------
    22
(1 row)

select emaj.emaj_gen_sql_group('phil''s group#3",', 'M1_rollbackable', NULL, '/tmp/emaj_test/sql_scripts/Group3.sql');
 emaj_gen_sql_group 
--------------------
                 57
(1 row)

select sum(stat_rows) + 1 as check from emaj.emaj_detailed_log_stat_group('phil''s group#3",', 'M1_rollbackable', NULL);
 check 
-------
    56
(1 row)

-- process \\ in script files
\! find /tmp/emaj_test/sql_scripts -name '*.sql' -type f -print0 | xargs -0 sed -i_s -s 's/\\\\/\\/g'
-- comment transaction commands for the need of the current test
\! find /tmp/emaj_test/sql_scripts -name '*.sql' -type f -print0 | xargs -0 sed -i -s 's/^BEGIN/--BEGIN/;s/^COMMIT/--COMMIT/'
-- mask timestamp in initial comment
\! find /tmp/emaj_test/sql_scripts -name '*.sql' -type f -print0 | xargs -0 sed -i -s 's/at .*$/at [ts]$/'
\! ls /tmp/emaj_test/sql_scripts
Group3.sql
Group3.sql_s
myGroup1.sql
myGroup1.sql_s
myGroup2.sql
myGroup2.sql_s
-- reset directory for second set of snaps
\! rm -Rf /tmp/emaj_test/snaps2
\! mkdir /tmp/emaj_test/snaps2
-- in a single transaction and as superuser:
--   rollback groups, replay updates with generated scripts, snap groups again and cancel the transaction
reset role;
begin;
  select emaj.emaj_rollback_group('myGroup1','Multi-1');
 emaj_rollback_group 
---------------------
                   1
(1 row)

  select emaj.emaj_rollback_group('myGroup2','Multi-1');
WARNING:  _check_fk_groups: Foreign key "mytbl6_col61_fkey", from table "myschema2.mytbl6", references "myschema2.mytbl7" that is outside groups (myGroup2).
CONTEXT:  SQL statement "SELECT emaj._check_fk_groups(v_groupNames)"
PL/pgSQL function emaj._rlbk_init(text[],text,boolean,integer,boolean) line 68 at PERFORM
SQL statement "SELECT emaj._rlbk_init(v_groupNames, v_mark, v_isLoggedRlbk, 1, v_multiGroup)"
PL/pgSQL function emaj._rlbk_groups(text[],text,boolean,boolean) line 20 at SQL statement
PL/pgSQL function emaj.emaj_rollback_group(text,text) line 7 at RETURN
WARNING:  _check_fk_groups: table "myschema2.mytbl6" is referenced by foreign key "mytbl8_col81_fkey" from table "myschema2.mytbl8" that is outside groups (myGroup2).
CONTEXT:  SQL statement "SELECT emaj._check_fk_groups(v_groupNames)"
PL/pgSQL function emaj._rlbk_init(text[],text,boolean,integer,boolean) line 68 at PERFORM
SQL statement "SELECT emaj._rlbk_init(v_groupNames, v_mark, v_isLoggedRlbk, 1, v_multiGroup)"
PL/pgSQL function emaj._rlbk_groups(text[],text,boolean,boolean) line 20 at SQL statement
PL/pgSQL function emaj.emaj_rollback_group(text,text) line 7 at RETURN
 emaj_rollback_group 
---------------------
                   4
(1 row)

  select emaj.emaj_rollback_group('phil''s group#3",','M1_rollbackable');
WARNING:  _check_fk_groups: Foreign key "mytbl2_col21_fkey", from table "phil's schema3.myTbl2\", references "phil's schema3.mytbl4" that is outside groups (phil's group#3",).
CONTEXT:  SQL statement "SELECT emaj._check_fk_groups(v_groupNames)"
PL/pgSQL function emaj._rlbk_init(text[],text,boolean,integer,boolean) line 68 at PERFORM
SQL statement "SELECT emaj._rlbk_init(v_groupNames, v_mark, v_isLoggedRlbk, 1, v_multiGroup)"
PL/pgSQL function emaj._rlbk_groups(text[],text,boolean,boolean) line 20 at SQL statement
PL/pgSQL function emaj.emaj_rollback_group(text,text) line 7 at RETURN
WARNING:  _check_fk_groups: table "phil's schema3.phil's tbl1" is referenced by foreign key "mytbl4_col44_fkey" from table "phil's schema3.mytbl4" that is outside groups (phil's group#3",).
CONTEXT:  SQL statement "SELECT emaj._check_fk_groups(v_groupNames)"
PL/pgSQL function emaj._rlbk_init(text[],text,boolean,integer,boolean) line 68 at PERFORM
SQL statement "SELECT emaj._rlbk_init(v_groupNames, v_mark, v_isLoggedRlbk, 1, v_multiGroup)"
PL/pgSQL function emaj._rlbk_groups(text[],text,boolean,boolean) line 20 at SQL statement
PL/pgSQL function emaj.emaj_rollback_group(text,text) line 7 at RETURN
 emaj_rollback_group 
---------------------
                   4
(1 row)

\i /tmp/emaj_test/sql_scripts/myGroup1.sql
-- SQL script generated by E-Maj at [ts]$
--    for tables group(s): myGroup1
--    processing logs between mark Multi-1 and the current situation
SET standard_conforming_strings = ON;
--BEGIN TRANSACTION;
ALTER SEQUENCE myschema1."myTbl3_col31_seq" RESTART 21 START 1 INCREMENT 1 MAXVALUE 9223372036854775807 MINVALUE 1 CACHE 1 NO CYCLE;
--COMMIT;
RESET standard_conforming_strings;
\i /tmp/emaj_test/sql_scripts/myGroup2.sql
-- SQL script generated by E-Maj at [ts]$
--    for tables group(s): myGroup2
--    processing logs between mark Multi-1 and the current situation
--    only for the following tables/sequences: myschema2.mytbl1,myschema2.mytbl2,myschema2.myTbl3,myschema2.mytbl4,myschema2.mytbl5,myschema2.mytbl6,myschema2.myseq1,myschema2.myTbl3_col31_seq
SET standard_conforming_strings = ON;
--BEGIN TRANSACTION;
INSERT INTO myschema2.mytbl5 VALUES (10, '{abc,def,ghi}', '{1,2,3}', NULL);
INSERT INTO myschema2.mytbl5 VALUES (20, '{abc,def,ghi}', '{3,4,5}', '{02-01-2000,02-28-2000}');
UPDATE ONLY myschema2.mytbl5 SET col51 = 10, col52 = '{abc,def,ghi}', col53 = '{1,2,3}', col54 = '{11-28-2010,12-03-2010}' WHERE col51 = 10;
INSERT INTO myschema2.mytbl6 VALUES (11, '(1,1.3)', '(2,2),(0,0)', '<(5,5),1>', '((-2,-2),(3,0),(1,4))', '10.20.30.40/27');
INSERT INTO myschema2.mytbl6 VALUES (12, '(2,1.3)', '(2,2),(0,0)', '<(5,5),2>', '((-2,-2),(3,0),(1,4))', '10.20.30.40/27');
INSERT INTO myschema2.mytbl6 VALUES (13, '(3,1.3)', '(2,2),(0,0)', '<(5,5),3>', '((-2,-2),(3,0),(1,4))', '10.20.30.40/27');
INSERT INTO myschema2.mytbl6 VALUES (14, '(4,1.3)', '(2,2),(0,0)', '<(5,5),4>', '((-2,-2),(3,0),(1,4))', '10.20.30.40/27');
INSERT INTO myschema2.mytbl6 VALUES (15, '(5,1.3)', '(2,2),(0,0)', '<(5,5),5>', '((-2,-2),(3,0),(1,4))', '10.20.30.40/27');
INSERT INTO myschema2.mytbl6 VALUES (16, '(6,1.3)', '(2,2),(0,0)', '<(5,5),6>', '((-2,-2),(3,0),(1,4))', '10.20.30.40/27');
INSERT INTO myschema2.mytbl6 VALUES (17, '(7,1.3)', '(2,2),(0,0)', '<(5,5),7>', '((-2,-2),(3,0),(1,4))', '10.20.30.40/27');
INSERT INTO myschema2.mytbl6 VALUES (18, '(8,1.3)', '(2,2),(0,0)', '<(5,5),8>', '((-2,-2),(3,0),(1,4))', '10.20.30.40/27');
UPDATE ONLY myschema2.mytbl6 SET col61 = 0, col62 = NULL, col63 = NULL, col64 = '<(5,6),3.5>', col65 = NULL, col66 = NULL WHERE col61 = 0;
UPDATE ONLY myschema2.mytbl6 SET col61 = 4, col62 = '(4,1.3)', col63 = '(2,2),(0,0)', col64 = '<(5,6),3.5>', col65 = NULL, col66 = '10.20.30.40/27' WHERE col61 = 4;
UPDATE ONLY myschema2.mytbl6 SET col61 = 5, col62 = '(5,1.3)', col63 = '(2,2),(0,0)', col64 = '<(5,6),3.5>', col65 = NULL, col66 = '10.20.30.40/27' WHERE col61 = 5;
UPDATE ONLY myschema2.mytbl6 SET col61 = 6, col62 = '(6,1.3)', col63 = '(2,2),(0,0)', col64 = '<(5,6),3.5>', col65 = NULL, col66 = '10.20.30.40/27' WHERE col61 = 6;
UPDATE ONLY myschema2.mytbl6 SET col61 = 7, col62 = '(7,1.3)', col63 = '(2,2),(0,0)', col64 = '<(5,6),3.5>', col65 = NULL, col66 = '10.20.30.40/27' WHERE col61 = 7;
UPDATE ONLY myschema2.mytbl6 SET col61 = 8, col62 = '(8,1.3)', col63 = '(2,2),(0,0)', col64 = '<(5,6),3.5>', col65 = NULL, col66 = '10.20.30.40/27' WHERE col61 = 8;
UPDATE ONLY myschema2.mytbl6 SET col61 = 11, col62 = '(1,1.3)', col63 = '(2,2),(0,0)', col64 = '<(5,6),3.5>', col65 = NULL, col66 = '10.20.30.40/27' WHERE col61 = 11;
UPDATE ONLY myschema2.mytbl6 SET col61 = 12, col62 = '(2,1.3)', col63 = '(2,2),(0,0)', col64 = '<(5,6),3.5>', col65 = NULL, col66 = '10.20.30.40/27' WHERE col61 = 12;
UPDATE ONLY myschema2.mytbl6 SET col61 = 13, col62 = '(3,1.3)', col63 = '(2,2),(0,0)', col64 = '<(5,6),3.5>', col65 = NULL, col66 = '10.20.30.40/27' WHERE col61 = 13;
ALTER SEQUENCE myschema2.myseq1 RESTART 1004 START 1000 INCREMENT 1 MAXVALUE 9223372036854775807 MINVALUE 1000 CACHE 1 NO CYCLE;
ALTER SEQUENCE myschema2."myTbl3_col31_seq" RESTART 21 START 1 INCREMENT 1 MAXVALUE 9223372036854775807 MINVALUE 1 CACHE 1 NO CYCLE;
--COMMIT;
RESET standard_conforming_strings;
\i /tmp/emaj_test/sql_scripts/Group3.sql
-- SQL script generated by E-Maj at [ts]$
--    for tables group(s): phil's group#3",
--    processing logs between mark M1_rollbackable and the current situation
SET standard_conforming_strings = ON;
--BEGIN TRANSACTION;
INSERT INTO "phil's schema3"."phil's tbl1" VALUES (1, 'AB''C', E'\\x0c');
INSERT INTO "phil's schema3"."phil's tbl1" VALUES (2, 'AB''C', E'\\x0c');
INSERT INTO "phil's schema3"."phil's tbl1" VALUES (3, 'AB''C', E'\\x0c');
INSERT INTO "phil's schema3"."phil's tbl1" VALUES (4, 'AB''C', E'\\x0c');
INSERT INTO "phil's schema3"."phil's tbl1" VALUES (5, 'AB''C', E'\\x0c');
INSERT INTO "phil's schema3"."phil's tbl1" VALUES (6, 'AB''C', E'\\x0c');
INSERT INTO "phil's schema3"."phil's tbl1" VALUES (7, 'AB''C', E'\\x0c');
INSERT INTO "phil's schema3"."phil's tbl1" VALUES (8, 'AB''C', E'\\x0c');
INSERT INTO "phil's schema3"."phil's tbl1" VALUES (9, 'AB''C', E'\\x0c');
INSERT INTO "phil's schema3"."phil's tbl1" VALUES (10, 'AB''C', E'\\x0c');
INSERT INTO "phil's schema3"."phil's tbl1" VALUES (11, 'AB''C', E'\\x0c');
INSERT INTO "phil's schema3"."phil's tbl1" VALUES (12, 'AB''C', E'\\x0c');
INSERT INTO "phil's schema3"."phil's tbl1" VALUES (13, 'AB''C', E'\\x0c');
INSERT INTO "phil's schema3"."phil's tbl1" VALUES (14, 'AB''C', E'\\x0c');
INSERT INTO "phil's schema3"."phil's tbl1" VALUES (15, 'AB''C', E'\\x0c');
INSERT INTO "phil's schema3"."phil's tbl1" VALUES (16, 'AB''C', E'\\x0c');
INSERT INTO "phil's schema3"."phil's tbl1" VALUES (17, 'AB''C', E'\\x0c');
INSERT INTO "phil's schema3"."phil's tbl1" VALUES (18, 'AB''C', E'\\x0c');
INSERT INTO "phil's schema3"."phil's tbl1" VALUES (19, 'AB''C', E'\\x0c');
INSERT INTO "phil's schema3"."phil's tbl1" VALUES (20, 'AB''C', E'\\x0c');
INSERT INTO "phil's schema3"."phil's tbl1" VALUES (21, 'AB''C', E'\\x0c');
INSERT INTO "phil's schema3"."phil's tbl1" VALUES (22, 'AB''C', E'\\x0c');
INSERT INTO "phil's schema3"."phil's tbl1" VALUES (23, 'AB''C', E'\\x0c');
INSERT INTO "phil's schema3"."phil's tbl1" VALUES (24, 'AB''C', E'\\x0c');
INSERT INTO "phil's schema3"."phil's tbl1" VALUES (25, 'AB''C', E'\\x0c');
INSERT INTO "phil's schema3"."phil's tbl1" VALUES (26, 'AB''C', E'\\x0c');
INSERT INTO "phil's schema3"."phil's tbl1" VALUES (27, 'AB''C', E'\\x0c');
INSERT INTO "phil's schema3"."phil's tbl1" VALUES (28, 'AB''C', E'\\x0c');
INSERT INTO "phil's schema3"."phil's tbl1" VALUES (29, 'AB''C', E'\\x0c');
INSERT INTO "phil's schema3"."phil's tbl1" VALUES (30, 'AB''C', E'\\x0c');
INSERT INTO "phil's schema3"."phil's tbl1" VALUES (31, 'AB''C', E'\\x0c');
UPDATE ONLY "phil's schema3"."phil's tbl1" SET "phil's col11" = 1, "phil's col12" = 'AB''C', "phil\s col13" = E'\\x1c' WHERE "phil's col11" = 1 AND "phil's col12" = 'AB''C';
UPDATE ONLY "phil's schema3"."phil's tbl1" SET "phil's col11" = 2, "phil's col12" = 'AB''C', "phil\s col13" = E'\\x1c' WHERE "phil's col11" = 2 AND "phil's col12" = 'AB''C';
UPDATE ONLY "phil's schema3"."phil's tbl1" SET "phil's col11" = 3, "phil's col12" = 'AB''C', "phil\s col13" = E'\\x1c' WHERE "phil's col11" = 3 AND "phil's col12" = 'AB''C';
UPDATE ONLY "phil's schema3"."phil's tbl1" SET "phil's col11" = 18, "phil's col12" = 'AB''C', "phil\s col13" = E'\\x1c27' WHERE "phil's col11" = 18 AND "phil's col12" = 'AB''C';
UPDATE ONLY "phil's schema3"."phil's tbl1" SET "phil's col11" = 19, "phil's col12" = 'AB''C', "phil\s col13" = E'\\x1c27' WHERE "phil's col11" = 19 AND "phil's col12" = 'AB''C';
UPDATE ONLY "phil's schema3"."phil's tbl1" SET "phil's col11" = 20, "phil's col12" = 'AB''C', "phil\s col13" = E'\\x1c27' WHERE "phil's col11" = 20 AND "phil's col12" = 'AB''C';
UPDATE ONLY "phil's schema3"."phil's tbl1" SET "phil's col11" = 21, "phil's col12" = 'AB''C', "phil\s col13" = E'\\x1c27' WHERE "phil's col11" = 21 AND "phil's col12" = 'AB''C';
UPDATE ONLY "phil's schema3"."phil's tbl1" SET "phil's col11" = 22, "phil's col12" = 'AB''C', "phil\s col13" = E'\\x1c27' WHERE "phil's col11" = 22 AND "phil's col12" = 'AB''C';
INSERT INTO "phil's schema3"."myTbl2\" VALUES (1, 'ABC', '12-31-2010');
DELETE FROM ONLY "phil's schema3"."phil's tbl1" WHERE "phil's col11" = 23 AND "phil's col12" = 'AB''C';
DELETE FROM ONLY "phil's schema3"."phil's tbl1" WHERE "phil's col11" = 24 AND "phil's col12" = 'AB''C';
DELETE FROM ONLY "phil's schema3"."phil's tbl1" WHERE "phil's col11" = 25 AND "phil's col12" = 'AB''C';
DELETE FROM ONLY "phil's schema3"."phil's tbl1" WHERE "phil's col11" = 26 AND "phil's col12" = 'AB''C';
DELETE FROM ONLY "phil's schema3"."phil's tbl1" WHERE "phil's col11" = 27 AND "phil's col12" = 'AB''C';
DELETE FROM ONLY "phil's schema3"."phil's tbl1" WHERE "phil's col11" = 28 AND "phil's col12" = 'AB''C';
DELETE FROM ONLY "phil's schema3"."phil's tbl1" WHERE "phil's col11" = 29 AND "phil's col12" = 'AB''C';
DELETE FROM ONLY "phil's schema3"."phil's tbl1" WHERE "phil's col11" = 30 AND "phil's col12" = 'AB''C';
DELETE FROM ONLY "phil's schema3"."phil's tbl1" WHERE "phil's col11" = 31 AND "phil's col12" = 'AB''C';
DELETE FROM ONLY "phil's schema3"."phil's tbl1" WHERE "phil's col11" = 21 AND "phil's col12" = 'AB''C';
DELETE FROM ONLY "phil's schema3"."phil's tbl1" WHERE "phil's col11" = 22 AND "phil's col12" = 'AB''C';
INSERT INTO "phil's schema3"."myTbl2\" VALUES (2, 'DEF', NULL);
DELETE FROM ONLY "phil's schema3"."phil's tbl1" WHERE "phil's col11" = 10 AND "phil's col12" = 'AB''C';
UPDATE ONLY "phil's schema3"."phil's tbl1" SET "phil's col11" = 1, "phil's col12" = 'DEF', "phil\s col13" = E'\\x1c' WHERE "phil's col11" = 1 AND "phil's col12" = 'AB''C';
UPDATE ONLY "phil's schema3"."phil's tbl1" SET "phil's col11" = 2, "phil's col12" = 'DEF', "phil\s col13" = E'\\x1c' WHERE "phil's col11" = 2 AND "phil's col12" = 'AB''C';
ALTER SEQUENCE "phil's schema3"."myTbl2\_col21_seq" RESTART 1 START 1 INCREMENT 1 MAXVALUE 9223372036854775807 MINVALUE 1 CACHE 1 NO CYCLE;
ALTER SEQUENCE "phil's schema3"."phil's seq\1" RESTART 1002 START 1000 INCREMENT 1 MAXVALUE 2000 MINVALUE 1000 CACHE 1 CYCLE;
--COMMIT;
RESET standard_conforming_strings;
  select emaj.emaj_snap_group('myGroup1','/tmp/emaj_test/snaps2','CSV HEADER');
 emaj_snap_group 
-----------------
               6
(1 row)

  select emaj.emaj_snap_group('myGroup2','/tmp/emaj_test/snaps2','CSV HEADER');
 emaj_snap_group 
-----------------
               8
(1 row)

  select emaj.emaj_snap_group('phil''s group#3",','/tmp/emaj_test/snaps2','CSV HEADER');
 emaj_snap_group 
-----------------
               4
(1 row)

rollback;
-- mask timestamp in _INFO files
\! sed -i_s -s 's/at .*/at [ts]/' /tmp/emaj_test/snaps/_INFO /tmp/emaj_test/snaps2/_INFO
-- and compare both snaps sets
-- sequences are detected as different because of :
-- - the effect of RESTART on is_called and next_val attributes
-- - internal log_cnt value being reset
\! diff --exclude _INFO_s /tmp/emaj_test/snaps /tmp/emaj_test/snaps2
diff --exclude _INFO_s /tmp/emaj_test/snaps/myschema1_myTbl3_col31_seq.snap /tmp/emaj_test/snaps2/myschema1_myTbl3_col31_seq.snap
2c2
< myTbl3_col31_seq,20,1,1,9223372036854775807,1,1,f,t
---
> myTbl3_col31_seq,21,1,1,9223372036854775807,1,1,f,f
diff --exclude _INFO_s /tmp/emaj_test/snaps/myschema2_myTbl3_col31_seq.snap /tmp/emaj_test/snaps2/myschema2_myTbl3_col31_seq.snap
2c2
< myTbl3_col31_seq,20,1,1,9223372036854775807,1,1,f,t
---
> myTbl3_col31_seq,21,1,1,9223372036854775807,1,1,f,f
diff --exclude _INFO_s "/tmp/emaj_test/snaps/phil's schema3_phil's seq\\1.snap" "/tmp/emaj_test/snaps2/phil's schema3_phil's seq\\1.snap"
2c2
< phil's seq\1,1001,1000,1,2000,1000,1,t,t
---
> phil's seq\1,1002,1000,1,2000,1000,1,t,f
set role emaj_regression_tests_adm_user;
-----------------------------
-- Step 12 : test use of a table with a very long name (63 characters long)
-----------------------------
select emaj.emaj_stop_group('phil''s group#3",');
 emaj_stop_group 
-----------------
               4
(1 row)

-- rename the "phil's tbl1" table and alter its group
reset role;
alter table "phil's schema3"."phil's tbl1" rename to table_with_very_looooooooooooooooooooooooooooooooooooooong_name;
set role emaj_regression_tests_adm_user;
update emaj.emaj_group_def set grpdef_tblseq = 'table_with_very_looooooooooooooooooooooooooooooooooooooong_name', grpdef_emaj_names_prefix = 'short' where grpdef_schema = 'phil''s schema3' and grpdef_tblseq = 'phil''s tbl1';
select emaj.emaj_alter_group('phil''s group#3",');
NOTICE:  drop cascades to trigger emaj_log_trg on table "phil's schema3".table_with_very_looooooooooooooooooooooooooooooooooooooong_name
CONTEXT:  SQL statement "DROP FUNCTION IF EXISTS "emaj #'3"."phil's schema3_phil's tbl1_log_fnct"() CASCADE"
PL/pgSQL function emaj._drop_tbl(emaj.emaj_relation) line 19 at EXECUTE
SQL statement "SELECT emaj._drop_tbl(r_rel)"
PL/pgSQL function emaj.emaj_alter_group(text) line 103 at PERFORM
NOTICE:  table "short_log" does not exist, skipping
CONTEXT:  SQL statement "DROP TABLE IF EXISTS "emaj #'3".short_log"
PL/pgSQL function emaj._create_tbl(emaj.emaj_group_def,text,boolean,text) line 69 at EXECUTE
SQL statement "SELECT emaj._create_tbl(r_grpdef, v_groupName, v_isRollbackable, v_defTsp)"
PL/pgSQL function emaj.emaj_alter_group(text) line 196 at PERFORM
NOTICE:  trigger "emaj_log_trg" for relation "phil's schema3.table_with_very_looooooooooooooooooooooooooooooooooooooong_name" does not exist, skipping
CONTEXT:  SQL statement "DROP TRIGGER IF EXISTS emaj_log_trg ON "phil's schema3".table_with_very_looooooooooooooooooooooooooooooooooooooong_name"
PL/pgSQL function emaj._create_tbl(emaj.emaj_group_def,text,boolean,text) line 123 at EXECUTE
SQL statement "SELECT emaj._create_tbl(r_grpdef, v_groupName, v_isRollbackable, v_defTsp)"
PL/pgSQL function emaj.emaj_alter_group(text) line 196 at PERFORM
WARNING:  _check_fk_groups: Foreign key "mytbl2_col21_fkey", from table "phil's schema3.myTbl2\", references "phil's schema3.mytbl4" that is outside groups (phil's group#3",).
CONTEXT:  SQL statement "SELECT emaj._check_fk_groups(array[v_groupName])"
PL/pgSQL function emaj.emaj_alter_group(text) line 225 at PERFORM
WARNING:  _check_fk_groups: table "phil's schema3.table_with_very_looooooooooooooooooooooooooooooooooooooong_name" is referenced by foreign key "mytbl4_col44_fkey" from table "phil's schema3.mytbl4" that is outside groups (phil's group#3",).
CONTEXT:  SQL statement "SELECT emaj._check_fk_groups(array[v_groupName])"
PL/pgSQL function emaj.emaj_alter_group(text) line 225 at PERFORM
 emaj_alter_group 
------------------
                4
(1 row)

-- use the table and its group
select emaj.emaj_start_group('phil''s group#3",','M1_after_alter_group');
WARNING:  _check_fk_groups: Foreign key "mytbl2_col21_fkey", from table "phil's schema3.myTbl2\", references "phil's schema3.mytbl4" that is outside groups (phil's group#3",).
CONTEXT:  SQL statement "SELECT emaj._check_fk_groups(v_groupNames)"
PL/pgSQL function emaj._start_groups(text[],text,boolean,boolean) line 36 at PERFORM
SQL statement "SELECT emaj._start_groups(array[v_groupName], v_mark, false, v_resetLog)"
PL/pgSQL function emaj.emaj_start_group(text,text,boolean) line 17 at SQL statement
WARNING:  _check_fk_groups: table "phil's schema3.table_with_very_looooooooooooooooooooooooooooooooooooooong_name" is referenced by foreign key "mytbl4_col44_fkey" from table "phil's schema3.mytbl4" that is outside groups (phil's group#3",).
CONTEXT:  SQL statement "SELECT emaj._check_fk_groups(v_groupNames)"
PL/pgSQL function emaj._start_groups(text[],text,boolean,boolean) line 36 at PERFORM
SQL statement "SELECT emaj._start_groups(array[v_groupName], v_mark, false, v_resetLog)"
PL/pgSQL function emaj.emaj_start_group(text,text,boolean) line 17 at SQL statement
 emaj_start_group 
------------------
                4
(1 row)

update "phil's schema3".table_with_very_looooooooooooooooooooooooooooooooooooooong_name set "phil's col12" = 'GHI' where "phil's col11" between 6 and 9;
select emaj.emaj_set_mark_group('phil''s group#3",','M2');
 emaj_set_mark_group 
---------------------
                   4
(1 row)

delete from "phil's schema3".table_with_very_looooooooooooooooooooooooooooooooooooooong_name where "phil's col11" > 18;
select emaj.emaj_rollback_group('phil''s group#3",','M1_after_alter_group');
WARNING:  _check_fk_groups: Foreign key "mytbl2_col21_fkey", from table "phil's schema3.myTbl2\", references "phil's schema3.mytbl4" that is outside groups (phil's group#3",).
CONTEXT:  SQL statement "SELECT emaj._check_fk_groups(v_groupNames)"
PL/pgSQL function emaj._rlbk_init(text[],text,boolean,integer,boolean) line 68 at PERFORM
SQL statement "SELECT emaj._rlbk_init(v_groupNames, v_mark, v_isLoggedRlbk, 1, v_multiGroup)"
PL/pgSQL function emaj._rlbk_groups(text[],text,boolean,boolean) line 20 at SQL statement
PL/pgSQL function emaj.emaj_rollback_group(text,text) line 7 at RETURN
WARNING:  _check_fk_groups: table "phil's schema3.table_with_very_looooooooooooooooooooooooooooooooooooooong_name" is referenced by foreign key "mytbl4_col44_fkey" from table "phil's schema3.mytbl4" that is outside groups (phil's group#3",).
CONTEXT:  SQL statement "SELECT emaj._check_fk_groups(v_groupNames)"
PL/pgSQL function emaj._rlbk_init(text[],text,boolean,integer,boolean) line 68 at PERFORM
SQL statement "SELECT emaj._rlbk_init(v_groupNames, v_mark, v_isLoggedRlbk, 1, v_multiGroup)"
PL/pgSQL function emaj._rlbk_groups(text[],text,boolean,boolean) line 20 at SQL statement
PL/pgSQL function emaj.emaj_rollback_group(text,text) line 7 at RETURN
 emaj_rollback_group 
---------------------
                   3
(1 row)

select emaj.emaj_stop_group('phil''s group#3",');
 emaj_stop_group 
-----------------
               4
(1 row)

select emaj.emaj_drop_group('phil''s group#3",');
 emaj_drop_group 
-----------------
               4
(1 row)

-----------------------------
-- Step 13 : test use of groups or marks protection
-----------------------------
-- try to rollback a protected group
select emaj.emaj_protect_group('myGroup2');
 emaj_protect_group 
--------------------
                  1
(1 row)

select emaj.emaj_rollback_group('myGroup2','M3');
ERROR:  _rlbk_check: Group "myGroup2" is currently protected against rollback.
CONTEXT:  SQL statement "SELECT emaj._rlbk_check(v_groupNames, v_mark)"
PL/pgSQL function emaj._rlbk_init(text[],text,boolean,integer,boolean) line 24 at SQL statement
SQL statement "SELECT emaj._rlbk_init(v_groupNames, v_mark, v_isLoggedRlbk, 1, v_multiGroup)"
PL/pgSQL function emaj._rlbk_groups(text[],text,boolean,boolean) line 20 at SQL statement
PL/pgSQL function emaj.emaj_rollback_group(text,text) line 7 at RETURN
select emaj.emaj_unprotect_group('myGroup2');
 emaj_unprotect_group 
----------------------
                    1
(1 row)

-- try to rollback over a protected mark
select emaj.emaj_set_mark_group('myGroup1','Mark_to_protect');
 emaj_set_mark_group 
---------------------
                   6
(1 row)

select emaj.emaj_protect_mark_group('myGroup1','Mark_to_protect');
 emaj_protect_mark_group 
-------------------------
                       1
(1 row)

select emaj.emaj_rollback_group('myGroup1','Multi-1');
ERROR:  _rlbk_check: protected marks (Mark_to_protect) for group "myGroup1" block the rollback to mark "Multi-1".
CONTEXT:  SQL statement "SELECT emaj._rlbk_check(v_groupNames, v_mark)"
PL/pgSQL function emaj._rlbk_init(text[],text,boolean,integer,boolean) line 24 at SQL statement
SQL statement "SELECT emaj._rlbk_init(v_groupNames, v_mark, v_isLoggedRlbk, 1, v_multiGroup)"
PL/pgSQL function emaj._rlbk_groups(text[],text,boolean,boolean) line 20 at SQL statement
PL/pgSQL function emaj.emaj_rollback_group(text,text) line 7 at RETURN
select emaj.emaj_unprotect_mark_group('myGroup1','Mark_to_protect');
 emaj_unprotect_mark_group 
---------------------------
                         1
(1 row)

select emaj.emaj_delete_mark_group('myGroup1','Mark_to_protect');
 emaj_delete_mark_group 
------------------------
                      1
(1 row)

-----------------------------
-- Step 14 : test complex use of rollbacks consolidations
-----------------------------
set search_path=public,myschema1;
-- 2 consolidations of 2 logged rollbacks
-- Multi-1 MC1 MC2 RMC1S RMC1D      MC3 MC4 MC5 RMC3S RMC3D
--         ^       lrg(MC1)         ^           lrg(MC3)
--         xxxxxxxxxxxxxxx conso(RMC1D)
-- 	       	                        xxxxxxxxxxxxxxxxxxx conso(RMC3D)
select emaj.emaj_set_mark_group('myGroup1','MC1');
 emaj_set_mark_group 
---------------------
                   6
(1 row)

insert into myTbl1 select i, 'Test', 'Conso' from generate_series (2000,2012) as i;
insert into myTbl2 values (2000,'TC1',NULL);
delete from myTbl1 where col11 > 2010;
select emaj.emaj_set_mark_group('myGroup1','MC2');
 emaj_set_mark_group 
---------------------
                   6
(1 row)

update myTbl2 set col22 = 'TC2' WHERE col22 ='TC1';
select emaj.emaj_logged_rollback_group('myGroup1','MC1');
 emaj_logged_rollback_group 
----------------------------
                          3
(1 row)

insert into myTbl2 values (2000,'TC3',NULL);
select emaj.emaj_rename_mark_group('myGroup1','EMAJ_LAST_MARK','RLBK_MC1_DONE');
 emaj_rename_mark_group 
------------------------
 
(1 row)

select emaj.emaj_set_mark_group('myGroup1','MC3');
 emaj_set_mark_group 
---------------------
                   6
(1 row)

insert into "myTbl3" (col33) select generate_series(2000,2039,4)/100;
insert into myTbl4 values (2000,'FK...',1,10,'ABC');
update myTbl4 set col43 = NULL where col41 = 2000;
select emaj.emaj_set_mark_group('myGroup1','MC4');
 emaj_set_mark_group 
---------------------
                   6
(1 row)

select emaj.emaj_set_mark_group('myGroup1','MC5');
 emaj_set_mark_group 
---------------------
                   6
(1 row)

select emaj.emaj_logged_rollback_group('myGroup1','MC3');
 emaj_logged_rollback_group 
----------------------------
                          3
(1 row)

select cons_group, regexp_replace(cons_end_rlbk_mark_name,E'\\d\\d\.\\d\\d\\.\\d\\d\\.\\d\\d\\d','%','g'), 
       cons_target_rlbk_mark_name, cons_end_rlbk_mark_id, cons_target_rlbk_mark_id, cons_rows, cons_marks, cons_marks
  from emaj.emaj_get_consolidable_rollbacks();
 cons_group | regexp_replace  | cons_target_rlbk_mark_name | cons_end_rlbk_mark_id | cons_target_rlbk_mark_id | cons_rows | cons_marks | cons_marks 
------------+-----------------+----------------------------+-----------------------+--------------------------+-----------+------------+------------
 myGroup1   | RLBK_MC1_DONE   | MC1                        |                   651 |                      648 |        29 |          2 |          2
 myGroup1   | RLBK_MC3_%_DONE | MC3                        |                   656 |                      652 |        23 |          3 |          3
(2 rows)

-- consolidate both logged rollback at once
select cons_target_rlbk_mark_name, regexp_replace(cons_end_rlbk_mark_name,E'\\d\\d\.\\d\\d\\.\\d\\d\\.\\d\\d\\d','%','g'), 
       emaj.emaj_consolidate_rollback_group(cons_group, cons_end_rlbk_mark_name)
  from emaj.emaj_get_consolidable_rollbacks() where cons_group = 'myGroup1';
 cons_target_rlbk_mark_name | regexp_replace  | emaj_consolidate_rollback_group 
----------------------------+-----------------+---------------------------------
 MC1                        | RLBK_MC1_DONE   |                               3
 MC3                        | RLBK_MC3_%_DONE |                               3
(2 rows)

select cons_group, regexp_replace(cons_end_rlbk_mark_name,E'\\d\\d\.\\d\\d\\.\\d\\d\\.\\d\\d\\d','%','g'), 
       cons_target_rlbk_mark_name, cons_end_rlbk_mark_id, cons_target_rlbk_mark_id, cons_rows, cons_marks
  from emaj.emaj_get_consolidable_rollbacks();
 cons_group | regexp_replace  | cons_target_rlbk_mark_name | cons_end_rlbk_mark_id | cons_target_rlbk_mark_id | cons_rows | cons_marks 
------------+-----------------+----------------------------+-----------------------+--------------------------+-----------+------------
 myGroup1   | RLBK_MC1_DONE   | MC1                        |                   651 |                      648 |         0 |          0
 myGroup1   | RLBK_MC3_%_DONE | MC3                        |                   656 |                      652 |         0 |          0
(2 rows)

select * from emaj.emaj_detailed_log_stat_group('myGroup1','Multi-1',NULL);
 stat_group | stat_schema | stat_table | stat_role | stat_verb | stat_rows 
------------+-------------+------------+-----------+-----------+-----------
 myGroup1   | myschema1   | mytbl2     | postgres  | INSERT    |         1
(1 row)

-- 2 consolidations of 2 nested logged rollbacks
-- MC6 MC7 MC8  RMC8S RMC8D M9 RMC6S RMC6D
--         ^    lrg(MC8)
--         xxxxxxxxxxxx conso(RMC8D)
-- ^                           lrb(MC6)
-- xxxxxxxxxxxxxxxxxxxxxxxxxxxxxxxxxxx conso(RMC6D)
select emaj.emaj_set_mark_group('myGroup1','MC6');
 emaj_set_mark_group 
---------------------
                   6
(1 row)

insert into myTbl1 select i, 'Test', 'Conso' from generate_series (2000,2012) as i;
insert into myTbl2 values (3000,'TC6',NULL);
delete from myTbl1 where col11 > 2010;
select emaj.emaj_set_mark_group('myGroup1','MC7');
 emaj_set_mark_group 
---------------------
                   6
(1 row)

update myTbl2 set col22 = 'TC7' WHERE col22 ='TC6';
select emaj.emaj_set_mark_group('myGroup1','MC8');
 emaj_set_mark_group 
---------------------
                   6
(1 row)

insert into myTbl2 values (3001,'TC8',NULL);
select emaj.emaj_logged_rollback_group('myGroup1','MC8');
 emaj_logged_rollback_group 
----------------------------
                          2
(1 row)

select emaj.emaj_consolidate_rollback_group('myGroup1','EMAJ_LAST_MARK');
 emaj_consolidate_rollback_group 
---------------------------------
                               2
(1 row)

select emaj.emaj_set_mark_group('myGroup1','MC9');
 emaj_set_mark_group 
---------------------
                   6
(1 row)

insert into "myTbl3" (col33) select generate_series(2000,2039,4)/100;
insert into myTbl4 values (2000,'FK...',1,10,'ABC');
update myTbl4 set col43 = NULL where col41 = 2000;
select emaj.emaj_logged_rollback_group('myGroup1','MC6');
 emaj_logged_rollback_group 
----------------------------
                          5
(1 row)

select emaj.emaj_consolidate_rollback_group('myGroup1','EMAJ_LAST_MARK');
 emaj_consolidate_rollback_group 
---------------------------------
                               5
(1 row)

select * from emaj.emaj_detailed_log_stat_group('myGroup1','Multi-1',NULL);
 stat_group | stat_schema | stat_table | stat_role | stat_verb | stat_rows 
------------+-------------+------------+-----------+-----------+-----------
 myGroup1   | myschema1   | mytbl2     | postgres  | INSERT    |         1
(1 row)

-- consolidation of 2 logged rollbacks referencing the same mark
-- MC10  RMC10S RMC10D M11 RMC10S RMC10D
-- ^     lrg(MC10)
-- ^                       lrb(MC10)
-- xxxxxxxxxxxxxxxxxxxxxxxxxxxxxxx conso(RMC10D)
select emaj.emaj_set_mark_group('myGroup1','MC10');
 emaj_set_mark_group 
---------------------
                   6
(1 row)

insert into myTbl1 select i, 'Test', 'Conso' from generate_series (3000,3010) as i;
delete from myTbl1 where col11 > 3005;
select emaj.emaj_logged_rollback_group('myGroup1','MC10');
 emaj_logged_rollback_group 
----------------------------
                          2
(1 row)

update myTbl2 set col22 = 'TC7' WHERE col22 ='TC6';
select emaj.emaj_set_mark_group('myGroup1','MC11');
 emaj_set_mark_group 
---------------------
                   6
(1 row)

insert into myTbl4 values (3000,'FK...',1,10,'ABC');
update myTbl4 set col43 = NULL where col41 = 3000;
select emaj.emaj_logged_rollback_group('myGroup1','MC10');
 emaj_logged_rollback_group 
----------------------------
                          3
(1 row)

select emaj.emaj_consolidate_rollback_group('myGroup1','EMAJ_LAST_MARK');
 emaj_consolidate_rollback_group 
---------------------------------
                               3
(1 row)

select * from emaj.emaj_detailed_log_stat_group('myGroup1','Multi-1',NULL);
 stat_group | stat_schema | stat_table | stat_role | stat_verb | stat_rows 
------------+-------------+------------+-----------+-----------+-----------
 myGroup1   | myschema1   | mytbl2     | postgres  | INSERT    |         1
(1 row)

-- consolidation of 1 from 2 overlapping logged rollbacks
-- MC15 MC16 RMC15S RMC15D MC17 RMC16S RMC16D
-- ^         lrg(MC15)
--      ^                       lrg(MC16)
-- xxxxxxxxxxxxxxxxx conso(RMC15D)
select emaj.emaj_set_mark_group('myGroup1','MC15');
 emaj_set_mark_group 
---------------------
                   6
(1 row)

insert into myTbl1 select i, 'Test', 'Conso' from generate_series (4000,4012) as i;
insert into myTbl2 values (4000,'TC15',NULL);
delete from myTbl1 where col11 > 4010;
select emaj.emaj_set_mark_group('myGroup1','MC16');
 emaj_set_mark_group 
---------------------
                   6
(1 row)

update myTbl2 set col22 = 'TC16' WHERE col22 ='TC15';
select emaj.emaj_logged_rollback_group('myGroup1','MC15');
 emaj_logged_rollback_group 
----------------------------
                          3
(1 row)

select emaj.emaj_rename_mark_group('myGroup1','EMAJ_LAST_MARK','RLBK_MC15_DONE');
 emaj_rename_mark_group 
------------------------
 
(1 row)

select emaj.emaj_set_mark_group('myGroup1','MC17');
 emaj_set_mark_group 
---------------------
                   6
(1 row)

insert into myTbl2 values (4001,'TC15',NULL);
select emaj.emaj_logged_rollback_group('myGroup1','MC16');
 emaj_logged_rollback_group 
----------------------------
                          3
(1 row)

select emaj.emaj_consolidate_rollback_group('myGroup1','RLBK_MC15_DONE');
 emaj_consolidate_rollback_group 
---------------------------------
                               3
(1 row)

select * from emaj.emaj_detailed_log_stat_group('myGroup1','Multi-1',NULL);
 stat_group | stat_schema | stat_table | stat_role | stat_verb | stat_rows 
------------+-------------+------------+-----------+-----------+-----------
 myGroup1   | myschema1   | mytbl1     | postgres  | INSERT    |        11
 myGroup1   | myschema1   | mytbl2     | postgres  | DELETE    |         1
 myGroup1   | myschema1   | mytbl2     | postgres  | INSERT    |         3
(3 rows)

select * from myTbl1 order by col11;
 col11 |   col12    |    col13     
-------+------------+--------------
     2 | ABC        | \x1c
     3 | ABC        | \x1c
     4 | ABC        | \x0c
     5 | ABC        | \x0c
     6 | ABC        | \x0c
     7 | ABC        | \x0c
     8 | ABC        | \x0c
     9 | ABC        | \x0c
    10 | ABC        | \x0c
   100 | DEF        | \x00
   101 | DEF        | \x00
   102 | DEF        | \x00
   103 | DEF        | \x00
   104 | DEF        | \x00
   105 | DEF        | \x00
   106 | DEF        | \x00
   107 | DEF        | \x00
   108 | DEF        | \x00
   109 | DEF        | \x00
   110 | DEF        | \x00
  4000 | Test       | \x436f6e736f
  4001 | Test       | \x436f6e736f
  4002 | Test       | \x436f6e736f
  4003 | Test       | \x436f6e736f
  4004 | Test       | \x436f6e736f
  4005 | Test       | \x436f6e736f
  4006 | Test       | \x436f6e736f
  4007 | Test       | \x436f6e736f
  4008 | Test       | \x436f6e736f
  4009 | Test       | \x436f6e736f
  4010 | Test       | \x436f6e736f
(31 rows)

select * from myTbl2 order by col21;
 col21 | col22 |   col23    
-------+-------+------------
     1 | ABC   | 12-31-2010
     2 | DEF   | 
     3 | GHI   | 01-02-2010
  2000 | TC3   | 
  4000 | TC15  | 
(5 rows)

select mark_id, mark_group, regexp_replace(mark_name,E'\\d\\d\.\\d\\d\\.\\d\\d\\.\\d\\d\\d','%','g'), mark_time_id, mark_is_deleted, mark_is_rlbk_protected, mark_comment, mark_log_rows_before_next, mark_logged_rlbk_target_mark from emaj.emaj_mark where mark_group = 'myGroup1' order by mark_id;
 mark_id | mark_group |        regexp_replace        | mark_time_id | mark_is_deleted | mark_is_rlbk_protected | mark_comment | mark_log_rows_before_next | mark_logged_rlbk_target_mark 
---------+------------+------------------------------+--------------+-----------------+------------------------+--------------+---------------------------+------------------------------
     612 | myGroup1   | M4                           |          615 | t               | f                      |              |                        10 | 
     613 | myGroup1   | M5                           |          616 | t               | f                      |              |                         3 | 
     617 | myGroup1   | Before logged rollback to M4 |          622 | t               | f                      |              |                        28 | 
     619 | myGroup1   | STOP_%                       |          624 | t               | f                      |              |                         0 | 
     629 | myGroup1   | Stop after rollback          |          631 | t               | f                      |              |                         0 | 
     631 | myGroup1   | Multi-1                      |          632 | f               | f                      |              |                         0 | 
     648 | myGroup1   | MC1                          |          659 | f               | f                      |              |                         0 | 
     651 | myGroup1   | RLBK_MC1_DONE                |          662 | f               | f                      |              |                         1 | MC1
     652 | myGroup1   | MC3                          |          663 | f               | f                      |              |                         0 | 
     656 | myGroup1   | RLBK_MC3_%_DONE              |          667 | f               | f                      |              |                         0 | MC3
     657 | myGroup1   | MC6                          |          668 | f               | f                      |              |                         0 | 
     664 | myGroup1   | RLBK_MC6_%_DONE              |          675 | f               | f                      |              |                         0 | MC6
     665 | myGroup1   | MC10                         |          676 | f               | f                      |              |                         0 | 
     670 | myGroup1   | RLBK_MC10_%_DONE             |          681 | f               | f                      |              |                         0 | MC10
     671 | myGroup1   | MC15                         |          682 | f               | f                      |              |                         0 | 
     674 | myGroup1   | RLBK_MC15_DONE               |          685 | f               | f                      |              |                         0 | MC15
     675 | myGroup1   | MC17                         |          686 | f               | f                      |              |                         1 | 
     676 | myGroup1   | RLBK_MC16_%_START            |          687 | f               | f                      |              |                        13 | 
     677 | myGroup1   | RLBK_MC16_%_DONE             |          688 | f               | f                      |              |                           | 
(19 rows)

select sequ_schema, sequ_name, sequ_time_id, sequ_last_val, sequ_is_called from emaj.emaj_sequence where sequ_name like 'myschema1%' order by sequ_time_id, sequ_schema, sequ_name;
 sequ_schema |         sequ_name         | sequ_time_id | sequ_last_val | sequ_is_called 
-------------+---------------------------+--------------+---------------+----------------
 emaj        | myschema1_mytbl1_log_seq  |          615 |            30 | t
 emaj        | myschema1_mytbl2_log_seq  |          615 |             3 | t
 emaj        | myschema1_mytbl4_log_seq  |          615 |             8 | t
 emajb       | myschema1_mytbl2b_log_seq |          615 |             1 | f
 emajC       | myschema1_myTbl3_log_seq  |          615 |            10 | t
 emaj        | myschema1_mytbl1_log_seq  |          616 |            30 | t
 emaj        | myschema1_mytbl2_log_seq  |          616 |             3 | t
 emaj        | myschema1_mytbl4_log_seq  |          616 |             8 | t
 emajb       | myschema1_mytbl2b_log_seq |          616 |             1 | f
 emajC       | myschema1_myTbl3_log_seq  |          616 |            20 | t
 emaj        | myschema1_mytbl1_log_seq  |          622 |            32 | t
 emaj        | myschema1_mytbl2_log_seq  |          622 |             3 | t
 emaj        | myschema1_mytbl4_log_seq  |          622 |            12 | t
 emajb       | myschema1_mytbl2b_log_seq |          622 |             1 | f
 emajC       | myschema1_myTbl3_log_seq  |          622 |            20 | t
 emaj        | myschema1_mytbl1_log_seq  |          624 |            33 | t
 emaj        | myschema1_mytbl2_log_seq  |          624 |             3 | t
 emaj        | myschema1_mytbl4_log_seq  |          624 |            14 | t
 emajb       | myschema1_mytbl2b_log_seq |          624 |             1 | f
 emajC       | myschema1_myTbl3_log_seq  |          624 |            45 | t
 emaj        | myschema1_mytbl1_log_seq  |          631 |            33 | t
 emaj        | myschema1_mytbl2_log_seq  |          631 |             3 | t
 emaj        | myschema1_mytbl4_log_seq  |          631 |            14 | t
 emajb       | myschema1_mytbl2b_log_seq |          631 |             1 | f
 emajC       | myschema1_myTbl3_log_seq  |          631 |            45 | t
 emaj        | myschema1_mytbl1_log_seq  |          632 |            33 | t
 emaj        | myschema1_mytbl2_log_seq  |          632 |             3 | t
 emaj        | myschema1_mytbl4_log_seq  |          632 |            14 | t
 emajb       | myschema1_mytbl2b_log_seq |          632 |             1 | f
 emajC       | myschema1_myTbl3_log_seq  |          632 |            45 | t
 emaj        | myschema1_mytbl1_log_seq  |          659 |            53 | t
 emaj        | myschema1_mytbl2_log_seq  |          659 |             3 | t
 emaj        | myschema1_mytbl4_log_seq  |          659 |            14 | t
 emajb       | myschema1_mytbl2b_log_seq |          659 |             1 | f
 emajC       | myschema1_myTbl3_log_seq  |          659 |            45 | t
 emaj        | myschema1_mytbl1_log_seq  |          662 |            79 | t
 emaj        | myschema1_mytbl2_log_seq  |          662 |             6 | t
 emaj        | myschema1_mytbl4_log_seq  |          662 |            14 | t
 emajb       | myschema1_mytbl2b_log_seq |          662 |             1 | f
 emajC       | myschema1_myTbl3_log_seq  |          662 |            45 | t
 emaj        | myschema1_mytbl1_log_seq  |          663 |            79 | t
 emaj        | myschema1_mytbl2_log_seq  |          663 |             7 | t
 emaj        | myschema1_mytbl4_log_seq  |          663 |            14 | t
 emajb       | myschema1_mytbl2b_log_seq |          663 |             1 | f
 emajC       | myschema1_myTbl3_log_seq  |          663 |            45 | t
 emaj        | myschema1_mytbl1_log_seq  |          667 |            79 | t
 emaj        | myschema1_mytbl2_log_seq  |          667 |             7 | t
 emaj        | myschema1_mytbl4_log_seq  |          667 |            17 | t
 emajb       | myschema1_mytbl2b_log_seq |          667 |             1 | f
 emajC       | myschema1_myTbl3_log_seq  |          667 |            65 | t
 emaj        | myschema1_mytbl1_log_seq  |          668 |            79 | t
 emaj        | myschema1_mytbl2_log_seq  |          668 |             7 | t
 emaj        | myschema1_mytbl4_log_seq  |          668 |            17 | t
 emajb       | myschema1_mytbl2b_log_seq |          668 |             1 | f
 emajC       | myschema1_myTbl3_log_seq  |          668 |            65 | t
 emaj        | myschema1_mytbl1_log_seq  |          675 |           105 | t
 emaj        | myschema1_mytbl2_log_seq  |          675 |            12 | t
 emaj        | myschema1_mytbl4_log_seq  |          675 |            20 | t
 emajb       | myschema1_mytbl2b_log_seq |          675 |             1 | f
 emajC       | myschema1_myTbl3_log_seq  |          675 |            85 | t
 emaj        | myschema1_mytbl1_log_seq  |          676 |           105 | t
 emaj        | myschema1_mytbl2_log_seq  |          676 |            12 | t
 emaj        | myschema1_mytbl4_log_seq  |          676 |            20 | t
 emajb       | myschema1_mytbl2b_log_seq |          676 |             1 | f
 emajC       | myschema1_myTbl3_log_seq  |          676 |            85 | t
 emaj        | myschema1_mytbl1_log_seq  |          681 |           127 | t
 emaj        | myschema1_mytbl2_log_seq  |          681 |            12 | t
 emaj        | myschema1_mytbl4_log_seq  |          681 |            23 | t
 emajb       | myschema1_mytbl2b_log_seq |          681 |             1 | f
 emajC       | myschema1_myTbl3_log_seq  |          681 |            85 | t
 emaj        | myschema1_mytbl1_log_seq  |          682 |           127 | t
 emaj        | myschema1_mytbl2_log_seq  |          682 |            12 | t
 emaj        | myschema1_mytbl4_log_seq  |          682 |            23 | t
 emajb       | myschema1_mytbl2b_log_seq |          682 |             1 | f
 emajC       | myschema1_myTbl3_log_seq  |          682 |            85 | t
 emaj        | myschema1_mytbl1_log_seq  |          685 |           153 | t
 emaj        | myschema1_mytbl2_log_seq  |          685 |            15 | t
 emaj        | myschema1_mytbl4_log_seq  |          685 |            23 | t
 emajb       | myschema1_mytbl2b_log_seq |          685 |             1 | f
 emajC       | myschema1_myTbl3_log_seq  |          685 |            85 | t
 emaj        | myschema1_mytbl1_log_seq  |          686 |           153 | t
 emaj        | myschema1_mytbl2_log_seq  |          686 |            15 | t
 emaj        | myschema1_mytbl4_log_seq  |          686 |            23 | t
 emajb       | myschema1_mytbl2b_log_seq |          686 |             1 | f
 emajC       | myschema1_myTbl3_log_seq  |          686 |            85 | t
 emaj        | myschema1_mytbl1_log_seq  |          687 |           153 | t
 emaj        | myschema1_mytbl2_log_seq  |          687 |            16 | t
 emaj        | myschema1_mytbl4_log_seq  |          687 |            23 | t
 emajb       | myschema1_mytbl2b_log_seq |          687 |             1 | f
 emajC       | myschema1_myTbl3_log_seq  |          687 |            85 | t
 emaj        | myschema1_mytbl1_log_seq  |          688 |           164 | t
 emaj        | myschema1_mytbl2_log_seq  |          688 |            18 | t
 emaj        | myschema1_mytbl4_log_seq  |          688 |            23 | t
 emajb       | myschema1_mytbl2b_log_seq |          688 |             1 | f
 emajC       | myschema1_myTbl3_log_seq  |          688 |            85 | t
(95 rows)

select sqhl_schema, sqhl_table, sqhl_begin_time_id, sqhl_end_time_id, sqhl_hole_size from emaj.emaj_seq_hole where sqhl_schema = 'myschema1' order by 1,2,3;
 sqhl_schema | sqhl_table | sqhl_begin_time_id | sqhl_end_time_id | sqhl_hole_size 
-------------+------------+--------------------+------------------+----------------
 myschema1   | mytbl1     |                616 |              621 |              1
 myschema1   | mytbl1     |                632 |              648 |             20
 myschema1   | mytbl1     |                659 |              662 |             26
 myschema1   | mytbl1     |                668 |              675 |             26
 myschema1   | mytbl1     |                676 |              681 |             22
 myschema1   | mytbl1     |                682 |              685 |             26
 myschema1   | mytbl2     |                659 |              662 |              3
 myschema1   | mytbl2     |                668 |              675 |              5
 myschema1   | mytbl2     |                682 |              685 |              3
 myschema1   | myTbl3     |                663 |              667 |             20
 myschema1   | myTbl3     |                668 |              675 |             20
 myschema1   | mytbl4     |                616 |              621 |              2
 myschema1   | mytbl4     |                663 |              667 |              3
 myschema1   | mytbl4     |                668 |              675 |              3
 myschema1   | mytbl4     |                676 |              681 |              3
(15 rows)

select emaj.emaj_rollback_group('myGroup1','Multi-1');
 emaj_rollback_group 
---------------------
                   3
(1 row)

-----------------------------
-- test end: check, reset history and force sequences id
-----------------------------
-- first set all rollback events state
select emaj.emaj_cleanup_rollback_state();
 emaj_cleanup_rollback_state 
-----------------------------
                           2
(1 row)

-- check rollback related tables
select rlbk_id, rlbk_groups, rlbk_mark, rlbk_time_id, rlbk_is_logged, rlbk_nb_session, rlbk_nb_table, rlbk_nb_sequence, 
       rlbk_eff_nb_table, rlbk_status, rlbk_begin_hist_id, rlbk_is_dblink_used,
       case when rlbk_end_datetime is null then 'null' else '[ts]' end as "end_datetime", rlbk_msg
  from emaj.emaj_rlbk order by rlbk_id;
 rlbk_id |      rlbk_groups      |      rlbk_mark       | rlbk_time_id | rlbk_is_logged | rlbk_nb_session | rlbk_nb_table | rlbk_nb_sequence | rlbk_eff_nb_table | rlbk_status | rlbk_begin_hist_id | rlbk_is_dblink_used | end_datetime |                         rlbk_msg                          
---------+-----------------------+----------------------+--------------+----------------+-----------------+---------------+------------------+-------------------+-------------+--------------------+---------------------+--------------+-----------------------------------------------------------
       1 | {myGroup1}            | Different_Mark       |          406 | f              |               1 |             5 |                1 |                 0 | COMMITTED   |               4036 | f                   | [ts]         | Completed: 0 tables and 1 sequences effectively processed
       4 | {myGroup1}            | Different_Mark       |          415 | f              |               1 |             5 |                1 |                 0 | COMMITTED   |               4088 | f                   | [ts]         | Completed: 0 tables and 1 sequences effectively processed
       5 | {myGroup2}            | Mark21               |          416 | f              |               1 |             6 |                2 |                 0 | COMMITTED   |               4094 | f                   | [ts]         | Completed: 0 tables and 2 sequences effectively processed
       6 | {myGroup1}            | Different_Mark       |          417 | t              |               1 |             5 |                1 |                 0 | COMMITTED   |               4102 | f                   | [ts]         | Completed: 0 tables and 1 sequences effectively processed
       7 | {myGroup2}            | Mark21               |          419 | t              |               1 |             6 |                2 |                 0 | COMMITTED   |               4112 | f                   | [ts]         | Completed: 0 tables and 2 sequences effectively processed
       8 | {myGroup1,myGroup2}   | Mark1B               |          422 | f              |               1 |            11 |                3 |                 0 | COMMITTED   |               4127 | f                   | [ts]         | Completed: 0 tables and 3 sequences effectively processed
       9 | {myGroup1,myGroup2}   | Mark1B               |          423 | f              |               1 |            11 |                3 |                 0 | COMMITTED   |               4135 | f                   | [ts]         | Completed: 0 tables and 3 sequences effectively processed
      10 | {myGroup1,myGroup2}   | Mark1B               |          424 | t              |               1 |            11 |                3 |                 0 | COMMITTED   |               4143 | f                   | [ts]         | Completed: 0 tables and 3 sequences effectively processed
      11 | {myGroup1,myGroup2}   | Mark1B               |          426 | t              |               1 |            11 |                3 |                 0 | COMMITTED   |               4155 | t                   | [ts]         | Completed: 0 tables and 3 sequences effectively processed
      12 | {myGroup1}            | Mark12               |          433 | f              |               1 |             5 |                1 |                 2 | COMMITTED   |               4195 | t                   | [ts]         | Completed: 2 tables and 1 sequences effectively processed
      13 | {myGroup1}            | Mark11               |          434 | f              |               1 |             5 |                1 |                 3 | COMMITTED   |               4207 | t                   | [ts]         | Completed: 3 tables and 1 sequences effectively processed
      14 | {myGroup1}            | Mark12               |          439 | t              |               1 |             5 |                1 |                 2 | COMMITTED   |               4243 | t                   | [ts]         | Completed: 2 tables and 1 sequences effectively processed
      15 | {myGroup1}            | Mark11               |          441 | t              |               1 |             5 |                1 |                 5 | COMMITTED   |               4258 | t                   | [ts]         | Completed: 5 tables and 1 sequences effectively processed
      16 | {myGroup1}            | Mark13               |          443 | f              |               1 |             5 |                1 |                 5 | COMMITTED   |               4280 | t                   | [ts]         | Completed: 5 tables and 1 sequences effectively processed
      17 | {myGroup4}            | mark1                |          446 | t              |               1 |             3 |                0 |                 3 | COMMITTED   |               4313 | t                   | [ts]         | Completed: 3 tables and 0 sequences effectively processed
      18 | {myGroup4}            | myGroup4_start       |          448 | f              |               1 |             3 |                0 |                 3 | COMMITTED   |               4329 | t                   | [ts]         | Completed: 3 tables and 0 sequences effectively processed
      19 | {myGroup1}            | Conso_M1             |          450 | t              |               1 |             5 |                1 |                 0 | COMMITTED   |               4351 | t                   | [ts]         | Completed: 0 tables and 1 sequences effectively processed
      20 | {myGroup1}            | Conso_M2             |          454 | t              |               1 |             5 |                1 |                 3 | COMMITTED   |               4373 | t                   | [ts]         | Completed: 3 tables and 1 sequences effectively processed
      21 | {myGroup1}            | Conso_M1             |          456 | f              |               1 |             5 |                1 |                 2 | COMMITTED   |               4398 | t                   | [ts]         | Completed: 2 tables and 1 sequences effectively processed
      22 | {myGroup4}            | myGroup4_start       |          457 | f              |               1 |             3 |                0 |                 0 | ABORTED     |               4412 | t                   | [ts]         | Completed: 0 tables and 0 sequences effectively processed
     100 | {myGroup2}            | M2                   |          610 | t              |               1 |             6 |                2 |                 3 | COMMITTED   |               6066 | f                   | [ts]         | Completed: 3 tables and 2 sequences effectively processed
     101 | {myGroup2}            | M3                   |          612 | t              |               1 |             6 |                2 |                 3 | COMMITTED   |               6083 | f                   | [ts]         | Completed: 3 tables and 2 sequences effectively processed
     102 | {myGroup1}            | M2                   |          614 | f              |               1 |             5 |                1 |                 2 | COMMITTED   |               6100 | t                   | [ts]         | Completed: 2 tables and 1 sequences effectively processed
     103 | {myGroup2}            | M2                   |          618 | t              |               1 |             6 |                2 |                 3 | COMMITTED   |               6125 | t                   | [ts]         | Completed: 3 tables and 2 sequences effectively processed
     104 | {myGroup2}            | M3                   |          620 | f              |               1 |             6 |                2 |                 3 | COMMITTED   |               6143 | t                   | [ts]         | Completed: 3 tables and 2 sequences effectively processed
     105 | {myGroup1}            | M5                   |          621 | f              |               1 |             5 |                1 |                 2 | COMMITTED   |               6163 | t                   | [ts]         | Completed: 2 tables and 1 sequences effectively processed
     106 | {myGroup1}            | M4                   |          622 | t              |               1 |             5 |                1 |                 3 | COMMITTED   |               6175 | t                   | [ts]         | Completed: 3 tables and 1 sequences effectively processed
     107 | {myGroup1,myGroup2}   | Multi-1              |          627 | t              |               1 |            11 |                3 |                 0 | COMMITTED   |               6223 | t                   | [ts]         | Completed: 0 tables and 3 sequences effectively processed
     108 | {myGroup1,myGroup2}   | Multi-2              |          629 | f              |               1 |            11 |                3 |                 0 | COMMITTED   |               6236 | t                   | [ts]         | Completed: 0 tables and 3 sequences effectively processed
     109 | {myGroup1,myGroup2}   | Multi-1              |          630 | f              |               1 |            11 |                3 |                 0 | COMMITTED   |               6249 | t                   | [ts]         | Completed: 0 tables and 3 sequences effectively processed
     110 | {myGroup2}            | Multi-2              |          634 | f              |               1 |             6 |                2 |                 0 | COMMITTED   |               6282 | t                   | [ts]         | Completed: 0 tables and 2 sequences effectively processed
     111 | {"phil's group#3\","} | phil's mark #3       |          645 | t              |               1 |             2 |                2 |                 0 | COMMITTED   |               6356 | t                   | [ts]         | Completed: 0 tables and 2 sequences effectively processed
     112 | {"phil's group#3\","} | phil's mark #3       |          647 | f              |               1 |             2 |                2 |                 0 | COMMITTED   |               6368 | t                   | [ts]         | Completed: 0 tables and 2 sequences effectively processed
     113 | {myGroup1}            | Multi-1              |          648 | f              |               1 |             5 |                1 |                 1 | COMMITTED   |               6378 | t                   | [ts]         | Completed: 1 tables and 1 sequences effectively processed
     114 | {myGroup1}            | Multi-1              |          649 | f              |               1 |             5 |                1 |                 0 | ABORTED     |               6399 | t                   | [ts]         | Completed: 0 tables and 1 sequences effectively processed
     115 | {myGroup2}            | Multi-1              |          650 | f              |               1 |             6 |                2 |                 2 | ABORTED     |               6406 | t                   | [ts]         | Completed: 2 tables and 2 sequences effectively processed
     116 | {"phil's group#3\","} | M1_rollbackable      |          651 | f              |               1 |             2 |                2 |                 2 | ABORTED     |               6418 | t                   | [ts]         | Completed: 2 tables and 2 sequences effectively processed
     117 | {"phil's group#3\","} | M1_after_alter_group |          656 | f              |               1 |             2 |                2 |                 1 | COMMITTED   |               6462 | t                   | [ts]         | Completed: 1 tables and 2 sequences effectively processed
     118 | {myGroup1}            | MC1                  |          661 | t              |               1 |             5 |                1 |                 2 | COMMITTED   |               6501 | t                   | [ts]         | Completed: 2 tables and 1 sequences effectively processed
     119 | {myGroup1}            | MC3                  |          666 | t              |               1 |             5 |                1 |                 2 | COMMITTED   |               6531 | t                   | [ts]         | Completed: 2 tables and 1 sequences effectively processed
     120 | {myGroup1}            | MC8                  |          671 | t              |               1 |             5 |                1 |                 1 | COMMITTED   |               6563 | t                   | [ts]         | Completed: 1 tables and 1 sequences effectively processed
     121 | {myGroup1}            | MC6                  |          674 | t              |               1 |             5 |                1 |                 4 | COMMITTED   |               6583 | t                   | [ts]         | Completed: 4 tables and 1 sequences effectively processed
     122 | {myGroup1}            | MC10                 |          677 | t              |               1 |             5 |                1 |                 1 | COMMITTED   |               6609 | t                   | [ts]         | Completed: 1 tables and 1 sequences effectively processed
     123 | {myGroup1}            | MC10                 |          680 | t              |               1 |             5 |                1 |                 2 | COMMITTED   |               6627 | t                   | [ts]         | Completed: 2 tables and 1 sequences effectively processed
     124 | {myGroup1}            | MC15                 |          684 | t              |               1 |             5 |                1 |                 2 | COMMITTED   |               6653 | t                   | [ts]         | Completed: 2 tables and 1 sequences effectively processed
     125 | {myGroup1}            | MC16                 |          687 | t              |               1 |             5 |                1 |                 2 | COMMITTED   |               6675 | t                   | [ts]         | Completed: 2 tables and 1 sequences effectively processed
     126 | {myGroup1}            | Multi-1              |          689 | f              |               1 |             5 |                1 |                 2 | COMMITTED   |               6692 | t                   | [ts]         | Completed: 2 tables and 1 sequences effectively processed
(47 rows)

select rlbs_rlbk_id, rlbs_session, 
       case when rlbs_end_datetime is null then 'null' else '[ts]' end as "end_datetime"
  from emaj.emaj_rlbk_session order by rlbs_rlbk_id, rlbs_session;
 rlbs_rlbk_id | rlbs_session | end_datetime 
--------------+--------------+--------------
          100 |            1 | [ts]
          101 |            1 | [ts]
          102 |            1 | [ts]
          103 |            1 | [ts]
          104 |            1 | [ts]
          105 |            1 | [ts]
          106 |            1 | [ts]
          107 |            1 | [ts]
          108 |            1 | [ts]
          109 |            1 | [ts]
          110 |            1 | [ts]
          111 |            1 | [ts]
          112 |            1 | [ts]
          113 |            1 | [ts]
          114 |            1 | [ts]
          115 |            1 | [ts]
          116 |            1 | [ts]
          117 |            1 | [ts]
          118 |            1 | [ts]
          119 |            1 | [ts]
          120 |            1 | [ts]
          121 |            1 | [ts]
          122 |            1 | [ts]
          123 |            1 | [ts]
          124 |            1 | [ts]
          125 |            1 | [ts]
          126 |            1 | [ts]
(27 rows)

select rlbp_rlbk_id, rlbp_step, rlbp_schema, rlbp_table, rlbp_fkey, rlbp_batch_number, rlbp_session,
       rlbp_fkey_def, rlbp_estimated_quantity, rlbp_estimate_method, rlbp_quantity
  from emaj.emaj_rlbk_plan order by rlbp_rlbk_id, rlbp_step, rlbp_schema, rlbp_table, rlbp_fkey;
 rlbp_rlbk_id |  rlbp_step  |  rlbp_schema   |                           rlbp_table                            |     rlbp_fkey     | rlbp_batch_number | rlbp_session |                                                                                        rlbp_fkey_def                                                                                        | rlbp_estimated_quantity | rlbp_estimate_method | rlbp_quantity 
--------------+-------------+----------------+-----------------------------------------------------------------+-------------------+-------------------+--------------+---------------------------------------------------------------------------------------------------------------------------------------------------------------------------------------------+-------------------------+----------------------+---------------
          100 | DROP_FK     | myschema2      | mytbl4                                                          | mytbl4_col44_fkey |                 1 |            1 |                                                                                                                                                                                             |                         |                    3 |              
          100 | SET_FK_DEF  | myschema2      | mytbl6                                                          | mytbl6_col61_fkey |                 2 |            1 |                                                                                                                                                                                             |                         |                    3 |              
          100 | SET_FK_DEF  | myschema2      | mytbl8                                                          | mytbl8_col81_fkey |                 2 |            1 |                                                                                                                                                                                             |                         |                    3 |              
          100 | RLBK_TABLE  | myschema2      | mytbl4                                                          |                   |                 1 |            1 |                                                                                                                                                                                             |                       4 |                    3 |             2
          100 | RLBK_TABLE  | myschema2      | mytbl5                                                          |                   |                 3 |            1 |                                                                                                                                                                                             |                       1 |                    3 |             1
          100 | RLBK_TABLE  | myschema2      | mytbl6                                                          |                   |                 2 |            1 |                                                                                                                                                                                             |                       3 |                    3 |             3
          100 | SET_FK_IMM  | myschema2      | mytbl4                                                          | mytbl4_col43_fkey |                 1 |            1 |                                                                                                                                                                                             |                       4 |                    3 |              
          100 | SET_FK_IMM  | myschema2      | mytbl6                                                          | mytbl6_col61_fkey |                 2 |            1 |                                                                                                                                                                                             |                       3 |                    3 |              
          100 | SET_FK_IMM  | myschema2      | mytbl8                                                          | mytbl8_col81_fkey |                 2 |            1 |                                                                                                                                                                                             |                       3 |                    3 |              
          100 | ADD_FK      | myschema2      | mytbl4                                                          | mytbl4_col44_fkey |                 1 |            1 | FOREIGN KEY (col44, col45) REFERENCES mytbl1(col11, col12) ON UPDATE SET NULL ON DELETE CASCADE                                                                                             |                       2 |                    3 |              
          100 | CTRL-DBLINK |                |                                                                 |                   |                   |              |                                                                                                                                                                                             |                      10 |                    3 |              
          101 | DROP_FK     | myschema2      | mytbl4                                                          | mytbl4_col44_fkey |                 2 |            1 |                                                                                                                                                                                             |                         |                    2 |              
          101 | SET_FK_DEF  | myschema2      | mytbl6                                                          | mytbl6_col61_fkey |                 1 |            1 |                                                                                                                                                                                             |                         |                    2 |              
          101 | SET_FK_DEF  | myschema2      | mytbl8                                                          | mytbl8_col81_fkey |                 1 |            1 |                                                                                                                                                                                             |                         |                    2 |              
          101 | RLBK_TABLE  | myschema2      | mytbl4                                                          |                   |                 2 |            1 |                                                                                                                                                                                             |                       2 |                    1 |             2
          101 | RLBK_TABLE  | myschema2      | mytbl5                                                          |                   |                 3 |            1 |                                                                                                                                                                                             |                       1 |                    1 |             1
          101 | RLBK_TABLE  | myschema2      | mytbl6                                                          |                   |                 1 |            1 |                                                                                                                                                                                             |                       3 |                    1 |             3
          101 | SET_FK_IMM  | myschema2      | mytbl4                                                          | mytbl4_col43_fkey |                 2 |            1 |                                                                                                                                                                                             |                       2 |                    2 |              
          101 | SET_FK_IMM  | myschema2      | mytbl6                                                          | mytbl6_col61_fkey |                 1 |            1 |                                                                                                                                                                                             |                       3 |                    2 |              
          101 | SET_FK_IMM  | myschema2      | mytbl8                                                          | mytbl8_col81_fkey |                 1 |            1 |                                                                                                                                                                                             |                       3 |                    2 |              
          101 | ADD_FK      | myschema2      | mytbl4                                                          | mytbl4_col44_fkey |                 2 |            1 | FOREIGN KEY (col44, col45) REFERENCES mytbl1(col11, col12) ON UPDATE SET NULL ON DELETE CASCADE                                                                                             |                       2 |                    1 |              
          101 | CTRL-DBLINK |                |                                                                 |                   |                   |              |                                                                                                                                                                                             |                      10 |                    2 |              
          102 | DIS_LOG_TRG | myschema1      | mytbl1                                                          |                   |                 1 |            1 |                                                                                                                                                                                             |                         |                    3 |              
          102 | DIS_LOG_TRG | myschema1      | mytbl4                                                          |                   |                 1 |            1 |                                                                                                                                                                                             |                         |                    3 |              
          102 | DROP_FK     | myschema1      | mytbl4                                                          | mytbl4_col44_fkey |                 1 |            1 |                                                                                                                                                                                             |                         |                    2 |              
          102 | SET_FK_DEF  | myschema1      | mytbl4                                                          | mytbl4_col43_fkey |                 1 |            1 |                                                                                                                                                                                             |                         |                    2 |              
          102 | RLBK_TABLE  | myschema1      | mytbl1                                                          |                   |                 1 |            1 |                                                                                                                                                                                             |                       3 |                    3 |             5
          102 | RLBK_TABLE  | myschema1      | mytbl4                                                          |                   |                 1 |            1 |                                                                                                                                                                                             |                       8 |                    3 |             3
          102 | DELETE_LOG  | myschema1      | mytbl1                                                          |                   |                 1 |            1 |                                                                                                                                                                                             |                       3 |                    3 |             5
          102 | DELETE_LOG  | myschema1      | mytbl4                                                          |                   |                 1 |            1 |                                                                                                                                                                                             |                       8 |                    3 |            12
          102 | SET_FK_IMM  | myschema1      | mytbl4                                                          | mytbl4_col43_fkey |                 1 |            1 |                                                                                                                                                                                             |                       8 |                    3 |              
          102 | ADD_FK      | myschema1      | mytbl4                                                          | mytbl4_col44_fkey |                 1 |            1 | FOREIGN KEY (col44, col45) REFERENCES myschema1.mytbl1(col11, col12) ON UPDATE SET NULL ON DELETE CASCADE DEFERRABLE INITIALLY DEFERRED                                                     |                       0 |                    3 |              
          102 | ENA_LOG_TRG | myschema1      | mytbl1                                                          |                   |                 1 |            1 |                                                                                                                                                                                             |                         |                    3 |              
          102 | ENA_LOG_TRG | myschema1      | mytbl4                                                          |                   |                 1 |            1 |                                                                                                                                                                                             |                         |                    3 |              
          102 | CTRL+DBLINK |                |                                                                 |                   |                   |              |                                                                                                                                                                                             |                      12 |                    3 |              
          103 | DROP_FK     | myschema2      | mytbl4                                                          | mytbl4_col44_fkey |                 2 |            1 |                                                                                                                                                                                             |                         |                    2 |              
          103 | SET_FK_DEF  | myschema2      | mytbl6                                                          | mytbl6_col61_fkey |                 1 |            1 |                                                                                                                                                                                             |                         |                    2 |              
          103 | SET_FK_DEF  | myschema2      | mytbl8                                                          | mytbl8_col81_fkey |                 1 |            1 |                                                                                                                                                                                             |                         |                    2 |              
          103 | RLBK_TABLE  | myschema2      | mytbl4                                                          |                   |                 2 |            1 |                                                                                                                                                                                             |                       8 |                    1 |             2
          103 | RLBK_TABLE  | myschema2      | mytbl5                                                          |                   |                 3 |            1 |                                                                                                                                                                                             |                       3 |                    1 |             1
          103 | RLBK_TABLE  | myschema2      | mytbl6                                                          |                   |                 1 |            1 |                                                                                                                                                                                             |                       9 |                    1 |             3
          103 | SET_FK_IMM  | myschema2      | mytbl4                                                          | mytbl4_col43_fkey |                 2 |            1 |                                                                                                                                                                                             |                       8 |                    2 |              
          103 | SET_FK_IMM  | myschema2      | mytbl6                                                          | mytbl6_col61_fkey |                 1 |            1 |                                                                                                                                                                                             |                       9 |                    2 |              
          103 | SET_FK_IMM  | myschema2      | mytbl8                                                          | mytbl8_col81_fkey |                 1 |            1 |                                                                                                                                                                                             |                       9 |                    2 |              
          103 | ADD_FK      | myschema2      | mytbl4                                                          | mytbl4_col44_fkey |                 2 |            1 | FOREIGN KEY (col44, col45) REFERENCES myschema2.mytbl1(col11, col12) ON UPDATE SET NULL ON DELETE CASCADE                                                                                   |                       2 |                    1 |              
          103 | CTRL+DBLINK |                |                                                                 |                   |                   |              |                                                                                                                                                                                             |                      10 |                    2 |              
          104 | DIS_LOG_TRG | myschema2      | mytbl4                                                          |                   |                 2 |            1 |                                                                                                                                                                                             |                         |                    2 |              
          104 | DIS_LOG_TRG | myschema2      | mytbl5                                                          |                   |                 3 |            1 |                                                                                                                                                                                             |                         |                    2 |              
          104 | DIS_LOG_TRG | myschema2      | mytbl6                                                          |                   |                 1 |            1 |                                                                                                                                                                                             |                         |                    2 |              
          104 | DROP_FK     | myschema2      | mytbl4                                                          | mytbl4_col44_fkey |                 2 |            1 |                                                                                                                                                                                             |                         |                    2 |              
          104 | SET_FK_DEF  | myschema2      | mytbl6                                                          | mytbl6_col61_fkey |                 1 |            1 |                                                                                                                                                                                             |                         |                    2 |              
          104 | SET_FK_DEF  | myschema2      | mytbl8                                                          | mytbl8_col81_fkey |                 1 |            1 |                                                                                                                                                                                             |                         |                    2 |              
          104 | RLBK_TABLE  | myschema2      | mytbl4                                                          |                   |                 2 |            1 |                                                                                                                                                                                             |                       6 |                    1 |             2
          104 | RLBK_TABLE  | myschema2      | mytbl5                                                          |                   |                 3 |            1 |                                                                                                                                                                                             |                       3 |                    1 |             1
          104 | RLBK_TABLE  | myschema2      | mytbl6                                                          |                   |                 1 |            1 |                                                                                                                                                                                             |                       9 |                    1 |             3
          104 | DELETE_LOG  | myschema2      | mytbl4                                                          |                   |                 2 |            1 |                                                                                                                                                                                             |                       6 |                    3 |             6
          104 | DELETE_LOG  | myschema2      | mytbl5                                                          |                   |                 3 |            1 |                                                                                                                                                                                             |                       3 |                    3 |             3
          104 | DELETE_LOG  | myschema2      | mytbl6                                                          |                   |                 1 |            1 |                                                                                                                                                                                             |                       9 |                    3 |             9
          104 | SET_FK_IMM  | myschema2      | mytbl4                                                          | mytbl4_col43_fkey |                 2 |            1 |                                                                                                                                                                                             |                       6 |                    2 |              
          104 | SET_FK_IMM  | myschema2      | mytbl6                                                          | mytbl6_col61_fkey |                 1 |            1 |                                                                                                                                                                                             |                       9 |                    2 |              
          104 | SET_FK_IMM  | myschema2      | mytbl8                                                          | mytbl8_col81_fkey |                 1 |            1 |                                                                                                                                                                                             |                       9 |                    2 |              
          104 | ADD_FK      | myschema2      | mytbl4                                                          | mytbl4_col44_fkey |                 2 |            1 | FOREIGN KEY (col44, col45) REFERENCES myschema2.mytbl1(col11, col12) ON UPDATE SET NULL ON DELETE CASCADE                                                                                   |                       2 |                    1 |              
          104 | ENA_LOG_TRG | myschema2      | mytbl4                                                          |                   |                 2 |            1 |                                                                                                                                                                                             |                         |                    2 |              
          104 | ENA_LOG_TRG | myschema2      | mytbl5                                                          |                   |                 3 |            1 |                                                                                                                                                                                             |                         |                    2 |              
          104 | ENA_LOG_TRG | myschema2      | mytbl6                                                          |                   |                 1 |            1 |                                                                                                                                                                                             |                         |                    2 |              
          104 | CTRL+DBLINK |                |                                                                 |                   |                   |              |                                                                                                                                                                                             |                      19 |                    2 |              
          105 | DIS_LOG_TRG | myschema1      | mytbl1                                                          |                   |                 1 |            1 |                                                                                                                                                                                             |                         |                    2 |              
          105 | DIS_LOG_TRG | myschema1      | mytbl4                                                          |                   |                 1 |            1 |                                                                                                                                                                                             |                         |                    2 |              
          105 | DROP_FK     | myschema1      | mytbl4                                                          | mytbl4_col44_fkey |                 1 |            1 |                                                                                                                                                                                             |                         |                    2 |              
          105 | SET_FK_DEF  | myschema1      | mytbl4                                                          | mytbl4_col43_fkey |                 1 |            1 |                                                                                                                                                                                             |                         |                    2 |              
          105 | RLBK_TABLE  | myschema1      | mytbl1                                                          |                   |                 1 |            1 |                                                                                                                                                                                             |                       1 |                    1 |             1
          105 | RLBK_TABLE  | myschema1      | mytbl4                                                          |                   |                 1 |            1 |                                                                                                                                                                                             |                       2 |                    1 |             2
          105 | DELETE_LOG  | myschema1      | mytbl1                                                          |                   |                 1 |            1 |                                                                                                                                                                                             |                       1 |                    1 |             1
          105 | DELETE_LOG  | myschema1      | mytbl4                                                          |                   |                 1 |            1 |                                                                                                                                                                                             |                       2 |                    1 |             2
          105 | SET_FK_IMM  | myschema1      | mytbl4                                                          | mytbl4_col43_fkey |                 1 |            1 |                                                                                                                                                                                             |                       2 |                    2 |              
          105 | ADD_FK      | myschema1      | mytbl4                                                          | mytbl4_col44_fkey |                 1 |            1 | FOREIGN KEY (col44, col45) REFERENCES myschema1.mytbl1(col11, col12) ON UPDATE SET NULL ON DELETE CASCADE DEFERRABLE INITIALLY DEFERRED                                                     |                       0 |                    3 |              
          105 | ENA_LOG_TRG | myschema1      | mytbl1                                                          |                   |                 1 |            1 |                                                                                                                                                                                             |                         |                    2 |              
          105 | ENA_LOG_TRG | myschema1      | mytbl4                                                          |                   |                 1 |            1 |                                                                                                                                                                                             |                         |                    2 |              
          105 | CTRL+DBLINK |                |                                                                 |                   |                   |              |                                                                                                                                                                                             |                      12 |                    2 |              
          106 | DROP_FK     | myschema1      | mytbl4                                                          | mytbl4_col44_fkey |                 2 |            1 |                                                                                                                                                                                             |                         |                    2 |              
          106 | SET_FK_DEF  | myschema1      | mytbl4                                                          | mytbl4_col43_fkey |                 2 |            1 |                                                                                                                                                                                             |                         |                    2 |              
          106 | RLBK_TABLE  | myschema1      | mytbl1                                                          |                   |                 2 |            1 |                                                                                                                                                                                             |                       1 |                    1 |             1
          106 | RLBK_TABLE  | myschema1      | myTbl3                                                          |                   |                 1 |            1 |                                                                                                                                                                                             |                      10 |                    3 |            10
          106 | RLBK_TABLE  | myschema1      | mytbl4                                                          |                   |                 2 |            1 |                                                                                                                                                                                             |                       2 |                    1 |             2
          106 | SET_FK_IMM  | myschema1      | mytbl4                                                          | mytbl4_col43_fkey |                 2 |            1 |                                                                                                                                                                                             |                       2 |                    2 |              
          106 | ADD_FK      | myschema1      | mytbl4                                                          | mytbl4_col44_fkey |                 2 |            1 | FOREIGN KEY (col44, col45) REFERENCES myschema1.mytbl1(col11, col12) ON UPDATE SET NULL ON DELETE CASCADE DEFERRABLE INITIALLY DEFERRED                                                     |                       0 |                    3 |              
          106 | CTRL+DBLINK |                |                                                                 |                   |                   |              |                                                                                                                                                                                             |                       7 |                    2 |              
          113 | DIS_LOG_TRG | myschema1      | mytbl1                                                          |                   |                 1 |            1 |                                                                                                                                                                                             |                         |                    2 |              
          113 | DROP_FK     | myschema1      | mytbl4                                                          | mytbl4_col44_fkey |                 1 |            1 |                                                                                                                                                                                             |                         |                    2 |              
          113 | RLBK_TABLE  | myschema1      | mytbl1                                                          |                   |                 1 |            1 |                                                                                                                                                                                             |                      20 |                    1 |             0
          113 | DELETE_LOG  | myschema1      | mytbl1                                                          |                   |                 1 |            1 |                                                                                                                                                                                             |                      20 |                    1 |             0
          113 | ADD_FK      | myschema1      | mytbl4                                                          | mytbl4_col44_fkey |                 1 |            1 | FOREIGN KEY (col44, col45) REFERENCES myschema1.mytbl1(col11, col12) ON UPDATE SET NULL ON DELETE CASCADE DEFERRABLE INITIALLY DEFERRED                                                     |                       0 |                    3 |              
          113 | ENA_LOG_TRG | myschema1      | mytbl1                                                          |                   |                 1 |            1 |                                                                                                                                                                                             |                         |                    2 |              
          113 | CTRL+DBLINK |                |                                                                 |                   |                   |              |                                                                                                                                                                                             |                       6 |                    2 |              
          115 | DIS_LOG_TRG | myschema2      | mytbl5                                                          |                   |                 2 |            1 |                                                                                                                                                                                             |                         |                    2 |              
          115 | DIS_LOG_TRG | myschema2      | mytbl6                                                          |                   |                 1 |            1 |                                                                                                                                                                                             |                         |                    2 |              
          115 | SET_FK_DEF  | myschema2      | mytbl6                                                          | mytbl6_col61_fkey |                 1 |            1 |                                                                                                                                                                                             |                         |                    2 |              
          115 | SET_FK_DEF  | myschema2      | mytbl8                                                          | mytbl8_col81_fkey |                 1 |            1 |                                                                                                                                                                                             |                         |                    2 |              
          115 | RLBK_TABLE  | myschema2      | mytbl5                                                          |                   |                 2 |            1 |                                                                                                                                                                                             |                       3 |                    1 |             2
          115 | RLBK_TABLE  | myschema2      | mytbl6                                                          |                   |                 1 |            1 |                                                                                                                                                                                             |                      17 |                    1 |            14
          115 | DELETE_LOG  | myschema2      | mytbl5                                                          |                   |                 2 |            1 |                                                                                                                                                                                             |                       3 |                    1 |             4
          115 | DELETE_LOG  | myschema2      | mytbl6                                                          |                   |                 1 |            1 |                                                                                                                                                                                             |                      17 |                    1 |            26
          115 | SET_FK_IMM  | myschema2      | mytbl6                                                          | mytbl6_col61_fkey |                 1 |            1 |                                                                                                                                                                                             |                      17 |                    2 |              
          115 | SET_FK_IMM  | myschema2      | mytbl8                                                          | mytbl8_col81_fkey |                 1 |            1 |                                                                                                                                                                                             |                      17 |                    2 |              
          115 | ENA_LOG_TRG | myschema2      | mytbl5                                                          |                   |                 2 |            1 |                                                                                                                                                                                             |                         |                    2 |              
          115 | ENA_LOG_TRG | myschema2      | mytbl6                                                          |                   |                 1 |            1 |                                                                                                                                                                                             |                         |                    2 |              
          115 | CTRL+DBLINK |                |                                                                 |                   |                   |              |                                                                                                                                                                                             |                      12 |                    2 |              
          116 | DIS_LOG_TRG | phil's schema3 | myTbl2\                                                         |                   |                 2 |            1 |                                                                                                                                                                                             |                         |                    2 |              
          116 | DIS_LOG_TRG | phil's schema3 | phil's tbl1                                                     |                   |                 1 |            1 |                                                                                                                                                                                             |                         |                    2 |              
          116 | DROP_FK     | phil's schema3 | myTbl2\                                                         | mytbl2_col21_fkey |                 2 |            1 |                                                                                                                                                                                             |                         |                    2 |              
          116 | DROP_FK     | phil's schema3 | mytbl4                                                          | mytbl4_col44_fkey |                 1 |            1 |                                                                                                                                                                                             |                         |                    2 |              
          116 | RLBK_TABLE  | phil's schema3 | myTbl2\                                                         |                   |                 2 |            1 |                                                                                                                                                                                             |                       2 |                    3 |             2
          116 | RLBK_TABLE  | phil's schema3 | phil's tbl1                                                     |                   |                 1 |            1 |                                                                                                                                                                                             |                      53 |                    3 |            33
          116 | DELETE_LOG  | phil's schema3 | myTbl2\                                                         |                   |                 2 |            1 |                                                                                                                                                                                             |                       2 |                    3 |             2
          116 | DELETE_LOG  | phil's schema3 | phil's tbl1                                                     |                   |                 1 |            1 |                                                                                                                                                                                             |                      53 |                    3 |            63
          116 | ADD_FK      | phil's schema3 | myTbl2\                                                         | mytbl2_col21_fkey |                 2 |            1 | FOREIGN KEY (col21) REFERENCES "phil's schema3".mytbl4(col41)                                                                                                                               |                       0 |                    3 |              
          116 | ADD_FK      | phil's schema3 | mytbl4                                                          | mytbl4_col44_fkey |                 1 |            1 | FOREIGN KEY (col44, col45) REFERENCES "phil's schema3"."phil's tbl1"("phil's col11", "phil's col12") ON UPDATE SET NULL ON DELETE CASCADE                                                   |                       0 |                    3 |              
          116 | ENA_LOG_TRG | phil's schema3 | myTbl2\                                                         |                   |                 2 |            1 |                                                                                                                                                                                             |                         |                    2 |              
          116 | ENA_LOG_TRG | phil's schema3 | phil's tbl1                                                     |                   |                 1 |            1 |                                                                                                                                                                                             |                         |                    2 |              
          116 | CTRL+DBLINK |                |                                                                 |                   |                   |              |                                                                                                                                                                                             |                      12 |                    2 |              
          117 | DIS_LOG_TRG | phil's schema3 | table_with_very_looooooooooooooooooooooooooooooooooooooong_name |                   |                 1 |            1 |                                                                                                                                                                                             |                         |                    2 |              
          117 | DROP_FK     | phil's schema3 | mytbl4                                                          | mytbl4_col44_fkey |                 1 |            1 |                                                                                                                                                                                             |                         |                    2 |              
          117 | RLBK_TABLE  | phil's schema3 | table_with_very_looooooooooooooooooooooooooooooooooooooong_name |                   |                 1 |            1 |                                                                                                                                                                                             |                       6 |                    3 |            10
          117 | DELETE_LOG  | phil's schema3 | table_with_very_looooooooooooooooooooooooooooooooooooooong_name |                   |                 1 |            1 |                                                                                                                                                                                             |                       6 |                    3 |            10
          117 | ADD_FK      | phil's schema3 | mytbl4                                                          | mytbl4_col44_fkey |                 1 |            1 | FOREIGN KEY (col44, col45) REFERENCES "phil's schema3".table_with_very_looooooooooooooooooooooooooooooooooooooong_name("phil's col11", "phil's col12") ON UPDATE SET NULL ON DELETE CASCADE |                       0 |                    3 |              
          117 | ENA_LOG_TRG | phil's schema3 | table_with_very_looooooooooooooooooooooooooooooooooooooong_name |                   |                 1 |            1 |                                                                                                                                                                                             |                         |                    2 |              
          117 | CTRL+DBLINK |                |                                                                 |                   |                   |              |                                                                                                                                                                                             |                       6 |                    2 |              
          118 | DROP_FK     | myschema1      | mytbl4                                                          | mytbl4_col44_fkey |                 1 |            1 |                                                                                                                                                                                             |                         |                    2 |              
          118 | SET_FK_DEF  | myschema1      | mytbl4                                                          | mytbl4_col43_fkey |                 1 |            1 |                                                                                                                                                                                             |                         |                    2 |              
          118 | RLBK_TABLE  | myschema1      | mytbl1                                                          |                   |                 1 |            1 |                                                                                                                                                                                             |                      15 |                    1 |            13
          118 | RLBK_TABLE  | myschema1      | mytbl2                                                          |                   |                 1 |            1 |                                                                                                                                                                                             |                       2 |                    3 |             1
          118 | SET_FK_IMM  | myschema1      | mytbl4                                                          | mytbl4_col43_fkey |                 1 |            1 |                                                                                                                                                                                             |                       2 |                    2 |              
          118 | ADD_FK      | myschema1      | mytbl4                                                          | mytbl4_col44_fkey |                 1 |            1 | FOREIGN KEY (col44, col45) REFERENCES myschema1.mytbl1(col11, col12) ON UPDATE SET NULL ON DELETE CASCADE DEFERRABLE INITIALLY DEFERRED                                                     |                       0 |                    3 |              
          118 | CTRL+DBLINK |                |                                                                 |                   |                   |              |                                                                                                                                                                                             |                       6 |                    2 |              
          119 | DROP_FK     | myschema1      | mytbl4                                                          | mytbl4_col44_fkey |                 2 |            1 |                                                                                                                                                                                             |                         |                    2 |              
          119 | SET_FK_DEF  | myschema1      | mytbl4                                                          | mytbl4_col43_fkey |                 2 |            1 |                                                                                                                                                                                             |                         |                    2 |              
          119 | RLBK_TABLE  | myschema1      | myTbl3                                                          |                   |                 1 |            1 |                                                                                                                                                                                             |                      10 |                    1 |            10
          119 | RLBK_TABLE  | myschema1      | mytbl4                                                          |                   |                 2 |            1 |                                                                                                                                                                                             |                       2 |                    1 |             1
          119 | SET_FK_IMM  | myschema1      | mytbl4                                                          | mytbl4_col43_fkey |                 2 |            1 |                                                                                                                                                                                             |                       2 |                    2 |              
          119 | ADD_FK      | myschema1      | mytbl4                                                          | mytbl4_col44_fkey |                 2 |            1 | FOREIGN KEY (col44, col45) REFERENCES myschema1.mytbl1(col11, col12) ON UPDATE SET NULL ON DELETE CASCADE DEFERRABLE INITIALLY DEFERRED                                                     |                       0 |                    3 |              
          119 | CTRL+DBLINK |                |                                                                 |                   |                   |              |                                                                                                                                                                                             |                       6 |                    2 |              
          120 | SET_FK_DEF  | myschema1      | mytbl4                                                          | mytbl4_col43_fkey |                 1 |            1 |                                                                                                                                                                                             |                         |                    2 |              
          120 | RLBK_TABLE  | myschema1      | mytbl2                                                          |                   |                 1 |            1 |                                                                                                                                                                                             |                       1 |                    1 |             1
          120 | SET_FK_IMM  | myschema1      | mytbl4                                                          | mytbl4_col43_fkey |                 1 |            1 |                                                                                                                                                                                             |                       1 |                    2 |              
          120 | CTRL+DBLINK |                |                                                                 |                   |                   |              |                                                                                                                                                                                             |                       3 |                    2 |              
          121 | DROP_FK     | myschema1      | mytbl4                                                          | mytbl4_col44_fkey |                 1 |            1 |                                                                                                                                                                                             |                         |                    2 |              
          121 | SET_FK_DEF  | myschema1      | mytbl4                                                          | mytbl4_col43_fkey |                 1 |            1 |                                                                                                                                                                                             |                         |                    2 |              
          121 | RLBK_TABLE  | myschema1      | mytbl1                                                          |                   |                 1 |            1 |                                                                                                                                                                                             |                      15 |                    1 |            13
          121 | RLBK_TABLE  | myschema1      | mytbl2                                                          |                   |                 1 |            1 |                                                                                                                                                                                             |                       2 |                    1 |             1
          121 | RLBK_TABLE  | myschema1      | myTbl3                                                          |                   |                 2 |            1 |                                                                                                                                                                                             |                      10 |                    1 |            10
          121 | RLBK_TABLE  | myschema1      | mytbl4                                                          |                   |                 1 |            1 |                                                                                                                                                                                             |                       2 |                    1 |             1
          121 | SET_FK_IMM  | myschema1      | mytbl4                                                          | mytbl4_col43_fkey |                 1 |            1 |                                                                                                                                                                                             |                       4 |                    2 |              
          121 | ADD_FK      | myschema1      | mytbl4                                                          | mytbl4_col44_fkey |                 1 |            1 | FOREIGN KEY (col44, col45) REFERENCES myschema1.mytbl1(col11, col12) ON UPDATE SET NULL ON DELETE CASCADE DEFERRABLE INITIALLY DEFERRED                                                     |                       0 |                    3 |              
          121 | CTRL+DBLINK |                |                                                                 |                   |                   |              |                                                                                                                                                                                             |                       8 |                    2 |              
          122 | DROP_FK     | myschema1      | mytbl4                                                          | mytbl4_col44_fkey |                 1 |            1 |                                                                                                                                                                                             |                         |                    2 |              
          122 | RLBK_TABLE  | myschema1      | mytbl1                                                          |                   |                 1 |            1 |                                                                                                                                                                                             |                      16 |                    1 |            11
          122 | ADD_FK      | myschema1      | mytbl4                                                          | mytbl4_col44_fkey |                 1 |            1 | FOREIGN KEY (col44, col45) REFERENCES myschema1.mytbl1(col11, col12) ON UPDATE SET NULL ON DELETE CASCADE DEFERRABLE INITIALLY DEFERRED                                                     |                       0 |                    3 |              
          122 | CTRL+DBLINK |                |                                                                 |                   |                   |              |                                                                                                                                                                                             |                       3 |                    2 |              
          123 | DROP_FK     | myschema1      | mytbl4                                                          | mytbl4_col44_fkey |                 1 |            1 |                                                                                                                                                                                             |                         |                    2 |              
          123 | SET_FK_DEF  | myschema1      | mytbl4                                                          | mytbl4_col43_fkey |                 1 |            1 |                                                                                                                                                                                             |                         |                    2 |              
          123 | RLBK_TABLE  | myschema1      | mytbl1                                                          |                   |                 1 |            1 |                                                                                                                                                                                             |                      22 |                    1 |            11
          123 | RLBK_TABLE  | myschema1      | mytbl4                                                          |                   |                 1 |            1 |                                                                                                                                                                                             |                       2 |                    1 |             1
          123 | SET_FK_IMM  | myschema1      | mytbl4                                                          | mytbl4_col43_fkey |                 1 |            1 |                                                                                                                                                                                             |                       2 |                    2 |              
          123 | ADD_FK      | myschema1      | mytbl4                                                          | mytbl4_col44_fkey |                 1 |            1 | FOREIGN KEY (col44, col45) REFERENCES myschema1.mytbl1(col11, col12) ON UPDATE SET NULL ON DELETE CASCADE DEFERRABLE INITIALLY DEFERRED                                                     |                       0 |                    3 |              
          123 | CTRL+DBLINK |                |                                                                 |                   |                   |              |                                                                                                                                                                                             |                       6 |                    2 |              
          124 | DROP_FK     | myschema1      | mytbl4                                                          | mytbl4_col44_fkey |                 1 |            1 |                                                                                                                                                                                             |                         |                    2 |              
          124 | SET_FK_DEF  | myschema1      | mytbl4                                                          | mytbl4_col43_fkey |                 1 |            1 |                                                                                                                                                                                             |                         |                    2 |              
          124 | RLBK_TABLE  | myschema1      | mytbl1                                                          |                   |                 1 |            1 |                                                                                                                                                                                             |                      15 |                    1 |            13
          124 | RLBK_TABLE  | myschema1      | mytbl2                                                          |                   |                 1 |            1 |                                                                                                                                                                                             |                       2 |                    1 |             1
          124 | SET_FK_IMM  | myschema1      | mytbl4                                                          | mytbl4_col43_fkey |                 1 |            1 |                                                                                                                                                                                             |                       2 |                    2 |              
          124 | ADD_FK      | myschema1      | mytbl4                                                          | mytbl4_col44_fkey |                 1 |            1 | FOREIGN KEY (col44, col45) REFERENCES myschema1.mytbl1(col11, col12) ON UPDATE SET NULL ON DELETE CASCADE DEFERRABLE INITIALLY DEFERRED                                                     |                       0 |                    3 |              
          124 | CTRL+DBLINK |                |                                                                 |                   |                   |              |                                                                                                                                                                                             |                       6 |                    2 |              
          125 | DROP_FK     | myschema1      | mytbl4                                                          | mytbl4_col44_fkey |                 1 |            1 |                                                                                                                                                                                             |                         |                    2 |              
          125 | SET_FK_DEF  | myschema1      | mytbl4                                                          | mytbl4_col43_fkey |                 1 |            1 |                                                                                                                                                                                             |                         |                    2 |              
          125 | RLBK_TABLE  | myschema1      | mytbl1                                                          |                   |                 1 |            1 |                                                                                                                                                                                             |                      11 |                    1 |            11
          125 | RLBK_TABLE  | myschema1      | mytbl2                                                          |                   |                 1 |            1 |                                                                                                                                                                                             |                       3 |                    1 |             2
          125 | SET_FK_IMM  | myschema1      | mytbl4                                                          | mytbl4_col43_fkey |                 1 |            1 |                                                                                                                                                                                             |                       3 |                    2 |              
          125 | ADD_FK      | myschema1      | mytbl4                                                          | mytbl4_col44_fkey |                 1 |            1 | FOREIGN KEY (col44, col45) REFERENCES myschema1.mytbl1(col11, col12) ON UPDATE SET NULL ON DELETE CASCADE DEFERRABLE INITIALLY DEFERRED                                                     |                       0 |                    3 |              
          125 | CTRL+DBLINK |                |                                                                 |                   |                   |              |                                                                                                                                                                                             |                       6 |                    2 |              
          126 | DIS_LOG_TRG | myschema1      | mytbl1                                                          |                   |                 1 |            1 |                                                                                                                                                                                             |                         |                    2 |              
          126 | DIS_LOG_TRG | myschema1      | mytbl2                                                          |                   |                 1 |            1 |                                                                                                                                                                                             |                         |                    2 |              
          126 | DROP_FK     | myschema1      | mytbl4                                                          | mytbl4_col44_fkey |                 1 |            1 |                                                                                                                                                                                             |                         |                    2 |              
          126 | SET_FK_DEF  | myschema1      | mytbl4                                                          | mytbl4_col43_fkey |                 1 |            1 |                                                                                                                                                                                             |                         |                    2 |              
          126 | RLBK_TABLE  | myschema1      | mytbl1                                                          |                   |                 1 |            1 |                                                                                                                                                                                             |                      11 |                    1 |            11
          126 | RLBK_TABLE  | myschema1      | mytbl2                                                          |                   |                 1 |            1 |                                                                                                                                                                                             |                       4 |                    1 |             3
          126 | DELETE_LOG  | myschema1      | mytbl1                                                          |                   |                 1 |            1 |                                                                                                                                                                                             |                      11 |                    1 |            11
          126 | DELETE_LOG  | myschema1      | mytbl2                                                          |                   |                 1 |            1 |                                                                                                                                                                                             |                       4 |                    3 |             4
          126 | SET_FK_IMM  | myschema1      | mytbl4                                                          | mytbl4_col43_fkey |                 1 |            1 |                                                                                                                                                                                             |                       4 |                    2 |              
          126 | ADD_FK      | myschema1      | mytbl4                                                          | mytbl4_col44_fkey |                 1 |            1 | FOREIGN KEY (col44, col45) REFERENCES myschema1.mytbl1(col11, col12) ON UPDATE SET NULL ON DELETE CASCADE DEFERRABLE INITIALLY DEFERRED                                                     |                       0 |                    3 |              
          126 | ENA_LOG_TRG | myschema1      | mytbl1                                                          |                   |                 1 |            1 |                                                                                                                                                                                             |                         |                    2 |              
          126 | ENA_LOG_TRG | myschema1      | mytbl2                                                          |                   |                 1 |            1 |                                                                                                                                                                                             |                         |                    2 |              
          126 | CTRL+DBLINK |                |                                                                 |                   |                   |              |                                                                                                                                                                                             |                      12 |                    2 |              
(192 rows)

select rlbt_step, rlbt_schema, rlbt_table, rlbt_fkey, rlbt_rlbk_id, rlbt_quantity from emaj.emaj_rlbk_stat
  order by rlbt_rlbk_id, rlbt_step, rlbt_schema, rlbt_table, rlbt_fkey;
  rlbt_step  |  rlbt_schema   |                           rlbt_table                            |     rlbt_fkey     | rlbt_rlbk_id | rlbt_quantity 
-------------+----------------+-----------------------------------------------------------------+-------------------+--------------+---------------
 DROP_FK     |                |                                                                 |                   |          100 |             1
 SET_FK_DEF  |                |                                                                 |                   |          100 |             2
 RLBK_TABLE  | myschema2      | mytbl4                                                          |                   |          100 |             4
 RLBK_TABLE  | myschema2      | mytbl5                                                          |                   |          100 |             1
 RLBK_TABLE  | myschema2      | mytbl6                                                          |                   |          100 |             3
 SET_FK_IMM  | myschema2      | mytbl4                                                          | mytbl4_col43_fkey |          100 |             4
 SET_FK_IMM  | myschema2      | mytbl6                                                          | mytbl6_col61_fkey |          100 |             3
 SET_FK_IMM  | myschema2      | mytbl8                                                          | mytbl8_col81_fkey |          100 |             3
 ADD_FK      | myschema2      | mytbl4                                                          | mytbl4_col44_fkey |          100 |             2
 CTRL-DBLINK |                |                                                                 |                   |          100 |            10
 DROP_FK     |                |                                                                 |                   |          101 |             1
 SET_FK_DEF  |                |                                                                 |                   |          101 |             2
 RLBK_TABLE  | myschema2      | mytbl4                                                          |                   |          101 |             2
 RLBK_TABLE  | myschema2      | mytbl5                                                          |                   |          101 |             1
 RLBK_TABLE  | myschema2      | mytbl6                                                          |                   |          101 |             3
 SET_FK_IMM  | myschema2      | mytbl4                                                          | mytbl4_col43_fkey |          101 |             2
 SET_FK_IMM  | myschema2      | mytbl6                                                          | mytbl6_col61_fkey |          101 |             3
 SET_FK_IMM  | myschema2      | mytbl8                                                          | mytbl8_col81_fkey |          101 |             3
 ADD_FK      | myschema2      | mytbl4                                                          | mytbl4_col44_fkey |          101 |             2
 CTRL-DBLINK |                |                                                                 |                   |          101 |            10
 DIS_LOG_TRG |                |                                                                 |                   |          102 |             2
 DROP_FK     |                |                                                                 |                   |          102 |             1
 SET_FK_DEF  |                |                                                                 |                   |          102 |             1
 RLBK_TABLE  | myschema1      | mytbl1                                                          |                   |          102 |             3
 RLBK_TABLE  | myschema1      | mytbl4                                                          |                   |          102 |             8
 DELETE_LOG  | myschema1      | mytbl1                                                          |                   |          102 |             3
 DELETE_LOG  | myschema1      | mytbl4                                                          |                   |          102 |             8
 SET_FK_IMM  | myschema1      | mytbl4                                                          | mytbl4_col43_fkey |          102 |             8
 ADD_FK      | myschema1      | mytbl4                                                          | mytbl4_col44_fkey |          102 |             0
 ENA_LOG_TRG |                |                                                                 |                   |          102 |             2
 CTRL+DBLINK |                |                                                                 |                   |          102 |            12
 DROP_FK     |                |                                                                 |                   |          103 |             1
 SET_FK_DEF  |                |                                                                 |                   |          103 |             2
 RLBK_TABLE  | myschema2      | mytbl4                                                          |                   |          103 |             8
 RLBK_TABLE  | myschema2      | mytbl5                                                          |                   |          103 |             3
 RLBK_TABLE  | myschema2      | mytbl6                                                          |                   |          103 |             9
 SET_FK_IMM  | myschema2      | mytbl4                                                          | mytbl4_col43_fkey |          103 |             8
 SET_FK_IMM  | myschema2      | mytbl6                                                          | mytbl6_col61_fkey |          103 |             9
 SET_FK_IMM  | myschema2      | mytbl8                                                          | mytbl8_col81_fkey |          103 |             9
 ADD_FK      | myschema2      | mytbl4                                                          | mytbl4_col44_fkey |          103 |             2
 CTRL+DBLINK |                |                                                                 |                   |          103 |            10
 DIS_LOG_TRG |                |                                                                 |                   |          104 |             3
 DROP_FK     |                |                                                                 |                   |          104 |             1
 SET_FK_DEF  |                |                                                                 |                   |          104 |             2
 RLBK_TABLE  | myschema2      | mytbl4                                                          |                   |          104 |             6
 RLBK_TABLE  | myschema2      | mytbl5                                                          |                   |          104 |             3
 RLBK_TABLE  | myschema2      | mytbl6                                                          |                   |          104 |             9
 DELETE_LOG  | myschema2      | mytbl4                                                          |                   |          104 |             6
 DELETE_LOG  | myschema2      | mytbl5                                                          |                   |          104 |             3
 DELETE_LOG  | myschema2      | mytbl6                                                          |                   |          104 |             9
 SET_FK_IMM  | myschema2      | mytbl4                                                          | mytbl4_col43_fkey |          104 |             6
 SET_FK_IMM  | myschema2      | mytbl6                                                          | mytbl6_col61_fkey |          104 |             9
 SET_FK_IMM  | myschema2      | mytbl8                                                          | mytbl8_col81_fkey |          104 |             9
 ADD_FK      | myschema2      | mytbl4                                                          | mytbl4_col44_fkey |          104 |             2
 ENA_LOG_TRG |                |                                                                 |                   |          104 |             3
 CTRL+DBLINK |                |                                                                 |                   |          104 |            19
 DIS_LOG_TRG |                |                                                                 |                   |          105 |             2
 DROP_FK     |                |                                                                 |                   |          105 |             1
 SET_FK_DEF  |                |                                                                 |                   |          105 |             1
 RLBK_TABLE  | myschema1      | mytbl1                                                          |                   |          105 |             1
 RLBK_TABLE  | myschema1      | mytbl4                                                          |                   |          105 |             2
 DELETE_LOG  | myschema1      | mytbl1                                                          |                   |          105 |             1
 DELETE_LOG  | myschema1      | mytbl4                                                          |                   |          105 |             2
 SET_FK_IMM  | myschema1      | mytbl4                                                          | mytbl4_col43_fkey |          105 |             2
 ADD_FK      | myschema1      | mytbl4                                                          | mytbl4_col44_fkey |          105 |             0
 ENA_LOG_TRG |                |                                                                 |                   |          105 |             2
 CTRL+DBLINK |                |                                                                 |                   |          105 |            12
 DROP_FK     |                |                                                                 |                   |          106 |             1
 SET_FK_DEF  |                |                                                                 |                   |          106 |             1
 RLBK_TABLE  | myschema1      | mytbl1                                                          |                   |          106 |             1
 RLBK_TABLE  | myschema1      | myTbl3                                                          |                   |          106 |            10
 RLBK_TABLE  | myschema1      | mytbl4                                                          |                   |          106 |             2
 SET_FK_IMM  | myschema1      | mytbl4                                                          | mytbl4_col43_fkey |          106 |             2
 ADD_FK      | myschema1      | mytbl4                                                          | mytbl4_col44_fkey |          106 |             0
 CTRL+DBLINK |                |                                                                 |                   |          106 |             7
 DIS_LOG_TRG |                |                                                                 |                   |          113 |             1
 DROP_FK     |                |                                                                 |                   |          113 |             1
 RLBK_TABLE  | myschema1      | mytbl1                                                          |                   |          113 |            20
 DELETE_LOG  | myschema1      | mytbl1                                                          |                   |          113 |            20
 ADD_FK      | myschema1      | mytbl4                                                          | mytbl4_col44_fkey |          113 |             0
 ENA_LOG_TRG |                |                                                                 |                   |          113 |             1
 CTRL+DBLINK |                |                                                                 |                   |          113 |             6
 DIS_LOG_TRG |                |                                                                 |                   |          115 |             2
 SET_FK_DEF  |                |                                                                 |                   |          115 |             2
 RLBK_TABLE  | myschema2      | mytbl5                                                          |                   |          115 |             3
 RLBK_TABLE  | myschema2      | mytbl6                                                          |                   |          115 |            17
 DELETE_LOG  | myschema2      | mytbl5                                                          |                   |          115 |             3
 DELETE_LOG  | myschema2      | mytbl6                                                          |                   |          115 |            17
 SET_FK_IMM  | myschema2      | mytbl6                                                          | mytbl6_col61_fkey |          115 |            17
 SET_FK_IMM  | myschema2      | mytbl8                                                          | mytbl8_col81_fkey |          115 |            17
 ENA_LOG_TRG |                |                                                                 |                   |          115 |             2
 CTRL+DBLINK |                |                                                                 |                   |          115 |            12
 DIS_LOG_TRG |                |                                                                 |                   |          116 |             2
 DROP_FK     |                |                                                                 |                   |          116 |             2
 RLBK_TABLE  | phil's schema3 | myTbl2\                                                         |                   |          116 |             2
 RLBK_TABLE  | phil's schema3 | phil's tbl1                                                     |                   |          116 |            53
 DELETE_LOG  | phil's schema3 | myTbl2\                                                         |                   |          116 |             2
 DELETE_LOG  | phil's schema3 | phil's tbl1                                                     |                   |          116 |            53
 ADD_FK      | phil's schema3 | myTbl2\                                                         | mytbl2_col21_fkey |          116 |             0
 ADD_FK      | phil's schema3 | mytbl4                                                          | mytbl4_col44_fkey |          116 |             0
 ENA_LOG_TRG |                |                                                                 |                   |          116 |             2
 CTRL+DBLINK |                |                                                                 |                   |          116 |            12
 DIS_LOG_TRG |                |                                                                 |                   |          117 |             1
 DROP_FK     |                |                                                                 |                   |          117 |             1
 RLBK_TABLE  | phil's schema3 | table_with_very_looooooooooooooooooooooooooooooooooooooong_name |                   |          117 |             6
 DELETE_LOG  | phil's schema3 | table_with_very_looooooooooooooooooooooooooooooooooooooong_name |                   |          117 |             6
 ADD_FK      | phil's schema3 | mytbl4                                                          | mytbl4_col44_fkey |          117 |             0
 ENA_LOG_TRG |                |                                                                 |                   |          117 |             1
 CTRL+DBLINK |                |                                                                 |                   |          117 |             6
 DROP_FK     |                |                                                                 |                   |          118 |             1
 SET_FK_DEF  |                |                                                                 |                   |          118 |             1
 RLBK_TABLE  | myschema1      | mytbl1                                                          |                   |          118 |            15
 RLBK_TABLE  | myschema1      | mytbl2                                                          |                   |          118 |             2
 SET_FK_IMM  | myschema1      | mytbl4                                                          | mytbl4_col43_fkey |          118 |             2
 ADD_FK      | myschema1      | mytbl4                                                          | mytbl4_col44_fkey |          118 |             0
 CTRL+DBLINK |                |                                                                 |                   |          118 |             6
 DROP_FK     |                |                                                                 |                   |          119 |             1
 SET_FK_DEF  |                |                                                                 |                   |          119 |             1
 RLBK_TABLE  | myschema1      | myTbl3                                                          |                   |          119 |            10
 RLBK_TABLE  | myschema1      | mytbl4                                                          |                   |          119 |             2
 SET_FK_IMM  | myschema1      | mytbl4                                                          | mytbl4_col43_fkey |          119 |             2
 ADD_FK      | myschema1      | mytbl4                                                          | mytbl4_col44_fkey |          119 |             0
 CTRL+DBLINK |                |                                                                 |                   |          119 |             6
 SET_FK_DEF  |                |                                                                 |                   |          120 |             1
 RLBK_TABLE  | myschema1      | mytbl2                                                          |                   |          120 |             1
 SET_FK_IMM  | myschema1      | mytbl4                                                          | mytbl4_col43_fkey |          120 |             1
 CTRL+DBLINK |                |                                                                 |                   |          120 |             3
 DROP_FK     |                |                                                                 |                   |          121 |             1
 SET_FK_DEF  |                |                                                                 |                   |          121 |             1
 RLBK_TABLE  | myschema1      | mytbl1                                                          |                   |          121 |            15
 RLBK_TABLE  | myschema1      | mytbl2                                                          |                   |          121 |             2
 RLBK_TABLE  | myschema1      | myTbl3                                                          |                   |          121 |            10
 RLBK_TABLE  | myschema1      | mytbl4                                                          |                   |          121 |             2
 SET_FK_IMM  | myschema1      | mytbl4                                                          | mytbl4_col43_fkey |          121 |             4
 ADD_FK      | myschema1      | mytbl4                                                          | mytbl4_col44_fkey |          121 |             0
 CTRL+DBLINK |                |                                                                 |                   |          121 |             8
 DROP_FK     |                |                                                                 |                   |          122 |             1
 RLBK_TABLE  | myschema1      | mytbl1                                                          |                   |          122 |            16
 ADD_FK      | myschema1      | mytbl4                                                          | mytbl4_col44_fkey |          122 |             0
 CTRL+DBLINK |                |                                                                 |                   |          122 |             3
 DROP_FK     |                |                                                                 |                   |          123 |             1
 SET_FK_DEF  |                |                                                                 |                   |          123 |             1
 RLBK_TABLE  | myschema1      | mytbl1                                                          |                   |          123 |            22
 RLBK_TABLE  | myschema1      | mytbl4                                                          |                   |          123 |             2
 SET_FK_IMM  | myschema1      | mytbl4                                                          | mytbl4_col43_fkey |          123 |             2
 ADD_FK      | myschema1      | mytbl4                                                          | mytbl4_col44_fkey |          123 |             0
 CTRL+DBLINK |                |                                                                 |                   |          123 |             6
 DROP_FK     |                |                                                                 |                   |          124 |             1
 SET_FK_DEF  |                |                                                                 |                   |          124 |             1
 RLBK_TABLE  | myschema1      | mytbl1                                                          |                   |          124 |            15
 RLBK_TABLE  | myschema1      | mytbl2                                                          |                   |          124 |             2
 SET_FK_IMM  | myschema1      | mytbl4                                                          | mytbl4_col43_fkey |          124 |             2
 ADD_FK      | myschema1      | mytbl4                                                          | mytbl4_col44_fkey |          124 |             0
 CTRL+DBLINK |                |                                                                 |                   |          124 |             6
 DROP_FK     |                |                                                                 |                   |          125 |             1
 SET_FK_DEF  |                |                                                                 |                   |          125 |             1
 RLBK_TABLE  | myschema1      | mytbl1                                                          |                   |          125 |            11
 RLBK_TABLE  | myschema1      | mytbl2                                                          |                   |          125 |             3
 SET_FK_IMM  | myschema1      | mytbl4                                                          | mytbl4_col43_fkey |          125 |             3
 ADD_FK      | myschema1      | mytbl4                                                          | mytbl4_col44_fkey |          125 |             0
 CTRL+DBLINK |                |                                                                 |                   |          125 |             6
 DIS_LOG_TRG |                |                                                                 |                   |          126 |             2
 DROP_FK     |                |                                                                 |                   |          126 |             1
 SET_FK_DEF  |                |                                                                 |                   |          126 |             1
 RLBK_TABLE  | myschema1      | mytbl1                                                          |                   |          126 |            11
 RLBK_TABLE  | myschema1      | mytbl2                                                          |                   |          126 |             4
 DELETE_LOG  | myschema1      | mytbl1                                                          |                   |          126 |            11
 DELETE_LOG  | myschema1      | mytbl2                                                          |                   |          126 |             4
 SET_FK_IMM  | myschema1      | mytbl4                                                          | mytbl4_col43_fkey |          126 |             4
 ADD_FK      | myschema1      | mytbl4                                                          | mytbl4_col44_fkey |          126 |             0
 ENA_LOG_TRG |                |                                                                 |                   |          126 |             2
 CTRL+DBLINK |                |                                                                 |                   |          126 |            12
(172 rows)

select time_id, time_last_emaj_gid, time_event from emaj.emaj_time_stamp where time_id >= 600 order by time_id;
 time_id | time_last_emaj_gid | time_event 
---------+--------------------+------------
     600 |              99999 | M
     601 |              99999 | M
     602 |              99999 | C
     603 |              99999 | C
     604 |              99999 | M
     605 |              99999 | M
     606 |             100026 | M
     607 |             100037 | M
     608 |             100078 | M
     609 |             100086 | M
     610 |             100086 | R
     611 |             100092 | M
     612 |             100092 | R
     613 |             100098 | M
     614 |             100098 | R
     615 |             100111 | M
     616 |             100121 | M
     617 |             100121 | M
     618 |             100121 | R
     619 |             100127 | M
     620 |             100127 | R
     621 |             100130 | R
     622 |             100133 | R
     623 |             100156 | M
     624 |             100161 | M
     625 |             100161 | M
     626 |             100161 | M
     627 |             100161 | R
     628 |             100161 | M
     629 |             100161 | R
     630 |             100161 | R
     631 |             100161 | M
     632 |             100161 | M
     633 |             100161 | M
     634 |             100161 | R
     635 |             100161 | C
     636 |             100161 | A
     637 |             100161 | M
     638 |             100161 | M
     639 |             100161 | A
     640 |             100161 | C
     641 |             100161 | M
     642 |             100213 | M
     643 |             100213 | M
     644 |             100216 | M
     645 |             100216 | R
     646 |             100216 | M
     647 |             100216 | R
     648 |             100236 | R
     649 |             100256 | R
     650 |             100256 | R
     651 |             100256 | R
     652 |             100331 | M
     653 |             100331 | A
     654 |             100331 | M
     655 |             100335 | M
     656 |             100337 | R
     657 |             100337 | M
     658 |             100337 | M
     659 |             100337 | M
     660 |             100353 | M
     661 |             100354 | R
     662 |             100366 | M
     663 |             100367 | M
     664 |             100379 | M
     665 |             100379 | M
     666 |             100379 | R
     667 |             100390 | M
     668 |             100390 | M
     669 |             100406 | M
     670 |             100407 | M
     671 |             100408 | R
     672 |             100409 | M
     673 |             100409 | M
     674 |             100421 | R
     675 |             100444 | M
     676 |             100444 | M
     677 |             100460 | R
     678 |             100466 | M
     679 |             100466 | M
     680 |             100468 | R
     681 |             100469 | M
     682 |             100469 | M
     683 |             100485 | M
     684 |             100486 | R
     685 |             100498 | M
     686 |             100498 | M
     687 |             100499 | R
     688 |             100512 | M
     689 |             100512 | R
(90 rows)

select hist_id, hist_function, hist_event, hist_object, regexp_replace(regexp_replace(hist_wording,E'\\d\\d\.\\d\\d\\.\\d\\d\\.\\d\\d\\d','%','g'),E'\\[.+\\]','(timestamp)','g'), hist_user from emaj.emaj_hist order by hist_id;
 hist_id |      hist_function       |       hist_event        |                                   hist_object                                    |                                                     regexp_replace                                                     | hist_user 
---------+--------------------------+-------------------------+----------------------------------------------------------------------------------+------------------------------------------------------------------------------------------------------------------------+-----------
    6036 | START_GROUP              | BEGIN                   | myGroup1                                                                         | With log reset                                                                                                         | postgres
    6037 | PURGE_HISTORY            |                         |                                                                                  | 36 emaj_hist rows deleted ; 20 rollback events deleted                                                                 | postgres
    6038 | LOCK_GROUP               | BEGIN                   | myGroup1                                                                         |                                                                                                                        | postgres
    6039 | LOCK_GROUP               | END                     | myGroup1                                                                         | 5 tables locked, 0 deadlock(s)                                                                                         | postgres
    6040 | SET_MARK_GROUP           | BEGIN                   | myGroup1                                                                         | M1                                                                                                                     | postgres
    6041 | SET_MARK_GROUP           | END                     | myGroup1                                                                         | M1                                                                                                                     | postgres
    6042 | START_GROUP              | END                     | myGroup1                                                                         | 6 tables/sequences processed                                                                                           | postgres
    6043 | START_GROUP              | BEGIN                   | myGroup2                                                                         | With log reset                                                                                                         | postgres
    6044 | LOCK_GROUP               | BEGIN                   | myGroup2                                                                         |                                                                                                                        | postgres
    6045 | LOCK_GROUP               | END                     | myGroup2                                                                         | 6 tables locked, 0 deadlock(s)                                                                                         | postgres
    6046 | SET_MARK_GROUP           | BEGIN                   | myGroup2                                                                         | M1                                                                                                                     | postgres
    6047 | SET_MARK_GROUP           | END                     | myGroup2                                                                         | M1                                                                                                                     | postgres
    6048 | START_GROUP              | END                     | myGroup2                                                                         | 8 tables/sequences processed                                                                                           | postgres
    6049 | SET_MARK_GROUP           | BEGIN                   | myGroup1                                                                         |                                                                                                                        | postgres
    6050 | LOCK_GROUP               | BEGIN                   | myGroup1                                                                         |                                                                                                                        | postgres
    6051 | LOCK_GROUP               | END                     | myGroup1                                                                         | 5 tables locked, 0 deadlock(s)                                                                                         | postgres
    6052 | SET_MARK_GROUP           | END                     | myGroup1                                                                         | M2                                                                                                                     | postgres
    6053 | SET_MARK_GROUP           | BEGIN                   | myGroup1                                                                         |                                                                                                                        | postgres
    6054 | LOCK_GROUP               | BEGIN                   | myGroup1                                                                         |                                                                                                                        | postgres
    6055 | LOCK_GROUP               | END                     | myGroup1                                                                         | 5 tables locked, 0 deadlock(s)                                                                                         | postgres
    6056 | SET_MARK_GROUP           | END                     | myGroup1                                                                         | M3                                                                                                                     | postgres
    6057 | COMMENT_MARK_GROUP       |                         | myGroup1                                                                         | Mark M3                                                                                                                | postgres
    6058 | SET_MARK_GROUP           | BEGIN                   | myGroup2                                                                         |                                                                                                                        | postgres
    6059 | LOCK_GROUP               | BEGIN                   | myGroup2                                                                         |                                                                                                                        | postgres
    6060 | LOCK_GROUP               | END                     | myGroup2                                                                         | 6 tables locked, 0 deadlock(s)                                                                                         | postgres
    6061 | SET_MARK_GROUP           | END                     | myGroup2                                                                         | M2                                                                                                                     | postgres
    6062 | SET_MARK_GROUP           | BEGIN                   | myGroup2                                                                         |                                                                                                                        | postgres
    6063 | LOCK_GROUP               | BEGIN                   | myGroup2                                                                         |                                                                                                                        | postgres
    6064 | LOCK_GROUP               | END                     | myGroup2                                                                         | 6 tables locked, 0 deadlock(s)                                                                                         | postgres
    6065 | SET_MARK_GROUP           | END                     | myGroup2                                                                         | M3                                                                                                                     | postgres
    6066 | ROLLBACK_GROUP           | BEGIN                   | myGroup2                                                                         | Logged rollback to mark M2 (timestamp)                                                                                 | postgres
    6067 | DBLINK_OPEN_CNX          |                         | rlbk#1                                                                           | Status = -3                                                                                                            | postgres
    6068 | LOCK_GROUP               | BEGIN                   | myGroup2                                                                         | Rollback session #1                                                                                                    | postgres
    6069 | LOCK_GROUP               | END                     | myGroup2                                                                         | Rollback session #1: 6 tables locked, 0 deadlock(s)                                                                    | postgres
    6070 | SET_MARK_GROUP           | BEGIN                   | myGroup2                                                                         | RLBK_M2_%_START                                                                                                        | postgres
    6071 | SET_MARK_GROUP           | END                     | myGroup2                                                                         | RLBK_M2_%_START                                                                                                        | postgres
    6072 | ROLLBACK_TABLE           | BEGIN                   | myschema2.mytbl4                                                                 | All log rows with emaj_gid > 100078 and <= 100086                                                                      | postgres
    6073 | ROLLBACK_TABLE           | END                     | myschema2.mytbl4                                                                 | 2 rolled back primary keys                                                                                             | postgres
    6074 | ROLLBACK_TABLE           | BEGIN                   | myschema2.mytbl6                                                                 | All log rows with emaj_gid > 100078 and <= 100086                                                                      | postgres
    6075 | ROLLBACK_TABLE           | END                     | myschema2.mytbl6                                                                 | 3 rolled back primary keys                                                                                             | postgres
    6076 | ROLLBACK_TABLE           | BEGIN                   | myschema2.mytbl5                                                                 | All log rows with emaj_gid > 100078 and <= 100086                                                                      | postgres
    6077 | ROLLBACK_TABLE           | END                     | myschema2.mytbl5                                                                 | 1 rolled back primary keys                                                                                             | postgres
    6078 | ROLLBACK_SEQUENCE        |                         | myschema2.myseq1                                                                 | RESTART 1001 MAXVALUE 2000 CYCLE                                                                                       | postgres
    6079 | ROLLBACK_SEQUENCE        |                         | myschema2."myTbl3_col31_seq"                                                     |                                                                                                                        | postgres
    6080 | SET_MARK_GROUP           | BEGIN                   | myGroup2                                                                         | RLBK_M2_%_DONE                                                                                                         | postgres
    6081 | SET_MARK_GROUP           | END                     | myGroup2                                                                         | RLBK_M2_%_DONE                                                                                                         | postgres
    6082 | ROLLBACK_GROUP           | END                     | myGroup2                                                                         | Rollback_id 100, 3 tables and 2 sequences effectively processed                                                        | postgres
    6083 | ROLLBACK_GROUP           | BEGIN                   | myGroup2                                                                         | Logged rollback to mark M3 (timestamp)                                                                                 | postgres
    6084 | DBLINK_OPEN_CNX          |                         | rlbk#1                                                                           | Status = -3                                                                                                            | postgres
    6085 | LOCK_GROUP               | BEGIN                   | myGroup2                                                                         | Rollback session #1                                                                                                    | postgres
    6086 | LOCK_GROUP               | END                     | myGroup2                                                                         | Rollback session #1: 6 tables locked, 0 deadlock(s)                                                                    | postgres
    6087 | SET_MARK_GROUP           | BEGIN                   | myGroup2                                                                         | RLBK_M3_%_START                                                                                                        | postgres
    6088 | SET_MARK_GROUP           | END                     | myGroup2                                                                         | RLBK_M3_%_START                                                                                                        | postgres
    6089 | ROLLBACK_TABLE           | BEGIN                   | myschema2.mytbl6                                                                 | All log rows with emaj_gid > 100086 and <= 100092                                                                      | postgres
    6090 | ROLLBACK_TABLE           | END                     | myschema2.mytbl6                                                                 | 3 rolled back primary keys                                                                                             | postgres
    6091 | ROLLBACK_TABLE           | BEGIN                   | myschema2.mytbl4                                                                 | All log rows with emaj_gid > 100086 and <= 100092                                                                      | postgres
    6092 | ROLLBACK_TABLE           | END                     | myschema2.mytbl4                                                                 | 2 rolled back primary keys                                                                                             | postgres
    6093 | ROLLBACK_TABLE           | BEGIN                   | myschema2.mytbl5                                                                 | All log rows with emaj_gid > 100086 and <= 100092                                                                      | postgres
    6094 | ROLLBACK_TABLE           | END                     | myschema2.mytbl5                                                                 | 1 rolled back primary keys                                                                                             | postgres
    6095 | ROLLBACK_SEQUENCE        |                         | myschema2.myseq1                                                                 | RESTART 1004 MAXVALUE 9223372036854775807 NO  CYCLE                                                                    | postgres
    6096 | ROLLBACK_SEQUENCE        |                         | myschema2."myTbl3_col31_seq"                                                     |                                                                                                                        | postgres
    6097 | SET_MARK_GROUP           | BEGIN                   | myGroup2                                                                         | RLBK_M3_%_DONE                                                                                                         | postgres
    6098 | SET_MARK_GROUP           | END                     | myGroup2                                                                         | RLBK_M3_%_DONE                                                                                                         | postgres
    6099 | ROLLBACK_GROUP           | END                     | myGroup2                                                                         | Rollback_id 101, 3 tables and 2 sequences effectively processed                                                        | postgres
    6100 | ROLLBACK_GROUP           | BEGIN                   | myGroup1                                                                         | Unlogged rollback to mark M2 (timestamp)                                                                               | postgres
    6101 | DBLINK_OPEN_CNX          |                         | rlbk#1                                                                           | Status = 1                                                                                                             | postgres
    6102 | LOCK_GROUP               | BEGIN                   | myGroup1                                                                         | Rollback session #1                                                                                                    | postgres
    6103 | LOCK_GROUP               | END                     | myGroup1                                                                         | Rollback session #1: 5 tables locked, 0 deadlock(s)                                                                    | postgres
    6104 | ROLLBACK_TABLE           | BEGIN                   | myschema1.mytbl1                                                                 | All log rows with emaj_gid > 100026 and <= 100098                                                                      | postgres
    6105 | ROLLBACK_TABLE           | END                     | myschema1.mytbl1                                                                 | 5 rolled back primary keys                                                                                             | postgres
    6106 | ROLLBACK_TABLE           | BEGIN                   | myschema1.mytbl4                                                                 | All log rows with emaj_gid > 100026 and <= 100098                                                                      | postgres
    6107 | ROLLBACK_TABLE           | END                     | myschema1.mytbl4                                                                 | 3 rolled back primary keys                                                                                             | postgres
    6108 | ROLLBACK_GROUP           | MARK DELETED            | myGroup1                                                                         | mark M3 is deleted                                                                                                     | postgres
    6109 | ROLLBACK_SEQUENCE        |                         | myschema1."myTbl3_col31_seq"                                                     |                                                                                                                        | postgres
    6110 | ROLLBACK_GROUP           | END                     | myGroup1                                                                         | Rollback_id 102, 2 tables and 1 sequences effectively processed                                                        | postgres
    6111 | DBLINK_CLOSE_CNX         |                         | rlbk#1                                                                           |                                                                                                                        | postgres
    6112 | SET_MARK_GROUP           | BEGIN                   | myGroup1                                                                         |                                                                                                                        | postgres
    6113 | LOCK_GROUP               | BEGIN                   | myGroup1                                                                         |                                                                                                                        | postgres
    6114 | LOCK_GROUP               | END                     | myGroup1                                                                         | 5 tables locked, 0 deadlock(s)                                                                                         | postgres
    6115 | CLEANUP_RLBK_STATE       |                         | rollback id 102                                                                  | set to COMMITTED                                                                                                       | postgres
    6116 | SET_MARK_GROUP           | END                     | myGroup1                                                                         | M4                                                                                                                     | postgres
    6117 | SET_MARK_GROUP           | BEGIN                   | myGroup1                                                                         |                                                                                                                        | postgres
    6118 | LOCK_GROUP               | BEGIN                   | myGroup1                                                                         |                                                                                                                        | postgres
    6119 | LOCK_GROUP               | END                     | myGroup1                                                                         | 5 tables locked, 0 deadlock(s)                                                                                         | postgres
    6120 | SET_MARK_GROUP           | END                     | myGroup1                                                                         | M5                                                                                                                     | postgres
    6121 | SET_MARK_GROUP           | BEGIN                   | myGroup1                                                                         |                                                                                                                        | postgres
    6122 | LOCK_GROUP               | BEGIN                   | myGroup1                                                                         |                                                                                                                        | postgres
    6123 | LOCK_GROUP               | END                     | myGroup1                                                                         | 5 tables locked, 0 deadlock(s)                                                                                         | postgres
    6124 | SET_MARK_GROUP           | END                     | myGroup1                                                                         | M6                                                                                                                     | postgres
    6125 | ROLLBACK_GROUP           | BEGIN                   | myGroup2                                                                         | Logged rollback to mark M2 (timestamp)                                                                                 | postgres
    6126 | DBLINK_OPEN_CNX          |                         | rlbk#1                                                                           | Status = 1                                                                                                             | postgres
    6127 | LOCK_GROUP               | BEGIN                   | myGroup2                                                                         | Rollback session #1                                                                                                    | postgres
    6128 | LOCK_GROUP               | END                     | myGroup2                                                                         | Rollback session #1: 6 tables locked, 0 deadlock(s)                                                                    | postgres
    6129 | SET_MARK_GROUP           | BEGIN                   | myGroup2                                                                         | RLBK_M2_%_START                                                                                                        | postgres
    6130 | SET_MARK_GROUP           | END                     | myGroup2                                                                         | RLBK_M2_%_START                                                                                                        | postgres
    6131 | ROLLBACK_TABLE           | BEGIN                   | myschema2.mytbl6                                                                 | All log rows with emaj_gid > 100078 and <= 100121                                                                      | postgres
    6132 | ROLLBACK_TABLE           | END                     | myschema2.mytbl6                                                                 | 3 rolled back primary keys                                                                                             | postgres
    6133 | ROLLBACK_TABLE           | BEGIN                   | myschema2.mytbl4                                                                 | All log rows with emaj_gid > 100078 and <= 100121                                                                      | postgres
    6134 | ROLLBACK_TABLE           | END                     | myschema2.mytbl4                                                                 | 2 rolled back primary keys                                                                                             | postgres
    6135 | ROLLBACK_TABLE           | BEGIN                   | myschema2.mytbl5                                                                 | All log rows with emaj_gid > 100078 and <= 100121                                                                      | postgres
    6136 | ROLLBACK_TABLE           | END                     | myschema2.mytbl5                                                                 | 1 rolled back primary keys                                                                                             | postgres
    6137 | ROLLBACK_SEQUENCE        |                         | myschema2.myseq1                                                                 | RESTART 1001 MAXVALUE 2000 CYCLE                                                                                       | postgres
    6138 | ROLLBACK_SEQUENCE        |                         | myschema2."myTbl3_col31_seq"                                                     |                                                                                                                        | postgres
    6139 | SET_MARK_GROUP           | BEGIN                   | myGroup2                                                                         | RLBK_M2_%_DONE                                                                                                         | postgres
    6140 | SET_MARK_GROUP           | END                     | myGroup2                                                                         | RLBK_M2_%_DONE                                                                                                         | postgres
    6141 | ROLLBACK_GROUP           | END                     | myGroup2                                                                         | Rollback_id 103, 3 tables and 2 sequences effectively processed                                                        | postgres
    6142 | DBLINK_CLOSE_CNX         |                         | rlbk#1                                                                           |                                                                                                                        | postgres
    6143 | ROLLBACK_GROUP           | BEGIN                   | myGroup2                                                                         | Unlogged rollback to mark M3 (timestamp)                                                                               | postgres
    6144 | DBLINK_OPEN_CNX          |                         | rlbk#1                                                                           | Status = 1                                                                                                             | postgres
    6145 | LOCK_GROUP               | BEGIN                   | myGroup2                                                                         | Rollback session #1                                                                                                    | postgres
    6146 | LOCK_GROUP               | END                     | myGroup2                                                                         | Rollback session #1: 6 tables locked, 0 deadlock(s)                                                                    | postgres
    6147 | ROLLBACK_TABLE           | BEGIN                   | myschema2.mytbl6                                                                 | All log rows with emaj_gid > 100086 and <= 100127                                                                      | postgres
    6148 | ROLLBACK_TABLE           | END                     | myschema2.mytbl6                                                                 | 3 rolled back primary keys                                                                                             | postgres
    6149 | ROLLBACK_TABLE           | BEGIN                   | myschema2.mytbl4                                                                 | All log rows with emaj_gid > 100086 and <= 100127                                                                      | postgres
    6150 | ROLLBACK_TABLE           | END                     | myschema2.mytbl4                                                                 | 2 rolled back primary keys                                                                                             | postgres
    6151 | ROLLBACK_TABLE           | BEGIN                   | myschema2.mytbl5                                                                 | All log rows with emaj_gid > 100086 and <= 100127                                                                      | postgres
    6152 | ROLLBACK_TABLE           | END                     | myschema2.mytbl5                                                                 | 1 rolled back primary keys                                                                                             | postgres
    6153 | ROLLBACK_GROUP           | MARK DELETED            | myGroup2                                                                         | mark RLBK_M2_%_START is deleted                                                                                        | postgres
    6154 | ROLLBACK_GROUP           | MARK DELETED            | myGroup2                                                                         | mark RLBK_M2_%_DONE is deleted                                                                                         | postgres
    6155 | ROLLBACK_GROUP           | MARK DELETED            | myGroup2                                                                         | mark RLBK_M3_%_START is deleted                                                                                        | postgres
    6156 | ROLLBACK_GROUP           | MARK DELETED            | myGroup2                                                                         | mark RLBK_M3_%_DONE is deleted                                                                                         | postgres
    6157 | ROLLBACK_GROUP           | MARK DELETED            | myGroup2                                                                         | mark RLBK_M2_%_START is deleted                                                                                        | postgres
    6158 | ROLLBACK_GROUP           | MARK DELETED            | myGroup2                                                                         | mark RLBK_M2_%_DONE is deleted                                                                                         | postgres
    6159 | ROLLBACK_SEQUENCE        |                         | myschema2.myseq1                                                                 | RESTART 1004 MAXVALUE 9223372036854775807 NO  CYCLE                                                                    | postgres
    6160 | ROLLBACK_SEQUENCE        |                         | myschema2."myTbl3_col31_seq"                                                     |                                                                                                                        | postgres
    6161 | ROLLBACK_GROUP           | END                     | myGroup2                                                                         | Rollback_id 104, 3 tables and 2 sequences effectively processed                                                        | postgres
    6162 | DBLINK_CLOSE_CNX         |                         | rlbk#1                                                                           |                                                                                                                        | postgres
    6163 | ROLLBACK_GROUP           | BEGIN                   | myGroup1                                                                         | Unlogged rollback to mark M5 (timestamp)                                                                               | postgres
    6164 | DBLINK_OPEN_CNX          |                         | rlbk#1                                                                           | Status = 1                                                                                                             | postgres
    6165 | LOCK_GROUP               | BEGIN                   | myGroup1                                                                         | Rollback session #1                                                                                                    | postgres
    6166 | LOCK_GROUP               | END                     | myGroup1                                                                         | Rollback session #1: 5 tables locked, 0 deadlock(s)                                                                    | postgres
    6167 | ROLLBACK_TABLE           | BEGIN                   | myschema1.mytbl1                                                                 | All log rows with emaj_gid > 100121 and <= 100130                                                                      | postgres
    6168 | ROLLBACK_TABLE           | END                     | myschema1.mytbl1                                                                 | 1 rolled back primary keys                                                                                             | postgres
    6169 | ROLLBACK_TABLE           | BEGIN                   | myschema1.mytbl4                                                                 | All log rows with emaj_gid > 100121 and <= 100130                                                                      | postgres
    6170 | ROLLBACK_TABLE           | END                     | myschema1.mytbl4                                                                 | 2 rolled back primary keys                                                                                             | postgres
    6171 | ROLLBACK_GROUP           | MARK DELETED            | myGroup1                                                                         | mark M6 is deleted                                                                                                     | postgres
    6172 | ROLLBACK_SEQUENCE        |                         | myschema1."myTbl3_col31_seq"                                                     |                                                                                                                        | postgres
    6173 | ROLLBACK_GROUP           | END                     | myGroup1                                                                         | Rollback_id 105, 2 tables and 1 sequences effectively processed                                                        | postgres
    6174 | DBLINK_CLOSE_CNX         |                         | rlbk#1                                                                           |                                                                                                                        | postgres
    6175 | ROLLBACK_GROUP           | BEGIN                   | myGroup1                                                                         | Logged rollback to mark M4 (timestamp)                                                                                 | postgres
    6176 | DBLINK_OPEN_CNX          |                         | rlbk#1                                                                           | Status = 1                                                                                                             | postgres
    6177 | LOCK_GROUP               | BEGIN                   | myGroup1                                                                         | Rollback session #1                                                                                                    | postgres
    6178 | LOCK_GROUP               | END                     | myGroup1                                                                         | Rollback session #1: 5 tables locked, 0 deadlock(s)                                                                    | postgres
    6179 | SET_MARK_GROUP           | BEGIN                   | myGroup1                                                                         | RLBK_M4_%_START                                                                                                        | postgres
    6180 | CLEANUP_RLBK_STATE       |                         | rollback id 103                                                                  | set to COMMITTED                                                                                                       | postgres
    6181 | CLEANUP_RLBK_STATE       |                         | rollback id 104                                                                  | set to COMMITTED                                                                                                       | postgres
    6182 | CLEANUP_RLBK_STATE       |                         | rollback id 105                                                                  | set to COMMITTED                                                                                                       | postgres
    6183 | SET_MARK_GROUP           | END                     | myGroup1                                                                         | RLBK_M4_%_START                                                                                                        | postgres
    6184 | ROLLBACK_TABLE           | BEGIN                   | myschema1."myTbl3"                                                               | All log rows with emaj_gid > 100111 and <= 100133                                                                      | postgres
    6185 | ROLLBACK_TABLE           | END                     | myschema1."myTbl3"                                                               | 10 rolled back primary keys                                                                                            | postgres
    6186 | ROLLBACK_TABLE           | BEGIN                   | myschema1.mytbl1                                                                 | All log rows with emaj_gid > 100111 and <= 100133                                                                      | postgres
    6187 | ROLLBACK_TABLE           | END                     | myschema1.mytbl1                                                                 | 1 rolled back primary keys                                                                                             | postgres
    6188 | ROLLBACK_TABLE           | BEGIN                   | myschema1.mytbl4                                                                 | All log rows with emaj_gid > 100111 and <= 100133                                                                      | postgres
    6189 | ROLLBACK_TABLE           | END                     | myschema1.mytbl4                                                                 | 2 rolled back primary keys                                                                                             | postgres
    6190 | ROLLBACK_SEQUENCE        |                         | myschema1."myTbl3_col31_seq"                                                     |                                                                                                                        | postgres
    6191 | SET_MARK_GROUP           | BEGIN                   | myGroup1                                                                         | RLBK_M4_%_DONE                                                                                                         | postgres
    6192 | SET_MARK_GROUP           | END                     | myGroup1                                                                         | RLBK_M4_%_DONE                                                                                                         | postgres
    6193 | ROLLBACK_GROUP           | END                     | myGroup1                                                                         | Rollback_id 106, 3 tables and 1 sequences effectively processed                                                        | postgres
    6194 | DBLINK_CLOSE_CNX         |                         | rlbk#1                                                                           |                                                                                                                        | postgres
    6195 | RENAME_MARK_GROUP        | BEGIN                   | myGroup1                                                                         | RLBK_M4_%_START                                                                                                        | postgres
    6196 | RENAME_MARK_GROUP        | END                     | myGroup1                                                                         | RLBK_M4_%_START renamed Before logged rollback to M4                                                                   | postgres
    6197 | DELETE_MARK_GROUP        | BEGIN                   | myGroup1                                                                         | RLBK_M4_%_DONE                                                                                                         | postgres
    6198 | DELETE_MARK_GROUP        | END                     | myGroup1                                                                         | RLBK_M4_%_DONE                                                                                                         | postgres
    6199 | DELETE_MARK_GROUP        | BEGIN                   | myGroup1                                                                         | M1                                                                                                                     | postgres
    6200 | DELETE_MARK_GROUP        | END                     | myGroup1                                                                         | M1                                                                                                                     | postgres
    6201 | DELETE_BEFORE_MARK_GROUP | BEGIN                   | myGroup1                                                                         | M4                                                                                                                     | postgres
    6202 | DELETE_BEFORE_MARK_GROUP | END                     | myGroup1                                                                         | 1 marks deleted ; M4 is now the initial mark                                                                           | postgres
    6206 | CLEANUP_RLBK_STATE       |                         | rollback id 106                                                                  | set to COMMITTED                                                                                                       | postgres
    6207 | STOP_GROUPS              | BEGIN                   | myGroup1,myGroup2                                                                |                                                                                                                        | postgres
    6208 | LOCK_GROUPS              | BEGIN                   | myGroup1,myGroup2                                                                |                                                                                                                        | postgres
    6209 | LOCK_GROUPS              | END                     | myGroup1,myGroup2                                                                | 11 tables locked, 0 deadlock(s)                                                                                        | postgres
    6210 | SET_MARK_GROUPS          | BEGIN                   | myGroup1,myGroup2                                                                | STOP_%                                                                                                                 | postgres
    6211 | SET_MARK_GROUPS          | END                     | myGroup1,myGroup2                                                                | STOP_%                                                                                                                 | postgres
    6212 | STOP_GROUPS              | END                     | myGroup1,myGroup2                                                                | 14 tables/sequences processed                                                                                          | postgres
    6213 | START_GROUPS             | BEGIN                   | myGroup1,myGroup2                                                                | Without log reset                                                                                                      | postgres
    6214 | LOCK_GROUPS              | BEGIN                   | myGroup1,myGroup2                                                                |                                                                                                                        | postgres
    6215 | LOCK_GROUPS              | END                     | myGroup1,myGroup2                                                                | 11 tables locked, 0 deadlock(s)                                                                                        | postgres
    6216 | SET_MARK_GROUPS          | BEGIN                   | myGroup1,myGroup2                                                                | Multi-1                                                                                                                | postgres
    6217 | SET_MARK_GROUPS          | END                     | myGroup1,myGroup2                                                                | Multi-1                                                                                                                | postgres
    6218 | START_GROUPS             | END                     | myGroup1,myGroup2                                                                | 14 tables/sequences processed                                                                                          | postgres
    6219 | SET_MARK_GROUPS          | BEGIN                   | myGroup1,myGroup2                                                                | Multi-2                                                                                                                | postgres
    6220 | LOCK_GROUPS              | BEGIN                   | myGroup1,myGroup2                                                                |                                                                                                                        | postgres
    6221 | LOCK_GROUPS              | END                     | myGroup1,myGroup2                                                                | 11 tables locked, 0 deadlock(s)                                                                                        | postgres
    6222 | SET_MARK_GROUPS          | END                     | myGroup1,myGroup2                                                                | Multi-2                                                                                                                | postgres
    6223 | ROLLBACK_GROUPS          | BEGIN                   | myGroup1,myGroup2                                                                | Logged rollback to mark Multi-1 (timestamp)                                                                            | postgres
    6224 | DBLINK_OPEN_CNX          |                         | rlbk#1                                                                           | Status = 1                                                                                                             | postgres
    6225 | LOCK_GROUP               | BEGIN                   | myGroup1,myGroup2                                                                | Rollback session #1                                                                                                    | postgres
    6226 | LOCK_GROUP               | END                     | myGroup1,myGroup2                                                                | Rollback session #1: 11 tables locked, 0 deadlock(s)                                                                   | postgres
    6227 | SET_MARK_GROUPS          | BEGIN                   | myGroup1,myGroup2                                                                | RLBK_Multi-1_%_START                                                                                                   | postgres
    6228 | SET_MARK_GROUPS          | END                     | myGroup1,myGroup2                                                                | RLBK_Multi-1_%_START                                                                                                   | postgres
    6229 | ROLLBACK_SEQUENCE        |                         | myschema1."myTbl3_col31_seq"                                                     |                                                                                                                        | postgres
    6230 | ROLLBACK_SEQUENCE        |                         | myschema2.myseq1                                                                 |                                                                                                                        | postgres
    6231 | ROLLBACK_SEQUENCE        |                         | myschema2."myTbl3_col31_seq"                                                     |                                                                                                                        | postgres
    6232 | SET_MARK_GROUPS          | BEGIN                   | myGroup1,myGroup2                                                                | RLBK_Multi-1_%_DONE                                                                                                    | postgres
    6233 | SET_MARK_GROUPS          | END                     | myGroup1,myGroup2                                                                | RLBK_Multi-1_%_DONE                                                                                                    | postgres
    6234 | ROLLBACK_GROUPS          | END                     | myGroup1,myGroup2                                                                | Rollback_id 107, 0 tables and 3 sequences effectively processed                                                        | postgres
    6235 | DBLINK_CLOSE_CNX         |                         | rlbk#1                                                                           |                                                                                                                        | postgres
    6236 | ROLLBACK_GROUPS          | BEGIN                   | myGroup1,myGroup2                                                                | Unlogged rollback to mark Multi-2 (timestamp)                                                                          | postgres
    6237 | DBLINK_OPEN_CNX          |                         | rlbk#1                                                                           | Status = 1                                                                                                             | postgres
    6238 | LOCK_GROUP               | BEGIN                   | myGroup1,myGroup2                                                                | Rollback session #1                                                                                                    | postgres
    6239 | LOCK_GROUP               | END                     | myGroup1,myGroup2                                                                | Rollback session #1: 11 tables locked, 0 deadlock(s)                                                                   | postgres
    6240 | ROLLBACK_GROUPS          | MARK DELETED            | myGroup1                                                                         | mark RLBK_Multi-1_%_START is deleted                                                                                   | postgres
    6241 | ROLLBACK_GROUPS          | MARK DELETED            | myGroup2                                                                         | mark RLBK_Multi-1_%_START is deleted                                                                                   | postgres
    6242 | ROLLBACK_GROUPS          | MARK DELETED            | myGroup1                                                                         | mark RLBK_Multi-1_%_DONE is deleted                                                                                    | postgres
    6243 | ROLLBACK_GROUPS          | MARK DELETED            | myGroup2                                                                         | mark RLBK_Multi-1_%_DONE is deleted                                                                                    | postgres
    6244 | ROLLBACK_SEQUENCE        |                         | myschema1."myTbl3_col31_seq"                                                     |                                                                                                                        | postgres
    6245 | ROLLBACK_SEQUENCE        |                         | myschema2.myseq1                                                                 |                                                                                                                        | postgres
    6246 | ROLLBACK_SEQUENCE        |                         | myschema2."myTbl3_col31_seq"                                                     |                                                                                                                        | postgres
    6247 | ROLLBACK_GROUPS          | END                     | myGroup1,myGroup2                                                                | Rollback_id 108, 0 tables and 3 sequences effectively processed                                                        | postgres
    6248 | DBLINK_CLOSE_CNX         |                         | rlbk#1                                                                           |                                                                                                                        | postgres
    6249 | ROLLBACK_GROUPS          | BEGIN                   | myGroup1,myGroup2                                                                | Unlogged rollback to mark Multi-1 (timestamp)                                                                          | postgres
    6250 | DBLINK_OPEN_CNX          |                         | rlbk#1                                                                           | Status = 1                                                                                                             | postgres
    6251 | LOCK_GROUP               | BEGIN                   | myGroup1,myGroup2                                                                | Rollback session #1                                                                                                    | postgres
    6252 | LOCK_GROUP               | END                     | myGroup1,myGroup2                                                                | Rollback session #1: 11 tables locked, 0 deadlock(s)                                                                   | postgres
    6253 | ROLLBACK_GROUPS          | MARK DELETED            | myGroup1                                                                         | mark Multi-2 is deleted                                                                                                | postgres
    6254 | ROLLBACK_GROUPS          | MARK DELETED            | myGroup2                                                                         | mark Multi-2 is deleted                                                                                                | postgres
    6255 | ROLLBACK_SEQUENCE        |                         | myschema1."myTbl3_col31_seq"                                                     |                                                                                                                        | postgres
    6256 | ROLLBACK_SEQUENCE        |                         | myschema2.myseq1                                                                 |                                                                                                                        | postgres
    6257 | ROLLBACK_SEQUENCE        |                         | myschema2."myTbl3_col31_seq"                                                     |                                                                                                                        | postgres
    6258 | ROLLBACK_GROUPS          | END                     | myGroup1,myGroup2                                                                | Rollback_id 109, 0 tables and 3 sequences effectively processed                                                        | postgres
    6259 | DBLINK_CLOSE_CNX         |                         | rlbk#1                                                                           |                                                                                                                        | postgres
    6260 | STOP_GROUPS              | BEGIN                   | myGroup1,myGroup2                                                                |                                                                                                                        | postgres
    6261 | LOCK_GROUPS              | BEGIN                   | myGroup1,myGroup2                                                                |                                                                                                                        | postgres
    6262 | LOCK_GROUPS              | END                     | myGroup1,myGroup2                                                                | 11 tables locked, 0 deadlock(s)                                                                                        | postgres
    6263 | SET_MARK_GROUPS          | BEGIN                   | myGroup1,myGroup2                                                                | Stop after rollback                                                                                                    | postgres
    6264 | CLEANUP_RLBK_STATE       |                         | rollback id 107                                                                  | set to COMMITTED                                                                                                       | postgres
    6265 | CLEANUP_RLBK_STATE       |                         | rollback id 108                                                                  | set to COMMITTED                                                                                                       | postgres
    6266 | CLEANUP_RLBK_STATE       |                         | rollback id 109                                                                  | set to COMMITTED                                                                                                       | postgres
    6267 | SET_MARK_GROUPS          | END                     | myGroup1,myGroup2                                                                | Stop after rollback                                                                                                    | postgres
    6268 | STOP_GROUPS              | END                     | myGroup1,myGroup2                                                                | 14 tables/sequences processed                                                                                          | postgres
    6270 | START_GROUPS             | BEGIN                   | myGroup1,myGroup2                                                                | Without log reset                                                                                                      | postgres
    6271 | LOCK_GROUPS              | BEGIN                   | myGroup1,myGroup2                                                                |                                                                                                                        | postgres
    6272 | LOCK_GROUPS              | END                     | myGroup1,myGroup2                                                                | 11 tables locked, 0 deadlock(s)                                                                                        | postgres
    6273 | SET_MARK_GROUPS          | BEGIN                   | myGroup1,myGroup2                                                                | Multi-1b                                                                                                               | postgres
    6274 | SET_MARK_GROUPS          | END                     | myGroup1,myGroup2                                                                | Multi-1b                                                                                                               | postgres
    6275 | START_GROUPS             | END                     | myGroup1,myGroup2                                                                | 14 tables/sequences processed                                                                                          | postgres
    6276 | SET_MARK_GROUPS          | BEGIN                   | myGroup1,myGroup2                                                                | Multi-2                                                                                                                | postgres
    6277 | LOCK_GROUPS              | BEGIN                   | myGroup1,myGroup2                                                                |                                                                                                                        | postgres
    6278 | LOCK_GROUPS              | END                     | myGroup1,myGroup2                                                                | 11 tables locked, 0 deadlock(s)                                                                                        | postgres
    6279 | SET_MARK_GROUPS          | END                     | myGroup1,myGroup2                                                                | Multi-2                                                                                                                | postgres
    6280 | DELETE_MARK_GROUP        | BEGIN                   | myGroup1                                                                         | Multi-2                                                                                                                | postgres
    6281 | DELETE_MARK_GROUP        | END                     | myGroup1                                                                         | Multi-2                                                                                                                | postgres
    6282 | ROLLBACK_GROUP           | BEGIN                   | myGroup2                                                                         | Unlogged rollback to mark Multi-2 (timestamp)                                                                          | postgres
    6283 | DBLINK_OPEN_CNX          |                         | rlbk#1                                                                           | Status = 1                                                                                                             | postgres
    6284 | LOCK_GROUP               | BEGIN                   | myGroup2                                                                         | Rollback session #1                                                                                                    | postgres
    6285 | LOCK_GROUP               | END                     | myGroup2                                                                         | Rollback session #1: 6 tables locked, 0 deadlock(s)                                                                    | postgres
    6286 | ROLLBACK_SEQUENCE        |                         | myschema2.myseq1                                                                 |                                                                                                                        | postgres
    6287 | ROLLBACK_SEQUENCE        |                         | myschema2."myTbl3_col31_seq"                                                     |                                                                                                                        | postgres
    6288 | ROLLBACK_GROUP           | END                     | myGroup2                                                                         | Rollback_id 110, 0 tables and 2 sequences effectively processed                                                        | postgres
    6289 | DBLINK_CLOSE_CNX         |                         | rlbk#1                                                                           |                                                                                                                        | postgres
    6290 | DELETE_MARK_GROUP        | BEGIN                   | myGroup2                                                                         | Multi-2                                                                                                                | postgres
    6291 | DELETE_MARK_GROUP        | END                     | myGroup2                                                                         | Multi-2                                                                                                                | postgres
    6292 | DELETE_MARK_GROUP        | BEGIN                   | myGroup1                                                                         | Multi-1                                                                                                                | postgres
    6293 | DELETE_MARK_GROUP        | END                     | myGroup1                                                                         | Multi-1                                                                                                                | postgres
    6294 | DELETE_MARK_GROUP        | BEGIN                   | myGroup2                                                                         | Multi-1                                                                                                                | postgres
    6295 | DELETE_MARK_GROUP        | END                     | myGroup2                                                                         | Multi-1                                                                                                                | postgres
    6296 | RENAME_MARK_GROUP        | BEGIN                   | myGroup1                                                                         | Multi-1b                                                                                                               | postgres
    6297 | RENAME_MARK_GROUP        | END                     | myGroup1                                                                         | Multi-1b renamed Multi-1                                                                                               | postgres
    6298 | RENAME_MARK_GROUP        | BEGIN                   | myGroup2                                                                         | Multi-1b                                                                                                               | postgres
    6299 | RENAME_MARK_GROUP        | END                     | myGroup2                                                                         | Multi-1b renamed Multi-1                                                                                               | postgres
    6300 | RENAME_MARK_GROUP        | BEGIN                   | myGroup2                                                                         | M2                                                                                                                     | postgres
    6301 | RENAME_MARK_GROUP        | END                     | myGroup2                                                                         | M2 renamed Deleted M2                                                                                                  | postgres
    6302 | DELETE_BEFORE_MARK_GROUP | BEGIN                   | myGroup2                                                                         | M3                                                                                                                     | postgres
    6303 | DELETE_BEFORE_MARK_GROUP | END                     | myGroup2                                                                         | 2 marks deleted ; M3 is now the initial mark                                                                           | postgres
    6304 | COMMENT_MARK_GROUP       |                         | myGroup2                                                                         | Mark M3                                                                                                                | postgres
    6305 | CREATE_GROUP             | BEGIN                   | phil's group#3",                                                                 | audit_only                                                                                                             | postgres
    6306 | CREATE_GROUP             | SCHEMA CREATED          | "emaj #'3"                                                                       |                                                                                                                        | postgres
    6307 | CREATE_GROUP             | END                     | phil's group#3",                                                                 | 4 tables/sequences processed                                                                                           | postgres
    6308 | DISABLE_PROTECTION       | EVENT TRIGGERS DISABLED |                                                                                  | emaj_protection_trg, emaj_sql_drop_trg, emaj_table_rewrite_trg                                                         | postgres
    6309 | ALTER_GROUP              | BEGIN                   | phil's group#3",                                                                 |                                                                                                                        | postgres
    6310 | ALTER_GROUP              | END                     | phil's group#3",                                                                 | 1 dropped relations and 1 (re)created relations                                                                        | postgres
    6311 | START_GROUP              | BEGIN                   | phil's group#3",                                                                 | With log reset                                                                                                         | postgres
    6312 | LOCK_GROUP               | BEGIN                   | phil's group#3",                                                                 |                                                                                                                        | postgres
    6313 | LOCK_GROUP               | END                     | phil's group#3",                                                                 | 2 tables locked, 0 deadlock(s)                                                                                         | postgres
    6314 | SET_MARK_GROUP           | BEGIN                   | phil's group#3",                                                                 | M1_after_alter_group                                                                                                   | postgres
    6315 | CLEANUP_RLBK_STATE       |                         | rollback id 110                                                                  | set to COMMITTED                                                                                                       | postgres
    6316 | SET_MARK_GROUP           | END                     | phil's group#3",                                                                 | M1_after_alter_group                                                                                                   | postgres
    6317 | START_GROUP              | END                     | phil's group#3",                                                                 | 4 tables/sequences processed                                                                                           | postgres
    6318 | STOP_GROUP               | BEGIN                   | phil's group#3",                                                                 |                                                                                                                        | postgres
    6319 | LOCK_GROUP               | BEGIN                   | phil's group#3",                                                                 |                                                                                                                        | postgres
    6320 | LOCK_GROUP               | END                     | phil's group#3",                                                                 | 2 tables locked, 0 deadlock(s)                                                                                         | postgres
    6321 | SET_MARK_GROUP           | BEGIN                   | phil's group#3",                                                                 | STOP_%                                                                                                                 | postgres
    6322 | SET_MARK_GROUP           | END                     | phil's group#3",                                                                 | STOP_%                                                                                                                 | postgres
    6323 | STOP_GROUP               | END                     | phil's group#3",                                                                 | 4 tables/sequences processed                                                                                           | postgres
    6324 | ALTER_GROUP              | BEGIN                   | phil's group#3",                                                                 |                                                                                                                        | postgres
    6325 | ALTER_GROUP              | END                     | phil's group#3",                                                                 | 1 dropped relations and 1 (re)created relations                                                                        | postgres
    6326 | DROP_GROUP               | BEGIN                   | phil's group#3",                                                                 |                                                                                                                        | postgres
    6327 | DROP_GROUP               | SCHEMA DROPPED          | "emaj #'3"                                                                       |                                                                                                                        | postgres
    6328 | DROP_GROUP               | END                     | phil's group#3",                                                                 | 4 tables/sequences processed                                                                                           | postgres
    6329 | ENABLE_PROTECTION        | EVENT TRIGGERS ENABLED  |                                                                                  | emaj_protection_trg, emaj_sql_drop_trg, emaj_table_rewrite_trg                                                         | postgres
    6330 | CREATE_GROUP             | BEGIN                   | phil's group#3",                                                                 | rollbackable                                                                                                           | postgres
    6331 | CREATE_GROUP             | SCHEMA CREATED          | "emaj #'3"                                                                       |                                                                                                                        | postgres
    6332 | CREATE_GROUP             | END                     | phil's group#3",                                                                 | 4 tables/sequences processed                                                                                           | postgres
    6333 | START_GROUP              | BEGIN                   | phil's group#3",                                                                 | With log reset                                                                                                         | postgres
    6334 | LOCK_GROUP               | BEGIN                   | phil's group#3",                                                                 |                                                                                                                        | postgres
    6335 | LOCK_GROUP               | END                     | phil's group#3",                                                                 | 2 tables locked, 0 deadlock(s)                                                                                         | postgres
    6336 | SET_MARK_GROUP           | BEGIN                   | phil's group#3",                                                                 | M1_rollbackable                                                                                                        | postgres
    6337 | SET_MARK_GROUP           | END                     | phil's group#3",                                                                 | M1_rollbackable                                                                                                        | postgres
    6338 | START_GROUP              | END                     | phil's group#3",                                                                 | 4 tables/sequences processed                                                                                           | postgres
    6339 | SET_MARK_GROUP           | BEGIN                   | phil's group#3",                                                                 |                                                                                                                        | postgres
    6340 | LOCK_GROUP               | BEGIN                   | phil's group#3",                                                                 |                                                                                                                        | postgres
    6341 | LOCK_GROUP               | END                     | phil's group#3",                                                                 | 2 tables locked, 0 deadlock(s)                                                                                         | postgres
    6342 | SET_MARK_GROUP           | END                     | phil's group#3",                                                                 | M2_rollbackable                                                                                                        | postgres
    6343 | SET_MARK_GROUP           | BEGIN                   | phil's group#3",                                                                 |                                                                                                                        | postgres
    6344 | LOCK_GROUP               | BEGIN                   | phil's group#3",                                                                 |                                                                                                                        | postgres
    6345 | LOCK_GROUP               | END                     | phil's group#3",                                                                 | 2 tables locked, 0 deadlock(s)                                                                                         | postgres
    6346 | SET_MARK_GROUP           | END                     | phil's group#3",                                                                 | M2_again!                                                                                                              | postgres
    6347 | SET_MARK_GROUPS          | BEGIN                   | phil's group#3",                                                                 | phil's mark #1                                                                                                         | postgres
    6348 | LOCK_GROUPS              | BEGIN                   | phil's group#3",                                                                 |                                                                                                                        | postgres
    6349 | LOCK_GROUPS              | END                     | phil's group#3",                                                                 | 2 tables locked, 0 deadlock(s)                                                                                         | postgres
    6350 | SET_MARK_GROUPS          | END                     | phil's group#3",                                                                 | phil's mark #1                                                                                                         | postgres
    6351 | COMMENT_MARK_GROUP       |                         | phil's group#3",                                                                 | Mark phil's mark #1                                                                                                    | postgres
    6352 | RENAME_MARK_GROUP        | BEGIN                   | phil's group#3",                                                                 | phil's mark #1                                                                                                         | postgres
    6353 | RENAME_MARK_GROUP        | END                     | phil's group#3",                                                                 | phil's mark #1 renamed phil's mark #3                                                                                  | postgres
    6354 | DELETE_MARK_GROUP        | BEGIN                   | phil's group#3",                                                                 | M2_again!                                                                                                              | postgres
    6355 | DELETE_MARK_GROUP        | END                     | phil's group#3",                                                                 | M2_again!                                                                                                              | postgres
    6356 | ROLLBACK_GROUP           | BEGIN                   | phil's group#3",                                                                 | Logged rollback to mark phil's mark #3 (timestamp)                                                                     | postgres
    6357 | DBLINK_OPEN_CNX          |                         | rlbk#1                                                                           | Status = 1                                                                                                             | postgres
    6358 | LOCK_GROUP               | BEGIN                   | phil's group#3",                                                                 | Rollback session #1                                                                                                    | postgres
    6359 | LOCK_GROUP               | END                     | phil's group#3",                                                                 | Rollback session #1: 2 tables locked, 0 deadlock(s)                                                                    | postgres
    6360 | SET_MARK_GROUP           | BEGIN                   | phil's group#3",                                                                 | RLBK_phil's mark #3_%_START                                                                                            | postgres
    6361 | SET_MARK_GROUP           | END                     | phil's group#3",                                                                 | RLBK_phil's mark #3_%_START                                                                                            | postgres
    6362 | ROLLBACK_SEQUENCE        |                         | "phil's schema3"."myTbl2\_col21_seq"                                             |                                                                                                                        | postgres
    6363 | ROLLBACK_SEQUENCE        |                         | "phil's schema3"."phil's seq\1"                                                  |                                                                                                                        | postgres
    6364 | SET_MARK_GROUP           | BEGIN                   | phil's group#3",                                                                 | RLBK_phil's mark #3_%_DONE                                                                                             | postgres
    6365 | SET_MARK_GROUP           | END                     | phil's group#3",                                                                 | RLBK_phil's mark #3_%_DONE                                                                                             | postgres
    6366 | ROLLBACK_GROUP           | END                     | phil's group#3",                                                                 | Rollback_id 111, 0 tables and 2 sequences effectively processed                                                        | postgres
    6367 | DBLINK_CLOSE_CNX         |                         | rlbk#1                                                                           |                                                                                                                        | postgres
    6368 | ROLLBACK_GROUP           | BEGIN                   | phil's group#3",                                                                 | Unlogged rollback to mark phil's mark #3 (timestamp)                                                                   | postgres
    6369 | DBLINK_OPEN_CNX          |                         | rlbk#1                                                                           | Status = 1                                                                                                             | postgres
    6370 | LOCK_GROUP               | BEGIN                   | phil's group#3",                                                                 | Rollback session #1                                                                                                    | postgres
    6371 | LOCK_GROUP               | END                     | phil's group#3",                                                                 | Rollback session #1: 2 tables locked, 0 deadlock(s)                                                                    | postgres
    6372 | ROLLBACK_GROUP           | MARK DELETED            | phil's group#3",                                                                 | mark RLBK_phil's mark #3_%_START is deleted                                                                            | postgres
    6373 | ROLLBACK_GROUP           | MARK DELETED            | phil's group#3",                                                                 | mark RLBK_phil's mark #3_%_DONE is deleted                                                                             | postgres
    6374 | ROLLBACK_SEQUENCE        |                         | "phil's schema3"."myTbl2\_col21_seq"                                             |                                                                                                                        | postgres
    6375 | ROLLBACK_SEQUENCE        |                         | "phil's schema3"."phil's seq\1"                                                  |                                                                                                                        | postgres
    6376 | ROLLBACK_GROUP           | END                     | phil's group#3",                                                                 | Rollback_id 112, 0 tables and 2 sequences effectively processed                                                        | postgres
    6377 | DBLINK_CLOSE_CNX         |                         | rlbk#1                                                                           |                                                                                                                        | postgres
    6378 | ROLLBACK_GROUP           | BEGIN                   | myGroup1                                                                         | Unlogged rollback to mark Multi-1 (timestamp)                                                                          | postgres
    6379 | DBLINK_OPEN_CNX          |                         | rlbk#1                                                                           | Status = 1                                                                                                             | postgres
    6380 | LOCK_GROUP               | BEGIN                   | myGroup1                                                                         | Rollback session #1                                                                                                    | postgres
    6381 | LOCK_GROUP               | END                     | myGroup1                                                                         | Rollback session #1: 5 tables locked, 0 deadlock(s)                                                                    | postgres
    6382 | ROLLBACK_TABLE           | BEGIN                   | myschema1.mytbl1                                                                 | All log rows with emaj_gid > 100161 and <= 100236                                                                      | postgres
    6383 | ROLLBACK_TABLE           | END                     | myschema1.mytbl1                                                                 | 0 rolled back primary keys                                                                                             | postgres
    6384 | ROLLBACK_SEQUENCE        |                         | myschema1."myTbl3_col31_seq"                                                     |                                                                                                                        | postgres
    6385 | ROLLBACK_GROUP           | END                     | myGroup1                                                                         | Rollback_id 113, 1 tables and 1 sequences effectively processed                                                        | postgres
    6386 | DBLINK_CLOSE_CNX         |                         | rlbk#1                                                                           |                                                                                                                        | postgres
    6387 | SNAP_GROUP               | BEGIN                   | myGroup1                                                                         | /tmp/emaj_test/snaps                                                                                                   | postgres
    6388 | SNAP_GROUP               | END                     | myGroup1                                                                         | 6 tables/sequences processed                                                                                           | postgres
    6389 | SNAP_GROUP               | BEGIN                   | myGroup2                                                                         | /tmp/emaj_test/snaps                                                                                                   | postgres
    6390 | SNAP_GROUP               | END                     | myGroup2                                                                         | 8 tables/sequences processed                                                                                           | postgres
    6391 | SNAP_GROUP               | BEGIN                   | phil's group#3",                                                                 | /tmp/emaj_test/snaps                                                                                                   | postgres
    6392 | SNAP_GROUP               | END                     | phil's group#3",                                                                 | 4 tables/sequences processed                                                                                           | postgres
    6393 | GEN_SQL_GROUP            | BEGIN                   | myGroup1                                                                         | From mark Multi-1 to current situation towards /tmp/emaj_test/sql_scripts/myGroup1.sql                                 | postgres
    6394 | GEN_SQL_GROUP            | END                     | myGroup1                                                                         | 1 generated statements                                                                                                 | postgres
    6395 | GEN_SQL_GROUP            | BEGIN                   | myGroup2                                                                         | From mark Multi-1 to current situation towards /tmp/emaj_test/sql_scripts/myGroup2.sql with tables/sequences filtering | postgres
    6396 | GEN_SQL_GROUP            | END                     | myGroup2                                                                         | 22 generated statements                                                                                                | postgres
    6397 | GEN_SQL_GROUP            | BEGIN                   | phil's group#3",                                                                 | From mark M1_rollbackable to current situation towards /tmp/emaj_test/sql_scripts/Group3.sql                           | postgres
    6398 | GEN_SQL_GROUP            | END                     | phil's group#3",                                                                 | 57 generated statements                                                                                                | postgres
    6438 | STOP_GROUP               | BEGIN                   | phil's group#3",                                                                 |                                                                                                                        | postgres
    6439 | LOCK_GROUP               | BEGIN                   | phil's group#3",                                                                 |                                                                                                                        | postgres
    6440 | LOCK_GROUP               | END                     | phil's group#3",                                                                 | 2 tables locked, 0 deadlock(s)                                                                                         | postgres
    6441 | SET_MARK_GROUP           | BEGIN                   | phil's group#3",                                                                 | STOP_%                                                                                                                 | postgres
    6442 | CLEANUP_RLBK_STATE       |                         | rollback id 111                                                                  | set to COMMITTED                                                                                                       | postgres
    6443 | CLEANUP_RLBK_STATE       |                         | rollback id 112                                                                  | set to COMMITTED                                                                                                       | postgres
    6444 | CLEANUP_RLBK_STATE       |                         | rollback id 113                                                                  | set to COMMITTED                                                                                                       | postgres
    6445 | CLEANUP_RLBK_STATE       |                         | rollback id 114                                                                  | set to ABORTED                                                                                                         | postgres
    6446 | CLEANUP_RLBK_STATE       |                         | rollback id 115                                                                  | set to ABORTED                                                                                                         | postgres
    6447 | CLEANUP_RLBK_STATE       |                         | rollback id 116                                                                  | set to ABORTED                                                                                                         | postgres
    6448 | SET_MARK_GROUP           | END                     | phil's group#3",                                                                 | STOP_%                                                                                                                 | postgres
    6449 | STOP_GROUP               | END                     | phil's group#3",                                                                 | 4 tables/sequences processed                                                                                           | postgres
    6450 | ALTER_GROUP              | BEGIN                   | phil's group#3",                                                                 |                                                                                                                        | postgres
    6451 | ALTER_GROUP              | END                     | phil's group#3",                                                                 | 1 dropped relations and 1 (re)created relations                                                                        | postgres
    6452 | START_GROUP              | BEGIN                   | phil's group#3",                                                                 | With log reset                                                                                                         | postgres
    6453 | LOCK_GROUP               | BEGIN                   | phil's group#3",                                                                 |                                                                                                                        | postgres
    6454 | LOCK_GROUP               | END                     | phil's group#3",                                                                 | 2 tables locked, 0 deadlock(s)                                                                                         | postgres
    6455 | SET_MARK_GROUP           | BEGIN                   | phil's group#3",                                                                 | M1_after_alter_group                                                                                                   | postgres
    6456 | SET_MARK_GROUP           | END                     | phil's group#3",                                                                 | M1_after_alter_group                                                                                                   | postgres
    6457 | START_GROUP              | END                     | phil's group#3",                                                                 | 4 tables/sequences processed                                                                                           | postgres
    6458 | SET_MARK_GROUP           | BEGIN                   | phil's group#3",                                                                 |                                                                                                                        | postgres
    6459 | LOCK_GROUP               | BEGIN                   | phil's group#3",                                                                 |                                                                                                                        | postgres
    6460 | LOCK_GROUP               | END                     | phil's group#3",                                                                 | 2 tables locked, 0 deadlock(s)                                                                                         | postgres
    6461 | SET_MARK_GROUP           | END                     | phil's group#3",                                                                 | M2                                                                                                                     | postgres
    6462 | ROLLBACK_GROUP           | BEGIN                   | phil's group#3",                                                                 | Unlogged rollback to mark M1_after_alter_group (timestamp)                                                             | postgres
    6463 | DBLINK_OPEN_CNX          |                         | rlbk#1                                                                           | Status = 1                                                                                                             | postgres
    6464 | LOCK_GROUP               | BEGIN                   | phil's group#3",                                                                 | Rollback session #1                                                                                                    | postgres
    6465 | LOCK_GROUP               | END                     | phil's group#3",                                                                 | Rollback session #1: 2 tables locked, 0 deadlock(s)                                                                    | postgres
    6466 | ROLLBACK_TABLE           | BEGIN                   | "phil's schema3".table_with_very_looooooooooooooooooooooooooooooooooooooong_name | All log rows with emaj_gid > 100331 and <= 100337                                                                      | postgres
    6467 | ROLLBACK_TABLE           | END                     | "phil's schema3".table_with_very_looooooooooooooooooooooooooooooooooooooong_name | 10 rolled back primary keys                                                                                            | postgres
    6468 | ROLLBACK_GROUP           | MARK DELETED            | phil's group#3",                                                                 | mark M2 is deleted                                                                                                     | postgres
    6469 | ROLLBACK_SEQUENCE        |                         | "phil's schema3"."myTbl2\_col21_seq"                                             |                                                                                                                        | postgres
    6470 | ROLLBACK_SEQUENCE        |                         | "phil's schema3"."phil's seq\1"                                                  |                                                                                                                        | postgres
    6471 | ROLLBACK_GROUP           | END                     | phil's group#3",                                                                 | Rollback_id 117, 1 tables and 2 sequences effectively processed                                                        | postgres
    6472 | DBLINK_CLOSE_CNX         |                         | rlbk#1                                                                           |                                                                                                                        | postgres
    6473 | STOP_GROUP               | BEGIN                   | phil's group#3",                                                                 |                                                                                                                        | postgres
    6474 | LOCK_GROUP               | BEGIN                   | phil's group#3",                                                                 |                                                                                                                        | postgres
    6475 | LOCK_GROUP               | END                     | phil's group#3",                                                                 | 2 tables locked, 0 deadlock(s)                                                                                         | postgres
    6476 | SET_MARK_GROUP           | BEGIN                   | phil's group#3",                                                                 | STOP_%                                                                                                                 | postgres
    6477 | CLEANUP_RLBK_STATE       |                         | rollback id 117                                                                  | set to COMMITTED                                                                                                       | postgres
    6478 | SET_MARK_GROUP           | END                     | phil's group#3",                                                                 | STOP_%                                                                                                                 | postgres
    6479 | STOP_GROUP               | END                     | phil's group#3",                                                                 | 4 tables/sequences processed                                                                                           | postgres
    6480 | DROP_GROUP               | BEGIN                   | phil's group#3",                                                                 |                                                                                                                        | postgres
    6481 | DROP_GROUP               | SCHEMA DROPPED          | "emaj #'3"                                                                       |                                                                                                                        | postgres
    6482 | DROP_GROUP               | END                     | phil's group#3",                                                                 | 4 tables/sequences processed                                                                                           | postgres
    6483 | PROTECT_GROUP            |                         | myGroup2                                                                         | Status 1                                                                                                               | postgres
    6484 | UNPROTECT_GROUP          |                         | myGroup2                                                                         | Status 1                                                                                                               | postgres
    6485 | SET_MARK_GROUP           | BEGIN                   | myGroup1                                                                         |                                                                                                                        | postgres
    6486 | LOCK_GROUP               | BEGIN                   | myGroup1                                                                         |                                                                                                                        | postgres
    6487 | LOCK_GROUP               | END                     | myGroup1                                                                         | 5 tables locked, 0 deadlock(s)                                                                                         | postgres
    6488 | SET_MARK_GROUP           | END                     | myGroup1                                                                         | Mark_to_protect                                                                                                        | postgres
    6489 | PROTECT_MARK_GROUP       |                         | myGroup1                                                                         | Mark Mark_to_protect ; status 1                                                                                        | postgres
    6490 | UNPROTECT_MARK_GROUP     |                         | myGroup1                                                                         | Mark Mark_to_protect ; status 1                                                                                        | postgres
    6491 | DELETE_MARK_GROUP        | BEGIN                   | myGroup1                                                                         | Mark_to_protect                                                                                                        | postgres
    6492 | DELETE_MARK_GROUP        | END                     | myGroup1                                                                         | Mark_to_protect                                                                                                        | postgres
    6493 | SET_MARK_GROUP           | BEGIN                   | myGroup1                                                                         |                                                                                                                        | postgres
    6494 | LOCK_GROUP               | BEGIN                   | myGroup1                                                                         |                                                                                                                        | postgres
    6495 | LOCK_GROUP               | END                     | myGroup1                                                                         | 5 tables locked, 0 deadlock(s)                                                                                         | postgres
    6496 | SET_MARK_GROUP           | END                     | myGroup1                                                                         | MC1                                                                                                                    | postgres
    6497 | SET_MARK_GROUP           | BEGIN                   | myGroup1                                                                         |                                                                                                                        | postgres
    6498 | LOCK_GROUP               | BEGIN                   | myGroup1                                                                         |                                                                                                                        | postgres
    6499 | LOCK_GROUP               | END                     | myGroup1                                                                         | 5 tables locked, 0 deadlock(s)                                                                                         | postgres
    6500 | SET_MARK_GROUP           | END                     | myGroup1                                                                         | MC2                                                                                                                    | postgres
    6501 | ROLLBACK_GROUP           | BEGIN                   | myGroup1                                                                         | Logged rollback to mark MC1 (timestamp)                                                                                | postgres
    6502 | DBLINK_OPEN_CNX          |                         | rlbk#1                                                                           | Status = 1                                                                                                             | postgres
    6503 | LOCK_GROUP               | BEGIN                   | myGroup1                                                                         | Rollback session #1                                                                                                    | postgres
    6504 | LOCK_GROUP               | END                     | myGroup1                                                                         | Rollback session #1: 5 tables locked, 0 deadlock(s)                                                                    | postgres
    6505 | SET_MARK_GROUP           | BEGIN                   | myGroup1                                                                         | RLBK_MC1_%_START                                                                                                       | postgres
    6506 | SET_MARK_GROUP           | END                     | myGroup1                                                                         | RLBK_MC1_%_START                                                                                                       | postgres
    6507 | ROLLBACK_TABLE           | BEGIN                   | myschema1.mytbl1                                                                 | All log rows with emaj_gid > 100337 and <= 100354                                                                      | postgres
    6508 | ROLLBACK_TABLE           | END                     | myschema1.mytbl1                                                                 | 13 rolled back primary keys                                                                                            | postgres
    6509 | ROLLBACK_TABLE           | BEGIN                   | myschema1.mytbl2                                                                 | All log rows with emaj_gid > 100337 and <= 100354                                                                      | postgres
    6510 | ROLLBACK_TABLE           | END                     | myschema1.mytbl2                                                                 | 1 rolled back primary keys                                                                                             | postgres
    6511 | ROLLBACK_SEQUENCE        |                         | myschema1."myTbl3_col31_seq"                                                     |                                                                                                                        | postgres
    6512 | SET_MARK_GROUP           | BEGIN                   | myGroup1                                                                         | RLBK_MC1_%_DONE                                                                                                        | postgres
    6513 | SET_MARK_GROUP           | END                     | myGroup1                                                                         | RLBK_MC1_%_DONE                                                                                                        | postgres
    6514 | ROLLBACK_GROUP           | END                     | myGroup1                                                                         | Rollback_id 118, 2 tables and 1 sequences effectively processed                                                        | postgres
    6515 | DBLINK_CLOSE_CNX         |                         | rlbk#1                                                                           |                                                                                                                        | postgres
    6516 | RENAME_MARK_GROUP        | BEGIN                   | myGroup1                                                                         | EMAJ_LAST_MARK                                                                                                         | postgres
    6517 | RENAME_MARK_GROUP        | END                     | myGroup1                                                                         | RLBK_MC1_%_DONE renamed RLBK_MC1_DONE                                                                                  | postgres
    6518 | SET_MARK_GROUP           | BEGIN                   | myGroup1                                                                         |                                                                                                                        | postgres
    6519 | LOCK_GROUP               | BEGIN                   | myGroup1                                                                         |                                                                                                                        | postgres
    6520 | LOCK_GROUP               | END                     | myGroup1                                                                         | 5 tables locked, 0 deadlock(s)                                                                                         | postgres
    6521 | CLEANUP_RLBK_STATE       |                         | rollback id 118                                                                  | set to COMMITTED                                                                                                       | postgres
    6522 | SET_MARK_GROUP           | END                     | myGroup1                                                                         | MC3                                                                                                                    | postgres
    6523 | SET_MARK_GROUP           | BEGIN                   | myGroup1                                                                         |                                                                                                                        | postgres
    6524 | LOCK_GROUP               | BEGIN                   | myGroup1                                                                         |                                                                                                                        | postgres
    6525 | LOCK_GROUP               | END                     | myGroup1                                                                         | 5 tables locked, 0 deadlock(s)                                                                                         | postgres
    6526 | SET_MARK_GROUP           | END                     | myGroup1                                                                         | MC4                                                                                                                    | postgres
    6527 | SET_MARK_GROUP           | BEGIN                   | myGroup1                                                                         |                                                                                                                        | postgres
    6528 | LOCK_GROUP               | BEGIN                   | myGroup1                                                                         |                                                                                                                        | postgres
    6529 | LOCK_GROUP               | END                     | myGroup1                                                                         | 5 tables locked, 0 deadlock(s)                                                                                         | postgres
    6530 | SET_MARK_GROUP           | END                     | myGroup1                                                                         | MC5                                                                                                                    | postgres
    6531 | ROLLBACK_GROUP           | BEGIN                   | myGroup1                                                                         | Logged rollback to mark MC3 (timestamp)                                                                                | postgres
    6532 | DBLINK_OPEN_CNX          |                         | rlbk#1                                                                           | Status = 1                                                                                                             | postgres
    6533 | LOCK_GROUP               | BEGIN                   | myGroup1                                                                         | Rollback session #1                                                                                                    | postgres
    6534 | LOCK_GROUP               | END                     | myGroup1                                                                         | Rollback session #1: 5 tables locked, 0 deadlock(s)                                                                    | postgres
    6535 | SET_MARK_GROUP           | BEGIN                   | myGroup1                                                                         | RLBK_MC3_%_START                                                                                                       | postgres
    6536 | SET_MARK_GROUP           | END                     | myGroup1                                                                         | RLBK_MC3_%_START                                                                                                       | postgres
    6537 | ROLLBACK_TABLE           | BEGIN                   | myschema1."myTbl3"                                                               | All log rows with emaj_gid > 100367 and <= 100379                                                                      | postgres
    6538 | ROLLBACK_TABLE           | END                     | myschema1."myTbl3"                                                               | 10 rolled back primary keys                                                                                            | postgres
    6539 | ROLLBACK_TABLE           | BEGIN                   | myschema1.mytbl4                                                                 | All log rows with emaj_gid > 100367 and <= 100379                                                                      | postgres
    6540 | ROLLBACK_TABLE           | END                     | myschema1.mytbl4                                                                 | 1 rolled back primary keys                                                                                             | postgres
    6541 | ROLLBACK_SEQUENCE        |                         | myschema1."myTbl3_col31_seq"                                                     | RESTART 21                                                                                                             | postgres
    6542 | SET_MARK_GROUP           | BEGIN                   | myGroup1                                                                         | RLBK_MC3_%_DONE                                                                                                        | postgres
    6543 | SET_MARK_GROUP           | END                     | myGroup1                                                                         | RLBK_MC3_%_DONE                                                                                                        | postgres
    6544 | ROLLBACK_GROUP           | END                     | myGroup1                                                                         | Rollback_id 119, 2 tables and 1 sequences effectively processed                                                        | postgres
    6545 | DBLINK_CLOSE_CNX         |                         | rlbk#1                                                                           |                                                                                                                        | postgres
    6546 | CONSOLIDATE_RLBK_GROUP   | BEGIN                   | myGroup1                                                                         | Erase all between marks MC1 and RLBK_MC1_DONE                                                                          | postgres
    6547 | CONSOLIDATE_RLBK_GROUP   | END                     | myGroup1                                                                         | 2 tables and 1 sequences processed ; 2 marks deleted                                                                   | postgres
    6548 | CONSOLIDATE_RLBK_GROUP   | BEGIN                   | myGroup1                                                                         | Erase all between marks MC3 and RLBK_MC3_%_DONE                                                                        | postgres
    6549 | CONSOLIDATE_RLBK_GROUP   | END                     | myGroup1                                                                         | 2 tables and 1 sequences processed ; 3 marks deleted                                                                   | postgres
    6550 | SET_MARK_GROUP           | BEGIN                   | myGroup1                                                                         |                                                                                                                        | postgres
    6551 | LOCK_GROUP               | BEGIN                   | myGroup1                                                                         |                                                                                                                        | postgres
    6552 | LOCK_GROUP               | END                     | myGroup1                                                                         | 5 tables locked, 0 deadlock(s)                                                                                         | postgres
    6553 | CLEANUP_RLBK_STATE       |                         | rollback id 119                                                                  | set to COMMITTED                                                                                                       | postgres
    6554 | SET_MARK_GROUP           | END                     | myGroup1                                                                         | MC6                                                                                                                    | postgres
    6555 | SET_MARK_GROUP           | BEGIN                   | myGroup1                                                                         |                                                                                                                        | postgres
    6556 | LOCK_GROUP               | BEGIN                   | myGroup1                                                                         |                                                                                                                        | postgres
    6557 | LOCK_GROUP               | END                     | myGroup1                                                                         | 5 tables locked, 0 deadlock(s)                                                                                         | postgres
    6558 | SET_MARK_GROUP           | END                     | myGroup1                                                                         | MC7                                                                                                                    | postgres
    6559 | SET_MARK_GROUP           | BEGIN                   | myGroup1                                                                         |                                                                                                                        | postgres
    6560 | LOCK_GROUP               | BEGIN                   | myGroup1                                                                         |                                                                                                                        | postgres
    6561 | LOCK_GROUP               | END                     | myGroup1                                                                         | 5 tables locked, 0 deadlock(s)                                                                                         | postgres
    6562 | SET_MARK_GROUP           | END                     | myGroup1                                                                         | MC8                                                                                                                    | postgres
    6563 | ROLLBACK_GROUP           | BEGIN                   | myGroup1                                                                         | Logged rollback to mark MC8 (timestamp)                                                                                | postgres
    6564 | DBLINK_OPEN_CNX          |                         | rlbk#1                                                                           | Status = 1                                                                                                             | postgres
    6565 | LOCK_GROUP               | BEGIN                   | myGroup1                                                                         | Rollback session #1                                                                                                    | postgres
    6566 | LOCK_GROUP               | END                     | myGroup1                                                                         | Rollback session #1: 5 tables locked, 0 deadlock(s)                                                                    | postgres
    6567 | SET_MARK_GROUP           | BEGIN                   | myGroup1                                                                         | RLBK_MC8_%_START                                                                                                       | postgres
    6568 | SET_MARK_GROUP           | END                     | myGroup1                                                                         | RLBK_MC8_%_START                                                                                                       | postgres
    6569 | ROLLBACK_TABLE           | BEGIN                   | myschema1.mytbl2                                                                 | All log rows with emaj_gid > 100407 and <= 100408                                                                      | postgres
    6570 | ROLLBACK_TABLE           | END                     | myschema1.mytbl2                                                                 | 1 rolled back primary keys                                                                                             | postgres
    6571 | ROLLBACK_SEQUENCE        |                         | myschema1."myTbl3_col31_seq"                                                     |                                                                                                                        | postgres
    6572 | SET_MARK_GROUP           | BEGIN                   | myGroup1                                                                         | RLBK_MC8_%_DONE                                                                                                        | postgres
    6573 | SET_MARK_GROUP           | END                     | myGroup1                                                                         | RLBK_MC8_%_DONE                                                                                                        | postgres
    6574 | ROLLBACK_GROUP           | END                     | myGroup1                                                                         | Rollback_id 120, 1 tables and 1 sequences effectively processed                                                        | postgres
    6575 | DBLINK_CLOSE_CNX         |                         | rlbk#1                                                                           |                                                                                                                        | postgres
    6576 | CONSOLIDATE_RLBK_GROUP   | BEGIN                   | myGroup1                                                                         | Erase all between marks MC8 and RLBK_MC8_%_DONE                                                                        | postgres
    6577 | CONSOLIDATE_RLBK_GROUP   | END                     | myGroup1                                                                         | 1 tables and 1 sequences processed ; 1 marks deleted                                                                   | postgres
    6578 | SET_MARK_GROUP           | BEGIN                   | myGroup1                                                                         |                                                                                                                        | postgres
    6579 | LOCK_GROUP               | BEGIN                   | myGroup1                                                                         |                                                                                                                        | postgres
    6580 | LOCK_GROUP               | END                     | myGroup1                                                                         | 5 tables locked, 0 deadlock(s)                                                                                         | postgres
    6581 | CLEANUP_RLBK_STATE       |                         | rollback id 120                                                                  | set to COMMITTED                                                                                                       | postgres
    6582 | SET_MARK_GROUP           | END                     | myGroup1                                                                         | MC9                                                                                                                    | postgres
    6583 | ROLLBACK_GROUP           | BEGIN                   | myGroup1                                                                         | Logged rollback to mark MC6 (timestamp)                                                                                | postgres
    6584 | DBLINK_OPEN_CNX          |                         | rlbk#1                                                                           | Status = 1                                                                                                             | postgres
    6585 | LOCK_GROUP               | BEGIN                   | myGroup1                                                                         | Rollback session #1                                                                                                    | postgres
    6586 | LOCK_GROUP               | END                     | myGroup1                                                                         | Rollback session #1: 5 tables locked, 0 deadlock(s)                                                                    | postgres
    6587 | SET_MARK_GROUP           | BEGIN                   | myGroup1                                                                         | RLBK_MC6_%_START                                                                                                       | postgres
    6588 | SET_MARK_GROUP           | END                     | myGroup1                                                                         | RLBK_MC6_%_START                                                                                                       | postgres
    6589 | ROLLBACK_TABLE           | BEGIN                   | myschema1.mytbl1                                                                 | All log rows with emaj_gid > 100390 and <= 100421                                                                      | postgres
    6590 | ROLLBACK_TABLE           | END                     | myschema1.mytbl1                                                                 | 13 rolled back primary keys                                                                                            | postgres
    6591 | ROLLBACK_TABLE           | BEGIN                   | myschema1.mytbl2                                                                 | All log rows with emaj_gid > 100390 and <= 100421                                                                      | postgres
    6592 | ROLLBACK_TABLE           | END                     | myschema1.mytbl2                                                                 | 1 rolled back primary keys                                                                                             | postgres
    6593 | ROLLBACK_TABLE           | BEGIN                   | myschema1.mytbl4                                                                 | All log rows with emaj_gid > 100390 and <= 100421                                                                      | postgres
    6594 | ROLLBACK_TABLE           | END                     | myschema1.mytbl4                                                                 | 1 rolled back primary keys                                                                                             | postgres
    6595 | ROLLBACK_TABLE           | BEGIN                   | myschema1."myTbl3"                                                               | All log rows with emaj_gid > 100390 and <= 100421                                                                      | postgres
    6596 | ROLLBACK_TABLE           | END                     | myschema1."myTbl3"                                                               | 10 rolled back primary keys                                                                                            | postgres
    6597 | ROLLBACK_SEQUENCE        |                         | myschema1."myTbl3_col31_seq"                                                     | RESTART 21                                                                                                             | postgres
    6598 | SET_MARK_GROUP           | BEGIN                   | myGroup1                                                                         | RLBK_MC6_%_DONE                                                                                                        | postgres
    6599 | SET_MARK_GROUP           | END                     | myGroup1                                                                         | RLBK_MC6_%_DONE                                                                                                        | postgres
    6600 | ROLLBACK_GROUP           | END                     | myGroup1                                                                         | Rollback_id 121, 4 tables and 1 sequences effectively processed                                                        | postgres
    6601 | DBLINK_CLOSE_CNX         |                         | rlbk#1                                                                           |                                                                                                                        | postgres
    6602 | CONSOLIDATE_RLBK_GROUP   | BEGIN                   | myGroup1                                                                         | Erase all between marks MC6 and RLBK_MC6_%_DONE                                                                        | postgres
    6603 | CONSOLIDATE_RLBK_GROUP   | END                     | myGroup1                                                                         | 4 tables and 1 sequences processed ; 5 marks deleted                                                                   | postgres
    6604 | SET_MARK_GROUP           | BEGIN                   | myGroup1                                                                         |                                                                                                                        | postgres
    6605 | LOCK_GROUP               | BEGIN                   | myGroup1                                                                         |                                                                                                                        | postgres
    6606 | LOCK_GROUP               | END                     | myGroup1                                                                         | 5 tables locked, 0 deadlock(s)                                                                                         | postgres
    6607 | CLEANUP_RLBK_STATE       |                         | rollback id 121                                                                  | set to COMMITTED                                                                                                       | postgres
    6608 | SET_MARK_GROUP           | END                     | myGroup1                                                                         | MC10                                                                                                                   | postgres
    6609 | ROLLBACK_GROUP           | BEGIN                   | myGroup1                                                                         | Logged rollback to mark MC10 (timestamp)                                                                               | postgres
    6610 | DBLINK_OPEN_CNX          |                         | rlbk#1                                                                           | Status = 1                                                                                                             | postgres
    6611 | LOCK_GROUP               | BEGIN                   | myGroup1                                                                         | Rollback session #1                                                                                                    | postgres
    6612 | LOCK_GROUP               | END                     | myGroup1                                                                         | Rollback session #1: 5 tables locked, 0 deadlock(s)                                                                    | postgres
    6613 | SET_MARK_GROUP           | BEGIN                   | myGroup1                                                                         | RLBK_MC10_%_START                                                                                                      | postgres
    6614 | SET_MARK_GROUP           | END                     | myGroup1                                                                         | RLBK_MC10_%_START                                                                                                      | postgres
    6615 | ROLLBACK_TABLE           | BEGIN                   | myschema1.mytbl1                                                                 | All log rows with emaj_gid > 100444 and <= 100460                                                                      | postgres
    6616 | ROLLBACK_TABLE           | END                     | myschema1.mytbl1                                                                 | 11 rolled back primary keys                                                                                            | postgres
    6617 | ROLLBACK_SEQUENCE        |                         | myschema1."myTbl3_col31_seq"                                                     |                                                                                                                        | postgres
    6618 | SET_MARK_GROUP           | BEGIN                   | myGroup1                                                                         | RLBK_MC10_%_DONE                                                                                                       | postgres
    6619 | SET_MARK_GROUP           | END                     | myGroup1                                                                         | RLBK_MC10_%_DONE                                                                                                       | postgres
    6620 | ROLLBACK_GROUP           | END                     | myGroup1                                                                         | Rollback_id 122, 1 tables and 1 sequences effectively processed                                                        | postgres
    6621 | DBLINK_CLOSE_CNX         |                         | rlbk#1                                                                           |                                                                                                                        | postgres
    6622 | SET_MARK_GROUP           | BEGIN                   | myGroup1                                                                         |                                                                                                                        | postgres
    6623 | LOCK_GROUP               | BEGIN                   | myGroup1                                                                         |                                                                                                                        | postgres
    6624 | LOCK_GROUP               | END                     | myGroup1                                                                         | 5 tables locked, 0 deadlock(s)                                                                                         | postgres
    6625 | CLEANUP_RLBK_STATE       |                         | rollback id 122                                                                  | set to COMMITTED                                                                                                       | postgres
    6626 | SET_MARK_GROUP           | END                     | myGroup1                                                                         | MC11                                                                                                                   | postgres
    6627 | ROLLBACK_GROUP           | BEGIN                   | myGroup1                                                                         | Logged rollback to mark MC10 (timestamp)                                                                               | postgres
    6628 | DBLINK_OPEN_CNX          |                         | rlbk#1                                                                           | Status = 1                                                                                                             | postgres
    6629 | LOCK_GROUP               | BEGIN                   | myGroup1                                                                         | Rollback session #1                                                                                                    | postgres
    6630 | LOCK_GROUP               | END                     | myGroup1                                                                         | Rollback session #1: 5 tables locked, 0 deadlock(s)                                                                    | postgres
    6631 | SET_MARK_GROUP           | BEGIN                   | myGroup1                                                                         | RLBK_MC10_%_START                                                                                                      | postgres
    6632 | SET_MARK_GROUP           | END                     | myGroup1                                                                         | RLBK_MC10_%_START                                                                                                      | postgres
    6633 | ROLLBACK_TABLE           | BEGIN                   | myschema1.mytbl1                                                                 | All log rows with emaj_gid > 100444 and <= 100468                                                                      | postgres
    6634 | ROLLBACK_TABLE           | END                     | myschema1.mytbl1                                                                 | 11 rolled back primary keys                                                                                            | postgres
    6635 | ROLLBACK_TABLE           | BEGIN                   | myschema1.mytbl4                                                                 | All log rows with emaj_gid > 100444 and <= 100468                                                                      | postgres
    6636 | ROLLBACK_TABLE           | END                     | myschema1.mytbl4                                                                 | 1 rolled back primary keys                                                                                             | postgres
    6637 | ROLLBACK_SEQUENCE        |                         | myschema1."myTbl3_col31_seq"                                                     |                                                                                                                        | postgres
    6638 | SET_MARK_GROUP           | BEGIN                   | myGroup1                                                                         | RLBK_MC10_%_DONE                                                                                                       | postgres
    6639 | SET_MARK_GROUP           | END                     | myGroup1                                                                         | RLBK_MC10_%_DONE                                                                                                       | postgres
    6640 | ROLLBACK_GROUP           | END                     | myGroup1                                                                         | Rollback_id 123, 2 tables and 1 sequences effectively processed                                                        | postgres
    6641 | DBLINK_CLOSE_CNX         |                         | rlbk#1                                                                           |                                                                                                                        | postgres
    6642 | CONSOLIDATE_RLBK_GROUP   | BEGIN                   | myGroup1                                                                         | Erase all between marks MC10 and RLBK_MC10_%_DONE                                                                      | postgres
    6643 | CONSOLIDATE_RLBK_GROUP   | END                     | myGroup1                                                                         | 2 tables and 1 sequences processed ; 4 marks deleted                                                                   | postgres
    6644 | SET_MARK_GROUP           | BEGIN                   | myGroup1                                                                         |                                                                                                                        | postgres
    6645 | LOCK_GROUP               | BEGIN                   | myGroup1                                                                         |                                                                                                                        | postgres
    6646 | LOCK_GROUP               | END                     | myGroup1                                                                         | 5 tables locked, 0 deadlock(s)                                                                                         | postgres
    6647 | CLEANUP_RLBK_STATE       |                         | rollback id 123                                                                  | set to COMMITTED                                                                                                       | postgres
    6648 | SET_MARK_GROUP           | END                     | myGroup1                                                                         | MC15                                                                                                                   | postgres
    6649 | SET_MARK_GROUP           | BEGIN                   | myGroup1                                                                         |                                                                                                                        | postgres
    6650 | LOCK_GROUP               | BEGIN                   | myGroup1                                                                         |                                                                                                                        | postgres
    6651 | LOCK_GROUP               | END                     | myGroup1                                                                         | 5 tables locked, 0 deadlock(s)                                                                                         | postgres
    6652 | SET_MARK_GROUP           | END                     | myGroup1                                                                         | MC16                                                                                                                   | postgres
    6653 | ROLLBACK_GROUP           | BEGIN                   | myGroup1                                                                         | Logged rollback to mark MC15 (timestamp)                                                                               | postgres
    6654 | DBLINK_OPEN_CNX          |                         | rlbk#1                                                                           | Status = 1                                                                                                             | postgres
    6655 | LOCK_GROUP               | BEGIN                   | myGroup1                                                                         | Rollback session #1                                                                                                    | postgres
    6656 | LOCK_GROUP               | END                     | myGroup1                                                                         | Rollback session #1: 5 tables locked, 0 deadlock(s)                                                                    | postgres
    6657 | SET_MARK_GROUP           | BEGIN                   | myGroup1                                                                         | RLBK_MC15_%_START                                                                                                      | postgres
    6658 | SET_MARK_GROUP           | END                     | myGroup1                                                                         | RLBK_MC15_%_START                                                                                                      | postgres
    6659 | ROLLBACK_TABLE           | BEGIN                   | myschema1.mytbl1                                                                 | All log rows with emaj_gid > 100469 and <= 100486                                                                      | postgres
    6660 | ROLLBACK_TABLE           | END                     | myschema1.mytbl1                                                                 | 13 rolled back primary keys                                                                                            | postgres
    6661 | ROLLBACK_TABLE           | BEGIN                   | myschema1.mytbl2                                                                 | All log rows with emaj_gid > 100469 and <= 100486                                                                      | postgres
    6662 | ROLLBACK_TABLE           | END                     | myschema1.mytbl2                                                                 | 1 rolled back primary keys                                                                                             | postgres
    6663 | ROLLBACK_SEQUENCE        |                         | myschema1."myTbl3_col31_seq"                                                     |                                                                                                                        | postgres
    6664 | SET_MARK_GROUP           | BEGIN                   | myGroup1                                                                         | RLBK_MC15_%_DONE                                                                                                       | postgres
    6665 | SET_MARK_GROUP           | END                     | myGroup1                                                                         | RLBK_MC15_%_DONE                                                                                                       | postgres
    6666 | ROLLBACK_GROUP           | END                     | myGroup1                                                                         | Rollback_id 124, 2 tables and 1 sequences effectively processed                                                        | postgres
    6667 | DBLINK_CLOSE_CNX         |                         | rlbk#1                                                                           |                                                                                                                        | postgres
    6668 | RENAME_MARK_GROUP        | BEGIN                   | myGroup1                                                                         | EMAJ_LAST_MARK                                                                                                         | postgres
    6669 | RENAME_MARK_GROUP        | END                     | myGroup1                                                                         | RLBK_MC15_%_DONE renamed RLBK_MC15_DONE                                                                                | postgres
    6670 | SET_MARK_GROUP           | BEGIN                   | myGroup1                                                                         |                                                                                                                        | postgres
    6671 | LOCK_GROUP               | BEGIN                   | myGroup1                                                                         |                                                                                                                        | postgres
    6672 | LOCK_GROUP               | END                     | myGroup1                                                                         | 5 tables locked, 0 deadlock(s)                                                                                         | postgres
    6673 | CLEANUP_RLBK_STATE       |                         | rollback id 124                                                                  | set to COMMITTED                                                                                                       | postgres
    6674 | SET_MARK_GROUP           | END                     | myGroup1                                                                         | MC17                                                                                                                   | postgres
    6675 | ROLLBACK_GROUP           | BEGIN                   | myGroup1                                                                         | Logged rollback to mark MC16 (timestamp)                                                                               | postgres
    6676 | DBLINK_OPEN_CNX          |                         | rlbk#1                                                                           | Status = 1                                                                                                             | postgres
    6677 | LOCK_GROUP               | BEGIN                   | myGroup1                                                                         | Rollback session #1                                                                                                    | postgres
    6678 | LOCK_GROUP               | END                     | myGroup1                                                                         | Rollback session #1: 5 tables locked, 0 deadlock(s)                                                                    | postgres
    6679 | SET_MARK_GROUP           | BEGIN                   | myGroup1                                                                         | RLBK_MC16_%_START                                                                                                      | postgres
    6680 | SET_MARK_GROUP           | END                     | myGroup1                                                                         | RLBK_MC16_%_START                                                                                                      | postgres
    6681 | ROLLBACK_TABLE           | BEGIN                   | myschema1.mytbl1                                                                 | All log rows with emaj_gid > 100485 and <= 100499                                                                      | postgres
    6682 | ROLLBACK_TABLE           | END                     | myschema1.mytbl1                                                                 | 11 rolled back primary keys                                                                                            | postgres
    6683 | ROLLBACK_TABLE           | BEGIN                   | myschema1.mytbl2                                                                 | All log rows with emaj_gid > 100485 and <= 100499                                                                      | postgres
    6684 | ROLLBACK_TABLE           | END                     | myschema1.mytbl2                                                                 | 2 rolled back primary keys                                                                                             | postgres
    6685 | ROLLBACK_SEQUENCE        |                         | myschema1."myTbl3_col31_seq"                                                     |                                                                                                                        | postgres
    6686 | SET_MARK_GROUP           | BEGIN                   | myGroup1                                                                         | RLBK_MC16_%_DONE                                                                                                       | postgres
    6687 | SET_MARK_GROUP           | END                     | myGroup1                                                                         | RLBK_MC16_%_DONE                                                                                                       | postgres
    6688 | ROLLBACK_GROUP           | END                     | myGroup1                                                                         | Rollback_id 125, 2 tables and 1 sequences effectively processed                                                        | postgres
    6689 | DBLINK_CLOSE_CNX         |                         | rlbk#1                                                                           |                                                                                                                        | postgres
    6690 | CONSOLIDATE_RLBK_GROUP   | BEGIN                   | myGroup1                                                                         | Erase all between marks MC15 and RLBK_MC15_DONE                                                                        | postgres
    6691 | CONSOLIDATE_RLBK_GROUP   | END                     | myGroup1                                                                         | 2 tables and 1 sequences processed ; 2 marks deleted                                                                   | postgres
    6692 | ROLLBACK_GROUP           | BEGIN                   | myGroup1                                                                         | Unlogged rollback to mark Multi-1 (timestamp)                                                                          | postgres
    6693 | DBLINK_OPEN_CNX          |                         | rlbk#1                                                                           | Status = 1                                                                                                             | postgres
    6694 | LOCK_GROUP               | BEGIN                   | myGroup1                                                                         | Rollback session #1                                                                                                    | postgres
    6695 | LOCK_GROUP               | END                     | myGroup1                                                                         | Rollback session #1: 5 tables locked, 0 deadlock(s)                                                                    | postgres
    6696 | ROLLBACK_TABLE           | BEGIN                   | myschema1.mytbl1                                                                 | All log rows with emaj_gid > 100161 and <= 100512                                                                      | postgres
    6697 | ROLLBACK_TABLE           | END                     | myschema1.mytbl1                                                                 | 11 rolled back primary keys                                                                                            | postgres
    6698 | ROLLBACK_TABLE           | BEGIN                   | myschema1.mytbl2                                                                 | All log rows with emaj_gid > 100161 and <= 100512                                                                      | postgres
    6699 | ROLLBACK_TABLE           | END                     | myschema1.mytbl2                                                                 | 3 rolled back primary keys                                                                                             | postgres
    6700 | ROLLBACK_GROUP           | MARK DELETED            | myGroup1                                                                         | mark MC1 is deleted                                                                                                    | postgres
    6701 | ROLLBACK_GROUP           | MARK DELETED            | myGroup1                                                                         | mark RLBK_MC1_DONE is deleted                                                                                          | postgres
    6702 | ROLLBACK_GROUP           | MARK DELETED            | myGroup1                                                                         | mark MC3 is deleted                                                                                                    | postgres
    6703 | ROLLBACK_GROUP           | MARK DELETED            | myGroup1                                                                         | mark RLBK_MC3_%_DONE is deleted                                                                                        | postgres
    6704 | ROLLBACK_GROUP           | MARK DELETED            | myGroup1                                                                         | mark MC6 is deleted                                                                                                    | postgres
    6705 | ROLLBACK_GROUP           | MARK DELETED            | myGroup1                                                                         | mark RLBK_MC6_%_DONE is deleted                                                                                        | postgres
    6706 | ROLLBACK_GROUP           | MARK DELETED            | myGroup1                                                                         | mark MC10 is deleted                                                                                                   | postgres
    6707 | ROLLBACK_GROUP           | MARK DELETED            | myGroup1                                                                         | mark RLBK_MC10_%_DONE is deleted                                                                                       | postgres
    6708 | ROLLBACK_GROUP           | MARK DELETED            | myGroup1                                                                         | mark MC15 is deleted                                                                                                   | postgres
    6709 | ROLLBACK_GROUP           | MARK DELETED            | myGroup1                                                                         | mark RLBK_MC15_DONE is deleted                                                                                         | postgres
    6710 | ROLLBACK_GROUP           | MARK DELETED            | myGroup1                                                                         | mark MC17 is deleted                                                                                                   | postgres
    6711 | ROLLBACK_GROUP           | MARK DELETED            | myGroup1                                                                         | mark RLBK_MC16_%_START is deleted                                                                                      | postgres
    6712 | ROLLBACK_GROUP           | MARK DELETED            | myGroup1                                                                         | mark RLBK_MC16_%_DONE is deleted                                                                                       | postgres
    6713 | ROLLBACK_SEQUENCE        |                         | myschema1."myTbl3_col31_seq"                                                     | RESTART 21                                                                                                             | postgres
    6714 | ROLLBACK_GROUP           | END                     | myGroup1                                                                         | Rollback_id 126, 2 tables and 1 sequences effectively processed                                                        | postgres
    6715 | DBLINK_CLOSE_CNX         |                         | rlbk#1                                                                           |                                                                                                                        | postgres
    6716 | CLEANUP_RLBK_STATE       |                         | rollback id 125                                                                  | set to COMMITTED                                                                                                       | postgres
    6717 | CLEANUP_RLBK_STATE       |                         | rollback id 126                                                                  | set to COMMITTED                                                                                                       | postgres
(639 rows)

--
reset role;
alter table "phil's schema3".table_with_very_looooooooooooooooooooooooooooooooooooooong_name rename to "phil's tbl1";
truncate emaj.emaj_hist;
alter sequence emaj.emaj_hist_hist_id_seq restart 10000;
alter sequence emaj.emaj_time_stamp_time_id_seq restart 1000;
alter sequence emaj.emaj_mark_mark_id_seq restart 1000;
alter sequence emaj.emaj_rlbk_rlbk_id_seq restart 200;
-- the groups are left in their current state for the parallel rollback test.
select count(*) from mySchema1.myTbl4;
 count 
-------
     0
(1 row)

select count(*) from mySchema1.myTbl1;
 count 
-------
    20
(1 row)

select count(*) from mySchema1.myTbl2; 
 count 
-------
     3
(1 row)

select count(*) from mySchema1."myTbl3";
 count 
-------
     5
(1 row)

select count(*) from mySchema1.myTbl2b;
 count 
-------
     0
(1 row)

select count(*) from mySchema2.myTbl4;
 count 
-------
     2
(1 row)

select count(*) from mySchema2.myTbl1;
 count 
-------
    10
(1 row)

select count(*) from mySchema2.myTbl2; 
 count 
-------
     2
(1 row)

select count(*) from mySchema2."myTbl3";
 count 
-------
    10
(1 row)

select count(*) from mySchema2.myTbl5;
 count 
-------
     3
(1 row)

select count(*) from mySchema2.myTbl6;
 count 
-------
    14
(1 row)

