-- adm2.sql : complex scenario executed by an emaj_adm role. 
--            Follows adm1.sql, and includes more specific test cases
--
set role emaj_regression_tests_adm_user;
-----------------------------
-- Step 8 : use of multi-group functions, start_group(s) without log reset and use deleted marks
-----------------------------
-- stop both groups
select emaj.emaj_stop_groups(array['myGroup1','myGroup2']);
 emaj_stop_groups 
------------------
               15
(1 row)

-- start both groups
select emaj.emaj_start_groups(array['myGroup1','myGroup2'],'Multi-1', false);
WARNING:  _check_fk_groups: The foreign key "mytbl6_col61_fkey" on the table "myschema2.mytbl6" references the table "myschema2.mytbl7" that is outside the groups (myGroup1,myGroup2).
CONTEXT:  SQL statement "SELECT emaj._check_fk_groups(v_groupNames)"
PL/pgSQL function emaj._start_groups(text[],text,boolean,boolean) line 37 at PERFORM
SQL statement "SELECT emaj._start_groups(emaj._check_names_array(v_groupNames,'group'), v_mark, true, v_resetLog)"
PL/pgSQL function emaj.emaj_start_groups(text[],text,boolean) line 16 at SQL statement
WARNING:  _check_fk_groups: The table "myschema2.mytbl6" is referenced by the foreign key "mytbl8_col81_fkey" on the table "myschema2.mytbl8" that is outside the groups (myGroup1,myGroup2).
CONTEXT:  SQL statement "SELECT emaj._check_fk_groups(v_groupNames)"
PL/pgSQL function emaj._start_groups(text[],text,boolean,boolean) line 37 at PERFORM
SQL statement "SELECT emaj._start_groups(emaj._check_names_array(v_groupNames,'group'), v_mark, true, v_resetLog)"
PL/pgSQL function emaj.emaj_start_groups(text[],text,boolean) line 16 at SQL statement
 emaj_start_groups 
-------------------
                15
(1 row)

-- set a mark for both groups
select emaj.emaj_set_mark_groups(array['myGroup1','myGroup2'],'Multi-2');
 emaj_set_mark_groups 
----------------------
                   15
(1 row)

-- logged rollback to Multi-1
select * from emaj.emaj_logged_rollback_groups(array['myGroup1','myGroup2'],'Multi-1',false) order by 1,2;
WARNING:  _check_fk_groups: The foreign key "mytbl6_col61_fkey" on the table "myschema2.mytbl6" references the table "myschema2.mytbl7" that is outside the groups (myGroup1,myGroup2).
CONTEXT:  SQL statement "SELECT emaj._check_fk_groups(v_groupNames)"
PL/pgSQL function emaj._rlbk_init(text[],text,boolean,integer,boolean,boolean) line 68 at PERFORM
SQL statement "SELECT emaj._rlbk_init(v_groupNames, v_mark, v_isLoggedRlbk, 1, v_multiGroup, v_isAlterGroupAllowed)"
PL/pgSQL function emaj._rlbk_groups(text[],text,boolean,boolean,boolean) line 20 at SQL statement
PL/pgSQL function emaj.emaj_logged_rollback_groups(text[],text,boolean) line 11 at RETURN QUERY
WARNING:  _check_fk_groups: The table "myschema2.mytbl6" is referenced by the foreign key "mytbl8_col81_fkey" on the table "myschema2.mytbl8" that is outside the groups (myGroup1,myGroup2).
CONTEXT:  SQL statement "SELECT emaj._check_fk_groups(v_groupNames)"
PL/pgSQL function emaj._rlbk_init(text[],text,boolean,integer,boolean,boolean) line 68 at PERFORM
SQL statement "SELECT emaj._rlbk_init(v_groupNames, v_mark, v_isLoggedRlbk, 1, v_multiGroup, v_isAlterGroupAllowed)"
PL/pgSQL function emaj._rlbk_groups(text[],text,boolean,boolean,boolean) line 20 at SQL statement
PL/pgSQL function emaj.emaj_logged_rollback_groups(text[],text,boolean) line 11 at RETURN QUERY
 rlbk_severity |             rlbk_message             
---------------+--------------------------------------
 Notice        | 0 / 11 tables effectively processed.
 Notice        | 4 sequences processed.
(2 rows)

-- rollback to Multi-2
select * from emaj.emaj_rollback_groups(array['myGroup1','myGroup2'],'Multi-2',false) order by 1,2;
WARNING:  _check_fk_groups: The foreign key "mytbl6_col61_fkey" on the table "myschema2.mytbl6" references the table "myschema2.mytbl7" that is outside the groups (myGroup1,myGroup2).
CONTEXT:  SQL statement "SELECT emaj._check_fk_groups(v_groupNames)"
PL/pgSQL function emaj._rlbk_init(text[],text,boolean,integer,boolean,boolean) line 68 at PERFORM
SQL statement "SELECT emaj._rlbk_init(v_groupNames, v_mark, v_isLoggedRlbk, 1, v_multiGroup, v_isAlterGroupAllowed)"
PL/pgSQL function emaj._rlbk_groups(text[],text,boolean,boolean,boolean) line 20 at SQL statement
PL/pgSQL function emaj.emaj_rollback_groups(text[],text,boolean) line 7 at RETURN QUERY
WARNING:  _check_fk_groups: The table "myschema2.mytbl6" is referenced by the foreign key "mytbl8_col81_fkey" on the table "myschema2.mytbl8" that is outside the groups (myGroup1,myGroup2).
CONTEXT:  SQL statement "SELECT emaj._check_fk_groups(v_groupNames)"
PL/pgSQL function emaj._rlbk_init(text[],text,boolean,integer,boolean,boolean) line 68 at PERFORM
SQL statement "SELECT emaj._rlbk_init(v_groupNames, v_mark, v_isLoggedRlbk, 1, v_multiGroup, v_isAlterGroupAllowed)"
PL/pgSQL function emaj._rlbk_groups(text[],text,boolean,boolean,boolean) line 20 at SQL statement
PL/pgSQL function emaj.emaj_rollback_groups(text[],text,boolean) line 7 at RETURN QUERY
 rlbk_severity |             rlbk_message             
---------------+--------------------------------------
 Notice        | 0 / 11 tables effectively processed.
 Notice        | 4 sequences processed.
(2 rows)

-- rollback and stop to Multi-1
select * from emaj.emaj_rollback_groups(array['myGroup1','myGroup2'],'Multi-1',false) order by 1,2;
WARNING:  _check_fk_groups: The foreign key "mytbl6_col61_fkey" on the table "myschema2.mytbl6" references the table "myschema2.mytbl7" that is outside the groups (myGroup1,myGroup2).
CONTEXT:  SQL statement "SELECT emaj._check_fk_groups(v_groupNames)"
PL/pgSQL function emaj._rlbk_init(text[],text,boolean,integer,boolean,boolean) line 68 at PERFORM
SQL statement "SELECT emaj._rlbk_init(v_groupNames, v_mark, v_isLoggedRlbk, 1, v_multiGroup, v_isAlterGroupAllowed)"
PL/pgSQL function emaj._rlbk_groups(text[],text,boolean,boolean,boolean) line 20 at SQL statement
PL/pgSQL function emaj.emaj_rollback_groups(text[],text,boolean) line 7 at RETURN QUERY
WARNING:  _check_fk_groups: The table "myschema2.mytbl6" is referenced by the foreign key "mytbl8_col81_fkey" on the table "myschema2.mytbl8" that is outside the groups (myGroup1,myGroup2).
CONTEXT:  SQL statement "SELECT emaj._check_fk_groups(v_groupNames)"
PL/pgSQL function emaj._rlbk_init(text[],text,boolean,integer,boolean,boolean) line 68 at PERFORM
SQL statement "SELECT emaj._rlbk_init(v_groupNames, v_mark, v_isLoggedRlbk, 1, v_multiGroup, v_isAlterGroupAllowed)"
PL/pgSQL function emaj._rlbk_groups(text[],text,boolean,boolean,boolean) line 20 at SQL statement
PL/pgSQL function emaj.emaj_rollback_groups(text[],text,boolean) line 7 at RETURN QUERY
 rlbk_severity |             rlbk_message             
---------------+--------------------------------------
 Notice        | 0 / 11 tables effectively processed.
 Notice        | 4 sequences processed.
(2 rows)

select emaj.emaj_stop_groups(array['myGroup1','myGroup2'],'Stop after rollback');
 emaj_stop_groups 
------------------
               15
(1 row)

-- try to start both groups, but with an old deleted mark name
select emaj.emaj_start_groups(array['myGroup1','myGroup2'],'Multi-1', false);
WARNING:  _check_fk_groups: The foreign key "mytbl6_col61_fkey" on the table "myschema2.mytbl6" references the table "myschema2.mytbl7" that is outside the groups (myGroup1,myGroup2).
CONTEXT:  SQL statement "SELECT emaj._check_fk_groups(v_groupNames)"
PL/pgSQL function emaj._start_groups(text[],text,boolean,boolean) line 37 at PERFORM
SQL statement "SELECT emaj._start_groups(emaj._check_names_array(v_groupNames,'group'), v_mark, true, v_resetLog)"
PL/pgSQL function emaj.emaj_start_groups(text[],text,boolean) line 16 at SQL statement
WARNING:  _check_fk_groups: The table "myschema2.mytbl6" is referenced by the foreign key "mytbl8_col81_fkey" on the table "myschema2.mytbl8" that is outside the groups (myGroup1,myGroup2).
CONTEXT:  SQL statement "SELECT emaj._check_fk_groups(v_groupNames)"
PL/pgSQL function emaj._start_groups(text[],text,boolean,boolean) line 37 at PERFORM
SQL statement "SELECT emaj._start_groups(emaj._check_names_array(v_groupNames,'group'), v_mark, true, v_resetLog)"
PL/pgSQL function emaj.emaj_start_groups(text[],text,boolean) line 16 at SQL statement
ERROR:  _check_new_mark: The group "myGroup1" already contains a mark named "Multi-1".
CONTEXT:  SQL statement "SELECT emaj._check_new_mark(v_mark, v_groupNames)"
PL/pgSQL function emaj._start_groups(text[],text,boolean,boolean) line 50 at SQL statement
SQL statement "SELECT emaj._start_groups(emaj._check_names_array(v_groupNames,'group'), v_mark, true, v_resetLog)"
PL/pgSQL function emaj.emaj_start_groups(text[],text,boolean) line 16 at SQL statement
-- really start both groups
select emaj.emaj_start_groups(array['myGroup1','myGroup2'],'Multi-1b', false);
WARNING:  _check_fk_groups: The foreign key "mytbl6_col61_fkey" on the table "myschema2.mytbl6" references the table "myschema2.mytbl7" that is outside the groups (myGroup1,myGroup2).
CONTEXT:  SQL statement "SELECT emaj._check_fk_groups(v_groupNames)"
PL/pgSQL function emaj._start_groups(text[],text,boolean,boolean) line 37 at PERFORM
SQL statement "SELECT emaj._start_groups(emaj._check_names_array(v_groupNames,'group'), v_mark, true, v_resetLog)"
PL/pgSQL function emaj.emaj_start_groups(text[],text,boolean) line 16 at SQL statement
WARNING:  _check_fk_groups: The table "myschema2.mytbl6" is referenced by the foreign key "mytbl8_col81_fkey" on the table "myschema2.mytbl8" that is outside the groups (myGroup1,myGroup2).
CONTEXT:  SQL statement "SELECT emaj._check_fk_groups(v_groupNames)"
PL/pgSQL function emaj._start_groups(text[],text,boolean,boolean) line 37 at PERFORM
SQL statement "SELECT emaj._start_groups(emaj._check_names_array(v_groupNames,'group'), v_mark, true, v_resetLog)"
PL/pgSQL function emaj.emaj_start_groups(text[],text,boolean) line 16 at SQL statement
 emaj_start_groups 
-------------------
                15
(1 row)

-- set again a mark for both groups
select emaj.emaj_set_mark_groups(array['myGroup1','myGroup2'],'Multi-2');
 emaj_set_mark_groups 
----------------------
                   15
(1 row)

-- delete the mark for only 1 group and get detailed statistics for the other group
select emaj.emaj_delete_mark_group('myGroup1','Multi-2');
 emaj_delete_mark_group 
------------------------
                      1
(1 row)

-- use this mark for the other group before delete it
select * from emaj.emaj_detailed_log_stat_group('myGroup2','Multi-2',NULL);
 stat_group | stat_schema | stat_table | stat_role | stat_verb | stat_rows 
------------+-------------+------------+-----------+-----------+-----------
(0 rows)

select * from emaj.emaj_rollback_group('myGroup2','Multi-2',false) order by 1,2;
WARNING:  _check_fk_groups: The foreign key "mytbl6_col61_fkey" on the table "myschema2.mytbl6" references the table "myschema2.mytbl7" that is outside the groups (myGroup2).
CONTEXT:  SQL statement "SELECT emaj._check_fk_groups(v_groupNames)"
PL/pgSQL function emaj._rlbk_init(text[],text,boolean,integer,boolean,boolean) line 68 at PERFORM
SQL statement "SELECT emaj._rlbk_init(v_groupNames, v_mark, v_isLoggedRlbk, 1, v_multiGroup, v_isAlterGroupAllowed)"
PL/pgSQL function emaj._rlbk_groups(text[],text,boolean,boolean,boolean) line 20 at SQL statement
PL/pgSQL function emaj.emaj_rollback_group(text,text,boolean) line 7 at RETURN QUERY
WARNING:  _check_fk_groups: The table "myschema2.mytbl6" is referenced by the foreign key "mytbl8_col81_fkey" on the table "myschema2.mytbl8" that is outside the groups (myGroup2).
CONTEXT:  SQL statement "SELECT emaj._check_fk_groups(v_groupNames)"
PL/pgSQL function emaj._rlbk_init(text[],text,boolean,integer,boolean,boolean) line 68 at PERFORM
SQL statement "SELECT emaj._rlbk_init(v_groupNames, v_mark, v_isLoggedRlbk, 1, v_multiGroup, v_isAlterGroupAllowed)"
PL/pgSQL function emaj._rlbk_groups(text[],text,boolean,boolean,boolean) line 20 at SQL statement
PL/pgSQL function emaj.emaj_rollback_group(text,text,boolean) line 7 at RETURN QUERY
 rlbk_severity |            rlbk_message             
---------------+-------------------------------------
 Notice        | 0 / 6 tables effectively processed.
 Notice        | 2 sequences processed.
(2 rows)

select emaj.emaj_delete_mark_group('myGroup2','Multi-2');
 emaj_delete_mark_group 
------------------------
                      1
(1 row)

-- get statistics using deleted marks
select * from emaj.emaj_detailed_log_stat_group('myGroup2','M1','M2');
 stat_group | stat_schema | stat_table | stat_role | stat_verb | stat_rows 
------------+-------------+------------+-----------+-----------+-----------
 myGroup2   | myschema2   | mytbl1     | postgres  | DELETE    |         1
 myGroup2   | myschema2   | mytbl1     | postgres  | INSERT    |        11
 myGroup2   | myschema2   | mytbl1     | postgres  | UPDATE    |         3
 myGroup2   | myschema2   | mytbl2     | postgres  | INSERT    |         2
 myGroup2   | myschema2   | myTbl3     | postgres  | INSERT    |        10
 myGroup2   | myschema2   | mytbl5     | postgres  | INSERT    |         2
 myGroup2   | myschema2   | mytbl5     | postgres  | UPDATE    |         1
 myGroup2   | myschema2   | mytbl6     | postgres  | INSERT    |         8
 myGroup2   | myschema2   | mytbl6     | postgres  | UPDATE    |         3
(9 rows)

-- delete intermediate deleted marks
select emaj.emaj_delete_mark_group('myGroup1','Multi-1');
 emaj_delete_mark_group 
------------------------
                      1
(1 row)

select emaj.emaj_delete_mark_group('myGroup2','Multi-1');
 emaj_delete_mark_group 
------------------------
                      1
(1 row)

-- ... and reuse mark names for parallel rollback test
select emaj.emaj_rename_mark_group('myGroup1','Multi-1b','Multi-1');
 emaj_rename_mark_group 
------------------------
 
(1 row)

select emaj.emaj_rename_mark_group('myGroup2','Multi-1b','Multi-1');
 emaj_rename_mark_group 
------------------------
 
(1 row)

-- rename a deleted mark
select emaj.emaj_rename_mark_group('myGroup2','M2','Deleted M2');
 emaj_rename_mark_group 
------------------------
 
(1 row)

-- use emaj_get_previous_mark_group and delete an initial deleted mark
select emaj.emaj_delete_before_mark_group('myGroup2',
      (select emaj.emaj_get_previous_mark_group('myGroup2',
             (select time_clock_timestamp from emaj.emaj_mark, emaj.emaj_time_stamp where time_id = mark_time_id and mark_group = 'myGroup2' and mark_group = 'myGroup2' and mark_name = 'M3')+'0.000001 SECOND'::interval)));
 emaj_delete_before_mark_group 
-------------------------------
                             2
(1 row)

-- comment a deleted mark
select emaj.emaj_comment_mark_group('myGroup2','M3','This mark is deleted');
 emaj_comment_mark_group 
-------------------------
 
(1 row)

-- try to get a rollback duration estimate on a deleted mark
select emaj.emaj_estimate_rollback_group('myGroup2','M3',TRUE);
ERROR:  _rlbk_check: The mark "M3" for the group "myGroup2" is not usable for rollback.
CONTEXT:  SQL statement "SELECT emaj._rlbk_check(v_groupNames, v_mark, TRUE, TRUE)"
PL/pgSQL function emaj._estimate_rollback_groups(text[],text,boolean) line 16 at SQL statement
PL/pgSQL function emaj.emaj_estimate_rollback_group(text,text,boolean) line 8 at RETURN
-- try to rollback on a deleted mark
select * from emaj.emaj_rollback_group('myGroup2','M3',false) order by 1,2;
ERROR:  _rlbk_check: The mark "M3" for the group "myGroup2" is not usable for rollback.
CONTEXT:  SQL statement "SELECT emaj._rlbk_check(v_groupNames, v_mark, v_isAlterGroupAllowed, FALSE)"
PL/pgSQL function emaj._rlbk_init(text[],text,boolean,integer,boolean,boolean) line 24 at SQL statement
SQL statement "SELECT emaj._rlbk_init(v_groupNames, v_mark, v_isLoggedRlbk, 1, v_multiGroup, v_isAlterGroupAllowed)"
PL/pgSQL function emaj._rlbk_groups(text[],text,boolean,boolean,boolean) line 20 at SQL statement
PL/pgSQL function emaj.emaj_rollback_group(text,text,boolean) line 7 at RETURN QUERY
-----------------------------
-- Checking step 8
-----------------------------
-- emaj tables
select mark_id, mark_group, regexp_replace(mark_name,E'\\d\\d\.\\d\\d\\.\\d\\d\\.\\d\\d\\d','%','g'), mark_time_id, mark_is_deleted, mark_is_rlbk_protected, mark_comment, mark_log_rows_before_next, mark_logged_rlbk_target_mark from emaj.emaj_mark order by mark_id;
 mark_id | mark_group |        regexp_replace        | mark_time_id | mark_is_deleted | mark_is_rlbk_protected |     mark_comment     | mark_log_rows_before_next | mark_logged_rlbk_target_mark 
---------+------------+------------------------------+--------------+-----------------+------------------------+----------------------+---------------------------+------------------------------
   10006 | myGroup2   | M3                           |        10008 | t               | f                      | This mark is deleted |                         0 | 
   10011 | myGroup1   | M4                           |        10014 | t               | f                      |                      |                        10 | 
   10012 | myGroup1   | M5                           |        10015 | t               | f                      |                      |                         3 | 
   10016 | myGroup1   | Before logged rollback to M4 |        10021 | t               | f                      |                      |                        28 | 
   10018 | myGroup1   | STOP_%                       |        10023 | t               | f                      |                      |                         0 | 
   10019 | myGroup2   | STOP_%                       |        10023 | t               | f                      |                      |                         0 | 
   10028 | myGroup1   | Stop after rollback          |        10030 | t               | f                      |                      |                         0 | 
   10029 | myGroup2   | Stop after rollback          |        10030 | t               | f                      |                      |                         0 | 
   10030 | myGroup1   | Multi-1                      |        10031 | f               | f                      |                      |                           | 
   10031 | myGroup2   | Multi-1                      |        10031 | f               | f                      |                      |                           | 
(10 rows)

select sequ_schema, sequ_name, sequ_time_id, sequ_last_val, sequ_is_called from emaj.emaj_sequence order by sequ_time_id, sequ_schema, sequ_name;
 sequ_schema |         sequ_name          | sequ_time_id | sequ_last_val | sequ_is_called 
-------------+----------------------------+--------------+---------------+----------------
 emaj        | myschema2_mytbl1_log_seq   |        10008 |            15 | t
 emaj        | myschema2_mytbl2_log_seq   |        10008 |             2 | t
 emaj        | myschema2_mytbl4_log_seq   |        10008 |             4 | t
 emaj        | myschema2_mytbl6_log_seq   |        10008 |            14 | t
 emaj        | otherPrefix4mytbl5_log_seq |        10008 |             4 | t
 emajC       | myschema2_myTbl3_log_seq   |        10008 |            10 | t
 myschema2   | myseq1                     |        10008 |          1003 | t
 myschema2   | myTbl3_col31_seq           |        10008 |            20 | t
 emaj        | myschema1_mytbl1_log_seq   |        10014 |            30 | t
 emaj        | myschema1_mytbl2_log_seq   |        10014 |             3 | t
 emaj        | myschema1_mytbl4_log_seq   |        10014 |             8 | t
 emajb       | myschema1_mytbl2b_log_seq  |        10014 |             1 | f
 emajC       | myschema1_myTbl3_log_seq   |        10014 |            10 | t
 myschema1   | mytbl2b_col20_seq          |        10014 |             3 | f
 myschema1   | myTbl3_col31_seq           |        10014 |            20 | t
 emaj        | myschema1_mytbl1_log_seq   |        10015 |            30 | t
 emaj        | myschema1_mytbl2_log_seq   |        10015 |             3 | t
 emaj        | myschema1_mytbl4_log_seq   |        10015 |             8 | t
 emajb       | myschema1_mytbl2b_log_seq  |        10015 |             1 | f
 emajC       | myschema1_myTbl3_log_seq   |        10015 |            20 | t
 myschema1   | mytbl2b_col20_seq          |        10015 |             3 | f
 myschema1   | myTbl3_col31_seq           |        10015 |            20 | t
 emaj        | myschema1_mytbl1_log_seq   |        10021 |            32 | t
 emaj        | myschema1_mytbl2_log_seq   |        10021 |             3 | t
 emaj        | myschema1_mytbl4_log_seq   |        10021 |            12 | t
 emajb       | myschema1_mytbl2b_log_seq  |        10021 |             1 | f
 emajC       | myschema1_myTbl3_log_seq   |        10021 |            20 | t
 myschema1   | mytbl2b_col20_seq          |        10021 |             3 | f
 myschema1   | myTbl3_col31_seq           |        10021 |            20 | t
 emaj        | myschema1_mytbl1_log_seq   |        10023 |            33 | t
 emaj        | myschema1_mytbl2_log_seq   |        10023 |             3 | t
 emaj        | myschema1_mytbl4_log_seq   |        10023 |            14 | t
 emaj        | myschema2_mytbl1_log_seq   |        10023 |            15 | t
 emaj        | myschema2_mytbl2_log_seq   |        10023 |             2 | t
 emaj        | myschema2_mytbl4_log_seq   |        10023 |            10 | t
 emaj        | myschema2_mytbl6_log_seq   |        10023 |            23 | t
 emaj        | otherPrefix4mytbl5_log_seq |        10023 |             7 | t
 emajb       | myschema1_mytbl2b_log_seq  |        10023 |             1 | f
 emajC       | myschema1_myTbl3_log_seq   |        10023 |            45 | t
 emajC       | myschema2_myTbl3_log_seq   |        10023 |            10 | t
 myschema1   | mytbl2b_col20_seq          |        10023 |             3 | f
 myschema1   | myTbl3_col31_seq           |        10023 |            20 | t
 myschema2   | myseq1                     |        10023 |          1004 | f
 myschema2   | myTbl3_col31_seq           |        10023 |            20 | t
 emaj        | myschema1_mytbl1_log_seq   |        10030 |            33 | t
 emaj        | myschema1_mytbl2_log_seq   |        10030 |             3 | t
 emaj        | myschema1_mytbl4_log_seq   |        10030 |            14 | t
 emaj        | myschema2_mytbl1_log_seq   |        10030 |            15 | t
 emaj        | myschema2_mytbl2_log_seq   |        10030 |             2 | t
 emaj        | myschema2_mytbl4_log_seq   |        10030 |            10 | t
 emaj        | myschema2_mytbl6_log_seq   |        10030 |            23 | t
 emaj        | otherPrefix4mytbl5_log_seq |        10030 |             7 | t
 emajb       | myschema1_mytbl2b_log_seq  |        10030 |             1 | f
 emajC       | myschema1_myTbl3_log_seq   |        10030 |            45 | t
 emajC       | myschema2_myTbl3_log_seq   |        10030 |            10 | t
 myschema1   | mytbl2b_col20_seq          |        10030 |             3 | f
 myschema1   | myTbl3_col31_seq           |        10030 |            20 | t
 myschema2   | myseq1                     |        10030 |          1004 | f
 myschema2   | myTbl3_col31_seq           |        10030 |            20 | t
 emaj        | myschema1_mytbl1_log_seq   |        10031 |            33 | t
 emaj        | myschema1_mytbl2_log_seq   |        10031 |             3 | t
 emaj        | myschema1_mytbl4_log_seq   |        10031 |            14 | t
 emaj        | myschema2_mytbl1_log_seq   |        10031 |            15 | t
 emaj        | myschema2_mytbl2_log_seq   |        10031 |             2 | t
 emaj        | myschema2_mytbl4_log_seq   |        10031 |            10 | t
 emaj        | myschema2_mytbl6_log_seq   |        10031 |            23 | t
 emaj        | otherPrefix4mytbl5_log_seq |        10031 |             7 | t
 emajb       | myschema1_mytbl2b_log_seq  |        10031 |             1 | f
 emajC       | myschema1_myTbl3_log_seq   |        10031 |            45 | t
 emajC       | myschema2_myTbl3_log_seq   |        10031 |            10 | t
 myschema1   | mytbl2b_col20_seq          |        10031 |             3 | f
 myschema1   | myTbl3_col31_seq           |        10031 |            20 | t
 myschema2   | myseq1                     |        10031 |          1004 | f
 myschema2   | myTbl3_col31_seq           |        10031 |            20 | t
(74 rows)

select sqhl_schema, sqhl_table, sqhl_begin_time_id, sqhl_end_time_id, sqhl_hole_size from emaj.emaj_seq_hole order by 1,2,3;
 sqhl_schema | sqhl_table | sqhl_begin_time_id | sqhl_end_time_id | sqhl_hole_size 
-------------+------------+--------------------+------------------+----------------
 myschema1   | mytbl1     |              10015 |            10020 |              1
 myschema1   | mytbl4     |              10015 |            10020 |              2
 myschema2   | mytbl4     |              10008 |            10019 |              6
 myschema2   | mytbl5     |              10008 |            10019 |              3
 myschema2   | mytbl6     |              10008 |            10019 |              9
(5 rows)

-- log tables
select col11, col12, col13, emaj_verb, emaj_tuple, emaj_gid from emaj.mySchema1_myTbl1_log order by emaj_gid, emaj_tuple desc;
 col11 |   col12    | col13 | emaj_verb | emaj_tuple | emaj_gid 
-------+------------+-------+-----------+------------+----------
     1 | Step 6     | \x01  | INS       | NEW        |   100131
     1 | Step 6     | \x01  | DEL       | OLD        |   100154
(2 rows)

select col21, col22, col23, emaj_verb, emaj_tuple, emaj_gid from emaj.mySchema1_myTbl2_log order by emaj_gid, emaj_tuple desc;
 col21 | col22 | col23 | emaj_verb | emaj_tuple | emaj_gid 
-------+-------+-------+-----------+------------+----------
(0 rows)

select col20, col21, emaj_verb, emaj_tuple, emaj_gid from emajb.mySchema1_myTbl2b_log order by emaj_gid, emaj_tuple desc;
 col20 | col21 | emaj_verb | emaj_tuple | emaj_gid 
-------+-------+-----------+------------+----------
(0 rows)

select col31, col33, emaj_verb, emaj_tuple, emaj_gid from "emajC"."myschema1_myTbl3_log" order by emaj_gid, emaj_tuple desc;
 col31 | col33 | emaj_verb | emaj_tuple | emaj_gid 
-------+-------+-----------+------------+----------
    11 | 10.00 | UPD       | OLD        |   100112
    11 |  5.00 | UPD       | NEW        |   100112
    12 | 10.00 | UPD       | OLD        |   100113
    12 |  5.00 | UPD       | NEW        |   100113
    13 | 10.00 | UPD       | OLD        |   100114
    13 |  5.00 | UPD       | NEW        |   100114
    14 | 10.00 | UPD       | OLD        |   100115
    14 |  5.00 | UPD       | NEW        |   100115
    15 | 10.00 | UPD       | OLD        |   100116
    15 |  5.00 | UPD       | NEW        |   100116
    16 | 10.00 | UPD       | OLD        |   100117
    16 |  5.00 | UPD       | NEW        |   100117
    17 | 10.00 | UPD       | OLD        |   100118
    17 |  5.00 | UPD       | NEW        |   100118
    18 | 10.00 | UPD       | OLD        |   100119
    18 |  5.00 | UPD       | NEW        |   100119
    19 | 10.00 | UPD       | OLD        |   100120
    19 |  5.00 | UPD       | NEW        |   100120
    20 | 10.00 | UPD       | OLD        |   100121
    20 |  5.00 | UPD       | NEW        |   100121
    14 |  5.00 | DEL       | OLD        |   100134
    18 |  5.00 | DEL       | OLD        |   100135
    20 |  5.00 | DEL       | OLD        |   100136
    12 |  5.00 | DEL       | OLD        |   100137
    13 |  5.00 | DEL       | OLD        |   100138
    17 |  5.00 | DEL       | OLD        |   100139
    19 |  5.00 | DEL       | OLD        |   100140
    15 |  5.00 | DEL       | OLD        |   100141
    16 |  5.00 | DEL       | OLD        |   100142
    11 |  5.00 | DEL       | OLD        |   100143
    14 | 10.00 | INS       | NEW        |   100144
    18 | 10.00 | INS       | NEW        |   100145
    20 | 10.00 | INS       | NEW        |   100146
    12 | 10.00 | INS       | NEW        |   100147
    13 | 10.00 | INS       | NEW        |   100148
    17 | 10.00 | INS       | NEW        |   100149
    19 | 10.00 | INS       | NEW        |   100150
    15 | 10.00 | INS       | NEW        |   100151
    16 | 10.00 | INS       | NEW        |   100152
    11 | 10.00 | INS       | NEW        |   100153
    14 | 10.00 | DEL       | OLD        |   100157
    15 | 10.00 | DEL       | OLD        |   100158
    16 | 10.00 | DEL       | OLD        |   100159
    17 | 10.00 | DEL       | OLD        |   100160
    18 | 10.00 | DEL       | OLD        |   100161
(45 rows)

select col41, col42, col43, col44, col45, emaj_verb, emaj_tuple, emaj_gid from emaj.mySchema1_myTbl4_log order by emaj_gid, emaj_tuple desc;
 col41 | col42 | col43 | col44 |   col45    | emaj_verb | emaj_tuple | emaj_gid 
-------+-------+-------+-------+------------+-----------+------------+----------
    11 |       |     1 |     1 | Step 6     | INS       | NEW        |   100132
    12 |       |     1 |     1 | Step 6     | INS       | NEW        |   100133
    12 |       |     1 |     1 | Step 6     | DEL       | OLD        |   100155
    11 |       |     1 |     1 | Step 6     | DEL       | OLD        |   100156
(4 rows)

select col11, col12, col13, emaj_verb, emaj_tuple, emaj_gid from emaj.mySchema2_myTbl1_log order by emaj_gid, emaj_tuple desc;
 col11 | col12 | col13 | emaj_verb | emaj_tuple | emaj_gid 
-------+-------+-------+-----------+------------+----------
(0 rows)

select col21, col22, col23, emaj_verb, emaj_tuple, emaj_gid from emaj.mySchema2_myTbl2_log order by emaj_gid, emaj_tuple desc;
 col21 | col22 | col23 | emaj_verb | emaj_tuple | emaj_gid 
-------+-------+-------+-----------+------------+----------
(0 rows)

select col31, col33, emaj_verb, emaj_tuple, emaj_gid from "emajC"."myschema2_myTbl3_log" order by emaj_gid, emaj_tuple desc;
 col31 | col33 | emaj_verb | emaj_tuple | emaj_gid 
-------+-------+-----------+------------+----------
(0 rows)

select col41, col42, col43, col44, col45, emaj_verb, emaj_tuple, emaj_gid from emaj.mySchema2_myTbl4_log order by emaj_gid, emaj_tuple desc;
 col41 | col42 | col43 | col44 | col45 | emaj_verb | emaj_tuple | emaj_gid 
-------+-------+-------+-------+-------+-----------+------------+----------
(0 rows)

select col51, col52, col53, col54, emaj_verb, emaj_tuple, emaj_gid from emaj."otherPrefix4mytbl5_log" order by emaj_gid, emaj_tuple desc;
 col51 | col52 | col53 | col54 | emaj_verb | emaj_tuple | emaj_gid 
-------+-------+-------+-------+-----------+------------+----------
(0 rows)

select col61, col62, col63, col64, col65, col66, emaj_verb, emaj_tuple, emaj_gid from emaj.mySchema2_myTbl6_log order by emaj_gid, emaj_tuple desc;
 col61 | col62 | col63 | col64 | col65 | col66 | emaj_verb | emaj_tuple | emaj_gid 
-------+-------+-------+-------+-------+-------+-----------+------------+----------
(0 rows)

-----------------------------
-- Step 9 : test the emaj_alter_group() and emaj_alter_groups() functions with the audit-only phil's group#3, group and a mix of rollbackable and audit-only groups
-----------------------------
select emaj.emaj_create_group('phil''s group#3",',false);
NOTICE:  table "phil's schema3_myTbl2\_log" does not exist, skipping
CONTEXT:  SQL statement "DROP TABLE IF EXISTS emaj."phil's schema3_myTbl2\_log""
PL/pgSQL function emaj._create_tbl(emaj.emaj_group_def,bigint,boolean) line 66 at EXECUTE
SQL statement "SELECT emaj._create_tbl(r_grpdef, v_timeId, v_isRollbackable)"
PL/pgSQL function emaj.emaj_create_group(text,boolean,boolean) line 55 at PERFORM
NOTICE:  trigger "emaj_log_trg" for relation "phil's schema3.myTbl2\" does not exist, skipping
CONTEXT:  SQL statement "DROP TRIGGER IF EXISTS emaj_log_trg ON "phil's schema3"."myTbl2\""
PL/pgSQL function emaj._create_tbl(emaj.emaj_group_def,bigint,boolean) line 120 at EXECUTE
SQL statement "SELECT emaj._create_tbl(r_grpdef, v_timeId, v_isRollbackable)"
PL/pgSQL function emaj.emaj_create_group(text,boolean,boolean) line 55 at PERFORM
NOTICE:  trigger "emaj_trunc_trg" for relation "phil's schema3.myTbl2\" does not exist, skipping
CONTEXT:  SQL statement "DROP TRIGGER IF EXISTS emaj_trunc_trg ON "phil's schema3"."myTbl2\""
PL/pgSQL function emaj._create_tbl(emaj.emaj_group_def,bigint,boolean) line 127 at EXECUTE
SQL statement "SELECT emaj._create_tbl(r_grpdef, v_timeId, v_isRollbackable)"
PL/pgSQL function emaj.emaj_create_group(text,boolean,boolean) line 55 at PERFORM
NOTICE:  table "phil's schema3_phil's tbl1_log" does not exist, skipping
CONTEXT:  SQL statement "DROP TABLE IF EXISTS "emaj #'3"."phil's schema3_phil's tbl1_log""
PL/pgSQL function emaj._create_tbl(emaj.emaj_group_def,bigint,boolean) line 66 at EXECUTE
SQL statement "SELECT emaj._create_tbl(r_grpdef, v_timeId, v_isRollbackable)"
PL/pgSQL function emaj.emaj_create_group(text,boolean,boolean) line 55 at PERFORM
NOTICE:  trigger "emaj_log_trg" for relation "phil's schema3.phil's tbl1" does not exist, skipping
CONTEXT:  SQL statement "DROP TRIGGER IF EXISTS emaj_log_trg ON "phil's schema3"."phil's tbl1""
PL/pgSQL function emaj._create_tbl(emaj.emaj_group_def,bigint,boolean) line 120 at EXECUTE
SQL statement "SELECT emaj._create_tbl(r_grpdef, v_timeId, v_isRollbackable)"
PL/pgSQL function emaj.emaj_create_group(text,boolean,boolean) line 55 at PERFORM
NOTICE:  trigger "emaj_trunc_trg" for relation "phil's schema3.phil's tbl1" does not exist, skipping
CONTEXT:  SQL statement "DROP TRIGGER IF EXISTS emaj_trunc_trg ON "phil's schema3"."phil's tbl1""
PL/pgSQL function emaj._create_tbl(emaj.emaj_group_def,bigint,boolean) line 127 at EXECUTE
SQL statement "SELECT emaj._create_tbl(r_grpdef, v_timeId, v_isRollbackable)"
PL/pgSQL function emaj.emaj_create_group(text,boolean,boolean) line 55 at PERFORM
 emaj_create_group 
-------------------
                 4
(1 row)

-- disable event triggers for this step to allow an application table structure change
select emaj.emaj_disable_protection_by_event_triggers();
 emaj_disable_protection_by_event_triggers 
-------------------------------------------
                                         3
(1 row)

reset role;
alter table "phil's schema3"."phil's tbl1" alter column "phil's col12" type char(11);
set role emaj_regression_tests_adm_user;
update emaj.emaj_group_def set grpdef_priority = 1, grpdef_log_schema_suffix = '3', grpdef_emaj_names_prefix = 'phil_mytbl2'
  where grpdef_schema = 'phil''s schema3' and grpdef_tblseq = E'myTbl2\\';
select emaj.emaj_alter_group('phil''s group#3",');
NOTICE:  table "phil's schema3_phil's tbl1_log" does not exist, skipping
CONTEXT:  SQL statement "DROP TABLE IF EXISTS "emaj #'3"."phil's schema3_phil's tbl1_log""
PL/pgSQL function emaj._create_tbl(emaj.emaj_group_def,bigint,boolean) line 66 at EXECUTE
SQL statement "SELECT emaj._create_tbl(r_grpdef, v_timeId, v_isRollbackable)"
PL/pgSQL function emaj._alter_exec(bigint) line 50 at PERFORM
SQL statement "SELECT emaj._alter_exec(v_timeId)"
PL/pgSQL function emaj._alter_groups(text[],boolean,text) line 49 at PERFORM
PL/pgSQL function emaj.emaj_alter_group(text,text) line 6 at RETURN
NOTICE:  trigger "emaj_log_trg" for relation "phil's schema3.phil's tbl1" does not exist, skipping
CONTEXT:  SQL statement "DROP TRIGGER IF EXISTS emaj_log_trg ON "phil's schema3"."phil's tbl1""
PL/pgSQL function emaj._create_tbl(emaj.emaj_group_def,bigint,boolean) line 120 at EXECUTE
SQL statement "SELECT emaj._create_tbl(r_grpdef, v_timeId, v_isRollbackable)"
PL/pgSQL function emaj._alter_exec(bigint) line 50 at PERFORM
SQL statement "SELECT emaj._alter_exec(v_timeId)"
PL/pgSQL function emaj._alter_groups(text[],boolean,text) line 49 at PERFORM
PL/pgSQL function emaj.emaj_alter_group(text,text) line 6 at RETURN
NOTICE:  trigger "emaj_trunc_trg" for relation "phil's schema3.phil's tbl1" does not exist, skipping
CONTEXT:  SQL statement "DROP TRIGGER IF EXISTS emaj_trunc_trg ON "phil's schema3"."phil's tbl1""
PL/pgSQL function emaj._create_tbl(emaj.emaj_group_def,bigint,boolean) line 127 at EXECUTE
SQL statement "SELECT emaj._create_tbl(r_grpdef, v_timeId, v_isRollbackable)"
PL/pgSQL function emaj._alter_exec(bigint) line 50 at PERFORM
SQL statement "SELECT emaj._alter_exec(v_timeId)"
PL/pgSQL function emaj._alter_groups(text[],boolean,text) line 49 at PERFORM
PL/pgSQL function emaj.emaj_alter_group(text,text) line 6 at RETURN
 emaj_alter_group 
------------------
                4
(1 row)

select emaj.emaj_start_group('phil''s group#3",','M1_after_alter_group');
 emaj_start_group 
------------------
                4
(1 row)

select emaj.emaj_stop_group('phil''s group#3",');
 emaj_stop_group 
-----------------
               4
(1 row)

reset role;
alter table "phil's schema3"."phil's tbl1" alter column "phil's col12" type char(10);
set role emaj_regression_tests_adm_user;
select emaj.emaj_create_group('myGroup4');
NOTICE:  table "myschema4_mypartp1_log" does not exist, skipping
CONTEXT:  SQL statement "DROP TABLE IF EXISTS emaj.myschema4_mypartp1_log"
PL/pgSQL function emaj._create_tbl(emaj.emaj_group_def,bigint,boolean) line 66 at EXECUTE
SQL statement "SELECT emaj._create_tbl(r_grpdef, v_timeId, v_isRollbackable)"
PL/pgSQL function emaj.emaj_create_group(text,boolean,boolean) line 55 at PERFORM
NOTICE:  trigger "emaj_log_trg" for relation "myschema4.mypartp1" does not exist, skipping
CONTEXT:  SQL statement "DROP TRIGGER IF EXISTS emaj_log_trg ON myschema4.mypartp1"
PL/pgSQL function emaj._create_tbl(emaj.emaj_group_def,bigint,boolean) line 120 at EXECUTE
SQL statement "SELECT emaj._create_tbl(r_grpdef, v_timeId, v_isRollbackable)"
PL/pgSQL function emaj.emaj_create_group(text,boolean,boolean) line 55 at PERFORM
NOTICE:  trigger "emaj_trunc_trg" for relation "myschema4.mypartp1" does not exist, skipping
CONTEXT:  SQL statement "DROP TRIGGER IF EXISTS emaj_trunc_trg ON myschema4.mypartp1"
PL/pgSQL function emaj._create_tbl(emaj.emaj_group_def,bigint,boolean) line 127 at EXECUTE
SQL statement "SELECT emaj._create_tbl(r_grpdef, v_timeId, v_isRollbackable)"
PL/pgSQL function emaj.emaj_create_group(text,boolean,boolean) line 55 at PERFORM
NOTICE:  table "myschema4_mypartp2_log" does not exist, skipping
CONTEXT:  SQL statement "DROP TABLE IF EXISTS emaj.myschema4_mypartp2_log"
PL/pgSQL function emaj._create_tbl(emaj.emaj_group_def,bigint,boolean) line 66 at EXECUTE
SQL statement "SELECT emaj._create_tbl(r_grpdef, v_timeId, v_isRollbackable)"
PL/pgSQL function emaj.emaj_create_group(text,boolean,boolean) line 55 at PERFORM
NOTICE:  trigger "emaj_log_trg" for relation "myschema4.mypartp2" does not exist, skipping
CONTEXT:  SQL statement "DROP TRIGGER IF EXISTS emaj_log_trg ON myschema4.mypartp2"
PL/pgSQL function emaj._create_tbl(emaj.emaj_group_def,bigint,boolean) line 120 at EXECUTE
SQL statement "SELECT emaj._create_tbl(r_grpdef, v_timeId, v_isRollbackable)"
PL/pgSQL function emaj.emaj_create_group(text,boolean,boolean) line 55 at PERFORM
NOTICE:  trigger "emaj_trunc_trg" for relation "myschema4.mypartp2" does not exist, skipping
CONTEXT:  SQL statement "DROP TRIGGER IF EXISTS emaj_trunc_trg ON myschema4.mypartp2"
PL/pgSQL function emaj._create_tbl(emaj.emaj_group_def,bigint,boolean) line 127 at EXECUTE
SQL statement "SELECT emaj._create_tbl(r_grpdef, v_timeId, v_isRollbackable)"
PL/pgSQL function emaj.emaj_create_group(text,boolean,boolean) line 55 at PERFORM
NOTICE:  table "myschema4_mytblc1_log" does not exist, skipping
CONTEXT:  SQL statement "DROP TABLE IF EXISTS emaj.myschema4_mytblc1_log"
PL/pgSQL function emaj._create_tbl(emaj.emaj_group_def,bigint,boolean) line 66 at EXECUTE
SQL statement "SELECT emaj._create_tbl(r_grpdef, v_timeId, v_isRollbackable)"
PL/pgSQL function emaj.emaj_create_group(text,boolean,boolean) line 55 at PERFORM
NOTICE:  trigger "emaj_log_trg" for relation "myschema4.mytblc1" does not exist, skipping
CONTEXT:  SQL statement "DROP TRIGGER IF EXISTS emaj_log_trg ON myschema4.mytblc1"
PL/pgSQL function emaj._create_tbl(emaj.emaj_group_def,bigint,boolean) line 120 at EXECUTE
SQL statement "SELECT emaj._create_tbl(r_grpdef, v_timeId, v_isRollbackable)"
PL/pgSQL function emaj.emaj_create_group(text,boolean,boolean) line 55 at PERFORM
NOTICE:  trigger "emaj_trunc_trg" for relation "myschema4.mytblc1" does not exist, skipping
CONTEXT:  SQL statement "DROP TRIGGER IF EXISTS emaj_trunc_trg ON myschema4.mytblc1"
PL/pgSQL function emaj._create_tbl(emaj.emaj_group_def,bigint,boolean) line 127 at EXECUTE
SQL statement "SELECT emaj._create_tbl(r_grpdef, v_timeId, v_isRollbackable)"
PL/pgSQL function emaj.emaj_create_group(text,boolean,boolean) line 55 at PERFORM
NOTICE:  table "myschema4_mytblc2_log" does not exist, skipping
CONTEXT:  SQL statement "DROP TABLE IF EXISTS emaj.myschema4_mytblc2_log"
PL/pgSQL function emaj._create_tbl(emaj.emaj_group_def,bigint,boolean) line 66 at EXECUTE
SQL statement "SELECT emaj._create_tbl(r_grpdef, v_timeId, v_isRollbackable)"
PL/pgSQL function emaj.emaj_create_group(text,boolean,boolean) line 55 at PERFORM
NOTICE:  trigger "emaj_log_trg" for relation "myschema4.mytblc2" does not exist, skipping
CONTEXT:  SQL statement "DROP TRIGGER IF EXISTS emaj_log_trg ON myschema4.mytblc2"
PL/pgSQL function emaj._create_tbl(emaj.emaj_group_def,bigint,boolean) line 120 at EXECUTE
SQL statement "SELECT emaj._create_tbl(r_grpdef, v_timeId, v_isRollbackable)"
PL/pgSQL function emaj.emaj_create_group(text,boolean,boolean) line 55 at PERFORM
NOTICE:  trigger "emaj_trunc_trg" for relation "myschema4.mytblc2" does not exist, skipping
CONTEXT:  SQL statement "DROP TRIGGER IF EXISTS emaj_trunc_trg ON myschema4.mytblc2"
PL/pgSQL function emaj._create_tbl(emaj.emaj_group_def,bigint,boolean) line 127 at EXECUTE
SQL statement "SELECT emaj._create_tbl(r_grpdef, v_timeId, v_isRollbackable)"
PL/pgSQL function emaj.emaj_create_group(text,boolean,boolean) line 55 at PERFORM
NOTICE:  table "myschema4_mytblm_log" does not exist, skipping
CONTEXT:  SQL statement "DROP TABLE IF EXISTS emaj.myschema4_mytblm_log"
PL/pgSQL function emaj._create_tbl(emaj.emaj_group_def,bigint,boolean) line 66 at EXECUTE
SQL statement "SELECT emaj._create_tbl(r_grpdef, v_timeId, v_isRollbackable)"
PL/pgSQL function emaj.emaj_create_group(text,boolean,boolean) line 55 at PERFORM
NOTICE:  trigger "emaj_log_trg" for relation "myschema4.mytblm" does not exist, skipping
CONTEXT:  SQL statement "DROP TRIGGER IF EXISTS emaj_log_trg ON myschema4.mytblm"
PL/pgSQL function emaj._create_tbl(emaj.emaj_group_def,bigint,boolean) line 120 at EXECUTE
SQL statement "SELECT emaj._create_tbl(r_grpdef, v_timeId, v_isRollbackable)"
PL/pgSQL function emaj.emaj_create_group(text,boolean,boolean) line 55 at PERFORM
NOTICE:  trigger "emaj_trunc_trg" for relation "myschema4.mytblm" does not exist, skipping
CONTEXT:  SQL statement "DROP TRIGGER IF EXISTS emaj_trunc_trg ON myschema4.mytblm"
PL/pgSQL function emaj._create_tbl(emaj.emaj_group_def,bigint,boolean) line 127 at EXECUTE
SQL statement "SELECT emaj._create_tbl(r_grpdef, v_timeId, v_isRollbackable)"
PL/pgSQL function emaj.emaj_create_group(text,boolean,boolean) line 55 at PERFORM
WARNING:  _create_tbl: The table "myschema4.mytblm" has triggers (mytblm_insert_trigger). Verify the compatibility with emaj rollback operations (in particular if triggers update one or several other tables). Triggers may have to be manualy disabled before rollback.
CONTEXT:  SQL statement "SELECT emaj._create_tbl(r_grpdef, v_timeId, v_isRollbackable)"
PL/pgSQL function emaj.emaj_create_group(text,boolean,boolean) line 55 at PERFORM
 emaj_create_group 
-------------------
                 5
(1 row)

update emaj.emaj_group_def set grpdef_priority = NULL, grpdef_log_schema_suffix = NULL, grpdef_emaj_names_prefix = NULL
  where grpdef_schema = 'phil''s schema3' and grpdef_tblseq = E'myTbl2\\';
update emaj.emaj_group_def set grpdef_priority = 999
  where grpdef_schema = 'myschema4' and grpdef_tblseq = 'mytblm';
select emaj.emaj_alter_groups('{"phil''s group#3\",","myGroup4"}');
NOTICE:  table "phil's schema3_phil's tbl1_log" does not exist, skipping
CONTEXT:  SQL statement "DROP TABLE IF EXISTS "emaj #'3"."phil's schema3_phil's tbl1_log""
PL/pgSQL function emaj._create_tbl(emaj.emaj_group_def,bigint,boolean) line 66 at EXECUTE
SQL statement "SELECT emaj._create_tbl(r_grpdef, v_timeId, v_isRollbackable)"
PL/pgSQL function emaj._alter_exec(bigint) line 50 at PERFORM
SQL statement "SELECT emaj._alter_exec(v_timeId)"
PL/pgSQL function emaj._alter_groups(text[],boolean,text) line 49 at PERFORM
PL/pgSQL function emaj.emaj_alter_groups(text[],text) line 6 at RETURN
NOTICE:  trigger "emaj_log_trg" for relation "phil's schema3.phil's tbl1" does not exist, skipping
CONTEXT:  SQL statement "DROP TRIGGER IF EXISTS emaj_log_trg ON "phil's schema3"."phil's tbl1""
PL/pgSQL function emaj._create_tbl(emaj.emaj_group_def,bigint,boolean) line 120 at EXECUTE
SQL statement "SELECT emaj._create_tbl(r_grpdef, v_timeId, v_isRollbackable)"
PL/pgSQL function emaj._alter_exec(bigint) line 50 at PERFORM
SQL statement "SELECT emaj._alter_exec(v_timeId)"
PL/pgSQL function emaj._alter_groups(text[],boolean,text) line 49 at PERFORM
PL/pgSQL function emaj.emaj_alter_groups(text[],text) line 6 at RETURN
NOTICE:  trigger "emaj_trunc_trg" for relation "phil's schema3.phil's tbl1" does not exist, skipping
CONTEXT:  SQL statement "DROP TRIGGER IF EXISTS emaj_trunc_trg ON "phil's schema3"."phil's tbl1""
PL/pgSQL function emaj._create_tbl(emaj.emaj_group_def,bigint,boolean) line 127 at EXECUTE
SQL statement "SELECT emaj._create_tbl(r_grpdef, v_timeId, v_isRollbackable)"
PL/pgSQL function emaj._alter_exec(bigint) line 50 at PERFORM
SQL statement "SELECT emaj._alter_exec(v_timeId)"
PL/pgSQL function emaj._alter_groups(text[],boolean,text) line 49 at PERFORM
PL/pgSQL function emaj.emaj_alter_groups(text[],text) line 6 at RETURN
 emaj_alter_groups 
-------------------
                 9
(1 row)

select emaj.emaj_drop_group('phil''s group#3",');
 emaj_drop_group 
-----------------
               4
(1 row)

select emaj.emaj_drop_group('myGroup4');
 emaj_drop_group 
-----------------
               5
(1 row)

select emaj.emaj_enable_protection_by_event_triggers();
 emaj_enable_protection_by_event_triggers 
------------------------------------------
                                        3
(1 row)

-----------------------------
-- Checking step 9
-----------------------------
select * from emaj.emaj_alter_plan where altr_time_id > 10000 order by 1,2,3,4,5;
 altr_time_id |        altr_step        |  altr_schema   | altr_tblseq |    altr_group    | altr_priority | altr_group_is_logging | altr_new_group | altr_new_priority | altr_new_group_is_logging | altr_rlbk_id 
--------------+-------------------------+----------------+-------------+------------------+---------------+-----------------------+----------------+-------------------+---------------------------+--------------
        10035 | REPAIR_TBL              | phil's schema3 | phil's tbl1 | phil's group#3", |               | f                     |                |                   |                           |             
        10035 | RESET_GROUP             |                |             | phil's group#3", |               | f                     |                |                   |                           |             
        10035 | CHANGE_TBL_LOG_SCHEMA   | phil's schema3 | myTbl2\     | phil's group#3", |             1 | f                     |                |                   |                           |             
        10035 | CHANGE_TBL_NAMES_PREFIX | phil's schema3 | myTbl2\     | phil's group#3", |             1 | f                     |                |                   |                           |             
        10035 | CHANGE_REL_PRIORITY     | phil's schema3 | myTbl2\     | phil's group#3", |               | f                     |                |                 1 |                           |             
        10039 | REPAIR_TBL              | phil's schema3 | phil's tbl1 | phil's group#3", |               | f                     |                |                   |                           |             
        10039 | RESET_GROUP             |                |             | myGroup4         |               | f                     |                |                   |                           |             
        10039 | RESET_GROUP             |                |             | phil's group#3", |               | f                     |                |                   |                           |             
        10039 | CHANGE_TBL_LOG_SCHEMA   | phil's schema3 | myTbl2\     | phil's group#3", |               | f                     |                |                   |                           |             
        10039 | CHANGE_TBL_NAMES_PREFIX | phil's schema3 | myTbl2\     | phil's group#3", |               | f                     |                |                   |                           |             
        10039 | CHANGE_REL_PRIORITY     | myschema4      | mytblm      | myGroup4         |               | f                     |                |               999 |                           |             
        10039 | CHANGE_REL_PRIORITY     | phil's schema3 | myTbl2\     | phil's group#3", |             1 | f                     |                |                   |                           |             
(12 rows)

-----------------------------
-- Step 10 : for phil''s group#3", recreate the group as rollbackable, update tables, 
--           rename a mark, then delete 2 marks then delete all before a mark 
-----------------------------
-- prepare phil's group#3, group
--
reset role;
alter table "phil's schema3"."myTbl2\" add primary key (col21);
set role emaj_regression_tests_adm_user;
select emaj.emaj_create_group('phil''s group#3",',true);
NOTICE:  table "phil's schema3_myTbl2\_log" does not exist, skipping
CONTEXT:  SQL statement "DROP TABLE IF EXISTS emaj."phil's schema3_myTbl2\_log""
PL/pgSQL function emaj._create_tbl(emaj.emaj_group_def,bigint,boolean) line 66 at EXECUTE
SQL statement "SELECT emaj._create_tbl(r_grpdef, v_timeId, v_isRollbackable)"
PL/pgSQL function emaj.emaj_create_group(text,boolean,boolean) line 55 at PERFORM
NOTICE:  trigger "emaj_log_trg" for relation "phil's schema3.myTbl2\" does not exist, skipping
CONTEXT:  SQL statement "DROP TRIGGER IF EXISTS emaj_log_trg ON "phil's schema3"."myTbl2\""
PL/pgSQL function emaj._create_tbl(emaj.emaj_group_def,bigint,boolean) line 120 at EXECUTE
SQL statement "SELECT emaj._create_tbl(r_grpdef, v_timeId, v_isRollbackable)"
PL/pgSQL function emaj.emaj_create_group(text,boolean,boolean) line 55 at PERFORM
NOTICE:  trigger "emaj_trunc_trg" for relation "phil's schema3.myTbl2\" does not exist, skipping
CONTEXT:  SQL statement "DROP TRIGGER IF EXISTS emaj_trunc_trg ON "phil's schema3"."myTbl2\""
PL/pgSQL function emaj._create_tbl(emaj.emaj_group_def,bigint,boolean) line 127 at EXECUTE
SQL statement "SELECT emaj._create_tbl(r_grpdef, v_timeId, v_isRollbackable)"
PL/pgSQL function emaj.emaj_create_group(text,boolean,boolean) line 55 at PERFORM
NOTICE:  table "phil's schema3_phil's tbl1_log" does not exist, skipping
CONTEXT:  SQL statement "DROP TABLE IF EXISTS "emaj #'3"."phil's schema3_phil's tbl1_log""
PL/pgSQL function emaj._create_tbl(emaj.emaj_group_def,bigint,boolean) line 66 at EXECUTE
SQL statement "SELECT emaj._create_tbl(r_grpdef, v_timeId, v_isRollbackable)"
PL/pgSQL function emaj.emaj_create_group(text,boolean,boolean) line 55 at PERFORM
NOTICE:  trigger "emaj_log_trg" for relation "phil's schema3.phil's tbl1" does not exist, skipping
CONTEXT:  SQL statement "DROP TRIGGER IF EXISTS emaj_log_trg ON "phil's schema3"."phil's tbl1""
PL/pgSQL function emaj._create_tbl(emaj.emaj_group_def,bigint,boolean) line 120 at EXECUTE
SQL statement "SELECT emaj._create_tbl(r_grpdef, v_timeId, v_isRollbackable)"
PL/pgSQL function emaj.emaj_create_group(text,boolean,boolean) line 55 at PERFORM
NOTICE:  trigger "emaj_trunc_trg" for relation "phil's schema3.phil's tbl1" does not exist, skipping
CONTEXT:  SQL statement "DROP TRIGGER IF EXISTS emaj_trunc_trg ON "phil's schema3"."phil's tbl1""
PL/pgSQL function emaj._create_tbl(emaj.emaj_group_def,bigint,boolean) line 127 at EXECUTE
SQL statement "SELECT emaj._create_tbl(r_grpdef, v_timeId, v_isRollbackable)"
PL/pgSQL function emaj.emaj_create_group(text,boolean,boolean) line 55 at PERFORM
WARNING:  _check_fk_groups: The foreign key "mytbl2_col21_fkey" on the table "phil's schema3.myTbl2\" references the table "phil's schema3.mytbl4" that is outside the groups (phil's group#3",).
CONTEXT:  SQL statement "SELECT emaj._check_fk_groups(array[v_groupName])"
PL/pgSQL function emaj.emaj_create_group(text,boolean,boolean) line 75 at PERFORM
WARNING:  _check_fk_groups: The table "phil's schema3.phil's tbl1" is referenced by the foreign key "mytbl4_col44_fkey" on the table "phil's schema3.mytbl4" that is outside the groups (phil's group#3",).
CONTEXT:  SQL statement "SELECT emaj._check_fk_groups(array[v_groupName])"
PL/pgSQL function emaj.emaj_create_group(text,boolean,boolean) line 75 at PERFORM
 emaj_create_group 
-------------------
                 4
(1 row)

select emaj.emaj_start_group('phil''s group#3",','M1_rollbackable');
WARNING:  _check_fk_groups: The foreign key "mytbl2_col21_fkey" on the table "phil's schema3.myTbl2\" references the table "phil's schema3.mytbl4" that is outside the groups (phil's group#3",).
CONTEXT:  SQL statement "SELECT emaj._check_fk_groups(v_groupNames)"
PL/pgSQL function emaj._start_groups(text[],text,boolean,boolean) line 37 at PERFORM
SQL statement "SELECT emaj._start_groups(array[v_groupName], v_mark, false, v_resetLog)"
PL/pgSQL function emaj.emaj_start_group(text,text,boolean) line 17 at SQL statement
WARNING:  _check_fk_groups: The table "phil's schema3.phil's tbl1" is referenced by the foreign key "mytbl4_col44_fkey" on the table "phil's schema3.mytbl4" that is outside the groups (phil's group#3",).
CONTEXT:  SQL statement "SELECT emaj._check_fk_groups(v_groupNames)"
PL/pgSQL function emaj._start_groups(text[],text,boolean,boolean) line 37 at PERFORM
SQL statement "SELECT emaj._start_groups(array[v_groupName], v_mark, false, v_resetLog)"
PL/pgSQL function emaj.emaj_start_group(text,text,boolean) line 17 at SQL statement
 emaj_start_group 
------------------
                4
(1 row)

--
set search_path=public,"phil's schema3";
--
insert into "phil's tbl1" select i, 'AB''C', E'\\014'::bytea from generate_series (1,31) as i;
update "phil's tbl1" set "phil\s col13" = E'\\034'::bytea where "phil's col11" <= 3;
update "phil's tbl1" set "phil\s col13" = E'\\034'''::bytea where "phil's col11" between 18 and 22;
insert into myTbl4 (col41) values (1);
insert into myTbl4 (col41) values (2);
insert into "myTbl2\" values (1,'ABC','2010-12-31');
delete from "phil's tbl1" where "phil's col11" > 20;
insert into "myTbl2\" values (2,'DEF',NULL);
select nextval(E'"phil''s schema3"."phil''s seq\\1"');
 nextval 
---------
    1000
(1 row)

--
select emaj.emaj_set_mark_group('phil''s group#3",','M2_rollbackable');
 emaj_set_mark_group 
---------------------
                   4
(1 row)

select emaj.emaj_set_mark_group('phil''s group#3",','M2_again!');
 emaj_set_mark_group 
---------------------
                   4
(1 row)

--
delete from "phil's tbl1" where "phil's col11" = 10;
update "phil's tbl1" set "phil's col12" = 'DEF' where "phil's col11" <= 2;
select nextval(E'"phil''s schema3"."phil''s seq\\1"');
 nextval 
---------
    1001
(1 row)

--
select emaj.emaj_set_mark_groups(array['phil''s group#3",'],'phil''s mark #1');
 emaj_set_mark_groups 
----------------------
                    4
(1 row)

select emaj.emaj_comment_mark_group('phil''s group#3",','phil''s mark #1','Third mark set');
 emaj_comment_mark_group 
-------------------------
 
(1 row)

--
select emaj.emaj_rename_mark_group('phil''s group#3",','phil''s mark #1','phil''s mark #3');
 emaj_rename_mark_group 
------------------------
 
(1 row)

-- 
select emaj.emaj_delete_mark_group('phil''s group#3",','M2_again!');
 emaj_delete_mark_group 
------------------------
                      1
(1 row)

--
select * from emaj.emaj_log_stat_group('phil''s group#3",','','');
    stat_group    |  stat_schema   | stat_table  | stat_rows 
------------------+----------------+-------------+-----------
 phil's group#3", | phil's schema3 | myTbl2\     |         2
 phil's group#3", | phil's schema3 | phil's tbl1 |        53
(2 rows)

select * from emaj.emaj_detailed_log_stat_group('phil''s group#3",','phil''s mark #3','');
 stat_group | stat_schema | stat_table | stat_role | stat_verb | stat_rows 
------------+-------------+------------+-----------+-----------+-----------
(0 rows)

--
select * from emaj.emaj_logged_rollback_group('phil''s group#3",','phil''s mark #3',false) order by 1,2;
WARNING:  _check_fk_groups: The foreign key "mytbl2_col21_fkey" on the table "phil's schema3.myTbl2\" references the table "phil's schema3.mytbl4" that is outside the groups (phil's group#3",).
CONTEXT:  SQL statement "SELECT emaj._check_fk_groups(v_groupNames)"
PL/pgSQL function emaj._rlbk_init(text[],text,boolean,integer,boolean,boolean) line 68 at PERFORM
SQL statement "SELECT emaj._rlbk_init(v_groupNames, v_mark, v_isLoggedRlbk, 1, v_multiGroup, v_isAlterGroupAllowed)"
PL/pgSQL function emaj._rlbk_groups(text[],text,boolean,boolean,boolean) line 20 at SQL statement
PL/pgSQL function emaj.emaj_logged_rollback_group(text,text,boolean) line 11 at RETURN QUERY
WARNING:  _check_fk_groups: The table "phil's schema3.phil's tbl1" is referenced by the foreign key "mytbl4_col44_fkey" on the table "phil's schema3.mytbl4" that is outside the groups (phil's group#3",).
CONTEXT:  SQL statement "SELECT emaj._check_fk_groups(v_groupNames)"
PL/pgSQL function emaj._rlbk_init(text[],text,boolean,integer,boolean,boolean) line 68 at PERFORM
SQL statement "SELECT emaj._rlbk_init(v_groupNames, v_mark, v_isLoggedRlbk, 1, v_multiGroup, v_isAlterGroupAllowed)"
PL/pgSQL function emaj._rlbk_groups(text[],text,boolean,boolean,boolean) line 20 at SQL statement
PL/pgSQL function emaj.emaj_logged_rollback_group(text,text,boolean) line 11 at RETURN QUERY
 rlbk_severity |            rlbk_message             
---------------+-------------------------------------
 Notice        | 0 / 2 tables effectively processed.
 Notice        | 2 sequences processed.
(2 rows)

select * from emaj.emaj_rollback_group('phil''s group#3",','phil''s mark #3',false) order by 1,2;
WARNING:  _check_fk_groups: The foreign key "mytbl2_col21_fkey" on the table "phil's schema3.myTbl2\" references the table "phil's schema3.mytbl4" that is outside the groups (phil's group#3",).
CONTEXT:  SQL statement "SELECT emaj._check_fk_groups(v_groupNames)"
PL/pgSQL function emaj._rlbk_init(text[],text,boolean,integer,boolean,boolean) line 68 at PERFORM
SQL statement "SELECT emaj._rlbk_init(v_groupNames, v_mark, v_isLoggedRlbk, 1, v_multiGroup, v_isAlterGroupAllowed)"
PL/pgSQL function emaj._rlbk_groups(text[],text,boolean,boolean,boolean) line 20 at SQL statement
PL/pgSQL function emaj.emaj_rollback_group(text,text,boolean) line 7 at RETURN QUERY
WARNING:  _check_fk_groups: The table "phil's schema3.phil's tbl1" is referenced by the foreign key "mytbl4_col44_fkey" on the table "phil's schema3.mytbl4" that is outside the groups (phil's group#3",).
CONTEXT:  SQL statement "SELECT emaj._check_fk_groups(v_groupNames)"
PL/pgSQL function emaj._rlbk_init(text[],text,boolean,integer,boolean,boolean) line 68 at PERFORM
SQL statement "SELECT emaj._rlbk_init(v_groupNames, v_mark, v_isLoggedRlbk, 1, v_multiGroup, v_isAlterGroupAllowed)"
PL/pgSQL function emaj._rlbk_groups(text[],text,boolean,boolean,boolean) line 20 at SQL statement
PL/pgSQL function emaj.emaj_rollback_group(text,text,boolean) line 7 at RETURN QUERY
 rlbk_severity |            rlbk_message             
---------------+-------------------------------------
 Notice        | 0 / 2 tables effectively processed.
 Notice        | 2 sequences processed.
(2 rows)

-----------------------------
-- Checking step 10
-----------------------------
-- emaj tables
select mark_id, mark_group, regexp_replace(mark_name,E'\\d\\d\.\\d\\d\\.\\d\\d\\.\\d\\d\\d','%','g'), mark_time_id, mark_is_deleted, mark_is_rlbk_protected, mark_comment, mark_log_rows_before_next, mark_logged_rlbk_target_mark from emaj.emaj_mark order by mark_id;
 mark_id |    mark_group    |        regexp_replace        | mark_time_id | mark_is_deleted | mark_is_rlbk_protected |     mark_comment     | mark_log_rows_before_next | mark_logged_rlbk_target_mark 
---------+------------------+------------------------------+--------------+-----------------+------------------------+----------------------+---------------------------+------------------------------
   10006 | myGroup2         | M3                           |        10008 | t               | f                      | This mark is deleted |                         0 | 
   10011 | myGroup1         | M4                           |        10014 | t               | f                      |                      |                        10 | 
   10012 | myGroup1         | M5                           |        10015 | t               | f                      |                      |                         3 | 
   10016 | myGroup1         | Before logged rollback to M4 |        10021 | t               | f                      |                      |                        28 | 
   10018 | myGroup1         | STOP_%                       |        10023 | t               | f                      |                      |                         0 | 
   10019 | myGroup2         | STOP_%                       |        10023 | t               | f                      |                      |                         0 | 
   10028 | myGroup1         | Stop after rollback          |        10030 | t               | f                      |                      |                         0 | 
   10029 | myGroup2         | Stop after rollback          |        10030 | t               | f                      |                      |                         0 | 
   10030 | myGroup1         | Multi-1                      |        10031 | f               | f                      |                      |                           | 
   10031 | myGroup2         | Multi-1                      |        10031 | f               | f                      |                      |                           | 
   10036 | phil's group#3", | M1_rollbackable              |        10041 | f               | f                      |                      |                        52 | 
   10037 | phil's group#3", | M2_rollbackable              |        10042 | f               | f                      |                      |                         3 | 
   10039 | phil's group#3", | phil's mark #3               |        10044 | f               | f                      | Third mark set       |                           | 
(13 rows)

select sequ_schema, sequ_name, sequ_time_id, sequ_last_val, sequ_is_called from emaj.emaj_sequence order by sequ_time_id, sequ_schema, sequ_name;
  sequ_schema   |             sequ_name              | sequ_time_id | sequ_last_val | sequ_is_called 
----------------+------------------------------------+--------------+---------------+----------------
 emaj           | myschema2_mytbl1_log_seq           |        10008 |            15 | t
 emaj           | myschema2_mytbl2_log_seq           |        10008 |             2 | t
 emaj           | myschema2_mytbl4_log_seq           |        10008 |             4 | t
 emaj           | myschema2_mytbl6_log_seq           |        10008 |            14 | t
 emaj           | otherPrefix4mytbl5_log_seq         |        10008 |             4 | t
 emajC          | myschema2_myTbl3_log_seq           |        10008 |            10 | t
 myschema2      | myseq1                             |        10008 |          1003 | t
 myschema2      | myTbl3_col31_seq                   |        10008 |            20 | t
 emaj           | myschema1_mytbl1_log_seq           |        10014 |            30 | t
 emaj           | myschema1_mytbl2_log_seq           |        10014 |             3 | t
 emaj           | myschema1_mytbl4_log_seq           |        10014 |             8 | t
 emajb          | myschema1_mytbl2b_log_seq          |        10014 |             1 | f
 emajC          | myschema1_myTbl3_log_seq           |        10014 |            10 | t
 myschema1      | mytbl2b_col20_seq                  |        10014 |             3 | f
 myschema1      | myTbl3_col31_seq                   |        10014 |            20 | t
 emaj           | myschema1_mytbl1_log_seq           |        10015 |            30 | t
 emaj           | myschema1_mytbl2_log_seq           |        10015 |             3 | t
 emaj           | myschema1_mytbl4_log_seq           |        10015 |             8 | t
 emajb          | myschema1_mytbl2b_log_seq          |        10015 |             1 | f
 emajC          | myschema1_myTbl3_log_seq           |        10015 |            20 | t
 myschema1      | mytbl2b_col20_seq                  |        10015 |             3 | f
 myschema1      | myTbl3_col31_seq                   |        10015 |            20 | t
 emaj           | myschema1_mytbl1_log_seq           |        10021 |            32 | t
 emaj           | myschema1_mytbl2_log_seq           |        10021 |             3 | t
 emaj           | myschema1_mytbl4_log_seq           |        10021 |            12 | t
 emajb          | myschema1_mytbl2b_log_seq          |        10021 |             1 | f
 emajC          | myschema1_myTbl3_log_seq           |        10021 |            20 | t
 myschema1      | mytbl2b_col20_seq                  |        10021 |             3 | f
 myschema1      | myTbl3_col31_seq                   |        10021 |            20 | t
 emaj           | myschema1_mytbl1_log_seq           |        10023 |            33 | t
 emaj           | myschema1_mytbl2_log_seq           |        10023 |             3 | t
 emaj           | myschema1_mytbl4_log_seq           |        10023 |            14 | t
 emaj           | myschema2_mytbl1_log_seq           |        10023 |            15 | t
 emaj           | myschema2_mytbl2_log_seq           |        10023 |             2 | t
 emaj           | myschema2_mytbl4_log_seq           |        10023 |            10 | t
 emaj           | myschema2_mytbl6_log_seq           |        10023 |            23 | t
 emaj           | otherPrefix4mytbl5_log_seq         |        10023 |             7 | t
 emajb          | myschema1_mytbl2b_log_seq          |        10023 |             1 | f
 emajC          | myschema1_myTbl3_log_seq           |        10023 |            45 | t
 emajC          | myschema2_myTbl3_log_seq           |        10023 |            10 | t
 myschema1      | mytbl2b_col20_seq                  |        10023 |             3 | f
 myschema1      | myTbl3_col31_seq                   |        10023 |            20 | t
 myschema2      | myseq1                             |        10023 |          1004 | f
 myschema2      | myTbl3_col31_seq                   |        10023 |            20 | t
 emaj           | myschema1_mytbl1_log_seq           |        10030 |            33 | t
 emaj           | myschema1_mytbl2_log_seq           |        10030 |             3 | t
 emaj           | myschema1_mytbl4_log_seq           |        10030 |            14 | t
 emaj           | myschema2_mytbl1_log_seq           |        10030 |            15 | t
 emaj           | myschema2_mytbl2_log_seq           |        10030 |             2 | t
 emaj           | myschema2_mytbl4_log_seq           |        10030 |            10 | t
 emaj           | myschema2_mytbl6_log_seq           |        10030 |            23 | t
 emaj           | otherPrefix4mytbl5_log_seq         |        10030 |             7 | t
 emajb          | myschema1_mytbl2b_log_seq          |        10030 |             1 | f
 emajC          | myschema1_myTbl3_log_seq           |        10030 |            45 | t
 emajC          | myschema2_myTbl3_log_seq           |        10030 |            10 | t
 myschema1      | mytbl2b_col20_seq                  |        10030 |             3 | f
 myschema1      | myTbl3_col31_seq                   |        10030 |            20 | t
 myschema2      | myseq1                             |        10030 |          1004 | f
 myschema2      | myTbl3_col31_seq                   |        10030 |            20 | t
 emaj           | myschema1_mytbl1_log_seq           |        10031 |            33 | t
 emaj           | myschema1_mytbl2_log_seq           |        10031 |             3 | t
 emaj           | myschema1_mytbl4_log_seq           |        10031 |            14 | t
 emaj           | myschema2_mytbl1_log_seq           |        10031 |            15 | t
 emaj           | myschema2_mytbl2_log_seq           |        10031 |             2 | t
 emaj           | myschema2_mytbl4_log_seq           |        10031 |            10 | t
 emaj           | myschema2_mytbl6_log_seq           |        10031 |            23 | t
 emaj           | otherPrefix4mytbl5_log_seq         |        10031 |             7 | t
 emajb          | myschema1_mytbl2b_log_seq          |        10031 |             1 | f
 emajC          | myschema1_myTbl3_log_seq           |        10031 |            45 | t
 emajC          | myschema2_myTbl3_log_seq           |        10031 |            10 | t
 myschema1      | mytbl2b_col20_seq                  |        10031 |             3 | f
 myschema1      | myTbl3_col31_seq                   |        10031 |            20 | t
 myschema2      | myseq1                             |        10031 |          1004 | f
 myschema2      | myTbl3_col31_seq                   |        10031 |            20 | t
 emaj           | phil's schema3_myTbl2\_log_seq     |        10041 |             1 | f
 emaj #'3       | phil's schema3_phil's tbl1_log_seq |        10041 |             1 | f
 phil's schema3 | myTbl2\_col21_seq                  |        10041 |             1 | f
 phil's schema3 | phil's seq\1                       |        10041 |          1000 | f
 emaj           | phil's schema3_myTbl2\_log_seq     |        10042 |             2 | t
 emaj #'3       | phil's schema3_phil's tbl1_log_seq |        10042 |            50 | t
 phil's schema3 | myTbl2\_col21_seq                  |        10042 |             1 | f
 phil's schema3 | phil's seq\1                       |        10042 |          1000 | t
 emaj           | phil's schema3_myTbl2\_log_seq     |        10044 |             2 | t
 emaj #'3       | phil's schema3_phil's tbl1_log_seq |        10044 |            53 | t
 phil's schema3 | myTbl2\_col21_seq                  |        10044 |             1 | f
 phil's schema3 | phil's seq\1                       |        10044 |          1001 | t
(86 rows)

select sqhl_schema, sqhl_table, sqhl_begin_time_id, sqhl_end_time_id, sqhl_hole_size from emaj.emaj_seq_hole order by 1,2,3;
 sqhl_schema | sqhl_table | sqhl_begin_time_id | sqhl_end_time_id | sqhl_hole_size 
-------------+------------+--------------------+------------------+----------------
 myschema1   | mytbl1     |              10015 |            10020 |              1
 myschema1   | mytbl4     |              10015 |            10020 |              2
 myschema2   | mytbl4     |              10008 |            10019 |              6
 myschema2   | mytbl5     |              10008 |            10019 |              3
 myschema2   | mytbl6     |              10008 |            10019 |              9
(5 rows)

select rlbt_rlbk_id, rlbt_step, rlbt_schema, rlbt_table, rlbt_fkey, rlbt_quantity from emaj.emaj_rlbk_stat
  order by rlbt_rlbk_id, rlbt_step, rlbt_schema, rlbt_table, rlbt_fkey;
 rlbt_rlbk_id |  rlbt_step  | rlbt_schema | rlbt_table |     rlbt_fkey     | rlbt_quantity 
--------------+-------------+-------------+------------+-------------------+---------------
         6005 | RLBK_TABLE  | myschema1   | myTbl3     |                   |             1
         6005 | CTRL+DBLINK |             |            |                   |             1
         6006 | DIS_LOG_TRG |             |            |                   |             1
         6006 | RLBK_TABLE  | myschema1   | myTbl3     |                   |             1
         6006 | DELETE_LOG  | myschema1   | myTbl3     |                   |             1
         6006 | ENA_LOG_TRG |             |            |                   |             1
         6006 | CTRL+DBLINK |             |            |                   |             4
        10000 | DROP_FK     |             |            |                   |             1
        10000 | SET_FK_DEF  |             |            |                   |             2
        10000 | RLBK_TABLE  | myschema2   | mytbl4     |                   |             4
        10000 | RLBK_TABLE  | myschema2   | mytbl5     |                   |             1
        10000 | RLBK_TABLE  | myschema2   | mytbl6     |                   |             3
        10000 | SET_FK_IMM  | myschema2   | mytbl4     | mytbl4_col43_fkey |             4
        10000 | SET_FK_IMM  | myschema2   | mytbl6     | mytbl6_col61_fkey |             3
        10000 | SET_FK_IMM  | myschema2   | mytbl8     | mytbl8_col81_fkey |             3
        10000 | ADD_FK      | myschema2   | mytbl4     | mytbl4_col44_fkey |             2
        10000 | CTRL-DBLINK |             |            |                   |            10
        10001 | DROP_FK     |             |            |                   |             1
        10001 | SET_FK_DEF  |             |            |                   |             2
        10001 | RLBK_TABLE  | myschema2   | mytbl4     |                   |             2
        10001 | RLBK_TABLE  | myschema2   | mytbl5     |                   |             1
        10001 | RLBK_TABLE  | myschema2   | mytbl6     |                   |             3
        10001 | SET_FK_IMM  | myschema2   | mytbl4     | mytbl4_col43_fkey |             2
        10001 | SET_FK_IMM  | myschema2   | mytbl6     | mytbl6_col61_fkey |             3
        10001 | SET_FK_IMM  | myschema2   | mytbl8     | mytbl8_col81_fkey |             3
        10001 | ADD_FK      | myschema2   | mytbl4     | mytbl4_col44_fkey |             2
        10001 | CTRL-DBLINK |             |            |                   |            10
        10002 | DIS_LOG_TRG |             |            |                   |             2
        10002 | DROP_FK     |             |            |                   |             1
        10002 | SET_FK_DEF  |             |            |                   |             1
        10002 | RLBK_TABLE  | myschema1   | mytbl1     |                   |             3
        10002 | RLBK_TABLE  | myschema1   | mytbl4     |                   |             8
        10002 | DELETE_LOG  | myschema1   | mytbl1     |                   |             3
        10002 | DELETE_LOG  | myschema1   | mytbl4     |                   |             8
        10002 | SET_FK_IMM  | myschema1   | mytbl4     | mytbl4_col43_fkey |             8
        10002 | ADD_FK      | myschema1   | mytbl4     | mytbl4_col44_fkey |             0
        10002 | ENA_LOG_TRG |             |            |                   |             2
        10002 | CTRL+DBLINK |             |            |                   |            12
        10003 | DROP_FK     |             |            |                   |             1
        10003 | SET_FK_DEF  |             |            |                   |             2
        10003 | RLBK_TABLE  | myschema2   | mytbl4     |                   |             8
        10003 | RLBK_TABLE  | myschema2   | mytbl5     |                   |             3
        10003 | RLBK_TABLE  | myschema2   | mytbl6     |                   |             9
        10003 | SET_FK_IMM  | myschema2   | mytbl4     | mytbl4_col43_fkey |             8
        10003 | SET_FK_IMM  | myschema2   | mytbl6     | mytbl6_col61_fkey |             9
        10003 | SET_FK_IMM  | myschema2   | mytbl8     | mytbl8_col81_fkey |             9
        10003 | ADD_FK      | myschema2   | mytbl4     | mytbl4_col44_fkey |             2
        10003 | CTRL+DBLINK |             |            |                   |            10
        10004 | DIS_LOG_TRG |             |            |                   |             3
        10004 | DROP_FK     |             |            |                   |             1
        10004 | SET_FK_DEF  |             |            |                   |             2
        10004 | RLBK_TABLE  | myschema2   | mytbl4     |                   |             6
        10004 | RLBK_TABLE  | myschema2   | mytbl5     |                   |             3
        10004 | RLBK_TABLE  | myschema2   | mytbl6     |                   |             9
        10004 | DELETE_LOG  | myschema2   | mytbl4     |                   |             6
        10004 | DELETE_LOG  | myschema2   | mytbl5     |                   |             3
        10004 | DELETE_LOG  | myschema2   | mytbl6     |                   |             9
        10004 | SET_FK_IMM  | myschema2   | mytbl4     | mytbl4_col43_fkey |             6
        10004 | SET_FK_IMM  | myschema2   | mytbl6     | mytbl6_col61_fkey |             9
        10004 | SET_FK_IMM  | myschema2   | mytbl8     | mytbl8_col81_fkey |             9
        10004 | ADD_FK      | myschema2   | mytbl4     | mytbl4_col44_fkey |             2
        10004 | ENA_LOG_TRG |             |            |                   |             3
        10004 | CTRL+DBLINK |             |            |                   |            19
        10005 | DIS_LOG_TRG |             |            |                   |             2
        10005 | DROP_FK     |             |            |                   |             1
        10005 | SET_FK_DEF  |             |            |                   |             1
        10005 | RLBK_TABLE  | myschema1   | mytbl1     |                   |             1
        10005 | RLBK_TABLE  | myschema1   | mytbl4     |                   |             2
        10005 | DELETE_LOG  | myschema1   | mytbl1     |                   |             1
        10005 | DELETE_LOG  | myschema1   | mytbl4     |                   |             2
        10005 | SET_FK_IMM  | myschema1   | mytbl4     | mytbl4_col43_fkey |             2
        10005 | ADD_FK      | myschema1   | mytbl4     | mytbl4_col44_fkey |             0
        10005 | ENA_LOG_TRG |             |            |                   |             2
        10005 | CTRL+DBLINK |             |            |                   |            12
        10006 | DROP_FK     |             |            |                   |             1
        10006 | SET_FK_DEF  |             |            |                   |             1
        10006 | RLBK_TABLE  | myschema1   | mytbl1     |                   |             1
        10006 | RLBK_TABLE  | myschema1   | myTbl3     |                   |            10
        10006 | RLBK_TABLE  | myschema1   | mytbl4     |                   |             2
        10006 | SET_FK_IMM  | myschema1   | mytbl4     | mytbl4_col43_fkey |             2
        10006 | ADD_FK      | myschema1   | mytbl4     | mytbl4_col44_fkey |             0
        10006 | CTRL+DBLINK |             |            |                   |             7
(82 rows)

-- user tables
select * from "phil's schema3"."phil's tbl1" order by "phil's col11","phil's col12";
 phil's col11 | phil's col12 | phil\s col13 
--------------+--------------+--------------
            1 | DEF          | \x1c
            2 | DEF          | \x1c
            3 | AB'C         | \x1c
            4 | AB'C         | \x0c
            5 | AB'C         | \x0c
            6 | AB'C         | \x0c
            7 | AB'C         | \x0c
            8 | AB'C         | \x0c
            9 | AB'C         | \x0c
           11 | AB'C         | \x0c
           12 | AB'C         | \x0c
           13 | AB'C         | \x0c
           14 | AB'C         | \x0c
           15 | AB'C         | \x0c
           16 | AB'C         | \x0c
           17 | AB'C         | \x0c
           18 | AB'C         | \x1c27
           19 | AB'C         | \x1c27
           20 | AB'C         | \x1c27
(19 rows)

select * from "phil's schema3"."myTbl2\" order by col21;
 col21 | col22 |   col23    
-------+-------+------------
     1 | ABC   | 12-31-2010
     2 | DEF   | 
(2 rows)

-- log tables
select "phil's col11", "phil's col12", "phil\s col13", emaj_verb, emaj_tuple, emaj_gid from "emaj #'3"."phil's schema3_phil's tbl1_log" order by emaj_gid, emaj_tuple desc;
 phil's col11 | phil's col12 | phil\s col13 | emaj_verb | emaj_tuple | emaj_gid 
--------------+--------------+--------------+-----------+------------+----------
            1 | AB'C         | \x0c         | INS       | NEW        |   100162
            2 | AB'C         | \x0c         | INS       | NEW        |   100163
            3 | AB'C         | \x0c         | INS       | NEW        |   100164
            4 | AB'C         | \x0c         | INS       | NEW        |   100165
            5 | AB'C         | \x0c         | INS       | NEW        |   100166
            6 | AB'C         | \x0c         | INS       | NEW        |   100167
            7 | AB'C         | \x0c         | INS       | NEW        |   100168
            8 | AB'C         | \x0c         | INS       | NEW        |   100169
            9 | AB'C         | \x0c         | INS       | NEW        |   100170
           10 | AB'C         | \x0c         | INS       | NEW        |   100171
           11 | AB'C         | \x0c         | INS       | NEW        |   100172
           12 | AB'C         | \x0c         | INS       | NEW        |   100173
           13 | AB'C         | \x0c         | INS       | NEW        |   100174
           14 | AB'C         | \x0c         | INS       | NEW        |   100175
           15 | AB'C         | \x0c         | INS       | NEW        |   100176
           16 | AB'C         | \x0c         | INS       | NEW        |   100177
           17 | AB'C         | \x0c         | INS       | NEW        |   100178
           18 | AB'C         | \x0c         | INS       | NEW        |   100179
           19 | AB'C         | \x0c         | INS       | NEW        |   100180
           20 | AB'C         | \x0c         | INS       | NEW        |   100181
           21 | AB'C         | \x0c         | INS       | NEW        |   100182
           22 | AB'C         | \x0c         | INS       | NEW        |   100183
           23 | AB'C         | \x0c         | INS       | NEW        |   100184
           24 | AB'C         | \x0c         | INS       | NEW        |   100185
           25 | AB'C         | \x0c         | INS       | NEW        |   100186
           26 | AB'C         | \x0c         | INS       | NEW        |   100187
           27 | AB'C         | \x0c         | INS       | NEW        |   100188
           28 | AB'C         | \x0c         | INS       | NEW        |   100189
           29 | AB'C         | \x0c         | INS       | NEW        |   100190
           30 | AB'C         | \x0c         | INS       | NEW        |   100191
           31 | AB'C         | \x0c         | INS       | NEW        |   100192
            1 | AB'C         | \x0c         | UPD       | OLD        |   100193
            1 | AB'C         | \x1c         | UPD       | NEW        |   100193
            2 | AB'C         | \x0c         | UPD       | OLD        |   100194
            2 | AB'C         | \x1c         | UPD       | NEW        |   100194
            3 | AB'C         | \x0c         | UPD       | OLD        |   100195
            3 | AB'C         | \x1c         | UPD       | NEW        |   100195
           18 | AB'C         | \x0c         | UPD       | OLD        |   100196
           18 | AB'C         | \x1c27       | UPD       | NEW        |   100196
           19 | AB'C         | \x0c         | UPD       | OLD        |   100197
           19 | AB'C         | \x1c27       | UPD       | NEW        |   100197
           20 | AB'C         | \x0c         | UPD       | OLD        |   100198
           20 | AB'C         | \x1c27       | UPD       | NEW        |   100198
           21 | AB'C         | \x0c         | UPD       | OLD        |   100199
           21 | AB'C         | \x1c27       | UPD       | NEW        |   100199
           22 | AB'C         | \x0c         | UPD       | OLD        |   100200
           22 | AB'C         | \x1c27       | UPD       | NEW        |   100200
           23 | AB'C         | \x0c         | DEL       | OLD        |   100202
           24 | AB'C         | \x0c         | DEL       | OLD        |   100203
           25 | AB'C         | \x0c         | DEL       | OLD        |   100204
           26 | AB'C         | \x0c         | DEL       | OLD        |   100205
           27 | AB'C         | \x0c         | DEL       | OLD        |   100206
           28 | AB'C         | \x0c         | DEL       | OLD        |   100207
           29 | AB'C         | \x0c         | DEL       | OLD        |   100208
           30 | AB'C         | \x0c         | DEL       | OLD        |   100209
           31 | AB'C         | \x0c         | DEL       | OLD        |   100210
           21 | AB'C         | \x1c27       | DEL       | OLD        |   100211
           22 | AB'C         | \x1c27       | DEL       | OLD        |   100212
           10 | AB'C         | \x0c         | DEL       | OLD        |   100214
            1 | AB'C         | \x1c         | UPD       | OLD        |   100215
            1 | DEF          | \x1c         | UPD       | NEW        |   100215
            2 | AB'C         | \x1c         | UPD       | OLD        |   100216
            2 | DEF          | \x1c         | UPD       | NEW        |   100216
(63 rows)

select col21, col22, col23, emaj_verb, emaj_tuple, emaj_gid from emaj."phil's schema3_myTbl2\_log" order by emaj_gid, emaj_tuple desc;
 col21 | col22 |   col23    | emaj_verb | emaj_tuple | emaj_gid 
-------+-------+------------+-----------+------------+----------
     1 | ABC   | 12-31-2010 | INS       | NEW        |   100201
     2 | DEF   |            | INS       | NEW        |   100213
(2 rows)

-----------------------------
-- Step 11 : for myGroup1, in a transaction, update tables and rollback the transaction, 
--           then rollback to previous mark 
-----------------------------
set search_path=public,myschema1;
--
begin transaction;
  delete from mytbl1;
rollback;
--
select * from emaj.emaj_rollback_group('myGroup1','EMAJ_LAST_MARK',false) order by 1,2;
 rlbk_severity |            rlbk_message             
---------------+-------------------------------------
 Notice        | 1 / 5 tables effectively processed.
 Notice        | 2 sequences processed.
(2 rows)

-----------------------------
-- Checking step 11
-----------------------------
-- emaj tables
select sqhl_schema, sqhl_table, sqhl_begin_time_id, sqhl_end_time_id, sqhl_hole_size from emaj.emaj_seq_hole order by 1,2,3;
 sqhl_schema | sqhl_table | sqhl_begin_time_id | sqhl_end_time_id | sqhl_hole_size 
-------------+------------+--------------------+------------------+----------------
 myschema1   | mytbl1     |              10015 |            10020 |              1
 myschema1   | mytbl1     |              10031 |            10048 |             20
 myschema1   | mytbl4     |              10015 |            10020 |              2
 myschema2   | mytbl4     |              10008 |            10019 |              6
 myschema2   | mytbl5     |              10008 |            10019 |              3
 myschema2   | mytbl6     |              10008 |            10019 |              9
(6 rows)

select rlbt_rlbk_id, rlbt_step, rlbt_schema, rlbt_table, rlbt_fkey, rlbt_quantity from emaj.emaj_rlbk_stat
  order by rlbt_rlbk_id, rlbt_step, rlbt_schema, rlbt_table, rlbt_fkey;
 rlbt_rlbk_id |  rlbt_step  | rlbt_schema | rlbt_table |     rlbt_fkey     | rlbt_quantity 
--------------+-------------+-------------+------------+-------------------+---------------
         6005 | RLBK_TABLE  | myschema1   | myTbl3     |                   |             1
         6005 | CTRL+DBLINK |             |            |                   |             1
         6006 | DIS_LOG_TRG |             |            |                   |             1
         6006 | RLBK_TABLE  | myschema1   | myTbl3     |                   |             1
         6006 | DELETE_LOG  | myschema1   | myTbl3     |                   |             1
         6006 | ENA_LOG_TRG |             |            |                   |             1
         6006 | CTRL+DBLINK |             |            |                   |             4
        10000 | DROP_FK     |             |            |                   |             1
        10000 | SET_FK_DEF  |             |            |                   |             2
        10000 | RLBK_TABLE  | myschema2   | mytbl4     |                   |             4
        10000 | RLBK_TABLE  | myschema2   | mytbl5     |                   |             1
        10000 | RLBK_TABLE  | myschema2   | mytbl6     |                   |             3
        10000 | SET_FK_IMM  | myschema2   | mytbl4     | mytbl4_col43_fkey |             4
        10000 | SET_FK_IMM  | myschema2   | mytbl6     | mytbl6_col61_fkey |             3
        10000 | SET_FK_IMM  | myschema2   | mytbl8     | mytbl8_col81_fkey |             3
        10000 | ADD_FK      | myschema2   | mytbl4     | mytbl4_col44_fkey |             2
        10000 | CTRL-DBLINK |             |            |                   |            10
        10001 | DROP_FK     |             |            |                   |             1
        10001 | SET_FK_DEF  |             |            |                   |             2
        10001 | RLBK_TABLE  | myschema2   | mytbl4     |                   |             2
        10001 | RLBK_TABLE  | myschema2   | mytbl5     |                   |             1
        10001 | RLBK_TABLE  | myschema2   | mytbl6     |                   |             3
        10001 | SET_FK_IMM  | myschema2   | mytbl4     | mytbl4_col43_fkey |             2
        10001 | SET_FK_IMM  | myschema2   | mytbl6     | mytbl6_col61_fkey |             3
        10001 | SET_FK_IMM  | myschema2   | mytbl8     | mytbl8_col81_fkey |             3
        10001 | ADD_FK      | myschema2   | mytbl4     | mytbl4_col44_fkey |             2
        10001 | CTRL-DBLINK |             |            |                   |            10
        10002 | DIS_LOG_TRG |             |            |                   |             2
        10002 | DROP_FK     |             |            |                   |             1
        10002 | SET_FK_DEF  |             |            |                   |             1
        10002 | RLBK_TABLE  | myschema1   | mytbl1     |                   |             3
        10002 | RLBK_TABLE  | myschema1   | mytbl4     |                   |             8
        10002 | DELETE_LOG  | myschema1   | mytbl1     |                   |             3
        10002 | DELETE_LOG  | myschema1   | mytbl4     |                   |             8
        10002 | SET_FK_IMM  | myschema1   | mytbl4     | mytbl4_col43_fkey |             8
        10002 | ADD_FK      | myschema1   | mytbl4     | mytbl4_col44_fkey |             0
        10002 | ENA_LOG_TRG |             |            |                   |             2
        10002 | CTRL+DBLINK |             |            |                   |            12
        10003 | DROP_FK     |             |            |                   |             1
        10003 | SET_FK_DEF  |             |            |                   |             2
        10003 | RLBK_TABLE  | myschema2   | mytbl4     |                   |             8
        10003 | RLBK_TABLE  | myschema2   | mytbl5     |                   |             3
        10003 | RLBK_TABLE  | myschema2   | mytbl6     |                   |             9
        10003 | SET_FK_IMM  | myschema2   | mytbl4     | mytbl4_col43_fkey |             8
        10003 | SET_FK_IMM  | myschema2   | mytbl6     | mytbl6_col61_fkey |             9
        10003 | SET_FK_IMM  | myschema2   | mytbl8     | mytbl8_col81_fkey |             9
        10003 | ADD_FK      | myschema2   | mytbl4     | mytbl4_col44_fkey |             2
        10003 | CTRL+DBLINK |             |            |                   |            10
        10004 | DIS_LOG_TRG |             |            |                   |             3
        10004 | DROP_FK     |             |            |                   |             1
        10004 | SET_FK_DEF  |             |            |                   |             2
        10004 | RLBK_TABLE  | myschema2   | mytbl4     |                   |             6
        10004 | RLBK_TABLE  | myschema2   | mytbl5     |                   |             3
        10004 | RLBK_TABLE  | myschema2   | mytbl6     |                   |             9
        10004 | DELETE_LOG  | myschema2   | mytbl4     |                   |             6
        10004 | DELETE_LOG  | myschema2   | mytbl5     |                   |             3
        10004 | DELETE_LOG  | myschema2   | mytbl6     |                   |             9
        10004 | SET_FK_IMM  | myschema2   | mytbl4     | mytbl4_col43_fkey |             6
        10004 | SET_FK_IMM  | myschema2   | mytbl6     | mytbl6_col61_fkey |             9
        10004 | SET_FK_IMM  | myschema2   | mytbl8     | mytbl8_col81_fkey |             9
        10004 | ADD_FK      | myschema2   | mytbl4     | mytbl4_col44_fkey |             2
        10004 | ENA_LOG_TRG |             |            |                   |             3
        10004 | CTRL+DBLINK |             |            |                   |            19
        10005 | DIS_LOG_TRG |             |            |                   |             2
        10005 | DROP_FK     |             |            |                   |             1
        10005 | SET_FK_DEF  |             |            |                   |             1
        10005 | RLBK_TABLE  | myschema1   | mytbl1     |                   |             1
        10005 | RLBK_TABLE  | myschema1   | mytbl4     |                   |             2
        10005 | DELETE_LOG  | myschema1   | mytbl1     |                   |             1
        10005 | DELETE_LOG  | myschema1   | mytbl4     |                   |             2
        10005 | SET_FK_IMM  | myschema1   | mytbl4     | mytbl4_col43_fkey |             2
        10005 | ADD_FK      | myschema1   | mytbl4     | mytbl4_col44_fkey |             0
        10005 | ENA_LOG_TRG |             |            |                   |             2
        10005 | CTRL+DBLINK |             |            |                   |            12
        10006 | DROP_FK     |             |            |                   |             1
        10006 | SET_FK_DEF  |             |            |                   |             1
        10006 | RLBK_TABLE  | myschema1   | mytbl1     |                   |             1
        10006 | RLBK_TABLE  | myschema1   | myTbl3     |                   |            10
        10006 | RLBK_TABLE  | myschema1   | mytbl4     |                   |             2
        10006 | SET_FK_IMM  | myschema1   | mytbl4     | mytbl4_col43_fkey |             2
        10006 | ADD_FK      | myschema1   | mytbl4     | mytbl4_col44_fkey |             0
        10006 | CTRL+DBLINK |             |            |                   |             7
        10013 | DIS_LOG_TRG |             |            |                   |             1
        10013 | DROP_FK     |             |            |                   |             1
        10013 | RLBK_TABLE  | myschema1   | mytbl1     |                   |            20
        10013 | DELETE_LOG  | myschema1   | mytbl1     |                   |            20
        10013 | ADD_FK      | myschema1   | mytbl4     | mytbl4_col44_fkey |             0
        10013 | ENA_LOG_TRG |             |            |                   |             1
        10013 | CTRL+DBLINK |             |            |                   |             6
(89 rows)

-----------------------------
-- Step 12 : tests snaps and script generation functions
-----------------------------
-- first add some updates for tables with unusual types (arrays, geometric)
set search_path=public,myschema2;
insert into myTbl5 values (10,'{"abc","def","ghi"}','{1,2,3}',NULL,'{}');
insert into myTbl5 values (20,array['abc','def','ghi'],array[3,4,5],array['2000/02/01'::date,'2000/02/28'::date],'{"id":1000, "c1":"abc"}');
update myTbl5 set col54 = '{"2010/11/28","2010/12/03"}', col55 = '{"id":1001, "c2":"def"}' where col54 is null;
insert into myTbl6 select i+10, point(i,1.3), '((0,0),(2,2))', circle(point(5,5),i),'((-2,-2),(3,0),(1,4))','10.20.30.40/27' from generate_series (1,8) as i;
update myTbl6 set col64 = '<(5,6),3.5>', col65 = null where col61 <= 13;
-- reset directory for snaps
\! rm -Rf /tmp/emaj_test/snaps
\! mkdir /tmp/emaj_test/snaps
mkdir: cannot create directory ‘/tmp/emaj_test/snaps’: No such file or directory
-- ... and snap the all groups
select emaj.emaj_snap_group('myGroup1','/tmp/emaj_test/snaps','CSV HEADER');
ERROR:  could not open file "/tmp/emaj_test/snaps/myschema1_myTbl3_col31_seq.snap" for writing: No such file or directory
CONTEXT:  SQL statement "COPY (SELECT sequence_name, last_value, start_value, increment_by, max_value, min_value, cache_value, is_cycled, is_called FROM myschema1."myTbl3_col31_seq") TO '/tmp/emaj_test/snaps/myschema1_myTbl3_col31_seq.snap' CSV HEADER"
PL/pgSQL function emaj.emaj_snap_group(text,text,text) line 90 at EXECUTE
select emaj.emaj_snap_group('myGroup2','/tmp/emaj_test/snaps','CSV HEADER');
ERROR:  could not open file "/tmp/emaj_test/snaps/myschema2_myseq1.snap" for writing: No such file or directory
CONTEXT:  SQL statement "COPY (SELECT sequence_name, last_value, start_value, increment_by, max_value, min_value, cache_value, is_cycled, is_called FROM myschema2.myseq1) TO '/tmp/emaj_test/snaps/myschema2_myseq1.snap' CSV HEADER"
PL/pgSQL function emaj.emaj_snap_group(text,text,text) line 90 at EXECUTE
select emaj.emaj_snap_group('phil''s group#3",','/tmp/emaj_test/snaps','CSV HEADER');
ERROR:  could not open file "/tmp/emaj_test/snaps/phil's schema3_myTbl2\.snap" for writing: No such file or directory
CONTEXT:  SQL statement "COPY (SELECT * FROM "phil's schema3"."myTbl2\" ORDER BY col21) TO E'/tmp/emaj_test/snaps/phil''s schema3_myTbl2\\.snap' CSV HEADER"
PL/pgSQL function emaj.emaj_snap_group(text,text,text) line 90 at EXECUTE
\! ls /tmp/emaj_test/snaps
ls: cannot access '/tmp/emaj_test/snaps': No such file or directory
-- reset directory for emaj_gen_sql_group tests
\! rm -Rf /tmp/emaj_test/sql_scripts
\! mkdir /tmp/emaj_test/sql_scripts
mkdir: cannot create directory ‘/tmp/emaj_test/sql_scripts’: No such file or directory
-- generate sql script for each active group (and check the result with detailed log statistics + number of sequences)
select emaj.emaj_gen_sql_group('myGroup1', 'Multi-1', NULL, '/tmp/emaj_test/sql_scripts/myGroup1.sql');
ERROR:  _gen_sql_groups: The file "/tmp/emaj_test/sql_scripts/myGroup1.sql" cannot be used as script output file.
CONTEXT:  SQL statement "SELECT emaj._gen_sql_groups(CASE WHEN v_groupName IS NOT NULL THEN array[v_groupName] ELSE NULL END, v_firstMark, v_lastMark, v_location, v_tblseqs)"
PL/pgSQL function emaj.emaj_gen_sql_group(text,text,text,text,text[]) line 22 at SQL statement
select coalesce(sum(stat_rows),0) + 1 as check from emaj.emaj_detailed_log_stat_group('myGroup1', 'Multi-1', NULL);
 check 
-------
     1
(1 row)

select emaj.emaj_gen_sql_group('myGroup2', 'Multi-1', NULL, '/tmp/emaj_test/sql_scripts/myGroup2.sql', array[
     'myschema2.mytbl1','myschema2.mytbl2','myschema2.myTbl3','myschema2.mytbl4',
     'myschema2.mytbl5','myschema2.mytbl6','myschema2.myseq1','myschema2.myTbl3_col31_seq']);
ERROR:  _gen_sql_groups: The file "/tmp/emaj_test/sql_scripts/myGroup2.sql" cannot be used as script output file.
CONTEXT:  SQL statement "SELECT emaj._gen_sql_groups(CASE WHEN v_groupName IS NOT NULL THEN array[v_groupName] ELSE NULL END, v_firstMark, v_lastMark, v_location, v_tblseqs)"
PL/pgSQL function emaj.emaj_gen_sql_group(text,text,text,text,text[]) line 22 at SQL statement
select sum(stat_rows) + 2 as check from emaj.emaj_detailed_log_stat_group('myGroup2', 'Multi-1', NULL);
 check 
-------
    22
(1 row)

select emaj.emaj_gen_sql_group('phil''s group#3",', 'M1_rollbackable', NULL, '/tmp/emaj_test/sql_scripts/Group3.sql');
ERROR:  _gen_sql_groups: The file "/tmp/emaj_test/sql_scripts/Group3.sql" cannot be used as script output file.
CONTEXT:  SQL statement "SELECT emaj._gen_sql_groups(CASE WHEN v_groupName IS NOT NULL THEN array[v_groupName] ELSE NULL END, v_firstMark, v_lastMark, v_location, v_tblseqs)"
PL/pgSQL function emaj.emaj_gen_sql_group(text,text,text,text,text[]) line 22 at SQL statement
select sum(stat_rows) + 1 as check from emaj.emaj_detailed_log_stat_group('phil''s group#3",', 'M1_rollbackable', NULL);
 check 
-------
    56
(1 row)

-- process \\ in script files
\! find /tmp/emaj_test/sql_scripts -name '*.sql' -type f -print0 | xargs -0 sed -i_s -s 's/\\\\/\\/g'
find: ‘/tmp/emaj_test/sql_scripts’: No such file or directory
sed: no input files
-- comment transaction commands for the need of the current test
\! find /tmp/emaj_test/sql_scripts -name '*.sql' -type f -print0 | xargs -0 sed -i -s 's/^BEGIN/--BEGIN/;s/^COMMIT/--COMMIT/'
find: ‘/tmp/emaj_test/sql_scripts’: No such file or directory
sed: no input files
-- mask timestamp in initial comment
\! find /tmp/emaj_test/sql_scripts -name '*.sql' -type f -print0 | xargs -0 sed -i -s 's/at .*$/at [ts]$/'
find: ‘/tmp/emaj_test/sql_scripts’: No such file or directory
sed: no input files
\! ls /tmp/emaj_test/sql_scripts
ls: cannot access '/tmp/emaj_test/sql_scripts': No such file or directory
-- reset directory for second set of snaps
\! rm -Rf /tmp/emaj_test/snaps2
\! mkdir /tmp/emaj_test/snaps2
mkdir: cannot create directory ‘/tmp/emaj_test/snaps2’: No such file or directory
-- in a single transaction and as superuser:
--   rollback groups, replay updates with generated scripts, snap groups again and cancel the transaction
reset role;
begin;
  select * from emaj.emaj_rollback_group('myGroup1','Multi-1',false) order by 1,2;
 rlbk_severity |            rlbk_message             
---------------+-------------------------------------
 Notice        | 0 / 5 tables effectively processed.
 Notice        | 2 sequences processed.
(2 rows)

  select * from emaj.emaj_rollback_group('myGroup2','Multi-1',false) order by 1,2;
WARNING:  _check_fk_groups: The foreign key "mytbl6_col61_fkey" on the table "myschema2.mytbl6" references the table "myschema2.mytbl7" that is outside the groups (myGroup2).
CONTEXT:  SQL statement "SELECT emaj._check_fk_groups(v_groupNames)"
PL/pgSQL function emaj._rlbk_init(text[],text,boolean,integer,boolean,boolean) line 68 at PERFORM
SQL statement "SELECT emaj._rlbk_init(v_groupNames, v_mark, v_isLoggedRlbk, 1, v_multiGroup, v_isAlterGroupAllowed)"
PL/pgSQL function emaj._rlbk_groups(text[],text,boolean,boolean,boolean) line 20 at SQL statement
PL/pgSQL function emaj.emaj_rollback_group(text,text,boolean) line 7 at RETURN QUERY
WARNING:  _check_fk_groups: The table "myschema2.mytbl6" is referenced by the foreign key "mytbl8_col81_fkey" on the table "myschema2.mytbl8" that is outside the groups (myGroup2).
CONTEXT:  SQL statement "SELECT emaj._check_fk_groups(v_groupNames)"
PL/pgSQL function emaj._rlbk_init(text[],text,boolean,integer,boolean,boolean) line 68 at PERFORM
SQL statement "SELECT emaj._rlbk_init(v_groupNames, v_mark, v_isLoggedRlbk, 1, v_multiGroup, v_isAlterGroupAllowed)"
PL/pgSQL function emaj._rlbk_groups(text[],text,boolean,boolean,boolean) line 20 at SQL statement
PL/pgSQL function emaj.emaj_rollback_group(text,text,boolean) line 7 at RETURN QUERY
 rlbk_severity |            rlbk_message             
---------------+-------------------------------------
 Notice        | 2 / 6 tables effectively processed.
 Notice        | 2 sequences processed.
(2 rows)

  select * from emaj.emaj_rollback_group('phil''s group#3",','M1_rollbackable',false) order by 1,2;
WARNING:  _check_fk_groups: The foreign key "mytbl2_col21_fkey" on the table "phil's schema3.myTbl2\" references the table "phil's schema3.mytbl4" that is outside the groups (phil's group#3",).
CONTEXT:  SQL statement "SELECT emaj._check_fk_groups(v_groupNames)"
PL/pgSQL function emaj._rlbk_init(text[],text,boolean,integer,boolean,boolean) line 68 at PERFORM
SQL statement "SELECT emaj._rlbk_init(v_groupNames, v_mark, v_isLoggedRlbk, 1, v_multiGroup, v_isAlterGroupAllowed)"
PL/pgSQL function emaj._rlbk_groups(text[],text,boolean,boolean,boolean) line 20 at SQL statement
PL/pgSQL function emaj.emaj_rollback_group(text,text,boolean) line 7 at RETURN QUERY
WARNING:  _check_fk_groups: The table "phil's schema3.phil's tbl1" is referenced by the foreign key "mytbl4_col44_fkey" on the table "phil's schema3.mytbl4" that is outside the groups (phil's group#3",).
CONTEXT:  SQL statement "SELECT emaj._check_fk_groups(v_groupNames)"
PL/pgSQL function emaj._rlbk_init(text[],text,boolean,integer,boolean,boolean) line 68 at PERFORM
SQL statement "SELECT emaj._rlbk_init(v_groupNames, v_mark, v_isLoggedRlbk, 1, v_multiGroup, v_isAlterGroupAllowed)"
PL/pgSQL function emaj._rlbk_groups(text[],text,boolean,boolean,boolean) line 20 at SQL statement
PL/pgSQL function emaj.emaj_rollback_group(text,text,boolean) line 7 at RETURN QUERY
 rlbk_severity |            rlbk_message             
---------------+-------------------------------------
 Notice        | 2 / 2 tables effectively processed.
 Notice        | 2 sequences processed.
(2 rows)

\i /tmp/emaj_test/sql_scripts/myGroup1.sql
/tmp/emaj_test/sql_scripts/myGroup1.sql: No such file or directory
\i /tmp/emaj_test/sql_scripts/myGroup2.sql
/tmp/emaj_test/sql_scripts/myGroup2.sql: No such file or directory
\i /tmp/emaj_test/sql_scripts/Group3.sql
/tmp/emaj_test/sql_scripts/Group3.sql: No such file or directory
  select emaj.emaj_snap_group('myGroup1','/tmp/emaj_test/snaps2','CSV HEADER');
ERROR:  could not open file "/tmp/emaj_test/snaps2/myschema1_myTbl3_col31_seq.snap" for writing: No such file or directory
CONTEXT:  SQL statement "COPY (SELECT sequence_name, last_value, start_value, increment_by, max_value, min_value, cache_value, is_cycled, is_called FROM myschema1."myTbl3_col31_seq") TO '/tmp/emaj_test/snaps2/myschema1_myTbl3_col31_seq.snap' CSV HEADER"
PL/pgSQL function emaj.emaj_snap_group(text,text,text) line 90 at EXECUTE
  select emaj.emaj_snap_group('myGroup2','/tmp/emaj_test/snaps2','CSV HEADER');
ERROR:  current transaction is aborted, commands ignored until end of transaction block
  select emaj.emaj_snap_group('phil''s group#3",','/tmp/emaj_test/snaps2','CSV HEADER');
ERROR:  current transaction is aborted, commands ignored until end of transaction block
rollback;
-- mask timestamp in _INFO files
\! sed -i_s -s 's/at .*/at [ts]/' /tmp/emaj_test/snaps/_INFO /tmp/emaj_test/snaps2/_INFO
sed: can't read /tmp/emaj_test/snaps/_INFO: No such file or directory
sed: can't read /tmp/emaj_test/snaps2/_INFO: No such file or directory
-- and compare both snaps sets
-- sequences are detected as different because of :
-- - the effect of RESTART on is_called and next_val attributes
-- - internal log_cnt value being reset
\! diff --exclude _INFO_s /tmp/emaj_test/snaps /tmp/emaj_test/snaps2
diff: /tmp/emaj_test/snaps: No such file or directory
diff: /tmp/emaj_test/snaps2: No such file or directory
set role emaj_regression_tests_adm_user;
-----------------------------
-- Step 12 : test use of a table with a very long name (63 characters long)
-----------------------------
select emaj.emaj_stop_group('phil''s group#3",');
 emaj_stop_group 
-----------------
               4
(1 row)

-- rename the "phil's tbl1" table and alter its group
reset role;
alter table "phil's schema3"."phil's tbl1" rename to table_with_very_looooooooooooooooooooooooooooooooooooooong_name;
set role emaj_regression_tests_adm_user;
update emaj.emaj_group_def set grpdef_tblseq = 'table_with_very_looooooooooooooooooooooooooooooooooooooong_name', grpdef_emaj_names_prefix = 'short' where grpdef_schema = 'phil''s schema3' and grpdef_tblseq = 'phil''s tbl1';
select emaj.emaj_alter_group('phil''s group#3",');
NOTICE:  drop cascades to trigger emaj_log_trg on table "phil's schema3".table_with_very_looooooooooooooooooooooooooooooooooooooong_name
CONTEXT:  SQL statement "DROP FUNCTION IF EXISTS "emaj #'3"."phil's schema3_phil's tbl1_log_fnct"() CASCADE"
PL/pgSQL function emaj._drop_tbl(emaj.emaj_relation) line 19 at EXECUTE
SQL statement "SELECT emaj._drop_tbl(emaj.emaj_relation.*) FROM emaj.emaj_relation
        WHERE rel_schema = r_plan.altr_schema AND rel_tblseq = r_plan.altr_tblseq AND upper_inf(rel_time_range)"
PL/pgSQL function emaj._remove_tbl(emaj.emaj_alter_plan,bigint) line 18 at PERFORM
SQL statement "SELECT emaj._remove_tbl(r_plan, v_timeId)"
PL/pgSQL function emaj._alter_exec(bigint) line 25 at PERFORM
SQL statement "SELECT emaj._alter_exec(v_timeId)"
PL/pgSQL function emaj._alter_groups(text[],boolean,text) line 49 at PERFORM
PL/pgSQL function emaj.emaj_alter_group(text,text) line 6 at RETURN
NOTICE:  table "short_log" does not exist, skipping
CONTEXT:  SQL statement "DROP TABLE IF EXISTS "emaj #'3".short_log"
PL/pgSQL function emaj._create_tbl(emaj.emaj_group_def,bigint,boolean) line 66 at EXECUTE
SQL statement "SELECT emaj._create_tbl(r_grpdef, v_timeId, v_isRollbackable)"
PL/pgSQL function emaj._alter_exec(bigint) line 129 at PERFORM
SQL statement "SELECT emaj._alter_exec(v_timeId)"
PL/pgSQL function emaj._alter_groups(text[],boolean,text) line 49 at PERFORM
PL/pgSQL function emaj.emaj_alter_group(text,text) line 6 at RETURN
NOTICE:  trigger "emaj_log_trg" for relation "phil's schema3.table_with_very_looooooooooooooooooooooooooooooooooooooong_name" does not exist, skipping
CONTEXT:  SQL statement "DROP TRIGGER IF EXISTS emaj_log_trg ON "phil's schema3".table_with_very_looooooooooooooooooooooooooooooooooooooong_name"
PL/pgSQL function emaj._create_tbl(emaj.emaj_group_def,bigint,boolean) line 120 at EXECUTE
SQL statement "SELECT emaj._create_tbl(r_grpdef, v_timeId, v_isRollbackable)"
PL/pgSQL function emaj._alter_exec(bigint) line 129 at PERFORM
SQL statement "SELECT emaj._alter_exec(v_timeId)"
PL/pgSQL function emaj._alter_groups(text[],boolean,text) line 49 at PERFORM
PL/pgSQL function emaj.emaj_alter_group(text,text) line 6 at RETURN
WARNING:  _check_fk_groups: The foreign key "mytbl2_col21_fkey" on the table "phil's schema3.myTbl2\" references the table "phil's schema3.mytbl4" that is outside the groups (phil's group#3",).
CONTEXT:  SQL statement "SELECT emaj._check_fk_groups(v_groupNames)"
PL/pgSQL function emaj._alter_groups(text[],boolean,text) line 61 at PERFORM
PL/pgSQL function emaj.emaj_alter_group(text,text) line 6 at RETURN
WARNING:  _check_fk_groups: The table "phil's schema3.table_with_very_looooooooooooooooooooooooooooooooooooooong_name" is referenced by the foreign key "mytbl4_col44_fkey" on the table "phil's schema3.mytbl4" that is outside the groups (phil's group#3",).
CONTEXT:  SQL statement "SELECT emaj._check_fk_groups(v_groupNames)"
PL/pgSQL function emaj._alter_groups(text[],boolean,text) line 61 at PERFORM
PL/pgSQL function emaj.emaj_alter_group(text,text) line 6 at RETURN
 emaj_alter_group 
------------------
                4
(1 row)

-- use the table and its group
select emaj.emaj_start_group('phil''s group#3",','M1_after_alter_group');
WARNING:  _check_fk_groups: The foreign key "mytbl2_col21_fkey" on the table "phil's schema3.myTbl2\" references the table "phil's schema3.mytbl4" that is outside the groups (phil's group#3",).
CONTEXT:  SQL statement "SELECT emaj._check_fk_groups(v_groupNames)"
PL/pgSQL function emaj._start_groups(text[],text,boolean,boolean) line 37 at PERFORM
SQL statement "SELECT emaj._start_groups(array[v_groupName], v_mark, false, v_resetLog)"
PL/pgSQL function emaj.emaj_start_group(text,text,boolean) line 17 at SQL statement
WARNING:  _check_fk_groups: The table "phil's schema3.table_with_very_looooooooooooooooooooooooooooooooooooooong_name" is referenced by the foreign key "mytbl4_col44_fkey" on the table "phil's schema3.mytbl4" that is outside the groups (phil's group#3",).
CONTEXT:  SQL statement "SELECT emaj._check_fk_groups(v_groupNames)"
PL/pgSQL function emaj._start_groups(text[],text,boolean,boolean) line 37 at PERFORM
SQL statement "SELECT emaj._start_groups(array[v_groupName], v_mark, false, v_resetLog)"
PL/pgSQL function emaj.emaj_start_group(text,text,boolean) line 17 at SQL statement
 emaj_start_group 
------------------
                4
(1 row)

update "phil's schema3".table_with_very_looooooooooooooooooooooooooooooooooooooong_name set "phil's col12" = 'GHI' where "phil's col11" between 6 and 9;
select emaj.emaj_set_mark_group('phil''s group#3",','M2');
 emaj_set_mark_group 
---------------------
                   4
(1 row)

delete from "phil's schema3".table_with_very_looooooooooooooooooooooooooooooooooooooong_name where "phil's col11" > 18;
select * from emaj.emaj_rollback_group('phil''s group#3",','M1_after_alter_group',false) order by 1,2;
WARNING:  _check_fk_groups: The foreign key "mytbl2_col21_fkey" on the table "phil's schema3.myTbl2\" references the table "phil's schema3.mytbl4" that is outside the groups (phil's group#3",).
CONTEXT:  SQL statement "SELECT emaj._check_fk_groups(v_groupNames)"
PL/pgSQL function emaj._rlbk_init(text[],text,boolean,integer,boolean,boolean) line 68 at PERFORM
SQL statement "SELECT emaj._rlbk_init(v_groupNames, v_mark, v_isLoggedRlbk, 1, v_multiGroup, v_isAlterGroupAllowed)"
PL/pgSQL function emaj._rlbk_groups(text[],text,boolean,boolean,boolean) line 20 at SQL statement
PL/pgSQL function emaj.emaj_rollback_group(text,text,boolean) line 7 at RETURN QUERY
WARNING:  _check_fk_groups: The table "phil's schema3.table_with_very_looooooooooooooooooooooooooooooooooooooong_name" is referenced by the foreign key "mytbl4_col44_fkey" on the table "phil's schema3.mytbl4" that is outside the groups (phil's group#3",).
CONTEXT:  SQL statement "SELECT emaj._check_fk_groups(v_groupNames)"
PL/pgSQL function emaj._rlbk_init(text[],text,boolean,integer,boolean,boolean) line 68 at PERFORM
SQL statement "SELECT emaj._rlbk_init(v_groupNames, v_mark, v_isLoggedRlbk, 1, v_multiGroup, v_isAlterGroupAllowed)"
PL/pgSQL function emaj._rlbk_groups(text[],text,boolean,boolean,boolean) line 20 at SQL statement
PL/pgSQL function emaj.emaj_rollback_group(text,text,boolean) line 7 at RETURN QUERY
 rlbk_severity |            rlbk_message             
---------------+-------------------------------------
 Notice        | 1 / 2 tables effectively processed.
 Notice        | 2 sequences processed.
(2 rows)

select emaj.emaj_stop_group('phil''s group#3",');
 emaj_stop_group 
-----------------
               4
(1 row)

select emaj.emaj_drop_group('phil''s group#3",');
 emaj_drop_group 
-----------------
               4
(1 row)

-----------------------------
-- Step 13 : test use of groups or marks protection
-----------------------------
-- try to rollback a protected group
select emaj.emaj_protect_group('myGroup2');
 emaj_protect_group 
--------------------
                  1
(1 row)

select * from emaj.emaj_rollback_group('myGroup2','M3',false) order by 1,2;
ERROR:  _rlbk_check: The group "myGroup2" is currently protected against rollback.
CONTEXT:  SQL statement "SELECT emaj._rlbk_check(v_groupNames, v_mark, v_isAlterGroupAllowed, FALSE)"
PL/pgSQL function emaj._rlbk_init(text[],text,boolean,integer,boolean,boolean) line 24 at SQL statement
SQL statement "SELECT emaj._rlbk_init(v_groupNames, v_mark, v_isLoggedRlbk, 1, v_multiGroup, v_isAlterGroupAllowed)"
PL/pgSQL function emaj._rlbk_groups(text[],text,boolean,boolean,boolean) line 20 at SQL statement
PL/pgSQL function emaj.emaj_rollback_group(text,text,boolean) line 7 at RETURN QUERY
select emaj.emaj_unprotect_group('myGroup2');
 emaj_unprotect_group 
----------------------
                    1
(1 row)

-- try to rollback over a protected mark
select emaj.emaj_set_mark_group('myGroup1','Mark_to_protect');
 emaj_set_mark_group 
---------------------
                   7
(1 row)

select emaj.emaj_protect_mark_group('myGroup1','Mark_to_protect');
 emaj_protect_mark_group 
-------------------------
                       1
(1 row)

select * from emaj.emaj_rollback_group('myGroup1','Multi-1',false) order by 1,2;
ERROR:  _rlbk_check: Protected marks (Mark_to_protect) for group "myGroup1" block the rollback to the mark "Multi-1".
CONTEXT:  SQL statement "SELECT emaj._rlbk_check(v_groupNames, v_mark, v_isAlterGroupAllowed, FALSE)"
PL/pgSQL function emaj._rlbk_init(text[],text,boolean,integer,boolean,boolean) line 24 at SQL statement
SQL statement "SELECT emaj._rlbk_init(v_groupNames, v_mark, v_isLoggedRlbk, 1, v_multiGroup, v_isAlterGroupAllowed)"
PL/pgSQL function emaj._rlbk_groups(text[],text,boolean,boolean,boolean) line 20 at SQL statement
PL/pgSQL function emaj.emaj_rollback_group(text,text,boolean) line 7 at RETURN QUERY
select emaj.emaj_unprotect_mark_group('myGroup1','Mark_to_protect');
 emaj_unprotect_mark_group 
---------------------------
                         1
(1 row)

select emaj.emaj_delete_mark_group('myGroup1','Mark_to_protect');
 emaj_delete_mark_group 
------------------------
                      1
(1 row)

-----------------------------
-- Step 14 : test complex use of rollbacks consolidations
-----------------------------
set search_path=public,myschema1;
-- 2 consolidations of 2 logged rollbacks
-- Multi-1 MC1 MC2 RMC1S RMC1D      MC3 MC4 MC5 RMC3S RMC3D
--         ^       lrg(MC1)         ^           lrg(MC3)
--         xxxxxxxxxxxxxxx conso(RMC1D)
-- 	       	                        xxxxxxxxxxxxxxxxxxx conso(RMC3D)
select emaj.emaj_set_mark_group('myGroup1','MC1');
 emaj_set_mark_group 
---------------------
                   7
(1 row)

insert into myTbl1 select i, 'Test', 'Conso' from generate_series (2000,2012) as i;
insert into myTbl2 values (2000,'TC1',NULL);
delete from myTbl1 where col11 > 2010;
select emaj.emaj_set_mark_group('myGroup1','MC2');
 emaj_set_mark_group 
---------------------
                   7
(1 row)

update myTbl2 set col22 = 'TC2' WHERE col22 ='TC1';
select * from emaj.emaj_logged_rollback_group('myGroup1','MC1',false) order by 1,2;
 rlbk_severity |            rlbk_message             
---------------+-------------------------------------
 Notice        | 2 / 5 tables effectively processed.
 Notice        | 2 sequences processed.
(2 rows)

insert into myTbl2 values (2000,'TC3',NULL);
select emaj.emaj_rename_mark_group('myGroup1','EMAJ_LAST_MARK','RLBK_MC1_DONE');
 emaj_rename_mark_group 
------------------------
 
(1 row)

select emaj.emaj_set_mark_group('myGroup1','MC3');
 emaj_set_mark_group 
---------------------
                   7
(1 row)

insert into "myTbl3" (col33) select generate_series(2000,2039,4)/100;
insert into myTbl4 values (2000,'FK...',1,10,'ABC');
update myTbl4 set col43 = NULL where col41 = 2000;
select emaj.emaj_set_mark_group('myGroup1','MC4');
 emaj_set_mark_group 
---------------------
                   7
(1 row)

select emaj.emaj_set_mark_group('myGroup1','MC5');
 emaj_set_mark_group 
---------------------
                   7
(1 row)

select * from emaj.emaj_logged_rollback_group('myGroup1','MC3',false) order by 1,2;
 rlbk_severity |            rlbk_message             
---------------+-------------------------------------
 Notice        | 2 / 5 tables effectively processed.
 Notice        | 2 sequences processed.
(2 rows)

select cons_group, regexp_replace(cons_end_rlbk_mark_name,E'\\d\\d\.\\d\\d\\.\\d\\d\\.\\d\\d\\d','%','g'), 
       cons_target_rlbk_mark_name, cons_end_rlbk_mark_id, cons_target_rlbk_mark_id, cons_rows, cons_marks, cons_marks
  from emaj.emaj_get_consolidable_rollbacks();
 cons_group | regexp_replace  | cons_target_rlbk_mark_name | cons_end_rlbk_mark_id | cons_target_rlbk_mark_id | cons_rows | cons_marks | cons_marks 
------------+-----------------+----------------------------+-----------------------+--------------------------+-----------+------------+------------
 myGroup1   | RLBK_MC1_DONE   | MC1                        |                 10050 |                    10047 |        29 |          2 |          2
 myGroup1   | RLBK_MC3_%_DONE | MC3                        |                 10055 |                    10051 |        23 |          3 |          3
(2 rows)

-- consolidate both logged rollback at once
select cons_target_rlbk_mark_name, regexp_replace(cons_end_rlbk_mark_name,E'\\d\\d\.\\d\\d\\.\\d\\d\\.\\d\\d\\d','%','g'), 
       emaj.emaj_consolidate_rollback_group(cons_group, cons_end_rlbk_mark_name)
  from emaj.emaj_get_consolidable_rollbacks() where cons_group = 'myGroup1';
 cons_target_rlbk_mark_name | regexp_replace  | emaj_consolidate_rollback_group 
----------------------------+-----------------+---------------------------------
 MC1                        | RLBK_MC1_DONE   |                               4
 MC3                        | RLBK_MC3_%_DONE |                               4
(2 rows)

select cons_group, regexp_replace(cons_end_rlbk_mark_name,E'\\d\\d\.\\d\\d\\.\\d\\d\\.\\d\\d\\d','%','g'), 
       cons_target_rlbk_mark_name, cons_end_rlbk_mark_id, cons_target_rlbk_mark_id, cons_rows, cons_marks
  from emaj.emaj_get_consolidable_rollbacks();
 cons_group | regexp_replace  | cons_target_rlbk_mark_name | cons_end_rlbk_mark_id | cons_target_rlbk_mark_id | cons_rows | cons_marks 
------------+-----------------+----------------------------+-----------------------+--------------------------+-----------+------------
 myGroup1   | RLBK_MC1_DONE   | MC1                        |                 10050 |                    10047 |         0 |          0
 myGroup1   | RLBK_MC3_%_DONE | MC3                        |                 10055 |                    10051 |         0 |          0
(2 rows)

select * from emaj.emaj_detailed_log_stat_group('myGroup1','Multi-1',NULL);
 stat_group | stat_schema | stat_table | stat_role | stat_verb | stat_rows 
------------+-------------+------------+-----------+-----------+-----------
 myGroup1   | myschema1   | mytbl2     | postgres  | INSERT    |         1
(1 row)

-- 2 consolidations of 2 nested logged rollbacks
-- MC6 MC7 MC8  RMC8S RMC8D M9 RMC6S RMC6D
--         ^    lrg(MC8)
--         xxxxxxxxxxxx conso(RMC8D)
-- ^                           lrb(MC6)
-- xxxxxxxxxxxxxxxxxxxxxxxxxxxxxxxxxxx conso(RMC6D)
select emaj.emaj_set_mark_group('myGroup1','MC6');
 emaj_set_mark_group 
---------------------
                   7
(1 row)

insert into myTbl1 select i, 'Test', 'Conso' from generate_series (2000,2012) as i;
insert into myTbl2 values (3000,'TC6',NULL);
delete from myTbl1 where col11 > 2010;
select emaj.emaj_set_mark_group('myGroup1','MC7');
 emaj_set_mark_group 
---------------------
                   7
(1 row)

update myTbl2 set col22 = 'TC7' WHERE col22 ='TC6';
select emaj.emaj_set_mark_group('myGroup1','MC8');
 emaj_set_mark_group 
---------------------
                   7
(1 row)

insert into myTbl2 values (3001,'TC8',NULL);
select * from emaj.emaj_logged_rollback_group('myGroup1','MC8',false) order by 1,2;
 rlbk_severity |            rlbk_message             
---------------+-------------------------------------
 Notice        | 1 / 5 tables effectively processed.
 Notice        | 2 sequences processed.
(2 rows)

select emaj.emaj_consolidate_rollback_group('myGroup1','EMAJ_LAST_MARK');
 emaj_consolidate_rollback_group 
---------------------------------
                               3
(1 row)

select emaj.emaj_set_mark_group('myGroup1','MC9');
 emaj_set_mark_group 
---------------------
                   7
(1 row)

insert into "myTbl3" (col33) select generate_series(2000,2039,4)/100;
insert into myTbl4 values (2000,'FK...',1,10,'ABC');
update myTbl4 set col43 = NULL where col41 = 2000;
select * from emaj.emaj_logged_rollback_group('myGroup1','MC6',false) order by 1,2;
 rlbk_severity |            rlbk_message             
---------------+-------------------------------------
 Notice        | 2 sequences processed.
 Notice        | 4 / 5 tables effectively processed.
(2 rows)

select emaj.emaj_consolidate_rollback_group('myGroup1','EMAJ_LAST_MARK');
 emaj_consolidate_rollback_group 
---------------------------------
                               6
(1 row)

select * from emaj.emaj_detailed_log_stat_group('myGroup1','Multi-1',NULL);
 stat_group | stat_schema | stat_table | stat_role | stat_verb | stat_rows 
------------+-------------+------------+-----------+-----------+-----------
 myGroup1   | myschema1   | mytbl2     | postgres  | INSERT    |         1
(1 row)

-- consolidation of 2 logged rollbacks referencing the same mark
-- MC10  RMC10S RMC10D M11 RMC10S RMC10D
-- ^     lrg(MC10)
-- ^                       lrb(MC10)
-- xxxxxxxxxxxxxxxxxxxxxxxxxxxxxxx conso(RMC10D)
select emaj.emaj_set_mark_group('myGroup1','MC10');
 emaj_set_mark_group 
---------------------
                   7
(1 row)

insert into myTbl1 select i, 'Test', 'Conso' from generate_series (3000,3010) as i;
delete from myTbl1 where col11 > 3005;
select * from emaj.emaj_logged_rollback_group('myGroup1','MC10',false) order by 1,2;
 rlbk_severity |            rlbk_message             
---------------+-------------------------------------
 Notice        | 1 / 5 tables effectively processed.
 Notice        | 2 sequences processed.
(2 rows)

update myTbl2 set col22 = 'TC7' WHERE col22 ='TC6';
select emaj.emaj_set_mark_group('myGroup1','MC11');
 emaj_set_mark_group 
---------------------
                   7
(1 row)

insert into myTbl4 values (3000,'FK...',1,10,'ABC');
update myTbl4 set col43 = NULL where col41 = 3000;
select * from emaj.emaj_logged_rollback_group('myGroup1','MC10',false) order by 1,2;
 rlbk_severity |            rlbk_message             
---------------+-------------------------------------
 Notice        | 2 / 5 tables effectively processed.
 Notice        | 2 sequences processed.
(2 rows)

select emaj.emaj_consolidate_rollback_group('myGroup1','EMAJ_LAST_MARK');
 emaj_consolidate_rollback_group 
---------------------------------
                               4
(1 row)

select * from emaj.emaj_detailed_log_stat_group('myGroup1','Multi-1',NULL);
 stat_group | stat_schema | stat_table | stat_role | stat_verb | stat_rows 
------------+-------------+------------+-----------+-----------+-----------
 myGroup1   | myschema1   | mytbl2     | postgres  | INSERT    |         1
(1 row)

-- consolidation of 1 from 2 overlapping logged rollbacks
-- MC15 MC16 RMC15S RMC15D MC17 RMC16S RMC16D
-- ^         lrg(MC15)
--      ^                       lrg(MC16)
-- xxxxxxxxxxxxxxxxx conso(RMC15D)
select emaj.emaj_set_mark_group('myGroup1','MC15');
 emaj_set_mark_group 
---------------------
                   7
(1 row)

insert into myTbl1 select i, 'Test', 'Conso' from generate_series (4000,4012) as i;
insert into myTbl2 values (4000,'TC15',NULL);
delete from myTbl1 where col11 > 4010;
select emaj.emaj_set_mark_group('myGroup1','MC16');
 emaj_set_mark_group 
---------------------
                   7
(1 row)

update myTbl2 set col22 = 'TC16' WHERE col22 ='TC15';
select * from emaj.emaj_logged_rollback_group('myGroup1','MC15',false) order by 1,2;
 rlbk_severity |            rlbk_message             
---------------+-------------------------------------
 Notice        | 2 / 5 tables effectively processed.
 Notice        | 2 sequences processed.
(2 rows)

select emaj.emaj_rename_mark_group('myGroup1','EMAJ_LAST_MARK','RLBK_MC15_DONE');
 emaj_rename_mark_group 
------------------------
 
(1 row)

select emaj.emaj_set_mark_group('myGroup1','MC17');
 emaj_set_mark_group 
---------------------
                   7
(1 row)

insert into myTbl2 values (4001,'TC15',NULL);
select * from emaj.emaj_logged_rollback_group('myGroup1','MC16',false) order by 1,2;
 rlbk_severity |            rlbk_message             
---------------+-------------------------------------
 Notice        | 2 / 5 tables effectively processed.
 Notice        | 2 sequences processed.
(2 rows)

select emaj.emaj_consolidate_rollback_group('myGroup1','RLBK_MC15_DONE');
 emaj_consolidate_rollback_group 
---------------------------------
                               4
(1 row)

select * from emaj.emaj_detailed_log_stat_group('myGroup1','Multi-1',NULL);
 stat_group | stat_schema | stat_table | stat_role | stat_verb | stat_rows 
------------+-------------+------------+-----------+-----------+-----------
 myGroup1   | myschema1   | mytbl1     | postgres  | INSERT    |        11
 myGroup1   | myschema1   | mytbl2     | postgres  | DELETE    |         1
 myGroup1   | myschema1   | mytbl2     | postgres  | INSERT    |         3
(3 rows)

select * from myTbl1 order by col11;
 col11 |   col12    |    col13     
-------+------------+--------------
     2 | ABC        | \x1c
     3 | ABC        | \x1c
     4 | ABC        | \x0c
     5 | ABC        | \x0c
     6 | ABC        | \x0c
     7 | ABC        | \x0c
     8 | ABC        | \x0c
     9 | ABC        | \x0c
    10 | ABC        | \x0c
   100 | DEF        | \x00
   101 | DEF        | \x00
   102 | DEF        | \x00
   103 | DEF        | \x00
   104 | DEF        | \x00
   105 | DEF        | \x00
   106 | DEF        | \x00
   107 | DEF        | \x00
   108 | DEF        | \x00
   109 | DEF        | \x00
   110 | DEF        | \x00
  4000 | Test       | \x436f6e736f
  4001 | Test       | \x436f6e736f
  4002 | Test       | \x436f6e736f
  4003 | Test       | \x436f6e736f
  4004 | Test       | \x436f6e736f
  4005 | Test       | \x436f6e736f
  4006 | Test       | \x436f6e736f
  4007 | Test       | \x436f6e736f
  4008 | Test       | \x436f6e736f
  4009 | Test       | \x436f6e736f
  4010 | Test       | \x436f6e736f
(31 rows)

select * from myTbl2 order by col21;
 col21 | col22 |   col23    
-------+-------+------------
     1 | ABC   | 12-31-2010
     2 | DEF   | 
     3 | GHI   | 01-02-2010
  2000 | TC3   | 
  4000 | TC15  | 
(5 rows)

select mark_id, mark_group, regexp_replace(mark_name,E'\\d\\d\.\\d\\d\\.\\d\\d\\.\\d\\d\\d','%','g'), mark_time_id, mark_is_deleted, mark_is_rlbk_protected, mark_comment, mark_log_rows_before_next, mark_logged_rlbk_target_mark from emaj.emaj_mark where mark_group = 'myGroup1' order by mark_id;
 mark_id | mark_group |        regexp_replace        | mark_time_id | mark_is_deleted | mark_is_rlbk_protected | mark_comment | mark_log_rows_before_next | mark_logged_rlbk_target_mark 
---------+------------+------------------------------+--------------+-----------------+------------------------+--------------+---------------------------+------------------------------
   10011 | myGroup1   | M4                           |        10014 | t               | f                      |              |                        10 | 
   10012 | myGroup1   | M5                           |        10015 | t               | f                      |              |                         3 | 
   10016 | myGroup1   | Before logged rollback to M4 |        10021 | t               | f                      |              |                        28 | 
   10018 | myGroup1   | STOP_%                       |        10023 | t               | f                      |              |                         0 | 
   10028 | myGroup1   | Stop after rollback          |        10030 | t               | f                      |              |                         0 | 
   10030 | myGroup1   | Multi-1                      |        10031 | f               | f                      |              |                         0 | 
   10047 | myGroup1   | MC1                          |        10059 | f               | f                      |              |                         0 | 
   10050 | myGroup1   | RLBK_MC1_DONE                |        10062 | f               | f                      |              |                         1 | MC1
   10051 | myGroup1   | MC3                          |        10063 | f               | f                      |              |                         0 | 
   10055 | myGroup1   | RLBK_MC3_%_DONE              |        10067 | f               | f                      |              |                         0 | MC3
   10056 | myGroup1   | MC6                          |        10068 | f               | f                      |              |                         0 | 
   10063 | myGroup1   | RLBK_MC6_%_DONE              |        10075 | f               | f                      |              |                         0 | MC6
   10064 | myGroup1   | MC10                         |        10076 | f               | f                      |              |                         0 | 
   10069 | myGroup1   | RLBK_MC10_%_DONE             |        10081 | f               | f                      |              |                         0 | MC10
   10070 | myGroup1   | MC15                         |        10082 | f               | f                      |              |                         0 | 
   10073 | myGroup1   | RLBK_MC15_DONE               |        10085 | f               | f                      |              |                         0 | MC15
   10074 | myGroup1   | MC17                         |        10086 | f               | f                      |              |                         1 | 
   10075 | myGroup1   | RLBK_MC16_%_START            |        10087 | f               | f                      |              |                        13 | 
   10076 | myGroup1   | RLBK_MC16_%_DONE             |        10088 | f               | f                      |              |                           | 
(19 rows)

select sequ_schema, sequ_name, sequ_time_id, sequ_last_val, sequ_is_called from emaj.emaj_sequence where sequ_name like 'myschema1%' order by sequ_time_id, sequ_schema, sequ_name;
 sequ_schema |         sequ_name         | sequ_time_id | sequ_last_val | sequ_is_called 
-------------+---------------------------+--------------+---------------+----------------
 emaj        | myschema1_mytbl1_log_seq  |        10014 |            30 | t
 emaj        | myschema1_mytbl2_log_seq  |        10014 |             3 | t
 emaj        | myschema1_mytbl4_log_seq  |        10014 |             8 | t
 emajb       | myschema1_mytbl2b_log_seq |        10014 |             1 | f
 emajC       | myschema1_myTbl3_log_seq  |        10014 |            10 | t
 emaj        | myschema1_mytbl1_log_seq  |        10015 |            30 | t
 emaj        | myschema1_mytbl2_log_seq  |        10015 |             3 | t
 emaj        | myschema1_mytbl4_log_seq  |        10015 |             8 | t
 emajb       | myschema1_mytbl2b_log_seq |        10015 |             1 | f
 emajC       | myschema1_myTbl3_log_seq  |        10015 |            20 | t
 emaj        | myschema1_mytbl1_log_seq  |        10021 |            32 | t
 emaj        | myschema1_mytbl2_log_seq  |        10021 |             3 | t
 emaj        | myschema1_mytbl4_log_seq  |        10021 |            12 | t
 emajb       | myschema1_mytbl2b_log_seq |        10021 |             1 | f
 emajC       | myschema1_myTbl3_log_seq  |        10021 |            20 | t
 emaj        | myschema1_mytbl1_log_seq  |        10023 |            33 | t
 emaj        | myschema1_mytbl2_log_seq  |        10023 |             3 | t
 emaj        | myschema1_mytbl4_log_seq  |        10023 |            14 | t
 emajb       | myschema1_mytbl2b_log_seq |        10023 |             1 | f
 emajC       | myschema1_myTbl3_log_seq  |        10023 |            45 | t
 emaj        | myschema1_mytbl1_log_seq  |        10030 |            33 | t
 emaj        | myschema1_mytbl2_log_seq  |        10030 |             3 | t
 emaj        | myschema1_mytbl4_log_seq  |        10030 |            14 | t
 emajb       | myschema1_mytbl2b_log_seq |        10030 |             1 | f
 emajC       | myschema1_myTbl3_log_seq  |        10030 |            45 | t
 emaj        | myschema1_mytbl1_log_seq  |        10031 |            33 | t
 emaj        | myschema1_mytbl2_log_seq  |        10031 |             3 | t
 emaj        | myschema1_mytbl4_log_seq  |        10031 |            14 | t
 emajb       | myschema1_mytbl2b_log_seq |        10031 |             1 | f
 emajC       | myschema1_myTbl3_log_seq  |        10031 |            45 | t
 emaj        | myschema1_mytbl1_log_seq  |        10059 |            53 | t
 emaj        | myschema1_mytbl2_log_seq  |        10059 |             3 | t
 emaj        | myschema1_mytbl4_log_seq  |        10059 |            14 | t
 emajb       | myschema1_mytbl2b_log_seq |        10059 |             1 | f
 emajC       | myschema1_myTbl3_log_seq  |        10059 |            45 | t
 emaj        | myschema1_mytbl1_log_seq  |        10062 |            79 | t
 emaj        | myschema1_mytbl2_log_seq  |        10062 |             6 | t
 emaj        | myschema1_mytbl4_log_seq  |        10062 |            14 | t
 emajb       | myschema1_mytbl2b_log_seq |        10062 |             1 | f
 emajC       | myschema1_myTbl3_log_seq  |        10062 |            45 | t
 emaj        | myschema1_mytbl1_log_seq  |        10063 |            79 | t
 emaj        | myschema1_mytbl2_log_seq  |        10063 |             7 | t
 emaj        | myschema1_mytbl4_log_seq  |        10063 |            14 | t
 emajb       | myschema1_mytbl2b_log_seq |        10063 |             1 | f
 emajC       | myschema1_myTbl3_log_seq  |        10063 |            45 | t
 emaj        | myschema1_mytbl1_log_seq  |        10067 |            79 | t
 emaj        | myschema1_mytbl2_log_seq  |        10067 |             7 | t
 emaj        | myschema1_mytbl4_log_seq  |        10067 |            17 | t
 emajb       | myschema1_mytbl2b_log_seq |        10067 |             1 | f
 emajC       | myschema1_myTbl3_log_seq  |        10067 |            65 | t
 emaj        | myschema1_mytbl1_log_seq  |        10068 |            79 | t
 emaj        | myschema1_mytbl2_log_seq  |        10068 |             7 | t
 emaj        | myschema1_mytbl4_log_seq  |        10068 |            17 | t
 emajb       | myschema1_mytbl2b_log_seq |        10068 |             1 | f
 emajC       | myschema1_myTbl3_log_seq  |        10068 |            65 | t
 emaj        | myschema1_mytbl1_log_seq  |        10075 |           105 | t
 emaj        | myschema1_mytbl2_log_seq  |        10075 |            12 | t
 emaj        | myschema1_mytbl4_log_seq  |        10075 |            20 | t
 emajb       | myschema1_mytbl2b_log_seq |        10075 |             1 | f
 emajC       | myschema1_myTbl3_log_seq  |        10075 |            85 | t
 emaj        | myschema1_mytbl1_log_seq  |        10076 |           105 | t
 emaj        | myschema1_mytbl2_log_seq  |        10076 |            12 | t
 emaj        | myschema1_mytbl4_log_seq  |        10076 |            20 | t
 emajb       | myschema1_mytbl2b_log_seq |        10076 |             1 | f
 emajC       | myschema1_myTbl3_log_seq  |        10076 |            85 | t
 emaj        | myschema1_mytbl1_log_seq  |        10081 |           127 | t
 emaj        | myschema1_mytbl2_log_seq  |        10081 |            12 | t
 emaj        | myschema1_mytbl4_log_seq  |        10081 |            23 | t
 emajb       | myschema1_mytbl2b_log_seq |        10081 |             1 | f
 emajC       | myschema1_myTbl3_log_seq  |        10081 |            85 | t
 emaj        | myschema1_mytbl1_log_seq  |        10082 |           127 | t
 emaj        | myschema1_mytbl2_log_seq  |        10082 |            12 | t
 emaj        | myschema1_mytbl4_log_seq  |        10082 |            23 | t
 emajb       | myschema1_mytbl2b_log_seq |        10082 |             1 | f
 emajC       | myschema1_myTbl3_log_seq  |        10082 |            85 | t
 emaj        | myschema1_mytbl1_log_seq  |        10085 |           153 | t
 emaj        | myschema1_mytbl2_log_seq  |        10085 |            15 | t
 emaj        | myschema1_mytbl4_log_seq  |        10085 |            23 | t
 emajb       | myschema1_mytbl2b_log_seq |        10085 |             1 | f
 emajC       | myschema1_myTbl3_log_seq  |        10085 |            85 | t
 emaj        | myschema1_mytbl1_log_seq  |        10086 |           153 | t
 emaj        | myschema1_mytbl2_log_seq  |        10086 |            15 | t
 emaj        | myschema1_mytbl4_log_seq  |        10086 |            23 | t
 emajb       | myschema1_mytbl2b_log_seq |        10086 |             1 | f
 emajC       | myschema1_myTbl3_log_seq  |        10086 |            85 | t
 emaj        | myschema1_mytbl1_log_seq  |        10087 |           153 | t
 emaj        | myschema1_mytbl2_log_seq  |        10087 |            16 | t
 emaj        | myschema1_mytbl4_log_seq  |        10087 |            23 | t
 emajb       | myschema1_mytbl2b_log_seq |        10087 |             1 | f
 emajC       | myschema1_myTbl3_log_seq  |        10087 |            85 | t
 emaj        | myschema1_mytbl1_log_seq  |        10088 |           164 | t
 emaj        | myschema1_mytbl2_log_seq  |        10088 |            18 | t
 emaj        | myschema1_mytbl4_log_seq  |        10088 |            23 | t
 emajb       | myschema1_mytbl2b_log_seq |        10088 |             1 | f
 emajC       | myschema1_myTbl3_log_seq  |        10088 |            85 | t
(95 rows)

select sqhl_schema, sqhl_table, sqhl_begin_time_id, sqhl_end_time_id, sqhl_hole_size from emaj.emaj_seq_hole where sqhl_schema = 'myschema1' order by 1,2,3;
 sqhl_schema | sqhl_table | sqhl_begin_time_id | sqhl_end_time_id | sqhl_hole_size 
-------------+------------+--------------------+------------------+----------------
 myschema1   | mytbl1     |              10015 |            10020 |              1
 myschema1   | mytbl1     |              10031 |            10048 |             20
 myschema1   | mytbl1     |              10059 |            10062 |             26
 myschema1   | mytbl1     |              10068 |            10075 |             26
 myschema1   | mytbl1     |              10076 |            10081 |             22
 myschema1   | mytbl1     |              10082 |            10085 |             26
 myschema1   | mytbl2     |              10059 |            10062 |              3
 myschema1   | mytbl2     |              10068 |            10075 |              5
 myschema1   | mytbl2     |              10082 |            10085 |              3
 myschema1   | myTbl3     |              10063 |            10067 |             20
 myschema1   | myTbl3     |              10068 |            10075 |             20
 myschema1   | mytbl4     |              10015 |            10020 |              2
 myschema1   | mytbl4     |              10063 |            10067 |              3
 myschema1   | mytbl4     |              10068 |            10075 |              3
 myschema1   | mytbl4     |              10076 |            10081 |              3
(15 rows)

select * from emaj.emaj_rollback_group('myGroup1','Multi-1',false) order by 1,2;
 rlbk_severity |            rlbk_message             
---------------+-------------------------------------
 Notice        | 2 / 5 tables effectively processed.
 Notice        | 2 sequences processed.
(2 rows)

-----------------------------
-- Step 15 : test transactions with several emaj operations
-----------------------------
select emaj.emaj_create_group('myGroup4');
NOTICE:  table "myschema4_mytblm_log" does not exist, skipping
CONTEXT:  SQL statement "DROP TABLE IF EXISTS emaj.myschema4_mytblm_log"
PL/pgSQL function emaj._create_tbl(emaj.emaj_group_def,bigint,boolean) line 66 at EXECUTE
SQL statement "SELECT emaj._create_tbl(r_grpdef, v_timeId, v_isRollbackable)"
PL/pgSQL function emaj.emaj_create_group(text,boolean,boolean) line 55 at PERFORM
NOTICE:  trigger "emaj_log_trg" for relation "myschema4.mytblm" does not exist, skipping
CONTEXT:  SQL statement "DROP TRIGGER IF EXISTS emaj_log_trg ON myschema4.mytblm"
PL/pgSQL function emaj._create_tbl(emaj.emaj_group_def,bigint,boolean) line 120 at EXECUTE
SQL statement "SELECT emaj._create_tbl(r_grpdef, v_timeId, v_isRollbackable)"
PL/pgSQL function emaj.emaj_create_group(text,boolean,boolean) line 55 at PERFORM
NOTICE:  trigger "emaj_trunc_trg" for relation "myschema4.mytblm" does not exist, skipping
CONTEXT:  SQL statement "DROP TRIGGER IF EXISTS emaj_trunc_trg ON myschema4.mytblm"
PL/pgSQL function emaj._create_tbl(emaj.emaj_group_def,bigint,boolean) line 127 at EXECUTE
SQL statement "SELECT emaj._create_tbl(r_grpdef, v_timeId, v_isRollbackable)"
PL/pgSQL function emaj.emaj_create_group(text,boolean,boolean) line 55 at PERFORM
WARNING:  _create_tbl: The table "myschema4.mytblm" has triggers (mytblm_insert_trigger). Verify the compatibility with emaj rollback operations (in particular if triggers update one or several other tables). Triggers may have to be manualy disabled before rollback.
CONTEXT:  SQL statement "SELECT emaj._create_tbl(r_grpdef, v_timeId, v_isRollbackable)"
PL/pgSQL function emaj.emaj_create_group(text,boolean,boolean) line 55 at PERFORM
NOTICE:  table "myschema4_mypartp1_log" does not exist, skipping
CONTEXT:  SQL statement "DROP TABLE IF EXISTS emaj.myschema4_mypartp1_log"
PL/pgSQL function emaj._create_tbl(emaj.emaj_group_def,bigint,boolean) line 66 at EXECUTE
SQL statement "SELECT emaj._create_tbl(r_grpdef, v_timeId, v_isRollbackable)"
PL/pgSQL function emaj.emaj_create_group(text,boolean,boolean) line 55 at PERFORM
NOTICE:  trigger "emaj_log_trg" for relation "myschema4.mypartp1" does not exist, skipping
CONTEXT:  SQL statement "DROP TRIGGER IF EXISTS emaj_log_trg ON myschema4.mypartp1"
PL/pgSQL function emaj._create_tbl(emaj.emaj_group_def,bigint,boolean) line 120 at EXECUTE
SQL statement "SELECT emaj._create_tbl(r_grpdef, v_timeId, v_isRollbackable)"
PL/pgSQL function emaj.emaj_create_group(text,boolean,boolean) line 55 at PERFORM
NOTICE:  trigger "emaj_trunc_trg" for relation "myschema4.mypartp1" does not exist, skipping
CONTEXT:  SQL statement "DROP TRIGGER IF EXISTS emaj_trunc_trg ON myschema4.mypartp1"
PL/pgSQL function emaj._create_tbl(emaj.emaj_group_def,bigint,boolean) line 127 at EXECUTE
SQL statement "SELECT emaj._create_tbl(r_grpdef, v_timeId, v_isRollbackable)"
PL/pgSQL function emaj.emaj_create_group(text,boolean,boolean) line 55 at PERFORM
NOTICE:  table "myschema4_mypartp2_log" does not exist, skipping
CONTEXT:  SQL statement "DROP TABLE IF EXISTS emaj.myschema4_mypartp2_log"
PL/pgSQL function emaj._create_tbl(emaj.emaj_group_def,bigint,boolean) line 66 at EXECUTE
SQL statement "SELECT emaj._create_tbl(r_grpdef, v_timeId, v_isRollbackable)"
PL/pgSQL function emaj.emaj_create_group(text,boolean,boolean) line 55 at PERFORM
NOTICE:  trigger "emaj_log_trg" for relation "myschema4.mypartp2" does not exist, skipping
CONTEXT:  SQL statement "DROP TRIGGER IF EXISTS emaj_log_trg ON myschema4.mypartp2"
PL/pgSQL function emaj._create_tbl(emaj.emaj_group_def,bigint,boolean) line 120 at EXECUTE
SQL statement "SELECT emaj._create_tbl(r_grpdef, v_timeId, v_isRollbackable)"
PL/pgSQL function emaj.emaj_create_group(text,boolean,boolean) line 55 at PERFORM
NOTICE:  trigger "emaj_trunc_trg" for relation "myschema4.mypartp2" does not exist, skipping
CONTEXT:  SQL statement "DROP TRIGGER IF EXISTS emaj_trunc_trg ON myschema4.mypartp2"
PL/pgSQL function emaj._create_tbl(emaj.emaj_group_def,bigint,boolean) line 127 at EXECUTE
SQL statement "SELECT emaj._create_tbl(r_grpdef, v_timeId, v_isRollbackable)"
PL/pgSQL function emaj.emaj_create_group(text,boolean,boolean) line 55 at PERFORM
NOTICE:  table "myschema4_mytblc1_log" does not exist, skipping
CONTEXT:  SQL statement "DROP TABLE IF EXISTS emaj.myschema4_mytblc1_log"
PL/pgSQL function emaj._create_tbl(emaj.emaj_group_def,bigint,boolean) line 66 at EXECUTE
SQL statement "SELECT emaj._create_tbl(r_grpdef, v_timeId, v_isRollbackable)"
PL/pgSQL function emaj.emaj_create_group(text,boolean,boolean) line 55 at PERFORM
NOTICE:  trigger "emaj_log_trg" for relation "myschema4.mytblc1" does not exist, skipping
CONTEXT:  SQL statement "DROP TRIGGER IF EXISTS emaj_log_trg ON myschema4.mytblc1"
PL/pgSQL function emaj._create_tbl(emaj.emaj_group_def,bigint,boolean) line 120 at EXECUTE
SQL statement "SELECT emaj._create_tbl(r_grpdef, v_timeId, v_isRollbackable)"
PL/pgSQL function emaj.emaj_create_group(text,boolean,boolean) line 55 at PERFORM
NOTICE:  trigger "emaj_trunc_trg" for relation "myschema4.mytblc1" does not exist, skipping
CONTEXT:  SQL statement "DROP TRIGGER IF EXISTS emaj_trunc_trg ON myschema4.mytblc1"
PL/pgSQL function emaj._create_tbl(emaj.emaj_group_def,bigint,boolean) line 127 at EXECUTE
SQL statement "SELECT emaj._create_tbl(r_grpdef, v_timeId, v_isRollbackable)"
PL/pgSQL function emaj.emaj_create_group(text,boolean,boolean) line 55 at PERFORM
NOTICE:  table "myschema4_mytblc2_log" does not exist, skipping
CONTEXT:  SQL statement "DROP TABLE IF EXISTS emaj.myschema4_mytblc2_log"
PL/pgSQL function emaj._create_tbl(emaj.emaj_group_def,bigint,boolean) line 66 at EXECUTE
SQL statement "SELECT emaj._create_tbl(r_grpdef, v_timeId, v_isRollbackable)"
PL/pgSQL function emaj.emaj_create_group(text,boolean,boolean) line 55 at PERFORM
NOTICE:  trigger "emaj_log_trg" for relation "myschema4.mytblc2" does not exist, skipping
CONTEXT:  SQL statement "DROP TRIGGER IF EXISTS emaj_log_trg ON myschema4.mytblc2"
PL/pgSQL function emaj._create_tbl(emaj.emaj_group_def,bigint,boolean) line 120 at EXECUTE
SQL statement "SELECT emaj._create_tbl(r_grpdef, v_timeId, v_isRollbackable)"
PL/pgSQL function emaj.emaj_create_group(text,boolean,boolean) line 55 at PERFORM
NOTICE:  trigger "emaj_trunc_trg" for relation "myschema4.mytblc2" does not exist, skipping
CONTEXT:  SQL statement "DROP TRIGGER IF EXISTS emaj_trunc_trg ON myschema4.mytblc2"
PL/pgSQL function emaj._create_tbl(emaj.emaj_group_def,bigint,boolean) line 127 at EXECUTE
SQL statement "SELECT emaj._create_tbl(r_grpdef, v_timeId, v_isRollbackable)"
PL/pgSQL function emaj.emaj_create_group(text,boolean,boolean) line 55 at PERFORM
 emaj_create_group 
-------------------
                 5
(1 row)

-- several similar operations in a single transaction, using different mark names
begin;
  select emaj.emaj_start_group('myGroup4','M1');
 emaj_start_group 
------------------
                5
(1 row)

  select emaj.emaj_set_mark_group('myGroup4','M2');
 emaj_set_mark_group 
---------------------
                   5
(1 row)

  select emaj.emaj_set_mark_group('myGroup4','M3');
 emaj_set_mark_group 
---------------------
                   5
(1 row)

  select emaj.emaj_alter_group('myGroup4','M4');
 emaj_alter_group 
------------------
                5
(1 row)

  select emaj.emaj_alter_group('myGroup4','M5');
 emaj_alter_group 
------------------
                5
(1 row)

  select emaj.emaj_stop_group('myGroup4','M6');
 emaj_stop_group 
-----------------
               5
(1 row)

  select emaj.emaj_start_group('myGroup4','M7',false);
 emaj_start_group 
------------------
                5
(1 row)

  select emaj.emaj_stop_group('myGroup4','M8');
 emaj_stop_group 
-----------------
               5
(1 row)

commit;
select * from emaj.emaj_mark where mark_group = 'myGroup4' order by mark_id;
 mark_group | mark_name | mark_id | mark_time_id | mark_is_deleted | mark_is_rlbk_protected | mark_comment | mark_log_rows_before_next | mark_logged_rlbk_target_mark 
------------+-----------+---------+--------------+-----------------+------------------------+--------------+---------------------------+------------------------------
 myGroup4   | M1        |   10077 |        10091 | t               | f                      |              |                         0 | 
 myGroup4   | M2        |   10078 |        10092 | t               | f                      |              |                         0 | 
 myGroup4   | M3        |   10079 |        10093 | t               | f                      |              |                         0 | 
 myGroup4   | M4        |   10080 |        10094 | t               | f                      |              |                         0 | 
 myGroup4   | M5        |   10081 |        10095 | t               | f                      |              |                         0 | 
 myGroup4   | M6        |   10082 |        10096 | t               | f                      |              |                         0 | 
 myGroup4   | M7        |   10083 |        10097 | t               | f                      |              |                         0 | 
 myGroup4   | M8        |   10084 |        10098 | t               | f                      |              |                         0 | 
(8 rows)

select emaj.emaj_drop_group('myGroup4');
 emaj_drop_group 
-----------------
               5
(1 row)

-----------------------------
-- test end: check, reset history and force sequences id
-----------------------------
-- first set all rollback events state
select emaj.emaj_cleanup_rollback_state();
 emaj_cleanup_rollback_state 
-----------------------------
                           0
(1 row)

-- check rollback related tables
select rlbk_id, rlbk_groups, rlbk_mark, rlbk_time_id, rlbk_is_logged, rlbk_is_alter_group_allowed, rlbk_nb_session, rlbk_nb_table, rlbk_nb_sequence, 
       rlbk_eff_nb_table, rlbk_status, rlbk_begin_hist_id, rlbk_is_dblink_used,
       case when rlbk_end_datetime is null then 'null' else '[ts]' end as "end_datetime", rlbk_messages
  from emaj.emaj_rlbk order by rlbk_id;
 rlbk_id |      rlbk_groups      |      rlbk_mark       | rlbk_time_id | rlbk_is_logged | rlbk_is_alter_group_allowed | rlbk_nb_session | rlbk_nb_table | rlbk_nb_sequence | rlbk_eff_nb_table | rlbk_status | rlbk_begin_hist_id | rlbk_is_dblink_used | end_datetime |                                                                                                                                                                                                                                                                  rlbk_messages                                                                                                                                                                                                                                                                  
---------+-----------------------+----------------------+--------------+----------------+-----------------------------+-----------------+---------------+------------------+-------------------+-------------+--------------------+---------------------+--------------+-------------------------------------------------------------------------------------------------------------------------------------------------------------------------------------------------------------------------------------------------------------------------------------------------------------------------------------------------------------------------------------------------------------------------------------------------------------------------------------------------------------------------------------------------
       1 | {myGroup1}            | Different_Mark       |         3006 | f              |                             |               1 |             5 |                2 |                 0 | COMMITTED   |               3036 | f                   | [ts]         | {"Notice: 0 / 5 tables effectively processed.","Notice: 2 sequences processed."}
       4 | {myGroup1}            | Different_Mark       |         3015 | f              |                             |               1 |             5 |                2 |                 0 | COMMITTED   |               3094 | f                   | [ts]         | {"Notice: 0 / 5 tables effectively processed.","Notice: 2 sequences processed."}
       5 | {myGroup2}            | Mark21               |         3016 | f              |                             |               1 |             6 |                2 |                 0 | COMMITTED   |               3103 | f                   | [ts]         | {"Notice: 0 / 6 tables effectively processed.","Notice: 2 sequences processed."}
       6 | {myGroup1}            | Different_Mark       |         3017 | t              |                             |               1 |             5 |                2 |                 0 | COMMITTED   |               3113 | f                   | [ts]         | {"Notice: 0 / 5 tables effectively processed.","Notice: 2 sequences processed."}
       7 | {myGroup2}            | Mark21               |         3019 | t              |                             |               1 |             6 |                2 |                 0 | COMMITTED   |               3126 | f                   | [ts]         | {"Notice: 0 / 6 tables effectively processed.","Notice: 2 sequences processed."}
       8 | {myGroup1,myGroup2}   | Mark1B               |         3022 | f              |                             |               1 |            11 |                4 |                 0 | COMMITTED   |               3143 | f                   | [ts]         | {"Notice: 0 / 11 tables effectively processed.","Notice: 4 sequences processed."}
       9 | {myGroup1,myGroup2}   | Mark1B               |         3023 | f              |                             |               1 |            11 |                4 |                 0 | COMMITTED   |               3154 | f                   | [ts]         | {"Notice: 0 / 11 tables effectively processed.","Notice: 4 sequences processed."}
      10 | {myGroup1,myGroup2}   | Mark1B               |         3024 | t              |                             |               1 |            11 |                4 |                 0 | COMMITTED   |               3165 | f                   | [ts]         | {"Notice: 0 / 11 tables effectively processed.","Notice: 4 sequences processed."}
      11 | {myGroup1,myGroup2}   | Mark1B               |         3026 | t              |                             |               1 |            11 |                4 |                 0 | COMMITTED   |               3180 | t                   | [ts]         | {"Notice: 0 / 11 tables effectively processed.","Notice: 4 sequences processed."}
      12 | {myGroup1}            | Mark12               |         3033 | f              |                             |               1 |             5 |                2 |                 2 | COMMITTED   |               3223 | t                   | [ts]         | {"Notice: 2 / 5 tables effectively processed.","Notice: 2 sequences processed."}
      13 | {myGroup1}            | Mark11               |         3034 | f              |                             |               1 |             5 |                2 |                 3 | COMMITTED   |               3238 | t                   | [ts]         | {"Notice: 3 / 5 tables effectively processed.","Notice: 2 sequences processed."}
      14 | {myGroup1}            | Mark12               |         3039 | t              |                             |               1 |             5 |                2 |                 2 | COMMITTED   |               3277 | t                   | [ts]         | {"Notice: 2 / 5 tables effectively processed.","Notice: 2 sequences processed."}
      15 | {myGroup1}            | Mark11               |         3041 | t              |                             |               1 |             5 |                2 |                 5 | COMMITTED   |               3295 | t                   | [ts]         | {"Notice: 5 / 5 tables effectively processed.","Notice: 2 sequences processed."}
      16 | {myGroup1}            | Mark13               |         3043 | f              |                             |               1 |             5 |                2 |                 5 | COMMITTED   |               3320 | t                   | [ts]         | {"Notice: 5 / 5 tables effectively processed.","Notice: 2 sequences processed."}
      17 | {emptyGroup}          | EGM4                 |         3044 | f              |                             |               1 |             0 |                0 |                 0 | COMMITTED   |               3344 | t                   | [ts]         | {"Notice: 0 / 0 tables effectively processed."}
      18 | {emptyGroup}          | EGM3                 |         3045 | t              |                             |               1 |             0 |                0 |                 0 | COMMITTED   |               3351 | t                   | [ts]         | {"Notice: 0 / 0 tables effectively processed."}
      19 | {myGroup4}            | mark1                |         3049 | t              |                             |               1 |             5 |                0 |                 3 | COMMITTED   |               3376 | t                   | [ts]         | {"Notice: 3 / 5 tables effectively processed."}
      20 | {myGroup4}            | myGroup4_start       |         3051 | f              | t                           |               1 |             5 |                0 |                 3 | COMMITTED   |               3393 | t                   | [ts]         | {"Notice: 3 / 5 tables effectively processed."}
      21 | {myGroup1}            | Conso_M1             |         3053 | t              |                             |               1 |             5 |                2 |                 0 | COMMITTED   |               3416 | t                   | [ts]         | {"Notice: 0 / 5 tables effectively processed.","Notice: 2 sequences processed."}
      22 | {myGroup1}            | Conso_M2             |         3057 | t              |                             |               1 |             5 |                2 |                 3 | COMMITTED   |               3441 | t                   | [ts]         | {"Notice: 3 / 5 tables effectively processed.","Notice: 2 sequences processed."}
      23 | {myGroup1}            | Conso_M1             |         3059 | f              |                             |               1 |             5 |                2 |                 2 | COMMITTED   |               3469 | t                   | [ts]         | {"Notice: 2 / 5 tables effectively processed.","Notice: 2 sequences processed."}
      24 | {myGroup4}            | myGroup4_start       |         3061 | f              |                             |               1 |             5 |                0 |                 0 | ABORTED     |               3497 | t                   | [ts]         | {"Notice: 0 / 5 tables effectively processed."}
    6000 | {myGroup1}            | Mk2b                 |         6059 | t              | t                           |               1 |             5 |                1 |                 0 | ABORTED     |               6260 | t                   | [ts]         | {"Notice: 0 / 5 tables effectively processed.","Notice: 1 sequences processed.","Warning: The sequence myschema1.\"myTbl3_col31_seq\" has been left unchanged (not in group anymore)"}
    6001 | {myGroup1}            | Mk2b                 |         6061 | f              | t                           |               1 |             5 |                1 |                 0 | ABORTED     |               6274 | t                   | [ts]         | {"Notice: 0 / 5 tables effectively processed.","Notice: 1 sequences processed."}
    6004 | {myGroup1,myGroup2}   | Mk3                  |         6075 | f              | f                           |               1 |            11 |                4 |                 0 | COMMITTED   |               6391 | t                   | [ts]         | {"Notice: 0 / 11 tables effectively processed.","Notice: 4 sequences processed."}
    6005 | {myGroup1,myGroup2}   | Mk2                  |         6076 | t              | t                           |               1 |            11 |                4 |                 1 | COMMITTED   |               6403 | t                   | [ts]         | {"Notice: 1 / 11 tables effectively processed.","Notice: 4 sequences processed.","Warning: Tables group change not rolled back: E-Maj priority for myschema1.mytbl1","Warning: Tables group change not rolled back: E-Maj log schema for myschema2.\"myTbl3\"","Warning: Tables group change not rolled back: E-Maj names prefix for myschema1.\"myTbl3\"","Warning: Tables group change not rolled back: log data tablespace for myschema1.mytbl2b","Warning: Tables group change not rolled back: log index tablespace for myschema2.mytbl6"}
    6006 | {myGroup1,myGroup2}   | Mk2                  |         6078 | f              | f                           |               1 |            11 |                4 |                 1 | COMMITTED   |               6427 | t                   | [ts]         | {"Notice: 1 / 11 tables effectively processed.","Notice: 4 sequences processed."}
    6007 | {myGroup1,myGroup2}   | Mk1                  |         6079 | f              | t                           |               1 |            11 |                4 |                 0 | COMMITTED   |               6452 | t                   | [ts]         | {"Notice: 0 / 11 tables effectively processed.","Notice: 4 sequences processed.","Warning: Tables group change not rolled back: E-Maj priority for myschema1.mytbl1","Warning: Tables group change not rolled back: E-Maj log schema for myschema2.\"myTbl3\"","Warning: Tables group change not rolled back: E-Maj names prefix for myschema1.\"myTbl3\"","Warning: Tables group change not rolled back: log data tablespace for myschema1.mytbl2b","Warning: Tables group change not rolled back: log index tablespace for myschema2.mytbl6"}
    6008 | {myGroup1,myGroup2}   | Mk1                  |         6080 | t              | f                           |               1 |            11 |                4 |                 0 | ABORTED     |               6474 | t                   | [ts]         | {"Notice: 0 / 11 tables effectively processed.","Notice: 4 sequences processed."}
    6009 | {myGroup1,myGroup2}   | Mk1                  |         6082 | f              | f                           |               1 |            11 |                4 |                 0 | ABORTED     |               6493 | t                   | [ts]         | {"Notice: 0 / 11 tables effectively processed.","Notice: 4 sequences processed."}
   10000 | {myGroup2}            | M2                   |        10009 | t              | f                           |               1 |             6 |                2 |                 3 | COMMITTED   |              10057 | f                   | [ts]         | {"Notice: 3 / 6 tables effectively processed.","Notice: 2 sequences processed."}
   10001 | {myGroup2}            | M3                   |        10011 | t              | f                           |               1 |             6 |                2 |                 3 | COMMITTED   |              10076 | f                   | [ts]         | {"Notice: 3 / 6 tables effectively processed.","Notice: 2 sequences processed."}
   10002 | {myGroup1}            | M2                   |        10013 | f              | f                           |               1 |             5 |                2 |                 2 | COMMITTED   |              10095 | t                   | [ts]         | {"Notice: 2 / 5 tables effectively processed.","Notice: 2 sequences processed."}
   10003 | {myGroup2}            | M2                   |        10017 | t              | f                           |               1 |             6 |                2 |                 3 | COMMITTED   |              10123 | t                   | [ts]         | {"Notice: 3 / 6 tables effectively processed.","Notice: 2 sequences processed."}
   10004 | {myGroup2}            | M3                   |        10019 | f              | f                           |               1 |             6 |                2 |                 3 | COMMITTED   |              10143 | t                   | [ts]         | {"Notice: 3 / 6 tables effectively processed.","Notice: 2 sequences processed."}
   10005 | {myGroup1}            | M5                   |        10020 | f              | f                           |               1 |             5 |                2 |                 2 | COMMITTED   |              10165 | t                   | [ts]         | {"Notice: 2 / 5 tables effectively processed.","Notice: 2 sequences processed."}
   10006 | {myGroup1}            | M4                   |        10021 | t              | t                           |               1 |             5 |                2 |                 3 | COMMITTED   |              10180 | t                   | [ts]         | {"Notice: 3 / 5 tables effectively processed.","Notice: 2 sequences processed."}
   10007 | {myGroup1,myGroup2}   | Multi-1              |        10026 | t              | f                           |               1 |            11 |                4 |                 0 | COMMITTED   |              10231 | t                   | [ts]         | {"Notice: 0 / 11 tables effectively processed.","Notice: 4 sequences processed."}
   10008 | {myGroup1,myGroup2}   | Multi-2              |        10028 | f              | f                           |               1 |            11 |                4 |                 0 | COMMITTED   |              10247 | t                   | [ts]         | {"Notice: 0 / 11 tables effectively processed.","Notice: 4 sequences processed."}
   10009 | {myGroup1,myGroup2}   | Multi-1              |        10029 | f              | f                           |               1 |            11 |                4 |                 0 | COMMITTED   |              10263 | t                   | [ts]         | {"Notice: 0 / 11 tables effectively processed.","Notice: 4 sequences processed."}
   10010 | {myGroup2}            | Multi-2              |        10033 | f              | f                           |               1 |             6 |                2 |                 0 | COMMITTED   |              10299 | t                   | [ts]         | {"Notice: 0 / 6 tables effectively processed.","Notice: 2 sequences processed."}
   10011 | {"phil's group#3\","} | phil's mark #3       |        10045 | t              | f                           |               1 |             2 |                2 |                 0 | COMMITTED   |              10385 | t                   | [ts]         | {"Notice: 0 / 2 tables effectively processed.","Notice: 2 sequences processed."}
   10012 | {"phil's group#3\","} | phil's mark #3       |        10047 | f              | f                           |               1 |             2 |                2 |                 0 | COMMITTED   |              10399 | t                   | [ts]         | {"Notice: 0 / 2 tables effectively processed.","Notice: 2 sequences processed."}
   10013 | {myGroup1}            | Multi-1              |        10048 | f              | f                           |               1 |             5 |                2 |                 1 | COMMITTED   |              10411 | t                   | [ts]         | {"Notice: 1 / 5 tables effectively processed.","Notice: 2 sequences processed."}
   10014 | {myGroup1}            | Multi-1              |        10049 | f              | f                           |               1 |             5 |                2 |                 0 | ABORTED     |              10429 | t                   | [ts]         | {"Notice: 0 / 5 tables effectively processed.","Notice: 2 sequences processed."}
   10015 | {myGroup2}            | Multi-1              |        10050 | f              | f                           |               1 |             6 |                2 |                 2 | ABORTED     |              10439 | t                   | [ts]         | {"Notice: 2 / 6 tables effectively processed.","Notice: 2 sequences processed."}
   10016 | {"phil's group#3\","} | M1_rollbackable      |        10051 | f              | f                           |               1 |             2 |                2 |                 2 | ABORTED     |              10453 | t                   | [ts]         | {"Notice: 2 / 2 tables effectively processed.","Notice: 2 sequences processed."}
   10017 | {"phil's group#3\","} | M1_after_alter_group |        10056 | f              | f                           |               1 |             2 |                2 |                 1 | COMMITTED   |              10494 | t                   | [ts]         | {"Notice: 1 / 2 tables effectively processed.","Notice: 2 sequences processed."}
   10018 | {myGroup1}            | MC1                  |        10061 | t              | f                           |               1 |             5 |                2 |                 2 | COMMITTED   |              10535 | t                   | [ts]         | {"Notice: 2 / 5 tables effectively processed.","Notice: 2 sequences processed."}
   10019 | {myGroup1}            | MC3                  |        10066 | t              | f                           |               1 |             5 |                2 |                 2 | COMMITTED   |              10568 | t                   | [ts]         | {"Notice: 2 / 5 tables effectively processed.","Notice: 2 sequences processed."}
   10020 | {myGroup1}            | MC8                  |        10071 | t              | f                           |               1 |             5 |                2 |                 1 | COMMITTED   |              10603 | t                   | [ts]         | {"Notice: 1 / 5 tables effectively processed.","Notice: 2 sequences processed."}
   10021 | {myGroup1}            | MC6                  |        10074 | t              | f                           |               1 |             5 |                2 |                 4 | COMMITTED   |              10626 | t                   | [ts]         | {"Notice: 4 / 5 tables effectively processed.","Notice: 2 sequences processed."}
   10022 | {myGroup1}            | MC10                 |        10077 | t              | f                           |               1 |             5 |                2 |                 1 | COMMITTED   |              10655 | t                   | [ts]         | {"Notice: 1 / 5 tables effectively processed.","Notice: 2 sequences processed."}
   10023 | {myGroup1}            | MC10                 |        10080 | t              | f                           |               1 |             5 |                2 |                 2 | COMMITTED   |              10676 | t                   | [ts]         | {"Notice: 2 / 5 tables effectively processed.","Notice: 2 sequences processed."}
   10024 | {myGroup1}            | MC15                 |        10084 | t              | f                           |               1 |             5 |                2 |                 2 | COMMITTED   |              10705 | t                   | [ts]         | {"Notice: 2 / 5 tables effectively processed.","Notice: 2 sequences processed."}
   10025 | {myGroup1}            | MC16                 |        10087 | t              | f                           |               1 |             5 |                2 |                 2 | COMMITTED   |              10730 | t                   | [ts]         | {"Notice: 2 / 5 tables effectively processed.","Notice: 2 sequences processed."}
   10026 | {myGroup1}            | Multi-1              |        10089 | f              | f                           |               1 |             5 |                2 |                 2 | COMMITTED   |              10750 | t                   | [ts]         | {"Notice: 2 / 5 tables effectively processed.","Notice: 2 sequences processed."}
(57 rows)

select rlbs_rlbk_id, rlbs_session, 
       case when rlbs_end_datetime is null then 'null' else '[ts]' end as "end_datetime"
  from emaj.emaj_rlbk_session order by rlbs_rlbk_id, rlbs_session;
 rlbs_rlbk_id | rlbs_session | end_datetime 
--------------+--------------+--------------
        10000 |            1 | [ts]
        10001 |            1 | [ts]
        10002 |            1 | [ts]
        10003 |            1 | [ts]
        10004 |            1 | [ts]
        10005 |            1 | [ts]
        10006 |            1 | [ts]
        10007 |            1 | [ts]
        10008 |            1 | [ts]
        10009 |            1 | [ts]
        10010 |            1 | [ts]
        10011 |            1 | [ts]
        10012 |            1 | [ts]
        10013 |            1 | [ts]
        10014 |            1 | [ts]
        10015 |            1 | [ts]
        10016 |            1 | [ts]
        10017 |            1 | [ts]
        10018 |            1 | [ts]
        10019 |            1 | [ts]
        10020 |            1 | [ts]
        10021 |            1 | [ts]
        10022 |            1 | [ts]
        10023 |            1 | [ts]
        10024 |            1 | [ts]
        10025 |            1 | [ts]
        10026 |            1 | [ts]
(27 rows)

select rlbp_rlbk_id, rlbp_step, rlbp_schema, rlbp_table, rlbp_fkey, rlbp_batch_number, rlbp_session,
       rlbp_fkey_def, rlbp_estimated_quantity, rlbp_estimate_method, rlbp_quantity
  from emaj.emaj_rlbk_plan order by rlbp_rlbk_id, rlbp_step, rlbp_schema, rlbp_table, rlbp_fkey;
 rlbp_rlbk_id |  rlbp_step  |  rlbp_schema   |                           rlbp_table                            |     rlbp_fkey     | rlbp_batch_number | rlbp_session |                                                                                        rlbp_fkey_def                                                                                        | rlbp_estimated_quantity | rlbp_estimate_method | rlbp_quantity 
--------------+-------------+----------------+-----------------------------------------------------------------+-------------------+-------------------+--------------+---------------------------------------------------------------------------------------------------------------------------------------------------------------------------------------------+-------------------------+----------------------+---------------
        10000 | DROP_FK     | myschema2      | mytbl4                                                          | mytbl4_col44_fkey |                 1 |            1 |                                                                                                                                                                                             |                         |                    3 |              
        10000 | SET_FK_DEF  | myschema2      | mytbl6                                                          | mytbl6_col61_fkey |                 2 |            1 |                                                                                                                                                                                             |                         |                    3 |              
        10000 | SET_FK_DEF  | myschema2      | mytbl8                                                          | mytbl8_col81_fkey |                 2 |            1 |                                                                                                                                                                                             |                         |                    3 |              
        10000 | RLBK_TABLE  | myschema2      | mytbl4                                                          |                   |                 1 |            1 |                                                                                                                                                                                             |                       4 |                    3 |             2
        10000 | RLBK_TABLE  | myschema2      | mytbl5                                                          |                   |                 3 |            1 |                                                                                                                                                                                             |                       1 |                    3 |             1
        10000 | RLBK_TABLE  | myschema2      | mytbl6                                                          |                   |                 2 |            1 |                                                                                                                                                                                             |                       3 |                    3 |             3
        10000 | SET_FK_IMM  | myschema2      | mytbl4                                                          | mytbl4_col43_fkey |                 1 |            1 |                                                                                                                                                                                             |                       4 |                    3 |              
        10000 | SET_FK_IMM  | myschema2      | mytbl6                                                          | mytbl6_col61_fkey |                 2 |            1 |                                                                                                                                                                                             |                       3 |                    3 |              
        10000 | SET_FK_IMM  | myschema2      | mytbl8                                                          | mytbl8_col81_fkey |                 2 |            1 |                                                                                                                                                                                             |                       3 |                    3 |              
        10000 | ADD_FK      | myschema2      | mytbl4                                                          | mytbl4_col44_fkey |                 1 |            1 | FOREIGN KEY (col44, col45) REFERENCES mytbl1(col11, col12) ON UPDATE SET NULL ON DELETE CASCADE                                                                                             |                       2 |                    3 |              
        10000 | CTRL-DBLINK |                |                                                                 |                   |                   |              |                                                                                                                                                                                             |                      10 |                    3 |              
        10001 | DROP_FK     | myschema2      | mytbl4                                                          | mytbl4_col44_fkey |                 2 |            1 |                                                                                                                                                                                             |                         |                    2 |              
        10001 | SET_FK_DEF  | myschema2      | mytbl6                                                          | mytbl6_col61_fkey |                 1 |            1 |                                                                                                                                                                                             |                         |                    2 |              
        10001 | SET_FK_DEF  | myschema2      | mytbl8                                                          | mytbl8_col81_fkey |                 1 |            1 |                                                                                                                                                                                             |                         |                    2 |              
        10001 | RLBK_TABLE  | myschema2      | mytbl4                                                          |                   |                 2 |            1 |                                                                                                                                                                                             |                       2 |                    1 |             2
        10001 | RLBK_TABLE  | myschema2      | mytbl5                                                          |                   |                 3 |            1 |                                                                                                                                                                                             |                       1 |                    1 |             1
        10001 | RLBK_TABLE  | myschema2      | mytbl6                                                          |                   |                 1 |            1 |                                                                                                                                                                                             |                       3 |                    1 |             3
        10001 | SET_FK_IMM  | myschema2      | mytbl4                                                          | mytbl4_col43_fkey |                 2 |            1 |                                                                                                                                                                                             |                       2 |                    2 |              
        10001 | SET_FK_IMM  | myschema2      | mytbl6                                                          | mytbl6_col61_fkey |                 1 |            1 |                                                                                                                                                                                             |                       3 |                    2 |              
        10001 | SET_FK_IMM  | myschema2      | mytbl8                                                          | mytbl8_col81_fkey |                 1 |            1 |                                                                                                                                                                                             |                       3 |                    2 |              
        10001 | ADD_FK      | myschema2      | mytbl4                                                          | mytbl4_col44_fkey |                 2 |            1 | FOREIGN KEY (col44, col45) REFERENCES mytbl1(col11, col12) ON UPDATE SET NULL ON DELETE CASCADE                                                                                             |                       2 |                    1 |              
        10001 | CTRL-DBLINK |                |                                                                 |                   |                   |              |                                                                                                                                                                                             |                      10 |                    2 |              
        10002 | DIS_LOG_TRG | myschema1      | mytbl1                                                          |                   |                 1 |            1 |                                                                                                                                                                                             |                         |                    2 |              
        10002 | DIS_LOG_TRG | myschema1      | mytbl4                                                          |                   |                 1 |            1 |                                                                                                                                                                                             |                         |                    2 |              
        10002 | DROP_FK     | myschema1      | mytbl4                                                          | mytbl4_col44_fkey |                 1 |            1 |                                                                                                                                                                                             |                         |                    2 |              
        10002 | SET_FK_DEF  | myschema1      | mytbl4                                                          | mytbl4_col43_fkey |                 1 |            1 |                                                                                                                                                                                             |                         |                    2 |              
        10002 | RLBK_TABLE  | myschema1      | mytbl1                                                          |                   |                 1 |            1 |                                                                                                                                                                                             |                       3 |                    3 |             5
        10002 | RLBK_TABLE  | myschema1      | mytbl4                                                          |                   |                 1 |            1 |                                                                                                                                                                                             |                       8 |                    3 |             3
        10002 | DELETE_LOG  | myschema1      | mytbl1                                                          |                   |                 1 |            1 |                                                                                                                                                                                             |                       3 |                    3 |             5
        10002 | DELETE_LOG  | myschema1      | mytbl4                                                          |                   |                 1 |            1 |                                                                                                                                                                                             |                       8 |                    3 |            12
        10002 | SET_FK_IMM  | myschema1      | mytbl4                                                          | mytbl4_col43_fkey |                 1 |            1 |                                                                                                                                                                                             |                       8 |                    3 |              
        10002 | ADD_FK      | myschema1      | mytbl4                                                          | mytbl4_col44_fkey |                 1 |            1 | FOREIGN KEY (col44, col45) REFERENCES myschema1.mytbl1(col11, col12) ON UPDATE SET NULL ON DELETE CASCADE DEFERRABLE INITIALLY DEFERRED                                                     |                       0 |                    3 |              
        10002 | ENA_LOG_TRG | myschema1      | mytbl1                                                          |                   |                 1 |            1 |                                                                                                                                                                                             |                         |                    2 |              
        10002 | ENA_LOG_TRG | myschema1      | mytbl4                                                          |                   |                 1 |            1 |                                                                                                                                                                                             |                         |                    2 |              
        10002 | CTRL+DBLINK |                |                                                                 |                   |                   |              |                                                                                                                                                                                             |                      12 |                    2 |              
        10003 | DROP_FK     | myschema2      | mytbl4                                                          | mytbl4_col44_fkey |                 2 |            1 |                                                                                                                                                                                             |                         |                    2 |              
        10003 | SET_FK_DEF  | myschema2      | mytbl6                                                          | mytbl6_col61_fkey |                 1 |            1 |                                                                                                                                                                                             |                         |                    2 |              
        10003 | SET_FK_DEF  | myschema2      | mytbl8                                                          | mytbl8_col81_fkey |                 1 |            1 |                                                                                                                                                                                             |                         |                    2 |              
        10003 | RLBK_TABLE  | myschema2      | mytbl4                                                          |                   |                 2 |            1 |                                                                                                                                                                                             |                       8 |                    1 |             2
        10003 | RLBK_TABLE  | myschema2      | mytbl5                                                          |                   |                 3 |            1 |                                                                                                                                                                                             |                       3 |                    1 |             1
        10003 | RLBK_TABLE  | myschema2      | mytbl6                                                          |                   |                 1 |            1 |                                                                                                                                                                                             |                       9 |                    1 |             3
        10003 | SET_FK_IMM  | myschema2      | mytbl4                                                          | mytbl4_col43_fkey |                 2 |            1 |                                                                                                                                                                                             |                       8 |                    2 |              
        10003 | SET_FK_IMM  | myschema2      | mytbl6                                                          | mytbl6_col61_fkey |                 1 |            1 |                                                                                                                                                                                             |                       9 |                    2 |              
        10003 | SET_FK_IMM  | myschema2      | mytbl8                                                          | mytbl8_col81_fkey |                 1 |            1 |                                                                                                                                                                                             |                       9 |                    2 |              
        10003 | ADD_FK      | myschema2      | mytbl4                                                          | mytbl4_col44_fkey |                 2 |            1 | FOREIGN KEY (col44, col45) REFERENCES myschema2.mytbl1(col11, col12) ON UPDATE SET NULL ON DELETE CASCADE                                                                                   |                       2 |                    1 |              
        10003 | CTRL+DBLINK |                |                                                                 |                   |                   |              |                                                                                                                                                                                             |                      10 |                    2 |              
        10004 | DIS_LOG_TRG | myschema2      | mytbl4                                                          |                   |                 2 |            1 |                                                                                                                                                                                             |                         |                    2 |              
        10004 | DIS_LOG_TRG | myschema2      | mytbl5                                                          |                   |                 3 |            1 |                                                                                                                                                                                             |                         |                    2 |              
        10004 | DIS_LOG_TRG | myschema2      | mytbl6                                                          |                   |                 1 |            1 |                                                                                                                                                                                             |                         |                    2 |              
        10004 | DROP_FK     | myschema2      | mytbl4                                                          | mytbl4_col44_fkey |                 2 |            1 |                                                                                                                                                                                             |                         |                    2 |              
        10004 | SET_FK_DEF  | myschema2      | mytbl6                                                          | mytbl6_col61_fkey |                 1 |            1 |                                                                                                                                                                                             |                         |                    2 |              
        10004 | SET_FK_DEF  | myschema2      | mytbl8                                                          | mytbl8_col81_fkey |                 1 |            1 |                                                                                                                                                                                             |                         |                    2 |              
        10004 | RLBK_TABLE  | myschema2      | mytbl4                                                          |                   |                 2 |            1 |                                                                                                                                                                                             |                       6 |                    1 |             2
        10004 | RLBK_TABLE  | myschema2      | mytbl5                                                          |                   |                 3 |            1 |                                                                                                                                                                                             |                       3 |                    1 |             1
        10004 | RLBK_TABLE  | myschema2      | mytbl6                                                          |                   |                 1 |            1 |                                                                                                                                                                                             |                       9 |                    1 |             3
        10004 | DELETE_LOG  | myschema2      | mytbl4                                                          |                   |                 2 |            1 |                                                                                                                                                                                             |                       6 |                    3 |             6
        10004 | DELETE_LOG  | myschema2      | mytbl5                                                          |                   |                 3 |            1 |                                                                                                                                                                                             |                       3 |                    3 |             3
        10004 | DELETE_LOG  | myschema2      | mytbl6                                                          |                   |                 1 |            1 |                                                                                                                                                                                             |                       9 |                    3 |             9
        10004 | SET_FK_IMM  | myschema2      | mytbl4                                                          | mytbl4_col43_fkey |                 2 |            1 |                                                                                                                                                                                             |                       6 |                    2 |              
        10004 | SET_FK_IMM  | myschema2      | mytbl6                                                          | mytbl6_col61_fkey |                 1 |            1 |                                                                                                                                                                                             |                       9 |                    2 |              
        10004 | SET_FK_IMM  | myschema2      | mytbl8                                                          | mytbl8_col81_fkey |                 1 |            1 |                                                                                                                                                                                             |                       9 |                    2 |              
        10004 | ADD_FK      | myschema2      | mytbl4                                                          | mytbl4_col44_fkey |                 2 |            1 | FOREIGN KEY (col44, col45) REFERENCES myschema2.mytbl1(col11, col12) ON UPDATE SET NULL ON DELETE CASCADE                                                                                   |                       2 |                    1 |              
        10004 | ENA_LOG_TRG | myschema2      | mytbl4                                                          |                   |                 2 |            1 |                                                                                                                                                                                             |                         |                    2 |              
        10004 | ENA_LOG_TRG | myschema2      | mytbl5                                                          |                   |                 3 |            1 |                                                                                                                                                                                             |                         |                    2 |              
        10004 | ENA_LOG_TRG | myschema2      | mytbl6                                                          |                   |                 1 |            1 |                                                                                                                                                                                             |                         |                    2 |              
        10004 | CTRL+DBLINK |                |                                                                 |                   |                   |              |                                                                                                                                                                                             |                      19 |                    2 |              
        10005 | DIS_LOG_TRG | myschema1      | mytbl1                                                          |                   |                 1 |            1 |                                                                                                                                                                                             |                         |                    2 |              
        10005 | DIS_LOG_TRG | myschema1      | mytbl4                                                          |                   |                 1 |            1 |                                                                                                                                                                                             |                         |                    2 |              
        10005 | DROP_FK     | myschema1      | mytbl4                                                          | mytbl4_col44_fkey |                 1 |            1 |                                                                                                                                                                                             |                         |                    2 |              
        10005 | SET_FK_DEF  | myschema1      | mytbl4                                                          | mytbl4_col43_fkey |                 1 |            1 |                                                                                                                                                                                             |                         |                    2 |              
        10005 | RLBK_TABLE  | myschema1      | mytbl1                                                          |                   |                 1 |            1 |                                                                                                                                                                                             |                       1 |                    1 |             1
        10005 | RLBK_TABLE  | myschema1      | mytbl4                                                          |                   |                 1 |            1 |                                                                                                                                                                                             |                       2 |                    1 |             2
        10005 | DELETE_LOG  | myschema1      | mytbl1                                                          |                   |                 1 |            1 |                                                                                                                                                                                             |                       1 |                    1 |             1
        10005 | DELETE_LOG  | myschema1      | mytbl4                                                          |                   |                 1 |            1 |                                                                                                                                                                                             |                       2 |                    1 |             2
        10005 | SET_FK_IMM  | myschema1      | mytbl4                                                          | mytbl4_col43_fkey |                 1 |            1 |                                                                                                                                                                                             |                       2 |                    2 |              
        10005 | ADD_FK      | myschema1      | mytbl4                                                          | mytbl4_col44_fkey |                 1 |            1 | FOREIGN KEY (col44, col45) REFERENCES myschema1.mytbl1(col11, col12) ON UPDATE SET NULL ON DELETE CASCADE DEFERRABLE INITIALLY DEFERRED                                                     |                       0 |                    3 |              
        10005 | ENA_LOG_TRG | myschema1      | mytbl1                                                          |                   |                 1 |            1 |                                                                                                                                                                                             |                         |                    2 |              
        10005 | ENA_LOG_TRG | myschema1      | mytbl4                                                          |                   |                 1 |            1 |                                                                                                                                                                                             |                         |                    2 |              
        10005 | CTRL+DBLINK |                |                                                                 |                   |                   |              |                                                                                                                                                                                             |                      12 |                    2 |              
        10006 | DROP_FK     | myschema1      | mytbl4                                                          | mytbl4_col44_fkey |                 2 |            1 |                                                                                                                                                                                             |                         |                    2 |              
        10006 | SET_FK_DEF  | myschema1      | mytbl4                                                          | mytbl4_col43_fkey |                 2 |            1 |                                                                                                                                                                                             |                         |                    2 |              
        10006 | RLBK_TABLE  | myschema1      | mytbl1                                                          |                   |                 2 |            1 |                                                                                                                                                                                             |                       1 |                    1 |             1
        10006 | RLBK_TABLE  | myschema1      | myTbl3                                                          |                   |                 1 |            1 |                                                                                                                                                                                             |                      10 |                    2 |            10
        10006 | RLBK_TABLE  | myschema1      | mytbl4                                                          |                   |                 2 |            1 |                                                                                                                                                                                             |                       2 |                    1 |             2
        10006 | SET_FK_IMM  | myschema1      | mytbl4                                                          | mytbl4_col43_fkey |                 2 |            1 |                                                                                                                                                                                             |                       2 |                    2 |              
        10006 | ADD_FK      | myschema1      | mytbl4                                                          | mytbl4_col44_fkey |                 2 |            1 | FOREIGN KEY (col44, col45) REFERENCES myschema1.mytbl1(col11, col12) ON UPDATE SET NULL ON DELETE CASCADE DEFERRABLE INITIALLY DEFERRED                                                     |                       0 |                    3 |              
        10006 | CTRL+DBLINK |                |                                                                 |                   |                   |              |                                                                                                                                                                                             |                       7 |                    2 |              
        10013 | DIS_LOG_TRG | myschema1      | mytbl1                                                          |                   |                 1 |            1 |                                                                                                                                                                                             |                         |                    2 |              
        10013 | DROP_FK     | myschema1      | mytbl4                                                          | mytbl4_col44_fkey |                 1 |            1 |                                                                                                                                                                                             |                         |                    2 |              
        10013 | RLBK_TABLE  | myschema1      | mytbl1                                                          |                   |                 1 |            1 |                                                                                                                                                                                             |                      20 |                    1 |             0
        10013 | DELETE_LOG  | myschema1      | mytbl1                                                          |                   |                 1 |            1 |                                                                                                                                                                                             |                      20 |                    1 |             0
        10013 | ADD_FK      | myschema1      | mytbl4                                                          | mytbl4_col44_fkey |                 1 |            1 | FOREIGN KEY (col44, col45) REFERENCES myschema1.mytbl1(col11, col12) ON UPDATE SET NULL ON DELETE CASCADE DEFERRABLE INITIALLY DEFERRED                                                     |                       0 |                    3 |              
        10013 | ENA_LOG_TRG | myschema1      | mytbl1                                                          |                   |                 1 |            1 |                                                                                                                                                                                             |                         |                    2 |              
        10013 | CTRL+DBLINK |                |                                                                 |                   |                   |              |                                                                                                                                                                                             |                       6 |                    2 |              
        10015 | DIS_LOG_TRG | myschema2      | mytbl5                                                          |                   |                 2 |            1 |                                                                                                                                                                                             |                         |                    2 |              
        10015 | DIS_LOG_TRG | myschema2      | mytbl6                                                          |                   |                 1 |            1 |                                                                                                                                                                                             |                         |                    2 |              
        10015 | SET_FK_DEF  | myschema2      | mytbl6                                                          | mytbl6_col61_fkey |                 1 |            1 |                                                                                                                                                                                             |                         |                    2 |              
        10015 | SET_FK_DEF  | myschema2      | mytbl8                                                          | mytbl8_col81_fkey |                 1 |            1 |                                                                                                                                                                                             |                         |                    2 |              
        10015 | RLBK_TABLE  | myschema2      | mytbl5                                                          |                   |                 2 |            1 |                                                                                                                                                                                             |                       3 |                    1 |             2
        10015 | RLBK_TABLE  | myschema2      | mytbl6                                                          |                   |                 1 |            1 |                                                                                                                                                                                             |                      17 |                    1 |            14
        10015 | DELETE_LOG  | myschema2      | mytbl5                                                          |                   |                 2 |            1 |                                                                                                                                                                                             |                       3 |                    1 |             4
        10015 | DELETE_LOG  | myschema2      | mytbl6                                                          |                   |                 1 |            1 |                                                                                                                                                                                             |                      17 |                    1 |            26
        10015 | SET_FK_IMM  | myschema2      | mytbl6                                                          | mytbl6_col61_fkey |                 1 |            1 |                                                                                                                                                                                             |                      17 |                    2 |              
        10015 | SET_FK_IMM  | myschema2      | mytbl8                                                          | mytbl8_col81_fkey |                 1 |            1 |                                                                                                                                                                                             |                      17 |                    2 |              
        10015 | ENA_LOG_TRG | myschema2      | mytbl5                                                          |                   |                 2 |            1 |                                                                                                                                                                                             |                         |                    2 |              
        10015 | ENA_LOG_TRG | myschema2      | mytbl6                                                          |                   |                 1 |            1 |                                                                                                                                                                                             |                         |                    2 |              
        10015 | CTRL+DBLINK |                |                                                                 |                   |                   |              |                                                                                                                                                                                             |                      12 |                    2 |              
        10016 | DIS_LOG_TRG | phil's schema3 | myTbl2\                                                         |                   |                 2 |            1 |                                                                                                                                                                                             |                         |                    2 |              
        10016 | DIS_LOG_TRG | phil's schema3 | phil's tbl1                                                     |                   |                 1 |            1 |                                                                                                                                                                                             |                         |                    2 |              
        10016 | DROP_FK     | phil's schema3 | myTbl2\                                                         | mytbl2_col21_fkey |                 2 |            1 |                                                                                                                                                                                             |                         |                    2 |              
        10016 | DROP_FK     | phil's schema3 | mytbl4                                                          | mytbl4_col44_fkey |                 1 |            1 |                                                                                                                                                                                             |                         |                    2 |              
        10016 | RLBK_TABLE  | phil's schema3 | myTbl2\                                                         |                   |                 2 |            1 |                                                                                                                                                                                             |                       2 |                    3 |             2
        10016 | RLBK_TABLE  | phil's schema3 | phil's tbl1                                                     |                   |                 1 |            1 |                                                                                                                                                                                             |                      53 |                    3 |            33
        10016 | DELETE_LOG  | phil's schema3 | myTbl2\                                                         |                   |                 2 |            1 |                                                                                                                                                                                             |                       2 |                    3 |             2
        10016 | DELETE_LOG  | phil's schema3 | phil's tbl1                                                     |                   |                 1 |            1 |                                                                                                                                                                                             |                      53 |                    3 |            63
        10016 | ADD_FK      | phil's schema3 | myTbl2\                                                         | mytbl2_col21_fkey |                 2 |            1 | FOREIGN KEY (col21) REFERENCES "phil's schema3".mytbl4(col41)                                                                                                                               |                       0 |                    3 |              
        10016 | ADD_FK      | phil's schema3 | mytbl4                                                          | mytbl4_col44_fkey |                 1 |            1 | FOREIGN KEY (col44, col45) REFERENCES "phil's schema3"."phil's tbl1"("phil's col11", "phil's col12") ON UPDATE SET NULL ON DELETE CASCADE                                                   |                       0 |                    3 |              
        10016 | ENA_LOG_TRG | phil's schema3 | myTbl2\                                                         |                   |                 2 |            1 |                                                                                                                                                                                             |                         |                    2 |              
        10016 | ENA_LOG_TRG | phil's schema3 | phil's tbl1                                                     |                   |                 1 |            1 |                                                                                                                                                                                             |                         |                    2 |              
        10016 | CTRL+DBLINK |                |                                                                 |                   |                   |              |                                                                                                                                                                                             |                      12 |                    2 |              
        10017 | DIS_LOG_TRG | phil's schema3 | table_with_very_looooooooooooooooooooooooooooooooooooooong_name |                   |                 1 |            1 |                                                                                                                                                                                             |                         |                    2 |              
        10017 | DROP_FK     | phil's schema3 | mytbl4                                                          | mytbl4_col44_fkey |                 1 |            1 |                                                                                                                                                                                             |                         |                    2 |              
        10017 | RLBK_TABLE  | phil's schema3 | table_with_very_looooooooooooooooooooooooooooooooooooooong_name |                   |                 1 |            1 |                                                                                                                                                                                             |                       6 |                    3 |            10
        10017 | DELETE_LOG  | phil's schema3 | table_with_very_looooooooooooooooooooooooooooooooooooooong_name |                   |                 1 |            1 |                                                                                                                                                                                             |                       6 |                    3 |            10
        10017 | ADD_FK      | phil's schema3 | mytbl4                                                          | mytbl4_col44_fkey |                 1 |            1 | FOREIGN KEY (col44, col45) REFERENCES "phil's schema3".table_with_very_looooooooooooooooooooooooooooooooooooooong_name("phil's col11", "phil's col12") ON UPDATE SET NULL ON DELETE CASCADE |                       0 |                    3 |              
        10017 | ENA_LOG_TRG | phil's schema3 | table_with_very_looooooooooooooooooooooooooooooooooooooong_name |                   |                 1 |            1 |                                                                                                                                                                                             |                         |                    2 |              
        10017 | CTRL+DBLINK |                |                                                                 |                   |                   |              |                                                                                                                                                                                             |                       6 |                    2 |              
        10018 | DROP_FK     | myschema1      | mytbl4                                                          | mytbl4_col44_fkey |                 1 |            1 |                                                                                                                                                                                             |                         |                    2 |              
        10018 | SET_FK_DEF  | myschema1      | mytbl4                                                          | mytbl4_col43_fkey |                 1 |            1 |                                                                                                                                                                                             |                         |                    2 |              
        10018 | RLBK_TABLE  | myschema1      | mytbl1                                                          |                   |                 1 |            1 |                                                                                                                                                                                             |                      15 |                    1 |            13
        10018 | RLBK_TABLE  | myschema1      | mytbl2                                                          |                   |                 1 |            1 |                                                                                                                                                                                             |                       2 |                    3 |             1
        10018 | SET_FK_IMM  | myschema1      | mytbl4                                                          | mytbl4_col43_fkey |                 1 |            1 |                                                                                                                                                                                             |                       2 |                    2 |              
        10018 | ADD_FK      | myschema1      | mytbl4                                                          | mytbl4_col44_fkey |                 1 |            1 | FOREIGN KEY (col44, col45) REFERENCES myschema1.mytbl1(col11, col12) ON UPDATE SET NULL ON DELETE CASCADE DEFERRABLE INITIALLY DEFERRED                                                     |                       0 |                    3 |              
        10018 | CTRL+DBLINK |                |                                                                 |                   |                   |              |                                                                                                                                                                                             |                       6 |                    2 |              
        10019 | DROP_FK     | myschema1      | mytbl4                                                          | mytbl4_col44_fkey |                 2 |            1 |                                                                                                                                                                                             |                         |                    2 |              
        10019 | SET_FK_DEF  | myschema1      | mytbl4                                                          | mytbl4_col43_fkey |                 2 |            1 |                                                                                                                                                                                             |                         |                    2 |              
        10019 | RLBK_TABLE  | myschema1      | myTbl3                                                          |                   |                 1 |            1 |                                                                                                                                                                                             |                      10 |                    1 |            10
        10019 | RLBK_TABLE  | myschema1      | mytbl4                                                          |                   |                 2 |            1 |                                                                                                                                                                                             |                       2 |                    1 |             1
        10019 | SET_FK_IMM  | myschema1      | mytbl4                                                          | mytbl4_col43_fkey |                 2 |            1 |                                                                                                                                                                                             |                       2 |                    2 |              
        10019 | ADD_FK      | myschema1      | mytbl4                                                          | mytbl4_col44_fkey |                 2 |            1 | FOREIGN KEY (col44, col45) REFERENCES myschema1.mytbl1(col11, col12) ON UPDATE SET NULL ON DELETE CASCADE DEFERRABLE INITIALLY DEFERRED                                                     |                       0 |                    3 |              
        10019 | CTRL+DBLINK |                |                                                                 |                   |                   |              |                                                                                                                                                                                             |                       6 |                    2 |              
        10020 | SET_FK_DEF  | myschema1      | mytbl4                                                          | mytbl4_col43_fkey |                 1 |            1 |                                                                                                                                                                                             |                         |                    2 |              
        10020 | RLBK_TABLE  | myschema1      | mytbl2                                                          |                   |                 1 |            1 |                                                                                                                                                                                             |                       1 |                    1 |             1
        10020 | SET_FK_IMM  | myschema1      | mytbl4                                                          | mytbl4_col43_fkey |                 1 |            1 |                                                                                                                                                                                             |                       1 |                    2 |              
        10020 | CTRL+DBLINK |                |                                                                 |                   |                   |              |                                                                                                                                                                                             |                       3 |                    2 |              
        10021 | DROP_FK     | myschema1      | mytbl4                                                          | mytbl4_col44_fkey |                 1 |            1 |                                                                                                                                                                                             |                         |                    2 |              
        10021 | SET_FK_DEF  | myschema1      | mytbl4                                                          | mytbl4_col43_fkey |                 1 |            1 |                                                                                                                                                                                             |                         |                    2 |              
        10021 | RLBK_TABLE  | myschema1      | mytbl1                                                          |                   |                 1 |            1 |                                                                                                                                                                                             |                      15 |                    1 |            13
        10021 | RLBK_TABLE  | myschema1      | mytbl2                                                          |                   |                 1 |            1 |                                                                                                                                                                                             |                       2 |                    1 |             1
        10021 | RLBK_TABLE  | myschema1      | myTbl3                                                          |                   |                 2 |            1 |                                                                                                                                                                                             |                      10 |                    1 |            10
        10021 | RLBK_TABLE  | myschema1      | mytbl4                                                          |                   |                 1 |            1 |                                                                                                                                                                                             |                       2 |                    1 |             1
        10021 | SET_FK_IMM  | myschema1      | mytbl4                                                          | mytbl4_col43_fkey |                 1 |            1 |                                                                                                                                                                                             |                       4 |                    2 |              
        10021 | ADD_FK      | myschema1      | mytbl4                                                          | mytbl4_col44_fkey |                 1 |            1 | FOREIGN KEY (col44, col45) REFERENCES myschema1.mytbl1(col11, col12) ON UPDATE SET NULL ON DELETE CASCADE DEFERRABLE INITIALLY DEFERRED                                                     |                       0 |                    3 |              
        10021 | CTRL+DBLINK |                |                                                                 |                   |                   |              |                                                                                                                                                                                             |                       8 |                    2 |              
        10022 | DROP_FK     | myschema1      | mytbl4                                                          | mytbl4_col44_fkey |                 1 |            1 |                                                                                                                                                                                             |                         |                    2 |              
        10022 | RLBK_TABLE  | myschema1      | mytbl1                                                          |                   |                 1 |            1 |                                                                                                                                                                                             |                      16 |                    1 |            11
        10022 | ADD_FK      | myschema1      | mytbl4                                                          | mytbl4_col44_fkey |                 1 |            1 | FOREIGN KEY (col44, col45) REFERENCES myschema1.mytbl1(col11, col12) ON UPDATE SET NULL ON DELETE CASCADE DEFERRABLE INITIALLY DEFERRED                                                     |                       0 |                    3 |              
        10022 | CTRL+DBLINK |                |                                                                 |                   |                   |              |                                                                                                                                                                                             |                       3 |                    2 |              
        10023 | DROP_FK     | myschema1      | mytbl4                                                          | mytbl4_col44_fkey |                 1 |            1 |                                                                                                                                                                                             |                         |                    2 |              
        10023 | SET_FK_DEF  | myschema1      | mytbl4                                                          | mytbl4_col43_fkey |                 1 |            1 |                                                                                                                                                                                             |                         |                    2 |              
        10023 | RLBK_TABLE  | myschema1      | mytbl1                                                          |                   |                 1 |            1 |                                                                                                                                                                                             |                      22 |                    1 |            11
        10023 | RLBK_TABLE  | myschema1      | mytbl4                                                          |                   |                 1 |            1 |                                                                                                                                                                                             |                       2 |                    1 |             1
        10023 | SET_FK_IMM  | myschema1      | mytbl4                                                          | mytbl4_col43_fkey |                 1 |            1 |                                                                                                                                                                                             |                       2 |                    2 |              
        10023 | ADD_FK      | myschema1      | mytbl4                                                          | mytbl4_col44_fkey |                 1 |            1 | FOREIGN KEY (col44, col45) REFERENCES myschema1.mytbl1(col11, col12) ON UPDATE SET NULL ON DELETE CASCADE DEFERRABLE INITIALLY DEFERRED                                                     |                       0 |                    3 |              
        10023 | CTRL+DBLINK |                |                                                                 |                   |                   |              |                                                                                                                                                                                             |                       6 |                    2 |              
        10024 | DROP_FK     | myschema1      | mytbl4                                                          | mytbl4_col44_fkey |                 1 |            1 |                                                                                                                                                                                             |                         |                    2 |              
        10024 | SET_FK_DEF  | myschema1      | mytbl4                                                          | mytbl4_col43_fkey |                 1 |            1 |                                                                                                                                                                                             |                         |                    2 |              
        10024 | RLBK_TABLE  | myschema1      | mytbl1                                                          |                   |                 1 |            1 |                                                                                                                                                                                             |                      15 |                    1 |            13
        10024 | RLBK_TABLE  | myschema1      | mytbl2                                                          |                   |                 1 |            1 |                                                                                                                                                                                             |                       2 |                    1 |             1
        10024 | SET_FK_IMM  | myschema1      | mytbl4                                                          | mytbl4_col43_fkey |                 1 |            1 |                                                                                                                                                                                             |                       2 |                    2 |              
        10024 | ADD_FK      | myschema1      | mytbl4                                                          | mytbl4_col44_fkey |                 1 |            1 | FOREIGN KEY (col44, col45) REFERENCES myschema1.mytbl1(col11, col12) ON UPDATE SET NULL ON DELETE CASCADE DEFERRABLE INITIALLY DEFERRED                                                     |                       0 |                    3 |              
        10024 | CTRL+DBLINK |                |                                                                 |                   |                   |              |                                                                                                                                                                                             |                       6 |                    2 |              
        10025 | DROP_FK     | myschema1      | mytbl4                                                          | mytbl4_col44_fkey |                 1 |            1 |                                                                                                                                                                                             |                         |                    2 |              
        10025 | SET_FK_DEF  | myschema1      | mytbl4                                                          | mytbl4_col43_fkey |                 1 |            1 |                                                                                                                                                                                             |                         |                    2 |              
        10025 | RLBK_TABLE  | myschema1      | mytbl1                                                          |                   |                 1 |            1 |                                                                                                                                                                                             |                      11 |                    1 |            11
        10025 | RLBK_TABLE  | myschema1      | mytbl2                                                          |                   |                 1 |            1 |                                                                                                                                                                                             |                       3 |                    1 |             2
        10025 | SET_FK_IMM  | myschema1      | mytbl4                                                          | mytbl4_col43_fkey |                 1 |            1 |                                                                                                                                                                                             |                       3 |                    2 |              
        10025 | ADD_FK      | myschema1      | mytbl4                                                          | mytbl4_col44_fkey |                 1 |            1 | FOREIGN KEY (col44, col45) REFERENCES myschema1.mytbl1(col11, col12) ON UPDATE SET NULL ON DELETE CASCADE DEFERRABLE INITIALLY DEFERRED                                                     |                       0 |                    3 |              
        10025 | CTRL+DBLINK |                |                                                                 |                   |                   |              |                                                                                                                                                                                             |                       6 |                    2 |              
        10026 | DIS_LOG_TRG | myschema1      | mytbl1                                                          |                   |                 1 |            1 |                                                                                                                                                                                             |                         |                    2 |              
        10026 | DIS_LOG_TRG | myschema1      | mytbl2                                                          |                   |                 1 |            1 |                                                                                                                                                                                             |                         |                    2 |              
        10026 | DROP_FK     | myschema1      | mytbl4                                                          | mytbl4_col44_fkey |                 1 |            1 |                                                                                                                                                                                             |                         |                    2 |              
        10026 | SET_FK_DEF  | myschema1      | mytbl4                                                          | mytbl4_col43_fkey |                 1 |            1 |                                                                                                                                                                                             |                         |                    2 |              
        10026 | RLBK_TABLE  | myschema1      | mytbl1                                                          |                   |                 1 |            1 |                                                                                                                                                                                             |                      11 |                    1 |            11
        10026 | RLBK_TABLE  | myschema1      | mytbl2                                                          |                   |                 1 |            1 |                                                                                                                                                                                             |                       4 |                    1 |             3
        10026 | DELETE_LOG  | myschema1      | mytbl1                                                          |                   |                 1 |            1 |                                                                                                                                                                                             |                      11 |                    1 |            11
        10026 | DELETE_LOG  | myschema1      | mytbl2                                                          |                   |                 1 |            1 |                                                                                                                                                                                             |                       4 |                    3 |             4
        10026 | SET_FK_IMM  | myschema1      | mytbl4                                                          | mytbl4_col43_fkey |                 1 |            1 |                                                                                                                                                                                             |                       4 |                    2 |              
        10026 | ADD_FK      | myschema1      | mytbl4                                                          | mytbl4_col44_fkey |                 1 |            1 | FOREIGN KEY (col44, col45) REFERENCES myschema1.mytbl1(col11, col12) ON UPDATE SET NULL ON DELETE CASCADE DEFERRABLE INITIALLY DEFERRED                                                     |                       0 |                    3 |              
        10026 | ENA_LOG_TRG | myschema1      | mytbl1                                                          |                   |                 1 |            1 |                                                                                                                                                                                             |                         |                    2 |              
        10026 | ENA_LOG_TRG | myschema1      | mytbl2                                                          |                   |                 1 |            1 |                                                                                                                                                                                             |                         |                    2 |              
        10026 | CTRL+DBLINK |                |                                                                 |                   |                   |              |                                                                                                                                                                                             |                      12 |                    2 |              
(192 rows)

select rlbt_step, rlbt_schema, rlbt_table, rlbt_fkey, rlbt_rlbk_id, rlbt_quantity from emaj.emaj_rlbk_stat
  order by rlbt_rlbk_id, rlbt_step, rlbt_schema, rlbt_table, rlbt_fkey;
  rlbt_step  |  rlbt_schema   |                           rlbt_table                            |     rlbt_fkey     | rlbt_rlbk_id | rlbt_quantity 
-------------+----------------+-----------------------------------------------------------------+-------------------+--------------+---------------
 RLBK_TABLE  | myschema1      | myTbl3                                                          |                   |         6005 |             1
 CTRL+DBLINK |                |                                                                 |                   |         6005 |             1
 DIS_LOG_TRG |                |                                                                 |                   |         6006 |             1
 RLBK_TABLE  | myschema1      | myTbl3                                                          |                   |         6006 |             1
 DELETE_LOG  | myschema1      | myTbl3                                                          |                   |         6006 |             1
 ENA_LOG_TRG |                |                                                                 |                   |         6006 |             1
 CTRL+DBLINK |                |                                                                 |                   |         6006 |             4
 DROP_FK     |                |                                                                 |                   |        10000 |             1
 SET_FK_DEF  |                |                                                                 |                   |        10000 |             2
 RLBK_TABLE  | myschema2      | mytbl4                                                          |                   |        10000 |             4
 RLBK_TABLE  | myschema2      | mytbl5                                                          |                   |        10000 |             1
 RLBK_TABLE  | myschema2      | mytbl6                                                          |                   |        10000 |             3
 SET_FK_IMM  | myschema2      | mytbl4                                                          | mytbl4_col43_fkey |        10000 |             4
 SET_FK_IMM  | myschema2      | mytbl6                                                          | mytbl6_col61_fkey |        10000 |             3
 SET_FK_IMM  | myschema2      | mytbl8                                                          | mytbl8_col81_fkey |        10000 |             3
 ADD_FK      | myschema2      | mytbl4                                                          | mytbl4_col44_fkey |        10000 |             2
 CTRL-DBLINK |                |                                                                 |                   |        10000 |            10
 DROP_FK     |                |                                                                 |                   |        10001 |             1
 SET_FK_DEF  |                |                                                                 |                   |        10001 |             2
 RLBK_TABLE  | myschema2      | mytbl4                                                          |                   |        10001 |             2
 RLBK_TABLE  | myschema2      | mytbl5                                                          |                   |        10001 |             1
 RLBK_TABLE  | myschema2      | mytbl6                                                          |                   |        10001 |             3
 SET_FK_IMM  | myschema2      | mytbl4                                                          | mytbl4_col43_fkey |        10001 |             2
 SET_FK_IMM  | myschema2      | mytbl6                                                          | mytbl6_col61_fkey |        10001 |             3
 SET_FK_IMM  | myschema2      | mytbl8                                                          | mytbl8_col81_fkey |        10001 |             3
 ADD_FK      | myschema2      | mytbl4                                                          | mytbl4_col44_fkey |        10001 |             2
 CTRL-DBLINK |                |                                                                 |                   |        10001 |            10
 DIS_LOG_TRG |                |                                                                 |                   |        10002 |             2
 DROP_FK     |                |                                                                 |                   |        10002 |             1
 SET_FK_DEF  |                |                                                                 |                   |        10002 |             1
 RLBK_TABLE  | myschema1      | mytbl1                                                          |                   |        10002 |             3
 RLBK_TABLE  | myschema1      | mytbl4                                                          |                   |        10002 |             8
 DELETE_LOG  | myschema1      | mytbl1                                                          |                   |        10002 |             3
 DELETE_LOG  | myschema1      | mytbl4                                                          |                   |        10002 |             8
 SET_FK_IMM  | myschema1      | mytbl4                                                          | mytbl4_col43_fkey |        10002 |             8
 ADD_FK      | myschema1      | mytbl4                                                          | mytbl4_col44_fkey |        10002 |             0
 ENA_LOG_TRG |                |                                                                 |                   |        10002 |             2
 CTRL+DBLINK |                |                                                                 |                   |        10002 |            12
 DROP_FK     |                |                                                                 |                   |        10003 |             1
 SET_FK_DEF  |                |                                                                 |                   |        10003 |             2
 RLBK_TABLE  | myschema2      | mytbl4                                                          |                   |        10003 |             8
 RLBK_TABLE  | myschema2      | mytbl5                                                          |                   |        10003 |             3
 RLBK_TABLE  | myschema2      | mytbl6                                                          |                   |        10003 |             9
 SET_FK_IMM  | myschema2      | mytbl4                                                          | mytbl4_col43_fkey |        10003 |             8
 SET_FK_IMM  | myschema2      | mytbl6                                                          | mytbl6_col61_fkey |        10003 |             9
 SET_FK_IMM  | myschema2      | mytbl8                                                          | mytbl8_col81_fkey |        10003 |             9
 ADD_FK      | myschema2      | mytbl4                                                          | mytbl4_col44_fkey |        10003 |             2
 CTRL+DBLINK |                |                                                                 |                   |        10003 |            10
 DIS_LOG_TRG |                |                                                                 |                   |        10004 |             3
 DROP_FK     |                |                                                                 |                   |        10004 |             1
 SET_FK_DEF  |                |                                                                 |                   |        10004 |             2
 RLBK_TABLE  | myschema2      | mytbl4                                                          |                   |        10004 |             6
 RLBK_TABLE  | myschema2      | mytbl5                                                          |                   |        10004 |             3
 RLBK_TABLE  | myschema2      | mytbl6                                                          |                   |        10004 |             9
 DELETE_LOG  | myschema2      | mytbl4                                                          |                   |        10004 |             6
 DELETE_LOG  | myschema2      | mytbl5                                                          |                   |        10004 |             3
 DELETE_LOG  | myschema2      | mytbl6                                                          |                   |        10004 |             9
 SET_FK_IMM  | myschema2      | mytbl4                                                          | mytbl4_col43_fkey |        10004 |             6
 SET_FK_IMM  | myschema2      | mytbl6                                                          | mytbl6_col61_fkey |        10004 |             9
 SET_FK_IMM  | myschema2      | mytbl8                                                          | mytbl8_col81_fkey |        10004 |             9
 ADD_FK      | myschema2      | mytbl4                                                          | mytbl4_col44_fkey |        10004 |             2
 ENA_LOG_TRG |                |                                                                 |                   |        10004 |             3
 CTRL+DBLINK |                |                                                                 |                   |        10004 |            19
 DIS_LOG_TRG |                |                                                                 |                   |        10005 |             2
 DROP_FK     |                |                                                                 |                   |        10005 |             1
 SET_FK_DEF  |                |                                                                 |                   |        10005 |             1
 RLBK_TABLE  | myschema1      | mytbl1                                                          |                   |        10005 |             1
 RLBK_TABLE  | myschema1      | mytbl4                                                          |                   |        10005 |             2
 DELETE_LOG  | myschema1      | mytbl1                                                          |                   |        10005 |             1
 DELETE_LOG  | myschema1      | mytbl4                                                          |                   |        10005 |             2
 SET_FK_IMM  | myschema1      | mytbl4                                                          | mytbl4_col43_fkey |        10005 |             2
 ADD_FK      | myschema1      | mytbl4                                                          | mytbl4_col44_fkey |        10005 |             0
 ENA_LOG_TRG |                |                                                                 |                   |        10005 |             2
 CTRL+DBLINK |                |                                                                 |                   |        10005 |            12
 DROP_FK     |                |                                                                 |                   |        10006 |             1
 SET_FK_DEF  |                |                                                                 |                   |        10006 |             1
 RLBK_TABLE  | myschema1      | mytbl1                                                          |                   |        10006 |             1
 RLBK_TABLE  | myschema1      | myTbl3                                                          |                   |        10006 |            10
 RLBK_TABLE  | myschema1      | mytbl4                                                          |                   |        10006 |             2
 SET_FK_IMM  | myschema1      | mytbl4                                                          | mytbl4_col43_fkey |        10006 |             2
 ADD_FK      | myschema1      | mytbl4                                                          | mytbl4_col44_fkey |        10006 |             0
 CTRL+DBLINK |                |                                                                 |                   |        10006 |             7
 DIS_LOG_TRG |                |                                                                 |                   |        10013 |             1
 DROP_FK     |                |                                                                 |                   |        10013 |             1
 RLBK_TABLE  | myschema1      | mytbl1                                                          |                   |        10013 |            20
 DELETE_LOG  | myschema1      | mytbl1                                                          |                   |        10013 |            20
 ADD_FK      | myschema1      | mytbl4                                                          | mytbl4_col44_fkey |        10013 |             0
 ENA_LOG_TRG |                |                                                                 |                   |        10013 |             1
 CTRL+DBLINK |                |                                                                 |                   |        10013 |             6
 DIS_LOG_TRG |                |                                                                 |                   |        10015 |             2
 SET_FK_DEF  |                |                                                                 |                   |        10015 |             2
 RLBK_TABLE  | myschema2      | mytbl5                                                          |                   |        10015 |             3
 RLBK_TABLE  | myschema2      | mytbl6                                                          |                   |        10015 |            17
 DELETE_LOG  | myschema2      | mytbl5                                                          |                   |        10015 |             3
 DELETE_LOG  | myschema2      | mytbl6                                                          |                   |        10015 |            17
 SET_FK_IMM  | myschema2      | mytbl6                                                          | mytbl6_col61_fkey |        10015 |            17
 SET_FK_IMM  | myschema2      | mytbl8                                                          | mytbl8_col81_fkey |        10015 |            17
 ENA_LOG_TRG |                |                                                                 |                   |        10015 |             2
 CTRL+DBLINK |                |                                                                 |                   |        10015 |            12
 DIS_LOG_TRG |                |                                                                 |                   |        10016 |             2
 DROP_FK     |                |                                                                 |                   |        10016 |             2
 RLBK_TABLE  | phil's schema3 | myTbl2\                                                         |                   |        10016 |             2
 RLBK_TABLE  | phil's schema3 | phil's tbl1                                                     |                   |        10016 |            53
 DELETE_LOG  | phil's schema3 | myTbl2\                                                         |                   |        10016 |             2
 DELETE_LOG  | phil's schema3 | phil's tbl1                                                     |                   |        10016 |            53
 ADD_FK      | phil's schema3 | myTbl2\                                                         | mytbl2_col21_fkey |        10016 |             0
 ADD_FK      | phil's schema3 | mytbl4                                                          | mytbl4_col44_fkey |        10016 |             0
 ENA_LOG_TRG |                |                                                                 |                   |        10016 |             2
 CTRL+DBLINK |                |                                                                 |                   |        10016 |            12
 DIS_LOG_TRG |                |                                                                 |                   |        10017 |             1
 DROP_FK     |                |                                                                 |                   |        10017 |             1
 RLBK_TABLE  | phil's schema3 | table_with_very_looooooooooooooooooooooooooooooooooooooong_name |                   |        10017 |             6
 DELETE_LOG  | phil's schema3 | table_with_very_looooooooooooooooooooooooooooooooooooooong_name |                   |        10017 |             6
 ADD_FK      | phil's schema3 | mytbl4                                                          | mytbl4_col44_fkey |        10017 |             0
 ENA_LOG_TRG |                |                                                                 |                   |        10017 |             1
 CTRL+DBLINK |                |                                                                 |                   |        10017 |             6
 DROP_FK     |                |                                                                 |                   |        10018 |             1
 SET_FK_DEF  |                |                                                                 |                   |        10018 |             1
 RLBK_TABLE  | myschema1      | mytbl1                                                          |                   |        10018 |            15
 RLBK_TABLE  | myschema1      | mytbl2                                                          |                   |        10018 |             2
 SET_FK_IMM  | myschema1      | mytbl4                                                          | mytbl4_col43_fkey |        10018 |             2
 ADD_FK      | myschema1      | mytbl4                                                          | mytbl4_col44_fkey |        10018 |             0
 CTRL+DBLINK |                |                                                                 |                   |        10018 |             6
 DROP_FK     |                |                                                                 |                   |        10019 |             1
 SET_FK_DEF  |                |                                                                 |                   |        10019 |             1
 RLBK_TABLE  | myschema1      | myTbl3                                                          |                   |        10019 |            10
 RLBK_TABLE  | myschema1      | mytbl4                                                          |                   |        10019 |             2
 SET_FK_IMM  | myschema1      | mytbl4                                                          | mytbl4_col43_fkey |        10019 |             2
 ADD_FK      | myschema1      | mytbl4                                                          | mytbl4_col44_fkey |        10019 |             0
 CTRL+DBLINK |                |                                                                 |                   |        10019 |             6
 SET_FK_DEF  |                |                                                                 |                   |        10020 |             1
 RLBK_TABLE  | myschema1      | mytbl2                                                          |                   |        10020 |             1
 SET_FK_IMM  | myschema1      | mytbl4                                                          | mytbl4_col43_fkey |        10020 |             1
 CTRL+DBLINK |                |                                                                 |                   |        10020 |             3
 DROP_FK     |                |                                                                 |                   |        10021 |             1
 SET_FK_DEF  |                |                                                                 |                   |        10021 |             1
 RLBK_TABLE  | myschema1      | mytbl1                                                          |                   |        10021 |            15
 RLBK_TABLE  | myschema1      | mytbl2                                                          |                   |        10021 |             2
 RLBK_TABLE  | myschema1      | myTbl3                                                          |                   |        10021 |            10
 RLBK_TABLE  | myschema1      | mytbl4                                                          |                   |        10021 |             2
 SET_FK_IMM  | myschema1      | mytbl4                                                          | mytbl4_col43_fkey |        10021 |             4
 ADD_FK      | myschema1      | mytbl4                                                          | mytbl4_col44_fkey |        10021 |             0
 CTRL+DBLINK |                |                                                                 |                   |        10021 |             8
 DROP_FK     |                |                                                                 |                   |        10022 |             1
 RLBK_TABLE  | myschema1      | mytbl1                                                          |                   |        10022 |            16
 ADD_FK      | myschema1      | mytbl4                                                          | mytbl4_col44_fkey |        10022 |             0
 CTRL+DBLINK |                |                                                                 |                   |        10022 |             3
 DROP_FK     |                |                                                                 |                   |        10023 |             1
 SET_FK_DEF  |                |                                                                 |                   |        10023 |             1
 RLBK_TABLE  | myschema1      | mytbl1                                                          |                   |        10023 |            22
 RLBK_TABLE  | myschema1      | mytbl4                                                          |                   |        10023 |             2
 SET_FK_IMM  | myschema1      | mytbl4                                                          | mytbl4_col43_fkey |        10023 |             2
 ADD_FK      | myschema1      | mytbl4                                                          | mytbl4_col44_fkey |        10023 |             0
 CTRL+DBLINK |                |                                                                 |                   |        10023 |             6
 DROP_FK     |                |                                                                 |                   |        10024 |             1
 SET_FK_DEF  |                |                                                                 |                   |        10024 |             1
 RLBK_TABLE  | myschema1      | mytbl1                                                          |                   |        10024 |            15
 RLBK_TABLE  | myschema1      | mytbl2                                                          |                   |        10024 |             2
 SET_FK_IMM  | myschema1      | mytbl4                                                          | mytbl4_col43_fkey |        10024 |             2
 ADD_FK      | myschema1      | mytbl4                                                          | mytbl4_col44_fkey |        10024 |             0
 CTRL+DBLINK |                |                                                                 |                   |        10024 |             6
 DROP_FK     |                |                                                                 |                   |        10025 |             1
 SET_FK_DEF  |                |                                                                 |                   |        10025 |             1
 RLBK_TABLE  | myschema1      | mytbl1                                                          |                   |        10025 |            11
 RLBK_TABLE  | myschema1      | mytbl2                                                          |                   |        10025 |             3
 SET_FK_IMM  | myschema1      | mytbl4                                                          | mytbl4_col43_fkey |        10025 |             3
 ADD_FK      | myschema1      | mytbl4                                                          | mytbl4_col44_fkey |        10025 |             0
 CTRL+DBLINK |                |                                                                 |                   |        10025 |             6
 DIS_LOG_TRG |                |                                                                 |                   |        10026 |             2
 DROP_FK     |                |                                                                 |                   |        10026 |             1
 SET_FK_DEF  |                |                                                                 |                   |        10026 |             1
 RLBK_TABLE  | myschema1      | mytbl1                                                          |                   |        10026 |            11
 RLBK_TABLE  | myschema1      | mytbl2                                                          |                   |        10026 |             4
 DELETE_LOG  | myschema1      | mytbl1                                                          |                   |        10026 |            11
 DELETE_LOG  | myschema1      | mytbl2                                                          |                   |        10026 |             4
 SET_FK_IMM  | myschema1      | mytbl4                                                          | mytbl4_col43_fkey |        10026 |             4
 ADD_FK      | myschema1      | mytbl4                                                          | mytbl4_col44_fkey |        10026 |             0
 ENA_LOG_TRG |                |                                                                 |                   |        10026 |             2
 CTRL+DBLINK |                |                                                                 |                   |        10026 |            12
(179 rows)

select time_id, time_last_emaj_gid, time_event from emaj.emaj_time_stamp where time_id >= 10000 order by time_id;
 time_id | time_last_emaj_gid | time_event 
---------+--------------------+------------
   10000 |              99999 | M
   10001 |              99999 | C
   10002 |              99999 | C
   10003 |              99999 | M
   10004 |              99999 | M
   10005 |             100026 | M
   10006 |             100037 | M
   10007 |             100078 | M
   10008 |             100086 | M
   10009 |             100086 | R
   10010 |             100092 | M
   10011 |             100092 | R
   10012 |             100098 | M
   10013 |             100098 | R
   10014 |             100111 | M
   10015 |             100121 | M
   10016 |             100121 | M
   10017 |             100121 | R
   10018 |             100127 | M
   10019 |             100127 | R
   10020 |             100130 | R
   10021 |             100133 | R
   10022 |             100156 | M
   10023 |             100161 | M
   10024 |             100161 | M
   10025 |             100161 | M
   10026 |             100161 | R
   10027 |             100161 | M
   10028 |             100161 | R
   10029 |             100161 | R
   10030 |             100161 | M
   10031 |             100161 | M
   10032 |             100161 | M
   10033 |             100161 | R
   10034 |             100161 | C
   10035 |             100161 | A
   10036 |             100161 | M
   10037 |             100161 | M
   10038 |             100161 | C
   10039 |             100161 | A
   10040 |             100161 | C
   10041 |             100161 | M
   10042 |             100213 | M
   10043 |             100213 | M
   10044 |             100216 | M
   10045 |             100216 | R
   10046 |             100216 | M
   10047 |             100216 | R
   10048 |             100236 | R
   10049 |             100256 | R
   10050 |             100256 | R
   10051 |             100256 | R
   10052 |             100256 | M
   10053 |             100256 | A
   10054 |             100256 | M
   10055 |             100260 | M
   10056 |             100262 | R
   10057 |             100262 | M
   10058 |             100262 | M
   10059 |             100262 | M
   10060 |             100278 | M
   10061 |             100279 | R
   10062 |             100291 | M
   10063 |             100292 | M
   10064 |             100304 | M
   10065 |             100304 | M
   10066 |             100304 | R
   10067 |             100315 | M
   10068 |             100315 | M
   10069 |             100331 | M
   10070 |             100332 | M
   10071 |             100333 | R
   10072 |             100334 | M
   10073 |             100334 | M
   10074 |             100346 | R
   10075 |             100369 | M
   10076 |             100369 | M
   10077 |             100385 | R
   10078 |             100391 | M
   10079 |             100391 | M
   10080 |             100393 | R
   10081 |             100394 | M
   10082 |             100394 | M
   10083 |             100410 | M
   10084 |             100411 | R
   10085 |             100423 | M
   10086 |             100423 | M
   10087 |             100424 | R
   10088 |             100437 | M
   10089 |             100437 | R
   10090 |             100437 | C
   10091 |             100437 | M
   10092 |             100437 | M
   10093 |             100437 | M
   10094 |             100437 | A
   10095 |             100437 | A
   10096 |             100437 | M
   10097 |             100437 | M
   10098 |             100437 | M
(99 rows)

select hist_id, hist_function, hist_event, hist_object, regexp_replace(regexp_replace(hist_wording,E'\\d\\d\.\\d\\d\\.\\d\\d\\.\\d\\d\\d','%','g'),E'\\[.+\\]','(timestamp)','g'), hist_user from emaj.emaj_hist order by hist_id;
 hist_id |      hist_function       |       hist_event        |                                   hist_object                                    |                                     regexp_replace                                      | hist_user 
---------+--------------------------+-------------------------+----------------------------------------------------------------------------------+-----------------------------------------------------------------------------------------+-----------
   10027 | START_GROUP              | BEGIN                   | myGroup1                                                                         | With log reset                                                                          | postgres
   10028 | PURGE_HISTORY            |                         |                                                                                  | 27 emaj_hist rows deleted ; 42 alter groups events deleted ; 30 rollback events deleted | postgres
   10029 | LOCK_GROUP               | BEGIN                   | myGroup1                                                                         |                                                                                         | postgres
   10030 | LOCK_GROUP               | END                     | myGroup1                                                                         | 5 tables locked, 0 deadlock(s)                                                          | postgres
   10031 | SET_MARK_GROUP           | BEGIN                   | myGroup1                                                                         | M1                                                                                      | postgres
   10032 | SET_MARK_GROUP           | END                     | myGroup1                                                                         | M1                                                                                      | postgres
   10033 | START_GROUP              | END                     | myGroup1                                                                         | 7 tables/sequences processed                                                            | postgres
   10034 | START_GROUP              | BEGIN                   | myGroup2                                                                         | With log reset                                                                          | postgres
   10035 | LOCK_GROUP               | BEGIN                   | myGroup2                                                                         |                                                                                         | postgres
   10036 | LOCK_GROUP               | END                     | myGroup2                                                                         | 6 tables locked, 0 deadlock(s)                                                          | postgres
   10037 | SET_MARK_GROUP           | BEGIN                   | myGroup2                                                                         | M1                                                                                      | postgres
   10038 | SET_MARK_GROUP           | END                     | myGroup2                                                                         | M1                                                                                      | postgres
   10039 | START_GROUP              | END                     | myGroup2                                                                         | 8 tables/sequences processed                                                            | postgres
   10040 | SET_MARK_GROUP           | BEGIN                   | myGroup1                                                                         |                                                                                         | postgres
   10041 | LOCK_GROUP               | BEGIN                   | myGroup1                                                                         |                                                                                         | postgres
   10042 | LOCK_GROUP               | END                     | myGroup1                                                                         | 5 tables locked, 0 deadlock(s)                                                          | postgres
   10043 | SET_MARK_GROUP           | END                     | myGroup1                                                                         | M2                                                                                      | postgres
   10044 | SET_MARK_GROUP           | BEGIN                   | myGroup1                                                                         |                                                                                         | postgres
   10045 | LOCK_GROUP               | BEGIN                   | myGroup1                                                                         |                                                                                         | postgres
   10046 | LOCK_GROUP               | END                     | myGroup1                                                                         | 5 tables locked, 0 deadlock(s)                                                          | postgres
   10047 | SET_MARK_GROUP           | END                     | myGroup1                                                                         | M3                                                                                      | postgres
   10048 | COMMENT_MARK_GROUP       |                         | myGroup1                                                                         | Mark M3                                                                                 | postgres
   10049 | SET_MARK_GROUP           | BEGIN                   | myGroup2                                                                         |                                                                                         | postgres
   10050 | LOCK_GROUP               | BEGIN                   | myGroup2                                                                         |                                                                                         | postgres
   10051 | LOCK_GROUP               | END                     | myGroup2                                                                         | 6 tables locked, 0 deadlock(s)                                                          | postgres
   10052 | SET_MARK_GROUP           | END                     | myGroup2                                                                         | M2                                                                                      | postgres
   10053 | SET_MARK_GROUP           | BEGIN                   | myGroup2                                                                         |                                                                                         | postgres
   10054 | LOCK_GROUP               | BEGIN                   | myGroup2                                                                         |                                                                                         | postgres
   10055 | LOCK_GROUP               | END                     | myGroup2                                                                         | 6 tables locked, 0 deadlock(s)                                                          | postgres
   10056 | SET_MARK_GROUP           | END                     | myGroup2                                                                         | M3                                                                                      | postgres
   10057 | ROLLBACK_GROUP           | BEGIN                   | myGroup2                                                                         | Logged rollback to mark M2 (timestamp)                                                  | postgres
   10058 | DBLINK_OPEN_CNX          |                         | rlbk#1                                                                           | Status = -3                                                                             | postgres
   10059 | LOCK_GROUP               | BEGIN                   | myGroup2                                                                         | Rollback session #1                                                                     | postgres
   10060 | LOCK_GROUP               | END                     | myGroup2                                                                         | Rollback session #1: 6 tables locked, 0 deadlock(s)                                     | postgres
   10061 | SET_MARK_GROUP           | BEGIN                   | myGroup2                                                                         | RLBK_M2_%_START                                                                         | postgres
   10062 | SET_MARK_GROUP           | END                     | myGroup2                                                                         | RLBK_M2_%_START                                                                         | postgres
   10063 | ROLLBACK_TABLE           | BEGIN                   | myschema2.mytbl4                                                                 | All log rows with emaj_gid > 100078 and <= 100086                                       | postgres
   10064 | ROLLBACK_TABLE           | END                     | myschema2.mytbl4                                                                 | 2 rolled back primary keys                                                              | postgres
   10065 | ROLLBACK_TABLE           | BEGIN                   | myschema2.mytbl6                                                                 | All log rows with emaj_gid > 100078 and <= 100086                                       | postgres
   10066 | ROLLBACK_TABLE           | END                     | myschema2.mytbl6                                                                 | 3 rolled back primary keys                                                              | postgres
   10067 | ROLLBACK_TABLE           | BEGIN                   | myschema2.mytbl5                                                                 | All log rows with emaj_gid > 100078 and <= 100086                                       | postgres
   10068 | ROLLBACK_TABLE           | END                     | myschema2.mytbl5                                                                 | 1 rolled back primary keys                                                              | postgres
   10069 | ROLLBACK_SEQUENCE        |                         | myschema2.myseq1                                                                 | RESTART 1001 MAXVALUE 2000 CYCLE                                                        | postgres
   10070 | ROLLBACK_SEQUENCE        |                         | myschema2."myTbl3_col31_seq"                                                     |                                                                                         | postgres
   10071 | SET_MARK_GROUP           | BEGIN                   | myGroup2                                                                         | RLBK_M2_%_DONE                                                                          | postgres
   10072 | SET_MARK_GROUP           | END                     | myGroup2                                                                         | RLBK_M2_%_DONE                                                                          | postgres
   10073 | ROLLBACK_GROUP           | NOTICE                  | Rollback id 10000                                                                | 3 / 6 tables effectively processed.                                                     | postgres
   10074 | ROLLBACK_GROUP           | NOTICE                  | Rollback id 10000                                                                | 2 sequences processed.                                                                  | postgres
   10075 | ROLLBACK_GROUP           | END                     | myGroup2                                                                         | Rollback_id 10000, 3 tables and 2 sequences effectively processed                       | postgres
   10076 | ROLLBACK_GROUP           | BEGIN                   | myGroup2                                                                         | Logged rollback to mark M3 (timestamp)                                                  | postgres
   10077 | DBLINK_OPEN_CNX          |                         | rlbk#1                                                                           | Status = -3                                                                             | postgres
   10078 | LOCK_GROUP               | BEGIN                   | myGroup2                                                                         | Rollback session #1                                                                     | postgres
   10079 | LOCK_GROUP               | END                     | myGroup2                                                                         | Rollback session #1: 6 tables locked, 0 deadlock(s)                                     | postgres
   10080 | SET_MARK_GROUP           | BEGIN                   | myGroup2                                                                         | RLBK_M3_%_START                                                                         | postgres
   10081 | SET_MARK_GROUP           | END                     | myGroup2                                                                         | RLBK_M3_%_START                                                                         | postgres
   10082 | ROLLBACK_TABLE           | BEGIN                   | myschema2.mytbl6                                                                 | All log rows with emaj_gid > 100086 and <= 100092                                       | postgres
   10083 | ROLLBACK_TABLE           | END                     | myschema2.mytbl6                                                                 | 3 rolled back primary keys                                                              | postgres
   10084 | ROLLBACK_TABLE           | BEGIN                   | myschema2.mytbl4                                                                 | All log rows with emaj_gid > 100086 and <= 100092                                       | postgres
   10085 | ROLLBACK_TABLE           | END                     | myschema2.mytbl4                                                                 | 2 rolled back primary keys                                                              | postgres
   10086 | ROLLBACK_TABLE           | BEGIN                   | myschema2.mytbl5                                                                 | All log rows with emaj_gid > 100086 and <= 100092                                       | postgres
   10087 | ROLLBACK_TABLE           | END                     | myschema2.mytbl5                                                                 | 1 rolled back primary keys                                                              | postgres
   10088 | ROLLBACK_SEQUENCE        |                         | myschema2.myseq1                                                                 | RESTART 1004 MAXVALUE 9223372036854775807 NO  CYCLE                                     | postgres
   10089 | ROLLBACK_SEQUENCE        |                         | myschema2."myTbl3_col31_seq"                                                     |                                                                                         | postgres
   10090 | SET_MARK_GROUP           | BEGIN                   | myGroup2                                                                         | RLBK_M3_%_DONE                                                                          | postgres
   10091 | SET_MARK_GROUP           | END                     | myGroup2                                                                         | RLBK_M3_%_DONE                                                                          | postgres
   10092 | ROLLBACK_GROUP           | NOTICE                  | Rollback id 10001                                                                | 3 / 6 tables effectively processed.                                                     | postgres
   10093 | ROLLBACK_GROUP           | NOTICE                  | Rollback id 10001                                                                | 2 sequences processed.                                                                  | postgres
   10094 | ROLLBACK_GROUP           | END                     | myGroup2                                                                         | Rollback_id 10001, 3 tables and 2 sequences effectively processed                       | postgres
   10095 | ROLLBACK_GROUP           | BEGIN                   | myGroup1                                                                         | Unlogged rollback to mark M2 (timestamp)                                                | postgres
   10096 | DBLINK_OPEN_CNX          |                         | rlbk#1                                                                           | Status = 1                                                                              | postgres
   10097 | LOCK_GROUP               | BEGIN                   | myGroup1                                                                         | Rollback session #1                                                                     | postgres
   10098 | LOCK_GROUP               | END                     | myGroup1                                                                         | Rollback session #1: 5 tables locked, 0 deadlock(s)                                     | postgres
   10099 | ROLLBACK_TABLE           | BEGIN                   | myschema1.mytbl1                                                                 | All log rows with emaj_gid > 100026 and <= 100098                                       | postgres
   10100 | ROLLBACK_TABLE           | END                     | myschema1.mytbl1                                                                 | 5 rolled back primary keys                                                              | postgres
   10101 | ROLLBACK_TABLE           | BEGIN                   | myschema1.mytbl4                                                                 | All log rows with emaj_gid > 100026 and <= 100098                                       | postgres
   10102 | ROLLBACK_TABLE           | END                     | myschema1.mytbl4                                                                 | 3 rolled back primary keys                                                              | postgres
   10103 | ROLLBACK_GROUP           | MARK DELETED            | myGroup1                                                                         | mark M3 is deleted                                                                      | postgres
   10104 | ROLLBACK_SEQUENCE        |                         | myschema1."myTbl3_col31_seq"                                                     |                                                                                         | postgres
   10105 | ROLLBACK_SEQUENCE        |                         | myschema1.mytbl2b_col20_seq                                                      |                                                                                         | postgres
   10106 | ROLLBACK_GROUP           | NOTICE                  | Rollback id 10002                                                                | 2 / 5 tables effectively processed.                                                     | postgres
   10107 | ROLLBACK_GROUP           | NOTICE                  | Rollback id 10002                                                                | 2 sequences processed.                                                                  | postgres
   10108 | DBLINK_CLOSE_CNX         |                         | rlbk#1                                                                           |                                                                                         | postgres
   10109 | ROLLBACK_GROUP           | END                     | myGroup1                                                                         | Rollback_id 10002, 2 tables and 2 sequences effectively processed                       | postgres
   10110 | SET_MARK_GROUP           | BEGIN                   | myGroup1                                                                         |                                                                                         | postgres
   10111 | LOCK_GROUP               | BEGIN                   | myGroup1                                                                         |                                                                                         | postgres
   10112 | LOCK_GROUP               | END                     | myGroup1                                                                         | 5 tables locked, 0 deadlock(s)                                                          | postgres
   10113 | CLEANUP_RLBK_STATE       |                         | Rollback id 10002                                                                | set to COMMITTED                                                                        | postgres
   10114 | SET_MARK_GROUP           | END                     | myGroup1                                                                         | M4                                                                                      | postgres
   10115 | SET_MARK_GROUP           | BEGIN                   | myGroup1                                                                         |                                                                                         | postgres
   10116 | LOCK_GROUP               | BEGIN                   | myGroup1                                                                         |                                                                                         | postgres
   10117 | LOCK_GROUP               | END                     | myGroup1                                                                         | 5 tables locked, 0 deadlock(s)                                                          | postgres
   10118 | SET_MARK_GROUP           | END                     | myGroup1                                                                         | M5                                                                                      | postgres
   10119 | SET_MARK_GROUP           | BEGIN                   | myGroup1                                                                         |                                                                                         | postgres
   10120 | LOCK_GROUP               | BEGIN                   | myGroup1                                                                         |                                                                                         | postgres
   10121 | LOCK_GROUP               | END                     | myGroup1                                                                         | 5 tables locked, 0 deadlock(s)                                                          | postgres
   10122 | SET_MARK_GROUP           | END                     | myGroup1                                                                         | M6                                                                                      | postgres
   10123 | ROLLBACK_GROUP           | BEGIN                   | myGroup2                                                                         | Logged rollback to mark M2 (timestamp)                                                  | postgres
   10124 | DBLINK_OPEN_CNX          |                         | rlbk#1                                                                           | Status = 1                                                                              | postgres
   10125 | LOCK_GROUP               | BEGIN                   | myGroup2                                                                         | Rollback session #1                                                                     | postgres
   10126 | LOCK_GROUP               | END                     | myGroup2                                                                         | Rollback session #1: 6 tables locked, 0 deadlock(s)                                     | postgres
   10127 | SET_MARK_GROUP           | BEGIN                   | myGroup2                                                                         | RLBK_M2_%_START                                                                         | postgres
   10128 | SET_MARK_GROUP           | END                     | myGroup2                                                                         | RLBK_M2_%_START                                                                         | postgres
   10129 | ROLLBACK_TABLE           | BEGIN                   | myschema2.mytbl6                                                                 | All log rows with emaj_gid > 100078 and <= 100121                                       | postgres
   10130 | ROLLBACK_TABLE           | END                     | myschema2.mytbl6                                                                 | 3 rolled back primary keys                                                              | postgres
   10131 | ROLLBACK_TABLE           | BEGIN                   | myschema2.mytbl4                                                                 | All log rows with emaj_gid > 100078 and <= 100121                                       | postgres
   10132 | ROLLBACK_TABLE           | END                     | myschema2.mytbl4                                                                 | 2 rolled back primary keys                                                              | postgres
   10133 | ROLLBACK_TABLE           | BEGIN                   | myschema2.mytbl5                                                                 | All log rows with emaj_gid > 100078 and <= 100121                                       | postgres
   10134 | ROLLBACK_TABLE           | END                     | myschema2.mytbl5                                                                 | 1 rolled back primary keys                                                              | postgres
   10135 | ROLLBACK_SEQUENCE        |                         | myschema2.myseq1                                                                 | RESTART 1001 MAXVALUE 2000 CYCLE                                                        | postgres
   10136 | ROLLBACK_SEQUENCE        |                         | myschema2."myTbl3_col31_seq"                                                     |                                                                                         | postgres
   10137 | SET_MARK_GROUP           | BEGIN                   | myGroup2                                                                         | RLBK_M2_%_DONE                                                                          | postgres
   10138 | SET_MARK_GROUP           | END                     | myGroup2                                                                         | RLBK_M2_%_DONE                                                                          | postgres
   10139 | ROLLBACK_GROUP           | NOTICE                  | Rollback id 10003                                                                | 3 / 6 tables effectively processed.                                                     | postgres
   10140 | ROLLBACK_GROUP           | NOTICE                  | Rollback id 10003                                                                | 2 sequences processed.                                                                  | postgres
   10141 | DBLINK_CLOSE_CNX         |                         | rlbk#1                                                                           |                                                                                         | postgres
   10142 | ROLLBACK_GROUP           | END                     | myGroup2                                                                         | Rollback_id 10003, 3 tables and 2 sequences effectively processed                       | postgres
   10143 | ROLLBACK_GROUP           | BEGIN                   | myGroup2                                                                         | Unlogged rollback to mark M3 (timestamp)                                                | postgres
   10144 | DBLINK_OPEN_CNX          |                         | rlbk#1                                                                           | Status = 1                                                                              | postgres
   10145 | LOCK_GROUP               | BEGIN                   | myGroup2                                                                         | Rollback session #1                                                                     | postgres
   10146 | LOCK_GROUP               | END                     | myGroup2                                                                         | Rollback session #1: 6 tables locked, 0 deadlock(s)                                     | postgres
   10147 | ROLLBACK_TABLE           | BEGIN                   | myschema2.mytbl6                                                                 | All log rows with emaj_gid > 100086 and <= 100127                                       | postgres
   10148 | ROLLBACK_TABLE           | END                     | myschema2.mytbl6                                                                 | 3 rolled back primary keys                                                              | postgres
   10149 | ROLLBACK_TABLE           | BEGIN                   | myschema2.mytbl4                                                                 | All log rows with emaj_gid > 100086 and <= 100127                                       | postgres
   10150 | ROLLBACK_TABLE           | END                     | myschema2.mytbl4                                                                 | 2 rolled back primary keys                                                              | postgres
   10151 | ROLLBACK_TABLE           | BEGIN                   | myschema2.mytbl5                                                                 | All log rows with emaj_gid > 100086 and <= 100127                                       | postgres
   10152 | ROLLBACK_TABLE           | END                     | myschema2.mytbl5                                                                 | 1 rolled back primary keys                                                              | postgres
   10153 | ROLLBACK_GROUP           | MARK DELETED            | myGroup2                                                                         | mark RLBK_M2_%_START is deleted                                                         | postgres
   10154 | ROLLBACK_GROUP           | MARK DELETED            | myGroup2                                                                         | mark RLBK_M2_%_DONE is deleted                                                          | postgres
   10155 | ROLLBACK_GROUP           | MARK DELETED            | myGroup2                                                                         | mark RLBK_M3_%_START is deleted                                                         | postgres
   10156 | ROLLBACK_GROUP           | MARK DELETED            | myGroup2                                                                         | mark RLBK_M3_%_DONE is deleted                                                          | postgres
   10157 | ROLLBACK_GROUP           | MARK DELETED            | myGroup2                                                                         | mark RLBK_M2_%_START is deleted                                                         | postgres
   10158 | ROLLBACK_GROUP           | MARK DELETED            | myGroup2                                                                         | mark RLBK_M2_%_DONE is deleted                                                          | postgres
   10159 | ROLLBACK_SEQUENCE        |                         | myschema2.myseq1                                                                 | RESTART 1004 MAXVALUE 9223372036854775807 NO  CYCLE                                     | postgres
   10160 | ROLLBACK_SEQUENCE        |                         | myschema2."myTbl3_col31_seq"                                                     |                                                                                         | postgres
   10161 | ROLLBACK_GROUP           | NOTICE                  | Rollback id 10004                                                                | 3 / 6 tables effectively processed.                                                     | postgres
   10162 | ROLLBACK_GROUP           | NOTICE                  | Rollback id 10004                                                                | 2 sequences processed.                                                                  | postgres
   10163 | DBLINK_CLOSE_CNX         |                         | rlbk#1                                                                           |                                                                                         | postgres
   10164 | ROLLBACK_GROUP           | END                     | myGroup2                                                                         | Rollback_id 10004, 3 tables and 2 sequences effectively processed                       | postgres
   10165 | ROLLBACK_GROUP           | BEGIN                   | myGroup1                                                                         | Unlogged rollback to mark M5 (timestamp)                                                | postgres
   10166 | DBLINK_OPEN_CNX          |                         | rlbk#1                                                                           | Status = 1                                                                              | postgres
   10167 | LOCK_GROUP               | BEGIN                   | myGroup1                                                                         | Rollback session #1                                                                     | postgres
   10168 | LOCK_GROUP               | END                     | myGroup1                                                                         | Rollback session #1: 5 tables locked, 0 deadlock(s)                                     | postgres
   10169 | ROLLBACK_TABLE           | BEGIN                   | myschema1.mytbl1                                                                 | All log rows with emaj_gid > 100121 and <= 100130                                       | postgres
   10170 | ROLLBACK_TABLE           | END                     | myschema1.mytbl1                                                                 | 1 rolled back primary keys                                                              | postgres
   10171 | ROLLBACK_TABLE           | BEGIN                   | myschema1.mytbl4                                                                 | All log rows with emaj_gid > 100121 and <= 100130                                       | postgres
   10172 | ROLLBACK_TABLE           | END                     | myschema1.mytbl4                                                                 | 2 rolled back primary keys                                                              | postgres
   10173 | ROLLBACK_GROUP           | MARK DELETED            | myGroup1                                                                         | mark M6 is deleted                                                                      | postgres
   10174 | ROLLBACK_SEQUENCE        |                         | myschema1."myTbl3_col31_seq"                                                     |                                                                                         | postgres
   10175 | ROLLBACK_SEQUENCE        |                         | myschema1.mytbl2b_col20_seq                                                      |                                                                                         | postgres
   10176 | ROLLBACK_GROUP           | NOTICE                  | Rollback id 10005                                                                | 2 / 5 tables effectively processed.                                                     | postgres
   10177 | ROLLBACK_GROUP           | NOTICE                  | Rollback id 10005                                                                | 2 sequences processed.                                                                  | postgres
   10178 | DBLINK_CLOSE_CNX         |                         | rlbk#1                                                                           |                                                                                         | postgres
   10179 | ROLLBACK_GROUP           | END                     | myGroup1                                                                         | Rollback_id 10005, 2 tables and 2 sequences effectively processed                       | postgres
   10180 | ROLLBACK_GROUP           | BEGIN                   | myGroup1                                                                         | Logged rollback to mark M4 (timestamp)                                                  | postgres
   10181 | DBLINK_OPEN_CNX          |                         | rlbk#1                                                                           | Status = 1                                                                              | postgres
   10182 | LOCK_GROUP               | BEGIN                   | myGroup1                                                                         | Rollback session #1                                                                     | postgres
   10183 | LOCK_GROUP               | END                     | myGroup1                                                                         | Rollback session #1: 5 tables locked, 0 deadlock(s)                                     | postgres
   10184 | SET_MARK_GROUP           | BEGIN                   | myGroup1                                                                         | RLBK_M4_%_START                                                                         | postgres
   10185 | CLEANUP_RLBK_STATE       |                         | Rollback id 10003                                                                | set to COMMITTED                                                                        | postgres
   10186 | CLEANUP_RLBK_STATE       |                         | Rollback id 10004                                                                | set to COMMITTED                                                                        | postgres
   10187 | CLEANUP_RLBK_STATE       |                         | Rollback id 10005                                                                | set to COMMITTED                                                                        | postgres
   10188 | SET_MARK_GROUP           | END                     | myGroup1                                                                         | RLBK_M4_%_START                                                                         | postgres
   10189 | ROLLBACK_TABLE           | BEGIN                   | myschema1."myTbl3"                                                               | All log rows with emaj_gid > 100111 and <= 100133                                       | postgres
   10190 | ROLLBACK_TABLE           | END                     | myschema1."myTbl3"                                                               | 10 rolled back primary keys                                                             | postgres
   10191 | ROLLBACK_TABLE           | BEGIN                   | myschema1.mytbl1                                                                 | All log rows with emaj_gid > 100111 and <= 100133                                       | postgres
   10192 | ROLLBACK_TABLE           | END                     | myschema1.mytbl1                                                                 | 1 rolled back primary keys                                                              | postgres
   10193 | ROLLBACK_TABLE           | BEGIN                   | myschema1.mytbl4                                                                 | All log rows with emaj_gid > 100111 and <= 100133                                       | postgres
   10194 | ROLLBACK_TABLE           | END                     | myschema1.mytbl4                                                                 | 2 rolled back primary keys                                                              | postgres
   10195 | ROLLBACK_SEQUENCE        |                         | myschema1."myTbl3_col31_seq"                                                     |                                                                                         | postgres
   10196 | ROLLBACK_SEQUENCE        |                         | myschema1.mytbl2b_col20_seq                                                      |                                                                                         | postgres
   10197 | SET_MARK_GROUP           | BEGIN                   | myGroup1                                                                         | RLBK_M4_%_DONE                                                                          | postgres
   10198 | SET_MARK_GROUP           | END                     | myGroup1                                                                         | RLBK_M4_%_DONE                                                                          | postgres
   10199 | ROLLBACK_GROUP           | NOTICE                  | Rollback id 10006                                                                | 3 / 5 tables effectively processed.                                                     | postgres
   10200 | ROLLBACK_GROUP           | NOTICE                  | Rollback id 10006                                                                | 2 sequences processed.                                                                  | postgres
   10201 | DBLINK_CLOSE_CNX         |                         | rlbk#1                                                                           |                                                                                         | postgres
   10202 | ROLLBACK_GROUP           | END                     | myGroup1                                                                         | Rollback_id 10006, 3 tables and 2 sequences effectively processed                       | postgres
   10203 | RENAME_MARK_GROUP        | BEGIN                   | myGroup1                                                                         | RLBK_M4_%_START                                                                         | postgres
   10204 | RENAME_MARK_GROUP        | END                     | myGroup1                                                                         | RLBK_M4_%_START renamed Before logged rollback to M4                                    | postgres
   10205 | DELETE_MARK_GROUP        | BEGIN                   | myGroup1                                                                         | RLBK_M4_%_DONE                                                                          | postgres
   10206 | DELETE_MARK_GROUP        | END                     | myGroup1                                                                         | RLBK_M4_%_DONE                                                                          | postgres
   10207 | DELETE_MARK_GROUP        | BEGIN                   | myGroup1                                                                         | M1                                                                                      | postgres
   10208 | DELETE_MARK_GROUP        | END                     | myGroup1                                                                         | M1                                                                                      | postgres
   10209 | DELETE_BEFORE_MARK_GROUP | BEGIN                   | myGroup1                                                                         | M4                                                                                      | postgres
   10210 | DELETE_BEFORE_MARK_GROUP | END                     | myGroup1                                                                         | 1 marks deleted ; M4 is now the initial mark                                            | postgres
   10214 | CLEANUP_RLBK_STATE       |                         | Rollback id 10006                                                                | set to COMMITTED                                                                        | postgres
   10215 | STOP_GROUPS              | BEGIN                   | myGroup1,myGroup2                                                                |                                                                                         | postgres
   10216 | LOCK_GROUPS              | BEGIN                   | myGroup1,myGroup2                                                                |                                                                                         | postgres
   10217 | LOCK_GROUPS              | END                     | myGroup1,myGroup2                                                                | 11 tables locked, 0 deadlock(s)                                                         | postgres
   10218 | SET_MARK_GROUPS          | BEGIN                   | myGroup1,myGroup2                                                                | STOP_%                                                                                  | postgres
   10219 | SET_MARK_GROUPS          | END                     | myGroup1,myGroup2                                                                | STOP_%                                                                                  | postgres
   10220 | STOP_GROUPS              | END                     | myGroup1,myGroup2                                                                | 15 tables/sequences processed                                                           | postgres
   10221 | START_GROUPS             | BEGIN                   | myGroup1,myGroup2                                                                | Without log reset                                                                       | postgres
   10222 | LOCK_GROUPS              | BEGIN                   | myGroup1,myGroup2                                                                |                                                                                         | postgres
   10223 | LOCK_GROUPS              | END                     | myGroup1,myGroup2                                                                | 11 tables locked, 0 deadlock(s)                                                         | postgres
   10224 | SET_MARK_GROUPS          | BEGIN                   | myGroup1,myGroup2                                                                | Multi-1                                                                                 | postgres
   10225 | SET_MARK_GROUPS          | END                     | myGroup1,myGroup2                                                                | Multi-1                                                                                 | postgres
   10226 | START_GROUPS             | END                     | myGroup1,myGroup2                                                                | 15 tables/sequences processed                                                           | postgres
   10227 | SET_MARK_GROUPS          | BEGIN                   | myGroup1,myGroup2                                                                | Multi-2                                                                                 | postgres
   10228 | LOCK_GROUPS              | BEGIN                   | myGroup1,myGroup2                                                                |                                                                                         | postgres
   10229 | LOCK_GROUPS              | END                     | myGroup1,myGroup2                                                                | 11 tables locked, 0 deadlock(s)                                                         | postgres
   10230 | SET_MARK_GROUPS          | END                     | myGroup1,myGroup2                                                                | Multi-2                                                                                 | postgres
   10231 | ROLLBACK_GROUPS          | BEGIN                   | myGroup1,myGroup2                                                                | Logged rollback to mark Multi-1 (timestamp)                                             | postgres
   10232 | DBLINK_OPEN_CNX          |                         | rlbk#1                                                                           | Status = 1                                                                              | postgres
   10233 | LOCK_GROUP               | BEGIN                   | myGroup1,myGroup2                                                                | Rollback session #1                                                                     | postgres
   10234 | LOCK_GROUP               | END                     | myGroup1,myGroup2                                                                | Rollback session #1: 11 tables locked, 0 deadlock(s)                                    | postgres
   10235 | SET_MARK_GROUPS          | BEGIN                   | myGroup1,myGroup2                                                                | RLBK_Multi-1_%_START                                                                    | postgres
   10236 | SET_MARK_GROUPS          | END                     | myGroup1,myGroup2                                                                | RLBK_Multi-1_%_START                                                                    | postgres
   10237 | ROLLBACK_SEQUENCE        |                         | myschema1."myTbl3_col31_seq"                                                     |                                                                                         | postgres
   10238 | ROLLBACK_SEQUENCE        |                         | myschema1.mytbl2b_col20_seq                                                      |                                                                                         | postgres
   10239 | ROLLBACK_SEQUENCE        |                         | myschema2.myseq1                                                                 |                                                                                         | postgres
   10240 | ROLLBACK_SEQUENCE        |                         | myschema2."myTbl3_col31_seq"                                                     |                                                                                         | postgres
   10241 | SET_MARK_GROUPS          | BEGIN                   | myGroup1,myGroup2                                                                | RLBK_Multi-1_%_DONE                                                                     | postgres
   10242 | SET_MARK_GROUPS          | END                     | myGroup1,myGroup2                                                                | RLBK_Multi-1_%_DONE                                                                     | postgres
   10243 | ROLLBACK_GROUPS          | NOTICE                  | Rollback id 10007                                                                | 0 / 11 tables effectively processed.                                                    | postgres
   10244 | ROLLBACK_GROUPS          | NOTICE                  | Rollback id 10007                                                                | 4 sequences processed.                                                                  | postgres
   10245 | DBLINK_CLOSE_CNX         |                         | rlbk#1                                                                           |                                                                                         | postgres
   10246 | ROLLBACK_GROUPS          | END                     | myGroup1,myGroup2                                                                | Rollback_id 10007, 0 tables and 4 sequences effectively processed                       | postgres
   10247 | ROLLBACK_GROUPS          | BEGIN                   | myGroup1,myGroup2                                                                | Unlogged rollback to mark Multi-2 (timestamp)                                           | postgres
   10248 | DBLINK_OPEN_CNX          |                         | rlbk#1                                                                           | Status = 1                                                                              | postgres
   10249 | LOCK_GROUP               | BEGIN                   | myGroup1,myGroup2                                                                | Rollback session #1                                                                     | postgres
   10250 | LOCK_GROUP               | END                     | myGroup1,myGroup2                                                                | Rollback session #1: 11 tables locked, 0 deadlock(s)                                    | postgres
   10251 | ROLLBACK_GROUPS          | MARK DELETED            | myGroup1                                                                         | mark RLBK_Multi-1_%_START is deleted                                                    | postgres
   10252 | ROLLBACK_GROUPS          | MARK DELETED            | myGroup2                                                                         | mark RLBK_Multi-1_%_START is deleted                                                    | postgres
   10253 | ROLLBACK_GROUPS          | MARK DELETED            | myGroup1                                                                         | mark RLBK_Multi-1_%_DONE is deleted                                                     | postgres
   10254 | ROLLBACK_GROUPS          | MARK DELETED            | myGroup2                                                                         | mark RLBK_Multi-1_%_DONE is deleted                                                     | postgres
   10255 | ROLLBACK_SEQUENCE        |                         | myschema1."myTbl3_col31_seq"                                                     |                                                                                         | postgres
   10256 | ROLLBACK_SEQUENCE        |                         | myschema1.mytbl2b_col20_seq                                                      |                                                                                         | postgres
   10257 | ROLLBACK_SEQUENCE        |                         | myschema2.myseq1                                                                 |                                                                                         | postgres
   10258 | ROLLBACK_SEQUENCE        |                         | myschema2."myTbl3_col31_seq"                                                     |                                                                                         | postgres
   10259 | ROLLBACK_GROUPS          | NOTICE                  | Rollback id 10008                                                                | 0 / 11 tables effectively processed.                                                    | postgres
   10260 | ROLLBACK_GROUPS          | NOTICE                  | Rollback id 10008                                                                | 4 sequences processed.                                                                  | postgres
   10261 | DBLINK_CLOSE_CNX         |                         | rlbk#1                                                                           |                                                                                         | postgres
   10262 | ROLLBACK_GROUPS          | END                     | myGroup1,myGroup2                                                                | Rollback_id 10008, 0 tables and 4 sequences effectively processed                       | postgres
   10263 | ROLLBACK_GROUPS          | BEGIN                   | myGroup1,myGroup2                                                                | Unlogged rollback to mark Multi-1 (timestamp)                                           | postgres
   10264 | DBLINK_OPEN_CNX          |                         | rlbk#1                                                                           | Status = 1                                                                              | postgres
   10265 | LOCK_GROUP               | BEGIN                   | myGroup1,myGroup2                                                                | Rollback session #1                                                                     | postgres
   10266 | LOCK_GROUP               | END                     | myGroup1,myGroup2                                                                | Rollback session #1: 11 tables locked, 0 deadlock(s)                                    | postgres
   10267 | ROLLBACK_GROUPS          | MARK DELETED            | myGroup1                                                                         | mark Multi-2 is deleted                                                                 | postgres
   10268 | ROLLBACK_GROUPS          | MARK DELETED            | myGroup2                                                                         | mark Multi-2 is deleted                                                                 | postgres
   10269 | ROLLBACK_SEQUENCE        |                         | myschema1."myTbl3_col31_seq"                                                     |                                                                                         | postgres
   10270 | ROLLBACK_SEQUENCE        |                         | myschema1.mytbl2b_col20_seq                                                      |                                                                                         | postgres
   10271 | ROLLBACK_SEQUENCE        |                         | myschema2.myseq1                                                                 |                                                                                         | postgres
   10272 | ROLLBACK_SEQUENCE        |                         | myschema2."myTbl3_col31_seq"                                                     |                                                                                         | postgres
   10273 | ROLLBACK_GROUPS          | NOTICE                  | Rollback id 10009                                                                | 0 / 11 tables effectively processed.                                                    | postgres
   10274 | ROLLBACK_GROUPS          | NOTICE                  | Rollback id 10009                                                                | 4 sequences processed.                                                                  | postgres
   10275 | DBLINK_CLOSE_CNX         |                         | rlbk#1                                                                           |                                                                                         | postgres
   10276 | ROLLBACK_GROUPS          | END                     | myGroup1,myGroup2                                                                | Rollback_id 10009, 0 tables and 4 sequences effectively processed                       | postgres
   10277 | STOP_GROUPS              | BEGIN                   | myGroup1,myGroup2                                                                |                                                                                         | postgres
   10278 | LOCK_GROUPS              | BEGIN                   | myGroup1,myGroup2                                                                |                                                                                         | postgres
   10279 | LOCK_GROUPS              | END                     | myGroup1,myGroup2                                                                | 11 tables locked, 0 deadlock(s)                                                         | postgres
   10280 | SET_MARK_GROUPS          | BEGIN                   | myGroup1,myGroup2                                                                | Stop after rollback                                                                     | postgres
   10281 | CLEANUP_RLBK_STATE       |                         | Rollback id 10007                                                                | set to COMMITTED                                                                        | postgres
   10282 | CLEANUP_RLBK_STATE       |                         | Rollback id 10008                                                                | set to COMMITTED                                                                        | postgres
   10283 | CLEANUP_RLBK_STATE       |                         | Rollback id 10009                                                                | set to COMMITTED                                                                        | postgres
   10284 | SET_MARK_GROUPS          | END                     | myGroup1,myGroup2                                                                | Stop after rollback                                                                     | postgres
   10285 | STOP_GROUPS              | END                     | myGroup1,myGroup2                                                                | 15 tables/sequences processed                                                           | postgres
   10287 | START_GROUPS             | BEGIN                   | myGroup1,myGroup2                                                                | Without log reset                                                                       | postgres
   10288 | LOCK_GROUPS              | BEGIN                   | myGroup1,myGroup2                                                                |                                                                                         | postgres
   10289 | LOCK_GROUPS              | END                     | myGroup1,myGroup2                                                                | 11 tables locked, 0 deadlock(s)                                                         | postgres
   10290 | SET_MARK_GROUPS          | BEGIN                   | myGroup1,myGroup2                                                                | Multi-1b                                                                                | postgres
   10291 | SET_MARK_GROUPS          | END                     | myGroup1,myGroup2                                                                | Multi-1b                                                                                | postgres
   10292 | START_GROUPS             | END                     | myGroup1,myGroup2                                                                | 15 tables/sequences processed                                                           | postgres
   10293 | SET_MARK_GROUPS          | BEGIN                   | myGroup1,myGroup2                                                                | Multi-2                                                                                 | postgres
   10294 | LOCK_GROUPS              | BEGIN                   | myGroup1,myGroup2                                                                |                                                                                         | postgres
   10295 | LOCK_GROUPS              | END                     | myGroup1,myGroup2                                                                | 11 tables locked, 0 deadlock(s)                                                         | postgres
   10296 | SET_MARK_GROUPS          | END                     | myGroup1,myGroup2                                                                | Multi-2                                                                                 | postgres
   10297 | DELETE_MARK_GROUP        | BEGIN                   | myGroup1                                                                         | Multi-2                                                                                 | postgres
   10298 | DELETE_MARK_GROUP        | END                     | myGroup1                                                                         | Multi-2                                                                                 | postgres
   10299 | ROLLBACK_GROUP           | BEGIN                   | myGroup2                                                                         | Unlogged rollback to mark Multi-2 (timestamp)                                           | postgres
   10300 | DBLINK_OPEN_CNX          |                         | rlbk#1                                                                           | Status = 1                                                                              | postgres
   10301 | LOCK_GROUP               | BEGIN                   | myGroup2                                                                         | Rollback session #1                                                                     | postgres
   10302 | LOCK_GROUP               | END                     | myGroup2                                                                         | Rollback session #1: 6 tables locked, 0 deadlock(s)                                     | postgres
   10303 | ROLLBACK_SEQUENCE        |                         | myschema2.myseq1                                                                 |                                                                                         | postgres
   10304 | ROLLBACK_SEQUENCE        |                         | myschema2."myTbl3_col31_seq"                                                     |                                                                                         | postgres
   10305 | ROLLBACK_GROUP           | NOTICE                  | Rollback id 10010                                                                | 0 / 6 tables effectively processed.                                                     | postgres
   10306 | ROLLBACK_GROUP           | NOTICE                  | Rollback id 10010                                                                | 2 sequences processed.                                                                  | postgres
   10307 | DBLINK_CLOSE_CNX         |                         | rlbk#1                                                                           |                                                                                         | postgres
   10308 | ROLLBACK_GROUP           | END                     | myGroup2                                                                         | Rollback_id 10010, 0 tables and 2 sequences effectively processed                       | postgres
   10309 | DELETE_MARK_GROUP        | BEGIN                   | myGroup2                                                                         | Multi-2                                                                                 | postgres
   10310 | DELETE_MARK_GROUP        | END                     | myGroup2                                                                         | Multi-2                                                                                 | postgres
   10311 | DELETE_MARK_GROUP        | BEGIN                   | myGroup1                                                                         | Multi-1                                                                                 | postgres
   10312 | DELETE_MARK_GROUP        | END                     | myGroup1                                                                         | Multi-1                                                                                 | postgres
   10313 | DELETE_MARK_GROUP        | BEGIN                   | myGroup2                                                                         | Multi-1                                                                                 | postgres
   10314 | DELETE_MARK_GROUP        | END                     | myGroup2                                                                         | Multi-1                                                                                 | postgres
   10315 | RENAME_MARK_GROUP        | BEGIN                   | myGroup1                                                                         | Multi-1b                                                                                | postgres
   10316 | RENAME_MARK_GROUP        | END                     | myGroup1                                                                         | Multi-1b renamed Multi-1                                                                | postgres
   10317 | RENAME_MARK_GROUP        | BEGIN                   | myGroup2                                                                         | Multi-1b                                                                                | postgres
   10318 | RENAME_MARK_GROUP        | END                     | myGroup2                                                                         | Multi-1b renamed Multi-1                                                                | postgres
   10319 | RENAME_MARK_GROUP        | BEGIN                   | myGroup2                                                                         | M2                                                                                      | postgres
   10320 | RENAME_MARK_GROUP        | END                     | myGroup2                                                                         | M2 renamed Deleted M2                                                                   | postgres
   10321 | DELETE_BEFORE_MARK_GROUP | BEGIN                   | myGroup2                                                                         | M3                                                                                      | postgres
   10322 | DELETE_BEFORE_MARK_GROUP | END                     | myGroup2                                                                         | 2 marks deleted ; M3 is now the initial mark                                            | postgres
   10323 | COMMENT_MARK_GROUP       |                         | myGroup2                                                                         | Mark M3                                                                                 | postgres
   10324 | CREATE_GROUP             | BEGIN                   | phil's group#3",                                                                 | audit_only                                                                              | postgres
   10325 | CREATE_GROUP             | SCHEMA CREATED          | "emaj #'3"                                                                       |                                                                                         | postgres
   10326 | CREATE_GROUP             | END                     | phil's group#3",                                                                 | 4 tables/sequences processed                                                            | postgres
   10327 | DISABLE_PROTECTION       | EVENT TRIGGERS DISABLED |                                                                                  | emaj_protection_trg, emaj_sql_drop_trg, emaj_table_rewrite_trg                          | postgres
   10328 | ALTER_GROUP              | BEGIN                   | phil's group#3",                                                                 |                                                                                         | postgres
   10329 | ALTER_GROUP              | SCHEMA CREATED          | emaj3                                                                            |                                                                                         | postgres
   10330 | ALTER_GROUP              | LOG SCHEMA CHANGED      | "phil's schema3"."myTbl2\"                                                       | emaj => emaj3                                                                           | postgres
   10331 | ALTER_GROUP              | NAMES PREFIX CHANGED    | "phil's schema3"."myTbl2\"                                                       | phil's schema3_myTbl2\ => phil_mytbl2                                                   | postgres
   10332 | ALTER_GROUP              | END                     | phil's group#3",                                                                 | Timestamp Id : 10035                                                                    | postgres
   10333 | START_GROUP              | BEGIN                   | phil's group#3",                                                                 | With log reset                                                                          | postgres
   10334 | LOCK_GROUP               | BEGIN                   | phil's group#3",                                                                 |                                                                                         | postgres
   10335 | LOCK_GROUP               | END                     | phil's group#3",                                                                 | 2 tables locked, 0 deadlock(s)                                                          | postgres
   10336 | SET_MARK_GROUP           | BEGIN                   | phil's group#3",                                                                 | M1_after_alter_group                                                                    | postgres
   10337 | CLEANUP_RLBK_STATE       |                         | Rollback id 10010                                                                | set to COMMITTED                                                                        | postgres
   10338 | SET_MARK_GROUP           | END                     | phil's group#3",                                                                 | M1_after_alter_group                                                                    | postgres
   10339 | START_GROUP              | END                     | phil's group#3",                                                                 | 4 tables/sequences processed                                                            | postgres
   10340 | STOP_GROUP               | BEGIN                   | phil's group#3",                                                                 |                                                                                         | postgres
   10341 | LOCK_GROUP               | BEGIN                   | phil's group#3",                                                                 |                                                                                         | postgres
   10342 | LOCK_GROUP               | END                     | phil's group#3",                                                                 | 2 tables locked, 0 deadlock(s)                                                          | postgres
   10343 | SET_MARK_GROUP           | BEGIN                   | phil's group#3",                                                                 | STOP_%                                                                                  | postgres
   10344 | SET_MARK_GROUP           | END                     | phil's group#3",                                                                 | STOP_%                                                                                  | postgres
   10345 | STOP_GROUP               | END                     | phil's group#3",                                                                 | 4 tables/sequences processed                                                            | postgres
   10346 | CREATE_GROUP             | BEGIN                   | myGroup4                                                                         | rollbackable                                                                            | postgres
   10347 | CREATE_GROUP             | END                     | myGroup4                                                                         | 5 tables/sequences processed                                                            | postgres
   10348 | ALTER_GROUPS             | BEGIN                   | phil's group#3",,myGroup4                                                        |                                                                                         | postgres
   10349 | ALTER_GROUP              | LOG SCHEMA CHANGED      | "phil's schema3"."myTbl2\"                                                       | emaj3 => emaj                                                                           | postgres
   10350 | ALTER_GROUP              | NAMES PREFIX CHANGED    | "phil's schema3"."myTbl2\"                                                       | phil_mytbl2 => phil's schema3_myTbl2\                                                   | postgres
   10351 | ALTER_GROUP              | SCHEMA DROPPED          | emaj3                                                                            |                                                                                         | postgres
   10352 | ALTER_GROUPS             | END                     | phil's group#3",,myGroup4                                                        | Timestamp Id : 10039                                                                    | postgres
   10353 | DROP_GROUP               | BEGIN                   | phil's group#3",                                                                 |                                                                                         | postgres
   10354 | DROP_GROUP               | SCHEMA DROPPED          | "emaj #'3"                                                                       |                                                                                         | postgres
   10355 | DROP_GROUP               | END                     | phil's group#3",                                                                 | 4 tables/sequences processed                                                            | postgres
   10356 | DROP_GROUP               | BEGIN                   | myGroup4                                                                         |                                                                                         | postgres
   10357 | DROP_GROUP               | END                     | myGroup4                                                                         | 5 tables/sequences processed                                                            | postgres
   10358 | ENABLE_PROTECTION        | EVENT TRIGGERS ENABLED  |                                                                                  | emaj_protection_trg, emaj_sql_drop_trg, emaj_table_rewrite_trg                          | postgres
   10359 | CREATE_GROUP             | BEGIN                   | phil's group#3",                                                                 | rollbackable                                                                            | postgres
   10360 | CREATE_GROUP             | SCHEMA CREATED          | "emaj #'3"                                                                       |                                                                                         | postgres
   10361 | CREATE_GROUP             | END                     | phil's group#3",                                                                 | 4 tables/sequences processed                                                            | postgres
   10362 | START_GROUP              | BEGIN                   | phil's group#3",                                                                 | With log reset                                                                          | postgres
   10363 | LOCK_GROUP               | BEGIN                   | phil's group#3",                                                                 |                                                                                         | postgres
   10364 | LOCK_GROUP               | END                     | phil's group#3",                                                                 | 2 tables locked, 0 deadlock(s)                                                          | postgres
   10365 | SET_MARK_GROUP           | BEGIN                   | phil's group#3",                                                                 | M1_rollbackable                                                                         | postgres
   10366 | SET_MARK_GROUP           | END                     | phil's group#3",                                                                 | M1_rollbackable                                                                         | postgres
   10367 | START_GROUP              | END                     | phil's group#3",                                                                 | 4 tables/sequences processed                                                            | postgres
   10368 | SET_MARK_GROUP           | BEGIN                   | phil's group#3",                                                                 |                                                                                         | postgres
   10369 | LOCK_GROUP               | BEGIN                   | phil's group#3",                                                                 |                                                                                         | postgres
   10370 | LOCK_GROUP               | END                     | phil's group#3",                                                                 | 2 tables locked, 0 deadlock(s)                                                          | postgres
   10371 | SET_MARK_GROUP           | END                     | phil's group#3",                                                                 | M2_rollbackable                                                                         | postgres
   10372 | SET_MARK_GROUP           | BEGIN                   | phil's group#3",                                                                 |                                                                                         | postgres
   10373 | LOCK_GROUP               | BEGIN                   | phil's group#3",                                                                 |                                                                                         | postgres
   10374 | LOCK_GROUP               | END                     | phil's group#3",                                                                 | 2 tables locked, 0 deadlock(s)                                                          | postgres
   10375 | SET_MARK_GROUP           | END                     | phil's group#3",                                                                 | M2_again!                                                                               | postgres
   10376 | SET_MARK_GROUPS          | BEGIN                   | phil's group#3",                                                                 | phil's mark #1                                                                          | postgres
   10377 | LOCK_GROUPS              | BEGIN                   | phil's group#3",                                                                 |                                                                                         | postgres
   10378 | LOCK_GROUPS              | END                     | phil's group#3",                                                                 | 2 tables locked, 0 deadlock(s)                                                          | postgres
   10379 | SET_MARK_GROUPS          | END                     | phil's group#3",                                                                 | phil's mark #1                                                                          | postgres
   10380 | COMMENT_MARK_GROUP       |                         | phil's group#3",                                                                 | Mark phil's mark #1                                                                     | postgres
   10381 | RENAME_MARK_GROUP        | BEGIN                   | phil's group#3",                                                                 | phil's mark #1                                                                          | postgres
   10382 | RENAME_MARK_GROUP        | END                     | phil's group#3",                                                                 | phil's mark #1 renamed phil's mark #3                                                   | postgres
   10383 | DELETE_MARK_GROUP        | BEGIN                   | phil's group#3",                                                                 | M2_again!                                                                               | postgres
   10384 | DELETE_MARK_GROUP        | END                     | phil's group#3",                                                                 | M2_again!                                                                               | postgres
   10385 | ROLLBACK_GROUP           | BEGIN                   | phil's group#3",                                                                 | Logged rollback to mark phil's mark #3 (timestamp)                                      | postgres
   10386 | DBLINK_OPEN_CNX          |                         | rlbk#1                                                                           | Status = 1                                                                              | postgres
   10387 | LOCK_GROUP               | BEGIN                   | phil's group#3",                                                                 | Rollback session #1                                                                     | postgres
   10388 | LOCK_GROUP               | END                     | phil's group#3",                                                                 | Rollback session #1: 2 tables locked, 0 deadlock(s)                                     | postgres
   10389 | SET_MARK_GROUP           | BEGIN                   | phil's group#3",                                                                 | RLBK_phil's mark #3_%_START                                                             | postgres
   10390 | SET_MARK_GROUP           | END                     | phil's group#3",                                                                 | RLBK_phil's mark #3_%_START                                                             | postgres
   10391 | ROLLBACK_SEQUENCE        |                         | "phil's schema3"."myTbl2\_col21_seq"                                             |                                                                                         | postgres
   10392 | ROLLBACK_SEQUENCE        |                         | "phil's schema3"."phil's seq\1"                                                  |                                                                                         | postgres
   10393 | SET_MARK_GROUP           | BEGIN                   | phil's group#3",                                                                 | RLBK_phil's mark #3_%_DONE                                                              | postgres
   10394 | SET_MARK_GROUP           | END                     | phil's group#3",                                                                 | RLBK_phil's mark #3_%_DONE                                                              | postgres
   10395 | ROLLBACK_GROUP           | NOTICE                  | Rollback id 10011                                                                | 0 / 2 tables effectively processed.                                                     | postgres
   10396 | ROLLBACK_GROUP           | NOTICE                  | Rollback id 10011                                                                | 2 sequences processed.                                                                  | postgres
   10397 | DBLINK_CLOSE_CNX         |                         | rlbk#1                                                                           |                                                                                         | postgres
   10398 | ROLLBACK_GROUP           | END                     | phil's group#3",                                                                 | Rollback_id 10011, 0 tables and 2 sequences effectively processed                       | postgres
   10399 | ROLLBACK_GROUP           | BEGIN                   | phil's group#3",                                                                 | Unlogged rollback to mark phil's mark #3 (timestamp)                                    | postgres
   10400 | DBLINK_OPEN_CNX          |                         | rlbk#1                                                                           | Status = 1                                                                              | postgres
   10401 | LOCK_GROUP               | BEGIN                   | phil's group#3",                                                                 | Rollback session #1                                                                     | postgres
   10402 | LOCK_GROUP               | END                     | phil's group#3",                                                                 | Rollback session #1: 2 tables locked, 0 deadlock(s)                                     | postgres
   10403 | ROLLBACK_GROUP           | MARK DELETED            | phil's group#3",                                                                 | mark RLBK_phil's mark #3_%_START is deleted                                             | postgres
   10404 | ROLLBACK_GROUP           | MARK DELETED            | phil's group#3",                                                                 | mark RLBK_phil's mark #3_%_DONE is deleted                                              | postgres
   10405 | ROLLBACK_SEQUENCE        |                         | "phil's schema3"."myTbl2\_col21_seq"                                             |                                                                                         | postgres
   10406 | ROLLBACK_SEQUENCE        |                         | "phil's schema3"."phil's seq\1"                                                  |                                                                                         | postgres
   10407 | ROLLBACK_GROUP           | NOTICE                  | Rollback id 10012                                                                | 0 / 2 tables effectively processed.                                                     | postgres
   10408 | ROLLBACK_GROUP           | NOTICE                  | Rollback id 10012                                                                | 2 sequences processed.                                                                  | postgres
   10409 | DBLINK_CLOSE_CNX         |                         | rlbk#1                                                                           |                                                                                         | postgres
   10410 | ROLLBACK_GROUP           | END                     | phil's group#3",                                                                 | Rollback_id 10012, 0 tables and 2 sequences effectively processed                       | postgres
   10411 | ROLLBACK_GROUP           | BEGIN                   | myGroup1                                                                         | Unlogged rollback to mark Multi-1 (timestamp)                                           | postgres
   10412 | DBLINK_OPEN_CNX          |                         | rlbk#1                                                                           | Status = 1                                                                              | postgres
   10413 | LOCK_GROUP               | BEGIN                   | myGroup1                                                                         | Rollback session #1                                                                     | postgres
   10414 | LOCK_GROUP               | END                     | myGroup1                                                                         | Rollback session #1: 5 tables locked, 0 deadlock(s)                                     | postgres
   10415 | ROLLBACK_TABLE           | BEGIN                   | myschema1.mytbl1                                                                 | All log rows with emaj_gid > 100161 and <= 100236                                       | postgres
   10416 | ROLLBACK_TABLE           | END                     | myschema1.mytbl1                                                                 | 0 rolled back primary keys                                                              | postgres
   10417 | ROLLBACK_SEQUENCE        |                         | myschema1."myTbl3_col31_seq"                                                     |                                                                                         | postgres
   10418 | ROLLBACK_SEQUENCE        |                         | myschema1.mytbl2b_col20_seq                                                      |                                                                                         | postgres
   10419 | ROLLBACK_GROUP           | NOTICE                  | Rollback id 10013                                                                | 1 / 5 tables effectively processed.                                                     | postgres
   10420 | ROLLBACK_GROUP           | NOTICE                  | Rollback id 10013                                                                | 2 sequences processed.                                                                  | postgres
   10421 | DBLINK_CLOSE_CNX         |                         | rlbk#1                                                                           |                                                                                         | postgres
   10422 | ROLLBACK_GROUP           | END                     | myGroup1                                                                         | Rollback_id 10013, 1 tables and 2 sequences effectively processed                       | postgres
   10470 | STOP_GROUP               | BEGIN                   | phil's group#3",                                                                 |                                                                                         | postgres
   10471 | LOCK_GROUP               | BEGIN                   | phil's group#3",                                                                 |                                                                                         | postgres
   10472 | LOCK_GROUP               | END                     | phil's group#3",                                                                 | 2 tables locked, 0 deadlock(s)                                                          | postgres
   10473 | SET_MARK_GROUP           | BEGIN                   | phil's group#3",                                                                 | STOP_%                                                                                  | postgres
   10474 | CLEANUP_RLBK_STATE       |                         | Rollback id 10011                                                                | set to COMMITTED                                                                        | postgres
   10475 | CLEANUP_RLBK_STATE       |                         | Rollback id 10012                                                                | set to COMMITTED                                                                        | postgres
   10476 | CLEANUP_RLBK_STATE       |                         | Rollback id 10013                                                                | set to COMMITTED                                                                        | postgres
   10477 | CLEANUP_RLBK_STATE       |                         | Rollback id 10014                                                                | set to ABORTED                                                                          | postgres
   10478 | CLEANUP_RLBK_STATE       |                         | Rollback id 10015                                                                | set to ABORTED                                                                          | postgres
   10479 | CLEANUP_RLBK_STATE       |                         | Rollback id 10016                                                                | set to ABORTED                                                                          | postgres
   10480 | SET_MARK_GROUP           | END                     | phil's group#3",                                                                 | STOP_%                                                                                  | postgres
   10481 | STOP_GROUP               | END                     | phil's group#3",                                                                 | 4 tables/sequences processed                                                            | postgres
   10482 | ALTER_GROUP              | BEGIN                   | phil's group#3",                                                                 |                                                                                         | postgres
   10483 | ALTER_GROUP              | END                     | phil's group#3",                                                                 | Timestamp Id : 10053                                                                    | postgres
   10484 | START_GROUP              | BEGIN                   | phil's group#3",                                                                 | With log reset                                                                          | postgres
   10485 | LOCK_GROUP               | BEGIN                   | phil's group#3",                                                                 |                                                                                         | postgres
   10486 | LOCK_GROUP               | END                     | phil's group#3",                                                                 | 2 tables locked, 0 deadlock(s)                                                          | postgres
   10487 | SET_MARK_GROUP           | BEGIN                   | phil's group#3",                                                                 | M1_after_alter_group                                                                    | postgres
   10488 | SET_MARK_GROUP           | END                     | phil's group#3",                                                                 | M1_after_alter_group                                                                    | postgres
   10489 | START_GROUP              | END                     | phil's group#3",                                                                 | 4 tables/sequences processed                                                            | postgres
   10490 | SET_MARK_GROUP           | BEGIN                   | phil's group#3",                                                                 |                                                                                         | postgres
   10491 | LOCK_GROUP               | BEGIN                   | phil's group#3",                                                                 |                                                                                         | postgres
   10492 | LOCK_GROUP               | END                     | phil's group#3",                                                                 | 2 tables locked, 0 deadlock(s)                                                          | postgres
   10493 | SET_MARK_GROUP           | END                     | phil's group#3",                                                                 | M2                                                                                      | postgres
   10494 | ROLLBACK_GROUP           | BEGIN                   | phil's group#3",                                                                 | Unlogged rollback to mark M1_after_alter_group (timestamp)                              | postgres
   10495 | DBLINK_OPEN_CNX          |                         | rlbk#1                                                                           | Status = 1                                                                              | postgres
   10496 | LOCK_GROUP               | BEGIN                   | phil's group#3",                                                                 | Rollback session #1                                                                     | postgres
   10497 | LOCK_GROUP               | END                     | phil's group#3",                                                                 | Rollback session #1: 2 tables locked, 0 deadlock(s)                                     | postgres
   10498 | ROLLBACK_TABLE           | BEGIN                   | "phil's schema3".table_with_very_looooooooooooooooooooooooooooooooooooooong_name | All log rows with emaj_gid > 100256 and <= 100262                                       | postgres
   10499 | ROLLBACK_TABLE           | END                     | "phil's schema3".table_with_very_looooooooooooooooooooooooooooooooooooooong_name | 10 rolled back primary keys                                                             | postgres
   10500 | ROLLBACK_GROUP           | MARK DELETED            | phil's group#3",                                                                 | mark M2 is deleted                                                                      | postgres
   10501 | ROLLBACK_SEQUENCE        |                         | "phil's schema3"."myTbl2\_col21_seq"                                             |                                                                                         | postgres
   10502 | ROLLBACK_SEQUENCE        |                         | "phil's schema3"."phil's seq\1"                                                  |                                                                                         | postgres
   10503 | ROLLBACK_GROUP           | NOTICE                  | Rollback id 10017                                                                | 1 / 2 tables effectively processed.                                                     | postgres
   10504 | ROLLBACK_GROUP           | NOTICE                  | Rollback id 10017                                                                | 2 sequences processed.                                                                  | postgres
   10505 | DBLINK_CLOSE_CNX         |                         | rlbk#1                                                                           |                                                                                         | postgres
   10506 | ROLLBACK_GROUP           | END                     | phil's group#3",                                                                 | Rollback_id 10017, 1 tables and 2 sequences effectively processed                       | postgres
   10507 | STOP_GROUP               | BEGIN                   | phil's group#3",                                                                 |                                                                                         | postgres
   10508 | LOCK_GROUP               | BEGIN                   | phil's group#3",                                                                 |                                                                                         | postgres
   10509 | LOCK_GROUP               | END                     | phil's group#3",                                                                 | 2 tables locked, 0 deadlock(s)                                                          | postgres
   10510 | SET_MARK_GROUP           | BEGIN                   | phil's group#3",                                                                 | STOP_%                                                                                  | postgres
   10511 | CLEANUP_RLBK_STATE       |                         | Rollback id 10017                                                                | set to COMMITTED                                                                        | postgres
   10512 | SET_MARK_GROUP           | END                     | phil's group#3",                                                                 | STOP_%                                                                                  | postgres
   10513 | STOP_GROUP               | END                     | phil's group#3",                                                                 | 4 tables/sequences processed                                                            | postgres
   10514 | DROP_GROUP               | BEGIN                   | phil's group#3",                                                                 |                                                                                         | postgres
   10515 | DROP_GROUP               | SCHEMA DROPPED          | "emaj #'3"                                                                       |                                                                                         | postgres
   10516 | DROP_GROUP               | END                     | phil's group#3",                                                                 | 4 tables/sequences processed                                                            | postgres
   10517 | PROTECT_GROUP            |                         | myGroup2                                                                         | Status 1                                                                                | postgres
   10518 | UNPROTECT_GROUP          |                         | myGroup2                                                                         | Status 1                                                                                | postgres
   10519 | SET_MARK_GROUP           | BEGIN                   | myGroup1                                                                         |                                                                                         | postgres
   10520 | LOCK_GROUP               | BEGIN                   | myGroup1                                                                         |                                                                                         | postgres
   10521 | LOCK_GROUP               | END                     | myGroup1                                                                         | 5 tables locked, 0 deadlock(s)                                                          | postgres
   10522 | SET_MARK_GROUP           | END                     | myGroup1                                                                         | Mark_to_protect                                                                         | postgres
   10523 | PROTECT_MARK_GROUP       |                         | myGroup1                                                                         | Mark Mark_to_protect ; status 1                                                         | postgres
   10524 | UNPROTECT_MARK_GROUP     |                         | myGroup1                                                                         | Mark Mark_to_protect ; status 1                                                         | postgres
   10525 | DELETE_MARK_GROUP        | BEGIN                   | myGroup1                                                                         | Mark_to_protect                                                                         | postgres
   10526 | DELETE_MARK_GROUP        | END                     | myGroup1                                                                         | Mark_to_protect                                                                         | postgres
   10527 | SET_MARK_GROUP           | BEGIN                   | myGroup1                                                                         |                                                                                         | postgres
   10528 | LOCK_GROUP               | BEGIN                   | myGroup1                                                                         |                                                                                         | postgres
   10529 | LOCK_GROUP               | END                     | myGroup1                                                                         | 5 tables locked, 0 deadlock(s)                                                          | postgres
   10530 | SET_MARK_GROUP           | END                     | myGroup1                                                                         | MC1                                                                                     | postgres
   10531 | SET_MARK_GROUP           | BEGIN                   | myGroup1                                                                         |                                                                                         | postgres
   10532 | LOCK_GROUP               | BEGIN                   | myGroup1                                                                         |                                                                                         | postgres
   10533 | LOCK_GROUP               | END                     | myGroup1                                                                         | 5 tables locked, 0 deadlock(s)                                                          | postgres
   10534 | SET_MARK_GROUP           | END                     | myGroup1                                                                         | MC2                                                                                     | postgres
   10535 | ROLLBACK_GROUP           | BEGIN                   | myGroup1                                                                         | Logged rollback to mark MC1 (timestamp)                                                 | postgres
   10536 | DBLINK_OPEN_CNX          |                         | rlbk#1                                                                           | Status = 1                                                                              | postgres
   10537 | LOCK_GROUP               | BEGIN                   | myGroup1                                                                         | Rollback session #1                                                                     | postgres
   10538 | LOCK_GROUP               | END                     | myGroup1                                                                         | Rollback session #1: 5 tables locked, 0 deadlock(s)                                     | postgres
   10539 | SET_MARK_GROUP           | BEGIN                   | myGroup1                                                                         | RLBK_MC1_%_START                                                                        | postgres
   10540 | SET_MARK_GROUP           | END                     | myGroup1                                                                         | RLBK_MC1_%_START                                                                        | postgres
   10541 | ROLLBACK_TABLE           | BEGIN                   | myschema1.mytbl1                                                                 | All log rows with emaj_gid > 100262 and <= 100279                                       | postgres
   10542 | ROLLBACK_TABLE           | END                     | myschema1.mytbl1                                                                 | 13 rolled back primary keys                                                             | postgres
   10543 | ROLLBACK_TABLE           | BEGIN                   | myschema1.mytbl2                                                                 | All log rows with emaj_gid > 100262 and <= 100279                                       | postgres
   10544 | ROLLBACK_TABLE           | END                     | myschema1.mytbl2                                                                 | 1 rolled back primary keys                                                              | postgres
   10545 | ROLLBACK_SEQUENCE        |                         | myschema1."myTbl3_col31_seq"                                                     |                                                                                         | postgres
   10546 | ROLLBACK_SEQUENCE        |                         | myschema1.mytbl2b_col20_seq                                                      |                                                                                         | postgres
   10547 | SET_MARK_GROUP           | BEGIN                   | myGroup1                                                                         | RLBK_MC1_%_DONE                                                                         | postgres
   10548 | SET_MARK_GROUP           | END                     | myGroup1                                                                         | RLBK_MC1_%_DONE                                                                         | postgres
   10549 | ROLLBACK_GROUP           | NOTICE                  | Rollback id 10018                                                                | 2 / 5 tables effectively processed.                                                     | postgres
   10550 | ROLLBACK_GROUP           | NOTICE                  | Rollback id 10018                                                                | 2 sequences processed.                                                                  | postgres
   10551 | DBLINK_CLOSE_CNX         |                         | rlbk#1                                                                           |                                                                                         | postgres
   10552 | ROLLBACK_GROUP           | END                     | myGroup1                                                                         | Rollback_id 10018, 2 tables and 2 sequences effectively processed                       | postgres
   10553 | RENAME_MARK_GROUP        | BEGIN                   | myGroup1                                                                         | EMAJ_LAST_MARK                                                                          | postgres
   10554 | RENAME_MARK_GROUP        | END                     | myGroup1                                                                         | RLBK_MC1_%_DONE renamed RLBK_MC1_DONE                                                   | postgres
   10555 | SET_MARK_GROUP           | BEGIN                   | myGroup1                                                                         |                                                                                         | postgres
   10556 | LOCK_GROUP               | BEGIN                   | myGroup1                                                                         |                                                                                         | postgres
   10557 | LOCK_GROUP               | END                     | myGroup1                                                                         | 5 tables locked, 0 deadlock(s)                                                          | postgres
   10558 | CLEANUP_RLBK_STATE       |                         | Rollback id 10018                                                                | set to COMMITTED                                                                        | postgres
   10559 | SET_MARK_GROUP           | END                     | myGroup1                                                                         | MC3                                                                                     | postgres
   10560 | SET_MARK_GROUP           | BEGIN                   | myGroup1                                                                         |                                                                                         | postgres
   10561 | LOCK_GROUP               | BEGIN                   | myGroup1                                                                         |                                                                                         | postgres
   10562 | LOCK_GROUP               | END                     | myGroup1                                                                         | 5 tables locked, 0 deadlock(s)                                                          | postgres
   10563 | SET_MARK_GROUP           | END                     | myGroup1                                                                         | MC4                                                                                     | postgres
   10564 | SET_MARK_GROUP           | BEGIN                   | myGroup1                                                                         |                                                                                         | postgres
   10565 | LOCK_GROUP               | BEGIN                   | myGroup1                                                                         |                                                                                         | postgres
   10566 | LOCK_GROUP               | END                     | myGroup1                                                                         | 5 tables locked, 0 deadlock(s)                                                          | postgres
   10567 | SET_MARK_GROUP           | END                     | myGroup1                                                                         | MC5                                                                                     | postgres
   10568 | ROLLBACK_GROUP           | BEGIN                   | myGroup1                                                                         | Logged rollback to mark MC3 (timestamp)                                                 | postgres
   10569 | DBLINK_OPEN_CNX          |                         | rlbk#1                                                                           | Status = 1                                                                              | postgres
   10570 | LOCK_GROUP               | BEGIN                   | myGroup1                                                                         | Rollback session #1                                                                     | postgres
   10571 | LOCK_GROUP               | END                     | myGroup1                                                                         | Rollback session #1: 5 tables locked, 0 deadlock(s)                                     | postgres
   10572 | SET_MARK_GROUP           | BEGIN                   | myGroup1                                                                         | RLBK_MC3_%_START                                                                        | postgres
   10573 | SET_MARK_GROUP           | END                     | myGroup1                                                                         | RLBK_MC3_%_START                                                                        | postgres
   10574 | ROLLBACK_TABLE           | BEGIN                   | myschema1."myTbl3"                                                               | All log rows with emaj_gid > 100292 and <= 100304                                       | postgres
   10575 | ROLLBACK_TABLE           | END                     | myschema1."myTbl3"                                                               | 10 rolled back primary keys                                                             | postgres
   10576 | ROLLBACK_TABLE           | BEGIN                   | myschema1.mytbl4                                                                 | All log rows with emaj_gid > 100292 and <= 100304                                       | postgres
   10577 | ROLLBACK_TABLE           | END                     | myschema1.mytbl4                                                                 | 1 rolled back primary keys                                                              | postgres
   10578 | ROLLBACK_SEQUENCE        |                         | myschema1."myTbl3_col31_seq"                                                     | RESTART 21                                                                              | postgres
   10579 | ROLLBACK_SEQUENCE        |                         | myschema1.mytbl2b_col20_seq                                                      |                                                                                         | postgres
   10580 | SET_MARK_GROUP           | BEGIN                   | myGroup1                                                                         | RLBK_MC3_%_DONE                                                                         | postgres
   10581 | SET_MARK_GROUP           | END                     | myGroup1                                                                         | RLBK_MC3_%_DONE                                                                         | postgres
   10582 | ROLLBACK_GROUP           | NOTICE                  | Rollback id 10019                                                                | 2 / 5 tables effectively processed.                                                     | postgres
   10583 | ROLLBACK_GROUP           | NOTICE                  | Rollback id 10019                                                                | 2 sequences processed.                                                                  | postgres
   10584 | DBLINK_CLOSE_CNX         |                         | rlbk#1                                                                           |                                                                                         | postgres
   10585 | ROLLBACK_GROUP           | END                     | myGroup1                                                                         | Rollback_id 10019, 2 tables and 2 sequences effectively processed                       | postgres
   10586 | CONSOLIDATE_RLBK_GROUP   | BEGIN                   | myGroup1                                                                         | Erase all between marks MC1 and RLBK_MC1_DONE                                           | postgres
   10587 | CONSOLIDATE_RLBK_GROUP   | END                     | myGroup1                                                                         | 2 tables and 2 sequences processed ; 2 marks deleted                                    | postgres
   10588 | CONSOLIDATE_RLBK_GROUP   | BEGIN                   | myGroup1                                                                         | Erase all between marks MC3 and RLBK_MC3_%_DONE                                         | postgres
   10589 | CONSOLIDATE_RLBK_GROUP   | END                     | myGroup1                                                                         | 2 tables and 2 sequences processed ; 3 marks deleted                                    | postgres
   10590 | SET_MARK_GROUP           | BEGIN                   | myGroup1                                                                         |                                                                                         | postgres
   10591 | LOCK_GROUP               | BEGIN                   | myGroup1                                                                         |                                                                                         | postgres
   10592 | LOCK_GROUP               | END                     | myGroup1                                                                         | 5 tables locked, 0 deadlock(s)                                                          | postgres
   10593 | CLEANUP_RLBK_STATE       |                         | Rollback id 10019                                                                | set to COMMITTED                                                                        | postgres
   10594 | SET_MARK_GROUP           | END                     | myGroup1                                                                         | MC6                                                                                     | postgres
   10595 | SET_MARK_GROUP           | BEGIN                   | myGroup1                                                                         |                                                                                         | postgres
   10596 | LOCK_GROUP               | BEGIN                   | myGroup1                                                                         |                                                                                         | postgres
   10597 | LOCK_GROUP               | END                     | myGroup1                                                                         | 5 tables locked, 0 deadlock(s)                                                          | postgres
   10598 | SET_MARK_GROUP           | END                     | myGroup1                                                                         | MC7                                                                                     | postgres
   10599 | SET_MARK_GROUP           | BEGIN                   | myGroup1                                                                         |                                                                                         | postgres
   10600 | LOCK_GROUP               | BEGIN                   | myGroup1                                                                         |                                                                                         | postgres
   10601 | LOCK_GROUP               | END                     | myGroup1                                                                         | 5 tables locked, 0 deadlock(s)                                                          | postgres
   10602 | SET_MARK_GROUP           | END                     | myGroup1                                                                         | MC8                                                                                     | postgres
   10603 | ROLLBACK_GROUP           | BEGIN                   | myGroup1                                                                         | Logged rollback to mark MC8 (timestamp)                                                 | postgres
   10604 | DBLINK_OPEN_CNX          |                         | rlbk#1                                                                           | Status = 1                                                                              | postgres
   10605 | LOCK_GROUP               | BEGIN                   | myGroup1                                                                         | Rollback session #1                                                                     | postgres
   10606 | LOCK_GROUP               | END                     | myGroup1                                                                         | Rollback session #1: 5 tables locked, 0 deadlock(s)                                     | postgres
   10607 | SET_MARK_GROUP           | BEGIN                   | myGroup1                                                                         | RLBK_MC8_%_START                                                                        | postgres
   10608 | SET_MARK_GROUP           | END                     | myGroup1                                                                         | RLBK_MC8_%_START                                                                        | postgres
   10609 | ROLLBACK_TABLE           | BEGIN                   | myschema1.mytbl2                                                                 | All log rows with emaj_gid > 100332 and <= 100333                                       | postgres
   10610 | ROLLBACK_TABLE           | END                     | myschema1.mytbl2                                                                 | 1 rolled back primary keys                                                              | postgres
   10611 | ROLLBACK_SEQUENCE        |                         | myschema1."myTbl3_col31_seq"                                                     |                                                                                         | postgres
   10612 | ROLLBACK_SEQUENCE        |                         | myschema1.mytbl2b_col20_seq                                                      |                                                                                         | postgres
   10613 | SET_MARK_GROUP           | BEGIN                   | myGroup1                                                                         | RLBK_MC8_%_DONE                                                                         | postgres
   10614 | SET_MARK_GROUP           | END                     | myGroup1                                                                         | RLBK_MC8_%_DONE                                                                         | postgres
   10615 | ROLLBACK_GROUP           | NOTICE                  | Rollback id 10020                                                                | 1 / 5 tables effectively processed.                                                     | postgres
   10616 | ROLLBACK_GROUP           | NOTICE                  | Rollback id 10020                                                                | 2 sequences processed.                                                                  | postgres
   10617 | DBLINK_CLOSE_CNX         |                         | rlbk#1                                                                           |                                                                                         | postgres
   10618 | ROLLBACK_GROUP           | END                     | myGroup1                                                                         | Rollback_id 10020, 1 tables and 2 sequences effectively processed                       | postgres
   10619 | CONSOLIDATE_RLBK_GROUP   | BEGIN                   | myGroup1                                                                         | Erase all between marks MC8 and RLBK_MC8_%_DONE                                         | postgres
   10620 | CONSOLIDATE_RLBK_GROUP   | END                     | myGroup1                                                                         | 1 tables and 2 sequences processed ; 1 marks deleted                                    | postgres
   10621 | SET_MARK_GROUP           | BEGIN                   | myGroup1                                                                         |                                                                                         | postgres
   10622 | LOCK_GROUP               | BEGIN                   | myGroup1                                                                         |                                                                                         | postgres
   10623 | LOCK_GROUP               | END                     | myGroup1                                                                         | 5 tables locked, 0 deadlock(s)                                                          | postgres
   10624 | CLEANUP_RLBK_STATE       |                         | Rollback id 10020                                                                | set to COMMITTED                                                                        | postgres
   10625 | SET_MARK_GROUP           | END                     | myGroup1                                                                         | MC9                                                                                     | postgres
   10626 | ROLLBACK_GROUP           | BEGIN                   | myGroup1                                                                         | Logged rollback to mark MC6 (timestamp)                                                 | postgres
   10627 | DBLINK_OPEN_CNX          |                         | rlbk#1                                                                           | Status = 1                                                                              | postgres
   10628 | LOCK_GROUP               | BEGIN                   | myGroup1                                                                         | Rollback session #1                                                                     | postgres
   10629 | LOCK_GROUP               | END                     | myGroup1                                                                         | Rollback session #1: 5 tables locked, 0 deadlock(s)                                     | postgres
   10630 | SET_MARK_GROUP           | BEGIN                   | myGroup1                                                                         | RLBK_MC6_%_START                                                                        | postgres
   10631 | SET_MARK_GROUP           | END                     | myGroup1                                                                         | RLBK_MC6_%_START                                                                        | postgres
   10632 | ROLLBACK_TABLE           | BEGIN                   | myschema1.mytbl1                                                                 | All log rows with emaj_gid > 100315 and <= 100346                                       | postgres
   10633 | ROLLBACK_TABLE           | END                     | myschema1.mytbl1                                                                 | 13 rolled back primary keys                                                             | postgres
   10634 | ROLLBACK_TABLE           | BEGIN                   | myschema1.mytbl2                                                                 | All log rows with emaj_gid > 100315 and <= 100346                                       | postgres
   10635 | ROLLBACK_TABLE           | END                     | myschema1.mytbl2                                                                 | 1 rolled back primary keys                                                              | postgres
   10636 | ROLLBACK_TABLE           | BEGIN                   | myschema1.mytbl4                                                                 | All log rows with emaj_gid > 100315 and <= 100346                                       | postgres
   10637 | ROLLBACK_TABLE           | END                     | myschema1.mytbl4                                                                 | 1 rolled back primary keys                                                              | postgres
   10638 | ROLLBACK_TABLE           | BEGIN                   | myschema1."myTbl3"                                                               | All log rows with emaj_gid > 100315 and <= 100346                                       | postgres
   10639 | ROLLBACK_TABLE           | END                     | myschema1."myTbl3"                                                               | 10 rolled back primary keys                                                             | postgres
   10640 | ROLLBACK_SEQUENCE        |                         | myschema1."myTbl3_col31_seq"                                                     | RESTART 21                                                                              | postgres
   10641 | ROLLBACK_SEQUENCE        |                         | myschema1.mytbl2b_col20_seq                                                      |                                                                                         | postgres
   10642 | SET_MARK_GROUP           | BEGIN                   | myGroup1                                                                         | RLBK_MC6_%_DONE                                                                         | postgres
   10643 | SET_MARK_GROUP           | END                     | myGroup1                                                                         | RLBK_MC6_%_DONE                                                                         | postgres
   10644 | ROLLBACK_GROUP           | NOTICE                  | Rollback id 10021                                                                | 4 / 5 tables effectively processed.                                                     | postgres
   10645 | ROLLBACK_GROUP           | NOTICE                  | Rollback id 10021                                                                | 2 sequences processed.                                                                  | postgres
   10646 | DBLINK_CLOSE_CNX         |                         | rlbk#1                                                                           |                                                                                         | postgres
   10647 | ROLLBACK_GROUP           | END                     | myGroup1                                                                         | Rollback_id 10021, 4 tables and 2 sequences effectively processed                       | postgres
   10648 | CONSOLIDATE_RLBK_GROUP   | BEGIN                   | myGroup1                                                                         | Erase all between marks MC6 and RLBK_MC6_%_DONE                                         | postgres
   10649 | CONSOLIDATE_RLBK_GROUP   | END                     | myGroup1                                                                         | 4 tables and 2 sequences processed ; 5 marks deleted                                    | postgres
   10650 | SET_MARK_GROUP           | BEGIN                   | myGroup1                                                                         |                                                                                         | postgres
   10651 | LOCK_GROUP               | BEGIN                   | myGroup1                                                                         |                                                                                         | postgres
   10652 | LOCK_GROUP               | END                     | myGroup1                                                                         | 5 tables locked, 0 deadlock(s)                                                          | postgres
   10653 | CLEANUP_RLBK_STATE       |                         | Rollback id 10021                                                                | set to COMMITTED                                                                        | postgres
   10654 | SET_MARK_GROUP           | END                     | myGroup1                                                                         | MC10                                                                                    | postgres
   10655 | ROLLBACK_GROUP           | BEGIN                   | myGroup1                                                                         | Logged rollback to mark MC10 (timestamp)                                                | postgres
   10656 | DBLINK_OPEN_CNX          |                         | rlbk#1                                                                           | Status = 1                                                                              | postgres
   10657 | LOCK_GROUP               | BEGIN                   | myGroup1                                                                         | Rollback session #1                                                                     | postgres
   10658 | LOCK_GROUP               | END                     | myGroup1                                                                         | Rollback session #1: 5 tables locked, 0 deadlock(s)                                     | postgres
   10659 | SET_MARK_GROUP           | BEGIN                   | myGroup1                                                                         | RLBK_MC10_%_START                                                                       | postgres
   10660 | SET_MARK_GROUP           | END                     | myGroup1                                                                         | RLBK_MC10_%_START                                                                       | postgres
   10661 | ROLLBACK_TABLE           | BEGIN                   | myschema1.mytbl1                                                                 | All log rows with emaj_gid > 100369 and <= 100385                                       | postgres
   10662 | ROLLBACK_TABLE           | END                     | myschema1.mytbl1                                                                 | 11 rolled back primary keys                                                             | postgres
   10663 | ROLLBACK_SEQUENCE        |                         | myschema1."myTbl3_col31_seq"                                                     |                                                                                         | postgres
   10664 | ROLLBACK_SEQUENCE        |                         | myschema1.mytbl2b_col20_seq                                                      |                                                                                         | postgres
   10665 | SET_MARK_GROUP           | BEGIN                   | myGroup1                                                                         | RLBK_MC10_%_DONE                                                                        | postgres
   10666 | SET_MARK_GROUP           | END                     | myGroup1                                                                         | RLBK_MC10_%_DONE                                                                        | postgres
   10667 | ROLLBACK_GROUP           | NOTICE                  | Rollback id 10022                                                                | 1 / 5 tables effectively processed.                                                     | postgres
   10668 | ROLLBACK_GROUP           | NOTICE                  | Rollback id 10022                                                                | 2 sequences processed.                                                                  | postgres
   10669 | DBLINK_CLOSE_CNX         |                         | rlbk#1                                                                           |                                                                                         | postgres
   10670 | ROLLBACK_GROUP           | END                     | myGroup1                                                                         | Rollback_id 10022, 1 tables and 2 sequences effectively processed                       | postgres
   10671 | SET_MARK_GROUP           | BEGIN                   | myGroup1                                                                         |                                                                                         | postgres
   10672 | LOCK_GROUP               | BEGIN                   | myGroup1                                                                         |                                                                                         | postgres
   10673 | LOCK_GROUP               | END                     | myGroup1                                                                         | 5 tables locked, 0 deadlock(s)                                                          | postgres
   10674 | CLEANUP_RLBK_STATE       |                         | Rollback id 10022                                                                | set to COMMITTED                                                                        | postgres
   10675 | SET_MARK_GROUP           | END                     | myGroup1                                                                         | MC11                                                                                    | postgres
   10676 | ROLLBACK_GROUP           | BEGIN                   | myGroup1                                                                         | Logged rollback to mark MC10 (timestamp)                                                | postgres
   10677 | DBLINK_OPEN_CNX          |                         | rlbk#1                                                                           | Status = 1                                                                              | postgres
   10678 | LOCK_GROUP               | BEGIN                   | myGroup1                                                                         | Rollback session #1                                                                     | postgres
   10679 | LOCK_GROUP               | END                     | myGroup1                                                                         | Rollback session #1: 5 tables locked, 0 deadlock(s)                                     | postgres
   10680 | SET_MARK_GROUP           | BEGIN                   | myGroup1                                                                         | RLBK_MC10_%_START                                                                       | postgres
   10681 | SET_MARK_GROUP           | END                     | myGroup1                                                                         | RLBK_MC10_%_START                                                                       | postgres
   10682 | ROLLBACK_TABLE           | BEGIN                   | myschema1.mytbl1                                                                 | All log rows with emaj_gid > 100369 and <= 100393                                       | postgres
   10683 | ROLLBACK_TABLE           | END                     | myschema1.mytbl1                                                                 | 11 rolled back primary keys                                                             | postgres
   10684 | ROLLBACK_TABLE           | BEGIN                   | myschema1.mytbl4                                                                 | All log rows with emaj_gid > 100369 and <= 100393                                       | postgres
   10685 | ROLLBACK_TABLE           | END                     | myschema1.mytbl4                                                                 | 1 rolled back primary keys                                                              | postgres
   10686 | ROLLBACK_SEQUENCE        |                         | myschema1."myTbl3_col31_seq"                                                     |                                                                                         | postgres
   10687 | ROLLBACK_SEQUENCE        |                         | myschema1.mytbl2b_col20_seq                                                      |                                                                                         | postgres
   10688 | SET_MARK_GROUP           | BEGIN                   | myGroup1                                                                         | RLBK_MC10_%_DONE                                                                        | postgres
   10689 | SET_MARK_GROUP           | END                     | myGroup1                                                                         | RLBK_MC10_%_DONE                                                                        | postgres
   10690 | ROLLBACK_GROUP           | NOTICE                  | Rollback id 10023                                                                | 2 / 5 tables effectively processed.                                                     | postgres
   10691 | ROLLBACK_GROUP           | NOTICE                  | Rollback id 10023                                                                | 2 sequences processed.                                                                  | postgres
   10692 | DBLINK_CLOSE_CNX         |                         | rlbk#1                                                                           |                                                                                         | postgres
   10693 | ROLLBACK_GROUP           | END                     | myGroup1                                                                         | Rollback_id 10023, 2 tables and 2 sequences effectively processed                       | postgres
   10694 | CONSOLIDATE_RLBK_GROUP   | BEGIN                   | myGroup1                                                                         | Erase all between marks MC10 and RLBK_MC10_%_DONE                                       | postgres
   10695 | CONSOLIDATE_RLBK_GROUP   | END                     | myGroup1                                                                         | 2 tables and 2 sequences processed ; 4 marks deleted                                    | postgres
   10696 | SET_MARK_GROUP           | BEGIN                   | myGroup1                                                                         |                                                                                         | postgres
   10697 | LOCK_GROUP               | BEGIN                   | myGroup1                                                                         |                                                                                         | postgres
   10698 | LOCK_GROUP               | END                     | myGroup1                                                                         | 5 tables locked, 0 deadlock(s)                                                          | postgres
   10699 | CLEANUP_RLBK_STATE       |                         | Rollback id 10023                                                                | set to COMMITTED                                                                        | postgres
   10700 | SET_MARK_GROUP           | END                     | myGroup1                                                                         | MC15                                                                                    | postgres
   10701 | SET_MARK_GROUP           | BEGIN                   | myGroup1                                                                         |                                                                                         | postgres
   10702 | LOCK_GROUP               | BEGIN                   | myGroup1                                                                         |                                                                                         | postgres
   10703 | LOCK_GROUP               | END                     | myGroup1                                                                         | 5 tables locked, 0 deadlock(s)                                                          | postgres
   10704 | SET_MARK_GROUP           | END                     | myGroup1                                                                         | MC16                                                                                    | postgres
   10705 | ROLLBACK_GROUP           | BEGIN                   | myGroup1                                                                         | Logged rollback to mark MC15 (timestamp)                                                | postgres
   10706 | DBLINK_OPEN_CNX          |                         | rlbk#1                                                                           | Status = 1                                                                              | postgres
   10707 | LOCK_GROUP               | BEGIN                   | myGroup1                                                                         | Rollback session #1                                                                     | postgres
   10708 | LOCK_GROUP               | END                     | myGroup1                                                                         | Rollback session #1: 5 tables locked, 0 deadlock(s)                                     | postgres
   10709 | SET_MARK_GROUP           | BEGIN                   | myGroup1                                                                         | RLBK_MC15_%_START                                                                       | postgres
   10710 | SET_MARK_GROUP           | END                     | myGroup1                                                                         | RLBK_MC15_%_START                                                                       | postgres
   10711 | ROLLBACK_TABLE           | BEGIN                   | myschema1.mytbl1                                                                 | All log rows with emaj_gid > 100394 and <= 100411                                       | postgres
   10712 | ROLLBACK_TABLE           | END                     | myschema1.mytbl1                                                                 | 13 rolled back primary keys                                                             | postgres
   10713 | ROLLBACK_TABLE           | BEGIN                   | myschema1.mytbl2                                                                 | All log rows with emaj_gid > 100394 and <= 100411                                       | postgres
   10714 | ROLLBACK_TABLE           | END                     | myschema1.mytbl2                                                                 | 1 rolled back primary keys                                                              | postgres
   10715 | ROLLBACK_SEQUENCE        |                         | myschema1."myTbl3_col31_seq"                                                     |                                                                                         | postgres
   10716 | ROLLBACK_SEQUENCE        |                         | myschema1.mytbl2b_col20_seq                                                      |                                                                                         | postgres
   10717 | SET_MARK_GROUP           | BEGIN                   | myGroup1                                                                         | RLBK_MC15_%_DONE                                                                        | postgres
   10718 | SET_MARK_GROUP           | END                     | myGroup1                                                                         | RLBK_MC15_%_DONE                                                                        | postgres
   10719 | ROLLBACK_GROUP           | NOTICE                  | Rollback id 10024                                                                | 2 / 5 tables effectively processed.                                                     | postgres
   10720 | ROLLBACK_GROUP           | NOTICE                  | Rollback id 10024                                                                | 2 sequences processed.                                                                  | postgres
   10721 | DBLINK_CLOSE_CNX         |                         | rlbk#1                                                                           |                                                                                         | postgres
   10722 | ROLLBACK_GROUP           | END                     | myGroup1                                                                         | Rollback_id 10024, 2 tables and 2 sequences effectively processed                       | postgres
   10723 | RENAME_MARK_GROUP        | BEGIN                   | myGroup1                                                                         | EMAJ_LAST_MARK                                                                          | postgres
   10724 | RENAME_MARK_GROUP        | END                     | myGroup1                                                                         | RLBK_MC15_%_DONE renamed RLBK_MC15_DONE                                                 | postgres
   10725 | SET_MARK_GROUP           | BEGIN                   | myGroup1                                                                         |                                                                                         | postgres
   10726 | LOCK_GROUP               | BEGIN                   | myGroup1                                                                         |                                                                                         | postgres
   10727 | LOCK_GROUP               | END                     | myGroup1                                                                         | 5 tables locked, 0 deadlock(s)                                                          | postgres
   10728 | CLEANUP_RLBK_STATE       |                         | Rollback id 10024                                                                | set to COMMITTED                                                                        | postgres
   10729 | SET_MARK_GROUP           | END                     | myGroup1                                                                         | MC17                                                                                    | postgres
   10730 | ROLLBACK_GROUP           | BEGIN                   | myGroup1                                                                         | Logged rollback to mark MC16 (timestamp)                                                | postgres
   10731 | DBLINK_OPEN_CNX          |                         | rlbk#1                                                                           | Status = 1                                                                              | postgres
   10732 | LOCK_GROUP               | BEGIN                   | myGroup1                                                                         | Rollback session #1                                                                     | postgres
   10733 | LOCK_GROUP               | END                     | myGroup1                                                                         | Rollback session #1: 5 tables locked, 0 deadlock(s)                                     | postgres
   10734 | SET_MARK_GROUP           | BEGIN                   | myGroup1                                                                         | RLBK_MC16_%_START                                                                       | postgres
   10735 | SET_MARK_GROUP           | END                     | myGroup1                                                                         | RLBK_MC16_%_START                                                                       | postgres
   10736 | ROLLBACK_TABLE           | BEGIN                   | myschema1.mytbl1                                                                 | All log rows with emaj_gid > 100410 and <= 100424                                       | postgres
   10737 | ROLLBACK_TABLE           | END                     | myschema1.mytbl1                                                                 | 11 rolled back primary keys                                                             | postgres
   10738 | ROLLBACK_TABLE           | BEGIN                   | myschema1.mytbl2                                                                 | All log rows with emaj_gid > 100410 and <= 100424                                       | postgres
   10739 | ROLLBACK_TABLE           | END                     | myschema1.mytbl2                                                                 | 2 rolled back primary keys                                                              | postgres
   10740 | ROLLBACK_SEQUENCE        |                         | myschema1."myTbl3_col31_seq"                                                     |                                                                                         | postgres
   10741 | ROLLBACK_SEQUENCE        |                         | myschema1.mytbl2b_col20_seq                                                      |                                                                                         | postgres
   10742 | SET_MARK_GROUP           | BEGIN                   | myGroup1                                                                         | RLBK_MC16_%_DONE                                                                        | postgres
   10743 | SET_MARK_GROUP           | END                     | myGroup1                                                                         | RLBK_MC16_%_DONE                                                                        | postgres
   10744 | ROLLBACK_GROUP           | NOTICE                  | Rollback id 10025                                                                | 2 / 5 tables effectively processed.                                                     | postgres
   10745 | ROLLBACK_GROUP           | NOTICE                  | Rollback id 10025                                                                | 2 sequences processed.                                                                  | postgres
   10746 | DBLINK_CLOSE_CNX         |                         | rlbk#1                                                                           |                                                                                         | postgres
   10747 | ROLLBACK_GROUP           | END                     | myGroup1                                                                         | Rollback_id 10025, 2 tables and 2 sequences effectively processed                       | postgres
   10748 | CONSOLIDATE_RLBK_GROUP   | BEGIN                   | myGroup1                                                                         | Erase all between marks MC15 and RLBK_MC15_DONE                                         | postgres
   10749 | CONSOLIDATE_RLBK_GROUP   | END                     | myGroup1                                                                         | 2 tables and 2 sequences processed ; 2 marks deleted                                    | postgres
   10750 | ROLLBACK_GROUP           | BEGIN                   | myGroup1                                                                         | Unlogged rollback to mark Multi-1 (timestamp)                                           | postgres
   10751 | DBLINK_OPEN_CNX          |                         | rlbk#1                                                                           | Status = 1                                                                              | postgres
   10752 | LOCK_GROUP               | BEGIN                   | myGroup1                                                                         | Rollback session #1                                                                     | postgres
   10753 | LOCK_GROUP               | END                     | myGroup1                                                                         | Rollback session #1: 5 tables locked, 0 deadlock(s)                                     | postgres
   10754 | ROLLBACK_TABLE           | BEGIN                   | myschema1.mytbl1                                                                 | All log rows with emaj_gid > 100161 and <= 100437                                       | postgres
   10755 | ROLLBACK_TABLE           | END                     | myschema1.mytbl1                                                                 | 11 rolled back primary keys                                                             | postgres
   10756 | ROLLBACK_TABLE           | BEGIN                   | myschema1.mytbl2                                                                 | All log rows with emaj_gid > 100161 and <= 100437                                       | postgres
   10757 | ROLLBACK_TABLE           | END                     | myschema1.mytbl2                                                                 | 3 rolled back primary keys                                                              | postgres
   10758 | ROLLBACK_GROUP           | MARK DELETED            | myGroup1                                                                         | mark MC1 is deleted                                                                     | postgres
   10759 | ROLLBACK_GROUP           | MARK DELETED            | myGroup1                                                                         | mark RLBK_MC1_DONE is deleted                                                           | postgres
   10760 | ROLLBACK_GROUP           | MARK DELETED            | myGroup1                                                                         | mark MC3 is deleted                                                                     | postgres
   10761 | ROLLBACK_GROUP           | MARK DELETED            | myGroup1                                                                         | mark RLBK_MC3_%_DONE is deleted                                                         | postgres
   10762 | ROLLBACK_GROUP           | MARK DELETED            | myGroup1                                                                         | mark MC6 is deleted                                                                     | postgres
   10763 | ROLLBACK_GROUP           | MARK DELETED            | myGroup1                                                                         | mark RLBK_MC6_%_DONE is deleted                                                         | postgres
   10764 | ROLLBACK_GROUP           | MARK DELETED            | myGroup1                                                                         | mark MC10 is deleted                                                                    | postgres
   10765 | ROLLBACK_GROUP           | MARK DELETED            | myGroup1                                                                         | mark RLBK_MC10_%_DONE is deleted                                                        | postgres
   10766 | ROLLBACK_GROUP           | MARK DELETED            | myGroup1                                                                         | mark MC15 is deleted                                                                    | postgres
   10767 | ROLLBACK_GROUP           | MARK DELETED            | myGroup1                                                                         | mark RLBK_MC15_DONE is deleted                                                          | postgres
   10768 | ROLLBACK_GROUP           | MARK DELETED            | myGroup1                                                                         | mark MC17 is deleted                                                                    | postgres
   10769 | ROLLBACK_GROUP           | MARK DELETED            | myGroup1                                                                         | mark RLBK_MC16_%_START is deleted                                                       | postgres
   10770 | ROLLBACK_GROUP           | MARK DELETED            | myGroup1                                                                         | mark RLBK_MC16_%_DONE is deleted                                                        | postgres
   10771 | ROLLBACK_SEQUENCE        |                         | myschema1."myTbl3_col31_seq"                                                     | RESTART 21                                                                              | postgres
   10772 | ROLLBACK_SEQUENCE        |                         | myschema1.mytbl2b_col20_seq                                                      |                                                                                         | postgres
   10773 | ROLLBACK_GROUP           | NOTICE                  | Rollback id 10026                                                                | 2 / 5 tables effectively processed.                                                     | postgres
   10774 | ROLLBACK_GROUP           | NOTICE                  | Rollback id 10026                                                                | 2 sequences processed.                                                                  | postgres
   10775 | DBLINK_CLOSE_CNX         |                         | rlbk#1                                                                           |                                                                                         | postgres
   10776 | ROLLBACK_GROUP           | END                     | myGroup1                                                                         | Rollback_id 10026, 2 tables and 2 sequences effectively processed                       | postgres
   10777 | CREATE_GROUP             | BEGIN                   | myGroup4                                                                         | rollbackable                                                                            | postgres
   10778 | CREATE_GROUP             | END                     | myGroup4                                                                         | 5 tables/sequences processed                                                            | postgres
   10779 | START_GROUP              | BEGIN                   | myGroup4                                                                         | With log reset                                                                          | postgres
   10780 | LOCK_GROUP               | BEGIN                   | myGroup4                                                                         |                                                                                         | postgres
   10781 | LOCK_GROUP               | END                     | myGroup4                                                                         | 5 tables locked, 0 deadlock(s)                                                          | postgres
   10782 | SET_MARK_GROUP           | BEGIN                   | myGroup4                                                                         | M1                                                                                      | postgres
   10783 | CLEANUP_RLBK_STATE       |                         | Rollback id 10025                                                                | set to COMMITTED                                                                        | postgres
   10784 | CLEANUP_RLBK_STATE       |                         | Rollback id 10026                                                                | set to COMMITTED                                                                        | postgres
   10785 | SET_MARK_GROUP           | END                     | myGroup4                                                                         | M1                                                                                      | postgres
   10786 | START_GROUP              | END                     | myGroup4                                                                         | 5 tables/sequences processed                                                            | postgres
   10787 | SET_MARK_GROUP           | BEGIN                   | myGroup4                                                                         |                                                                                         | postgres
   10788 | LOCK_GROUP               | BEGIN                   | myGroup4                                                                         |                                                                                         | postgres
   10789 | LOCK_GROUP               | END                     | myGroup4                                                                         | 5 tables locked, 0 deadlock(s)                                                          | postgres
   10790 | SET_MARK_GROUP           | END                     | myGroup4                                                                         | M2                                                                                      | postgres
   10791 | SET_MARK_GROUP           | BEGIN                   | myGroup4                                                                         |                                                                                         | postgres
   10792 | LOCK_GROUP               | BEGIN                   | myGroup4                                                                         |                                                                                         | postgres
   10793 | LOCK_GROUP               | END                     | myGroup4                                                                         | 5 tables locked, 0 deadlock(s)                                                          | postgres
   10794 | SET_MARK_GROUP           | END                     | myGroup4                                                                         | M3                                                                                      | postgres
   10795 | ALTER_GROUP              | BEGIN                   | myGroup4                                                                         |                                                                                         | postgres
   10796 | LOCK_GROUP               | BEGIN                   | myGroup4                                                                         |                                                                                         | postgres
   10797 | LOCK_GROUP               | END                     | myGroup4                                                                         | 5 tables locked, 0 deadlock(s)                                                          | postgres
   10798 | SET_MARK_GROUP           | BEGIN                   | myGroup4                                                                         | M4                                                                                      | postgres
   10799 | SET_MARK_GROUP           | END                     | myGroup4                                                                         | M4                                                                                      | postgres
   10800 | ALTER_GROUP              | END                     | myGroup4                                                                         | Timestamp Id : 10094                                                                    | postgres
   10801 | ALTER_GROUP              | BEGIN                   | myGroup4                                                                         |                                                                                         | postgres
   10802 | LOCK_GROUP               | BEGIN                   | myGroup4                                                                         |                                                                                         | postgres
   10803 | LOCK_GROUP               | END                     | myGroup4                                                                         | 5 tables locked, 0 deadlock(s)                                                          | postgres
   10804 | SET_MARK_GROUP           | BEGIN                   | myGroup4                                                                         | M5                                                                                      | postgres
   10805 | SET_MARK_GROUP           | END                     | myGroup4                                                                         | M5                                                                                      | postgres
   10806 | ALTER_GROUP              | END                     | myGroup4                                                                         | Timestamp Id : 10095                                                                    | postgres
   10807 | STOP_GROUP               | BEGIN                   | myGroup4                                                                         |                                                                                         | postgres
   10808 | LOCK_GROUP               | BEGIN                   | myGroup4                                                                         |                                                                                         | postgres
   10809 | LOCK_GROUP               | END                     | myGroup4                                                                         | 5 tables locked, 0 deadlock(s)                                                          | postgres
   10810 | SET_MARK_GROUP           | BEGIN                   | myGroup4                                                                         | M6                                                                                      | postgres
   10811 | SET_MARK_GROUP           | END                     | myGroup4                                                                         | M6                                                                                      | postgres
   10812 | STOP_GROUP               | END                     | myGroup4                                                                         | 5 tables/sequences processed                                                            | postgres
   10813 | START_GROUP              | BEGIN                   | myGroup4                                                                         | Without log reset                                                                       | postgres
   10814 | LOCK_GROUP               | BEGIN                   | myGroup4                                                                         |                                                                                         | postgres
   10815 | LOCK_GROUP               | END                     | myGroup4                                                                         | 5 tables locked, 0 deadlock(s)                                                          | postgres
   10816 | SET_MARK_GROUP           | BEGIN                   | myGroup4                                                                         | M7                                                                                      | postgres
   10817 | SET_MARK_GROUP           | END                     | myGroup4                                                                         | M7                                                                                      | postgres
   10818 | START_GROUP              | END                     | myGroup4                                                                         | 5 tables/sequences processed                                                            | postgres
   10819 | STOP_GROUP               | BEGIN                   | myGroup4                                                                         |                                                                                         | postgres
   10820 | LOCK_GROUP               | BEGIN                   | myGroup4                                                                         |                                                                                         | postgres
   10821 | LOCK_GROUP               | END                     | myGroup4                                                                         | 5 tables locked, 0 deadlock(s)                                                          | postgres
   10822 | SET_MARK_GROUP           | BEGIN                   | myGroup4                                                                         | M8                                                                                      | postgres
   10823 | SET_MARK_GROUP           | END                     | myGroup4                                                                         | M8                                                                                      | postgres
   10824 | STOP_GROUP               | END                     | myGroup4                                                                         | 5 tables/sequences processed                                                            | postgres
   10825 | DROP_GROUP               | BEGIN                   | myGroup4                                                                         |                                                                                         | postgres
   10826 | DROP_GROUP               | END                     | myGroup4                                                                         | 5 tables/sequences processed                                                            | postgres
(749 rows)

--
reset role;
alter table "phil's schema3".table_with_very_looooooooooooooooooooooooooooooooooooooong_name rename to "phil's tbl1";
-- the groups are left in their current state for the parallel rollback test.
select count(*) from mySchema1.myTbl4;
 count 
-------
     0
(1 row)

select count(*) from mySchema1.myTbl1;
 count 
-------
    20
(1 row)

select count(*) from mySchema1.myTbl2; 
 count 
-------
     3
(1 row)

select count(*) from mySchema1."myTbl3";
 count 
-------
     5
(1 row)

select count(*) from mySchema1.myTbl2b;
 count 
-------
     0
(1 row)

select count(*) from mySchema2.myTbl4;
 count 
-------
     2
(1 row)

select count(*) from mySchema2.myTbl1;
 count 
-------
    10
(1 row)

select count(*) from mySchema2.myTbl2; 
 count 
-------
     2
(1 row)

select count(*) from mySchema2."myTbl3";
 count 
-------
    10
(1 row)

select count(*) from mySchema2.myTbl5;
 count 
-------
     3
(1 row)

select count(*) from mySchema2.myTbl6;
 count 
-------
    14
(1 row)

