-- after_upg_while_logging.sql : complex scenario executed by an emaj_adm role
-- The E-Maj version is changed while groups are in logging state
-- This script is the part of operations performed after the upgrade
--
-----------------------------
-- Step 1 : check the E-Maj installation
-----------------------------
select * from emaj.emaj_verify_all();
  emaj_verify_all  
-------------------
 No error detected
(1 row)

select group_name, group_is_rollbackable, group_creation_time_id,
       group_last_alter_time_id, group_has_waiting_changes, group_is_logging, 
       group_is_rlbk_protected, group_nb_table, group_nb_sequence, group_comment
  from emaj.emaj_group order by group_name;
    group_name    | group_is_rollbackable | group_creation_time_id | group_last_alter_time_id | group_has_waiting_changes | group_is_logging | group_is_rlbk_protected | group_nb_table | group_nb_sequence | group_comment 
------------------+-----------------------+------------------------+--------------------------+---------------------------+------------------+-------------------------+----------------+-------------------+---------------
 myGroup1         | t                     |                      1 |                       18 | f                         | t                | t                       |              4 |                 1 | 
 myGroup2         | t                     |                      2 |                          | f                         | t                | f                       |              4 |                 2 | 
 myGroup6         | t                     |                     19 |                       21 | f                         | f                | f                       |              3 |                 0 | 
 phil's group#3", | f                     |                      3 |                          | f                         | t                | t                       |              2 |                 1 | 
(4 rows)

-----------------------------
-- Step 2 : for both groups, rollback to the common mark just set before the upgrade, after having unprotected the first group
-----------------------------
select * from emaj.emaj_rollback_groups('{"myGroup1","myGroup2"}','Common',false) order by 1,2;
ERROR:  _check_group_names: The group "myGroup1" is currently protected against rollback operations.
CONTEXT:  SQL statement "SELECT emaj._check_group_names(v_groupNames := v_groupNames, v_mayBeNull := FALSE, v_lockGroups := TRUE,
                                     v_checkList := 'LOGGING,ROLLBACKABLE,UNPROTECTED')"
PL/pgSQL function emaj._rlbk_check(text[],text,boolean,boolean) line 16 at SQL statement
SQL statement "SELECT emaj._rlbk_check(v_groupNames, v_mark, v_isAlterGroupAllowed, FALSE)"
PL/pgSQL function emaj._rlbk_init(text[],text,boolean,integer,boolean,boolean) line 23 at SQL statement
SQL statement "SELECT emaj._rlbk_init(v_groupNames, v_mark, v_isLoggedRlbk, 1, v_multiGroup, v_isAlterGroupAllowed)"
PL/pgSQL function emaj._rlbk_groups(text[],text,boolean,boolean,boolean) line 25 at SQL statement
PL/pgSQL function emaj.emaj_rollback_groups(text[],text,boolean) line 8 at RETURN QUERY
select emaj.emaj_unprotect_group('myGroup1');
 emaj_unprotect_group 
----------------------
                    1
(1 row)

select rlbk_severity, regexp_replace(rlbk_message,E'\\d\\d\\d\\d/\\d\\d\\/\\d\\d\\ \\d\\d\\:\\d\\d:\\d\\d .*?\\)','<timestamp>)','g')
  from emaj.emaj_rollback_groups('{"myGroup1","myGroup2"}','Common',true) order by 1,2;
 rlbk_severity |                                        regexp_replace                                         
---------------+-----------------------------------------------------------------------------------------------
 Notice        | 0 / 8 tables effectively processed.
 Notice        | 3 sequences processed.
 Warning       | The table myschema1."myTbl3" has been left unchanged (not in group anymore since <timestamp>)
(3 rows)

-----------------------------
-- Step 3 : for myGroup1, update tables, then unprotect, logged_rollback, rename the end rollback mark and consolidate the rollback
-----------------------------
set search_path=myschema1;
--
update "myTbl3" set col33 = col33 / 2;
--
select * from emaj.emaj_rollback_group('myGroup1','M2',false) order by 1,2;
ERROR:  _rlbk_check: Protected marks (M3) for the group "myGroup1" block the rollback to the mark "M2".
CONTEXT:  SQL statement "SELECT emaj._rlbk_check(v_groupNames, v_mark, v_isAlterGroupAllowed, FALSE)"
PL/pgSQL function emaj._rlbk_init(text[],text,boolean,integer,boolean,boolean) line 23 at SQL statement
SQL statement "SELECT emaj._rlbk_init(v_groupNames, v_mark, v_isLoggedRlbk, 1, v_multiGroup, v_isAlterGroupAllowed)"
PL/pgSQL function emaj._rlbk_groups(text[],text,boolean,boolean,boolean) line 25 at SQL statement
PL/pgSQL function emaj.emaj_rollback_group(text,text,boolean) line 7 at RETURN QUERY
select emaj.emaj_unprotect_mark_group('myGroup1','M3');
 emaj_unprotect_mark_group 
---------------------------
                         1
(1 row)

select * from emaj.emaj_logged_rollback_group('myGroup1','M2',true) order by 1,2;
 rlbk_severity |            rlbk_message             
---------------+-------------------------------------
 Notice        | 1 sequences processed.
 Notice        | 2 / 4 tables effectively processed.
(2 rows)

--
select emaj.emaj_rename_mark_group('myGroup1','EMAJ_LAST_MARK','End_rollback_to_M2');
 emaj_rename_mark_group 
------------------------
 
(1 row)

select emaj.emaj_consolidate_rollback_group('myGroup1','End_rollback_to_M2');
 emaj_consolidate_rollback_group 
---------------------------------
                               3
(1 row)

-----------------------------
-- Step 4 : for myGroup1, update tables again then set 3 marks
-----------------------------
insert into myTbl1 select i, 'DEF', E'\\000'::bytea from generate_series (100,110) as i;
insert into myTbl2 values (3,'GHI','2010-01-02');
delete from myTbl1 where col11 = 1;
--
select emaj.emaj_set_mark_group('myGroup1','M4');
 emaj_set_mark_group 
---------------------
                   5
(1 row)

--
update "myTbl3" set col33 = col33 / 2;
--
select emaj.emaj_set_mark_group('myGroup1','M5');
 emaj_set_mark_group 
---------------------
                   5
(1 row)

--
update myTbl1 set col11 = 99 where col11 = 1;
--
select emaj.emaj_set_mark_group('myGroup1','M6');
 emaj_set_mark_group 
---------------------
                   5
(1 row)

-----------------------------
-- Step 5 : for myGroup2, logged rollback again then unlogged rollback 
-----------------------------
select * from emaj.emaj_logged_rollback_group('myGroup2','M2',false) order by 1,2;
 rlbk_severity |            rlbk_message             
---------------+-------------------------------------
 Notice        | 1 / 4 tables effectively processed.
 Notice        | 2 sequences processed.
(2 rows)

--
select * from emaj.emaj_rollback_group('myGroup2','M3',false) order by 1,2;
 rlbk_severity |            rlbk_message             
---------------+-------------------------------------
 Notice        | 1 / 4 tables effectively processed.
 Notice        | 2 sequences processed.
(2 rows)

-----------------------------
-- Step 6 : for myGroup1, update tables, rollback, other updates, then logged rollback
-----------------------------
set search_path=myschema1;
--
insert into myTbl1 values (1, 'Step 6', E'\\000'::bytea);
insert into myTbl4 values (11,'FK...',1,1,'Step 6');
insert into myTbl4 values (12,'FK...',1,1,'Step 6');
--
select * from emaj.emaj_rollback_group('myGroup1','M5',false) order by 1,2;
 rlbk_severity |            rlbk_message             
---------------+-------------------------------------
 Notice        | 1 sequences processed.
 Notice        | 2 / 4 tables effectively processed.
(2 rows)

--
insert into myTbl1 values (1, 'Step 6', E'\\001'::bytea);
copy myTbl4 from stdin;
--
select * from emaj.emaj_logged_rollback_group('myGroup1','M4',false) order by 1,2;
 rlbk_severity |            rlbk_message             
---------------+-------------------------------------
 Notice        | 1 sequences processed.
 Notice        | 2 / 4 tables effectively processed.
(2 rows)

-----------------------------
-- Step 7 : for myGroup1, update tables, rename a mark, then delete 2 marks then delete all before a mark 
-----------------------------
set search_path=myschema1;
--
delete from "myTbl3" where col31 between 14 and 18;
--
select emaj.emaj_rename_mark_group('myGroup1',mark_name,'Before logged rollback to M4') from emaj.emaj_mark where mark_name like 'RLBK_M4_%_START';
 emaj_rename_mark_group 
------------------------
 
(1 row)

-- 
select emaj.emaj_delete_mark_group('myGroup1',mark_name) from emaj.emaj_mark where mark_name like 'RLBK_M4_%_DONE';
 emaj_delete_mark_group 
------------------------
                      1
(1 row)

select emaj.emaj_delete_mark_group('myGroup1','M1');
 emaj_delete_mark_group 
------------------------
                      1
(1 row)

--
select emaj.emaj_delete_before_mark_group('myGroup1','M4');
 emaj_delete_before_mark_group 
-------------------------------
                             2
(1 row)

-----------------------------
-- Step 8 : for myGroup6, perform a table change and verify that no log trigger has been called
--          and finaly drop the group
-----------------------------
insert into mySchema6.table_with_51_characters_long_name_____0_________0a values (1),(2);
select count(*) from emaj_myschema6."table_with_51_characters_long_name_____0_________0#1_log";
 count 
-------
     0
(1 row)

select emaj.emaj_start_group('myGroup6', 'Start G6');
 emaj_start_group 
------------------
                3
(1 row)

insert into mySchema6.table_with_51_characters_long_name_____0_________0a values (3),(4);
delete from mySchema6.table_with_51_characters_long_name_____0_________0a;
select stat_group, stat_schema, stat_table, stat_first_mark, stat_last_mark, stat_rows
  from emaj.emaj_log_stat_group('myGroup6','Start G6',NULL) order by 1,2,3,4;
 stat_group | stat_schema |                       stat_table                        | stat_first_mark | stat_last_mark | stat_rows 
------------+-------------+---------------------------------------------------------+-----------------+----------------+-----------
 myGroup6   | myschema6   | table_with_50_characters_long_name_____0_________0      | Start G6        |                |         0
 myGroup6   | myschema6   | table_with_51_characters_long_name_____0_________0a     | Start G6        |                |         6
 myGroup6   | myschema6   | table_with_55_characters_long_name_____0_________0fghij | Start G6        |                |         0
(3 rows)

select emaj.emaj_rollback_group('myGroup6', 'Start G6');
 emaj_rollback_group 
---------------------
                   1
(1 row)

select emaj.emaj_stop_group('myGroup6');
 emaj_stop_group 
-----------------
               3
(1 row)

select emaj.emaj_drop_group('myGroup6');
 emaj_drop_group 
-----------------
               3
(1 row)

-----------------------------
-- test end: check and reset history
-----------------------------
select time_id, time_last_emaj_gid, time_event from emaj.emaj_time_stamp order by time_id;
 time_id | time_last_emaj_gid | time_event 
---------+--------------------+------------
       1 |                  0 | C
       2 |                  0 | C
       3 |                  0 | C
       4 |                  0 | M
       5 |                  0 | M
       6 |                  0 | M
       7 |                 29 | M
       8 |                 40 | M
       9 |                 46 | R
      10 |                 49 | R
      11 |                 76 | M
      12 |                 80 | M
      13 |                 80 | R
      14 |                 82 | M
      15 |                 82 | R
      16 |                 84 | M
      17 |                 84 | M
      18 |                 84 | A
      19 |                 84 | C
      20 |                 84 | M
      21 |                 84 | A
      22 |                 84 | M
      23 |                 84 | R
      24 |                 84 | R
      25 |                 91 | M
      26 |                105 | M
      27 |                105 | M
      28 |                105 | M
      29 |                105 | R
      30 |                107 | M
      31 |                107 | R
      32 |                110 | R
      33 |                113 | R
      34 |                116 | M
      35 |                116 | M
      36 |                122 | R
      37 |                122 | M
      38 |                122 | D
(38 rows)

select hist_function, hist_event, hist_object,
       regexp_replace(regexp_replace(regexp_replace(hist_wording,
            E'\\d\\d\.\\d\\d\\.\\d\\d\\.\\d\\d\\d(\\d?)','%','g'),
            E'\\d\\d\\d\\d/\\d\\d\\/\\d\\d\\ \\d\\d\\:\\d\\d:\\d\\d .*?\\)','<timestamp>)','g'),
            E'\\[.+\\]','(timestamp)','g'), 
       hist_user 
  from emaj.emaj_hist 
  order by hist_id;
      hist_function       |     hist_event     |                            hist_object                            |                                        regexp_replace                                         | hist_user 
--------------------------+--------------------+-------------------------------------------------------------------+-----------------------------------------------------------------------------------------------+-----------
 EMAJ_INSTALL             |                    | E-Maj 3.1.0                                                       | Initialisation completed                                                                      | postgres
 CREATE_GROUP             | BEGIN              | myGroup1                                                          | rollbackable                                                                                  | postgres
 CREATE_GROUP             | LOG_SCHEMA CREATED | emaj_myschema1                                                    |                                                                                               | postgres
 CREATE_GROUP             | END                | myGroup1                                                          | 6 tables/sequences processed                                                                  | postgres
 CREATE_GROUP             | BEGIN              | myGroup2                                                          | rollbackable                                                                                  | postgres
 CREATE_GROUP             | LOG_SCHEMA CREATED | emaj_myschema2                                                    |                                                                                               | postgres
 CREATE_GROUP             | END                | myGroup2                                                          | 6 tables/sequences processed                                                                  | postgres
 CREATE_GROUP             | BEGIN              | phil's group#3",                                                  | audit_only                                                                                    | postgres
 CREATE_GROUP             | LOG_SCHEMA CREATED | "emaj_phil's schema3"                                             |                                                                                               | postgres
 CREATE_GROUP             | END                | phil's group#3",                                                  | 3 tables/sequences processed                                                                  | postgres
 START_GROUP              | BEGIN              | myGroup1                                                          | With log reset                                                                                | postgres
 LOCK_GROUP               | BEGIN              | myGroup1                                                          |                                                                                               | postgres
 LOCK_GROUP               | END                | myGroup1                                                          | 5 tables locked, 0 deadlock(s)                                                                | postgres
 SET_MARK_GROUP           | BEGIN              | myGroup1                                                          | M1                                                                                            | postgres
 SET_MARK_GROUP           | END                | myGroup1                                                          | M1                                                                                            | postgres
 START_GROUP              | END                | myGroup1                                                          | 6 tables/sequences processed                                                                  | postgres
 START_GROUP              | BEGIN              | myGroup2                                                          | With log reset                                                                                | postgres
 LOCK_GROUP               | BEGIN              | myGroup2                                                          |                                                                                               | postgres
 LOCK_GROUP               | END                | myGroup2                                                          | 4 tables locked, 0 deadlock(s)                                                                | postgres
 SET_MARK_GROUP           | BEGIN              | myGroup2                                                          | M1                                                                                            | postgres
 SET_MARK_GROUP           | END                | myGroup2                                                          | M1                                                                                            | postgres
 START_GROUP              | END                | myGroup2                                                          | 6 tables/sequences processed                                                                  | postgres
 START_GROUP              | BEGIN              | phil's group#3",                                                  | With log reset                                                                                | postgres
 LOCK_GROUP               | BEGIN              | phil's group#3",                                                  |                                                                                               | postgres
 LOCK_GROUP               | END                | phil's group#3",                                                  | 2 tables locked, 0 deadlock(s)                                                                | postgres
 SET_MARK_GROUP           | BEGIN              | phil's group#3",                                                  | M1                                                                                            | postgres
 SET_MARK_GROUP           | END                | phil's group#3",                                                  | M1                                                                                            | postgres
 START_GROUP              | END                | phil's group#3",                                                  | 3 tables/sequences processed                                                                  | postgres
 SET_MARK_GROUP           | BEGIN              | myGroup1                                                          |                                                                                               | postgres
 LOCK_GROUP               | BEGIN              | myGroup1                                                          |                                                                                               | postgres
 LOCK_GROUP               | END                | myGroup1                                                          | 5 tables locked, 0 deadlock(s)                                                                | postgres
 SET_MARK_GROUP           | END                | myGroup1                                                          | M2                                                                                            | postgres
 SET_MARK_GROUP           | BEGIN              | myGroup1                                                          |                                                                                               | postgres
 LOCK_GROUP               | BEGIN              | myGroup1                                                          |                                                                                               | postgres
 LOCK_GROUP               | END                | myGroup1                                                          | 5 tables locked, 0 deadlock(s)                                                                | postgres
 SET_MARK_GROUP           | END                | myGroup1                                                          | M3                                                                                            | postgres
 COMMENT_MARK_GROUP       |                    | myGroup1                                                          | Mark M3                                                                                       | postgres
 ROLLBACK_GROUP           | BEGIN              | myGroup1                                                          | Unlogged rollback to mark M3 (timestamp)                                                      | postgres
 DBLINK_OPEN_CNX          |                    | rlbk#1                                                            | Status = -3                                                                                   | postgres
 LOCK_GROUP               | BEGIN              | myGroup1                                                          | Rollback session #1                                                                           | postgres
 LOCK_GROUP               | END                | myGroup1                                                          | Rollback session #1: 5 tables locked, 0 deadlock(s)                                           | postgres
 ROLLBACK_TABLE           | BEGIN              | myschema1.mytbl1                                                  | All log rows with emaj_gid > 40 and <= 46                                                     | postgres
 ROLLBACK_TABLE           | END                | myschema1.mytbl1                                                  | 6 rolled back primary keys                                                                    | postgres
 ROLLBACK_SEQUENCE        |                    | myschema1."myTbl3_col31_seq"                                      |                                                                                               | postgres
 ROLLBACK_GROUP           | NOTICE             | Rollback id 1                                                     | 1 / 5 tables effectively processed.                                                           | postgres
 ROLLBACK_GROUP           | NOTICE             | Rollback id 1                                                     | 1 sequences processed.                                                                        | postgres
 ROLLBACK_GROUP           | END                | myGroup1                                                          | Rollback_id 1, 1 tables and 1 sequences effectively processed                                 | postgres
 ROLLBACK_GROUP           | BEGIN              | myGroup1                                                          | Unlogged rollback to mark M3 (timestamp)                                                      | postgres
 DBLINK_OPEN_CNX          |                    | rlbk#1                                                            | Status = -3                                                                                   | postgres
 LOCK_GROUP               | BEGIN              | myGroup1                                                          | Rollback session #1                                                                           | postgres
 LOCK_GROUP               | END                | myGroup1                                                          | Rollback session #1: 5 tables locked, 0 deadlock(s)                                           | postgres
 ROLLBACK_TABLE           | BEGIN              | myschema1.mytbl2                                                  | All log rows with emaj_gid > 40 and <= 49                                                     | postgres
 ROLLBACK_TABLE           | END                | myschema1.mytbl2                                                  | 1 rolled back primary keys                                                                    | postgres
 ROLLBACK_TABLE           | BEGIN              | myschema1.mytbl4                                                  | All log rows with emaj_gid > 40 and <= 49                                                     | postgres
 ROLLBACK_TABLE           | END                | myschema1.mytbl4                                                  | 1 rolled back primary keys                                                                    | postgres
 ROLLBACK_TABLE           | BEGIN              | myschema1.mytbl2b                                                 | All log rows with emaj_gid > 40 and <= 49                                                     | postgres
 ROLLBACK_TABLE           | END                | myschema1.mytbl2b                                                 | 1 rolled back primary keys                                                                    | postgres
 ROLLBACK_SEQUENCE        |                    | myschema1."myTbl3_col31_seq"                                      |                                                                                               | postgres
 ROLLBACK_GROUP           | NOTICE             | Rollback id 2                                                     | 3 / 5 tables effectively processed.                                                           | postgres
 ROLLBACK_GROUP           | NOTICE             | Rollback id 2                                                     | 1 sequences processed.                                                                        | postgres
 ROLLBACK_GROUP           | END                | myGroup1                                                          | Rollback_id 2, 3 tables and 1 sequences effectively processed                                 | postgres
 PROTECT_MARK_GROUP       |                    | myGroup1                                                          | Mark M3 ; status 1                                                                            | postgres
 PROTECT_GROUP            |                    | myGroup1                                                          | Status 1                                                                                      | postgres
 SET_MARK_GROUP           | BEGIN              | myGroup2                                                          |                                                                                               | postgres
 LOCK_GROUP               | BEGIN              | myGroup2                                                          |                                                                                               | postgres
 LOCK_GROUP               | END                | myGroup2                                                          | 4 tables locked, 0 deadlock(s)                                                                | postgres
 SET_MARK_GROUP           | END                | myGroup2                                                          | M2                                                                                            | postgres
 SET_MARK_GROUP           | BEGIN              | myGroup2                                                          |                                                                                               | postgres
 LOCK_GROUP               | BEGIN              | myGroup2                                                          |                                                                                               | postgres
 LOCK_GROUP               | END                | myGroup2                                                          | 4 tables locked, 0 deadlock(s)                                                                | postgres
 SET_MARK_GROUP           | END                | myGroup2                                                          | M3                                                                                            | postgres
 ROLLBACK_GROUP           | BEGIN              | myGroup2                                                          | Logged rollback to mark M2 (timestamp)                                                        | postgres
 DBLINK_OPEN_CNX          |                    | rlbk#1                                                            | Status = -3                                                                                   | postgres
 LOCK_GROUP               | BEGIN              | myGroup2                                                          | Rollback session #1                                                                           | postgres
 LOCK_GROUP               | END                | myGroup2                                                          | Rollback session #1: 4 tables locked, 0 deadlock(s)                                           | postgres
 SET_MARK_GROUP           | BEGIN              | myGroup2                                                          | RLBK_M2_%_START                                                                               | postgres
 SET_MARK_GROUP           | END                | myGroup2                                                          | RLBK_M2_%_START                                                                               | postgres
 ROLLBACK_TABLE           | BEGIN              | myschema2.mytbl4                                                  | All log rows with emaj_gid > 76 and <= 80                                                     | postgres
 ROLLBACK_TABLE           | END                | myschema2.mytbl4                                                  | 2 rolled back primary keys                                                                    | postgres
 ROLLBACK_SEQUENCE        |                    | myschema2."myTbl3_col31_seq"                                      |                                                                                               | postgres
 ROLLBACK_SEQUENCE        |                    | myschema2.myseq1                                                  | RESTART 1001 MAXVALUE 2000 CYCLE                                                              | postgres
 SET_MARK_GROUP           | BEGIN              | myGroup2                                                          | RLBK_M2_%_DONE                                                                                | postgres
 SET_MARK_GROUP           | END                | myGroup2                                                          | RLBK_M2_%_DONE                                                                                | postgres
 ROLLBACK_GROUP           | NOTICE             | Rollback id 3                                                     | 1 / 4 tables effectively processed.                                                           | postgres
 ROLLBACK_GROUP           | NOTICE             | Rollback id 3                                                     | 2 sequences processed.                                                                        | postgres
 ROLLBACK_GROUP           | END                | myGroup2                                                          | Rollback_id 3, 1 tables and 2 sequences effectively processed                                 | postgres
 ROLLBACK_GROUP           | BEGIN              | myGroup2                                                          | Logged rollback to mark M3 (timestamp)                                                        | postgres
 DBLINK_OPEN_CNX          |                    | rlbk#1                                                            | Status = -3                                                                                   | postgres
 LOCK_GROUP               | BEGIN              | myGroup2                                                          | Rollback session #1                                                                           | postgres
 LOCK_GROUP               | END                | myGroup2                                                          | Rollback session #1: 4 tables locked, 0 deadlock(s)                                           | postgres
 SET_MARK_GROUP           | BEGIN              | myGroup2                                                          | RLBK_M3_%_START                                                                               | postgres
 SET_MARK_GROUP           | END                | myGroup2                                                          | RLBK_M3_%_START                                                                               | postgres
 ROLLBACK_TABLE           | BEGIN              | myschema2.mytbl4                                                  | All log rows with emaj_gid > 80 and <= 82                                                     | postgres
 ROLLBACK_TABLE           | END                | myschema2.mytbl4                                                  | 2 rolled back primary keys                                                                    | postgres
 ROLLBACK_SEQUENCE        |                    | myschema2."myTbl3_col31_seq"                                      |                                                                                               | postgres
 ROLLBACK_SEQUENCE        |                    | myschema2.myseq1                                                  | RESTART 1004 MAXVALUE 9223372036854775807 NO  CYCLE                                           | postgres
 SET_MARK_GROUP           | BEGIN              | myGroup2                                                          | RLBK_M3_%_DONE                                                                                | postgres
 SET_MARK_GROUP           | END                | myGroup2                                                          | RLBK_M3_%_DONE                                                                                | postgres
 ROLLBACK_GROUP           | NOTICE             | Rollback id 4                                                     | 1 / 4 tables effectively processed.                                                           | postgres
 ROLLBACK_GROUP           | NOTICE             | Rollback id 4                                                     | 2 sequences processed.                                                                        | postgres
 ROLLBACK_GROUP           | END                | myGroup2                                                          | Rollback_id 4, 1 tables and 2 sequences effectively processed                                 | postgres
 SET_MARK_GROUPS          | BEGIN              | myGroup1,myGroup2                                                 | Common                                                                                        | postgres
 LOCK_GROUPS              | BEGIN              | myGroup1,myGroup2                                                 |                                                                                               | postgres
 LOCK_GROUPS              | END                | myGroup1,myGroup2                                                 | 9 tables locked, 0 deadlock(s)                                                                | postgres
 SET_MARK_GROUPS          | END                | myGroup1,myGroup2                                                 | Common                                                                                        | postgres
 ALTER_GROUP              | BEGIN              | myGroup1                                                          |                                                                                               | postgres
 LOCK_GROUP               | BEGIN              | myGroup1                                                          |                                                                                               | postgres
 LOCK_GROUP               | END                | myGroup1                                                          | 5 tables locked, 0 deadlock(s)                                                                | postgres
 SET_MARK_GROUP           | BEGIN              | myGroup1                                                          | ALTER_%                                                                                       | postgres
 SET_MARK_GROUP           | END                | myGroup1                                                          | ALTER_%                                                                                       | postgres
 ALTER_GROUP              | TABLE REMOVED      | myschema1."myTbl3"                                                | From the group myGroup1                                                                       | postgres
 ALTER_GROUP              | END                | myGroup1                                                          | Timestamp Id : 18                                                                             | postgres
 CREATE_GROUP             | BEGIN              | myGroup6                                                          | rollbackable                                                                                  | postgres
 CREATE_GROUP             | LOG_SCHEMA CREATED | emaj_myschema6                                                    |                                                                                               | postgres
 CREATE_GROUP             | END                | myGroup6                                                          | 4 tables/sequences processed                                                                  | postgres
 START_GROUP              | BEGIN              | myGroup6                                                          | With log reset                                                                                | postgres
 LOCK_GROUP               | BEGIN              | myGroup6                                                          |                                                                                               | postgres
 LOCK_GROUP               | END                | myGroup6                                                          | 4 tables locked, 0 deadlock(s)                                                                | postgres
 SET_MARK_GROUP           | BEGIN              | myGroup6                                                          | Start G6                                                                                      | postgres
 SET_MARK_GROUP           | END                | myGroup6                                                          | Start G6                                                                                      | postgres
 START_GROUP              | END                | myGroup6                                                          | 4 tables/sequences processed                                                                  | postgres
 ALTER_GROUP              | BEGIN              | myGroup6                                                          |                                                                                               | postgres
 LOCK_GROUP               | BEGIN              | myGroup6                                                          |                                                                                               | postgres
 LOCK_GROUP               | END                | myGroup6                                                          | 4 tables locked, 0 deadlock(s)                                                                | postgres
 SET_MARK_GROUP           | BEGIN              | myGroup6                                                          | ALTER_%                                                                                       | postgres
 SET_MARK_GROUP           | END                | myGroup6                                                          | ALTER_%                                                                                       | postgres
 ALTER_GROUP              | TABLE REMOVED      | myschema6.table_with_55_characters_long_name_____0_________0abcde | From the group myGroup6                                                                       | postgres
 ALTER_GROUP              | END                | myGroup6                                                          | Timestamp Id : 21                                                                             | postgres
 STOP_GROUP               | BEGIN              | myGroup6                                                          |                                                                                               | postgres
 LOCK_GROUP               | BEGIN              | myGroup6                                                          |                                                                                               | postgres
 LOCK_GROUP               | END                | myGroup6                                                          | 3 tables locked, 0 deadlock(s)                                                                | postgres
 SET_MARK_GROUP           | BEGIN              | myGroup6                                                          | STOP_%                                                                                        | postgres
 SET_MARK_GROUP           | END                | myGroup6                                                          | STOP_%                                                                                        | postgres
 STOP_GROUP               | END                | myGroup6                                                          | 3 tables/sequences processed                                                                  | postgres
 EMAJ_INSTALL             | BEGIN              | E-Maj <devel>                                                     | Upgrade from 3.1.0 started                                                                    | postgres
 EMAJ_INSTALL             | END                | E-Maj <devel>                                                     | Upgrade from 3.1.0 completed                                                                  | postgres
 UNPROTECT_GROUP          |                    | myGroup1                                                          | Status 1                                                                                      | postgres
 ROLLBACK_GROUPS          | BEGIN              | myGroup1,myGroup2                                                 | Unlogged rollback to mark Common (timestamp)                                                  | postgres
 DBLINK_OPEN_CNX          |                    | rlbk#1                                                            | Status = -5                                                                                   | postgres
 LOCK_GROUP               | BEGIN              | myGroup1,myGroup2                                                 | Rollback session #1                                                                           | postgres
 LOCK_GROUP               | END                | myGroup1,myGroup2                                                 | Rollback session #1: 8 tables locked, 0 deadlock(s)                                           | postgres
 ROLLBACK_GROUPS          | MARK DELETED       | myGroup1                                                          | mark ALTER_% is deleted                                                                       | postgres
 ROLLBACK_SEQUENCE        |                    | myschema1."myTbl3_col31_seq"                                      |                                                                                               | postgres
 ROLLBACK_SEQUENCE        |                    | myschema2."myTbl3_col31_seq"                                      |                                                                                               | postgres
 ROLLBACK_SEQUENCE        |                    | myschema2.myseq1                                                  |                                                                                               | postgres
 ROLLBACK_GROUPS          | NOTICE             | Rollback id 5                                                     | 0 / 8 tables effectively processed.                                                           | postgres
 ROLLBACK_GROUPS          | NOTICE             | Rollback id 5                                                     | 3 sequences processed.                                                                        | postgres
 ROLLBACK_GROUPS          | WARNING            | Rollback id 5                                                     | The table myschema1."myTbl3" has been left unchanged (not in group anymore since <timestamp>) | postgres
 ROLLBACK_GROUPS          | END                | myGroup1,myGroup2                                                 | Rollback_id 5, 0 tables and 3 sequences effectively processed                                 | postgres
 UNPROTECT_MARK_GROUP     |                    | myGroup1                                                          | Mark M3 ; status 1                                                                            | postgres
 ROLLBACK_GROUP           | BEGIN              | myGroup1                                                          | Logged rollback to mark M2 (timestamp)                                                        | postgres
 DBLINK_OPEN_CNX          |                    | rlbk#1                                                            | Status = -5                                                                                   | postgres
 LOCK_GROUP               | BEGIN              | myGroup1                                                          | Rollback session #1                                                                           | postgres
 LOCK_GROUP               | END                | myGroup1                                                          | Rollback session #1: 4 tables locked, 0 deadlock(s)                                           | postgres
 SET_MARK_GROUP           | BEGIN              | myGroup1                                                          | RLBK_M2_%_START                                                                               | postgres
 SET_MARK_GROUP           | END                | myGroup1                                                          | RLBK_M2_%_START                                                                               | postgres
 ROLLBACK_TABLE           | BEGIN              | myschema1.mytbl1                                                  | All log rows with emaj_gid > 29 and <= 84                                                     | postgres
 ROLLBACK_TABLE           | END                | myschema1.mytbl1                                                  | 5 rolled back primary keys                                                                    | postgres
 ROLLBACK_TABLE           | BEGIN              | myschema1.mytbl4                                                  | All log rows with emaj_gid > 29 and <= 84                                                     | postgres
 ROLLBACK_TABLE           | END                | myschema1.mytbl4                                                  | 3 rolled back primary keys                                                                    | postgres
 ROLLBACK_SEQUENCE        |                    | myschema1."myTbl3_col31_seq"                                      |                                                                                               | postgres
 SET_MARK_GROUP           | BEGIN              | myGroup1                                                          | RLBK_M2_%_DONE                                                                                | postgres
 SET_MARK_GROUP           | END                | myGroup1                                                          | RLBK_M2_%_DONE                                                                                | postgres
 ROLLBACK_GROUP           | NOTICE             | Rollback id 6                                                     | 2 / 4 tables effectively processed.                                                           | postgres
 ROLLBACK_GROUP           | NOTICE             | Rollback id 6                                                     | 1 sequences processed.                                                                        | postgres
 ROLLBACK_GROUP           | END                | myGroup1                                                          | Rollback_id 6, 2 tables and 1 sequences effectively processed                                 | postgres
 RENAME_MARK_GROUP        | BEGIN              | myGroup1                                                          | EMAJ_LAST_MARK                                                                                | postgres
 RENAME_MARK_GROUP        | END                | myGroup1                                                          | RLBK_M2_%_DONE renamed End_rollback_to_M2                                                     | postgres
 CONSOLIDATE_RLBK_GROUP   | BEGIN              | myGroup1                                                          | Erase all between marks M2 and End_rollback_to_M2                                             | postgres
 CONSOLIDATE_RLBK_GROUP   | END                | myGroup1                                                          | 2 tables and 1 sequences processed ; 3 marks deleted                                          | postgres
 SET_MARK_GROUP           | BEGIN              | myGroup1                                                          |                                                                                               | postgres
 LOCK_GROUP               | BEGIN              | myGroup1                                                          |                                                                                               | postgres
 LOCK_GROUP               | END                | myGroup1                                                          | 4 tables locked, 0 deadlock(s)                                                                | postgres
 SET_MARK_GROUP           | END                | myGroup1                                                          | M4                                                                                            | postgres
 SET_MARK_GROUP           | BEGIN              | myGroup1                                                          |                                                                                               | postgres
 LOCK_GROUP               | BEGIN              | myGroup1                                                          |                                                                                               | postgres
 LOCK_GROUP               | END                | myGroup1                                                          | 4 tables locked, 0 deadlock(s)                                                                | postgres
 SET_MARK_GROUP           | END                | myGroup1                                                          | M5                                                                                            | postgres
 SET_MARK_GROUP           | BEGIN              | myGroup1                                                          |                                                                                               | postgres
 LOCK_GROUP               | BEGIN              | myGroup1                                                          |                                                                                               | postgres
 LOCK_GROUP               | END                | myGroup1                                                          | 4 tables locked, 0 deadlock(s)                                                                | postgres
 SET_MARK_GROUP           | END                | myGroup1                                                          | M6                                                                                            | postgres
 ROLLBACK_GROUP           | BEGIN              | myGroup2                                                          | Logged rollback to mark M2 (timestamp)                                                        | postgres
 DBLINK_OPEN_CNX          |                    | rlbk#1                                                            | Status = -5                                                                                   | postgres
 LOCK_GROUP               | BEGIN              | myGroup2                                                          | Rollback session #1                                                                           | postgres
 LOCK_GROUP               | END                | myGroup2                                                          | Rollback session #1: 4 tables locked, 0 deadlock(s)                                           | postgres
 SET_MARK_GROUP           | BEGIN              | myGroup2                                                          | RLBK_M2_%_START                                                                               | postgres
 SET_MARK_GROUP           | END                | myGroup2                                                          | RLBK_M2_%_START                                                                               | postgres
 ROLLBACK_TABLE           | BEGIN              | myschema2.mytbl4                                                  | All log rows with emaj_gid > 76 and <= 105                                                    | postgres
 ROLLBACK_TABLE           | END                | myschema2.mytbl4                                                  | 2 rolled back primary keys                                                                    | postgres
 ROLLBACK_SEQUENCE        |                    | myschema2."myTbl3_col31_seq"                                      |                                                                                               | postgres
 ROLLBACK_SEQUENCE        |                    | myschema2.myseq1                                                  | RESTART 1001 MAXVALUE 2000 CYCLE                                                              | postgres
 SET_MARK_GROUP           | BEGIN              | myGroup2                                                          | RLBK_M2_%_DONE                                                                                | postgres
 SET_MARK_GROUP           | END                | myGroup2                                                          | RLBK_M2_%_DONE                                                                                | postgres
 ROLLBACK_GROUP           | NOTICE             | Rollback id 7                                                     | 1 / 4 tables effectively processed.                                                           | postgres
 ROLLBACK_GROUP           | NOTICE             | Rollback id 7                                                     | 2 sequences processed.                                                                        | postgres
 ROLLBACK_GROUP           | END                | myGroup2                                                          | Rollback_id 7, 1 tables and 2 sequences effectively processed                                 | postgres
 ROLLBACK_GROUP           | BEGIN              | myGroup2                                                          | Unlogged rollback to mark M3 (timestamp)                                                      | postgres
 DBLINK_OPEN_CNX          |                    | rlbk#1                                                            | Status = -5                                                                                   | postgres
 LOCK_GROUP               | BEGIN              | myGroup2                                                          | Rollback session #1                                                                           | postgres
 LOCK_GROUP               | END                | myGroup2                                                          | Rollback session #1: 4 tables locked, 0 deadlock(s)                                           | postgres
 ROLLBACK_TABLE           | BEGIN              | myschema2.mytbl4                                                  | All log rows with emaj_gid > 80 and <= 107                                                    | postgres
 ROLLBACK_TABLE           | END                | myschema2.mytbl4                                                  | 2 rolled back primary keys                                                                    | postgres
 ROLLBACK_GROUP           | MARK DELETED       | myGroup2                                                          | mark RLBK_M2_%_START is deleted                                                               | postgres
 ROLLBACK_GROUP           | MARK DELETED       | myGroup2                                                          | mark RLBK_M2_%_DONE is deleted                                                                | postgres
 ROLLBACK_GROUP           | MARK DELETED       | myGroup2                                                          | mark RLBK_M3_%_START is deleted                                                               | postgres
 ROLLBACK_GROUP           | MARK DELETED       | myGroup2                                                          | mark RLBK_M3_%_DONE is deleted                                                                | postgres
 ROLLBACK_GROUP           | MARK DELETED       | myGroup2                                                          | mark Common is deleted                                                                        | postgres
 ROLLBACK_GROUP           | MARK DELETED       | myGroup2                                                          | mark RLBK_M2_%_START is deleted                                                               | postgres
 ROLLBACK_GROUP           | MARK DELETED       | myGroup2                                                          | mark RLBK_M2_%_DONE is deleted                                                                | postgres
 ROLLBACK_SEQUENCE        |                    | myschema2."myTbl3_col31_seq"                                      |                                                                                               | postgres
 ROLLBACK_SEQUENCE        |                    | myschema2.myseq1                                                  | RESTART 1004 MAXVALUE 9223372036854775807 NO  CYCLE                                           | postgres
 ROLLBACK_GROUP           | NOTICE             | Rollback id 8                                                     | 1 / 4 tables effectively processed.                                                           | postgres
 ROLLBACK_GROUP           | NOTICE             | Rollback id 8                                                     | 2 sequences processed.                                                                        | postgres
 ROLLBACK_GROUP           | END                | myGroup2                                                          | Rollback_id 8, 1 tables and 2 sequences effectively processed                                 | postgres
 ROLLBACK_GROUP           | BEGIN              | myGroup1                                                          | Unlogged rollback to mark M5 (timestamp)                                                      | postgres
 DBLINK_OPEN_CNX          |                    | rlbk#1                                                            | Status = -5                                                                                   | postgres
 LOCK_GROUP               | BEGIN              | myGroup1                                                          | Rollback session #1                                                                           | postgres
 LOCK_GROUP               | END                | myGroup1                                                          | Rollback session #1: 4 tables locked, 0 deadlock(s)                                           | postgres
 ROLLBACK_TABLE           | BEGIN              | myschema1.mytbl1                                                  | All log rows with emaj_gid > 105 and <= 110                                                   | postgres
 ROLLBACK_TABLE           | END                | myschema1.mytbl1                                                  | 1 rolled back primary keys                                                                    | postgres
 ROLLBACK_TABLE           | BEGIN              | myschema1.mytbl4                                                  | All log rows with emaj_gid > 105 and <= 110                                                   | postgres
 ROLLBACK_TABLE           | END                | myschema1.mytbl4                                                  | 2 rolled back primary keys                                                                    | postgres
 ROLLBACK_GROUP           | MARK DELETED       | myGroup1                                                          | mark M6 is deleted                                                                            | postgres
 ROLLBACK_SEQUENCE        |                    | myschema1."myTbl3_col31_seq"                                      |                                                                                               | postgres
 ROLLBACK_GROUP           | NOTICE             | Rollback id 9                                                     | 2 / 4 tables effectively processed.                                                           | postgres
 ROLLBACK_GROUP           | NOTICE             | Rollback id 9                                                     | 1 sequences processed.                                                                        | postgres
 ROLLBACK_GROUP           | END                | myGroup1                                                          | Rollback_id 9, 2 tables and 1 sequences effectively processed                                 | postgres
 ROLLBACK_GROUP           | BEGIN              | myGroup1                                                          | Logged rollback to mark M4 (timestamp)                                                        | postgres
 DBLINK_OPEN_CNX          |                    | rlbk#1                                                            | Status = -5                                                                                   | postgres
 LOCK_GROUP               | BEGIN              | myGroup1                                                          | Rollback session #1                                                                           | postgres
 LOCK_GROUP               | END                | myGroup1                                                          | Rollback session #1: 4 tables locked, 0 deadlock(s)                                           | postgres
 SET_MARK_GROUP           | BEGIN              | myGroup1                                                          | RLBK_M4_%_START                                                                               | postgres
 SET_MARK_GROUP           | END                | myGroup1                                                          | RLBK_M4_%_START                                                                               | postgres
 ROLLBACK_TABLE           | BEGIN              | myschema1.mytbl1                                                  | All log rows with emaj_gid > 105 and <= 113                                                   | postgres
 ROLLBACK_TABLE           | END                | myschema1.mytbl1                                                  | 1 rolled back primary keys                                                                    | postgres
 ROLLBACK_TABLE           | BEGIN              | myschema1.mytbl4                                                  | All log rows with emaj_gid > 105 and <= 113                                                   | postgres
 ROLLBACK_TABLE           | END                | myschema1.mytbl4                                                  | 2 rolled back primary keys                                                                    | postgres
 ROLLBACK_SEQUENCE        |                    | myschema1."myTbl3_col31_seq"                                      |                                                                                               | postgres
 SET_MARK_GROUP           | BEGIN              | myGroup1                                                          | RLBK_M4_%_DONE                                                                                | postgres
 SET_MARK_GROUP           | END                | myGroup1                                                          | RLBK_M4_%_DONE                                                                                | postgres
 ROLLBACK_GROUP           | NOTICE             | Rollback id 10                                                    | 2 / 4 tables effectively processed.                                                           | postgres
 ROLLBACK_GROUP           | NOTICE             | Rollback id 10                                                    | 1 sequences processed.                                                                        | postgres
 ROLLBACK_GROUP           | END                | myGroup1                                                          | Rollback_id 10, 2 tables and 1 sequences effectively processed                                | postgres
 RENAME_MARK_GROUP        | BEGIN              | myGroup1                                                          | RLBK_M4_%_START                                                                               | postgres
 RENAME_MARK_GROUP        | END                | myGroup1                                                          | RLBK_M4_%_START renamed Before logged rollback to M4                                          | postgres
 DELETE_MARK_GROUP        | BEGIN              | myGroup1                                                          | RLBK_M4_%_DONE                                                                                | postgres
 DELETE_MARK_GROUP        | END                | myGroup1                                                          | RLBK_M4_%_DONE                                                                                | postgres
 DELETE_MARK_GROUP        | BEGIN              | myGroup1                                                          | M1                                                                                            | postgres
 DELETE_MARK_GROUP        | END                | myGroup1                                                          | M1                                                                                            | postgres
 DELETE_BEFORE_MARK_GROUP | BEGIN              | myGroup1                                                          | M4                                                                                            | postgres
 DELETE_BEFORE_MARK_GROUP | END                | myGroup1                                                          | 2 marks deleted ; M4 is now the initial mark                                                  | postgres
 START_GROUP              | BEGIN              | myGroup6                                                          | With log reset                                                                                | postgres
 LOCK_GROUP               | BEGIN              | myGroup6                                                          |                                                                                               | postgres
 LOCK_GROUP               | END                | myGroup6                                                          | 3 tables locked, 0 deadlock(s)                                                                | postgres
 SET_MARK_GROUP           | BEGIN              | myGroup6                                                          | Start G6                                                                                      | postgres
 SET_MARK_GROUP           | END                | myGroup6                                                          | Start G6                                                                                      | postgres
 START_GROUP              | END                | myGroup6                                                          | 3 tables/sequences processed                                                                  | postgres
 ROLLBACK_GROUP           | BEGIN              | myGroup6                                                          | Unlogged rollback to mark Start G6 (timestamp)                                                | postgres
 DBLINK_OPEN_CNX          |                    | rlbk#1                                                            | Status = -5                                                                                   | postgres
 LOCK_GROUP               | BEGIN              | myGroup6                                                          | Rollback session #1                                                                           | postgres
 LOCK_GROUP               | END                | myGroup6                                                          | Rollback session #1: 3 tables locked, 0 deadlock(s)                                           | postgres
 ROLLBACK_TABLE           | BEGIN              | myschema6.table_with_51_characters_long_name_____0_________0a     | All log rows with emaj_gid > 116 and <= 122                                                   | postgres
 ROLLBACK_TABLE           | END                | myschema6.table_with_51_characters_long_name_____0_________0a     | 4 rolled back primary keys                                                                    | postgres
 ROLLBACK_GROUP           | NOTICE             | Rollback id 11                                                    | 1 / 3 tables effectively processed.                                                           | postgres
 ROLLBACK_GROUP           | END                | myGroup6                                                          | Rollback_id 11, 1 tables and 0 sequences effectively processed                                | postgres
 STOP_GROUP               | BEGIN              | myGroup6                                                          |                                                                                               | postgres
 LOCK_GROUP               | BEGIN              | myGroup6                                                          |                                                                                               | postgres
 LOCK_GROUP               | END                | myGroup6                                                          | 3 tables locked, 0 deadlock(s)                                                                | postgres
 SET_MARK_GROUP           | BEGIN              | myGroup6                                                          | STOP_%                                                                                        | postgres
 SET_MARK_GROUP           | END                | myGroup6                                                          | STOP_%                                                                                        | postgres
 STOP_GROUP               | END                | myGroup6                                                          | 3 tables/sequences processed                                                                  | postgres
 DROP_GROUP               | BEGIN              | myGroup6                                                          |                                                                                               | postgres
 DROP_GROUP               | LOG_SCHEMA DROPPED | emaj_myschema6                                                    |                                                                                               | postgres
 DROP_GROUP               | END                | myGroup6                                                          | 3 tables/sequences processed                                                                  | postgres
(275 rows)

--
reset role;
truncate emaj.emaj_hist;
alter sequence emaj.emaj_hist_hist_id_seq restart 30000;
-- the groups are left in their current state for the parallel rollback test.
-- perform some updates to prepare the parallel rollback test
-- set a mark for both groups
select emaj.emaj_set_mark_groups(array['myGroup1','myGroup2'],'Multi-1');
 emaj_set_mark_groups 
----------------------
                   11
(1 row)

select count(*) from mySchema1.myTbl4;
 count 
-------
     0
(1 row)

select count(*) from mySchema1.myTbl1;
 count 
-------
    20
(1 row)

select count(*) from mySchema1.myTbl2; 
 count 
-------
     3
(1 row)

select count(*) from mySchema1."myTbl3";
 count 
-------
    10
(1 row)

select count(*) from mySchema1.myTbl2b;
 count 
-------
     3
(1 row)

select count(*) from mySchema2.myTbl4;
 count 
-------
     2
(1 row)

select count(*) from mySchema2.myTbl1;
 count 
-------
    10
(1 row)

select count(*) from mySchema2.myTbl2; 
 count 
-------
     2
(1 row)

select count(*) from mySchema2."myTbl3";
 count 
-------
    10
(1 row)

delete from mySchema1.myTbl4;
delete from mySchema1.myTbl1;
delete from mySchema1.myTbl2; 
delete from mySchema1."myTbl3";
delete from mySchema1.myTbl2b;
delete from mySchema2.myTbl4;
delete from mySchema2.myTbl1;
delete from mySchema2.myTbl2; 
delete from mySchema2."myTbl3";
alter sequence mySchema2.mySeq1 restart 9999;
