-- rollback.sql : test updates log, emaj_rollback_group(), emaj_logged_rollback_group(),
--                emaj_rollback_groups(), emaj_logged_rollback_groups(),
--                emaj_cleanup_rollback_state(), emaj_rollback_activity(),
--                emaj_consolidate_rollback_group() and emaj_get_consolidable_rollbacks() functions.
--
-- set sequence restart value
select public.handle_emaj_sequences(4000);
 handle_emaj_sequences 
-----------------------
 
(1 row)

-- set the triggers state
select emaj.emaj_ignore_app_trigger('REMOVE','myschema1','mytbl2','mytbl2%');
 emaj_ignore_app_trigger 
-------------------------
                       0
(1 row)

ALTER TABLE mySchema1.myTbl2 ENABLE TRIGGER myTbl2trg2;
select emaj.emaj_ignore_app_trigger('ADD','myschema1','mytbl2','mytbl2trg2');
 emaj_ignore_app_trigger 
-------------------------
                       1
(1 row)

-- disable event triggers to test cases with missing components
select emaj.emaj_disable_protection_by_event_triggers();
 emaj_disable_protection_by_event_triggers 
-------------------------------------------
                                         3
(1 row)

-----------------------------
-- rollback nothing tests
-----------------------------
-- group or groups is NULL
select * from emaj.emaj_rollback_group(NULL,NULL);
ERROR:  _check_group_names: No group to process.
CONTEXT:  SQL statement "SELECT emaj._check_group_names(v_groupNames := v_groupNames, v_mayBeNull := v_multiGroup, v_lockGroups := FALSE, v_checkList := '')"
PL/pgSQL function emaj._rlbk_groups(text[],text,boolean,boolean,boolean) line 17 at SQL statement
PL/pgSQL function emaj.emaj_rollback_group(text,text,boolean) line 7 at RETURN QUERY
select * from emaj.emaj_logged_rollback_group(NULL,NULL);
ERROR:  _check_group_names: No group to process.
CONTEXT:  SQL statement "SELECT emaj._check_group_names(v_groupNames := v_groupNames, v_mayBeNull := v_multiGroup, v_lockGroups := FALSE, v_checkList := '')"
PL/pgSQL function emaj._rlbk_groups(text[],text,boolean,boolean,boolean) line 17 at SQL statement
PL/pgSQL function emaj.emaj_logged_rollback_group(text,text,boolean) line 11 at RETURN QUERY
select * from emaj.emaj_rollback_groups(NULL,NULL);
WARNING:  _check_group_names: No group to process.
CONTEXT:  SQL statement "SELECT emaj._check_group_names(v_groupNames := v_groupNames, v_mayBeNull := v_multiGroup, v_lockGroups := FALSE, v_checkList := '')"
PL/pgSQL function emaj._rlbk_groups(text[],text,boolean,boolean,boolean) line 17 at SQL statement
PL/pgSQL function emaj.emaj_rollback_groups(text[],text,boolean) line 8 at RETURN QUERY
 rlbk_severity | rlbk_message 
---------------+--------------
 Notice        | 0
(1 row)

select * from emaj.emaj_logged_rollback_groups(NULL,NULL);
WARNING:  _check_group_names: No group to process.
CONTEXT:  SQL statement "SELECT emaj._check_group_names(v_groupNames := v_groupNames, v_mayBeNull := v_multiGroup, v_lockGroups := FALSE, v_checkList := '')"
PL/pgSQL function emaj._rlbk_groups(text[],text,boolean,boolean,boolean) line 17 at SQL statement
PL/pgSQL function emaj.emaj_logged_rollback_groups(text[],text,boolean) line 12 at RETURN QUERY
 rlbk_severity | rlbk_message 
---------------+--------------
 Notice        | 0
(1 row)

-- group is unknown
select * from emaj.emaj_rollback_group('unknownGroup',NULL);
ERROR:  _check_group_names: The group "unknownGroup" does not exist.
CONTEXT:  SQL statement "SELECT emaj._check_group_names(v_groupNames := v_groupNames, v_mayBeNull := v_multiGroup, v_lockGroups := FALSE, v_checkList := '')"
PL/pgSQL function emaj._rlbk_groups(text[],text,boolean,boolean,boolean) line 17 at SQL statement
PL/pgSQL function emaj.emaj_rollback_group(text,text,boolean) line 7 at RETURN QUERY
select * from emaj.emaj_logged_rollback_group('unknownGroup',NULL);
ERROR:  _check_group_names: The group "unknownGroup" does not exist.
CONTEXT:  SQL statement "SELECT emaj._check_group_names(v_groupNames := v_groupNames, v_mayBeNull := v_multiGroup, v_lockGroups := FALSE, v_checkList := '')"
PL/pgSQL function emaj._rlbk_groups(text[],text,boolean,boolean,boolean) line 17 at SQL statement
PL/pgSQL function emaj.emaj_logged_rollback_group(text,text,boolean) line 11 at RETURN QUERY
select * from emaj.emaj_rollback_groups('{"unknownGroup"}',NULL);
ERROR:  _check_group_names: The group "unknownGroup" does not exist.
CONTEXT:  SQL statement "SELECT emaj._check_group_names(v_groupNames := v_groupNames, v_mayBeNull := v_multiGroup, v_lockGroups := FALSE, v_checkList := '')"
PL/pgSQL function emaj._rlbk_groups(text[],text,boolean,boolean,boolean) line 17 at SQL statement
PL/pgSQL function emaj.emaj_rollback_groups(text[],text,boolean) line 8 at RETURN QUERY
select * from emaj.emaj_logged_rollback_groups('{"unknownGroup","myGroup1"}',NULL);
ERROR:  _check_group_names: The group "unknownGroup" does not exist.
CONTEXT:  SQL statement "SELECT emaj._check_group_names(v_groupNames := v_groupNames, v_mayBeNull := v_multiGroup, v_lockGroups := FALSE, v_checkList := '')"
PL/pgSQL function emaj._rlbk_groups(text[],text,boolean,boolean,boolean) line 17 at SQL statement
PL/pgSQL function emaj.emaj_logged_rollback_groups(text[],text,boolean) line 12 at RETURN QUERY
begin;
  select emaj.emaj_start_group('myGroup1','');
 emaj_start_group 
------------------
                7
(1 row)

  select * from emaj.emaj_rollback_groups('{"myGroup1","unknownGroup"}','EMAJ_LAST_MARK');
ERROR:  _check_group_names: The group "unknownGroup" does not exist.
CONTEXT:  SQL statement "SELECT emaj._check_group_names(v_groupNames := v_groupNames, v_mayBeNull := v_multiGroup, v_lockGroups := FALSE, v_checkList := '')"
PL/pgSQL function emaj._rlbk_groups(text[],text,boolean,boolean,boolean) line 17 at SQL statement
PL/pgSQL function emaj.emaj_rollback_groups(text[],text,boolean) line 8 at RETURN QUERY
rollback;
-- group not in logging state
select * from emaj.emaj_rollback_group('myGroup1','EMAJ_LAST_MARK');
ERROR:  _check_group_names: The group "myGroup1" is not in LOGGING state.
CONTEXT:  SQL statement "SELECT emaj._check_group_names(v_groupNames := v_groupNames, v_mayBeNull := FALSE, v_lockGroups := TRUE,
                                     v_checkList := 'LOGGING,ROLLBACKABLE,UNPROTECTED')"
PL/pgSQL function emaj._rlbk_check(text[],text,boolean,boolean) line 16 at SQL statement
SQL statement "SELECT emaj._rlbk_check(v_groupNames, v_mark, v_isAlterGroupAllowed, FALSE)"
PL/pgSQL function emaj._rlbk_init(text[],text,boolean,integer,boolean,boolean) line 23 at SQL statement
SQL statement "SELECT emaj._rlbk_init(v_groupNames, v_mark, v_isLoggedRlbk, 1, v_multiGroup, v_isAlterGroupAllowed)"
PL/pgSQL function emaj._rlbk_groups(text[],text,boolean,boolean,boolean) line 26 at SQL statement
PL/pgSQL function emaj.emaj_rollback_group(text,text,boolean) line 7 at RETURN QUERY
select * from emaj.emaj_rollback_group('myGroup2','EMAJ_LAST_MARK');
ERROR:  _check_group_names: The group "myGroup2" is not in LOGGING state.
CONTEXT:  SQL statement "SELECT emaj._check_group_names(v_groupNames := v_groupNames, v_mayBeNull := FALSE, v_lockGroups := TRUE,
                                     v_checkList := 'LOGGING,ROLLBACKABLE,UNPROTECTED')"
PL/pgSQL function emaj._rlbk_check(text[],text,boolean,boolean) line 16 at SQL statement
SQL statement "SELECT emaj._rlbk_check(v_groupNames, v_mark, v_isAlterGroupAllowed, FALSE)"
PL/pgSQL function emaj._rlbk_init(text[],text,boolean,integer,boolean,boolean) line 23 at SQL statement
SQL statement "SELECT emaj._rlbk_init(v_groupNames, v_mark, v_isLoggedRlbk, 1, v_multiGroup, v_isAlterGroupAllowed)"
PL/pgSQL function emaj._rlbk_groups(text[],text,boolean,boolean,boolean) line 26 at SQL statement
PL/pgSQL function emaj.emaj_rollback_group(text,text,boolean) line 7 at RETURN QUERY
select * from emaj.emaj_logged_rollback_group('myGroup1','EMAJ_LAST_MARK');
ERROR:  _check_group_names: The group "myGroup1" is not in LOGGING state.
CONTEXT:  SQL statement "SELECT emaj._check_group_names(v_groupNames := v_groupNames, v_mayBeNull := FALSE, v_lockGroups := TRUE,
                                     v_checkList := 'LOGGING,ROLLBACKABLE,UNPROTECTED')"
PL/pgSQL function emaj._rlbk_check(text[],text,boolean,boolean) line 16 at SQL statement
SQL statement "SELECT emaj._rlbk_check(v_groupNames, v_mark, v_isAlterGroupAllowed, FALSE)"
PL/pgSQL function emaj._rlbk_init(text[],text,boolean,integer,boolean,boolean) line 23 at SQL statement
SQL statement "SELECT emaj._rlbk_init(v_groupNames, v_mark, v_isLoggedRlbk, 1, v_multiGroup, v_isAlterGroupAllowed)"
PL/pgSQL function emaj._rlbk_groups(text[],text,boolean,boolean,boolean) line 26 at SQL statement
PL/pgSQL function emaj.emaj_logged_rollback_group(text,text,boolean) line 11 at RETURN QUERY
select * from emaj.emaj_logged_rollback_group('myGroup2','EMAJ_LAST_MARK');
ERROR:  _check_group_names: The group "myGroup2" is not in LOGGING state.
CONTEXT:  SQL statement "SELECT emaj._check_group_names(v_groupNames := v_groupNames, v_mayBeNull := FALSE, v_lockGroups := TRUE,
                                     v_checkList := 'LOGGING,ROLLBACKABLE,UNPROTECTED')"
PL/pgSQL function emaj._rlbk_check(text[],text,boolean,boolean) line 16 at SQL statement
SQL statement "SELECT emaj._rlbk_check(v_groupNames, v_mark, v_isAlterGroupAllowed, FALSE)"
PL/pgSQL function emaj._rlbk_init(text[],text,boolean,integer,boolean,boolean) line 23 at SQL statement
SQL statement "SELECT emaj._rlbk_init(v_groupNames, v_mark, v_isLoggedRlbk, 1, v_multiGroup, v_isAlterGroupAllowed)"
PL/pgSQL function emaj._rlbk_groups(text[],text,boolean,boolean,boolean) line 26 at SQL statement
PL/pgSQL function emaj.emaj_logged_rollback_group(text,text,boolean) line 11 at RETURN QUERY
select * from emaj.emaj_rollback_groups('{"myGroup1","myGroup2"}',NULL);
ERROR:  _check_group_names: The groups "myGroup1, myGroup2" are not in LOGGING state.
CONTEXT:  SQL statement "SELECT emaj._check_group_names(v_groupNames := v_groupNames, v_mayBeNull := FALSE, v_lockGroups := TRUE,
                                     v_checkList := 'LOGGING,ROLLBACKABLE,UNPROTECTED')"
PL/pgSQL function emaj._rlbk_check(text[],text,boolean,boolean) line 16 at SQL statement
SQL statement "SELECT emaj._rlbk_check(v_groupNames, v_mark, v_isAlterGroupAllowed, FALSE)"
PL/pgSQL function emaj._rlbk_init(text[],text,boolean,integer,boolean,boolean) line 23 at SQL statement
SQL statement "SELECT emaj._rlbk_init(v_groupNames, v_mark, v_isLoggedRlbk, 1, v_multiGroup, v_isAlterGroupAllowed)"
PL/pgSQL function emaj._rlbk_groups(text[],text,boolean,boolean,boolean) line 26 at SQL statement
PL/pgSQL function emaj.emaj_rollback_groups(text[],text,boolean) line 8 at RETURN QUERY
begin;
  select emaj.emaj_start_group('myGroup1','');
 emaj_start_group 
------------------
                7
(1 row)

  select * from emaj.emaj_logged_rollback_groups('{"myGroup1","myGroup2"}','EMAJ_LAST_MARK');
ERROR:  _check_group_names: The group "myGroup2" is not in LOGGING state.
CONTEXT:  SQL statement "SELECT emaj._check_group_names(v_groupNames := v_groupNames, v_mayBeNull := FALSE, v_lockGroups := TRUE,
                                     v_checkList := 'LOGGING,ROLLBACKABLE,UNPROTECTED')"
PL/pgSQL function emaj._rlbk_check(text[],text,boolean,boolean) line 16 at SQL statement
SQL statement "SELECT emaj._rlbk_check(v_groupNames, v_mark, v_isAlterGroupAllowed, FALSE)"
PL/pgSQL function emaj._rlbk_init(text[],text,boolean,integer,boolean,boolean) line 23 at SQL statement
SQL statement "SELECT emaj._rlbk_init(v_groupNames, v_mark, v_isLoggedRlbk, 1, v_multiGroup, v_isAlterGroupAllowed)"
PL/pgSQL function emaj._rlbk_groups(text[],text,boolean,boolean,boolean) line 26 at SQL statement
PL/pgSQL function emaj.emaj_logged_rollback_groups(text[],text,boolean) line 12 at RETURN QUERY
rollback;
-- start groups and set some marks
select emaj.emaj_start_group('myGroup1','Mark11');
 emaj_start_group 
------------------
                7
(1 row)

select emaj.emaj_start_group('myGroup2','Mark21');
 emaj_start_group 
------------------
               10
(1 row)

select emaj.emaj_set_mark_group('myGroup1','Different_Mark');
 emaj_set_mark_group 
---------------------
                   7
(1 row)

select emaj.emaj_set_mark_group('myGroup2','Different_Mark');
 emaj_set_mark_group 
---------------------
                  10
(1 row)

-- log tables are empty
select count(*) from emaj_myschema1.mytbl1_log;
 count 
-------
     0
(1 row)

select count(*) from emaj_myschema1.mytbl2_log;
 count 
-------
     0
(1 row)

select count(*) from emaj_myschema1.mytbl2b_log;
 count 
-------
     0
(1 row)

select count(*) from emaj_myschema1."myTbl3_log";
 count 
-------
     0
(1 row)

select count(*) from emaj_myschema1.mytbl4_log;
 count 
-------
     0
(1 row)

select count(*) from emaj_myschema2.mytbl1_log;
 count 
-------
     0
(1 row)

select count(*) from emaj_myschema2.mytbl2_log;
 count 
-------
     0
(1 row)

select count(*) from emaj_myschema2."myTbl3_log";
 count 
-------
     0
(1 row)

select count(*) from emaj_myschema1.myTbl4_log;
 count 
-------
     0
(1 row)

-- protected group
select emaj.emaj_protect_group('myGroup1');
 emaj_protect_group 
--------------------
                  1
(1 row)

select emaj.emaj_protect_group('myGroup2');
 emaj_protect_group 
--------------------
                  1
(1 row)

select * from emaj.emaj_rollback_group('myGroup1','EMAJ_LAST_MARK');
ERROR:  _check_group_names: The group "myGroup1" is currently protected against rollback operations.
CONTEXT:  SQL statement "SELECT emaj._check_group_names(v_groupNames := v_groupNames, v_mayBeNull := FALSE, v_lockGroups := TRUE,
                                     v_checkList := 'LOGGING,ROLLBACKABLE,UNPROTECTED')"
PL/pgSQL function emaj._rlbk_check(text[],text,boolean,boolean) line 16 at SQL statement
SQL statement "SELECT emaj._rlbk_check(v_groupNames, v_mark, v_isAlterGroupAllowed, FALSE)"
PL/pgSQL function emaj._rlbk_init(text[],text,boolean,integer,boolean,boolean) line 23 at SQL statement
SQL statement "SELECT emaj._rlbk_init(v_groupNames, v_mark, v_isLoggedRlbk, 1, v_multiGroup, v_isAlterGroupAllowed)"
PL/pgSQL function emaj._rlbk_groups(text[],text,boolean,boolean,boolean) line 26 at SQL statement
PL/pgSQL function emaj.emaj_rollback_group(text,text,boolean) line 7 at RETURN QUERY
select * from emaj.emaj_logged_rollback_groups('{"myGroup2","myGroup1"}',NULL);
ERROR:  _check_group_names: The groups "myGroup1, myGroup2" are currently protected against rollback operations.
CONTEXT:  SQL statement "SELECT emaj._check_group_names(v_groupNames := v_groupNames, v_mayBeNull := FALSE, v_lockGroups := TRUE,
                                     v_checkList := 'LOGGING,ROLLBACKABLE,UNPROTECTED')"
PL/pgSQL function emaj._rlbk_check(text[],text,boolean,boolean) line 16 at SQL statement
SQL statement "SELECT emaj._rlbk_check(v_groupNames, v_mark, v_isAlterGroupAllowed, FALSE)"
PL/pgSQL function emaj._rlbk_init(text[],text,boolean,integer,boolean,boolean) line 23 at SQL statement
SQL statement "SELECT emaj._rlbk_init(v_groupNames, v_mark, v_isLoggedRlbk, 1, v_multiGroup, v_isAlterGroupAllowed)"
PL/pgSQL function emaj._rlbk_groups(text[],text,boolean,boolean,boolean) line 26 at SQL statement
PL/pgSQL function emaj.emaj_logged_rollback_groups(text[],text,boolean) line 12 at RETURN QUERY
select emaj.emaj_unprotect_group('myGroup1');
 emaj_unprotect_group 
----------------------
                    1
(1 row)

select emaj.emaj_unprotect_group('myGroup2');
 emaj_unprotect_group 
----------------------
                    1
(1 row)

select * from emaj.emaj_rollback_group('myGroup1','EMAJ_LAST_MARK');
 rlbk_severity |            rlbk_message             
---------------+-------------------------------------
 Notice        | 0 / 5 tables effectively processed.
 Notice        | 2 sequences processed.
(2 rows)

-- unknown mark name
select * from emaj.emaj_rollback_group('myGroup1',NULL);
ERROR:  _check_mark_name: The mark "<NULL>" does not exist for the group "myGroup1".
CONTEXT:  SQL statement "SELECT emaj._check_mark_name(v_groupNames := v_groupNames, v_mark := v_mark, v_checkList := 'ACTIVE')"
PL/pgSQL function emaj._rlbk_check(text[],text,boolean,boolean) line 21 at SQL statement
SQL statement "SELECT emaj._rlbk_check(v_groupNames, v_mark, v_isAlterGroupAllowed, FALSE)"
PL/pgSQL function emaj._rlbk_init(text[],text,boolean,integer,boolean,boolean) line 23 at SQL statement
SQL statement "SELECT emaj._rlbk_init(v_groupNames, v_mark, v_isLoggedRlbk, 1, v_multiGroup, v_isAlterGroupAllowed)"
PL/pgSQL function emaj._rlbk_groups(text[],text,boolean,boolean,boolean) line 26 at SQL statement
PL/pgSQL function emaj.emaj_rollback_group(text,text,boolean) line 7 at RETURN QUERY
select * from emaj.emaj_rollback_group('myGroup1','DummyMark');
ERROR:  _check_mark_name: The mark "DummyMark" does not exist for the group "myGroup1".
CONTEXT:  SQL statement "SELECT emaj._check_mark_name(v_groupNames := v_groupNames, v_mark := v_mark, v_checkList := 'ACTIVE')"
PL/pgSQL function emaj._rlbk_check(text[],text,boolean,boolean) line 21 at SQL statement
SQL statement "SELECT emaj._rlbk_check(v_groupNames, v_mark, v_isAlterGroupAllowed, FALSE)"
PL/pgSQL function emaj._rlbk_init(text[],text,boolean,integer,boolean,boolean) line 23 at SQL statement
SQL statement "SELECT emaj._rlbk_init(v_groupNames, v_mark, v_isLoggedRlbk, 1, v_multiGroup, v_isAlterGroupAllowed)"
PL/pgSQL function emaj._rlbk_groups(text[],text,boolean,boolean,boolean) line 26 at SQL statement
PL/pgSQL function emaj.emaj_rollback_group(text,text,boolean) line 7 at RETURN QUERY
select * from emaj.emaj_logged_rollback_group('myGroup1',NULL);
ERROR:  _check_mark_name: The mark "<NULL>" does not exist for the group "myGroup1".
CONTEXT:  SQL statement "SELECT emaj._check_mark_name(v_groupNames := v_groupNames, v_mark := v_mark, v_checkList := 'ACTIVE')"
PL/pgSQL function emaj._rlbk_check(text[],text,boolean,boolean) line 21 at SQL statement
SQL statement "SELECT emaj._rlbk_check(v_groupNames, v_mark, v_isAlterGroupAllowed, FALSE)"
PL/pgSQL function emaj._rlbk_init(text[],text,boolean,integer,boolean,boolean) line 23 at SQL statement
SQL statement "SELECT emaj._rlbk_init(v_groupNames, v_mark, v_isLoggedRlbk, 1, v_multiGroup, v_isAlterGroupAllowed)"
PL/pgSQL function emaj._rlbk_groups(text[],text,boolean,boolean,boolean) line 26 at SQL statement
PL/pgSQL function emaj.emaj_logged_rollback_group(text,text,boolean) line 11 at RETURN QUERY
select * from emaj.emaj_logged_rollback_group('myGroup1','DummyMark');
ERROR:  _check_mark_name: The mark "DummyMark" does not exist for the group "myGroup1".
CONTEXT:  SQL statement "SELECT emaj._check_mark_name(v_groupNames := v_groupNames, v_mark := v_mark, v_checkList := 'ACTIVE')"
PL/pgSQL function emaj._rlbk_check(text[],text,boolean,boolean) line 21 at SQL statement
SQL statement "SELECT emaj._rlbk_check(v_groupNames, v_mark, v_isAlterGroupAllowed, FALSE)"
PL/pgSQL function emaj._rlbk_init(text[],text,boolean,integer,boolean,boolean) line 23 at SQL statement
SQL statement "SELECT emaj._rlbk_init(v_groupNames, v_mark, v_isLoggedRlbk, 1, v_multiGroup, v_isAlterGroupAllowed)"
PL/pgSQL function emaj._rlbk_groups(text[],text,boolean,boolean,boolean) line 26 at SQL statement
PL/pgSQL function emaj.emaj_logged_rollback_group(text,text,boolean) line 11 at RETURN QUERY
select * from emaj.emaj_rollback_groups('{"myGroup1","myGroup2",""}',NULL);
ERROR:  _check_mark_name: The mark "<NULL>" does not exist for the groups "myGroup1, myGroup2".
CONTEXT:  SQL statement "SELECT emaj._check_mark_name(v_groupNames := v_groupNames, v_mark := v_mark, v_checkList := 'ACTIVE')"
PL/pgSQL function emaj._rlbk_check(text[],text,boolean,boolean) line 21 at SQL statement
SQL statement "SELECT emaj._rlbk_check(v_groupNames, v_mark, v_isAlterGroupAllowed, FALSE)"
PL/pgSQL function emaj._rlbk_init(text[],text,boolean,integer,boolean,boolean) line 23 at SQL statement
SQL statement "SELECT emaj._rlbk_init(v_groupNames, v_mark, v_isLoggedRlbk, 1, v_multiGroup, v_isAlterGroupAllowed)"
PL/pgSQL function emaj._rlbk_groups(text[],text,boolean,boolean,boolean) line 26 at SQL statement
PL/pgSQL function emaj.emaj_rollback_groups(text[],text,boolean) line 8 at RETURN QUERY
select * from emaj.emaj_rollback_groups('{"myGroup1","myGroup2",NULL}',NULL);
ERROR:  _check_mark_name: The mark "<NULL>" does not exist for the groups "myGroup1, myGroup2".
CONTEXT:  SQL statement "SELECT emaj._check_mark_name(v_groupNames := v_groupNames, v_mark := v_mark, v_checkList := 'ACTIVE')"
PL/pgSQL function emaj._rlbk_check(text[],text,boolean,boolean) line 21 at SQL statement
SQL statement "SELECT emaj._rlbk_check(v_groupNames, v_mark, v_isAlterGroupAllowed, FALSE)"
PL/pgSQL function emaj._rlbk_init(text[],text,boolean,integer,boolean,boolean) line 23 at SQL statement
SQL statement "SELECT emaj._rlbk_init(v_groupNames, v_mark, v_isLoggedRlbk, 1, v_multiGroup, v_isAlterGroupAllowed)"
PL/pgSQL function emaj._rlbk_groups(text[],text,boolean,boolean,boolean) line 26 at SQL statement
PL/pgSQL function emaj.emaj_rollback_groups(text[],text,boolean) line 8 at RETURN QUERY
select * from emaj.emaj_rollback_groups('{"myGroup1","myGroup2"}','DummyMark');
ERROR:  _check_mark_name: The mark "DummyMark" does not exist for the groups "myGroup1, myGroup2".
CONTEXT:  SQL statement "SELECT emaj._check_mark_name(v_groupNames := v_groupNames, v_mark := v_mark, v_checkList := 'ACTIVE')"
PL/pgSQL function emaj._rlbk_check(text[],text,boolean,boolean) line 21 at SQL statement
SQL statement "SELECT emaj._rlbk_check(v_groupNames, v_mark, v_isAlterGroupAllowed, FALSE)"
PL/pgSQL function emaj._rlbk_init(text[],text,boolean,integer,boolean,boolean) line 23 at SQL statement
SQL statement "SELECT emaj._rlbk_init(v_groupNames, v_mark, v_isLoggedRlbk, 1, v_multiGroup, v_isAlterGroupAllowed)"
PL/pgSQL function emaj._rlbk_groups(text[],text,boolean,boolean,boolean) line 26 at SQL statement
PL/pgSQL function emaj.emaj_rollback_groups(text[],text,boolean) line 8 at RETURN QUERY
select * from emaj.emaj_logged_rollback_groups('{"myGroup1","myGroup2","myGroup2"}',NULL);
ERROR:  _check_mark_name: The mark "<NULL>" does not exist for the groups "myGroup1, myGroup2".
CONTEXT:  SQL statement "SELECT emaj._check_mark_name(v_groupNames := v_groupNames, v_mark := v_mark, v_checkList := 'ACTIVE')"
PL/pgSQL function emaj._rlbk_check(text[],text,boolean,boolean) line 21 at SQL statement
SQL statement "SELECT emaj._rlbk_check(v_groupNames, v_mark, v_isAlterGroupAllowed, FALSE)"
PL/pgSQL function emaj._rlbk_init(text[],text,boolean,integer,boolean,boolean) line 23 at SQL statement
SQL statement "SELECT emaj._rlbk_init(v_groupNames, v_mark, v_isLoggedRlbk, 1, v_multiGroup, v_isAlterGroupAllowed)"
PL/pgSQL function emaj._rlbk_groups(text[],text,boolean,boolean,boolean) line 26 at SQL statement
PL/pgSQL function emaj.emaj_logged_rollback_groups(text[],text,boolean) line 12 at RETURN QUERY
select * from emaj.emaj_logged_rollback_groups('{"myGroup1","myGroup2"}','Mark11');
ERROR:  _check_mark_name: The mark "Mark11" does not exist for the group "myGroup2".
CONTEXT:  SQL statement "SELECT emaj._check_mark_name(v_groupNames := v_groupNames, v_mark := v_mark, v_checkList := 'ACTIVE')"
PL/pgSQL function emaj._rlbk_check(text[],text,boolean,boolean) line 21 at SQL statement
SQL statement "SELECT emaj._rlbk_check(v_groupNames, v_mark, v_isAlterGroupAllowed, FALSE)"
PL/pgSQL function emaj._rlbk_init(text[],text,boolean,integer,boolean,boolean) line 23 at SQL statement
SQL statement "SELECT emaj._rlbk_init(v_groupNames, v_mark, v_isLoggedRlbk, 1, v_multiGroup, v_isAlterGroupAllowed)"
PL/pgSQL function emaj._rlbk_groups(text[],text,boolean,boolean,boolean) line 26 at SQL statement
PL/pgSQL function emaj.emaj_logged_rollback_groups(text[],text,boolean) line 12 at RETURN QUERY
-- mark name referencing different points in time
select * from emaj.emaj_rollback_groups('{"myGroup1","myGroup2"}','Different_Mark');
ERROR:  _check_mark_name: The mark "Different_Mark" does not represent the same point in time for all groups.
CONTEXT:  SQL statement "SELECT emaj._check_mark_name(v_groupNames := v_groupNames, v_mark := v_mark, v_checkList := 'ACTIVE')"
PL/pgSQL function emaj._rlbk_check(text[],text,boolean,boolean) line 21 at SQL statement
SQL statement "SELECT emaj._rlbk_check(v_groupNames, v_mark, v_isAlterGroupAllowed, FALSE)"
PL/pgSQL function emaj._rlbk_init(text[],text,boolean,integer,boolean,boolean) line 23 at SQL statement
SQL statement "SELECT emaj._rlbk_init(v_groupNames, v_mark, v_isLoggedRlbk, 1, v_multiGroup, v_isAlterGroupAllowed)"
PL/pgSQL function emaj._rlbk_groups(text[],text,boolean,boolean,boolean) line 26 at SQL statement
PL/pgSQL function emaj.emaj_rollback_groups(text[],text,boolean) line 8 at RETURN QUERY
select * from emaj.emaj_rollback_groups('{"myGroup1","myGroup2"}','EMAJ_LAST_MARK');
ERROR:  _check_mark_name: The EMAJ_LAST_MARK does not represent the same point in time for all groups.
CONTEXT:  SQL statement "SELECT emaj._check_mark_name(v_groupNames := v_groupNames, v_mark := v_mark, v_checkList := 'ACTIVE')"
PL/pgSQL function emaj._rlbk_check(text[],text,boolean,boolean) line 21 at SQL statement
SQL statement "SELECT emaj._rlbk_check(v_groupNames, v_mark, v_isAlterGroupAllowed, FALSE)"
PL/pgSQL function emaj._rlbk_init(text[],text,boolean,integer,boolean,boolean) line 23 at SQL statement
SQL statement "SELECT emaj._rlbk_init(v_groupNames, v_mark, v_isLoggedRlbk, 1, v_multiGroup, v_isAlterGroupAllowed)"
PL/pgSQL function emaj._rlbk_groups(text[],text,boolean,boolean,boolean) line 26 at SQL statement
PL/pgSQL function emaj.emaj_rollback_groups(text[],text,boolean) line 8 at RETURN QUERY
-- attempt to rollback 'audit_only' groups
select emaj.emaj_create_group('auditOnlyEmptyGroup',false);
 emaj_create_group 
-------------------
                 1
(1 row)

select * from emaj.emaj_rollback_group('phil''s group#3",','EMAJ_LAST_MARK');
ERROR:  _check_group_names: The group "phil's group#3"," has been created as AUDIT_ONLY.
CONTEXT:  SQL statement "SELECT emaj._check_group_names(v_groupNames := v_groupNames, v_mayBeNull := FALSE, v_lockGroups := TRUE,
                                     v_checkList := 'LOGGING,ROLLBACKABLE,UNPROTECTED')"
PL/pgSQL function emaj._rlbk_check(text[],text,boolean,boolean) line 16 at SQL statement
SQL statement "SELECT emaj._rlbk_check(v_groupNames, v_mark, v_isAlterGroupAllowed, FALSE)"
PL/pgSQL function emaj._rlbk_init(text[],text,boolean,integer,boolean,boolean) line 23 at SQL statement
SQL statement "SELECT emaj._rlbk_init(v_groupNames, v_mark, v_isLoggedRlbk, 1, v_multiGroup, v_isAlterGroupAllowed)"
PL/pgSQL function emaj._rlbk_groups(text[],text,boolean,boolean,boolean) line 26 at SQL statement
PL/pgSQL function emaj.emaj_rollback_group(text,text,boolean) line 7 at RETURN QUERY
select * from emaj.emaj_logged_rollback_groups(array['phil''s group#3",','auditOnlyEmptyGroup'],'M1_audit_only');
ERROR:  _check_group_names: The groups "auditOnlyEmptyGroup, phil's group#3"," have been created as AUDIT_ONLY.
CONTEXT:  SQL statement "SELECT emaj._check_group_names(v_groupNames := v_groupNames, v_mayBeNull := FALSE, v_lockGroups := TRUE,
                                     v_checkList := 'LOGGING,ROLLBACKABLE,UNPROTECTED')"
PL/pgSQL function emaj._rlbk_check(text[],text,boolean,boolean) line 16 at SQL statement
SQL statement "SELECT emaj._rlbk_check(v_groupNames, v_mark, v_isAlterGroupAllowed, FALSE)"
PL/pgSQL function emaj._rlbk_init(text[],text,boolean,integer,boolean,boolean) line 23 at SQL statement
SQL statement "SELECT emaj._rlbk_init(v_groupNames, v_mark, v_isLoggedRlbk, 1, v_multiGroup, v_isAlterGroupAllowed)"
PL/pgSQL function emaj._rlbk_groups(text[],text,boolean,boolean,boolean) line 26 at SQL statement
PL/pgSQL function emaj.emaj_logged_rollback_groups(text[],text,boolean) line 12 at RETURN QUERY
select emaj.emaj_drop_group('auditOnlyEmptyGroup');
 emaj_drop_group 
-----------------
               0
(1 row)

-- attempt to rollback to a stop mark
begin;
  select emaj.emaj_stop_group('myGroup1');
 emaj_stop_group 
-----------------
               7
(1 row)

  select emaj.emaj_start_group('myGroup1','StartMark',false);
 emaj_start_group 
------------------
                7
(1 row)

  select emaj.emaj_rename_mark_group('myGroup1',(select emaj.emaj_get_previous_mark_group('myGroup1','StartMark')), 'GeneratedStopMark');
 emaj_rename_mark_group 
------------------------
 
(1 row)

  select * from emaj.emaj_rollback_group('myGroup1','GeneratedStopMark');
ERROR:  _check_mark_name: For the group "myGroup1", the mark "GeneratedStopMark" is DELETED.
CONTEXT:  SQL statement "SELECT emaj._check_mark_name(v_groupNames := v_groupNames, v_mark := v_mark, v_checkList := 'ACTIVE')"
PL/pgSQL function emaj._rlbk_check(text[],text,boolean,boolean) line 21 at SQL statement
SQL statement "SELECT emaj._rlbk_check(v_groupNames, v_mark, v_isAlterGroupAllowed, FALSE)"
PL/pgSQL function emaj._rlbk_init(text[],text,boolean,integer,boolean,boolean) line 23 at SQL statement
SQL statement "SELECT emaj._rlbk_init(v_groupNames, v_mark, v_isLoggedRlbk, 1, v_multiGroup, v_isAlterGroupAllowed)"
PL/pgSQL function emaj._rlbk_groups(text[],text,boolean,boolean,boolean) line 26 at SQL statement
PL/pgSQL function emaj.emaj_rollback_group(text,text,boolean) line 7 at RETURN QUERY
rollback;
-- attempt to rollback over protected marks
begin;
  select emaj.emaj_set_mark_group('myGroup1','Protected Mark 1');
 emaj_set_mark_group 
---------------------
                   7
(1 row)

  select emaj.emaj_protect_mark_group('myGroup1','Protected Mark 1');
 emaj_protect_mark_group 
-------------------------
                       1
(1 row)

  select emaj.emaj_set_mark_group('myGroup1','Protected Mark 2');
 emaj_set_mark_group 
---------------------
                   7
(1 row)

  select emaj.emaj_protect_mark_group('myGroup1','Protected Mark 2');
 emaj_protect_mark_group 
-------------------------
                       1
(1 row)

  select * from emaj.emaj_rollback_group('myGroup1','Mark11');
ERROR:  _rlbk_check: Protected marks (Protected Mark 1, Protected Mark 2) for the group "myGroup1" block the rollback to the mark "Mark11".
CONTEXT:  SQL statement "SELECT emaj._rlbk_check(v_groupNames, v_mark, v_isAlterGroupAllowed, FALSE)"
PL/pgSQL function emaj._rlbk_init(text[],text,boolean,integer,boolean,boolean) line 23 at SQL statement
SQL statement "SELECT emaj._rlbk_init(v_groupNames, v_mark, v_isLoggedRlbk, 1, v_multiGroup, v_isAlterGroupAllowed)"
PL/pgSQL function emaj._rlbk_groups(text[],text,boolean,boolean,boolean) line 26 at SQL statement
PL/pgSQL function emaj.emaj_rollback_group(text,text,boolean) line 7 at RETURN QUERY
rollback;
-- attempt to rollback several groups over one single-mark protected marks
begin;
  select emaj.emaj_set_mark_groups('{"myGroup1","myGroup2"}','Common Mark 1');
 emaj_set_mark_groups 
----------------------
                   17
(1 row)

  select emaj.emaj_set_mark_group('myGroup1','Protected Mark 1');
 emaj_set_mark_group 
---------------------
                   7
(1 row)

  select emaj.emaj_protect_mark_group('myGroup1','Protected Mark 1');
 emaj_protect_mark_group 
-------------------------
                       1
(1 row)

  select * from emaj.emaj_rollback_groups('{"myGroup1","myGroup2"}','Common Mark 1');
ERROR:  _rlbk_check: Protected marks (Protected Mark 1) for the group "myGroup1" block the rollback to the mark "Common Mark 1".
CONTEXT:  SQL statement "SELECT emaj._rlbk_check(v_groupNames, v_mark, v_isAlterGroupAllowed, FALSE)"
PL/pgSQL function emaj._rlbk_init(text[],text,boolean,integer,boolean,boolean) line 23 at SQL statement
SQL statement "SELECT emaj._rlbk_init(v_groupNames, v_mark, v_isLoggedRlbk, 1, v_multiGroup, v_isAlterGroupAllowed)"
PL/pgSQL function emaj._rlbk_groups(text[],text,boolean,boolean,boolean) line 26 at SQL statement
PL/pgSQL function emaj.emaj_rollback_groups(text[],text,boolean) line 8 at RETURN QUERY
rollback;
-- attempt to logged-rollback over a protected mark
begin;
  select emaj.emaj_protect_mark_group('myGroup1','EMAJ_LAST_MARK');
 emaj_protect_mark_group 
-------------------------
                       1
(1 row)

  select * from emaj.emaj_logged_rollback_group('myGroup1','Mark11');
ERROR:  _rlbk_check: Protected marks (Different_Mark) for the group "myGroup1" block the rollback to the mark "Mark11".
CONTEXT:  SQL statement "SELECT emaj._rlbk_check(v_groupNames, v_mark, v_isAlterGroupAllowed, FALSE)"
PL/pgSQL function emaj._rlbk_init(text[],text,boolean,integer,boolean,boolean) line 23 at SQL statement
SQL statement "SELECT emaj._rlbk_init(v_groupNames, v_mark, v_isLoggedRlbk, 1, v_multiGroup, v_isAlterGroupAllowed)"
PL/pgSQL function emaj._rlbk_groups(text[],text,boolean,boolean,boolean) line 26 at SQL statement
PL/pgSQL function emaj.emaj_logged_rollback_group(text,text,boolean) line 11 at RETURN QUERY
rollback;
-- rollback to a protected mark
begin;
  select emaj.emaj_protect_mark_group('myGroup1','EMAJ_LAST_MARK');
 emaj_protect_mark_group 
-------------------------
                       1
(1 row)

  select * from emaj.emaj_rollback_group('myGroup1','EMAJ_LAST_MARK');
 rlbk_severity |            rlbk_message             
---------------+-------------------------------------
 Notice        | 0 / 5 tables effectively processed.
 Notice        | 2 sequences processed.
(2 rows)

rollback;
-- missing application table and mono-group rollback
begin;
  drop table mySchema2."myTbl3" cascade;
  select * from emaj.emaj_rollback_group('myGroup2','Mark21');
ERROR:  _verify_groups (1): In group "myGroup2", the table "myschema2"."myTbl3" does not exist any more. You may use "SELECT * FROM emaj.emaj_verify_all()" to look for other issues.
CONTEXT:  SQL statement "SELECT 0
        FROM emaj._verify_groups(v_groupNames, TRUE)"
PL/pgSQL function emaj._rlbk_init(text[],text,boolean,integer,boolean,boolean) line 26 at PERFORM
SQL statement "SELECT emaj._rlbk_init(v_groupNames, v_mark, v_isLoggedRlbk, 1, v_multiGroup, v_isAlterGroupAllowed)"
PL/pgSQL function emaj._rlbk_groups(text[],text,boolean,boolean,boolean) line 26 at SQL statement
PL/pgSQL function emaj.emaj_rollback_group(text,text,boolean) line 7 at RETURN QUERY
rollback;
begin;
  drop table mySchema2."myTbl3" cascade;
  select * from emaj.emaj_logged_rollback_group('myGroup2','Mark21');
ERROR:  _verify_groups (1): In group "myGroup2", the table "myschema2"."myTbl3" does not exist any more. You may use "SELECT * FROM emaj.emaj_verify_all()" to look for other issues.
CONTEXT:  SQL statement "SELECT 0
        FROM emaj._verify_groups(v_groupNames, TRUE)"
PL/pgSQL function emaj._rlbk_init(text[],text,boolean,integer,boolean,boolean) line 26 at PERFORM
SQL statement "SELECT emaj._rlbk_init(v_groupNames, v_mark, v_isLoggedRlbk, 1, v_multiGroup, v_isAlterGroupAllowed)"
PL/pgSQL function emaj._rlbk_groups(text[],text,boolean,boolean,boolean) line 26 at SQL statement
PL/pgSQL function emaj.emaj_logged_rollback_group(text,text,boolean) line 11 at RETURN QUERY
rollback;
-- internal error when the row corresponding to an application sequence to rollback is missing in emaj_sequence
begin;
  delete from emaj.emaj_sequence where sequ_schema = 'myschema2' and sequ_name = 'myseq1';
  select * from emaj.emaj_rollback_group('myGroup2','Mark21');
ERROR:  _rlbk_seq: No mark at time id "4003" can be found for the sequence "myschema2.myseq1".
CONTEXT:  SQL statement "SELECT emaj._rlbk_seq(t.*, greatest(v_markTimeId, lower(t.rel_time_range)))
      FROM
        (SELECT *
           FROM emaj.emaj_relation
           WHERE upper_inf(rel_time_range)
             AND rel_group = ANY (v_groupNames)
             AND rel_kind = 'S'
           ORDER BY rel_schema, rel_tblseq
        ) as t"
PL/pgSQL function emaj._rlbk_end(integer,boolean) line 138 at PERFORM
PL/pgSQL function emaj._rlbk_groups(text[],text,boolean,boolean,boolean) line 34 at RETURN QUERY
PL/pgSQL function emaj.emaj_rollback_group(text,text,boolean) line 7 at RETURN QUERY
rollback;
-- should be OK, with different cases of dblink status
-- hide dblink_connect functions
alter function public.dblink_connect_u(text,text) rename to renamed_dblink_connect_u;
alter function public.dblink_connect_u(text) rename to renamed_dblink_connect_u;
select * from emaj.emaj_rollback_group('myGroup1','EMAJ_LAST_MARK');
 rlbk_severity |            rlbk_message             
---------------+-------------------------------------
 Notice        | 0 / 5 tables effectively processed.
 Notice        | 2 sequences processed.
(2 rows)

select * from emaj.emaj_rollback_group('myGroup2','Mark21');
 rlbk_severity |            rlbk_message             
---------------+-------------------------------------
 Notice        | 0 / 8 tables effectively processed.
 Notice        | 2 sequences processed.
(2 rows)

alter function public.renamed_dblink_connect_u(text,text) rename to dblink_connect_u;
alter function public.renamed_dblink_connect_u(text) rename to dblink_connect_u;
select emaj.emaj_set_mark_groups('{"myGroup1","myGroup2"}','Mark1B');
 emaj_set_mark_groups 
----------------------
                   17
(1 row)

-- no user/password defined in emaj_param
select * from emaj.emaj_rollback_groups('{"myGroup1","myGroup2"}','EMAJ_LAST_MARK');
 rlbk_severity |             rlbk_message             
---------------+--------------------------------------
 Notice        | 0 / 13 tables effectively processed.
 Notice        | 4 sequences processed.
(2 rows)

-- bad user/password defined in emaj_param
insert into emaj.emaj_param (param_key, param_value_text) 
  values ('dblink_user_password','user=<user> password=<password>');
select * from emaj.emaj_rollback_groups('{"myGroup1","myGroup2"}','Mark1B');
 rlbk_severity |             rlbk_message             
---------------+--------------------------------------
 Notice        | 0 / 13 tables effectively processed.
 Notice        | 4 sequences processed.
(2 rows)

-- transaction not in READ COMMITTED isolation level => the dblink connection is not possible
begin;
  set transaction isolation level repeatable read;
  select * from emaj.emaj_logged_rollback_groups('{"myGroup1","myGroup2"}','EMAJ_LAST_MARK');
 rlbk_severity |             rlbk_message             
---------------+--------------------------------------
 Notice        | 0 / 13 tables effectively processed.
 Notice        | 4 sequences processed.
(2 rows)

commit;
-- dblink connection should now be ok (missing right on dblink functions is tested in adm1.sql)
update emaj.emaj_param set param_value_text = 'user=postgres password=postgres' 
  where param_key = 'dblink_user_password';
select * from emaj.emaj_logged_rollback_groups('{"myGroup1","myGroup2"}','Mark1B');
 rlbk_severity |             rlbk_message             
---------------+--------------------------------------
 Notice        | 0 / 13 tables effectively processed.
 Notice        | 4 sequences processed.
(2 rows)

-- missing application table and multi-groups rollback
begin;
  drop table mySchema2."myTbl3" cascade;
  select * from emaj.emaj_rollback_groups('{"myGroup1","myGroup2"}','Mark1B');
ERROR:  _verify_groups (1): In group "myGroup2", the table "myschema2"."myTbl3" does not exist any more. You may use "SELECT * FROM emaj.emaj_verify_all()" to look for other issues.
CONTEXT:  SQL statement "SELECT 0
        FROM emaj._verify_groups(v_groupNames, TRUE)"
PL/pgSQL function emaj._rlbk_init(text[],text,boolean,integer,boolean,boolean) line 26 at PERFORM
SQL statement "SELECT emaj._rlbk_init(v_groupNames, v_mark, v_isLoggedRlbk, 1, v_multiGroup, v_isAlterGroupAllowed)"
PL/pgSQL function emaj._rlbk_groups(text[],text,boolean,boolean,boolean) line 26 at SQL statement
PL/pgSQL function emaj.emaj_rollback_groups(text[],text,boolean) line 8 at RETURN QUERY
rollback;
begin;
  drop table mySchema2."myTbl3" cascade;
  select * from emaj.emaj_logged_rollback_groups('{"myGroup1","myGroup2"}','Mark1B');
ERROR:  _verify_groups (1): In group "myGroup2", the table "myschema2"."myTbl3" does not exist any more. You may use "SELECT * FROM emaj.emaj_verify_all()" to look for other issues.
CONTEXT:  SQL statement "SELECT 0
        FROM emaj._verify_groups(v_groupNames, TRUE)"
PL/pgSQL function emaj._rlbk_init(text[],text,boolean,integer,boolean,boolean) line 26 at PERFORM
SQL statement "SELECT emaj._rlbk_init(v_groupNames, v_mark, v_isLoggedRlbk, 1, v_multiGroup, v_isAlterGroupAllowed)"
PL/pgSQL function emaj._rlbk_groups(text[],text,boolean,boolean,boolean) line 26 at SQL statement
PL/pgSQL function emaj.emaj_logged_rollback_groups(text[],text,boolean) line 12 at RETURN QUERY
rollback;
-- restart groups
select emaj.emaj_stop_groups('{"myGroup1","myGroup2"}');
 emaj_stop_groups 
------------------
               17
(1 row)

select emaj.emaj_start_group('myGroup1','Mark11');
 emaj_start_group 
------------------
                7
(1 row)

select emaj.emaj_start_group('myGroup2','Mark21');
 emaj_start_group 
------------------
               10
(1 row)

-----------------------------
-- log phase #1 with 2 unlogged rollbacks
-----------------------------
-- Populate application tables
set search_path=public,myschema1;
-- inserts/updates/deletes in myTbl1, myTbl2 and myTbl2b (via trigger)
insert into myTbl1 select i, 'ABC', E'\\014'::bytea from generate_series (1,11) as i;
begin transaction;
  update myTbl1 set col13=E'\\034'::bytea where col11 <= 3;
  insert into myTbl2 values (1,'ABC',current_date);
commit;
delete from myTbl1 where col11 > 10;
insert into myTbl2 values (2,'DEF',NULL);
insert into myTbl2 values (3,'GHI',NULL);
update myTbl2 set col22 = NULL WHERE col23 IS NULL;
delete from myTbl2 where col21 = 3 and col22 is NULL;
select count(*) from mytbl1;
 count 
-------
    10
(1 row)

select count(*) from mytbl2;
 count 
-------
     2
(1 row)

select count(*) from mytbl2b;
 count 
-------
     6
(1 row)

select count(*) from "myTbl3";
 count 
-------
     0
(1 row)

select count(*) from myTbl4;
 count 
-------
     0
(1 row)

-- set a mark
select emaj.emaj_set_mark_group('myGroup1','Mark12');
 emaj_set_mark_group 
---------------------
                   7
(1 row)

select mark_group, regexp_replace(mark_name,E'\\d\\d\.\\d\\d\\.\\d\\d\\.\\d\\d\\d\\d','%','g'), mark_time_id, mark_is_deleted, mark_is_rlbk_protected, mark_comment, mark_log_rows_before_next, mark_logged_rlbk_target_mark from emaj.emaj_mark order by mark_time_id, mark_group;
    mark_group    | regexp_replace | mark_time_id | mark_is_deleted | mark_is_rlbk_protected |              mark_comment              | mark_log_rows_before_next | mark_logged_rlbk_target_mark 
------------------+----------------+--------------+-----------------+------------------------+----------------------------------------+---------------------------+------------------------------
 emptyGroup       | SM2            |         3006 | f               | f                      | a comment on a mark for an empty group |                         0 | Mark1
 emptyGroup       | EGM3           |         3400 | f               | f                      |                                        |                         0 | 
 emptyGroup       | EGM4           |         3401 | f               | f                      |                                        |                         0 | 
 phil's group#3", | Mark4          |         3402 | f               | f                      |                                        |                         0 | 
 myGroup1         | Mark11         |         4027 | f               | f                      |                                        |                        27 | 
 myGroup2         | Mark21         |         4028 | f               | f                      |                                        |                         0 | 
 myGroup1         | Mark12         |         4029 | f               | f                      |                                        |                           | 
(7 rows)

select sequ_schema, sequ_name, sequ_time_id, sequ_last_val, sequ_is_called from emaj.emaj_sequence order by sequ_time_id, sequ_schema, sequ_name;
  sequ_schema   |     sequ_name     | sequ_time_id | sequ_last_val | sequ_is_called 
----------------+-------------------+--------------+---------------+----------------
 phil's schema3 | myTbl2\_col21_seq |         3402 |             1 | f
 phil's schema3 | phil's seq\1      |         3402 |          1000 | f
 myschema1      | myTbl3_col31_seq  |         4027 |             1 | f
 myschema1      | mytbl2b_col20_seq |         4027 |             1 | f
 myschema2      | myTbl3_col31_seq  |         4028 |             1 | f
 myschema2      | myseq1            |         4028 |          1000 | f
 myschema1      | myTbl3_col31_seq  |         4029 |             1 | f
 myschema1      | mytbl2b_col20_seq |         4029 |             6 | t
(8 rows)

select tbl_schema, tbl_name, tbl_time_id, tbl_log_seq_last_val from emaj.emaj_table order by tbl_time_id, tbl_schema, tbl_name;
   tbl_schema   |  tbl_name   | tbl_time_id | tbl_log_seq_last_val 
----------------+-------------+-------------+----------------------
 phil's schema3 | myTbl2\     |        3402 |                    0
 phil's schema3 | phil's tbl1 |        3402 |                    0
 myschema1      | myTbl3      |        4027 |                    0
 myschema1      | mytbl1      |        4027 |                    0
 myschema1      | mytbl2      |        4027 |                    0
 myschema1      | mytbl2b     |        4027 |                    0
 myschema1      | mytbl4      |        4027 |                    0
 myschema2      | myTbl3      |        4028 |                    0
 myschema2      | mytbl1      |        4028 |                    0
 myschema2      | mytbl2      |        4028 |                    0
 myschema2      | mytbl4      |        4028 |                    0
 myschema2      | mytbl5      |        4028 |                    0
 myschema2      | mytbl6      |        4028 |                    0
 myschema2      | mytbl7      |        4028 |                    0
 myschema2      | mytbl8      |        4028 |                    0
 myschema1      | myTbl3      |        4029 |                    0
 myschema1      | mytbl1      |        4029 |                   15
 myschema1      | mytbl2      |        4029 |                    6
 myschema1      | mytbl2b     |        4029 |                    6
 myschema1      | mytbl4      |        4029 |                    0
(20 rows)

-- inserts/updates/deletes in myTbl3 and myTbl4
insert into "myTbl3" (col33) select generate_series(1000,1039,4)/100;
insert into myTbl4 values (1,'FK...',1,1,'ABC');
update myTbl4 set col43 = NULL where col41 = 1;
select count(*) from "myTbl3";
 count 
-------
    10
(1 row)

select count(*) from myTbl4;
 count 
-------
     1
(1 row)

-- set a mark
select emaj.emaj_set_mark_group('myGroup1','Mark13');
 emaj_set_mark_group 
---------------------
                   7
(1 row)

select mark_group, regexp_replace(mark_name,E'\\d\\d\.\\d\\d\\.\\d\\d\\.\\d\\d\\d\\d','%','g'), mark_time_id, mark_is_deleted, mark_is_rlbk_protected, mark_comment, mark_log_rows_before_next, mark_logged_rlbk_target_mark from emaj.emaj_mark order by mark_time_id, mark_group;
    mark_group    | regexp_replace | mark_time_id | mark_is_deleted | mark_is_rlbk_protected |              mark_comment              | mark_log_rows_before_next | mark_logged_rlbk_target_mark 
------------------+----------------+--------------+-----------------+------------------------+----------------------------------------+---------------------------+------------------------------
 emptyGroup       | SM2            |         3006 | f               | f                      | a comment on a mark for an empty group |                         0 | Mark1
 emptyGroup       | EGM3           |         3400 | f               | f                      |                                        |                         0 | 
 emptyGroup       | EGM4           |         3401 | f               | f                      |                                        |                         0 | 
 phil's group#3", | Mark4          |         3402 | f               | f                      |                                        |                         0 | 
 myGroup1         | Mark11         |         4027 | f               | f                      |                                        |                        27 | 
 myGroup2         | Mark21         |         4028 | f               | f                      |                                        |                         0 | 
 myGroup1         | Mark12         |         4029 | f               | f                      |                                        |                        12 | 
 myGroup1         | Mark13         |         4030 | f               | f                      |                                        |                           | 
(8 rows)

select sequ_schema, sequ_name, sequ_time_id, sequ_last_val, sequ_is_called from emaj.emaj_sequence order by sequ_time_id, sequ_schema, sequ_name;
  sequ_schema   |     sequ_name     | sequ_time_id | sequ_last_val | sequ_is_called 
----------------+-------------------+--------------+---------------+----------------
 phil's schema3 | myTbl2\_col21_seq |         3402 |             1 | f
 phil's schema3 | phil's seq\1      |         3402 |          1000 | f
 myschema1      | myTbl3_col31_seq  |         4027 |             1 | f
 myschema1      | mytbl2b_col20_seq |         4027 |             1 | f
 myschema2      | myTbl3_col31_seq  |         4028 |             1 | f
 myschema2      | myseq1            |         4028 |          1000 | f
 myschema1      | myTbl3_col31_seq  |         4029 |             1 | f
 myschema1      | mytbl2b_col20_seq |         4029 |             6 | t
 myschema1      | myTbl3_col31_seq  |         4030 |            10 | t
 myschema1      | mytbl2b_col20_seq |         4030 |             6 | t
(10 rows)

select tbl_schema, tbl_name, tbl_time_id, tbl_log_seq_last_val from emaj.emaj_table order by tbl_time_id, tbl_schema, tbl_name;
   tbl_schema   |  tbl_name   | tbl_time_id | tbl_log_seq_last_val 
----------------+-------------+-------------+----------------------
 phil's schema3 | myTbl2\     |        3402 |                    0
 phil's schema3 | phil's tbl1 |        3402 |                    0
 myschema1      | myTbl3      |        4027 |                    0
 myschema1      | mytbl1      |        4027 |                    0
 myschema1      | mytbl2      |        4027 |                    0
 myschema1      | mytbl2b     |        4027 |                    0
 myschema1      | mytbl4      |        4027 |                    0
 myschema2      | myTbl3      |        4028 |                    0
 myschema2      | mytbl1      |        4028 |                    0
 myschema2      | mytbl2      |        4028 |                    0
 myschema2      | mytbl4      |        4028 |                    0
 myschema2      | mytbl5      |        4028 |                    0
 myschema2      | mytbl6      |        4028 |                    0
 myschema2      | mytbl7      |        4028 |                    0
 myschema2      | mytbl8      |        4028 |                    0
 myschema1      | myTbl3      |        4029 |                    0
 myschema1      | mytbl1      |        4029 |                   15
 myschema1      | mytbl2      |        4029 |                    6
 myschema1      | mytbl2b     |        4029 |                    6
 myschema1      | mytbl4      |        4029 |                    0
 myschema1      | myTbl3      |        4030 |                   10
 myschema1      | mytbl1      |        4030 |                   15
 myschema1      | mytbl2      |        4030 |                    6
 myschema1      | mytbl2b     |        4030 |                    6
 myschema1      | mytbl4      |        4030 |                    2
(25 rows)

select col11, col12, col13, emaj_verb, emaj_tuple, emaj_gid from emaj_myschema1.mytbl1_log order by emaj_gid, emaj_tuple desc;
 col11 |   col12    | col13 | emaj_verb | emaj_tuple | emaj_gid 
-------+------------+-------+-----------+------------+----------
     1 | ABC        | \x0c  | INS       | NEW        |  4000001
     2 | ABC        | \x0c  | INS       | NEW        |  4000002
     3 | ABC        | \x0c  | INS       | NEW        |  4000003
     4 | ABC        | \x0c  | INS       | NEW        |  4000004
     5 | ABC        | \x0c  | INS       | NEW        |  4000005
     6 | ABC        | \x0c  | INS       | NEW        |  4000006
     7 | ABC        | \x0c  | INS       | NEW        |  4000007
     8 | ABC        | \x0c  | INS       | NEW        |  4000008
     9 | ABC        | \x0c  | INS       | NEW        |  4000009
    10 | ABC        | \x0c  | INS       | NEW        |  4000010
    11 | ABC        | \x0c  | INS       | NEW        |  4000011
     1 | ABC        | \x0c  | UPD       | OLD        |  4000012
     1 | ABC        | \x1c  | UPD       | NEW        |  4000012
     2 | ABC        | \x0c  | UPD       | OLD        |  4000013
     2 | ABC        | \x1c  | UPD       | NEW        |  4000013
     3 | ABC        | \x0c  | UPD       | OLD        |  4000014
     3 | ABC        | \x1c  | UPD       | NEW        |  4000014
    11 | ABC        | \x0c  | DEL       | OLD        |  4000017
(18 rows)

select col21, col22, emaj_verb, emaj_tuple, emaj_gid from emaj_myschema1.mytbl2_log order by emaj_gid, emaj_tuple desc;
 col21 | col22 | emaj_verb | emaj_tuple | emaj_gid 
-------+-------+-----------+------------+----------
     1 | ABC   | INS       | NEW        |  4000015
     2 | DEF   | INS       | NEW        |  4000018
     3 | GHI   | INS       | NEW        |  4000020
     2 | DEF   | UPD       | OLD        |  4000022
     2 |       | UPD       | NEW        |  4000022
     3 | GHI   | UPD       | OLD        |  4000024
     3 |       | UPD       | NEW        |  4000024
     3 |       | DEL       | OLD        |  4000026
(8 rows)

select col20, col21, col22, col23, emaj_verb, emaj_tuple, emaj_gid from emaj_myschema1.mytbl2b_log order by emaj_gid, emaj_tuple desc;
 col20 | col21 | col22 | col23 | emaj_verb | emaj_tuple | emaj_gid 
-------+-------+-------+-------+-----------+------------+----------
     1 |     1 |       | t     | INS       | NEW        |  4000016
     2 |     2 |       | t     | INS       | NEW        |  4000019
     3 |     3 |       | t     | INS       | NEW        |  4000021
     4 |     2 |       | t     | INS       | NEW        |  4000023
     5 |     3 |       | t     | INS       | NEW        |  4000025
     6 |     3 |       | t     | INS       | NEW        |  4000027
(6 rows)

select col31, col33, emaj_verb, emaj_tuple, emaj_gid from emaj_myschema1."myTbl3_log" order by emaj_gid, emaj_tuple desc;
 col31 | col33 | emaj_verb | emaj_tuple | emaj_gid 
-------+-------+-----------+------------+----------
     1 | 10.00 | INS       | NEW        |  4000028
     2 | 10.00 | INS       | NEW        |  4000029
     3 | 10.00 | INS       | NEW        |  4000030
     4 | 10.00 | INS       | NEW        |  4000031
     5 | 10.00 | INS       | NEW        |  4000032
     6 | 10.00 | INS       | NEW        |  4000033
     7 | 10.00 | INS       | NEW        |  4000034
     8 | 10.00 | INS       | NEW        |  4000035
     9 | 10.00 | INS       | NEW        |  4000036
    10 | 10.00 | INS       | NEW        |  4000037
(10 rows)

select col41, col42, col43, col44, col45, emaj_verb, emaj_tuple, emaj_gid from emaj_myschema1.myTbl4_log order by emaj_gid, emaj_tuple desc;
 col41 | col42 | col43 | col44 |   col45    | emaj_verb | emaj_tuple | emaj_gid 
-------+-------+-------+-------+------------+-----------+------------+----------
     1 | FK... |     1 |     1 | ABC        | INS       | NEW        |  4000038
     1 | FK... |     1 |     1 | ABC        | UPD       | OLD        |  4000039
     1 | FK... |       |     1 | ABC        | UPD       | NEW        |  4000039
(3 rows)

-- rollback #1
select * from emaj.emaj_rollback_group('myGroup1','Mark12');
 rlbk_severity |            rlbk_message             
---------------+-------------------------------------
 Notice        | 2 / 5 tables effectively processed.
 Notice        | 2 sequences processed.
(2 rows)

-- check impact
select mark_group, regexp_replace(mark_name,E'\\d\\d\.\\d\\d\\.\\d\\d\\.\\d\\d\\d\\d','%','g'), mark_time_id, mark_is_deleted, mark_is_rlbk_protected, mark_comment, mark_log_rows_before_next, mark_logged_rlbk_target_mark from emaj.emaj_mark order by mark_time_id, mark_group;
    mark_group    | regexp_replace | mark_time_id | mark_is_deleted | mark_is_rlbk_protected |              mark_comment              | mark_log_rows_before_next | mark_logged_rlbk_target_mark 
------------------+----------------+--------------+-----------------+------------------------+----------------------------------------+---------------------------+------------------------------
 emptyGroup       | SM2            |         3006 | f               | f                      | a comment on a mark for an empty group |                         0 | Mark1
 emptyGroup       | EGM3           |         3400 | f               | f                      |                                        |                         0 | 
 emptyGroup       | EGM4           |         3401 | f               | f                      |                                        |                         0 | 
 phil's group#3", | Mark4          |         3402 | f               | f                      |                                        |                         0 | 
 myGroup1         | Mark11         |         4027 | f               | f                      |                                        |                        27 | 
 myGroup2         | Mark21         |         4028 | f               | f                      |                                        |                         0 | 
 myGroup1         | Mark12         |         4029 | f               | f                      |                                        |                           | 
(7 rows)

select sequ_schema, sequ_name, sequ_time_id, sequ_last_val, sequ_is_called from emaj.emaj_sequence order by sequ_time_id, sequ_schema, sequ_name;
  sequ_schema   |     sequ_name     | sequ_time_id | sequ_last_val | sequ_is_called 
----------------+-------------------+--------------+---------------+----------------
 phil's schema3 | myTbl2\_col21_seq |         3402 |             1 | f
 phil's schema3 | phil's seq\1      |         3402 |          1000 | f
 myschema1      | myTbl3_col31_seq  |         4027 |             1 | f
 myschema1      | mytbl2b_col20_seq |         4027 |             1 | f
 myschema2      | myTbl3_col31_seq  |         4028 |             1 | f
 myschema2      | myseq1            |         4028 |          1000 | f
 myschema1      | myTbl3_col31_seq  |         4029 |             1 | f
 myschema1      | mytbl2b_col20_seq |         4029 |             6 | t
(8 rows)

select tbl_schema, tbl_name, tbl_time_id, tbl_log_seq_last_val from emaj.emaj_table order by tbl_time_id, tbl_schema, tbl_name;
   tbl_schema   |  tbl_name   | tbl_time_id | tbl_log_seq_last_val 
----------------+-------------+-------------+----------------------
 phil's schema3 | myTbl2\     |        3402 |                    0
 phil's schema3 | phil's tbl1 |        3402 |                    0
 myschema1      | myTbl3      |        4027 |                    0
 myschema1      | mytbl1      |        4027 |                    0
 myschema1      | mytbl2      |        4027 |                    0
 myschema1      | mytbl2b     |        4027 |                    0
 myschema1      | mytbl4      |        4027 |                    0
 myschema2      | myTbl3      |        4028 |                    0
 myschema2      | mytbl1      |        4028 |                    0
 myschema2      | mytbl2      |        4028 |                    0
 myschema2      | mytbl4      |        4028 |                    0
 myschema2      | mytbl5      |        4028 |                    0
 myschema2      | mytbl6      |        4028 |                    0
 myschema2      | mytbl7      |        4028 |                    0
 myschema2      | mytbl8      |        4028 |                    0
 myschema1      | myTbl3      |        4029 |                    0
 myschema1      | mytbl1      |        4029 |                   15
 myschema1      | mytbl2      |        4029 |                    6
 myschema1      | mytbl2b     |        4029 |                    6
 myschema1      | mytbl4      |        4029 |                    0
(20 rows)

select sqhl_schema, sqhl_table, sqhl_begin_time_id, sqhl_end_time_id, sqhl_hole_size from emaj.emaj_seq_hole order by 1,2,3;
 sqhl_schema | sqhl_table | sqhl_begin_time_id | sqhl_end_time_id | sqhl_hole_size 
-------------+------------+--------------------+------------------+----------------
 myschema1   | myTbl3     |               4029 |             4031 |             10
 myschema1   | mytbl4     |               4029 |             4031 |              2
(2 rows)

select col31, col33, emaj_verb, emaj_tuple, emaj_gid from emaj_myschema1."myTbl3_log" order by emaj_gid, emaj_tuple desc;
 col31 | col33 | emaj_verb | emaj_tuple | emaj_gid 
-------+-------+-----------+------------+----------
(0 rows)

select col41, col42, col43, col44, col45, emaj_verb, emaj_tuple, emaj_gid from emaj_myschema1.myTbl4_log order by emaj_gid, emaj_tuple desc;
 col41 | col42 | col43 | col44 | col45 | emaj_verb | emaj_tuple | emaj_gid 
-------+-------+-------+-------+-------+-----------+------------+----------
(0 rows)

select col31, col33 from myschema1."myTbl3" order by col31;
 col31 | col33 
-------+-------
(0 rows)

select col41, col42, col43, col44, col45 from myschema1.myTbl4 order by col41;
 col41 | col42 | col43 | col44 | col45 
-------+-------+-------+-------+-------
(0 rows)

-- rollback #2 (and stop)
select * from emaj.emaj_rollback_group('myGroup1','Mark11');
 rlbk_severity |            rlbk_message             
---------------+-------------------------------------
 Notice        | 3 / 5 tables effectively processed.
 Notice        | 2 sequences processed.
(2 rows)

select emaj.emaj_stop_group('myGroup1');
 emaj_stop_group 
-----------------
               7
(1 row)

-- check impact
select mark_group, regexp_replace(mark_name,E'\\d\\d\.\\d\\d\\.\\d\\d\\.\\d\\d\\d\\d','%','g'), mark_time_id, mark_is_deleted, mark_is_rlbk_protected, mark_comment, mark_log_rows_before_next, mark_logged_rlbk_target_mark from emaj.emaj_mark order by mark_time_id, mark_group;
    mark_group    | regexp_replace | mark_time_id | mark_is_deleted | mark_is_rlbk_protected |              mark_comment              | mark_log_rows_before_next | mark_logged_rlbk_target_mark 
------------------+----------------+--------------+-----------------+------------------------+----------------------------------------+---------------------------+------------------------------
 emptyGroup       | SM2            |         3006 | f               | f                      | a comment on a mark for an empty group |                         0 | Mark1
 emptyGroup       | EGM3           |         3400 | f               | f                      |                                        |                         0 | 
 emptyGroup       | EGM4           |         3401 | f               | f                      |                                        |                         0 | 
 phil's group#3", | Mark4          |         3402 | f               | f                      |                                        |                         0 | 
 myGroup1         | Mark11         |         4027 | t               | f                      |                                        |                         0 | 
 myGroup2         | Mark21         |         4028 | f               | f                      |                                        |                         0 | 
 myGroup1         | STOP_%         |         4033 | t               | f                      |                                        |                         0 | 
(7 rows)

select sequ_schema, sequ_name, sequ_time_id, sequ_last_val, sequ_is_called from emaj.emaj_sequence order by sequ_time_id, sequ_schema, sequ_name;
  sequ_schema   |     sequ_name     | sequ_time_id | sequ_last_val | sequ_is_called 
----------------+-------------------+--------------+---------------+----------------
 phil's schema3 | myTbl2\_col21_seq |         3402 |             1 | f
 phil's schema3 | phil's seq\1      |         3402 |          1000 | f
 myschema1      | myTbl3_col31_seq  |         4027 |             1 | f
 myschema1      | mytbl2b_col20_seq |         4027 |             1 | f
 myschema2      | myTbl3_col31_seq  |         4028 |             1 | f
 myschema2      | myseq1            |         4028 |          1000 | f
 myschema1      | myTbl3_col31_seq  |         4033 |             1 | f
 myschema1      | mytbl2b_col20_seq |         4033 |             1 | f
(8 rows)

select tbl_schema, tbl_name, tbl_time_id, tbl_log_seq_last_val from emaj.emaj_table order by tbl_time_id, tbl_schema, tbl_name;
   tbl_schema   |  tbl_name   | tbl_time_id | tbl_log_seq_last_val 
----------------+-------------+-------------+----------------------
 phil's schema3 | myTbl2\     |        3402 |                    0
 phil's schema3 | phil's tbl1 |        3402 |                    0
 myschema1      | myTbl3      |        4027 |                    0
 myschema1      | mytbl1      |        4027 |                    0
 myschema1      | mytbl2      |        4027 |                    0
 myschema1      | mytbl2b     |        4027 |                    0
 myschema1      | mytbl4      |        4027 |                    0
 myschema2      | myTbl3      |        4028 |                    0
 myschema2      | mytbl1      |        4028 |                    0
 myschema2      | mytbl2      |        4028 |                    0
 myschema2      | mytbl4      |        4028 |                    0
 myschema2      | mytbl5      |        4028 |                    0
 myschema2      | mytbl6      |        4028 |                    0
 myschema2      | mytbl7      |        4028 |                    0
 myschema2      | mytbl8      |        4028 |                    0
 myschema1      | myTbl3      |        4033 |                   10
 myschema1      | mytbl1      |        4033 |                   15
 myschema1      | mytbl2      |        4033 |                    6
 myschema1      | mytbl2b     |        4033 |                    6
 myschema1      | mytbl4      |        4033 |                    2
(20 rows)

select sqhl_schema, sqhl_table, sqhl_begin_time_id, sqhl_end_time_id, sqhl_hole_size from emaj.emaj_seq_hole order by 1,2,3;
 sqhl_schema | sqhl_table | sqhl_begin_time_id | sqhl_end_time_id | sqhl_hole_size 
-------------+------------+--------------------+------------------+----------------
 myschema1   | myTbl3     |               4029 |             4031 |             10
 myschema1   | mytbl1     |               4027 |             4032 |             15
 myschema1   | mytbl2     |               4027 |             4032 |              6
 myschema1   | mytbl2b    |               4027 |             4032 |              6
 myschema1   | mytbl4     |               4029 |             4031 |              2
(5 rows)

select col11, col12, col13, emaj_verb, emaj_tuple, emaj_gid from emaj_myschema1.myTbl1_log order by emaj_gid, emaj_tuple desc;
 col11 | col12 | col13 | emaj_verb | emaj_tuple | emaj_gid 
-------+-------+-------+-----------+------------+----------
(0 rows)

select col21, col22, emaj_verb, emaj_tuple, emaj_gid from emaj_myschema1.myTbl2_log order by emaj_gid, emaj_tuple desc;
 col21 | col22 | emaj_verb | emaj_tuple | emaj_gid 
-------+-------+-----------+------------+----------
(0 rows)

select col20, col21, col22, col23, emaj_verb, emaj_tuple, emaj_gid from emaj_myschema1.myTbl2b_log order by emaj_gid, emaj_tuple desc;
 col20 | col21 | col22 | col23 | emaj_verb | emaj_tuple | emaj_gid 
-------+-------+-------+-------+-----------+------------+----------
(0 rows)

select col11, col12, col13 from myschema1.myTbl1 order by col11, col12;
 col11 | col12 | col13 
-------+-------+-------
(0 rows)

select col21, col22 from myschema1.myTbl2 order by col21;
 col21 | col22 
-------+-------
(0 rows)

select col20, col21 from myschema1.myTbl2b order by col20;
 col20 | col21 
-------+-------
(0 rows)

-- restart group
select emaj.emaj_start_group('myGroup1','Mark11');
 emaj_start_group 
------------------
                7
(1 row)

-- check the logs are empty again
select count(*) from emaj_myschema1.mytbl1_log;
 count 
-------
     0
(1 row)

select count(*) from emaj_myschema1.mytbl2_log;
 count 
-------
     0
(1 row)

select count(*) from emaj_myschema1.mytbl2b_log;
 count 
-------
     0
(1 row)

select count(*) from emaj_myschema1."myTbl3_log";
 count 
-------
     0
(1 row)

select count(*) from emaj_myschema1.mytbl4_log;
 count 
-------
     0
(1 row)

-----------------------------
-- log phase #2 with 2 logged rollbacks
-----------------------------
-- Populate application tables
set search_path=public,myschema1;
-- inserts/updates/deletes in myTbl1, myTbl2 and myTbl2b (via trigger)
insert into myTbl1 select i, 'ABC', E'\\014'::bytea from generate_series (1,11) as i;
begin transaction;
  update myTbl1 set col13=E'\\034'::bytea where col11 <= 3;
  insert into myTbl2 values (1,'ABC',current_date);
commit;
delete from myTbl1 where col11 > 10;
insert into myTbl2 values (2,'DEF',NULL);
select count(*) from mytbl1;
 count 
-------
    10
(1 row)

select count(*) from mytbl2;
 count 
-------
     2
(1 row)

select count(*) from mytbl2b;
 count 
-------
     2
(1 row)

-- set a mark
select emaj.emaj_set_mark_group('myGroup1','Mark12');
 emaj_set_mark_group 
---------------------
                   7
(1 row)

-- inserts/updates/deletes in myTbl3 and myTbl4
insert into "myTbl3" (col33) select generate_series(1000,1039,4)/100;
insert into myTbl4 values (1,'FK...',1,1,'ABC');
select count(*) from "myTbl3";
 count 
-------
    10
(1 row)

select count(*) from myTbl4;
 count 
-------
     1
(1 row)

-- set a mark
select emaj.emaj_set_mark_group('myGroup1','Mark13');
 emaj_set_mark_group 
---------------------
                   7
(1 row)

select mark_group, regexp_replace(mark_name,E'\\d\\d\.\\d\\d\\.\\d\\d\\.\\d\\d\\d\\d','%','g'),mark_time_id, mark_is_deleted, mark_is_rlbk_protected, mark_comment, mark_log_rows_before_next, mark_logged_rlbk_target_mark from emaj.emaj_mark order by mark_time_id, mark_group;
    mark_group    | regexp_replace | mark_time_id | mark_is_deleted | mark_is_rlbk_protected |              mark_comment              | mark_log_rows_before_next | mark_logged_rlbk_target_mark 
------------------+----------------+--------------+-----------------+------------------------+----------------------------------------+---------------------------+------------------------------
 emptyGroup       | SM2            |         3006 | f               | f                      | a comment on a mark for an empty group |                         0 | Mark1
 emptyGroup       | EGM3           |         3400 | f               | f                      |                                        |                         0 | 
 emptyGroup       | EGM4           |         3401 | f               | f                      |                                        |                         0 | 
 phil's group#3", | Mark4          |         3402 | f               | f                      |                                        |                         0 | 
 myGroup2         | Mark21         |         4028 | f               | f                      |                                        |                         0 | 
 myGroup1         | Mark11         |         4034 | f               | f                      |                                        |                        19 | 
 myGroup1         | Mark12         |         4035 | f               | f                      |                                        |                        11 | 
 myGroup1         | Mark13         |         4036 | f               | f                      |                                        |                           | 
(8 rows)

select sequ_schema, sequ_name, sequ_time_id, sequ_last_val, sequ_is_called from emaj.emaj_sequence order by sequ_time_id, sequ_schema, sequ_name;
  sequ_schema   |     sequ_name     | sequ_time_id | sequ_last_val | sequ_is_called 
----------------+-------------------+--------------+---------------+----------------
 phil's schema3 | myTbl2\_col21_seq |         3402 |             1 | f
 phil's schema3 | phil's seq\1      |         3402 |          1000 | f
 myschema2      | myTbl3_col31_seq  |         4028 |             1 | f
 myschema2      | myseq1            |         4028 |          1000 | f
 myschema1      | myTbl3_col31_seq  |         4034 |             1 | f
 myschema1      | mytbl2b_col20_seq |         4034 |             1 | f
 myschema1      | myTbl3_col31_seq  |         4035 |             1 | f
 myschema1      | mytbl2b_col20_seq |         4035 |             2 | t
 myschema1      | myTbl3_col31_seq  |         4036 |            10 | t
 myschema1      | mytbl2b_col20_seq |         4036 |             2 | t
(10 rows)

select tbl_schema, tbl_name, tbl_time_id, tbl_log_seq_last_val from emaj.emaj_table order by tbl_time_id, tbl_schema, tbl_name;
   tbl_schema   |  tbl_name   | tbl_time_id | tbl_log_seq_last_val 
----------------+-------------+-------------+----------------------
 phil's schema3 | myTbl2\     |        3402 |                    0
 phil's schema3 | phil's tbl1 |        3402 |                    0
 myschema2      | myTbl3      |        4028 |                    0
 myschema2      | mytbl1      |        4028 |                    0
 myschema2      | mytbl2      |        4028 |                    0
 myschema2      | mytbl4      |        4028 |                    0
 myschema2      | mytbl5      |        4028 |                    0
 myschema2      | mytbl6      |        4028 |                    0
 myschema2      | mytbl7      |        4028 |                    0
 myschema2      | mytbl8      |        4028 |                    0
 myschema1      | myTbl3      |        4034 |                   10
 myschema1      | mytbl1      |        4034 |                   15
 myschema1      | mytbl2      |        4034 |                    6
 myschema1      | mytbl2b     |        4034 |                    6
 myschema1      | mytbl4      |        4034 |                    2
 myschema1      | myTbl3      |        4035 |                   10
 myschema1      | mytbl1      |        4035 |                   30
 myschema1      | mytbl2      |        4035 |                    8
 myschema1      | mytbl2b     |        4035 |                    8
 myschema1      | mytbl4      |        4035 |                    2
 myschema1      | myTbl3      |        4036 |                   20
 myschema1      | mytbl1      |        4036 |                   30
 myschema1      | mytbl2      |        4036 |                    8
 myschema1      | mytbl2b     |        4036 |                    8
 myschema1      | mytbl4      |        4036 |                    3
(25 rows)

select col11, col12, col13, emaj_verb, emaj_tuple, emaj_gid from emaj_myschema1.mytbl1_log order by emaj_gid, emaj_tuple desc;
 col11 |   col12    | col13 | emaj_verb | emaj_tuple | emaj_gid 
-------+------------+-------+-----------+------------+----------
     1 | ABC        | \x0c  | INS       | NEW        |  4000040
     2 | ABC        | \x0c  | INS       | NEW        |  4000041
     3 | ABC        | \x0c  | INS       | NEW        |  4000042
     4 | ABC        | \x0c  | INS       | NEW        |  4000043
     5 | ABC        | \x0c  | INS       | NEW        |  4000044
     6 | ABC        | \x0c  | INS       | NEW        |  4000045
     7 | ABC        | \x0c  | INS       | NEW        |  4000046
     8 | ABC        | \x0c  | INS       | NEW        |  4000047
     9 | ABC        | \x0c  | INS       | NEW        |  4000048
    10 | ABC        | \x0c  | INS       | NEW        |  4000049
    11 | ABC        | \x0c  | INS       | NEW        |  4000050
     1 | ABC        | \x0c  | UPD       | OLD        |  4000051
     1 | ABC        | \x1c  | UPD       | NEW        |  4000051
     2 | ABC        | \x0c  | UPD       | OLD        |  4000052
     2 | ABC        | \x1c  | UPD       | NEW        |  4000052
     3 | ABC        | \x0c  | UPD       | OLD        |  4000053
     3 | ABC        | \x1c  | UPD       | NEW        |  4000053
    11 | ABC        | \x0c  | DEL       | OLD        |  4000056
(18 rows)

select col21, col22, emaj_verb, emaj_tuple, emaj_gid from emaj_myschema1.mytbl2_log order by emaj_gid, emaj_tuple desc;
 col21 | col22 | emaj_verb | emaj_tuple | emaj_gid 
-------+-------+-----------+------------+----------
     1 | ABC   | INS       | NEW        |  4000054
     2 | DEF   | INS       | NEW        |  4000057
(2 rows)

select col20, col21, col22, col23, emaj_verb, emaj_tuple, emaj_gid from emaj_myschema1.mytbl2b_log order by emaj_gid, emaj_tuple desc;
 col20 | col21 | col22 | col23 | emaj_verb | emaj_tuple | emaj_gid 
-------+-------+-------+-------+-----------+------------+----------
     1 |     1 |       | t     | INS       | NEW        |  4000055
     2 |     2 |       | t     | INS       | NEW        |  4000058
(2 rows)

select col31, col33, emaj_verb, emaj_tuple, emaj_gid from emaj_myschema1."myTbl3_log" order by emaj_gid, emaj_tuple desc;
 col31 | col33 | emaj_verb | emaj_tuple | emaj_gid 
-------+-------+-----------+------------+----------
     1 | 10.00 | INS       | NEW        |  4000059
     2 | 10.00 | INS       | NEW        |  4000060
     3 | 10.00 | INS       | NEW        |  4000061
     4 | 10.00 | INS       | NEW        |  4000062
     5 | 10.00 | INS       | NEW        |  4000063
     6 | 10.00 | INS       | NEW        |  4000064
     7 | 10.00 | INS       | NEW        |  4000065
     8 | 10.00 | INS       | NEW        |  4000066
     9 | 10.00 | INS       | NEW        |  4000067
    10 | 10.00 | INS       | NEW        |  4000068
(10 rows)

select col41, col42, col43, col44, col45, emaj_verb, emaj_tuple, emaj_gid from emaj_myschema1.myTbl4_log order by emaj_gid, emaj_tuple desc;
 col41 | col42 | col43 | col44 |   col45    | emaj_verb | emaj_tuple | emaj_gid 
-------+-------+-------+-------+------------+-----------+------------+----------
     1 | FK... |     1 |     1 | ABC        | INS       | NEW        |  4000069
(1 row)

-- logged rollback #1
select * from emaj.emaj_logged_rollback_group('myGroup1','Mark12');
 rlbk_severity |            rlbk_message             
---------------+-------------------------------------
 Notice        | 2 / 5 tables effectively processed.
 Notice        | 2 sequences processed.
(2 rows)

-- check impact
select mark_group, regexp_replace(mark_name,E'\\d\\d\.\\d\\d\\.\\d\\d\\.\\d\\d\\d\\d','%','g'), mark_time_id, mark_is_deleted, mark_is_rlbk_protected, mark_comment, mark_log_rows_before_next, mark_logged_rlbk_target_mark from emaj.emaj_mark order by mark_time_id, mark_group;
    mark_group    |   regexp_replace    | mark_time_id | mark_is_deleted | mark_is_rlbk_protected |              mark_comment              | mark_log_rows_before_next | mark_logged_rlbk_target_mark 
------------------+---------------------+--------------+-----------------+------------------------+----------------------------------------+---------------------------+------------------------------
 emptyGroup       | SM2                 |         3006 | f               | f                      | a comment on a mark for an empty group |                         0 | Mark1
 emptyGroup       | EGM3                |         3400 | f               | f                      |                                        |                         0 | 
 emptyGroup       | EGM4                |         3401 | f               | f                      |                                        |                         0 | 
 phil's group#3", | Mark4               |         3402 | f               | f                      |                                        |                         0 | 
 myGroup2         | Mark21              |         4028 | f               | f                      |                                        |                         0 | 
 myGroup1         | Mark11              |         4034 | f               | f                      |                                        |                        19 | 
 myGroup1         | Mark12              |         4035 | f               | f                      |                                        |                        11 | 
 myGroup1         | Mark13              |         4036 | f               | f                      |                                        |                         0 | 
 myGroup1         | RLBK_Mark12_%_START |         4037 | f               | f                      |                                        |                        11 | 
 myGroup1         | RLBK_Mark12_%_DONE  |         4038 | f               | f                      |                                        |                           | Mark12
(10 rows)

select sequ_schema, sequ_name, sequ_time_id, sequ_last_val, sequ_is_called from emaj.emaj_sequence order by sequ_time_id, sequ_schema, sequ_name;
  sequ_schema   |     sequ_name     | sequ_time_id | sequ_last_val | sequ_is_called 
----------------+-------------------+--------------+---------------+----------------
 phil's schema3 | myTbl2\_col21_seq |         3402 |             1 | f
 phil's schema3 | phil's seq\1      |         3402 |          1000 | f
 myschema2      | myTbl3_col31_seq  |         4028 |             1 | f
 myschema2      | myseq1            |         4028 |          1000 | f
 myschema1      | myTbl3_col31_seq  |         4034 |             1 | f
 myschema1      | mytbl2b_col20_seq |         4034 |             1 | f
 myschema1      | myTbl3_col31_seq  |         4035 |             1 | f
 myschema1      | mytbl2b_col20_seq |         4035 |             2 | t
 myschema1      | myTbl3_col31_seq  |         4036 |            10 | t
 myschema1      | mytbl2b_col20_seq |         4036 |             2 | t
 myschema1      | myTbl3_col31_seq  |         4037 |            10 | t
 myschema1      | mytbl2b_col20_seq |         4037 |             2 | t
 myschema1      | myTbl3_col31_seq  |         4038 |             1 | f
 myschema1      | mytbl2b_col20_seq |         4038 |             2 | t
(14 rows)

select tbl_schema, tbl_name, tbl_time_id, tbl_log_seq_last_val from emaj.emaj_table order by tbl_time_id, tbl_schema, tbl_name;
   tbl_schema   |  tbl_name   | tbl_time_id | tbl_log_seq_last_val 
----------------+-------------+-------------+----------------------
 phil's schema3 | myTbl2\     |        3402 |                    0
 phil's schema3 | phil's tbl1 |        3402 |                    0
 myschema2      | myTbl3      |        4028 |                    0
 myschema2      | mytbl1      |        4028 |                    0
 myschema2      | mytbl2      |        4028 |                    0
 myschema2      | mytbl4      |        4028 |                    0
 myschema2      | mytbl5      |        4028 |                    0
 myschema2      | mytbl6      |        4028 |                    0
 myschema2      | mytbl7      |        4028 |                    0
 myschema2      | mytbl8      |        4028 |                    0
 myschema1      | myTbl3      |        4034 |                   10
 myschema1      | mytbl1      |        4034 |                   15
 myschema1      | mytbl2      |        4034 |                    6
 myschema1      | mytbl2b     |        4034 |                    6
 myschema1      | mytbl4      |        4034 |                    2
 myschema1      | myTbl3      |        4035 |                   10
 myschema1      | mytbl1      |        4035 |                   30
 myschema1      | mytbl2      |        4035 |                    8
 myschema1      | mytbl2b     |        4035 |                    8
 myschema1      | mytbl4      |        4035 |                    2
 myschema1      | myTbl3      |        4036 |                   20
 myschema1      | mytbl1      |        4036 |                   30
 myschema1      | mytbl2      |        4036 |                    8
 myschema1      | mytbl2b     |        4036 |                    8
 myschema1      | mytbl4      |        4036 |                    3
 myschema1      | myTbl3      |        4037 |                   20
 myschema1      | mytbl1      |        4037 |                   30
 myschema1      | mytbl2      |        4037 |                    8
 myschema1      | mytbl2b     |        4037 |                    8
 myschema1      | mytbl4      |        4037 |                    3
 myschema1      | myTbl3      |        4038 |                   30
 myschema1      | mytbl1      |        4038 |                   30
 myschema1      | mytbl2      |        4038 |                    8
 myschema1      | mytbl2b     |        4038 |                    8
 myschema1      | mytbl4      |        4038 |                    4
(35 rows)

select sqhl_schema, sqhl_table, sqhl_begin_time_id, sqhl_end_time_id, sqhl_hole_size from emaj.emaj_seq_hole order by 1,2,3;
 sqhl_schema | sqhl_table | sqhl_begin_time_id | sqhl_end_time_id | sqhl_hole_size 
-------------+------------+--------------------+------------------+----------------
(0 rows)

select col31, col33, emaj_verb, emaj_tuple, emaj_gid from emaj_myschema1."myTbl3_log" order by emaj_gid, emaj_tuple desc;
 col31 | col33 | emaj_verb | emaj_tuple | emaj_gid 
-------+-------+-----------+------------+----------
     1 | 10.00 | INS       | NEW        |  4000059
     2 | 10.00 | INS       | NEW        |  4000060
     3 | 10.00 | INS       | NEW        |  4000061
     4 | 10.00 | INS       | NEW        |  4000062
     5 | 10.00 | INS       | NEW        |  4000063
     6 | 10.00 | INS       | NEW        |  4000064
     7 | 10.00 | INS       | NEW        |  4000065
     8 | 10.00 | INS       | NEW        |  4000066
     9 | 10.00 | INS       | NEW        |  4000067
    10 | 10.00 | INS       | NEW        |  4000068
     6 | 10.00 | DEL       | OLD        |  4000070
     4 | 10.00 | DEL       | OLD        |  4000071
     5 | 10.00 | DEL       | OLD        |  4000072
     8 | 10.00 | DEL       | OLD        |  4000073
     1 | 10.00 | DEL       | OLD        |  4000074
     2 | 10.00 | DEL       | OLD        |  4000075
     9 | 10.00 | DEL       | OLD        |  4000076
     3 | 10.00 | DEL       | OLD        |  4000077
     7 | 10.00 | DEL       | OLD        |  4000078
    10 | 10.00 | DEL       | OLD        |  4000079
(20 rows)

select col41, col42, col43, col44, col45, emaj_verb, emaj_tuple, emaj_gid from emaj_myschema1.myTbl4_log order by emaj_gid, emaj_tuple desc;
 col41 | col42 | col43 | col44 |   col45    | emaj_verb | emaj_tuple | emaj_gid 
-------+-------+-------+-------+------------+-----------+------------+----------
     1 | FK... |     1 |     1 | ABC        | INS       | NEW        |  4000069
     1 | FK... |     1 |     1 | ABC        | DEL       | OLD        |  4000080
(2 rows)

select col31, col33 from myschema1."myTbl3" order by col31;
 col31 | col33 
-------+-------
(0 rows)

select col41, col42, col43, col44, col45 from myschema1.myTbl4 order by col41;
 col41 | col42 | col43 | col44 | col45 
-------+-------+-------+-------+-------
(0 rows)

-- logged rollback #2
select * from emaj.emaj_logged_rollback_group('myGroup1','Mark11');
 rlbk_severity |            rlbk_message             
---------------+-------------------------------------
 Notice        | 5 / 5 tables effectively processed.
 Notice        | 2 sequences processed.
(2 rows)

-- check impact
select mark_group, regexp_replace(mark_name,E'\\d\\d\.\\d\\d\\.\\d\\d\\.\\d\\d\\d\\d','%','g'), mark_time_id, mark_is_deleted, mark_is_rlbk_protected, mark_comment, mark_log_rows_before_next, mark_logged_rlbk_target_mark from emaj.emaj_mark order by mark_time_id, mark_group;
    mark_group    |   regexp_replace    | mark_time_id | mark_is_deleted | mark_is_rlbk_protected |              mark_comment              | mark_log_rows_before_next | mark_logged_rlbk_target_mark 
------------------+---------------------+--------------+-----------------+------------------------+----------------------------------------+---------------------------+------------------------------
 emptyGroup       | SM2                 |         3006 | f               | f                      | a comment on a mark for an empty group |                         0 | Mark1
 emptyGroup       | EGM3                |         3400 | f               | f                      |                                        |                         0 | 
 emptyGroup       | EGM4                |         3401 | f               | f                      |                                        |                         0 | 
 phil's group#3", | Mark4               |         3402 | f               | f                      |                                        |                         0 | 
 myGroup2         | Mark21              |         4028 | f               | f                      |                                        |                         0 | 
 myGroup1         | Mark11              |         4034 | f               | f                      |                                        |                        19 | 
 myGroup1         | Mark12              |         4035 | f               | f                      |                                        |                        11 | 
 myGroup1         | Mark13              |         4036 | f               | f                      |                                        |                         0 | 
 myGroup1         | RLBK_Mark12_%_START |         4037 | f               | f                      |                                        |                        11 | 
 myGroup1         | RLBK_Mark12_%_DONE  |         4038 | f               | f                      |                                        |                         0 | Mark12
 myGroup1         | RLBK_Mark11_%_START |         4039 | f               | f                      |                                        |                        14 | 
 myGroup1         | RLBK_Mark11_%_DONE  |         4040 | f               | f                      |                                        |                           | Mark11
(12 rows)

select sequ_schema, sequ_name, sequ_time_id, sequ_last_val, sequ_is_called from emaj.emaj_sequence order by sequ_time_id, sequ_schema, sequ_name;
  sequ_schema   |     sequ_name     | sequ_time_id | sequ_last_val | sequ_is_called 
----------------+-------------------+--------------+---------------+----------------
 phil's schema3 | myTbl2\_col21_seq |         3402 |             1 | f
 phil's schema3 | phil's seq\1      |         3402 |          1000 | f
 myschema2      | myTbl3_col31_seq  |         4028 |             1 | f
 myschema2      | myseq1            |         4028 |          1000 | f
 myschema1      | myTbl3_col31_seq  |         4034 |             1 | f
 myschema1      | mytbl2b_col20_seq |         4034 |             1 | f
 myschema1      | myTbl3_col31_seq  |         4035 |             1 | f
 myschema1      | mytbl2b_col20_seq |         4035 |             2 | t
 myschema1      | myTbl3_col31_seq  |         4036 |            10 | t
 myschema1      | mytbl2b_col20_seq |         4036 |             2 | t
 myschema1      | myTbl3_col31_seq  |         4037 |            10 | t
 myschema1      | mytbl2b_col20_seq |         4037 |             2 | t
 myschema1      | myTbl3_col31_seq  |         4038 |             1 | f
 myschema1      | mytbl2b_col20_seq |         4038 |             2 | t
 myschema1      | myTbl3_col31_seq  |         4039 |             1 | f
 myschema1      | mytbl2b_col20_seq |         4039 |             2 | t
 myschema1      | myTbl3_col31_seq  |         4040 |             1 | f
 myschema1      | mytbl2b_col20_seq |         4040 |             1 | f
(18 rows)

select tbl_schema, tbl_name, tbl_time_id, tbl_log_seq_last_val from emaj.emaj_table order by tbl_time_id, tbl_schema, tbl_name;
   tbl_schema   |  tbl_name   | tbl_time_id | tbl_log_seq_last_val 
----------------+-------------+-------------+----------------------
 phil's schema3 | myTbl2\     |        3402 |                    0
 phil's schema3 | phil's tbl1 |        3402 |                    0
 myschema2      | myTbl3      |        4028 |                    0
 myschema2      | mytbl1      |        4028 |                    0
 myschema2      | mytbl2      |        4028 |                    0
 myschema2      | mytbl4      |        4028 |                    0
 myschema2      | mytbl5      |        4028 |                    0
 myschema2      | mytbl6      |        4028 |                    0
 myschema2      | mytbl7      |        4028 |                    0
 myschema2      | mytbl8      |        4028 |                    0
 myschema1      | myTbl3      |        4034 |                   10
 myschema1      | mytbl1      |        4034 |                   15
 myschema1      | mytbl2      |        4034 |                    6
 myschema1      | mytbl2b     |        4034 |                    6
 myschema1      | mytbl4      |        4034 |                    2
 myschema1      | myTbl3      |        4035 |                   10
 myschema1      | mytbl1      |        4035 |                   30
 myschema1      | mytbl2      |        4035 |                    8
 myschema1      | mytbl2b     |        4035 |                    8
 myschema1      | mytbl4      |        4035 |                    2
 myschema1      | myTbl3      |        4036 |                   20
 myschema1      | mytbl1      |        4036 |                   30
 myschema1      | mytbl2      |        4036 |                    8
 myschema1      | mytbl2b     |        4036 |                    8
 myschema1      | mytbl4      |        4036 |                    3
 myschema1      | myTbl3      |        4037 |                   20
 myschema1      | mytbl1      |        4037 |                   30
 myschema1      | mytbl2      |        4037 |                    8
 myschema1      | mytbl2b     |        4037 |                    8
 myschema1      | mytbl4      |        4037 |                    3
 myschema1      | myTbl3      |        4038 |                   30
 myschema1      | mytbl1      |        4038 |                   30
 myschema1      | mytbl2      |        4038 |                    8
 myschema1      | mytbl2b     |        4038 |                    8
 myschema1      | mytbl4      |        4038 |                    4
 myschema1      | myTbl3      |        4039 |                   30
 myschema1      | mytbl1      |        4039 |                   30
 myschema1      | mytbl2      |        4039 |                    8
 myschema1      | mytbl2b     |        4039 |                    8
 myschema1      | mytbl4      |        4039 |                    4
 myschema1      | myTbl3      |        4040 |                   30
 myschema1      | mytbl1      |        4040 |                   40
 myschema1      | mytbl2      |        4040 |                   10
 myschema1      | mytbl2b     |        4040 |                   10
 myschema1      | mytbl4      |        4040 |                    4
(45 rows)

select sqhl_schema, sqhl_table, sqhl_begin_time_id, sqhl_end_time_id, sqhl_hole_size from emaj.emaj_seq_hole order by 1,2,3;
 sqhl_schema | sqhl_table | sqhl_begin_time_id | sqhl_end_time_id | sqhl_hole_size 
-------------+------------+--------------------+------------------+----------------
(0 rows)

select col11, col12, col13, emaj_verb, emaj_tuple, emaj_gid from emaj_myschema1.myTbl1_log order by emaj_gid, emaj_tuple desc;
 col11 |   col12    | col13 | emaj_verb | emaj_tuple | emaj_gid 
-------+------------+-------+-----------+------------+----------
     1 | ABC        | \x0c  | INS       | NEW        |  4000040
     2 | ABC        | \x0c  | INS       | NEW        |  4000041
     3 | ABC        | \x0c  | INS       | NEW        |  4000042
     4 | ABC        | \x0c  | INS       | NEW        |  4000043
     5 | ABC        | \x0c  | INS       | NEW        |  4000044
     6 | ABC        | \x0c  | INS       | NEW        |  4000045
     7 | ABC        | \x0c  | INS       | NEW        |  4000046
     8 | ABC        | \x0c  | INS       | NEW        |  4000047
     9 | ABC        | \x0c  | INS       | NEW        |  4000048
    10 | ABC        | \x0c  | INS       | NEW        |  4000049
    11 | ABC        | \x0c  | INS       | NEW        |  4000050
     1 | ABC        | \x0c  | UPD       | OLD        |  4000051
     1 | ABC        | \x1c  | UPD       | NEW        |  4000051
     2 | ABC        | \x0c  | UPD       | OLD        |  4000052
     2 | ABC        | \x1c  | UPD       | NEW        |  4000052
     3 | ABC        | \x0c  | UPD       | OLD        |  4000053
     3 | ABC        | \x1c  | UPD       | NEW        |  4000053
    11 | ABC        | \x0c  | DEL       | OLD        |  4000056
     1 | ABC        | \x1c  | DEL       | OLD        |  4000081
     2 | ABC        | \x1c  | DEL       | OLD        |  4000082
     3 | ABC        | \x1c  | DEL       | OLD        |  4000083
     4 | ABC        | \x0c  | DEL       | OLD        |  4000084
     5 | ABC        | \x0c  | DEL       | OLD        |  4000085
     6 | ABC        | \x0c  | DEL       | OLD        |  4000086
     7 | ABC        | \x0c  | DEL       | OLD        |  4000087
     8 | ABC        | \x0c  | DEL       | OLD        |  4000088
     9 | ABC        | \x0c  | DEL       | OLD        |  4000089
    10 | ABC        | \x0c  | DEL       | OLD        |  4000090
(28 rows)

select col21, col22, emaj_verb, emaj_tuple, emaj_gid from emaj_myschema1.myTbl2_log order by emaj_gid, emaj_tuple desc;
 col21 | col22 | emaj_verb | emaj_tuple | emaj_gid 
-------+-------+-----------+------------+----------
     1 | ABC   | INS       | NEW        |  4000054
     2 | DEF   | INS       | NEW        |  4000057
     1 | ABC   | DEL       | OLD        |  4000091
     2 | DEF   | DEL       | OLD        |  4000092
(4 rows)

select col20, col21, col22, col23, emaj_verb, emaj_tuple, emaj_gid from emaj_myschema1.myTbl2b_log order by emaj_gid, emaj_tuple desc;
 col20 | col21 | col22 | col23 | emaj_verb | emaj_tuple | emaj_gid 
-------+-------+-------+-------+-----------+------------+----------
     1 |     1 |       | t     | INS       | NEW        |  4000055
     2 |     2 |       | t     | INS       | NEW        |  4000058
     1 |     1 |       | t     | DEL       | OLD        |  4000093
     2 |     2 |       | t     | DEL       | OLD        |  4000094
(4 rows)

select col11, col12, col13 from myschema1.myTbl1 order by col11, col12;
 col11 | col12 | col13 
-------+-------+-------
(0 rows)

select col21, col22 from myschema1.myTbl2 order by col21;
 col21 | col22 
-------+-------
(0 rows)

select col20, col21 from myschema1.myTbl2b order by col20;
 col20 | col21 
-------+-------
(0 rows)

-----------------------------
-- unlogged rollback of logged rollbacks #3
-----------------------------
alter table mySchema1.myTbl2 disable trigger myTbl2trg1;
select * from emaj.emaj_rollback_group('myGroup1','Mark13');
 rlbk_severity |            rlbk_message             
---------------+-------------------------------------
 Notice        | 5 / 5 tables effectively processed.
 Notice        | 2 sequences processed.
(2 rows)

alter table mySchema1.myTbl2 enable trigger myTbl2trg1;
-- check impact
select mark_group, regexp_replace(mark_name,E'\\d\\d\.\\d\\d\\.\\d\\d\\.\\d\\d\\d\\d','%','g'), mark_time_id, mark_is_deleted, mark_is_rlbk_protected, mark_comment, mark_log_rows_before_next, mark_logged_rlbk_target_mark from emaj.emaj_mark order by mark_time_id, mark_group;
    mark_group    | regexp_replace | mark_time_id | mark_is_deleted | mark_is_rlbk_protected |              mark_comment              | mark_log_rows_before_next | mark_logged_rlbk_target_mark 
------------------+----------------+--------------+-----------------+------------------------+----------------------------------------+---------------------------+------------------------------
 emptyGroup       | SM2            |         3006 | f               | f                      | a comment on a mark for an empty group |                         0 | Mark1
 emptyGroup       | EGM3           |         3400 | f               | f                      |                                        |                         0 | 
 emptyGroup       | EGM4           |         3401 | f               | f                      |                                        |                         0 | 
 phil's group#3", | Mark4          |         3402 | f               | f                      |                                        |                         0 | 
 myGroup2         | Mark21         |         4028 | f               | f                      |                                        |                         0 | 
 myGroup1         | Mark11         |         4034 | f               | f                      |                                        |                        19 | 
 myGroup1         | Mark12         |         4035 | f               | f                      |                                        |                        11 | 
 myGroup1         | Mark13         |         4036 | f               | f                      |                                        |                           | 
(8 rows)

select sequ_schema, sequ_name, sequ_time_id, sequ_last_val, sequ_is_called from emaj.emaj_sequence order by sequ_time_id, sequ_schema, sequ_name;
  sequ_schema   |     sequ_name     | sequ_time_id | sequ_last_val | sequ_is_called 
----------------+-------------------+--------------+---------------+----------------
 phil's schema3 | myTbl2\_col21_seq |         3402 |             1 | f
 phil's schema3 | phil's seq\1      |         3402 |          1000 | f
 myschema2      | myTbl3_col31_seq  |         4028 |             1 | f
 myschema2      | myseq1            |         4028 |          1000 | f
 myschema1      | myTbl3_col31_seq  |         4034 |             1 | f
 myschema1      | mytbl2b_col20_seq |         4034 |             1 | f
 myschema1      | myTbl3_col31_seq  |         4035 |             1 | f
 myschema1      | mytbl2b_col20_seq |         4035 |             2 | t
 myschema1      | myTbl3_col31_seq  |         4036 |            10 | t
 myschema1      | mytbl2b_col20_seq |         4036 |             2 | t
(10 rows)

select tbl_schema, tbl_name, tbl_time_id, tbl_log_seq_last_val from emaj.emaj_table order by tbl_time_id, tbl_schema, tbl_name;
   tbl_schema   |  tbl_name   | tbl_time_id | tbl_log_seq_last_val 
----------------+-------------+-------------+----------------------
 phil's schema3 | myTbl2\     |        3402 |                    0
 phil's schema3 | phil's tbl1 |        3402 |                    0
 myschema2      | myTbl3      |        4028 |                    0
 myschema2      | mytbl1      |        4028 |                    0
 myschema2      | mytbl2      |        4028 |                    0
 myschema2      | mytbl4      |        4028 |                    0
 myschema2      | mytbl5      |        4028 |                    0
 myschema2      | mytbl6      |        4028 |                    0
 myschema2      | mytbl7      |        4028 |                    0
 myschema2      | mytbl8      |        4028 |                    0
 myschema1      | myTbl3      |        4034 |                   10
 myschema1      | mytbl1      |        4034 |                   15
 myschema1      | mytbl2      |        4034 |                    6
 myschema1      | mytbl2b     |        4034 |                    6
 myschema1      | mytbl4      |        4034 |                    2
 myschema1      | myTbl3      |        4035 |                   10
 myschema1      | mytbl1      |        4035 |                   30
 myschema1      | mytbl2      |        4035 |                    8
 myschema1      | mytbl2b     |        4035 |                    8
 myschema1      | mytbl4      |        4035 |                    2
 myschema1      | myTbl3      |        4036 |                   20
 myschema1      | mytbl1      |        4036 |                   30
 myschema1      | mytbl2      |        4036 |                    8
 myschema1      | mytbl2b     |        4036 |                    8
 myschema1      | mytbl4      |        4036 |                    3
(25 rows)

select sqhl_schema, sqhl_table, sqhl_begin_time_id, sqhl_end_time_id, sqhl_hole_size from emaj.emaj_seq_hole order by 1,2,3;
 sqhl_schema | sqhl_table | sqhl_begin_time_id | sqhl_end_time_id | sqhl_hole_size 
-------------+------------+--------------------+------------------+----------------
 myschema1   | myTbl3     |               4036 |             4041 |             10
 myschema1   | mytbl1     |               4036 |             4041 |             10
 myschema1   | mytbl2     |               4036 |             4041 |              2
 myschema1   | mytbl2b    |               4036 |             4041 |              2
 myschema1   | mytbl4     |               4036 |             4041 |              1
(5 rows)

select col11, col12, col13, emaj_verb, emaj_tuple, emaj_gid from emaj_myschema1.myTbl1_log order by emaj_gid, emaj_tuple desc;
 col11 |   col12    | col13 | emaj_verb | emaj_tuple | emaj_gid 
-------+------------+-------+-----------+------------+----------
     1 | ABC        | \x0c  | INS       | NEW        |  4000040
     2 | ABC        | \x0c  | INS       | NEW        |  4000041
     3 | ABC        | \x0c  | INS       | NEW        |  4000042
     4 | ABC        | \x0c  | INS       | NEW        |  4000043
     5 | ABC        | \x0c  | INS       | NEW        |  4000044
     6 | ABC        | \x0c  | INS       | NEW        |  4000045
     7 | ABC        | \x0c  | INS       | NEW        |  4000046
     8 | ABC        | \x0c  | INS       | NEW        |  4000047
     9 | ABC        | \x0c  | INS       | NEW        |  4000048
    10 | ABC        | \x0c  | INS       | NEW        |  4000049
    11 | ABC        | \x0c  | INS       | NEW        |  4000050
     1 | ABC        | \x0c  | UPD       | OLD        |  4000051
     1 | ABC        | \x1c  | UPD       | NEW        |  4000051
     2 | ABC        | \x0c  | UPD       | OLD        |  4000052
     2 | ABC        | \x1c  | UPD       | NEW        |  4000052
     3 | ABC        | \x0c  | UPD       | OLD        |  4000053
     3 | ABC        | \x1c  | UPD       | NEW        |  4000053
    11 | ABC        | \x0c  | DEL       | OLD        |  4000056
(18 rows)

select col21, col22, emaj_verb, emaj_tuple, emaj_gid from emaj_myschema1.myTbl2_log order by emaj_gid, emaj_tuple desc;
 col21 | col22 | emaj_verb | emaj_tuple | emaj_gid 
-------+-------+-----------+------------+----------
     1 | ABC   | INS       | NEW        |  4000054
     2 | DEF   | INS       | NEW        |  4000057
(2 rows)

select col20, col21, col22, col23, emaj_verb, emaj_tuple, emaj_gid from emaj_myschema1.myTbl2b_log order by emaj_gid, emaj_tuple desc;
 col20 | col21 | col22 | col23 | emaj_verb | emaj_tuple | emaj_gid 
-------+-------+-------+-------+-----------+------------+----------
     1 |     1 |       | t     | INS       | NEW        |  4000055
     2 |     2 |       | t     | INS       | NEW        |  4000058
(2 rows)

select col11, col12, col13 from myschema1.myTbl1 order by col11, col12;
 col11 |   col12    | col13 
-------+------------+-------
     1 | ABC        | \x1c
     2 | ABC        | \x1c
     3 | ABC        | \x1c
     4 | ABC        | \x0c
     5 | ABC        | \x0c
     6 | ABC        | \x0c
     7 | ABC        | \x0c
     8 | ABC        | \x0c
     9 | ABC        | \x0c
    10 | ABC        | \x0c
(10 rows)

select col21, col22 from myschema1.myTbl2 order by col21;
 col21 | col22 
-------+-------
     1 | ABC
     2 | DEF
(2 rows)

select col20, col21 from myschema1.myTbl2b order by col20;
 col20 | col21 
-------+-------
     1 |     1
     2 |     2
(2 rows)

-----------------------------
-- rollback an empty group
-----------------------------
select * from emaj.emaj_rollback_group('emptyGroup','EGM4');
 rlbk_severity |            rlbk_message             
---------------+-------------------------------------
 Notice        | 0 / 0 tables effectively processed.
(1 row)

select * from emaj.emaj_logged_rollback_group('emptyGroup','EGM3');
 rlbk_severity |            rlbk_message             
---------------+-------------------------------------
 Notice        | 0 / 0 tables effectively processed.
(1 row)

-----------------------------
-- test use of partitionned tables
-----------------------------
select emaj.emaj_start_group('myGroup4','myGroup4_start');
 emaj_start_group 
------------------
                5
(1 row)

insert into myschema4.myTblM values ('2001-09-11',0,'abc'),('2011-09-11',10,'def'),('2021-09-11',20,'ghi');
insert into myschema4.myTblP values (-1,'abc'),(0,'def'),(1,'ghi');
select emaj.emaj_set_mark_group('myGroup4','mark1');
 emaj_set_mark_group 
---------------------
                   5
(1 row)

truncate myschema4.myTblM;
update myschema4.myTblP set col2 = 'DEF' where col1 = 0;
select * from emaj.emaj_logged_rollback_group('myGroup4','mark1');
 rlbk_severity |            rlbk_message             
---------------+-------------------------------------
 Notice        | 3 / 5 tables effectively processed.
(1 row)

select col1, col2, col3, emaj_verb, emaj_tuple, emaj_gid from emaj_myschema4.mytblm_log;
    col1    | col2 | col3 | emaj_verb | emaj_tuple | emaj_gid 
------------+------+------+-----------+------------+----------
 09-11-2021 |   20 | ghi  | INS       | NEW        |  4000097
            |      |      | TRU       |            |  4000098
 09-11-2021 |   20 | ghi  | TRU       | OLD        |  4000099
 09-11-2021 |   20 | ghi  | INS       | NEW        |  4000106
(4 rows)

select col1, col2, col3, emaj_verb, emaj_tuple, emaj_gid from emaj_myschema4.mytblc1_log;
    col1    | col2 | col3 | emaj_verb | emaj_tuple | emaj_gid 
------------+------+------+-----------+------------+----------
 09-11-2001 |    0 | abc  | INS       | NEW        |  4000095
            |      |      | TRU       |            |  4000100
 09-11-2001 |    0 | abc  | TRU       | OLD        |  4000101
 09-11-2001 |    0 | abc  | INS       | NEW        |  4000104
(4 rows)

select col1, col2, col3, emaj_verb, emaj_tuple, emaj_gid from emaj_myschema4.mytblc2_log;
    col1    | col2 | col3 | emaj_verb | emaj_tuple | emaj_gid 
------------+------+------+-----------+------------+----------
 09-11-2011 |   10 | def  | INS       | NEW        |  4000096
            |      |      | TRU       |            |  4000102
 09-11-2011 |   10 | def  | TRU       | OLD        |  4000103
 09-11-2011 |   10 | def  | INS       | NEW        |  4000105
(4 rows)

select col1, col2, emaj_verb, emaj_tuple, emaj_gid from emaj_myschema4.mypartp1_log;          -- empty in pg 9.6-
 col1 | col2 | emaj_verb | emaj_tuple | emaj_gid 
------+------+-----------+------------+----------
(0 rows)

select col1, col2, emaj_verb, emaj_tuple, emaj_gid from emaj_myschema4.mypartp2_log;          -- empty in pg 9.6-
 col1 | col2 | emaj_verb | emaj_tuple | emaj_gid 
------+------+-----------+------------+----------
(0 rows)

-- use the functions dedicated to emaj_web
-- for an equivalent of "select * from emaj.emaj_rollback_group('myGroup4','myGroup4_start',true);"
select * from emaj._rlbk_async(emaj._rlbk_init(array['myGroup4'], 'myGroup4_start', false, 1, false, true), false);
 rlbk_severity |            rlbk_message             
---------------+-------------------------------------
 Notice        | 3 / 5 tables effectively processed.
(1 row)

-- and check the result
select rlbk_id, rlbk_groups, rlbk_mark, rlbk_mark_time_id, rlbk_time_id, rlbk_is_logged, rlbk_is_alter_group_allowed, 
       rlbk_nb_session, rlbk_nb_table, rlbk_nb_sequence, rlbk_eff_nb_table, rlbk_status, rlbk_begin_hist_id,
       rlbk_dblink_schema, rlbk_is_dblink_used, rlbk_messages
 from emaj.emaj_rlbk order by rlbk_id desc limit 1;
 rlbk_id | rlbk_groups |   rlbk_mark    | rlbk_mark_time_id | rlbk_time_id | rlbk_is_logged | rlbk_is_alter_group_allowed | rlbk_nb_session | rlbk_nb_table | rlbk_nb_sequence | rlbk_eff_nb_table | rlbk_status | rlbk_begin_hist_id | rlbk_dblink_schema | rlbk_is_dblink_used |                  rlbk_messages                  
---------+-------------+----------------+-------------------+--------------+----------------+-----------------------------+-----------------+---------------+------------------+-------------------+-------------+--------------------+--------------------+---------------------+-------------------------------------------------
    4017 | {myGroup4}  | myGroup4_start |              4045 |         4049 | f              | t                           |               1 |             5 |                0 |                 3 | COMPLETED   |               4375 | public             | t                   | {"Notice: 3 / 5 tables effectively processed."}
(1 row)

-----------------------------
-- test emaj_rollback_activity()
-----------------------------
-- insert necessary rows into rollback tables in order to test various cases of emaj_rollback_activity() reports.
-- these tests ares performed inside transactions that are then rolled back.
begin;
-- 1 rollback operation in EXECUTING state, but no rollback steps have started yet
  insert into emaj.emaj_time_stamp (time_id, time_tx_timestamp) values (-1, now()-'0.1 seconds'::interval);
  insert into emaj.emaj_time_stamp (time_id, time_clock_timestamp) values (-2, '2000-01-01 01:00:00');
  insert into emaj.emaj_rlbk (rlbk_id, rlbk_groups, rlbk_mark, rlbk_mark_time_id, rlbk_time_id, rlbk_is_logged, rlbk_is_alter_group_allowed, 
             rlbk_nb_session, rlbk_nb_table, rlbk_nb_sequence, rlbk_eff_nb_table, rlbk_status)
    values (1232,array['group1232'],'mark1232',-2,-1,true,false,
             1,5,4,3,'EXECUTING');
  insert into emaj.emaj_rlbk_plan (rlbp_rlbk_id, rlbp_step, rlbp_schema, rlbp_table, rlbp_object,
             rlbp_estimated_duration, rlbp_estimated_quantity, rlbp_start_datetime, rlbp_duration)
    values (1232, 'RLBK_TABLE','schema','t1','','50 seconds'::interval,null,null,null),
           (1232, 'RLBK_TABLE','schema','t2','','30 seconds'::interval,null,null,null),
           (1232, 'RLBK_TABLE','schema','t3','','20 seconds'::interval,null,null,null),
           (1232, 'CTRL+DBLINK','',     '',  '','0.3 second'::interval,3,   null,null);
  select rlbk_id, rlbk_status, rlbk_remaining, rlbk_completion_pct from emaj._rollback_activity();
 rlbk_id | rlbk_status |  rlbk_remaining   | rlbk_completion_pct 
---------+-------------+-------------------+---------------------
    1232 | EXECUTING   | @ 1 min 40.3 secs |                   0
(1 row)

-- the first RLBK_TABLE has started, but the elapse of the step is not yet > estimated duration 
  update emaj.emaj_time_stamp set time_tx_timestamp = now() - '11 seconds'::interval where time_id = -1;
  update emaj.emaj_rlbk_plan set rlbp_start_datetime = now() - '11 seconds'::interval
    where rlbp_rlbk_id = 1232 and rlbp_table = 't1';
  select rlbk_id, rlbk_status, rlbk_remaining, rlbk_completion_pct from emaj._rollback_activity();
 rlbk_id | rlbk_status |  rlbk_remaining   | rlbk_completion_pct 
---------+-------------+-------------------+---------------------
    1232 | EXECUTING   | @ 1 min 29.2 secs |                  11
(1 row)

  select 1.0 - ((20.0 + 30.0)+(50.0 - 11.0) + 2*0.3/3) / (11.1 + (20.0 + 30.0)+(50.0 - 11.0) + 2*0.3/3); -- the completion % should be 11%
        ?column?        
------------------------
 0.11066799601196410768
(1 row)

-- the first RLBK_TABLE is completed, and the step duration < the estimated duration 
  update emaj.emaj_time_stamp set time_tx_timestamp = now() - '45.1 seconds'::interval where time_id = -1;
  update emaj.emaj_rlbk_plan set rlbp_start_datetime = now() - '45 seconds'::interval,
                                 rlbp_duration = '45 seconds'::interval
    where rlbp_rlbk_id = 1232 and rlbp_table = 't1';
  select rlbk_id, rlbk_status, rlbk_remaining, rlbk_completion_pct from emaj._rollback_activity();
 rlbk_id | rlbk_status | rlbk_remaining | rlbk_completion_pct 
---------+-------------+----------------+---------------------
    1232 | EXECUTING   | @ 50.2 secs    |                  47
(1 row)

  select 1.0 - (20.0 + 30.0 + 2*0.3/3) / (45.1 + (20.0 + 30.0) + 2*0.3/3);  -- the completion % should be 47%
        ?column?        
------------------------
 0.47324239244491080797
(1 row)

-- the second RLBK_TABLE has started, but the elapse of the step is not yet > estimated duration 
  update emaj.emaj_time_stamp set time_tx_timestamp = now() - '73.1 seconds'::interval where time_id = -1;
  update emaj.emaj_rlbk_plan set rlbp_start_datetime = now() - '28 seconds'::interval
    where rlbp_rlbk_id = 1232 and rlbp_table = 't2';
  select rlbk_id, rlbk_status, rlbk_remaining, rlbk_completion_pct from emaj._rollback_activity();
 rlbk_id | rlbk_status | rlbk_remaining | rlbk_completion_pct 
---------+-------------+----------------+---------------------
    1232 | EXECUTING   | @ 22.1 secs    |                  77
(1 row)

  select 1.0 - (20.0 + (30.0 - 28.0) + 1*0.3/3) / (73.1 + (20.0 + (30.0 - 28.0) + 1*0.3/3));  -- the completion % should be 77%
        ?column?        
------------------------
 0.76785714285714285714
(1 row)

-- the second RLBK_TABLE has started, but the elapse of the step is already > estimated duration 
  update emaj.emaj_time_stamp set time_tx_timestamp = now() - '85.1 seconds'::interval where time_id = -1;
  update emaj.emaj_rlbk_plan set rlbp_start_datetime = now() - '40 seconds'::interval
    where rlbp_rlbk_id = 1232 and rlbp_table = 't2';
  select rlbk_id, rlbk_status, rlbk_remaining, rlbk_completion_pct from emaj._rollback_activity();
 rlbk_id | rlbk_status | rlbk_remaining | rlbk_completion_pct 
---------+-------------+----------------+---------------------
    1232 | EXECUTING   | @ 20.1 secs    |                  81
(1 row)

  select 1.0 - (20.0 + 1*0.3/3) / (85.1 + (20.0 + 1*0.3/3));  -- the completion % should be 81%
        ?column?        
------------------------
 0.80893536121673003802
(1 row)

-- the second RLBK_TABLE has started, but the elapse of the step is already > estimated duration 
  update emaj.emaj_time_stamp set time_tx_timestamp = now() - '105.1 seconds'::interval where time_id = -1;
  update emaj.emaj_rlbk_plan set rlbp_start_datetime = now() - '60 seconds'::interval
    where rlbp_rlbk_id = 1232 and rlbp_table = 't2';
  select rlbk_id, rlbk_status, rlbk_remaining, rlbk_completion_pct from emaj._rollback_activity();
 rlbk_id | rlbk_status | rlbk_remaining | rlbk_completion_pct 
---------+-------------+----------------+---------------------
    1232 | EXECUTING   | @ 20.1 secs    |                  84
(1 row)

  select 1.0 - (20.0 + 1*0.3/3) / (105.1 + (20.0 + 1*0.3/3 ));  -- the completion % should be 84%
        ?column?        
------------------------
 0.83945686900958466454
(1 row)

-- the second RLBK_TABLE is completed, and the step duration > the estimated duration 
  update emaj.emaj_time_stamp set time_tx_timestamp = now() - '110.1 seconds'::interval where time_id = -1;
  update emaj.emaj_rlbk_plan set rlbp_start_datetime = now() - '65 seconds'::interval,
                                 rlbp_duration = '65 seconds'::interval
    where rlbp_rlbk_id = 1232 and rlbp_table = 't2';
  select rlbk_id, rlbk_status, rlbk_remaining, rlbk_completion_pct from emaj._rollback_activity();
 rlbk_id | rlbk_status | rlbk_remaining | rlbk_completion_pct 
---------+-------------+----------------+---------------------
    1232 | EXECUTING   | @ 20.1 secs    |                  85
(1 row)

  select 1.0 - (20.0 + 1*0.3/3) / (110.1 + (20.0 + 1*0.3/3));  -- the completion % should be 85%
        ?column?        
------------------------
 0.84562211981566820276
(1 row)

-- the third RLBK_TABLE has started, and is almost completed 
  update emaj.emaj_time_stamp set time_tx_timestamp = now() - '124.1 seconds'::interval where time_id = -1;
  update emaj.emaj_rlbk_plan set rlbp_start_datetime = now() - '19 seconds'::interval
    where rlbp_rlbk_id = 1232 and rlbp_table = 't3';
  select rlbk_id, rlbk_status, rlbk_remaining, rlbk_completion_pct from emaj._rollback_activity();
 rlbk_id | rlbk_status | rlbk_remaining | rlbk_completion_pct 
---------+-------------+----------------+---------------------
    1232 | EXECUTING   | @ 1 sec        |                  99
(1 row)

  select 1.0 - ((20.0 - 19.0)) / (124.1 + (20.0 - 19.0));  -- the completion % should be 99%
        ?column?        
------------------------
 0.99200639488409272582
(1 row)

rollback;
begin;
-- 1 rollback operation in LOCKING state and without step other than LOCK_TABLE
  insert into emaj.emaj_time_stamp (time_id, time_tx_timestamp) values (-1, now()-'2 minutes'::interval);
  insert into emaj.emaj_time_stamp (time_id, time_clock_timestamp) values (-2, '2000-01-01 01:00:00');
  insert into emaj.emaj_rlbk (rlbk_id, rlbk_groups, rlbk_mark, rlbk_mark_time_id, rlbk_time_id, rlbk_is_logged, rlbk_is_alter_group_allowed, 
             rlbk_nb_session, rlbk_nb_table, rlbk_nb_sequence, rlbk_eff_nb_table, rlbk_status)
    values (1233,array['group1233'],'mark1233',-2,-1,true,false,
             1,5,4,3,'LOCKING');
  insert into emaj.emaj_rlbk_plan (rlbp_rlbk_id, rlbp_step, rlbp_schema, rlbp_table, rlbp_object,
             rlbp_estimated_duration, rlbp_start_datetime, rlbp_duration)
    values (1233, 'LOCK_TABLE','schema','t1','',null,null,null),
           (1233, 'LOCK_TABLE','schema','t2','',null,null,null),
           (1233, 'LOCK_TABLE','schema','t3','',null,null,null);
  select rlbk_id, rlbk_status, rlbk_elapse, rlbk_remaining, rlbk_completion_pct from emaj._rollback_activity();
 rlbk_id | rlbk_status | rlbk_elapse | rlbk_remaining | rlbk_completion_pct 
---------+-------------+-------------+----------------+---------------------
    1233 | LOCKING     | @ 2 mins    | @ 0            |                   0
(1 row)

-- the rollback operation in LOCKING state now has RLBK_TABLE steps
  insert into emaj.emaj_rlbk_plan (rlbp_rlbk_id, rlbp_step, rlbp_schema, rlbp_table, rlbp_object,
             rlbp_estimated_duration, rlbp_start_datetime, rlbp_duration)
    values (1233, 'RLBK_TABLE','schema','t1','','0:20:00'::interval,null,null),
           (1233, 'RLBK_TABLE','schema','t2','','0:02:00'::interval,null,null),
           (1233, 'RLBK_TABLE','schema','t3','','0:00:20'::interval,null,null);
  select rlbk_id, rlbk_status, rlbk_elapse, rlbk_remaining, rlbk_completion_pct from emaj._rollback_activity();
 rlbk_id | rlbk_status | rlbk_elapse |  rlbk_remaining   | rlbk_completion_pct 
---------+-------------+-------------+-------------------+---------------------
    1233 | LOCKING     | @ 2 mins    | @ 22 mins 20 secs |                   0
(1 row)

-- +1 rollback operation in PLANNING state
  insert into emaj.emaj_time_stamp (time_id, time_tx_timestamp) values (-3, now()-'1 minute'::interval);
  insert into emaj.emaj_rlbk (rlbk_id, rlbk_groups, rlbk_mark, rlbk_mark_time_id, rlbk_time_id, rlbk_is_logged, rlbk_is_alter_group_allowed, 
             rlbk_nb_session, rlbk_nb_table, rlbk_nb_sequence, rlbk_eff_nb_table, rlbk_status)
    values (1234,array['group1234'],'mark1234',-2,-3,true,false,
             1,5,4,3,'PLANNING');
  select rlbk_id, rlbk_groups, rlbk_mark, rlbk_mark_datetime, rlbk_is_logged, rlbk_nb_session, rlbk_nb_table,
         rlbk_nb_sequence, rlbk_eff_nb_table, rlbk_status, rlbk_elapse, rlbk_remaining, rlbk_completion_pct 
    from emaj._rollback_activity();
 rlbk_id | rlbk_groups | rlbk_mark |      rlbk_mark_datetime      | rlbk_is_logged | rlbk_nb_session | rlbk_nb_table | rlbk_nb_sequence | rlbk_eff_nb_table | rlbk_status | rlbk_elapse |  rlbk_remaining   | rlbk_completion_pct 
---------+-------------+-----------+------------------------------+----------------+-----------------+---------------+------------------+-------------------+-------------+-------------+-------------------+---------------------
    1233 | {group1233} | mark1233  | Sat Jan 01 01:00:00 2000 PST | t              |               1 |             5 |                4 |                 3 | LOCKING     | @ 2 mins    | @ 22 mins 20 secs |                   0
    1234 | {group1234} | mark1234  | Sat Jan 01 01:00:00 2000 PST | t              |               1 |             5 |                4 |                 3 | PLANNING    | @ 1 min     |                   |                   0
(2 rows)

rollback;
-----------------------------
-- test emaj_consolidate_rollback_group() and emaj_get_consolidable_rollbacks()
-----------------------------
-- group is NULL or unknown
select emaj.emaj_consolidate_rollback_group(NULL,NULL);
ERROR:  _check_group_names: No group to process.
CONTEXT:  SQL statement "SELECT emaj._check_group_names(v_groupNames := ARRAY[v_groupName], v_mayBeNull := FALSE, v_lockGroups := TRUE, v_checkList := '')"
PL/pgSQL function emaj.emaj_consolidate_rollback_group(text,text) line 16 at PERFORM
select emaj.emaj_consolidate_rollback_group('unknownGroup',NULL);
ERROR:  _check_group_names: The group "unknownGroup" does not exist.
CONTEXT:  SQL statement "SELECT emaj._check_group_names(v_groupNames := ARRAY[v_groupName], v_mayBeNull := FALSE, v_lockGroups := TRUE, v_checkList := '')"
PL/pgSQL function emaj.emaj_consolidate_rollback_group(text,text) line 16 at PERFORM
-- mark is unknown
select emaj.emaj_consolidate_rollback_group('myGroup1',NULL);
ERROR:  _check_mark_name: The mark "<NULL>" does not exist for the group "myGroup1".
CONTEXT:  SQL statement "SELECT emaj._check_mark_name(v_groupNames := ARRAY[v_groupName], v_mark := v_endRlbkMark, v_checkList := '')"
PL/pgSQL function emaj.emaj_consolidate_rollback_group(text,text) line 18 at SQL statement
select emaj.emaj_consolidate_rollback_group('myGroup1','unknown mark');
ERROR:  _check_mark_name: The mark "unknown mark" does not exist for the group "myGroup1".
CONTEXT:  SQL statement "SELECT emaj._check_mark_name(v_groupNames := ARRAY[v_groupName], v_mark := v_endRlbkMark, v_checkList := '')"
PL/pgSQL function emaj.emaj_consolidate_rollback_group(text,text) line 18 at SQL statement
-- mark is known but is not an end rollback mark
select emaj.emaj_consolidate_rollback_group('myGroup1','Mark12');
ERROR:  emaj_consolidate_rollback_group: The mark "Mark12" for the group "myGroup1" is not an end rollback mark.
-- mark is an end rollback mark but the rollback target mark is invalid
begin;
  update emaj.emaj_mark set mark_logged_rlbk_target_mark = 'dummy' where mark_name = 'Mark12';
  select emaj.emaj_consolidate_rollback_group('myGroup1','Mark12');
ERROR:  emaj_consolidate_rollback_group: The rollback target mark "dummy" for the group "myGroup1" has not been found.
rollback;
-- should be ok
set search_path=public,myschema1;
select emaj.emaj_ignore_app_trigger('ADD', 'myschema1', 'mytbl2', 'mytbl2trg%');
 emaj_ignore_app_trigger 
-------------------------
                       1
(1 row)

-- rollback without log rows to delete
select emaj.emaj_set_mark_group('myGroup1','Conso_M1');
 emaj_set_mark_group 
---------------------
                   7
(1 row)

select * from emaj.emaj_logged_rollback_group('myGroup1','Conso_M1');
 rlbk_severity |            rlbk_message             
---------------+-------------------------------------
 Notice        | 0 / 5 tables effectively processed.
 Notice        | 2 sequences processed.
(2 rows)

select emaj.emaj_consolidate_rollback_group('myGroup1','EMAJ_LAST_MARK');
 emaj_consolidate_rollback_group 
---------------------------------
                               2
(1 row)

-- mark Conso_M1, updates, mark Conso_M2, updates, logged rlbk back to Conso_M1, updates, rename both marks, consolidate, check and cancel
select emaj.emaj_set_mark_group('myGroup1','Conso_M2');
 emaj_set_mark_group 
---------------------
                   7
(1 row)

insert into myTbl1 select i, 'Test', 'Conso' from generate_series (1000,1011) as i;
insert into myTbl2 values (1000,'TC1',NULL);
delete from myTbl1 where col11 > 1010;
select emaj.emaj_set_mark_group('myGroup1','Conso_M3');
 emaj_set_mark_group 
---------------------
                   7
(1 row)

update myTbl2 set col22 = 'TC2' WHERE col22 ='TC1';
select * from emaj.emaj_logged_rollback_group('myGroup1','Conso_M2');
 rlbk_severity |            rlbk_message             
---------------+-------------------------------------
 Notice        | 3 / 5 tables effectively processed.
 Notice        | 2 sequences processed.
(2 rows)

insert into myTbl2 values (1000,'TC3',NULL);
select emaj.emaj_rename_mark_group('myGroup1','Conso_M2','Renamed_conso_M2');
 emaj_rename_mark_group 
------------------------
 
(1 row)

select emaj.emaj_rename_mark_group('myGroup1','EMAJ_LAST_MARK','Renamed_last_mark');
 emaj_rename_mark_group 
------------------------
 
(1 row)

select cons_group, cons_target_rlbk_mark_name, cons_target_rlbk_mark_time_id, 
       regexp_replace(cons_end_rlbk_mark_name,E'\\d\\d\.\\d\\d\\.\\d\\d\\.\\d\\d\\d\\d','%','g'), cons_end_rlbk_mark_time_id, cons_rows, cons_marks 
  from emaj.emaj_get_consolidable_rollbacks();
 cons_group | cons_target_rlbk_mark_name | cons_target_rlbk_mark_time_id |    regexp_replace    | cons_end_rlbk_mark_time_id | cons_rows | cons_marks 
------------+----------------------------+-------------------------------+----------------------+----------------------------+-----------+------------
 emptyGroup | EGM3                       |                          3400 | RLBK_EGM3_%_DONE     |                       4044 |         0 |          2
 myGroup1   | Conso_M1                   |                          4050 | RLBK_Conso_M1_%_DONE |                       4052 |         0 |          0
 myGroup1   | Renamed_conso_M2           |                          4053 | Renamed_last_mark    |                       4056 |        32 |          2
(3 rows)

  
select emaj.emaj_consolidate_rollback_group('myGroup1','Renamed_last_mark');
 emaj_consolidate_rollback_group 
---------------------------------
                               5
(1 row)

select cons_group, cons_target_rlbk_mark_name, cons_target_rlbk_mark_time_id, 
       regexp_replace(cons_end_rlbk_mark_name,E'\\d\\d\.\\d\\d\\.\\d\\d\\.\\d\\d\\d\\d','%','g'), cons_end_rlbk_mark_time_id, cons_rows, cons_marks
  from emaj.emaj_get_consolidable_rollbacks();
 cons_group | cons_target_rlbk_mark_name | cons_target_rlbk_mark_time_id |    regexp_replace    | cons_end_rlbk_mark_time_id | cons_rows | cons_marks 
------------+----------------------------+-------------------------------+----------------------+----------------------------+-----------+------------
 emptyGroup | EGM3                       |                          3400 | RLBK_EGM3_%_DONE     |                       4044 |         0 |          2
 myGroup1   | Conso_M1                   |                          4050 | RLBK_Conso_M1_%_DONE |                       4052 |         0 |          0
 myGroup1   | Renamed_conso_M2           |                          4053 | Renamed_last_mark    |                       4056 |         0 |          0
(3 rows)

-- consolidate a rollback already consolidated
select emaj.emaj_consolidate_rollback_group('myGroup1','Renamed_last_mark');
 emaj_consolidate_rollback_group 
---------------------------------
                               2
(1 row)

select mark_group, regexp_replace(mark_name,E'\\d\\d\.\\d\\d\\.\\d\\d\\.\\d\\d\\d\\d','%','g'), mark_time_id, mark_is_deleted, mark_is_rlbk_protected, mark_comment, mark_log_rows_before_next, mark_logged_rlbk_target_mark from emaj.emaj_mark where mark_group = 'myGroup1' order by mark_time_id, mark_group;
 mark_group |    regexp_replace    | mark_time_id | mark_is_deleted | mark_is_rlbk_protected | mark_comment | mark_log_rows_before_next | mark_logged_rlbk_target_mark 
------------+----------------------+--------------+-----------------+------------------------+--------------+---------------------------+------------------------------
 myGroup1   | Mark11               |         4034 | f               | f                      |              |                        19 | 
 myGroup1   | Mark12               |         4035 | f               | f                      |              |                        11 | 
 myGroup1   | Mark13               |         4036 | f               | f                      |              |                         0 | 
 myGroup1   | Conso_M1             |         4050 | f               | f                      |              |                         0 | 
 myGroup1   | RLBK_Conso_M1_%_DONE |         4052 | f               | f                      |              |                         0 | Conso_M1
 myGroup1   | Renamed_conso_M2     |         4053 | f               | f                      |              |                         0 | 
 myGroup1   | Renamed_last_mark    |         4056 | f               | f                      |              |                           | Renamed_conso_M2
(7 rows)

select sequ_schema, sequ_name, sequ_time_id, sequ_last_val, sequ_is_called from emaj.emaj_sequence where sequ_schema = 'emaj_myschema1' order by sequ_time_id, sequ_schema, sequ_name;
 sequ_schema | sequ_name | sequ_time_id | sequ_last_val | sequ_is_called 
-------------+-----------+--------------+---------------+----------------
(0 rows)

select tbl_schema, tbl_name, tbl_time_id, tbl_log_seq_last_val from emaj.emaj_table order by tbl_time_id, tbl_schema, tbl_name;
   tbl_schema   |  tbl_name   | tbl_time_id | tbl_log_seq_last_val 
----------------+-------------+-------------+----------------------
 phil's schema3 | myTbl2\     |        3402 |                    0
 phil's schema3 | phil's tbl1 |        3402 |                    0
 myschema2      | myTbl3      |        4028 |                    0
 myschema2      | mytbl1      |        4028 |                    0
 myschema2      | mytbl2      |        4028 |                    0
 myschema2      | mytbl4      |        4028 |                    0
 myschema2      | mytbl5      |        4028 |                    0
 myschema2      | mytbl6      |        4028 |                    0
 myschema2      | mytbl7      |        4028 |                    0
 myschema2      | mytbl8      |        4028 |                    0
 myschema1      | myTbl3      |        4034 |                   10
 myschema1      | mytbl1      |        4034 |                   15
 myschema1      | mytbl2      |        4034 |                    6
 myschema1      | mytbl2b     |        4034 |                    6
 myschema1      | mytbl4      |        4034 |                    2
 myschema1      | myTbl3      |        4035 |                   10
 myschema1      | mytbl1      |        4035 |                   30
 myschema1      | mytbl2      |        4035 |                    8
 myschema1      | mytbl2b     |        4035 |                    8
 myschema1      | mytbl4      |        4035 |                    2
 myschema1      | myTbl3      |        4036 |                   20
 myschema1      | mytbl1      |        4036 |                   30
 myschema1      | mytbl2      |        4036 |                    8
 myschema1      | mytbl2b     |        4036 |                    8
 myschema1      | mytbl4      |        4036 |                    3
 myschema4      | mypartp1    |        4045 |                    0
 myschema4      | mypartp2    |        4045 |                    0
 myschema4      | mytblc1     |        4045 |                    0
 myschema4      | mytblc2     |        4045 |                    0
 myschema4      | mytblm      |        4045 |                    0
 myschema1      | myTbl3      |        4050 |                   30
 myschema1      | mytbl1      |        4050 |                   40
 myschema1      | mytbl2      |        4050 |                   10
 myschema1      | mytbl2b     |        4050 |                   10
 myschema1      | mytbl4      |        4050 |                    4
 myschema1      | myTbl3      |        4052 |                   30
 myschema1      | mytbl1      |        4052 |                   40
 myschema1      | mytbl2      |        4052 |                   10
 myschema1      | mytbl2b     |        4052 |                   10
 myschema1      | mytbl4      |        4052 |                    4
 myschema1      | myTbl3      |        4053 |                   30
 myschema1      | mytbl1      |        4053 |                   40
 myschema1      | mytbl2      |        4053 |                   10
 myschema1      | mytbl2b     |        4053 |                   10
 myschema1      | mytbl4      |        4053 |                    4
 myschema1      | myTbl3      |        4056 |                   30
 myschema1      | mytbl1      |        4056 |                   64
 myschema1      | mytbl2      |        4056 |                   13
 myschema1      | mytbl2b     |        4056 |                   15
 myschema1      | mytbl4      |        4056 |                    4
(50 rows)

select sqhl_schema, sqhl_table, sqhl_begin_time_id, sqhl_end_time_id, sqhl_hole_size from emaj.emaj_seq_hole where sqhl_schema = 'myschema1' order by 1,2,3;
 sqhl_schema | sqhl_table | sqhl_begin_time_id | sqhl_end_time_id | sqhl_hole_size 
-------------+------------+--------------------+------------------+----------------
 myschema1   | myTbl3     |               4036 |             4041 |             10
 myschema1   | mytbl1     |               4036 |             4041 |             10
 myschema1   | mytbl1     |               4053 |             4056 |             24
 myschema1   | mytbl2     |               4036 |             4041 |              2
 myschema1   | mytbl2     |               4053 |             4056 |              3
 myschema1   | mytbl2b    |               4036 |             4041 |              2
 myschema1   | mytbl2b    |               4053 |             4056 |              5
 myschema1   | mytbl4     |               4036 |             4041 |              1
(8 rows)

select * from emaj.emaj_rollback_group('myGroup1','Conso_M1');
 rlbk_severity |            rlbk_message             
---------------+-------------------------------------
 Notice        | 2 / 5 tables effectively processed.
 Notice        | 2 sequences processed.
(2 rows)

select emaj.emaj_ignore_app_trigger('REMOVE', 'myschema1', 'mytbl2', '%');
 emaj_ignore_app_trigger 
-------------------------
                       2
(1 row)

-- consolidate a stopped (and empty) group
begin;
  select emaj.emaj_rename_mark_group('emptyGroup','EMAJ_LAST_MARK','end_rlbk_mark');
 emaj_rename_mark_group 
------------------------
 
(1 row)

  select emaj.emaj_stop_group('emptyGroup','stop');
 emaj_stop_group 
-----------------
               0
(1 row)

  select * from emaj.emaj_get_consolidable_rollbacks();
 cons_group | cons_target_rlbk_mark_name | cons_target_rlbk_mark_time_id | cons_end_rlbk_mark_name | cons_end_rlbk_mark_time_id | cons_rows | cons_marks 
------------+----------------------------+-------------------------------+-------------------------+----------------------------+-----------+------------
 emptyGroup | EGM3                       |                          3400 | end_rlbk_mark           |                       4044 |         0 |          2
(1 row)

  select emaj.emaj_consolidate_rollback_group('emptyGroup','end_rlbk_mark');
 emaj_consolidate_rollback_group 
---------------------------------
                               0
(1 row)

  select * from emaj.emaj_mark where mark_group = 'emptyGroup' order by mark_time_id, mark_group;
 mark_group |   mark_name   | mark_time_id | mark_is_deleted | mark_is_rlbk_protected |              mark_comment              | mark_log_rows_before_next | mark_logged_rlbk_target_mark 
------------+---------------+--------------+-----------------+------------------------+----------------------------------------+---------------------------+------------------------------
 emptyGroup | SM2           |         3006 | t               | f                      | a comment on a mark for an empty group |                         0 | Mark1
 emptyGroup | EGM3          |         3400 | t               | f                      |                                        |                         0 | 
 emptyGroup | end_rlbk_mark |         4044 | t               | f                      |                                        |                         0 | EGM3
 emptyGroup | stop          |         4058 | t               | f                      |                                        |                         0 | 
(4 rows)

rollback;
-- check that dropping the group deletes rows from emaj_sequence and emaj_seq_hole
begin;
  select emaj.emaj_stop_group('myGroup1');
 emaj_stop_group 
-----------------
               7
(1 row)

  select emaj.emaj_drop_group('myGroup1');
 emaj_drop_group 
-----------------
               7
(1 row)

  select sequ_schema, sequ_name, sequ_time_id, sequ_last_val, sequ_is_called from emaj.emaj_sequence where sequ_name like 'myschema1%' order by sequ_time_id, sequ_schema, sequ_name;
 sequ_schema | sequ_name | sequ_time_id | sequ_last_val | sequ_is_called 
-------------+-----------+--------------+---------------+----------------
(0 rows)

  select tbl_schema, tbl_name, tbl_time_id, tbl_log_seq_last_val from emaj.emaj_table order by tbl_schema, tbl_name, tbl_time_id;
   tbl_schema   |  tbl_name   | tbl_time_id | tbl_log_seq_last_val 
----------------+-------------+-------------+----------------------
 myschema2      | myTbl3      |        4028 |                    0
 myschema2      | mytbl1      |        4028 |                    0
 myschema2      | mytbl2      |        4028 |                    0
 myschema2      | mytbl4      |        4028 |                    0
 myschema2      | mytbl5      |        4028 |                    0
 myschema2      | mytbl6      |        4028 |                    0
 myschema2      | mytbl7      |        4028 |                    0
 myschema2      | mytbl8      |        4028 |                    0
 myschema4      | mypartp1    |        4045 |                    0
 myschema4      | mypartp2    |        4045 |                    0
 myschema4      | mytblc1     |        4045 |                    0
 myschema4      | mytblc2     |        4045 |                    0
 myschema4      | mytblm      |        4045 |                    0
 phil's schema3 | myTbl2\     |        3402 |                    0
 phil's schema3 | phil's tbl1 |        3402 |                    0
(15 rows)

  select sqhl_schema, sqhl_table, sqhl_begin_time_id, sqhl_end_time_id, sqhl_hole_size from emaj.emaj_seq_hole where sqhl_schema = 'myschema1' order by 1,2,3;
 sqhl_schema | sqhl_table | sqhl_begin_time_id | sqhl_end_time_id | sqhl_hole_size 
-------------+------------+--------------------+------------------+----------------
(0 rows)

rollback;
-----------------------------
-- test emaj_cleanup_rollback_state()
-----------------------------
-- rollback a transaction with an E-Maj rollback to generate an ABORTED rollback event
begin;
  select * from emaj.emaj_rollback_group('myGroup4','myGroup4_start');
 rlbk_severity |            rlbk_message             
---------------+-------------------------------------
 Notice        | 0 / 5 tables effectively processed.
(1 row)

rollback;
select rlbk_id, rlbk_status, rlbk_begin_hist_id, rlbk_nb_session from emaj.emaj_rlbk
  where rlbk_status in ('PLANNING', 'LOCKING', 'EXECUTING', 'COMPLETED') order by rlbk_id;
 rlbk_id | rlbk_status | rlbk_begin_hist_id | rlbk_nb_session 
---------+-------------+--------------------+-----------------
    4019 | COMPLETED   |               4424 |               1
    4020 | COMPLETED   |               4452 |               1
    4021 | COMPLETED   |               4492 |               1
(3 rows)

select emaj.emaj_cleanup_rollback_state();
 emaj_cleanup_rollback_state 
-----------------------------
                           3
(1 row)

-----------------------------
-- check rollback tables
-----------------------------
select rlbk_id, rlbk_groups, rlbk_mark, rlbk_time_id, rlbk_is_logged, rlbk_is_alter_group_allowed, rlbk_nb_session, rlbk_nb_table,
       rlbk_nb_sequence, rlbk_eff_nb_table, rlbk_status, rlbk_begin_hist_id, rlbk_dblink_schema, rlbk_is_dblink_used,
       case when rlbk_end_datetime is null then 'null' else '[ts]' end as "end_datetime", rlbk_messages
  from emaj.emaj_rlbk order by rlbk_id;
 rlbk_id |     rlbk_groups     |   rlbk_mark    | rlbk_time_id | rlbk_is_logged | rlbk_is_alter_group_allowed | rlbk_nb_session | rlbk_nb_table | rlbk_nb_sequence | rlbk_eff_nb_table | rlbk_status | rlbk_begin_hist_id | rlbk_dblink_schema | rlbk_is_dblink_used | end_datetime |                                   rlbk_messages                                   
---------+---------------------+----------------+--------------+----------------+-----------------------------+-----------------+---------------+------------------+-------------------+-------------+--------------------+--------------------+---------------------+--------------+-----------------------------------------------------------------------------------
    4000 | {myGroup1}          | Different_Mark |         4006 | f              | f                           |               1 |             5 |                2 |                 0 | COMMITTED   |               4037 |                    | f                   | [ts]         | {"Notice: 0 / 5 tables effectively processed.","Notice: 2 sequences processed."}
    4003 | {myGroup1}          | Different_Mark |         4017 | f              | f                           |               1 |             5 |                2 |                 0 | COMMITTED   |               4100 |                    | f                   | [ts]         | {"Notice: 0 / 5 tables effectively processed.","Notice: 2 sequences processed."}
    4004 | {myGroup2}          | Mark21         |         4018 | f              | f                           |               1 |             8 |                2 |                 0 | COMMITTED   |               4109 |                    | f                   | [ts]         | {"Notice: 0 / 8 tables effectively processed.","Notice: 2 sequences processed."}
    4005 | {myGroup1,myGroup2} | Mark1B         |         4020 | f              | f                           |               1 |            13 |                4 |                 0 | COMMITTED   |               4123 |                    | f                   | [ts]         | {"Notice: 0 / 13 tables effectively processed.","Notice: 4 sequences processed."}
    4006 | {myGroup1,myGroup2} | Mark1B         |         4021 | f              | f                           |               1 |            13 |                4 |                 0 | COMMITTED   |               4135 |                    | f                   | [ts]         | {"Notice: 0 / 13 tables effectively processed.","Notice: 4 sequences processed."}
    4007 | {myGroup1,myGroup2} | Mark1B         |         4022 | t              | f                           |               1 |            13 |                4 |                 0 | COMMITTED   |               4146 |                    | f                   | [ts]         | {"Notice: 0 / 13 tables effectively processed.","Notice: 4 sequences processed."}
    4008 | {myGroup1,myGroup2} | Mark1B         |         4024 | t              | f                           |               1 |            13 |                4 |                 0 | COMMITTED   |               4162 | public             | t                   | [ts]         | {"Notice: 0 / 13 tables effectively processed.","Notice: 4 sequences processed."}
    4009 | {myGroup1}          | Mark12         |         4031 | f              | f                           |               1 |             5 |                2 |                 2 | COMMITTED   |               4205 | public             | t                   | [ts]         | {"Notice: 2 / 5 tables effectively processed.","Notice: 2 sequences processed."}
    4010 | {myGroup1}          | Mark11         |         4032 | f              | f                           |               1 |             5 |                2 |                 3 | COMMITTED   |               4220 | public             | t                   | [ts]         | {"Notice: 3 / 5 tables effectively processed.","Notice: 2 sequences processed."}
    4011 | {myGroup1}          | Mark12         |         4037 | t              | f                           |               1 |             5 |                2 |                 2 | COMMITTED   |               4259 | public             | t                   | [ts]         | {"Notice: 2 / 5 tables effectively processed.","Notice: 2 sequences processed."}
    4012 | {myGroup1}          | Mark11         |         4039 | t              | f                           |               1 |             5 |                2 |                 5 | COMMITTED   |               4277 | public             | t                   | [ts]         | {"Notice: 5 / 5 tables effectively processed.","Notice: 2 sequences processed."}
    4013 | {myGroup1}          | Mark13         |         4041 | f              | f                           |               1 |             5 |                2 |                 5 | COMMITTED   |               4302 | public             | t                   | [ts]         | {"Notice: 5 / 5 tables effectively processed.","Notice: 2 sequences processed."}
    4014 | {emptyGroup}        | EGM4           |         4042 | f              | f                           |               1 |             0 |                0 |                 0 | COMMITTED   |               4326 | public             | t                   | [ts]         | {"Notice: 0 / 0 tables effectively processed."}
    4015 | {emptyGroup}        | EGM3           |         4043 | t              | f                           |               1 |             0 |                0 |                 0 | COMMITTED   |               4333 | public             | t                   | [ts]         | {"Notice: 0 / 0 tables effectively processed."}
    4016 | {myGroup4}          | mark1          |         4047 | t              | f                           |               1 |             5 |                0 |                 3 | COMMITTED   |               4358 | public             | t                   | [ts]         | {"Notice: 3 / 5 tables effectively processed."}
    4017 | {myGroup4}          | myGroup4_start |         4049 | f              | t                           |               1 |             5 |                0 |                 3 | COMMITTED   |               4375 | public             | t                   | [ts]         | {"Notice: 3 / 5 tables effectively processed."}
    4018 | {myGroup1}          | Conso_M1       |         4051 | t              | f                           |               1 |             5 |                2 |                 0 | COMMITTED   |               4399 | public             | t                   | [ts]         | {"Notice: 0 / 5 tables effectively processed.","Notice: 2 sequences processed."}
    4019 | {myGroup1}          | Conso_M2       |         4055 | t              | f                           |               1 |             5 |                2 |                 3 | COMMITTED   |               4424 | public             | t                   | [ts]         | {"Notice: 3 / 5 tables effectively processed.","Notice: 2 sequences processed."}
    4020 | {myGroup1}          | Conso_M1       |         4057 | f              | f                           |               1 |             5 |                2 |                 2 | COMMITTED   |               4452 | public             | t                   | [ts]         | {"Notice: 2 / 5 tables effectively processed.","Notice: 2 sequences processed."}
    4021 | {myGroup4}          | myGroup4_start |         4061 | f              | f                           |               1 |             5 |                0 |                 0 | ABORTED     |               4492 | public             | t                   | [ts]         | {"Notice: 0 / 5 tables effectively processed."}
(20 rows)

select rlbs_rlbk_id, rlbs_session, 
       case when rlbs_end_datetime is null then 'null' else '[ts]' end as "end_datetime"
  from emaj.emaj_rlbk_session order by rlbs_rlbk_id, rlbs_session;
 rlbs_rlbk_id | rlbs_session | end_datetime 
--------------+--------------+--------------
         4000 |            1 | [ts]
         4003 |            1 | [ts]
         4004 |            1 | [ts]
         4005 |            1 | [ts]
         4006 |            1 | [ts]
         4007 |            1 | [ts]
         4008 |            1 | [ts]
         4009 |            1 | [ts]
         4010 |            1 | [ts]
         4011 |            1 | [ts]
         4012 |            1 | [ts]
         4013 |            1 | [ts]
         4014 |            1 | [ts]
         4015 |            1 | [ts]
         4016 |            1 | [ts]
         4017 |            1 | [ts]
         4018 |            1 | [ts]
         4019 |            1 | [ts]
         4020 |            1 | [ts]
         4021 |            1 | [ts]
(20 rows)

select rlbp_rlbk_id, rlbp_step, rlbp_schema, rlbp_table, rlbp_object, rlbp_target_time_id, rlbp_batch_number, rlbp_session,
       rlbp_object_def, rlbp_estimated_quantity, rlbp_estimate_method, rlbp_quantity
  from emaj.emaj_rlbk_plan order by rlbp_rlbk_id, rlbp_step, rlbp_schema, rlbp_table, rlbp_object;
 rlbp_rlbk_id |  rlbp_step  | rlbp_schema | rlbp_table |      rlbp_object      | rlbp_target_time_id | rlbp_batch_number | rlbp_session |                                                             rlbp_object_def                                                             | rlbp_estimated_quantity | rlbp_estimate_method | rlbp_quantity 
--------------+-------------+-------------+------------+-----------------------+---------------------+-------------------+--------------+-----------------------------------------------------------------------------------------------------------------------------------------+-------------------------+----------------------+---------------
         4009 | DIS_LOG_TRG | myschema1   | myTbl3     |                       |                     |                 1 |            1 |                                                                                                                                         |                         |                    3 |              
         4009 | DIS_LOG_TRG | myschema1   | mytbl4     |                       |                     |                 2 |            1 |                                                                                                                                         |                         |                    3 |              
         4009 | DROP_FK     | myschema1   | mytbl4     | mytbl4_col44_fkey     |                     |                 2 |            1 |                                                                                                                                         |                         |                    3 |              
         4009 | SET_FK_DEF  | myschema1   | mytbl4     | mytbl4_col43_fkey     |                     |                 2 |            1 |                                                                                                                                         |                         |                    3 |              
         4009 | RLBK_TABLE  | myschema1   | myTbl3     |                       |                4029 |                 1 |            1 |                                                                                                                                         |                      10 |                    3 |            10
         4009 | RLBK_TABLE  | myschema1   | mytbl4     |                       |                4029 |                 2 |            1 |                                                                                                                                         |                       2 |                    3 |             1
         4009 | DELETE_LOG  | myschema1   | myTbl3     |                       |                4029 |                 1 |            1 |                                                                                                                                         |                      10 |                    3 |            10
         4009 | DELETE_LOG  | myschema1   | mytbl4     |                       |                4029 |                 2 |            1 |                                                                                                                                         |                       2 |                    3 |             3
         4009 | SET_FK_IMM  | myschema1   | mytbl4     | mytbl4_col43_fkey     |                     |                 2 |            1 |                                                                                                                                         |                       2 |                    3 |              
         4009 | ADD_FK      | myschema1   | mytbl4     | mytbl4_col44_fkey     |                     |                 2 |            1 | FOREIGN KEY (col44, col45) REFERENCES myschema1.mytbl1(col11, col12) ON UPDATE SET NULL ON DELETE CASCADE DEFERRABLE INITIALLY DEFERRED |                       0 |                    3 |              
         4009 | ENA_LOG_TRG | myschema1   | myTbl3     |                       |                     |                 1 |            1 |                                                                                                                                         |                         |                    3 |              
         4009 | ENA_LOG_TRG | myschema1   | mytbl4     |                       |                     |                 2 |            1 |                                                                                                                                         |                         |                    3 |              
         4009 | CTRL+DBLINK |             |            |                       |                     |                   |              |                                                                                                                                         |                      12 |                    3 |              
         4010 | DIS_APP_TRG | myschema1   | mytbl2     | mytbl2trg1            |                     |                 1 |            1 |                                                                                                                                         |                         |                    3 |              
         4010 | DIS_LOG_TRG | myschema1   | mytbl1     |                       |                     |                 1 |            1 |                                                                                                                                         |                         |                    2 |              
         4010 | DIS_LOG_TRG | myschema1   | mytbl2     |                       |                     |                 1 |            1 |                                                                                                                                         |                         |                    2 |              
         4010 | DIS_LOG_TRG | myschema1   | mytbl2b    |                       |                     |                 2 |            1 |                                                                                                                                         |                         |                    2 |              
         4010 | DROP_FK     | myschema1   | mytbl4     | mytbl4_col44_fkey     |                     |                 1 |            1 |                                                                                                                                         |                         |                    2 |              
         4010 | SET_FK_DEF  | myschema1   | mytbl4     | mytbl4_col43_fkey     |                     |                 1 |            1 |                                                                                                                                         |                         |                    2 |              
         4010 | RLBK_TABLE  | myschema1   | mytbl1     |                       |                4027 |                 1 |            1 |                                                                                                                                         |                      15 |                    3 |            11
         4010 | RLBK_TABLE  | myschema1   | mytbl2     |                       |                4027 |                 1 |            1 |                                                                                                                                         |                       6 |                    3 |             3
         4010 | RLBK_TABLE  | myschema1   | mytbl2b    |                       |                4027 |                 2 |            1 |                                                                                                                                         |                       6 |                    3 |             6
         4010 | DELETE_LOG  | myschema1   | mytbl1     |                       |                4027 |                 1 |            1 |                                                                                                                                         |                      15 |                    3 |            18
         4010 | DELETE_LOG  | myschema1   | mytbl2     |                       |                4027 |                 1 |            1 |                                                                                                                                         |                       6 |                    3 |             8
         4010 | DELETE_LOG  | myschema1   | mytbl2b    |                       |                4027 |                 2 |            1 |                                                                                                                                         |                       6 |                    3 |             6
         4010 | SET_FK_IMM  | myschema1   | mytbl4     | mytbl4_col43_fkey     |                     |                 1 |            1 |                                                                                                                                         |                       6 |                    2 |              
         4010 | ADD_FK      | myschema1   | mytbl4     | mytbl4_col44_fkey     |                     |                 1 |            1 | FOREIGN KEY (col44, col45) REFERENCES myschema1.mytbl1(col11, col12) ON UPDATE SET NULL ON DELETE CASCADE DEFERRABLE INITIALLY DEFERRED |                       0 |                    3 |              
         4010 | ENA_APP_TRG | myschema1   | mytbl2     | mytbl2trg1            |                     |                 1 |            1 |                                                                                                                                         |                         |                    3 |              
         4010 | ENA_LOG_TRG | myschema1   | mytbl1     |                       |                     |                 1 |            1 |                                                                                                                                         |                         |                    2 |              
         4010 | ENA_LOG_TRG | myschema1   | mytbl2     |                       |                     |                 1 |            1 |                                                                                                                                         |                         |                    2 |              
         4010 | ENA_LOG_TRG | myschema1   | mytbl2b    |                       |                     |                 2 |            1 |                                                                                                                                         |                         |                    2 |              
         4010 | CTRL+DBLINK |             |            |                       |                     |                   |              |                                                                                                                                         |                      18 |                    2 |              
         4011 | DROP_FK     | myschema1   | mytbl4     | mytbl4_col44_fkey     |                     |                 2 |            1 |                                                                                                                                         |                         |                    2 |              
         4011 | SET_FK_DEF  | myschema1   | mytbl4     | mytbl4_col43_fkey     |                     |                 2 |            1 |                                                                                                                                         |                         |                    2 |              
         4011 | RLBK_TABLE  | myschema1   | myTbl3     |                       |                4035 |                 1 |            1 |                                                                                                                                         |                      10 |                    1 |            10
         4011 | RLBK_TABLE  | myschema1   | mytbl4     |                       |                4035 |                 2 |            1 |                                                                                                                                         |                       1 |                    1 |             1
         4011 | SET_FK_IMM  | myschema1   | mytbl4     | mytbl4_col43_fkey     |                     |                 2 |            1 |                                                                                                                                         |                       1 |                    2 |              
         4011 | ADD_FK      | myschema1   | mytbl4     | mytbl4_col44_fkey     |                     |                 2 |            1 | FOREIGN KEY (col44, col45) REFERENCES myschema1.mytbl1(col11, col12) ON UPDATE SET NULL ON DELETE CASCADE DEFERRABLE INITIALLY DEFERRED |                       0 |                    3 |              
         4011 | CTRL+DBLINK |             |            |                       |                     |                   |              |                                                                                                                                         |                       6 |                    2 |              
         4012 | DIS_APP_TRG | myschema1   | mytbl2     | mytbl2trg1            |                     |                 2 |            1 |                                                                                                                                         |                         |                    2 |              
         4012 | DROP_FK     | myschema1   | mytbl4     | mytbl4_col44_fkey     |                     |                 2 |            1 |                                                                                                                                         |                         |                    2 |              
         4012 | SET_FK_DEF  | myschema1   | mytbl4     | mytbl4_col43_fkey     |                     |                 2 |            1 |                                                                                                                                         |                         |                    2 |              
         4012 | RLBK_TABLE  | myschema1   | myTbl3     |                       |                4034 |                 1 |            1 |                                                                                                                                         |                      20 |                    1 |            10
         4012 | RLBK_TABLE  | myschema1   | mytbl1     |                       |                4034 |                 2 |            1 |                                                                                                                                         |                      15 |                    1 |            11
         4012 | RLBK_TABLE  | myschema1   | mytbl2     |                       |                4034 |                 2 |            1 |                                                                                                                                         |                       2 |                    1 |             2
         4012 | RLBK_TABLE  | myschema1   | mytbl2b    |                       |                4034 |                 3 |            1 |                                                                                                                                         |                       2 |                    1 |             2
         4012 | RLBK_TABLE  | myschema1   | mytbl4     |                       |                4034 |                 2 |            1 |                                                                                                                                         |                       2 |                    1 |             1
         4012 | SET_FK_IMM  | myschema1   | mytbl4     | mytbl4_col43_fkey     |                     |                 2 |            1 |                                                                                                                                         |                       4 |                    2 |              
         4012 | ADD_FK      | myschema1   | mytbl4     | mytbl4_col44_fkey     |                     |                 2 |            1 | FOREIGN KEY (col44, col45) REFERENCES myschema1.mytbl1(col11, col12) ON UPDATE SET NULL ON DELETE CASCADE DEFERRABLE INITIALLY DEFERRED |                       0 |                    3 |              
         4012 | ENA_APP_TRG | myschema1   | mytbl2     | mytbl2trg1            |                     |                 2 |            1 |                                                                                                                                         |                         |                    2 |              
         4012 | CTRL+DBLINK |             |            |                       |                     |                   |              |                                                                                                                                         |                      11 |                    2 |              
         4013 | DIS_LOG_TRG | myschema1   | myTbl3     |                       |                     |                 1 |            1 |                                                                                                                                         |                         |                    2 |              
         4013 | DIS_LOG_TRG | myschema1   | mytbl1     |                       |                     |                 2 |            1 |                                                                                                                                         |                         |                    2 |              
         4013 | DIS_LOG_TRG | myschema1   | mytbl2     |                       |                     |                 2 |            1 |                                                                                                                                         |                         |                    2 |              
         4013 | DIS_LOG_TRG | myschema1   | mytbl2b    |                       |                     |                 3 |            1 |                                                                                                                                         |                         |                    2 |              
         4013 | DIS_LOG_TRG | myschema1   | mytbl4     |                       |                     |                 2 |            1 |                                                                                                                                         |                         |                    2 |              
         4013 | DROP_FK     | myschema1   | mytbl4     | mytbl4_col44_fkey     |                     |                 2 |            1 |                                                                                                                                         |                         |                    2 |              
         4013 | SET_FK_DEF  | myschema1   | mytbl4     | mytbl4_col43_fkey     |                     |                 2 |            1 |                                                                                                                                         |                         |                    2 |              
         4013 | RLBK_TABLE  | myschema1   | myTbl3     |                       |                4036 |                 1 |            1 |                                                                                                                                         |                      10 |                    1 |            10
         4013 | RLBK_TABLE  | myschema1   | mytbl1     |                       |                4036 |                 2 |            1 |                                                                                                                                         |                      10 |                    1 |            10
         4013 | RLBK_TABLE  | myschema1   | mytbl2     |                       |                4036 |                 2 |            1 |                                                                                                                                         |                       2 |                    1 |             2
         4013 | RLBK_TABLE  | myschema1   | mytbl2b    |                       |                4036 |                 3 |            1 |                                                                                                                                         |                       2 |                    1 |             2
         4013 | RLBK_TABLE  | myschema1   | mytbl4     |                       |                4036 |                 2 |            1 |                                                                                                                                         |                       1 |                    1 |             1
         4013 | DELETE_LOG  | myschema1   | myTbl3     |                       |                4036 |                 1 |            1 |                                                                                                                                         |                      10 |                    1 |            10
         4013 | DELETE_LOG  | myschema1   | mytbl1     |                       |                4036 |                 2 |            1 |                                                                                                                                         |                      10 |                    1 |            10
         4013 | DELETE_LOG  | myschema1   | mytbl2     |                       |                4036 |                 2 |            1 |                                                                                                                                         |                       2 |                    1 |             2
         4013 | DELETE_LOG  | myschema1   | mytbl2b    |                       |                4036 |                 3 |            1 |                                                                                                                                         |                       2 |                    1 |             2
         4013 | DELETE_LOG  | myschema1   | mytbl4     |                       |                4036 |                 2 |            1 |                                                                                                                                         |                       1 |                    1 |             1
         4013 | SET_FK_IMM  | myschema1   | mytbl4     | mytbl4_col43_fkey     |                     |                 2 |            1 |                                                                                                                                         |                       3 |                    2 |              
         4013 | ADD_FK      | myschema1   | mytbl4     | mytbl4_col44_fkey     |                     |                 2 |            1 | FOREIGN KEY (col44, col45) REFERENCES myschema1.mytbl1(col11, col12) ON UPDATE SET NULL ON DELETE CASCADE DEFERRABLE INITIALLY DEFERRED |                       0 |                    3 |              
         4013 | ENA_LOG_TRG | myschema1   | myTbl3     |                       |                     |                 1 |            1 |                                                                                                                                         |                         |                    2 |              
         4013 | ENA_LOG_TRG | myschema1   | mytbl1     |                       |                     |                 2 |            1 |                                                                                                                                         |                         |                    2 |              
         4013 | ENA_LOG_TRG | myschema1   | mytbl2     |                       |                     |                 2 |            1 |                                                                                                                                         |                         |                    2 |              
         4013 | ENA_LOG_TRG | myschema1   | mytbl2b    |                       |                     |                 3 |            1 |                                                                                                                                         |                         |                    2 |              
         4013 | ENA_LOG_TRG | myschema1   | mytbl4     |                       |                     |                 2 |            1 |                                                                                                                                         |                         |                    2 |              
         4013 | CTRL+DBLINK |             |            |                       |                     |                   |              |                                                                                                                                         |                      24 |                    2 |              
         4016 | DIS_APP_TRG | myschema4   | mytblm     | mytblm_insert_trigger |                     |                 3 |            1 |                                                                                                                                         |                         |                    2 |              
         4016 | RLBK_TABLE  | myschema4   | mytblc1    |                       |                4046 |                 1 |            1 |                                                                                                                                         |                       1 |                    3 |             2
         4016 | RLBK_TABLE  | myschema4   | mytblc2    |                       |                4046 |                 2 |            1 |                                                                                                                                         |                       1 |                    3 |             2
         4016 | RLBK_TABLE  | myschema4   | mytblm     |                       |                4046 |                 3 |            1 |                                                                                                                                         |                       1 |                    3 |             2
         4016 | ENA_APP_TRG | myschema4   | mytblm     | mytblm_insert_trigger |                     |                 3 |            1 |                                                                                                                                         |                         |                    2 |              
         4016 | CTRL+DBLINK |             |            |                       |                     |                   |              |                                                                                                                                         |                       5 |                    2 |              
         4017 | DIS_APP_TRG | myschema4   | mytblm     | mytblm_insert_trigger |                     |                 3 |            1 |                                                                                                                                         |                         |                    2 |              
         4017 | DIS_LOG_TRG | myschema4   | mytblc1    |                       |                     |                 1 |            1 |                                                                                                                                         |                         |                    2 |              
         4017 | DIS_LOG_TRG | myschema4   | mytblc2    |                       |                     |                 2 |            1 |                                                                                                                                         |                         |                    2 |              
         4017 | DIS_LOG_TRG | myschema4   | mytblm     |                       |                     |                 3 |            1 |                                                                                                                                         |                         |                    2 |              
         4017 | RLBK_TABLE  | myschema4   | mytblc1    |                       |                4045 |                 1 |            1 |                                                                                                                                         |                       3 |                    1 |             2
         4017 | RLBK_TABLE  | myschema4   | mytblc2    |                       |                4045 |                 2 |            1 |                                                                                                                                         |                       3 |                    1 |             2
         4017 | RLBK_TABLE  | myschema4   | mytblm     |                       |                4045 |                 3 |            1 |                                                                                                                                         |                       3 |                    1 |             2
         4017 | DELETE_LOG  | myschema4   | mytblc1    |                       |                4045 |                 1 |            1 |                                                                                                                                         |                       3 |                    3 |             4
         4017 | DELETE_LOG  | myschema4   | mytblc2    |                       |                4045 |                 2 |            1 |                                                                                                                                         |                       3 |                    3 |             4
         4017 | DELETE_LOG  | myschema4   | mytblm     |                       |                4045 |                 3 |            1 |                                                                                                                                         |                       3 |                    3 |             4
         4017 | ENA_APP_TRG | myschema4   | mytblm     | mytblm_insert_trigger |                     |                 3 |            1 |                                                                                                                                         |                         |                    2 |              
         4017 | ENA_LOG_TRG | myschema4   | mytblc1    |                       |                     |                 1 |            1 |                                                                                                                                         |                         |                    2 |              
         4017 | ENA_LOG_TRG | myschema4   | mytblc2    |                       |                     |                 2 |            1 |                                                                                                                                         |                         |                    2 |              
         4017 | ENA_LOG_TRG | myschema4   | mytblm     |                       |                     |                 3 |            1 |                                                                                                                                         |                         |                    2 |              
         4017 | CTRL+DBLINK |             |            |                       |                     |                   |              |                                                                                                                                         |                      14 |                    2 |              
         4019 | DROP_FK     | myschema1   | mytbl4     | mytbl4_col44_fkey     |                     |                 1 |            1 |                                                                                                                                         |                         |                    2 |              
         4019 | SET_FK_DEF  | myschema1   | mytbl4     | mytbl4_col43_fkey     |                     |                 1 |            1 |                                                                                                                                         |                         |                    2 |              
         4019 | RLBK_TABLE  | myschema1   | mytbl1     |                       |                4053 |                 1 |            1 |                                                                                                                                         |                      13 |                    1 |            12
         4019 | RLBK_TABLE  | myschema1   | mytbl2     |                       |                4053 |                 1 |            1 |                                                                                                                                         |                       2 |                    1 |             1
         4019 | RLBK_TABLE  | myschema1   | mytbl2b    |                       |                4053 |                 2 |            1 |                                                                                                                                         |                       2 |                    1 |             2
         4019 | SET_FK_IMM  | myschema1   | mytbl4     | mytbl4_col43_fkey     |                     |                 1 |            1 |                                                                                                                                         |                       2 |                    2 |              
         4019 | ADD_FK      | myschema1   | mytbl4     | mytbl4_col44_fkey     |                     |                 1 |            1 | FOREIGN KEY (col44, col45) REFERENCES myschema1.mytbl1(col11, col12) ON UPDATE SET NULL ON DELETE CASCADE DEFERRABLE INITIALLY DEFERRED |                       0 |                    3 |              
         4019 | CTRL+DBLINK |             |            |                       |                     |                   |              |                                                                                                                                         |                       7 |                    2 |              
         4020 | DIS_LOG_TRG | myschema1   | mytbl2     |                       |                     |                 1 |            1 |                                                                                                                                         |                         |                    2 |              
         4020 | DIS_LOG_TRG | myschema1   | mytbl2b    |                       |                     |                 2 |            1 |                                                                                                                                         |                         |                    2 |              
         4020 | SET_FK_DEF  | myschema1   | mytbl4     | mytbl4_col43_fkey     |                     |                 1 |            1 |                                                                                                                                         |                         |                    2 |              
         4020 | RLBK_TABLE  | myschema1   | mytbl2     |                       |                4050 |                 1 |            1 |                                                                                                                                         |                       1 |                    1 |             1
         4020 | RLBK_TABLE  | myschema1   | mytbl2b    |                       |                4050 |                 2 |            1 |                                                                                                                                         |                       1 |                    1 |             1
         4020 | DELETE_LOG  | myschema1   | mytbl2     |                       |                4050 |                 1 |            1 |                                                                                                                                         |                       1 |                    1 |             1
         4020 | DELETE_LOG  | myschema1   | mytbl2b    |                       |                4050 |                 2 |            1 |                                                                                                                                         |                       1 |                    1 |             2
         4020 | SET_FK_IMM  | myschema1   | mytbl4     | mytbl4_col43_fkey     |                     |                 1 |            1 |                                                                                                                                         |                       1 |                    2 |              
         4020 | ENA_LOG_TRG | myschema1   | mytbl2     |                       |                     |                 1 |            1 |                                                                                                                                         |                         |                    2 |              
         4020 | ENA_LOG_TRG | myschema1   | mytbl2b    |                       |                     |                 2 |            1 |                                                                                                                                         |                         |                    2 |              
         4020 | CTRL+DBLINK |             |            |                       |                     |                   |              |                                                                                                                                         |                      10 |                    2 |              
(116 rows)

select rlbt_step, rlbt_schema, rlbt_table, rlbt_object, rlbt_rlbk_id, rlbt_quantity from emaj.emaj_rlbk_stat
  order by rlbt_rlbk_id, rlbt_step, rlbt_schema, rlbt_table, rlbt_object;
  rlbt_step  | rlbt_schema | rlbt_table |    rlbt_object    | rlbt_rlbk_id | rlbt_quantity 
-------------+-------------+------------+-------------------+--------------+---------------
 DIS_LOG_TRG |             |            |                   |         4009 |             2
 DROP_FK     |             |            |                   |         4009 |             1
 SET_FK_DEF  |             |            |                   |         4009 |             1
 RLBK_TABLE  | myschema1   | myTbl3     |                   |         4009 |            10
 RLBK_TABLE  | myschema1   | mytbl4     |                   |         4009 |             2
 DELETE_LOG  | myschema1   | myTbl3     |                   |         4009 |            10
 DELETE_LOG  | myschema1   | mytbl4     |                   |         4009 |             2
 SET_FK_IMM  | myschema1   | mytbl4     | mytbl4_col43_fkey |         4009 |             2
 ADD_FK      | myschema1   | mytbl4     | mytbl4_col44_fkey |         4009 |             0
 ENA_LOG_TRG |             |            |                   |         4009 |             2
 CTRL+DBLINK |             |            |                   |         4009 |            12
 DIS_APP_TRG |             |            |                   |         4010 |             1
 DIS_LOG_TRG |             |            |                   |         4010 |             3
 DROP_FK     |             |            |                   |         4010 |             1
 SET_FK_DEF  |             |            |                   |         4010 |             1
 RLBK_TABLE  | myschema1   | mytbl1     |                   |         4010 |            15
 RLBK_TABLE  | myschema1   | mytbl2     |                   |         4010 |             6
 RLBK_TABLE  | myschema1   | mytbl2b    |                   |         4010 |             6
 DELETE_LOG  | myschema1   | mytbl1     |                   |         4010 |            15
 DELETE_LOG  | myschema1   | mytbl2     |                   |         4010 |             6
 DELETE_LOG  | myschema1   | mytbl2b    |                   |         4010 |             6
 SET_FK_IMM  | myschema1   | mytbl4     | mytbl4_col43_fkey |         4010 |             6
 ADD_FK      | myschema1   | mytbl4     | mytbl4_col44_fkey |         4010 |             0
 ENA_APP_TRG |             |            |                   |         4010 |             1
 ENA_LOG_TRG |             |            |                   |         4010 |             3
 CTRL+DBLINK |             |            |                   |         4010 |            18
 DROP_FK     |             |            |                   |         4011 |             1
 SET_FK_DEF  |             |            |                   |         4011 |             1
 RLBK_TABLE  | myschema1   | myTbl3     |                   |         4011 |            10
 RLBK_TABLE  | myschema1   | mytbl4     |                   |         4011 |             1
 SET_FK_IMM  | myschema1   | mytbl4     | mytbl4_col43_fkey |         4011 |             1
 ADD_FK      | myschema1   | mytbl4     | mytbl4_col44_fkey |         4011 |             0
 CTRL+DBLINK |             |            |                   |         4011 |             6
 DIS_APP_TRG |             |            |                   |         4012 |             1
 DROP_FK     |             |            |                   |         4012 |             1
 SET_FK_DEF  |             |            |                   |         4012 |             1
 RLBK_TABLE  | myschema1   | myTbl3     |                   |         4012 |            20
 RLBK_TABLE  | myschema1   | mytbl1     |                   |         4012 |            15
 RLBK_TABLE  | myschema1   | mytbl2     |                   |         4012 |             2
 RLBK_TABLE  | myschema1   | mytbl2b    |                   |         4012 |             2
 RLBK_TABLE  | myschema1   | mytbl4     |                   |         4012 |             2
 SET_FK_IMM  | myschema1   | mytbl4     | mytbl4_col43_fkey |         4012 |             4
 ADD_FK      | myschema1   | mytbl4     | mytbl4_col44_fkey |         4012 |             0
 ENA_APP_TRG |             |            |                   |         4012 |             1
 CTRL+DBLINK |             |            |                   |         4012 |            11
 DIS_LOG_TRG |             |            |                   |         4013 |             5
 DROP_FK     |             |            |                   |         4013 |             1
 SET_FK_DEF  |             |            |                   |         4013 |             1
 RLBK_TABLE  | myschema1   | myTbl3     |                   |         4013 |            10
 RLBK_TABLE  | myschema1   | mytbl1     |                   |         4013 |            10
 RLBK_TABLE  | myschema1   | mytbl2     |                   |         4013 |             2
 RLBK_TABLE  | myschema1   | mytbl2b    |                   |         4013 |             2
 RLBK_TABLE  | myschema1   | mytbl4     |                   |         4013 |             1
 DELETE_LOG  | myschema1   | myTbl3     |                   |         4013 |            10
 DELETE_LOG  | myschema1   | mytbl1     |                   |         4013 |            10
 DELETE_LOG  | myschema1   | mytbl2     |                   |         4013 |             2
 DELETE_LOG  | myschema1   | mytbl2b    |                   |         4013 |             2
 DELETE_LOG  | myschema1   | mytbl4     |                   |         4013 |             1
 SET_FK_IMM  | myschema1   | mytbl4     | mytbl4_col43_fkey |         4013 |             3
 ADD_FK      | myschema1   | mytbl4     | mytbl4_col44_fkey |         4013 |             0
 ENA_LOG_TRG |             |            |                   |         4013 |             5
 CTRL+DBLINK |             |            |                   |         4013 |            24
 DIS_APP_TRG |             |            |                   |         4016 |             1
 RLBK_TABLE  | myschema4   | mytblc1    |                   |         4016 |             1
 RLBK_TABLE  | myschema4   | mytblc2    |                   |         4016 |             1
 RLBK_TABLE  | myschema4   | mytblm     |                   |         4016 |             1
 ENA_APP_TRG |             |            |                   |         4016 |             1
 CTRL+DBLINK |             |            |                   |         4016 |             5
 DIS_APP_TRG |             |            |                   |         4017 |             1
 DIS_LOG_TRG |             |            |                   |         4017 |             3
 RLBK_TABLE  | myschema4   | mytblc1    |                   |         4017 |             3
 RLBK_TABLE  | myschema4   | mytblc2    |                   |         4017 |             3
 RLBK_TABLE  | myschema4   | mytblm     |                   |         4017 |             3
 DELETE_LOG  | myschema4   | mytblc1    |                   |         4017 |             3
 DELETE_LOG  | myschema4   | mytblc2    |                   |         4017 |             3
 DELETE_LOG  | myschema4   | mytblm     |                   |         4017 |             3
 ENA_APP_TRG |             |            |                   |         4017 |             1
 ENA_LOG_TRG |             |            |                   |         4017 |             3
 CTRL+DBLINK |             |            |                   |         4017 |            14
 DROP_FK     |             |            |                   |         4019 |             1
 SET_FK_DEF  |             |            |                   |         4019 |             1
 RLBK_TABLE  | myschema1   | mytbl1     |                   |         4019 |            13
 RLBK_TABLE  | myschema1   | mytbl2     |                   |         4019 |             2
 RLBK_TABLE  | myschema1   | mytbl2b    |                   |         4019 |             2
 SET_FK_IMM  | myschema1   | mytbl4     | mytbl4_col43_fkey |         4019 |             2
 ADD_FK      | myschema1   | mytbl4     | mytbl4_col44_fkey |         4019 |             0
 CTRL+DBLINK |             |            |                   |         4019 |             7
 DIS_LOG_TRG |             |            |                   |         4020 |             2
 SET_FK_DEF  |             |            |                   |         4020 |             1
 RLBK_TABLE  | myschema1   | mytbl2     |                   |         4020 |             1
 RLBK_TABLE  | myschema1   | mytbl2b    |                   |         4020 |             1
 DELETE_LOG  | myschema1   | mytbl2     |                   |         4020 |             1
 DELETE_LOG  | myschema1   | mytbl2b    |                   |         4020 |             1
 SET_FK_IMM  | myschema1   | mytbl4     | mytbl4_col43_fkey |         4020 |             1
 ENA_LOG_TRG |             |            |                   |         4020 |             2
 CTRL+DBLINK |             |            |                   |         4020 |            10
(96 rows)

-----------------------------
-- test end: reset history and force sequences id
-----------------------------
select emaj.emaj_enable_protection_by_event_triggers();
 emaj_enable_protection_by_event_triggers 
------------------------------------------
                                        3
(1 row)

select time_id, time_last_emaj_gid, time_event from emaj.emaj_time_stamp where time_id >= 4000 order by time_id;
 time_id | time_last_emaj_gid | time_event 
---------+--------------------+------------
    4002 |            4000000 | M
    4003 |            4000000 | M
    4004 |            4000000 | M
    4005 |            4000000 | M
    4006 |            4000000 | R
    4007 |            4000000 | C
    4008 |            4000000 | D
    4017 |            4000000 | R
    4018 |            4000000 | R
    4019 |            4000000 | M
    4020 |            4000000 | R
    4021 |            4000000 | R
    4022 |            4000000 | R
    4023 |            4000000 | M
    4024 |            4000000 | R
    4025 |            4000000 | M
    4026 |            4000000 | M
    4027 |            4000000 | M
    4028 |            4000000 | M
    4029 |            4000027 | M
    4030 |            4000039 | M
    4031 |            4000039 | R
    4032 |            4000039 | R
    4033 |            4000039 | M
    4034 |            4000039 | M
    4035 |            4000058 | M
    4036 |            4000069 | M
    4037 |            4000069 | R
    4038 |            4000080 | M
    4039 |            4000080 | R
    4040 |            4000094 | M
    4041 |            4000094 | R
    4042 |            4000094 | R
    4043 |            4000094 | R
    4044 |            4000094 | M
    4045 |            4000094 | M
    4046 |            4000097 | M
    4047 |            4000103 | R
    4048 |            4000106 | M
    4049 |            4000106 | R
    4050 |            4000106 | M
    4051 |            4000106 | R
    4052 |            4000106 | M
    4053 |            4000106 | M
    4054 |            4000121 | M
    4055 |            4000123 | R
    4056 |            4000138 | M
    4057 |            4000140 | R
    4061 |            4000141 | R
(49 rows)

select hist_id, hist_function, hist_event, hist_object, regexp_replace(regexp_replace(hist_wording,E'\\d\\d\.\\d\\d\\.\\d\\d\\.\\d\\d\\d\\d','%','g'),E'\\[.+\\]','(timestamp)','g'), hist_user from 
  (select * from emaj.emaj_hist where hist_id >= 4000 order by hist_id) as t;
 hist_id |     hist_function      |       hist_event        |         hist_object          |                          regexp_replace                          | hist_user 
---------+------------------------+-------------------------+------------------------------+------------------------------------------------------------------+-----------
    4000 | DISABLE_PROTECTION     | EVENT TRIGGERS DISABLED |                              | emaj_protection_trg, emaj_sql_drop_trg, emaj_table_rewrite_trg   | postgres
    4013 | START_GROUP            | BEGIN                   | myGroup1                     | With log reset                                                   | postgres
    4014 | LOCK_GROUP             | BEGIN                   | myGroup1                     |                                                                  | postgres
    4015 | LOCK_GROUP             | END                     | myGroup1                     | 5 tables locked, 0 deadlock(s)                                   | postgres
    4016 | SET_MARK_GROUP         | BEGIN                   | myGroup1                     | Mark11                                                           | postgres
    4017 | SET_MARK_GROUP         | END                     | myGroup1                     | Mark11                                                           | postgres
    4018 | START_GROUP            | END                     | myGroup1                     | 7 tables/sequences processed                                     | postgres
    4019 | START_GROUP            | BEGIN                   | myGroup2                     | With log reset                                                   | postgres
    4020 | LOCK_GROUP             | BEGIN                   | myGroup2                     |                                                                  | postgres
    4021 | LOCK_GROUP             | END                     | myGroup2                     | 8 tables locked, 0 deadlock(s)                                   | postgres
    4022 | SET_MARK_GROUP         | BEGIN                   | myGroup2                     | Mark21                                                           | postgres
    4023 | SET_MARK_GROUP         | END                     | myGroup2                     | Mark21                                                           | postgres
    4024 | START_GROUP            | END                     | myGroup2                     | 10 tables/sequences processed                                    | postgres
    4025 | SET_MARK_GROUP         | BEGIN                   | myGroup1                     |                                                                  | postgres
    4026 | LOCK_GROUP             | BEGIN                   | myGroup1                     |                                                                  | postgres
    4027 | LOCK_GROUP             | END                     | myGroup1                     | 5 tables locked, 0 deadlock(s)                                   | postgres
    4028 | SET_MARK_GROUP         | END                     | myGroup1                     | Different_Mark                                                   | postgres
    4029 | SET_MARK_GROUP         | BEGIN                   | myGroup2                     |                                                                  | postgres
    4030 | LOCK_GROUP             | BEGIN                   | myGroup2                     |                                                                  | postgres
    4031 | LOCK_GROUP             | END                     | myGroup2                     | 8 tables locked, 0 deadlock(s)                                   | postgres
    4032 | SET_MARK_GROUP         | END                     | myGroup2                     | Different_Mark                                                   | postgres
    4033 | PROTECT_GROUP          |                         | myGroup1                     | Status 1                                                         | postgres
    4034 | PROTECT_GROUP          |                         | myGroup2                     | Status 1                                                         | postgres
    4035 | UNPROTECT_GROUP        |                         | myGroup1                     | Status 1                                                         | postgres
    4036 | UNPROTECT_GROUP        |                         | myGroup2                     | Status 1                                                         | postgres
    4037 | ROLLBACK_GROUP         | BEGIN                   | myGroup1                     | Unlogged rollback to mark Different_Mark (timestamp)             | postgres
    4038 | DBLINK_OPEN_CNX        |                         | rlbk#1                       | Status = -5                                                      | postgres
    4039 | LOCK_GROUP             | BEGIN                   | myGroup1                     | Rollback session #1                                              | postgres
    4040 | LOCK_GROUP             | END                     | myGroup1                     | Rollback session #1: 5 tables locked, 0 deadlock(s)              | postgres
    4041 | ROLLBACK_SEQUENCE      |                         | myschema1."myTbl3_col31_seq" |                                                                  | postgres
    4042 | ROLLBACK_SEQUENCE      |                         | myschema1.mytbl2b_col20_seq  |                                                                  | postgres
    4043 | ROLLBACK_GROUP         | NOTICE                  | Rollback id 4000             | 0 / 5 tables effectively processed.                              | postgres
    4044 | ROLLBACK_GROUP         | NOTICE                  | Rollback id 4000             | 2 sequences processed.                                           | postgres
    4045 | ROLLBACK_GROUP         | END                     | myGroup1                     | Rollback_id 4000, 0 tables and 2 sequences effectively processed | postgres
    4046 | CREATE_GROUP           | BEGIN                   | auditOnlyEmptyGroup          | audit_only                                                       | postgres
    4047 | CREATE_GROUP           | END                     | auditOnlyEmptyGroup          |                                                                  | postgres
    4048 | DROP_GROUP             | BEGIN                   | auditOnlyEmptyGroup          |                                                                  | postgres
    4049 | DROP_GROUP             | END                     | auditOnlyEmptyGroup          | 0 tables/sequences processed                                     | postgres
    4100 | ROLLBACK_GROUP         | BEGIN                   | myGroup1                     | Unlogged rollback to mark Different_Mark (timestamp)             | postgres
    4101 | DBLINK_OPEN_CNX        |                         | rlbk#1                       | Status = -1                                                      | postgres
    4102 | LOCK_GROUP             | BEGIN                   | myGroup1                     | Rollback session #1                                              | postgres
    4103 | LOCK_GROUP             | END                     | myGroup1                     | Rollback session #1: 5 tables locked, 0 deadlock(s)              | postgres
    4104 | ROLLBACK_SEQUENCE      |                         | myschema1."myTbl3_col31_seq" |                                                                  | postgres
    4105 | ROLLBACK_SEQUENCE      |                         | myschema1.mytbl2b_col20_seq  |                                                                  | postgres
    4106 | ROLLBACK_GROUP         | NOTICE                  | Rollback id 4003             | 0 / 5 tables effectively processed.                              | postgres
    4107 | ROLLBACK_GROUP         | NOTICE                  | Rollback id 4003             | 2 sequences processed.                                           | postgres
    4108 | ROLLBACK_GROUP         | END                     | myGroup1                     | Rollback_id 4003, 0 tables and 2 sequences effectively processed | postgres
    4109 | ROLLBACK_GROUP         | BEGIN                   | myGroup2                     | Unlogged rollback to mark Mark21 (timestamp)                     | postgres
    4110 | DBLINK_OPEN_CNX        |                         | rlbk#1                       | Status = -1                                                      | postgres
    4111 | LOCK_GROUP             | BEGIN                   | myGroup2                     | Rollback session #1                                              | postgres
    4112 | LOCK_GROUP             | END                     | myGroup2                     | Rollback session #1: 8 tables locked, 0 deadlock(s)              | postgres
    4113 | ROLLBACK_GROUP         | MARK DELETED            | myGroup2                     | mark Different_Mark is deleted                                   | postgres
    4114 | ROLLBACK_SEQUENCE      |                         | myschema2."myTbl3_col31_seq" |                                                                  | postgres
    4115 | ROLLBACK_SEQUENCE      |                         | myschema2.myseq1             |                                                                  | postgres
    4116 | ROLLBACK_GROUP         | NOTICE                  | Rollback id 4004             | 0 / 8 tables effectively processed.                              | postgres
    4117 | ROLLBACK_GROUP         | NOTICE                  | Rollback id 4004             | 2 sequences processed.                                           | postgres
    4118 | ROLLBACK_GROUP         | END                     | myGroup2                     | Rollback_id 4004, 0 tables and 2 sequences effectively processed | postgres
    4119 | SET_MARK_GROUPS        | BEGIN                   | myGroup1,myGroup2            | Mark1B                                                           | postgres
    4120 | LOCK_GROUPS            | BEGIN                   | myGroup1,myGroup2            |                                                                  | postgres
    4121 | LOCK_GROUPS            | END                     | myGroup1,myGroup2            | 13 tables locked, 0 deadlock(s)                                  | postgres
    4122 | SET_MARK_GROUPS        | END                     | myGroup1,myGroup2            | Mark1B                                                           | postgres
    4123 | ROLLBACK_GROUPS        | BEGIN                   | myGroup1,myGroup2            | Unlogged rollback to mark Mark1B (timestamp)                     | postgres
    4124 | DBLINK_OPEN_CNX        |                         | rlbk#1                       | Status = -5                                                      | postgres
    4125 | LOCK_GROUP             | BEGIN                   | myGroup1,myGroup2            | Rollback session #1                                              | postgres
    4126 | LOCK_GROUP             | END                     | myGroup1,myGroup2            | Rollback session #1: 13 tables locked, 0 deadlock(s)             | postgres
    4127 | ROLLBACK_SEQUENCE      |                         | myschema1."myTbl3_col31_seq" |                                                                  | postgres
    4128 | ROLLBACK_SEQUENCE      |                         | myschema1.mytbl2b_col20_seq  |                                                                  | postgres
    4129 | ROLLBACK_SEQUENCE      |                         | myschema2."myTbl3_col31_seq" |                                                                  | postgres
    4130 | ROLLBACK_SEQUENCE      |                         | myschema2.myseq1             |                                                                  | postgres
    4131 | ROLLBACK_GROUPS        | NOTICE                  | Rollback id 4005             | 0 / 13 tables effectively processed.                             | postgres
    4132 | ROLLBACK_GROUPS        | NOTICE                  | Rollback id 4005             | 4 sequences processed.                                           | postgres
    4133 | ROLLBACK_GROUPS        | END                     | myGroup1,myGroup2            | Rollback_id 4005, 0 tables and 4 sequences effectively processed | postgres
    4134 |                        | INSERTED PARAMETER      | dblink_user_password         | <masked data>                                                    | postgres
    4135 | ROLLBACK_GROUPS        | BEGIN                   | myGroup1,myGroup2            | Unlogged rollback to mark Mark1B (timestamp)                     | postgres
    4136 | DBLINK_OPEN_CNX        |                         | rlbk#1                       | Status = -6                                                      | postgres
    4137 | LOCK_GROUP             | BEGIN                   | myGroup1,myGroup2            | Rollback session #1                                              | postgres
    4138 | LOCK_GROUP             | END                     | myGroup1,myGroup2            | Rollback session #1: 13 tables locked, 0 deadlock(s)             | postgres
    4139 | ROLLBACK_SEQUENCE      |                         | myschema1."myTbl3_col31_seq" |                                                                  | postgres
    4140 | ROLLBACK_SEQUENCE      |                         | myschema1.mytbl2b_col20_seq  |                                                                  | postgres
    4141 | ROLLBACK_SEQUENCE      |                         | myschema2."myTbl3_col31_seq" |                                                                  | postgres
    4142 | ROLLBACK_SEQUENCE      |                         | myschema2.myseq1             |                                                                  | postgres
    4143 | ROLLBACK_GROUPS        | NOTICE                  | Rollback id 4006             | 0 / 13 tables effectively processed.                             | postgres
    4144 | ROLLBACK_GROUPS        | NOTICE                  | Rollback id 4006             | 4 sequences processed.                                           | postgres
    4145 | ROLLBACK_GROUPS        | END                     | myGroup1,myGroup2            | Rollback_id 4006, 0 tables and 4 sequences effectively processed | postgres
    4146 | ROLLBACK_GROUPS        | BEGIN                   | myGroup1,myGroup2            | Logged rollback to mark Mark1B (timestamp)                       | postgres
    4147 | DBLINK_OPEN_CNX        |                         | rlbk#1                       | Status = -4                                                      | postgres
    4148 | LOCK_GROUP             | BEGIN                   | myGroup1,myGroup2            | Rollback session #1                                              | postgres
    4149 | LOCK_GROUP             | END                     | myGroup1,myGroup2            | Rollback session #1: 13 tables locked, 0 deadlock(s)             | postgres
    4150 | SET_MARK_GROUPS        | BEGIN                   | myGroup1,myGroup2            | RLBK_Mark1B_%_START                                              | postgres
    4151 | SET_MARK_GROUPS        | END                     | myGroup1,myGroup2            | RLBK_Mark1B_%_START                                              | postgres
    4152 | ROLLBACK_SEQUENCE      |                         | myschema1."myTbl3_col31_seq" |                                                                  | postgres
    4153 | ROLLBACK_SEQUENCE      |                         | myschema1.mytbl2b_col20_seq  |                                                                  | postgres
    4154 | ROLLBACK_SEQUENCE      |                         | myschema2."myTbl3_col31_seq" |                                                                  | postgres
    4155 | ROLLBACK_SEQUENCE      |                         | myschema2.myseq1             |                                                                  | postgres
    4156 | SET_MARK_GROUPS        | BEGIN                   | myGroup1,myGroup2            | RLBK_Mark1B_%_DONE                                               | postgres
    4157 | SET_MARK_GROUPS        | END                     | myGroup1,myGroup2            | RLBK_Mark1B_%_DONE                                               | postgres
    4158 | ROLLBACK_GROUPS        | NOTICE                  | Rollback id 4007             | 0 / 13 tables effectively processed.                             | postgres
    4159 | ROLLBACK_GROUPS        | NOTICE                  | Rollback id 4007             | 4 sequences processed.                                           | postgres
    4160 | ROLLBACK_GROUPS        | END                     | myGroup1,myGroup2            | Rollback_id 4007, 0 tables and 4 sequences effectively processed | postgres
    4161 |                        | UPDATED PARAMETER       | dblink_user_password         | <masked data>                                                    | postgres
    4162 | ROLLBACK_GROUPS        | BEGIN                   | myGroup1,myGroup2            | Logged rollback to mark Mark1B (timestamp)                       | postgres
    4163 | DBLINK_OPEN_CNX        |                         | rlbk#1                       | Status = 1                                                       | postgres
    4164 | LOCK_GROUP             | BEGIN                   | myGroup1,myGroup2            | Rollback session #1                                              | postgres
    4165 | LOCK_GROUP             | END                     | myGroup1,myGroup2            | Rollback session #1: 13 tables locked, 0 deadlock(s)             | postgres
    4166 | SET_MARK_GROUPS        | BEGIN                   | myGroup1,myGroup2            | RLBK_Mark1B_%_START                                              | postgres
    4167 | SET_MARK_GROUPS        | END                     | myGroup1,myGroup2            | RLBK_Mark1B_%_START                                              | postgres
    4168 | ROLLBACK_SEQUENCE      |                         | myschema1."myTbl3_col31_seq" |                                                                  | postgres
    4169 | ROLLBACK_SEQUENCE      |                         | myschema1.mytbl2b_col20_seq  |                                                                  | postgres
    4170 | ROLLBACK_SEQUENCE      |                         | myschema2."myTbl3_col31_seq" |                                                                  | postgres
    4171 | ROLLBACK_SEQUENCE      |                         | myschema2.myseq1             |                                                                  | postgres
    4172 | SET_MARK_GROUPS        | BEGIN                   | myGroup1,myGroup2            | RLBK_Mark1B_%_DONE                                               | postgres
    4173 | SET_MARK_GROUPS        | END                     | myGroup1,myGroup2            | RLBK_Mark1B_%_DONE                                               | postgres
    4174 | ROLLBACK_GROUPS        | NOTICE                  | Rollback id 4008             | 0 / 13 tables effectively processed.                             | postgres
    4175 | ROLLBACK_GROUPS        | NOTICE                  | Rollback id 4008             | 4 sequences processed.                                           | postgres
    4176 | DBLINK_CLOSE_CNX       |                         | rlbk#1                       |                                                                  | postgres
    4177 | ROLLBACK_GROUPS        | END                     | myGroup1,myGroup2            | Rollback_id 4008, 0 tables and 4 sequences effectively processed | postgres
    4178 | STOP_GROUPS            | BEGIN                   | myGroup1,myGroup2            |                                                                  | postgres
    4179 | LOCK_GROUPS            | BEGIN                   | myGroup1,myGroup2            |                                                                  | postgres
    4180 | LOCK_GROUPS            | END                     | myGroup1,myGroup2            | 13 tables locked, 0 deadlock(s)                                  | postgres
    4181 | SET_MARK_GROUPS        | BEGIN                   | myGroup1,myGroup2            | STOP_%                                                           | postgres
    4182 | CLEANUP_RLBK_STATE     |                         | Rollback id 4008             | set to COMMITTED                                                 | postgres
    4183 | SET_MARK_GROUPS        | END                     | myGroup1,myGroup2            | STOP_%                                                           | postgres
    4184 | STOP_GROUPS            | END                     | myGroup1,myGroup2            | 17 tables/sequences processed                                    | postgres
    4185 | START_GROUP            | BEGIN                   | myGroup1                     | With log reset                                                   | postgres
    4186 | LOCK_GROUP             | BEGIN                   | myGroup1                     |                                                                  | postgres
    4187 | LOCK_GROUP             | END                     | myGroup1                     | 5 tables locked, 0 deadlock(s)                                   | postgres
    4188 | SET_MARK_GROUP         | BEGIN                   | myGroup1                     | Mark11                                                           | postgres
    4189 | SET_MARK_GROUP         | END                     | myGroup1                     | Mark11                                                           | postgres
    4190 | START_GROUP            | END                     | myGroup1                     | 7 tables/sequences processed                                     | postgres
    4191 | START_GROUP            | BEGIN                   | myGroup2                     | With log reset                                                   | postgres
    4192 | LOCK_GROUP             | BEGIN                   | myGroup2                     |                                                                  | postgres
    4193 | LOCK_GROUP             | END                     | myGroup2                     | 8 tables locked, 0 deadlock(s)                                   | postgres
    4194 | SET_MARK_GROUP         | BEGIN                   | myGroup2                     | Mark21                                                           | postgres
    4195 | SET_MARK_GROUP         | END                     | myGroup2                     | Mark21                                                           | postgres
    4196 | START_GROUP            | END                     | myGroup2                     | 10 tables/sequences processed                                    | postgres
    4197 | SET_MARK_GROUP         | BEGIN                   | myGroup1                     |                                                                  | postgres
    4198 | LOCK_GROUP             | BEGIN                   | myGroup1                     |                                                                  | postgres
    4199 | LOCK_GROUP             | END                     | myGroup1                     | 5 tables locked, 0 deadlock(s)                                   | postgres
    4200 | SET_MARK_GROUP         | END                     | myGroup1                     | Mark12                                                           | postgres
    4201 | SET_MARK_GROUP         | BEGIN                   | myGroup1                     |                                                                  | postgres
    4202 | LOCK_GROUP             | BEGIN                   | myGroup1                     |                                                                  | postgres
    4203 | LOCK_GROUP             | END                     | myGroup1                     | 5 tables locked, 0 deadlock(s)                                   | postgres
    4204 | SET_MARK_GROUP         | END                     | myGroup1                     | Mark13                                                           | postgres
    4205 | ROLLBACK_GROUP         | BEGIN                   | myGroup1                     | Unlogged rollback to mark Mark12 (timestamp)                     | postgres
    4206 | DBLINK_OPEN_CNX        |                         | rlbk#1                       | Status = 1                                                       | postgres
    4207 | LOCK_GROUP             | BEGIN                   | myGroup1                     | Rollback session #1                                              | postgres
    4208 | LOCK_GROUP             | END                     | myGroup1                     | Rollback session #1: 5 tables locked, 0 deadlock(s)              | postgres
    4209 | ROLLBACK_TABLE         | BEGIN                   | myschema1."myTbl3"           | All log rows with emaj_gid > 4000027 and <= 4000039              | postgres
    4210 | ROLLBACK_TABLE         | END                     | myschema1."myTbl3"           | 10 rolled back primary keys                                      | postgres
    4211 | ROLLBACK_TABLE         | BEGIN                   | myschema1.mytbl4             | All log rows with emaj_gid > 4000027 and <= 4000039              | postgres
    4212 | ROLLBACK_TABLE         | END                     | myschema1.mytbl4             | 1 rolled back primary keys                                       | postgres
    4213 | ROLLBACK_GROUP         | MARK DELETED            | myGroup1                     | mark Mark13 is deleted                                           | postgres
    4214 | ROLLBACK_SEQUENCE      |                         | myschema1."myTbl3_col31_seq" | RESTART 1                                                        | postgres
    4215 | ROLLBACK_SEQUENCE      |                         | myschema1.mytbl2b_col20_seq  |                                                                  | postgres
    4216 | ROLLBACK_GROUP         | NOTICE                  | Rollback id 4009             | 2 / 5 tables effectively processed.                              | postgres
    4217 | ROLLBACK_GROUP         | NOTICE                  | Rollback id 4009             | 2 sequences processed.                                           | postgres
    4218 | DBLINK_CLOSE_CNX       |                         | rlbk#1                       |                                                                  | postgres
    4219 | ROLLBACK_GROUP         | END                     | myGroup1                     | Rollback_id 4009, 2 tables and 2 sequences effectively processed | postgres
    4220 | ROLLBACK_GROUP         | BEGIN                   | myGroup1                     | Unlogged rollback to mark Mark11 (timestamp)                     | postgres
    4221 | DBLINK_OPEN_CNX        |                         | rlbk#1                       | Status = 1                                                       | postgres
    4222 | LOCK_GROUP             | BEGIN                   | myGroup1                     | Rollback session #1                                              | postgres
    4223 | LOCK_GROUP             | END                     | myGroup1                     | Rollback session #1: 5 tables locked, 0 deadlock(s)              | postgres
    4224 | ROLLBACK_TABLE         | BEGIN                   | myschema1.mytbl1             | All log rows with emaj_gid > 4000000 and <= 4000039              | postgres
    4225 | ROLLBACK_TABLE         | END                     | myschema1.mytbl1             | 11 rolled back primary keys                                      | postgres
    4226 | ROLLBACK_TABLE         | BEGIN                   | myschema1.mytbl2             | All log rows with emaj_gid > 4000000 and <= 4000039              | postgres
    4227 | ROLLBACK_TABLE         | END                     | myschema1.mytbl2             | 3 rolled back primary keys                                       | postgres
    4228 | ROLLBACK_TABLE         | BEGIN                   | myschema1.mytbl2b            | All log rows with emaj_gid > 4000000 and <= 4000039              | postgres
    4229 | ROLLBACK_TABLE         | END                     | myschema1.mytbl2b            | 6 rolled back primary keys                                       | postgres
    4230 | ROLLBACK_GROUP         | MARK DELETED            | myGroup1                     | mark Mark12 is deleted                                           | postgres
    4231 | ROLLBACK_SEQUENCE      |                         | myschema1."myTbl3_col31_seq" |                                                                  | postgres
    4232 | ROLLBACK_SEQUENCE      |                         | myschema1.mytbl2b_col20_seq  | RESTART 1                                                        | postgres
    4233 | ROLLBACK_GROUP         | NOTICE                  | Rollback id 4010             | 3 / 5 tables effectively processed.                              | postgres
    4234 | ROLLBACK_GROUP         | NOTICE                  | Rollback id 4010             | 2 sequences processed.                                           | postgres
    4235 | DBLINK_CLOSE_CNX       |                         | rlbk#1                       |                                                                  | postgres
    4236 | ROLLBACK_GROUP         | END                     | myGroup1                     | Rollback_id 4010, 3 tables and 2 sequences effectively processed | postgres
    4237 | STOP_GROUP             | BEGIN                   | myGroup1                     |                                                                  | postgres
    4238 | LOCK_GROUP             | BEGIN                   | myGroup1                     |                                                                  | postgres
    4239 | LOCK_GROUP             | END                     | myGroup1                     | 5 tables locked, 0 deadlock(s)                                   | postgres
    4240 | SET_MARK_GROUP         | BEGIN                   | myGroup1                     | STOP_%                                                           | postgres
    4241 | CLEANUP_RLBK_STATE     |                         | Rollback id 4009             | set to COMMITTED                                                 | postgres
    4242 | CLEANUP_RLBK_STATE     |                         | Rollback id 4010             | set to COMMITTED                                                 | postgres
    4243 | SET_MARK_GROUP         | END                     | myGroup1                     | STOP_%                                                           | postgres
    4244 | STOP_GROUP             | END                     | myGroup1                     | 7 tables/sequences processed                                     | postgres
    4245 | START_GROUP            | BEGIN                   | myGroup1                     | With log reset                                                   | postgres
    4246 | LOCK_GROUP             | BEGIN                   | myGroup1                     |                                                                  | postgres
    4247 | LOCK_GROUP             | END                     | myGroup1                     | 5 tables locked, 0 deadlock(s)                                   | postgres
    4248 | SET_MARK_GROUP         | BEGIN                   | myGroup1                     | Mark11                                                           | postgres
    4249 | SET_MARK_GROUP         | END                     | myGroup1                     | Mark11                                                           | postgres
    4250 | START_GROUP            | END                     | myGroup1                     | 7 tables/sequences processed                                     | postgres
    4251 | SET_MARK_GROUP         | BEGIN                   | myGroup1                     |                                                                  | postgres
    4252 | LOCK_GROUP             | BEGIN                   | myGroup1                     |                                                                  | postgres
    4253 | LOCK_GROUP             | END                     | myGroup1                     | 5 tables locked, 0 deadlock(s)                                   | postgres
    4254 | SET_MARK_GROUP         | END                     | myGroup1                     | Mark12                                                           | postgres
    4255 | SET_MARK_GROUP         | BEGIN                   | myGroup1                     |                                                                  | postgres
    4256 | LOCK_GROUP             | BEGIN                   | myGroup1                     |                                                                  | postgres
    4257 | LOCK_GROUP             | END                     | myGroup1                     | 5 tables locked, 0 deadlock(s)                                   | postgres
    4258 | SET_MARK_GROUP         | END                     | myGroup1                     | Mark13                                                           | postgres
    4259 | ROLLBACK_GROUP         | BEGIN                   | myGroup1                     | Logged rollback to mark Mark12 (timestamp)                       | postgres
    4260 | DBLINK_OPEN_CNX        |                         | rlbk#1                       | Status = 1                                                       | postgres
    4261 | LOCK_GROUP             | BEGIN                   | myGroup1                     | Rollback session #1                                              | postgres
    4262 | LOCK_GROUP             | END                     | myGroup1                     | Rollback session #1: 5 tables locked, 0 deadlock(s)              | postgres
    4263 | SET_MARK_GROUP         | BEGIN                   | myGroup1                     | RLBK_Mark12_%_START                                              | postgres
    4264 | SET_MARK_GROUP         | END                     | myGroup1                     | RLBK_Mark12_%_START                                              | postgres
    4265 | ROLLBACK_TABLE         | BEGIN                   | myschema1."myTbl3"           | All log rows with emaj_gid > 4000058 and <= 4000069              | postgres
    4266 | ROLLBACK_TABLE         | END                     | myschema1."myTbl3"           | 10 rolled back primary keys                                      | postgres
    4267 | ROLLBACK_TABLE         | BEGIN                   | myschema1.mytbl4             | All log rows with emaj_gid > 4000058 and <= 4000069              | postgres
    4268 | ROLLBACK_TABLE         | END                     | myschema1.mytbl4             | 1 rolled back primary keys                                       | postgres
    4269 | ROLLBACK_SEQUENCE      |                         | myschema1."myTbl3_col31_seq" | RESTART 1                                                        | postgres
    4270 | ROLLBACK_SEQUENCE      |                         | myschema1.mytbl2b_col20_seq  |                                                                  | postgres
    4271 | SET_MARK_GROUP         | BEGIN                   | myGroup1                     | RLBK_Mark12_%_DONE                                               | postgres
    4272 | SET_MARK_GROUP         | END                     | myGroup1                     | RLBK_Mark12_%_DONE                                               | postgres
    4273 | ROLLBACK_GROUP         | NOTICE                  | Rollback id 4011             | 2 / 5 tables effectively processed.                              | postgres
    4274 | ROLLBACK_GROUP         | NOTICE                  | Rollback id 4011             | 2 sequences processed.                                           | postgres
    4275 | DBLINK_CLOSE_CNX       |                         | rlbk#1                       |                                                                  | postgres
    4276 | ROLLBACK_GROUP         | END                     | myGroup1                     | Rollback_id 4011, 2 tables and 2 sequences effectively processed | postgres
    4277 | ROLLBACK_GROUP         | BEGIN                   | myGroup1                     | Logged rollback to mark Mark11 (timestamp)                       | postgres
    4278 | DBLINK_OPEN_CNX        |                         | rlbk#1                       | Status = 1                                                       | postgres
    4279 | LOCK_GROUP             | BEGIN                   | myGroup1                     | Rollback session #1                                              | postgres
    4280 | LOCK_GROUP             | END                     | myGroup1                     | Rollback session #1: 5 tables locked, 0 deadlock(s)              | postgres
    4281 | SET_MARK_GROUP         | BEGIN                   | myGroup1                     | RLBK_Mark11_%_START                                              | postgres
    4282 | CLEANUP_RLBK_STATE     |                         | Rollback id 4011             | set to COMMITTED                                                 | postgres
    4283 | SET_MARK_GROUP         | END                     | myGroup1                     | RLBK_Mark11_%_START                                              | postgres
    4284 | ROLLBACK_TABLE         | BEGIN                   | myschema1."myTbl3"           | All log rows with emaj_gid > 4000039 and <= 4000080              | postgres
    4285 | ROLLBACK_TABLE         | END                     | myschema1."myTbl3"           | 10 rolled back primary keys                                      | postgres
    4286 | ROLLBACK_TABLE         | BEGIN                   | myschema1.mytbl1             | All log rows with emaj_gid > 4000039 and <= 4000080              | postgres
    4287 | ROLLBACK_TABLE         | END                     | myschema1.mytbl1             | 11 rolled back primary keys                                      | postgres
    4288 | ROLLBACK_TABLE         | BEGIN                   | myschema1.mytbl2             | All log rows with emaj_gid > 4000039 and <= 4000080              | postgres
    4289 | ROLLBACK_TABLE         | END                     | myschema1.mytbl2             | 2 rolled back primary keys                                       | postgres
    4290 | ROLLBACK_TABLE         | BEGIN                   | myschema1.mytbl4             | All log rows with emaj_gid > 4000039 and <= 4000080              | postgres
    4291 | ROLLBACK_TABLE         | END                     | myschema1.mytbl4             | 1 rolled back primary keys                                       | postgres
    4292 | ROLLBACK_TABLE         | BEGIN                   | myschema1.mytbl2b            | All log rows with emaj_gid > 4000039 and <= 4000080              | postgres
    4293 | ROLLBACK_TABLE         | END                     | myschema1.mytbl2b            | 2 rolled back primary keys                                       | postgres
    4294 | ROLLBACK_SEQUENCE      |                         | myschema1."myTbl3_col31_seq" |                                                                  | postgres
    4295 | ROLLBACK_SEQUENCE      |                         | myschema1.mytbl2b_col20_seq  | RESTART 1                                                        | postgres
    4296 | SET_MARK_GROUP         | BEGIN                   | myGroup1                     | RLBK_Mark11_%_DONE                                               | postgres
    4297 | SET_MARK_GROUP         | END                     | myGroup1                     | RLBK_Mark11_%_DONE                                               | postgres
    4298 | ROLLBACK_GROUP         | NOTICE                  | Rollback id 4012             | 5 / 5 tables effectively processed.                              | postgres
    4299 | ROLLBACK_GROUP         | NOTICE                  | Rollback id 4012             | 2 sequences processed.                                           | postgres
    4300 | DBLINK_CLOSE_CNX       |                         | rlbk#1                       |                                                                  | postgres
    4301 | ROLLBACK_GROUP         | END                     | myGroup1                     | Rollback_id 4012, 5 tables and 2 sequences effectively processed | postgres
    4302 | ROLLBACK_GROUP         | BEGIN                   | myGroup1                     | Unlogged rollback to mark Mark13 (timestamp)                     | postgres
    4303 | DBLINK_OPEN_CNX        |                         | rlbk#1                       | Status = 1                                                       | postgres
    4304 | LOCK_GROUP             | BEGIN                   | myGroup1                     | Rollback session #1                                              | postgres
    4305 | LOCK_GROUP             | END                     | myGroup1                     | Rollback session #1: 5 tables locked, 0 deadlock(s)              | postgres
    4306 | ROLLBACK_TABLE         | BEGIN                   | myschema1."myTbl3"           | All log rows with emaj_gid > 4000069 and <= 4000094              | postgres
    4307 | ROLLBACK_TABLE         | END                     | myschema1."myTbl3"           | 10 rolled back primary keys                                      | postgres
    4308 | ROLLBACK_TABLE         | BEGIN                   | myschema1.mytbl1             | All log rows with emaj_gid > 4000069 and <= 4000094              | postgres
    4309 | ROLLBACK_TABLE         | END                     | myschema1.mytbl1             | 10 rolled back primary keys                                      | postgres
    4310 | ROLLBACK_TABLE         | BEGIN                   | myschema1.mytbl2             | All log rows with emaj_gid > 4000069 and <= 4000094              | postgres
    4311 | ROLLBACK_TABLE         | END                     | myschema1.mytbl2             | 2 rolled back primary keys                                       | postgres
    4312 | ROLLBACK_TABLE         | BEGIN                   | myschema1.mytbl4             | All log rows with emaj_gid > 4000069 and <= 4000094              | postgres
    4313 | ROLLBACK_TABLE         | END                     | myschema1.mytbl4             | 1 rolled back primary keys                                       | postgres
    4314 | ROLLBACK_TABLE         | BEGIN                   | myschema1.mytbl2b            | All log rows with emaj_gid > 4000069 and <= 4000094              | postgres
    4315 | ROLLBACK_TABLE         | END                     | myschema1.mytbl2b            | 2 rolled back primary keys                                       | postgres
    4316 | ROLLBACK_GROUP         | MARK DELETED            | myGroup1                     | mark RLBK_Mark12_%_START is deleted                              | postgres
    4317 | ROLLBACK_GROUP         | MARK DELETED            | myGroup1                     | mark RLBK_Mark12_%_DONE is deleted                               | postgres
    4318 | ROLLBACK_GROUP         | MARK DELETED            | myGroup1                     | mark RLBK_Mark11_%_START is deleted                              | postgres
    4319 | ROLLBACK_GROUP         | MARK DELETED            | myGroup1                     | mark RLBK_Mark11_%_DONE is deleted                               | postgres
    4320 | ROLLBACK_SEQUENCE      |                         | myschema1."myTbl3_col31_seq" | RESTART 11                                                       | postgres
    4321 | ROLLBACK_SEQUENCE      |                         | myschema1.mytbl2b_col20_seq  | RESTART 3                                                        | postgres
    4322 | ROLLBACK_GROUP         | NOTICE                  | Rollback id 4013             | 5 / 5 tables effectively processed.                              | postgres
    4323 | ROLLBACK_GROUP         | NOTICE                  | Rollback id 4013             | 2 sequences processed.                                           | postgres
    4324 | DBLINK_CLOSE_CNX       |                         | rlbk#1                       |                                                                  | postgres
    4325 | ROLLBACK_GROUP         | END                     | myGroup1                     | Rollback_id 4013, 5 tables and 2 sequences effectively processed | postgres
    4326 | ROLLBACK_GROUP         | BEGIN                   | emptyGroup                   | Unlogged rollback to mark EGM4 (timestamp)                       | postgres
    4327 | DBLINK_OPEN_CNX        |                         | rlbk#1                       | Status = 1                                                       | postgres
    4328 | LOCK_GROUP             | BEGIN                   | emptyGroup                   | Rollback session #1                                              | postgres
    4329 | LOCK_GROUP             | END                     | emptyGroup                   | Rollback session #1: 0 tables locked, 0 deadlock(s)              | postgres
    4330 | ROLLBACK_GROUP         | NOTICE                  | Rollback id 4014             | 0 / 0 tables effectively processed.                              | postgres
    4331 | DBLINK_CLOSE_CNX       |                         | rlbk#1                       |                                                                  | postgres
    4332 | ROLLBACK_GROUP         | END                     | emptyGroup                   | Rollback_id 4014, 0 tables and 0 sequences effectively processed | postgres
    4333 | ROLLBACK_GROUP         | BEGIN                   | emptyGroup                   | Logged rollback to mark EGM3 (timestamp)                         | postgres
    4334 | DBLINK_OPEN_CNX        |                         | rlbk#1                       | Status = 1                                                       | postgres
    4335 | LOCK_GROUP             | BEGIN                   | emptyGroup                   | Rollback session #1                                              | postgres
    4336 | LOCK_GROUP             | END                     | emptyGroup                   | Rollback session #1: 0 tables locked, 0 deadlock(s)              | postgres
    4337 | SET_MARK_GROUP         | BEGIN                   | emptyGroup                   | RLBK_EGM3_%_START                                                | postgres
    4338 | CLEANUP_RLBK_STATE     |                         | Rollback id 4012             | set to COMMITTED                                                 | postgres
    4339 | CLEANUP_RLBK_STATE     |                         | Rollback id 4013             | set to COMMITTED                                                 | postgres
    4340 | CLEANUP_RLBK_STATE     |                         | Rollback id 4014             | set to COMMITTED                                                 | postgres
    4341 | SET_MARK_GROUP         | END                     | emptyGroup                   | RLBK_EGM3_%_START                                                | postgres
    4342 | SET_MARK_GROUP         | BEGIN                   | emptyGroup                   | RLBK_EGM3_%_DONE                                                 | postgres
    4343 | SET_MARK_GROUP         | END                     | emptyGroup                   | RLBK_EGM3_%_DONE                                                 | postgres
    4344 | ROLLBACK_GROUP         | NOTICE                  | Rollback id 4015             | 0 / 0 tables effectively processed.                              | postgres
    4345 | DBLINK_CLOSE_CNX       |                         | rlbk#1                       |                                                                  | postgres
    4346 | ROLLBACK_GROUP         | END                     | emptyGroup                   | Rollback_id 4015, 0 tables and 0 sequences effectively processed | postgres
    4347 | START_GROUP            | BEGIN                   | myGroup4                     | With log reset                                                   | postgres
    4348 | LOCK_GROUP             | BEGIN                   | myGroup4                     |                                                                  | postgres
    4349 | LOCK_GROUP             | END                     | myGroup4                     | 5 tables locked, 0 deadlock(s)                                   | postgres
    4350 | SET_MARK_GROUP         | BEGIN                   | myGroup4                     | myGroup4_start                                                   | postgres
    4351 | CLEANUP_RLBK_STATE     |                         | Rollback id 4015             | set to COMMITTED                                                 | postgres
    4352 | SET_MARK_GROUP         | END                     | myGroup4                     | myGroup4_start                                                   | postgres
    4353 | START_GROUP            | END                     | myGroup4                     | 5 tables/sequences processed                                     | postgres
    4354 | SET_MARK_GROUP         | BEGIN                   | myGroup4                     |                                                                  | postgres
    4355 | LOCK_GROUP             | BEGIN                   | myGroup4                     |                                                                  | postgres
    4356 | LOCK_GROUP             | END                     | myGroup4                     | 5 tables locked, 0 deadlock(s)                                   | postgres
    4357 | SET_MARK_GROUP         | END                     | myGroup4                     | mark1                                                            | postgres
    4358 | ROLLBACK_GROUP         | BEGIN                   | myGroup4                     | Logged rollback to mark mark1 (timestamp)                        | postgres
    4359 | DBLINK_OPEN_CNX        |                         | rlbk#1                       | Status = 1                                                       | postgres
    4360 | LOCK_GROUP             | BEGIN                   | myGroup4                     | Rollback session #1                                              | postgres
    4361 | LOCK_GROUP             | END                     | myGroup4                     | Rollback session #1: 5 tables locked, 0 deadlock(s)              | postgres
    4362 | SET_MARK_GROUP         | BEGIN                   | myGroup4                     | RLBK_mark1_%_START                                               | postgres
    4363 | SET_MARK_GROUP         | END                     | myGroup4                     | RLBK_mark1_%_START                                               | postgres
    4364 | ROLLBACK_TABLE         | BEGIN                   | myschema4.mytblc1            | All log rows with emaj_gid > 4000097 and <= 4000103              | postgres
    4365 | ROLLBACK_TABLE         | END                     | myschema4.mytblc1            | 2 rolled back primary keys                                       | postgres
    4366 | ROLLBACK_TABLE         | BEGIN                   | myschema4.mytblc2            | All log rows with emaj_gid > 4000097 and <= 4000103              | postgres
    4367 | ROLLBACK_TABLE         | END                     | myschema4.mytblc2            | 2 rolled back primary keys                                       | postgres
    4368 | ROLLBACK_TABLE         | BEGIN                   | myschema4.mytblm             | All log rows with emaj_gid > 4000097 and <= 4000103              | postgres
    4369 | ROLLBACK_TABLE         | END                     | myschema4.mytblm             | 2 rolled back primary keys                                       | postgres
    4370 | SET_MARK_GROUP         | BEGIN                   | myGroup4                     | RLBK_mark1_%_DONE                                                | postgres
    4371 | SET_MARK_GROUP         | END                     | myGroup4                     | RLBK_mark1_%_DONE                                                | postgres
    4372 | ROLLBACK_GROUP         | NOTICE                  | Rollback id 4016             | 3 / 5 tables effectively processed.                              | postgres
    4373 | DBLINK_CLOSE_CNX       |                         | rlbk#1                       |                                                                  | postgres
    4374 | ROLLBACK_GROUP         | END                     | myGroup4                     | Rollback_id 4016, 3 tables and 0 sequences effectively processed | postgres
    4375 | ROLLBACK_GROUP         | BEGIN                   | myGroup4                     | Unlogged rollback to mark myGroup4_start (timestamp)             | postgres
    4376 | DBLINK_OPEN_CNX        |                         | rlbk#1                       | Status = 1                                                       | postgres
    4377 | DBLINK_OPEN_CNX        |                         | rlbk#1                       | Status = 0                                                       | postgres
    4378 | LOCK_GROUP             | BEGIN                   | myGroup4                     | Rollback session #1                                              | postgres
    4379 | LOCK_GROUP             | END                     | myGroup4                     | Rollback session #1: 5 tables locked, 0 deadlock(s)              | postgres
    4380 | ROLLBACK_TABLE         | BEGIN                   | myschema4.mytblc1            | All log rows with emaj_gid > 4000094 and <= 4000106              | postgres
    4381 | ROLLBACK_TABLE         | END                     | myschema4.mytblc1            | 2 rolled back primary keys                                       | postgres
    4382 | ROLLBACK_TABLE         | BEGIN                   | myschema4.mytblc2            | All log rows with emaj_gid > 4000094 and <= 4000106              | postgres
    4383 | ROLLBACK_TABLE         | END                     | myschema4.mytblc2            | 2 rolled back primary keys                                       | postgres
    4384 | ROLLBACK_TABLE         | BEGIN                   | myschema4.mytblm             | All log rows with emaj_gid > 4000094 and <= 4000106              | postgres
    4385 | ROLLBACK_TABLE         | END                     | myschema4.mytblm             | 2 rolled back primary keys                                       | postgres
    4386 | ROLLBACK_GROUP         | MARK DELETED            | myGroup4                     | mark mark1 is deleted                                            | postgres
    4387 | ROLLBACK_GROUP         | MARK DELETED            | myGroup4                     | mark RLBK_mark1_%_START is deleted                               | postgres
    4388 | ROLLBACK_GROUP         | MARK DELETED            | myGroup4                     | mark RLBK_mark1_%_DONE is deleted                                | postgres
    4389 | ROLLBACK_GROUP         | NOTICE                  | Rollback id 4017             | 3 / 5 tables effectively processed.                              | postgres
    4390 | DBLINK_CLOSE_CNX       |                         | rlbk#1                       |                                                                  | postgres
    4391 | ROLLBACK_GROUP         | END                     | myGroup4                     | Rollback_id 4017, 3 tables and 0 sequences effectively processed | postgres
    4393 | SET_MARK_GROUP         | BEGIN                   | myGroup1                     |                                                                  | postgres
    4394 | LOCK_GROUP             | BEGIN                   | myGroup1                     |                                                                  | postgres
    4395 | LOCK_GROUP             | END                     | myGroup1                     | 5 tables locked, 0 deadlock(s)                                   | postgres
    4396 | CLEANUP_RLBK_STATE     |                         | Rollback id 4016             | set to COMMITTED                                                 | postgres
    4397 | CLEANUP_RLBK_STATE     |                         | Rollback id 4017             | set to COMMITTED                                                 | postgres
    4398 | SET_MARK_GROUP         | END                     | myGroup1                     | Conso_M1                                                         | postgres
    4399 | ROLLBACK_GROUP         | BEGIN                   | myGroup1                     | Logged rollback to mark Conso_M1 (timestamp)                     | postgres
    4400 | DBLINK_OPEN_CNX        |                         | rlbk#1                       | Status = 1                                                       | postgres
    4401 | LOCK_GROUP             | BEGIN                   | myGroup1                     | Rollback session #1                                              | postgres
    4402 | LOCK_GROUP             | END                     | myGroup1                     | Rollback session #1: 5 tables locked, 0 deadlock(s)              | postgres
    4403 | SET_MARK_GROUP         | BEGIN                   | myGroup1                     | RLBK_Conso_M1_%_START                                            | postgres
    4404 | SET_MARK_GROUP         | END                     | myGroup1                     | RLBK_Conso_M1_%_START                                            | postgres
    4405 | ROLLBACK_SEQUENCE      |                         | myschema1."myTbl3_col31_seq" |                                                                  | postgres
    4406 | ROLLBACK_SEQUENCE      |                         | myschema1.mytbl2b_col20_seq  |                                                                  | postgres
    4407 | SET_MARK_GROUP         | BEGIN                   | myGroup1                     | RLBK_Conso_M1_%_DONE                                             | postgres
    4408 | SET_MARK_GROUP         | END                     | myGroup1                     | RLBK_Conso_M1_%_DONE                                             | postgres
    4409 | ROLLBACK_GROUP         | NOTICE                  | Rollback id 4018             | 0 / 5 tables effectively processed.                              | postgres
    4410 | ROLLBACK_GROUP         | NOTICE                  | Rollback id 4018             | 2 sequences processed.                                           | postgres
    4411 | DBLINK_CLOSE_CNX       |                         | rlbk#1                       |                                                                  | postgres
    4412 | ROLLBACK_GROUP         | END                     | myGroup1                     | Rollback_id 4018, 0 tables and 2 sequences effectively processed | postgres
    4413 | CONSOLIDATE_RLBK_GROUP | BEGIN                   | myGroup1                     | Erase all between marks Conso_M1 and RLBK_Conso_M1_%_DONE        | postgres
    4414 | CONSOLIDATE_RLBK_GROUP | END                     | myGroup1                     | 0 tables and 2 sequences processed ; 1 marks deleted             | postgres
    4415 | SET_MARK_GROUP         | BEGIN                   | myGroup1                     |                                                                  | postgres
    4416 | LOCK_GROUP             | BEGIN                   | myGroup1                     |                                                                  | postgres
    4417 | LOCK_GROUP             | END                     | myGroup1                     | 5 tables locked, 0 deadlock(s)                                   | postgres
    4418 | CLEANUP_RLBK_STATE     |                         | Rollback id 4018             | set to COMMITTED                                                 | postgres
    4419 | SET_MARK_GROUP         | END                     | myGroup1                     | Conso_M2                                                         | postgres
    4420 | SET_MARK_GROUP         | BEGIN                   | myGroup1                     |                                                                  | postgres
    4421 | LOCK_GROUP             | BEGIN                   | myGroup1                     |                                                                  | postgres
    4422 | LOCK_GROUP             | END                     | myGroup1                     | 5 tables locked, 0 deadlock(s)                                   | postgres
    4423 | SET_MARK_GROUP         | END                     | myGroup1                     | Conso_M3                                                         | postgres
    4424 | ROLLBACK_GROUP         | BEGIN                   | myGroup1                     | Logged rollback to mark Conso_M2 (timestamp)                     | postgres
    4425 | DBLINK_OPEN_CNX        |                         | rlbk#1                       | Status = 1                                                       | postgres
    4426 | LOCK_GROUP             | BEGIN                   | myGroup1                     | Rollback session #1                                              | postgres
    4427 | LOCK_GROUP             | END                     | myGroup1                     | Rollback session #1: 5 tables locked, 0 deadlock(s)              | postgres
    4428 | SET_MARK_GROUP         | BEGIN                   | myGroup1                     | RLBK_Conso_M2_%_START                                            | postgres
    4429 | SET_MARK_GROUP         | END                     | myGroup1                     | RLBK_Conso_M2_%_START                                            | postgres
    4430 | ROLLBACK_TABLE         | BEGIN                   | myschema1.mytbl1             | All log rows with emaj_gid > 4000106 and <= 4000123              | postgres
    4431 | ROLLBACK_TABLE         | END                     | myschema1.mytbl1             | 12 rolled back primary keys                                      | postgres
    4432 | ROLLBACK_TABLE         | BEGIN                   | myschema1.mytbl2             | All log rows with emaj_gid > 4000106 and <= 4000123              | postgres
    4433 | ROLLBACK_TABLE         | END                     | myschema1.mytbl2             | 1 rolled back primary keys                                       | postgres
    4434 | ROLLBACK_TABLE         | BEGIN                   | myschema1.mytbl2b            | All log rows with emaj_gid > 4000106 and <= 4000123              | postgres
    4435 | ROLLBACK_TABLE         | END                     | myschema1.mytbl2b            | 2 rolled back primary keys                                       | postgres
    4436 | ROLLBACK_SEQUENCE      |                         | myschema1."myTbl3_col31_seq" |                                                                  | postgres
    4437 | ROLLBACK_SEQUENCE      |                         | myschema1.mytbl2b_col20_seq  | RESTART 3                                                        | postgres
    4438 | SET_MARK_GROUP         | BEGIN                   | myGroup1                     | RLBK_Conso_M2_%_DONE                                             | postgres
    4439 | SET_MARK_GROUP         | END                     | myGroup1                     | RLBK_Conso_M2_%_DONE                                             | postgres
    4440 | ROLLBACK_GROUP         | NOTICE                  | Rollback id 4019             | 3 / 5 tables effectively processed.                              | postgres
    4441 | ROLLBACK_GROUP         | NOTICE                  | Rollback id 4019             | 2 sequences processed.                                           | postgres
    4442 | DBLINK_CLOSE_CNX       |                         | rlbk#1                       |                                                                  | postgres
    4443 | ROLLBACK_GROUP         | END                     | myGroup1                     | Rollback_id 4019, 3 tables and 2 sequences effectively processed | postgres
    4444 | RENAME_MARK_GROUP      | BEGIN                   | myGroup1                     | Conso_M2                                                         | postgres
    4445 | RENAME_MARK_GROUP      | END                     | myGroup1                     | Conso_M2 renamed Renamed_conso_M2                                | postgres
    4446 | RENAME_MARK_GROUP      | BEGIN                   | myGroup1                     | EMAJ_LAST_MARK                                                   | postgres
    4447 | RENAME_MARK_GROUP      | END                     | myGroup1                     | RLBK_Conso_M2_%_DONE renamed Renamed_last_mark                   | postgres
    4448 | CONSOLIDATE_RLBK_GROUP | BEGIN                   | myGroup1                     | Erase all between marks Renamed_conso_M2 and Renamed_last_mark   | postgres
    4449 | CONSOLIDATE_RLBK_GROUP | END                     | myGroup1                     | 3 tables and 2 sequences processed ; 2 marks deleted             | postgres
    4450 | CONSOLIDATE_RLBK_GROUP | BEGIN                   | myGroup1                     | Erase all between marks Renamed_conso_M2 and Renamed_last_mark   | postgres
    4451 | CONSOLIDATE_RLBK_GROUP | END                     | myGroup1                     | 0 tables and 2 sequences processed ; 0 marks deleted             | postgres
    4452 | ROLLBACK_GROUP         | BEGIN                   | myGroup1                     | Unlogged rollback to mark Conso_M1 (timestamp)                   | postgres
    4453 | DBLINK_OPEN_CNX        |                         | rlbk#1                       | Status = 1                                                       | postgres
    4454 | LOCK_GROUP             | BEGIN                   | myGroup1                     | Rollback session #1                                              | postgres
    4455 | LOCK_GROUP             | END                     | myGroup1                     | Rollback session #1: 5 tables locked, 0 deadlock(s)              | postgres
    4456 | ROLLBACK_TABLE         | BEGIN                   | myschema1.mytbl2             | All log rows with emaj_gid > 4000106 and <= 4000140              | postgres
    4457 | ROLLBACK_TABLE         | END                     | myschema1.mytbl2             | 1 rolled back primary keys                                       | postgres
    4458 | ROLLBACK_TABLE         | BEGIN                   | myschema1.mytbl2b            | All log rows with emaj_gid > 4000106 and <= 4000140              | postgres
    4459 | ROLLBACK_TABLE         | END                     | myschema1.mytbl2b            | 1 rolled back primary keys                                       | postgres
    4460 | ROLLBACK_GROUP         | MARK DELETED            | myGroup1                     | mark RLBK_Conso_M1_%_DONE is deleted                             | postgres
    4461 | ROLLBACK_GROUP         | MARK DELETED            | myGroup1                     | mark Renamed_conso_M2 is deleted                                 | postgres
    4462 | ROLLBACK_GROUP         | MARK DELETED            | myGroup1                     | mark Renamed_last_mark is deleted                                | postgres
    4463 | ROLLBACK_SEQUENCE      |                         | myschema1."myTbl3_col31_seq" |                                                                  | postgres
    4464 | ROLLBACK_SEQUENCE      |                         | myschema1.mytbl2b_col20_seq  | RESTART 3                                                        | postgres
    4465 | ROLLBACK_GROUP         | NOTICE                  | Rollback id 4020             | 2 / 5 tables effectively processed.                              | postgres
    4466 | ROLLBACK_GROUP         | NOTICE                  | Rollback id 4020             | 2 sequences processed.                                           | postgres
    4467 | DBLINK_CLOSE_CNX       |                         | rlbk#1                       |                                                                  | postgres
    4468 | ROLLBACK_GROUP         | END                     | myGroup1                     | Rollback_id 4020, 2 tables and 2 sequences effectively processed | postgres
    4499 | CLEANUP_RLBK_STATE     |                         | Rollback id 4019             | set to COMMITTED                                                 | postgres
    4500 | CLEANUP_RLBK_STATE     |                         | Rollback id 4020             | set to COMMITTED                                                 | postgres
    4501 | CLEANUP_RLBK_STATE     |                         | Rollback id 4021             | set to ABORTED                                                   | postgres
    4502 | ENABLE_PROTECTION      | EVENT TRIGGERS ENABLED  |                              | emaj_protection_trg, emaj_sql_drop_trg, emaj_table_rewrite_trg   | postgres
(410 rows)

