-- Adm1.sql : complex scenarios executed by an emaj_adm role.
--
-- Do not display DETAIL and CONTEXT outputs when an error is raised (\errverbose can be used to debug a statement).
\set VERBOSITY terse
SET datestyle TO ymd;
-- Set sequence restart value.
SELECT public.handle_emaj_sequences(12000);
 handle_emaj_sequences 
-----------------------
 
(1 row)

TRUNCATE emaj.emaj_hist;
-----------------------------
-- Grant emaj_adm role.
-----------------------------
GRANT emaj_adm TO _regress_emaj_adm1, _regress_emaj_adm2;
SELECT emaj.emaj_set_param('dblink_user_password', 'user=_regress_emaj_adm1 password=adm');
 emaj_set_param 
----------------
              1
(1 row)

--
SET session_authorization TO _regress_emaj_adm1;
-----------------------------
-- Authorized tables and views accesses.
-----------------------------
SELECT 'select ok' AS result FROM (SELECT count(*) FROM emaj.emaj_version_hist) AS t;
  result   
-----------
 select ok
(1 row)

SELECT 'select ok' AS result FROM (SELECT count(*) FROM emaj.emaj_all_param) AS t;
  result   
-----------
 select ok
(1 row)

SELECT 'select ok' AS result FROM (SELECT count(*) FROM emaj.emaj_visible_param) AS t;
  result   
-----------
 select ok
(1 row)

SELECT 'select ok' AS result FROM (SELECT count(*) FROM emaj.emaj_time_stamp) AS t;
  result   
-----------
 select ok
(1 row)

SELECT 'select ok' AS result FROM (SELECT count(*) FROM emaj.emaj_hist) AS t;
  result   
-----------
 select ok
(1 row)

SELECT 'select ok' AS result FROM (SELECT count(*) FROM emaj.emaj_group) AS t;
  result   
-----------
 select ok
(1 row)

SELECT 'select ok' AS result FROM (SELECT count(*) FROM emaj.emaj_schema) AS t;
  result   
-----------
 select ok
(1 row)

SELECT 'select ok' AS result FROM (SELECT count(*) FROM emaj.emaj_relation) AS t;
  result   
-----------
 select ok
(1 row)

SELECT 'select ok' AS result FROM (SELECT count(*) FROM emaj.emaj_rel_hist) AS t;
  result   
-----------
 select ok
(1 row)

SELECT 'select ok' AS result FROM (SELECT count(*) FROM emaj.emaj_relation_change) AS t;
  result   
-----------
 select ok
(1 row)

SELECT 'select ok' AS result FROM (SELECT count(*) FROM emaj.emaj_log_session) AS t;
  result   
-----------
 select ok
(1 row)

SELECT 'select ok' AS result FROM (SELECT count(*) FROM emaj.emaj_mark) AS t;
  result   
-----------
 select ok
(1 row)

SELECT 'select ok' AS result FROM (SELECT count(*) FROM emaj.emaj_sequence) AS t;
  result   
-----------
 select ok
(1 row)

SELECT 'select ok' AS result FROM (SELECT count(*) FROM emaj.emaj_table) AS t;
  result   
-----------
 select ok
(1 row)

SELECT 'select ok' AS result FROM (SELECT count(*) FROM emaj.emaj_seq_hole) AS t;
  result   
-----------
 select ok
(1 row)

SELECT 'select ok' AS result FROM (SELECT count(*) FROM emaj.emaj_rlbk) AS t;
  result   
-----------
 select ok
(1 row)

SELECT 'select ok' AS result FROM (SELECT count(*) FROM emaj.emaj_rlbk_session) AS t;
  result   
-----------
 select ok
(1 row)

SELECT 'select ok' AS result FROM (SELECT count(*) FROM emaj.emaj_rlbk_plan) AS t;
  result   
-----------
 select ok
(1 row)

SELECT 'select ok' AS result FROM (SELECT count(*) FROM emaj.emaj_rlbk_stat) AS t;
  result   
-----------
 select ok
(1 row)

SELECT 'select ok' AS result FROM (SELECT count(*) FROM emaj_mySchema1.myTbl1_log) AS t;
  result   
-----------
 select ok
(1 row)

-----------------------------
-- Stop, reset and drop existing groups.
-----------------------------
SELECT emaj.emaj_stop_group('myGroup1', 'Simple stop mark');
 emaj_stop_group 
-----------------
               7
(1 row)

SELECT emaj.emaj_force_stop_group('emptyGroup');
 emaj_force_stop_group 
-----------------------
                     0
(1 row)

SELECT emaj.emaj_stop_groups(emaj.emaj_get_logging_groups());
WARNING:  _check_group_names: No group to process.
 emaj_stop_groups 
------------------
                0
(1 row)

SELECT emaj.emaj_reset_group('myGroup1');
 emaj_reset_group 
------------------
                7
(1 row)

SELECT emaj.emaj_drop_group('myGroup1');
 emaj_drop_group 
-----------------
               7
(1 row)

SELECT emaj.emaj_force_drop_group('myGroup2');
 emaj_force_drop_group 
-----------------------
                     8
(1 row)

SELECT emaj.emaj_drop_group(grp) FROM unnest(emaj.emaj_get_groups()) AS grp;
 emaj_drop_group 
-----------------
               0
(1 row)

-- emaj tables.
SELECT * FROM emaj.emaj_group;
 group_name | group_is_rollbackable | group_pg_version | group_last_alter_time_id | group_is_logging | group_is_rlbk_protected | group_nb_table | group_nb_sequence | group_comment 
------------+-----------------------+------------------+--------------------------+------------------+-------------------------+----------------+-------------------+---------------
(0 rows)

SELECT * FROM emaj.emaj_schema;
 sch_name | sch_time_id 
----------+-------------
 emaj     |            
(1 row)

SELECT * FROM emaj.emaj_relation;
 rel_schema | rel_tblseq | rel_time_range | rel_group | rel_kind | rel_priority | rel_log_schema | rel_log_table | rel_log_dat_tsp | rel_log_index | rel_log_idx_tsp | rel_log_sequence | rel_log_function | rel_ignored_triggers | rel_pk_cols | rel_gen_expr_cols | rel_emaj_verb_attnum | rel_has_always_ident_col | rel_sql_rlbk_columns | rel_sql_gen_ins_col | rel_sql_gen_ins_val | rel_sql_gen_upd_set | rel_sql_gen_pk_conditions | rel_log_seq_last_value 
------------+------------+----------------+-----------+----------+--------------+----------------+---------------+-----------------+---------------+-----------------+------------------+------------------+----------------------+-------------+-------------------+----------------------+--------------------------+----------------------+---------------------+---------------------+---------------------+---------------------------+------------------------
(0 rows)

SELECT * FROM emaj.emaj_mark;
 mark_group | mark_name | mark_time_id | mark_is_rlbk_protected | mark_comment | mark_log_rows_before_next | mark_logged_rlbk_target_mark 
------------+-----------+--------------+------------------------+--------------+---------------------------+------------------------------
(0 rows)

SELECT * FROM emaj.emaj_sequence;
 sequ_schema | sequ_name | sequ_time_id | sequ_last_val | sequ_start_val | sequ_increment | sequ_max_val | sequ_min_val | sequ_cache_val | sequ_is_cycled | sequ_is_called 
-------------+-----------+--------------+---------------+----------------+----------------+--------------+--------------+----------------+----------------+----------------
(0 rows)

SELECT * FROM emaj.emaj_table;
 tbl_schema | tbl_name | tbl_time_id | tbl_pages | tbl_tuples | tbl_log_seq_last_val 
------------+----------+-------------+-----------+------------+----------------------
(0 rows)

SELECT * FROM emaj.emaj_seq_hole;
 sqhl_schema | sqhl_table | sqhl_begin_time_id | sqhl_end_time_id | sqhl_hole_size 
-------------+------------+--------------------+------------------+----------------
(0 rows)

SELECT count(*) FROM emaj.emaj_rlbk;
 count 
-------
    43
(1 row)

SELECT count(*) FROM emaj.emaj_rlbk_session;
 count 
-------
    43
(1 row)

SELECT count(*) FROM emaj.emaj_rlbk_plan;
 count 
-------
   252
(1 row)

SELECT count(*) FROM emaj.emaj_rlbk_stat;
 count 
-------
     0
(1 row)

-----------------------------
-- Cleanup application tables.
-----------------------------
RESET session_authorization;
TRUNCATE mySchema1.myTbl1, mySchema1.myTbl2, mySchema1."myTbl3", mySchema1.myTbl4, mySchema1.myTbl2b;
TRUNCATE mySchema2.myTbl1, mySchema2.myTbl2, mySchema2."myTbl3", mySchema2.myTbl4, mySchema2.myTbl5, mySchema2.myTbl6, mySchema2.myTbl7, mySchema2.myTbl8;
INSERT INTO myschema2.myTbl7 SELECT i FROM generate_series(0, 100, 1) i;
INSERT INTO myschema2.myTbl6 (col61) VALUES (0);
INSERT INTO myschema2.myTbl8 (col81) VALUES (0);
ALTER SEQUENCE mySchema2.mySeq1 restart 1000;
TRUNCATE mySchema4.myTblM, mySchema4.myTblC1, mySchema4.myTblC2;
TRUNCATE mySchema4.myTblP, mySchema4.myPartP1a, mySchema4.myPartP1b, mySchema4.myPartP2, mySchema4.myTblR1, mySchema4.myTblR2 CASCADE;
-- Analyze to get some statistics.
ANALYZE;
SET session_authorization TO _regress_emaj_adm2;
-----------------------------
-- Explicitely purge the histories.
-----------------------------
SELECT emaj.emaj_purge_histories('0 SECOND');
                                                                                    emaj_purge_histories                                                                                    
--------------------------------------------------------------------------------------------------------------------------------------------------------------------------------------------
 28 emaj_hist rows deleted ; 16 log session rows deleted ; 13 group history rows deleted ; 143 relation history rows deleted ; 95 relation changes deleted ; 43 rollback operations cleaned
(1 row)

SELECT hist_function, hist_event, hist_wording
  FROM emaj.emaj_hist ORDER BY hist_id;
  hist_function  | hist_event |                                                                                        hist_wording                                                                                        
-----------------+------------+--------------------------------------------------------------------------------------------------------------------------------------------------------------------------------------------
 PURGE_HISTORIES | BEGIN      | Retention delay @ 0
 PURGE_HISTORIES |            | 28 emaj_hist rows deleted ; 16 log session rows deleted ; 13 group history rows deleted ; 143 relation history rows deleted ; 95 relation changes deleted ; 43 rollback operations cleaned
 PURGE_HISTORIES | END        | 
(3 rows)

-----------------------------
-- Recreate and start groups.
-----------------------------
-- Set the parameter to drop the emaj_user_port column and add an 'extra_col_appname' column.
SELECT emaj.emaj_set_param('alter_log_table',
  'ADD COLUMN emaj_user_ip INET DEFAULT inet_client_addr(), ADD COLUMN extra_col_appname TEXT DEFAULT current_setting(''application_name'')');
 emaj_set_param 
----------------
              1
(1 row)

SELECT emaj.emaj_create_group('myGroup1') WHERE NOT emaj.emaj_does_exist_group('myGroup1');
 emaj_create_group 
-------------------
                 1
(1 row)

SELECT emaj.emaj_comment_group('myGroup1', 'This is group #1');
 emaj_comment_group 
--------------------
 
(1 row)

SELECT emaj.emaj_assign_table('myschema1', 'mytbl1', 'myGroup1', '{"priority":20}'::JSONB)
  WHERE emaj.emaj_get_assigned_group_table('myschema1', 'mytbl1') is NULL;
 emaj_assign_table 
-------------------
                 1
(1 row)

SELECT emaj.emaj_assign_table('myschema1', 'mytbl2', 'myGroup1', '{"log_data_tablespace":"tsplog1", "log_index_tablespace":"tsplog1"}'::JSONB);
WARNING:  _create_tbl: The table "myschema1.mytbl2" has triggers that will be automatically disabled during E-Maj rollback operations (mytbl2trg1, mytbl2trg2). Use the emaj_modify_table() function to change this behaviour.
 emaj_assign_table 
-------------------
                 1
(1 row)

SELECT emaj.emaj_assign_table('myschema1', 'mytbl2b', 'myGroup1', '{"log_data_tablespace":"tsp log''2", "log_index_tablespace":"tsp log''2"}'::JSONB);
 emaj_assign_table 
-------------------
                 1
(1 row)

SELECT emaj.emaj_assign_table('myschema1', 'myTbl3', 'myGroup1', '{"priority":10, "log_data_tablespace":"tsplog1"}'::JSONB);
 emaj_assign_table 
-------------------
                 1
(1 row)

SELECT emaj.emaj_assign_table('myschema1', 'mytbl4', 'myGroup1', '{"priority":20, "log_data_tablespace":"tsplog1", "log_index_tablespace":"tsp log''2"}'::JSONB);
 emaj_assign_table 
-------------------
                 1
(1 row)

SELECT emaj.emaj_assign_sequences('myschema1', '.*', NULL, 'myGroup1');
 emaj_assign_sequences 
-----------------------
                     2
(1 row)

SELECT emaj.emaj_create_group('myGroup2', TRUE, 'This is group #2');
 emaj_create_group 
-------------------
                 1
(1 row)

SELECT emaj.emaj_assign_tables('myschema2', '.*', 'mytbl[7,8]', 'myGroup2');
 emaj_assign_tables 
--------------------
                  6
(1 row)

SELECT emaj.emaj_assign_sequences('myschema2', '.*', 'myseq2', 'myGroup2');
 emaj_assign_sequences 
-----------------------
                     2
(1 row)

SELECT emaj.emaj_assign_sequence('myschema2', 'myseq1', 'myGroup2')
  WHERE emaj.emaj_get_assigned_group_sequence('myschema2', 'myseq1') is NULL;
 emaj_assign_sequence 
----------------------
(0 rows)

SELECT emaj.emaj_create_group('emptyGroup');
 emaj_create_group 
-------------------
                 1
(1 row)

-- Try to rename the last mark for a group that has no mark.
SELECT emaj.emaj_rename_mark_group('myGroup2', 'EMAJ_LAST_MARK', 'new_mark_name');
ERROR:  _check_mark_name: The group "myGroup2" has no mark.
-- Force a purge of the history, the alter and the rollback tables.
SELECT emaj.emaj_set_param('history_retention', '0.1 second');
 emaj_set_param 
----------------
              1
(1 row)

SELECT pg_sleep(0.2);
 pg_sleep 
----------
 
(1 row)

SELECT emaj.emaj_start_group('myGroup1', 'M1') WHERE NOT emaj.emaj_is_logging_group('myGroup1') AND NOT emaj.emaj_does_exist_mark_group('myGroup1', 'M1');
 emaj_start_group 
------------------
                7
(1 row)

SELECT emaj.emaj_set_param('history_retention', NULL);
 emaj_set_param 
----------------
              1
(1 row)

SELECT emaj.emaj_start_group('myGroup2', 'M1');
WARNING:  _check_fk_groups: The foreign key "mytbl6_col61_fkey" on the table "myschema2.mytbl6" references the table "myschema2.mytbl7" that is outside the groups (myGroup2).
WARNING:  _check_fk_groups: The table "myschema2.mytbl6" is referenced by the foreign key "mytbl8_col81_fkey" on the table "myschema2.mytbl8" that is outside the groups (myGroup2).
 emaj_start_group 
------------------
                8
(1 row)

-- Set sequence restart value.
SELECT public.handle_emaj_sequences(12200);
 handle_emaj_sequences 
-----------------------
 
(1 row)

-----------------------------
-- Step 1 : for myGroup1, update tables and set 2 marks.
-----------------------------
--
RESET session_authorization;
SET search_path TO public, myschema1;
INSERT INTO myTbl1 SELECT i, 'ABC', E'\\014'::bytea FROM generate_series (1, 11) AS i;
UPDATE myTbl1 SET col13=E'\\034'::bytea WHERE col11 <= 3;
INSERT INTO myTbl2 VALUES (1, 'ABC', '2010-12-31');
DELETE FROM myTbl1 WHERE col11 > 10;
INSERT INTO myTbl2 VALUES (2, 'DEF', NULL);
INSERT INTO "myTbl3" (col33) SELECT generate_series(1000, 1039, 4)/100;
--
SET session_authorization TO _regress_emaj_adm2;
SELECT emaj.emaj_set_mark_group('myGroup1', 'M2');
 emaj_set_mark_group 
---------------------
                   7
(1 row)

--
RESET session_authorization;
SET search_path TO public, myschema1;
INSERT INTO myTbl4 VALUES (1, 'FK...', 1, 1, 'ABC');
INSERT INTO myTbl4 VALUES (2, 'FK...', 1, 1, 'ABC');
UPDATE myTbl4 SET col43 = 2;
INSERT INTO myTbl4 VALUES (3, 'FK...', 1, 10, 'ABC');
-- The 2 next statements activate fkey on delete and on update clauses.
DELETE FROM myTbl1 WHERE col11 = 10;
UPDATE myTbl1 SET col12='DEF' WHERE col11 <= 2;
--
SET session_authorization TO _regress_emaj_adm2;
SELECT emaj.emaj_set_mark_group('myGroup1', 'M3');
 emaj_set_mark_group 
---------------------
                   7
(1 row)

SELECT emaj.emaj_comment_mark_group('myGroup1', 'M3', 'Third mark set');
 emaj_comment_mark_group 
-------------------------
 
(1 row)

-----------------------------
-- Checking step 1.
-----------------------------
-- emaj tables.
SELECT group_name, group_is_rollbackable, group_last_alter_time_id, group_is_logging, group_is_rlbk_protected, group_nb_table, group_nb_sequence, group_comment
  FROM emaj.emaj_group ORDER BY group_name;
 group_name | group_is_rollbackable | group_last_alter_time_id | group_is_logging | group_is_rlbk_protected | group_nb_table | group_nb_sequence |  group_comment   
------------+-----------------------+--------------------------+------------------+-------------------------+----------------+-------------------+------------------
 emptyGroup | t                     |                          | f                | f                       |              0 |                 0 | 
 myGroup1   | t                     |                    12011 | t                | f                       |              5 |                 2 | This is group #1
 myGroup2   | t                     |                    12014 | t                | f                       |              6 |                 2 | This is group #2
(3 rows)

SELECT * FROM emaj.emaj_group_hist ORDER BY grph_group, grph_time_range;
 grph_group | grph_time_range | grph_is_rollbackable | grph_log_sessions 
------------+-----------------+----------------------+-------------------
 emptyGroup | [12015,)        | t                    |                 0
 myGroup1   | [12005,)        | t                    |                 1
 myGroup2   | [12012,)        | t                    |                 1
(3 rows)

SELECT mark_group, regexp_replace(mark_name, E'\\d\\d\.\\d\\d\\.\\d\\d\\.\\d\\d\\d\\d', '%', 'g'), mark_time_id, mark_is_rlbk_protected,
       mark_is_rlbk_protected, mark_comment, mark_log_rows_before_next, mark_logged_rlbk_target_mark FROM emaj.emaj_mark ORDER BY mark_time_id, mark_group;
 mark_group | regexp_replace | mark_time_id | mark_is_rlbk_protected | mark_is_rlbk_protected |  mark_comment  | mark_log_rows_before_next | mark_logged_rlbk_target_mark 
------------+----------------+--------------+------------------------+------------------------+----------------+---------------------------+------------------------------
 myGroup1   | M1             |        12016 | f                      | f                      |                |                        29 | 
 myGroup2   | M1             |        12017 | f                      | f                      |                |                           | 
 myGroup1   | M2             |        12200 | f                      | f                      |                |                        11 | 
 myGroup1   | M3             |        12201 | f                      | f                      | Third mark set |                           | 
(4 rows)

SELECT sequ_schema, sequ_name, sequ_time_id, sequ_last_val, sequ_is_called FROM emaj.emaj_sequence ORDER BY sequ_time_id, sequ_schema, sequ_name;
 sequ_schema |     sequ_name     | sequ_time_id | sequ_last_val | sequ_is_called 
-------------+-------------------+--------------+---------------+----------------
 myschema1   | myTbl3_col31_seq  |        12016 |            11 | f
 myschema1   | mytbl2b_col20_seq |        12016 |             3 | f
 myschema2   | myTbl3_col31_seq  |        12017 |            11 | f
 myschema2   | myseq1            |        12017 |          1000 | f
 myschema1   | myTbl3_col31_seq  |        12200 |            20 | t
 myschema1   | mytbl2b_col20_seq |        12200 |             4 | t
 myschema1   | myTbl3_col31_seq  |        12201 |            20 | t
 myschema1   | mytbl2b_col20_seq |        12201 |             4 | t
(8 rows)

SELECT tbl_schema, tbl_name, tbl_time_id, tbl_tuples, tbl_pages, tbl_log_seq_last_val FROM emaj.emaj_table ORDER BY tbl_time_id, tbl_schema, tbl_name;
 tbl_schema | tbl_name | tbl_time_id | tbl_tuples | tbl_pages | tbl_log_seq_last_val 
------------+----------+-------------+------------+-----------+----------------------
 myschema1  | myTbl3   |       12016 |          0 |         0 |                    0
 myschema1  | mytbl1   |       12016 |          0 |         0 |                    0
 myschema1  | mytbl2   |       12016 |          0 |         0 |                    0
 myschema1  | mytbl2b  |       12016 |          0 |         0 |                    0
 myschema1  | mytbl4   |       12016 |          0 |         0 |                    0
 myschema2  | myTbl3   |       12017 |          0 |         0 |                    0
 myschema2  | mytbl1   |       12017 |          0 |         0 |                    0
 myschema2  | mytbl2   |       12017 |          0 |         0 |                    0
 myschema2  | mytbl4   |       12017 |          0 |         0 |                    0
 myschema2  | mytbl5   |       12017 |          0 |         0 |                    0
 myschema2  | mytbl6   |       12017 |          1 |         1 |                    0
 myschema1  | myTbl3   |       12200 |          0 |         0 |                   10
 myschema1  | mytbl1   |       12200 |          0 |         0 |                   15
 myschema1  | mytbl2   |       12200 |          0 |         0 |                    2
 myschema1  | mytbl2b  |       12200 |          0 |         0 |                    2
 myschema1  | mytbl4   |       12200 |          0 |         0 |                    0
 myschema1  | myTbl3   |       12201 |          0 |         0 |                   10
 myschema1  | mytbl1   |       12201 |          0 |         0 |                   18
 myschema1  | mytbl2   |       12201 |          0 |         0 |                    2
 myschema1  | mytbl2b  |       12201 |          0 |         0 |                    2
 myschema1  | mytbl4   |       12201 |          0 |         0 |                    8
(21 rows)

SELECT time_id, time_last_emaj_gid, time_event FROM emaj.emaj_time_stamp WHERE time_id >= 12000 ORDER BY time_id;
 time_id | time_last_emaj_gid | time_event 
---------+--------------------+------------
   12000 |           12000000 | X
   12001 |           12000000 | X
   12002 |           12000000 | D
   12003 |           12000000 | D
   12004 |           12000000 | D
   12005 |           12000000 | C
   12006 |           12000000 | A
   12007 |           12000000 | A
   12008 |           12000000 | A
   12009 |           12000000 | A
   12010 |           12000000 | A
   12011 |           12000000 | A
   12012 |           12000000 | C
   12013 |           12000000 | A
   12014 |           12000000 | A
   12015 |           12000000 | C
   12016 |           12000000 | S
   12017 |           12000000 | S
   12200 |           12200029 | M
   12201 |           12200040 | M
(20 rows)

SELECT hist_function, hist_event, hist_object,
       regexp_replace(regexp_replace(regexp_replace(hist_wording,
            E'\\d\\d\.\\d\\d\\.\\d\\d\\.\\d\\d\\d\\d', '%', 'g'),
            E'\\d\\d\\d\\d/\\d\\d\\/\\d\\d\\ \\d\\d\\:\\d\\d:\\d\\d .*?\\)', '<timestamp>)', 'g'),
            E'\\[.+\\]', '(timestamp)', 'g'),
       hist_user
  FROM emaj.emaj_hist WHERE hist_id >= 12000 ORDER BY hist_id;
   hist_function    |    hist_event     |    hist_object    |                                    regexp_replace                                     |     hist_user      
--------------------+-------------------+-------------------+---------------------------------------------------------------------------------------+--------------------
 START_GROUP        | BEGIN             | myGroup1          | With logs reset                                                                       | _regress_emaj_adm2
 LOCK_GROUP         | BEGIN             | myGroup1          |                                                                                       | _regress_emaj_adm2
 LOCK_GROUP         | END               | myGroup1          | 5 tables locked, 0 deadlock(s)                                                        | _regress_emaj_adm2
 START_GROUP        | TIME STAMP SET    | 12016             |                                                                                       | _regress_emaj_adm2
 PURGE_HISTORIES    |                   |                   | 56 emaj_hist rows deleted ; 1 group history rows deleted ; 8 relation changes deleted | _regress_emaj_adm2
 SET_MARK_GROUP     | BEGIN             | myGroup1          | M1                                                                                    | _regress_emaj_adm2
 SET_MARK_GROUP     | END               | myGroup1          | M1                                                                                    | _regress_emaj_adm2
 START_GROUP        | END               | myGroup1          | 7 tables/sequences processed                                                          | _regress_emaj_adm2
 SET_PARAM          | DELETED PARAMETER | history_retention | From: 0.1 second to: 1 year                                                           | _regress_emaj_adm2
 START_GROUP        | BEGIN             | myGroup2          | With logs reset                                                                       | _regress_emaj_adm2
 LOCK_GROUP         | BEGIN             | myGroup2          |                                                                                       | _regress_emaj_adm2
 LOCK_GROUP         | END               | myGroup2          | 6 tables locked, 0 deadlock(s)                                                        | _regress_emaj_adm2
 START_GROUP        | TIME STAMP SET    | 12017             |                                                                                       | _regress_emaj_adm2
 SET_MARK_GROUP     | BEGIN             | myGroup2          | M1                                                                                    | _regress_emaj_adm2
 SET_MARK_GROUP     | END               | myGroup2          | M1                                                                                    | _regress_emaj_adm2
 START_GROUP        | END               | myGroup2          | 8 tables/sequences processed                                                          | _regress_emaj_adm2
 SET_MARK_GROUP     | BEGIN             | myGroup1          | M2                                                                                    | _regress_emaj_adm2
 LOCK_GROUP         | BEGIN             | myGroup1          |                                                                                       | _regress_emaj_adm2
 LOCK_GROUP         | END               | myGroup1          | 5 tables locked, 0 deadlock(s)                                                        | _regress_emaj_adm2
 SET_MARK_GROUP     | TIME STAMP SET    | 12200             |                                                                                       | _regress_emaj_adm2
 SET_MARK_GROUP     | END               | myGroup1          | M2                                                                                    | _regress_emaj_adm2
 SET_MARK_GROUP     | BEGIN             | myGroup1          | M3                                                                                    | _regress_emaj_adm2
 LOCK_GROUP         | BEGIN             | myGroup1          |                                                                                       | _regress_emaj_adm2
 LOCK_GROUP         | END               | myGroup1          | 5 tables locked, 0 deadlock(s)                                                        | _regress_emaj_adm2
 SET_MARK_GROUP     | TIME STAMP SET    | 12201             |                                                                                       | _regress_emaj_adm2
 SET_MARK_GROUP     | END               | myGroup1          | M3                                                                                    | _regress_emaj_adm2
 COMMENT_MARK_GROUP |                   | myGroup1          | Mark M3                                                                               | _regress_emaj_adm2
(27 rows)

-- User tables.
RESET session_authorization;
SELECT * FROM mySchema1.myTbl1 ORDER BY col11, col12;
 col11 |   col12    | col13 
-------+------------+-------
     1 | DEF        | \x1c
     2 | DEF        | \x1c
     3 | ABC        | \x1c
     4 | ABC        | \x0c
     5 | ABC        | \x0c
     6 | ABC        | \x0c
     7 | ABC        | \x0c
     8 | ABC        | \x0c
     9 | ABC        | \x0c
(9 rows)

SELECT * FROM mySchema1.myTbl2 ORDER BY col21;
 col21 | col22 |   col23    
-------+-------+------------
     1 | ABC   | 12-31-2010
     2 | DEF   | 
(2 rows)

SELECT * FROM mySchema1.myTbl2b ORDER BY col20;
 col20 | col21 | col22 |         col23         | col24 
-------+-------+-------+-----------------------+-------
     3 |     1 |     1 |    0.7071067811865476 | t
     4 |     2 |   0.5 | 6.123233995736766e-17 | t
(2 rows)

SELECT col31, col33 FROM mySchema1."myTbl3" ORDER BY col31;
 col31 | col33 
-------+-------
    11 | 10.00
    12 | 10.00
    13 | 10.00
    14 | 10.00
    15 | 10.00
    16 | 10.00
    17 | 10.00
    18 | 10.00
    19 | 10.00
    20 | 10.00
(10 rows)

SELECT * FROM mySchema1.myTbl4 ORDER BY col41;
 col41 | col42 | col43 | col44 | col45 
-------+-------+-------+-------+-------
     1 | FK... |     2 |       | 
     2 | FK... |     2 |       | 
(2 rows)

-- Log tables.
SELECT col11, col12, col13, emaj_verb, emaj_tuple, emaj_gid, emaj_user, emaj_user_ip, extra_col_appname
    FROM emaj_mySchema1.myTbl1_log ORDER BY emaj_gid, emaj_tuple DESC;
 col11 |   col12    | col13 | emaj_verb | emaj_tuple | emaj_gid | emaj_user | emaj_user_ip | extra_col_appname 
-------+------------+-------+-----------+------------+----------+-----------+--------------+-------------------
     1 | ABC        | \x0c  | INS       | NEW        | 12200001 | postgres  | 127.0.0.1    | psql
     2 | ABC        | \x0c  | INS       | NEW        | 12200002 | postgres  | 127.0.0.1    | psql
     3 | ABC        | \x0c  | INS       | NEW        | 12200003 | postgres  | 127.0.0.1    | psql
     4 | ABC        | \x0c  | INS       | NEW        | 12200004 | postgres  | 127.0.0.1    | psql
     5 | ABC        | \x0c  | INS       | NEW        | 12200005 | postgres  | 127.0.0.1    | psql
     6 | ABC        | \x0c  | INS       | NEW        | 12200006 | postgres  | 127.0.0.1    | psql
     7 | ABC        | \x0c  | INS       | NEW        | 12200007 | postgres  | 127.0.0.1    | psql
     8 | ABC        | \x0c  | INS       | NEW        | 12200008 | postgres  | 127.0.0.1    | psql
     9 | ABC        | \x0c  | INS       | NEW        | 12200009 | postgres  | 127.0.0.1    | psql
    10 | ABC        | \x0c  | INS       | NEW        | 12200010 | postgres  | 127.0.0.1    | psql
    11 | ABC        | \x0c  | INS       | NEW        | 12200011 | postgres  | 127.0.0.1    | psql
     1 | ABC        | \x0c  | UPD       | OLD        | 12200012 | postgres  | 127.0.0.1    | psql
     1 | ABC        | \x1c  | UPD       | NEW        | 12200012 | postgres  | 127.0.0.1    | psql
     2 | ABC        | \x0c  | UPD       | OLD        | 12200013 | postgres  | 127.0.0.1    | psql
     2 | ABC        | \x1c  | UPD       | NEW        | 12200013 | postgres  | 127.0.0.1    | psql
     3 | ABC        | \x0c  | UPD       | OLD        | 12200014 | postgres  | 127.0.0.1    | psql
     3 | ABC        | \x1c  | UPD       | NEW        | 12200014 | postgres  | 127.0.0.1    | psql
    11 | ABC        | \x0c  | DEL       | OLD        | 12200017 | postgres  | 127.0.0.1    | psql
    10 | ABC        | \x0c  | DEL       | OLD        | 12200035 | postgres  | 127.0.0.1    | psql
     1 | ABC        | \x1c  | UPD       | OLD        | 12200037 | postgres  | 127.0.0.1    | psql
     1 | DEF        | \x1c  | UPD       | NEW        | 12200037 | postgres  | 127.0.0.1    | psql
     2 | ABC        | \x1c  | UPD       | OLD        | 12200038 | postgres  | 127.0.0.1    | psql
     2 | DEF        | \x1c  | UPD       | NEW        | 12200038 | postgres  | 127.0.0.1    | psql
(23 rows)

SELECT col21, col22, col23, emaj_verb, emaj_tuple, emaj_gid, emaj_user, emaj_user_ip, extra_col_appname
    FROM emaj_mySchema1.myTbl2_log ORDER BY emaj_gid, emaj_tuple DESC;
 col21 | col22 |   col23    | emaj_verb | emaj_tuple | emaj_gid | emaj_user | emaj_user_ip | extra_col_appname 
-------+-------+------------+-----------+------------+----------+-----------+--------------+-------------------
     1 | ABC   | 12-31-2010 | INS       | NEW        | 12200015 | postgres  | 127.0.0.1    | psql
     2 | DEF   |            | INS       | NEW        | 12200018 | postgres  | 127.0.0.1    | psql
(2 rows)

SELECT col20, col21, col22, col23, emaj_verb, emaj_tuple, emaj_gid, emaj_user, emaj_user_ip, extra_col_appname
    FROM emaj_mySchema1.myTbl2b_log ORDER BY emaj_gid, emaj_tuple DESC;
 col20 | col21 | col22 |         col23         | emaj_verb | emaj_tuple | emaj_gid | emaj_user | emaj_user_ip | extra_col_appname 
-------+-------+-------+-----------------------+-----------+------------+----------+-----------+--------------+-------------------
     3 |     1 |     1 |    0.7071067811865476 | INS       | NEW        | 12200016 | postgres  | 127.0.0.1    | psql
     4 |     2 |   0.5 | 6.123233995736766e-17 | INS       | NEW        | 12200019 | postgres  | 127.0.0.1    | psql
(2 rows)

SELECT col31, col33, emaj_verb, emaj_tuple, emaj_gid, emaj_user, emaj_user_ip, extra_col_appname
    FROM emaj_myschema1."myTbl3_log" ORDER BY emaj_gid, emaj_tuple DESC;
 col31 | col33 | emaj_verb | emaj_tuple | emaj_gid | emaj_user | emaj_user_ip | extra_col_appname 
-------+-------+-----------+------------+----------+-----------+--------------+-------------------
    11 | 10.00 | INS       | NEW        | 12200020 | postgres  | 127.0.0.1    | psql
    12 | 10.00 | INS       | NEW        | 12200021 | postgres  | 127.0.0.1    | psql
    13 | 10.00 | INS       | NEW        | 12200022 | postgres  | 127.0.0.1    | psql
    14 | 10.00 | INS       | NEW        | 12200023 | postgres  | 127.0.0.1    | psql
    15 | 10.00 | INS       | NEW        | 12200024 | postgres  | 127.0.0.1    | psql
    16 | 10.00 | INS       | NEW        | 12200025 | postgres  | 127.0.0.1    | psql
    17 | 10.00 | INS       | NEW        | 12200026 | postgres  | 127.0.0.1    | psql
    18 | 10.00 | INS       | NEW        | 12200027 | postgres  | 127.0.0.1    | psql
    19 | 10.00 | INS       | NEW        | 12200028 | postgres  | 127.0.0.1    | psql
    20 | 10.00 | INS       | NEW        | 12200029 | postgres  | 127.0.0.1    | psql
(10 rows)

SELECT col41, col42, col43, col44, col45, emaj_verb, emaj_tuple, emaj_gid, emaj_user, emaj_user_ip, extra_col_appname
    FROM emaj_mySchema1.myTbl4_log ORDER BY emaj_gid, emaj_tuple DESC;
 col41 | col42 | col43 | col44 | col45 | emaj_verb | emaj_tuple | emaj_gid | emaj_user | emaj_user_ip | extra_col_appname 
-------+-------+-------+-------+-------+-----------+------------+----------+-----------+--------------+-------------------
     1 | FK... |     1 |     1 | ABC   | INS       | NEW        | 12200030 | postgres  | 127.0.0.1    | psql
     2 | FK... |     1 |     1 | ABC   | INS       | NEW        | 12200031 | postgres  | 127.0.0.1    | psql
     1 | FK... |     1 |     1 | ABC   | UPD       | OLD        | 12200032 | postgres  | 127.0.0.1    | psql
     1 | FK... |     2 |     1 | ABC   | UPD       | NEW        | 12200032 | postgres  | 127.0.0.1    | psql
     2 | FK... |     1 |     1 | ABC   | UPD       | OLD        | 12200033 | postgres  | 127.0.0.1    | psql
     2 | FK... |     2 |     1 | ABC   | UPD       | NEW        | 12200033 | postgres  | 127.0.0.1    | psql
     3 | FK... |     1 |    10 | ABC   | INS       | NEW        | 12200034 | postgres  | 127.0.0.1    | psql
     3 | FK... |     1 |    10 | ABC   | DEL       | OLD        | 12200036 | postgres  | 127.0.0.1    | psql
     1 | FK... |     2 |     1 | ABC   | UPD       | OLD        | 12200039 | postgres  | 127.0.0.1    | psql
     1 | FK... |     2 |       |       | UPD       | NEW        | 12200039 | postgres  | 127.0.0.1    | psql
     2 | FK... |     2 |     1 | ABC   | UPD       | OLD        | 12200040 | postgres  | 127.0.0.1    | psql
     2 | FK... |     2 |       |       | UPD       | NEW        | 12200040 | postgres  | 127.0.0.1    | psql
(12 rows)

-- Set sequence restart value.
SELECT public.handle_emaj_sequences(12300);
 handle_emaj_sequences 
-----------------------
 
(1 row)

-----------------------------
-- Step 2 : for myGroup2, start, update tables and set 2 marks.
-----------------------------
SET search_path TO public, myschema2;
INSERT INTO myTbl1 SELECT i, 'ABC', E'\\014'::BYTEA FROM generate_series (1, 11) AS i;
UPDATE myTbl1 SET col13=E'\\034'::BYTEA WHERE col11 <= 3;
INSERT INTO myTbl2 VALUES (1, 'ABC', '2010-01-01');
DELETE FROM myTbl1 WHERE col11 > 10;
SELECT nextval('myschema2.myseq1');
 nextval 
---------
    1000
(1 row)

INSERT INTO myTbl2 VALUES (2, 'DEF', NULL);
INSERT INTO "myTbl3" (col33) SELECT generate_series(1000, 1039, 4)/100;
INSERT INTO myTbl5 VALUES (1, '{"abc", "def", "ghi"}', '{1, 2, 3}', NULL, '{}', NULL, '{"id":1000}', '[2020-01-01, 2021-01-01)', NULL);
INSERT INTO myTbl5 VALUES (2, ARRAY['abc', 'def', 'ghi'], ARRAY[3, 4, 5], ARRAY['2000/02/01'::DATE, '2000/02/28'::DATE], '{"id":1001, "c1":"abc"}',
                           NULL, '{"id":1001}', NULL, XMLPARSE (CONTENT '<foo>bar</foo>'));
UPDATE myTbl5 SET col54 = '{"2010/11/28", "2010/12/03"}', col55 = '{"id":1001, "c2":"def"}', col57 = '{"id":1001, "c3":"ghi"}' WHERE col54 IS NULL;
INSERT INTO myTbl6
  SELECT i, point(i, 1.3), box(point(i, 0), point(i+0.2, 1)), circle(point(5, 5), i), '((-2, -2), (3, 0), (1, 4))',
         '10.20.30.40/27', 'EXECUTING', (i, point(i, 1.3))::mycomposite
    FROM generate_series (1, 8) AS i;
UPDATE myTbl6 SET col64 = '<(5, 6), 3.5>', col65 = NULL, col67 = 'COMPLETED' WHERE col61 between 1 AND 3;
--
SET session_authorization TO _regress_emaj_adm1;
SELECT emaj.emaj_set_mark_group('myGroup2', 'M2');
 emaj_set_mark_group 
---------------------
                   8
(1 row)

--
reset session_authorization;
SET search_path TO public, myschema2;
SELECT nextval('myschema2.myseq1');
 nextval 
---------
    1001
(1 row)

SELECT nextval('myschema2.myseq1');
 nextval 
---------
    1002
(1 row)

SELECT nextval('myschema2.myseq1');
 nextval 
---------
    1003
(1 row)

--
ALTER SEQUENCE mySeq1 NO MAXVALUE NO CYCLE;
--
INSERT INTO myTbl4 VALUES (1, 'FK...', 1, 1, 'ABC');
INSERT INTO myTbl4 VALUES (2, 'FK...', 1, 1, 'ABC');
UPDATE myTbl4 SET col43 = 2;
DELETE FROM mytbl5 WHERE 4 = ANY(col53);
DELETE FROM myTbl6 WHERE col65 IS NULL AND col61 <> 0;
--
SET session_authorization TO _regress_emaj_adm1;
SELECT emaj.emaj_set_mark_group('myGroup2', 'M3');
 emaj_set_mark_group 
---------------------
                   8
(1 row)

-----------------------------
-- Checking step 2.
-----------------------------
-- emaj tables.
SELECT mark_group, regexp_replace(mark_name, E'\\d\\d\.\\d\\d\\.\\d\\d\\.\\d\\d\\d\\d', '%', 'g'), mark_time_id, mark_is_rlbk_protected,
       mark_comment, mark_log_rows_before_next, mark_logged_rlbk_target_mark FROM emaj.emaj_mark ORDER BY mark_time_id, mark_group;
 mark_group | regexp_replace | mark_time_id | mark_is_rlbk_protected |  mark_comment  | mark_log_rows_before_next | mark_logged_rlbk_target_mark 
------------+----------------+--------------+------------------------+----------------+---------------------------+------------------------------
 myGroup1   | M1             |        12016 | f                      |                |                        29 | 
 myGroup2   | M1             |        12017 | f                      |                |                        41 | 
 myGroup1   | M2             |        12200 | f                      |                |                        11 | 
 myGroup1   | M3             |        12201 | f                      | Third mark set |                           | 
 myGroup2   | M2             |        12300 | f                      |                |                         8 | 
 myGroup2   | M3             |        12301 | f                      |                |                           | 
(6 rows)

SELECT sequ_schema, sequ_name, sequ_time_id, sequ_last_val, sequ_is_called
  FROM emaj.emaj_sequence ORDER BY sequ_time_id, sequ_schema, sequ_name;
 sequ_schema |     sequ_name     | sequ_time_id | sequ_last_val | sequ_is_called 
-------------+-------------------+--------------+---------------+----------------
 myschema1   | myTbl3_col31_seq  |        12016 |            11 | f
 myschema1   | mytbl2b_col20_seq |        12016 |             3 | f
 myschema2   | myTbl3_col31_seq  |        12017 |            11 | f
 myschema2   | myseq1            |        12017 |          1000 | f
 myschema1   | myTbl3_col31_seq  |        12200 |            20 | t
 myschema1   | mytbl2b_col20_seq |        12200 |             4 | t
 myschema1   | myTbl3_col31_seq  |        12201 |            20 | t
 myschema1   | mytbl2b_col20_seq |        12201 |             4 | t
 myschema2   | myTbl3_col31_seq  |        12300 |            20 | t
 myschema2   | myseq1            |        12300 |          1000 | t
 myschema2   | myTbl3_col31_seq  |        12301 |            20 | t
 myschema2   | myseq1            |        12301 |          1003 | t
(12 rows)

SELECT tbl_schema, tbl_name, tbl_time_id, tbl_log_seq_last_val
  FROM emaj.emaj_table ORDER BY tbl_time_id, tbl_schema, tbl_name;
 tbl_schema | tbl_name | tbl_time_id | tbl_log_seq_last_val 
------------+----------+-------------+----------------------
 myschema1  | myTbl3   |       12016 |                    0
 myschema1  | mytbl1   |       12016 |                    0
 myschema1  | mytbl2   |       12016 |                    0
 myschema1  | mytbl2b  |       12016 |                    0
 myschema1  | mytbl4   |       12016 |                    0
 myschema2  | myTbl3   |       12017 |                    0
 myschema2  | mytbl1   |       12017 |                    0
 myschema2  | mytbl2   |       12017 |                    0
 myschema2  | mytbl4   |       12017 |                    0
 myschema2  | mytbl5   |       12017 |                    0
 myschema2  | mytbl6   |       12017 |                    0
 myschema1  | myTbl3   |       12200 |                   10
 myschema1  | mytbl1   |       12200 |                   15
 myschema1  | mytbl2   |       12200 |                    2
 myschema1  | mytbl2b  |       12200 |                    2
 myschema1  | mytbl4   |       12200 |                    0
 myschema1  | myTbl3   |       12201 |                   10
 myschema1  | mytbl1   |       12201 |                   18
 myschema1  | mytbl2   |       12201 |                    2
 myschema1  | mytbl2b  |       12201 |                    2
 myschema1  | mytbl4   |       12201 |                    8
 myschema2  | myTbl3   |       12300 |                   10
 myschema2  | mytbl1   |       12300 |                   15
 myschema2  | mytbl2   |       12300 |                    2
 myschema2  | mytbl4   |       12300 |                    0
 myschema2  | mytbl5   |       12300 |                    3
 myschema2  | mytbl6   |       12300 |                   11
 myschema2  | myTbl3   |       12301 |                   10
 myschema2  | mytbl1   |       12301 |                   15
 myschema2  | mytbl2   |       12301 |                    2
 myschema2  | mytbl4   |       12301 |                    4
 myschema2  | mytbl5   |       12301 |                    4
 myschema2  | mytbl6   |       12301 |                   14
(33 rows)

SELECT time_id, time_last_emaj_gid, time_event FROM emaj.emaj_time_stamp WHERE time_id >= 12300 ORDER BY time_id;
 time_id | time_last_emaj_gid | time_event 
---------+--------------------+------------
   12300 |           12300041 | M
   12301 |           12300049 | M
(2 rows)

SELECT hist_function, hist_event, hist_object,
       regexp_replace(regexp_replace(regexp_replace(hist_wording,
            E'\\d\\d\.\\d\\d\\.\\d\\d\\.\\d\\d\\d\\d', '%', 'g'),
            E'\\d\\d\\d\\d/\\d\\d\\/\\d\\d\\ \\d\\d\\:\\d\\d:\\d\\d .*?\\)', '<timestamp>)', 'g'),
            E'\\[.+\\]', '(timestamp)', 'g'),
       hist_user
  FROM emaj.emaj_hist WHERE hist_id >= 12300 ORDER BY hist_id;
 hist_function  |   hist_event   | hist_object |         regexp_replace         |     hist_user      
----------------+----------------+-------------+--------------------------------+--------------------
 SET_MARK_GROUP | BEGIN          | myGroup2    | M2                             | _regress_emaj_adm1
 LOCK_GROUP     | BEGIN          | myGroup2    |                                | _regress_emaj_adm1
 LOCK_GROUP     | END            | myGroup2    | 6 tables locked, 0 deadlock(s) | _regress_emaj_adm1
 SET_MARK_GROUP | TIME STAMP SET | 12300       |                                | _regress_emaj_adm1
 SET_MARK_GROUP | END            | myGroup2    | M2                             | _regress_emaj_adm1
 SET_MARK_GROUP | BEGIN          | myGroup2    | M3                             | _regress_emaj_adm1
 LOCK_GROUP     | BEGIN          | myGroup2    |                                | _regress_emaj_adm1
 LOCK_GROUP     | END            | myGroup2    | 6 tables locked, 0 deadlock(s) | _regress_emaj_adm1
 SET_MARK_GROUP | TIME STAMP SET | 12301       |                                | _regress_emaj_adm1
 SET_MARK_GROUP | END            | myGroup2    | M3                             | _regress_emaj_adm1
(10 rows)

-- User tables.
RESET session_authorization;
SELECT * FROM mySchema2.myTbl1 ORDER BY col11, col12;
 col11 |   col12    | col13 
-------+------------+-------
     1 | ABC        | \x1c
     2 | ABC        | \x1c
     3 | ABC        | \x1c
     4 | ABC        | \x0c
     5 | ABC        | \x0c
     6 | ABC        | \x0c
     7 | ABC        | \x0c
     8 | ABC        | \x0c
     9 | ABC        | \x0c
    10 | ABC        | \x0c
(10 rows)

SELECT * FROM mySchema2.myTbl2 ORDER BY col21;
 col21 | col22 |   col23    
-------+-------+------------
     1 | ABC   | 01-01-2010
     2 | DEF   | 
(2 rows)

SELECT col31, col33 FROM mySchema2."myTbl3" ORDER BY col31;
 col31 | col33 
-------+-------
    11 | 10.00
    12 | 10.00
    13 | 10.00
    14 | 10.00
    15 | 10.00
    16 | 10.00
    17 | 10.00
    18 | 10.00
    19 | 10.00
    20 | 10.00
(10 rows)

SELECT * FROM mySchema2.myTbl4 ORDER BY col41;
 col41 | col42 | col43 | col44 |   col45    
-------+-------+-------+-------+------------
     1 | FK... |     2 |     1 | ABC       
     2 | FK... |     2 |     1 | ABC       
(2 rows)

SELECT * FROM mySchema2.myTbl5 ORDER BY col51;
 col51 |     col52     |  col53  |          col54          |          col55          | col56 |          col57          |          col58          | col59 
-------+---------------+---------+-------------------------+-------------------------+-------+-------------------------+-------------------------+-------
     1 | {abc,def,ghi} | {1,2,3} | {11-28-2010,12-03-2010} | {"id":1001, "c2":"def"} |       | {"id":1001, "c3":"ghi"} | [01-01-2020,01-01-2021) | 
(1 row)

SELECT * FROM mySchema2.myTbl6 ORDER BY col61;
 col61 |  col62  |     col63     |   col64   |         col65         |     col66      |   col67   |     col68     |   col69   
-------+---------+---------------+-----------+-----------------------+----------------+-----------+---------------+-----------
     0 |         |               |           |                       |                |           |               | 
     4 | (4,1.3) | (4.2,1),(4,0) | <(5,5),4> | ((-2,-2),(3,0),(1,4)) | 10.20.30.40/27 | EXECUTING | (4,"(4,1.3)") | (4.1,0.5)
     5 | (5,1.3) | (5.2,1),(5,0) | <(5,5),5> | ((-2,-2),(3,0),(1,4)) | 10.20.30.40/27 | EXECUTING | (5,"(5,1.3)") | (5.1,0.5)
     6 | (6,1.3) | (6.2,1),(6,0) | <(5,5),6> | ((-2,-2),(3,0),(1,4)) | 10.20.30.40/27 | EXECUTING | (6,"(6,1.3)") | (6.1,0.5)
     7 | (7,1.3) | (7.2,1),(7,0) | <(5,5),7> | ((-2,-2),(3,0),(1,4)) | 10.20.30.40/27 | EXECUTING | (7,"(7,1.3)") | (7.1,0.5)
     8 | (8,1.3) | (8.2,1),(8,0) | <(5,5),8> | ((-2,-2),(3,0),(1,4)) | 10.20.30.40/27 | EXECUTING | (8,"(8,1.3)") | (8.1,0.5)
(6 rows)

-- Log tables.
SET session_authorization TO _regress_emaj_adm1;
SELECT col11, col12, col13, emaj_verb, emaj_tuple, emaj_gid FROM emaj_mySchema2.myTbl1_log ORDER BY emaj_gid, emaj_tuple DESC;
 col11 |   col12    | col13 | emaj_verb | emaj_tuple | emaj_gid 
-------+------------+-------+-----------+------------+----------
     1 | ABC        | \x0c  | INS       | NEW        | 12300001
     2 | ABC        | \x0c  | INS       | NEW        | 12300002
     3 | ABC        | \x0c  | INS       | NEW        | 12300003
     4 | ABC        | \x0c  | INS       | NEW        | 12300004
     5 | ABC        | \x0c  | INS       | NEW        | 12300005
     6 | ABC        | \x0c  | INS       | NEW        | 12300006
     7 | ABC        | \x0c  | INS       | NEW        | 12300007
     8 | ABC        | \x0c  | INS       | NEW        | 12300008
     9 | ABC        | \x0c  | INS       | NEW        | 12300009
    10 | ABC        | \x0c  | INS       | NEW        | 12300010
    11 | ABC        | \x0c  | INS       | NEW        | 12300011
     1 | ABC        | \x0c  | UPD       | OLD        | 12300012
     1 | ABC        | \x1c  | UPD       | NEW        | 12300012
     2 | ABC        | \x0c  | UPD       | OLD        | 12300013
     2 | ABC        | \x1c  | UPD       | NEW        | 12300013
     3 | ABC        | \x0c  | UPD       | OLD        | 12300014
     3 | ABC        | \x1c  | UPD       | NEW        | 12300014
    11 | ABC        | \x0c  | DEL       | OLD        | 12300016
(18 rows)

SELECT col21, col22, col23, emaj_verb, emaj_tuple, emaj_gid FROM emaj_mySchema2.myTbl2_log ORDER BY emaj_gid, emaj_tuple DESC;
 col21 | col22 |   col23    | emaj_verb | emaj_tuple | emaj_gid 
-------+-------+------------+-----------+------------+----------
     1 | ABC   | 01-01-2010 | INS       | NEW        | 12300015
     2 | DEF   |            | INS       | NEW        | 12300017
(2 rows)

SELECT col31, col33, emaj_verb, emaj_tuple, emaj_gid FROM emaj_myschema2."myTbl3_log" ORDER BY emaj_gid, emaj_tuple DESC;
 col31 | col33 | emaj_verb | emaj_tuple | emaj_gid 
-------+-------+-----------+------------+----------
    11 | 10.00 | INS       | NEW        | 12300018
    12 | 10.00 | INS       | NEW        | 12300019
    13 | 10.00 | INS       | NEW        | 12300020
    14 | 10.00 | INS       | NEW        | 12300021
    15 | 10.00 | INS       | NEW        | 12300022
    16 | 10.00 | INS       | NEW        | 12300023
    17 | 10.00 | INS       | NEW        | 12300024
    18 | 10.00 | INS       | NEW        | 12300025
    19 | 10.00 | INS       | NEW        | 12300026
    20 | 10.00 | INS       | NEW        | 12300027
(10 rows)

SELECT col41, col42, col43, col44, col45, emaj_verb, emaj_tuple, emaj_gid FROM emaj_myschema2.mytbl4_log ORDER BY emaj_gid, emaj_tuple DESC;
 col41 | col42 | col43 | col44 |   col45    | emaj_verb | emaj_tuple | emaj_gid 
-------+-------+-------+-------+------------+-----------+------------+----------
     1 | FK... |     1 |     1 | ABC        | INS       | NEW        | 12300042
     2 | FK... |     1 |     1 | ABC        | INS       | NEW        | 12300043
     1 | FK... |     1 |     1 | ABC        | UPD       | OLD        | 12300044
     1 | FK... |     2 |     1 | ABC        | UPD       | NEW        | 12300044
     2 | FK... |     1 |     1 | ABC        | UPD       | OLD        | 12300045
     2 | FK... |     2 |     1 | ABC        | UPD       | NEW        | 12300045
(6 rows)

SELECT col51, col52, col53, col54, emaj_verb, emaj_tuple, emaj_gid FROM emaj_myschema2.mytbl5_log ORDER BY emaj_gid, emaj_tuple DESC;
 col51 |     col52     |  col53  |          col54          | emaj_verb | emaj_tuple | emaj_gid 
-------+---------------+---------+-------------------------+-----------+------------+----------
     1 | {abc,def,ghi} | {1,2,3} |                         | INS       | NEW        | 12300028
     2 | {abc,def,ghi} | {3,4,5} | {02-01-2000,02-28-2000} | INS       | NEW        | 12300029
     1 | {abc,def,ghi} | {1,2,3} |                         | UPD       | OLD        | 12300030
     1 | {abc,def,ghi} | {1,2,3} | {11-28-2010,12-03-2010} | UPD       | NEW        | 12300030
     2 | {abc,def,ghi} | {3,4,5} | {02-01-2000,02-28-2000} | DEL       | OLD        | 12300046
(5 rows)

SELECT col61, col62, col63, col64, col65, col66, col67, col68, col69, emaj_verb, emaj_tuple, emaj_gid FROM emaj_mySchema2.myTbl6_log ORDER BY emaj_gid, emaj_tuple DESC;
 col61 |  col62  |     col63     |    col64    |         col65         |     col66      |   col67   |     col68     |   col69   | emaj_verb | emaj_tuple | emaj_gid 
-------+---------+---------------+-------------+-----------------------+----------------+-----------+---------------+-----------+-----------+------------+----------
     1 | (1,1.3) | (1.2,1),(1,0) | <(5,5),1>   | ((-2,-2),(3,0),(1,4)) | 10.20.30.40/27 | EXECUTING | (1,"(1,1.3)") | (1.1,0.5) | INS       | NEW        | 12300031
     2 | (2,1.3) | (2.2,1),(2,0) | <(5,5),2>   | ((-2,-2),(3,0),(1,4)) | 10.20.30.40/27 | EXECUTING | (2,"(2,1.3)") | (2.1,0.5) | INS       | NEW        | 12300032
     3 | (3,1.3) | (3.2,1),(3,0) | <(5,5),3>   | ((-2,-2),(3,0),(1,4)) | 10.20.30.40/27 | EXECUTING | (3,"(3,1.3)") | (3.1,0.5) | INS       | NEW        | 12300033
     4 | (4,1.3) | (4.2,1),(4,0) | <(5,5),4>   | ((-2,-2),(3,0),(1,4)) | 10.20.30.40/27 | EXECUTING | (4,"(4,1.3)") | (4.1,0.5) | INS       | NEW        | 12300034
     5 | (5,1.3) | (5.2,1),(5,0) | <(5,5),5>   | ((-2,-2),(3,0),(1,4)) | 10.20.30.40/27 | EXECUTING | (5,"(5,1.3)") | (5.1,0.5) | INS       | NEW        | 12300035
     6 | (6,1.3) | (6.2,1),(6,0) | <(5,5),6>   | ((-2,-2),(3,0),(1,4)) | 10.20.30.40/27 | EXECUTING | (6,"(6,1.3)") | (6.1,0.5) | INS       | NEW        | 12300036
     7 | (7,1.3) | (7.2,1),(7,0) | <(5,5),7>   | ((-2,-2),(3,0),(1,4)) | 10.20.30.40/27 | EXECUTING | (7,"(7,1.3)") | (7.1,0.5) | INS       | NEW        | 12300037
     8 | (8,1.3) | (8.2,1),(8,0) | <(5,5),8>   | ((-2,-2),(3,0),(1,4)) | 10.20.30.40/27 | EXECUTING | (8,"(8,1.3)") | (8.1,0.5) | INS       | NEW        | 12300038
     1 | (1,1.3) | (1.2,1),(1,0) | <(5,5),1>   | ((-2,-2),(3,0),(1,4)) | 10.20.30.40/27 | EXECUTING | (1,"(1,1.3)") | (1.1,0.5) | UPD       | OLD        | 12300039
     1 | (1,1.3) | (1.2,1),(1,0) | <(5,6),3.5> |                       | 10.20.30.40/27 | COMPLETED | (1,"(1,1.3)") | (1.1,0.5) | UPD       | NEW        | 12300039
     2 | (2,1.3) | (2.2,1),(2,0) | <(5,5),2>   | ((-2,-2),(3,0),(1,4)) | 10.20.30.40/27 | EXECUTING | (2,"(2,1.3)") | (2.1,0.5) | UPD       | OLD        | 12300040
     2 | (2,1.3) | (2.2,1),(2,0) | <(5,6),3.5> |                       | 10.20.30.40/27 | COMPLETED | (2,"(2,1.3)") | (2.1,0.5) | UPD       | NEW        | 12300040
     3 | (3,1.3) | (3.2,1),(3,0) | <(5,5),3>   | ((-2,-2),(3,0),(1,4)) | 10.20.30.40/27 | EXECUTING | (3,"(3,1.3)") | (3.1,0.5) | UPD       | OLD        | 12300041
     3 | (3,1.3) | (3.2,1),(3,0) | <(5,6),3.5> |                       | 10.20.30.40/27 | COMPLETED | (3,"(3,1.3)") | (3.1,0.5) | UPD       | NEW        | 12300041
     1 | (1,1.3) | (1.2,1),(1,0) | <(5,6),3.5> |                       | 10.20.30.40/27 | COMPLETED | (1,"(1,1.3)") | (1.1,0.5) | DEL       | OLD        | 12300047
     2 | (2,1.3) | (2.2,1),(2,0) | <(5,6),3.5> |                       | 10.20.30.40/27 | COMPLETED | (2,"(2,1.3)") | (2.1,0.5) | DEL       | OLD        | 12300048
     3 | (3,1.3) | (3.2,1),(3,0) | <(5,6),3.5> |                       | 10.20.30.40/27 | COMPLETED | (3,"(3,1.3)") | (3.1,0.5) | DEL       | OLD        | 12300049
(17 rows)

-- Set sequence restart value.
SELECT public.handle_emaj_sequences(12400);
 handle_emaj_sequences 
-----------------------
 
(1 row)

-----------------------------
-- Step 3 : for myGroup2, double logged rollback.
-----------------------------
RESET session_authorization;
ANALYZE mytbl4;
-- Rollback without dblink.
ALTER FUNCTION public.dblink_connect(TEXT, TEXT) RENAME TO renamed_dblink_connect;
ALTER FUNCTION public.dblink_connect(TEXT) RENAME TO renamed_dblink_connect;
SET session_authorization TO _regress_emaj_adm2;
SELECT * FROM emaj.emaj_logged_rollback_group('myGroup2', 'M2', FALSE) ORDER BY 1, 2;
 rlbk_severity |              rlbk_message              
---------------+----------------------------------------
 Notice        | 1 / 2 sequences effectively processed.
 Notice        | 3 / 6 tables effectively processed.
 Notice        | Rollback id = 12400.
(3 rows)

SELECT * FROM emaj.emaj_logged_rollback_group('myGroup2', 'M3', FALSE) ORDER BY 1, 2;
 rlbk_severity |              rlbk_message              
---------------+----------------------------------------
 Notice        | 1 / 2 sequences effectively processed.
 Notice        | 3 / 6 tables effectively processed.
 Notice        | Rollback id = 12401.
(3 rows)

reset session_authorization;
ALTER FUNCTION public.renamed_dblink_connect(TEXT, TEXT) RENAME TO dblink_connect;
ALTER FUNCTION public.renamed_dblink_connect(TEXT) RENAME TO dblink_connect;
SET session_authorization TO _regress_emaj_adm1;
-----------------------------
-- Checking step 3.
-----------------------------
-- emaj tables.
SELECT mark_group, regexp_replace(mark_name, E'\\d\\d\.\\d\\d\\.\\d\\d\\.\\d\\d\\d\\d', '%', 'g'), mark_time_id, mark_is_rlbk_protected,
       mark_comment, mark_log_rows_before_next, mark_logged_rlbk_target_mark
  FROM emaj.emaj_mark ORDER BY mark_time_id, mark_group;
 mark_group |  regexp_replace  | mark_time_id | mark_is_rlbk_protected |                  mark_comment                  | mark_log_rows_before_next | mark_logged_rlbk_target_mark 
------------+------------------+--------------+------------------------+------------------------------------------------+---------------------------+------------------------------
 myGroup1   | M1               |        12016 | f                      |                                                |                        29 | 
 myGroup2   | M1               |        12017 | f                      |                                                |                        41 | 
 myGroup1   | M2               |        12200 | f                      |                                                |                        11 | 
 myGroup1   | M3               |        12201 | f                      | Third mark set                                 |                           | 
 myGroup2   | M2               |        12300 | f                      |                                                |                         8 | 
 myGroup2   | M3               |        12301 | f                      |                                                |                         0 | 
 myGroup2   | RLBK_12400_START |        12400 | f                      | Automatically set at rollback to mark M2 start |                         6 | 
 myGroup2   | RLBK_12400_DONE  |        12401 | f                      | Automatically set at rollback to mark M2 end   |                         0 | M2
 myGroup2   | RLBK_12401_START |        12402 | f                      | Automatically set at rollback to mark M3 start |                         6 | 
 myGroup2   | RLBK_12401_DONE  |        12403 | f                      | Automatically set at rollback to mark M3 end   |                           | M3
(10 rows)

SELECT sequ_schema, sequ_name, sequ_time_id, sequ_last_val, sequ_is_called
  FROM emaj.emaj_sequence ORDER BY sequ_time_id, sequ_schema, sequ_name;
 sequ_schema |     sequ_name     | sequ_time_id | sequ_last_val | sequ_is_called 
-------------+-------------------+--------------+---------------+----------------
 myschema1   | myTbl3_col31_seq  |        12016 |            11 | f
 myschema1   | mytbl2b_col20_seq |        12016 |             3 | f
 myschema2   | myTbl3_col31_seq  |        12017 |            11 | f
 myschema2   | myseq1            |        12017 |          1000 | f
 myschema1   | myTbl3_col31_seq  |        12200 |            20 | t
 myschema1   | mytbl2b_col20_seq |        12200 |             4 | t
 myschema1   | myTbl3_col31_seq  |        12201 |            20 | t
 myschema1   | mytbl2b_col20_seq |        12201 |             4 | t
 myschema2   | myTbl3_col31_seq  |        12300 |            20 | t
 myschema2   | myseq1            |        12300 |          1000 | t
 myschema2   | myTbl3_col31_seq  |        12301 |            20 | t
 myschema2   | myseq1            |        12301 |          1003 | t
 myschema2   | myTbl3_col31_seq  |        12400 |            20 | t
 myschema2   | myseq1            |        12400 |          1003 | t
 myschema2   | myTbl3_col31_seq  |        12401 |            20 | t
 myschema2   | myseq1            |        12401 |          1001 | f
 myschema2   | myTbl3_col31_seq  |        12402 |            20 | t
 myschema2   | myseq1            |        12402 |          1001 | f
 myschema2   | myTbl3_col31_seq  |        12403 |            20 | t
 myschema2   | myseq1            |        12403 |          1004 | f
(20 rows)

SELECT tbl_schema, tbl_name, tbl_time_id, tbl_log_seq_last_val
  FROM emaj.emaj_table ORDER BY tbl_time_id, tbl_schema, tbl_name;
 tbl_schema | tbl_name | tbl_time_id | tbl_log_seq_last_val 
------------+----------+-------------+----------------------
 myschema1  | myTbl3   |       12016 |                    0
 myschema1  | mytbl1   |       12016 |                    0
 myschema1  | mytbl2   |       12016 |                    0
 myschema1  | mytbl2b  |       12016 |                    0
 myschema1  | mytbl4   |       12016 |                    0
 myschema2  | myTbl3   |       12017 |                    0
 myschema2  | mytbl1   |       12017 |                    0
 myschema2  | mytbl2   |       12017 |                    0
 myschema2  | mytbl4   |       12017 |                    0
 myschema2  | mytbl5   |       12017 |                    0
 myschema2  | mytbl6   |       12017 |                    0
 myschema1  | myTbl3   |       12200 |                   10
 myschema1  | mytbl1   |       12200 |                   15
 myschema1  | mytbl2   |       12200 |                    2
 myschema1  | mytbl2b  |       12200 |                    2
 myschema1  | mytbl4   |       12200 |                    0
 myschema1  | myTbl3   |       12201 |                   10
 myschema1  | mytbl1   |       12201 |                   18
 myschema1  | mytbl2   |       12201 |                    2
 myschema1  | mytbl2b  |       12201 |                    2
 myschema1  | mytbl4   |       12201 |                    8
 myschema2  | myTbl3   |       12300 |                   10
 myschema2  | mytbl1   |       12300 |                   15
 myschema2  | mytbl2   |       12300 |                    2
 myschema2  | mytbl4   |       12300 |                    0
 myschema2  | mytbl5   |       12300 |                    3
 myschema2  | mytbl6   |       12300 |                   11
 myschema2  | myTbl3   |       12301 |                   10
 myschema2  | mytbl1   |       12301 |                   15
 myschema2  | mytbl2   |       12301 |                    2
 myschema2  | mytbl4   |       12301 |                    4
 myschema2  | mytbl5   |       12301 |                    4
 myschema2  | mytbl6   |       12301 |                   14
 myschema2  | myTbl3   |       12400 |                   10
 myschema2  | mytbl1   |       12400 |                   15
 myschema2  | mytbl2   |       12400 |                    2
 myschema2  | mytbl4   |       12400 |                    4
 myschema2  | mytbl5   |       12400 |                    4
 myschema2  | mytbl6   |       12400 |                   14
 myschema2  | myTbl3   |       12401 |                   10
 myschema2  | mytbl1   |       12401 |                   15
 myschema2  | mytbl2   |       12401 |                    2
 myschema2  | mytbl4   |       12401 |                    6
 myschema2  | mytbl5   |       12401 |                    5
 myschema2  | mytbl6   |       12401 |                   17
 myschema2  | myTbl3   |       12402 |                   10
 myschema2  | mytbl1   |       12402 |                   15
 myschema2  | mytbl2   |       12402 |                    2
 myschema2  | mytbl4   |       12402 |                    6
 myschema2  | mytbl5   |       12402 |                    5
 myschema2  | mytbl6   |       12402 |                   17
 myschema2  | myTbl3   |       12403 |                   10
 myschema2  | mytbl1   |       12403 |                   15
 myschema2  | mytbl2   |       12403 |                    2
 myschema2  | mytbl4   |       12403 |                    8
 myschema2  | mytbl5   |       12403 |                    6
 myschema2  | mytbl6   |       12403 |                   20
(57 rows)

SELECT time_id, time_last_emaj_gid, time_event FROM emaj.emaj_time_stamp WHERE time_id >= 12400 ORDER BY time_id;
 time_id | time_last_emaj_gid | time_event 
---------+--------------------+------------
   12400 |           12400000 | R
   12401 |           12400006 | M
   12402 |           12400006 | R
   12403 |           12400012 | M
(4 rows)

SELECT hist_function, hist_event, hist_object,
       regexp_replace(regexp_replace(regexp_replace(hist_wording,
            E'\\d\\d\.\\d\\d\\.\\d\\d\\.\\d\\d\\d\\d', '%', 'g'),
            E'\\d\\d\\d\\d/\\d\\d\\/\\d\\d\\ \\d\\d\\:\\d\\d:\\d\\d .*?\\)', '<timestamp>)', 'g'),
            E'\\[.+\\]', '(timestamp)', 'g'),
       hist_user
  FROM emaj.emaj_hist WHERE hist_id >= 12400 ORDER BY hist_id;
   hist_function   |   hist_event   |    hist_object    |                                           regexp_replace                                           |     hist_user      
-------------------+----------------+-------------------+----------------------------------------------------------------------------------------------------+--------------------
 ROLLBACK_GROUP    | BEGIN          | myGroup2          | Logged rollback to mark M2 (timestamp)                                                             | _regress_emaj_adm2
 DBLINK_OPEN_CNX   |                | rlbk#1            | Status = -1 (dblink extension not installed)                                                       | _regress_emaj_adm2
 LOCK_GROUP        | BEGIN          | myGroup2          | Rollback session #1                                                                                | _regress_emaj_adm2
 LOCK_GROUP        | END            | myGroup2          | Rollback session #1: 6 tables locked, 0 deadlock(s)                                                | _regress_emaj_adm2
 ROLLBACK_GROUP    | TIME STAMP SET | 12400             |                                                                                                    | _regress_emaj_adm2
 SET_MARK_GROUP    | BEGIN          | myGroup2          | RLBK_12400_START                                                                                   | _regress_emaj_adm2
 SET_MARK_GROUP    | END            | myGroup2          | RLBK_12400_START                                                                                   | _regress_emaj_adm2
 ROLLBACK_SEQUENCE |                | myschema2.myseq1  | RESTART 1001 MAXVALUE 2000 CYCLE                                                                   | _regress_emaj_adm2
 ROLLBACK_TABLE    | BEGIN          | myschema2.mytbl4  | All log rows where emaj_gid > 12300041 and <= 12400000, in session_replication_role = replica mode | _regress_emaj_adm2
 ROLLBACK_TABLE    | END            | myschema2.mytbl4  | 2 rolled back primary keys                                                                         | _regress_emaj_adm2
 ROLLBACK_TABLE    | BEGIN          | myschema2.mytbl6  | All log rows where emaj_gid > 12300041 and <= 12400000                                             | _regress_emaj_adm2
 ROLLBACK_TABLE    | END            | myschema2.mytbl6  | 3 rolled back primary keys                                                                         | _regress_emaj_adm2
 ROLLBACK_TABLE    | BEGIN          | myschema2.mytbl5  | All log rows where emaj_gid > 12300041 and <= 12400000                                             | _regress_emaj_adm2
 ROLLBACK_TABLE    | END            | myschema2.mytbl5  | 1 rolled back primary keys                                                                         | _regress_emaj_adm2
 ROLLBACK_GROUP    | TIME STAMP SET | 12401             |                                                                                                    | _regress_emaj_adm2
 SET_MARK_GROUP    | BEGIN          | myGroup2          | RLBK_12400_DONE                                                                                    | _regress_emaj_adm2
 SET_MARK_GROUP    | END            | myGroup2          | RLBK_12400_DONE                                                                                    | _regress_emaj_adm2
 ROLLBACK_GROUP    | NOTICE         | Rollback id 12400 | Rollback id = 12400.                                                                               | _regress_emaj_adm2
 ROLLBACK_GROUP    | NOTICE         | Rollback id 12400 | 3 / 6 tables effectively processed.                                                                | _regress_emaj_adm2
 ROLLBACK_GROUP    | NOTICE         | Rollback id 12400 | 1 / 2 sequences effectively processed.                                                             | _regress_emaj_adm2
 ROLLBACK_GROUP    | END            | myGroup2          | Rollback_id 12400                                                                                  | _regress_emaj_adm2
 ROLLBACK_GROUP    | BEGIN          | myGroup2          | Logged rollback to mark M3 (timestamp)                                                             | _regress_emaj_adm2
 DBLINK_OPEN_CNX   |                | rlbk#1            | Status = -1 (dblink extension not installed)                                                       | _regress_emaj_adm2
 LOCK_GROUP        | BEGIN          | myGroup2          | Rollback session #1                                                                                | _regress_emaj_adm2
 LOCK_GROUP        | END            | myGroup2          | Rollback session #1: 6 tables locked, 0 deadlock(s)                                                | _regress_emaj_adm2
 ROLLBACK_GROUP    | TIME STAMP SET | 12402             |                                                                                                    | _regress_emaj_adm2
 SET_MARK_GROUP    | BEGIN          | myGroup2          | RLBK_12401_START                                                                                   | _regress_emaj_adm2
 SET_MARK_GROUP    | END            | myGroup2          | RLBK_12401_START                                                                                   | _regress_emaj_adm2
 ROLLBACK_SEQUENCE |                | myschema2.myseq1  | RESTART 1004 MAXVALUE 9223372036854775807 NO CYCLE                                                 | _regress_emaj_adm2
 ROLLBACK_TABLE    | BEGIN          | myschema2.mytbl6  | All log rows where emaj_gid > 12300049 and <= 12400006                                             | _regress_emaj_adm2
 ROLLBACK_TABLE    | END            | myschema2.mytbl6  | 3 rolled back primary keys                                                                         | _regress_emaj_adm2
 ROLLBACK_TABLE    | BEGIN          | myschema2.mytbl4  | All log rows where emaj_gid > 12300049 and <= 12400006, in session_replication_role = replica mode | _regress_emaj_adm2
 ROLLBACK_TABLE    | END            | myschema2.mytbl4  | 2 rolled back primary keys                                                                         | _regress_emaj_adm2
 ROLLBACK_TABLE    | BEGIN          | myschema2.mytbl5  | All log rows where emaj_gid > 12300049 and <= 12400006                                             | _regress_emaj_adm2
 ROLLBACK_TABLE    | END            | myschema2.mytbl5  | 1 rolled back primary keys                                                                         | _regress_emaj_adm2
 ROLLBACK_GROUP    | TIME STAMP SET | 12403             |                                                                                                    | _regress_emaj_adm2
 SET_MARK_GROUP    | BEGIN          | myGroup2          | RLBK_12401_DONE                                                                                    | _regress_emaj_adm2
 SET_MARK_GROUP    | END            | myGroup2          | RLBK_12401_DONE                                                                                    | _regress_emaj_adm2
 ROLLBACK_GROUP    | NOTICE         | Rollback id 12401 | Rollback id = 12401.                                                                               | _regress_emaj_adm2
 ROLLBACK_GROUP    | NOTICE         | Rollback id 12401 | 3 / 6 tables effectively processed.                                                                | _regress_emaj_adm2
 ROLLBACK_GROUP    | NOTICE         | Rollback id 12401 | 1 / 2 sequences effectively processed.                                                             | _regress_emaj_adm2
 ROLLBACK_GROUP    | END            | myGroup2          | Rollback_id 12401                                                                                  | _regress_emaj_adm2
(42 rows)

-- User tables.
RESET session_authorization;
SELECT * FROM mySchema2.myTbl1 ORDER BY col11, col12;
 col11 |   col12    | col13 
-------+------------+-------
     1 | ABC        | \x1c
     2 | ABC        | \x1c
     3 | ABC        | \x1c
     4 | ABC        | \x0c
     5 | ABC        | \x0c
     6 | ABC        | \x0c
     7 | ABC        | \x0c
     8 | ABC        | \x0c
     9 | ABC        | \x0c
    10 | ABC        | \x0c
(10 rows)

SELECT * FROM mySchema2.myTbl2 ORDER BY col21;
 col21 | col22 |   col23    
-------+-------+------------
     1 | ABC   | 01-01-2010
     2 | DEF   | 
(2 rows)

SELECT col31, col33 FROM mySchema2."myTbl3" ORDER BY col31;
 col31 | col33 
-------+-------
    11 | 10.00
    12 | 10.00
    13 | 10.00
    14 | 10.00
    15 | 10.00
    16 | 10.00
    17 | 10.00
    18 | 10.00
    19 | 10.00
    20 | 10.00
(10 rows)

SELECT * FROM mySchema2.myTbl4 ORDER BY col41;
 col41 | col42 | col43 | col44 |   col45    
-------+-------+-------+-------+------------
     1 | FK... |     2 |     1 | ABC       
     2 | FK... |     2 |     1 | ABC       
(2 rows)

SELECT * FROM mySchema2.myTbl5 ORDER BY col51;
 col51 |     col52     |  col53  |          col54          |          col55          | col56 |          col57          |          col58          | col59 
-------+---------------+---------+-------------------------+-------------------------+-------+-------------------------+-------------------------+-------
     1 | {abc,def,ghi} | {1,2,3} | {11-28-2010,12-03-2010} | {"id":1001, "c2":"def"} |       | {"id":1001, "c3":"ghi"} | [01-01-2020,01-01-2021) | 
(1 row)

SELECT * FROM mySchema2.myTbl6 ORDER BY col61;
 col61 |  col62  |     col63     |   col64   |         col65         |     col66      |   col67   |     col68     |   col69   
-------+---------+---------------+-----------+-----------------------+----------------+-----------+---------------+-----------
     0 |         |               |           |                       |                |           |               | 
     4 | (4,1.3) | (4.2,1),(4,0) | <(5,5),4> | ((-2,-2),(3,0),(1,4)) | 10.20.30.40/27 | EXECUTING | (4,"(4,1.3)") | (4.1,0.5)
     5 | (5,1.3) | (5.2,1),(5,0) | <(5,5),5> | ((-2,-2),(3,0),(1,4)) | 10.20.30.40/27 | EXECUTING | (5,"(5,1.3)") | (5.1,0.5)
     6 | (6,1.3) | (6.2,1),(6,0) | <(5,5),6> | ((-2,-2),(3,0),(1,4)) | 10.20.30.40/27 | EXECUTING | (6,"(6,1.3)") | (6.1,0.5)
     7 | (7,1.3) | (7.2,1),(7,0) | <(5,5),7> | ((-2,-2),(3,0),(1,4)) | 10.20.30.40/27 | EXECUTING | (7,"(7,1.3)") | (7.1,0.5)
     8 | (8,1.3) | (8.2,1),(8,0) | <(5,5),8> | ((-2,-2),(3,0),(1,4)) | 10.20.30.40/27 | EXECUTING | (8,"(8,1.3)") | (8.1,0.5)
(6 rows)

-- Log tables.
SET session_authorization TO _regress_emaj_adm1;
SELECT col11, col12, col13, emaj_verb, emaj_tuple, emaj_gid FROM emaj_mySchema2.myTbl1_log ORDER BY emaj_gid, emaj_tuple DESC;
 col11 |   col12    | col13 | emaj_verb | emaj_tuple | emaj_gid 
-------+------------+-------+-----------+------------+----------
     1 | ABC        | \x0c  | INS       | NEW        | 12300001
     2 | ABC        | \x0c  | INS       | NEW        | 12300002
     3 | ABC        | \x0c  | INS       | NEW        | 12300003
     4 | ABC        | \x0c  | INS       | NEW        | 12300004
     5 | ABC        | \x0c  | INS       | NEW        | 12300005
     6 | ABC        | \x0c  | INS       | NEW        | 12300006
     7 | ABC        | \x0c  | INS       | NEW        | 12300007
     8 | ABC        | \x0c  | INS       | NEW        | 12300008
     9 | ABC        | \x0c  | INS       | NEW        | 12300009
    10 | ABC        | \x0c  | INS       | NEW        | 12300010
    11 | ABC        | \x0c  | INS       | NEW        | 12300011
     1 | ABC        | \x0c  | UPD       | OLD        | 12300012
     1 | ABC        | \x1c  | UPD       | NEW        | 12300012
     2 | ABC        | \x0c  | UPD       | OLD        | 12300013
     2 | ABC        | \x1c  | UPD       | NEW        | 12300013
     3 | ABC        | \x0c  | UPD       | OLD        | 12300014
     3 | ABC        | \x1c  | UPD       | NEW        | 12300014
    11 | ABC        | \x0c  | DEL       | OLD        | 12300016
(18 rows)

SELECT col21, col22, col23, emaj_verb, emaj_tuple, emaj_gid FROM emaj_mySchema2.myTbl2_log ORDER BY emaj_gid, emaj_tuple DESC;
 col21 | col22 |   col23    | emaj_verb | emaj_tuple | emaj_gid 
-------+-------+------------+-----------+------------+----------
     1 | ABC   | 01-01-2010 | INS       | NEW        | 12300015
     2 | DEF   |            | INS       | NEW        | 12300017
(2 rows)

SELECT col31, col33, emaj_verb, emaj_tuple, emaj_gid FROM emaj_myschema2."myTbl3_log" ORDER BY emaj_gid, emaj_tuple DESC;
 col31 | col33 | emaj_verb | emaj_tuple | emaj_gid 
-------+-------+-----------+------------+----------
    11 | 10.00 | INS       | NEW        | 12300018
    12 | 10.00 | INS       | NEW        | 12300019
    13 | 10.00 | INS       | NEW        | 12300020
    14 | 10.00 | INS       | NEW        | 12300021
    15 | 10.00 | INS       | NEW        | 12300022
    16 | 10.00 | INS       | NEW        | 12300023
    17 | 10.00 | INS       | NEW        | 12300024
    18 | 10.00 | INS       | NEW        | 12300025
    19 | 10.00 | INS       | NEW        | 12300026
    20 | 10.00 | INS       | NEW        | 12300027
(10 rows)

SELECT col41, col42, col43, col44, col45, emaj_verb, emaj_tuple, emaj_gid FROM emaj_myschema2.mytbl4_log ORDER BY emaj_gid, emaj_tuple DESC;
 col41 | col42 | col43 | col44 |   col45    | emaj_verb | emaj_tuple | emaj_gid 
-------+-------+-------+-------+------------+-----------+------------+----------
     1 | FK... |     1 |     1 | ABC        | INS       | NEW        | 12300042
     2 | FK... |     1 |     1 | ABC        | INS       | NEW        | 12300043
     1 | FK... |     1 |     1 | ABC        | UPD       | OLD        | 12300044
     1 | FK... |     2 |     1 | ABC        | UPD       | NEW        | 12300044
     2 | FK... |     1 |     1 | ABC        | UPD       | OLD        | 12300045
     2 | FK... |     2 |     1 | ABC        | UPD       | NEW        | 12300045
     1 | FK... |     2 |     1 | ABC        | DEL       | OLD        | 12400001
     2 | FK... |     2 |     1 | ABC        | DEL       | OLD        | 12400002
     1 | FK... |     2 |     1 | ABC        | INS       | NEW        | 12400010
     2 | FK... |     2 |     1 | ABC        | INS       | NEW        | 12400011
(10 rows)

SELECT col51, col52, col53, col54, emaj_verb, emaj_tuple, emaj_gid FROM emaj_myschema2.mytbl5_log ORDER BY emaj_gid, emaj_tuple DESC;
 col51 |     col52     |  col53  |          col54          | emaj_verb | emaj_tuple | emaj_gid 
-------+---------------+---------+-------------------------+-----------+------------+----------
     1 | {abc,def,ghi} | {1,2,3} |                         | INS       | NEW        | 12300028
     2 | {abc,def,ghi} | {3,4,5} | {02-01-2000,02-28-2000} | INS       | NEW        | 12300029
     1 | {abc,def,ghi} | {1,2,3} |                         | UPD       | OLD        | 12300030
     1 | {abc,def,ghi} | {1,2,3} | {11-28-2010,12-03-2010} | UPD       | NEW        | 12300030
     2 | {abc,def,ghi} | {3,4,5} | {02-01-2000,02-28-2000} | DEL       | OLD        | 12300046
     2 | {abc,def,ghi} | {3,4,5} | {02-01-2000,02-28-2000} | INS       | NEW        | 12400006
     2 | {abc,def,ghi} | {3,4,5} | {02-01-2000,02-28-2000} | DEL       | OLD        | 12400012
(7 rows)

SELECT col61, col62, col63, col64, col65, col66, emaj_verb, emaj_tuple, emaj_gid FROM emaj_mySchema2.myTbl6_log ORDER BY emaj_gid, emaj_tuple DESC;
 col61 |  col62  |     col63     |    col64    |         col65         |     col66      | emaj_verb | emaj_tuple | emaj_gid 
-------+---------+---------------+-------------+-----------------------+----------------+-----------+------------+----------
     1 | (1,1.3) | (1.2,1),(1,0) | <(5,5),1>   | ((-2,-2),(3,0),(1,4)) | 10.20.30.40/27 | INS       | NEW        | 12300031
     2 | (2,1.3) | (2.2,1),(2,0) | <(5,5),2>   | ((-2,-2),(3,0),(1,4)) | 10.20.30.40/27 | INS       | NEW        | 12300032
     3 | (3,1.3) | (3.2,1),(3,0) | <(5,5),3>   | ((-2,-2),(3,0),(1,4)) | 10.20.30.40/27 | INS       | NEW        | 12300033
     4 | (4,1.3) | (4.2,1),(4,0) | <(5,5),4>   | ((-2,-2),(3,0),(1,4)) | 10.20.30.40/27 | INS       | NEW        | 12300034
     5 | (5,1.3) | (5.2,1),(5,0) | <(5,5),5>   | ((-2,-2),(3,0),(1,4)) | 10.20.30.40/27 | INS       | NEW        | 12300035
     6 | (6,1.3) | (6.2,1),(6,0) | <(5,5),6>   | ((-2,-2),(3,0),(1,4)) | 10.20.30.40/27 | INS       | NEW        | 12300036
     7 | (7,1.3) | (7.2,1),(7,0) | <(5,5),7>   | ((-2,-2),(3,0),(1,4)) | 10.20.30.40/27 | INS       | NEW        | 12300037
     8 | (8,1.3) | (8.2,1),(8,0) | <(5,5),8>   | ((-2,-2),(3,0),(1,4)) | 10.20.30.40/27 | INS       | NEW        | 12300038
     1 | (1,1.3) | (1.2,1),(1,0) | <(5,5),1>   | ((-2,-2),(3,0),(1,4)) | 10.20.30.40/27 | UPD       | OLD        | 12300039
     1 | (1,1.3) | (1.2,1),(1,0) | <(5,6),3.5> |                       | 10.20.30.40/27 | UPD       | NEW        | 12300039
     2 | (2,1.3) | (2.2,1),(2,0) | <(5,5),2>   | ((-2,-2),(3,0),(1,4)) | 10.20.30.40/27 | UPD       | OLD        | 12300040
     2 | (2,1.3) | (2.2,1),(2,0) | <(5,6),3.5> |                       | 10.20.30.40/27 | UPD       | NEW        | 12300040
     3 | (3,1.3) | (3.2,1),(3,0) | <(5,5),3>   | ((-2,-2),(3,0),(1,4)) | 10.20.30.40/27 | UPD       | OLD        | 12300041
     3 | (3,1.3) | (3.2,1),(3,0) | <(5,6),3.5> |                       | 10.20.30.40/27 | UPD       | NEW        | 12300041
     1 | (1,1.3) | (1.2,1),(1,0) | <(5,6),3.5> |                       | 10.20.30.40/27 | DEL       | OLD        | 12300047
     2 | (2,1.3) | (2.2,1),(2,0) | <(5,6),3.5> |                       | 10.20.30.40/27 | DEL       | OLD        | 12300048
     3 | (3,1.3) | (3.2,1),(3,0) | <(5,6),3.5> |                       | 10.20.30.40/27 | DEL       | OLD        | 12300049
     1 | (1,1.3) | (1.2,1),(1,0) | <(5,6),3.5> |                       | 10.20.30.40/27 | INS       | NEW        | 12400003
     2 | (2,1.3) | (2.2,1),(2,0) | <(5,6),3.5> |                       | 10.20.30.40/27 | INS       | NEW        | 12400004
     3 | (3,1.3) | (3.2,1),(3,0) | <(5,6),3.5> |                       | 10.20.30.40/27 | INS       | NEW        | 12400005
     1 | (1,1.3) | (1.2,1),(1,0) | <(5,6),3.5> |                       | 10.20.30.40/27 | DEL       | OLD        | 12400007
     2 | (2,1.3) | (2.2,1),(2,0) | <(5,6),3.5> |                       | 10.20.30.40/27 | DEL       | OLD        | 12400008
     3 | (3,1.3) | (3.2,1),(3,0) | <(5,6),3.5> |                       | 10.20.30.40/27 | DEL       | OLD        | 12400009
(23 rows)

-- Set sequence restart value.
SELECT public.handle_emaj_sequences(12500);
 handle_emaj_sequences 
-----------------------
 
(1 row)

-----------------------------
-- Step 4 : for myGroup1, rollback then update tables then set 3 marks.
-----------------------------
SELECT * FROM emaj.emaj_rollback_group('myGroup1', 'M2', FALSE) ORDER BY 1, 2;
 rlbk_severity |              rlbk_message              
---------------+----------------------------------------
 Notice        | 0 / 2 sequences effectively processed.
 Notice        | 2 / 5 tables effectively processed.
 Notice        | Rollback id = 12500.
(3 rows)

--
RESET session_authorization;
SET search_path TO public, myschema1;
INSERT INTO myTbl1 SELECT i, 'DEF', E'\\000'::bytea FROM generate_series (100, 110) AS i;
INSERT INTO myTbl2 VALUES (3, 'GHI', '2010-01-02');
DELETE FROM myTbl1 WHERE col11 = 1;
--
SET session_authorization TO _regress_emaj_adm1;
SELECT emaj.emaj_set_mark_group('myGroup1', 'M4');
 emaj_set_mark_group 
---------------------
                   7
(1 row)

--
RESET session_authorization;
UPDATE "myTbl3" SET col33 = col33 / 2;
--
SET session_authorization TO _regress_emaj_adm1;
SELECT emaj.emaj_set_mark_group('myGroup1', 'M5');
 emaj_set_mark_group 
---------------------
                   7
(1 row)

--
RESET session_authorization;
UPDATE myTbl1 SET col11 = 99 WHERE col11 = 1;
--
set session_authorization TO _regress_emaj_adm1;
SELECT emaj.emaj_set_mark_group('myGroup1', 'M6');
 emaj_set_mark_group 
---------------------
                   7
(1 row)

-----------------------------
-- Checking step 4.
-----------------------------
-- emaj tables.
SELECT mark_group, regexp_replace(mark_name, E'\\d\\d\.\\d\\d\\.\\d\\d\\.\\d\\d\\d\\d', '%', 'g'), mark_time_id, mark_is_rlbk_protected,
       mark_comment, mark_log_rows_before_next, mark_logged_rlbk_target_mark
  FROM emaj.emaj_mark ORDER BY mark_time_id, mark_group;
 mark_group |  regexp_replace  | mark_time_id | mark_is_rlbk_protected |                  mark_comment                  | mark_log_rows_before_next | mark_logged_rlbk_target_mark 
------------+------------------+--------------+------------------------+------------------------------------------------+---------------------------+------------------------------
 myGroup1   | M1               |        12016 | f                      |                                                |                        29 | 
 myGroup2   | M1               |        12017 | f                      |                                                |                        41 | 
 myGroup1   | M2               |        12200 | f                      |                                                |                        14 | 
 myGroup2   | M2               |        12300 | f                      |                                                |                         8 | 
 myGroup2   | M3               |        12301 | f                      |                                                |                         0 | 
 myGroup2   | RLBK_12400_START |        12400 | f                      | Automatically set at rollback to mark M2 start |                         6 | 
 myGroup2   | RLBK_12400_DONE  |        12401 | f                      | Automatically set at rollback to mark M2 end   |                         0 | M2
 myGroup2   | RLBK_12401_START |        12402 | f                      | Automatically set at rollback to mark M3 start |                         6 | 
 myGroup2   | RLBK_12401_DONE  |        12403 | f                      | Automatically set at rollback to mark M3 end   |                           | M3
 myGroup1   | M4               |        12501 | f                      |                                                |                        10 | 
 myGroup1   | M5               |        12502 | f                      |                                                |                         0 | 
 myGroup1   | M6               |        12503 | f                      |                                                |                           | 
(12 rows)

SELECT sequ_schema, sequ_name, sequ_time_id, sequ_last_val, sequ_is_called
  FROM emaj.emaj_sequence ORDER BY sequ_time_id, sequ_schema, sequ_name;
 sequ_schema |     sequ_name     | sequ_time_id | sequ_last_val | sequ_is_called 
-------------+-------------------+--------------+---------------+----------------
 myschema1   | myTbl3_col31_seq  |        12016 |            11 | f
 myschema1   | mytbl2b_col20_seq |        12016 |             3 | f
 myschema2   | myTbl3_col31_seq  |        12017 |            11 | f
 myschema2   | myseq1            |        12017 |          1000 | f
 myschema1   | myTbl3_col31_seq  |        12200 |            20 | t
 myschema1   | mytbl2b_col20_seq |        12200 |             4 | t
 myschema2   | myTbl3_col31_seq  |        12300 |            20 | t
 myschema2   | myseq1            |        12300 |          1000 | t
 myschema2   | myTbl3_col31_seq  |        12301 |            20 | t
 myschema2   | myseq1            |        12301 |          1003 | t
 myschema2   | myTbl3_col31_seq  |        12400 |            20 | t
 myschema2   | myseq1            |        12400 |          1003 | t
 myschema2   | myTbl3_col31_seq  |        12401 |            20 | t
 myschema2   | myseq1            |        12401 |          1001 | f
 myschema2   | myTbl3_col31_seq  |        12402 |            20 | t
 myschema2   | myseq1            |        12402 |          1001 | f
 myschema2   | myTbl3_col31_seq  |        12403 |            20 | t
 myschema2   | myseq1            |        12403 |          1004 | f
 myschema1   | myTbl3_col31_seq  |        12501 |            20 | t
 myschema1   | mytbl2b_col20_seq |        12501 |             5 | t
 myschema1   | myTbl3_col31_seq  |        12502 |            20 | t
 myschema1   | mytbl2b_col20_seq |        12502 |             5 | t
 myschema1   | myTbl3_col31_seq  |        12503 |            20 | t
 myschema1   | mytbl2b_col20_seq |        12503 |             5 | t
(24 rows)

SELECT tbl_schema, tbl_name, tbl_time_id, tbl_log_seq_last_val
  FROM emaj.emaj_table ORDER BY tbl_time_id, tbl_schema, tbl_name;
 tbl_schema | tbl_name | tbl_time_id | tbl_log_seq_last_val 
------------+----------+-------------+----------------------
 myschema1  | myTbl3   |       12016 |                    0
 myschema1  | mytbl1   |       12016 |                    0
 myschema1  | mytbl2   |       12016 |                    0
 myschema1  | mytbl2b  |       12016 |                    0
 myschema1  | mytbl4   |       12016 |                    0
 myschema2  | myTbl3   |       12017 |                    0
 myschema2  | mytbl1   |       12017 |                    0
 myschema2  | mytbl2   |       12017 |                    0
 myschema2  | mytbl4   |       12017 |                    0
 myschema2  | mytbl5   |       12017 |                    0
 myschema2  | mytbl6   |       12017 |                    0
 myschema1  | myTbl3   |       12200 |                   10
 myschema1  | mytbl1   |       12200 |                   15
 myschema1  | mytbl2   |       12200 |                    2
 myschema1  | mytbl2b  |       12200 |                    2
 myschema1  | mytbl4   |       12200 |                    0
 myschema2  | myTbl3   |       12300 |                   10
 myschema2  | mytbl1   |       12300 |                   15
 myschema2  | mytbl2   |       12300 |                    2
 myschema2  | mytbl4   |       12300 |                    0
 myschema2  | mytbl5   |       12300 |                    3
 myschema2  | mytbl6   |       12300 |                   11
 myschema2  | myTbl3   |       12301 |                   10
 myschema2  | mytbl1   |       12301 |                   15
 myschema2  | mytbl2   |       12301 |                    2
 myschema2  | mytbl4   |       12301 |                    4
 myschema2  | mytbl5   |       12301 |                    4
 myschema2  | mytbl6   |       12301 |                   14
 myschema2  | myTbl3   |       12400 |                   10
 myschema2  | mytbl1   |       12400 |                   15
 myschema2  | mytbl2   |       12400 |                    2
 myschema2  | mytbl4   |       12400 |                    4
 myschema2  | mytbl5   |       12400 |                    4
 myschema2  | mytbl6   |       12400 |                   14
 myschema2  | myTbl3   |       12401 |                   10
 myschema2  | mytbl1   |       12401 |                   15
 myschema2  | mytbl2   |       12401 |                    2
 myschema2  | mytbl4   |       12401 |                    6
 myschema2  | mytbl5   |       12401 |                    5
 myschema2  | mytbl6   |       12401 |                   17
 myschema2  | myTbl3   |       12402 |                   10
 myschema2  | mytbl1   |       12402 |                   15
 myschema2  | mytbl2   |       12402 |                    2
 myschema2  | mytbl4   |       12402 |                    6
 myschema2  | mytbl5   |       12402 |                    5
 myschema2  | mytbl6   |       12402 |                   17
 myschema2  | myTbl3   |       12403 |                   10
 myschema2  | mytbl1   |       12403 |                   15
 myschema2  | mytbl2   |       12403 |                    2
 myschema2  | mytbl4   |       12403 |                    8
 myschema2  | mytbl5   |       12403 |                    6
 myschema2  | mytbl6   |       12403 |                   20
 myschema1  | myTbl3   |       12501 |                   10
 myschema1  | mytbl1   |       12501 |                   30
 myschema1  | mytbl2   |       12501 |                    3
 myschema1  | mytbl2b  |       12501 |                    3
 myschema1  | mytbl4   |       12501 |                    8
 myschema1  | myTbl3   |       12502 |                   20
 myschema1  | mytbl1   |       12502 |                   30
 myschema1  | mytbl2   |       12502 |                    3
 myschema1  | mytbl2b  |       12502 |                    3
 myschema1  | mytbl4   |       12502 |                    8
 myschema1  | myTbl3   |       12503 |                   20
 myschema1  | mytbl1   |       12503 |                   30
 myschema1  | mytbl2   |       12503 |                    3
 myschema1  | mytbl2b  |       12503 |                    3
 myschema1  | mytbl4   |       12503 |                    8
(67 rows)

SELECT time_id, time_last_emaj_gid, time_event FROM emaj.emaj_time_stamp WHERE time_id >= 12500 ORDER BY time_id;
 time_id | time_last_emaj_gid | time_event 
---------+--------------------+------------
   12500 |           12500000 | R
   12501 |           12500014 | M
   12502 |           12500024 | M
   12503 |           12500024 | M
(4 rows)

SELECT hist_function, hist_event, hist_object,
       regexp_replace(regexp_replace(regexp_replace(hist_wording,
            E'\\d\\d\.\\d\\d\\.\\d\\d\\.\\d\\d\\d\\d', '%', 'g'),
            E'\\d\\d\\d\\d/\\d\\d\\/\\d\\d\\ \\d\\d\\:\\d\\d:\\d\\d .*?\\)', '<timestamp>)', 'g'),
            E'\\[.+\\]', '(timestamp)', 'g'),
       hist_user
  FROM emaj.emaj_hist WHERE hist_id >= 12500 ORDER BY hist_id;
   hist_function    |   hist_event   |    hist_object    |                                           regexp_replace                                           |     hist_user      
--------------------+----------------+-------------------+----------------------------------------------------------------------------------------------------+--------------------
 ROLLBACK_GROUP     | BEGIN          | myGroup1          | Unlogged rollback to mark M2 (timestamp)                                                           | _regress_emaj_adm1
 DBLINK_OPEN_CNX    |                | rlbk#1            | Status = 1                                                                                         | _regress_emaj_adm1
 LOCK_GROUP         | BEGIN          | myGroup1          | Rollback session #1                                                                                | _regress_emaj_adm1
 LOCK_GROUP         | END            | myGroup1          | Rollback session #1: 5 tables locked, 0 deadlock(s)                                                | _regress_emaj_adm1
 ROLLBACK_GROUP     | TIME STAMP SET | 12500             |                                                                                                    | _regress_emaj_adm1
 ROLLBACK_TABLE     | BEGIN          | myschema1.mytbl4  | All log rows where emaj_gid > 12200029 and <= 12500000, in session_replication_role = replica mode | _regress_emaj_adm1
 ROLLBACK_TABLE     | END            | myschema1.mytbl4  | 5 rolled back primary keys                                                                         | _regress_emaj_adm1
 ROLLBACK_TABLE     | BEGIN          | myschema1.mytbl1  | All log rows where emaj_gid > 12200029 and <= 12500000, in session_replication_role = replica mode | _regress_emaj_adm1
 ROLLBACK_TABLE     | END            | myschema1.mytbl1  | 5 rolled back primary keys                                                                         | _regress_emaj_adm1
 ROLLBACK_GROUP     | MARK DELETED   | myGroup1          | mark M3 is deleted                                                                                 | _regress_emaj_adm1
 ROLLBACK_GROUP     | NOTICE         | Rollback id 12500 | Rollback id = 12500.                                                                               | _regress_emaj_adm1
 ROLLBACK_GROUP     | NOTICE         | Rollback id 12500 | 2 / 5 tables effectively processed.                                                                | _regress_emaj_adm1
 ROLLBACK_GROUP     | NOTICE         | Rollback id 12500 | 0 / 2 sequences effectively processed.                                                             | _regress_emaj_adm1
 DBLINK_CLOSE_CNX   |                | rlbk#1            |                                                                                                    | _regress_emaj_adm1
 ROLLBACK_GROUP     | END            | myGroup1          | Rollback_id 12500                                                                                  | _regress_emaj_adm1
 SET_MARK_GROUP     | BEGIN          | myGroup1          | M4                                                                                                 | _regress_emaj_adm1
 LOCK_GROUP         | BEGIN          | myGroup1          |                                                                                                    | _regress_emaj_adm1
 LOCK_GROUP         | END            | myGroup1          | 5 tables locked, 0 deadlock(s)                                                                     | _regress_emaj_adm1
 SET_MARK_GROUP     | TIME STAMP SET | 12501             |                                                                                                    | _regress_emaj_adm1
 CLEANUP_RLBK_STATE |                | Rollback id 12500 | set to COMMITTED                                                                                   | _regress_emaj_adm1
 SET_MARK_GROUP     | END            | myGroup1          | M4                                                                                                 | _regress_emaj_adm1
 SET_MARK_GROUP     | BEGIN          | myGroup1          | M5                                                                                                 | _regress_emaj_adm1
 LOCK_GROUP         | BEGIN          | myGroup1          |                                                                                                    | _regress_emaj_adm1
 LOCK_GROUP         | END            | myGroup1          | 5 tables locked, 0 deadlock(s)                                                                     | _regress_emaj_adm1
 SET_MARK_GROUP     | TIME STAMP SET | 12502             |                                                                                                    | _regress_emaj_adm1
 SET_MARK_GROUP     | END            | myGroup1          | M5                                                                                                 | _regress_emaj_adm1
 SET_MARK_GROUP     | BEGIN          | myGroup1          | M6                                                                                                 | _regress_emaj_adm1
 LOCK_GROUP         | BEGIN          | myGroup1          |                                                                                                    | _regress_emaj_adm1
 LOCK_GROUP         | END            | myGroup1          | 5 tables locked, 0 deadlock(s)                                                                     | _regress_emaj_adm1
 SET_MARK_GROUP     | TIME STAMP SET | 12503             |                                                                                                    | _regress_emaj_adm1
 SET_MARK_GROUP     | END            | myGroup1          | M6                                                                                                 | _regress_emaj_adm1
(31 rows)

-- User tables.
RESET session_authorization;
SELECT * FROM mySchema1.myTbl1 ORDER BY col11, col12;
 col11 |   col12    | col13 
-------+------------+-------
     2 | ABC        | \x1c
     3 | ABC        | \x1c
     4 | ABC        | \x0c
     5 | ABC        | \x0c
     6 | ABC        | \x0c
     7 | ABC        | \x0c
     8 | ABC        | \x0c
     9 | ABC        | \x0c
    10 | ABC        | \x0c
   100 | DEF        | \x00
   101 | DEF        | \x00
   102 | DEF        | \x00
   103 | DEF        | \x00
   104 | DEF        | \x00
   105 | DEF        | \x00
   106 | DEF        | \x00
   107 | DEF        | \x00
   108 | DEF        | \x00
   109 | DEF        | \x00
   110 | DEF        | \x00
(20 rows)

SELECT * FROM mySchema1.myTbl2 ORDER BY col21;
 col21 | col22 |   col23    
-------+-------+------------
     1 | ABC   | 12-31-2010
     2 | DEF   | 
     3 | GHI   | 01-02-2010
(3 rows)

SELECT * FROM mySchema1.myTbl2b ORDER BY col20;
 col20 | col21 |       col22        |         col23         | col24 
-------+-------+--------------------+-----------------------+-------
     3 |     1 |                  1 |    0.7071067811865476 | t
     4 |     2 |                0.5 | 6.123233995736766e-17 | t
     5 |     3 | 0.3333333333333333 |   -0.7071067811865475 | t
(3 rows)

SELECT col31, col33 FROM mySchema1."myTbl3" ORDER BY col31;
 col31 | col33 
-------+-------
    11 |  5.00
    12 |  5.00
    13 |  5.00
    14 |  5.00
    15 |  5.00
    16 |  5.00
    17 |  5.00
    18 |  5.00
    19 |  5.00
    20 |  5.00
(10 rows)

SELECT * FROM mySchema1.myTbl4 ORDER BY col41;
 col41 | col42 | col43 | col44 | col45 
-------+-------+-------+-------+-------
(0 rows)

-- Log tables.
SET session_authorization TO _regress_emaj_adm1;
SELECT col11, col12, col13, emaj_verb, emaj_tuple, emaj_gid FROM emaj_mySchema1.myTbl1_log ORDER BY emaj_gid, emaj_tuple DESC;
 col11 |   col12    | col13 | emaj_verb | emaj_tuple | emaj_gid 
-------+------------+-------+-----------+------------+----------
     1 | ABC        | \x0c  | INS       | NEW        | 12200001
     2 | ABC        | \x0c  | INS       | NEW        | 12200002
     3 | ABC        | \x0c  | INS       | NEW        | 12200003
     4 | ABC        | \x0c  | INS       | NEW        | 12200004
     5 | ABC        | \x0c  | INS       | NEW        | 12200005
     6 | ABC        | \x0c  | INS       | NEW        | 12200006
     7 | ABC        | \x0c  | INS       | NEW        | 12200007
     8 | ABC        | \x0c  | INS       | NEW        | 12200008
     9 | ABC        | \x0c  | INS       | NEW        | 12200009
    10 | ABC        | \x0c  | INS       | NEW        | 12200010
    11 | ABC        | \x0c  | INS       | NEW        | 12200011
     1 | ABC        | \x0c  | UPD       | OLD        | 12200012
     1 | ABC        | \x1c  | UPD       | NEW        | 12200012
     2 | ABC        | \x0c  | UPD       | OLD        | 12200013
     2 | ABC        | \x1c  | UPD       | NEW        | 12200013
     3 | ABC        | \x0c  | UPD       | OLD        | 12200014
     3 | ABC        | \x1c  | UPD       | NEW        | 12200014
    11 | ABC        | \x0c  | DEL       | OLD        | 12200017
   100 | DEF        | \x00  | INS       | NEW        | 12500001
   101 | DEF        | \x00  | INS       | NEW        | 12500002
   102 | DEF        | \x00  | INS       | NEW        | 12500003
   103 | DEF        | \x00  | INS       | NEW        | 12500004
   104 | DEF        | \x00  | INS       | NEW        | 12500005
   105 | DEF        | \x00  | INS       | NEW        | 12500006
   106 | DEF        | \x00  | INS       | NEW        | 12500007
   107 | DEF        | \x00  | INS       | NEW        | 12500008
   108 | DEF        | \x00  | INS       | NEW        | 12500009
   109 | DEF        | \x00  | INS       | NEW        | 12500010
   110 | DEF        | \x00  | INS       | NEW        | 12500011
     1 | ABC        | \x1c  | DEL       | OLD        | 12500014
(30 rows)

SELECT col21, col22, col23, emaj_verb, emaj_tuple, emaj_gid FROM emaj_mySchema1.myTbl2_log ORDER BY emaj_gid, emaj_tuple DESC;
 col21 | col22 |   col23    | emaj_verb | emaj_tuple | emaj_gid 
-------+-------+------------+-----------+------------+----------
     1 | ABC   | 12-31-2010 | INS       | NEW        | 12200015
     2 | DEF   |            | INS       | NEW        | 12200018
     3 | GHI   | 01-02-2010 | INS       | NEW        | 12500012
(3 rows)

SELECT col20, col21, col22, col23, col24, emaj_verb, emaj_tuple, emaj_gid FROM emaj_mySchema1.myTbl2b_log ORDER BY emaj_gid, emaj_tuple DESC;
 col20 | col21 |       col22        |         col23         | col24 | emaj_verb | emaj_tuple | emaj_gid 
-------+-------+--------------------+-----------------------+-------+-----------+------------+----------
     3 |     1 |                  1 |    0.7071067811865476 | t     | INS       | NEW        | 12200016
     4 |     2 |                0.5 | 6.123233995736766e-17 | t     | INS       | NEW        | 12200019
     5 |     3 | 0.3333333333333333 |   -0.7071067811865475 | t     | INS       | NEW        | 12500013
(3 rows)

SELECT col31, col33, emaj_verb, emaj_tuple, emaj_gid FROM emaj_myschema1."myTbl3_log" ORDER BY emaj_gid, emaj_tuple DESC;
 col31 | col33 | emaj_verb | emaj_tuple | emaj_gid 
-------+-------+-----------+------------+----------
    11 | 10.00 | INS       | NEW        | 12200020
    12 | 10.00 | INS       | NEW        | 12200021
    13 | 10.00 | INS       | NEW        | 12200022
    14 | 10.00 | INS       | NEW        | 12200023
    15 | 10.00 | INS       | NEW        | 12200024
    16 | 10.00 | INS       | NEW        | 12200025
    17 | 10.00 | INS       | NEW        | 12200026
    18 | 10.00 | INS       | NEW        | 12200027
    19 | 10.00 | INS       | NEW        | 12200028
    20 | 10.00 | INS       | NEW        | 12200029
    11 | 10.00 | UPD       | OLD        | 12500015
    11 |  5.00 | UPD       | NEW        | 12500015
    12 | 10.00 | UPD       | OLD        | 12500016
    12 |  5.00 | UPD       | NEW        | 12500016
    13 | 10.00 | UPD       | OLD        | 12500017
    13 |  5.00 | UPD       | NEW        | 12500017
    14 | 10.00 | UPD       | OLD        | 12500018
    14 |  5.00 | UPD       | NEW        | 12500018
    15 | 10.00 | UPD       | OLD        | 12500019
    15 |  5.00 | UPD       | NEW        | 12500019
    16 | 10.00 | UPD       | OLD        | 12500020
    16 |  5.00 | UPD       | NEW        | 12500020
    17 | 10.00 | UPD       | OLD        | 12500021
    17 |  5.00 | UPD       | NEW        | 12500021
    18 | 10.00 | UPD       | OLD        | 12500022
    18 |  5.00 | UPD       | NEW        | 12500022
    19 | 10.00 | UPD       | OLD        | 12500023
    19 |  5.00 | UPD       | NEW        | 12500023
    20 | 10.00 | UPD       | OLD        | 12500024
    20 |  5.00 | UPD       | NEW        | 12500024
(30 rows)

SELECT col41, col42, col43, col44, col45, emaj_verb, emaj_tuple, emaj_gid FROM emaj_mySchema1.myTbl4_log ORDER BY emaj_gid, emaj_tuple DESC;
 col41 | col42 | col43 | col44 | col45 | emaj_verb | emaj_tuple | emaj_gid 
-------+-------+-------+-------+-------+-----------+------------+----------
(0 rows)

-- Set sequence restart value.
SELECT public.handle_emaj_sequences(12600);
 handle_emaj_sequences 
-----------------------
 
(1 row)

-----------------------------
-- Step 5 : for myGroup2, logged rollback again then unlogged rollback.
-----------------------------
SELECT * FROM emaj.emaj_logged_rollback_group('myGroup2', 'M2', FALSE) ORDER BY 1, 2;
 rlbk_severity |              rlbk_message              
---------------+----------------------------------------
 Notice        | 1 / 2 sequences effectively processed.
 Notice        | 3 / 6 tables effectively processed.
 Notice        | Rollback id = 12600.
(3 rows)

--
SELECT * FROM emaj.emaj_rollback_group('myGroup2', 'M3', FALSE) ORDER BY 1, 2;
 rlbk_severity |              rlbk_message              
---------------+----------------------------------------
 Notice        | 1 / 2 sequences effectively processed.
 Notice        | 3 / 6 tables effectively processed.
 Notice        | Rollback id = 12601.
(3 rows)

-----------------------------
-- Checking step 5.
-----------------------------
-- emaj tables.
SELECT mark_group, regexp_replace(mark_name, E'\\d\\d\.\\d\\d\\.\\d\\d\\.\\d\\d\\d\\d', '%', 'g'), mark_time_id, mark_is_rlbk_protected,
       mark_comment, mark_log_rows_before_next, mark_logged_rlbk_target_mark FROM emaj.emaj_mark ORDER BY mark_time_id, mark_group;
 mark_group | regexp_replace | mark_time_id | mark_is_rlbk_protected | mark_comment | mark_log_rows_before_next | mark_logged_rlbk_target_mark 
------------+----------------+--------------+------------------------+--------------+---------------------------+------------------------------
 myGroup1   | M1             |        12016 | f                      |              |                        29 | 
 myGroup2   | M1             |        12017 | f                      |              |                        41 | 
 myGroup1   | M2             |        12200 | f                      |              |                        14 | 
 myGroup2   | M2             |        12300 | f                      |              |                         8 | 
 myGroup2   | M3             |        12301 | f                      |              |                           | 
 myGroup1   | M4             |        12501 | f                      |              |                        10 | 
 myGroup1   | M5             |        12502 | f                      |              |                         0 | 
 myGroup1   | M6             |        12503 | f                      |              |                           | 
(8 rows)

SELECT sequ_schema, sequ_name, sequ_time_id, sequ_last_val, sequ_is_called
  FROM emaj.emaj_sequence ORDER BY sequ_time_id, sequ_schema, sequ_name;
 sequ_schema |     sequ_name     | sequ_time_id | sequ_last_val | sequ_is_called 
-------------+-------------------+--------------+---------------+----------------
 myschema1   | myTbl3_col31_seq  |        12016 |            11 | f
 myschema1   | mytbl2b_col20_seq |        12016 |             3 | f
 myschema2   | myTbl3_col31_seq  |        12017 |            11 | f
 myschema2   | myseq1            |        12017 |          1000 | f
 myschema1   | myTbl3_col31_seq  |        12200 |            20 | t
 myschema1   | mytbl2b_col20_seq |        12200 |             4 | t
 myschema2   | myTbl3_col31_seq  |        12300 |            20 | t
 myschema2   | myseq1            |        12300 |          1000 | t
 myschema2   | myTbl3_col31_seq  |        12301 |            20 | t
 myschema2   | myseq1            |        12301 |          1003 | t
 myschema1   | myTbl3_col31_seq  |        12501 |            20 | t
 myschema1   | mytbl2b_col20_seq |        12501 |             5 | t
 myschema1   | myTbl3_col31_seq  |        12502 |            20 | t
 myschema1   | mytbl2b_col20_seq |        12502 |             5 | t
 myschema1   | myTbl3_col31_seq  |        12503 |            20 | t
 myschema1   | mytbl2b_col20_seq |        12503 |             5 | t
(16 rows)

SELECT tbl_schema, tbl_name, tbl_time_id, tbl_log_seq_last_val
  FROM emaj.emaj_table ORDER BY tbl_time_id, tbl_schema, tbl_name;
 tbl_schema | tbl_name | tbl_time_id | tbl_log_seq_last_val 
------------+----------+-------------+----------------------
 myschema1  | myTbl3   |       12016 |                    0
 myschema1  | mytbl1   |       12016 |                    0
 myschema1  | mytbl2   |       12016 |                    0
 myschema1  | mytbl2b  |       12016 |                    0
 myschema1  | mytbl4   |       12016 |                    0
 myschema2  | myTbl3   |       12017 |                    0
 myschema2  | mytbl1   |       12017 |                    0
 myschema2  | mytbl2   |       12017 |                    0
 myschema2  | mytbl4   |       12017 |                    0
 myschema2  | mytbl5   |       12017 |                    0
 myschema2  | mytbl6   |       12017 |                    0
 myschema1  | myTbl3   |       12200 |                   10
 myschema1  | mytbl1   |       12200 |                   15
 myschema1  | mytbl2   |       12200 |                    2
 myschema1  | mytbl2b  |       12200 |                    2
 myschema1  | mytbl4   |       12200 |                    0
 myschema2  | myTbl3   |       12300 |                   10
 myschema2  | mytbl1   |       12300 |                   15
 myschema2  | mytbl2   |       12300 |                    2
 myschema2  | mytbl4   |       12300 |                    0
 myschema2  | mytbl5   |       12300 |                    3
 myschema2  | mytbl6   |       12300 |                   11
 myschema2  | myTbl3   |       12301 |                   10
 myschema2  | mytbl1   |       12301 |                   15
 myschema2  | mytbl2   |       12301 |                    2
 myschema2  | mytbl4   |       12301 |                    4
 myschema2  | mytbl5   |       12301 |                    4
 myschema2  | mytbl6   |       12301 |                   14
 myschema1  | myTbl3   |       12501 |                   10
 myschema1  | mytbl1   |       12501 |                   30
 myschema1  | mytbl2   |       12501 |                    3
 myschema1  | mytbl2b  |       12501 |                    3
 myschema1  | mytbl4   |       12501 |                    8
 myschema1  | myTbl3   |       12502 |                   20
 myschema1  | mytbl1   |       12502 |                   30
 myschema1  | mytbl2   |       12502 |                    3
 myschema1  | mytbl2b  |       12502 |                    3
 myschema1  | mytbl4   |       12502 |                    8
 myschema1  | myTbl3   |       12503 |                   20
 myschema1  | mytbl1   |       12503 |                   30
 myschema1  | mytbl2   |       12503 |                    3
 myschema1  | mytbl2b  |       12503 |                    3
 myschema1  | mytbl4   |       12503 |                    8
(43 rows)

SELECT sqhl_schema, sqhl_table, sqhl_begin_time_id, sqhl_end_time_id, sqhl_hole_size FROM emaj.emaj_seq_hole ORDER BY 1, 2, 3;
 sqhl_schema | sqhl_table | sqhl_begin_time_id | sqhl_end_time_id | sqhl_hole_size 
-------------+------------+--------------------+------------------+----------------
 myschema1   | mytbl1     |              12200 |            12500 |              3
 myschema1   | mytbl4     |              12200 |            12500 |              8
 myschema2   | mytbl4     |              12301 |            12602 |              6
 myschema2   | mytbl5     |              12301 |            12602 |              3
 myschema2   | mytbl6     |              12301 |            12602 |              9
(5 rows)

SELECT time_id, time_last_emaj_gid, time_event FROM emaj.emaj_time_stamp WHERE time_id >= 12600 ORDER BY time_id;
 time_id | time_last_emaj_gid | time_event 
---------+--------------------+------------
   12600 |           12600000 | R
   12601 |           12600006 | M
   12602 |           12600006 | R
(3 rows)

SELECT hist_function, hist_event, hist_object,
       regexp_replace(regexp_replace(regexp_replace(hist_wording,
            E'\\d\\d\.\\d\\d\\.\\d\\d\\.\\d\\d\\d\\d', '%', 'g'),
            E'\\d\\d\\d\\d/\\d\\d\\/\\d\\d\\ \\d\\d\\:\\d\\d:\\d\\d .*?\\)', '<timestamp>)', 'g'),
            E'\\[.+\\]', '(timestamp)', 'g'),
       hist_user
  FROM emaj.emaj_hist WHERE hist_id >= 12600 ORDER BY hist_id;
   hist_function   |   hist_event   |    hist_object    |                                           regexp_replace                                           |     hist_user      
-------------------+----------------+-------------------+----------------------------------------------------------------------------------------------------+--------------------
 ROLLBACK_GROUP    | BEGIN          | myGroup2          | Logged rollback to mark M2 (timestamp)                                                             | _regress_emaj_adm1
 DBLINK_OPEN_CNX   |                | rlbk#1            | Status = 1                                                                                         | _regress_emaj_adm1
 LOCK_GROUP        | BEGIN          | myGroup2          | Rollback session #1                                                                                | _regress_emaj_adm1
 LOCK_GROUP        | END            | myGroup2          | Rollback session #1: 6 tables locked, 0 deadlock(s)                                                | _regress_emaj_adm1
 ROLLBACK_GROUP    | TIME STAMP SET | 12600             |                                                                                                    | _regress_emaj_adm1
 SET_MARK_GROUP    | BEGIN          | myGroup2          | RLBK_12600_START                                                                                   | _regress_emaj_adm1
 SET_MARK_GROUP    | END            | myGroup2          | RLBK_12600_START                                                                                   | _regress_emaj_adm1
 ROLLBACK_SEQUENCE |                | myschema2.myseq1  | RESTART 1001 MAXVALUE 2000 CYCLE                                                                   | _regress_emaj_adm1
 ROLLBACK_TABLE    | BEGIN          | myschema2.mytbl6  | All log rows where emaj_gid > 12300041 and <= 12600000                                             | _regress_emaj_adm1
 ROLLBACK_TABLE    | END            | myschema2.mytbl6  | 3 rolled back primary keys                                                                         | _regress_emaj_adm1
 ROLLBACK_TABLE    | BEGIN          | myschema2.mytbl4  | All log rows where emaj_gid > 12300041 and <= 12600000, in session_replication_role = replica mode | _regress_emaj_adm1
 ROLLBACK_TABLE    | END            | myschema2.mytbl4  | 2 rolled back primary keys                                                                         | _regress_emaj_adm1
 ROLLBACK_TABLE    | BEGIN          | myschema2.mytbl5  | All log rows where emaj_gid > 12300041 and <= 12600000                                             | _regress_emaj_adm1
 ROLLBACK_TABLE    | END            | myschema2.mytbl5  | 1 rolled back primary keys                                                                         | _regress_emaj_adm1
 ROLLBACK_GROUP    | TIME STAMP SET | 12601             |                                                                                                    | _regress_emaj_adm1
 SET_MARK_GROUP    | BEGIN          | myGroup2          | RLBK_12600_DONE                                                                                    | _regress_emaj_adm1
 SET_MARK_GROUP    | END            | myGroup2          | RLBK_12600_DONE                                                                                    | _regress_emaj_adm1
 ROLLBACK_GROUP    | NOTICE         | Rollback id 12600 | Rollback id = 12600.                                                                               | _regress_emaj_adm1
 ROLLBACK_GROUP    | NOTICE         | Rollback id 12600 | 3 / 6 tables effectively processed.                                                                | _regress_emaj_adm1
 ROLLBACK_GROUP    | NOTICE         | Rollback id 12600 | 1 / 2 sequences effectively processed.                                                             | _regress_emaj_adm1
 DBLINK_CLOSE_CNX  |                | rlbk#1            |                                                                                                    | _regress_emaj_adm1
 ROLLBACK_GROUP    | END            | myGroup2          | Rollback_id 12600                                                                                  | _regress_emaj_adm1
 ROLLBACK_GROUP    | BEGIN          | myGroup2          | Unlogged rollback to mark M3 (timestamp)                                                           | _regress_emaj_adm1
 DBLINK_OPEN_CNX   |                | rlbk#1            | Status = 1                                                                                         | _regress_emaj_adm1
 LOCK_GROUP        | BEGIN          | myGroup2          | Rollback session #1                                                                                | _regress_emaj_adm1
 LOCK_GROUP        | END            | myGroup2          | Rollback session #1: 6 tables locked, 0 deadlock(s)                                                | _regress_emaj_adm1
 ROLLBACK_GROUP    | TIME STAMP SET | 12602             |                                                                                                    | _regress_emaj_adm1
 ROLLBACK_SEQUENCE |                | myschema2.myseq1  | RESTART 1004 MAXVALUE 9223372036854775807 NO CYCLE                                                 | _regress_emaj_adm1
 ROLLBACK_TABLE    | BEGIN          | myschema2.mytbl6  | All log rows where emaj_gid > 12300049 and <= 12600006                                             | _regress_emaj_adm1
 ROLLBACK_TABLE    | END            | myschema2.mytbl6  | 3 rolled back primary keys                                                                         | _regress_emaj_adm1
 ROLLBACK_TABLE    | BEGIN          | myschema2.mytbl4  | All log rows where emaj_gid > 12300049 and <= 12600006, in session_replication_role = replica mode | _regress_emaj_adm1
 ROLLBACK_TABLE    | END            | myschema2.mytbl4  | 2 rolled back primary keys                                                                         | _regress_emaj_adm1
 ROLLBACK_TABLE    | BEGIN          | myschema2.mytbl5  | All log rows where emaj_gid > 12300049 and <= 12600006                                             | _regress_emaj_adm1
 ROLLBACK_TABLE    | END            | myschema2.mytbl5  | 1 rolled back primary keys                                                                         | _regress_emaj_adm1
 ROLLBACK_GROUP    | MARK DELETED   | myGroup2          | mark RLBK_12400_START is deleted                                                                   | _regress_emaj_adm1
 ROLLBACK_GROUP    | MARK DELETED   | myGroup2          | mark RLBK_12400_DONE is deleted                                                                    | _regress_emaj_adm1
 ROLLBACK_GROUP    | MARK DELETED   | myGroup2          | mark RLBK_12401_START is deleted                                                                   | _regress_emaj_adm1
 ROLLBACK_GROUP    | MARK DELETED   | myGroup2          | mark RLBK_12401_DONE is deleted                                                                    | _regress_emaj_adm1
 ROLLBACK_GROUP    | MARK DELETED   | myGroup2          | mark RLBK_12600_START is deleted                                                                   | _regress_emaj_adm1
 ROLLBACK_GROUP    | MARK DELETED   | myGroup2          | mark RLBK_12600_DONE is deleted                                                                    | _regress_emaj_adm1
 ROLLBACK_GROUP    | NOTICE         | Rollback id 12601 | Rollback id = 12601.                                                                               | _regress_emaj_adm1
 ROLLBACK_GROUP    | NOTICE         | Rollback id 12601 | 3 / 6 tables effectively processed.                                                                | _regress_emaj_adm1
 ROLLBACK_GROUP    | NOTICE         | Rollback id 12601 | 1 / 2 sequences effectively processed.                                                             | _regress_emaj_adm1
 DBLINK_CLOSE_CNX  |                | rlbk#1            |                                                                                                    | _regress_emaj_adm1
 ROLLBACK_GROUP    | END            | myGroup2          | Rollback_id 12601                                                                                  | _regress_emaj_adm1
(45 rows)

-- User tables.
RESET session_authorization;
SELECT * FROM mySchema2.myTbl1 ORDER BY col11, col12;
 col11 |   col12    | col13 
-------+------------+-------
     1 | ABC        | \x1c
     2 | ABC        | \x1c
     3 | ABC        | \x1c
     4 | ABC        | \x0c
     5 | ABC        | \x0c
     6 | ABC        | \x0c
     7 | ABC        | \x0c
     8 | ABC        | \x0c
     9 | ABC        | \x0c
    10 | ABC        | \x0c
(10 rows)

SELECT * FROM mySchema2.myTbl2 ORDER BY col21;
 col21 | col22 |   col23    
-------+-------+------------
     1 | ABC   | 01-01-2010
     2 | DEF   | 
(2 rows)

SELECT col31, col33 FROM mySchema2."myTbl3" ORDER BY col31;
 col31 | col33 
-------+-------
    11 | 10.00
    12 | 10.00
    13 | 10.00
    14 | 10.00
    15 | 10.00
    16 | 10.00
    17 | 10.00
    18 | 10.00
    19 | 10.00
    20 | 10.00
(10 rows)

SELECT * FROM mySchema2.myTbl4 ORDER BY col41;
 col41 | col42 | col43 | col44 |   col45    
-------+-------+-------+-------+------------
     1 | FK... |     2 |     1 | ABC       
     2 | FK... |     2 |     1 | ABC       
(2 rows)

SELECT * FROM mySchema2.myTbl5 ORDER BY col51;
 col51 |     col52     |  col53  |          col54          |          col55          | col56 |          col57          |          col58          | col59 
-------+---------------+---------+-------------------------+-------------------------+-------+-------------------------+-------------------------+-------
     1 | {abc,def,ghi} | {1,2,3} | {11-28-2010,12-03-2010} | {"id":1001, "c2":"def"} |       | {"id":1001, "c3":"ghi"} | [01-01-2020,01-01-2021) | 
(1 row)

SELECT * FROM mySchema2.myTbl6 ORDER BY col61;
 col61 |  col62  |     col63     |   col64   |         col65         |     col66      |   col67   |     col68     |   col69   
-------+---------+---------------+-----------+-----------------------+----------------+-----------+---------------+-----------
     0 |         |               |           |                       |                |           |               | 
     4 | (4,1.3) | (4.2,1),(4,0) | <(5,5),4> | ((-2,-2),(3,0),(1,4)) | 10.20.30.40/27 | EXECUTING | (4,"(4,1.3)") | (4.1,0.5)
     5 | (5,1.3) | (5.2,1),(5,0) | <(5,5),5> | ((-2,-2),(3,0),(1,4)) | 10.20.30.40/27 | EXECUTING | (5,"(5,1.3)") | (5.1,0.5)
     6 | (6,1.3) | (6.2,1),(6,0) | <(5,5),6> | ((-2,-2),(3,0),(1,4)) | 10.20.30.40/27 | EXECUTING | (6,"(6,1.3)") | (6.1,0.5)
     7 | (7,1.3) | (7.2,1),(7,0) | <(5,5),7> | ((-2,-2),(3,0),(1,4)) | 10.20.30.40/27 | EXECUTING | (7,"(7,1.3)") | (7.1,0.5)
     8 | (8,1.3) | (8.2,1),(8,0) | <(5,5),8> | ((-2,-2),(3,0),(1,4)) | 10.20.30.40/27 | EXECUTING | (8,"(8,1.3)") | (8.1,0.5)
(6 rows)

-- Log tables.
SET session_authorization TO _regress_emaj_adm1;
SELECT col11, col12, col13, emaj_verb, emaj_tuple, emaj_gid FROM emaj_mySchema2.myTbl1_log ORDER BY emaj_gid, emaj_tuple DESC;
 col11 |   col12    | col13 | emaj_verb | emaj_tuple | emaj_gid 
-------+------------+-------+-----------+------------+----------
     1 | ABC        | \x0c  | INS       | NEW        | 12300001
     2 | ABC        | \x0c  | INS       | NEW        | 12300002
     3 | ABC        | \x0c  | INS       | NEW        | 12300003
     4 | ABC        | \x0c  | INS       | NEW        | 12300004
     5 | ABC        | \x0c  | INS       | NEW        | 12300005
     6 | ABC        | \x0c  | INS       | NEW        | 12300006
     7 | ABC        | \x0c  | INS       | NEW        | 12300007
     8 | ABC        | \x0c  | INS       | NEW        | 12300008
     9 | ABC        | \x0c  | INS       | NEW        | 12300009
    10 | ABC        | \x0c  | INS       | NEW        | 12300010
    11 | ABC        | \x0c  | INS       | NEW        | 12300011
     1 | ABC        | \x0c  | UPD       | OLD        | 12300012
     1 | ABC        | \x1c  | UPD       | NEW        | 12300012
     2 | ABC        | \x0c  | UPD       | OLD        | 12300013
     2 | ABC        | \x1c  | UPD       | NEW        | 12300013
     3 | ABC        | \x0c  | UPD       | OLD        | 12300014
     3 | ABC        | \x1c  | UPD       | NEW        | 12300014
    11 | ABC        | \x0c  | DEL       | OLD        | 12300016
(18 rows)

SELECT col21, col22, col23, emaj_verb, emaj_tuple, emaj_gid FROM emaj_mySchema2.myTbl2_log ORDER BY emaj_gid, emaj_tuple DESC;
 col21 | col22 |   col23    | emaj_verb | emaj_tuple | emaj_gid 
-------+-------+------------+-----------+------------+----------
     1 | ABC   | 01-01-2010 | INS       | NEW        | 12300015
     2 | DEF   |            | INS       | NEW        | 12300017
(2 rows)

SELECT col31, col33, emaj_verb, emaj_tuple, emaj_gid FROM emaj_myschema2."myTbl3_log" ORDER BY emaj_gid, emaj_tuple DESC;
 col31 | col33 | emaj_verb | emaj_tuple | emaj_gid 
-------+-------+-----------+------------+----------
    11 | 10.00 | INS       | NEW        | 12300018
    12 | 10.00 | INS       | NEW        | 12300019
    13 | 10.00 | INS       | NEW        | 12300020
    14 | 10.00 | INS       | NEW        | 12300021
    15 | 10.00 | INS       | NEW        | 12300022
    16 | 10.00 | INS       | NEW        | 12300023
    17 | 10.00 | INS       | NEW        | 12300024
    18 | 10.00 | INS       | NEW        | 12300025
    19 | 10.00 | INS       | NEW        | 12300026
    20 | 10.00 | INS       | NEW        | 12300027
(10 rows)

SELECT col41, col42, col43, col44, col45, emaj_verb, emaj_tuple, emaj_gid FROM emaj_myschema2.mytbl4_log ORDER BY emaj_gid, emaj_tuple DESC;
 col41 | col42 | col43 | col44 |   col45    | emaj_verb | emaj_tuple | emaj_gid 
-------+-------+-------+-------+------------+-----------+------------+----------
     1 | FK... |     1 |     1 | ABC        | INS       | NEW        | 12300042
     2 | FK... |     1 |     1 | ABC        | INS       | NEW        | 12300043
     1 | FK... |     1 |     1 | ABC        | UPD       | OLD        | 12300044
     1 | FK... |     2 |     1 | ABC        | UPD       | NEW        | 12300044
     2 | FK... |     1 |     1 | ABC        | UPD       | OLD        | 12300045
     2 | FK... |     2 |     1 | ABC        | UPD       | NEW        | 12300045
(6 rows)

SELECT col51, col52, col53, col54, emaj_verb, emaj_tuple, emaj_gid FROM emaj_myschema2.mytbl5_log ORDER BY emaj_gid, emaj_tuple DESC;
 col51 |     col52     |  col53  |          col54          | emaj_verb | emaj_tuple | emaj_gid 
-------+---------------+---------+-------------------------+-----------+------------+----------
     1 | {abc,def,ghi} | {1,2,3} |                         | INS       | NEW        | 12300028
     2 | {abc,def,ghi} | {3,4,5} | {02-01-2000,02-28-2000} | INS       | NEW        | 12300029
     1 | {abc,def,ghi} | {1,2,3} |                         | UPD       | OLD        | 12300030
     1 | {abc,def,ghi} | {1,2,3} | {11-28-2010,12-03-2010} | UPD       | NEW        | 12300030
     2 | {abc,def,ghi} | {3,4,5} | {02-01-2000,02-28-2000} | DEL       | OLD        | 12300046
(5 rows)

SELECT col61, col62, col63, col64, col65, col66, emaj_verb, emaj_tuple, emaj_gid FROM emaj_mySchema2.myTbl6_log ORDER BY emaj_gid, emaj_tuple DESC;
 col61 |  col62  |     col63     |    col64    |         col65         |     col66      | emaj_verb | emaj_tuple | emaj_gid 
-------+---------+---------------+-------------+-----------------------+----------------+-----------+------------+----------
     1 | (1,1.3) | (1.2,1),(1,0) | <(5,5),1>   | ((-2,-2),(3,0),(1,4)) | 10.20.30.40/27 | INS       | NEW        | 12300031
     2 | (2,1.3) | (2.2,1),(2,0) | <(5,5),2>   | ((-2,-2),(3,0),(1,4)) | 10.20.30.40/27 | INS       | NEW        | 12300032
     3 | (3,1.3) | (3.2,1),(3,0) | <(5,5),3>   | ((-2,-2),(3,0),(1,4)) | 10.20.30.40/27 | INS       | NEW        | 12300033
     4 | (4,1.3) | (4.2,1),(4,0) | <(5,5),4>   | ((-2,-2),(3,0),(1,4)) | 10.20.30.40/27 | INS       | NEW        | 12300034
     5 | (5,1.3) | (5.2,1),(5,0) | <(5,5),5>   | ((-2,-2),(3,0),(1,4)) | 10.20.30.40/27 | INS       | NEW        | 12300035
     6 | (6,1.3) | (6.2,1),(6,0) | <(5,5),6>   | ((-2,-2),(3,0),(1,4)) | 10.20.30.40/27 | INS       | NEW        | 12300036
     7 | (7,1.3) | (7.2,1),(7,0) | <(5,5),7>   | ((-2,-2),(3,0),(1,4)) | 10.20.30.40/27 | INS       | NEW        | 12300037
     8 | (8,1.3) | (8.2,1),(8,0) | <(5,5),8>   | ((-2,-2),(3,0),(1,4)) | 10.20.30.40/27 | INS       | NEW        | 12300038
     1 | (1,1.3) | (1.2,1),(1,0) | <(5,5),1>   | ((-2,-2),(3,0),(1,4)) | 10.20.30.40/27 | UPD       | OLD        | 12300039
     1 | (1,1.3) | (1.2,1),(1,0) | <(5,6),3.5> |                       | 10.20.30.40/27 | UPD       | NEW        | 12300039
     2 | (2,1.3) | (2.2,1),(2,0) | <(5,5),2>   | ((-2,-2),(3,0),(1,4)) | 10.20.30.40/27 | UPD       | OLD        | 12300040
     2 | (2,1.3) | (2.2,1),(2,0) | <(5,6),3.5> |                       | 10.20.30.40/27 | UPD       | NEW        | 12300040
     3 | (3,1.3) | (3.2,1),(3,0) | <(5,5),3>   | ((-2,-2),(3,0),(1,4)) | 10.20.30.40/27 | UPD       | OLD        | 12300041
     3 | (3,1.3) | (3.2,1),(3,0) | <(5,6),3.5> |                       | 10.20.30.40/27 | UPD       | NEW        | 12300041
     1 | (1,1.3) | (1.2,1),(1,0) | <(5,6),3.5> |                       | 10.20.30.40/27 | DEL       | OLD        | 12300047
     2 | (2,1.3) | (2.2,1),(2,0) | <(5,6),3.5> |                       | 10.20.30.40/27 | DEL       | OLD        | 12300048
     3 | (3,1.3) | (3.2,1),(3,0) | <(5,6),3.5> |                       | 10.20.30.40/27 | DEL       | OLD        | 12300049
(17 rows)

-- Set sequence restart value.
SELECT public.handle_emaj_sequences(12700);
 handle_emaj_sequences 
-----------------------
 
(1 row)

-----------------------------
-- Step 6 : for myGroup1, update tables, rollback, other updates, then logged rollback.
-----------------------------
RESET session_authorization;
SET search_path TO public, myschema1;
--
INSERT INTO myTbl1 VALUES (1, 'Step 6', E'\\000'::BYTEA);
INSERT INTO myTbl4 VALUES (11, 'FK...', 1, 1, 'Step 6');
INSERT INTO myTbl4 VALUES (12, 'FK...', 1, 1, 'Step 6');
--
SET session_authorization TO _regress_emaj_adm1;
SELECT * FROM emaj.emaj_rollback_group('myGroup1', 'M5', FALSE) ORDER BY 1, 2;
 rlbk_severity |              rlbk_message              
---------------+----------------------------------------
 Notice        | 0 / 2 sequences effectively processed.
 Notice        | 2 / 5 tables effectively processed.
 Notice        | Rollback id = 12700.
(3 rows)

--
RESET session_authorization;
INSERT INTO myTbl1 VALUES (1, 'Step 6', E'\\001'::BYTEA);
INSERT INTO myTbl4 VALUES (11, '', 1, 1, 'Step 6');
INSERT INTO myTbl4 VALUES (12, '', 1, 1, 'Step 6');
--
-- For an equivalent of "select * from emaj.emaj_logged_rollback_group('myGroup1', 'M4', true, 'my comment');".
SET session_authorization TO _regress_emaj_adm1;
SELECT * FROM emaj._rlbk_async(emaj._rlbk_init(ARRAY['myGroup1'], 'M4', TRUE, 1, FALSE, TRUE, 'my comment'), FALSE);
 rlbk_severity |              rlbk_message              
---------------+----------------------------------------
 Notice        | Rollback id = 12701.
 Notice        | 3 / 5 tables effectively processed.
 Notice        | 0 / 2 sequences effectively processed.
(3 rows)

SELECT emaj.emaj_comment_rollback(12701, 'Updated comment');
 emaj_comment_rollback 
-----------------------
 
(1 row)

-- And check the rollback result.
SELECT rlbk_id, rlbk_groups, rlbk_mark, rlbk_mark_time_id, rlbk_time_id, rlbk_is_logged, rlbk_is_alter_group_allowed, rlbk_comment,
       rlbk_nb_session, rlbk_nb_table, rlbk_nb_sequence, rlbk_eff_nb_table, rlbk_eff_nb_sequence, rlbk_status, rlbk_begin_hist_id,
       rlbk_dblink_schema, rlbk_is_dblink_used, rlbk_messages
 FROM emaj.emaj_rlbk ORDER BY rlbk_id DESC LIMIT 1;
 rlbk_id | rlbk_groups | rlbk_mark | rlbk_mark_time_id | rlbk_time_id | rlbk_is_logged | rlbk_is_alter_group_allowed |  rlbk_comment   | rlbk_nb_session | rlbk_nb_table | rlbk_nb_sequence | rlbk_eff_nb_table | rlbk_eff_nb_sequence | rlbk_status | rlbk_begin_hist_id | rlbk_dblink_schema | rlbk_is_dblink_used |                                                          rlbk_messages                                                          
---------+-------------+-----------+-------------------+--------------+----------------+-----------------------------+-----------------+-----------------+---------------+------------------+-------------------+----------------------+-------------+--------------------+--------------------+---------------------+---------------------------------------------------------------------------------------------------------------------------------
   12701 | {myGroup1}  | M4        |             12501 |        12701 | t              | t                           | Updated comment |               1 |             5 |                2 |                 3 |                    0 | COMPLETED   |              12715 | public             | t                   | {"Notice: Rollback id = 12701.","Notice: 3 / 5 tables effectively processed.","Notice: 0 / 2 sequences effectively processed."}
(1 row)

-----------------------------
-- Checking step 6.
-----------------------------
-- emaj tables.
SELECT mark_group, regexp_replace(mark_name, E'\\d\\d\.\\d\\d\\.\\d\\d\\.\\d\\d\\d\\d', '%', 'g'), mark_time_id, mark_is_rlbk_protected,
       mark_comment, mark_log_rows_before_next, mark_logged_rlbk_target_mark FROM emaj.emaj_mark ORDER BY mark_time_id, mark_group;
 mark_group |  regexp_replace  | mark_time_id | mark_is_rlbk_protected |                  mark_comment                  | mark_log_rows_before_next | mark_logged_rlbk_target_mark 
------------+------------------+--------------+------------------------+------------------------------------------------+---------------------------+------------------------------
 myGroup1   | M1               |        12016 | f                      |                                                |                        29 | 
 myGroup2   | M1               |        12017 | f                      |                                                |                        41 | 
 myGroup1   | M2               |        12200 | f                      |                                                |                        14 | 
 myGroup2   | M2               |        12300 | f                      |                                                |                         8 | 
 myGroup2   | M3               |        12301 | f                      |                                                |                           | 
 myGroup1   | M4               |        12501 | f                      |                                                |                        10 | 
 myGroup1   | M5               |        12502 | f                      |                                                |                         3 | 
 myGroup1   | RLBK_12701_START |        12701 | f                      | Automatically set at rollback to mark M4 start |                        23 | 
 myGroup1   | RLBK_12701_DONE  |        12702 | f                      | Automatically set at rollback to mark M4 end   |                           | M4
(9 rows)

SELECT sequ_schema, sequ_name, sequ_time_id, sequ_last_val, sequ_is_called
  FROM emaj.emaj_sequence ORDER BY sequ_time_id, sequ_schema, sequ_name;
 sequ_schema |     sequ_name     | sequ_time_id | sequ_last_val | sequ_is_called 
-------------+-------------------+--------------+---------------+----------------
 myschema1   | myTbl3_col31_seq  |        12016 |            11 | f
 myschema1   | mytbl2b_col20_seq |        12016 |             3 | f
 myschema2   | myTbl3_col31_seq  |        12017 |            11 | f
 myschema2   | myseq1            |        12017 |          1000 | f
 myschema1   | myTbl3_col31_seq  |        12200 |            20 | t
 myschema1   | mytbl2b_col20_seq |        12200 |             4 | t
 myschema2   | myTbl3_col31_seq  |        12300 |            20 | t
 myschema2   | myseq1            |        12300 |          1000 | t
 myschema2   | myTbl3_col31_seq  |        12301 |            20 | t
 myschema2   | myseq1            |        12301 |          1003 | t
 myschema1   | myTbl3_col31_seq  |        12501 |            20 | t
 myschema1   | mytbl2b_col20_seq |        12501 |             5 | t
 myschema1   | myTbl3_col31_seq  |        12502 |            20 | t
 myschema1   | mytbl2b_col20_seq |        12502 |             5 | t
 myschema1   | myTbl3_col31_seq  |        12701 |            20 | t
 myschema1   | mytbl2b_col20_seq |        12701 |             5 | t
 myschema1   | myTbl3_col31_seq  |        12702 |            20 | t
 myschema1   | mytbl2b_col20_seq |        12702 |             5 | t
(18 rows)

SELECT tbl_schema, tbl_name, tbl_time_id, tbl_log_seq_last_val
  FROM emaj.emaj_table ORDER BY tbl_time_id, tbl_schema, tbl_name;
 tbl_schema | tbl_name | tbl_time_id | tbl_log_seq_last_val 
------------+----------+-------------+----------------------
 myschema1  | myTbl3   |       12016 |                    0
 myschema1  | mytbl1   |       12016 |                    0
 myschema1  | mytbl2   |       12016 |                    0
 myschema1  | mytbl2b  |       12016 |                    0
 myschema1  | mytbl4   |       12016 |                    0
 myschema2  | myTbl3   |       12017 |                    0
 myschema2  | mytbl1   |       12017 |                    0
 myschema2  | mytbl2   |       12017 |                    0
 myschema2  | mytbl4   |       12017 |                    0
 myschema2  | mytbl5   |       12017 |                    0
 myschema2  | mytbl6   |       12017 |                    0
 myschema1  | myTbl3   |       12200 |                   10
 myschema1  | mytbl1   |       12200 |                   15
 myschema1  | mytbl2   |       12200 |                    2
 myschema1  | mytbl2b  |       12200 |                    2
 myschema1  | mytbl4   |       12200 |                    0
 myschema2  | myTbl3   |       12300 |                   10
 myschema2  | mytbl1   |       12300 |                   15
 myschema2  | mytbl2   |       12300 |                    2
 myschema2  | mytbl4   |       12300 |                    0
 myschema2  | mytbl5   |       12300 |                    3
 myschema2  | mytbl6   |       12300 |                   11
 myschema2  | myTbl3   |       12301 |                   10
 myschema2  | mytbl1   |       12301 |                   15
 myschema2  | mytbl2   |       12301 |                    2
 myschema2  | mytbl4   |       12301 |                    4
 myschema2  | mytbl5   |       12301 |                    4
 myschema2  | mytbl6   |       12301 |                   14
 myschema1  | myTbl3   |       12501 |                   10
 myschema1  | mytbl1   |       12501 |                   30
 myschema1  | mytbl2   |       12501 |                    3
 myschema1  | mytbl2b  |       12501 |                    3
 myschema1  | mytbl4   |       12501 |                    8
 myschema1  | myTbl3   |       12502 |                   20
 myschema1  | mytbl1   |       12502 |                   30
 myschema1  | mytbl2   |       12502 |                    3
 myschema1  | mytbl2b  |       12502 |                    3
 myschema1  | mytbl4   |       12502 |                    8
 myschema1  | myTbl3   |       12701 |                   20
 myschema1  | mytbl1   |       12701 |                   32
 myschema1  | mytbl2   |       12701 |                    3
 myschema1  | mytbl2b  |       12701 |                    3
 myschema1  | mytbl4   |       12701 |                   12
 myschema1  | myTbl3   |       12702 |                   40
 myschema1  | mytbl1   |       12702 |                   33
 myschema1  | mytbl2   |       12702 |                    3
 myschema1  | mytbl2b  |       12702 |                    3
 myschema1  | mytbl4   |       12702 |                   14
(48 rows)

-- Check that mark_log_stat_before_next column is always equal to either NULL or the emaj_log_stat_rows() function's result.
-- This should always return 0 row.
SELECT * FROM
  (SELECT mark_time_id, mark_group, mark_name, mark_log_rows_before_next -
    (SELECT sum(stat_rows) FROM emaj.emaj_log_stat_group(mark_group, mark_name,
      (SELECT mark_name FROM emaj.emaj_mark m2 WHERE m2.mark_group = m1.mark_group AND m2.mark_time_id > m1.mark_time_id ORDER BY mark_time_id LIMIT 1))
    ) AS checked_stat_rows FROM emaj.emaj_mark m1 WHERE mark_log_rows_before_next IS NOT NULL
  ) AS t
  WHERE checked_stat_rows <> 0;
 mark_time_id | mark_group | mark_name | checked_stat_rows 
--------------+------------+-----------+-------------------
(0 rows)

--
SELECT sqhl_schema, sqhl_table, sqhl_begin_time_id, sqhl_end_time_id, sqhl_hole_size FROM emaj.emaj_seq_hole ORDER BY 1, 2, 3;
 sqhl_schema | sqhl_table | sqhl_begin_time_id | sqhl_end_time_id | sqhl_hole_size 
-------------+------------+--------------------+------------------+----------------
 myschema1   | mytbl1     |              12200 |            12500 |              3
 myschema1   | mytbl1     |              12502 |            12700 |              1
 myschema1   | mytbl4     |              12200 |            12500 |              8
 myschema1   | mytbl4     |              12502 |            12700 |              2
 myschema2   | mytbl4     |              12301 |            12602 |              6
 myschema2   | mytbl5     |              12301 |            12602 |              3
 myschema2   | mytbl6     |              12301 |            12602 |              9
(7 rows)

SELECT time_id, time_last_emaj_gid, time_event FROM emaj.emaj_time_stamp WHERE time_id >= 12700 ORDER BY time_id;
 time_id | time_last_emaj_gid | time_event 
---------+--------------------+------------
   12700 |           12700003 | R
   12701 |           12700006 | R
   12702 |           12700029 | M
(3 rows)

SELECT hist_function, hist_event, hist_object,
       regexp_replace(regexp_replace(regexp_replace(hist_wording,
            E'\\d\\d\.\\d\\d\\.\\d\\d\\.\\d\\d\\d\\d', '%', 'g'),
            E'\\d\\d\\d\\d/\\d\\d\\/\\d\\d\\ \\d\\d\\:\\d\\d:\\d\\d .*?\\)', '<timestamp>)', 'g'),
            E'\\[.+\\]', '(timestamp)', 'g'),
       hist_user
  FROM emaj.emaj_hist WHERE hist_id >= 12700 ORDER BY hist_id;
   hist_function    |   hist_event   |    hist_object     |                                           regexp_replace                                           |     hist_user      
--------------------+----------------+--------------------+----------------------------------------------------------------------------------------------------+--------------------
 ROLLBACK_GROUP     | BEGIN          | myGroup1           | Unlogged rollback to mark M5 (timestamp)                                                           | _regress_emaj_adm1
 DBLINK_OPEN_CNX    |                | rlbk#1             | Status = 1                                                                                         | _regress_emaj_adm1
 LOCK_GROUP         | BEGIN          | myGroup1           | Rollback session #1                                                                                | _regress_emaj_adm1
 LOCK_GROUP         | END            | myGroup1           | Rollback session #1: 5 tables locked, 0 deadlock(s)                                                | _regress_emaj_adm1
 ROLLBACK_GROUP     | TIME STAMP SET | 12700              |                                                                                                    | _regress_emaj_adm1
 ROLLBACK_TABLE     | BEGIN          | myschema1.mytbl4   | All log rows where emaj_gid > 12500024 and <= 12700003, in session_replication_role = replica mode | _regress_emaj_adm1
 ROLLBACK_TABLE     | END            | myschema1.mytbl4   | 2 rolled back primary keys                                                                         | _regress_emaj_adm1
 ROLLBACK_TABLE     | BEGIN          | myschema1.mytbl1   | All log rows where emaj_gid > 12500024 and <= 12700003, in session_replication_role = replica mode | _regress_emaj_adm1
 ROLLBACK_TABLE     | END            | myschema1.mytbl1   | 1 rolled back primary keys                                                                         | _regress_emaj_adm1
 ROLLBACK_GROUP     | MARK DELETED   | myGroup1           | mark M6 is deleted                                                                                 | _regress_emaj_adm1
 ROLLBACK_GROUP     | NOTICE         | Rollback id 12700  | Rollback id = 12700.                                                                               | _regress_emaj_adm1
 ROLLBACK_GROUP     | NOTICE         | Rollback id 12700  | 2 / 5 tables effectively processed.                                                                | _regress_emaj_adm1
 ROLLBACK_GROUP     | NOTICE         | Rollback id 12700  | 0 / 2 sequences effectively processed.                                                             | _regress_emaj_adm1
 DBLINK_CLOSE_CNX   |                | rlbk#1             |                                                                                                    | _regress_emaj_adm1
 ROLLBACK_GROUP     | END            | myGroup1           | Rollback_id 12700                                                                                  | _regress_emaj_adm1
 ROLLBACK_GROUP     | BEGIN          | myGroup1           | Logged rollback to mark M4 (timestamp)                                                             | _regress_emaj_adm1
 DBLINK_OPEN_CNX    |                | rlbk#1             | Status = 1                                                                                         | _regress_emaj_adm1
 DBLINK_OPEN_CNX    |                | rlbk#1             | Status = 0                                                                                         | _regress_emaj_adm1
 LOCK_GROUP         | BEGIN          | myGroup1           | Rollback session #1                                                                                | _regress_emaj_adm1
 LOCK_GROUP         | END            | myGroup1           | Rollback session #1: 5 tables locked, 0 deadlock(s)                                                | _regress_emaj_adm1
 ROLLBACK_GROUP     | TIME STAMP SET | 12701              |                                                                                                    | _regress_emaj_adm1
 SET_MARK_GROUP     | BEGIN          | myGroup1           | RLBK_12701_START                                                                                   | _regress_emaj_adm1
 CLEANUP_RLBK_STATE |                | Rollback id 12600  | set to COMMITTED                                                                                   | _regress_emaj_adm1
 CLEANUP_RLBK_STATE |                | Rollback id 12601  | set to COMMITTED                                                                                   | _regress_emaj_adm1
 CLEANUP_RLBK_STATE |                | Rollback id 12700  | set to COMMITTED                                                                                   | _regress_emaj_adm1
 SET_MARK_GROUP     | END            | myGroup1           | RLBK_12701_START                                                                                   | _regress_emaj_adm1
 ROLLBACK_TABLE     | BEGIN          | myschema1."myTbl3" | All log rows where emaj_gid > 12500014 and <= 12700006                                             | _regress_emaj_adm1
 ROLLBACK_TABLE     | END            | myschema1."myTbl3" | 10 rolled back primary keys                                                                        | _regress_emaj_adm1
 ROLLBACK_TABLE     | BEGIN          | myschema1.mytbl4   | All log rows where emaj_gid > 12500014 and <= 12700006, in session_replication_role = replica mode | _regress_emaj_adm1
 ROLLBACK_TABLE     | END            | myschema1.mytbl4   | 2 rolled back primary keys                                                                         | _regress_emaj_adm1
 ROLLBACK_TABLE     | BEGIN          | myschema1.mytbl1   | All log rows where emaj_gid > 12500014 and <= 12700006, in session_replication_role = replica mode | _regress_emaj_adm1
 ROLLBACK_TABLE     | END            | myschema1.mytbl1   | 1 rolled back primary keys                                                                         | _regress_emaj_adm1
 ROLLBACK_GROUP     | TIME STAMP SET | 12702              |                                                                                                    | _regress_emaj_adm1
 SET_MARK_GROUP     | BEGIN          | myGroup1           | RLBK_12701_DONE                                                                                    | _regress_emaj_adm1
 SET_MARK_GROUP     | END            | myGroup1           | RLBK_12701_DONE                                                                                    | _regress_emaj_adm1
 ROLLBACK_GROUP     | NOTICE         | Rollback id 12701  | Rollback id = 12701.                                                                               | _regress_emaj_adm1
 ROLLBACK_GROUP     | NOTICE         | Rollback id 12701  | 3 / 5 tables effectively processed.                                                                | _regress_emaj_adm1
 ROLLBACK_GROUP     | NOTICE         | Rollback id 12701  | 0 / 2 sequences effectively processed.                                                             | _regress_emaj_adm1
 DBLINK_CLOSE_CNX   |                | rlbk#1             |                                                                                                    | _regress_emaj_adm1
 ROLLBACK_GROUP     | END            | myGroup1           | Rollback_id 12701                                                                                  | _regress_emaj_adm1
 COMMENT_ROLLBACK   |                | 12701              |                                                                                                    | _regress_emaj_adm1
(41 rows)

-- User tables.
RESET session_authorization;
SELECT * FROM mySchema1.myTbl1 ORDER BY col11, col12;
 col11 |   col12    | col13 
-------+------------+-------
     2 | ABC        | \x1c
     3 | ABC        | \x1c
     4 | ABC        | \x0c
     5 | ABC        | \x0c
     6 | ABC        | \x0c
     7 | ABC        | \x0c
     8 | ABC        | \x0c
     9 | ABC        | \x0c
    10 | ABC        | \x0c
   100 | DEF        | \x00
   101 | DEF        | \x00
   102 | DEF        | \x00
   103 | DEF        | \x00
   104 | DEF        | \x00
   105 | DEF        | \x00
   106 | DEF        | \x00
   107 | DEF        | \x00
   108 | DEF        | \x00
   109 | DEF        | \x00
   110 | DEF        | \x00
(20 rows)

SELECT * FROM mySchema1.myTbl2 ORDER BY col21;
 col21 | col22 |   col23    
-------+-------+------------
     1 | ABC   | 12-31-2010
     2 | DEF   | 
     3 | GHI   | 01-02-2010
(3 rows)

SELECT * FROM mySchema1.myTbl2b ORDER BY col20;
 col20 | col21 |       col22        |         col23         | col24 
-------+-------+--------------------+-----------------------+-------
     3 |     1 |                  1 |    0.7071067811865476 | t
     4 |     2 |                0.5 | 6.123233995736766e-17 | t
     5 |     3 | 0.3333333333333333 |   -0.7071067811865475 | t
(3 rows)

SELECT col31, col33 FROM mySchema1."myTbl3" ORDER BY col31;
 col31 | col33 
-------+-------
    11 | 10.00
    12 | 10.00
    13 | 10.00
    14 | 10.00
    15 | 10.00
    16 | 10.00
    17 | 10.00
    18 | 10.00
    19 | 10.00
    20 | 10.00
(10 rows)

SELECT * FROM mySchema1.myTbl4 ORDER BY col41;
 col41 | col42 | col43 | col44 | col45 
-------+-------+-------+-------+-------
(0 rows)

-- Log tables.
SET session_authorization TO _regress_emaj_adm1;
SELECT col11, col12, col13, emaj_verb, emaj_tuple, emaj_gid FROM emaj_mySchema1.myTbl1_log ORDER BY emaj_gid, emaj_tuple DESC;
 col11 |   col12    | col13 | emaj_verb | emaj_tuple | emaj_gid 
-------+------------+-------+-----------+------------+----------
     1 | ABC        | \x0c  | INS       | NEW        | 12200001
     2 | ABC        | \x0c  | INS       | NEW        | 12200002
     3 | ABC        | \x0c  | INS       | NEW        | 12200003
     4 | ABC        | \x0c  | INS       | NEW        | 12200004
     5 | ABC        | \x0c  | INS       | NEW        | 12200005
     6 | ABC        | \x0c  | INS       | NEW        | 12200006
     7 | ABC        | \x0c  | INS       | NEW        | 12200007
     8 | ABC        | \x0c  | INS       | NEW        | 12200008
     9 | ABC        | \x0c  | INS       | NEW        | 12200009
    10 | ABC        | \x0c  | INS       | NEW        | 12200010
    11 | ABC        | \x0c  | INS       | NEW        | 12200011
     1 | ABC        | \x0c  | UPD       | OLD        | 12200012
     1 | ABC        | \x1c  | UPD       | NEW        | 12200012
     2 | ABC        | \x0c  | UPD       | OLD        | 12200013
     2 | ABC        | \x1c  | UPD       | NEW        | 12200013
     3 | ABC        | \x0c  | UPD       | OLD        | 12200014
     3 | ABC        | \x1c  | UPD       | NEW        | 12200014
    11 | ABC        | \x0c  | DEL       | OLD        | 12200017
   100 | DEF        | \x00  | INS       | NEW        | 12500001
   101 | DEF        | \x00  | INS       | NEW        | 12500002
   102 | DEF        | \x00  | INS       | NEW        | 12500003
   103 | DEF        | \x00  | INS       | NEW        | 12500004
   104 | DEF        | \x00  | INS       | NEW        | 12500005
   105 | DEF        | \x00  | INS       | NEW        | 12500006
   106 | DEF        | \x00  | INS       | NEW        | 12500007
   107 | DEF        | \x00  | INS       | NEW        | 12500008
   108 | DEF        | \x00  | INS       | NEW        | 12500009
   109 | DEF        | \x00  | INS       | NEW        | 12500010
   110 | DEF        | \x00  | INS       | NEW        | 12500011
     1 | ABC        | \x1c  | DEL       | OLD        | 12500014
     1 | Step 6     | \x01  | INS       | NEW        | 12700004
     1 | Step 6     | \x01  | DEL       | OLD        | 12700029
(32 rows)

SELECT col21, col22, col23, emaj_verb, emaj_tuple, emaj_gid FROM emaj_mySchema1.myTbl2_log ORDER BY emaj_gid, emaj_tuple DESC;
 col21 | col22 |   col23    | emaj_verb | emaj_tuple | emaj_gid 
-------+-------+------------+-----------+------------+----------
     1 | ABC   | 12-31-2010 | INS       | NEW        | 12200015
     2 | DEF   |            | INS       | NEW        | 12200018
     3 | GHI   | 01-02-2010 | INS       | NEW        | 12500012
(3 rows)

SELECT col20, col21, col22, col23, col24, emaj_verb, emaj_tuple, emaj_gid FROM emaj_mySchema1.myTbl2b_log ORDER BY emaj_gid, emaj_tuple DESC;
 col20 | col21 |       col22        |         col23         | col24 | emaj_verb | emaj_tuple | emaj_gid 
-------+-------+--------------------+-----------------------+-------+-----------+------------+----------
     3 |     1 |                  1 |    0.7071067811865476 | t     | INS       | NEW        | 12200016
     4 |     2 |                0.5 | 6.123233995736766e-17 | t     | INS       | NEW        | 12200019
     5 |     3 | 0.3333333333333333 |   -0.7071067811865475 | t     | INS       | NEW        | 12500013
(3 rows)

SELECT col31, col33, emaj_verb, emaj_tuple, emaj_gid FROM emaj_myschema1."myTbl3_log" ORDER BY emaj_gid, emaj_tuple DESC;
 col31 | col33 | emaj_verb | emaj_tuple | emaj_gid 
-------+-------+-----------+------------+----------
    11 | 10.00 | INS       | NEW        | 12200020
    12 | 10.00 | INS       | NEW        | 12200021
    13 | 10.00 | INS       | NEW        | 12200022
    14 | 10.00 | INS       | NEW        | 12200023
    15 | 10.00 | INS       | NEW        | 12200024
    16 | 10.00 | INS       | NEW        | 12200025
    17 | 10.00 | INS       | NEW        | 12200026
    18 | 10.00 | INS       | NEW        | 12200027
    19 | 10.00 | INS       | NEW        | 12200028
    20 | 10.00 | INS       | NEW        | 12200029
    11 | 10.00 | UPD       | OLD        | 12500015
    11 |  5.00 | UPD       | NEW        | 12500015
    12 | 10.00 | UPD       | OLD        | 12500016
    12 |  5.00 | UPD       | NEW        | 12500016
    13 | 10.00 | UPD       | OLD        | 12500017
    13 |  5.00 | UPD       | NEW        | 12500017
    14 | 10.00 | UPD       | OLD        | 12500018
    14 |  5.00 | UPD       | NEW        | 12500018
    15 | 10.00 | UPD       | OLD        | 12500019
    15 |  5.00 | UPD       | NEW        | 12500019
    16 | 10.00 | UPD       | OLD        | 12500020
    16 |  5.00 | UPD       | NEW        | 12500020
    17 | 10.00 | UPD       | OLD        | 12500021
    17 |  5.00 | UPD       | NEW        | 12500021
    18 | 10.00 | UPD       | OLD        | 12500022
    18 |  5.00 | UPD       | NEW        | 12500022
    19 | 10.00 | UPD       | OLD        | 12500023
    19 |  5.00 | UPD       | NEW        | 12500023
    20 | 10.00 | UPD       | OLD        | 12500024
    20 |  5.00 | UPD       | NEW        | 12500024
    11 |  5.00 | DEL       | OLD        | 12700007
    12 |  5.00 | DEL       | OLD        | 12700008
    13 |  5.00 | DEL       | OLD        | 12700009
    14 |  5.00 | DEL       | OLD        | 12700010
    15 |  5.00 | DEL       | OLD        | 12700011
    16 |  5.00 | DEL       | OLD        | 12700012
    17 |  5.00 | DEL       | OLD        | 12700013
    18 |  5.00 | DEL       | OLD        | 12700014
    19 |  5.00 | DEL       | OLD        | 12700015
    20 |  5.00 | DEL       | OLD        | 12700016
    11 | 10.00 | INS       | NEW        | 12700017
    12 | 10.00 | INS       | NEW        | 12700018
    13 | 10.00 | INS       | NEW        | 12700019
    14 | 10.00 | INS       | NEW        | 12700020
    15 | 10.00 | INS       | NEW        | 12700021
    16 | 10.00 | INS       | NEW        | 12700022
    17 | 10.00 | INS       | NEW        | 12700023
    18 | 10.00 | INS       | NEW        | 12700024
    19 | 10.00 | INS       | NEW        | 12700025
    20 | 10.00 | INS       | NEW        | 12700026
(50 rows)

SELECT col41, col42, col43, col44, col45, emaj_verb, emaj_tuple, emaj_gid FROM emaj_mySchema1.myTbl4_log ORDER BY emaj_gid, emaj_tuple DESC;
 col41 | col42 | col43 | col44 | col45  | emaj_verb | emaj_tuple | emaj_gid 
-------+-------+-------+-------+--------+-----------+------------+----------
    11 |       |     1 |     1 | Step 6 | INS       | NEW        | 12700005
    12 |       |     1 |     1 | Step 6 | INS       | NEW        | 12700006
    11 |       |     1 |     1 | Step 6 | DEL       | OLD        | 12700027
    12 |       |     1 |     1 | Step 6 | DEL       | OLD        | 12700028
(4 rows)

-- Set sequence restart value.
SELECT public.handle_emaj_sequences(12800);
 handle_emaj_sequences 
-----------------------
 
(1 row)

-----------------------------
-- Step 7 : for myGroup1, update tables, rename a mark, then delete 2 marks then delete all before a mark.
-----------------------------
SET search_path TO public, myschema1;
--
RESET session_authorization;
DELETE FROM "myTbl3" WHERE col31 = 14;
DELETE FROM "myTbl3" WHERE col31 = 15;
DELETE FROM "myTbl3" WHERE col31 = 16;
DELETE FROM "myTbl3" WHERE col31 = 17;
DELETE FROM "myTbl3" WHERE col31 = 18;
--
SET session_authorization TO _regress_emaj_adm1;
SELECT emaj.emaj_rename_mark_group('myGroup1', mark_name, 'Before logged rollback to M4') FROM emaj.emaj_mark WHERE mark_comment LIKE '%to mark M4 start';
 emaj_rename_mark_group 
------------------------
 
(1 row)

--
SELECT emaj.emaj_delete_mark_group('myGroup1', mark_name) FROM emaj.emaj_mark WHERE mark_comment LIKE '%to mark M4 end';
 emaj_delete_mark_group 
------------------------
                      1
(1 row)

SELECT emaj.emaj_delete_mark_group('myGroup1', 'M1');
 emaj_delete_mark_group 
------------------------
                      1
(1 row)

--
SELECT emaj.emaj_delete_before_mark_group('myGroup1', 'M4');
 emaj_delete_before_mark_group 
-------------------------------
                             1
(1 row)

-----------------------------
-- Checking step 7.
-----------------------------
-- emaj tables.
SELECT mark_group, regexp_replace(mark_name, E'\\d\\d\.\\d\\d\\.\\d\\d\\.\\d\\d\\d\\d', '%', 'g'), mark_time_id, mark_is_rlbk_protected,
       mark_comment, mark_log_rows_before_next, mark_logged_rlbk_target_mark FROM emaj.emaj_mark ORDER BY mark_time_id, mark_group;
 mark_group |        regexp_replace        | mark_time_id | mark_is_rlbk_protected |                  mark_comment                  | mark_log_rows_before_next | mark_logged_rlbk_target_mark 
------------+------------------------------+--------------+------------------------+------------------------------------------------+---------------------------+------------------------------
 myGroup2   | M1                           |        12017 | f                      |                                                |                        41 | 
 myGroup2   | M2                           |        12300 | f                      |                                                |                         8 | 
 myGroup2   | M3                           |        12301 | f                      |                                                |                           | 
 myGroup1   | M4                           |        12501 | f                      |                                                |                        10 | 
 myGroup1   | M5                           |        12502 | f                      |                                                |                         3 | 
 myGroup1   | Before logged rollback to M4 |        12701 | f                      | Automatically set at rollback to mark M4 start |                           | 
(6 rows)

SELECT sequ_schema, sequ_name, sequ_time_id, sequ_last_val, sequ_is_called
  FROM emaj.emaj_sequence ORDER BY sequ_time_id, sequ_schema, sequ_name;
 sequ_schema |     sequ_name     | sequ_time_id | sequ_last_val | sequ_is_called 
-------------+-------------------+--------------+---------------+----------------
 myschema2   | myTbl3_col31_seq  |        12017 |            11 | f
 myschema2   | myseq1            |        12017 |          1000 | f
 myschema2   | myTbl3_col31_seq  |        12300 |            20 | t
 myschema2   | myseq1            |        12300 |          1000 | t
 myschema2   | myTbl3_col31_seq  |        12301 |            20 | t
 myschema2   | myseq1            |        12301 |          1003 | t
 myschema1   | myTbl3_col31_seq  |        12501 |            20 | t
 myschema1   | mytbl2b_col20_seq |        12501 |             5 | t
 myschema1   | myTbl3_col31_seq  |        12502 |            20 | t
 myschema1   | mytbl2b_col20_seq |        12502 |             5 | t
 myschema1   | myTbl3_col31_seq  |        12701 |            20 | t
 myschema1   | mytbl2b_col20_seq |        12701 |             5 | t
(12 rows)

SELECT tbl_schema, tbl_name, tbl_time_id, tbl_log_seq_last_val
  FROM emaj.emaj_table ORDER BY tbl_time_id, tbl_schema, tbl_name;
 tbl_schema | tbl_name | tbl_time_id | tbl_log_seq_last_val 
------------+----------+-------------+----------------------
 myschema2  | myTbl3   |       12017 |                    0
 myschema2  | mytbl1   |       12017 |                    0
 myschema2  | mytbl2   |       12017 |                    0
 myschema2  | mytbl4   |       12017 |                    0
 myschema2  | mytbl5   |       12017 |                    0
 myschema2  | mytbl6   |       12017 |                    0
 myschema2  | myTbl3   |       12300 |                   10
 myschema2  | mytbl1   |       12300 |                   15
 myschema2  | mytbl2   |       12300 |                    2
 myschema2  | mytbl4   |       12300 |                    0
 myschema2  | mytbl5   |       12300 |                    3
 myschema2  | mytbl6   |       12300 |                   11
 myschema2  | myTbl3   |       12301 |                   10
 myschema2  | mytbl1   |       12301 |                   15
 myschema2  | mytbl2   |       12301 |                    2
 myschema2  | mytbl4   |       12301 |                    4
 myschema2  | mytbl5   |       12301 |                    4
 myschema2  | mytbl6   |       12301 |                   14
 myschema1  | myTbl3   |       12501 |                   10
 myschema1  | mytbl1   |       12501 |                   30
 myschema1  | mytbl2   |       12501 |                    3
 myschema1  | mytbl2b  |       12501 |                    3
 myschema1  | mytbl4   |       12501 |                    8
 myschema1  | myTbl3   |       12502 |                   20
 myschema1  | mytbl1   |       12502 |                   30
 myschema1  | mytbl2   |       12502 |                    3
 myschema1  | mytbl2b  |       12502 |                    3
 myschema1  | mytbl4   |       12502 |                    8
 myschema1  | myTbl3   |       12701 |                   20
 myschema1  | mytbl1   |       12701 |                   32
 myschema1  | mytbl2   |       12701 |                    3
 myschema1  | mytbl2b  |       12701 |                    3
 myschema1  | mytbl4   |       12701 |                   12
(33 rows)

SELECT sqhl_schema, sqhl_table, sqhl_begin_time_id, sqhl_end_time_id, sqhl_hole_size FROM emaj.emaj_seq_hole ORDER BY 1, 2, 3;
 sqhl_schema | sqhl_table | sqhl_begin_time_id | sqhl_end_time_id | sqhl_hole_size 
-------------+------------+--------------------+------------------+----------------
 myschema1   | mytbl1     |              12502 |            12700 |              1
 myschema1   | mytbl4     |              12502 |            12700 |              2
 myschema2   | mytbl4     |              12301 |            12602 |              6
 myschema2   | mytbl5     |              12301 |            12602 |              3
 myschema2   | mytbl6     |              12301 |            12602 |              9
(5 rows)

SELECT time_id, time_last_emaj_gid, time_event FROM emaj.emaj_time_stamp WHERE time_id >= 12800 ORDER BY time_id;
 time_id | time_last_emaj_gid | time_event 
---------+--------------------+------------
(0 rows)

SELECT hist_function, hist_event, hist_object,
       regexp_replace(regexp_replace(regexp_replace(hist_wording,
            E'\\d\\d\.\\d\\d\\.\\d\\d\\.\\d\\d\\d\\d', '%', 'g'),
            E'\\d\\d\\d\\d/\\d\\d\\/\\d\\d\\ \\d\\d\\:\\d\\d:\\d\\d .*?\\)', '<timestamp>)', 'g'),
            E'\\[.+\\]', '(timestamp)', 'g'),
       hist_user
  FROM emaj.emaj_hist WHERE hist_id >= 12800 ORDER BY hist_id;
      hist_function       | hist_event | hist_object |                    regexp_replace                     |     hist_user      
--------------------------+------------+-------------+-------------------------------------------------------+--------------------
 RENAME_MARK_GROUP        | BEGIN      | myGroup1    | RLBK_12701_START                                      | _regress_emaj_adm1
 RENAME_MARK_GROUP        | END        | myGroup1    | RLBK_12701_START renamed Before logged rollback to M4 | _regress_emaj_adm1
 DELETE_MARK_GROUP        | BEGIN      | myGroup1    | RLBK_12701_DONE                                       | _regress_emaj_adm1
 DELETE_MARK_GROUP        | END        | myGroup1    | RLBK_12701_DONE                                       | _regress_emaj_adm1
 DELETE_MARK_GROUP        | BEGIN      | myGroup1    | M1                                                    | _regress_emaj_adm1
 DELETE_MARK_GROUP        | END        | myGroup1    | M1                                                    | _regress_emaj_adm1
 DELETE_BEFORE_MARK_GROUP | BEGIN      | myGroup1    | M4                                                    | _regress_emaj_adm1
 DELETE_BEFORE_MARK_GROUP | END        | myGroup1    | 1 marks deleted ; M4 is now the initial mark          | _regress_emaj_adm1
(8 rows)

-- User tables.
RESET session_authorization;
SELECT * FROM mySchema1.myTbl1 ORDER BY col11, col12;
 col11 |   col12    | col13 
-------+------------+-------
     2 | ABC        | \x1c
     3 | ABC        | \x1c
     4 | ABC        | \x0c
     5 | ABC        | \x0c
     6 | ABC        | \x0c
     7 | ABC        | \x0c
     8 | ABC        | \x0c
     9 | ABC        | \x0c
    10 | ABC        | \x0c
   100 | DEF        | \x00
   101 | DEF        | \x00
   102 | DEF        | \x00
   103 | DEF        | \x00
   104 | DEF        | \x00
   105 | DEF        | \x00
   106 | DEF        | \x00
   107 | DEF        | \x00
   108 | DEF        | \x00
   109 | DEF        | \x00
   110 | DEF        | \x00
(20 rows)

SELECT * FROM mySchema1.myTbl2 ORDER BY col21;
 col21 | col22 |   col23    
-------+-------+------------
     1 | ABC   | 12-31-2010
     2 | DEF   | 
     3 | GHI   | 01-02-2010
(3 rows)

SELECT * FROM mySchema1.myTbl2b ORDER BY col20;
 col20 | col21 |       col22        |         col23         | col24 
-------+-------+--------------------+-----------------------+-------
     3 |     1 |                  1 |    0.7071067811865476 | t
     4 |     2 |                0.5 | 6.123233995736766e-17 | t
     5 |     3 | 0.3333333333333333 |   -0.7071067811865475 | t
(3 rows)

SELECT col31, col33 FROM mySchema1."myTbl3" ORDER BY col31;
 col31 | col33 
-------+-------
    11 | 10.00
    12 | 10.00
    13 | 10.00
    19 | 10.00
    20 | 10.00
(5 rows)

SELECT * FROM mySchema1.myTbl4 ORDER BY col41;
 col41 | col42 | col43 | col44 | col45 
-------+-------+-------+-------+-------
(0 rows)

-- Log tables.
SET session_authorization TO _regress_emaj_adm1;
SELECT col11, col12, col13, emaj_verb, emaj_tuple, emaj_gid FROM emaj_mySchema1.myTbl1_log ORDER BY emaj_gid, emaj_tuple DESC;
 col11 |   col12    | col13 | emaj_verb | emaj_tuple | emaj_gid 
-------+------------+-------+-----------+------------+----------
     1 | Step 6     | \x01  | INS       | NEW        | 12700004
     1 | Step 6     | \x01  | DEL       | OLD        | 12700029
(2 rows)

SELECT col21, col22, col23, emaj_verb, emaj_tuple, emaj_gid FROM emaj_mySchema1.myTbl2_log ORDER BY emaj_gid, emaj_tuple DESC;
 col21 | col22 | col23 | emaj_verb | emaj_tuple | emaj_gid 
-------+-------+-------+-----------+------------+----------
(0 rows)

SELECT col20, col21, col22, col23, col24, emaj_verb, emaj_tuple, emaj_gid FROM emaj_mySchema1.myTbl2b_log ORDER BY emaj_gid, emaj_tuple DESC;
 col20 | col21 | col22 | col23 | col24 | emaj_verb | emaj_tuple | emaj_gid 
-------+-------+-------+-------+-------+-----------+------------+----------
(0 rows)

SELECT col31, col33, emaj_verb, emaj_tuple, emaj_gid FROM emaj_myschema1."myTbl3_log" ORDER BY emaj_gid, emaj_tuple DESC;
 col31 | col33 | emaj_verb | emaj_tuple | emaj_gid 
-------+-------+-----------+------------+----------
    11 | 10.00 | UPD       | OLD        | 12500015
    11 |  5.00 | UPD       | NEW        | 12500015
    12 | 10.00 | UPD       | OLD        | 12500016
    12 |  5.00 | UPD       | NEW        | 12500016
    13 | 10.00 | UPD       | OLD        | 12500017
    13 |  5.00 | UPD       | NEW        | 12500017
    14 | 10.00 | UPD       | OLD        | 12500018
    14 |  5.00 | UPD       | NEW        | 12500018
    15 | 10.00 | UPD       | OLD        | 12500019
    15 |  5.00 | UPD       | NEW        | 12500019
    16 | 10.00 | UPD       | OLD        | 12500020
    16 |  5.00 | UPD       | NEW        | 12500020
    17 | 10.00 | UPD       | OLD        | 12500021
    17 |  5.00 | UPD       | NEW        | 12500021
    18 | 10.00 | UPD       | OLD        | 12500022
    18 |  5.00 | UPD       | NEW        | 12500022
    19 | 10.00 | UPD       | OLD        | 12500023
    19 |  5.00 | UPD       | NEW        | 12500023
    20 | 10.00 | UPD       | OLD        | 12500024
    20 |  5.00 | UPD       | NEW        | 12500024
    11 |  5.00 | DEL       | OLD        | 12700007
    12 |  5.00 | DEL       | OLD        | 12700008
    13 |  5.00 | DEL       | OLD        | 12700009
    14 |  5.00 | DEL       | OLD        | 12700010
    15 |  5.00 | DEL       | OLD        | 12700011
    16 |  5.00 | DEL       | OLD        | 12700012
    17 |  5.00 | DEL       | OLD        | 12700013
    18 |  5.00 | DEL       | OLD        | 12700014
    19 |  5.00 | DEL       | OLD        | 12700015
    20 |  5.00 | DEL       | OLD        | 12700016
    11 | 10.00 | INS       | NEW        | 12700017
    12 | 10.00 | INS       | NEW        | 12700018
    13 | 10.00 | INS       | NEW        | 12700019
    14 | 10.00 | INS       | NEW        | 12700020
    15 | 10.00 | INS       | NEW        | 12700021
    16 | 10.00 | INS       | NEW        | 12700022
    17 | 10.00 | INS       | NEW        | 12700023
    18 | 10.00 | INS       | NEW        | 12700024
    19 | 10.00 | INS       | NEW        | 12700025
    20 | 10.00 | INS       | NEW        | 12700026
    14 | 10.00 | DEL       | OLD        | 12800001
    15 | 10.00 | DEL       | OLD        | 12800002
    16 | 10.00 | DEL       | OLD        | 12800003
    17 | 10.00 | DEL       | OLD        | 12800004
    18 | 10.00 | DEL       | OLD        | 12800005
(45 rows)

SELECT col41, col42, col43, col44, col45, emaj_verb, emaj_tuple, emaj_gid FROM emaj_mySchema1.myTbl4_log ORDER BY emaj_gid, emaj_tuple DESC;
 col41 | col42 | col43 | col44 | col45  | emaj_verb | emaj_tuple | emaj_gid 
-------+-------+-------+-------+--------+-----------+------------+----------
    11 |       |     1 |     1 | Step 6 | INS       | NEW        | 12700005
    12 |       |     1 |     1 | Step 6 | INS       | NEW        | 12700006
    11 |       |     1 |     1 | Step 6 | DEL       | OLD        | 12700027
    12 |       |     1 |     1 | Step 6 | DEL       | OLD        | 12700028
(4 rows)

--
RESET session_authorization;
