-- alterLogging.sql : test groups structure changes with groups in LOGGING state
--
-- It follows alter.sql that tests the same functions but with groups in IDLE state.
-- It uses the same tables and groups, and the same sequences range
-- It includes the final checks for both alter.sql and alterLogging.sql scenarios
-- set sequence restart value
select public.handle_emaj_sequences(9000);
 handle_emaj_sequences 
-----------------------
 
(1 row)

-- define and create the temp file directory to be used by the script
\setenv EMAJTESTTMPDIR '/tmp/emaj_'`echo $PGVER`'/alter_logging'
\set EMAJTESTTMPDIR `echo $EMAJTESTTMPDIR`
\! mkdir -p $EMAJTESTTMPDIR
select emaj.emaj_remove_tables('myschema2', array['mytbl7','mytbl8']);
 emaj_remove_tables 
--------------------
                  2
(1 row)

select emaj.emaj_start_groups('{"myGroup1","myGroup2"}','Mk1');
WARNING:  _check_fk_groups: The foreign key "mytbl6_col61_fkey" on the table "myschema2.mytbl6" references the table "myschema2.mytbl7" that is outside the groups (myGroup1,myGroup2).
WARNING:  _check_fk_groups: The table "myschema2.mytbl6" is referenced by the foreign key "mytbl8_col81_fkey" on the table "myschema2.mytbl8" that is outside the groups (myGroup1,myGroup2).
 emaj_start_groups 
-------------------
                15
(1 row)

-- Save the groups configuration
select emaj.emaj_export_groups_configuration(:'EMAJTESTTMPDIR' || '/all_groups_conf.json');
 emaj_export_groups_configuration 
----------------------------------
                                4
(1 row)

-----------------------------
-- change attributes
-----------------------------
-- bad mark (duplicate name)
select emaj.emaj_modify_table('myschema1','mytbl1','{"priority":30}'::jsonb,emaj.emaj_get_previous_mark_group('myGroup1',now()));
ERROR:  _check_new_mark: The group "myGroup1" already contains a mark named "Mk1".
CONTEXT:  PL/pgSQL function emaj._check_new_mark(text[],text) line 29 at RAISE
SQL statement "SELECT emaj._check_new_mark(v_loggingGroups, v_mark)"
PL/pgSQL function emaj._modify_tables(text,text[],jsonb,text,boolean,boolean) line 120 at SQL statement
PL/pgSQL function emaj.emaj_modify_table(text,text,jsonb,text) line 7 at RETURN
-- change the priority
select emaj.emaj_modify_table('myschema1','mytbl1','{"priority":30}'::jsonb,'Priority Changed');
 emaj_modify_table 
-------------------
                 1
(1 row)

-- change the log data tablespace and the log index tablespace for different tables
set default_tablespace = tspemaj_renamed;
select emaj.emaj_modify_table('myschema1','mytbl2b','{"log_data_tablespace":null}'::jsonb,'Attributes_changed_1');
 emaj_modify_table 
-------------------
                 1
(1 row)

select emaj.emaj_modify_table('myschema2','mytbl6','{"log_index_tablespace":"tsplog1"}'::jsonb,'Attributes_changed_2');
 emaj_modify_table 
-------------------
                 1
(1 row)

reset default_tablespace;
-- perform some operations: set an intermediate mark, update myTbl3 and rollback
select emaj.emaj_set_mark_groups('{"myGroup1","myGroup2"}','Mk2');
 emaj_set_mark_groups 
----------------------
                   15
(1 row)

insert into myschema1."myTbl3" values (11, now(), 11.0);
update myschema2."myTbl3" set col33 = 11.0 where col31 = 10;
select * from emaj.emaj_rollback_groups('{"myGroup1","myGroup2"}','Mk2');
 rlbk_severity |             rlbk_message             
---------------+--------------------------------------
 Notice        | 2 / 11 tables effectively processed.
 Notice        | 4 sequences processed.
(2 rows)

-- revert the properties changes
select emaj.emaj_import_groups_configuration(:'EMAJTESTTMPDIR' || '/all_groups_conf.json', '{"myGroup1","myGroup2"}', true);
NOTICE:  table "tmp_app_table" does not exist, skipping
NOTICE:  table "tmp_app_sequence" does not exist, skipping
NOTICE:  table "tmp_app_trigger" does not exist, skipping
WARNING:  _check_fk_groups: The foreign key "mytbl6_col61_fkey" on the table "myschema2.mytbl6" references the table "myschema2.mytbl7" that is outside the groups (myGroup1,myGroup2).
WARNING:  _check_fk_groups: The table "myschema2.mytbl6" is referenced by the foreign key "mytbl8_col81_fkey" on the table "myschema2.mytbl8" that is outside the groups (myGroup1,myGroup2).
 emaj_import_groups_configuration 
----------------------------------
                                2
(1 row)

-- checks for attributes changes
select * from emaj.emaj_alter_plan where altr_time_id >= 9000 order by 1,2,3,4,5;
 altr_time_id |        altr_step         | altr_schema | altr_tblseq | altr_group | altr_priority | altr_group_is_logging | altr_new_group | altr_new_group_is_logging | altr_rlbk_id 
--------------+--------------------------+-------------+-------------+------------+---------------+-----------------------+----------------+---------------------------+--------------
         9000 | REMOVE_TBL               | myschema2   | mytbl7      | myGroup2   |               | f                     |                |                           |             
         9000 | REMOVE_TBL               | myschema2   | mytbl8      | myGroup2   |               | f                     |                |                           |             
         9002 | CHANGE_REL_PRIORITY      | myschema1   | mytbl1      | myGroup1   |            30 | t                     |                |                           |             
         9003 | CHANGE_TBL_LOG_DATA_TSP  | myschema1   | mytbl2b     | myGroup1   |               | t                     |                |                           |             
         9004 | CHANGE_TBL_LOG_INDEX_TSP | myschema2   | mytbl6      | myGroup2   |               | t                     |                |                           |             
         9007 | CHANGE_TBL_LOG_DATA_TSP  | myschema1   | mytbl2b     | myGroup1   |               | t                     |                |                           |             
         9007 | CHANGE_TBL_LOG_INDEX_TSP | myschema2   | mytbl6      | myGroup2   |               | t                     |                |                           |             
         9007 | CHANGE_REL_PRIORITY      | myschema1   | mytbl1      | myGroup1   |            20 | t                     |                |                           |             
(8 rows)

select time_id, time_last_emaj_gid, time_event from emaj.emaj_time_stamp where time_id >= 9000 order by time_id;
 time_id | time_last_emaj_gid | time_event 
---------+--------------------+------------
    9000 |            9000000 | A
    9001 |            9000000 | M
    9002 |            9000000 | A
    9003 |            9000000 | A
    9004 |            9000000 | A
    9005 |            9000000 | M
    9006 |            9000002 | R
    9007 |            9000002 | I
(8 rows)

select hist_function, hist_event, hist_object,
       regexp_replace(regexp_replace(regexp_replace(hist_wording,
            E'\\d\\d\.\\d\\d\\.\\d\\d\\.\\d\\d\\d\\d','%','g'),
            E'\\d\\d\\d\\d/\\d\\d\\/\\d\\d\\ \\d\\d\\:\\d\\d:\\d\\d .*?\\)','<timestamp>)','g'),
            E'\\[.+\\]','(timestamp)','g'), 
       hist_user 
  from emaj.emaj_hist where hist_id >= 9000 order by hist_id;
   hist_function    |          hist_event          |         hist_object          |                          regexp_replace                          | hist_user 
--------------------+------------------------------+------------------------------+------------------------------------------------------------------+-----------
 REMOVE_TABLES      | BEGIN                        |                              |                                                                  | postgres
 REMOVE_TABLES      | TABLE REMOVED                | myschema2.mytbl7             | From the idle group myGroup2                                     | postgres
 REMOVE_TABLES      | TABLE REMOVED                | myschema2.mytbl8             | From the idle group myGroup2                                     | postgres
 REMOVE_TABLES      | END                          |                              | 2 tables removed from their groups                               | postgres
 START_GROUPS       | BEGIN                        | myGroup1,myGroup2            | With log reset                                                   | postgres
 LOCK_GROUPS        | BEGIN                        | myGroup1,myGroup2            |                                                                  | postgres
 LOCK_GROUPS        | END                          | myGroup1,myGroup2            | 11 tables locked, 0 deadlock(s)                                  | postgres
 SET_MARK_GROUPS    | BEGIN                        | myGroup1,myGroup2            | Mk1                                                              | postgres
 SET_MARK_GROUPS    | END                          | myGroup1,myGroup2            | Mk1                                                              | postgres
 START_GROUPS       | END                          | myGroup1,myGroup2            | 15 tables/sequences processed                                    | postgres
 MODIFY_TABLE       | BEGIN                        |                              |                                                                  | postgres
 LOCK_GROUP         | BEGIN                        | myGroup1                     |                                                                  | postgres
 LOCK_GROUP         | END                          | myGroup1                     | 5 tables locked, 0 deadlock(s)                                   | postgres
 SET_MARK_GROUPS    | BEGIN                        | myGroup1                     | Priority Changed                                                 | postgres
 SET_MARK_GROUPS    | END                          | myGroup1                     | Priority Changed                                                 | postgres
 MODIFY_TABLE       | PRIORITY CHANGED             | myschema1.mytbl1             | 2 => 3                                                           | postgres
 MODIFY_TABLE       | END                          |                              | 1 tables effectively modified                                    | postgres
 MODIFY_TABLE       | BEGIN                        |                              |                                                                  | postgres
 LOCK_GROUP         | BEGIN                        | myGroup1                     |                                                                  | postgres
 LOCK_GROUP         | END                          | myGroup1                     | 5 tables locked, 0 deadlock(s)                                   | postgres
 SET_MARK_GROUPS    | BEGIN                        | myGroup1                     | Attributes_changed_1                                             | postgres
 SET_MARK_GROUPS    | END                          | myGroup1                     | Attributes_changed_1                                             | postgres
 MODIFY_TABLE       | LOG DATA TABLESPACE CHANGED  | myschema1.mytbl2b            | tsp log'2 => Default tablespace                                  | postgres
 MODIFY_TABLE       | END                          |                              | 1 tables effectively modified                                    | postgres
 MODIFY_TABLE       | BEGIN                        |                              |                                                                  | postgres
 LOCK_GROUP         | BEGIN                        | myGroup2                     |                                                                  | postgres
 LOCK_GROUP         | END                          | myGroup2                     | 6 tables locked, 0 deadlock(s)                                   | postgres
 SET_MARK_GROUPS    | BEGIN                        | myGroup2                     | Attributes_changed_2                                             | postgres
 SET_MARK_GROUPS    | END                          | myGroup2                     | Attributes_changed_2                                             | postgres
 MODIFY_TABLE       | LOG INDEX TABLESPACE CHANGED | myschema2.mytbl6             | Default tablespace => tsplog1                                    | postgres
 MODIFY_TABLE       | END                          |                              | 1 tables effectively modified                                    | postgres
 SET_MARK_GROUPS    | BEGIN                        | myGroup1,myGroup2            | Mk2                                                              | postgres
 LOCK_GROUPS        | BEGIN                        | myGroup1,myGroup2            |                                                                  | postgres
 LOCK_GROUPS        | END                          | myGroup1,myGroup2            | 11 tables locked, 0 deadlock(s)                                  | postgres
 SET_MARK_GROUPS    | END                          | myGroup1,myGroup2            | Mk2                                                              | postgres
 ROLLBACK_GROUPS    | BEGIN                        | myGroup1,myGroup2            | Unlogged rollback to mark Mk2 (timestamp)                        | postgres
 DBLINK_OPEN_CNX    |                              | rlbk#1                       | Status = 1                                                       | postgres
 LOCK_GROUP         | BEGIN                        | myGroup1,myGroup2            | Rollback session #1                                              | postgres
 LOCK_GROUP         | END                          | myGroup1,myGroup2            | Rollback session #1: 11 tables locked, 0 deadlock(s)             | postgres
 ROLLBACK_TABLE     | BEGIN                        | myschema1."myTbl3"           | All log rows with emaj_gid > 9000000 and <= 9000002              | postgres
 ROLLBACK_TABLE     | END                          | myschema1."myTbl3"           | 1 rolled back primary keys                                       | postgres
 ROLLBACK_TABLE     | BEGIN                        | myschema2."myTbl3"           | All log rows with emaj_gid > 9000000 and <= 9000002              | postgres
 ROLLBACK_TABLE     | END                          | myschema2."myTbl3"           | 1 rolled back primary keys                                       | postgres
 ROLLBACK_SEQUENCE  |                              | myschema1."myTbl3_col31_seq" |                                                                  | postgres
 ROLLBACK_SEQUENCE  |                              | myschema1.mytbl2b_col20_seq  |                                                                  | postgres
 ROLLBACK_SEQUENCE  |                              | myschema2."myTbl3_col31_seq" |                                                                  | postgres
 ROLLBACK_SEQUENCE  |                              | myschema2.myseq1             |                                                                  | postgres
 ROLLBACK_GROUPS    | NOTICE                       | Rollback id 9000             | 2 / 11 tables effectively processed.                             | postgres
 ROLLBACK_GROUPS    | NOTICE                       | Rollback id 9000             | 4 sequences processed.                                           | postgres
 DBLINK_CLOSE_CNX   |                              | rlbk#1                       |                                                                  | postgres
 ROLLBACK_GROUPS    | END                          | myGroup1,myGroup2            | Rollback_id 9000, 2 tables and 4 sequences effectively processed | postgres
 IMPORT_GROUPS      | BEGIN                        | myGroup1, myGroup2           | Input file: '/tmp/emaj_12/alter_logging/all_groups_conf.json'    | postgres
 LOCK_GROUPS        | BEGIN                        | myGroup1,myGroup2            |                                                                  | postgres
 LOCK_GROUPS        | END                          | myGroup1,myGroup2            | 11 tables locked, 0 deadlock(s)                                  | postgres
 SET_MARK_GROUPS    | BEGIN                        | myGroup1,myGroup2            | IMPORT_%                                                         | postgres
 CLEANUP_RLBK_STATE |                              | Rollback id 9000             | set to COMMITTED                                                 | postgres
 SET_MARK_GROUPS    | END                          | myGroup1,myGroup2            | IMPORT_%                                                         | postgres
 IMPORT_GROUPS      | LOG DATA TABLESPACE CHANGED  | myschema1.mytbl2b            | Default tablespace => tsp log'2                                  | postgres
 IMPORT_GROUPS      | LOG INDEX TABLESPACE CHANGED | myschema2.mytbl6             | tsplog1 => Default tablespace                                    | postgres
 IMPORT_GROUPS      | PRIORITY CHANGED             | myschema1.mytbl1             | 3 => 2                                                           | postgres
 IMPORT_GROUPS      | END                          |                              | 2 created or altered tables groups                               | postgres
(61 rows)

-- set sequence restart value
select public.handle_emaj_sequences(9100);
 handle_emaj_sequences 
-----------------------
 
(1 row)

-----------------------------
-- add sequences
-----------------------------
-- add myschema2.mySeq2 to the myGroup2 group
-- first perform changes and set marks
select emaj.emaj_set_mark_group('myGroup2','ADD_SEQ test');
 emaj_set_mark_group 
---------------------
                   8
(1 row)

select nextval('myschema2.myseq2');
 nextval 
---------
       1
(1 row)

select emaj.emaj_set_mark_group('myGroup2','Before ADD_SEQ');
 emaj_set_mark_group 
---------------------
                   8
(1 row)

select nextval('myschema2.myseq2');
 nextval 
---------
       2
(1 row)

-- then add the sequence to the group
select emaj.emaj_assign_sequence('myschema2', 'myseq2', 'myGroup2', 'Add myseq2');
 emaj_assign_sequence 
----------------------
                    1
(1 row)

select group_name, group_last_alter_time_id, group_nb_table, group_nb_sequence
  from emaj.emaj_group where group_name = 'myGroup2';
 group_name | group_last_alter_time_id | group_nb_table | group_nb_sequence 
------------+--------------------------+----------------+-------------------
 myGroup2   |                     9102 |              6 |                 3
(1 row)

select rel_schema, rel_tblseq, rel_time_range, rel_group, rel_kind
  from emaj.emaj_relation where rel_schema = 'myschema2' and rel_tblseq = 'myseq2' order by rel_time_range;
 rel_schema | rel_tblseq | rel_time_range | rel_group | rel_kind 
------------+------------+----------------+-----------+----------
 myschema2  | myseq2     | [9102,)        | myGroup2  | S
(1 row)

select * from emaj.emaj_sequence where sequ_name = 'myseq2';
 sequ_schema | sequ_name | sequ_time_id | sequ_last_val | sequ_start_val | sequ_increment |    sequ_max_val     | sequ_min_val | sequ_cache_val | sequ_is_cycled | sequ_is_called 
-------------+-----------+--------------+---------------+----------------+----------------+---------------------+--------------+----------------+----------------+----------------
 myschema2   | myseq2    |         9102 |             2 |              1 |              1 | 9223372036854775807 |            1 |              1 | f              | t
(1 row)

-- perform some other updates
select nextval('myschema2.myseq2');
 nextval 
---------
       3
(1 row)

select emaj.emaj_set_mark_group('myGroup2','After ADD_SEQ');
 emaj_set_mark_group 
---------------------
                   9
(1 row)

select nextval('myschema2.myseq2');
 nextval 
---------
       4
(1 row)

select nextval('myschema2.myseq2');
 nextval 
---------
       5
(1 row)

--testing snap and sql generation
\! mkdir $EMAJTESTTMPDIR/snap
select emaj.emaj_snap_group('myGroup2',:'EMAJTESTTMPDIR' || '/snap','');
 emaj_snap_group 
-----------------
               9
(1 row)

\! cat $EMAJTESTTMPDIR/snap/myschema2_myseq2.snap
myseq2	5	1	1	9223372036854775807	1	1	f	t
\! rm $EMAJTESTTMPDIR/snap/*
select emaj.emaj_snap_log_group('myGroup2',NULL,'After ADD_SEQ',:'EMAJTESTTMPDIR' || '/snap',NULL);
 emaj_snap_log_group 
---------------------
                   9
(1 row)

\! grep myseq2 $EMAJTESTTMPDIR/snap/myGroup2_sequences_at_Mk1
\! grep myseq2 $EMAJTESTTMPDIR/snap/myGroup2_sequences_at_After_ADD_SEQ
myschema2	myseq2	9103	3	1	1	9223372036854775807	1	1	f	t
\! rm $EMAJTESTTMPDIR/snap/*
select emaj.emaj_gen_sql_group('myGroup2', 'Before ADD_SEQ', NULL, :'EMAJTESTTMPDIR' || '/myFile');
NOTICE:  table "emaj_temp_script" does not exist, skipping
 emaj_gen_sql_group 
--------------------
                  0
(1 row)

\! grep myseq2 $EMAJTESTTMPDIR/myFile
select emaj.emaj_gen_sql_group('myGroup2', 'Before ADD_SEQ', NULL, :'EMAJTESTTMPDIR' || '/myFile',array['myschema2.myseq2']);
ERROR:  _gen_sql_groups: 1 tables/sequences (myschema2.myseq2) did not belong to any of the selected tables groups at Before ADD_SEQ mark time.
CONTEXT:  PL/pgSQL function emaj._gen_sql_groups(text[],boolean,text,text,text,text[]) line 69 at RAISE
PL/pgSQL function emaj.emaj_gen_sql_group(text,text,text,text,text[]) line 14 at RETURN
\! rm $EMAJTESTTMPDIR/myFile
-- testing mark deletions
begin;
  -- testing delete a single mark set after the sequence addition
  select emaj.emaj_delete_mark_group('myGroup2','After ADD_SEQ');
 emaj_delete_mark_group 
------------------------
                      1
(1 row)

  select 'Should not exist' from emaj.emaj_mark where mark_group = 'myGroup2' and mark_name = 'After ADD_SEQ';
 ?column? 
----------
(0 rows)

  -- testing delete all marks up to a mark set after the alter_group
  select emaj.emaj_delete_before_mark_group('myGroup2','EMAJ_LAST_MARK');
 emaj_delete_before_mark_group 
-------------------------------
                             6
(1 row)

  select * from emaj.emaj_mark where mark_group = 'myGroup2';
 mark_group | mark_name  | mark_time_id | mark_is_deleted | mark_is_rlbk_protected | mark_comment | mark_log_rows_before_next | mark_logged_rlbk_target_mark 
------------+------------+--------------+-----------------+------------------------+--------------+---------------------------+------------------------------
 myGroup2   | Add myseq2 |         9102 | f               | f                      |              |                           | 
(1 row)

  select * from emaj.emaj_sequence where sequ_name = 'myseq2' order by sequ_time_id;
 sequ_schema | sequ_name | sequ_time_id | sequ_last_val | sequ_start_val | sequ_increment |    sequ_max_val     | sequ_min_val | sequ_cache_val | sequ_is_cycled | sequ_is_called 
-------------+-----------+--------------+---------------+----------------+----------------+---------------------+--------------+----------------+----------------+----------------
 myschema2   | myseq2    |         9102 |             2 |              1 |              1 | 9223372036854775807 |            1 |              1 | f              | t
(1 row)

rollback;
begin;
  -- testing the alter_group mark deletion
  select mark_time_id from emaj.emaj_mark where mark_group = 'myGroup2' and mark_name = 'Add myseq2';
 mark_time_id 
--------------
         9102
(1 row)

  select emaj.emaj_delete_mark_group('myGroup2','Add myseq2');
 emaj_delete_mark_group 
------------------------
                      1
(1 row)

  select * from emaj.emaj_sequence where sequ_name = 'myseq2' order by sequ_time_id limit 1;
 sequ_schema | sequ_name | sequ_time_id | sequ_last_val | sequ_start_val | sequ_increment |    sequ_max_val     | sequ_min_val | sequ_cache_val | sequ_is_cycled | sequ_is_called 
-------------+-----------+--------------+---------------+----------------+----------------+---------------------+--------------+----------------+----------------+----------------
 myschema2   | myseq2    |         9102 |             2 |              1 |              1 | 9223372036854775807 |            1 |              1 | f              | t
(1 row)

rollback;
-- test sequences at bounds following a rollback targeting a mark set before an ADD_SEQ
begin;
  delete from emaj.emaj_param where param_key = 'dblink_user_password';
  select mark_time_id from emaj.emaj_mark where mark_group = 'myGroup2' and mark_name = 'Add myseq2';
 mark_time_id 
--------------
         9102
(1 row)

-- beware, the sequence changes generated by the E-Maj rollback will not be rollback by the transaction rollback
  select rlbk_severity, regexp_replace(rlbk_message,E'\\d\\d\\d\\d/\\d\\d\\/\\d\\d\\ \\d\\d\\:\\d\\d:\\d\\d .*?\\)','<timestamp>)','g')
    from emaj.emaj_rollback_group('myGroup2','Before ADD_SEQ',true);
 rlbk_severity |                                               regexp_replace                                               
---------------+------------------------------------------------------------------------------------------------------------
 Notice        | 0 / 6 tables effectively processed.
 Notice        | 3 sequences processed.
 Warning       | The sequence myschema2.myseq2 has only been rolled back to its latest group attachment state (<timestamp>)
(3 rows)

  select * from emaj.emaj_sequence where sequ_schema = 'myschema2' and sequ_name = 'myseq2';
 sequ_schema | sequ_name | sequ_time_id | sequ_last_val | sequ_start_val | sequ_increment |    sequ_max_val     | sequ_min_val | sequ_cache_val | sequ_is_cycled | sequ_is_called 
-------------+-----------+--------------+---------------+----------------+----------------+---------------------+--------------+----------------+----------------+----------------
 myschema2   | myseq2    |         9102 |             2 |              1 |              1 | 9223372036854775807 |            1 |              1 | f              | t
(1 row)

rollback;
-- estimate and then perform a logged rollback to reach a mark prior the ADD_SEQ operation and check
select * from emaj.emaj_estimate_rollback_group('myGroup2','Before ADD_SEQ',true);
 emaj_estimate_rollback_group 
------------------------------
 @ 0.009 secs
(1 row)

select rlbk_severity, regexp_replace(rlbk_message,E'\\d\\d\\d\\d/\\d\\d\\/\\d\\d\\ \\d\\d\\:\\d\\d:\\d\\d .*?\\)','<timestamp>)','g')
  from emaj.emaj_logged_rollback_group('myGroup2','Before ADD_SEQ',true);
 rlbk_severity |                                               regexp_replace                                               
---------------+------------------------------------------------------------------------------------------------------------
 Notice        | 0 / 6 tables effectively processed.
 Notice        | 3 sequences processed.
 Warning       | The sequence myschema2.myseq2 has only been rolled back to its latest group attachment state (<timestamp>)
(3 rows)

select * from myschema2.myseq2;
 last_value | log_cnt | is_called 
------------+---------+-----------
          3 |       0 | f
(1 row)

select * from emaj.emaj_sequence where sequ_name = 'myseq2' order by sequ_time_id;
 sequ_schema | sequ_name | sequ_time_id | sequ_last_val | sequ_start_val | sequ_increment |    sequ_max_val     | sequ_min_val | sequ_cache_val | sequ_is_cycled | sequ_is_called 
-------------+-----------+--------------+---------------+----------------+----------------+---------------------+--------------+----------------+----------------+----------------
 myschema2   | myseq2    |         9102 |             2 |              1 |              1 | 9223372036854775807 |            1 |              1 | f              | t
 myschema2   | myseq2    |         9103 |             3 |              1 |              1 | 9223372036854775807 |            1 |              1 | f              | t
 myschema2   | myseq2    |         9105 |             5 |              1 |              1 | 9223372036854775807 |            1 |              1 | f              | t
 myschema2   | myseq2    |         9106 |             3 |              1 |              1 | 9223372036854775807 |            1 |              1 | f              | f
(4 rows)

-- consolidate this logged rollback
select emaj.emaj_rename_mark_group('myGroup2','EMAJ_LAST_MARK','Logged_Rlbk_End');
 emaj_rename_mark_group 
------------------------
 
(1 row)

select mark_time_id from emaj.emaj_mark where mark_group = 'myGroup2' and mark_name = 'Add myseq2';
 mark_time_id 
--------------
         9102
(1 row)

select * from emaj.emaj_get_consolidable_rollbacks() where cons_group = 'myGroup2'; -- should report 1 row to consolidate
 cons_group | cons_target_rlbk_mark_name | cons_target_rlbk_mark_time_id | cons_end_rlbk_mark_name | cons_end_rlbk_mark_time_id | cons_rows | cons_marks 
------------+----------------------------+-------------------------------+-------------------------+----------------------------+-----------+------------
 myGroup2   | Before ADD_SEQ             |                          9101 | Logged_Rlbk_End         |                       9106 |         0 |          3
(1 row)

select * from emaj.emaj_consolidate_rollback_group('myGroup2', 'Logged_Rlbk_End');
 emaj_consolidate_rollback_group 
---------------------------------
                               3
(1 row)

select * from emaj.emaj_sequence where sequ_schema = 'myschema2' and sequ_name = 'myseq2' order by sequ_schema, sequ_name, sequ_time_id;
 sequ_schema | sequ_name | sequ_time_id | sequ_last_val | sequ_start_val | sequ_increment |    sequ_max_val     | sequ_min_val | sequ_cache_val | sequ_is_cycled | sequ_is_called 
-------------+-----------+--------------+---------------+----------------+----------------+---------------------+--------------+----------------+----------------+----------------
 myschema2   | myseq2    |         9102 |             2 |              1 |              1 | 9223372036854775807 |            1 |              1 | f              | t
 myschema2   | myseq2    |         9106 |             3 |              1 |              1 | 9223372036854775807 |            1 |              1 | f              | f
(2 rows)

-- remove mySeq2 from the group, then re-add it
select emaj.emaj_remove_sequence('myschema2', 'myseq2', 'Remove myseq2');
 emaj_remove_sequence 
----------------------
                    1
(1 row)

select emaj.emaj_assign_sequence('myschema2', 'myseq2', 'myGroup2', 'Re-add myseq2');
 emaj_assign_sequence 
----------------------
                    1
(1 row)

select rel_schema, rel_tblseq, rel_time_range, rel_group, rel_kind
  from emaj.emaj_relation where rel_schema = 'myschema2' and rel_tblseq = 'myseq2' order by rel_time_range;
 rel_schema | rel_tblseq | rel_time_range | rel_group | rel_kind 
------------+------------+----------------+-----------+----------
 myschema2  | myseq2     | [9102,9107)    | myGroup2  | S
 myschema2  | myseq2     | [9108,)        | myGroup2  | S
(2 rows)

-- finaly remove mySeq2 from the group
select emaj.emaj_remove_sequence('myschema2', 'myseq2', 'Really remove myseq2');
 emaj_remove_sequence 
----------------------
                    1
(1 row)

-- and perform a full rollback (that do not process mySeq2)
select rlbk_severity, regexp_replace(rlbk_message,E'\\d\\d\\d\\d/\\d\\d\\/\\d\\d\\ \\d\\d\\:\\d\\d:\\d\\d .*?\\)','<timestamp>)','g')
  from emaj.emaj_rollback_group('myGroup2', 'ADD_SEQ test',true);
 rlbk_severity |                                         regexp_replace                                         
---------------+------------------------------------------------------------------------------------------------
 Notice        | 0 / 6 tables effectively processed.
 Notice        | 2 sequences processed.
 Warning       | The sequence myschema2.myseq2 has been left unchanged (not in group anymore since <timestamp>)
(3 rows)

select * from myschema2.myseq2;
 last_value | log_cnt | is_called 
------------+---------+-----------
          3 |       0 | f
(1 row)

-- verify that all time range bounds of emaj_relation has its corresponding row into emaj_sequence
select * from emaj.emaj_sequence where sequ_schema = 'myschema2' and sequ_name = 'myseq2' and sequ_time_id in
  (select lower(rel_time_range) from emaj.emaj_relation where rel_schema = 'myschema2' and rel_tblseq = 'myseq2' union 
   select upper(rel_time_range) from emaj.emaj_relation where rel_schema = 'myschema2' and rel_tblseq = 'myseq2')
  order by sequ_time_id;
 sequ_schema | sequ_name | sequ_time_id | sequ_last_val | sequ_start_val | sequ_increment |    sequ_max_val     | sequ_min_val | sequ_cache_val | sequ_is_cycled | sequ_is_called 
-------------+-----------+--------------+---------------+----------------+----------------+---------------------+--------------+----------------+----------------+----------------
 myschema2   | myseq2    |         9102 |             2 |              1 |              1 | 9223372036854775807 |            1 |              1 | f              | t
 myschema2   | myseq2    |         9107 |             3 |              1 |              1 | 9223372036854775807 |            1 |              1 | f              | f
 myschema2   | myseq2    |         9108 |             3 |              1 |              1 | 9223372036854775807 |            1 |              1 | f              | f
 myschema2   | myseq2    |         9109 |             3 |              1 |              1 | 9223372036854775807 |            1 |              1 | f              | f
(4 rows)

-- checks for add sequences test
select * from emaj.emaj_alter_plan where altr_time_id >= 9100 order by 1,2,3,4,5;
 altr_time_id | altr_step  | altr_schema | altr_tblseq | altr_group | altr_priority | altr_group_is_logging | altr_new_group | altr_new_group_is_logging | altr_rlbk_id 
--------------+------------+-------------+-------------+------------+---------------+-----------------------+----------------+---------------------------+--------------
         9102 | ADD_SEQ    | myschema2   | myseq2      | myGroup2   |               | t                     |                |                           |         9101
         9107 | REMOVE_SEQ | myschema2   | myseq2      | myGroup2   |               | t                     |                |                           |         9102
         9108 | ADD_SEQ    | myschema2   | myseq2      | myGroup2   |               | t                     |                |                           |         9102
         9109 | REMOVE_SEQ | myschema2   | myseq2      | myGroup2   |               | t                     |                |                           |         9102
(4 rows)

select time_id, time_last_emaj_gid, time_event from emaj.emaj_time_stamp where time_id >= 9100 order by time_id;
 time_id | time_last_emaj_gid | time_event 
---------+--------------------+------------
    9100 |            9100000 | M
    9101 |            9100000 | M
    9102 |            9100000 | A
    9103 |            9100000 | M
    9105 |            9100000 | R
    9106 |            9100000 | M
    9107 |            9100000 | A
    9108 |            9100000 | A
    9109 |            9100000 | A
    9110 |            9100000 | R
(10 rows)

select hist_function, hist_event, hist_object,
       regexp_replace(regexp_replace(regexp_replace(hist_wording,
            E'\\d\\d\.\\d\\d\\.\\d\\d\\.\\d\\d\\d\\d','%','g'),
            E'\\d\\d\\d\\d/\\d\\d\\/\\d\\d\\ \\d\\d\\:\\d\\d:\\d\\d .*?\\)','<timestamp>)','g'),
            E'\\[.+\\]','(timestamp)','g'), 
       hist_user 
  from emaj.emaj_hist where hist_id >= 9100 order by hist_id;
     hist_function      |    hist_event    |         hist_object          |                                               regexp_replace                                               | hist_user 
------------------------+------------------+------------------------------+------------------------------------------------------------------------------------------------------------+-----------
 SET_MARK_GROUP         | BEGIN            | myGroup2                     |                                                                                                            | postgres
 LOCK_GROUP             | BEGIN            | myGroup2                     |                                                                                                            | postgres
 LOCK_GROUP             | END              | myGroup2                     | 6 tables locked, 0 deadlock(s)                                                                             | postgres
 SET_MARK_GROUP         | END              | myGroup2                     | ADD_SEQ test                                                                                               | postgres
 SET_MARK_GROUP         | BEGIN            | myGroup2                     |                                                                                                            | postgres
 LOCK_GROUP             | BEGIN            | myGroup2                     |                                                                                                            | postgres
 LOCK_GROUP             | END              | myGroup2                     | 6 tables locked, 0 deadlock(s)                                                                             | postgres
 SET_MARK_GROUP         | END              | myGroup2                     | Before ADD_SEQ                                                                                             | postgres
 ASSIGN_SEQUENCE        | BEGIN            |                              |                                                                                                            | postgres
 LOCK_GROUP             | BEGIN            | myGroup2                     |                                                                                                            | postgres
 LOCK_GROUP             | END              | myGroup2                     | 6 tables locked, 0 deadlock(s)                                                                             | postgres
 SET_MARK_GROUP         | BEGIN            | myGroup2                     | Add myseq2                                                                                                 | postgres
 SET_MARK_GROUP         | END              | myGroup2                     | Add myseq2                                                                                                 | postgres
 ASSIGN_SEQUENCE        | SEQUENCE ADDED   | myschema2.myseq2             | To the logging group myGroup2                                                                              | postgres
 ASSIGN_SEQUENCE        | END              |                              | 1 sequences assigned to the group myGroup2                                                                 | postgres
 SET_MARK_GROUP         | BEGIN            | myGroup2                     |                                                                                                            | postgres
 LOCK_GROUP             | BEGIN            | myGroup2                     |                                                                                                            | postgres
 LOCK_GROUP             | END              | myGroup2                     | 6 tables locked, 0 deadlock(s)                                                                             | postgres
 SET_MARK_GROUP         | END              | myGroup2                     | After ADD_SEQ                                                                                              | postgres
 SNAP_GROUP             | BEGIN            | myGroup2                     | /tmp/emaj_12/alter_logging/snap                                                                            | postgres
 SNAP_GROUP             | END              | myGroup2                     | 9 tables/sequences processed                                                                               | postgres
 SNAP_LOG_GROUP         | BEGIN            | myGroup2                     | From initial mark to mark After ADD_SEQ towards /tmp/emaj_12/alter_logging/snap                            | postgres
 SNAP_LOG_GROUP         | END              | myGroup2                     | 9 generated files                                                                                          | postgres
 GEN_SQL_GROUP          | BEGIN            | myGroup2                     | From mark Before ADD_SEQ to current situation                                                              | postgres
 GEN_SQL_GROUP          | END              | myGroup2                     | 0 generated statements - script exported into /tmp/emaj_12/alter_logging/myFile                            | postgres
 ROLLBACK_GROUP         | BEGIN            | myGroup2                     | Logged rollback to mark Before ADD_SEQ (timestamp)                                                         | postgres
 DBLINK_OPEN_CNX        |                  | rlbk#1                       | Status = 1                                                                                                 | postgres
 LOCK_GROUP             | BEGIN            | myGroup2                     | Rollback session #1                                                                                        | postgres
 LOCK_GROUP             | END              | myGroup2                     | Rollback session #1: 6 tables locked, 0 deadlock(s)                                                        | postgres
 SET_MARK_GROUP         | BEGIN            | myGroup2                     | RLBK_Before ADD_SEQ_%_START                                                                                | postgres
 SET_MARK_GROUP         | END              | myGroup2                     | RLBK_Before ADD_SEQ_%_START                                                                                | postgres
 ROLLBACK_SEQUENCE      |                  | myschema2."myTbl3_col31_seq" |                                                                                                            | postgres
 ROLLBACK_SEQUENCE      |                  | myschema2.myseq1             |                                                                                                            | postgres
 ROLLBACK_SEQUENCE      |                  | myschema2.myseq2             | RESTART 3                                                                                                  | postgres
 SET_MARK_GROUP         | BEGIN            | myGroup2                     | RLBK_Before ADD_SEQ_%_DONE                                                                                 | postgres
 SET_MARK_GROUP         | END              | myGroup2                     | RLBK_Before ADD_SEQ_%_DONE                                                                                 | postgres
 ROLLBACK_GROUP         | NOTICE           | Rollback id 9101             | 0 / 6 tables effectively processed.                                                                        | postgres
 ROLLBACK_GROUP         | NOTICE           | Rollback id 9101             | 3 sequences processed.                                                                                     | postgres
 ROLLBACK_GROUP         | WARNING          | Rollback id 9101             | The sequence myschema2.myseq2 has only been rolled back to its latest group attachment state (<timestamp>) | postgres
 DBLINK_CLOSE_CNX       |                  | rlbk#1                       |                                                                                                            | postgres
 ROLLBACK_GROUP         | END              | myGroup2                     | Rollback_id 9101, 0 tables and 3 sequences effectively processed                                           | postgres
 RENAME_MARK_GROUP      | BEGIN            | myGroup2                     | EMAJ_LAST_MARK                                                                                             | postgres
 RENAME_MARK_GROUP      | END              | myGroup2                     | RLBK_Before ADD_SEQ_%_DONE renamed Logged_Rlbk_End                                                         | postgres
 CONSOLIDATE_RLBK_GROUP | BEGIN            | myGroup2                     | Erase all between marks Before ADD_SEQ and Logged_Rlbk_End                                                 | postgres
 CONSOLIDATE_RLBK_GROUP | END              | myGroup2                     | 0 tables and 3 sequences processed ; 3 marks deleted                                                       | postgres
 REMOVE_SEQUENCE        | BEGIN            |                              |                                                                                                            | postgres
 LOCK_GROUP             | BEGIN            | myGroup2                     |                                                                                                            | postgres
 LOCK_GROUP             | END              | myGroup2                     | 6 tables locked, 0 deadlock(s)                                                                             | postgres
 SET_MARK_GROUP         | BEGIN            | myGroup2                     | Remove myseq2                                                                                              | postgres
 CLEANUP_RLBK_STATE     |                  | Rollback id 9101             | set to COMMITTED                                                                                           | postgres
 SET_MARK_GROUP         | END              | myGroup2                     | Remove myseq2                                                                                              | postgres
 REMOVE_SEQUENCE        | SEQUENCE REMOVED | myschema2.myseq2             | From the logging group myGroup2                                                                            | postgres
 REMOVE_SEQUENCE        | END              |                              | 1 sequences removed from their groups                                                                      | postgres
 ASSIGN_SEQUENCE        | BEGIN            |                              |                                                                                                            | postgres
 LOCK_GROUP             | BEGIN            | myGroup2                     |                                                                                                            | postgres
 LOCK_GROUP             | END              | myGroup2                     | 6 tables locked, 0 deadlock(s)                                                                             | postgres
 SET_MARK_GROUP         | BEGIN            | myGroup2                     | Re-add myseq2                                                                                              | postgres
 SET_MARK_GROUP         | END              | myGroup2                     | Re-add myseq2                                                                                              | postgres
 ASSIGN_SEQUENCE        | SEQUENCE ADDED   | myschema2.myseq2             | To the logging group myGroup2                                                                              | postgres
 ASSIGN_SEQUENCE        | END              |                              | 1 sequences assigned to the group myGroup2                                                                 | postgres
 REMOVE_SEQUENCE        | BEGIN            |                              |                                                                                                            | postgres
 LOCK_GROUP             | BEGIN            | myGroup2                     |                                                                                                            | postgres
 LOCK_GROUP             | END              | myGroup2                     | 6 tables locked, 0 deadlock(s)                                                                             | postgres
 SET_MARK_GROUP         | BEGIN            | myGroup2                     | Really remove myseq2                                                                                       | postgres
 SET_MARK_GROUP         | END              | myGroup2                     | Really remove myseq2                                                                                       | postgres
 REMOVE_SEQUENCE        | SEQUENCE REMOVED | myschema2.myseq2             | From the logging group myGroup2                                                                            | postgres
 REMOVE_SEQUENCE        | END              |                              | 1 sequences removed from their groups                                                                      | postgres
 ROLLBACK_GROUP         | BEGIN            | myGroup2                     | Unlogged rollback to mark ADD_SEQ test (timestamp)                                                         | postgres
 DBLINK_OPEN_CNX        |                  | rlbk#1                       | Status = 1                                                                                                 | postgres
 LOCK_GROUP             | BEGIN            | myGroup2                     | Rollback session #1                                                                                        | postgres
 LOCK_GROUP             | END              | myGroup2                     | Rollback session #1: 6 tables locked, 0 deadlock(s)                                                        | postgres
 ROLLBACK_GROUP         | MARK DELETED     | myGroup2                     | mark Before ADD_SEQ is deleted                                                                             | postgres
 ROLLBACK_GROUP         | MARK DELETED     | myGroup2                     | mark Logged_Rlbk_End is deleted                                                                            | postgres
 ROLLBACK_GROUP         | MARK DELETED     | myGroup2                     | mark Remove myseq2 is deleted                                                                              | postgres
 ROLLBACK_GROUP         | MARK DELETED     | myGroup2                     | mark Re-add myseq2 is deleted                                                                              | postgres
 ROLLBACK_GROUP         | MARK DELETED     | myGroup2                     | mark Really remove myseq2 is deleted                                                                       | postgres
 ROLLBACK_SEQUENCE      |                  | myschema2."myTbl3_col31_seq" |                                                                                                            | postgres
 ROLLBACK_SEQUENCE      |                  | myschema2.myseq1             |                                                                                                            | postgres
 ROLLBACK_GROUP         | NOTICE           | Rollback id 9102             | 0 / 6 tables effectively processed.                                                                        | postgres
 ROLLBACK_GROUP         | NOTICE           | Rollback id 9102             | 2 sequences processed.                                                                                     | postgres
 ROLLBACK_GROUP         | WARNING          | Rollback id 9102             | The sequence myschema2.myseq2 has been left unchanged (not in group anymore since <timestamp>)             | postgres
 DBLINK_CLOSE_CNX       |                  | rlbk#1                       |                                                                                                            | postgres
 ROLLBACK_GROUP         | END              | myGroup2                     | Rollback_id 9102, 0 tables and 2 sequences effectively processed                                           | postgres
(83 rows)

-- set sequence restart value
select public.handle_emaj_sequences(9300);
 handle_emaj_sequences 
-----------------------
 
(1 row)

-----------------------------
-- remove sequences
-----------------------------
select emaj.emaj_set_mark_group('myGroup1','Mk2b');
 emaj_set_mark_group 
---------------------
                   7
(1 row)

select emaj.emaj_set_mark_group('myGroup1','Before_remove');
 emaj_set_mark_group 
---------------------
                   7
(1 row)

select group_name, group_last_alter_time_id, group_nb_table, group_nb_sequence
  from emaj.emaj_group where group_name = 'myGroup1';
 group_name | group_last_alter_time_id | group_nb_table | group_nb_sequence 
------------+--------------------------+----------------+-------------------
 myGroup1   |                     9007 |              5 |                 2
(1 row)

select emaj.emaj_remove_sequence('myschema1', 'myTbl3_col31_seq', 'Sequence_removed');
 emaj_remove_sequence 
----------------------
                    1
(1 row)

select group_name, group_last_alter_time_id, group_nb_table, group_nb_sequence
  from emaj.emaj_group where group_name = 'myGroup1';
 group_name | group_last_alter_time_id | group_nb_table | group_nb_sequence 
------------+--------------------------+----------------+-------------------
 myGroup1   |                     9302 |              5 |                 1
(1 row)

select rel_schema, rel_tblseq, rel_time_range, rel_group, rel_kind
  from emaj.emaj_relation where rel_schema = 'myschema1' and rel_tblseq = 'myTbl3_col31_seq' order by rel_time_range;
 rel_schema |    rel_tblseq    | rel_time_range | rel_group | rel_kind 
------------+------------------+----------------+-----------+----------
 myschema1  | myTbl3_col31_seq | [8008,9302)    | myGroup1  | S
(1 row)

select * from emaj.emaj_verify_all();
                                                                                      emaj_verify_all                                                                                       
--------------------------------------------------------------------------------------------------------------------------------------------------------------------------------------------
 Warning: In the group "myGroup2", the foreign key "mytbl6_col61_fkey" on the table "myschema2"."mytbl6" references the table "myschema2"."mytbl7" that does not belong to any group.
 Warning: In the group "myGroup2", the table "myschema2"."mytbl6" is referenced by the foreign key "mytbl8_col81_fkey" of the table "myschema2"."mytbl8" that does not belong to any group.
 No error detected
(3 rows)

--testing snap and sql generation
select emaj.emaj_snap_group('myGroup1',:'EMAJTESTTMPDIR' || '/snap','');
 emaj_snap_group 
-----------------
               6
(1 row)

\! ls $EMAJTESTTMPDIR/snap
_INFO
myschema1_myTbl3.snap
myschema1_mytbl1.snap
myschema1_mytbl2.snap
myschema1_mytbl2b.snap
myschema1_mytbl2b_col20_seq.snap
myschema1_mytbl4.snap
\! rm -R $EMAJTESTTMPDIR/snap/*
select emaj.emaj_snap_log_group('myGroup1','Mk1',NULL,:'EMAJTESTTMPDIR' || '/snap',NULL);
 emaj_snap_log_group 
---------------------
                   8
(1 row)

-- sequences at begin bound
\! cat $EMAJTESTTMPDIR/snap/myGroup1_sequences_at_Mk1
myschema1	myTbl3_col31_seq	9001	11	1	1	2147483647	1	1	f	f
myschema1	mytbl2b_col20_seq	9001	3	1	1	2147483647	1	1	f	f
-- sequences at end bound
\! find $EMAJTESTTMPDIR/snap -regex '.*/myGroup1_sequences_at_[0123456789].*' | xargs cat
myschema1	mytbl2b_col20_seq	9303	3	1	1	2147483647	1	1	f	f
\! rm $EMAJTESTTMPDIR/snap/*
select emaj.emaj_set_mark_group('myGroup1','After_remove');
 emaj_set_mark_group 
---------------------
                   6
(1 row)

-- testing sql script generation
select emaj.emaj_gen_sql_group('myGroup1', NULL, 'EMAJ_LAST_MARK', :'EMAJTESTTMPDIR' || '/script.sql',array['myschema1.myTbl3_col31_seq']);
NOTICE:  table "emaj_temp_script" does not exist, skipping
 emaj_gen_sql_group 
--------------------
                  0
(1 row)

\! grep -v 'generated by E-Maj at' $EMAJTESTTMPDIR/script.sql
--    for tables group(s): myGroup1
--    processing logs between mark Mk1 and mark After_remove
--    only for the following tables/sequences: myschema1.myTbl3_col31_seq
SET standard_conforming_strings = OFF;
SET escape_string_warning = OFF;
SET datestyle = 'ISO, YMD';
BEGIN TRANSACTION;
COMMIT;
RESET standard_conforming_strings;
RESET escape_string_warning;
RESET datestyle;
\! rm $EMAJTESTTMPDIR/script.sql
begin;
  -- testing the alter_group mark deletion
  select emaj.emaj_delete_mark_group('myGroup1','Sequence_removed');
 emaj_delete_mark_group 
------------------------
                      1
(1 row)

  select rel_schema, rel_tblseq, rel_time_range, rel_group, rel_kind
    from emaj.emaj_relation where rel_schema = 'myschema1' and rel_tblseq = 'myTbl3_col31_seq' order by rel_time_range;
 rel_schema |    rel_tblseq    | rel_time_range | rel_group | rel_kind 
------------+------------------+----------------+-----------+----------
 myschema1  | myTbl3_col31_seq | [8008,9302)    | myGroup1  | S
(1 row)

  select mark_group, regexp_replace(mark_name,E'\\d\\d\.\\d\\d\\.\\d\\d\\.\\d\\d\\d\\d','%','g'), mark_time_id,
    mark_is_deleted, mark_is_rlbk_protected, mark_comment, mark_log_rows_before_next, mark_logged_rlbk_target_mark
    from emaj.emaj_mark where mark_group = 'myGroup1' order by mark_time_id desc limit 2;
 mark_group | regexp_replace | mark_time_id | mark_is_deleted | mark_is_rlbk_protected | mark_comment | mark_log_rows_before_next | mark_logged_rlbk_target_mark 
------------+----------------+--------------+-----------------+------------------------+--------------+---------------------------+------------------------------
 myGroup1   | After_remove   |         9304 | f               | f                      |              |                           | 
 myGroup1   | Before_remove  |         9301 | f               | f                      |              |                         0 | 
(2 rows)

rollback;
begin;
  -- testing delete a single mark set before the sequence removal
  select emaj.emaj_delete_mark_group('myGroup1','Before_remove');
 emaj_delete_mark_group 
------------------------
                      1
(1 row)

  select * from emaj.emaj_sequence where sequ_schema = 'myschema1'
    and sequ_time_id not in (select distinct mark_time_id from emaj.emaj_mark where mark_group = 'myGroup1');
 sequ_schema | sequ_name | sequ_time_id | sequ_last_val | sequ_start_val | sequ_increment | sequ_max_val | sequ_min_val | sequ_cache_val | sequ_is_cycled | sequ_is_called 
-------------+-----------+--------------+---------------+----------------+----------------+--------------+--------------+----------------+----------------+----------------
(0 rows)

  -- testing rollback
  select rlbk_severity, regexp_replace(rlbk_message,E'\\d\\d\\d\\d/\\d\\d\\/\\d\\d\\ \\d\\d\\:\\d\\d:\\d\\d .*?\\)','<timestamp>)','g')
    from emaj.emaj_logged_rollback_group('myGroup1','Mk2b',true) order by 1,2;
 rlbk_severity |                                               regexp_replace                                               
---------------+------------------------------------------------------------------------------------------------------------
 Notice        | 0 / 5 tables effectively processed.
 Notice        | 1 sequences processed.
 Warning       | The sequence myschema1."myTbl3_col31_seq" has been left unchanged (not in group anymore since <timestamp>)
(3 rows)

  select * from emaj.emaj_rollback_group('myGroup1','Mk2b',true) order by 1,2;
 rlbk_severity |            rlbk_message             
---------------+-------------------------------------
 Notice        | 0 / 5 tables effectively processed.
 Notice        | 1 sequences processed.
(2 rows)

  savepoint svp1;
  -- testing group's reset
    select emaj.emaj_stop_group('myGroup1');
 emaj_stop_group 
-----------------
               6
(1 row)

    select rel_schema, rel_tblseq, rel_time_range, rel_group, rel_kind
      from emaj.emaj_relation where rel_group = 'myGroup1' and not upper_inf(rel_time_range) order by 1,2,3;
 rel_schema |    rel_tblseq    | rel_time_range | rel_group | rel_kind 
------------+------------------+----------------+-----------+----------
 myschema1  | myTbl3_col31_seq | [8008,9302)    | myGroup1  | S
(1 row)

    select emaj.emaj_reset_group('myGroup1');
 emaj_reset_group 
------------------
                6
(1 row)

    select count(*) from emaj.emaj_relation where rel_group = 'myGroup1' and not upper_inf(rel_time_range) order by 1,2,3;
ERROR:  ORDER BY position 2 is not in select list
LINE 1: ...'myGroup1' and not upper_inf(rel_time_range) order by 1,2,3;
                                                                   ^
  rollback to svp1;
  -- testing marks deletion
  select emaj.emaj_set_mark_group('myGroup1','Mk2d');
 emaj_set_mark_group 
---------------------
                   6
(1 row)

  select emaj.emaj_delete_before_mark_group('myGroup1','Mk2b');
 emaj_delete_before_mark_group 
-------------------------------
                             5
(1 row)

  select rel_schema, rel_tblseq, rel_time_range, rel_group, rel_kind
    from emaj.emaj_relation where rel_group = 'myGroup1' and not upper_inf(rel_time_range) order by 1,2,3;
 rel_schema |    rel_tblseq    | rel_time_range | rel_group | rel_kind 
------------+------------------+----------------+-----------+----------
 myschema1  | myTbl3_col31_seq | [8008,9302)    | myGroup1  | S
(1 row)

  select emaj.emaj_delete_before_mark_group('myGroup1','Mk2d');
 emaj_delete_before_mark_group 
-------------------------------
                             1
(1 row)

  select count(*) from emaj.emaj_relation where rel_group = 'myGroup1' and not upper_inf(rel_time_range) order by 1,2,3;
ERROR:  ORDER BY position 2 is not in select list
LINE 1: ...'myGroup1' and not upper_inf(rel_time_range) order by 1,2,3;
                                                                   ^
  -- testing the sequence drop
  drop sequence mySchema1."myTbl3_col31_seq" cascade;
ERROR:  current transaction is aborted, commands ignored until end of transaction block
rollback;
-- revert the changes
select emaj.emaj_import_groups_configuration(:'EMAJTESTTMPDIR' || '/all_groups_conf.json', '{"myGroup1"}', true, 'Revert_sequences_removal');
NOTICE:  table "tmp_app_table" does not exist, skipping
NOTICE:  table "tmp_app_sequence" does not exist, skipping
NOTICE:  table "tmp_app_trigger" does not exist, skipping
 emaj_import_groups_configuration 
----------------------------------
                                1
(1 row)

select emaj.emaj_cleanup_rollback_state();
 emaj_cleanup_rollback_state 
-----------------------------
                           0
(1 row)

-- checks for remove sequences test
select * from emaj.emaj_alter_plan where altr_time_id >= 9300 order by 1,2,3,4,5;
 altr_time_id | altr_step  | altr_schema |   altr_tblseq    | altr_group | altr_priority | altr_group_is_logging | altr_new_group | altr_new_group_is_logging | altr_rlbk_id 
--------------+------------+-------------+------------------+------------+---------------+-----------------------+----------------+---------------------------+--------------
         9302 | REMOVE_SEQ | myschema1   | myTbl3_col31_seq | myGroup1   |               | t                     |                |                           |             
         9310 | ADD_SEQ    | myschema1   | myTbl3_col31_seq | myGroup1   |               | t                     |                |                           |             
(2 rows)

select time_id, time_last_emaj_gid, time_event from emaj.emaj_time_stamp where time_id >= 9300 order by time_id;
 time_id | time_last_emaj_gid | time_event 
---------+--------------------+------------
    9300 |            9300000 | M
    9301 |            9300000 | M
    9302 |            9300000 | A
    9303 |            9300000 | S
    9304 |            9300000 | M
    9305 |            9300000 | R
    9307 |            9300000 | R
    9310 |            9300000 | I
(8 rows)

select hist_function, hist_event, hist_object,
       regexp_replace(regexp_replace(regexp_replace(hist_wording,
            E'\\d\\d\.\\d\\d\\.\\d\\d\\.\\d\\d\\d\\d','%','g'),
            E'\\d\\d\\d\\d/\\d\\d\\/\\d\\d\\ \\d\\d\\:\\d\\d:\\d\\d .*?\\)','<timestamp>)','g'),
            E'\\[.+\\]','(timestamp)','g'), 
       hist_user 
  from emaj.emaj_hist where hist_id >= 9300 order by hist_id;
   hist_function    |    hist_event    |         hist_object          |                                   regexp_replace                                    | hist_user 
--------------------+------------------+------------------------------+-------------------------------------------------------------------------------------+-----------
 SET_MARK_GROUP     | BEGIN            | myGroup1                     |                                                                                     | postgres
 LOCK_GROUP         | BEGIN            | myGroup1                     |                                                                                     | postgres
 LOCK_GROUP         | END              | myGroup1                     | 5 tables locked, 0 deadlock(s)                                                      | postgres
 CLEANUP_RLBK_STATE |                  | Rollback id 9102             | set to COMMITTED                                                                    | postgres
 SET_MARK_GROUP     | END              | myGroup1                     | Mk2b                                                                                | postgres
 SET_MARK_GROUP     | BEGIN            | myGroup1                     |                                                                                     | postgres
 LOCK_GROUP         | BEGIN            | myGroup1                     |                                                                                     | postgres
 LOCK_GROUP         | END              | myGroup1                     | 5 tables locked, 0 deadlock(s)                                                      | postgres
 SET_MARK_GROUP     | END              | myGroup1                     | Before_remove                                                                       | postgres
 REMOVE_SEQUENCE    | BEGIN            |                              |                                                                                     | postgres
 LOCK_GROUP         | BEGIN            | myGroup1                     |                                                                                     | postgres
 LOCK_GROUP         | END              | myGroup1                     | 5 tables locked, 0 deadlock(s)                                                      | postgres
 SET_MARK_GROUP     | BEGIN            | myGroup1                     | Sequence_removed                                                                    | postgres
 SET_MARK_GROUP     | END              | myGroup1                     | Sequence_removed                                                                    | postgres
 REMOVE_SEQUENCE    | SEQUENCE REMOVED | myschema1."myTbl3_col31_seq" | From the logging group myGroup1                                                     | postgres
 REMOVE_SEQUENCE    | END              |                              | 1 sequences removed from their groups                                               | postgres
 SNAP_GROUP         | BEGIN            | myGroup1                     | /tmp/emaj_12/alter_logging/snap                                                     | postgres
 SNAP_GROUP         | END              | myGroup1                     | 6 tables/sequences processed                                                        | postgres
 SNAP_LOG_GROUP     | BEGIN            | myGroup1                     | From mark Mk1 to current situation towards /tmp/emaj_12/alter_logging/snap          | postgres
 SNAP_LOG_GROUP     | END              | myGroup1                     | 8 generated files                                                                   | postgres
 SET_MARK_GROUP     | BEGIN            | myGroup1                     |                                                                                     | postgres
 LOCK_GROUP         | BEGIN            | myGroup1                     |                                                                                     | postgres
 LOCK_GROUP         | END              | myGroup1                     | 5 tables locked, 0 deadlock(s)                                                      | postgres
 SET_MARK_GROUP     | END              | myGroup1                     | After_remove                                                                        | postgres
 GEN_SQL_GROUP      | BEGIN            | myGroup1                     | From initial mark to mark EMAJ_LAST_MARK with tables/sequences filtering            | postgres
 GEN_SQL_GROUP      | END              | myGroup1                     | 0 generated statements - script exported into /tmp/emaj_12/alter_logging/script.sql | postgres
 IMPORT_GROUPS      | BEGIN            | myGroup1                     | Input file: '/tmp/emaj_12/alter_logging/all_groups_conf.json'                       | postgres
 LOCK_GROUPS        | BEGIN            | myGroup1                     |                                                                                     | postgres
 LOCK_GROUPS        | END              | myGroup1                     | 5 tables locked, 0 deadlock(s)                                                      | postgres
 SET_MARK_GROUPS    | BEGIN            | myGroup1                     | Revert_sequences_removal                                                            | postgres
 CLEANUP_RLBK_STATE |                  | Rollback id 9300             | set to ABORTED                                                                      | postgres
 CLEANUP_RLBK_STATE |                  | Rollback id 9301             | set to ABORTED                                                                      | postgres
 SET_MARK_GROUPS    | END              | myGroup1                     | Revert_sequences_removal                                                            | postgres
 IMPORT_GROUPS      | SEQUENCE ADDED   | myschema1."myTbl3_col31_seq" | To the logging group myGroup1                                                       | postgres
 IMPORT_GROUPS      | END              |                              | 1 created or altered tables groups                                                  | postgres
(35 rows)

-- set sequence restart value
select public.handle_emaj_sequences(9500);
 handle_emaj_sequences 
-----------------------
 
(1 row)

-----------------------------
-- add tables
-----------------------------
-- add myschema2.mytbl7 to the myGroup2 group
-- first perform updates and set marks
select emaj.emaj_set_mark_group('myGroup2','ADD_TBL test');
 emaj_set_mark_group 
---------------------
                   8
(1 row)

insert into myschema2.mytbl7 values (1),(2),(3);
select emaj.emaj_set_mark_group('myGroup2','Before ADD_TBL');
 emaj_set_mark_group 
---------------------
                   8
(1 row)

delete from myschema2.mytbl7 where col71 = 3;
-- then add the table to the group
select emaj.emaj_assign_table('myschema2', 'mytbl7', 'myGroup2', null, 'Add mytbl7');
NOTICE:  table "mytbl7_log" does not exist, skipping
NOTICE:  trigger "emaj_log_trg" for relation "myschema2.mytbl7" does not exist, skipping
NOTICE:  trigger "emaj_trunc_trg" for relation "myschema2.mytbl7" does not exist, skipping
WARNING:  _check_fk_groups: The table "myschema2.mytbl6" is referenced by the foreign key "mytbl8_col81_fkey" on the table "myschema2.mytbl8" that is outside the groups (myGroup2).
 emaj_assign_table 
-------------------
                 1
(1 row)

select group_name, group_last_alter_time_id, group_nb_table, group_nb_sequence
  from emaj.emaj_group where group_name = 'myGroup2';
 group_name | group_last_alter_time_id | group_nb_table | group_nb_sequence 
------------+--------------------------+----------------+-------------------
 myGroup2   |                     9502 |              7 |                 2
(1 row)

select rel_schema, rel_tblseq, rel_time_range, rel_group, rel_kind, rel_log_schema, rel_log_table
  from emaj.emaj_relation where rel_schema = 'myschema2' and rel_tblseq = 'mytbl7' order by rel_time_range;
 rel_schema | rel_tblseq | rel_time_range | rel_group | rel_kind | rel_log_schema | rel_log_table 
------------+------------+----------------+-----------+----------+----------------+---------------
 myschema2  | mytbl7     | [9502,)        | myGroup2  | r        | emaj_myschema2 | mytbl7_log
(1 row)

-- perform some other updates
insert into myschema2.mytbl7 values (4),(5);
-- remove the alter group mark just after the alter operation and then get statistics and set a mark
begin;
  select emaj.emaj_delete_mark_group('myGroup2','Add mytbl7');
 emaj_delete_mark_group 
------------------------
                      1
(1 row)

  select stat_group, stat_schema, stat_table, stat_first_mark, stat_last_mark, stat_rows 
    from emaj.emaj_log_stat_group('myGroup2','Before ADD_TBL',NULL);
 stat_group | stat_schema | stat_table | stat_first_mark | stat_last_mark | stat_rows 
------------+-------------+------------+-----------------+----------------+-----------
 myGroup2   | myschema2   | myTbl3     | Before ADD_TBL  |                |         0
 myGroup2   | myschema2   | mytbl1     | Before ADD_TBL  |                |         0
 myGroup2   | myschema2   | mytbl2     | Before ADD_TBL  |                |         0
 myGroup2   | myschema2   | mytbl4     | Before ADD_TBL  |                |         0
 myGroup2   | myschema2   | mytbl5     | Before ADD_TBL  |                |         0
 myGroup2   | myschema2   | mytbl6     | Before ADD_TBL  |                |         0
 myGroup2   | myschema2   | mytbl7     | [deleted mark]  |                |         2
(7 rows)

  select emaj.emaj_set_mark_group('myGroup2','Just after ADD_TBL');
 emaj_set_mark_group 
---------------------
                   9
(1 row)

  select mark_log_rows_before_next from emaj.emaj_mark where mark_name = 'Before ADD_TBL';
 mark_log_rows_before_next 
---------------------------
                         2
(1 row)

rollback;
-- set marks and look at statistics
select emaj.emaj_set_mark_group('myGroup2','Just after ADD_TBL');
 emaj_set_mark_group 
---------------------
                   9
(1 row)

update myschema2.mytbl7 set col71 = 6 where col71 = 2;
select col71, emaj_verb, emaj_tuple from emaj_myschema2.mytbl7_log order by emaj_gid;
 col71 | emaj_verb | emaj_tuple 
-------+-----------+------------
     4 | INS       | NEW
     5 | INS       | NEW
     2 | UPD       | OLD
     6 | UPD       | NEW
(4 rows)

select stat_group, stat_schema, stat_table, stat_first_mark, stat_last_mark, stat_rows
  from emaj.emaj_log_stat_group('myGroup2','ADD_TBL test',NULL);
 stat_group | stat_schema | stat_table | stat_first_mark | stat_last_mark | stat_rows 
------------+-------------+------------+-----------------+----------------+-----------
 myGroup2   | myschema2   | myTbl3     | ADD_TBL test    |                |         0
 myGroup2   | myschema2   | mytbl1     | ADD_TBL test    |                |         0
 myGroup2   | myschema2   | mytbl2     | ADD_TBL test    |                |         0
 myGroup2   | myschema2   | mytbl4     | ADD_TBL test    |                |         0
 myGroup2   | myschema2   | mytbl5     | ADD_TBL test    |                |         0
 myGroup2   | myschema2   | mytbl6     | ADD_TBL test    |                |         0
 myGroup2   | myschema2   | mytbl7     | Add mytbl7      |                |         3
(7 rows)

select emaj.emaj_set_mark_group('myGroup2','After ADD_TBL');
 emaj_set_mark_group 
---------------------
                   9
(1 row)

select stat_group, stat_schema, stat_table, stat_first_mark, stat_last_mark, stat_role, stat_verb, stat_rows
  from emaj.emaj_detailed_log_stat_group('myGroup2','ADD_TBL test','After ADD_TBL');
 stat_group | stat_schema | stat_table | stat_first_mark | stat_last_mark | stat_role | stat_verb | stat_rows 
------------+-------------+------------+-----------------+----------------+-----------+-----------+-----------
 myGroup2   | myschema2   | mytbl7     | Add mytbl7      | After ADD_TBL  | postgres  | INSERT    |         2
 myGroup2   | myschema2   | mytbl7     | Add mytbl7      | After ADD_TBL  | postgres  | UPDATE    |         1
(2 rows)

--testing snap and sql generation
select emaj.emaj_snap_group('myGroup2',:'EMAJTESTTMPDIR' || '/snap','');
 emaj_snap_group 
-----------------
               9
(1 row)

\! ls $EMAJTESTTMPDIR/snap
_INFO
myschema2_myTbl3.snap
myschema2_myTbl3_col31_seq.snap
myschema2_myseq1.snap
myschema2_mytbl1.snap
myschema2_mytbl2.snap
myschema2_mytbl4.snap
myschema2_mytbl5.snap
myschema2_mytbl6.snap
myschema2_mytbl7.snap
\! rm $EMAJTESTTMPDIR/snap/*
select emaj.emaj_snap_log_group('myGroup2',NULL,'After ADD_TBL',:'EMAJTESTTMPDIR' || '/snap',NULL);
 emaj_snap_log_group 
---------------------
                  10
(1 row)

\! ls $EMAJTESTTMPDIR/snap/myschema2*
/tmp/emaj_12/alter_logging/snap/myschema2_myTbl3_log.snap
/tmp/emaj_12/alter_logging/snap/myschema2_mytbl1_log.snap
/tmp/emaj_12/alter_logging/snap/myschema2_mytbl2_log.snap
/tmp/emaj_12/alter_logging/snap/myschema2_mytbl4_log.snap
/tmp/emaj_12/alter_logging/snap/myschema2_mytbl5_log.snap
/tmp/emaj_12/alter_logging/snap/myschema2_mytbl6_log.snap
/tmp/emaj_12/alter_logging/snap/myschema2_mytbl7_log.snap
select emaj.emaj_gen_sql_group('myGroup2', 'Before ADD_TBL', NULL, :'EMAJTESTTMPDIR' || '/script.sql',array['myschema2.mytbl7']);
ERROR:  _gen_sql_groups: 1 tables/sequences (myschema2.mytbl7) did not belong to any of the selected tables groups at Before ADD_TBL mark time.
CONTEXT:  PL/pgSQL function emaj._gen_sql_groups(text[],boolean,text,text,text,text[]) line 69 at RAISE
PL/pgSQL function emaj.emaj_gen_sql_group(text,text,text,text,text[]) line 14 at RETURN
\! rm $EMAJTESTTMPDIR/script.sql
rm: cannot remove '/tmp/emaj_12/alter_logging/script.sql': No such file or directory
-- testing mark deletions
begin;
  -- testing delete a single mark set after the table addition
  select emaj.emaj_delete_mark_group('myGroup2','After ADD_TBL');
 emaj_delete_mark_group 
------------------------
                      1
(1 row)

  select 'Should not exist' from emaj.emaj_mark where mark_group = 'myGroup2' and mark_name = 'After ADD_TBL';
 ?column? 
----------
(0 rows)

  -- testing delete all marks up to a mark set after the alter_group
  select emaj.emaj_delete_before_mark_group('myGroup2','EMAJ_LAST_MARK');
 emaj_delete_before_mark_group 
-------------------------------
                             8
(1 row)

  select * from emaj.emaj_mark where mark_group = 'myGroup2';
 mark_group |     mark_name      | mark_time_id | mark_is_deleted | mark_is_rlbk_protected | mark_comment | mark_log_rows_before_next | mark_logged_rlbk_target_mark 
------------+--------------------+--------------+-----------------+------------------------+--------------+---------------------------+------------------------------
 myGroup2   | Just after ADD_TBL |         9504 | f               | f                      |              |                           | 
(1 row)

  select tbl_schema, tbl_name, tbl_time_id, tbl_log_seq_last_val from emaj.emaj_table
    where tbl_name = 'mytbl7' order by tbl_time_id;
 tbl_schema | tbl_name | tbl_time_id | tbl_log_seq_last_val 
------------+----------+-------------+----------------------
 myschema2  | mytbl7   |        9502 |                    0
 myschema2  | mytbl7   |        9504 |                    2
(2 rows)

rollback;
begin;
  -- testing the add table mark deletion
  select mark_time_id from emaj.emaj_mark where mark_group = 'myGroup2' and mark_name = 'Add mytbl7';
 mark_time_id 
--------------
         9502
(1 row)

  select emaj.emaj_delete_mark_group('myGroup2','Add mytbl7');
 emaj_delete_mark_group 
------------------------
                      1
(1 row)

  select tbl_schema, tbl_name, tbl_time_id, tbl_log_seq_last_val from emaj.emaj_table
    where tbl_name = 'mytbl7' order by tbl_time_id limit 1;
 tbl_schema | tbl_name | tbl_time_id | tbl_log_seq_last_val 
------------+----------+-------------+----------------------
 myschema2  | mytbl7   |        9502 |                    0
(1 row)

rollback;
-- test sequences and holes at bounds following a rollback targeting a mark set before an ADD_TBL
begin;
  delete from emaj.emaj_param where param_key = 'dblink_user_password';
  select mark_time_id from emaj.emaj_mark where mark_group = 'myGroup2' and mark_name = 'Add mytbl7';
 mark_time_id 
--------------
         9502
(1 row)

  select rlbk_severity, regexp_replace(rlbk_message,E'\\d\\d\\d\\d/\\d\\d\\/\\d\\d\\ \\d\\d\\:\\d\\d:\\d\\d .*?\\)','<timestamp>)','g')
    from emaj.emaj_rollback_group('myGroup2','Before ADD_TBL',true);
 rlbk_severity |                                          regexp_replace                                           
---------------+---------------------------------------------------------------------------------------------------
 Notice        | 1 / 7 tables effectively processed.
 Notice        | 2 sequences processed.
 Warning       | The table myschema2.mytbl7 has only been rolled back to its latest group attachment (<timestamp>)
(3 rows)

  select tbl_schema, tbl_name, tbl_time_id, tbl_log_seq_last_val from emaj.emaj_table
    where tbl_schema = 'myschema2' and tbl_name = 'mytbl7' order by tbl_time_id;
 tbl_schema | tbl_name | tbl_time_id | tbl_log_seq_last_val 
------------+----------+-------------+----------------------
 myschema2  | mytbl7   |        9502 |                    0
(1 row)

  select * from emaj.emaj_seq_hole where sqhl_schema = 'myschema2' and sqhl_table = 'mytbl7';
 sqhl_schema | sqhl_table | sqhl_begin_time_id | sqhl_end_time_id | sqhl_hole_size 
-------------+------------+--------------------+------------------+----------------
 myschema2   | mytbl7     |               9502 |             9506 |              3
(1 row)

  select stat_group, stat_schema, stat_table, stat_first_mark, stat_first_mark_gid, stat_last_mark, stat_last_mark_gid, stat_rows 
    from emaj._log_stat_groups('{"myGroup2"}',false,'ADD_TBL test',NULL);
 stat_group | stat_schema | stat_table | stat_first_mark | stat_first_mark_gid | stat_last_mark | stat_last_mark_gid | stat_rows 
------------+-------------+------------+-----------------+---------------------+----------------+--------------------+-----------
 myGroup2   | myschema2   | myTbl3     | ADD_TBL test    |             9500000 |                |                    |         0
 myGroup2   | myschema2   | mytbl1     | ADD_TBL test    |             9500000 |                |                    |         0
 myGroup2   | myschema2   | mytbl2     | ADD_TBL test    |             9500000 |                |                    |         0
 myGroup2   | myschema2   | mytbl4     | ADD_TBL test    |             9500000 |                |                    |         0
 myGroup2   | myschema2   | mytbl5     | ADD_TBL test    |             9500000 |                |                    |         0
 myGroup2   | myschema2   | mytbl6     | ADD_TBL test    |             9500000 |                |                    |         0
 myGroup2   | myschema2   | mytbl7     | [deleted mark]  |             9500000 |                |                    |         0
(7 rows)

rollback;
-- estimate and then perform a logged rollback to reach a mark prior the ADD_TBL operation and check
select * from emaj.emaj_estimate_rollback_group('myGroup2','Before ADD_TBL',true);
 emaj_estimate_rollback_group 
------------------------------
 @ 0.028815 secs
(1 row)

select rlbk_severity, regexp_replace(rlbk_message,E'\\d\\d\\d\\d/\\d\\d\\/\\d\\d\\ \\d\\d\\:\\d\\d:\\d\\d .*?\\)','<timestamp>)','g')
  from emaj.emaj_logged_rollback_group('myGroup2','Before ADD_TBL',true);
 rlbk_severity |                                          regexp_replace                                           
---------------+---------------------------------------------------------------------------------------------------
 Notice        | 1 / 7 tables effectively processed.
 Notice        | 2 sequences processed.
 Warning       | The table myschema2.mytbl7 has only been rolled back to its latest group attachment (<timestamp>)
(3 rows)

select col71, emaj_verb, emaj_tuple from emaj_myschema2.mytbl7_log order by emaj_gid;
 col71 | emaj_verb | emaj_tuple 
-------+-----------+------------
     4 | INS       | NEW
     5 | INS       | NEW
     2 | UPD       | OLD
     6 | UPD       | NEW
     4 | DEL       | OLD
     5 | DEL       | OLD
     6 | DEL       | OLD
     2 | INS       | NEW
(8 rows)

select * from myschema2.mytbl7 order by col71;
 col71 
-------
     1
     2
(2 rows)

-- consolidate this logged rollback
select emaj.emaj_rename_mark_group('myGroup2','EMAJ_LAST_MARK','Logged_Rlbk_End');
 emaj_rename_mark_group 
------------------------
 
(1 row)

select mark_time_id from emaj.emaj_mark where mark_group = 'myGroup2' and mark_name = 'Add mytbl7';
 mark_time_id 
--------------
         9502
(1 row)

select * from emaj.emaj_get_consolidable_rollbacks() where cons_group = 'myGroup2'; -- should report 1 row to consolidate
 cons_group | cons_target_rlbk_mark_name | cons_target_rlbk_mark_time_id | cons_end_rlbk_mark_name | cons_end_rlbk_mark_time_id | cons_rows | cons_marks 
------------+----------------------------+-------------------------------+-------------------------+----------------------------+-----------+------------
 myGroup2   | Before ADD_TBL             |                          9501 | Logged_Rlbk_End         |                       9508 |         7 |          4
(1 row)

select * from emaj.emaj_consolidate_rollback_group('myGroup2', 'Logged_Rlbk_End');
 emaj_consolidate_rollback_group 
---------------------------------
                               3
(1 row)

select tbl_schema, tbl_name, tbl_time_id, tbl_log_seq_last_val from emaj.emaj_table
  where tbl_schema = 'myschema2' and tbl_name = 'mytbl7' order by tbl_time_id;
 tbl_schema | tbl_name | tbl_time_id | tbl_log_seq_last_val 
------------+----------+-------------+----------------------
 myschema2  | mytbl7   |        9502 |                    0
 myschema2  | mytbl7   |        9508 |                    7
(2 rows)

-- perform some other updates
insert into myschema2.myTbl7 values (7),(8),(9);
-- verify the group and detect the lack of the new log table
begin;
  select emaj.emaj_disable_protection_by_event_triggers();
 emaj_disable_protection_by_event_triggers 
-------------------------------------------
                                         3
(1 row)

  drop table emaj_myschema2.mytbl7_log;
  select * from emaj.emaj_verify_all();
                                                                                      emaj_verify_all                                                                                       
--------------------------------------------------------------------------------------------------------------------------------------------------------------------------------------------
 Error: In the group "myGroup2", the log table "emaj_myschema2"."mytbl7_log" is not found.
 Warning: In the group "myGroup2", the table "myschema2"."mytbl6" is referenced by the foreign key "mytbl8_col81_fkey" of the table "myschema2"."mytbl8" that does not belong to any group.
 Warning: Some E-Maj event triggers exist but are disabled. You may enable them using the emaj_enable_protection_by_event_triggers() function.
(3 rows)

  select emaj.emaj_enable_protection_by_event_triggers();
 emaj_enable_protection_by_event_triggers 
------------------------------------------
                                        3
(1 row)

rollback;
-- remove myTbl7 from the group, then re-add it
select emaj.emaj_remove_table('myschema2', 'mytbl7', 'Remove mytbl7');
 emaj_remove_table 
-------------------
                 1
(1 row)

select emaj.emaj_assign_table('myschema2', 'mytbl7', 'myGroup2', null, 'Re-add mytbl7');
NOTICE:  table "mytbl7_log" does not exist, skipping
NOTICE:  trigger "emaj_log_trg" for relation "myschema2.mytbl7" does not exist, skipping
NOTICE:  trigger "emaj_trunc_trg" for relation "myschema2.mytbl7" does not exist, skipping
WARNING:  _check_fk_groups: The table "myschema2.mytbl6" is referenced by the foreign key "mytbl8_col81_fkey" on the table "myschema2.mytbl8" that is outside the groups (myGroup2).
 emaj_assign_table 
-------------------
                 1
(1 row)

select rel_schema, rel_tblseq, rel_time_range, rel_group, rel_kind, rel_log_schema, rel_log_table, rel_log_seq_last_value
  from emaj.emaj_relation where rel_schema = 'myschema2' and rel_tblseq = 'mytbl7' order by rel_time_range;
 rel_schema | rel_tblseq | rel_time_range | rel_group | rel_kind | rel_log_schema | rel_log_table | rel_log_seq_last_value 
------------+------------+----------------+-----------+----------+----------------+---------------+------------------------
 myschema2  | mytbl7     | [9502,9509)    | myGroup2  | r        | emaj_myschema2 | mytbl7_log_1  |                     10
 myschema2  | mytbl7     | [9510,)        | myGroup2  | r        | emaj_myschema2 | mytbl7_log    |                       
(2 rows)

delete from myschema2.myTbl7 where col71 = 9;
-- get statistics, using directly internal functions as done by web clients
select stat_group, stat_schema, stat_table, stat_log_schema, stat_log_table,
       stat_first_mark, stat_first_mark_gid, stat_last_mark, stat_last_mark_gid, stat_rows 
  from emaj._log_stat_groups('{"myGroup2"}',false,'ADD_TBL test',NULL);
 stat_group | stat_schema | stat_table | stat_log_schema | stat_log_table | stat_first_mark | stat_first_mark_gid | stat_last_mark | stat_last_mark_gid | stat_rows 
------------+-------------+------------+-----------------+----------------+-----------------+---------------------+----------------+--------------------+-----------
 myGroup2   | myschema2   | myTbl3     | emaj_myschema2  | myTbl3_log     | ADD_TBL test    |             9500000 |                |                    |         0
 myGroup2   | myschema2   | mytbl1     | emaj_myschema2  | mytbl1_log     | ADD_TBL test    |             9500000 |                |                    |         0
 myGroup2   | myschema2   | mytbl2     | emaj_myschema2  | mytbl2_log     | ADD_TBL test    |             9500000 |                |                    |         0
 myGroup2   | myschema2   | mytbl4     | emaj_myschema2  | mytbl4_log     | ADD_TBL test    |             9500000 |                |                    |         0
 myGroup2   | myschema2   | mytbl5     | emaj_myschema2  | mytbl5_log     | ADD_TBL test    |             9500000 |                |                    |         0
 myGroup2   | myschema2   | mytbl6     | emaj_myschema2  | mytbl6_log     | ADD_TBL test    |             9500000 |                |                    |         0
 myGroup2   | myschema2   | mytbl7     | emaj_myschema2  | mytbl7_log_1   | [deleted mark]  |             9500000 | Remove mytbl7  |            9500010 |         3
 myGroup2   | myschema2   | mytbl7     | emaj_myschema2  | mytbl7_log     | Re-add mytbl7   |             9500010 |                |                    |         1
(8 rows)

select stat_group, stat_schema, stat_table, stat_log_schema, stat_log_table,
       stat_first_mark, stat_first_mark_gid, stat_last_mark, stat_last_mark_gid, stat_role, stat_verb, stat_rows 
  from emaj._detailed_log_stat_groups('{"myGroup2"}',false,'ADD_TBL test',NULL);
 stat_group | stat_schema | stat_table | stat_log_schema | stat_log_table | stat_first_mark | stat_first_mark_gid | stat_last_mark | stat_last_mark_gid | stat_role | stat_verb | stat_rows 
------------+-------------+------------+-----------------+----------------+-----------------+---------------------+----------------+--------------------+-----------+-----------+-----------
 myGroup2   | myschema2   | mytbl7     | emaj_myschema2  | mytbl7_log_1   | [deleted mark]  |             9500000 | Remove mytbl7  |            9500010 | postgres  | INSERT    |         3
 myGroup2   | myschema2   | mytbl7     | emaj_myschema2  | mytbl7_log     | Re-add mytbl7   |             9500010 |                |                    | postgres  | DELETE    |         1
(2 rows)

-- snap the logs
select emaj.emaj_snap_log_group('myGroup2',NULL,NULL,:'EMAJTESTTMPDIR' || '/snap',NULL);
 emaj_snap_log_group 
---------------------
                  11
(1 row)

\! ls $EMAJTESTTMPDIR/snap/myschema2_mytbl7_log*
/tmp/emaj_12/alter_logging/snap/myschema2_mytbl7_log.snap
/tmp/emaj_12/alter_logging/snap/myschema2_mytbl7_log_1.snap
\! rm $EMAJTESTTMPDIR/snap/*
-- and finaly revert the group configuration changes
select emaj.emaj_import_groups_configuration(:'EMAJTESTTMPDIR' || '/all_groups_conf.json', '{"myGroup2"}', true);
NOTICE:  table "tmp_app_table" does not exist, skipping
NOTICE:  table "tmp_app_sequence" does not exist, skipping
NOTICE:  table "tmp_app_trigger" does not exist, skipping
WARNING:  _check_fk_groups: The foreign key "mytbl6_col61_fkey" on the table "myschema2.mytbl6" references the table "myschema2.mytbl7" that is outside the groups (myGroup2).
WARNING:  _check_fk_groups: The table "myschema2.mytbl6" is referenced by the foreign key "mytbl8_col81_fkey" on the table "myschema2.mytbl8" that is outside the groups (myGroup2).
 emaj_import_groups_configuration 
----------------------------------
                                1
(1 row)

-- and perform a full rollback (that do not process myTbl7)
select rlbk_severity, regexp_replace(rlbk_message,E'\\d\\d\\d\\d/\\d\\d\\/\\d\\d\\ \\d\\d\\:\\d\\d:\\d\\d .*?\\)','<timestamp>)','g')
  from emaj.emaj_rollback_group('myGroup2', 'ADD_TBL test',true);
 rlbk_severity |                                       regexp_replace                                        
---------------+---------------------------------------------------------------------------------------------
 Notice        | 0 / 6 tables effectively processed.
 Notice        | 2 sequences processed.
 Warning       | The table myschema2.mytbl7 has been left unchanged (not in group anymore since <timestamp>)
(3 rows)

select * from myschema2.mytbl7 order by col71;
 col71 
-------
     1
     2
     7
     8
(4 rows)

-- checks for add tables tests
select * from emaj.emaj_alter_plan where altr_time_id >= 9500 order by 1,2,3,4,5;
 altr_time_id | altr_step  | altr_schema | altr_tblseq | altr_group | altr_priority | altr_group_is_logging | altr_new_group | altr_new_group_is_logging | altr_rlbk_id 
--------------+------------+-------------+-------------+------------+---------------+-----------------------+----------------+---------------------------+--------------
         9502 | ADD_TBL    | myschema2   | mytbl7      | myGroup2   |               | t                     |                |                           |         9501
         9509 | REMOVE_TBL | myschema2   | mytbl7      | myGroup2   |               | t                     |                |                           |         9502
         9510 | ADD_TBL    | myschema2   | mytbl7      | myGroup2   |               | t                     |                |                           |         9502
         9512 | REMOVE_TBL | myschema2   | mytbl7      | myGroup2   |               | t                     |                |                           |         9502
(4 rows)

select time_id, time_last_emaj_gid, time_event from emaj.emaj_time_stamp where time_id >= 9500 order by time_id;
 time_id | time_last_emaj_gid | time_event 
---------+--------------------+------------
    9500 |            9500000 | M
    9501 |            9500000 | M
    9502 |            9500000 | A
    9504 |            9500002 | M
    9505 |            9500003 | M
    9507 |            9500003 | R
    9508 |            9500007 | M
    9509 |            9500010 | A
    9510 |            9500010 | A
    9511 |            9500011 | S
    9512 |            9500011 | I
    9513 |            9500011 | R
(12 rows)

select hist_function, hist_event, hist_object,
       regexp_replace(regexp_replace(regexp_replace(hist_wording,
            E'\\d\\d\.\\d\\d\\.\\d\\d\\.\\d\\d\\d\\d','%','g'),
            E'\\d\\d\\d\\d/\\d\\d\\/\\d\\d\\ \\d\\d\\:\\d\\d:\\d\\d .*?\\)','<timestamp>)','g'),
            E'\\[.+\\]','(timestamp)','g'), 
       hist_user 
  from emaj.emaj_hist where hist_id >= 9500 order by hist_id;
     hist_function      |  hist_event   |         hist_object          |                                          regexp_replace                                           | hist_user 
------------------------+---------------+------------------------------+---------------------------------------------------------------------------------------------------+-----------
 SET_MARK_GROUP         | BEGIN         | myGroup2                     |                                                                                                   | postgres
 LOCK_GROUP             | BEGIN         | myGroup2                     |                                                                                                   | postgres
 LOCK_GROUP             | END           | myGroup2                     | 6 tables locked, 0 deadlock(s)                                                                    | postgres
 SET_MARK_GROUP         | END           | myGroup2                     | ADD_TBL test                                                                                      | postgres
 SET_MARK_GROUP         | BEGIN         | myGroup2                     |                                                                                                   | postgres
 LOCK_GROUP             | BEGIN         | myGroup2                     |                                                                                                   | postgres
 LOCK_GROUP             | END           | myGroup2                     | 6 tables locked, 0 deadlock(s)                                                                    | postgres
 SET_MARK_GROUP         | END           | myGroup2                     | Before ADD_TBL                                                                                    | postgres
 ASSIGN_TABLE           | BEGIN         |                              |                                                                                                   | postgres
 LOCK_GROUP             | BEGIN         | myGroup2                     |                                                                                                   | postgres
 LOCK_GROUP             | END           | myGroup2                     | 6 tables locked, 0 deadlock(s)                                                                    | postgres
 SET_MARK_GROUP         | BEGIN         | myGroup2                     | Add mytbl7                                                                                        | postgres
 SET_MARK_GROUP         | END           | myGroup2                     | Add mytbl7                                                                                        | postgres
 ASSIGN_TABLE           | TABLE ADDED   | myschema2.mytbl7             | To the logging group myGroup2                                                                     | postgres
 ASSIGN_TABLE           | END           |                              | 1 tables assigned to the group myGroup2                                                           | postgres
 SET_MARK_GROUP         | BEGIN         | myGroup2                     |                                                                                                   | postgres
 LOCK_GROUP             | BEGIN         | myGroup2                     |                                                                                                   | postgres
 LOCK_GROUP             | END           | myGroup2                     | 7 tables locked, 0 deadlock(s)                                                                    | postgres
 SET_MARK_GROUP         | END           | myGroup2                     | Just after ADD_TBL                                                                                | postgres
 SET_MARK_GROUP         | BEGIN         | myGroup2                     |                                                                                                   | postgres
 LOCK_GROUP             | BEGIN         | myGroup2                     |                                                                                                   | postgres
 LOCK_GROUP             | END           | myGroup2                     | 7 tables locked, 0 deadlock(s)                                                                    | postgres
 SET_MARK_GROUP         | END           | myGroup2                     | After ADD_TBL                                                                                     | postgres
 SNAP_GROUP             | BEGIN         | myGroup2                     | /tmp/emaj_12/alter_logging/snap                                                                   | postgres
 SNAP_GROUP             | END           | myGroup2                     | 9 tables/sequences processed                                                                      | postgres
 SNAP_LOG_GROUP         | BEGIN         | myGroup2                     | From initial mark to mark After ADD_TBL towards /tmp/emaj_12/alter_logging/snap                   | postgres
 SNAP_LOG_GROUP         | END           | myGroup2                     | 10 generated files                                                                                | postgres
 ROLLBACK_GROUP         | BEGIN         | myGroup2                     | Logged rollback to mark Before ADD_TBL (timestamp)                                                | postgres
 DBLINK_OPEN_CNX        |               | rlbk#1                       | Status = 1                                                                                        | postgres
 LOCK_GROUP             | BEGIN         | myGroup2                     | Rollback session #1                                                                               | postgres
 LOCK_GROUP             | END           | myGroup2                     | Rollback session #1: 7 tables locked, 0 deadlock(s)                                               | postgres
 SET_MARK_GROUP         | BEGIN         | myGroup2                     | RLBK_Before ADD_TBL_%_START                                                                       | postgres
 SET_MARK_GROUP         | END           | myGroup2                     | RLBK_Before ADD_TBL_%_START                                                                       | postgres
 ROLLBACK_TABLE         | BEGIN         | myschema2.mytbl7             | All log rows with emaj_gid > 9500000 and <= 9500003                                               | postgres
 ROLLBACK_TABLE         | END           | myschema2.mytbl7             | 4 rolled back primary keys                                                                        | postgres
 ROLLBACK_SEQUENCE      |               | myschema2."myTbl3_col31_seq" |                                                                                                   | postgres
 ROLLBACK_SEQUENCE      |               | myschema2.myseq1             |                                                                                                   | postgres
 SET_MARK_GROUP         | BEGIN         | myGroup2                     | RLBK_Before ADD_TBL_%_DONE                                                                        | postgres
 SET_MARK_GROUP         | END           | myGroup2                     | RLBK_Before ADD_TBL_%_DONE                                                                        | postgres
 ROLLBACK_GROUP         | NOTICE        | Rollback id 9501             | 1 / 7 tables effectively processed.                                                               | postgres
 ROLLBACK_GROUP         | NOTICE        | Rollback id 9501             | 2 sequences processed.                                                                            | postgres
 ROLLBACK_GROUP         | WARNING       | Rollback id 9501             | The table myschema2.mytbl7 has only been rolled back to its latest group attachment (<timestamp>) | postgres
 DBLINK_CLOSE_CNX       |               | rlbk#1                       |                                                                                                   | postgres
 ROLLBACK_GROUP         | END           | myGroup2                     | Rollback_id 9501, 1 tables and 2 sequences effectively processed                                  | postgres
 RENAME_MARK_GROUP      | BEGIN         | myGroup2                     | EMAJ_LAST_MARK                                                                                    | postgres
 RENAME_MARK_GROUP      | END           | myGroup2                     | RLBK_Before ADD_TBL_%_DONE renamed Logged_Rlbk_End                                                | postgres
 CONSOLIDATE_RLBK_GROUP | BEGIN         | myGroup2                     | Erase all between marks Before ADD_TBL and Logged_Rlbk_End                                        | postgres
 CONSOLIDATE_RLBK_GROUP | END           | myGroup2                     | 1 tables and 2 sequences processed ; 4 marks deleted                                              | postgres
 REMOVE_TABLE           | BEGIN         |                              |                                                                                                   | postgres
 LOCK_GROUP             | BEGIN         | myGroup2                     |                                                                                                   | postgres
 LOCK_GROUP             | END           | myGroup2                     | 7 tables locked, 0 deadlock(s)                                                                    | postgres
 SET_MARK_GROUP         | BEGIN         | myGroup2                     | Remove mytbl7                                                                                     | postgres
 CLEANUP_RLBK_STATE     |               | Rollback id 9501             | set to COMMITTED                                                                                  | postgres
 SET_MARK_GROUP         | END           | myGroup2                     | Remove mytbl7                                                                                     | postgres
 REMOVE_TABLE           | TABLE REMOVED | myschema2.mytbl7             | From the logging group myGroup2                                                                   | postgres
 REMOVE_TABLE           | END           |                              | 1 tables removed from their groups                                                                | postgres
 ASSIGN_TABLE           | BEGIN         |                              |                                                                                                   | postgres
 LOCK_GROUP             | BEGIN         | myGroup2                     |                                                                                                   | postgres
 LOCK_GROUP             | END           | myGroup2                     | 6 tables locked, 0 deadlock(s)                                                                    | postgres
 SET_MARK_GROUP         | BEGIN         | myGroup2                     | Re-add mytbl7                                                                                     | postgres
 SET_MARK_GROUP         | END           | myGroup2                     | Re-add mytbl7                                                                                     | postgres
 ASSIGN_TABLE           | TABLE ADDED   | myschema2.mytbl7             | To the logging group myGroup2                                                                     | postgres
 ASSIGN_TABLE           | END           |                              | 1 tables assigned to the group myGroup2                                                           | postgres
 SNAP_LOG_GROUP         | BEGIN         | myGroup2                     | From initial mark to current situation towards /tmp/emaj_12/alter_logging/snap                    | postgres
 SNAP_LOG_GROUP         | END           | myGroup2                     | 11 generated files                                                                                | postgres
 IMPORT_GROUPS          | BEGIN         | myGroup2                     | Input file: '/tmp/emaj_12/alter_logging/all_groups_conf.json'                                     | postgres
 LOCK_GROUPS            | BEGIN         | myGroup2                     |                                                                                                   | postgres
 LOCK_GROUPS            | END           | myGroup2                     | 7 tables locked, 0 deadlock(s)                                                                    | postgres
 SET_MARK_GROUPS        | BEGIN         | myGroup2                     | IMPORT_%                                                                                          | postgres
 SET_MARK_GROUPS        | END           | myGroup2                     | IMPORT_%                                                                                          | postgres
 IMPORT_GROUPS          | TABLE REMOVED | myschema2.mytbl7             | From the logging group myGroup2                                                                   | postgres
 IMPORT_GROUPS          | END           |                              | 1 created or altered tables groups                                                                | postgres
 ROLLBACK_GROUP         | BEGIN         | myGroup2                     | Unlogged rollback to mark ADD_TBL test (timestamp)                                                | postgres
 DBLINK_OPEN_CNX        |               | rlbk#1                       | Status = 1                                                                                        | postgres
 LOCK_GROUP             | BEGIN         | myGroup2                     | Rollback session #1                                                                               | postgres
 LOCK_GROUP             | END           | myGroup2                     | Rollback session #1: 6 tables locked, 0 deadlock(s)                                               | postgres
 ROLLBACK_GROUP         | MARK DELETED  | myGroup2                     | mark Before ADD_TBL is deleted                                                                    | postgres
 ROLLBACK_GROUP         | MARK DELETED  | myGroup2                     | mark Logged_Rlbk_End is deleted                                                                   | postgres
 ROLLBACK_GROUP         | MARK DELETED  | myGroup2                     | mark Remove mytbl7 is deleted                                                                     | postgres
 ROLLBACK_GROUP         | MARK DELETED  | myGroup2                     | mark Re-add mytbl7 is deleted                                                                     | postgres
 ROLLBACK_GROUP         | MARK DELETED  | myGroup2                     | mark IMPORT_% is deleted                                                                          | postgres
 ROLLBACK_SEQUENCE      |               | myschema2."myTbl3_col31_seq" |                                                                                                   | postgres
 ROLLBACK_SEQUENCE      |               | myschema2.myseq1             |                                                                                                   | postgres
 ROLLBACK_GROUP         | NOTICE        | Rollback id 9502             | 0 / 6 tables effectively processed.                                                               | postgres
 ROLLBACK_GROUP         | NOTICE        | Rollback id 9502             | 2 sequences processed.                                                                            | postgres
 ROLLBACK_GROUP         | WARNING       | Rollback id 9502             | The table myschema2.mytbl7 has been left unchanged (not in group anymore since <timestamp>)       | postgres
 DBLINK_CLOSE_CNX       |               | rlbk#1                       |                                                                                                   | postgres
 ROLLBACK_GROUP         | END           | myGroup2                     | Rollback_id 9502, 0 tables and 2 sequences effectively processed                                  | postgres
(88 rows)

-- set sequence restart value
select public.handle_emaj_sequences(9700);
 handle_emaj_sequences 
-----------------------
 
(1 row)

-----------------------------
-- remove tables
-----------------------------
insert into myschema1."myTbl3" (col33) values (1.);
select emaj.emaj_set_mark_group('myGroup1','Mk2c');
 emaj_set_mark_group 
---------------------
                   7
(1 row)

insert into myschema1."myTbl3" (col33) values (1.);
select emaj.emaj_remove_tables('myschema1', '^(myTbl3|mytbl2b)$', null, '2 tables removed from myGroup1');
 emaj_remove_tables 
--------------------
                  2
(1 row)

select group_name, group_last_alter_time_id, group_nb_table, group_nb_sequence
  from emaj.emaj_group where group_name = 'myGroup1';
 group_name | group_last_alter_time_id | group_nb_table | group_nb_sequence 
------------+--------------------------+----------------+-------------------
 myGroup1   |                     9701 |              3 |                 2
(1 row)

select rel_schema, rel_tblseq, rel_time_range, rel_group, rel_kind, rel_log_schema, rel_log_table, rel_log_seq_last_value
  from emaj.emaj_relation where rel_schema = 'myschema1' and (rel_tblseq = 'myTbl3' or rel_tblseq = 'mytbl2b') order by 1,2,3;
 rel_schema | rel_tblseq | rel_time_range | rel_group | rel_kind | rel_log_schema | rel_log_table | rel_log_seq_last_value 
------------+------------+----------------+-----------+----------+----------------+---------------+------------------------
 myschema1  | myTbl3     | [8016,9701)    | myGroup1  | r        | emaj_myschema1 | myTbl3_log_1  |                      3
 myschema1  | mytbl2b    | [8203,9701)    | myGroup1  | r        | emaj_myschema1 | mytbl2b_log_1 |                      0
(2 rows)

delete from myschema1."myTbl3" where col33 = 1.;
select count(*) from emaj_myschema1."myTbl3_log_1";
 count 
-------
     2
(1 row)

select * from emaj.emaj_verify_all();
                                                                                      emaj_verify_all                                                                                       
--------------------------------------------------------------------------------------------------------------------------------------------------------------------------------------------
 Warning: In the group "myGroup1", the sequence "myschema1"."myTbl3_col31_seq" is linked to the table "myschema1"."myTbl3" but this table does not belong to any tables group.
 Warning: In the group "myGroup1", the sequence "myschema1"."mytbl2b_col20_seq" is linked to the table "myschema1"."mytbl2b" but this table does not belong to any tables group.
 Warning: In the group "myGroup2", the foreign key "mytbl6_col61_fkey" on the table "myschema2"."mytbl6" references the table "myschema2"."mytbl7" that does not belong to any group.
 Warning: In the group "myGroup2", the table "myschema2"."mytbl6" is referenced by the foreign key "mytbl8_col81_fkey" of the table "myschema2"."mytbl8" that does not belong to any group.
 No error detected
(5 rows)

-- test statistics following a rollback targeting a mark set before a REMOVE_TBL
begin;
  delete from emaj.emaj_param where param_key = 'dblink_user_password';
  select rlbk_severity, regexp_replace(rlbk_message,E'\\d\\d\\d\\d/\\d\\d\\/\\d\\d\\ \\d\\d\\:\\d\\d:\\d\\d .*?\\)','<timestamp>)','g')
    from emaj.emaj_rollback_group('myGroup1','Mk2c',true);
 rlbk_severity |                                        regexp_replace                                         
---------------+-----------------------------------------------------------------------------------------------
 Notice        | 0 / 3 tables effectively processed.
 Notice        | 2 sequences processed.
 Warning       | The table myschema1."myTbl3" has been left unchanged (not in group anymore since <timestamp>)
 Warning       | The table myschema1.mytbl2b has been left unchanged (not in group anymore since <timestamp>)
(4 rows)

  select stat_group, stat_schema, stat_table, stat_first_mark, stat_last_mark, stat_rows
    from emaj.emaj_log_stat_group('myGroup1','Mk2b',NULL) order by 1,2,3,4;
 stat_group | stat_schema | stat_table | stat_first_mark | stat_last_mark | stat_rows 
------------+-------------+------------+-----------------+----------------+-----------
 myGroup1   | myschema1   | myTbl3     | Mk2b            | [deleted mark] |         2
 myGroup1   | myschema1   | mytbl1     | Mk2b            |                |         0
 myGroup1   | myschema1   | mytbl2     | Mk2b            |                |         0
 myGroup1   | myschema1   | mytbl2b    | Mk2b            | [deleted mark] |         0
 myGroup1   | myschema1   | mytbl4     | Mk2b            |                |         0
(5 rows)

rollback;
-- get statistics, using directly internal functions as done by web clients
select stat_group, stat_schema, stat_table, stat_first_mark, stat_first_mark_gid, stat_last_mark, stat_last_mark_gid, stat_rows 
  from emaj._log_stat_groups('{"myGroup1"}',false,NULL,NULL);
 stat_group | stat_schema | stat_table | stat_first_mark | stat_first_mark_gid |         stat_last_mark         | stat_last_mark_gid | stat_rows 
------------+-------------+------------+-----------------+---------------------+--------------------------------+--------------------+-----------
 myGroup1   | myschema1   | myTbl3     | Mk1             |             9000000 | 2 tables removed from myGroup1 |            9700002 |         2
 myGroup1   | myschema1   | mytbl1     | Mk1             |             9000000 |                                |                    |         0
 myGroup1   | myschema1   | mytbl2     | Mk1             |             9000000 |                                |                    |         0
 myGroup1   | myschema1   | mytbl2b    | Mk1             |             9000000 | 2 tables removed from myGroup1 |            9700002 |         0
 myGroup1   | myschema1   | mytbl4     | Mk1             |             9000000 |                                |                    |         0
(5 rows)

select stat_group, stat_schema, stat_table, stat_first_mark, stat_first_mark_gid, stat_last_mark, stat_last_mark_gid, stat_role, stat_verb, stat_rows 
  from emaj._detailed_log_stat_groups('{"myGroup1"}',false,NULL,NULL);
 stat_group | stat_schema | stat_table | stat_first_mark | stat_first_mark_gid |         stat_last_mark         | stat_last_mark_gid | stat_role | stat_verb | stat_rows 
------------+-------------+------------+-----------------+---------------------+--------------------------------+--------------------+-----------+-----------+-----------
 myGroup1   | myschema1   | myTbl3     | Mk1             |             9000000 | 2 tables removed from myGroup1 |            9700002 | postgres  | INSERT    |         2
(1 row)

--testing snap and sql generation
select emaj.emaj_snap_group('myGroup1',:'EMAJTESTTMPDIR' || '/snap','');
 emaj_snap_group 
-----------------
               5
(1 row)

\! ls $EMAJTESTTMPDIR/snap
_INFO
myschema1_myTbl3_col31_seq.snap
myschema1_mytbl1.snap
myschema1_mytbl2.snap
myschema1_mytbl2b_col20_seq.snap
myschema1_mytbl4.snap
\! rm $EMAJTESTTMPDIR/snap/*
select emaj.emaj_snap_log_group('myGroup1',NULL,NULL,:'EMAJTESTTMPDIR' || '/snap',NULL);
 emaj_snap_log_group 
---------------------
                   8
(1 row)

\! ls $EMAJTESTTMPDIR/snap/myschema1*
/tmp/emaj_12/alter_logging/snap/myschema1_myTbl3_log_1.snap
/tmp/emaj_12/alter_logging/snap/myschema1_mytbl1_log.snap
/tmp/emaj_12/alter_logging/snap/myschema1_mytbl2_log.snap
/tmp/emaj_12/alter_logging/snap/myschema1_mytbl2b_log_1.snap
/tmp/emaj_12/alter_logging/snap/myschema1_mytbl4_log.snap
select emaj.emaj_gen_sql_group('myGroup1', NULL, NULL, :'EMAJTESTTMPDIR' || '/script.sql',array['myschema1.myTbl3']);
NOTICE:  table "emaj_temp_script" does not exist, skipping
 emaj_gen_sql_group 
--------------------
                  2
(1 row)

\! rm $EMAJTESTTMPDIR/script.sql
-- test marks deletions
begin;
-- testing delete a single mark set before the table removal
  select emaj.emaj_delete_mark_group('myGroup1','Mk2c');
 emaj_delete_mark_group 
------------------------
                      1
(1 row)

  select * from emaj.emaj_mark where mark_group = 'myGroup1' and mark_name = 'Mk2b';
 mark_group | mark_name | mark_time_id | mark_is_deleted | mark_is_rlbk_protected | mark_comment | mark_log_rows_before_next | mark_logged_rlbk_target_mark 
------------+-----------+--------------+-----------------+------------------------+--------------+---------------------------+------------------------------
 myGroup1   | Mk2b      |         9300 | f               | f                      |              |                         0 | 
(1 row)

-- testing marks deletion (delete all marks before the alter_group)
  select emaj.emaj_delete_before_mark_group('myGroup1','EMAJ_LAST_MARK');
 emaj_delete_before_mark_group 
-------------------------------
                            10
(1 row)

  select 'should not exist' from pg_class, pg_namespace 
    where relnamespace = pg_namespace.oid and nspname = 'emaj_myschema1' and relname in ('myTbl3_log','mytbl2b_log');
 ?column? 
----------
(0 rows)

  select count(*) from emaj.emaj_relation where rel_schema = 'myschema1' and rel_tblseq in ('myTbl3','mytbl2b');
 count 
-------
     0
(1 row)

  select * from emaj.emaj_rel_hist where relh_schema = 'myschema1' and relh_tblseq in ('myTbl3','mytbl2b') order by 1,2,3;
 relh_schema | relh_tblseq | relh_time_range | relh_group | relh_kind 
-------------+-------------+-----------------+------------+-----------
 myschema1   | myTbl3      | [2000,8001)     | myGroup1   | r
 myschema1   | myTbl3      | [8008,8011)     | myGroup1   | r
 myschema1   | myTbl3      | [8016,9701)     | myGroup1   | r
 myschema1   | mytbl2b     | [2000,8001)     | myGroup1   | r
 myschema1   | mytbl2b     | [8008,8010)     | myGroup1   | r
 myschema1   | mytbl2b     | [8016,8202)     | myGroup1   | r
 myschema1   | mytbl2b     | [8202,8203)     | myGroup2   | r
 myschema1   | mytbl2b     | [8203,9701)     | myGroup1   | r
(8 rows)

rollback;
begin;
-- testing the alter group mark deletion
  select emaj.emaj_delete_mark_group('myGroup1','2 tables removed from myGroup1');
 emaj_delete_mark_group 
------------------------
                      1
(1 row)

  select rel_schema, rel_tblseq, rel_time_range, rel_group, rel_kind, rel_log_schema, rel_log_table, rel_log_seq_last_value
    from emaj.emaj_relation where rel_schema = 'myschema1' and (rel_tblseq = 'myTbl3' or rel_tblseq = 'mytbl2b') order by rel_tblseq;
 rel_schema | rel_tblseq | rel_time_range | rel_group | rel_kind | rel_log_schema | rel_log_table | rel_log_seq_last_value 
------------+------------+----------------+-----------+----------+----------------+---------------+------------------------
 myschema1  | myTbl3     | [8016,9701)    | myGroup1  | r        | emaj_myschema1 | myTbl3_log_1  |                      3
 myschema1  | mytbl2b    | [8203,9701)    | myGroup1  | r        | emaj_myschema1 | mytbl2b_log_1 |                      0
(2 rows)

  select tbl_schema, tbl_name, tbl_time_id, tbl_log_seq_last_val from emaj.emaj_table
    where tbl_name in ('mytbl2b', 'myTbl3') order by tbl_time_id desc, tbl_name limit 2;
 tbl_schema | tbl_name | tbl_time_id | tbl_log_seq_last_val 
------------+----------+-------------+----------------------
 myschema1  | myTbl3   |        9701 |                    3
 myschema1  | mytbl2b  |        9701 |                    0
(2 rows)

  select * from emaj.emaj_mark where mark_group = 'myGroup1' and mark_name = '2 tables removed from myGroup1';
 mark_group | mark_name | mark_time_id | mark_is_deleted | mark_is_rlbk_protected | mark_comment | mark_log_rows_before_next | mark_logged_rlbk_target_mark 
------------+-----------+--------------+-----------------+------------------------+--------------+---------------------------+------------------------------
(0 rows)

rollback;
begin;
-- testing marks deletion (other cases)
  select emaj.emaj_set_mark_group('myGroup1','Mk2d');
 emaj_set_mark_group 
---------------------
                   5
(1 row)

  select emaj.emaj_delete_before_mark_group('myGroup1','Mk2b');
 emaj_delete_before_mark_group 
-------------------------------
                             5
(1 row)

  select rel_schema, rel_tblseq, rel_time_range, rel_group, rel_kind, rel_log_schema, rel_log_table, rel_log_seq_last_value
    from emaj.emaj_relation where rel_group = 'myGroup1' and not upper_inf(rel_time_range) order by 1,2,3;
 rel_schema |    rel_tblseq    | rel_time_range | rel_group | rel_kind | rel_log_schema | rel_log_table | rel_log_seq_last_value 
------------+------------------+----------------+-----------+----------+----------------+---------------+------------------------
 myschema1  | myTbl3           | [8016,9701)    | myGroup1  | r        | emaj_myschema1 | myTbl3_log_1  |                      3
 myschema1  | myTbl3_col31_seq | [8008,9302)    | myGroup1  | S        |                |               |                       
 myschema1  | mytbl2b          | [8203,9701)    | myGroup1  | r        | emaj_myschema1 | mytbl2b_log_1 |                      0
(3 rows)

  select * from emaj.emaj_rel_hist where relh_schema = 'myschema1' and relh_tblseq = 'mytbl2b' order by 1,2,3;
 relh_schema | relh_tblseq | relh_time_range | relh_group | relh_kind 
-------------+-------------+-----------------+------------+-----------
 myschema1   | mytbl2b     | [2000,8001)     | myGroup1   | r
 myschema1   | mytbl2b     | [8008,8010)     | myGroup1   | r
 myschema1   | mytbl2b     | [8016,8202)     | myGroup1   | r
 myschema1   | mytbl2b     | [8202,8203)     | myGroup2   | r
(4 rows)

  select 'found' from pg_class, pg_namespace where relnamespace = pg_namespace.oid and relname = 'mytbl2b_log_1' and nspname = 'emaj_myschema1';
 ?column? 
----------
 found
(1 row)

  select emaj.emaj_delete_before_mark_group('myGroup1','Mk2d');
 emaj_delete_before_mark_group 
-------------------------------
                             7
(1 row)

  select 'should not exist' from pg_class, pg_namespace where relnamespace = pg_namespace.oid and relname = 'mytbl2b_log' and nspname = 'emaj_myschema1';
 ?column? 
----------
(0 rows)

  select count(*) from emaj.emaj_relation where rel_group = 'myGroup1' and not upper_inf(rel_time_range) order by 1,2,3;
ERROR:  ORDER BY position 2 is not in select list
LINE 1: ...'myGroup1' and not upper_inf(rel_time_range) order by 1,2,3;
                                                                   ^
  select * from emaj.emaj_rel_hist where relh_schema = 'myschema1' and relh_tblseq = 'mytbl2b' order by 1,2,3;
ERROR:  current transaction is aborted, commands ignored until end of transaction block
rollback;
-- testing rollback and consolidation
insert into myschema1.mytbl1 values (100, 'Alter_logg', E'\\000'::bytea);
select rlbk_severity, regexp_replace(rlbk_message,E'\\d\\d\\d\\d/\\d\\d\\/\\d\\d\\ \\d\\d\\:\\d\\d:\\d\\d .*?\\)','<timestamp>)','g')
  from emaj.emaj_logged_rollback_group('myGroup1','Mk2b',true) order by 1,2;
 rlbk_severity |                                                     regexp_replace                                                     
---------------+------------------------------------------------------------------------------------------------------------------------
 Notice        | 1 / 3 tables effectively processed.
 Notice        | 2 sequences processed.
 Warning       | The sequence myschema1."myTbl3_col31_seq" has only been rolled back to its latest group attachment state (<timestamp>)
 Warning       | The table myschema1."myTbl3" has been left unchanged (not in group anymore since <timestamp>)
 Warning       | The table myschema1.mytbl2b has been left unchanged (not in group anymore since <timestamp>)
(5 rows)

select emaj.emaj_rename_mark_group('myGroup1','EMAJ_LAST_MARK','Logged_Rlbk_End');
 emaj_rename_mark_group 
------------------------
 
(1 row)

select emaj.emaj_remove_table('myschema1', 'mytbl1','2nd remove_tbl');
 emaj_remove_table 
-------------------
                 1
(1 row)

select * from emaj.emaj_get_consolidable_rollbacks() where cons_group = 'myGroup1';
 cons_group | cons_target_rlbk_mark_name | cons_target_rlbk_mark_time_id | cons_end_rlbk_mark_name | cons_end_rlbk_mark_time_id | cons_rows | cons_marks 
------------+----------------------------+-------------------------------+-------------------------+----------------------------+-----------+------------
 myGroup1   | Mk2b                       |                          9300 | Logged_Rlbk_End         |                       9706 |         2 |          7
(1 row)

select * from emaj.emaj_consolidate_rollback_group('myGroup1', 'Logged_Rlbk_End');
 emaj_consolidate_rollback_group 
---------------------------------
                               3
(1 row)

select count(*) from emaj_myschema1.mytbl1_log_1;   -- the log table should be empty
 count 
-------
     0
(1 row)

select rlbk_severity, regexp_replace(rlbk_message,E'\\d\\d\\d\\d/\\d\\d\\/\\d\\d\\ \\d\\d\\:\\d\\d:\\d\\d .*?\\)','<timestamp>)','g')
  from emaj.emaj_rollback_group('myGroup1','Mk2b',true) order by 1,2;
 rlbk_severity |                                       regexp_replace                                        
---------------+---------------------------------------------------------------------------------------------
 Notice        | 0 / 2 tables effectively processed.
 Notice        | 2 sequences processed.
 Warning       | The table myschema1.mytbl1 has been left unchanged (not in group anymore since <timestamp>)
(3 rows)

-- testing group's reset
begin;
  select emaj.emaj_stop_group('myGroup1');
 emaj_stop_group 
-----------------
               4
(1 row)

  select emaj.emaj_reset_group('myGroup1');
 emaj_reset_group 
------------------
                4
(1 row)

  select * from emaj.emaj_rel_hist where relh_schema = 'myschema1' and upper(relh_time_range) > 6050 order by 1,2,3;
 relh_schema |    relh_tblseq    | relh_time_range | relh_group | relh_kind 
-------------+-------------------+-----------------+------------+-----------
 myschema1   | myTbl3            | [2000,8001)     | myGroup1   | r
 myschema1   | myTbl3            | [8008,8011)     | myGroup1   | r
 myschema1   | myTbl3            | [8016,9701)     | myGroup1   | r
 myschema1   | myTbl3_col31_seq  | [2000,8001)     | myGroup1   | S
 myschema1   | myTbl3_col31_seq  | [8008,9302)     | myGroup1   | S
 myschema1   | mytbl1            | [2000,8001)     | myGroup1   | r
 myschema1   | mytbl1            | [8008,8009)     | myGroup1   | r
 myschema1   | mytbl1            | [8016,8201)     | myGroup1   | r
 myschema1   | mytbl1            | [8201,8203)     | myGroup2   | r
 myschema1   | mytbl1            | [8203,9707)     | myGroup1   | r
 myschema1   | mytbl2            | [2000,8001)     | myGroup1   | r
 myschema1   | mytbl2            | [8008,8010)     | myGroup1   | r
 myschema1   | mytbl2            | [8016,8202)     | myGroup1   | r
 myschema1   | mytbl2            | [8202,8204)     | myGroup2   | r
 myschema1   | mytbl2b           | [2000,8001)     | myGroup1   | r
 myschema1   | mytbl2b           | [8008,8010)     | myGroup1   | r
 myschema1   | mytbl2b           | [8016,8202)     | myGroup1   | r
 myschema1   | mytbl2b           | [8202,8203)     | myGroup2   | r
 myschema1   | mytbl2b           | [8203,9701)     | myGroup1   | r
 myschema1   | mytbl2b_col20_seq | [2000,8001)     | myGroup1   | S
 myschema1   | mytbl4            | [2000,8001)     | myGroup1   | r
 myschema1   | mytbl4            | [8008,8011)     | myGroup1   | r
(22 rows)

rollback;
-- testing group's stop and start
begin;
  select emaj.emaj_stop_group('myGroup1');
 emaj_stop_group 
-----------------
               4
(1 row)

  select emaj.emaj_start_group('myGroup1');
WARNING:  _check_fk_groups: The foreign key "mytbl4_col44_fkey" on the table "myschema1.mytbl4" references the table "myschema1.mytbl1" that is outside the groups (myGroup1).
 emaj_start_group 
------------------
                4
(1 row)

  select rel_schema, rel_tblseq, rel_time_range, rel_group, rel_kind, rel_log_schema, rel_log_table, rel_log_seq_last_value
    from emaj.emaj_relation where rel_group = 'myGroup1' and not upper_inf(rel_time_range) order by 1,2,3;
 rel_schema | rel_tblseq | rel_time_range | rel_group | rel_kind | rel_log_schema | rel_log_table | rel_log_seq_last_value 
------------+------------+----------------+-----------+----------+----------------+---------------+------------------------
(0 rows)

  select 'should not exist' from pg_class, pg_namespace where relnamespace = pg_namespace.oid and relname = 'mytbl2b_log' and nspname = 'emaj_myschema1';
 ?column? 
----------
(0 rows)

rollback;
-- testing the table drop (remove first the sequence linked to the table, otherwise an event triger fires)
begin;
  select emaj.emaj_remove_sequence('myschema1', 'myTbl3_col31_seq','remove_seq_before_drop_mytbl3');
 emaj_remove_sequence 
----------------------
                    1
(1 row)

  drop table mySchema1."myTbl3";
rollback;
-- testing an ALTER TABLE leading to a table rewrite
begin;
  alter table mySchema1."myTbl3" alter column col33 type decimal (10,1);
rollback;
-- re-add all removed tables
select emaj.emaj_import_groups_configuration(:'EMAJTESTTMPDIR' || '/all_groups_conf.json', array['myGroup1'], true, 'Revert_tables_removal');
NOTICE:  table "tmp_app_table" does not exist, skipping
NOTICE:  table "tmp_app_sequence" does not exist, skipping
NOTICE:  table "tmp_app_trigger" does not exist, skipping
NOTICE:  table "myTbl3_log" does not exist, skipping
NOTICE:  trigger "emaj_log_trg" for relation "myschema1.myTbl3" does not exist, skipping
NOTICE:  trigger "emaj_trunc_trg" for relation "myschema1.myTbl3" does not exist, skipping
NOTICE:  table "mytbl1_log" does not exist, skipping
NOTICE:  trigger "emaj_log_trg" for relation "myschema1.mytbl1" does not exist, skipping
NOTICE:  trigger "emaj_trunc_trg" for relation "myschema1.mytbl1" does not exist, skipping
NOTICE:  table "mytbl2b_log" does not exist, skipping
NOTICE:  trigger "emaj_log_trg" for relation "myschema1.mytbl2b" does not exist, skipping
NOTICE:  trigger "emaj_trunc_trg" for relation "myschema1.mytbl2b" does not exist, skipping
 emaj_import_groups_configuration 
----------------------------------
                                1
(1 row)

select emaj.emaj_cleanup_rollback_state();
 emaj_cleanup_rollback_state 
-----------------------------
                           0
(1 row)

-- set an intermediate mark
select emaj.emaj_set_mark_groups('{"myGroup1","myGroup2"}','Mk3');
 emaj_set_mark_groups 
----------------------
                   15
(1 row)

select mark_group, regexp_replace(mark_name,E'\\d\\d\.\\d\\d\\.\\d\\d\\.\\d\\d\\d\\d','%','g'), mark_time_id, mark_is_deleted,
       mark_is_rlbk_protected, mark_comment, mark_log_rows_before_next, mark_logged_rlbk_target_mark
  from emaj.emaj_mark order by mark_time_id, mark_group;
 mark_group |    regexp_replace     | mark_time_id | mark_is_deleted | mark_is_rlbk_protected | mark_comment | mark_log_rows_before_next | mark_logged_rlbk_target_mark 
------------+-----------------------+--------------+-----------------+------------------------+--------------+---------------------------+------------------------------
 myGroup1   | Mk1                   |         9001 | f               | f                      |              |                         0 | 
 myGroup2   | Mk1                   |         9001 | f               | f                      |              |                         0 | 
 myGroup1   | Priority Changed      |         9002 | f               | f                      |              |                         0 | 
 myGroup1   | Attributes_changed_1  |         9003 | f               | f                      |              |                         0 | 
 myGroup2   | Attributes_changed_2  |         9004 | f               | f                      |              |                         0 | 
 myGroup1   | Mk2                   |         9005 | f               | f                      |              |                         0 | 
 myGroup2   | Mk2                   |         9005 | f               | f                      |              |                         0 | 
 myGroup1   | IMPORT_%              |         9007 | f               | f                      |              |                         0 | 
 myGroup2   | IMPORT_%              |         9007 | f               | f                      |              |                         0 | 
 myGroup2   | ADD_SEQ test          |         9100 | f               | f                      |              |                         0 | 
 myGroup1   | Mk2b                  |         9300 | f               | f                      |              |                         0 | 
 myGroup2   | ADD_TBL test          |         9500 | f               | f                      |              |                         0 | 
 myGroup1   | Revert_tables_removal |         9713 | f               | f                      |              |                         0 | 
 myGroup1   | Mk3                   |         9714 | f               | f                      |              |                           | 
 myGroup2   | Mk3                   |         9714 | f               | f                      |              |                           | 
(15 rows)

-- estimate a rollback crossing alter group operations
delete from emaj.emaj_rlbk_stat;    -- to avoid unstable results in estimates
select emaj.emaj_estimate_rollback_groups('{"myGroup1","myGroup2"}','Mk1',false);
 emaj_estimate_rollback_groups 
-------------------------------
 @ 0.015 secs
(1 row)

-- execute a rollback not crossing any alter group operation
select * from emaj.emaj_rollback_groups('{"myGroup1","myGroup2"}','Mk3',false) order by 1,2;
 rlbk_severity |             rlbk_message             
---------------+--------------------------------------
 Notice        | 0 / 11 tables effectively processed.
 Notice        | 4 sequences processed.
(2 rows)

-- execute rollbacks crossing alter group operations
select * from emaj.emaj_logged_rollback_groups('{"myGroup1","myGroup2"}','Mk2');
ERROR:  _rlbk_check: This rollback operation would cross some previously executed alter group operations, which is not allowed by the current function parameters.
CONTEXT:  PL/pgSQL function emaj._rlbk_check(text[],text,boolean,boolean) line 60 at RAISE
SQL statement "SELECT emaj._rlbk_check(v_groupNames, v_mark, v_isAlterGroupAllowed, FALSE)"
PL/pgSQL function emaj._rlbk_init(text[],text,boolean,integer,boolean,boolean) line 23 at SQL statement
SQL statement "SELECT emaj._rlbk_init(v_groupNames, v_mark, v_isLoggedRlbk, 1, v_multiGroup, v_isAlterGroupAllowed)"
PL/pgSQL function emaj._rlbk_groups(text[],text,boolean,boolean,boolean) line 26 at SQL statement
PL/pgSQL function emaj.emaj_logged_rollback_groups(text[],text,boolean) line 12 at RETURN QUERY
select * from emaj.emaj_logged_rollback_groups('{"myGroup1","myGroup2"}','Mk2',false) order by 1,2;
ERROR:  _rlbk_check: This rollback operation would cross some previously executed alter group operations, which is not allowed by the current function parameters.
CONTEXT:  PL/pgSQL function emaj._rlbk_check(text[],text,boolean,boolean) line 60 at RAISE
SQL statement "SELECT emaj._rlbk_check(v_groupNames, v_mark, v_isAlterGroupAllowed, FALSE)"
PL/pgSQL function emaj._rlbk_init(text[],text,boolean,integer,boolean,boolean) line 23 at SQL statement
SQL statement "SELECT emaj._rlbk_init(v_groupNames, v_mark, v_isLoggedRlbk, 1, v_multiGroup, v_isAlterGroupAllowed)"
PL/pgSQL function emaj._rlbk_groups(text[],text,boolean,boolean,boolean) line 26 at SQL statement
PL/pgSQL function emaj.emaj_logged_rollback_groups(text[],text,boolean) line 12 at RETURN QUERY
select rlbk_severity, regexp_replace(rlbk_message,E'\\d\\d\\d\\d/\\d\\d\\/\\d\\d\\ \\d\\d\\:\\d\\d:\\d\\d .*?\\)','<timestamp>)','g')
  from emaj.emaj_logged_rollback_groups('{"myGroup1","myGroup2"}','Mk2',true) order by 1,2;
 rlbk_severity |                                           regexp_replace                                            
---------------+-----------------------------------------------------------------------------------------------------
 Notice        | 0 / 11 tables effectively processed.
 Notice        | 4 sequences processed.
 Warning       | Tables group change not rolled back: E-Maj priority for myschema1.mytbl1
 Warning       | Tables group change not rolled back: log data tablespace for myschema1.mytbl2b
 Warning       | Tables group change not rolled back: log index tablespace for myschema2.mytbl6
 Warning       | The table myschema1."myTbl3" has only been rolled back to its latest group attachment (<timestamp>)
 Warning       | The table myschema1.mytbl1 has only been rolled back to its latest group attachment (<timestamp>)
 Warning       | The table myschema1.mytbl2b has only been rolled back to its latest group attachment (<timestamp>)
(8 rows)

select * from emaj.emaj_rollback_groups('{"myGroup1","myGroup2"}','Mk2',false) order by 1,2;
 rlbk_severity |             rlbk_message             
---------------+--------------------------------------
 Notice        | 0 / 11 tables effectively processed.
 Notice        | 4 sequences processed.
(2 rows)

select * from emaj.emaj_rollback_groups('{"myGroup1","myGroup2"}','Mk1',true) order by 1,2;
 rlbk_severity |                                  rlbk_message                                  
---------------+--------------------------------------------------------------------------------
 Notice        | 0 / 11 tables effectively processed.
 Notice        | 4 sequences processed.
 Warning       | Tables group change not rolled back: E-Maj priority for myschema1.mytbl1
 Warning       | Tables group change not rolled back: log data tablespace for myschema1.mytbl2b
 Warning       | Tables group change not rolled back: log index tablespace for myschema2.mytbl6
(5 rows)

-- execute additional rollback not crossing alter operations anymore
select * from emaj.emaj_logged_rollback_groups('{"myGroup1","myGroup2"}','Mk1',false) order by 1,2;
 rlbk_severity |             rlbk_message             
---------------+--------------------------------------
 Notice        | 0 / 11 tables effectively processed.
 Notice        | 4 sequences processed.
(2 rows)

select * from emaj.emaj_rollback_groups('{"myGroup1","myGroup2"}','Mk1',false) order by 1,2;
 rlbk_severity |             rlbk_message             
---------------+--------------------------------------
 Notice        | 0 / 11 tables effectively processed.
 Notice        | 4 sequences processed.
(2 rows)

-- checks for remove tables tests
select * from emaj.emaj_alter_plan where altr_time_id >= 9700 order by 1,2,3,4,5;
 altr_time_id | altr_step  | altr_schema | altr_tblseq | altr_group | altr_priority | altr_group_is_logging | altr_new_group | altr_new_group_is_logging | altr_rlbk_id 
--------------+------------+-------------+-------------+------------+---------------+-----------------------+----------------+---------------------------+--------------
         9701 | REMOVE_TBL | myschema1   | myTbl3      | myGroup1   |               | t                     |                |                           |         9701
         9701 | REMOVE_TBL | myschema1   | mytbl2b     | myGroup1   |               | t                     |                |                           |         9701
         9707 | REMOVE_TBL | myschema1   | mytbl1      | myGroup1   |               | t                     |                |                           |         9702
         9713 | ADD_TBL    | myschema1   | myTbl3      | myGroup1   |            10 | t                     |                |                           |         9704
         9713 | ADD_TBL    | myschema1   | mytbl1      | myGroup1   |            20 | t                     |                |                           |         9704
         9713 | ADD_TBL    | myschema1   | mytbl2b     | myGroup1   |               | t                     |                |                           |         9704
(6 rows)

select time_id, time_last_emaj_gid, time_event from emaj.emaj_time_stamp where time_id >= 9700 order by time_id;
 time_id | time_last_emaj_gid | time_event 
---------+--------------------+------------
    9700 |            9700001 | M
    9701 |            9700002 | A
    9703 |            9700002 | S
    9705 |            9700003 | R
    9706 |            9700004 | M
    9707 |            9700004 | A
    9708 |            9700004 | R
    9713 |            9700004 | I
    9714 |            9700004 | M
    9715 |            9700004 | R
    9716 |            9700004 | R
    9717 |            9700004 | M
    9718 |            9700004 | R
    9719 |            9700004 | R
    9720 |            9700004 | R
    9721 |            9700004 | M
    9722 |            9700004 | R
(17 rows)

select hist_function, hist_event, hist_object,
       regexp_replace(regexp_replace(regexp_replace(hist_wording,
            E'\\d\\d\.\\d\\d\\.\\d\\d\\.\\d\\d\\d\\d','%','g'),
            E'\\d\\d\\d\\d/\\d\\d\\/\\d\\d\\ \\d\\d\\:\\d\\d:\\d\\d .*?\\)','<timestamp>)','g'),
            E'\\[.+\\]','(timestamp)','g'), 
       hist_user 
  from emaj.emaj_hist where hist_id >= 9700 order by hist_id;
     hist_function      |  hist_event   |         hist_object          |                                                     regexp_replace                                                     | hist_user 
------------------------+---------------+------------------------------+------------------------------------------------------------------------------------------------------------------------+-----------
 SET_MARK_GROUP         | BEGIN         | myGroup1                     |                                                                                                                        | postgres
 LOCK_GROUP             | BEGIN         | myGroup1                     |                                                                                                                        | postgres
 LOCK_GROUP             | END           | myGroup1                     | 5 tables locked, 0 deadlock(s)                                                                                         | postgres
 CLEANUP_RLBK_STATE     |               | Rollback id 9502             | set to COMMITTED                                                                                                       | postgres
 SET_MARK_GROUP         | END           | myGroup1                     | Mk2c                                                                                                                   | postgres
 REMOVE_TABLES          | BEGIN         |                              |                                                                                                                        | postgres
 LOCK_GROUP             | BEGIN         | myGroup1,myGroup1            |                                                                                                                        | postgres
 LOCK_GROUP             | END           | myGroup1,myGroup1            | 5 tables locked, 0 deadlock(s)                                                                                         | postgres
 SET_MARK_GROUP         | BEGIN         | myGroup1,myGroup1            | 2 tables removed from myGroup1                                                                                         | postgres
 SET_MARK_GROUP         | END           | myGroup1,myGroup1            | 2 tables removed from myGroup1                                                                                         | postgres
 REMOVE_TABLES          | TABLE REMOVED | myschema1."myTbl3"           | From the logging group myGroup1                                                                                        | postgres
 REMOVE_TABLES          | TABLE REMOVED | myschema1.mytbl2b            | From the logging group myGroup1                                                                                        | postgres
 REMOVE_TABLES          | END           |                              | 2 tables removed from their groups                                                                                     | postgres
 SNAP_GROUP             | BEGIN         | myGroup1                     | /tmp/emaj_12/alter_logging/snap                                                                                        | postgres
 SNAP_GROUP             | END           | myGroup1                     | 5 tables/sequences processed                                                                                           | postgres
 SNAP_LOG_GROUP         | BEGIN         | myGroup1                     | From initial mark to current situation towards /tmp/emaj_12/alter_logging/snap                                         | postgres
 SNAP_LOG_GROUP         | END           | myGroup1                     | 8 generated files                                                                                                      | postgres
 GEN_SQL_GROUP          | BEGIN         | myGroup1                     | From initial mark to current situation with tables/sequences filtering                                                 | postgres
 GEN_SQL_GROUP          | END           | myGroup1                     | 2 generated statements - script exported into /tmp/emaj_12/alter_logging/script.sql                                    | postgres
 ROLLBACK_GROUP         | BEGIN         | myGroup1                     | Logged rollback to mark Mk2b (timestamp)                                                                               | postgres
 DBLINK_OPEN_CNX        |               | rlbk#1                       | Status = 1                                                                                                             | postgres
 LOCK_GROUP             | BEGIN         | myGroup1                     | Rollback session #1                                                                                                    | postgres
 LOCK_GROUP             | END           | myGroup1                     | Rollback session #1: 3 tables locked, 0 deadlock(s)                                                                    | postgres
 SET_MARK_GROUP         | BEGIN         | myGroup1                     | RLBK_Mk2b_%_START                                                                                                      | postgres
 SET_MARK_GROUP         | END           | myGroup1                     | RLBK_Mk2b_%_START                                                                                                      | postgres
 ROLLBACK_TABLE         | BEGIN         | myschema1.mytbl1             | All log rows with emaj_gid > 9300000 and <= 9700003                                                                    | postgres
 ROLLBACK_TABLE         | END           | myschema1.mytbl1             | 1 rolled back primary keys                                                                                             | postgres
 ROLLBACK_SEQUENCE      |               | myschema1."myTbl3_col31_seq" | RESTART 11                                                                                                             | postgres
 ROLLBACK_SEQUENCE      |               | myschema1.mytbl2b_col20_seq  |                                                                                                                        | postgres
 SET_MARK_GROUP         | BEGIN         | myGroup1                     | RLBK_Mk2b_%_DONE                                                                                                       | postgres
 SET_MARK_GROUP         | END           | myGroup1                     | RLBK_Mk2b_%_DONE                                                                                                       | postgres
 ROLLBACK_GROUP         | NOTICE        | Rollback id 9701             | 1 / 3 tables effectively processed.                                                                                    | postgres
 ROLLBACK_GROUP         | NOTICE        | Rollback id 9701             | 2 sequences processed.                                                                                                 | postgres
 ROLLBACK_GROUP         | WARNING       | Rollback id 9701             | The sequence myschema1."myTbl3_col31_seq" has only been rolled back to its latest group attachment state (<timestamp>) | postgres
 ROLLBACK_GROUP         | WARNING       | Rollback id 9701             | The table myschema1."myTbl3" has been left unchanged (not in group anymore since <timestamp>)                          | postgres
 ROLLBACK_GROUP         | WARNING       | Rollback id 9701             | The table myschema1.mytbl2b has been left unchanged (not in group anymore since <timestamp>)                           | postgres
 DBLINK_CLOSE_CNX       |               | rlbk#1                       |                                                                                                                        | postgres
 ROLLBACK_GROUP         | END           | myGroup1                     | Rollback_id 9701, 1 tables and 2 sequences effectively processed                                                       | postgres
 RENAME_MARK_GROUP      | BEGIN         | myGroup1                     | EMAJ_LAST_MARK                                                                                                         | postgres
 RENAME_MARK_GROUP      | END           | myGroup1                     | RLBK_Mk2b_%_DONE renamed Logged_Rlbk_End                                                                               | postgres
 REMOVE_TABLE           | BEGIN         |                              |                                                                                                                        | postgres
 LOCK_GROUP             | BEGIN         | myGroup1                     |                                                                                                                        | postgres
 LOCK_GROUP             | END           | myGroup1                     | 3 tables locked, 0 deadlock(s)                                                                                         | postgres
 SET_MARK_GROUP         | BEGIN         | myGroup1                     | 2nd remove_tbl                                                                                                         | postgres
 CLEANUP_RLBK_STATE     |               | Rollback id 9701             | set to COMMITTED                                                                                                       | postgres
 SET_MARK_GROUP         | END           | myGroup1                     | 2nd remove_tbl                                                                                                         | postgres
 REMOVE_TABLE           | TABLE REMOVED | myschema1.mytbl1             | From the logging group myGroup1                                                                                        | postgres
 REMOVE_TABLE           | END           |                              | 1 tables removed from their groups                                                                                     | postgres
 CONSOLIDATE_RLBK_GROUP | BEGIN         | myGroup1                     | Erase all between marks Mk2b and Logged_Rlbk_End                                                                       | postgres
 CONSOLIDATE_RLBK_GROUP | END           | myGroup1                     | 1 tables and 2 sequences processed ; 7 marks deleted                                                                   | postgres
 ROLLBACK_GROUP         | BEGIN         | myGroup1                     | Unlogged rollback to mark Mk2b (timestamp)                                                                             | postgres
 DBLINK_OPEN_CNX        |               | rlbk#1                       | Status = 1                                                                                                             | postgres
 LOCK_GROUP             | BEGIN         | myGroup1                     | Rollback session #1                                                                                                    | postgres
 LOCK_GROUP             | END           | myGroup1                     | Rollback session #1: 2 tables locked, 0 deadlock(s)                                                                    | postgres
 ROLLBACK_GROUP         | MARK DELETED  | myGroup1                     | mark Logged_Rlbk_End is deleted                                                                                        | postgres
 ROLLBACK_GROUP         | MARK DELETED  | myGroup1                     | mark 2nd remove_tbl is deleted                                                                                         | postgres
 ROLLBACK_SEQUENCE      |               | myschema1."myTbl3_col31_seq" |                                                                                                                        | postgres
 ROLLBACK_SEQUENCE      |               | myschema1.mytbl2b_col20_seq  |                                                                                                                        | postgres
 ROLLBACK_GROUP         | NOTICE        | Rollback id 9702             | 0 / 2 tables effectively processed.                                                                                    | postgres
 ROLLBACK_GROUP         | NOTICE        | Rollback id 9702             | 2 sequences processed.                                                                                                 | postgres
 ROLLBACK_GROUP         | WARNING       | Rollback id 9702             | The table myschema1.mytbl1 has been left unchanged (not in group anymore since <timestamp>)                            | postgres
 DBLINK_CLOSE_CNX       |               | rlbk#1                       |                                                                                                                        | postgres
 ROLLBACK_GROUP         | END           | myGroup1                     | Rollback_id 9702, 0 tables and 2 sequences effectively processed                                                       | postgres
 IMPORT_GROUPS          | BEGIN         | myGroup1                     | Input file: '/tmp/emaj_12/alter_logging/all_groups_conf.json'                                                          | postgres
 LOCK_GROUPS            | BEGIN         | myGroup1                     |                                                                                                                        | postgres
 LOCK_GROUPS            | END           | myGroup1                     | 2 tables locked, 0 deadlock(s)                                                                                         | postgres
 SET_MARK_GROUPS        | BEGIN         | myGroup1                     | Revert_tables_removal                                                                                                  | postgres
 CLEANUP_RLBK_STATE     |               | Rollback id 9702             | set to COMMITTED                                                                                                       | postgres
 SET_MARK_GROUPS        | END           | myGroup1                     | Revert_tables_removal                                                                                                  | postgres
 IMPORT_GROUPS          | TABLE ADDED   | myschema1."myTbl3"           | To the logging group myGroup1                                                                                          | postgres
 IMPORT_GROUPS          | TABLE ADDED   | myschema1.mytbl1             | To the logging group myGroup1                                                                                          | postgres
 IMPORT_GROUPS          | TABLE ADDED   | myschema1.mytbl2b            | To the logging group myGroup1                                                                                          | postgres
 IMPORT_GROUPS          | END           |                              | 1 created or altered tables groups                                                                                     | postgres
 SET_MARK_GROUPS        | BEGIN         | myGroup1,myGroup2            | Mk3                                                                                                                    | postgres
 LOCK_GROUPS            | BEGIN         | myGroup1,myGroup2            |                                                                                                                        | postgres
 LOCK_GROUPS            | END           | myGroup1,myGroup2            | 11 tables locked, 0 deadlock(s)                                                                                        | postgres
 SET_MARK_GROUPS        | END           | myGroup1,myGroup2            | Mk3                                                                                                                    | postgres
 ROLLBACK_GROUPS        | BEGIN         | myGroup1,myGroup2            | Unlogged rollback to mark Mk3 (timestamp)                                                                              | postgres
 DBLINK_OPEN_CNX        |               | rlbk#1                       | Status = 1                                                                                                             | postgres
 LOCK_GROUP             | BEGIN         | myGroup1,myGroup2            | Rollback session #1                                                                                                    | postgres
 LOCK_GROUP             | END           | myGroup1,myGroup2            | Rollback session #1: 11 tables locked, 0 deadlock(s)                                                                   | postgres
 ROLLBACK_SEQUENCE      |               | myschema1."myTbl3_col31_seq" |                                                                                                                        | postgres
 ROLLBACK_SEQUENCE      |               | myschema1.mytbl2b_col20_seq  |                                                                                                                        | postgres
 ROLLBACK_SEQUENCE      |               | myschema2."myTbl3_col31_seq" |                                                                                                                        | postgres
 ROLLBACK_SEQUENCE      |               | myschema2.myseq1             |                                                                                                                        | postgres
 ROLLBACK_GROUPS        | NOTICE        | Rollback id 9703             | 0 / 11 tables effectively processed.                                                                                   | postgres
 ROLLBACK_GROUPS        | NOTICE        | Rollback id 9703             | 4 sequences processed.                                                                                                 | postgres
 DBLINK_CLOSE_CNX       |               | rlbk#1                       |                                                                                                                        | postgres
 ROLLBACK_GROUPS        | END           | myGroup1,myGroup2            | Rollback_id 9703, 0 tables and 4 sequences effectively processed                                                       | postgres
 ROLLBACK_GROUPS        | BEGIN         | myGroup1,myGroup2            | Logged rollback to mark Mk2 (timestamp)                                                                                | postgres
 DBLINK_OPEN_CNX        |               | rlbk#1                       | Status = 1                                                                                                             | postgres
 LOCK_GROUP             | BEGIN         | myGroup1,myGroup2            | Rollback session #1                                                                                                    | postgres
 LOCK_GROUP             | END           | myGroup1,myGroup2            | Rollback session #1: 11 tables locked, 0 deadlock(s)                                                                   | postgres
 SET_MARK_GROUPS        | BEGIN         | myGroup1,myGroup2            | RLBK_Mk2_%_START                                                                                                       | postgres
 CLEANUP_RLBK_STATE     |               | Rollback id 9703             | set to COMMITTED                                                                                                       | postgres
 SET_MARK_GROUPS        | END           | myGroup1,myGroup2            | RLBK_Mk2_%_START                                                                                                       | postgres
 ROLLBACK_SEQUENCE      |               | myschema1."myTbl3_col31_seq" |                                                                                                                        | postgres
 ROLLBACK_SEQUENCE      |               | myschema1.mytbl2b_col20_seq  |                                                                                                                        | postgres
 ROLLBACK_SEQUENCE      |               | myschema2."myTbl3_col31_seq" |                                                                                                                        | postgres
 ROLLBACK_SEQUENCE      |               | myschema2.myseq1             |                                                                                                                        | postgres
 SET_MARK_GROUPS        | BEGIN         | myGroup1,myGroup2            | RLBK_Mk2_%_DONE                                                                                                        | postgres
 SET_MARK_GROUPS        | END           | myGroup1,myGroup2            | RLBK_Mk2_%_DONE                                                                                                        | postgres
 ROLLBACK_GROUPS        | NOTICE        | Rollback id 9704             | 0 / 11 tables effectively processed.                                                                                   | postgres
 ROLLBACK_GROUPS        | NOTICE        | Rollback id 9704             | 4 sequences processed.                                                                                                 | postgres
 ROLLBACK_GROUPS        | WARNING       | Rollback id 9704             | Tables group change not rolled back: log data tablespace for myschema1.mytbl2b                                         | postgres
 ROLLBACK_GROUPS        | WARNING       | Rollback id 9704             | Tables group change not rolled back: log index tablespace for myschema2.mytbl6                                         | postgres
 ROLLBACK_GROUPS        | WARNING       | Rollback id 9704             | Tables group change not rolled back: E-Maj priority for myschema1.mytbl1                                               | postgres
 ROLLBACK_GROUPS        | WARNING       | Rollback id 9704             | The table myschema1."myTbl3" has only been rolled back to its latest group attachment (<timestamp>)                    | postgres
 ROLLBACK_GROUPS        | WARNING       | Rollback id 9704             | The table myschema1.mytbl1 has only been rolled back to its latest group attachment (<timestamp>)                      | postgres
 ROLLBACK_GROUPS        | WARNING       | Rollback id 9704             | The table myschema1.mytbl2b has only been rolled back to its latest group attachment (<timestamp>)                     | postgres
 DBLINK_CLOSE_CNX       |               | rlbk#1                       |                                                                                                                        | postgres
 ROLLBACK_GROUPS        | END           | myGroup1,myGroup2            | Rollback_id 9704, 0 tables and 4 sequences effectively processed                                                       | postgres
 ROLLBACK_GROUPS        | BEGIN         | myGroup1,myGroup2            | Unlogged rollback to mark Mk2 (timestamp)                                                                              | postgres
 DBLINK_OPEN_CNX        |               | rlbk#1                       | Status = 1                                                                                                             | postgres
 LOCK_GROUP             | BEGIN         | myGroup1,myGroup2            | Rollback session #1                                                                                                    | postgres
 LOCK_GROUP             | END           | myGroup1,myGroup2            | Rollback session #1: 11 tables locked, 0 deadlock(s)                                                                   | postgres
 ROLLBACK_GROUPS        | MARK DELETED  | myGroup1                     | mark IMPORT_% is deleted                                                                                               | postgres
 ROLLBACK_GROUPS        | MARK DELETED  | myGroup2                     | mark IMPORT_% is deleted                                                                                               | postgres
 ROLLBACK_GROUPS        | MARK DELETED  | myGroup2                     | mark ADD_SEQ test is deleted                                                                                           | postgres
 ROLLBACK_GROUPS        | MARK DELETED  | myGroup1                     | mark Mk2b is deleted                                                                                                   | postgres
 ROLLBACK_GROUPS        | MARK DELETED  | myGroup2                     | mark ADD_TBL test is deleted                                                                                           | postgres
 ROLLBACK_GROUPS        | MARK DELETED  | myGroup1                     | mark Revert_tables_removal is deleted                                                                                  | postgres
 ROLLBACK_GROUPS        | MARK DELETED  | myGroup1                     | mark Mk3 is deleted                                                                                                    | postgres
 ROLLBACK_GROUPS        | MARK DELETED  | myGroup2                     | mark Mk3 is deleted                                                                                                    | postgres
 ROLLBACK_GROUPS        | MARK DELETED  | myGroup1                     | mark RLBK_Mk2_%_START is deleted                                                                                       | postgres
 ROLLBACK_GROUPS        | MARK DELETED  | myGroup2                     | mark RLBK_Mk2_%_START is deleted                                                                                       | postgres
 ROLLBACK_GROUPS        | MARK DELETED  | myGroup1                     | mark RLBK_Mk2_%_DONE is deleted                                                                                        | postgres
 ROLLBACK_GROUPS        | MARK DELETED  | myGroup2                     | mark RLBK_Mk2_%_DONE is deleted                                                                                        | postgres
 ROLLBACK_SEQUENCE      |               | myschema1."myTbl3_col31_seq" |                                                                                                                        | postgres
 ROLLBACK_SEQUENCE      |               | myschema1.mytbl2b_col20_seq  |                                                                                                                        | postgres
 ROLLBACK_SEQUENCE      |               | myschema2."myTbl3_col31_seq" |                                                                                                                        | postgres
 ROLLBACK_SEQUENCE      |               | myschema2.myseq1             |                                                                                                                        | postgres
 ROLLBACK_GROUPS        | NOTICE        | Rollback id 9705             | 0 / 11 tables effectively processed.                                                                                   | postgres
 ROLLBACK_GROUPS        | NOTICE        | Rollback id 9705             | 4 sequences processed.                                                                                                 | postgres
 DBLINK_CLOSE_CNX       |               | rlbk#1                       |                                                                                                                        | postgres
 ROLLBACK_GROUPS        | END           | myGroup1,myGroup2            | Rollback_id 9705, 0 tables and 4 sequences effectively processed                                                       | postgres
 ROLLBACK_GROUPS        | BEGIN         | myGroup1,myGroup2            | Unlogged rollback to mark Mk1 (timestamp)                                                                              | postgres
 DBLINK_OPEN_CNX        |               | rlbk#1                       | Status = 1                                                                                                             | postgres
 LOCK_GROUP             | BEGIN         | myGroup1,myGroup2            | Rollback session #1                                                                                                    | postgres
 LOCK_GROUP             | END           | myGroup1,myGroup2            | Rollback session #1: 11 tables locked, 0 deadlock(s)                                                                   | postgres
 ROLLBACK_GROUPS        | MARK DELETED  | myGroup1                     | mark Priority Changed is deleted                                                                                       | postgres
 ROLLBACK_GROUPS        | MARK DELETED  | myGroup1                     | mark Attributes_changed_1 is deleted                                                                                   | postgres
 ROLLBACK_GROUPS        | MARK DELETED  | myGroup2                     | mark Attributes_changed_2 is deleted                                                                                   | postgres
 ROLLBACK_GROUPS        | MARK DELETED  | myGroup1                     | mark Mk2 is deleted                                                                                                    | postgres
 ROLLBACK_GROUPS        | MARK DELETED  | myGroup2                     | mark Mk2 is deleted                                                                                                    | postgres
 ROLLBACK_SEQUENCE      |               | myschema1."myTbl3_col31_seq" |                                                                                                                        | postgres
 ROLLBACK_SEQUENCE      |               | myschema1.mytbl2b_col20_seq  |                                                                                                                        | postgres
 ROLLBACK_SEQUENCE      |               | myschema2."myTbl3_col31_seq" |                                                                                                                        | postgres
 ROLLBACK_SEQUENCE      |               | myschema2.myseq1             |                                                                                                                        | postgres
 ROLLBACK_GROUPS        | NOTICE        | Rollback id 9706             | 0 / 11 tables effectively processed.                                                                                   | postgres
 ROLLBACK_GROUPS        | NOTICE        | Rollback id 9706             | 4 sequences processed.                                                                                                 | postgres
 ROLLBACK_GROUPS        | WARNING       | Rollback id 9706             | Tables group change not rolled back: E-Maj priority for myschema1.mytbl1                                               | postgres
 ROLLBACK_GROUPS        | WARNING       | Rollback id 9706             | Tables group change not rolled back: log data tablespace for myschema1.mytbl2b                                         | postgres
 ROLLBACK_GROUPS        | WARNING       | Rollback id 9706             | Tables group change not rolled back: log index tablespace for myschema2.mytbl6                                         | postgres
 DBLINK_CLOSE_CNX       |               | rlbk#1                       |                                                                                                                        | postgres
 ROLLBACK_GROUPS        | END           | myGroup1,myGroup2            | Rollback_id 9706, 0 tables and 4 sequences effectively processed                                                       | postgres
 ROLLBACK_GROUPS        | BEGIN         | myGroup1,myGroup2            | Logged rollback to mark Mk1 (timestamp)                                                                                | postgres
 DBLINK_OPEN_CNX        |               | rlbk#1                       | Status = 1                                                                                                             | postgres
 LOCK_GROUP             | BEGIN         | myGroup1,myGroup2            | Rollback session #1                                                                                                    | postgres
 LOCK_GROUP             | END           | myGroup1,myGroup2            | Rollback session #1: 11 tables locked, 0 deadlock(s)                                                                   | postgres
 SET_MARK_GROUPS        | BEGIN         | myGroup1,myGroup2            | RLBK_Mk1_%_START                                                                                                       | postgres
 CLEANUP_RLBK_STATE     |               | Rollback id 9704             | set to COMMITTED                                                                                                       | postgres
 CLEANUP_RLBK_STATE     |               | Rollback id 9705             | set to COMMITTED                                                                                                       | postgres
 CLEANUP_RLBK_STATE     |               | Rollback id 9706             | set to COMMITTED                                                                                                       | postgres
 SET_MARK_GROUPS        | END           | myGroup1,myGroup2            | RLBK_Mk1_%_START                                                                                                       | postgres
 ROLLBACK_SEQUENCE      |               | myschema1."myTbl3_col31_seq" |                                                                                                                        | postgres
 ROLLBACK_SEQUENCE      |               | myschema1.mytbl2b_col20_seq  |                                                                                                                        | postgres
 ROLLBACK_SEQUENCE      |               | myschema2."myTbl3_col31_seq" |                                                                                                                        | postgres
 ROLLBACK_SEQUENCE      |               | myschema2.myseq1             |                                                                                                                        | postgres
 SET_MARK_GROUPS        | BEGIN         | myGroup1,myGroup2            | RLBK_Mk1_%_DONE                                                                                                        | postgres
 SET_MARK_GROUPS        | END           | myGroup1,myGroup2            | RLBK_Mk1_%_DONE                                                                                                        | postgres
 ROLLBACK_GROUPS        | NOTICE        | Rollback id 9707             | 0 / 11 tables effectively processed.                                                                                   | postgres
 ROLLBACK_GROUPS        | NOTICE        | Rollback id 9707             | 4 sequences processed.                                                                                                 | postgres
 DBLINK_CLOSE_CNX       |               | rlbk#1                       |                                                                                                                        | postgres
 ROLLBACK_GROUPS        | END           | myGroup1,myGroup2            | Rollback_id 9707, 0 tables and 4 sequences effectively processed                                                       | postgres
 ROLLBACK_GROUPS        | BEGIN         | myGroup1,myGroup2            | Unlogged rollback to mark Mk1 (timestamp)                                                                              | postgres
 DBLINK_OPEN_CNX        |               | rlbk#1                       | Status = 1                                                                                                             | postgres
 LOCK_GROUP             | BEGIN         | myGroup1,myGroup2            | Rollback session #1                                                                                                    | postgres
 LOCK_GROUP             | END           | myGroup1,myGroup2            | Rollback session #1: 11 tables locked, 0 deadlock(s)                                                                   | postgres
 ROLLBACK_GROUPS        | MARK DELETED  | myGroup1                     | mark RLBK_Mk1_%_START is deleted                                                                                       | postgres
 ROLLBACK_GROUPS        | MARK DELETED  | myGroup2                     | mark RLBK_Mk1_%_START is deleted                                                                                       | postgres
 ROLLBACK_GROUPS        | MARK DELETED  | myGroup1                     | mark RLBK_Mk1_%_DONE is deleted                                                                                        | postgres
 ROLLBACK_GROUPS        | MARK DELETED  | myGroup2                     | mark RLBK_Mk1_%_DONE is deleted                                                                                        | postgres
 ROLLBACK_SEQUENCE      |               | myschema1."myTbl3_col31_seq" |                                                                                                                        | postgres
 ROLLBACK_SEQUENCE      |               | myschema1.mytbl2b_col20_seq  |                                                                                                                        | postgres
 ROLLBACK_SEQUENCE      |               | myschema2."myTbl3_col31_seq" |                                                                                                                        | postgres
 ROLLBACK_SEQUENCE      |               | myschema2.myseq1             |                                                                                                                        | postgres
 ROLLBACK_GROUPS        | NOTICE        | Rollback id 9708             | 0 / 11 tables effectively processed.                                                                                   | postgres
 ROLLBACK_GROUPS        | NOTICE        | Rollback id 9708             | 4 sequences processed.                                                                                                 | postgres
 DBLINK_CLOSE_CNX       |               | rlbk#1                       |                                                                                                                        | postgres
 ROLLBACK_GROUPS        | END           | myGroup1,myGroup2            | Rollback_id 9708, 0 tables and 4 sequences effectively processed                                                       | postgres
(191 rows)

-- set sequence restart value
select public.handle_emaj_sequences(10000);
 handle_emaj_sequences 
-----------------------
 
(1 row)

-----------------------------
-- change the group ownership of a table and a sequence (and some other attributes)
-----------------------------
-- case when the source group is idle and the destination group is logging
begin;
  select emaj.emaj_stop_group('myGroup2');
 emaj_stop_group 
-----------------
               8
(1 row)

  select emaj.emaj_move_table('myschema2', 'myTbl3', 'myGroup1', 'move table to myGroup1 while logging');
 emaj_move_table 
-----------------
               1
(1 row)

  select emaj.emaj_move_sequence('myschema2', 'myTbl3_col31_seq', 'myGroup1', 'move seq to myGroup1 while logging');
 emaj_move_sequence 
--------------------
                  1
(1 row)

  select emaj.emaj_modify_table('myschema2', 'myTbl3', '{"log_data_tablespace":"tsplog1", "log_index_tablespace":"tsplog1"}'::jsonb, 'modify table to myGroup1 while logging');
 emaj_modify_table 
-------------------
                 1
(1 row)

  select hist_function, hist_event, hist_object, hist_wording from emaj.emaj_hist 
    where hist_function like 'MO%' order by hist_id desc limit 10;
 hist_function |          hist_event          |         hist_object          |                        hist_wording                        
---------------+------------------------------+------------------------------+------------------------------------------------------------
 MODIFY_TABLE  | END                          |                              | 1 tables effectively modified
 MODIFY_TABLE  | LOG INDEX TABLESPACE CHANGED | myschema2."myTbl3"           | Default tablespace => tsplog1
 MODIFY_TABLE  | LOG DATA TABLESPACE CHANGED  | myschema2."myTbl3"           | Default tablespace => tsplog1
 MODIFY_TABLE  | BEGIN                        |                              | 
 MOVE_SEQUENCE | END                          |                              | 1 sequences moved to the new tables group myGroup1
 MOVE_SEQUENCE | SEQUENCE MOVED               | myschema2."myTbl3_col31_seq" | From the idle group myGroup2 to the logging group myGroup1
 MOVE_SEQUENCE | BEGIN                        |                              | 
 MOVE_TABLE    | END                          |                              | 1 tables moved to the new tables group myGroup1
 MOVE_TABLE    | TABLE MOVED                  | myschema2."myTbl3"           | From the idle group myGroup2 to the logging group myGroup1
 MOVE_TABLE    | BEGIN                        |                              | 
(10 rows)

rollback;
-- case when both groups are logging
-- generates updates before the group change
select emaj.emaj_set_mark_groups('{"myGroup1","myGroup2"}','before move');
 emaj_set_mark_groups 
----------------------
                   15
(1 row)

update myschema2."myTbl3" set col32 = col32 + '1 day' where col31 >= 8;
select emaj.emaj_move_table('myschema2', 'myTbl3', 'myGroup1', 'move table to myGroup1');
 emaj_move_table 
-----------------
               1
(1 row)

select emaj.emaj_move_sequence('myschema2', 'myTbl3_col31_seq', 'myGroup1', 'move seq to myGroup1');
 emaj_move_sequence 
--------------------
                  1
(1 row)

select emaj.emaj_modify_table('myschema2', 'myTbl3', '{"log_data_tablespace":"tsplog1", "log_index_tablespace":"tsplog1", "priority":100}'::jsonb, 'modify table');
 emaj_modify_table 
-------------------
                 1
(1 row)

select * from emaj.emaj_relation where rel_schema = 'myschema2' and (rel_tblseq = 'myTbl3' or rel_tblseq = 'myTbl3_col31_seq') order by 1,2,3,4;
 rel_schema |    rel_tblseq    | rel_time_range | rel_group | rel_kind | rel_priority | rel_log_schema | rel_log_table | rel_log_dat_tsp |  rel_log_index   | rel_log_idx_tsp | rel_log_sequence | rel_log_function | rel_emaj_verb_attnum | rel_has_always_ident_col |     rel_sql_rlbk_columns      | rel_sql_rlbk_pk_columns | rel_sql_rlbk_pk_conditions | rel_sql_gen_ins_col |                                                  rel_sql_gen_ins_val                                                  |                                                               rel_sql_gen_upd_set                                                               | rel_sql_gen_pk_conditions | rel_log_seq_last_value 
------------+------------------+----------------+-----------+----------+--------------+----------------+---------------+-----------------+------------------+-----------------+------------------+------------------+----------------------+--------------------------+-------------------------------+-------------------------+----------------------------+---------------------+-----------------------------------------------------------------------------------------------------------------------+-------------------------------------------------------------------------------------------------------------------------------------------------+---------------------------+------------------------
 myschema2  | myTbl3           | [8008,10005)   | myGroup2  | r        |              | emaj_myschema2 | myTbl3_log_1  |                 | myTbl3_log_idx_1 |                 | myTbl3_log_seq   | myTbl3_log_fnct  |                    4 | f                        | tbl.col31,tbl.col32,tbl.col33 | col31                   | tbl.col31 = keys.col31     |                     | ' || coalesce(o.col31::TEXT,'NULL') || ', ' || quote_nullable(o.col32) || ', ' || coalesce(o.col33::TEXT,'NULL') || ' | col31 = ' || coalesce(n.col31 ::TEXT,'NULL') || ', col32 = ' || quote_nullable(n.col32) || ', col33 = ' || coalesce(n.col33 ::TEXT,'NULL') || ' | col31 = ' || o.col31 || ' |                       
 myschema2  | myTbl3           | [10005,)       | myGroup1  | r        |          100 | emaj_myschema2 | myTbl3_log    | tsplog1         | myTbl3_log_idx   | tsplog1         | myTbl3_log_seq   | myTbl3_log_fnct  |                    4 | f                        | tbl.col31,tbl.col32,tbl.col33 | col31                   | tbl.col31 = keys.col31     |                     | ' || coalesce(o.col31::TEXT,'NULL') || ', ' || quote_nullable(o.col32) || ', ' || coalesce(o.col33::TEXT,'NULL') || ' | col31 = ' || coalesce(n.col31 ::TEXT,'NULL') || ', col32 = ' || quote_nullable(n.col32) || ', col33 = ' || coalesce(n.col33 ::TEXT,'NULL') || ' | col31 = ' || o.col31 || ' |                       
 myschema2  | myTbl3_col31_seq | [8016,10006)   | myGroup2  | S        |              |                |               |                 |                  |                 |                  |                  |                      |                          |                               |                         |                            |                     |                                                                                                                       |                                                                                                                                                 |                           |                       
 myschema2  | myTbl3_col31_seq | [10006,)       | myGroup1  | S        |              |                |               |                 |                  |                 |                  |                  |                      |                          |                               |                         |                            |                     |                                                                                                                       |                                                                                                                                                 |                           |                       
(4 rows)

-- perform various tasks on the groups
select emaj.emaj_set_mark_groups('{"myGroup1","myGroup2"}','after move');
 emaj_set_mark_groups 
----------------------
                   15
(1 row)

update myschema2."myTbl3" set col33 = 12.0 where col31 >= 9;
select  stat_group, stat_schema, stat_table, stat_first_mark, stat_last_mark, stat_rows
  from emaj.emaj_log_stat_groups('{"myGroup1","myGroup2"}', 'before move', NULL)
  where stat_schema = 'myschema2' and stat_table = 'myTbl3';
 stat_group | stat_schema | stat_table |    stat_first_mark     |     stat_last_mark     | stat_rows 
------------+-------------+------------+------------------------+------------------------+-----------
 myGroup2   | myschema2   | myTbl3     | before move            | move table to myGroup1 |         3
 myGroup1   | myschema2   | myTbl3     | move table to myGroup1 |                        |         2
(2 rows)

select  stat_group, stat_schema, stat_table, stat_first_mark, stat_last_mark, stat_verb, stat_role, stat_rows
  from emaj.emaj_detailed_log_stat_groups('{"myGroup1","myGroup2"}', 'before move', NULL) where stat_schema = 'myschema2' and stat_table = 'myTbl3';
 stat_group | stat_schema | stat_table |    stat_first_mark     |     stat_last_mark     | stat_verb | stat_role | stat_rows 
------------+-------------+------------+------------------------+------------------------+-----------+-----------+-----------
 myGroup2   | myschema2   | myTbl3     | before move            | move table to myGroup1 | UPDATE    | postgres  |         3
 myGroup1   | myschema2   | myTbl3     | move table to myGroup1 |                        | UPDATE    | postgres  |         2
(2 rows)

-- generate a sql script crossing the move (before rollback)
select emaj.emaj_gen_sql_groups('{"myGroup1","myGroup2"}', 'before move', NULL, :'EMAJTESTTMPDIR' || '/script1.sql',
  array['myschema2.myTbl3','myschema2.myTbl3_col31_seq']);
NOTICE:  table "emaj_temp_script" does not exist, skipping
 emaj_gen_sql_groups 
---------------------
                   3
(1 row)

-- rollback to a mark set after the group change
select * from emaj.emaj_logged_rollback_groups('{"myGroup1","myGroup2"}','after move');
 rlbk_severity |             rlbk_message             
---------------+--------------------------------------
 Notice        | 1 / 11 tables effectively processed.
 Notice        | 4 sequences processed.
(2 rows)

-- rollback to a mark set before the group change
select rlbk_severity, regexp_replace(rlbk_message,E'\\d\\d\\d\\d/\\d\\d\\/\\d\\d\\ \\d\\d\\:\\d\\d:\\d\\d .*?\\)','<timestamp>)','g')
  from emaj.emaj_rollback_groups('{"myGroup1","myGroup2"}','before move',true);
 rlbk_severity |                                                     regexp_replace                                                     
---------------+------------------------------------------------------------------------------------------------------------------------
 Notice        | 1 / 11 tables effectively processed.
 Notice        | 4 sequences processed.
 Warning       | The table myschema2."myTbl3" has only been rolled back to its latest group attachment (<timestamp>)
 Warning       | The sequence myschema2."myTbl3_col31_seq" has only been rolled back to its latest group attachment state (<timestamp>)
 Warning       | Tables group change not rolled back: log data tablespace for myschema2."myTbl3"
 Warning       | Tables group change not rolled back: log index tablespace for myschema2."myTbl3"
 Warning       | Tables group change not rolled back: E-Maj priority for myschema2."myTbl3"
(7 rows)

-- generate a sql script crossing the move (after rollback)
select emaj.emaj_gen_sql_group('myGroup1', 'before move', NULL, :'EMAJTESTTMPDIR' || '/script2.sql',
  array['myschema2.myTbl3','myschema2.myTbl3_col31_seq']);
ERROR:  _gen_sql_groups: 2 tables/sequences (myschema2.myTbl3, myschema2.myTbl3_col31_seq) did not belong to any of the selected tables groups at before move mark time.
CONTEXT:  PL/pgSQL function emaj._gen_sql_groups(text[],boolean,text,text,text,text[]) line 69 at RAISE
PL/pgSQL function emaj.emaj_gen_sql_group(text,text,text,text,text[]) line 14 at RETURN
select emaj.emaj_gen_sql_groups('{"myGroup1","myGroup2"}', 'before move', NULL, :'EMAJTESTTMPDIR' || '/script3.sql',
  array['myschema2.myTbl3','myschema2.myTbl3_col31_seq']);
NOTICE:  table "emaj_temp_script" does not exist, skipping
 emaj_gen_sql_groups 
---------------------
                   3
(1 row)

\! rm $EMAJTESTTMPDIR/script*
-- revert the changes and apply with a destination group in idle state
select emaj.emaj_stop_group('myGroup2');
 emaj_stop_group 
-----------------
               6
(1 row)

-- This first import try fails because a myGroup1 is missing
select emaj.emaj_import_groups_configuration(:'EMAJTESTTMPDIR' || '/all_groups_conf.json', array['myGroup2'], true);
NOTICE:  table "tmp_app_table" does not exist, skipping
NOTICE:  table "tmp_app_sequence" does not exist, skipping
NOTICE:  table "tmp_app_trigger" does not exist, skipping
WARNING:  _import_groups_conf (2): in the group "myGroup2", the table myschema2."myTbl3" already belongs to the group "myGroup1".
WARNING:  _import_groups_conf (2): in the group "myGroup2", the sequence myschema2."myTbl3_col31_seq" already belongs to the group "myGroup1".
ERROR:  _import_groups_conf: One or several errors have been detected in the JSON groups configuration.
CONTEXT:  PL/pgSQL function emaj._import_groups_conf(json,text[],boolean,text,text) line 78 at RAISE
SQL statement "SELECT emaj._import_groups_conf(v_json, v_groups, v_allowGroupsUpdate, v_location, v_mark)"
PL/pgSQL function emaj.emaj_import_groups_configuration(text,text[],boolean,text) line 34 at SQL statement
select emaj.emaj_import_groups_configuration(:'EMAJTESTTMPDIR' || '/all_groups_conf.json', '{"myGroup1","myGroup2"}', true);
NOTICE:  table "tmp_app_table" does not exist, skipping
NOTICE:  table "tmp_app_sequence" does not exist, skipping
NOTICE:  table "tmp_app_trigger" does not exist, skipping
 emaj_import_groups_configuration 
----------------------------------
                                2
(1 row)

-----------------------------
-- some extra tests with tables and sequences removal and addition
-----------------------------
select emaj.emaj_start_group('myGroup2','Start');
WARNING:  _check_fk_groups: The foreign key "mytbl6_col61_fkey" on the table "myschema2.mytbl6" references the table "myschema2.mytbl7" that is outside the groups (myGroup2).
WARNING:  _check_fk_groups: The table "myschema2.mytbl6" is referenced by the foreign key "mytbl8_col81_fkey" on the table "myschema2.mytbl8" that is outside the groups (myGroup2).
 emaj_start_group 
------------------
                8
(1 row)

insert into myschema2.mytbl1 values (100, 'Started', E'\\000'::bytea);
select nextval('myschema2.myseq1');
 nextval 
---------
    1000
(1 row)

-- remove and assign somes tables and sequences in a single transaction
begin;
  select emaj.emaj_remove_tables('myschema2','{"mytbl1","mytbl2","myTbl3"}'::text[],'REMOVE_3_TABLES');
 emaj_remove_tables 
--------------------
                  3
(1 row)

  select emaj.emaj_remove_sequence('myschema2','myseq1','REMOVE_1_SEQUENCES');
 emaj_remove_sequence 
----------------------
                    1
(1 row)

  select emaj.emaj_assign_tables('myschema2','{"mytbl1","mytbl2","myTbl3"}'::text[],'myGroup2',null,'ASSIGN_3_TABLES');
NOTICE:  table "myTbl3_log" does not exist, skipping
NOTICE:  trigger "emaj_log_trg" for relation "myschema2.myTbl3" does not exist, skipping
NOTICE:  trigger "emaj_trunc_trg" for relation "myschema2.myTbl3" does not exist, skipping
NOTICE:  table "mytbl1_log" does not exist, skipping
NOTICE:  trigger "emaj_log_trg" for relation "myschema2.mytbl1" does not exist, skipping
NOTICE:  trigger "emaj_trunc_trg" for relation "myschema2.mytbl1" does not exist, skipping
NOTICE:  table "mytbl2_log" does not exist, skipping
NOTICE:  trigger "emaj_log_trg" for relation "myschema2.mytbl2" does not exist, skipping
NOTICE:  trigger "emaj_trunc_trg" for relation "myschema2.mytbl2" does not exist, skipping
WARNING:  _check_fk_groups: The foreign key "mytbl6_col61_fkey" on the table "myschema2.mytbl6" references the table "myschema2.mytbl7" that is outside the groups (myGroup2).
WARNING:  _check_fk_groups: The table "myschema2.mytbl6" is referenced by the foreign key "mytbl8_col81_fkey" on the table "myschema2.mytbl8" that is outside the groups (myGroup2).
 emaj_assign_tables 
--------------------
                  3
(1 row)

  select emaj.emaj_assign_sequences('myschema2','{"myseq1","myseq2"}'::text[],'myGroup2','ASSIGN_2_SEQUENCES');
 emaj_assign_sequences 
-----------------------
                     2
(1 row)

  insert into myschema2.mytbl1 values (110, 'Assigned', E'\\000'::bytea);
  select nextval('myschema2.myseq1');
 nextval 
---------
    1001
(1 row)

  -- what if some (all but the emaj sequence) emaj components are missing at remove_table time ?
  select emaj.emaj_disable_protection_by_event_triggers();
 emaj_disable_protection_by_event_triggers 
-------------------------------------------
                                         3
(1 row)

  drop table emaj_myschema2.mytbl1_log;
  drop function emaj_myschema2.mytbl1_log_fnct() cascade;
NOTICE:  drop cascades to trigger emaj_log_trg on table myschema2.mytbl1
  select emaj.emaj_enable_protection_by_event_triggers();
 emaj_enable_protection_by_event_triggers 
------------------------------------------
                                        3
(1 row)

  select emaj.emaj_remove_tables('myschema2','{"mytbl1","mytbl2","myTbl3"}');
NOTICE:  relation "mytbl1_log" does not exist, skipping
NOTICE:  relation "mytbl1_log_idx" does not exist, skipping
NOTICE:  trigger "emaj_log_trg" for relation "myschema2.mytbl1" does not exist, skipping
NOTICE:  function emaj_myschema2.mytbl1_log_fnct() does not exist, skipping
 emaj_remove_tables 
--------------------
                  3
(1 row)

  select emaj.emaj_remove_sequences('myschema2','{"myseq1","myseq2"}');
 emaj_remove_sequences 
-----------------------
                     2
(1 row)

  select emaj.emaj_assign_tables('myschema2','{"mytbl1","mytbl2","myTbl3"}','myGroup2',
                                 '{"priority":1, "log_data_tablespace":"tsplog1", "log_index_tablespace":"tsplog1"}'::jsonb);
NOTICE:  table "myTbl3_log" does not exist, skipping
NOTICE:  trigger "emaj_log_trg" for relation "myschema2.myTbl3" does not exist, skipping
NOTICE:  trigger "emaj_trunc_trg" for relation "myschema2.myTbl3" does not exist, skipping
NOTICE:  table "mytbl1_log" does not exist, skipping
NOTICE:  trigger "emaj_log_trg" for relation "myschema2.mytbl1" does not exist, skipping
NOTICE:  trigger "emaj_trunc_trg" for relation "myschema2.mytbl1" does not exist, skipping
NOTICE:  table "mytbl2_log" does not exist, skipping
NOTICE:  trigger "emaj_log_trg" for relation "myschema2.mytbl2" does not exist, skipping
NOTICE:  trigger "emaj_trunc_trg" for relation "myschema2.mytbl2" does not exist, skipping
WARNING:  _check_fk_groups: The foreign key "mytbl6_col61_fkey" on the table "myschema2.mytbl6" references the table "myschema2.mytbl7" that is outside the groups (myGroup2).
WARNING:  _check_fk_groups: The table "myschema2.mytbl6" is referenced by the foreign key "mytbl8_col81_fkey" on the table "myschema2.mytbl8" that is outside the groups (myGroup2).
 emaj_assign_tables 
--------------------
                  3
(1 row)

  select emaj.emaj_assign_sequences('myschema2','{"myseq1","myseq2"}'::text[],'myGroup2','Mark_assign_sequences');
 emaj_assign_sequences 
-----------------------
                     2
(1 row)

commit;
-- remove tables and sequences with bad marks
select emaj.emaj_remove_table('myschema2','mytbl1','Mark_assign_sequences');
ERROR:  _check_new_mark: The group "myGroup2" already contains a mark named "Mark_assign_sequences".
CONTEXT:  PL/pgSQL function emaj._check_new_mark(text[],text) line 29 at RAISE
SQL statement "SELECT emaj._check_new_mark(v_loggingGroups, v_mark)"
PL/pgSQL function emaj._remove_tables(text,text[],text,boolean,boolean) line 70 at SQL statement
PL/pgSQL function emaj.emaj_remove_table(text,text,text) line 6 at RETURN
select emaj.emaj_remove_sequence('myschema2','myseq1','Mark_assign_sequences');
ERROR:  _check_new_mark: The group "myGroup2" already contains a mark named "Mark_assign_sequences".
CONTEXT:  PL/pgSQL function emaj._check_new_mark(text[],text) line 29 at RAISE
SQL statement "SELECT emaj._check_new_mark(v_loggingGroups, v_mark)"
PL/pgSQL function emaj._remove_sequences(text,text[],text,boolean,boolean) line 73 at SQL statement
PL/pgSQL function emaj.emaj_remove_sequence(text,text,text) line 6 at RETURN
-- alter a table in a logging group
select emaj.emaj_remove_table('myschema1','mytbl4');
 emaj_remove_table 
-------------------
                 1
(1 row)

alter table myschema1.mytbl4 alter column col45 type varchar(15);
select emaj.emaj_assign_table('myschema1','mytbl4','myGroup1');
NOTICE:  table "mytbl4_log" does not exist, skipping
NOTICE:  trigger "emaj_log_trg" for relation "myschema1.mytbl4" does not exist, skipping
NOTICE:  trigger "emaj_trunc_trg" for relation "myschema1.mytbl4" does not exist, skipping
 emaj_assign_table 
-------------------
                 1
(1 row)

begin;
  select emaj.emaj_remove_table('myschema1','mytbl4');
 emaj_remove_table 
-------------------
                 1
(1 row)

  alter table myschema1.mytbl4 alter column col45 type varchar(10);
  select emaj.emaj_assign_table('myschema1','mytbl4','myGroup1');
NOTICE:  table "mytbl4_log" does not exist, skipping
NOTICE:  trigger "emaj_log_trg" for relation "myschema1.mytbl4" does not exist, skipping
NOTICE:  trigger "emaj_trunc_trg" for relation "myschema1.mytbl4" does not exist, skipping
 emaj_assign_table 
-------------------
                 1
(1 row)

commit;
-- checks
select count(*) from emaj.emaj_mark where mark_group = 'myGroup2' and (mark_name like 'REMOVE%' or mark_name like 'ASSIGN%');
 count 
-------
     7
(1 row)

select rel_schema, rel_tblseq, rel_time_range, rel_group, rel_kind, rel_log_schema, rel_log_table, rel_log_seq_last_value
  from emaj.emaj_relation where rel_schema = 'myschema2' and rel_tblseq in ('mytbl1','mytbl2','myTbl3','myseq1','myseq2')
  order by rel_schema, rel_tblseq, rel_time_range;
 rel_schema | rel_tblseq | rel_time_range | rel_group | rel_kind | rel_log_schema | rel_log_table | rel_log_seq_last_value 
------------+------------+----------------+-----------+----------+----------------+---------------+------------------------
 myschema2  | myTbl3     | [10005,10013)  | myGroup1  | r        | emaj_myschema2 | myTbl3_log_1  |                       
 myschema2  | myTbl3     | [10013,10015)  | myGroup2  | r        | emaj_myschema2 | myTbl3_log_2  |                     10
 myschema2  | myTbl3     | [10017,10019)  | myGroup2  | r        | emaj_myschema2 | myTbl3_log_3  |                     10
 myschema2  | myTbl3     | [10021,)       | myGroup2  | r        | emaj_myschema2 | myTbl3_log    |                       
 myschema2  | myseq1     | [8207,8208)    | myGroup4  | S        |                |               |                       
 myschema2  | myseq1     | [8208,10016)   | myGroup2  | S        |                |               |                       
 myschema2  | myseq1     | [10018,10020)  | myGroup2  | S        |                |               |                       
 myschema2  | myseq1     | [10022,)       | myGroup2  | S        |                |               |                       
 myschema2  | myseq2     | [10018,10020)  | myGroup2  | S        |                |               |                       
 myschema2  | myseq2     | [10022,)       | myGroup2  | S        |                |               |                       
 myschema2  | mytbl1     | [8008,10015)   | myGroup2  | r        | emaj_myschema2 | mytbl1_log_1  |                      1
 myschema2  | mytbl1     | [10017,10019)  | myGroup2  | r        | emaj_myschema2 | mytbl1_log_2  |                      2
 myschema2  | mytbl1     | [10021,)       | myGroup2  | r        | emaj_myschema2 | mytbl1_log    |                       
 myschema2  | mytbl2     | [8008,10015)   | myGroup2  | r        | emaj_myschema2 | mytbl2_log_1  |                      0
 myschema2  | mytbl2     | [10017,10019)  | myGroup2  | r        | emaj_myschema2 | mytbl2_log_2  |                      0
 myschema2  | mytbl2     | [10021,)       | myGroup2  | r        | emaj_myschema2 | mytbl2_log    |                       
(16 rows)

select sequ_schema, sequ_name, sequ_time_id, sequ_last_val, sequ_is_called from emaj.emaj_sequence
  where sequ_schema = 'myschema2' and sequ_name like 'myseq%' order by sequ_name, sequ_time_id;
 sequ_schema | sequ_name | sequ_time_id | sequ_last_val | sequ_is_called 
-------------+-----------+--------------+---------------+----------------
 myschema2   | myseq1    |        10014 |          1000 | f
 myschema2   | myseq1    |        10015 |          1000 | t
 myschema2   | myseq1    |        10016 |          1000 | t
 myschema2   | myseq1    |        10018 |          1000 | t
 myschema2   | myseq1    |        10019 |          1001 | t
 myschema2   | myseq1    |        10020 |          1001 | t
 myschema2   | myseq1    |        10022 |          1001 | t
 myschema2   | myseq2    |        10018 |             3 | f
 myschema2   | myseq2    |        10019 |             3 | f
 myschema2   | myseq2    |        10020 |             3 | f
 myschema2   | myseq2    |        10022 |             3 | f
(11 rows)

select tbl_schema, tbl_name, tbl_time_id, tbl_log_seq_last_val from emaj.emaj_table
  where tbl_schema = 'myschema2' and tbl_name = 'mytbl1' order by tbl_time_id;
 tbl_schema | tbl_name | tbl_time_id | tbl_log_seq_last_val 
------------+----------+-------------+----------------------
 myschema2  | mytbl1   |       10014 |                    0
 myschema2  | mytbl1   |       10015 |                    1
 myschema2  | mytbl1   |       10017 |                    1
 myschema2  | mytbl1   |       10018 |                    1
 myschema2  | mytbl1   |       10019 |                    2
 myschema2  | mytbl1   |       10021 |                    2
 myschema2  | mytbl1   |       10022 |                    2
(7 rows)

-----------------------------
-- some extra tests with group ownership change for some tables and sequences
-----------------------------
-- from an idle to a logging group
select emaj.emaj_move_tables('myschema4','.*','','myGroup1','MOVE_TBL_idle_to_logging');
 emaj_move_tables 
------------------
                5
(1 row)

select emaj.emaj_move_sequences('myschema2','.*','','myGroup1','MOVE_SEQ_idle_to_logging');
 emaj_move_sequences 
---------------------
                   3
(1 row)

-- bad mark
select emaj.emaj_move_tables('myschema4','.*','','myGroup2',emaj.emaj_get_previous_mark_group('myGroup1',now()));
ERROR:  _check_new_mark: The groups "myGroup1, myGroup2" already contain a mark named "MOVE_SEQ_idle_to_logging".
CONTEXT:  PL/pgSQL function emaj._check_new_mark(text[],text) line 31 at RAISE
SQL statement "SELECT emaj._check_new_mark(v_loggingGroups, v_mark)"
PL/pgSQL function emaj._move_tables(text,text[],text,text,boolean,boolean) line 89 at SQL statement
PL/pgSQL function emaj.emaj_move_tables(text,text,text,text,text) line 27 at RETURN
select emaj.emaj_move_sequences('myschema2','.*','','myGroup2',emaj.emaj_get_previous_mark_group('myGroup1',now()));
ERROR:  _check_new_mark: The groups "myGroup1, myGroup2" already contain a mark named "MOVE_SEQ_idle_to_logging".
CONTEXT:  PL/pgSQL function emaj._check_new_mark(text[],text) line 31 at RAISE
SQL statement "SELECT emaj._check_new_mark(v_loggingGroups, v_mark)"
PL/pgSQL function emaj._move_sequences(text,text[],text,text,boolean,boolean) line 92 at SQL statement
PL/pgSQL function emaj.emaj_move_sequences(text,text,text,text,text) line 27 at RETURN
-- from a logging group to another logging group
select emaj.emaj_move_tables('myschema4','.*','','myGroup2','MOVE_TBL_logging_to_logging');
 emaj_move_tables 
------------------
                5
(1 row)

select emaj.emaj_move_sequences('myschema2','.*','','myGroup2','MOVE_SEQ_logging_to_logging');
 emaj_move_sequences 
---------------------
                   3
(1 row)

-- reset an idle group to check the emaj_sequence cleaning
begin;
  select emaj.emaj_reset_group('myGroup4');
 emaj_reset_group 
------------------
                0
(1 row)

  select rel_group, count(*) from emaj.emaj_sequence, emaj.emaj_relation
    where sequ_schema = rel_schema and sequ_name = rel_tblseq and sequ_time_id <@ rel_time_range
      and sequ_schema = 'myschema2' and sequ_name = 'myseq1'
    group by 1;
 rel_group | count 
-----------+-------
 myGroup1  |     2
 myGroup2  |     6
(2 rows)

rollback;
-- and back to the idle group
select emaj.emaj_move_tables('myschema4','.*','','myGroup4','MOVE_TBL_logging_to_idle');
 emaj_move_tables 
------------------
                5
(1 row)

select emaj.emaj_move_sequences('myschema2','.*','','myGroup4','MOVE_SEQ_logging_to_idle');
 emaj_move_sequences 
---------------------
                   3
(1 row)

-- move a table with fkey and verify all
select emaj.emaj_move_table('myschema2','mytbl2','myGroup1','Move a table with fkey');
 emaj_move_table 
-----------------
               1
(1 row)

select * from emaj.emaj_verify_all();
                                                                                       emaj_verify_all                                                                                        
----------------------------------------------------------------------------------------------------------------------------------------------------------------------------------------------
 Error: In the group "myGroup2", the log table "emaj_myschema2"."mytbl1_log_2" is not found.
 Warning: In the group "myGroup4", the sequence "myschema2"."myTbl3_col31_seq" is linked to the table "myschema2"."myTbl3" but this table belongs to another tables group (myGroup2).
 Warning: In the group "myGroup2", the foreign key "mytbl4_col43_fkey" on the table "myschema2"."mytbl4" references the table "myschema2"."mytbl2" that belongs to another group ("myGroup1")
 Warning: In the group "myGroup2", the foreign key "mytbl6_col61_fkey" on the table "myschema2"."mytbl6" references the table "myschema2"."mytbl7" that does not belong to any group.
 Warning: In the group "myGroup2", the table "myschema2"."mytbl6" is referenced by the foreign key "mytbl8_col81_fkey" of the table "myschema2"."mytbl8" that does not belong to any group.
(5 rows)

select emaj.emaj_move_table('myschema2','mytbl2','myGroup2','Move a table with fkey back');
 emaj_move_table 
-----------------
               1
(1 row)

-- rename a table and/or change its schema
alter table myschema1.mytbl1 rename to mytbl1_new_name;
select emaj.emaj_remove_table('myschema1','mytbl1');
NOTICE:  drop cascades to trigger emaj_log_trg on table myschema1.mytbl1_new_name
 emaj_remove_table 
-------------------
                 1
(1 row)

select emaj.emaj_assign_table('myschema1','mytbl1_new_name','myGroup1');
NOTICE:  table "mytbl1_new_name_log" does not exist, skipping
NOTICE:  trigger "emaj_log_trg" for relation "myschema1.mytbl1_new_name" does not exist, skipping
 emaj_assign_table 
-------------------
                 1
(1 row)

alter table myschema1.mytbl1_new_name set schema public;
select emaj.emaj_remove_table('myschema1','mytbl1_new_name');
NOTICE:  drop cascades to trigger emaj_log_trg on table mytbl1_new_name
 emaj_remove_table 
-------------------
                 1
(1 row)

select emaj.emaj_assign_table('public','mytbl1_new_name','myGroup1');
NOTICE:  table "mytbl1_new_name_log" does not exist, skipping
NOTICE:  trigger "emaj_log_trg" for relation "public.mytbl1_new_name" does not exist, skipping
 emaj_assign_table 
-------------------
                 1
(1 row)

alter table public.mytbl1_new_name rename to mytbl1;
alter table public.mytbl1 set schema myschema1;
select emaj.emaj_remove_table('public','mytbl1_new_name');
NOTICE:  drop cascades to trigger emaj_log_trg on table myschema1.mytbl1
 emaj_remove_table 
-------------------
                 1
(1 row)

select emaj.emaj_assign_table('myschema1','mytbl1','myGroup1');
NOTICE:  table "mytbl1_log" does not exist, skipping
NOTICE:  trigger "emaj_log_trg" for relation "myschema1.mytbl1" does not exist, skipping
 emaj_assign_table 
-------------------
                 1
(1 row)

-----------------------------
-- test end: check
-----------------------------
select emaj.emaj_stop_group('myGroup1');
 emaj_stop_group 
-----------------
               7
(1 row)

select emaj.emaj_drop_group('myGroup1');
 emaj_drop_group 
-----------------
               7
(1 row)

select emaj.emaj_stop_group('myGroup2');
 emaj_stop_group 
-----------------
               6
(1 row)

select emaj.emaj_drop_group('myGroup2');
NOTICE:  table "mytbl1_log_2" does not exist, skipping
 emaj_drop_group 
-----------------
               6
(1 row)

select emaj.emaj_drop_group('myGroup4');
 emaj_drop_group 
-----------------
               8
(1 row)

-- checks for group ownership change tests
select * from emaj.emaj_alter_plan where altr_time_id >= 10000 order by 1,2,3,4,5;
 altr_time_id |        altr_step         | altr_schema |   altr_tblseq    | altr_group | altr_priority | altr_group_is_logging | altr_new_group | altr_new_group_is_logging | altr_rlbk_id 
--------------+--------------------------+-------------+------------------+------------+---------------+-----------------------+----------------+---------------------------+--------------
        10005 | MOVE_TBL                 | myschema2   | myTbl3           | myGroup2   |               | t                     | myGroup1       | t                         |        10001
        10006 | MOVE_SEQ                 | myschema2   | myTbl3_col31_seq | myGroup2   |               | t                     | myGroup1       | t                         |        10001
        10007 | CHANGE_TBL_LOG_DATA_TSP  | myschema2   | myTbl3           | myGroup1   |               | t                     |                |                           |        10001
        10007 | CHANGE_TBL_LOG_INDEX_TSP | myschema2   | myTbl3           | myGroup1   |               | t                     |                |                           |        10001
        10007 | CHANGE_REL_PRIORITY      | myschema2   | myTbl3           | myGroup1   |           100 | t                     |                |                           |        10001
        10013 | RESET_GROUP              |             |                  | myGroup2   |               | f                     |                |                           |             
        10013 | CHANGE_TBL_LOG_DATA_TSP  | myschema2   | myTbl3           | myGroup1   |               | t                     | myGroup2       | f                         |             
        10013 | CHANGE_TBL_LOG_INDEX_TSP | myschema2   | myTbl3           | myGroup1   |               | t                     | myGroup2       | f                         |             
        10013 | MOVE_TBL                 | myschema2   | myTbl3           | myGroup1   |               | t                     | myGroup2       | f                         |             
        10013 | MOVE_SEQ                 | myschema2   | myTbl3_col31_seq | myGroup1   |               | t                     | myGroup2       | f                         |             
        10013 | CHANGE_REL_PRIORITY      | myschema2   | myTbl3           | myGroup1   |               | t                     |                |                           |             
        10015 | REMOVE_TBL               | myschema2   | myTbl3           | myGroup2   |               | t                     |                |                           |             
        10015 | REMOVE_TBL               | myschema2   | mytbl1           | myGroup2   |               | t                     |                |                           |             
        10015 | REMOVE_TBL               | myschema2   | mytbl2           | myGroup2   |               | t                     |                |                           |             
        10016 | REMOVE_SEQ               | myschema2   | myseq1           | myGroup2   |               | t                     |                |                           |             
        10017 | ADD_TBL                  | myschema2   | myTbl3           | myGroup2   |               | t                     |                |                           |             
        10017 | ADD_TBL                  | myschema2   | mytbl1           | myGroup2   |               | t                     |                |                           |             
        10017 | ADD_TBL                  | myschema2   | mytbl2           | myGroup2   |               | t                     |                |                           |             
        10018 | ADD_SEQ                  | myschema2   | myseq1           | myGroup2   |               | t                     |                |                           |             
        10018 | ADD_SEQ                  | myschema2   | myseq2           | myGroup2   |               | t                     |                |                           |             
        10019 | REMOVE_TBL               | myschema2   | myTbl3           | myGroup2   |               | t                     |                |                           |             
        10019 | REMOVE_TBL               | myschema2   | mytbl1           | myGroup2   |               | t                     |                |                           |             
        10019 | REMOVE_TBL               | myschema2   | mytbl2           | myGroup2   |               | t                     |                |                           |             
        10020 | REMOVE_SEQ               | myschema2   | myseq1           | myGroup2   |               | t                     |                |                           |             
        10020 | REMOVE_SEQ               | myschema2   | myseq2           | myGroup2   |               | t                     |                |                           |             
        10021 | ADD_TBL                  | myschema2   | myTbl3           | myGroup2   |               | t                     |                |                           |             
        10021 | ADD_TBL                  | myschema2   | mytbl1           | myGroup2   |               | t                     |                |                           |             
        10021 | ADD_TBL                  | myschema2   | mytbl2           | myGroup2   |               | t                     |                |                           |             
        10022 | ADD_SEQ                  | myschema2   | myseq1           | myGroup2   |               | t                     |                |                           |             
        10022 | ADD_SEQ                  | myschema2   | myseq2           | myGroup2   |               | t                     |                |                           |             
        10023 | REMOVE_TBL               | myschema1   | mytbl4           | myGroup1   |               | t                     |                |                           |             
        10024 | ADD_TBL                  | myschema1   | mytbl4           | myGroup1   |               | t                     |                |                           |             
        10025 | REMOVE_TBL               | myschema1   | mytbl4           | myGroup1   |               | t                     |                |                           |             
        10026 | ADD_TBL                  | myschema1   | mytbl4           | myGroup1   |               | t                     |                |                           |             
        10027 | MOVE_TBL                 | myschema4   | mypartp1         | myGroup4   |               | f                     | myGroup1       | t                         |             
        10027 | MOVE_TBL                 | myschema4   | mypartp2         | myGroup4   |               | f                     | myGroup1       | t                         |             
        10027 | MOVE_TBL                 | myschema4   | mytblc1          | myGroup4   |               | f                     | myGroup1       | t                         |             
        10027 | MOVE_TBL                 | myschema4   | mytblc2          | myGroup4   |               | f                     | myGroup1       | t                         |             
        10027 | MOVE_TBL                 | myschema4   | mytblm           | myGroup4   |               | f                     | myGroup1       | t                         |             
        10028 | MOVE_SEQ                 | myschema2   | myTbl3_col31_seq | myGroup2   |               | t                     | myGroup1       | t                         |             
        10028 | MOVE_SEQ                 | myschema2   | myseq1           | myGroup2   |               | t                     | myGroup1       | t                         |             
        10028 | MOVE_SEQ                 | myschema2   | myseq2           | myGroup2   |               | t                     | myGroup1       | t                         |             
        10029 | MOVE_TBL                 | myschema4   | mypartp1         | myGroup1   |               | t                     | myGroup2       | t                         |             
        10029 | MOVE_TBL                 | myschema4   | mypartp2         | myGroup1   |               | t                     | myGroup2       | t                         |             
        10029 | MOVE_TBL                 | myschema4   | mytblc1          | myGroup1   |               | t                     | myGroup2       | t                         |             
        10029 | MOVE_TBL                 | myschema4   | mytblc2          | myGroup1   |               | t                     | myGroup2       | t                         |             
        10029 | MOVE_TBL                 | myschema4   | mytblm           | myGroup1   |               | t                     | myGroup2       | t                         |             
        10030 | MOVE_SEQ                 | myschema2   | myTbl3_col31_seq | myGroup1   |               | t                     | myGroup2       | t                         |             
        10030 | MOVE_SEQ                 | myschema2   | myseq1           | myGroup1   |               | t                     | myGroup2       | t                         |             
        10030 | MOVE_SEQ                 | myschema2   | myseq2           | myGroup1   |               | t                     | myGroup2       | t                         |             
        10031 | MOVE_TBL                 | myschema4   | mypartp1         | myGroup2   |               | t                     | myGroup4       | f                         |             
        10031 | MOVE_TBL                 | myschema4   | mypartp2         | myGroup2   |               | t                     | myGroup4       | f                         |             
        10031 | MOVE_TBL                 | myschema4   | mytblc1          | myGroup2   |               | t                     | myGroup4       | f                         |             
        10031 | MOVE_TBL                 | myschema4   | mytblc2          | myGroup2   |               | t                     | myGroup4       | f                         |             
        10031 | MOVE_TBL                 | myschema4   | mytblm           | myGroup2   |               | t                     | myGroup4       | f                         |             
        10032 | MOVE_SEQ                 | myschema2   | myTbl3_col31_seq | myGroup2   |               | t                     | myGroup4       | f                         |             
        10032 | MOVE_SEQ                 | myschema2   | myseq1           | myGroup2   |               | t                     | myGroup4       | f                         |             
        10032 | MOVE_SEQ                 | myschema2   | myseq2           | myGroup2   |               | t                     | myGroup4       | f                         |             
        10033 | MOVE_TBL                 | myschema2   | mytbl2           | myGroup2   |               | t                     | myGroup1       | t                         |             
        10034 | MOVE_TBL                 | myschema2   | mytbl2           | myGroup1   |               | t                     | myGroup2       | t                         |             
        10035 | REMOVE_TBL               | myschema1   | mytbl1           | myGroup1   |               | t                     |                |                           |             
        10036 | ADD_TBL                  | myschema1   | mytbl1_new_name  | myGroup1   |               | t                     |                |                           |             
        10037 | REMOVE_TBL               | myschema1   | mytbl1_new_name  | myGroup1   |               | t                     |                |                           |             
        10038 | ADD_TBL                  | public      | mytbl1_new_name  | myGroup1   |               | t                     |                |                           |             
        10039 | REMOVE_TBL               | public      | mytbl1_new_name  | myGroup1   |               | t                     |                |                           |             
        10040 | ADD_TBL                  | myschema1   | mytbl1           | myGroup1   |               | t                     |                |                           |             
(66 rows)

select time_id, time_last_emaj_gid, time_event from emaj.emaj_time_stamp where time_id >= 10000 order by time_id;
 time_id | time_last_emaj_gid | time_event 
---------+--------------------+------------
   10004 |           10000000 | M
   10005 |           10000003 | A
   10006 |           10000003 | A
   10007 |           10000003 | A
   10008 |           10000003 | M
   10009 |           10000005 | R
   10010 |           10000009 | M
   10011 |           10000009 | R
   10012 |           10000009 | M
   10013 |           10000009 | I
   10014 |           10000009 | M
   10015 |           10000010 | A
   10016 |           10000010 | A
   10017 |           10000010 | A
   10018 |           10000010 | A
   10019 |           10000011 | A
   10020 |           10000011 | A
   10021 |           10000011 | A
   10022 |           10000011 | A
   10023 |           10000011 | A
   10024 |           10000011 | A
   10025 |           10000011 | A
   10026 |           10000011 | A
   10027 |           10000011 | A
   10028 |           10000011 | A
   10029 |           10000011 | A
   10030 |           10000011 | A
   10031 |           10000011 | A
   10032 |           10000011 | A
   10033 |           10000011 | A
   10034 |           10000011 | A
   10035 |           10000011 | A
   10036 |           10000011 | A
   10037 |           10000011 | A
   10038 |           10000011 | A
   10039 |           10000011 | A
   10040 |           10000011 | A
   10041 |           10000011 | M
   10042 |           10000011 | D
   10043 |           10000011 | M
   10044 |           10000011 | D
   10045 |           10000011 | D
(42 rows)

select hist_function, hist_event, hist_object,
       regexp_replace(regexp_replace(regexp_replace(hist_wording,
            E'\\d\\d\.\\d\\d\\.\\d\\d\\.\\d\\d\\d\\d','%','g'),
            E'\\d\\d\\d\\d/\\d\\d\\/\\d\\d\\ \\d\\d\\:\\d\\d:\\d\\d .*?\\)','<timestamp>)','g'),
            E'\\[.+\\]','(timestamp)','g'), 
       hist_user 
  from emaj.emaj_hist where hist_id >= 10000 order by hist_id;
   hist_function    |          hist_event          |         hist_object          |                                                     regexp_replace                                                     | hist_user 
--------------------+------------------------------+------------------------------+------------------------------------------------------------------------------------------------------------------------+-----------
 SET_MARK_GROUPS    | BEGIN                        | myGroup1,myGroup2            | before move                                                                                                            | postgres
 LOCK_GROUPS        | BEGIN                        | myGroup1,myGroup2            |                                                                                                                        | postgres
 LOCK_GROUPS        | END                          | myGroup1,myGroup2            | 11 tables locked, 0 deadlock(s)                                                                                        | postgres
 CLEANUP_RLBK_STATE |                              | Rollback id 9707             | set to COMMITTED                                                                                                       | postgres
 CLEANUP_RLBK_STATE |                              | Rollback id 9708             | set to COMMITTED                                                                                                       | postgres
 SET_MARK_GROUPS    | END                          | myGroup1,myGroup2            | before move                                                                                                            | postgres
 MOVE_TABLE         | BEGIN                        |                              |                                                                                                                        | postgres
 LOCK_GROUP         | BEGIN                        | myGroup1,myGroup2            |                                                                                                                        | postgres
 LOCK_GROUP         | END                          | myGroup1,myGroup2            | 11 tables locked, 0 deadlock(s)                                                                                        | postgres
 SET_MARK_GROUPS    | BEGIN                        | myGroup1,myGroup2            | move table to myGroup1                                                                                                 | postgres
 SET_MARK_GROUPS    | END                          | myGroup1,myGroup2            | move table to myGroup1                                                                                                 | postgres
 MOVE_TABLE         | TABLE MOVED                  | myschema2."myTbl3"           | From the logging group myGroup2 to the logging group myGroup1                                                          | postgres
 MOVE_TABLE         | END                          |                              | 1 tables moved to the new tables group myGroup1                                                                        | postgres
 MOVE_SEQUENCE      | BEGIN                        |                              |                                                                                                                        | postgres
 LOCK_GROUP         | BEGIN                        | myGroup1,myGroup2            |                                                                                                                        | postgres
 LOCK_GROUP         | END                          | myGroup1,myGroup2            | 11 tables locked, 0 deadlock(s)                                                                                        | postgres
 SET_MARK_GROUPS    | BEGIN                        | myGroup1,myGroup2            | move seq to myGroup1                                                                                                   | postgres
 SET_MARK_GROUPS    | END                          | myGroup1,myGroup2            | move seq to myGroup1                                                                                                   | postgres
 MOVE_SEQUENCE      | SEQUENCE MOVED               | myschema2."myTbl3_col31_seq" | From the logging group myGroup2 to the logging group myGroup1                                                          | postgres
 MOVE_SEQUENCE      | END                          |                              | 1 sequences moved to the new tables group myGroup1                                                                     | postgres
 MODIFY_TABLE       | BEGIN                        |                              |                                                                                                                        | postgres
 LOCK_GROUP         | BEGIN                        | myGroup1                     |                                                                                                                        | postgres
 LOCK_GROUP         | END                          | myGroup1                     | 6 tables locked, 0 deadlock(s)                                                                                         | postgres
 SET_MARK_GROUPS    | BEGIN                        | myGroup1                     | modify table                                                                                                           | postgres
 SET_MARK_GROUPS    | END                          | myGroup1                     | modify table                                                                                                           | postgres
 MODIFY_TABLE       | PRIORITY CHANGED             | myschema2."myTbl3"           | NULL => 1                                                                                                              | postgres
 MODIFY_TABLE       | LOG DATA TABLESPACE CHANGED  | myschema2."myTbl3"           | Default tablespace => tsplog1                                                                                          | postgres
 MODIFY_TABLE       | LOG INDEX TABLESPACE CHANGED | myschema2."myTbl3"           | Default tablespace => tsplog1                                                                                          | postgres
 MODIFY_TABLE       | END                          |                              | 1 tables effectively modified                                                                                          | postgres
 SET_MARK_GROUPS    | BEGIN                        | myGroup1,myGroup2            | after move                                                                                                             | postgres
 LOCK_GROUPS        | BEGIN                        | myGroup1,myGroup2            |                                                                                                                        | postgres
 LOCK_GROUPS        | END                          | myGroup1,myGroup2            | 11 tables locked, 0 deadlock(s)                                                                                        | postgres
 SET_MARK_GROUPS    | END                          | myGroup1,myGroup2            | after move                                                                                                             | postgres
 GEN_SQL_GROUPS     | BEGIN                        | myGroup1,myGroup2            | From mark before move to current situation with tables/sequences filtering                                             | postgres
 GEN_SQL_GROUPS     | END                          | myGroup1,myGroup2            | 3 generated statements - script exported into /tmp/emaj_12/alter_logging/script1.sql                                   | postgres
 ROLLBACK_GROUPS    | BEGIN                        | myGroup1,myGroup2            | Logged rollback to mark after move (timestamp)                                                                         | postgres
 DBLINK_OPEN_CNX    |                              | rlbk#1                       | Status = 1                                                                                                             | postgres
 LOCK_GROUP         | BEGIN                        | myGroup1,myGroup2            | Rollback session #1                                                                                                    | postgres
 LOCK_GROUP         | END                          | myGroup1,myGroup2            | Rollback session #1: 11 tables locked, 0 deadlock(s)                                                                   | postgres
 SET_MARK_GROUPS    | BEGIN                        | myGroup1,myGroup2            | RLBK_after move_%_START                                                                                                | postgres
 SET_MARK_GROUPS    | END                          | myGroup1,myGroup2            | RLBK_after move_%_START                                                                                                | postgres
 ROLLBACK_TABLE     | BEGIN                        | myschema2."myTbl3"           | All log rows with emaj_gid > 10000003 and <= 10000005                                                                  | postgres
 ROLLBACK_TABLE     | END                          | myschema2."myTbl3"           | 2 rolled back primary keys                                                                                             | postgres
 ROLLBACK_SEQUENCE  |                              | myschema1."myTbl3_col31_seq" |                                                                                                                        | postgres
 ROLLBACK_SEQUENCE  |                              | myschema1.mytbl2b_col20_seq  |                                                                                                                        | postgres
 ROLLBACK_SEQUENCE  |                              | myschema2."myTbl3_col31_seq" |                                                                                                                        | postgres
 ROLLBACK_SEQUENCE  |                              | myschema2.myseq1             |                                                                                                                        | postgres
 SET_MARK_GROUPS    | BEGIN                        | myGroup1,myGroup2            | RLBK_after move_%_DONE                                                                                                 | postgres
 SET_MARK_GROUPS    | END                          | myGroup1,myGroup2            | RLBK_after move_%_DONE                                                                                                 | postgres
 ROLLBACK_GROUPS    | NOTICE                       | Rollback id 10000            | 1 / 11 tables effectively processed.                                                                                   | postgres
 ROLLBACK_GROUPS    | NOTICE                       | Rollback id 10000            | 4 sequences processed.                                                                                                 | postgres
 DBLINK_CLOSE_CNX   |                              | rlbk#1                       |                                                                                                                        | postgres
 ROLLBACK_GROUPS    | END                          | myGroup1,myGroup2            | Rollback_id 10000, 1 tables and 4 sequences effectively processed                                                      | postgres
 ROLLBACK_GROUPS    | BEGIN                        | myGroup1,myGroup2            | Unlogged rollback to mark before move (timestamp)                                                                      | postgres
 DBLINK_OPEN_CNX    |                              | rlbk#1                       | Status = 1                                                                                                             | postgres
 LOCK_GROUP         | BEGIN                        | myGroup1,myGroup2            | Rollback session #1                                                                                                    | postgres
 LOCK_GROUP         | END                          | myGroup1,myGroup2            | Rollback session #1: 11 tables locked, 0 deadlock(s)                                                                   | postgres
 ROLLBACK_TABLE     | BEGIN                        | myschema2."myTbl3"           | All log rows with emaj_gid > 10000003 and <= 10000009                                                                  | postgres
 ROLLBACK_TABLE     | END                          | myschema2."myTbl3"           | 2 rolled back primary keys                                                                                             | postgres
 ROLLBACK_GROUPS    | MARK DELETED                 | myGroup1                     | mark move table to myGroup1 is deleted                                                                                 | postgres
 ROLLBACK_GROUPS    | MARK DELETED                 | myGroup2                     | mark move table to myGroup1 is deleted                                                                                 | postgres
 ROLLBACK_GROUPS    | MARK DELETED                 | myGroup1                     | mark move seq to myGroup1 is deleted                                                                                   | postgres
 ROLLBACK_GROUPS    | MARK DELETED                 | myGroup2                     | mark move seq to myGroup1 is deleted                                                                                   | postgres
 ROLLBACK_GROUPS    | MARK DELETED                 | myGroup1                     | mark modify table is deleted                                                                                           | postgres
 ROLLBACK_GROUPS    | MARK DELETED                 | myGroup1                     | mark after move is deleted                                                                                             | postgres
 ROLLBACK_GROUPS    | MARK DELETED                 | myGroup2                     | mark after move is deleted                                                                                             | postgres
 ROLLBACK_GROUPS    | MARK DELETED                 | myGroup1                     | mark RLBK_after move_%_START is deleted                                                                                | postgres
 ROLLBACK_GROUPS    | MARK DELETED                 | myGroup2                     | mark RLBK_after move_%_START is deleted                                                                                | postgres
 ROLLBACK_GROUPS    | MARK DELETED                 | myGroup1                     | mark RLBK_after move_%_DONE is deleted                                                                                 | postgres
 ROLLBACK_GROUPS    | MARK DELETED                 | myGroup2                     | mark RLBK_after move_%_DONE is deleted                                                                                 | postgres
 ROLLBACK_SEQUENCE  |                              | myschema1."myTbl3_col31_seq" |                                                                                                                        | postgres
 ROLLBACK_SEQUENCE  |                              | myschema1.mytbl2b_col20_seq  |                                                                                                                        | postgres
 ROLLBACK_SEQUENCE  |                              | myschema2."myTbl3_col31_seq" |                                                                                                                        | postgres
 ROLLBACK_SEQUENCE  |                              | myschema2.myseq1             |                                                                                                                        | postgres
 ROLLBACK_GROUPS    | NOTICE                       | Rollback id 10001            | 1 / 11 tables effectively processed.                                                                                   | postgres
 ROLLBACK_GROUPS    | NOTICE                       | Rollback id 10001            | 4 sequences processed.                                                                                                 | postgres
 ROLLBACK_GROUPS    | WARNING                      | Rollback id 10001            | The table myschema2."myTbl3" has only been rolled back to its latest group attachment (<timestamp>)                    | postgres
 ROLLBACK_GROUPS    | WARNING                      | Rollback id 10001            | The sequence myschema2."myTbl3_col31_seq" has only been rolled back to its latest group attachment state (<timestamp>) | postgres
 ROLLBACK_GROUPS    | WARNING                      | Rollback id 10001            | Tables group change not rolled back: log data tablespace for myschema2."myTbl3"                                        | postgres
 ROLLBACK_GROUPS    | WARNING                      | Rollback id 10001            | Tables group change not rolled back: log index tablespace for myschema2."myTbl3"                                       | postgres
 ROLLBACK_GROUPS    | WARNING                      | Rollback id 10001            | Tables group change not rolled back: E-Maj priority for myschema2."myTbl3"                                             | postgres
 DBLINK_CLOSE_CNX   |                              | rlbk#1                       |                                                                                                                        | postgres
 ROLLBACK_GROUPS    | END                          | myGroup1,myGroup2            | Rollback_id 10001, 1 tables and 4 sequences effectively processed                                                      | postgres
 GEN_SQL_GROUPS     | BEGIN                        | myGroup1,myGroup2            | From mark before move to current situation with tables/sequences filtering                                             | postgres
 GEN_SQL_GROUPS     | END                          | myGroup1,myGroup2            | 3 generated statements - script exported into /tmp/emaj_12/alter_logging/script3.sql                                   | postgres
 STOP_GROUP         | BEGIN                        | myGroup2                     |                                                                                                                        | postgres
 LOCK_GROUP         | BEGIN                        | myGroup2                     |                                                                                                                        | postgres
 LOCK_GROUP         | END                          | myGroup2                     | 5 tables locked, 0 deadlock(s)                                                                                         | postgres
 SET_MARK_GROUP     | BEGIN                        | myGroup2                     | STOP_%                                                                                                                 | postgres
 CLEANUP_RLBK_STATE |                              | Rollback id 10000            | set to COMMITTED                                                                                                       | postgres
 CLEANUP_RLBK_STATE |                              | Rollback id 10001            | set to COMMITTED                                                                                                       | postgres
 SET_MARK_GROUP     | END                          | myGroup2                     | STOP_%                                                                                                                 | postgres
 STOP_GROUP         | END                          | myGroup2                     | 6 tables/sequences processed                                                                                           | postgres
 IMPORT_GROUPS      | BEGIN                        | myGroup1, myGroup2           | Input file: '/tmp/emaj_12/alter_logging/all_groups_conf.json'                                                          | postgres
 LOCK_GROUPS        | BEGIN                        | myGroup1                     |                                                                                                                        | postgres
 LOCK_GROUPS        | END                          | myGroup1                     | 6 tables locked, 0 deadlock(s)                                                                                         | postgres
 SET_MARK_GROUPS    | BEGIN                        | myGroup1                     | IMPORT_%                                                                                                               | postgres
 SET_MARK_GROUPS    | END                          | myGroup1                     | IMPORT_%                                                                                                               | postgres
 IMPORT_GROUPS      | LOG DATA TABLESPACE CHANGED  | myschema2."myTbl3"           | tsplog1 => Default tablespace                                                                                          | postgres
 IMPORT_GROUPS      | LOG INDEX TABLESPACE CHANGED | myschema2."myTbl3"           | tsplog1 => Default tablespace                                                                                          | postgres
 IMPORT_GROUPS      | TABLE MOVED                  | myschema2."myTbl3"           | From the logging group myGroup1 to the idle group myGroup2                                                             | postgres
 IMPORT_GROUPS      | SEQUENCE MOVED               | myschema2."myTbl3_col31_seq" | From the logging group myGroup1 to the idle group myGroup2                                                             | postgres
 IMPORT_GROUPS      | PRIORITY CHANGED             | myschema2."myTbl3"           | 1 => NULL                                                                                                              | postgres
 IMPORT_GROUPS      | END                          |                              | 2 created or altered tables groups                                                                                     | postgres
 START_GROUP        | BEGIN                        | myGroup2                     | With log reset                                                                                                         | postgres
 LOCK_GROUP         | BEGIN                        | myGroup2                     |                                                                                                                        | postgres
 LOCK_GROUP         | END                          | myGroup2                     | 6 tables locked, 0 deadlock(s)                                                                                         | postgres
 SET_MARK_GROUP     | BEGIN                        | myGroup2                     | Start                                                                                                                  | postgres
 SET_MARK_GROUP     | END                          | myGroup2                     | Start                                                                                                                  | postgres
 START_GROUP        | END                          | myGroup2                     | 8 tables/sequences processed                                                                                           | postgres
 REMOVE_TABLES      | BEGIN                        |                              |                                                                                                                        | postgres
 LOCK_GROUP         | BEGIN                        | myGroup2,myGroup2,myGroup2   |                                                                                                                        | postgres
 LOCK_GROUP         | END                          | myGroup2,myGroup2,myGroup2   | 6 tables locked, 0 deadlock(s)                                                                                         | postgres
 SET_MARK_GROUP     | BEGIN                        | myGroup2,myGroup2,myGroup2   | REMOVE_3_TABLES                                                                                                        | postgres
 SET_MARK_GROUP     | END                          | myGroup2,myGroup2,myGroup2   | REMOVE_3_TABLES                                                                                                        | postgres
 REMOVE_TABLES      | TABLE REMOVED                | myschema2."myTbl3"           | From the logging group myGroup2                                                                                        | postgres
 REMOVE_TABLES      | TABLE REMOVED                | myschema2.mytbl1             | From the logging group myGroup2                                                                                        | postgres
 REMOVE_TABLES      | TABLE REMOVED                | myschema2.mytbl2             | From the logging group myGroup2                                                                                        | postgres
 REMOVE_TABLES      | END                          |                              | 3 tables removed from their groups                                                                                     | postgres
 REMOVE_SEQUENCE    | BEGIN                        |                              |                                                                                                                        | postgres
 LOCK_GROUP         | BEGIN                        | myGroup2                     |                                                                                                                        | postgres
 LOCK_GROUP         | END                          | myGroup2                     | 3 tables locked, 0 deadlock(s)                                                                                         | postgres
 SET_MARK_GROUP     | BEGIN                        | myGroup2                     | REMOVE_1_SEQUENCES                                                                                                     | postgres
 SET_MARK_GROUP     | END                          | myGroup2                     | REMOVE_1_SEQUENCES                                                                                                     | postgres
 REMOVE_SEQUENCE    | SEQUENCE REMOVED             | myschema2.myseq1             | From the logging group myGroup2                                                                                        | postgres
 REMOVE_SEQUENCE    | END                          |                              | 1 sequences removed from their groups                                                                                  | postgres
 ASSIGN_TABLES      | BEGIN                        |                              |                                                                                                                        | postgres
 LOCK_GROUP         | BEGIN                        | myGroup2                     |                                                                                                                        | postgres
 LOCK_GROUP         | END                          | myGroup2                     | 3 tables locked, 0 deadlock(s)                                                                                         | postgres
 SET_MARK_GROUP     | BEGIN                        | myGroup2                     | ASSIGN_3_TABLES                                                                                                        | postgres
 SET_MARK_GROUP     | END                          | myGroup2                     | ASSIGN_3_TABLES                                                                                                        | postgres
 ASSIGN_TABLES      | TABLE ADDED                  | myschema2."myTbl3"           | To the logging group myGroup2                                                                                          | postgres
 ASSIGN_TABLES      | TABLE ADDED                  | myschema2.mytbl1             | To the logging group myGroup2                                                                                          | postgres
 ASSIGN_TABLES      | TABLE ADDED                  | myschema2.mytbl2             | To the logging group myGroup2                                                                                          | postgres
 ASSIGN_TABLES      | END                          |                              | 3 tables assigned to the group myGroup2                                                                                | postgres
 ASSIGN_SEQUENCES   | BEGIN                        |                              |                                                                                                                        | postgres
 LOCK_GROUP         | BEGIN                        | myGroup2                     |                                                                                                                        | postgres
 LOCK_GROUP         | END                          | myGroup2                     | 6 tables locked, 0 deadlock(s)                                                                                         | postgres
 SET_MARK_GROUP     | BEGIN                        | myGroup2                     | ASSIGN_2_SEQUENCES                                                                                                     | postgres
 SET_MARK_GROUP     | END                          | myGroup2                     | ASSIGN_2_SEQUENCES                                                                                                     | postgres
 ASSIGN_SEQUENCES   | SEQUENCE ADDED               | myschema2.myseq1             | To the logging group myGroup2                                                                                          | postgres
 ASSIGN_SEQUENCES   | SEQUENCE ADDED               | myschema2.myseq2             | To the logging group myGroup2                                                                                          | postgres
 ASSIGN_SEQUENCES   | END                          |                              | 2 sequences assigned to the group myGroup2                                                                             | postgres
 DISABLE_PROTECTION | EVENT TRIGGERS DISABLED      |                              | emaj_protection_trg, emaj_sql_drop_trg, emaj_table_rewrite_trg                                                         | postgres
 ENABLE_PROTECTION  | EVENT TRIGGERS ENABLED       |                              | emaj_protection_trg, emaj_sql_drop_trg, emaj_table_rewrite_trg                                                         | postgres
 REMOVE_TABLES      | BEGIN                        |                              |                                                                                                                        | postgres
 LOCK_GROUP         | BEGIN                        | myGroup2,myGroup2,myGroup2   |                                                                                                                        | postgres
 LOCK_GROUP         | END                          | myGroup2,myGroup2,myGroup2   | 6 tables locked, 0 deadlock(s)                                                                                         | postgres
 SET_MARK_GROUP     | BEGIN                        | myGroup2,myGroup2,myGroup2   | REMOVE_%                                                                                                               | postgres
 SET_MARK_GROUP     | END                          | myGroup2,myGroup2,myGroup2   | REMOVE_%                                                                                                               | postgres
 REMOVE_TABLES      | TABLE REMOVED                | myschema2."myTbl3"           | From the logging group myGroup2                                                                                        | postgres
 REMOVE_TABLES      | TABLE REMOVED                | myschema2.mytbl1             | From the logging group myGroup2                                                                                        | postgres
 REMOVE_TABLES      | TABLE REMOVED                | myschema2.mytbl2             | From the logging group myGroup2                                                                                        | postgres
 REMOVE_TABLES      | END                          |                              | 3 tables removed from their groups                                                                                     | postgres
 REMOVE_SEQUENCES   | BEGIN                        |                              |                                                                                                                        | postgres
 LOCK_GROUP         | BEGIN                        | myGroup2,myGroup2            |                                                                                                                        | postgres
 LOCK_GROUP         | END                          | myGroup2,myGroup2            | 3 tables locked, 0 deadlock(s)                                                                                         | postgres
 SET_MARK_GROUP     | BEGIN                        | myGroup2,myGroup2            | REMOVE_%                                                                                                               | postgres
 SET_MARK_GROUP     | END                          | myGroup2,myGroup2            | REMOVE_%                                                                                                               | postgres
 REMOVE_SEQUENCES   | SEQUENCE REMOVED             | myschema2.myseq1             | From the logging group myGroup2                                                                                        | postgres
 REMOVE_SEQUENCES   | SEQUENCE REMOVED             | myschema2.myseq2             | From the logging group myGroup2                                                                                        | postgres
 REMOVE_SEQUENCES   | END                          |                              | 2 sequences removed from their groups                                                                                  | postgres
 ASSIGN_TABLES      | BEGIN                        |                              |                                                                                                                        | postgres
 LOCK_GROUP         | BEGIN                        | myGroup2                     |                                                                                                                        | postgres
 LOCK_GROUP         | END                          | myGroup2                     | 3 tables locked, 0 deadlock(s)                                                                                         | postgres
 SET_MARK_GROUP     | BEGIN                        | myGroup2                     | ASSIGN_%                                                                                                               | postgres
 SET_MARK_GROUP     | END                          | myGroup2                     | ASSIGN_%                                                                                                               | postgres
 ASSIGN_TABLES      | TABLE ADDED                  | myschema2."myTbl3"           | To the logging group myGroup2                                                                                          | postgres
 ASSIGN_TABLES      | TABLE ADDED                  | myschema2.mytbl1             | To the logging group myGroup2                                                                                          | postgres
 ASSIGN_TABLES      | TABLE ADDED                  | myschema2.mytbl2             | To the logging group myGroup2                                                                                          | postgres
 ASSIGN_TABLES      | END                          |                              | 3 tables assigned to the group myGroup2                                                                                | postgres
 ASSIGN_SEQUENCES   | BEGIN                        |                              |                                                                                                                        | postgres
 LOCK_GROUP         | BEGIN                        | myGroup2                     |                                                                                                                        | postgres
 LOCK_GROUP         | END                          | myGroup2                     | 6 tables locked, 0 deadlock(s)                                                                                         | postgres
 SET_MARK_GROUP     | BEGIN                        | myGroup2                     | Mark_assign_sequences                                                                                                  | postgres
 SET_MARK_GROUP     | END                          | myGroup2                     | Mark_assign_sequences                                                                                                  | postgres
 ASSIGN_SEQUENCES   | SEQUENCE ADDED               | myschema2.myseq1             | To the logging group myGroup2                                                                                          | postgres
 ASSIGN_SEQUENCES   | SEQUENCE ADDED               | myschema2.myseq2             | To the logging group myGroup2                                                                                          | postgres
 ASSIGN_SEQUENCES   | END                          |                              | 2 sequences assigned to the group myGroup2                                                                             | postgres
 REMOVE_TABLE       | BEGIN                        |                              |                                                                                                                        | postgres
 LOCK_GROUP         | BEGIN                        | myGroup1                     |                                                                                                                        | postgres
 LOCK_GROUP         | END                          | myGroup1                     | 5 tables locked, 0 deadlock(s)                                                                                         | postgres
 SET_MARK_GROUP     | BEGIN                        | myGroup1                     | REMOVE_%                                                                                                               | postgres
 SET_MARK_GROUP     | END                          | myGroup1                     | REMOVE_%                                                                                                               | postgres
 REMOVE_TABLE       | TABLE REMOVED                | myschema1.mytbl4             | From the logging group myGroup1                                                                                        | postgres
 REMOVE_TABLE       | END                          |                              | 1 tables removed from their groups                                                                                     | postgres
 ASSIGN_TABLE       | BEGIN                        |                              |                                                                                                                        | postgres
 LOCK_GROUP         | BEGIN                        | myGroup1                     |                                                                                                                        | postgres
 LOCK_GROUP         | END                          | myGroup1                     | 4 tables locked, 0 deadlock(s)                                                                                         | postgres
 SET_MARK_GROUP     | BEGIN                        | myGroup1                     | ASSIGN_%                                                                                                               | postgres
 SET_MARK_GROUP     | END                          | myGroup1                     | ASSIGN_%                                                                                                               | postgres
 ASSIGN_TABLE       | TABLE ADDED                  | myschema1.mytbl4             | To the logging group myGroup1                                                                                          | postgres
 ASSIGN_TABLE       | END                          |                              | 1 tables assigned to the group myGroup1                                                                                | postgres
 REMOVE_TABLE       | BEGIN                        |                              |                                                                                                                        | postgres
 LOCK_GROUP         | BEGIN                        | myGroup1                     |                                                                                                                        | postgres
 LOCK_GROUP         | END                          | myGroup1                     | 5 tables locked, 0 deadlock(s)                                                                                         | postgres
 SET_MARK_GROUP     | BEGIN                        | myGroup1                     | REMOVE_%                                                                                                               | postgres
 SET_MARK_GROUP     | END                          | myGroup1                     | REMOVE_%                                                                                                               | postgres
 REMOVE_TABLE       | TABLE REMOVED                | myschema1.mytbl4             | From the logging group myGroup1                                                                                        | postgres
 REMOVE_TABLE       | END                          |                              | 1 tables removed from their groups                                                                                     | postgres
 ASSIGN_TABLE       | BEGIN                        |                              |                                                                                                                        | postgres
 LOCK_GROUP         | BEGIN                        | myGroup1                     |                                                                                                                        | postgres
 LOCK_GROUP         | END                          | myGroup1                     | 4 tables locked, 0 deadlock(s)                                                                                         | postgres
 SET_MARK_GROUP     | BEGIN                        | myGroup1                     | ASSIGN_%                                                                                                               | postgres
 SET_MARK_GROUP     | END                          | myGroup1                     | ASSIGN_%                                                                                                               | postgres
 ASSIGN_TABLE       | TABLE ADDED                  | myschema1.mytbl4             | To the logging group myGroup1                                                                                          | postgres
 ASSIGN_TABLE       | END                          |                              | 1 tables assigned to the group myGroup1                                                                                | postgres
 MOVE_TABLES        | BEGIN                        |                              |                                                                                                                        | postgres
 LOCK_GROUP         | BEGIN                        | myGroup1                     |                                                                                                                        | postgres
 LOCK_GROUP         | END                          | myGroup1                     | 5 tables locked, 0 deadlock(s)                                                                                         | postgres
 SET_MARK_GROUPS    | BEGIN                        | myGroup1                     | MOVE_TBL_idle_to_logging                                                                                               | postgres
 SET_MARK_GROUPS    | END                          | myGroup1                     | MOVE_TBL_idle_to_logging                                                                                               | postgres
 MOVE_TABLES        | TABLE MOVED                  | myschema4.mypartp1           | From the idle group myGroup4 to the logging group myGroup1                                                             | postgres
 MOVE_TABLES        | TABLE MOVED                  | myschema4.mypartp2           | From the idle group myGroup4 to the logging group myGroup1                                                             | postgres
 MOVE_TABLES        | TABLE MOVED                  | myschema4.mytblc1            | From the idle group myGroup4 to the logging group myGroup1                                                             | postgres
 MOVE_TABLES        | TABLE MOVED                  | myschema4.mytblc2            | From the idle group myGroup4 to the logging group myGroup1                                                             | postgres
 MOVE_TABLES        | TABLE MOVED                  | myschema4.mytblm             | From the idle group myGroup4 to the logging group myGroup1                                                             | postgres
 MOVE_TABLES        | END                          |                              | 5 tables moved to the new tables group myGroup1                                                                        | postgres
 MOVE_SEQUENCES     | BEGIN                        |                              |                                                                                                                        | postgres
 LOCK_GROUP         | BEGIN                        | myGroup1,myGroup2            |                                                                                                                        | postgres
 LOCK_GROUP         | END                          | myGroup1,myGroup2            | 16 tables locked, 0 deadlock(s)                                                                                        | postgres
 SET_MARK_GROUPS    | BEGIN                        | myGroup1,myGroup2            | MOVE_SEQ_idle_to_logging                                                                                               | postgres
 SET_MARK_GROUPS    | END                          | myGroup1,myGroup2            | MOVE_SEQ_idle_to_logging                                                                                               | postgres
 MOVE_SEQUENCES     | SEQUENCE MOVED               | myschema2."myTbl3_col31_seq" | From the logging group myGroup2 to the logging group myGroup1                                                          | postgres
 MOVE_SEQUENCES     | SEQUENCE MOVED               | myschema2.myseq1             | From the logging group myGroup2 to the logging group myGroup1                                                          | postgres
 MOVE_SEQUENCES     | SEQUENCE MOVED               | myschema2.myseq2             | From the logging group myGroup2 to the logging group myGroup1                                                          | postgres
 MOVE_SEQUENCES     | END                          |                              | 3 sequences moved to the new tables group myGroup1                                                                     | postgres
 MOVE_TABLES        | BEGIN                        |                              |                                                                                                                        | postgres
 LOCK_GROUP         | BEGIN                        | myGroup1,myGroup2            |                                                                                                                        | postgres
 LOCK_GROUP         | END                          | myGroup1,myGroup2            | 16 tables locked, 0 deadlock(s)                                                                                        | postgres
 SET_MARK_GROUPS    | BEGIN                        | myGroup1,myGroup2            | MOVE_TBL_logging_to_logging                                                                                            | postgres
 SET_MARK_GROUPS    | END                          | myGroup1,myGroup2            | MOVE_TBL_logging_to_logging                                                                                            | postgres
 MOVE_TABLES        | TABLE MOVED                  | myschema4.mypartp1           | From the logging group myGroup1 to the logging group myGroup2                                                          | postgres
 MOVE_TABLES        | TABLE MOVED                  | myschema4.mypartp2           | From the logging group myGroup1 to the logging group myGroup2                                                          | postgres
 MOVE_TABLES        | TABLE MOVED                  | myschema4.mytblc1            | From the logging group myGroup1 to the logging group myGroup2                                                          | postgres
 MOVE_TABLES        | TABLE MOVED                  | myschema4.mytblc2            | From the logging group myGroup1 to the logging group myGroup2                                                          | postgres
 MOVE_TABLES        | TABLE MOVED                  | myschema4.mytblm             | From the logging group myGroup1 to the logging group myGroup2                                                          | postgres
 MOVE_TABLES        | END                          |                              | 5 tables moved to the new tables group myGroup2                                                                        | postgres
 MOVE_SEQUENCES     | BEGIN                        |                              |                                                                                                                        | postgres
 LOCK_GROUP         | BEGIN                        | myGroup1,myGroup2            |                                                                                                                        | postgres
 LOCK_GROUP         | END                          | myGroup1,myGroup2            | 16 tables locked, 0 deadlock(s)                                                                                        | postgres
 SET_MARK_GROUPS    | BEGIN                        | myGroup1,myGroup2            | MOVE_SEQ_logging_to_logging                                                                                            | postgres
 SET_MARK_GROUPS    | END                          | myGroup1,myGroup2            | MOVE_SEQ_logging_to_logging                                                                                            | postgres
 MOVE_SEQUENCES     | SEQUENCE MOVED               | myschema2."myTbl3_col31_seq" | From the logging group myGroup1 to the logging group myGroup2                                                          | postgres
 MOVE_SEQUENCES     | SEQUENCE MOVED               | myschema2.myseq1             | From the logging group myGroup1 to the logging group myGroup2                                                          | postgres
 MOVE_SEQUENCES     | SEQUENCE MOVED               | myschema2.myseq2             | From the logging group myGroup1 to the logging group myGroup2                                                          | postgres
 MOVE_SEQUENCES     | END                          |                              | 3 sequences moved to the new tables group myGroup2                                                                     | postgres
 MOVE_TABLES        | BEGIN                        |                              |                                                                                                                        | postgres
 LOCK_GROUP         | BEGIN                        | myGroup2                     |                                                                                                                        | postgres
 LOCK_GROUP         | END                          | myGroup2                     | 11 tables locked, 0 deadlock(s)                                                                                        | postgres
 SET_MARK_GROUPS    | BEGIN                        | myGroup2                     | MOVE_TBL_logging_to_idle                                                                                               | postgres
 SET_MARK_GROUPS    | END                          | myGroup2                     | MOVE_TBL_logging_to_idle                                                                                               | postgres
 MOVE_TABLES        | TABLE MOVED                  | myschema4.mypartp1           | From the logging group myGroup2 to the idle group myGroup4                                                             | postgres
 MOVE_TABLES        | TABLE MOVED                  | myschema4.mypartp2           | From the logging group myGroup2 to the idle group myGroup4                                                             | postgres
 MOVE_TABLES        | TABLE MOVED                  | myschema4.mytblc1            | From the logging group myGroup2 to the idle group myGroup4                                                             | postgres
 MOVE_TABLES        | TABLE MOVED                  | myschema4.mytblc2            | From the logging group myGroup2 to the idle group myGroup4                                                             | postgres
 MOVE_TABLES        | TABLE MOVED                  | myschema4.mytblm             | From the logging group myGroup2 to the idle group myGroup4                                                             | postgres
 MOVE_TABLES        | END                          |                              | 5 tables moved to the new tables group myGroup4                                                                        | postgres
 MOVE_SEQUENCES     | BEGIN                        |                              |                                                                                                                        | postgres
 LOCK_GROUP         | BEGIN                        | myGroup2                     |                                                                                                                        | postgres
 LOCK_GROUP         | END                          | myGroup2                     | 6 tables locked, 0 deadlock(s)                                                                                         | postgres
 SET_MARK_GROUPS    | BEGIN                        | myGroup2                     | MOVE_SEQ_logging_to_idle                                                                                               | postgres
 SET_MARK_GROUPS    | END                          | myGroup2                     | MOVE_SEQ_logging_to_idle                                                                                               | postgres
 MOVE_SEQUENCES     | SEQUENCE MOVED               | myschema2."myTbl3_col31_seq" | From the logging group myGroup2 to the idle group myGroup4                                                             | postgres
 MOVE_SEQUENCES     | SEQUENCE MOVED               | myschema2.myseq1             | From the logging group myGroup2 to the idle group myGroup4                                                             | postgres
 MOVE_SEQUENCES     | SEQUENCE MOVED               | myschema2.myseq2             | From the logging group myGroup2 to the idle group myGroup4                                                             | postgres
 MOVE_SEQUENCES     | END                          |                              | 3 sequences moved to the new tables group myGroup4                                                                     | postgres
 MOVE_TABLE         | BEGIN                        |                              |                                                                                                                        | postgres
 LOCK_GROUP         | BEGIN                        | myGroup1,myGroup2            |                                                                                                                        | postgres
 LOCK_GROUP         | END                          | myGroup1,myGroup2            | 11 tables locked, 0 deadlock(s)                                                                                        | postgres
 SET_MARK_GROUPS    | BEGIN                        | myGroup1,myGroup2            | Move a table with fkey                                                                                                 | postgres
 SET_MARK_GROUPS    | END                          | myGroup1,myGroup2            | Move a table with fkey                                                                                                 | postgres
 MOVE_TABLE         | TABLE MOVED                  | myschema2.mytbl2             | From the logging group myGroup2 to the logging group myGroup1                                                          | postgres
 MOVE_TABLE         | END                          |                              | 1 tables moved to the new tables group myGroup1                                                                        | postgres
 MOVE_TABLE         | BEGIN                        |                              |                                                                                                                        | postgres
 LOCK_GROUP         | BEGIN                        | myGroup1,myGroup2            |                                                                                                                        | postgres
 LOCK_GROUP         | END                          | myGroup1,myGroup2            | 11 tables locked, 0 deadlock(s)                                                                                        | postgres
 SET_MARK_GROUPS    | BEGIN                        | myGroup1,myGroup2            | Move a table with fkey back                                                                                            | postgres
 SET_MARK_GROUPS    | END                          | myGroup1,myGroup2            | Move a table with fkey back                                                                                            | postgres
 MOVE_TABLE         | TABLE MOVED                  | myschema2.mytbl2             | From the logging group myGroup1 to the logging group myGroup2                                                          | postgres
 MOVE_TABLE         | END                          |                              | 1 tables moved to the new tables group myGroup2                                                                        | postgres
 REMOVE_TABLE       | BEGIN                        |                              |                                                                                                                        | postgres
 LOCK_GROUP         | BEGIN                        | myGroup1                     |                                                                                                                        | postgres
 LOCK_GROUP         | END                          | myGroup1                     | 4 tables locked, 0 deadlock(s)                                                                                         | postgres
 SET_MARK_GROUP     | BEGIN                        | myGroup1                     | REMOVE_%                                                                                                               | postgres
 SET_MARK_GROUP     | END                          | myGroup1                     | REMOVE_%                                                                                                               | postgres
 REMOVE_TABLE       | TABLE REMOVED                | myschema1.mytbl1             | From the logging group myGroup1                                                                                        | postgres
 REMOVE_TABLE       | END                          |                              | 1 tables removed from their groups                                                                                     | postgres
 ASSIGN_TABLE       | BEGIN                        |                              |                                                                                                                        | postgres
 LOCK_GROUP         | BEGIN                        | myGroup1                     |                                                                                                                        | postgres
 LOCK_GROUP         | END                          | myGroup1                     | 4 tables locked, 0 deadlock(s)                                                                                         | postgres
 SET_MARK_GROUP     | BEGIN                        | myGroup1                     | ASSIGN_%                                                                                                               | postgres
 SET_MARK_GROUP     | END                          | myGroup1                     | ASSIGN_%                                                                                                               | postgres
 ASSIGN_TABLE       | TABLE ADDED                  | myschema1.mytbl1_new_name    | To the logging group myGroup1                                                                                          | postgres
 ASSIGN_TABLE       | END                          |                              | 1 tables assigned to the group myGroup1                                                                                | postgres
 REMOVE_TABLE       | BEGIN                        |                              |                                                                                                                        | postgres
 LOCK_GROUP         | BEGIN                        | myGroup1                     |                                                                                                                        | postgres
 LOCK_GROUP         | END                          | myGroup1                     | 4 tables locked, 0 deadlock(s)                                                                                         | postgres
 SET_MARK_GROUP     | BEGIN                        | myGroup1                     | REMOVE_%                                                                                                               | postgres
 SET_MARK_GROUP     | END                          | myGroup1                     | REMOVE_%                                                                                                               | postgres
 REMOVE_TABLE       | TABLE REMOVED                | myschema1.mytbl1_new_name    | From the logging group myGroup1                                                                                        | postgres
 REMOVE_TABLE       | END                          |                              | 1 tables removed from their groups                                                                                     | postgres
 ASSIGN_TABLE       | BEGIN                        |                              |                                                                                                                        | postgres
 LOCK_GROUP         | BEGIN                        | myGroup1                     |                                                                                                                        | postgres
 LOCK_GROUP         | END                          | myGroup1                     | 4 tables locked, 0 deadlock(s)                                                                                         | postgres
 SET_MARK_GROUP     | BEGIN                        | myGroup1                     | ASSIGN_%                                                                                                               | postgres
 SET_MARK_GROUP     | END                          | myGroup1                     | ASSIGN_%                                                                                                               | postgres
 ASSIGN_TABLE       | LOG_SCHEMA CREATED           | emaj_public                  |                                                                                                                        | postgres
 ASSIGN_TABLE       | TABLE ADDED                  | public.mytbl1_new_name       | To the logging group myGroup1                                                                                          | postgres
 ASSIGN_TABLE       | END                          |                              | 1 tables assigned to the group myGroup1                                                                                | postgres
 REMOVE_TABLE       | BEGIN                        |                              |                                                                                                                        | postgres
 LOCK_GROUP         | BEGIN                        | myGroup1                     |                                                                                                                        | postgres
 LOCK_GROUP         | END                          | myGroup1                     | 4 tables locked, 0 deadlock(s)                                                                                         | postgres
 SET_MARK_GROUP     | BEGIN                        | myGroup1                     | REMOVE_%                                                                                                               | postgres
 SET_MARK_GROUP     | END                          | myGroup1                     | REMOVE_%                                                                                                               | postgres
 REMOVE_TABLE       | TABLE REMOVED                | public.mytbl1_new_name       | From the logging group myGroup1                                                                                        | postgres
 REMOVE_TABLE       | END                          |                              | 1 tables removed from their groups                                                                                     | postgres
 ASSIGN_TABLE       | BEGIN                        |                              |                                                                                                                        | postgres
 LOCK_GROUP         | BEGIN                        | myGroup1                     |                                                                                                                        | postgres
 LOCK_GROUP         | END                          | myGroup1                     | 4 tables locked, 0 deadlock(s)                                                                                         | postgres
 SET_MARK_GROUP     | BEGIN                        | myGroup1                     | ASSIGN_%                                                                                                               | postgres
 SET_MARK_GROUP     | END                          | myGroup1                     | ASSIGN_%                                                                                                               | postgres
 ASSIGN_TABLE       | TABLE ADDED                  | myschema1.mytbl1             | To the logging group myGroup1                                                                                          | postgres
 ASSIGN_TABLE       | END                          |                              | 1 tables assigned to the group myGroup1                                                                                | postgres
 STOP_GROUP         | BEGIN                        | myGroup1                     |                                                                                                                        | postgres
 LOCK_GROUP         | BEGIN                        | myGroup1                     |                                                                                                                        | postgres
 LOCK_GROUP         | END                          | myGroup1                     | 5 tables locked, 0 deadlock(s)                                                                                         | postgres
 SET_MARK_GROUP     | BEGIN                        | myGroup1                     | STOP_%                                                                                                                 | postgres
 SET_MARK_GROUP     | END                          | myGroup1                     | STOP_%                                                                                                                 | postgres
 STOP_GROUP         | END                          | myGroup1                     | 7 tables/sequences processed                                                                                           | postgres
 DROP_GROUP         | BEGIN                        | myGroup1                     |                                                                                                                        | postgres
 DROP_GROUP         | LOG_SCHEMA DROPPED           | emaj_myschema1               |                                                                                                                        | postgres
 DROP_GROUP         | LOG_SCHEMA DROPPED           | emaj_public                  |                                                                                                                        | postgres
 DROP_GROUP         | END                          | myGroup1                     | 7 tables/sequences processed                                                                                           | postgres
 STOP_GROUP         | BEGIN                        | myGroup2                     |                                                                                                                        | postgres
 LOCK_GROUP         | BEGIN                        | myGroup2                     |                                                                                                                        | postgres
 LOCK_GROUP         | END                          | myGroup2                     | 6 tables locked, 0 deadlock(s)                                                                                         | postgres
 SET_MARK_GROUP     | BEGIN                        | myGroup2                     | STOP_%                                                                                                                 | postgres
 SET_MARK_GROUP     | END                          | myGroup2                     | STOP_%                                                                                                                 | postgres
 STOP_GROUP         | END                          | myGroup2                     | 6 tables/sequences processed                                                                                           | postgres
 DROP_GROUP         | BEGIN                        | myGroup2                     |                                                                                                                        | postgres
 DROP_GROUP         | LOG_SCHEMA DROPPED           | emaj_myschema2               |                                                                                                                        | postgres
 DROP_GROUP         | END                          | myGroup2                     | 6 tables/sequences processed                                                                                           | postgres
 DROP_GROUP         | BEGIN                        | myGroup4                     |                                                                                                                        | postgres
 DROP_GROUP         | LOG_SCHEMA DROPPED           | emaj_myschema4               |                                                                                                                        | postgres
 DROP_GROUP         | END                          | myGroup4                     | 8 tables/sequences processed                                                                                           | postgres
(346 rows)

select nspname from pg_namespace where nspname like 'emaj%' order by nspname;
 nspname 
---------
 emaj
(1 row)

select sch_name from emaj.emaj_schema order by 1;
 sch_name 
----------
 emaj
(1 row)

select * from emaj.emaj_rel_hist order by 1,2,3;
  relh_schema   |    relh_tblseq    | relh_time_range |    relh_group    | relh_kind 
----------------+-------------------+-----------------+------------------+-----------
 myschema1      | myTbl3            | [2000,8001)     | myGroup1         | r
 myschema1      | myTbl3            | [8008,8011)     | myGroup1         | r
 myschema1      | myTbl3            | [8016,9701)     | myGroup1         | r
 myschema1      | myTbl3            | [9713,10042)    | myGroup1         | r
 myschema1      | myTbl3_col31_seq  | [2000,8001)     | myGroup1         | S
 myschema1      | myTbl3_col31_seq  | [8008,9302)     | myGroup1         | S
 myschema1      | myTbl3_col31_seq  | [9310,10042)    | myGroup1         | S
 myschema1      | mytbl1            | [2000,8001)     | myGroup1         | r
 myschema1      | mytbl1            | [8008,8009)     | myGroup1         | r
 myschema1      | mytbl1            | [8016,8201)     | myGroup1         | r
 myschema1      | mytbl1            | [8201,8203)     | myGroup2         | r
 myschema1      | mytbl1            | [8203,9707)     | myGroup1         | r
 myschema1      | mytbl1            | [9713,10035)    | myGroup1         | r
 myschema1      | mytbl1            | [10040,10042)   | myGroup1         | r
 myschema1      | mytbl1_new_name   | [10036,10037)   | myGroup1         | r
 myschema1      | mytbl2            | [2000,8001)     | myGroup1         | r
 myschema1      | mytbl2            | [8008,8010)     | myGroup1         | r
 myschema1      | mytbl2            | [8016,8202)     | myGroup1         | r
 myschema1      | mytbl2            | [8202,8204)     | myGroup2         | r
 myschema1      | mytbl2            | [8204,10042)    | myGroup1         | r
 myschema1      | mytbl2b           | [2000,8001)     | myGroup1         | r
 myschema1      | mytbl2b           | [8008,8010)     | myGroup1         | r
 myschema1      | mytbl2b           | [8016,8202)     | myGroup1         | r
 myschema1      | mytbl2b           | [8202,8203)     | myGroup2         | r
 myschema1      | mytbl2b           | [8203,9701)     | myGroup1         | r
 myschema1      | mytbl2b           | [9713,10042)    | myGroup1         | r
 myschema1      | mytbl2b_col20_seq | [2000,8001)     | myGroup1         | S
 myschema1      | mytbl2b_col20_seq | [8008,10042)    | myGroup1         | S
 myschema1      | mytbl4            | [2000,8001)     | myGroup1         | r
 myschema1      | mytbl4            | [8008,8011)     | myGroup1         | r
 myschema1      | mytbl4            | [8016,10023)    | myGroup1         | r
 myschema1      | mytbl4            | [10024,10025)   | myGroup1         | r
 myschema1      | mytbl4            | [10026,10042)   | myGroup1         | r
 myschema2      | myTbl3            | [2000,8002)     | myGroup2         | r
 myschema2      | myTbl3            | [8008,10005)    | myGroup2         | r
 myschema2      | myTbl3            | [10005,10013)   | myGroup1         | r
 myschema2      | myTbl3            | [10013,10015)   | myGroup2         | r
 myschema2      | myTbl3            | [10017,10019)   | myGroup2         | r
 myschema2      | myTbl3            | [10021,10044)   | myGroup2         | r
 myschema2      | myTbl3_col31_seq  | [2000,8002)     | myGroup2         | S
 myschema2      | myTbl3_col31_seq  | [8008,8015)     | myGroup2         | S
 myschema2      | myTbl3_col31_seq  | [8016,10006)    | myGroup2         | S
 myschema2      | myTbl3_col31_seq  | [10006,10013)   | myGroup1         | S
 myschema2      | myTbl3_col31_seq  | [10013,10028)   | myGroup2         | S
 myschema2      | myTbl3_col31_seq  | [10028,10030)   | myGroup1         | S
 myschema2      | myTbl3_col31_seq  | [10030,10032)   | myGroup2         | S
 myschema2      | myTbl3_col31_seq  | [10032,10045)   | myGroup4         | S
 myschema2      | myseq1            | [2000,8002)     | myGroup2         | S
 myschema2      | myseq1            | [8008,8012)     | myGroup2         | S
 myschema2      | myseq1            | [8016,8206)     | myGroup2         | S
 myschema2      | myseq1            | [8206,8207)     | myGroup1         | S
 myschema2      | myseq1            | [8207,8208)     | myGroup4         | S
 myschema2      | myseq1            | [8208,10016)    | myGroup2         | S
 myschema2      | myseq1            | [10018,10020)   | myGroup2         | S
 myschema2      | myseq1            | [10022,10028)   | myGroup2         | S
 myschema2      | myseq1            | [10028,10030)   | myGroup1         | S
 myschema2      | myseq1            | [10030,10032)   | myGroup2         | S
 myschema2      | myseq1            | [10032,10045)   | myGroup4         | S
 myschema2      | myseq2            | [8013,8014)     | myGroup2         | S
 myschema2      | myseq2            | [9102,9107)     | myGroup2         | S
 myschema2      | myseq2            | [9108,9109)     | myGroup2         | S
 myschema2      | myseq2            | [10018,10020)   | myGroup2         | S
 myschema2      | myseq2            | [10022,10028)   | myGroup2         | S
 myschema2      | myseq2            | [10028,10030)   | myGroup1         | S
 myschema2      | myseq2            | [10030,10032)   | myGroup2         | S
 myschema2      | myseq2            | [10032,10045)   | myGroup4         | S
 myschema2      | mytbl1            | [2000,8002)     | myGroup2         | r
 myschema2      | mytbl1            | [8008,10015)    | myGroup2         | r
 myschema2      | mytbl1            | [10017,10019)   | myGroup2         | r
 myschema2      | mytbl1            | [10021,10044)   | myGroup2         | r
 myschema2      | mytbl2            | [2000,8002)     | myGroup2         | r
 myschema2      | mytbl2            | [8008,10015)    | myGroup2         | r
 myschema2      | mytbl2            | [10017,10019)   | myGroup2         | r
 myschema2      | mytbl2            | [10021,10033)   | myGroup2         | r
 myschema2      | mytbl2            | [10033,10034)   | myGroup1         | r
 myschema2      | mytbl2            | [10034,10044)   | myGroup2         | r
 myschema2      | mytbl4            | [2000,8002)     | myGroup2         | r
 myschema2      | mytbl4            | [8008,10044)    | myGroup2         | r
 myschema2      | mytbl5            | [2000,8002)     | myGroup2         | r
 myschema2      | mytbl5            | [8008,10044)    | myGroup2         | r
 myschema2      | mytbl6            | [2000,8002)     | myGroup2         | r
 myschema2      | mytbl6            | [8008,10044)    | myGroup2         | r
 myschema2      | mytbl7            | [2000,8002)     | myGroup2         | r
 myschema2      | mytbl7            | [8008,9000)     | myGroup2         | r
 myschema2      | mytbl7            | [9502,9509)     | myGroup2         | r
 myschema2      | mytbl7            | [9510,9512)     | myGroup2         | r
 myschema2      | mytbl8            | [2000,8002)     | myGroup2         | r
 myschema2      | mytbl8            | [8008,9000)     | myGroup2         | r
 myschema4      | mypartp1          | [1022,8005)     | myGroup4         | r
 myschema4      | mypartp1          | [8008,10027)    | myGroup4         | r
 myschema4      | mypartp1          | [10027,10029)   | myGroup1         | r
 myschema4      | mypartp1          | [10029,10031)   | myGroup2         | r
 myschema4      | mypartp1          | [10031,10045)   | myGroup4         | r
 myschema4      | mypartp2          | [1022,8005)     | myGroup4         | r
 myschema4      | mypartp2          | [8008,10027)    | myGroup4         | r
 myschema4      | mypartp2          | [10027,10029)   | myGroup1         | r
 myschema4      | mypartp2          | [10029,10031)   | myGroup2         | r
 myschema4      | mypartp2          | [10031,10045)   | myGroup4         | r
 myschema4      | mytblc1           | [1022,8005)     | myGroup4         | r
 myschema4      | mytblc1           | [8008,10027)    | myGroup4         | r
 myschema4      | mytblc1           | [10027,10029)   | myGroup1         | r
 myschema4      | mytblc1           | [10029,10031)   | myGroup2         | r
 myschema4      | mytblc1           | [10031,10045)   | myGroup4         | r
 myschema4      | mytblc2           | [1022,8005)     | myGroup4         | r
 myschema4      | mytblc2           | [8008,10027)    | myGroup4         | r
 myschema4      | mytblc2           | [10027,10029)   | myGroup1         | r
 myschema4      | mytblc2           | [10029,10031)   | myGroup2         | r
 myschema4      | mytblc2           | [10031,10045)   | myGroup4         | r
 myschema4      | mytblm            | [1022,8005)     | myGroup4         | r
 myschema4      | mytblm            | [8008,10027)    | myGroup4         | r
 myschema4      | mytblm            | [10027,10029)   | myGroup1         | r
 myschema4      | mytblm            | [10029,10031)   | myGroup2         | r
 myschema4      | mytblm            | [10031,10045)   | myGroup4         | r
 phil's schema3 | myTbl2\           | [1016,8004)     | phil's group#3", | r
 phil's schema3 | myTbl2\_col21_seq | [1027,8004)     | phil's group#3", | S
 phil's schema3 | phil's seq\1      | [1027,8004)     | phil's group#3", | S
 phil's schema3 | phil's tbl1       | [1016,8004)     | phil's group#3", | r
 public         | mytbl1_new_name   | [10038,10039)   | myGroup1         | r
(118 rows)

truncate emaj.emaj_hist;
-- remove the temp directory
\! rm -R $EMAJTESTTMPDIR
