-- adm2.sql : complex scenario executed by an emaj_adm role. 
--            Follows adm1.sql, and includes more specific test cases
--
-- set sequence restart value
select public.handle_emaj_sequences(14000);
 handle_emaj_sequences 
-----------------------
 
(1 row)

-- define and create the temp file directory to be used by the script
\setenv EMAJTESTTMPDIR '/tmp/emaj_'`echo $PGVER`'/adm2'
\set EMAJTESTTMPDIR `echo $EMAJTESTTMPDIR`
\! mkdir -p $EMAJTESTTMPDIR
set session_authorization to _regress_emaj_adm1;
-- before going on, save and reload parameters
select emaj.emaj_import_parameters_configuration(emaj.emaj_export_parameters_configuration());
 emaj_import_parameters_configuration 
--------------------------------------
                                    3
(1 row)

-----------------------------
-- Step 8 : use of multi-group functions, start_group(s) without log reset and use old marks (i.e. set before the latest group start)
-----------------------------
-- stop both groups
select emaj.emaj_stop_groups(array['myGroup1','myGroup2']);
 emaj_stop_groups 
------------------
               15
(1 row)

-- start both groups
select emaj.emaj_start_groups(array['myGroup1','myGroup2'],'Multi-1', false);
WARNING:  _check_fk_groups: The foreign key "mytbl6_col61_fkey" on the table "myschema2.mytbl6" references the table "myschema2.mytbl7" that is outside the groups (myGroup1,myGroup2).
WARNING:  _check_fk_groups: The table "myschema2.mytbl6" is referenced by the foreign key "mytbl8_col81_fkey" on the table "myschema2.mytbl8" that is outside the groups (myGroup1,myGroup2).
 emaj_start_groups 
-------------------
                15
(1 row)

-- set a mark for both groups
select emaj.emaj_set_mark_groups(array['myGroup1','myGroup2'],'Multi-2');
 emaj_set_mark_groups 
----------------------
                   15
(1 row)

-- logged rollback to Multi-1
select * from emaj.emaj_logged_rollback_groups(array['myGroup1','myGroup2'],'Multi-1',false) order by 1,2;
 rlbk_severity |              rlbk_message              
---------------+----------------------------------------
 Notice        | 0 / 11 tables effectively processed.
 Notice        | 0 / 4 sequences effectively processed.
 Notice        | Rollback id = 14000.
(3 rows)

-- rollback to Multi-2
select * from emaj.emaj_rollback_groups(array['myGroup1','myGroup2'],'Multi-2',false) order by 1,2;
 rlbk_severity |              rlbk_message              
---------------+----------------------------------------
 Notice        | 0 / 11 tables effectively processed.
 Notice        | 0 / 4 sequences effectively processed.
 Notice        | Rollback id = 14001.
(3 rows)

-- rollback and stop to Multi-1
select * from emaj.emaj_rollback_groups(array['myGroup1','myGroup2'],'Multi-1',false) order by 1,2;
 rlbk_severity |              rlbk_message              
---------------+----------------------------------------
 Notice        | 0 / 11 tables effectively processed.
 Notice        | 0 / 4 sequences effectively processed.
 Notice        | Rollback id = 14002.
(3 rows)

select emaj.emaj_stop_groups(array['myGroup1','myGroup2'],'Stop after rollback');
 emaj_stop_groups 
------------------
               15
(1 row)

-- try to start both groups, but with an old mark name
select emaj.emaj_start_groups(array['myGroup1','myGroup2'],'Multi-1', false);
WARNING:  _check_fk_groups: The foreign key "mytbl6_col61_fkey" on the table "myschema2.mytbl6" references the table "myschema2.mytbl7" that is outside the groups (myGroup1,myGroup2).
WARNING:  _check_fk_groups: The table "myschema2.mytbl6" is referenced by the foreign key "mytbl8_col81_fkey" on the table "myschema2.mytbl8" that is outside the groups (myGroup1,myGroup2).
ERROR:  _check_new_mark: The groups "myGroup1, myGroup2" already contain a mark named "Multi-1".
CONTEXT:  PL/pgSQL function emaj._check_new_mark(text[],text) line 31 at RAISE
SQL statement "SELECT emaj._check_new_mark(p_groupNames, p_mark)"
PL/pgSQL function emaj._start_groups(text[],text,boolean,boolean) line 46 at SQL statement
PL/pgSQL function emaj.emaj_start_groups(text[],text,boolean) line 11 at RETURN
-- really start both groups
select emaj.emaj_start_groups(array['myGroup1','myGroup2'],'Multi-1b', false);
WARNING:  _check_fk_groups: The foreign key "mytbl6_col61_fkey" on the table "myschema2.mytbl6" references the table "myschema2.mytbl7" that is outside the groups (myGroup1,myGroup2).
WARNING:  _check_fk_groups: The table "myschema2.mytbl6" is referenced by the foreign key "mytbl8_col81_fkey" on the table "myschema2.mytbl8" that is outside the groups (myGroup1,myGroup2).
 emaj_start_groups 
-------------------
                15
(1 row)

-- try to rollback several groups to an old common mark
select * from emaj.emaj_rollback_groups(array['myGroup1','myGroup2'],'Multi-1', false);
ERROR:  _check_mark_name: For the groups "myGroup1, myGroup2", the mark "Multi-1" was set before the latest group start.
CONTEXT:  PL/pgSQL function emaj._check_mark_name(text[],text,boolean) line 89 at RAISE
SQL statement "SELECT emaj._check_mark_name(p_groupNames := p_groupNames, p_mark := p_mark, p_checkActive := TRUE)"
PL/pgSQL function emaj._rlbk_check(text[],text,boolean,boolean) line 21 at SQL statement
SQL statement "SELECT emaj._rlbk_check(p_groupNames, p_mark, p_isAlterGroupAllowed, FALSE)"
PL/pgSQL function emaj._rlbk_init(text[],text,boolean,integer,boolean,boolean,text) line 25 at SQL statement
SQL statement "SELECT emaj._rlbk_init(p_groupNames, p_mark, p_isLoggedRlbk, 1, p_multiGroup, p_isAlterGroupAllowed, p_comment)"
PL/pgSQL function emaj._rlbk_groups(text[],text,boolean,boolean,boolean,text) line 26 at SQL statement
PL/pgSQL function emaj.emaj_rollback_groups(text[],text,boolean,text) line 8 at RETURN QUERY
-- set again a mark for both groups
select emaj.emaj_set_mark_groups(array['myGroup1','myGroup2'],'Multi-2');
 emaj_set_mark_groups 
----------------------
                   15
(1 row)

-- delete the mark for only 1 group and get detailed statistics for the other group
select emaj.emaj_delete_mark_group('myGroup1','Multi-2');
 emaj_delete_mark_group 
------------------------
                      1
(1 row)

-- use this mark for the other group before delete it
select * from emaj.emaj_detailed_log_stat_group('myGroup2','Multi-2',NULL);
 stat_group | stat_schema | stat_table | stat_first_mark | stat_first_mark_datetime | stat_first_time_id | stat_last_mark | stat_last_mark_datetime | stat_last_time_id | stat_role | stat_verb | stat_rows 
------------+-------------+------------+-----------------+--------------------------+--------------------+----------------+-------------------------+-------------------+-----------+-----------+-----------
(0 rows)

select stat_group, stat_schema, stat_sequence, stat_first_mark, stat_first_time_id, stat_last_mark, stat_last_time_id, stat_increments, stat_has_structure_changed
  from emaj.emaj_sequence_stat_group('myGroup2', 'Multi-2', NULL)
  order by stat_group, stat_schema, stat_sequence, stat_first_mark_datetime;
 stat_group | stat_schema |  stat_sequence   | stat_first_mark | stat_first_time_id | stat_last_mark | stat_last_time_id | stat_increments | stat_has_structure_changed 
------------+-------------+------------------+-----------------+--------------------+----------------+-------------------+-----------------+----------------------------
 myGroup2   | myschema2   | myTbl3_col31_seq | Multi-2         |              14010 |                |                   |               0 | f
 myGroup2   | myschema2   | myseq1           | Multi-2         |              14010 |                |                   |               0 | f
(2 rows)

select * from emaj.emaj_rollback_group('myGroup2','Multi-2',false) order by 1,2;
 rlbk_severity |              rlbk_message              
---------------+----------------------------------------
 Notice        | 0 / 2 sequences effectively processed.
 Notice        | 0 / 6 tables effectively processed.
 Notice        | Rollback id = 14003.
(3 rows)

select emaj.emaj_delete_mark_group('myGroup2','Multi-2');
 emaj_delete_mark_group 
------------------------
                      1
(1 row)

-- get statistics using old marks
select stat_group, stat_schema, stat_table, stat_first_mark, stat_first_time_id, stat_last_mark, stat_last_time_id, stat_role, stat_verb, stat_rows
  from emaj.emaj_detailed_log_stat_group('myGroup2','M1','M2');
 stat_group | stat_schema | stat_table | stat_first_mark | stat_first_time_id | stat_last_mark | stat_last_time_id | stat_role | stat_verb | stat_rows 
------------+-------------+------------+-----------------+--------------------+----------------+-------------------+-----------+-----------+-----------
 myGroup2   | myschema2   | myTbl3     | M1              |              12017 | M2             |             12300 | postgres  | INSERT    |        10
 myGroup2   | myschema2   | mytbl1     | M1              |              12017 | M2             |             12300 | postgres  | DELETE    |         1
 myGroup2   | myschema2   | mytbl1     | M1              |              12017 | M2             |             12300 | postgres  | INSERT    |        11
 myGroup2   | myschema2   | mytbl1     | M1              |              12017 | M2             |             12300 | postgres  | UPDATE    |         3
 myGroup2   | myschema2   | mytbl2     | M1              |              12017 | M2             |             12300 | postgres  | INSERT    |         2
 myGroup2   | myschema2   | mytbl5     | M1              |              12017 | M2             |             12300 | postgres  | INSERT    |         2
 myGroup2   | myschema2   | mytbl5     | M1              |              12017 | M2             |             12300 | postgres  | UPDATE    |         1
 myGroup2   | myschema2   | mytbl6     | M1              |              12017 | M2             |             12300 | postgres  | INSERT    |         8
 myGroup2   | myschema2   | mytbl6     | M1              |              12017 | M2             |             12300 | postgres  | UPDATE    |         3
(9 rows)

select stat_group, stat_schema, stat_sequence, stat_first_mark, stat_first_time_id, stat_last_mark, stat_last_time_id, stat_increments, stat_has_structure_changed
  from emaj.emaj_sequence_stat_group('myGroup2', 'M1', 'M2')
  order by stat_group, stat_schema, stat_sequence, stat_first_mark_datetime;
 stat_group | stat_schema |  stat_sequence   | stat_first_mark | stat_first_time_id | stat_last_mark | stat_last_time_id | stat_increments | stat_has_structure_changed 
------------+-------------+------------------+-----------------+--------------------+----------------+-------------------+-----------------+----------------------------
 myGroup2   | myschema2   | myTbl3_col31_seq | M1              |              12017 | M2             |             12300 |              10 | f
 myGroup2   | myschema2   | myseq1           | M1              |              12017 | M2             |             12300 |               1 | f
(2 rows)

-- delete intermediate old marks
select emaj.emaj_delete_mark_group('myGroup1','Multi-1');
 emaj_delete_mark_group 
------------------------
                      1
(1 row)

select emaj.emaj_delete_mark_group('myGroup2','Multi-1');
 emaj_delete_mark_group 
------------------------
                      1
(1 row)

-- ... and reuse mark names for parallel rollback test
select emaj.emaj_rename_mark_group('myGroup1','Multi-1b','Multi-1');
 emaj_rename_mark_group 
------------------------
 
(1 row)

select emaj.emaj_rename_mark_group('myGroup2','Multi-1b','Multi-1');
 emaj_rename_mark_group 
------------------------
 
(1 row)

-- rename an old mark
select emaj.emaj_rename_mark_group('myGroup2','M2','Deleted M2');
 emaj_rename_mark_group 
------------------------
 
(1 row)

-- use emaj_get_previous_mark_group and delete an initial old mark
select emaj.emaj_delete_before_mark_group('myGroup2',
      (select emaj.emaj_get_previous_mark_group('myGroup2',
             (select time_clock_timestamp from emaj.emaj_mark, emaj.emaj_time_stamp where time_id = mark_time_id and mark_group = 'myGroup2' and mark_group = 'myGroup2' and mark_name = 'M3')+'0.000001 SECOND'::interval)));
 emaj_delete_before_mark_group 
-------------------------------
                             2
(1 row)

-- comment an old mark
select emaj.emaj_comment_mark_group('myGroup2','M3','This mark is old');
 emaj_comment_mark_group 
-------------------------
 
(1 row)

-- try to get a rollback duration estimate on an old mark
select emaj.emaj_estimate_rollback_group('myGroup2','M3',TRUE);
ERROR:  _check_mark_name: For the group "myGroup2", the mark "M3" was set before the latest group start.
CONTEXT:  PL/pgSQL function emaj._check_mark_name(text[],text,boolean) line 85 at RAISE
SQL statement "SELECT emaj._check_mark_name(p_groupNames := p_groupNames, p_mark := p_mark, p_checkActive := TRUE)"
PL/pgSQL function emaj._rlbk_check(text[],text,boolean,boolean) line 21 at SQL statement
SQL statement "SELECT emaj._rlbk_check(p_groupNames, p_mark, TRUE, TRUE)"
PL/pgSQL function emaj._estimate_rollback_groups(text[],boolean,text,boolean) line 25 at SQL statement
PL/pgSQL function emaj.emaj_estimate_rollback_group(text,text,boolean) line 7 at RETURN
-- try to rollback on an old mark
select * from emaj.emaj_rollback_group('myGroup2','M3',false) order by 1,2;
ERROR:  _check_mark_name: For the group "myGroup2", the mark "M3" was set before the latest group start.
CONTEXT:  PL/pgSQL function emaj._check_mark_name(text[],text,boolean) line 85 at RAISE
SQL statement "SELECT emaj._check_mark_name(p_groupNames := p_groupNames, p_mark := p_mark, p_checkActive := TRUE)"
PL/pgSQL function emaj._rlbk_check(text[],text,boolean,boolean) line 21 at SQL statement
SQL statement "SELECT emaj._rlbk_check(p_groupNames, p_mark, p_isAlterGroupAllowed, FALSE)"
PL/pgSQL function emaj._rlbk_init(text[],text,boolean,integer,boolean,boolean,text) line 25 at SQL statement
SQL statement "SELECT emaj._rlbk_init(p_groupNames, p_mark, p_isLoggedRlbk, 1, p_multiGroup, p_isAlterGroupAllowed, p_comment)"
PL/pgSQL function emaj._rlbk_groups(text[],text,boolean,boolean,boolean,text) line 26 at SQL statement
PL/pgSQL function emaj.emaj_rollback_group(text,text,boolean,text) line 8 at RETURN QUERY
-----------------------------
-- Checking step 8
-----------------------------
-- emaj tables
select mark_group, regexp_replace(mark_name,E'\\d\\d\.\\d\\d\\.\\d\\d\\.\\d\\d\\d\\d','%','g'), mark_time_id, mark_is_rlbk_protected, mark_comment, mark_log_rows_before_next, mark_logged_rlbk_target_mark from emaj.emaj_mark order by mark_time_id, mark_group;
 mark_group |        regexp_replace        | mark_time_id | mark_is_rlbk_protected |                  mark_comment                  | mark_log_rows_before_next | mark_logged_rlbk_target_mark 
------------+------------------------------+--------------+------------------------+------------------------------------------------+---------------------------+------------------------------
 myGroup2   | M3                           |        12301 | f                      | This mark is old                               |                         0 | 
 myGroup1   | M4                           |        12501 | f                      |                                                |                        10 | 
 myGroup1   | M5                           |        12502 | f                      |                                                |                         3 | 
 myGroup1   | Before logged rollback to M4 |        12701 | f                      | Automatically set at rollback to mark M4 start |                        28 | 
 myGroup1   | STOP_%                       |        14000 | f                      |                                                |                         0 | 
 myGroup2   | STOP_%                       |        14000 | f                      |                                                |                         0 | 
 myGroup1   | Stop after rollback          |        14007 | f                      |                                                |                         0 | 
 myGroup2   | Stop after rollback          |        14007 | f                      |                                                |                         0 | 
 myGroup1   | Multi-1                      |        14009 | f                      |                                                |                           | 
 myGroup2   | Multi-1                      |        14009 | f                      |                                                |                           | 
(10 rows)

select sequ_schema, sequ_name, sequ_time_id, sequ_last_val, sequ_is_called from emaj.emaj_sequence order by sequ_time_id, sequ_schema, sequ_name;
 sequ_schema |     sequ_name     | sequ_time_id | sequ_last_val | sequ_is_called 
-------------+-------------------+--------------+---------------+----------------
 myschema2   | myTbl3_col31_seq  |        12301 |            20 | t
 myschema2   | myseq1            |        12301 |          1003 | t
 myschema1   | myTbl3_col31_seq  |        12501 |            20 | t
 myschema1   | mytbl2b_col20_seq |        12501 |             5 | t
 myschema1   | myTbl3_col31_seq  |        12502 |            20 | t
 myschema1   | mytbl2b_col20_seq |        12502 |             5 | t
 myschema1   | myTbl3_col31_seq  |        12701 |            20 | t
 myschema1   | mytbl2b_col20_seq |        12701 |             5 | t
 myschema1   | myTbl3_col31_seq  |        14000 |            20 | t
 myschema1   | mytbl2b_col20_seq |        14000 |             5 | t
 myschema2   | myTbl3_col31_seq  |        14000 |            20 | t
 myschema2   | myseq1            |        14000 |          1004 | f
 myschema1   | myTbl3_col31_seq  |        14001 |            20 | t
 myschema1   | mytbl2b_col20_seq |        14001 |             5 | t
 myschema2   | myTbl3_col31_seq  |        14001 |            20 | t
 myschema2   | myseq1            |        14001 |          1004 | f
 myschema1   | myTbl3_col31_seq  |        14007 |            20 | t
 myschema1   | mytbl2b_col20_seq |        14007 |             5 | t
 myschema2   | myTbl3_col31_seq  |        14007 |            20 | t
 myschema2   | myseq1            |        14007 |          1004 | f
 myschema1   | myTbl3_col31_seq  |        14009 |            20 | t
 myschema1   | mytbl2b_col20_seq |        14009 |             5 | t
 myschema2   | myTbl3_col31_seq  |        14009 |            20 | t
 myschema2   | myseq1            |        14009 |          1004 | f
(24 rows)

select tbl_schema, tbl_name, tbl_time_id, tbl_tuples, tbl_pages, tbl_log_seq_last_val from emaj.emaj_table order by tbl_time_id, tbl_schema, tbl_name;
 tbl_schema | tbl_name | tbl_time_id | tbl_tuples | tbl_pages | tbl_log_seq_last_val 
------------+----------+-------------+------------+-----------+----------------------
 myschema2  | myTbl3   |       12301 |          0 |         0 |                   10
 myschema2  | mytbl1   |       12301 |          0 |         0 |                   15
 myschema2  | mytbl2   |       12301 |          0 |         0 |                    2
 myschema2  | mytbl4   |       12301 |          0 |         0 |                    4
 myschema2  | mytbl5   |       12301 |          0 |         0 |                    4
 myschema2  | mytbl6   |       12301 |          1 |         1 |                   14
 myschema1  | myTbl3   |       12501 |          0 |         0 |                   10
 myschema1  | mytbl1   |       12501 |          0 |         0 |                   30
 myschema1  | mytbl2   |       12501 |          0 |         0 |                    3
 myschema1  | mytbl2b  |       12501 |          0 |         0 |                    3
 myschema1  | mytbl4   |       12501 |          0 |         0 |                    8
 myschema1  | myTbl3   |       12502 |          0 |         0 |                   20
 myschema1  | mytbl1   |       12502 |          0 |         0 |                   30
 myschema1  | mytbl2   |       12502 |          0 |         0 |                    3
 myschema1  | mytbl2b  |       12502 |          0 |         0 |                    3
 myschema1  | mytbl4   |       12502 |          0 |         0 |                    8
 myschema1  | myTbl3   |       12701 |          0 |         0 |                   20
 myschema1  | mytbl1   |       12701 |          0 |         0 |                   32
 myschema1  | mytbl2   |       12701 |          0 |         0 |                    3
 myschema1  | mytbl2b  |       12701 |          0 |         0 |                    3
 myschema1  | mytbl4   |       12701 |          0 |         0 |                   12
 myschema1  | myTbl3   |       14000 |          0 |         0 |                   45
 myschema1  | mytbl1   |       14000 |          0 |         0 |                   33
 myschema1  | mytbl2   |       14000 |          0 |         0 |                    3
 myschema1  | mytbl2b  |       14000 |          0 |         0 |                    3
 myschema1  | mytbl4   |       14000 |          0 |         0 |                   14
 myschema2  | myTbl3   |       14000 |          0 |         0 |                   10
 myschema2  | mytbl1   |       14000 |          0 |         0 |                   15
 myschema2  | mytbl2   |       14000 |          0 |         0 |                    2
 myschema2  | mytbl4   |       14000 |          2 |         1 |                   10
 myschema2  | mytbl5   |       14000 |          0 |         0 |                    7
 myschema2  | mytbl6   |       14000 |          1 |         1 |                   23
 myschema1  | myTbl3   |       14001 |          0 |         0 |                   45
 myschema1  | mytbl1   |       14001 |          0 |         0 |                   33
 myschema1  | mytbl2   |       14001 |          0 |         0 |                    3
 myschema1  | mytbl2b  |       14001 |          0 |         0 |                    3
 myschema1  | mytbl4   |       14001 |          0 |         0 |                   14
 myschema2  | myTbl3   |       14001 |          0 |         0 |                   10
 myschema2  | mytbl1   |       14001 |          0 |         0 |                   15
 myschema2  | mytbl2   |       14001 |          0 |         0 |                    2
 myschema2  | mytbl4   |       14001 |          2 |         1 |                   10
 myschema2  | mytbl5   |       14001 |          0 |         0 |                    7
 myschema2  | mytbl6   |       14001 |          1 |         1 |                   23
 myschema1  | myTbl3   |       14007 |          0 |         0 |                   45
 myschema1  | mytbl1   |       14007 |          0 |         0 |                   33
 myschema1  | mytbl2   |       14007 |          0 |         0 |                    3
 myschema1  | mytbl2b  |       14007 |          0 |         0 |                    3
 myschema1  | mytbl4   |       14007 |          0 |         0 |                   14
 myschema2  | myTbl3   |       14007 |          0 |         0 |                   10
 myschema2  | mytbl1   |       14007 |          0 |         0 |                   15
 myschema2  | mytbl2   |       14007 |          0 |         0 |                    2
 myschema2  | mytbl4   |       14007 |          2 |         1 |                   10
 myschema2  | mytbl5   |       14007 |          0 |         0 |                    7
 myschema2  | mytbl6   |       14007 |          1 |         1 |                   23
 myschema1  | myTbl3   |       14009 |          0 |         0 |                   45
 myschema1  | mytbl1   |       14009 |          0 |         0 |                   33
 myschema1  | mytbl2   |       14009 |          0 |         0 |                    3
 myschema1  | mytbl2b  |       14009 |          0 |         0 |                    3
 myschema1  | mytbl4   |       14009 |          0 |         0 |                   14
 myschema2  | myTbl3   |       14009 |          0 |         0 |                   10
 myschema2  | mytbl1   |       14009 |          0 |         0 |                   15
 myschema2  | mytbl2   |       14009 |          0 |         0 |                    2
 myschema2  | mytbl4   |       14009 |          2 |         1 |                   10
 myschema2  | mytbl5   |       14009 |          0 |         0 |                    7
 myschema2  | mytbl6   |       14009 |          1 |         1 |                   23
(65 rows)

select sqhl_schema, sqhl_table, sqhl_begin_time_id, sqhl_end_time_id, sqhl_hole_size from emaj.emaj_seq_hole order by 1,2,3;
 sqhl_schema | sqhl_table | sqhl_begin_time_id | sqhl_end_time_id | sqhl_hole_size 
-------------+------------+--------------------+------------------+----------------
 myschema1   | mytbl1     |              12502 |            12700 |              1
 myschema1   | mytbl4     |              12502 |            12700 |              2
 myschema2   | mytbl4     |              12301 |            12602 |              6
 myschema2   | mytbl5     |              12301 |            12602 |              3
 myschema2   | mytbl6     |              12301 |            12602 |              9
(5 rows)

select time_id, time_last_emaj_gid, time_event from emaj.emaj_time_stamp where time_id >= 14000 order by time_id;
 time_id | time_last_emaj_gid | time_event 
---------+--------------------+------------
   14000 |           14000000 | X
   14001 |           14000000 | S
   14002 |           14000000 | M
   14003 |           14000000 | R
   14004 |           14000000 | M
   14005 |           14000000 | R
   14006 |           14000000 | R
   14007 |           14000000 | X
   14009 |           14000000 | S
   14010 |           14000000 | M
   14011 |           14000000 | R
(11 rows)

select hist_function, hist_event, hist_object,
       regexp_replace(regexp_replace(regexp_replace(hist_wording,
            E'\\d\\d\.\\d\\d\\.\\d\\d\\.\\d\\d\\d\\d','%','g'),
            E'\\d\\d\\d\\d/\\d\\d\\/\\d\\d\\ \\d\\d\\:\\d\\d:\\d\\d .*?\\)','<timestamp>)','g'),
            E'\\[.+\\]','(timestamp)','g'), 
       hist_user
  from emaj.emaj_hist where hist_id >= 14000 order by hist_id;
      hist_function       |    hist_event     |         hist_object          |                                                             regexp_replace                                                             |     hist_user      
--------------------------+-------------------+------------------------------+----------------------------------------------------------------------------------------------------------------------------------------+--------------------
 IMPORT_PARAMETERS        | BEGIN             |                              |                                                                                                                                        | _regress_emaj_adm1
                          | UPDATED PARAMETER | dblink_user_password         | <masked data>                                                                                                                          | _regress_emaj_adm1
                          | UPDATED PARAMETER | alter_log_table              | ADD COLUMN emaj_user_ip INET DEFAULT inet_client_addr(), ADD COLUMN extra_col_appname TEXT DEFAULT current_setting('application_name') | _regress_emaj_adm1
                          | UPDATED PARAMETER | fixed_step_rollback_duration | @ 0.0025 secs                                                                                                                          | _regress_emaj_adm1
 IMPORT_PARAMETERS        | END               |                              | 3 parameters imported                                                                                                                  | _regress_emaj_adm1
 STOP_GROUPS              | BEGIN             | myGroup1,myGroup2            |                                                                                                                                        | _regress_emaj_adm1
 STOP_GROUPS              | TIME STAMP SET    | 14000                        |                                                                                                                                        | _regress_emaj_adm1
 LOCK_GROUPS              | BEGIN             | myGroup1,myGroup2            |                                                                                                                                        | _regress_emaj_adm1
 LOCK_GROUPS              | END               | myGroup1,myGroup2            | 11 tables locked, 0 deadlock(s)                                                                                                        | _regress_emaj_adm1
 SET_MARK_GROUPS          | BEGIN             | myGroup1,myGroup2            | STOP_%                                                                                                                                 | _regress_emaj_adm1
 CLEANUP_RLBK_STATE       |                   | Rollback id 12701            | set to COMMITTED                                                                                                                       | _regress_emaj_adm1
 SET_MARK_GROUPS          | END               | myGroup1,myGroup2            | STOP_%                                                                                                                                 | _regress_emaj_adm1
 STOP_GROUPS              | END               | myGroup1,myGroup2            | 15 tables/sequences processed                                                                                                          | _regress_emaj_adm1
 START_GROUPS             | BEGIN             | myGroup1,myGroup2            | Without log reset                                                                                                                      | _regress_emaj_adm1
 START_GROUPS             | TIME STAMP SET    | 14001                        |                                                                                                                                        | _regress_emaj_adm1
 LOCK_GROUPS              | BEGIN             | myGroup1,myGroup2            |                                                                                                                                        | _regress_emaj_adm1
 LOCK_GROUPS              | END               | myGroup1,myGroup2            | 11 tables locked, 0 deadlock(s)                                                                                                        | _regress_emaj_adm1
 SET_MARK_GROUPS          | BEGIN             | myGroup1,myGroup2            | Multi-1                                                                                                                                | _regress_emaj_adm1
 SET_MARK_GROUPS          | END               | myGroup1,myGroup2            | Multi-1                                                                                                                                | _regress_emaj_adm1
 START_GROUPS             | END               | myGroup1,myGroup2            | 15 tables/sequences processed                                                                                                          | _regress_emaj_adm1
 SET_MARK_GROUPS          | BEGIN             | myGroup1,myGroup2            | Multi-2                                                                                                                                | _regress_emaj_adm1
 LOCK_GROUPS              | BEGIN             | myGroup1,myGroup2            |                                                                                                                                        | _regress_emaj_adm1
 LOCK_GROUPS              | END               | myGroup1,myGroup2            | 11 tables locked, 0 deadlock(s)                                                                                                        | _regress_emaj_adm1
 SET_MARK_GROUPS          | TIME STAMP SET    | 14002                        |                                                                                                                                        | _regress_emaj_adm1
 SET_MARK_GROUPS          | END               | myGroup1,myGroup2            | Multi-2                                                                                                                                | _regress_emaj_adm1
 ROLLBACK_GROUPS          | BEGIN             | myGroup1,myGroup2            | Logged rollback to mark Multi-1 (timestamp)                                                                                            | _regress_emaj_adm1
 DBLINK_OPEN_CNX          |                   | rlbk#1                       | Status = 1                                                                                                                             | _regress_emaj_adm1
 LOCK_GROUP               | BEGIN             | myGroup1,myGroup2            | Rollback session #1                                                                                                                    | _regress_emaj_adm1
 LOCK_GROUP               | END               | myGroup1,myGroup2            | Rollback session #1: 11 tables locked, 0 deadlock(s)                                                                                   | _regress_emaj_adm1
 ROLLBACK_GROUPS          | TIME STAMP SET    | 14003                        |                                                                                                                                        | _regress_emaj_adm1
 SET_MARK_GROUPS          | BEGIN             | myGroup1,myGroup2            | RLBK_14000_START                                                                                                                       | _regress_emaj_adm1
 SET_MARK_GROUPS          | END               | myGroup1,myGroup2            | RLBK_14000_START                                                                                                                       | _regress_emaj_adm1
 ROLLBACK_GROUPS          | TIME STAMP SET    | 14004                        |                                                                                                                                        | _regress_emaj_adm1
 SET_MARK_GROUPS          | BEGIN             | myGroup1,myGroup2            | RLBK_14000_DONE                                                                                                                        | _regress_emaj_adm1
 SET_MARK_GROUPS          | END               | myGroup1,myGroup2            | RLBK_14000_DONE                                                                                                                        | _regress_emaj_adm1
 ROLLBACK_GROUPS          | NOTICE            | Rollback id 14000            | Rollback id = 14000.                                                                                                                   | _regress_emaj_adm1
 ROLLBACK_GROUPS          | NOTICE            | Rollback id 14000            | 0 / 11 tables effectively processed.                                                                                                   | _regress_emaj_adm1
 ROLLBACK_GROUPS          | NOTICE            | Rollback id 14000            | 0 / 4 sequences effectively processed.                                                                                                 | _regress_emaj_adm1
 DBLINK_CLOSE_CNX         |                   | rlbk#1                       |                                                                                                                                        | _regress_emaj_adm1
 ROLLBACK_GROUPS          | END               | myGroup1,myGroup2            | Rollback_id 14000                                                                                                                      | _regress_emaj_adm1
 ROLLBACK_GROUPS          | BEGIN             | myGroup1,myGroup2            | Unlogged rollback to mark Multi-2 (timestamp)                                                                                          | _regress_emaj_adm1
 DBLINK_OPEN_CNX          |                   | rlbk#1                       | Status = 1                                                                                                                             | _regress_emaj_adm1
 LOCK_GROUP               | BEGIN             | myGroup1,myGroup2            | Rollback session #1                                                                                                                    | _regress_emaj_adm1
 LOCK_GROUP               | END               | myGroup1,myGroup2            | Rollback session #1: 11 tables locked, 0 deadlock(s)                                                                                   | _regress_emaj_adm1
 ROLLBACK_GROUPS          | TIME STAMP SET    | 14005                        |                                                                                                                                        | _regress_emaj_adm1
 ROLLBACK_GROUPS          | MARK DELETED      | myGroup1                     | mark RLBK_14000_START is deleted                                                                                                       | _regress_emaj_adm1
 ROLLBACK_GROUPS          | MARK DELETED      | myGroup2                     | mark RLBK_14000_START is deleted                                                                                                       | _regress_emaj_adm1
 ROLLBACK_GROUPS          | MARK DELETED      | myGroup1                     | mark RLBK_14000_DONE is deleted                                                                                                        | _regress_emaj_adm1
 ROLLBACK_GROUPS          | MARK DELETED      | myGroup2                     | mark RLBK_14000_DONE is deleted                                                                                                        | _regress_emaj_adm1
 ROLLBACK_GROUPS          | NOTICE            | Rollback id 14001            | Rollback id = 14001.                                                                                                                   | _regress_emaj_adm1
 ROLLBACK_GROUPS          | NOTICE            | Rollback id 14001            | 0 / 11 tables effectively processed.                                                                                                   | _regress_emaj_adm1
 ROLLBACK_GROUPS          | NOTICE            | Rollback id 14001            | 0 / 4 sequences effectively processed.                                                                                                 | _regress_emaj_adm1
 DBLINK_CLOSE_CNX         |                   | rlbk#1                       |                                                                                                                                        | _regress_emaj_adm1
 ROLLBACK_GROUPS          | END               | myGroup1,myGroup2            | Rollback_id 14001                                                                                                                      | _regress_emaj_adm1
 ROLLBACK_GROUPS          | BEGIN             | myGroup1,myGroup2            | Unlogged rollback to mark Multi-1 (timestamp)                                                                                          | _regress_emaj_adm1
 DBLINK_OPEN_CNX          |                   | rlbk#1                       | Status = 1                                                                                                                             | _regress_emaj_adm1
 LOCK_GROUP               | BEGIN             | myGroup1,myGroup2            | Rollback session #1                                                                                                                    | _regress_emaj_adm1
 LOCK_GROUP               | END               | myGroup1,myGroup2            | Rollback session #1: 11 tables locked, 0 deadlock(s)                                                                                   | _regress_emaj_adm1
 ROLLBACK_GROUPS          | TIME STAMP SET    | 14006                        |                                                                                                                                        | _regress_emaj_adm1
 ROLLBACK_GROUPS          | MARK DELETED      | myGroup1                     | mark Multi-2 is deleted                                                                                                                | _regress_emaj_adm1
 ROLLBACK_GROUPS          | MARK DELETED      | myGroup2                     | mark Multi-2 is deleted                                                                                                                | _regress_emaj_adm1
 ROLLBACK_GROUPS          | NOTICE            | Rollback id 14002            | Rollback id = 14002.                                                                                                                   | _regress_emaj_adm1
 ROLLBACK_GROUPS          | NOTICE            | Rollback id 14002            | 0 / 11 tables effectively processed.                                                                                                   | _regress_emaj_adm1
 ROLLBACK_GROUPS          | NOTICE            | Rollback id 14002            | 0 / 4 sequences effectively processed.                                                                                                 | _regress_emaj_adm1
 DBLINK_CLOSE_CNX         |                   | rlbk#1                       |                                                                                                                                        | _regress_emaj_adm1
 ROLLBACK_GROUPS          | END               | myGroup1,myGroup2            | Rollback_id 14002                                                                                                                      | _regress_emaj_adm1
 STOP_GROUPS              | BEGIN             | myGroup1,myGroup2            |                                                                                                                                        | _regress_emaj_adm1
 STOP_GROUPS              | TIME STAMP SET    | 14007                        |                                                                                                                                        | _regress_emaj_adm1
 LOCK_GROUPS              | BEGIN             | myGroup1,myGroup2            |                                                                                                                                        | _regress_emaj_adm1
 LOCK_GROUPS              | END               | myGroup1,myGroup2            | 11 tables locked, 0 deadlock(s)                                                                                                        | _regress_emaj_adm1
 SET_MARK_GROUPS          | BEGIN             | myGroup1,myGroup2            | Stop after rollback                                                                                                                    | _regress_emaj_adm1
 CLEANUP_RLBK_STATE       |                   | Rollback id 14000            | set to COMMITTED                                                                                                                       | _regress_emaj_adm1
 CLEANUP_RLBK_STATE       |                   | Rollback id 14001            | set to COMMITTED                                                                                                                       | _regress_emaj_adm1
 CLEANUP_RLBK_STATE       |                   | Rollback id 14002            | set to COMMITTED                                                                                                                       | _regress_emaj_adm1
 SET_MARK_GROUPS          | END               | myGroup1,myGroup2            | Stop after rollback                                                                                                                    | _regress_emaj_adm1
 STOP_GROUPS              | END               | myGroup1,myGroup2            | 15 tables/sequences processed                                                                                                          | _regress_emaj_adm1
 START_GROUPS             | BEGIN             | myGroup1,myGroup2            | Without log reset                                                                                                                      | _regress_emaj_adm1
 START_GROUPS             | TIME STAMP SET    | 14009                        |                                                                                                                                        | _regress_emaj_adm1
 LOCK_GROUPS              | BEGIN             | myGroup1,myGroup2            |                                                                                                                                        | _regress_emaj_adm1
 LOCK_GROUPS              | END               | myGroup1,myGroup2            | 11 tables locked, 0 deadlock(s)                                                                                                        | _regress_emaj_adm1
 SET_MARK_GROUPS          | BEGIN             | myGroup1,myGroup2            | Multi-1b                                                                                                                               | _regress_emaj_adm1
 SET_MARK_GROUPS          | END               | myGroup1,myGroup2            | Multi-1b                                                                                                                               | _regress_emaj_adm1
 START_GROUPS             | END               | myGroup1,myGroup2            | 15 tables/sequences processed                                                                                                          | _regress_emaj_adm1
 SET_MARK_GROUPS          | BEGIN             | myGroup1,myGroup2            | Multi-2                                                                                                                                | _regress_emaj_adm1
 LOCK_GROUPS              | BEGIN             | myGroup1,myGroup2            |                                                                                                                                        | _regress_emaj_adm1
 LOCK_GROUPS              | END               | myGroup1,myGroup2            | 11 tables locked, 0 deadlock(s)                                                                                                        | _regress_emaj_adm1
 SET_MARK_GROUPS          | TIME STAMP SET    | 14010                        |                                                                                                                                        | _regress_emaj_adm1
 SET_MARK_GROUPS          | END               | myGroup1,myGroup2            | Multi-2                                                                                                                                | _regress_emaj_adm1
 DELETE_MARK_GROUP        | BEGIN             | myGroup1                     | Multi-2                                                                                                                                | _regress_emaj_adm1
 DELETE_MARK_GROUP        | END               | myGroup1                     | Multi-2                                                                                                                                | _regress_emaj_adm1
 ROLLBACK_GROUP           | BEGIN             | myGroup2                     | Unlogged rollback to mark Multi-2 (timestamp)                                                                                          | _regress_emaj_adm1
 DBLINK_OPEN_CNX          |                   | rlbk#1                       | Status = 1                                                                                                                             | _regress_emaj_adm1
 LOCK_GROUP               | BEGIN             | myGroup2                     | Rollback session #1                                                                                                                    | _regress_emaj_adm1
 LOCK_GROUP               | END               | myGroup2                     | Rollback session #1: 6 tables locked, 0 deadlock(s)                                                                                    | _regress_emaj_adm1
 ROLLBACK_GROUP           | TIME STAMP SET    | 14011                        |                                                                                                                                        | _regress_emaj_adm1
 ROLLBACK_GROUP           | NOTICE            | Rollback id 14003            | Rollback id = 14003.                                                                                                                   | _regress_emaj_adm1
 ROLLBACK_GROUP           | NOTICE            | Rollback id 14003            | 0 / 6 tables effectively processed.                                                                                                    | _regress_emaj_adm1
 ROLLBACK_GROUP           | NOTICE            | Rollback id 14003            | 0 / 2 sequences effectively processed.                                                                                                 | _regress_emaj_adm1
 DBLINK_CLOSE_CNX         |                   | rlbk#1                       |                                                                                                                                        | _regress_emaj_adm1
 ROLLBACK_GROUP           | END               | myGroup2                     | Rollback_id 14003                                                                                                                      | _regress_emaj_adm1
 DELETE_MARK_GROUP        | BEGIN             | myGroup2                     | Multi-2                                                                                                                                | _regress_emaj_adm1
 DELETE_MARK_GROUP        | END               | myGroup2                     | Multi-2                                                                                                                                | _regress_emaj_adm1
 DELETE_MARK_GROUP        | BEGIN             | myGroup1                     | Multi-1                                                                                                                                | _regress_emaj_adm1
 DELETE_MARK_GROUP        | END               | myGroup1                     | Multi-1                                                                                                                                | _regress_emaj_adm1
 DELETE_MARK_GROUP        | BEGIN             | myGroup2                     | Multi-1                                                                                                                                | _regress_emaj_adm1
 DELETE_MARK_GROUP        | END               | myGroup2                     | Multi-1                                                                                                                                | _regress_emaj_adm1
 RENAME_MARK_GROUP        | BEGIN             | myGroup1                     | Multi-1b                                                                                                                               | _regress_emaj_adm1
 RENAME_MARK_GROUP        | END               | myGroup1                     | Multi-1b renamed Multi-1                                                                                                               | _regress_emaj_adm1
 RENAME_MARK_GROUP        | BEGIN             | myGroup2                     | Multi-1b                                                                                                                               | _regress_emaj_adm1
 RENAME_MARK_GROUP        | END               | myGroup2                     | Multi-1b renamed Multi-1                                                                                                               | _regress_emaj_adm1
 RENAME_MARK_GROUP        | BEGIN             | myGroup2                     | M2                                                                                                                                     | _regress_emaj_adm1
 RENAME_MARK_GROUP        | END               | myGroup2                     | M2 renamed Deleted M2                                                                                                                  | _regress_emaj_adm1
 DELETE_BEFORE_MARK_GROUP | BEGIN             | myGroup2                     | M3                                                                                                                                     | _regress_emaj_adm1
 DELETE_BEFORE_MARK_GROUP | END               | myGroup2                     | 2 marks deleted ; M3 is now the initial mark                                                                                           | _regress_emaj_adm1
 COMMENT_MARK_GROUP       |                   | myGroup2                     | Mark M3                                                                                                                                | _regress_emaj_adm1
(115 rows)

-- log tables
reset session_authorization;
select col11, col12, col13, emaj_verb, emaj_tuple, emaj_gid from emaj_mySchema1.myTbl1_log order by emaj_gid, emaj_tuple desc;
 col11 |   col12    | col13 | emaj_verb | emaj_tuple | emaj_gid 
-------+------------+-------+-----------+------------+----------
     1 | Step 6     | \x01  | INS       | NEW        | 12700004
     1 | Step 6     | \x01  | DEL       | OLD        | 12700029
(2 rows)

select col21, col22, col23, emaj_verb, emaj_tuple, emaj_gid from emaj_mySchema1.myTbl2_log order by emaj_gid, emaj_tuple desc;
 col21 | col22 | col23 | emaj_verb | emaj_tuple | emaj_gid 
-------+-------+-------+-----------+------------+----------
(0 rows)

select col20, col21, col22, col23, col24, emaj_verb, emaj_tuple, emaj_gid from emaj_mySchema1.myTbl2b_log order by emaj_gid, emaj_tuple desc;
 col20 | col21 | col22 | col23 | col24 | emaj_verb | emaj_tuple | emaj_gid 
-------+-------+-------+-------+-------+-----------+------------+----------
(0 rows)

select col31, col33, emaj_verb, emaj_tuple, emaj_gid from emaj_myschema1."myTbl3_log" order by emaj_gid, emaj_tuple desc;
 col31 | col33 | emaj_verb | emaj_tuple | emaj_gid 
-------+-------+-----------+------------+----------
    11 | 10.00 | UPD       | OLD        | 12500015
    11 |  5.00 | UPD       | NEW        | 12500015
    12 | 10.00 | UPD       | OLD        | 12500016
    12 |  5.00 | UPD       | NEW        | 12500016
    13 | 10.00 | UPD       | OLD        | 12500017
    13 |  5.00 | UPD       | NEW        | 12500017
    14 | 10.00 | UPD       | OLD        | 12500018
    14 |  5.00 | UPD       | NEW        | 12500018
    15 | 10.00 | UPD       | OLD        | 12500019
    15 |  5.00 | UPD       | NEW        | 12500019
    16 | 10.00 | UPD       | OLD        | 12500020
    16 |  5.00 | UPD       | NEW        | 12500020
    17 | 10.00 | UPD       | OLD        | 12500021
    17 |  5.00 | UPD       | NEW        | 12500021
    18 | 10.00 | UPD       | OLD        | 12500022
    18 |  5.00 | UPD       | NEW        | 12500022
    19 | 10.00 | UPD       | OLD        | 12500023
    19 |  5.00 | UPD       | NEW        | 12500023
    20 | 10.00 | UPD       | OLD        | 12500024
    20 |  5.00 | UPD       | NEW        | 12500024
    11 |  5.00 | DEL       | OLD        | 12700007
    12 |  5.00 | DEL       | OLD        | 12700008
    13 |  5.00 | DEL       | OLD        | 12700009
    14 |  5.00 | DEL       | OLD        | 12700010
    15 |  5.00 | DEL       | OLD        | 12700011
    16 |  5.00 | DEL       | OLD        | 12700012
    17 |  5.00 | DEL       | OLD        | 12700013
    18 |  5.00 | DEL       | OLD        | 12700014
    19 |  5.00 | DEL       | OLD        | 12700015
    20 |  5.00 | DEL       | OLD        | 12700016
    11 | 10.00 | INS       | NEW        | 12700017
    12 | 10.00 | INS       | NEW        | 12700018
    13 | 10.00 | INS       | NEW        | 12700019
    14 | 10.00 | INS       | NEW        | 12700020
    15 | 10.00 | INS       | NEW        | 12700021
    16 | 10.00 | INS       | NEW        | 12700022
    17 | 10.00 | INS       | NEW        | 12700023
    18 | 10.00 | INS       | NEW        | 12700024
    19 | 10.00 | INS       | NEW        | 12700025
    20 | 10.00 | INS       | NEW        | 12700026
    14 | 10.00 | DEL       | OLD        | 12800001
    15 | 10.00 | DEL       | OLD        | 12800002
    16 | 10.00 | DEL       | OLD        | 12800003
    17 | 10.00 | DEL       | OLD        | 12800004
    18 | 10.00 | DEL       | OLD        | 12800005
(45 rows)

select col41, col42, col43, col44, col45, emaj_verb, emaj_tuple, emaj_gid from emaj_mySchema1.myTbl4_log order by emaj_gid, emaj_tuple desc;
 col41 | col42 | col43 | col44 | col45  | emaj_verb | emaj_tuple | emaj_gid 
-------+-------+-------+-------+--------+-----------+------------+----------
    11 |       |     1 |     1 | Step 6 | INS       | NEW        | 12700005
    12 |       |     1 |     1 | Step 6 | INS       | NEW        | 12700006
    11 |       |     1 |     1 | Step 6 | DEL       | OLD        | 12700027
    12 |       |     1 |     1 | Step 6 | DEL       | OLD        | 12700028
(4 rows)

select col11, col12, col13, emaj_verb, emaj_tuple, emaj_gid from emaj_mySchema2.myTbl1_log order by emaj_gid, emaj_tuple desc;
 col11 | col12 | col13 | emaj_verb | emaj_tuple | emaj_gid 
-------+-------+-------+-----------+------------+----------
(0 rows)

select col21, col22, col23, emaj_verb, emaj_tuple, emaj_gid from emaj_mySchema2.myTbl2_log order by emaj_gid, emaj_tuple desc;
 col21 | col22 | col23 | emaj_verb | emaj_tuple | emaj_gid 
-------+-------+-------+-----------+------------+----------
(0 rows)

select col31, col33, emaj_verb, emaj_tuple, emaj_gid from emaj_myschema2."myTbl3_log" order by emaj_gid, emaj_tuple desc;
 col31 | col33 | emaj_verb | emaj_tuple | emaj_gid 
-------+-------+-----------+------------+----------
(0 rows)

select col41, col42, col43, col44, col45, emaj_verb, emaj_tuple, emaj_gid from emaj_myschema2.mytbl4_log order by emaj_gid, emaj_tuple desc;
 col41 | col42 | col43 | col44 | col45 | emaj_verb | emaj_tuple | emaj_gid 
-------+-------+-------+-------+-------+-----------+------------+----------
(0 rows)

select col51, col52, col53, col54, col55, col56, col57, col58, emaj_verb, emaj_tuple, emaj_gid from emaj_myschema2.mytbl5_log order by emaj_gid, emaj_tuple desc;
 col51 | col52 | col53 | col54 | col55 | col56 | col57 | col58 | emaj_verb | emaj_tuple | emaj_gid 
-------+-------+-------+-------+-------+-------+-------+-------+-----------+------------+----------
(0 rows)

select col61, col62, col63, col64, col65, col66, emaj_verb, emaj_tuple, emaj_gid from emaj_mySchema2.myTbl6_log order by emaj_gid, emaj_tuple desc;
 col61 | col62 | col63 | col64 | col65 | col66 | emaj_verb | emaj_tuple | emaj_gid 
-------+-------+-------+-------+-------+-------+-----------+------------+----------
(0 rows)

-- set sequence restart value
select public.handle_emaj_sequences(14200);
 handle_emaj_sequences 
-----------------------
 
(1 row)

-----------------------------
-- Step 9 : for phil''s group#3", recreate the group as rollbackable, update tables, 
--          rename a mark, then delete 2 marks then delete all before a mark 
-----------------------------
-- prepare phil's group#3, group
--
reset session_authorization;
alter table "phil's schema""3"."myTbl2\" add primary key (col21);
set session_authorization to _regress_emaj_adm2;
select emaj.emaj_create_group('phil''s group#3",');
 emaj_create_group 
-------------------
                 1
(1 row)

select emaj.emaj_assign_tables('phil''s schema"3','.*','my"tbl4','phil''s group#3",');
 emaj_assign_tables 
--------------------
                  2
(1 row)

select emaj.emaj_assign_sequences('phil''s schema"3','.*',null,'phil''s group#3",');
 emaj_assign_sequences 
-----------------------
                     2
(1 row)

select emaj.emaj_start_group('phil''s group#3",','M1_rollbackable');
WARNING:  _check_fk_groups: The foreign key "mytbl2_col21_fkey" on the table "phil's schema"3.myTbl2\" references the table "phil's schema"3.my"tbl4" that is outside the groups (phil's group#3",).
WARNING:  _check_fk_groups: The table "phil's schema"3.phil's tbl1" is referenced by the foreign key "my"tbl4_col44_fkey" on the table "phil's schema"3.my"tbl4" that is outside the groups (phil's group#3",).
 emaj_start_group 
------------------
                4
(1 row)

--
reset session_authorization;
set search_path=public,"phil's schema""3";
--
insert into "phil's tbl1" select i, 'AB''C', E'\\014'::bytea from generate_series (1,31) as i;
update "phil's tbl1" set "phil\s""col13" = E'\\034'::bytea where "phil's col11" <= 3;
update "phil's tbl1" set "phil\s""col13" = E'\\034'''::bytea where "phil's col11" between 18 and 22;
insert into "my""tbl4" (col41) values (1);
insert into "my""tbl4" (col41) values (2);
insert into "myTbl2\" values (1,'ABC','2010-12-31');
delete from "phil's tbl1" where "phil's col11" > 20;
insert into "myTbl2\" values (2,'DEF',NULL);
select nextval(E'"phil''s schema""3"."phil''s""seq\\1"');
 nextval 
---------
    1000
(1 row)

--
set session_authorization to _regress_emaj_adm2;
select emaj.emaj_set_mark_group('phil''s group#3",','M2_rollbackable');
 emaj_set_mark_group 
---------------------
                   4
(1 row)

select emaj.emaj_set_mark_group('phil''s group#3",','M2_again!');
 emaj_set_mark_group 
---------------------
                   4
(1 row)

--
reset session_authorization;
delete from "phil's tbl1" where "phil's col11" = 10;
update "phil's tbl1" set "phil's col12" = 'DEF' where "phil's col11" <= 2;
select nextval(E'"phil''s schema""3"."phil''s""seq\\1"');
 nextval 
---------
    1001
(1 row)

--
set session_authorization to _regress_emaj_adm2;
select emaj.emaj_set_mark_groups(array['phil''s group#3",'],'phil''s mark #1','Third mark set');
 emaj_set_mark_groups 
----------------------
                    4
(1 row)

--
select emaj.emaj_rename_mark_group('phil''s group#3",','phil''s mark #1','phil''s mark #3');
 emaj_rename_mark_group 
------------------------
 
(1 row)

-- 
select emaj.emaj_delete_mark_group('phil''s group#3",','M2_again!');
 emaj_delete_mark_group 
------------------------
                      1
(1 row)

--
select stat_group, stat_schema, stat_table, stat_first_mark, stat_first_time_id, stat_last_mark, stat_last_time_id, stat_rows from emaj.emaj_log_stat_group('phil''s group#3",','M1_rollbackable','');
    stat_group    |   stat_schema   | stat_table  | stat_first_mark | stat_first_time_id | stat_last_mark | stat_last_time_id | stat_rows 
------------------+-----------------+-------------+-----------------+--------------------+----------------+-------------------+-----------
 phil's group#3", | phil's schema"3 | myTbl2\     | M1_rollbackable |              14203 |                |                   |         2
 phil's group#3", | phil's schema"3 | phil's tbl1 | M1_rollbackable |              14203 |                |                   |        53
(2 rows)

select stat_group, stat_schema, stat_table, stat_first_mark, stat_first_time_id, stat_last_mark, stat_last_time_id, stat_role, stat_verb, stat_rows
  from emaj.emaj_detailed_log_stat_group('phil''s group#3",','phil''s mark #3','');
 stat_group | stat_schema | stat_table | stat_first_mark | stat_first_time_id | stat_last_mark | stat_last_time_id | stat_role | stat_verb | stat_rows 
------------+-------------+------------+-----------------+--------------------+----------------+-------------------+-----------+-----------+-----------
(0 rows)

select stat_group, stat_first_mark, stat_is_log_start, stat_last_mark, stat_is_log_stop, stat_changes, stat_rollbacks
  from emaj.emaj_log_stat_table('phil''s schema"3', 'phil''s tbl1');
    stat_group    | stat_first_mark | stat_is_log_start | stat_last_mark  | stat_is_log_stop | stat_changes | stat_rollbacks 
------------------+-----------------+-------------------+-----------------+------------------+--------------+----------------
 phil's group#3", | M1_rollbackable | t                 | M2_rollbackable | f                |           50 |              0
 phil's group#3", | M2_rollbackable | f                 | phil's mark #3  | f                |            3 |              0
 phil's group#3", | phil's mark #3  | f                 | [current state] | f                |            0 |              0
(3 rows)

select stat_group, stat_first_mark, stat_is_log_start, stat_last_mark, stat_is_log_stop, stat_increments, stat_has_structure_changed, stat_rollbacks
  from emaj.emaj_log_stat_sequence('phil''s schema"3', 'phil''s"seq\1');
    stat_group    | stat_first_mark | stat_is_log_start | stat_last_mark  | stat_is_log_stop | stat_increments | stat_has_structure_changed | stat_rollbacks 
------------------+-----------------+-------------------+-----------------+------------------+-----------------+----------------------------+----------------
 phil's group#3", | M1_rollbackable | t                 | M2_rollbackable | f                |               1 | f                          |              0
 phil's group#3", | M2_rollbackable | f                 | phil's mark #3  | f                |               1 | f                          |              0
 phil's group#3", | phil's mark #3  | f                 | [current state] | f                |               0 | f                          |              0
(3 rows)

--
select * from emaj.emaj_logged_rollback_group('phil''s group#3",','phil''s mark #3',false) order by 1,2;
 rlbk_severity |              rlbk_message              
---------------+----------------------------------------
 Notice        | 0 / 2 sequences effectively processed.
 Notice        | 0 / 2 tables effectively processed.
 Notice        | Rollback id = 14200.
(3 rows)

select * from emaj.emaj_rollback_group('phil''s group#3",','phil''s mark #3',false) order by 1,2;
 rlbk_severity |              rlbk_message              
---------------+----------------------------------------
 Notice        | 0 / 2 sequences effectively processed.
 Notice        | 0 / 2 tables effectively processed.
 Notice        | Rollback id = 14201.
(3 rows)

-----------------------------
-- Checking step 9
-----------------------------
-- emaj tables
select mark_group, regexp_replace(mark_name,E'\\d\\d\.\\d\\d\\.\\d\\d\\.\\d\\d\\d\\d','%','g'), mark_time_id, mark_is_rlbk_protected, mark_comment, mark_log_rows_before_next, mark_logged_rlbk_target_mark from emaj.emaj_mark order by mark_time_id, mark_group;
    mark_group    |        regexp_replace        | mark_time_id | mark_is_rlbk_protected |                  mark_comment                  | mark_log_rows_before_next | mark_logged_rlbk_target_mark 
------------------+------------------------------+--------------+------------------------+------------------------------------------------+---------------------------+------------------------------
 myGroup2         | M3                           |        12301 | f                      | This mark is old                               |                         0 | 
 myGroup1         | M4                           |        12501 | f                      |                                                |                        10 | 
 myGroup1         | M5                           |        12502 | f                      |                                                |                         3 | 
 myGroup1         | Before logged rollback to M4 |        12701 | f                      | Automatically set at rollback to mark M4 start |                        28 | 
 myGroup1         | STOP_%                       |        14000 | f                      |                                                |                         0 | 
 myGroup2         | STOP_%                       |        14000 | f                      |                                                |                         0 | 
 myGroup1         | Stop after rollback          |        14007 | f                      |                                                |                         0 | 
 myGroup2         | Stop after rollback          |        14007 | f                      |                                                |                         0 | 
 myGroup1         | Multi-1                      |        14009 | f                      |                                                |                           | 
 myGroup2         | Multi-1                      |        14009 | f                      |                                                |                           | 
 phil's group#3", | M1_rollbackable              |        14203 | f                      |                                                |                        52 | 
 phil's group#3", | M2_rollbackable              |        14204 | f                      |                                                |                         3 | 
 phil's group#3", | phil's mark #3               |        14206 | f                      | Third mark set                                 |                           | 
(13 rows)

select sequ_schema, sequ_name, sequ_time_id, sequ_last_val, sequ_is_called from emaj.emaj_sequence order by sequ_time_id, sequ_schema, sequ_name;
   sequ_schema   |     sequ_name     | sequ_time_id | sequ_last_val | sequ_is_called 
-----------------+-------------------+--------------+---------------+----------------
 myschema2       | myTbl3_col31_seq  |        12301 |            20 | t
 myschema2       | myseq1            |        12301 |          1003 | t
 myschema1       | myTbl3_col31_seq  |        12501 |            20 | t
 myschema1       | mytbl2b_col20_seq |        12501 |             5 | t
 myschema1       | myTbl3_col31_seq  |        12502 |            20 | t
 myschema1       | mytbl2b_col20_seq |        12502 |             5 | t
 myschema1       | myTbl3_col31_seq  |        12701 |            20 | t
 myschema1       | mytbl2b_col20_seq |        12701 |             5 | t
 myschema1       | myTbl3_col31_seq  |        14000 |            20 | t
 myschema1       | mytbl2b_col20_seq |        14000 |             5 | t
 myschema2       | myTbl3_col31_seq  |        14000 |            20 | t
 myschema2       | myseq1            |        14000 |          1004 | f
 myschema1       | myTbl3_col31_seq  |        14001 |            20 | t
 myschema1       | mytbl2b_col20_seq |        14001 |             5 | t
 myschema2       | myTbl3_col31_seq  |        14001 |            20 | t
 myschema2       | myseq1            |        14001 |          1004 | f
 myschema1       | myTbl3_col31_seq  |        14007 |            20 | t
 myschema1       | mytbl2b_col20_seq |        14007 |             5 | t
 myschema2       | myTbl3_col31_seq  |        14007 |            20 | t
 myschema2       | myseq1            |        14007 |          1004 | f
 myschema1       | myTbl3_col31_seq  |        14009 |            20 | t
 myschema1       | mytbl2b_col20_seq |        14009 |             5 | t
 myschema2       | myTbl3_col31_seq  |        14009 |            20 | t
 myschema2       | myseq1            |        14009 |          1004 | f
 phil's schema"3 | myTbl2\_col21_seq |        14203 |             1 | f
 phil's schema"3 | phil's"seq\1      |        14203 |          1000 | f
 phil's schema"3 | myTbl2\_col21_seq |        14204 |             1 | f
 phil's schema"3 | phil's"seq\1      |        14204 |          1000 | t
 phil's schema"3 | myTbl2\_col21_seq |        14206 |             1 | f
 phil's schema"3 | phil's"seq\1      |        14206 |          1001 | t
(30 rows)

select tbl_schema, tbl_name, tbl_time_id, tbl_log_seq_last_val from emaj.emaj_table order by tbl_time_id, tbl_schema, tbl_name;
   tbl_schema    |  tbl_name   | tbl_time_id | tbl_log_seq_last_val 
-----------------+-------------+-------------+----------------------
 myschema2       | myTbl3      |       12301 |                   10
 myschema2       | mytbl1      |       12301 |                   15
 myschema2       | mytbl2      |       12301 |                    2
 myschema2       | mytbl4      |       12301 |                    4
 myschema2       | mytbl5      |       12301 |                    4
 myschema2       | mytbl6      |       12301 |                   14
 myschema1       | myTbl3      |       12501 |                   10
 myschema1       | mytbl1      |       12501 |                   30
 myschema1       | mytbl2      |       12501 |                    3
 myschema1       | mytbl2b     |       12501 |                    3
 myschema1       | mytbl4      |       12501 |                    8
 myschema1       | myTbl3      |       12502 |                   20
 myschema1       | mytbl1      |       12502 |                   30
 myschema1       | mytbl2      |       12502 |                    3
 myschema1       | mytbl2b     |       12502 |                    3
 myschema1       | mytbl4      |       12502 |                    8
 myschema1       | myTbl3      |       12701 |                   20
 myschema1       | mytbl1      |       12701 |                   32
 myschema1       | mytbl2      |       12701 |                    3
 myschema1       | mytbl2b     |       12701 |                    3
 myschema1       | mytbl4      |       12701 |                   12
 myschema1       | myTbl3      |       14000 |                   45
 myschema1       | mytbl1      |       14000 |                   33
 myschema1       | mytbl2      |       14000 |                    3
 myschema1       | mytbl2b     |       14000 |                    3
 myschema1       | mytbl4      |       14000 |                   14
 myschema2       | myTbl3      |       14000 |                   10
 myschema2       | mytbl1      |       14000 |                   15
 myschema2       | mytbl2      |       14000 |                    2
 myschema2       | mytbl4      |       14000 |                   10
 myschema2       | mytbl5      |       14000 |                    7
 myschema2       | mytbl6      |       14000 |                   23
 myschema1       | myTbl3      |       14001 |                   45
 myschema1       | mytbl1      |       14001 |                   33
 myschema1       | mytbl2      |       14001 |                    3
 myschema1       | mytbl2b     |       14001 |                    3
 myschema1       | mytbl4      |       14001 |                   14
 myschema2       | myTbl3      |       14001 |                   10
 myschema2       | mytbl1      |       14001 |                   15
 myschema2       | mytbl2      |       14001 |                    2
 myschema2       | mytbl4      |       14001 |                   10
 myschema2       | mytbl5      |       14001 |                    7
 myschema2       | mytbl6      |       14001 |                   23
 myschema1       | myTbl3      |       14007 |                   45
 myschema1       | mytbl1      |       14007 |                   33
 myschema1       | mytbl2      |       14007 |                    3
 myschema1       | mytbl2b     |       14007 |                    3
 myschema1       | mytbl4      |       14007 |                   14
 myschema2       | myTbl3      |       14007 |                   10
 myschema2       | mytbl1      |       14007 |                   15
 myschema2       | mytbl2      |       14007 |                    2
 myschema2       | mytbl4      |       14007 |                   10
 myschema2       | mytbl5      |       14007 |                    7
 myschema2       | mytbl6      |       14007 |                   23
 myschema1       | myTbl3      |       14009 |                   45
 myschema1       | mytbl1      |       14009 |                   33
 myschema1       | mytbl2      |       14009 |                    3
 myschema1       | mytbl2b     |       14009 |                    3
 myschema1       | mytbl4      |       14009 |                   14
 myschema2       | myTbl3      |       14009 |                   10
 myschema2       | mytbl1      |       14009 |                   15
 myschema2       | mytbl2      |       14009 |                    2
 myschema2       | mytbl4      |       14009 |                   10
 myschema2       | mytbl5      |       14009 |                    7
 myschema2       | mytbl6      |       14009 |                   23
 phil's schema"3 | myTbl2\     |       14203 |                    0
 phil's schema"3 | phil's tbl1 |       14203 |                    0
 phil's schema"3 | myTbl2\     |       14204 |                    2
 phil's schema"3 | phil's tbl1 |       14204 |                   50
 phil's schema"3 | myTbl2\     |       14206 |                    2
 phil's schema"3 | phil's tbl1 |       14206 |                   53
(71 rows)

select sqhl_schema, sqhl_table, sqhl_begin_time_id, sqhl_end_time_id, sqhl_hole_size from emaj.emaj_seq_hole order by 1,2,3;
 sqhl_schema | sqhl_table | sqhl_begin_time_id | sqhl_end_time_id | sqhl_hole_size 
-------------+------------+--------------------+------------------+----------------
 myschema1   | mytbl1     |              12502 |            12700 |              1
 myschema1   | mytbl4     |              12502 |            12700 |              2
 myschema2   | mytbl4     |              12301 |            12602 |              6
 myschema2   | mytbl5     |              12301 |            12602 |              3
 myschema2   | mytbl6     |              12301 |            12602 |              9
(5 rows)

select rlbt_rlbk_id, rlbt_step, rlbt_schema, rlbt_table, rlbt_object, rlbt_quantity from emaj.emaj_rlbk_stat
  order by rlbt_rlbk_id, rlbt_step, rlbt_schema, rlbt_table, rlbt_object;
 rlbt_rlbk_id |   rlbt_step    | rlbt_schema | rlbt_table |    rlbt_object    | rlbt_quantity 
--------------+----------------+-------------+------------+-------------------+---------------
        12400 | RLBK_SEQUENCES |             |            |                   |             2
        12400 | SET_FK_DEF     |             |            |                   |             2
        12400 | RLBK_TABLE     | myschema2   | mytbl4     |                   |             4
        12400 | RLBK_TABLE     | myschema2   | mytbl5     |                   |             1
        12400 | RLBK_TABLE     | myschema2   | mytbl6     |                   |             3
        12400 | SET_FK_IMM     | myschema2   | mytbl6     | mytbl6_col61_fkey |             3
        12400 | SET_FK_IMM     | myschema2   | mytbl8     | mytbl8_col81_fkey |             3
        12400 | CTRL-DBLINK    |             |            |                   |             8
        12401 | RLBK_SEQUENCES |             |            |                   |             2
        12401 | SET_FK_DEF     |             |            |                   |             2
        12401 | RLBK_TABLE     | myschema2   | mytbl4     |                   |             2
        12401 | RLBK_TABLE     | myschema2   | mytbl5     |                   |             1
        12401 | RLBK_TABLE     | myschema2   | mytbl6     |                   |             3
        12401 | SET_FK_IMM     | myschema2   | mytbl6     | mytbl6_col61_fkey |             3
        12401 | SET_FK_IMM     | myschema2   | mytbl8     | mytbl8_col81_fkey |             3
        12401 | CTRL-DBLINK    |             |            |                   |             8
        12500 | RLBK_SEQUENCES |             |            |                   |             2
        12500 | DIS_LOG_TRG    |             |            |                   |             2
        12500 | RLBK_TABLE     | myschema1   | mytbl1     |                   |             3
        12500 | RLBK_TABLE     | myschema1   | mytbl4     |                   |             8
        12500 | DELETE_LOG     | myschema1   | mytbl1     |                   |             3
        12500 | DELETE_LOG     | myschema1   | mytbl4     |                   |             8
        12500 | ENA_LOG_TRG    |             |            |                   |             2
        12500 | CTRL+DBLINK    |             |            |                   |             9
        12600 | RLBK_SEQUENCES |             |            |                   |             2
        12600 | SET_FK_DEF     |             |            |                   |             2
        12600 | RLBK_TABLE     | myschema2   | mytbl4     |                   |             8
        12600 | RLBK_TABLE     | myschema2   | mytbl5     |                   |             3
        12600 | RLBK_TABLE     | myschema2   | mytbl6     |                   |             9
        12600 | SET_FK_IMM     | myschema2   | mytbl6     | mytbl6_col61_fkey |             9
        12600 | SET_FK_IMM     | myschema2   | mytbl8     | mytbl8_col81_fkey |             9
        12600 | CTRL+DBLINK    |             |            |                   |             8
        12601 | RLBK_SEQUENCES |             |            |                   |             2
        12601 | DIS_LOG_TRG    |             |            |                   |             3
        12601 | SET_FK_DEF     |             |            |                   |             2
        12601 | RLBK_TABLE     | myschema2   | mytbl4     |                   |             6
        12601 | RLBK_TABLE     | myschema2   | mytbl5     |                   |             3
        12601 | RLBK_TABLE     | myschema2   | mytbl6     |                   |             9
        12601 | DELETE_LOG     | myschema2   | mytbl4     |                   |             6
        12601 | DELETE_LOG     | myschema2   | mytbl5     |                   |             3
        12601 | DELETE_LOG     | myschema2   | mytbl6     |                   |             9
        12601 | SET_FK_IMM     | myschema2   | mytbl6     | mytbl6_col61_fkey |             9
        12601 | SET_FK_IMM     | myschema2   | mytbl8     | mytbl8_col81_fkey |             9
        12601 | ENA_LOG_TRG    |             |            |                   |             3
        12601 | CTRL+DBLINK    |             |            |                   |            17
        12700 | RLBK_SEQUENCES |             |            |                   |             2
        12700 | DIS_LOG_TRG    |             |            |                   |             2
        12700 | RLBK_TABLE     | myschema1   | mytbl1     |                   |             1
        12700 | RLBK_TABLE     | myschema1   | mytbl4     |                   |             2
        12700 | DELETE_LOG     | myschema1   | mytbl1     |                   |             1
        12700 | DELETE_LOG     | myschema1   | mytbl4     |                   |             2
        12700 | ENA_LOG_TRG    |             |            |                   |             2
        12700 | CTRL+DBLINK    |             |            |                   |             9
        12701 | RLBK_SEQUENCES |             |            |                   |             2
        12701 | RLBK_TABLE     | myschema1   | myTbl3     |                   |            10
        12701 | RLBK_TABLE     | myschema1   | mytbl1     |                   |             1
        12701 | RLBK_TABLE     | myschema1   | mytbl4     |                   |             2
        12701 | CTRL+DBLINK    |             |            |                   |             4
        14000 | RLBK_SEQUENCES |             |            |                   |             4
        14000 | CTRL+DBLINK    |             |            |                   |             1
        14001 | RLBK_SEQUENCES |             |            |                   |             4
        14001 | CTRL+DBLINK    |             |            |                   |             1
        14002 | RLBK_SEQUENCES |             |            |                   |             4
        14002 | CTRL+DBLINK    |             |            |                   |             1
        14003 | RLBK_SEQUENCES |             |            |                   |             2
        14003 | CTRL+DBLINK    |             |            |                   |             1
        14200 | RLBK_SEQUENCES |             |            |                   |             2
        14200 | CTRL+DBLINK    |             |            |                   |             1
        14201 | RLBK_SEQUENCES |             |            |                   |             2
        14201 | CTRL+DBLINK    |             |            |                   |             1
(70 rows)

select time_id, time_last_emaj_gid, time_event from emaj.emaj_time_stamp where time_id >= 14200 order by time_id;
 time_id | time_last_emaj_gid | time_event 
---------+--------------------+------------
   14200 |           14200000 | C
   14201 |           14200000 | A
   14202 |           14200000 | A
   14203 |           14200000 | S
   14204 |           14200052 | M
   14205 |           14200052 | M
   14206 |           14200055 | M
   14207 |           14200055 | R
   14208 |           14200055 | M
   14209 |           14200055 | R
(10 rows)

select hist_function, hist_event, hist_object,
       regexp_replace(regexp_replace(regexp_replace(hist_wording,
            E'\\d\\d\.\\d\\d\\.\\d\\d\\.\\d\\d\\d\\d','%','g'),
            E'\\d\\d\\d\\d/\\d\\d\\/\\d\\d\\ \\d\\d\\:\\d\\d:\\d\\d .*?\\)','<timestamp>)','g'),
            E'\\[.+\\]','(timestamp)','g'), 
       hist_user
  from emaj.emaj_hist where hist_id >= 14200 order by hist_id;
   hist_function    |     hist_event     |              hist_object               |                    regexp_replace                    |     hist_user      
--------------------+--------------------+----------------------------------------+------------------------------------------------------+--------------------
 CREATE_GROUP       | BEGIN              | phil's group#3",                       | rollbackable                                         | _regress_emaj_adm2
 CREATE_GROUP       | TIME STAMP SET     | 14200                                  |                                                      | _regress_emaj_adm2
 CREATE_GROUP       | END                | phil's group#3",                       |                                                      | _regress_emaj_adm2
 ASSIGN_TABLES      | BEGIN              |                                        |                                                      | _regress_emaj_adm2
 ASSIGN_TABLES      | TIME STAMP SET     | 14201                                  |                                                      | _regress_emaj_adm2
 ASSIGN_TABLES      | LOG_SCHEMA CREATED | "emaj_phil's schema""3"                |                                                      | _regress_emaj_adm2
 ASSIGN_TABLES      | TABLE ADDED        | "phil's schema""3"."myTbl2\"           | To the idle group phil's group#3",                   | _regress_emaj_adm2
 ASSIGN_TABLES      | TABLE ADDED        | "phil's schema""3"."phil's tbl1"       | To the idle group phil's group#3",                   | _regress_emaj_adm2
 ASSIGN_TABLES      | END                |                                        | 2 tables assigned to the group phil's group#3",      | _regress_emaj_adm2
 ASSIGN_SEQUENCES   | BEGIN              |                                        |                                                      | _regress_emaj_adm2
 ASSIGN_SEQUENCES   | TIME STAMP SET     | 14202                                  |                                                      | _regress_emaj_adm2
 ASSIGN_SEQUENCES   | SEQUENCE ADDED     | "phil's schema""3"."myTbl2\_col21_seq" | To the idle group phil's group#3",                   | _regress_emaj_adm2
 ASSIGN_SEQUENCES   | SEQUENCE ADDED     | "phil's schema""3"."phil's""seq\1"     | To the idle group phil's group#3",                   | _regress_emaj_adm2
 ASSIGN_SEQUENCES   | END                |                                        | 2 sequences assigned to the group phil's group#3",   | _regress_emaj_adm2
 START_GROUP        | BEGIN              | phil's group#3",                       | With log reset                                       | _regress_emaj_adm2
 START_GROUP        | TIME STAMP SET     | 14203                                  |                                                      | _regress_emaj_adm2
 LOCK_GROUP         | BEGIN              | phil's group#3",                       |                                                      | _regress_emaj_adm2
 LOCK_GROUP         | END                | phil's group#3",                       | 2 tables locked, 0 deadlock(s)                       | _regress_emaj_adm2
 SET_MARK_GROUP     | BEGIN              | phil's group#3",                       | M1_rollbackable                                      | _regress_emaj_adm2
 CLEANUP_RLBK_STATE |                    | Rollback id 14003                      | set to COMMITTED                                     | _regress_emaj_adm2
 SET_MARK_GROUP     | END                | phil's group#3",                       | M1_rollbackable                                      | _regress_emaj_adm2
 START_GROUP        | END                | phil's group#3",                       | 4 tables/sequences processed                         | _regress_emaj_adm2
 SET_MARK_GROUP     | BEGIN              | phil's group#3",                       |                                                      | _regress_emaj_adm2
 LOCK_GROUP         | BEGIN              | phil's group#3",                       |                                                      | _regress_emaj_adm2
 LOCK_GROUP         | END                | phil's group#3",                       | 2 tables locked, 0 deadlock(s)                       | _regress_emaj_adm2
 SET_MARK_GROUP     | TIME STAMP SET     | 14204                                  |                                                      | _regress_emaj_adm2
 SET_MARK_GROUP     | END                | phil's group#3",                       | M2_rollbackable                                      | _regress_emaj_adm2
 SET_MARK_GROUP     | BEGIN              | phil's group#3",                       |                                                      | _regress_emaj_adm2
 LOCK_GROUP         | BEGIN              | phil's group#3",                       |                                                      | _regress_emaj_adm2
 LOCK_GROUP         | END                | phil's group#3",                       | 2 tables locked, 0 deadlock(s)                       | _regress_emaj_adm2
 SET_MARK_GROUP     | TIME STAMP SET     | 14205                                  |                                                      | _regress_emaj_adm2
 SET_MARK_GROUP     | END                | phil's group#3",                       | M2_again!                                            | _regress_emaj_adm2
 SET_MARK_GROUPS    | BEGIN              | phil's group#3",                       | phil's mark #1                                       | _regress_emaj_adm2
 LOCK_GROUPS        | BEGIN              | phil's group#3",                       |                                                      | _regress_emaj_adm2
 LOCK_GROUPS        | END                | phil's group#3",                       | 2 tables locked, 0 deadlock(s)                       | _regress_emaj_adm2
 SET_MARK_GROUPS    | TIME STAMP SET     | 14206                                  |                                                      | _regress_emaj_adm2
 SET_MARK_GROUPS    | END                | phil's group#3",                       | phil's mark #1                                       | _regress_emaj_adm2
 RENAME_MARK_GROUP  | BEGIN              | phil's group#3",                       | phil's mark #1                                       | _regress_emaj_adm2
 RENAME_MARK_GROUP  | END                | phil's group#3",                       | phil's mark #1 renamed phil's mark #3                | _regress_emaj_adm2
 DELETE_MARK_GROUP  | BEGIN              | phil's group#3",                       | M2_again!                                            | _regress_emaj_adm2
 DELETE_MARK_GROUP  | END                | phil's group#3",                       | M2_again!                                            | _regress_emaj_adm2
 ROLLBACK_GROUP     | BEGIN              | phil's group#3",                       | Logged rollback to mark phil's mark #3 (timestamp)   | _regress_emaj_adm2
 DBLINK_OPEN_CNX    |                    | rlbk#1                                 | Status = 1                                           | _regress_emaj_adm2
 LOCK_GROUP         | BEGIN              | phil's group#3",                       | Rollback session #1                                  | _regress_emaj_adm2
 LOCK_GROUP         | END                | phil's group#3",                       | Rollback session #1: 2 tables locked, 0 deadlock(s)  | _regress_emaj_adm2
 ROLLBACK_GROUP     | TIME STAMP SET     | 14207                                  |                                                      | _regress_emaj_adm2
 SET_MARK_GROUP     | BEGIN              | phil's group#3",                       | RLBK_14200_START                                     | _regress_emaj_adm2
 SET_MARK_GROUP     | END                | phil's group#3",                       | RLBK_14200_START                                     | _regress_emaj_adm2
 ROLLBACK_GROUP     | TIME STAMP SET     | 14208                                  |                                                      | _regress_emaj_adm1
 SET_MARK_GROUP     | BEGIN              | phil's group#3",                       | RLBK_14200_DONE                                      | _regress_emaj_adm2
 SET_MARK_GROUP     | END                | phil's group#3",                       | RLBK_14200_DONE                                      | _regress_emaj_adm2
 ROLLBACK_GROUP     | NOTICE             | Rollback id 14200                      | Rollback id = 14200.                                 | _regress_emaj_adm2
 ROLLBACK_GROUP     | NOTICE             | Rollback id 14200                      | 0 / 2 tables effectively processed.                  | _regress_emaj_adm2
 ROLLBACK_GROUP     | NOTICE             | Rollback id 14200                      | 0 / 2 sequences effectively processed.               | _regress_emaj_adm2
 DBLINK_CLOSE_CNX   |                    | rlbk#1                                 |                                                      | _regress_emaj_adm2
 ROLLBACK_GROUP     | END                | phil's group#3",                       | Rollback_id 14200                                    | _regress_emaj_adm2
 ROLLBACK_GROUP     | BEGIN              | phil's group#3",                       | Unlogged rollback to mark phil's mark #3 (timestamp) | _regress_emaj_adm2
 DBLINK_OPEN_CNX    |                    | rlbk#1                                 | Status = 1                                           | _regress_emaj_adm2
 LOCK_GROUP         | BEGIN              | phil's group#3",                       | Rollback session #1                                  | _regress_emaj_adm2
 LOCK_GROUP         | END                | phil's group#3",                       | Rollback session #1: 2 tables locked, 0 deadlock(s)  | _regress_emaj_adm2
 ROLLBACK_GROUP     | TIME STAMP SET     | 14209                                  |                                                      | _regress_emaj_adm2
 ROLLBACK_GROUP     | MARK DELETED       | phil's group#3",                       | mark RLBK_14200_START is deleted                     | _regress_emaj_adm2
 ROLLBACK_GROUP     | MARK DELETED       | phil's group#3",                       | mark RLBK_14200_DONE is deleted                      | _regress_emaj_adm2
 ROLLBACK_GROUP     | NOTICE             | Rollback id 14201                      | Rollback id = 14201.                                 | _regress_emaj_adm2
 ROLLBACK_GROUP     | NOTICE             | Rollback id 14201                      | 0 / 2 tables effectively processed.                  | _regress_emaj_adm2
 ROLLBACK_GROUP     | NOTICE             | Rollback id 14201                      | 0 / 2 sequences effectively processed.               | _regress_emaj_adm2
 DBLINK_CLOSE_CNX   |                    | rlbk#1                                 |                                                      | _regress_emaj_adm2
 ROLLBACK_GROUP     | END                | phil's group#3",                       | Rollback_id 14201                                    | _regress_emaj_adm2
(68 rows)

-- user tables
reset session_authorization;
select * from "phil's schema""3"."phil's tbl1" order by "phil's col11","phil's col12";
 phil's col11 | phil's col12 | phil\s"col13 
--------------+--------------+--------------
            1 | DEF          | \x1c
            2 | DEF          | \x1c
            3 | AB'C         | \x1c
            4 | AB'C         | \x0c
            5 | AB'C         | \x0c
            6 | AB'C         | \x0c
            7 | AB'C         | \x0c
            8 | AB'C         | \x0c
            9 | AB'C         | \x0c
           11 | AB'C         | \x0c
           12 | AB'C         | \x0c
           13 | AB'C         | \x0c
           14 | AB'C         | \x0c
           15 | AB'C         | \x0c
           16 | AB'C         | \x0c
           17 | AB'C         | \x0c
           18 | AB'C         | \x1c27
           19 | AB'C         | \x1c27
           20 | AB'C         | \x1c27
(19 rows)

select * from "phil's schema""3"."myTbl2\" order by col21;
 col21 | col22 |   col23    | col24 
-------+-------+------------+-------
     1 | ABC   | 12-31-2010 |     5
     2 | DEF   |            |      
(2 rows)

-- log tables
set session_authorization to _regress_emaj_adm2;
select "phil's col11", "phil's col12", "phil\s""col13", emaj_verb, emaj_tuple, emaj_gid from "emaj_phil's schema""3"."phil's tbl1_log" order by emaj_gid, emaj_tuple desc;
 phil's col11 | phil's col12 | phil\s"col13 | emaj_verb | emaj_tuple | emaj_gid 
--------------+--------------+--------------+-----------+------------+----------
            1 | AB'C         | \x0c         | INS       | NEW        | 14200001
            2 | AB'C         | \x0c         | INS       | NEW        | 14200002
            3 | AB'C         | \x0c         | INS       | NEW        | 14200003
            4 | AB'C         | \x0c         | INS       | NEW        | 14200004
            5 | AB'C         | \x0c         | INS       | NEW        | 14200005
            6 | AB'C         | \x0c         | INS       | NEW        | 14200006
            7 | AB'C         | \x0c         | INS       | NEW        | 14200007
            8 | AB'C         | \x0c         | INS       | NEW        | 14200008
            9 | AB'C         | \x0c         | INS       | NEW        | 14200009
           10 | AB'C         | \x0c         | INS       | NEW        | 14200010
           11 | AB'C         | \x0c         | INS       | NEW        | 14200011
           12 | AB'C         | \x0c         | INS       | NEW        | 14200012
           13 | AB'C         | \x0c         | INS       | NEW        | 14200013
           14 | AB'C         | \x0c         | INS       | NEW        | 14200014
           15 | AB'C         | \x0c         | INS       | NEW        | 14200015
           16 | AB'C         | \x0c         | INS       | NEW        | 14200016
           17 | AB'C         | \x0c         | INS       | NEW        | 14200017
           18 | AB'C         | \x0c         | INS       | NEW        | 14200018
           19 | AB'C         | \x0c         | INS       | NEW        | 14200019
           20 | AB'C         | \x0c         | INS       | NEW        | 14200020
           21 | AB'C         | \x0c         | INS       | NEW        | 14200021
           22 | AB'C         | \x0c         | INS       | NEW        | 14200022
           23 | AB'C         | \x0c         | INS       | NEW        | 14200023
           24 | AB'C         | \x0c         | INS       | NEW        | 14200024
           25 | AB'C         | \x0c         | INS       | NEW        | 14200025
           26 | AB'C         | \x0c         | INS       | NEW        | 14200026
           27 | AB'C         | \x0c         | INS       | NEW        | 14200027
           28 | AB'C         | \x0c         | INS       | NEW        | 14200028
           29 | AB'C         | \x0c         | INS       | NEW        | 14200029
           30 | AB'C         | \x0c         | INS       | NEW        | 14200030
           31 | AB'C         | \x0c         | INS       | NEW        | 14200031
            1 | AB'C         | \x0c         | UPD       | OLD        | 14200032
            1 | AB'C         | \x1c         | UPD       | NEW        | 14200032
            2 | AB'C         | \x0c         | UPD       | OLD        | 14200033
            2 | AB'C         | \x1c         | UPD       | NEW        | 14200033
            3 | AB'C         | \x0c         | UPD       | OLD        | 14200034
            3 | AB'C         | \x1c         | UPD       | NEW        | 14200034
           18 | AB'C         | \x0c         | UPD       | OLD        | 14200035
           18 | AB'C         | \x1c27       | UPD       | NEW        | 14200035
           19 | AB'C         | \x0c         | UPD       | OLD        | 14200036
           19 | AB'C         | \x1c27       | UPD       | NEW        | 14200036
           20 | AB'C         | \x0c         | UPD       | OLD        | 14200037
           20 | AB'C         | \x1c27       | UPD       | NEW        | 14200037
           21 | AB'C         | \x0c         | UPD       | OLD        | 14200038
           21 | AB'C         | \x1c27       | UPD       | NEW        | 14200038
           22 | AB'C         | \x0c         | UPD       | OLD        | 14200039
           22 | AB'C         | \x1c27       | UPD       | NEW        | 14200039
           23 | AB'C         | \x0c         | DEL       | OLD        | 14200041
           24 | AB'C         | \x0c         | DEL       | OLD        | 14200042
           25 | AB'C         | \x0c         | DEL       | OLD        | 14200043
           26 | AB'C         | \x0c         | DEL       | OLD        | 14200044
           27 | AB'C         | \x0c         | DEL       | OLD        | 14200045
           28 | AB'C         | \x0c         | DEL       | OLD        | 14200046
           29 | AB'C         | \x0c         | DEL       | OLD        | 14200047
           30 | AB'C         | \x0c         | DEL       | OLD        | 14200048
           31 | AB'C         | \x0c         | DEL       | OLD        | 14200049
           21 | AB'C         | \x1c27       | DEL       | OLD        | 14200050
           22 | AB'C         | \x1c27       | DEL       | OLD        | 14200051
           10 | AB'C         | \x0c         | DEL       | OLD        | 14200053
            1 | AB'C         | \x1c         | UPD       | OLD        | 14200054
            1 | DEF          | \x1c         | UPD       | NEW        | 14200054
            2 | AB'C         | \x1c         | UPD       | OLD        | 14200055
            2 | DEF          | \x1c         | UPD       | NEW        | 14200055
(63 rows)

select col21, col22, col23, emaj_verb, emaj_tuple, emaj_gid from "emaj_phil's schema""3"."myTbl2\_log" order by emaj_gid, emaj_tuple desc;
 col21 | col22 |   col23    | emaj_verb | emaj_tuple | emaj_gid 
-------+-------+------------+-----------+------------+----------
     1 | ABC   | 12-31-2010 | INS       | NEW        | 14200040
     2 | DEF   |            | INS       | NEW        | 14200052
(2 rows)

-- set sequence restart value
select public.handle_emaj_sequences(14300);
 handle_emaj_sequences 
-----------------------
 
(1 row)

-----------------------------
-- Step 10 : for myGroup1, in a transaction, update tables and rollback the transaction, 
--           then rollback to previous mark 
-----------------------------
reset session_authorization;
set search_path=public,myschema1;
--
begin transaction;
  delete from mytbl1;
rollback;
--
set session_authorization to _regress_emaj_adm2;
select * from emaj.emaj_rollback_group('myGroup1','EMAJ_LAST_MARK',false) order by 1,2;
 rlbk_severity |              rlbk_message              
---------------+----------------------------------------
 Notice        | 0 / 2 sequences effectively processed.
 Notice        | 1 / 5 tables effectively processed.
 Notice        | Rollback id = 14300.
(3 rows)

-----------------------------
-- Checking step 10
-----------------------------
-- emaj tables
select sqhl_schema, sqhl_table, sqhl_begin_time_id, sqhl_end_time_id, sqhl_hole_size from emaj.emaj_seq_hole order by 1,2,3;
 sqhl_schema | sqhl_table | sqhl_begin_time_id | sqhl_end_time_id | sqhl_hole_size 
-------------+------------+--------------------+------------------+----------------
 myschema1   | mytbl1     |              12502 |            12700 |              1
 myschema1   | mytbl1     |              14009 |            14300 |             20
 myschema1   | mytbl4     |              12502 |            12700 |              2
 myschema2   | mytbl4     |              12301 |            12602 |              6
 myschema2   | mytbl5     |              12301 |            12602 |              3
 myschema2   | mytbl6     |              12301 |            12602 |              9
(6 rows)

select rlbt_rlbk_id, rlbt_step, rlbt_schema, rlbt_table, rlbt_object, rlbt_quantity from emaj.emaj_rlbk_stat
  order by rlbt_rlbk_id, rlbt_step, rlbt_schema, rlbt_table, rlbt_object;
 rlbt_rlbk_id |   rlbt_step    | rlbt_schema | rlbt_table |    rlbt_object    | rlbt_quantity 
--------------+----------------+-------------+------------+-------------------+---------------
        12400 | RLBK_SEQUENCES |             |            |                   |             2
        12400 | SET_FK_DEF     |             |            |                   |             2
        12400 | RLBK_TABLE     | myschema2   | mytbl4     |                   |             4
        12400 | RLBK_TABLE     | myschema2   | mytbl5     |                   |             1
        12400 | RLBK_TABLE     | myschema2   | mytbl6     |                   |             3
        12400 | SET_FK_IMM     | myschema2   | mytbl6     | mytbl6_col61_fkey |             3
        12400 | SET_FK_IMM     | myschema2   | mytbl8     | mytbl8_col81_fkey |             3
        12400 | CTRL-DBLINK    |             |            |                   |             8
        12401 | RLBK_SEQUENCES |             |            |                   |             2
        12401 | SET_FK_DEF     |             |            |                   |             2
        12401 | RLBK_TABLE     | myschema2   | mytbl4     |                   |             2
        12401 | RLBK_TABLE     | myschema2   | mytbl5     |                   |             1
        12401 | RLBK_TABLE     | myschema2   | mytbl6     |                   |             3
        12401 | SET_FK_IMM     | myschema2   | mytbl6     | mytbl6_col61_fkey |             3
        12401 | SET_FK_IMM     | myschema2   | mytbl8     | mytbl8_col81_fkey |             3
        12401 | CTRL-DBLINK    |             |            |                   |             8
        12500 | RLBK_SEQUENCES |             |            |                   |             2
        12500 | DIS_LOG_TRG    |             |            |                   |             2
        12500 | RLBK_TABLE     | myschema1   | mytbl1     |                   |             3
        12500 | RLBK_TABLE     | myschema1   | mytbl4     |                   |             8
        12500 | DELETE_LOG     | myschema1   | mytbl1     |                   |             3
        12500 | DELETE_LOG     | myschema1   | mytbl4     |                   |             8
        12500 | ENA_LOG_TRG    |             |            |                   |             2
        12500 | CTRL+DBLINK    |             |            |                   |             9
        12600 | RLBK_SEQUENCES |             |            |                   |             2
        12600 | SET_FK_DEF     |             |            |                   |             2
        12600 | RLBK_TABLE     | myschema2   | mytbl4     |                   |             8
        12600 | RLBK_TABLE     | myschema2   | mytbl5     |                   |             3
        12600 | RLBK_TABLE     | myschema2   | mytbl6     |                   |             9
        12600 | SET_FK_IMM     | myschema2   | mytbl6     | mytbl6_col61_fkey |             9
        12600 | SET_FK_IMM     | myschema2   | mytbl8     | mytbl8_col81_fkey |             9
        12600 | CTRL+DBLINK    |             |            |                   |             8
        12601 | RLBK_SEQUENCES |             |            |                   |             2
        12601 | DIS_LOG_TRG    |             |            |                   |             3
        12601 | SET_FK_DEF     |             |            |                   |             2
        12601 | RLBK_TABLE     | myschema2   | mytbl4     |                   |             6
        12601 | RLBK_TABLE     | myschema2   | mytbl5     |                   |             3
        12601 | RLBK_TABLE     | myschema2   | mytbl6     |                   |             9
        12601 | DELETE_LOG     | myschema2   | mytbl4     |                   |             6
        12601 | DELETE_LOG     | myschema2   | mytbl5     |                   |             3
        12601 | DELETE_LOG     | myschema2   | mytbl6     |                   |             9
        12601 | SET_FK_IMM     | myschema2   | mytbl6     | mytbl6_col61_fkey |             9
        12601 | SET_FK_IMM     | myschema2   | mytbl8     | mytbl8_col81_fkey |             9
        12601 | ENA_LOG_TRG    |             |            |                   |             3
        12601 | CTRL+DBLINK    |             |            |                   |            17
        12700 | RLBK_SEQUENCES |             |            |                   |             2
        12700 | DIS_LOG_TRG    |             |            |                   |             2
        12700 | RLBK_TABLE     | myschema1   | mytbl1     |                   |             1
        12700 | RLBK_TABLE     | myschema1   | mytbl4     |                   |             2
        12700 | DELETE_LOG     | myschema1   | mytbl1     |                   |             1
        12700 | DELETE_LOG     | myschema1   | mytbl4     |                   |             2
        12700 | ENA_LOG_TRG    |             |            |                   |             2
        12700 | CTRL+DBLINK    |             |            |                   |             9
        12701 | RLBK_SEQUENCES |             |            |                   |             2
        12701 | RLBK_TABLE     | myschema1   | myTbl3     |                   |            10
        12701 | RLBK_TABLE     | myschema1   | mytbl1     |                   |             1
        12701 | RLBK_TABLE     | myschema1   | mytbl4     |                   |             2
        12701 | CTRL+DBLINK    |             |            |                   |             4
        14000 | RLBK_SEQUENCES |             |            |                   |             4
        14000 | CTRL+DBLINK    |             |            |                   |             1
        14001 | RLBK_SEQUENCES |             |            |                   |             4
        14001 | CTRL+DBLINK    |             |            |                   |             1
        14002 | RLBK_SEQUENCES |             |            |                   |             4
        14002 | CTRL+DBLINK    |             |            |                   |             1
        14003 | RLBK_SEQUENCES |             |            |                   |             2
        14003 | CTRL+DBLINK    |             |            |                   |             1
        14200 | RLBK_SEQUENCES |             |            |                   |             2
        14200 | CTRL+DBLINK    |             |            |                   |             1
        14201 | RLBK_SEQUENCES |             |            |                   |             2
        14201 | CTRL+DBLINK    |             |            |                   |             1
        14300 | RLBK_SEQUENCES |             |            |                   |             2
        14300 | DIS_LOG_TRG    |             |            |                   |             1
        14300 | RLBK_TABLE     | myschema1   | mytbl1     |                   |            20
        14300 | DELETE_LOG     | myschema1   | mytbl1     |                   |            20
        14300 | ENA_LOG_TRG    |             |            |                   |             1
        14300 | CTRL+DBLINK    |             |            |                   |             5
(76 rows)

select time_id, time_last_emaj_gid, time_event from emaj.emaj_time_stamp where time_id >= 14300 order by time_id;
 time_id | time_last_emaj_gid | time_event 
---------+--------------------+------------
   14300 |           14300020 | R
(1 row)

select hist_function, hist_event, hist_object,
       regexp_replace(regexp_replace(regexp_replace(hist_wording,
            E'\\d\\d\.\\d\\d\\.\\d\\d\\.\\d\\d\\d\\d','%','g'),
            E'\\d\\d\\d\\d/\\d\\d\\/\\d\\d\\ \\d\\d\\:\\d\\d:\\d\\d .*?\\)','<timestamp>)','g'),
            E'\\[.+\\]','(timestamp)','g'), 
       hist_user
  from emaj.emaj_hist where hist_id >= 14300 order by hist_id;
  hist_function   |   hist_event   |    hist_object    |                                           regexp_replace                                           |     hist_user      
------------------+----------------+-------------------+----------------------------------------------------------------------------------------------------+--------------------
 ROLLBACK_GROUP   | BEGIN          | myGroup1          | Unlogged rollback to mark Multi-1 (timestamp)                                                      | _regress_emaj_adm2
 DBLINK_OPEN_CNX  |                | rlbk#1            | Status = 1                                                                                         | _regress_emaj_adm2
 LOCK_GROUP       | BEGIN          | myGroup1          | Rollback session #1                                                                                | _regress_emaj_adm2
 LOCK_GROUP       | END            | myGroup1          | Rollback session #1: 5 tables locked, 0 deadlock(s)                                                | _regress_emaj_adm2
 ROLLBACK_GROUP   | TIME STAMP SET | 14300             |                                                                                                    | _regress_emaj_adm2
 ROLLBACK_TABLE   | BEGIN          | myschema1.mytbl1  | All log rows where emaj_gid > 14000000 and <= 14300020, in session_replication_role = replica mode | _regress_emaj_adm2
 ROLLBACK_TABLE   | END            | myschema1.mytbl1  | 0 rolled back primary keys                                                                         | _regress_emaj_adm2
 ROLLBACK_GROUP   | NOTICE         | Rollback id 14300 | Rollback id = 14300.                                                                               | _regress_emaj_adm2
 ROLLBACK_GROUP   | NOTICE         | Rollback id 14300 | 1 / 5 tables effectively processed.                                                                | _regress_emaj_adm2
 ROLLBACK_GROUP   | NOTICE         | Rollback id 14300 | 0 / 2 sequences effectively processed.                                                             | _regress_emaj_adm2
 DBLINK_CLOSE_CNX |                | rlbk#1            |                                                                                                    | _regress_emaj_adm2
 ROLLBACK_GROUP   | END            | myGroup1          | Rollback_id 14300                                                                                  | _regress_emaj_adm2
(12 rows)

-- set sequence restart value
select public.handle_emaj_sequences(14400);
 handle_emaj_sequences 
-----------------------
 
(1 row)

-----------------------------
-- Step 11 : tests snaps and script generation functions
-----------------------------
-- first perform changes in a table with generated columns
reset session_authorization;
set search_path=public,myschema1;
insert into mytbl2b (col21) values (10),(11);
update mytbl2b set col21 = 12 where col21 = 11;
delete from mytbl2b where col21 >= 10;
-- add some updates for tables with unusual types (arrays, geometric)
set search_path=public,myschema2;
insert into myTbl5 values (10,'{"abc","def","ghi"}','{1,2,3}',NULL,'{}',NULL,'{"id":1000}','[2020-01-01, 2021-01-01)',NULL);
insert into myTbl5 values (20,array['abc','def','ghi'],array[3,4,5],array['2000/02/01'::date,'2000/02/28'::date],'{"id":1001, "c1":"abc"}',NULL,'{"id":1001}',NULL,XMLPARSE (CONTENT '<foo>bar</foo>'));
update myTbl5 set col54 = '{"2010/11/28","2010/12/03"}', col55 = '{"id":1001, "c2":"def"}', col57 = '{"id":1001, "c3":"ghi"}' where col54 is null;
insert into myTbl6 select i+10, point(i,1.3), box(point(i,2),point(i+0.2,3)), circle(point(5,5),i),'((-2,-2),(3,0),(1,4))','10.20.30.40/27','EXECUTING',(i+10,point(i,1.3))::mycomposite from generate_series (1,8) as i;
update myTbl6 set col64 = '<(5,6),3.5>', col65 = null, col67 = 'COMPLETED' where col61 <= 13;
-- also add rows with unusual text content
insert into mytbl2 values (10, E'row 1 \r... and row 2 with a '' (quote) character',null);
insert into mytbl2 values (11, E'row 1 with a true \\ character\r... and row 2 with two \\n true and a '' (quote) characters',null);
-- and manupulate NULL characters
insert into mytbl1 values (200, E'Start\tEnd ', E'A\\000B'::BYTEA);
update mytbl1 set col12 = E' Start\tEnd' where col11 = 200;
delete from mytbl1 where col13 = E'A\\000B'::BYTEA;
-- also apply some changes in sequence characteristics
alter sequence myschema2.myseq1 minvalue 1 maxvalue 100 increment 10 start 21 restart 11 cache 2 cycle;
-- create the directory for the first snaps set
\! mkdir -p $EMAJTESTTMPDIR/snaps1
-- ... and snap all groups
set session_authorization to _regress_emaj_adm1;
select emaj.emaj_snap_group('myGroup1',:'EMAJTESTTMPDIR' || '/snaps1','CSV HEADER');
 emaj_snap_group 
-----------------
               7
(1 row)

select emaj.emaj_snap_group('myGroup2',:'EMAJTESTTMPDIR' || '/snaps1','CSV HEADER');
 emaj_snap_group 
-----------------
               8
(1 row)

select emaj.emaj_snap_group('phil''s group#3",',:'EMAJTESTTMPDIR' || '/snaps1','CSV HEADER');
 emaj_snap_group 
-----------------
               4
(1 row)

\! ls $EMAJTESTTMPDIR/snaps1
_INFO
myschema1_myTbl3.snap
myschema1_myTbl3_col31_seq.snap
myschema1_mytbl1.snap
myschema1_mytbl2.snap
myschema1_mytbl2b.snap
myschema1_mytbl2b_col20_seq.snap
myschema1_mytbl4.snap
myschema2_myTbl3.snap
myschema2_myTbl3_col31_seq.snap
myschema2_myseq1.snap
myschema2_mytbl1.snap
myschema2_mytbl2.snap
myschema2_mytbl4.snap
myschema2_mytbl5.snap
myschema2_mytbl6.snap
phil_s_schema_3_myTbl2_.snap
phil_s_schema_3_myTbl2__col21_seq.snap
phil_s_schema_3_phil_s_seq_1.snap
phil_s_schema_3_phil_s_tbl1.snap
-- generate a sql script for each active group (and check the result with detailed log statistics + number of sequences)
select emaj.emaj_gen_sql_group('myGroup1', 'Multi-1', NULL, :'EMAJTESTTMPDIR' || '/myGroup1.sql');
 emaj_gen_sql_group 
--------------------
                  6
(1 row)

select coalesce(sum(stat_rows),0) + 1 /* sequence change */ as check from emaj.emaj_detailed_log_stat_group('myGroup1', 'Multi-1', NULL);
 check 
-------
     6
(1 row)

select emaj.emaj_gen_sql_group('myGroup2', 'Multi-1', NULL, :'EMAJTESTTMPDIR' || '/myGroup2.sql', array[
     'myschema2.mytbl1','myschema2.mytbl2','myschema2.myTbl3','myschema2.mytbl4',
     'myschema2.mytbl5','myschema2.mytbl6','myschema2.myseq1','myschema2.myTbl3_col31_seq']);
 emaj_gen_sql_group 
--------------------
                 26
(1 row)

select sum(stat_rows) + 1 /* sequence change */ as check from emaj.emaj_detailed_log_stat_group('myGroup2', 'Multi-1', NULL);
 check 
-------
    26
(1 row)

select emaj.emaj_gen_sql_group('phil''s group#3",', 'M1_rollbackable', NULL, :'EMAJTESTTMPDIR' || '/Group3.sql');
 emaj_gen_sql_group 
--------------------
                 56
(1 row)

select sum(stat_rows) + 1 /* sequence change*/ as check from emaj.emaj_detailed_log_stat_group('phil''s group#3",', 'M1_rollbackable', NULL);
 check 
-------
    56
(1 row)

-- generate another sql script for myGroup1 but with a manual export and check both scripts are the same
select emaj.emaj_gen_sql_group('myGroup1', 'Multi-1', NULL, NULL);
 emaj_gen_sql_group 
--------------------
                  6
(1 row)

\setenv FILE1 :EMAJTESTTMPDIR'/myGroup1_2.sql'
\copy (select * from emaj_sql_script) to program 'cat >$FILE1'
-- mask timestamp in initial comment and compare
\! find $EMAJTESTTMPDIR -name '*.sql' -type f -print0 | xargs -0 sed -i -s 's/at .*$/at [ts]$/'
\! diff $EMAJTESTTMPDIR/myGroup1.sql $EMAJTESTTMPDIR/myGroup1_2.sql
-- process \\ characters in script files
\! find $EMAJTESTTMPDIR -name '*.sql' -type f -print0 | xargs -0 sed -i_s -s 's/\\\\/\\/g'
-- comment transaction commands for the need of the current test
\! find $EMAJTESTTMPDIR -name '*.sql' -type f -print0 | xargs -0 sed -i -s 's/^BEGIN/--BEGIN/;s/^COMMIT/--COMMIT/'
-- mask timestamp in initial comment
\! find $EMAJTESTTMPDIR -name '*.sql' -type f -print0 | xargs -0 sed -i -s 's/at .*$/at [ts]$/'
\! ls $EMAJTESTTMPDIR
Group3.sql
Group3.sql_s
myGroup1.sql
myGroup1.sql_s
myGroup1_2.sql
myGroup1_2.sql_s
myGroup2.sql
myGroup2.sql_s
snaps1
-- create the directory for the second snaps set
\! mkdir $EMAJTESTTMPDIR/snaps2
-- in a single transaction and as superuser:
--   rollback groups, replay updates with generated scripts, snap groups again and cancel the transaction
begin;
  select * from emaj.emaj_rollback_group('myGroup1','Multi-1',false) order by 1,2;
 rlbk_severity |              rlbk_message              
---------------+----------------------------------------
 Notice        | 1 / 2 sequences effectively processed.
 Notice        | 1 / 5 tables effectively processed.
 Notice        | Rollback id = 14400.
(3 rows)

  select * from emaj.emaj_rollback_group('myGroup2','Multi-1',false) order by 1,2;
 rlbk_severity |              rlbk_message              
---------------+----------------------------------------
 Notice        | 1 / 2 sequences effectively processed.
 Notice        | 4 / 6 tables effectively processed.
 Notice        | Rollback id = 14401.
(3 rows)

  select * from emaj.emaj_rollback_group('phil''s group#3",','M1_rollbackable',false) order by 1,2;
 rlbk_severity |              rlbk_message              
---------------+----------------------------------------
 Notice        | 1 / 2 sequences effectively processed.
 Notice        | 2 / 2 tables effectively processed.
 Notice        | Rollback id = 14402.
(3 rows)

  \! cat $EMAJTESTTMPDIR/myGroup1.sql
-- SQL script generated by E-Maj at [ts]$
--    for tables group(s): myGroup1
--    processing logs between mark Multi-1 and the current state
SET standard_conforming_strings = OFF;
SET escape_string_warning = OFF;
SET datestyle = 'ISO, YMD';
--BEGIN TRANSACTION;
INSERT INTO myschema1.mytbl2b (col20, col21, col24) OVERRIDING SYSTEM VALUE VALUES (6, 10, 'true');
INSERT INTO myschema1.mytbl2b (col20, col21, col24) OVERRIDING SYSTEM VALUE VALUES (7, 11, 'true');
UPDATE ONLY myschema1.mytbl2b SET col21 = 12, col24 = 'true' WHERE col20 = 7;
DELETE FROM ONLY myschema1.mytbl2b WHERE col20 = 6;
DELETE FROM ONLY myschema1.mytbl2b WHERE col20 = 7;
ALTER SEQUENCE myschema1.mytbl2b_col20_seq  RESTART 8;
--COMMIT;
RESET standard_conforming_strings;
RESET escape_string_warning;
RESET datestyle;
  reset session_authorization;
  \set FILE1 :EMAJTESTTMPDIR '/myGroup1.sql'
  \i :FILE1
-- SQL script generated by E-Maj at [ts]$
--    for tables group(s): myGroup1
--    processing logs between mark Multi-1 and the current state
SET standard_conforming_strings = OFF;
SET escape_string_warning = OFF;
SET datestyle = 'ISO, YMD';
--BEGIN TRANSACTION;
INSERT INTO myschema1.mytbl2b (col20, col21, col24) OVERRIDING SYSTEM VALUE VALUES (6, 10, 'true');
INSERT INTO myschema1.mytbl2b (col20, col21, col24) OVERRIDING SYSTEM VALUE VALUES (7, 11, 'true');
UPDATE ONLY myschema1.mytbl2b SET col21 = 12, col24 = 'true' WHERE col20 = 7;
DELETE FROM ONLY myschema1.mytbl2b WHERE col20 = 6;
DELETE FROM ONLY myschema1.mytbl2b WHERE col20 = 7;
ALTER SEQUENCE myschema1.mytbl2b_col20_seq  RESTART 8;
--COMMIT;
RESET standard_conforming_strings;
RESET escape_string_warning;
RESET datestyle;
  \set FILE2 :EMAJTESTTMPDIR '/myGroup2.sql'
  \i :FILE2
-- SQL script generated by E-Maj at [ts]$
--    for tables group(s): myGroup2
--    processing logs between mark Multi-1 and the current state
--    only for the following tables/sequences: myschema2.myTbl3,myschema2.myTbl3_col31_seq,myschema2.myseq1,myschema2.mytbl1,myschema2.mytbl2,myschema2.mytbl4,myschema2.mytbl5,myschema2.mytbl6
SET standard_conforming_strings = OFF;
SET escape_string_warning = OFF;
SET datestyle = 'ISO, YMD';
--BEGIN TRANSACTION;
INSERT INTO myschema2.mytbl5 VALUES (10, '{abc,def,ghi}', '{1,2,3}', NULL, '{}', NULL, '{"id":1000}', '[2020-01-01,2021-01-01)', NULL);
INSERT INTO myschema2.mytbl5 VALUES (20, '{abc,def,ghi}', '{3,4,5}', '{2000-02-01,2000-02-28}', '{"id":1001, "c1":"abc"}', NULL, '{"id":1001}', NULL, '<foo>bar</foo>');
UPDATE ONLY myschema2.mytbl5 SET col51 = 10, col52 = '{abc,def,ghi}', col53 = '{1,2,3}', col54 = '{2010-11-28,2010-12-03}', col55 = '{"id":1001, "c2":"def"}', col56 = NULL, col57 = '{"id":1001, "c3":"ghi"}', col58 = '[2020-01-01,2021-01-01)', col59 = NULL WHERE col51 = 10;
INSERT INTO myschema2.mytbl6 (col61, col62, col63, col64, col65, col66, col67, col68) VALUES (11, '(1,1.3)', '(1.2,3),(1,2)', '<(5,5),1>', '((-2,-2),(3,0),(1,4))', '10.20.30.40/27', 'EXECUTING', '(11,"(1,1.3)")');
INSERT INTO myschema2.mytbl6 (col61, col62, col63, col64, col65, col66, col67, col68) VALUES (12, '(2,1.3)', '(2.2,3),(2,2)', '<(5,5),2>', '((-2,-2),(3,0),(1,4))', '10.20.30.40/27', 'EXECUTING', '(12,"(2,1.3)")');
INSERT INTO myschema2.mytbl6 (col61, col62, col63, col64, col65, col66, col67, col68) VALUES (13, '(3,1.3)', '(3.2,3),(3,2)', '<(5,5),3>', '((-2,-2),(3,0),(1,4))', '10.20.30.40/27', 'EXECUTING', '(13,"(3,1.3)")');
INSERT INTO myschema2.mytbl6 (col61, col62, col63, col64, col65, col66, col67, col68) VALUES (14, '(4,1.3)', '(4.2,3),(4,2)', '<(5,5),4>', '((-2,-2),(3,0),(1,4))', '10.20.30.40/27', 'EXECUTING', '(14,"(4,1.3)")');
INSERT INTO myschema2.mytbl6 (col61, col62, col63, col64, col65, col66, col67, col68) VALUES (15, '(5,1.3)', '(5.2,3),(5,2)', '<(5,5),5>', '((-2,-2),(3,0),(1,4))', '10.20.30.40/27', 'EXECUTING', '(15,"(5,1.3)")');
INSERT INTO myschema2.mytbl6 (col61, col62, col63, col64, col65, col66, col67, col68) VALUES (16, '(6,1.3)', '(6.2,3),(6,2)', '<(5,5),6>', '((-2,-2),(3,0),(1,4))', '10.20.30.40/27', 'EXECUTING', '(16,"(6,1.3)")');
INSERT INTO myschema2.mytbl6 (col61, col62, col63, col64, col65, col66, col67, col68) VALUES (17, '(7,1.3)', '(7.2,3),(7,2)', '<(5,5),7>', '((-2,-2),(3,0),(1,4))', '10.20.30.40/27', 'EXECUTING', '(17,"(7,1.3)")');
INSERT INTO myschema2.mytbl6 (col61, col62, col63, col64, col65, col66, col67, col68) VALUES (18, '(8,1.3)', '(8.2,3),(8,2)', '<(5,5),8>', '((-2,-2),(3,0),(1,4))', '10.20.30.40/27', 'EXECUTING', '(18,"(8,1.3)")');
UPDATE ONLY myschema2.mytbl6 SET col61 = 0, col62 = NULL, col63 = NULL, col64 = '<(5,6),3.5>', col65 = NULL, col66 = NULL, col67 = 'COMPLETED', col68 = NULL WHERE col61 = 0;
UPDATE ONLY myschema2.mytbl6 SET col61 = 4, col62 = '(4,1.3)', col63 = '(4.2,1),(4,0)', col64 = '<(5,6),3.5>', col65 = NULL, col66 = '10.20.30.40/27', col67 = 'COMPLETED', col68 = '(4,"(4,1.3)")' WHERE col61 = 4;
UPDATE ONLY myschema2.mytbl6 SET col61 = 5, col62 = '(5,1.3)', col63 = '(5.2,1),(5,0)', col64 = '<(5,6),3.5>', col65 = NULL, col66 = '10.20.30.40/27', col67 = 'COMPLETED', col68 = '(5,"(5,1.3)")' WHERE col61 = 5;
UPDATE ONLY myschema2.mytbl6 SET col61 = 6, col62 = '(6,1.3)', col63 = '(6.2,1),(6,0)', col64 = '<(5,6),3.5>', col65 = NULL, col66 = '10.20.30.40/27', col67 = 'COMPLETED', col68 = '(6,"(6,1.3)")' WHERE col61 = 6;
UPDATE ONLY myschema2.mytbl6 SET col61 = 7, col62 = '(7,1.3)', col63 = '(7.2,1),(7,0)', col64 = '<(5,6),3.5>', col65 = NULL, col66 = '10.20.30.40/27', col67 = 'COMPLETED', col68 = '(7,"(7,1.3)")' WHERE col61 = 7;
UPDATE ONLY myschema2.mytbl6 SET col61 = 8, col62 = '(8,1.3)', col63 = '(8.2,1),(8,0)', col64 = '<(5,6),3.5>', col65 = NULL, col66 = '10.20.30.40/27', col67 = 'COMPLETED', col68 = '(8,"(8,1.3)")' WHERE col61 = 8;
UPDATE ONLY myschema2.mytbl6 SET col61 = 11, col62 = '(1,1.3)', col63 = '(1.2,3),(1,2)', col64 = '<(5,6),3.5>', col65 = NULL, col66 = '10.20.30.40/27', col67 = 'COMPLETED', col68 = '(11,"(1,1.3)")' WHERE col61 = 11;
UPDATE ONLY myschema2.mytbl6 SET col61 = 12, col62 = '(2,1.3)', col63 = '(2.2,3),(2,2)', col64 = '<(5,6),3.5>', col65 = NULL, col66 = '10.20.30.40/27', col67 = 'COMPLETED', col68 = '(12,"(2,1.3)")' WHERE col61 = 12;
UPDATE ONLY myschema2.mytbl6 SET col61 = 13, col62 = '(3,1.3)', col63 = '(3.2,3),(3,2)', col64 = '<(5,6),3.5>', col65 = NULL, col66 = '10.20.30.40/27', col67 = 'COMPLETED', col68 = '(13,"(3,1.3)")' WHERE col61 = 13;
INSERT INTO myschema2.mytbl2 VALUES (10, 'row 1 \r... and row 2 with a '' (quote) character', NULL);
INSERT INTO myschema2.mytbl2 VALUES (11, E'row 1 with a true \\ character\r... and row 2 with two \\n true and a '' (quote) characters', NULL);
INSERT INTO myschema2.mytbl1 VALUES (200, 'Start\tEnd', E'\\x410042');
UPDATE ONLY myschema2.mytbl1 SET col11 = 200, col12 = ' Start\tEnd', col13 = E'\\x410042' WHERE col11 = 200 AND col12 = 'Start\tEnd';
DELETE FROM ONLY myschema2.mytbl1 WHERE col11 = 200 AND col12 = ' Start\tEnd';
ALTER SEQUENCE myschema2.myseq1  RESTART 11 START 21 INCREMENT 10 MINVALUE 1 MAXVALUE 100 CACHE 2 CYCLE ;
--COMMIT;
RESET standard_conforming_strings;
RESET escape_string_warning;
RESET datestyle;
  \set FILE3 :EMAJTESTTMPDIR '/Group3.sql'
  \i :FILE3
-- SQL script generated by E-Maj at [ts]$
--    for tables group(s): phil's group#3",
--    processing logs between mark M1_rollbackable and the current state
SET standard_conforming_strings = OFF;
SET escape_string_warning = OFF;
SET datestyle = 'ISO, YMD';
--BEGIN TRANSACTION;
INSERT INTO "phil's schema""3"."phil's tbl1" VALUES (1, 'AB''C', E'\\x0c');
INSERT INTO "phil's schema""3"."phil's tbl1" VALUES (2, 'AB''C', E'\\x0c');
INSERT INTO "phil's schema""3"."phil's tbl1" VALUES (3, 'AB''C', E'\\x0c');
INSERT INTO "phil's schema""3"."phil's tbl1" VALUES (4, 'AB''C', E'\\x0c');
INSERT INTO "phil's schema""3"."phil's tbl1" VALUES (5, 'AB''C', E'\\x0c');
INSERT INTO "phil's schema""3"."phil's tbl1" VALUES (6, 'AB''C', E'\\x0c');
INSERT INTO "phil's schema""3"."phil's tbl1" VALUES (7, 'AB''C', E'\\x0c');
INSERT INTO "phil's schema""3"."phil's tbl1" VALUES (8, 'AB''C', E'\\x0c');
INSERT INTO "phil's schema""3"."phil's tbl1" VALUES (9, 'AB''C', E'\\x0c');
INSERT INTO "phil's schema""3"."phil's tbl1" VALUES (10, 'AB''C', E'\\x0c');
INSERT INTO "phil's schema""3"."phil's tbl1" VALUES (11, 'AB''C', E'\\x0c');
INSERT INTO "phil's schema""3"."phil's tbl1" VALUES (12, 'AB''C', E'\\x0c');
INSERT INTO "phil's schema""3"."phil's tbl1" VALUES (13, 'AB''C', E'\\x0c');
INSERT INTO "phil's schema""3"."phil's tbl1" VALUES (14, 'AB''C', E'\\x0c');
INSERT INTO "phil's schema""3"."phil's tbl1" VALUES (15, 'AB''C', E'\\x0c');
INSERT INTO "phil's schema""3"."phil's tbl1" VALUES (16, 'AB''C', E'\\x0c');
INSERT INTO "phil's schema""3"."phil's tbl1" VALUES (17, 'AB''C', E'\\x0c');
INSERT INTO "phil's schema""3"."phil's tbl1" VALUES (18, 'AB''C', E'\\x0c');
INSERT INTO "phil's schema""3"."phil's tbl1" VALUES (19, 'AB''C', E'\\x0c');
INSERT INTO "phil's schema""3"."phil's tbl1" VALUES (20, 'AB''C', E'\\x0c');
INSERT INTO "phil's schema""3"."phil's tbl1" VALUES (21, 'AB''C', E'\\x0c');
INSERT INTO "phil's schema""3"."phil's tbl1" VALUES (22, 'AB''C', E'\\x0c');
INSERT INTO "phil's schema""3"."phil's tbl1" VALUES (23, 'AB''C', E'\\x0c');
INSERT INTO "phil's schema""3"."phil's tbl1" VALUES (24, 'AB''C', E'\\x0c');
INSERT INTO "phil's schema""3"."phil's tbl1" VALUES (25, 'AB''C', E'\\x0c');
INSERT INTO "phil's schema""3"."phil's tbl1" VALUES (26, 'AB''C', E'\\x0c');
INSERT INTO "phil's schema""3"."phil's tbl1" VALUES (27, 'AB''C', E'\\x0c');
INSERT INTO "phil's schema""3"."phil's tbl1" VALUES (28, 'AB''C', E'\\x0c');
INSERT INTO "phil's schema""3"."phil's tbl1" VALUES (29, 'AB''C', E'\\x0c');
INSERT INTO "phil's schema""3"."phil's tbl1" VALUES (30, 'AB''C', E'\\x0c');
INSERT INTO "phil's schema""3"."phil's tbl1" VALUES (31, 'AB''C', E'\\x0c');
UPDATE ONLY "phil's schema""3"."phil's tbl1" SET "phil's col11" = 1, "phil's col12" = 'AB''C', "phil\s""col13" = E'\\x1c' WHERE "phil's col11" = 1 AND "phil's col12" = 'AB''C';
UPDATE ONLY "phil's schema""3"."phil's tbl1" SET "phil's col11" = 2, "phil's col12" = 'AB''C', "phil\s""col13" = E'\\x1c' WHERE "phil's col11" = 2 AND "phil's col12" = 'AB''C';
UPDATE ONLY "phil's schema""3"."phil's tbl1" SET "phil's col11" = 3, "phil's col12" = 'AB''C', "phil\s""col13" = E'\\x1c' WHERE "phil's col11" = 3 AND "phil's col12" = 'AB''C';
UPDATE ONLY "phil's schema""3"."phil's tbl1" SET "phil's col11" = 18, "phil's col12" = 'AB''C', "phil\s""col13" = E'\\x1c27' WHERE "phil's col11" = 18 AND "phil's col12" = 'AB''C';
UPDATE ONLY "phil's schema""3"."phil's tbl1" SET "phil's col11" = 19, "phil's col12" = 'AB''C', "phil\s""col13" = E'\\x1c27' WHERE "phil's col11" = 19 AND "phil's col12" = 'AB''C';
UPDATE ONLY "phil's schema""3"."phil's tbl1" SET "phil's col11" = 20, "phil's col12" = 'AB''C', "phil\s""col13" = E'\\x1c27' WHERE "phil's col11" = 20 AND "phil's col12" = 'AB''C';
UPDATE ONLY "phil's schema""3"."phil's tbl1" SET "phil's col11" = 21, "phil's col12" = 'AB''C', "phil\s""col13" = E'\\x1c27' WHERE "phil's col11" = 21 AND "phil's col12" = 'AB''C';
UPDATE ONLY "phil's schema""3"."phil's tbl1" SET "phil's col11" = 22, "phil's col12" = 'AB''C', "phil\s""col13" = E'\\x1c27' WHERE "phil's col11" = 22 AND "phil's col12" = 'AB''C';
INSERT INTO "phil's schema""3"."myTbl2\" (col21, col22, col23) VALUES (1, 'ABC', '2010-12-31');
DELETE FROM ONLY "phil's schema""3"."phil's tbl1" WHERE "phil's col11" = 23 AND "phil's col12" = 'AB''C';
DELETE FROM ONLY "phil's schema""3"."phil's tbl1" WHERE "phil's col11" = 24 AND "phil's col12" = 'AB''C';
DELETE FROM ONLY "phil's schema""3"."phil's tbl1" WHERE "phil's col11" = 25 AND "phil's col12" = 'AB''C';
DELETE FROM ONLY "phil's schema""3"."phil's tbl1" WHERE "phil's col11" = 26 AND "phil's col12" = 'AB''C';
DELETE FROM ONLY "phil's schema""3"."phil's tbl1" WHERE "phil's col11" = 27 AND "phil's col12" = 'AB''C';
DELETE FROM ONLY "phil's schema""3"."phil's tbl1" WHERE "phil's col11" = 28 AND "phil's col12" = 'AB''C';
DELETE FROM ONLY "phil's schema""3"."phil's tbl1" WHERE "phil's col11" = 29 AND "phil's col12" = 'AB''C';
DELETE FROM ONLY "phil's schema""3"."phil's tbl1" WHERE "phil's col11" = 30 AND "phil's col12" = 'AB''C';
DELETE FROM ONLY "phil's schema""3"."phil's tbl1" WHERE "phil's col11" = 31 AND "phil's col12" = 'AB''C';
DELETE FROM ONLY "phil's schema""3"."phil's tbl1" WHERE "phil's col11" = 21 AND "phil's col12" = 'AB''C';
DELETE FROM ONLY "phil's schema""3"."phil's tbl1" WHERE "phil's col11" = 22 AND "phil's col12" = 'AB''C';
INSERT INTO "phil's schema""3"."myTbl2\" (col21, col22, col23) VALUES (2, 'DEF', NULL);
DELETE FROM ONLY "phil's schema""3"."phil's tbl1" WHERE "phil's col11" = 10 AND "phil's col12" = 'AB''C';
UPDATE ONLY "phil's schema""3"."phil's tbl1" SET "phil's col11" = 1, "phil's col12" = 'DEF', "phil\s""col13" = E'\\x1c' WHERE "phil's col11" = 1 AND "phil's col12" = 'AB''C';
UPDATE ONLY "phil's schema""3"."phil's tbl1" SET "phil's col11" = 2, "phil's col12" = 'DEF', "phil\s""col13" = E'\\x1c' WHERE "phil's col11" = 2 AND "phil's col12" = 'AB''C';
ALTER SEQUENCE "phil's schema""3"."phil's""seq\1"  RESTART 1002;
--COMMIT;
RESET standard_conforming_strings;
RESET escape_string_warning;
RESET datestyle;
  set session_authorization to _regress_emaj_adm1;
  select emaj.emaj_snap_group('myGroup1',:'EMAJTESTTMPDIR' || '/snaps2','CSV HEADER');
 emaj_snap_group 
-----------------
               7
(1 row)

  select emaj.emaj_snap_group('myGroup2',:'EMAJTESTTMPDIR' || '/snaps2','CSV HEADER');
 emaj_snap_group 
-----------------
               8
(1 row)

  select emaj.emaj_snap_group('phil''s group#3",',:'EMAJTESTTMPDIR' || '/snaps2','CSV HEADER');
 emaj_snap_group 
-----------------
               4
(1 row)

rollback;
-- mask timestamp in _INFO files
\! sed -i_s -s 's/at .*/at [ts]/' $EMAJTESTTMPDIR/snaps1/_INFO $EMAJTESTTMPDIR/snaps2/_INFO
-- and compare both snaps sets
-- sequences are detected as different because of :
-- - the effect of RESTART on is_called and next_val attributes
-- - internal log_cnt value being reset
\! diff --exclude _INFO_s $EMAJTESTTMPDIR/snaps1 $EMAJTESTTMPDIR/snaps2
diff --exclude _INFO_s /tmp/emaj_13/adm2/snaps1/myschema1_mytbl2b_col20_seq.snap /tmp/emaj_13/adm2/snaps2/myschema1_mytbl2b_col20_seq.snap
2c2
< mytbl2b_col20_seq,7,1,1,2147483647,1,1,f,t
---
> mytbl2b_col20_seq,8,1,1,2147483647,1,1,f,f
diff --exclude _INFO_s /tmp/emaj_13/adm2/snaps1/phil_s_schema_3_phil_s_seq_1.snap /tmp/emaj_13/adm2/snaps2/phil_s_schema_3_phil_s_seq_1.snap
2c2
< "phil's""seq\1",1001,1000,1,2000,1000,1,t,t
---
> "phil's""seq\1",1002,1000,1,2000,1000,1,t,f
-- reset the sequence myschema2.myseq1 to its previous characteristics
reset session_authorization;
alter sequence myschema2.myseq1 restart 1004 start 1000 increment 1 maxvalue 9223372036854775807 minvalue 1000 cache 1 no cycle;
set session_authorization to _regress_emaj_adm2;
-----------------------------
-- Checking step 11
-----------------------------
select time_id, time_last_emaj_gid, time_event from emaj.emaj_time_stamp where time_id >= 14400 order by time_id;
 time_id | time_last_emaj_gid | time_event 
---------+--------------------+------------
   14400 |           14400030 | R
   14401 |           14400030 | R
   14402 |           14400030 | R
(3 rows)

select hist_function, hist_event, hist_object,
       regexp_replace(regexp_replace(regexp_replace(hist_wording,
            E'\\d\\d\.\\d\\d\\.\\d\\d\\.\\d\\d\\d\\d','%','g'),
            E'\\d\\d\\d\\d/\\d\\d\\/\\d\\d\\ \\d\\d\\:\\d\\d:\\d\\d .*?\\)','<timestamp>)','g'),
            E'\\[.+\\]','(timestamp)','g'), 
       hist_user
  from emaj.emaj_hist where hist_id >= 14400 order by hist_id;
 hist_function | hist_event |   hist_object    |                                regexp_replace                                 |     hist_user      
---------------+------------+------------------+-------------------------------------------------------------------------------+--------------------
 SNAP_GROUP    | BEGIN      | myGroup1         | /tmp/emaj_13/adm2/snaps1                                                      | _regress_emaj_adm1
 SNAP_GROUP    | END        | myGroup1         | 7 tables/sequences processed                                                  | _regress_emaj_adm1
 SNAP_GROUP    | BEGIN      | myGroup2         | /tmp/emaj_13/adm2/snaps1                                                      | _regress_emaj_adm1
 SNAP_GROUP    | END        | myGroup2         | 8 tables/sequences processed                                                  | _regress_emaj_adm1
 SNAP_GROUP    | BEGIN      | phil's group#3", | /tmp/emaj_13/adm2/snaps1                                                      | _regress_emaj_adm1
 SNAP_GROUP    | END        | phil's group#3", | 4 tables/sequences processed                                                  | _regress_emaj_adm1
 GEN_SQL_GROUP | BEGIN      | myGroup1         | From mark Multi-1 to current state                                            | _regress_emaj_adm1
 GEN_SQL_GROUP | END        | myGroup1         | 6 generated statements - script exported into /tmp/emaj_13/adm2/myGroup1.sql  | _regress_emaj_adm1
 GEN_SQL_GROUP | BEGIN      | myGroup2         | From mark Multi-1 to current state with tables/sequences filtering            | _regress_emaj_adm1
 GEN_SQL_GROUP | END        | myGroup2         | 26 generated statements - script exported into /tmp/emaj_13/adm2/myGroup2.sql | _regress_emaj_adm1
 GEN_SQL_GROUP | BEGIN      | phil's group#3", | From mark M1_rollbackable to current state                                    | _regress_emaj_adm1
 GEN_SQL_GROUP | END        | phil's group#3", | 56 generated statements - script exported into /tmp/emaj_13/adm2/Group3.sql   | _regress_emaj_adm1
 GEN_SQL_GROUP | BEGIN      | myGroup1         | From mark Multi-1 to current state                                            | _regress_emaj_adm1
 GEN_SQL_GROUP | END        | myGroup1         | 6 generated statements - script not exported                                  | _regress_emaj_adm1
(14 rows)

-- set sequence restart value
select public.handle_emaj_sequences(14500);
 handle_emaj_sequences 
-----------------------
 
(1 row)

-----------------------------
-- Step 12 : test use of a table with a very long name (63 characters long)
-----------------------------
select emaj.emaj_stop_group('phil''s group#3",');
 emaj_stop_group 
-----------------
               4
(1 row)

-- remove the "phil's tbl1" table, rename it and reassign it to its group
select emaj.emaj_remove_table('phil''s schema"3','phil''s tbl1');
 emaj_remove_table 
-------------------
                 1
(1 row)

reset session_authorization;
alter table "phil's schema""3"."phil's tbl1" rename to table_with_very_looooooooooooooooooooooooooooooooooooooong_name;
set session_authorization to _regress_emaj_adm1;
select emaj.emaj_assign_table('phil''s schema"3', 'table_with_very_looooooooooooooooooooooooooooooooooooooong_name', 'phil''s group#3",');
 emaj_assign_table 
-------------------
                 1
(1 row)

-- use the table and its group
select emaj.emaj_start_group('phil''s group#3",','M1_after_table_rename');
WARNING:  _check_fk_groups: The foreign key "mytbl2_col21_fkey" on the table "phil's schema"3.myTbl2\" references the table "phil's schema"3.my"tbl4" that is outside the groups (phil's group#3",).
WARNING:  _check_fk_groups: The table "phil's schema"3.table_with_very_looooooooooooooooooooooooooooooooooooooong_name" is referenced by the foreign key "my"tbl4_col44_fkey" on the table "phil's schema"3.my"tbl4" that is outside the groups (phil's group#3",).
 emaj_start_group 
------------------
                4
(1 row)

reset session_authorization;
update "phil's schema""3".table_with_very_looooooooooooooooooooooooooooooooooooooong_name set "phil's col12" = 'GHI' where "phil's col11" between 6 and 9;
set session_authorization to _regress_emaj_adm1;
select emaj.emaj_set_mark_group('phil''s group#3",','M2');
 emaj_set_mark_group 
---------------------
                   4
(1 row)

reset session_authorization;
delete from "phil's schema""3".table_with_very_looooooooooooooooooooooooooooooooooooooong_name where "phil's col11" > 18;
set session_authorization to _regress_emaj_adm1;
select * from emaj.emaj_rollback_group('phil''s group#3",','M1_after_table_rename',false) order by 1,2;
 rlbk_severity |              rlbk_message              
---------------+----------------------------------------
 Notice        | 0 / 2 sequences effectively processed.
 Notice        | 1 / 2 tables effectively processed.
 Notice        | Rollback id = 14500.
(3 rows)

select emaj.emaj_stop_group('phil''s group#3",');
 emaj_stop_group 
-----------------
               4
(1 row)

select emaj.emaj_drop_group('phil''s group#3",');
 emaj_drop_group 
-----------------
               4
(1 row)

--
reset session_authorization;
alter table "phil's schema""3".table_with_very_looooooooooooooooooooooooooooooooooooooong_name rename to "phil's tbl1";
-----------------------------
-- Checking step 12
-----------------------------
set session_authorization to _regress_emaj_adm1;
select time_id, time_last_emaj_gid, time_event from emaj.emaj_time_stamp where time_id >= 14500 order by time_id;
 time_id | time_last_emaj_gid | time_event 
---------+--------------------+------------
   14500 |           14500000 | X
   14501 |           14500000 | A
   14502 |           14500000 | A
   14503 |           14500000 | S
   14504 |           14500004 | M
   14505 |           14500006 | R
   14506 |           14500006 | X
   14507 |           14500006 | D
(8 rows)

select hist_function, hist_event, hist_object,
       regexp_replace(regexp_replace(regexp_replace(hist_wording,
            E'\\d\\d\.\\d\\d\\.\\d\\d\\.\\d\\d\\d\\d','%','g'),
            E'\\d\\d\\d\\d/\\d\\d\\/\\d\\d\\ \\d\\d\\:\\d\\d:\\d\\d .*?\\)','<timestamp>)','g'),
            E'\\[.+\\]','(timestamp)','g'), 
       hist_user
  from emaj.emaj_hist where hist_id >= 14500 order by hist_id;
   hist_function    |     hist_event     |                                    hist_object                                     |                       regexp_replace                        |     hist_user      
--------------------+--------------------+------------------------------------------------------------------------------------+-------------------------------------------------------------+--------------------
 STOP_GROUP         | BEGIN              | phil's group#3",                                                                   |                                                             | _regress_emaj_adm2
 STOP_GROUP         | TIME STAMP SET     | 14500                                                                              |                                                             | _regress_emaj_adm2
 LOCK_GROUP         | BEGIN              | phil's group#3",                                                                   |                                                             | _regress_emaj_adm2
 LOCK_GROUP         | END                | phil's group#3",                                                                   | 2 tables locked, 0 deadlock(s)                              | _regress_emaj_adm2
 SET_MARK_GROUP     | BEGIN              | phil's group#3",                                                                   | STOP_%                                                      | _regress_emaj_adm2
 CLEANUP_RLBK_STATE |                    | Rollback id 14200                                                                  | set to COMMITTED                                            | _regress_emaj_adm2
 CLEANUP_RLBK_STATE |                    | Rollback id 14201                                                                  | set to COMMITTED                                            | _regress_emaj_adm2
 CLEANUP_RLBK_STATE |                    | Rollback id 14300                                                                  | set to COMMITTED                                            | _regress_emaj_adm2
 CLEANUP_RLBK_STATE |                    | Rollback id 14400                                                                  | set to ABORTED                                              | _regress_emaj_adm2
 CLEANUP_RLBK_STATE |                    | Rollback id 14401                                                                  | set to ABORTED                                              | _regress_emaj_adm2
 CLEANUP_RLBK_STATE |                    | Rollback id 14402                                                                  | set to ABORTED                                              | _regress_emaj_adm2
 SET_MARK_GROUP     | END                | phil's group#3",                                                                   | STOP_%                                                      | _regress_emaj_adm2
 STOP_GROUP         | END                | phil's group#3",                                                                   | 4 tables/sequences processed                                | _regress_emaj_adm2
 REMOVE_TABLE       | BEGIN              |                                                                                    |                                                             | _regress_emaj_adm2
 REMOVE_TABLE       | TIME STAMP SET     | 14501                                                                              |                                                             | _regress_emaj_adm2
 REMOVE_TABLE       | TABLE REMOVED      | "phil's schema""3"."phil's tbl1"                                                   | From the idle group phil's group#3",                        | _regress_emaj_adm2
 REMOVE_TABLE       | END                |                                                                                    | 1 tables removed from their groups                          | _regress_emaj_adm2
 ASSIGN_TABLE       | BEGIN              |                                                                                    |                                                             | _regress_emaj_adm1
 ASSIGN_TABLE       | TIME STAMP SET     | 14502                                                                              |                                                             | _regress_emaj_adm1
 ASSIGN_TABLE       | TABLE ADDED        | "phil's schema""3".table_with_very_looooooooooooooooooooooooooooooooooooooong_name | To the idle group phil's group#3",                          | _regress_emaj_adm1
 ASSIGN_TABLE       | END                |                                                                                    | 1 tables assigned to the group phil's group#3",             | _regress_emaj_adm1
 START_GROUP        | BEGIN              | phil's group#3",                                                                   | With log reset                                              | _regress_emaj_adm1
 START_GROUP        | TIME STAMP SET     | 14503                                                                              |                                                             | _regress_emaj_adm1
 LOCK_GROUP         | BEGIN              | phil's group#3",                                                                   |                                                             | _regress_emaj_adm1
 LOCK_GROUP         | END                | phil's group#3",                                                                   | 2 tables locked, 0 deadlock(s)                              | _regress_emaj_adm1
 SET_MARK_GROUP     | BEGIN              | phil's group#3",                                                                   | M1_after_table_rename                                       | _regress_emaj_adm1
 SET_MARK_GROUP     | END                | phil's group#3",                                                                   | M1_after_table_rename                                       | _regress_emaj_adm1
 START_GROUP        | END                | phil's group#3",                                                                   | 4 tables/sequences processed                                | _regress_emaj_adm1
 SET_MARK_GROUP     | BEGIN              | phil's group#3",                                                                   |                                                             | _regress_emaj_adm1
 LOCK_GROUP         | BEGIN              | phil's group#3",                                                                   |                                                             | _regress_emaj_adm1
 LOCK_GROUP         | END                | phil's group#3",                                                                   | 2 tables locked, 0 deadlock(s)                              | _regress_emaj_adm1
 SET_MARK_GROUP     | TIME STAMP SET     | 14504                                                                              |                                                             | _regress_emaj_adm1
 SET_MARK_GROUP     | END                | phil's group#3",                                                                   | M2                                                          | _regress_emaj_adm1
 ROLLBACK_GROUP     | BEGIN              | phil's group#3",                                                                   | Unlogged rollback to mark M1_after_table_rename (timestamp) | _regress_emaj_adm1
 DBLINK_OPEN_CNX    |                    | rlbk#1                                                                             | Status = 1                                                  | _regress_emaj_adm1
 LOCK_GROUP         | BEGIN              | phil's group#3",                                                                   | Rollback session #1                                         | _regress_emaj_adm1
 LOCK_GROUP         | END                | phil's group#3",                                                                   | Rollback session #1: 2 tables locked, 0 deadlock(s)         | _regress_emaj_adm1
 ROLLBACK_GROUP     | TIME STAMP SET     | 14505                                                                              |                                                             | _regress_emaj_adm1
 ROLLBACK_TABLE     | BEGIN              | "phil's schema""3".table_with_very_looooooooooooooooooooooooooooooooooooooong_name | All log rows where emaj_gid > 14500000 and <= 14500006      | _regress_emaj_adm1
 ROLLBACK_TABLE     | END                | "phil's schema""3".table_with_very_looooooooooooooooooooooooooooooooooooooong_name | 10 rolled back primary keys                                 | _regress_emaj_adm1
 ROLLBACK_GROUP     | MARK DELETED       | phil's group#3",                                                                   | mark M2 is deleted                                          | _regress_emaj_adm1
 ROLLBACK_GROUP     | NOTICE             | Rollback id 14500                                                                  | Rollback id = 14500.                                        | _regress_emaj_adm1
 ROLLBACK_GROUP     | NOTICE             | Rollback id 14500                                                                  | 1 / 2 tables effectively processed.                         | _regress_emaj_adm1
 ROLLBACK_GROUP     | NOTICE             | Rollback id 14500                                                                  | 0 / 2 sequences effectively processed.                      | _regress_emaj_adm1
 DBLINK_CLOSE_CNX   |                    | rlbk#1                                                                             |                                                             | _regress_emaj_adm1
 ROLLBACK_GROUP     | END                | phil's group#3",                                                                   | Rollback_id 14500                                           | _regress_emaj_adm1
 STOP_GROUP         | BEGIN              | phil's group#3",                                                                   |                                                             | _regress_emaj_adm1
 STOP_GROUP         | TIME STAMP SET     | 14506                                                                              |                                                             | _regress_emaj_adm1
 LOCK_GROUP         | BEGIN              | phil's group#3",                                                                   |                                                             | _regress_emaj_adm1
 LOCK_GROUP         | END                | phil's group#3",                                                                   | 2 tables locked, 0 deadlock(s)                              | _regress_emaj_adm1
 SET_MARK_GROUP     | BEGIN              | phil's group#3",                                                                   | STOP_%                                                      | _regress_emaj_adm1
 CLEANUP_RLBK_STATE |                    | Rollback id 14500                                                                  | set to COMMITTED                                            | _regress_emaj_adm1
 SET_MARK_GROUP     | END                | phil's group#3",                                                                   | STOP_%                                                      | _regress_emaj_adm1
 STOP_GROUP         | END                | phil's group#3",                                                                   | 4 tables/sequences processed                                | _regress_emaj_adm1
 DROP_GROUP         | BEGIN              | phil's group#3",                                                                   |                                                             | _regress_emaj_adm1
 DROP_GROUP         | TIME STAMP SET     | 14507                                                                              |                                                             | _regress_emaj_adm1
 DROP_GROUP         | LOG_SCHEMA DROPPED | "emaj_phil's schema""3"                                                            |                                                             | _regress_emaj_adm1
 DROP_GROUP         | END                | phil's group#3",                                                                   | 4 tables/sequences processed                                | _regress_emaj_adm1
(58 rows)

-- set sequence restart value
select public.handle_emaj_sequences(14600);
 handle_emaj_sequences 
-----------------------
 
(1 row)

-----------------------------
-- Step 13 : test use of groups or marks protection
-----------------------------
set session_authorization to _regress_emaj_adm2;
-- try to rollback a protected group
select emaj.emaj_protect_group('myGroup2');
 emaj_protect_group 
--------------------
                  1
(1 row)

select * from emaj.emaj_rollback_group('myGroup2','M3',false) order by 1,2;
ERROR:  _check_group_names: The group "myGroup2" is currently protected against rollback operations.
CONTEXT:  PL/pgSQL function emaj._check_group_names(text[],boolean,boolean,boolean,boolean,boolean,boolean) line 97 at RAISE
SQL statement "SELECT emaj._check_group_names(p_groupNames := p_groupNames, p_mayBeNull := FALSE, p_lockGroups := TRUE,
                                     p_checkLogging := TRUE, p_checkRollbackable := TRUE, p_checkUnprotected := TRUE)"
PL/pgSQL function emaj._rlbk_check(text[],text,boolean,boolean) line 16 at SQL statement
SQL statement "SELECT emaj._rlbk_check(p_groupNames, p_mark, p_isAlterGroupAllowed, FALSE)"
PL/pgSQL function emaj._rlbk_init(text[],text,boolean,integer,boolean,boolean,text) line 25 at SQL statement
SQL statement "SELECT emaj._rlbk_init(p_groupNames, p_mark, p_isLoggedRlbk, 1, p_multiGroup, p_isAlterGroupAllowed, p_comment)"
PL/pgSQL function emaj._rlbk_groups(text[],text,boolean,boolean,boolean,text) line 26 at SQL statement
PL/pgSQL function emaj.emaj_rollback_group(text,text,boolean,text) line 8 at RETURN QUERY
select emaj.emaj_unprotect_group('myGroup2');
 emaj_unprotect_group 
----------------------
                    1
(1 row)

-- try to rollback over a protected mark
select emaj.emaj_set_mark_group('myGroup1','Mark_to_protect');
 emaj_set_mark_group 
---------------------
                   7
(1 row)

select emaj.emaj_protect_mark_group('myGroup1','Mark_to_protect');
 emaj_protect_mark_group 
-------------------------
                       1
(1 row)

select * from emaj.emaj_rollback_group('myGroup1','Multi-1',false) order by 1,2;
ERROR:  _rlbk_check: Protected marks (Mark_to_protect) for the group "myGroup1" block the rollback to the mark "Multi-1".
CONTEXT:  PL/pgSQL function emaj._rlbk_check(text[],text,boolean,boolean) line 41 at RAISE
SQL statement "SELECT emaj._rlbk_check(p_groupNames, p_mark, p_isAlterGroupAllowed, FALSE)"
PL/pgSQL function emaj._rlbk_init(text[],text,boolean,integer,boolean,boolean,text) line 25 at SQL statement
SQL statement "SELECT emaj._rlbk_init(p_groupNames, p_mark, p_isLoggedRlbk, 1, p_multiGroup, p_isAlterGroupAllowed, p_comment)"
PL/pgSQL function emaj._rlbk_groups(text[],text,boolean,boolean,boolean,text) line 26 at SQL statement
PL/pgSQL function emaj.emaj_rollback_group(text,text,boolean,text) line 8 at RETURN QUERY
select emaj.emaj_unprotect_mark_group('myGroup1','Mark_to_protect');
 emaj_unprotect_mark_group 
---------------------------
                         1
(1 row)

select emaj.emaj_delete_mark_group('myGroup1','Mark_to_protect');
 emaj_delete_mark_group 
------------------------
                      1
(1 row)

-----------------------------
-- Checking step 13
-----------------------------
select time_id, time_last_emaj_gid, time_event from emaj.emaj_time_stamp where time_id >= 14600 order by time_id;
 time_id | time_last_emaj_gid | time_event 
---------+--------------------+------------
   14600 |           14600000 | M
(1 row)

select hist_function, hist_event, hist_object,
       regexp_replace(regexp_replace(regexp_replace(hist_wording,
            E'\\d\\d\.\\d\\d\\.\\d\\d\\.\\d\\d\\d\\d','%','g'),
            E'\\d\\d\\d\\d/\\d\\d\\/\\d\\d\\ \\d\\d\\:\\d\\d:\\d\\d .*?\\)','<timestamp>)','g'),
            E'\\[.+\\]','(timestamp)','g'), 
       hist_user
  from emaj.emaj_hist where hist_id >= 14600 order by hist_id;
    hist_function     |   hist_event   | hist_object |         regexp_replace          |     hist_user      
----------------------+----------------+-------------+---------------------------------+--------------------
 PROTECT_GROUP        |                | myGroup2    | Status 1                        | _regress_emaj_adm2
 UNPROTECT_GROUP      |                | myGroup2    | Status 1                        | _regress_emaj_adm2
 SET_MARK_GROUP       | BEGIN          | myGroup1    |                                 | _regress_emaj_adm2
 LOCK_GROUP           | BEGIN          | myGroup1    |                                 | _regress_emaj_adm2
 LOCK_GROUP           | END            | myGroup1    | 5 tables locked, 0 deadlock(s)  | _regress_emaj_adm2
 SET_MARK_GROUP       | TIME STAMP SET | 14600       |                                 | _regress_emaj_adm2
 SET_MARK_GROUP       | END            | myGroup1    | Mark_to_protect                 | _regress_emaj_adm2
 PROTECT_MARK_GROUP   |                | myGroup1    | Mark Mark_to_protect ; status 1 | _regress_emaj_adm2
 UNPROTECT_MARK_GROUP |                | myGroup1    | Mark Mark_to_protect ; status 1 | _regress_emaj_adm2
 DELETE_MARK_GROUP    | BEGIN          | myGroup1    | Mark_to_protect                 | _regress_emaj_adm2
 DELETE_MARK_GROUP    | END            | myGroup1    | Mark_to_protect                 | _regress_emaj_adm2
(11 rows)

-- set sequence restart value
select public.handle_emaj_sequences(14700);
 handle_emaj_sequences 
-----------------------
 
(1 row)

-----------------------------
-- Step 14 : test complex use of rollbacks consolidations, with an application trigger kept enabled
-----------------------------
set search_path=public,myschema1;
select emaj.emaj_modify_table('myschema1','mytbl2','{"ignored_triggers":["mytbl2trg2"]}');
 emaj_modify_table 
-------------------
                 1
(1 row)

-- 2 consolidations of 2 logged rollbacks
-- Multi-1 MC1 MC2 RMC1S RMC1D      MC3 MC4 MC5 RMC3S RMC3D
--         ^       lrg(MC1)         ^           lrg(MC3)
--         xxxxxxxxxxxxxxx conso(RMC1D)
-- 	       	                        xxxxxxxxxxxxxxxxxxx conso(RMC3D)
select emaj.emaj_set_mark_group('myGroup1','MC1');
 emaj_set_mark_group 
---------------------
                   7
(1 row)

reset session_authorization;
insert into myTbl1 select i, 'Test', 'Conso' from generate_series (2000,2012) as i;
insert into myTbl2 values (2000,'TC1',NULL);
delete from myTbl1 where col11 > 2010;
set session_authorization to _regress_emaj_adm2;
select emaj.emaj_set_mark_group('myGroup1','MC2');
 emaj_set_mark_group 
---------------------
                   7
(1 row)

reset session_authorization;
update myTbl2 set col22 = 'TC2' WHERE col22 ='TC1';
set session_authorization to _regress_emaj_adm2;
select * from emaj.emaj_logged_rollback_group('myGroup1','MC1',false) order by 1,2;
 rlbk_severity |              rlbk_message              
---------------+----------------------------------------
 Notice        | 1 / 2 sequences effectively processed.
 Notice        | 3 / 5 tables effectively processed.
 Notice        | Rollback id = 14700.
(3 rows)

reset session_authorization;
insert into myTbl2 values (2000,'TC3',NULL);
set session_authorization to _regress_emaj_adm2;
select emaj.emaj_rename_mark_group('myGroup1','EMAJ_LAST_MARK','RLBK_MC1_DONE');
 emaj_rename_mark_group 
------------------------
 
(1 row)

select emaj.emaj_set_mark_group('myGroup1','MC3');
 emaj_set_mark_group 
---------------------
                   7
(1 row)

reset session_authorization;
insert into "myTbl3" (col33) select generate_series(2000,2039,4)/100;
insert into myTbl4 values (2000,'FK...',1,10,'ABC');
update myTbl4 set col44 = NULL where col41 = 2000;
set session_authorization to _regress_emaj_adm2;
select emaj.emaj_set_mark_group('myGroup1','MC4');
 emaj_set_mark_group 
---------------------
                   7
(1 row)

select emaj.emaj_set_mark_group('myGroup1','MC5');
 emaj_set_mark_group 
---------------------
                   7
(1 row)

select * from emaj.emaj_logged_rollback_group('myGroup1','MC3',false) order by 1,2;
 rlbk_severity |              rlbk_message              
---------------+----------------------------------------
 Notice        | 1 / 2 sequences effectively processed.
 Notice        | 2 / 5 tables effectively processed.
 Notice        | Rollback id = 14701.
(3 rows)

select cons_group, regexp_replace(cons_end_rlbk_mark_name,E'\\d\\d\.\\d\\d\\.\\d\\d\\.\\d\\d\\d\\d','%','g'), 
       cons_target_rlbk_mark_name, cons_end_rlbk_mark_time_id, cons_target_rlbk_mark_time_id, cons_rows, cons_marks, cons_marks
  from emaj.emaj_get_consolidable_rollbacks();
 cons_group | regexp_replace  | cons_target_rlbk_mark_name | cons_end_rlbk_mark_time_id | cons_target_rlbk_mark_time_id | cons_rows | cons_marks | cons_marks 
------------+-----------------+----------------------------+----------------------------+-------------------------------+-----------+------------+------------
 myGroup1   | RLBK_MC1_DONE   | MC1                        |                      14704 |                         14701 |        33 |          2 |          2
 myGroup1   | RLBK_14701_DONE | MC3                        |                      14709 |                         14705 |        23 |          3 |          3
(2 rows)

  
-- consolidate both logged rollback at once
select cons_target_rlbk_mark_name, regexp_replace(cons_end_rlbk_mark_name,E'\\d\\d\.\\d\\d\\.\\d\\d\\.\\d\\d\\d\\d','%','g'), 
       emaj.emaj_consolidate_rollback_group(cons_group, cons_end_rlbk_mark_name)
  from emaj.emaj_get_consolidable_rollbacks() where cons_group = 'myGroup1';
 cons_target_rlbk_mark_name | regexp_replace  | emaj_consolidate_rollback_group 
----------------------------+-----------------+---------------------------------
 MC1                        | RLBK_MC1_DONE   |                               5
 MC3                        | RLBK_14701_DONE |                               4
(2 rows)

select cons_group, regexp_replace(cons_end_rlbk_mark_name,E'\\d\\d\.\\d\\d\\.\\d\\d\\.\\d\\d\\d\\d','%','g'), 
       cons_target_rlbk_mark_name, cons_end_rlbk_mark_time_id, cons_target_rlbk_mark_time_id, cons_rows, cons_marks
  from emaj.emaj_get_consolidable_rollbacks();
 cons_group | regexp_replace  | cons_target_rlbk_mark_name | cons_end_rlbk_mark_time_id | cons_target_rlbk_mark_time_id | cons_rows | cons_marks 
------------+-----------------+----------------------------+----------------------------+-------------------------------+-----------+------------
 myGroup1   | RLBK_MC1_DONE   | MC1                        |                      14704 |                         14701 |         0 |          0
 myGroup1   | RLBK_14701_DONE | MC3                        |                      14709 |                         14705 |         0 |          0
(2 rows)

select stat_group, stat_schema, stat_table, stat_first_mark, stat_first_time_id, stat_last_mark, stat_last_time_id, stat_role, stat_verb, stat_rows
  from emaj.emaj_detailed_log_stat_group('myGroup1','Multi-1',NULL);
 stat_group | stat_schema | stat_table | stat_first_mark | stat_first_time_id | stat_last_mark | stat_last_time_id | stat_role | stat_verb | stat_rows 
------------+-------------+------------+-----------------+--------------------+----------------+-------------------+-----------+-----------+-----------
 myGroup1   | myschema1   | mytbl2     | Multi-1         |              14009 |                |                   | postgres  | INSERT    |         1
 myGroup1   | myschema1   | mytbl2b    | Multi-1         |              14009 |                |                   | postgres  | DELETE    |         2
 myGroup1   | myschema1   | mytbl2b    | Multi-1         |              14009 |                |                   | postgres  | INSERT    |         3
 myGroup1   | myschema1   | mytbl2b    | Multi-1         |              14009 |                |                   | postgres  | UPDATE    |         1
(4 rows)

-- 2 consolidations of 2 nested logged rollbacks
-- MC6 MC7 MC8  RMC8S RMC8D M9 RMC6S RMC6D
--         ^    lrg(MC8)
--         xxxxxxxxxxxx conso(RMC8D)
-- ^                           lrb(MC6)
-- xxxxxxxxxxxxxxxxxxxxxxxxxxxxxxxxxxx conso(RMC6D)
select emaj.emaj_set_mark_group('myGroup1','MC6');
 emaj_set_mark_group 
---------------------
                   7
(1 row)

reset session_authorization;
insert into myTbl1 select i, 'Test', 'Conso' from generate_series (2000,2012) as i;
insert into myTbl2 values (3000,'TC6',NULL);
delete from myTbl1 where col11 > 2010;
set session_authorization to _regress_emaj_adm2;
select emaj.emaj_set_mark_group('myGroup1','MC7');
 emaj_set_mark_group 
---------------------
                   7
(1 row)

reset session_authorization;
update myTbl2 set col22 = 'TC7' WHERE col22 ='TC6';
set session_authorization to _regress_emaj_adm2;
select emaj.emaj_set_mark_group('myGroup1','MC8');
 emaj_set_mark_group 
---------------------
                   7
(1 row)

reset session_authorization;
insert into myTbl2 values (3001,'TC8',NULL);
set session_authorization to _regress_emaj_adm2;
select * from emaj.emaj_logged_rollback_group('myGroup1','MC8',false) order by 1,2;
 rlbk_severity |              rlbk_message              
---------------+----------------------------------------
 Notice        | 1 / 2 sequences effectively processed.
 Notice        | 2 / 5 tables effectively processed.
 Notice        | Rollback id = 14702.
(3 rows)

select emaj.emaj_consolidate_rollback_group('myGroup1','EMAJ_LAST_MARK');
 emaj_consolidate_rollback_group 
---------------------------------
                               4
(1 row)

select emaj.emaj_set_mark_group('myGroup1','MC9');
 emaj_set_mark_group 
---------------------
                   7
(1 row)

reset session_authorization;
insert into "myTbl3" (col33) select generate_series(2000,2039,4)/100;
insert into myTbl4 values (2000,'FK...',1,10,'ABC');
update myTbl4 set col44 = NULL where col41 = 2000;
set session_authorization to _regress_emaj_adm2;
select * from emaj.emaj_logged_rollback_group('myGroup1','MC6',false) order by 1,2;
 rlbk_severity |              rlbk_message              
---------------+----------------------------------------
 Notice        | 2 / 2 sequences effectively processed.
 Notice        | 5 / 5 tables effectively processed.
 Notice        | Rollback id = 14703.
(3 rows)

select emaj.emaj_consolidate_rollback_group('myGroup1','EMAJ_LAST_MARK');
 emaj_consolidate_rollback_group 
---------------------------------
                               7
(1 row)

select stat_group, stat_schema, stat_table, stat_first_mark, stat_first_time_id, stat_last_mark, stat_last_time_id, stat_role, stat_verb, stat_rows
  from emaj.emaj_detailed_log_stat_group('myGroup1','Multi-1',NULL);
 stat_group | stat_schema | stat_table | stat_first_mark | stat_first_time_id | stat_last_mark | stat_last_time_id | stat_role | stat_verb | stat_rows 
------------+-------------+------------+-----------------+--------------------+----------------+-------------------+-----------+-----------+-----------
 myGroup1   | myschema1   | mytbl2     | Multi-1         |              14009 |                |                   | postgres  | INSERT    |         1
 myGroup1   | myschema1   | mytbl2b    | Multi-1         |              14009 |                |                   | postgres  | DELETE    |         2
 myGroup1   | myschema1   | mytbl2b    | Multi-1         |              14009 |                |                   | postgres  | INSERT    |         3
 myGroup1   | myschema1   | mytbl2b    | Multi-1         |              14009 |                |                   | postgres  | UPDATE    |         1
(4 rows)

-- consolidation of 2 logged rollbacks referencing the same mark
-- MC10  RMC10S RMC10D M11 RMC10S RMC10D
-- ^     lrg(MC10)
-- ^                       lrb(MC10)
-- xxxxxxxxxxxxxxxxxxxxxxxxxxxxxxx conso(RMC10D)
select emaj.emaj_set_mark_group('myGroup1','MC10');
 emaj_set_mark_group 
---------------------
                   7
(1 row)

reset session_authorization;
insert into myTbl1 select i, 'Test', 'Conso' from generate_series (3000,3010) as i;
delete from myTbl1 where col11 > 3005;
set session_authorization to _regress_emaj_adm2;
select * from emaj.emaj_logged_rollback_group('myGroup1','MC10',false) order by 1,2;
 rlbk_severity |              rlbk_message              
---------------+----------------------------------------
 Notice        | 0 / 2 sequences effectively processed.
 Notice        | 1 / 5 tables effectively processed.
 Notice        | Rollback id = 14704.
(3 rows)

reset session_authorization;
update myTbl2 set col22 = 'TC7' WHERE col22 ='TC6';
set session_authorization to _regress_emaj_adm2;
select emaj.emaj_set_mark_group('myGroup1','MC11');
 emaj_set_mark_group 
---------------------
                   7
(1 row)

reset session_authorization;
insert into myTbl4 values (3000,'FK...',1,10,'ABC');
update myTbl4 set col44 = NULL where col41 = 3000;
set session_authorization to _regress_emaj_adm2;
select * from emaj.emaj_logged_rollback_group('myGroup1','MC10',false) order by 1,2;
 rlbk_severity |              rlbk_message              
---------------+----------------------------------------
 Notice        | 0 / 2 sequences effectively processed.
 Notice        | 2 / 5 tables effectively processed.
 Notice        | Rollback id = 14705.
(3 rows)

select emaj.emaj_consolidate_rollback_group('myGroup1','EMAJ_LAST_MARK');
 emaj_consolidate_rollback_group 
---------------------------------
                               4
(1 row)

select stat_group, stat_schema, stat_table, stat_first_mark, stat_first_time_id, stat_last_mark, stat_last_time_id, stat_role, stat_verb, stat_rows
  from emaj.emaj_detailed_log_stat_group('myGroup1','Multi-1',NULL);
 stat_group | stat_schema | stat_table | stat_first_mark | stat_first_time_id | stat_last_mark | stat_last_time_id | stat_role | stat_verb | stat_rows 
------------+-------------+------------+-----------------+--------------------+----------------+-------------------+-----------+-----------+-----------
 myGroup1   | myschema1   | mytbl2     | Multi-1         |              14009 |                |                   | postgres  | INSERT    |         1
 myGroup1   | myschema1   | mytbl2b    | Multi-1         |              14009 |                |                   | postgres  | DELETE    |         2
 myGroup1   | myschema1   | mytbl2b    | Multi-1         |              14009 |                |                   | postgres  | INSERT    |         3
 myGroup1   | myschema1   | mytbl2b    | Multi-1         |              14009 |                |                   | postgres  | UPDATE    |         1
(4 rows)

-- consolidation of 1 from 2 overlapping logged rollbacks
-- MC15 MC16 RMC15S RMC15D MC17 RMC16S RMC16D
-- ^         lrg(MC15)
--      ^                       lrg(MC16)
-- xxxxxxxxxxxxxxxxx conso(RMC15D)
select emaj.emaj_set_mark_group('myGroup1','MC15');
 emaj_set_mark_group 
---------------------
                   7
(1 row)

reset session_authorization;
insert into myTbl1 select i, 'Test', 'Conso' from generate_series (4000,4012) as i;
insert into myTbl2 values (4000,'TC15',NULL);
delete from myTbl1 where col11 > 4010;
set session_authorization to _regress_emaj_adm2;
select emaj.emaj_set_mark_group('myGroup1','MC16');
 emaj_set_mark_group 
---------------------
                   7
(1 row)

reset session_authorization;
update myTbl2 set col22 = 'TC16' WHERE col22 ='TC15';
set session_authorization to _regress_emaj_adm2;
select * from emaj.emaj_logged_rollback_group('myGroup1','MC15',false) order by 1,2;
 rlbk_severity |              rlbk_message              
---------------+----------------------------------------
 Notice        | 1 / 2 sequences effectively processed.
 Notice        | 3 / 5 tables effectively processed.
 Notice        | Rollback id = 14706.
(3 rows)

select emaj.emaj_rename_mark_group('myGroup1','EMAJ_LAST_MARK','RLBK_MC15_DONE');
 emaj_rename_mark_group 
------------------------
 
(1 row)

select emaj.emaj_set_mark_group('myGroup1','MC17');
 emaj_set_mark_group 
---------------------
                   7
(1 row)

reset session_authorization;
insert into myTbl2 values (4001,'TC15',NULL);
set session_authorization to _regress_emaj_adm2;
select * from emaj.emaj_logged_rollback_group('myGroup1','MC16',false) order by 1,2;
 rlbk_severity |              rlbk_message              
---------------+----------------------------------------
 Notice        | 0 / 2 sequences effectively processed.
 Notice        | 3 / 5 tables effectively processed.
 Notice        | Rollback id = 14707.
(3 rows)

select emaj.emaj_consolidate_rollback_group('myGroup1','RLBK_MC15_DONE');
 emaj_consolidate_rollback_group 
---------------------------------
                               5
(1 row)

select stat_group, stat_schema, stat_table, stat_first_mark, stat_first_time_id, stat_last_mark, stat_last_time_id, stat_role, stat_verb, stat_rows
  from emaj.emaj_detailed_log_stat_group('myGroup1','Multi-1',NULL);
 stat_group | stat_schema | stat_table | stat_first_mark | stat_first_time_id | stat_last_mark | stat_last_time_id |     stat_role      | stat_verb | stat_rows 
------------+-------------+------------+-----------------+--------------------+----------------+-------------------+--------------------+-----------+-----------
 myGroup1   | myschema1   | mytbl1     | Multi-1         |              14009 |                |                   | _regress_emaj_adm2 | INSERT    |        11
 myGroup1   | myschema1   | mytbl2     | Multi-1         |              14009 |                |                   | _regress_emaj_adm2 | DELETE    |         1
 myGroup1   | myschema1   | mytbl2     | Multi-1         |              14009 |                |                   | _regress_emaj_adm2 | INSERT    |         1
 myGroup1   | myschema1   | mytbl2     | Multi-1         |              14009 |                |                   | postgres           | INSERT    |         2
 myGroup1   | myschema1   | mytbl2b    | Multi-1         |              14009 |                |                   | _regress_emaj_adm2 | DELETE    |         1
 myGroup1   | myschema1   | mytbl2b    | Multi-1         |              14009 |                |                   | _regress_emaj_adm2 | INSERT    |         1
 myGroup1   | myschema1   | mytbl2b    | Multi-1         |              14009 |                |                   | postgres           | DELETE    |         2
 myGroup1   | myschema1   | mytbl2b    | Multi-1         |              14009 |                |                   | postgres           | INSERT    |         4
 myGroup1   | myschema1   | mytbl2b    | Multi-1         |              14009 |                |                   | postgres           | UPDATE    |         1
(9 rows)

reset session_authorization;
select * from myTbl1 order by col11;
 col11 |   col12    |    col13     
-------+------------+--------------
     2 | ABC        | \x1c
     3 | ABC        | \x1c
     4 | ABC        | \x0c
     5 | ABC        | \x0c
     6 | ABC        | \x0c
     7 | ABC        | \x0c
     8 | ABC        | \x0c
     9 | ABC        | \x0c
    10 | ABC        | \x0c
   100 | DEF        | \x00
   101 | DEF        | \x00
   102 | DEF        | \x00
   103 | DEF        | \x00
   104 | DEF        | \x00
   105 | DEF        | \x00
   106 | DEF        | \x00
   107 | DEF        | \x00
   108 | DEF        | \x00
   109 | DEF        | \x00
   110 | DEF        | \x00
  4000 | Test       | \x436f6e736f
  4001 | Test       | \x436f6e736f
  4002 | Test       | \x436f6e736f
  4003 | Test       | \x436f6e736f
  4004 | Test       | \x436f6e736f
  4005 | Test       | \x436f6e736f
  4006 | Test       | \x436f6e736f
  4007 | Test       | \x436f6e736f
  4008 | Test       | \x436f6e736f
  4009 | Test       | \x436f6e736f
  4010 | Test       | \x436f6e736f
(31 rows)

select * from myTbl2 order by col21;
 col21 | col22 |   col23    
-------+-------+------------
     1 | ABC   | 12-31-2010
     2 | DEF   | 
     3 | GHI   | 01-02-2010
  2000 | TC3   | 
  4000 | TC15  | 
(5 rows)

-----------------------------
-- Checking step 14
-----------------------------
set session_authorization to _regress_emaj_adm2;
select mark_group, regexp_replace(mark_name,E'\\d\\d\.\\d\\d\\.\\d\\d\\.\\d\\d\\d\\d','%','g'), mark_time_id, mark_is_rlbk_protected, mark_comment, mark_log_rows_before_next, mark_logged_rlbk_target_mark from emaj.emaj_mark where mark_group = 'myGroup1' order by mark_time_id, mark_group;
 mark_group |        regexp_replace        | mark_time_id | mark_is_rlbk_protected |                   mark_comment                   | mark_log_rows_before_next | mark_logged_rlbk_target_mark 
------------+------------------------------+--------------+------------------------+--------------------------------------------------+---------------------------+------------------------------
 myGroup1   | M4                           |        12501 | f                      |                                                  |                        10 | 
 myGroup1   | M5                           |        12502 | f                      |                                                  |                         3 | 
 myGroup1   | Before logged rollback to M4 |        12701 | f                      | Automatically set at rollback to mark M4 start   |                        28 | 
 myGroup1   | STOP_%                       |        14000 | f                      |                                                  |                         0 | 
 myGroup1   | Stop after rollback          |        14007 | f                      |                                                  |                         0 | 
 myGroup1   | Multi-1                      |        14009 | f                      |                                                  |                        10 | 
 myGroup1   | MODIFY_%                     |        14700 | f                      |                                                  |                         0 | 
 myGroup1   | MC1                          |        14701 | f                      |                                                  |                         0 | 
 myGroup1   | RLBK_MC1_DONE                |        14704 | f                      | Automatically set at rollback to mark MC1 end    |                         2 | MC1
 myGroup1   | MC3                          |        14705 | f                      |                                                  |                         0 | 
 myGroup1   | RLBK_14701_DONE              |        14709 | f                      | Automatically set at rollback to mark MC3 end    |                         0 | MC3
 myGroup1   | MC6                          |        14710 | f                      |                                                  |                         0 | 
 myGroup1   | RLBK_14703_DONE              |        14717 | f                      | Automatically set at rollback to mark MC6 end    |                         0 | MC6
 myGroup1   | MC10                         |        14718 | f                      |                                                  |                         0 | 
 myGroup1   | RLBK_14705_DONE              |        14723 | f                      | Automatically set at rollback to mark MC10 end   |                         0 | MC10
 myGroup1   | MC15                         |        14724 | f                      |                                                  |                         0 | 
 myGroup1   | RLBK_MC15_DONE               |        14727 | f                      | Automatically set at rollback to mark MC15 end   |                         0 | MC15
 myGroup1   | MC17                         |        14728 | f                      |                                                  |                         2 | 
 myGroup1   | RLBK_14707_START             |        14729 | f                      | Automatically set at rollback to mark MC16 start |                        15 | 
 myGroup1   | RLBK_14707_DONE              |        14730 | f                      | Automatically set at rollback to mark MC16 end   |                           | 
(20 rows)

select sequ_schema, sequ_name, sequ_time_id, sequ_last_val, sequ_is_called from emaj.emaj_sequence where sequ_schema = 'emaj_myschema1' order by sequ_time_id, sequ_schema, sequ_name;
 sequ_schema | sequ_name | sequ_time_id | sequ_last_val | sequ_is_called 
-------------+-----------+--------------+---------------+----------------
(0 rows)

select tbl_schema, tbl_name, tbl_time_id, tbl_log_seq_last_val from emaj.emaj_table where tbl_schema = 'myschema1' order by tbl_time_id, tbl_schema, tbl_name;
 tbl_schema | tbl_name | tbl_time_id | tbl_log_seq_last_val 
------------+----------+-------------+----------------------
 myschema1  | myTbl3   |       12501 |                   10
 myschema1  | mytbl1   |       12501 |                   30
 myschema1  | mytbl2   |       12501 |                    3
 myschema1  | mytbl2b  |       12501 |                    3
 myschema1  | mytbl4   |       12501 |                    8
 myschema1  | myTbl3   |       12502 |                   20
 myschema1  | mytbl1   |       12502 |                   30
 myschema1  | mytbl2   |       12502 |                    3
 myschema1  | mytbl2b  |       12502 |                    3
 myschema1  | mytbl4   |       12502 |                    8
 myschema1  | myTbl3   |       12701 |                   20
 myschema1  | mytbl1   |       12701 |                   32
 myschema1  | mytbl2   |       12701 |                    3
 myschema1  | mytbl2b  |       12701 |                    3
 myschema1  | mytbl4   |       12701 |                   12
 myschema1  | myTbl3   |       14000 |                   45
 myschema1  | mytbl1   |       14000 |                   33
 myschema1  | mytbl2   |       14000 |                    3
 myschema1  | mytbl2b  |       14000 |                    3
 myschema1  | mytbl4   |       14000 |                   14
 myschema1  | myTbl3   |       14001 |                   45
 myschema1  | mytbl1   |       14001 |                   33
 myschema1  | mytbl2   |       14001 |                    3
 myschema1  | mytbl2b  |       14001 |                    3
 myschema1  | mytbl4   |       14001 |                   14
 myschema1  | myTbl3   |       14007 |                   45
 myschema1  | mytbl1   |       14007 |                   33
 myschema1  | mytbl2   |       14007 |                    3
 myschema1  | mytbl2b  |       14007 |                    3
 myschema1  | mytbl4   |       14007 |                   14
 myschema1  | myTbl3   |       14009 |                   45
 myschema1  | mytbl1   |       14009 |                   33
 myschema1  | mytbl2   |       14009 |                    3
 myschema1  | mytbl2b  |       14009 |                    3
 myschema1  | mytbl4   |       14009 |                   14
 myschema1  | myTbl3   |       14700 |                   45
 myschema1  | mytbl1   |       14700 |                   53
 myschema1  | mytbl2   |       14700 |                    3
 myschema1  | mytbl2b  |       14700 |                   13
 myschema1  | mytbl4   |       14700 |                   14
 myschema1  | myTbl3   |       14701 |                   45
 myschema1  | mytbl1   |       14701 |                   53
 myschema1  | mytbl2   |       14701 |                    3
 myschema1  | mytbl2b  |       14701 |                   13
 myschema1  | mytbl4   |       14701 |                   14
 myschema1  | myTbl3   |       14704 |                   45
 myschema1  | mytbl1   |       14704 |                   79
 myschema1  | mytbl2   |       14704 |                    6
 myschema1  | mytbl2b  |       14704 |                   17
 myschema1  | mytbl4   |       14704 |                   14
 myschema1  | myTbl3   |       14705 |                   45
 myschema1  | mytbl1   |       14705 |                   79
 myschema1  | mytbl2   |       14705 |                    7
 myschema1  | mytbl2b  |       14705 |                   18
 myschema1  | mytbl4   |       14705 |                   14
 myschema1  | myTbl3   |       14709 |                   65
 myschema1  | mytbl1   |       14709 |                   79
 myschema1  | mytbl2   |       14709 |                    7
 myschema1  | mytbl2b  |       14709 |                   18
 myschema1  | mytbl4   |       14709 |                   17
 myschema1  | myTbl3   |       14710 |                   65
 myschema1  | mytbl1   |       14710 |                   79
 myschema1  | mytbl2   |       14710 |                    7
 myschema1  | mytbl2b  |       14710 |                   18
 myschema1  | mytbl4   |       14710 |                   17
 myschema1  | myTbl3   |       14717 |                   85
 myschema1  | mytbl1   |       14717 |                  105
 myschema1  | mytbl2   |       14717 |                   12
 myschema1  | mytbl2b  |       14717 |                   24
 myschema1  | mytbl4   |       14717 |                   20
 myschema1  | myTbl3   |       14718 |                   85
 myschema1  | mytbl1   |       14718 |                  105
 myschema1  | mytbl2   |       14718 |                   12
 myschema1  | mytbl2b  |       14718 |                   24
 myschema1  | mytbl4   |       14718 |                   20
 myschema1  | myTbl3   |       14723 |                   85
 myschema1  | mytbl1   |       14723 |                  127
 myschema1  | mytbl2   |       14723 |                   12
 myschema1  | mytbl2b  |       14723 |                   24
 myschema1  | mytbl4   |       14723 |                   23
 myschema1  | myTbl3   |       14724 |                   85
 myschema1  | mytbl1   |       14724 |                  127
 myschema1  | mytbl2   |       14724 |                   12
 myschema1  | mytbl2b  |       14724 |                   24
 myschema1  | mytbl4   |       14724 |                   23
 myschema1  | myTbl3   |       14727 |                   85
 myschema1  | mytbl1   |       14727 |                  153
 myschema1  | mytbl2   |       14727 |                   15
 myschema1  | mytbl2b  |       14727 |                   28
 myschema1  | mytbl4   |       14727 |                   23
 myschema1  | myTbl3   |       14728 |                   85
 myschema1  | mytbl1   |       14728 |                  153
 myschema1  | mytbl2   |       14728 |                   15
 myschema1  | mytbl2b  |       14728 |                   28
 myschema1  | mytbl4   |       14728 |                   23
 myschema1  | myTbl3   |       14729 |                   85
 myschema1  | mytbl1   |       14729 |                  153
 myschema1  | mytbl2   |       14729 |                   16
 myschema1  | mytbl2b  |       14729 |                   29
 myschema1  | mytbl4   |       14729 |                   23
 myschema1  | myTbl3   |       14730 |                   85
 myschema1  | mytbl1   |       14730 |                  164
 myschema1  | mytbl2   |       14730 |                   18
 myschema1  | mytbl2b  |       14730 |                   31
 myschema1  | mytbl4   |       14730 |                   23
(105 rows)

select sqhl_schema, sqhl_table, sqhl_begin_time_id, sqhl_end_time_id, sqhl_hole_size from emaj.emaj_seq_hole where sqhl_schema = 'myschema1' order by 1,2,3;
 sqhl_schema | sqhl_table | sqhl_begin_time_id | sqhl_end_time_id | sqhl_hole_size 
-------------+------------+--------------------+------------------+----------------
 myschema1   | myTbl3     |              14705 |            14709 |             20
 myschema1   | myTbl3     |              14710 |            14717 |             20
 myschema1   | mytbl1     |              12502 |            12700 |              1
 myschema1   | mytbl1     |              14009 |            14300 |             20
 myschema1   | mytbl1     |              14701 |            14704 |             26
 myschema1   | mytbl1     |              14710 |            14717 |             26
 myschema1   | mytbl1     |              14718 |            14723 |             22
 myschema1   | mytbl1     |              14724 |            14727 |             26
 myschema1   | mytbl2     |              14701 |            14704 |              3
 myschema1   | mytbl2     |              14710 |            14717 |              5
 myschema1   | mytbl2     |              14724 |            14727 |              3
 myschema1   | mytbl2b    |              14701 |            14704 |              4
 myschema1   | mytbl2b    |              14710 |            14717 |              6
 myschema1   | mytbl2b    |              14724 |            14727 |              4
 myschema1   | mytbl4     |              12502 |            12700 |              2
 myschema1   | mytbl4     |              14705 |            14709 |              3
 myschema1   | mytbl4     |              14710 |            14717 |              3
 myschema1   | mytbl4     |              14718 |            14723 |              3
(18 rows)

select time_id, time_last_emaj_gid, time_event from emaj.emaj_time_stamp where time_id >= 14700 order by time_id;
 time_id | time_last_emaj_gid | time_event 
---------+--------------------+------------
   14700 |           14700000 | A
   14701 |           14700000 | M
   14702 |           14700017 | M
   14703 |           14700019 | R
   14704 |           14700033 | M
   14705 |           14700035 | M
   14706 |           14700047 | M
   14707 |           14700047 | M
   14708 |           14700047 | R
   14709 |           14700058 | M
   14710 |           14700058 | M
   14711 |           14700075 | M
   14712 |           14700077 | M
   14713 |           14700079 | R
   14714 |           14700081 | M
   14715 |           14700081 | M
   14716 |           14700093 | R
   14717 |           14700118 | M
   14718 |           14700118 | M
   14719 |           14700134 | R
   14720 |           14700140 | M
   14721 |           14700140 | M
   14722 |           14700142 | R
   14723 |           14700143 | M
   14724 |           14700143 | M
   14725 |           14700160 | M
   14726 |           14700162 | R
   14727 |           14700176 | M
   14728 |           14700176 | M
   14729 |           14700178 | R
   14730 |           14700193 | M
(31 rows)

select hist_function, hist_event, hist_object,
       regexp_replace(regexp_replace(regexp_replace(hist_wording,
            E'\\d\\d\.\\d\\d\\.\\d\\d\\.\\d\\d\\d\\d','%','g'),
            E'\\d\\d\\d\\d/\\d\\d\\/\\d\\d\\ \\d\\d\\:\\d\\d:\\d\\d .*?\\)','<timestamp>)','g'),
            E'\\[.+\\]','(timestamp)','g'), 
       hist_user
  from emaj.emaj_hist where hist_id >= 14700 order by hist_id;
     hist_function      |         hist_event         |         hist_object          |                                           regexp_replace                                           |     hist_user      
------------------------+----------------------------+------------------------------+----------------------------------------------------------------------------------------------------+--------------------
 MODIFY_TABLE           | BEGIN                      |                              |                                                                                                    | _regress_emaj_adm2
 MODIFY_TABLE           | TIME STAMP SET             | 14700                        |                                                                                                    | _regress_emaj_adm2
 LOCK_GROUP             | BEGIN                      | myGroup1                     |                                                                                                    | _regress_emaj_adm2
 LOCK_GROUP             | END                        | myGroup1                     | 5 tables locked, 0 deadlock(s)                                                                     | _regress_emaj_adm2
 SET_MARK_GROUPS        | BEGIN                      | myGroup1                     | MODIFY_%                                                                                           | _regress_emaj_adm2
 SET_MARK_GROUPS        | END                        | myGroup1                     | MODIFY_%                                                                                           | _regress_emaj_adm2
 MODIFY_TABLE           | TRIGGERS TO IGNORE CHANGED | myschema1.mytbl2             | none => {mytbl2trg2}                                                                               | _regress_emaj_adm2
 MODIFY_TABLE           | END                        |                              | 1 tables effectively modified                                                                      | _regress_emaj_adm2
 SET_MARK_GROUP         | BEGIN                      | myGroup1                     |                                                                                                    | _regress_emaj_adm2
 LOCK_GROUP             | BEGIN                      | myGroup1                     |                                                                                                    | _regress_emaj_adm2
 LOCK_GROUP             | END                        | myGroup1                     | 5 tables locked, 0 deadlock(s)                                                                     | _regress_emaj_adm2
 SET_MARK_GROUP         | TIME STAMP SET             | 14701                        |                                                                                                    | _regress_emaj_adm2
 SET_MARK_GROUP         | END                        | myGroup1                     | MC1                                                                                                | _regress_emaj_adm2
 SET_MARK_GROUP         | BEGIN                      | myGroup1                     |                                                                                                    | _regress_emaj_adm2
 LOCK_GROUP             | BEGIN                      | myGroup1                     |                                                                                                    | _regress_emaj_adm2
 LOCK_GROUP             | END                        | myGroup1                     | 5 tables locked, 0 deadlock(s)                                                                     | _regress_emaj_adm2
 SET_MARK_GROUP         | TIME STAMP SET             | 14702                        |                                                                                                    | _regress_emaj_adm2
 SET_MARK_GROUP         | END                        | myGroup1                     | MC2                                                                                                | _regress_emaj_adm2
 ROLLBACK_GROUP         | BEGIN                      | myGroup1                     | Logged rollback to mark MC1 (timestamp)                                                            | _regress_emaj_adm2
 DBLINK_OPEN_CNX        |                            | rlbk#1                       | Status = 1                                                                                         | _regress_emaj_adm2
 LOCK_GROUP             | BEGIN                      | myGroup1                     | Rollback session #1                                                                                | _regress_emaj_adm2
 LOCK_GROUP             | END                        | myGroup1                     | Rollback session #1: 5 tables locked, 0 deadlock(s)                                                | _regress_emaj_adm2
 ROLLBACK_GROUP         | TIME STAMP SET             | 14703                        |                                                                                                    | _regress_emaj_adm2
 SET_MARK_GROUP         | BEGIN                      | myGroup1                     | RLBK_14700_START                                                                                   | _regress_emaj_adm2
 SET_MARK_GROUP         | END                        | myGroup1                     | RLBK_14700_START                                                                                   | _regress_emaj_adm2
 ROLLBACK_SEQUENCE      |                            | myschema1.mytbl2b_col20_seq  | RESTART 8                                                                                          | _regress_emaj_adm2
 ROLLBACK_TABLE         | BEGIN                      | myschema1.mytbl1             | All log rows where emaj_gid > 14700000 and <= 14700019, in session_replication_role = replica mode | _regress_emaj_adm2
 ROLLBACK_TABLE         | END                        | myschema1.mytbl1             | 13 rolled back primary keys                                                                        | _regress_emaj_adm2
 ROLLBACK_TABLE         | BEGIN                      | myschema1.mytbl2             | All log rows where emaj_gid > 14700000 and <= 14700019, in session_replication_role = replica mode | _regress_emaj_adm2
 ROLLBACK_TABLE         | END                        | myschema1.mytbl2             | 1 rolled back primary keys                                                                         | _regress_emaj_adm2
 ROLLBACK_TABLE         | BEGIN                      | myschema1.mytbl2b            | All log rows where emaj_gid > 14700000 and <= 14700019                                             | _regress_emaj_adm2
 ROLLBACK_TABLE         | END                        | myschema1.mytbl2b            | 2 rolled back primary keys                                                                         | _regress_emaj_adm2
 ROLLBACK_GROUP         | TIME STAMP SET             | 14704                        |                                                                                                    | _regress_emaj_adm1
 SET_MARK_GROUP         | BEGIN                      | myGroup1                     | RLBK_14700_DONE                                                                                    | _regress_emaj_adm2
 SET_MARK_GROUP         | END                        | myGroup1                     | RLBK_14700_DONE                                                                                    | _regress_emaj_adm2
 ROLLBACK_GROUP         | NOTICE                     | Rollback id 14700            | Rollback id = 14700.                                                                               | _regress_emaj_adm2
 ROLLBACK_GROUP         | NOTICE                     | Rollback id 14700            | 3 / 5 tables effectively processed.                                                                | _regress_emaj_adm2
 ROLLBACK_GROUP         | NOTICE                     | Rollback id 14700            | 1 / 2 sequences effectively processed.                                                             | _regress_emaj_adm2
 DBLINK_CLOSE_CNX       |                            | rlbk#1                       |                                                                                                    | _regress_emaj_adm2
 ROLLBACK_GROUP         | END                        | myGroup1                     | Rollback_id 14700                                                                                  | _regress_emaj_adm2
 RENAME_MARK_GROUP      | BEGIN                      | myGroup1                     | EMAJ_LAST_MARK                                                                                     | _regress_emaj_adm2
 RENAME_MARK_GROUP      | END                        | myGroup1                     | RLBK_14700_DONE renamed RLBK_MC1_DONE                                                              | _regress_emaj_adm2
 SET_MARK_GROUP         | BEGIN                      | myGroup1                     |                                                                                                    | _regress_emaj_adm2
 LOCK_GROUP             | BEGIN                      | myGroup1                     |                                                                                                    | _regress_emaj_adm2
 LOCK_GROUP             | END                        | myGroup1                     | 5 tables locked, 0 deadlock(s)                                                                     | _regress_emaj_adm2
 SET_MARK_GROUP         | TIME STAMP SET             | 14705                        |                                                                                                    | _regress_emaj_adm2
 CLEANUP_RLBK_STATE     |                            | Rollback id 14700            | set to COMMITTED                                                                                   | _regress_emaj_adm2
 SET_MARK_GROUP         | END                        | myGroup1                     | MC3                                                                                                | _regress_emaj_adm2
 SET_MARK_GROUP         | BEGIN                      | myGroup1                     |                                                                                                    | _regress_emaj_adm2
 LOCK_GROUP             | BEGIN                      | myGroup1                     |                                                                                                    | _regress_emaj_adm2
 LOCK_GROUP             | END                        | myGroup1                     | 5 tables locked, 0 deadlock(s)                                                                     | _regress_emaj_adm2
 SET_MARK_GROUP         | TIME STAMP SET             | 14706                        |                                                                                                    | _regress_emaj_adm2
 SET_MARK_GROUP         | END                        | myGroup1                     | MC4                                                                                                | _regress_emaj_adm2
 SET_MARK_GROUP         | BEGIN                      | myGroup1                     |                                                                                                    | _regress_emaj_adm2
 LOCK_GROUP             | BEGIN                      | myGroup1                     |                                                                                                    | _regress_emaj_adm2
 LOCK_GROUP             | END                        | myGroup1                     | 5 tables locked, 0 deadlock(s)                                                                     | _regress_emaj_adm2
 SET_MARK_GROUP         | TIME STAMP SET             | 14707                        |                                                                                                    | _regress_emaj_adm2
 SET_MARK_GROUP         | END                        | myGroup1                     | MC5                                                                                                | _regress_emaj_adm2
 ROLLBACK_GROUP         | BEGIN                      | myGroup1                     | Logged rollback to mark MC3 (timestamp)                                                            | _regress_emaj_adm2
 DBLINK_OPEN_CNX        |                            | rlbk#1                       | Status = 1                                                                                         | _regress_emaj_adm2
 LOCK_GROUP             | BEGIN                      | myGroup1                     | Rollback session #1                                                                                | _regress_emaj_adm2
 LOCK_GROUP             | END                        | myGroup1                     | Rollback session #1: 5 tables locked, 0 deadlock(s)                                                | _regress_emaj_adm2
 ROLLBACK_GROUP         | TIME STAMP SET             | 14708                        |                                                                                                    | _regress_emaj_adm2
 SET_MARK_GROUP         | BEGIN                      | myGroup1                     | RLBK_14701_START                                                                                   | _regress_emaj_adm2
 SET_MARK_GROUP         | END                        | myGroup1                     | RLBK_14701_START                                                                                   | _regress_emaj_adm2
 ROLLBACK_SEQUENCE      |                            | myschema1."myTbl3_col31_seq" | RESTART 21                                                                                         | _regress_emaj_adm2
 ROLLBACK_TABLE         | BEGIN                      | myschema1."myTbl3"           | All log rows where emaj_gid > 14700035 and <= 14700047                                             | _regress_emaj_adm2
 ROLLBACK_TABLE         | END                        | myschema1."myTbl3"           | 10 rolled back primary keys                                                                        | _regress_emaj_adm2
 ROLLBACK_TABLE         | BEGIN                      | myschema1.mytbl4             | All log rows where emaj_gid > 14700035 and <= 14700047, in session_replication_role = replica mode | _regress_emaj_adm2
 ROLLBACK_TABLE         | END                        | myschema1.mytbl4             | 1 rolled back primary keys                                                                         | _regress_emaj_adm2
 ROLLBACK_GROUP         | TIME STAMP SET             | 14709                        |                                                                                                    | _regress_emaj_adm1
 SET_MARK_GROUP         | BEGIN                      | myGroup1                     | RLBK_14701_DONE                                                                                    | _regress_emaj_adm2
 SET_MARK_GROUP         | END                        | myGroup1                     | RLBK_14701_DONE                                                                                    | _regress_emaj_adm2
 ROLLBACK_GROUP         | NOTICE                     | Rollback id 14701            | Rollback id = 14701.                                                                               | _regress_emaj_adm2
 ROLLBACK_GROUP         | NOTICE                     | Rollback id 14701            | 2 / 5 tables effectively processed.                                                                | _regress_emaj_adm2
 ROLLBACK_GROUP         | NOTICE                     | Rollback id 14701            | 1 / 2 sequences effectively processed.                                                             | _regress_emaj_adm2
 DBLINK_CLOSE_CNX       |                            | rlbk#1                       |                                                                                                    | _regress_emaj_adm2
 ROLLBACK_GROUP         | END                        | myGroup1                     | Rollback_id 14701                                                                                  | _regress_emaj_adm2
 CONSOLIDATE_RLBK_GROUP | BEGIN                      | myGroup1                     | Erase all between marks MC1 and RLBK_MC1_DONE                                                      | _regress_emaj_adm2
 CONSOLIDATE_RLBK_GROUP | END                        | myGroup1                     | 3 tables and 2 sequences processed ; 2 marks deleted                                               | _regress_emaj_adm2
 CONSOLIDATE_RLBK_GROUP | BEGIN                      | myGroup1                     | Erase all between marks MC3 and RLBK_14701_DONE                                                    | _regress_emaj_adm2
 CONSOLIDATE_RLBK_GROUP | END                        | myGroup1                     | 2 tables and 2 sequences processed ; 3 marks deleted                                               | _regress_emaj_adm2
 SET_MARK_GROUP         | BEGIN                      | myGroup1                     |                                                                                                    | _regress_emaj_adm2
 LOCK_GROUP             | BEGIN                      | myGroup1                     |                                                                                                    | _regress_emaj_adm2
 LOCK_GROUP             | END                        | myGroup1                     | 5 tables locked, 0 deadlock(s)                                                                     | _regress_emaj_adm2
 SET_MARK_GROUP         | TIME STAMP SET             | 14710                        |                                                                                                    | _regress_emaj_adm2
 CLEANUP_RLBK_STATE     |                            | Rollback id 14701            | set to COMMITTED                                                                                   | _regress_emaj_adm2
 SET_MARK_GROUP         | END                        | myGroup1                     | MC6                                                                                                | _regress_emaj_adm2
 SET_MARK_GROUP         | BEGIN                      | myGroup1                     |                                                                                                    | _regress_emaj_adm2
 LOCK_GROUP             | BEGIN                      | myGroup1                     |                                                                                                    | _regress_emaj_adm2
 LOCK_GROUP             | END                        | myGroup1                     | 5 tables locked, 0 deadlock(s)                                                                     | _regress_emaj_adm2
 SET_MARK_GROUP         | TIME STAMP SET             | 14711                        |                                                                                                    | _regress_emaj_adm2
 SET_MARK_GROUP         | END                        | myGroup1                     | MC7                                                                                                | _regress_emaj_adm2
 SET_MARK_GROUP         | BEGIN                      | myGroup1                     |                                                                                                    | _regress_emaj_adm2
 LOCK_GROUP             | BEGIN                      | myGroup1                     |                                                                                                    | _regress_emaj_adm2
 LOCK_GROUP             | END                        | myGroup1                     | 5 tables locked, 0 deadlock(s)                                                                     | _regress_emaj_adm2
 SET_MARK_GROUP         | TIME STAMP SET             | 14712                        |                                                                                                    | _regress_emaj_adm2
 SET_MARK_GROUP         | END                        | myGroup1                     | MC8                                                                                                | _regress_emaj_adm2
 ROLLBACK_GROUP         | BEGIN                      | myGroup1                     | Logged rollback to mark MC8 (timestamp)                                                            | _regress_emaj_adm2
 DBLINK_OPEN_CNX        |                            | rlbk#1                       | Status = 1                                                                                         | _regress_emaj_adm2
 LOCK_GROUP             | BEGIN                      | myGroup1                     | Rollback session #1                                                                                | _regress_emaj_adm2
 LOCK_GROUP             | END                        | myGroup1                     | Rollback session #1: 5 tables locked, 0 deadlock(s)                                                | _regress_emaj_adm2
 ROLLBACK_GROUP         | TIME STAMP SET             | 14713                        |                                                                                                    | _regress_emaj_adm2
 SET_MARK_GROUP         | BEGIN                      | myGroup1                     | RLBK_14702_START                                                                                   | _regress_emaj_adm2
 SET_MARK_GROUP         | END                        | myGroup1                     | RLBK_14702_START                                                                                   | _regress_emaj_adm2
 ROLLBACK_SEQUENCE      |                            | myschema1.mytbl2b_col20_seq  | RESTART 11                                                                                         | _regress_emaj_adm2
 ROLLBACK_TABLE         | BEGIN                      | myschema1.mytbl2             | All log rows where emaj_gid > 14700077 and <= 14700079, in session_replication_role = replica mode | _regress_emaj_adm2
 ROLLBACK_TABLE         | END                        | myschema1.mytbl2             | 1 rolled back primary keys                                                                         | _regress_emaj_adm2
 ROLLBACK_TABLE         | BEGIN                      | myschema1.mytbl2b            | All log rows where emaj_gid > 14700077 and <= 14700079                                             | _regress_emaj_adm2
 ROLLBACK_TABLE         | END                        | myschema1.mytbl2b            | 1 rolled back primary keys                                                                         | _regress_emaj_adm2
 ROLLBACK_GROUP         | TIME STAMP SET             | 14714                        |                                                                                                    | _regress_emaj_adm1
 SET_MARK_GROUP         | BEGIN                      | myGroup1                     | RLBK_14702_DONE                                                                                    | _regress_emaj_adm2
 SET_MARK_GROUP         | END                        | myGroup1                     | RLBK_14702_DONE                                                                                    | _regress_emaj_adm2
 ROLLBACK_GROUP         | NOTICE                     | Rollback id 14702            | Rollback id = 14702.                                                                               | _regress_emaj_adm2
 ROLLBACK_GROUP         | NOTICE                     | Rollback id 14702            | 2 / 5 tables effectively processed.                                                                | _regress_emaj_adm2
 ROLLBACK_GROUP         | NOTICE                     | Rollback id 14702            | 1 / 2 sequences effectively processed.                                                             | _regress_emaj_adm2
 DBLINK_CLOSE_CNX       |                            | rlbk#1                       |                                                                                                    | _regress_emaj_adm2
 ROLLBACK_GROUP         | END                        | myGroup1                     | Rollback_id 14702                                                                                  | _regress_emaj_adm2
 CONSOLIDATE_RLBK_GROUP | BEGIN                      | myGroup1                     | Erase all between marks MC8 and RLBK_14702_DONE                                                    | _regress_emaj_adm2
 CONSOLIDATE_RLBK_GROUP | END                        | myGroup1                     | 2 tables and 2 sequences processed ; 1 marks deleted                                               | _regress_emaj_adm2
 SET_MARK_GROUP         | BEGIN                      | myGroup1                     |                                                                                                    | _regress_emaj_adm2
 LOCK_GROUP             | BEGIN                      | myGroup1                     |                                                                                                    | _regress_emaj_adm2
 LOCK_GROUP             | END                        | myGroup1                     | 5 tables locked, 0 deadlock(s)                                                                     | _regress_emaj_adm2
 SET_MARK_GROUP         | TIME STAMP SET             | 14715                        |                                                                                                    | _regress_emaj_adm2
 CLEANUP_RLBK_STATE     |                            | Rollback id 14702            | set to COMMITTED                                                                                   | _regress_emaj_adm2
 SET_MARK_GROUP         | END                        | myGroup1                     | MC9                                                                                                | _regress_emaj_adm2
 ROLLBACK_GROUP         | BEGIN                      | myGroup1                     | Logged rollback to mark MC6 (timestamp)                                                            | _regress_emaj_adm2
 DBLINK_OPEN_CNX        |                            | rlbk#1                       | Status = 1                                                                                         | _regress_emaj_adm2
 LOCK_GROUP             | BEGIN                      | myGroup1                     | Rollback session #1                                                                                | _regress_emaj_adm2
 LOCK_GROUP             | END                        | myGroup1                     | Rollback session #1: 5 tables locked, 0 deadlock(s)                                                | _regress_emaj_adm2
 ROLLBACK_GROUP         | TIME STAMP SET             | 14716                        |                                                                                                    | _regress_emaj_adm2
 SET_MARK_GROUP         | BEGIN                      | myGroup1                     | RLBK_14703_START                                                                                   | _regress_emaj_adm2
 SET_MARK_GROUP         | END                        | myGroup1                     | RLBK_14703_START                                                                                   | _regress_emaj_adm2
 ROLLBACK_SEQUENCE      |                            | myschema1."myTbl3_col31_seq" | RESTART 21                                                                                         | _regress_emaj_adm2
 ROLLBACK_SEQUENCE      |                            | myschema1.mytbl2b_col20_seq  | RESTART 9                                                                                          | _regress_emaj_adm2
 ROLLBACK_TABLE         | BEGIN                      | myschema1.mytbl1             | All log rows where emaj_gid > 14700058 and <= 14700093, in session_replication_role = replica mode | _regress_emaj_adm2
 ROLLBACK_TABLE         | END                        | myschema1.mytbl1             | 13 rolled back primary keys                                                                        | _regress_emaj_adm2
 ROLLBACK_TABLE         | BEGIN                      | myschema1."myTbl3"           | All log rows where emaj_gid > 14700058 and <= 14700093                                             | _regress_emaj_adm2
 ROLLBACK_TABLE         | END                        | myschema1."myTbl3"           | 10 rolled back primary keys                                                                        | _regress_emaj_adm2
 ROLLBACK_TABLE         | BEGIN                      | myschema1.mytbl2             | All log rows where emaj_gid > 14700058 and <= 14700093, in session_replication_role = replica mode | _regress_emaj_adm2
 ROLLBACK_TABLE         | END                        | myschema1.mytbl2             | 1 rolled back primary keys                                                                         | _regress_emaj_adm2
 ROLLBACK_TABLE         | BEGIN                      | myschema1.mytbl2b            | All log rows where emaj_gid > 14700058 and <= 14700093                                             | _regress_emaj_adm2
 ROLLBACK_TABLE         | END                        | myschema1.mytbl2b            | 2 rolled back primary keys                                                                         | _regress_emaj_adm2
 ROLLBACK_TABLE         | BEGIN                      | myschema1.mytbl4             | All log rows where emaj_gid > 14700058 and <= 14700093, in session_replication_role = replica mode | _regress_emaj_adm2
 ROLLBACK_TABLE         | END                        | myschema1.mytbl4             | 1 rolled back primary keys                                                                         | _regress_emaj_adm2
 ROLLBACK_GROUP         | TIME STAMP SET             | 14717                        |                                                                                                    | _regress_emaj_adm1
 SET_MARK_GROUP         | BEGIN                      | myGroup1                     | RLBK_14703_DONE                                                                                    | _regress_emaj_adm2
 SET_MARK_GROUP         | END                        | myGroup1                     | RLBK_14703_DONE                                                                                    | _regress_emaj_adm2
 ROLLBACK_GROUP         | NOTICE                     | Rollback id 14703            | Rollback id = 14703.                                                                               | _regress_emaj_adm2
 ROLLBACK_GROUP         | NOTICE                     | Rollback id 14703            | 5 / 5 tables effectively processed.                                                                | _regress_emaj_adm2
 ROLLBACK_GROUP         | NOTICE                     | Rollback id 14703            | 2 / 2 sequences effectively processed.                                                             | _regress_emaj_adm2
 DBLINK_CLOSE_CNX       |                            | rlbk#1                       |                                                                                                    | _regress_emaj_adm2
 ROLLBACK_GROUP         | END                        | myGroup1                     | Rollback_id 14703                                                                                  | _regress_emaj_adm2
 CONSOLIDATE_RLBK_GROUP | BEGIN                      | myGroup1                     | Erase all between marks MC6 and RLBK_14703_DONE                                                    | _regress_emaj_adm2
 CONSOLIDATE_RLBK_GROUP | END                        | myGroup1                     | 5 tables and 2 sequences processed ; 5 marks deleted                                               | _regress_emaj_adm2
 SET_MARK_GROUP         | BEGIN                      | myGroup1                     |                                                                                                    | _regress_emaj_adm2
 LOCK_GROUP             | BEGIN                      | myGroup1                     |                                                                                                    | _regress_emaj_adm2
 LOCK_GROUP             | END                        | myGroup1                     | 5 tables locked, 0 deadlock(s)                                                                     | _regress_emaj_adm2
 SET_MARK_GROUP         | TIME STAMP SET             | 14718                        |                                                                                                    | _regress_emaj_adm2
 CLEANUP_RLBK_STATE     |                            | Rollback id 14703            | set to COMMITTED                                                                                   | _regress_emaj_adm2
 SET_MARK_GROUP         | END                        | myGroup1                     | MC10                                                                                               | _regress_emaj_adm2
 ROLLBACK_GROUP         | BEGIN                      | myGroup1                     | Logged rollback to mark MC10 (timestamp)                                                           | _regress_emaj_adm2
 DBLINK_OPEN_CNX        |                            | rlbk#1                       | Status = 1                                                                                         | _regress_emaj_adm2
 LOCK_GROUP             | BEGIN                      | myGroup1                     | Rollback session #1                                                                                | _regress_emaj_adm2
 LOCK_GROUP             | END                        | myGroup1                     | Rollback session #1: 5 tables locked, 0 deadlock(s)                                                | _regress_emaj_adm2
 ROLLBACK_GROUP         | TIME STAMP SET             | 14719                        |                                                                                                    | _regress_emaj_adm2
 SET_MARK_GROUP         | BEGIN                      | myGroup1                     | RLBK_14704_START                                                                                   | _regress_emaj_adm2
 SET_MARK_GROUP         | END                        | myGroup1                     | RLBK_14704_START                                                                                   | _regress_emaj_adm2
 ROLLBACK_TABLE         | BEGIN                      | myschema1.mytbl1             | All log rows where emaj_gid > 14700118 and <= 14700134, in session_replication_role = replica mode | _regress_emaj_adm2
 ROLLBACK_TABLE         | END                        | myschema1.mytbl1             | 11 rolled back primary keys                                                                        | _regress_emaj_adm2
 ROLLBACK_GROUP         | TIME STAMP SET             | 14720                        |                                                                                                    | _regress_emaj_adm1
 SET_MARK_GROUP         | BEGIN                      | myGroup1                     | RLBK_14704_DONE                                                                                    | _regress_emaj_adm2
 SET_MARK_GROUP         | END                        | myGroup1                     | RLBK_14704_DONE                                                                                    | _regress_emaj_adm2
 ROLLBACK_GROUP         | NOTICE                     | Rollback id 14704            | Rollback id = 14704.                                                                               | _regress_emaj_adm2
 ROLLBACK_GROUP         | NOTICE                     | Rollback id 14704            | 1 / 5 tables effectively processed.                                                                | _regress_emaj_adm2
 ROLLBACK_GROUP         | NOTICE                     | Rollback id 14704            | 0 / 2 sequences effectively processed.                                                             | _regress_emaj_adm2
 DBLINK_CLOSE_CNX       |                            | rlbk#1                       |                                                                                                    | _regress_emaj_adm2
 ROLLBACK_GROUP         | END                        | myGroup1                     | Rollback_id 14704                                                                                  | _regress_emaj_adm2
 SET_MARK_GROUP         | BEGIN                      | myGroup1                     |                                                                                                    | _regress_emaj_adm2
 LOCK_GROUP             | BEGIN                      | myGroup1                     |                                                                                                    | _regress_emaj_adm2
 LOCK_GROUP             | END                        | myGroup1                     | 5 tables locked, 0 deadlock(s)                                                                     | _regress_emaj_adm2
 SET_MARK_GROUP         | TIME STAMP SET             | 14721                        |                                                                                                    | _regress_emaj_adm2
 CLEANUP_RLBK_STATE     |                            | Rollback id 14704            | set to COMMITTED                                                                                   | _regress_emaj_adm2
 SET_MARK_GROUP         | END                        | myGroup1                     | MC11                                                                                               | _regress_emaj_adm2
 ROLLBACK_GROUP         | BEGIN                      | myGroup1                     | Logged rollback to mark MC10 (timestamp)                                                           | _regress_emaj_adm2
 DBLINK_OPEN_CNX        |                            | rlbk#1                       | Status = 1                                                                                         | _regress_emaj_adm2
 LOCK_GROUP             | BEGIN                      | myGroup1                     | Rollback session #1                                                                                | _regress_emaj_adm2
 LOCK_GROUP             | END                        | myGroup1                     | Rollback session #1: 5 tables locked, 0 deadlock(s)                                                | _regress_emaj_adm2
 ROLLBACK_GROUP         | TIME STAMP SET             | 14722                        |                                                                                                    | _regress_emaj_adm2
 SET_MARK_GROUP         | BEGIN                      | myGroup1                     | RLBK_14705_START                                                                                   | _regress_emaj_adm2
 SET_MARK_GROUP         | END                        | myGroup1                     | RLBK_14705_START                                                                                   | _regress_emaj_adm2
 ROLLBACK_TABLE         | BEGIN                      | myschema1.mytbl1             | All log rows where emaj_gid > 14700118 and <= 14700142, in session_replication_role = replica mode | _regress_emaj_adm2
 ROLLBACK_TABLE         | END                        | myschema1.mytbl1             | 11 rolled back primary keys                                                                        | _regress_emaj_adm2
 ROLLBACK_TABLE         | BEGIN                      | myschema1.mytbl4             | All log rows where emaj_gid > 14700118 and <= 14700142, in session_replication_role = replica mode | _regress_emaj_adm2
 ROLLBACK_TABLE         | END                        | myschema1.mytbl4             | 1 rolled back primary keys                                                                         | _regress_emaj_adm2
 ROLLBACK_GROUP         | TIME STAMP SET             | 14723                        |                                                                                                    | _regress_emaj_adm1
 SET_MARK_GROUP         | BEGIN                      | myGroup1                     | RLBK_14705_DONE                                                                                    | _regress_emaj_adm2
 SET_MARK_GROUP         | END                        | myGroup1                     | RLBK_14705_DONE                                                                                    | _regress_emaj_adm2
 ROLLBACK_GROUP         | NOTICE                     | Rollback id 14705            | Rollback id = 14705.                                                                               | _regress_emaj_adm2
 ROLLBACK_GROUP         | NOTICE                     | Rollback id 14705            | 2 / 5 tables effectively processed.                                                                | _regress_emaj_adm2
 ROLLBACK_GROUP         | NOTICE                     | Rollback id 14705            | 0 / 2 sequences effectively processed.                                                             | _regress_emaj_adm2
 DBLINK_CLOSE_CNX       |                            | rlbk#1                       |                                                                                                    | _regress_emaj_adm2
 ROLLBACK_GROUP         | END                        | myGroup1                     | Rollback_id 14705                                                                                  | _regress_emaj_adm2
 CONSOLIDATE_RLBK_GROUP | BEGIN                      | myGroup1                     | Erase all between marks MC10 and RLBK_14705_DONE                                                   | _regress_emaj_adm2
 CONSOLIDATE_RLBK_GROUP | END                        | myGroup1                     | 2 tables and 2 sequences processed ; 4 marks deleted                                               | _regress_emaj_adm2
 SET_MARK_GROUP         | BEGIN                      | myGroup1                     |                                                                                                    | _regress_emaj_adm2
 LOCK_GROUP             | BEGIN                      | myGroup1                     |                                                                                                    | _regress_emaj_adm2
 LOCK_GROUP             | END                        | myGroup1                     | 5 tables locked, 0 deadlock(s)                                                                     | _regress_emaj_adm2
 SET_MARK_GROUP         | TIME STAMP SET             | 14724                        |                                                                                                    | _regress_emaj_adm2
 CLEANUP_RLBK_STATE     |                            | Rollback id 14705            | set to COMMITTED                                                                                   | _regress_emaj_adm2
 SET_MARK_GROUP         | END                        | myGroup1                     | MC15                                                                                               | _regress_emaj_adm2
 SET_MARK_GROUP         | BEGIN                      | myGroup1                     |                                                                                                    | _regress_emaj_adm2
 LOCK_GROUP             | BEGIN                      | myGroup1                     |                                                                                                    | _regress_emaj_adm2
 LOCK_GROUP             | END                        | myGroup1                     | 5 tables locked, 0 deadlock(s)                                                                     | _regress_emaj_adm2
 SET_MARK_GROUP         | TIME STAMP SET             | 14725                        |                                                                                                    | _regress_emaj_adm2
 SET_MARK_GROUP         | END                        | myGroup1                     | MC16                                                                                               | _regress_emaj_adm2
 ROLLBACK_GROUP         | BEGIN                      | myGroup1                     | Logged rollback to mark MC15 (timestamp)                                                           | _regress_emaj_adm2
 DBLINK_OPEN_CNX        |                            | rlbk#1                       | Status = 1                                                                                         | _regress_emaj_adm2
 LOCK_GROUP             | BEGIN                      | myGroup1                     | Rollback session #1                                                                                | _regress_emaj_adm2
 LOCK_GROUP             | END                        | myGroup1                     | Rollback session #1: 5 tables locked, 0 deadlock(s)                                                | _regress_emaj_adm2
 ROLLBACK_GROUP         | TIME STAMP SET             | 14726                        |                                                                                                    | _regress_emaj_adm2
 SET_MARK_GROUP         | BEGIN                      | myGroup1                     | RLBK_14706_START                                                                                   | _regress_emaj_adm2
 SET_MARK_GROUP         | END                        | myGroup1                     | RLBK_14706_START                                                                                   | _regress_emaj_adm2
 ROLLBACK_SEQUENCE      |                            | myschema1.mytbl2b_col20_seq  | RESTART 9                                                                                          | _regress_emaj_adm2
 ROLLBACK_TABLE         | BEGIN                      | myschema1.mytbl1             | All log rows where emaj_gid > 14700143 and <= 14700162, in session_replication_role = replica mode | _regress_emaj_adm2
 ROLLBACK_TABLE         | END                        | myschema1.mytbl1             | 13 rolled back primary keys                                                                        | _regress_emaj_adm2
 ROLLBACK_TABLE         | BEGIN                      | myschema1.mytbl2             | All log rows where emaj_gid > 14700143 and <= 14700162, in session_replication_role = replica mode | _regress_emaj_adm2
 ROLLBACK_TABLE         | END                        | myschema1.mytbl2             | 1 rolled back primary keys                                                                         | _regress_emaj_adm2
 ROLLBACK_TABLE         | BEGIN                      | myschema1.mytbl2b            | All log rows where emaj_gid > 14700143 and <= 14700162                                             | _regress_emaj_adm2
 ROLLBACK_TABLE         | END                        | myschema1.mytbl2b            | 2 rolled back primary keys                                                                         | _regress_emaj_adm2
 ROLLBACK_GROUP         | TIME STAMP SET             | 14727                        |                                                                                                    | _regress_emaj_adm1
 SET_MARK_GROUP         | BEGIN                      | myGroup1                     | RLBK_14706_DONE                                                                                    | _regress_emaj_adm2
 SET_MARK_GROUP         | END                        | myGroup1                     | RLBK_14706_DONE                                                                                    | _regress_emaj_adm2
 ROLLBACK_GROUP         | NOTICE                     | Rollback id 14706            | Rollback id = 14706.                                                                               | _regress_emaj_adm2
 ROLLBACK_GROUP         | NOTICE                     | Rollback id 14706            | 3 / 5 tables effectively processed.                                                                | _regress_emaj_adm2
 ROLLBACK_GROUP         | NOTICE                     | Rollback id 14706            | 1 / 2 sequences effectively processed.                                                             | _regress_emaj_adm2
 DBLINK_CLOSE_CNX       |                            | rlbk#1                       |                                                                                                    | _regress_emaj_adm2
 ROLLBACK_GROUP         | END                        | myGroup1                     | Rollback_id 14706                                                                                  | _regress_emaj_adm2
 RENAME_MARK_GROUP      | BEGIN                      | myGroup1                     | EMAJ_LAST_MARK                                                                                     | _regress_emaj_adm2
 RENAME_MARK_GROUP      | END                        | myGroup1                     | RLBK_14706_DONE renamed RLBK_MC15_DONE                                                             | _regress_emaj_adm2
 SET_MARK_GROUP         | BEGIN                      | myGroup1                     |                                                                                                    | _regress_emaj_adm2
 LOCK_GROUP             | BEGIN                      | myGroup1                     |                                                                                                    | _regress_emaj_adm2
 LOCK_GROUP             | END                        | myGroup1                     | 5 tables locked, 0 deadlock(s)                                                                     | _regress_emaj_adm2
 SET_MARK_GROUP         | TIME STAMP SET             | 14728                        |                                                                                                    | _regress_emaj_adm2
 CLEANUP_RLBK_STATE     |                            | Rollback id 14706            | set to COMMITTED                                                                                   | _regress_emaj_adm2
 SET_MARK_GROUP         | END                        | myGroup1                     | MC17                                                                                               | _regress_emaj_adm2
 ROLLBACK_GROUP         | BEGIN                      | myGroup1                     | Logged rollback to mark MC16 (timestamp)                                                           | _regress_emaj_adm2
 DBLINK_OPEN_CNX        |                            | rlbk#1                       | Status = 1                                                                                         | _regress_emaj_adm2
 LOCK_GROUP             | BEGIN                      | myGroup1                     | Rollback session #1                                                                                | _regress_emaj_adm2
 LOCK_GROUP             | END                        | myGroup1                     | Rollback session #1: 5 tables locked, 0 deadlock(s)                                                | _regress_emaj_adm2
 ROLLBACK_GROUP         | TIME STAMP SET             | 14729                        |                                                                                                    | _regress_emaj_adm2
 SET_MARK_GROUP         | BEGIN                      | myGroup1                     | RLBK_14707_START                                                                                   | _regress_emaj_adm2
 SET_MARK_GROUP         | END                        | myGroup1                     | RLBK_14707_START                                                                                   | _regress_emaj_adm2
 ROLLBACK_TABLE         | BEGIN                      | myschema1.mytbl1             | All log rows where emaj_gid > 14700160 and <= 14700178, in session_replication_role = replica mode | _regress_emaj_adm2
 ROLLBACK_TABLE         | END                        | myschema1.mytbl1             | 11 rolled back primary keys                                                                        | _regress_emaj_adm2
 ROLLBACK_TABLE         | BEGIN                      | myschema1.mytbl2b            | All log rows where emaj_gid > 14700160 and <= 14700178                                             | _regress_emaj_adm2
 ROLLBACK_TABLE         | END                        | myschema1.mytbl2b            | 2 rolled back primary keys                                                                         | _regress_emaj_adm2
 ROLLBACK_TABLE         | BEGIN                      | myschema1.mytbl2             | All log rows where emaj_gid > 14700160 and <= 14700178, in session_replication_role = replica mode | _regress_emaj_adm2
 ROLLBACK_TABLE         | END                        | myschema1.mytbl2             | 2 rolled back primary keys                                                                         | _regress_emaj_adm2
 ROLLBACK_GROUP         | TIME STAMP SET             | 14730                        |                                                                                                    | _regress_emaj_adm1
 SET_MARK_GROUP         | BEGIN                      | myGroup1                     | RLBK_14707_DONE                                                                                    | _regress_emaj_adm2
 SET_MARK_GROUP         | END                        | myGroup1                     | RLBK_14707_DONE                                                                                    | _regress_emaj_adm2
 ROLLBACK_GROUP         | NOTICE                     | Rollback id 14707            | Rollback id = 14707.                                                                               | _regress_emaj_adm2
 ROLLBACK_GROUP         | NOTICE                     | Rollback id 14707            | 3 / 5 tables effectively processed.                                                                | _regress_emaj_adm2
 ROLLBACK_GROUP         | NOTICE                     | Rollback id 14707            | 0 / 2 sequences effectively processed.                                                             | _regress_emaj_adm2
 DBLINK_CLOSE_CNX       |                            | rlbk#1                       |                                                                                                    | _regress_emaj_adm2
 ROLLBACK_GROUP         | END                        | myGroup1                     | Rollback_id 14707                                                                                  | _regress_emaj_adm2
 CONSOLIDATE_RLBK_GROUP | BEGIN                      | myGroup1                     | Erase all between marks MC15 and RLBK_MC15_DONE                                                    | _regress_emaj_adm2
 CONSOLIDATE_RLBK_GROUP | END                        | myGroup1                     | 3 tables and 2 sequences processed ; 2 marks deleted                                               | _regress_emaj_adm2
(269 rows)

select * from emaj.emaj_rollback_group('myGroup1','Multi-1',true) order by 1,2;
 rlbk_severity |                                  rlbk_message                                   
---------------+---------------------------------------------------------------------------------
 Notice        | 2 / 2 sequences effectively processed.
 Notice        | 3 / 5 tables effectively processed.
 Notice        | Rollback id = 14708.
 Warning       | Tables group change not rolled back: ignored triggers list for myschema1.mytbl2
(4 rows)

-- remove the temp directory
\! rm -R $EMAJTESTTMPDIR
reset session_authorization;
