-- adm2.sql : complex scenario executed by an emaj_adm role. 
--            Follows adm1.sql, and includes more specific test cases
--
-----------------------------
-- Step 8 : use of multi-group functions, start_group(s) without log reset and use deleted marks
-----------------------------
-- stop both groups
select emaj.emaj_stop_groups(array['myGroup1','myGroup2']);
 emaj_stop_groups 
------------------
               14
(1 row)

-- start both groups
select emaj.emaj_start_groups(array['myGroup1','myGroup2'],'Multi-1', false);
 emaj_start_groups 
-------------------
                14
(1 row)

-- set a mark for both groups
select emaj.emaj_set_mark_groups(array['myGroup1','myGroup2'],'Multi-2');
 emaj_set_mark_groups 
----------------------
                   14
(1 row)

-- logged rollback to Multi-1
select emaj.emaj_logged_rollback_groups(array['myGroup1','myGroup2'],'Multi-1');
 emaj_logged_rollback_groups 
-----------------------------
                           3
(1 row)

-- rollback to Multi-2
select emaj.emaj_rollback_groups(array['myGroup1','myGroup2'],'Multi-2');
 emaj_rollback_groups 
----------------------
                    3
(1 row)

-- rollback and stop to Multi-1
select emaj.emaj_rollback_groups(array['myGroup1','myGroup2'],'Multi-1');
 emaj_rollback_groups 
----------------------
                    3
(1 row)

select emaj.emaj_stop_groups(array['myGroup1','myGroup2'],'Stop after rollback');
 emaj_stop_groups 
------------------
               14
(1 row)

-- try to start both groups, but with an old deleted mark name
select emaj.emaj_start_groups(array['myGroup1','myGroup2'],'Multi-1', false);
ERROR:  _check_new_mark: Group myGroup1 already contains a mark named Multi-1.
CONTEXT:  SQL statement "SELECT emaj._check_new_mark( $1 ,  $2 )"
PL/pgSQL function "_start_groups" line 48 at SQL statement
SQL statement "SELECT emaj._start_groups(emaj._check_group_names_array( $1 ),  $2 , true,  $3 )"
PL/pgSQL function "emaj_start_groups" line 15 at SQL statement
-- really start both groups
select emaj.emaj_start_groups(array['myGroup1','myGroup2'],'Multi-1b', false);
 emaj_start_groups 
-------------------
                14
(1 row)

-- set again a mark for both groups
select emaj.emaj_set_mark_groups(array['myGroup1','myGroup2'],'Multi-2');
 emaj_set_mark_groups 
----------------------
                   14
(1 row)

-- delete the mark for only 1 group and get detailed statistics for the other group
select emaj.emaj_delete_mark_group('myGroup1','Multi-2');
 emaj_delete_mark_group 
------------------------
                      1
(1 row)

-- use this mark for the other group before delete it
select * from emaj.emaj_detailed_log_stat_group('myGroup2','Multi-2',NULL);
 stat_group | stat_schema | stat_table | stat_role | stat_verb | stat_rows 
------------+-------------+------------+-----------+-----------+-----------
(0 rows)

select emaj.emaj_rollback_group('myGroup2','Multi-2');
 emaj_rollback_group 
---------------------
                   2
(1 row)

select emaj.emaj_delete_mark_group('myGroup2','Multi-2');
 emaj_delete_mark_group 
------------------------
                      1
(1 row)

-- get statistics using deleted marks
select * from emaj.emaj_detailed_log_stat_group('myGroup2','M1','M2');
 stat_group | stat_schema | stat_table | stat_role | stat_verb | stat_rows 
------------+-------------+------------+-----------+-----------+-----------
 myGroup2   | myschema2   | mytbl1     | postgres  | DELETE    |         1
 myGroup2   | myschema2   | mytbl1     | postgres  | INSERT    |        11
 myGroup2   | myschema2   | mytbl1     | postgres  | UPDATE    |         3
 myGroup2   | myschema2   | mytbl2     | postgres  | INSERT    |         2
 myGroup2   | myschema2   | myTbl3     | postgres  | INSERT    |        10
 myGroup2   | myschema2   | mytbl5     | postgres  | INSERT    |         2
 myGroup2   | myschema2   | mytbl5     | postgres  | UPDATE    |         1
 myGroup2   | myschema2   | mytbl6     | postgres  | INSERT    |         8
 myGroup2   | myschema2   | mytbl6     | postgres  | UPDATE    |         3
(9 rows)

-- delete intermediate deleted marks
select emaj.emaj_delete_mark_group('myGroup1','Multi-1');
 emaj_delete_mark_group 
------------------------
                      1
(1 row)

select emaj.emaj_delete_mark_group('myGroup2','Multi-1');
 emaj_delete_mark_group 
------------------------
                      1
(1 row)

-- ... and reuse mark names for parallel rollback test
select emaj.emaj_rename_mark_group('myGroup1','Multi-1b','Multi-1');
 emaj_rename_mark_group 
------------------------
 
(1 row)

select emaj.emaj_rename_mark_group('myGroup2','Multi-1b','Multi-1');
 emaj_rename_mark_group 
------------------------
 
(1 row)

-- rename a deleted mark
select emaj.emaj_rename_mark_group('myGroup2','M2','Deleted M2');
 emaj_rename_mark_group 
------------------------
 
(1 row)

-- use emaj_get_previous_mark_group and delete an initial deleted mark
select emaj.emaj_delete_before_mark_group('myGroup2',
      (select emaj.emaj_get_previous_mark_group('myGroup2',
             (select mark_datetime from emaj.emaj_mark where mark_group = 'myGroup2' and mark_name = 'M3')+'0.000001 SECOND'::interval)));
 emaj_delete_before_mark_group 
-------------------------------
                             2
(1 row)

-- comment a deleted mark
select emaj.emaj_comment_mark_group('myGroup2','M3','This mark is deleted');
 emaj_comment_mark_group 
-------------------------
 
(1 row)

-- try to get rollback duration on a deleted mark
select emaj.emaj_estimate_rollback_duration('myGroup2','M3');
ERROR:  emaj_estimate_rollback_duration: mark M3 for group myGroup2 is not in ACTIVE state.
-- try to rollback on a deleted mark
select emaj.emaj_rollback_group('myGroup2','M3');
ERROR:  _rlbk_groups_step1: mark M3 for group myGroup2 is not in ACTIVE state.
CONTEXT:  SQL statement "SELECT emaj._rlbk_groups_step1( $1 ,  $2 ,  $3 , 1,  $4 )"
PL/pgSQL function "_rlbk_groups" line 19 at SQL statement
PL/pgSQL function "emaj_rollback_group" line 7 at RETURN
-----------------------------
-- Checking step 8
-----------------------------
-- emaj tables
select mark_id, mark_group, regexp_replace(mark_name,E'\\d\\d\.\\d\\d\\.\\d\\d\\.\\d\\d\\d','%','g'), mark_global_seq, mark_state, mark_comment, mark_last_seq_hole_id, mark_last_sequence_id, mark_log_rows_before_next from emaj.emaj_mark order by mark_id;
 mark_id | mark_group |        regexp_replace        | mark_global_seq | mark_state |     mark_comment     | mark_last_seq_hole_id | mark_last_sequence_id | mark_log_rows_before_next 
---------+------------+------------------------------+-----------------+------------+----------------------+-----------------------+-----------------------+---------------------------
     606 | myGroup2   | M3                           |           11927 | DELETED    | This mark is deleted |                   599 |                  6045 |                         0
     611 | myGroup1   | M4                           |           11956 | DELETED    |                      |                   601 |                  6083 |                        10
     612 | myGroup1   | M5                           |           11966 | DELETED    |                      |                   601 |                  6089 |                         3
     616 | myGroup1   | Before logged rollback to M4 |           11996 | DELETED    |                      |                   606 |                  6117 |                        18
     618 | myGroup1   | STOP_%                       |           12014 | DELETED    |                      |                   606 |                  6137 |                         0
     619 | myGroup2   | STOP_%                       |           12014 | DELETED    |                      |                   606 |                  6137 |                         0
     628 | myGroup1   | Stop after rollback          |           12014 | DELETED    |                      |                   606 |                  6207 |                         0
     629 | myGroup2   | Stop after rollback          |           12014 | DELETED    |                      |                   606 |                  6207 |                         0
     630 | myGroup1   | Multi-1                      |           12014 | ACTIVE     |                      |                   606 |                  6221 |                          
     631 | myGroup2   | Multi-1                      |           12014 | ACTIVE     |                      |                   606 |                  6221 |                          
(10 rows)

select sequ_id,sequ_schema, sequ_name, regexp_replace(sequ_mark,E'\\d\\d\.\\d\\d\\.\\d\\d\\.\\d\\d\\d','%','g'), sequ_last_val, sequ_is_called from emaj.emaj_sequence order by sequ_id;
 sequ_id | sequ_schema |         sequ_name         |        regexp_replace        | sequ_last_val | sequ_is_called 
---------+-------------+---------------------------+------------------------------+---------------+----------------
    6025 | emajC       | myschema1_myTbl3_log_seq  | M3                           |            10 | t
    6028 | emaj        | myschema1_mytbl2_log_seq  | M3                           |             2 | t
    6029 | emajb       | myschema1_mytbl2b_log_seq | M3                           |             1 | f
    6038 | myschema2   | myseq1                    | M3                           |          1003 | t
    6039 | myschema2   | myTbl3_col31_seq          | M3                           |            20 | t
    6040 | emaj        | myschema2_mytbl1_log_seq  | M3                           |            15 | t
    6041 | emaj        | myschema2_mytbl2_log_seq  | M3                           |             2 | t
    6042 | emajC       | myschema2_myTbl3_log_seq  | M3                           |            10 | t
    6043 | emaj        | myschema2_mytbl4_log_seq  | M3                           |             4 | t
    6044 | emaj        | myschema2_mytbl5_log_seq  | M3                           |             4 | t
    6045 | emaj        | myschema2_mytbl6_log_seq  | M3                           |            14 | t
    6048 | emaj        | myschema2_mytbl1_log_seq  | RLBK_M2_%_START              |            15 | t
    6049 | emaj        | myschema2_mytbl2_log_seq  | RLBK_M2_%_START              |             2 | t
    6050 | emajC       | myschema2_myTbl3_log_seq  | RLBK_M2_%_START              |            10 | t
    6056 | emaj        | myschema2_mytbl1_log_seq  | RLBK_M2_%_DONE               |            15 | t
    6057 | emaj        | myschema2_mytbl2_log_seq  | RLBK_M2_%_DONE               |             2 | t
    6058 | emajC       | myschema2_myTbl3_log_seq  | RLBK_M2_%_DONE               |            10 | t
    6064 | emaj        | myschema2_mytbl1_log_seq  | RLBK_M3_%_START              |            15 | t
    6065 | emaj        | myschema2_mytbl2_log_seq  | RLBK_M3_%_START              |             2 | t
    6066 | emajC       | myschema2_myTbl3_log_seq  | RLBK_M3_%_START              |            10 | t
    6072 | emaj        | myschema2_mytbl1_log_seq  | RLBK_M3_%_DONE               |            15 | t
    6073 | emaj        | myschema2_mytbl2_log_seq  | RLBK_M3_%_DONE               |             2 | t
    6074 | emajC       | myschema2_myTbl3_log_seq  | RLBK_M3_%_DONE               |            10 | t
    6078 | myschema1   | myTbl3_col31_seq          | M4                           |            20 | t
    6079 | emajC       | myschema1_myTbl3_log_seq  | M4                           |            10 | t
    6080 | emaj        | myschema1_mytbl1_log_seq  | M4                           |            30 | t
    6081 | emaj        | myschema1_mytbl4_log_seq  | M4                           |             8 | t
    6082 | emaj        | myschema1_mytbl2_log_seq  | M4                           |             3 | t
    6083 | emajb       | myschema1_mytbl2b_log_seq | M4                           |             1 | f
    6084 | myschema1   | myTbl3_col31_seq          | M5                           |            20 | t
    6085 | emajC       | myschema1_myTbl3_log_seq  | M5                           |            20 | t
    6086 | emaj        | myschema1_mytbl1_log_seq  | M5                           |            30 | t
    6087 | emaj        | myschema1_mytbl4_log_seq  | M5                           |             8 | t
    6088 | emaj        | myschema1_mytbl2_log_seq  | M5                           |             3 | t
    6089 | emajb       | myschema1_mytbl2b_log_seq | M5                           |             1 | f
    6091 | emajC       | myschema1_myTbl3_log_seq  | M6                           |            20 | t
    6094 | emaj        | myschema1_mytbl2_log_seq  | M6                           |             3 | t
    6095 | emajb       | myschema1_mytbl2b_log_seq | M6                           |             1 | f
    6098 | emaj        | myschema2_mytbl1_log_seq  | RLBK_M2_%_START              |            15 | t
    6099 | emaj        | myschema2_mytbl2_log_seq  | RLBK_M2_%_START              |             2 | t
    6100 | emajC       | myschema2_myTbl3_log_seq  | RLBK_M2_%_START              |            10 | t
    6106 | emaj        | myschema2_mytbl1_log_seq  | RLBK_M2_%_DONE               |            15 | t
    6107 | emaj        | myschema2_mytbl2_log_seq  | RLBK_M2_%_DONE               |             2 | t
    6108 | emajC       | myschema2_myTbl3_log_seq  | RLBK_M2_%_DONE               |            10 | t
    6112 | myschema1   | myTbl3_col31_seq          | Before logged rollback to M4 |            20 | t
    6113 | emajC       | myschema1_myTbl3_log_seq  | Before logged rollback to M4 |            20 | t
    6114 | emaj        | myschema1_mytbl1_log_seq  | Before logged rollback to M4 |            32 | t
    6115 | emaj        | myschema1_mytbl4_log_seq  | Before logged rollback to M4 |            12 | t
    6116 | emaj        | myschema1_mytbl2_log_seq  | Before logged rollback to M4 |             3 | t
    6117 | emajb       | myschema1_mytbl2b_log_seq | Before logged rollback to M4 |             1 | f
    6124 | myschema1   | myTbl3_col31_seq          | STOP_%                       |            20 | t
    6125 | myschema2   | myseq1                    | STOP_%                       |          1004 | f
    6126 | myschema2   | myTbl3_col31_seq          | STOP_%                       |            20 | t
    6127 | emajC       | myschema1_myTbl3_log_seq  | STOP_%                       |            35 | t
    6128 | emaj        | myschema1_mytbl1_log_seq  | STOP_%                       |            33 | t
    6129 | emaj        | myschema1_mytbl4_log_seq  | STOP_%                       |            14 | t
    6130 | emaj        | myschema1_mytbl2_log_seq  | STOP_%                       |             3 | t
    6131 | emajb       | myschema1_mytbl2b_log_seq | STOP_%                       |             1 | f
    6132 | emaj        | myschema2_mytbl1_log_seq  | STOP_%                       |            15 | t
    6133 | emaj        | myschema2_mytbl2_log_seq  | STOP_%                       |             2 | t
    6134 | emajC       | myschema2_myTbl3_log_seq  | STOP_%                       |            10 | t
    6135 | emaj        | myschema2_mytbl4_log_seq  | STOP_%                       |            24 | t
    6136 | emaj        | myschema2_mytbl5_log_seq  | STOP_%                       |             9 | t
    6137 | emaj        | myschema2_mytbl6_log_seq  | STOP_%                       |            29 | t
    6155 | emajC       | myschema1_myTbl3_log_seq  | Multi-2                      |            35 | t
    6156 | emaj        | myschema1_mytbl1_log_seq  | Multi-2                      |            33 | t
    6157 | emaj        | myschema1_mytbl4_log_seq  | Multi-2                      |            14 | t
    6158 | emaj        | myschema1_mytbl2_log_seq  | Multi-2                      |             3 | t
    6159 | emajb       | myschema1_mytbl2b_log_seq | Multi-2                      |             1 | f
    6160 | emaj        | myschema2_mytbl1_log_seq  | Multi-2                      |            15 | t
    6161 | emaj        | myschema2_mytbl2_log_seq  | Multi-2                      |             2 | t
    6162 | emajC       | myschema2_myTbl3_log_seq  | Multi-2                      |            10 | t
    6163 | emaj        | myschema2_mytbl4_log_seq  | Multi-2                      |            24 | t
    6164 | emaj        | myschema2_mytbl5_log_seq  | Multi-2                      |             9 | t
    6165 | emaj        | myschema2_mytbl6_log_seq  | Multi-2                      |            29 | t
    6169 | emajC       | myschema1_myTbl3_log_seq  | RLBK_Multi-1_%_START         |            35 | t
    6170 | emaj        | myschema1_mytbl1_log_seq  | RLBK_Multi-1_%_START         |            33 | t
    6171 | emaj        | myschema1_mytbl4_log_seq  | RLBK_Multi-1_%_START         |            14 | t
    6172 | emaj        | myschema1_mytbl2_log_seq  | RLBK_Multi-1_%_START         |             3 | t
    6173 | emajb       | myschema1_mytbl2b_log_seq | RLBK_Multi-1_%_START         |             1 | f
    6174 | emaj        | myschema2_mytbl1_log_seq  | RLBK_Multi-1_%_START         |            15 | t
    6175 | emaj        | myschema2_mytbl2_log_seq  | RLBK_Multi-1_%_START         |             2 | t
    6176 | emajC       | myschema2_myTbl3_log_seq  | RLBK_Multi-1_%_START         |            10 | t
    6177 | emaj        | myschema2_mytbl4_log_seq  | RLBK_Multi-1_%_START         |            24 | t
    6178 | emaj        | myschema2_mytbl5_log_seq  | RLBK_Multi-1_%_START         |             9 | t
    6179 | emaj        | myschema2_mytbl6_log_seq  | RLBK_Multi-1_%_START         |            29 | t
    6183 | emajC       | myschema1_myTbl3_log_seq  | RLBK_Multi-1_%_DONE          |            35 | t
    6184 | emaj        | myschema1_mytbl1_log_seq  | RLBK_Multi-1_%_DONE          |            33 | t
    6185 | emaj        | myschema1_mytbl4_log_seq  | RLBK_Multi-1_%_DONE          |            14 | t
    6186 | emaj        | myschema1_mytbl2_log_seq  | RLBK_Multi-1_%_DONE          |             3 | t
    6187 | emajb       | myschema1_mytbl2b_log_seq | RLBK_Multi-1_%_DONE          |             1 | f
    6188 | emaj        | myschema2_mytbl1_log_seq  | RLBK_Multi-1_%_DONE          |            15 | t
    6189 | emaj        | myschema2_mytbl2_log_seq  | RLBK_Multi-1_%_DONE          |             2 | t
    6190 | emajC       | myschema2_myTbl3_log_seq  | RLBK_Multi-1_%_DONE          |            10 | t
    6191 | emaj        | myschema2_mytbl4_log_seq  | RLBK_Multi-1_%_DONE          |            24 | t
    6192 | emaj        | myschema2_mytbl5_log_seq  | RLBK_Multi-1_%_DONE          |             9 | t
    6193 | emaj        | myschema2_mytbl6_log_seq  | RLBK_Multi-1_%_DONE          |            29 | t
    6194 | myschema1   | myTbl3_col31_seq          | Stop after rollback          |            20 | t
    6195 | myschema2   | myseq1                    | Stop after rollback          |          1004 | f
    6196 | myschema2   | myTbl3_col31_seq          | Stop after rollback          |            20 | t
    6197 | emajC       | myschema1_myTbl3_log_seq  | Stop after rollback          |            35 | t
    6198 | emaj        | myschema1_mytbl1_log_seq  | Stop after rollback          |            33 | t
    6199 | emaj        | myschema1_mytbl4_log_seq  | Stop after rollback          |            14 | t
    6200 | emaj        | myschema1_mytbl2_log_seq  | Stop after rollback          |             3 | t
    6201 | emajb       | myschema1_mytbl2b_log_seq | Stop after rollback          |             1 | f
    6202 | emaj        | myschema2_mytbl1_log_seq  | Stop after rollback          |            15 | t
    6203 | emaj        | myschema2_mytbl2_log_seq  | Stop after rollback          |             2 | t
    6204 | emajC       | myschema2_myTbl3_log_seq  | Stop after rollback          |            10 | t
    6205 | emaj        | myschema2_mytbl4_log_seq  | Stop after rollback          |            24 | t
    6206 | emaj        | myschema2_mytbl5_log_seq  | Stop after rollback          |             9 | t
    6207 | emaj        | myschema2_mytbl6_log_seq  | Stop after rollback          |            29 | t
    6208 | myschema1   | myTbl3_col31_seq          | Multi-1                      |            20 | t
    6209 | myschema2   | myseq1                    | Multi-1                      |          1004 | f
    6210 | myschema2   | myTbl3_col31_seq          | Multi-1                      |            20 | t
    6211 | emajC       | myschema1_myTbl3_log_seq  | Multi-1                      |            35 | t
    6212 | emaj        | myschema1_mytbl1_log_seq  | Multi-1                      |            33 | t
    6213 | emaj        | myschema1_mytbl4_log_seq  | Multi-1                      |            14 | t
    6214 | emaj        | myschema1_mytbl2_log_seq  | Multi-1                      |             3 | t
    6215 | emajb       | myschema1_mytbl2b_log_seq | Multi-1                      |             1 | f
    6216 | emaj        | myschema2_mytbl1_log_seq  | Multi-1                      |            15 | t
    6217 | emaj        | myschema2_mytbl2_log_seq  | Multi-1                      |             2 | t
    6218 | emajC       | myschema2_myTbl3_log_seq  | Multi-1                      |            10 | t
    6219 | emaj        | myschema2_mytbl4_log_seq  | Multi-1                      |            24 | t
    6220 | emaj        | myschema2_mytbl5_log_seq  | Multi-1                      |             9 | t
    6221 | emaj        | myschema2_mytbl6_log_seq  | Multi-1                      |            29 | t
(125 rows)

select sqhl_id, sqhl_schema, sqhl_table, sqhl_hole_size from emaj.emaj_seq_hole order by sqhl_id;
 sqhl_id | sqhl_schema | sqhl_table | sqhl_hole_size 
---------+-------------+------------+----------------
     602 | myschema2   | mytbl4     |             20
     603 | myschema2   | mytbl5     |              5
     604 | myschema2   | mytbl6     |             15
     605 | myschema1   | mytbl1     |              1
     606 | myschema1   | mytbl4     |              2
(5 rows)

-- log tables
select col11, col12, col13, emaj_verb, emaj_tuple, emaj_gid from emaj.mySchema1_myTbl1_log order by emaj_gid, emaj_tuple desc;
 col11 |   col12    | col13 | emaj_verb | emaj_tuple | emaj_gid 
-------+------------+-------+-----------+------------+----------
     1 | Step 6     | \001  | INS       | NEW        |    11994
     1 | Step 6     | \001  | DEL       | OLD        |    12007
(2 rows)

select col21, col22, col23, emaj_verb, emaj_tuple, emaj_gid from emaj.mySchema1_myTbl2_log order by emaj_gid, emaj_tuple desc;
 col21 | col22 | col23 | emaj_verb | emaj_tuple | emaj_gid 
-------+-------+-------+-----------+------------+----------
(0 rows)

select col20, col21, emaj_verb, emaj_tuple, emaj_gid from emajb.mySchema1_myTbl2b_log order by emaj_gid, emaj_tuple desc;
 col20 | col21 | emaj_verb | emaj_tuple | emaj_gid 
-------+-------+-----------+------------+----------
(0 rows)

select col31, col33, emaj_verb, emaj_tuple, emaj_gid from "emajC"."myschema1_myTbl3_log" order by emaj_gid, emaj_tuple desc;
 col31 | col33 | emaj_verb | emaj_tuple | emaj_gid 
-------+-------+-----------+------------+----------
    11 | 10.00 | UPD       | OLD        |    11957
    11 |  5.00 | UPD       | NEW        |    11957
    12 | 10.00 | UPD       | OLD        |    11958
    12 |  5.00 | UPD       | NEW        |    11958
    13 | 10.00 | UPD       | OLD        |    11959
    13 |  5.00 | UPD       | NEW        |    11959
    14 | 10.00 | UPD       | OLD        |    11960
    14 |  5.00 | UPD       | NEW        |    11960
    15 | 10.00 | UPD       | OLD        |    11961
    15 |  5.00 | UPD       | NEW        |    11961
    16 | 10.00 | UPD       | OLD        |    11962
    16 |  5.00 | UPD       | NEW        |    11962
    17 | 10.00 | UPD       | OLD        |    11963
    17 |  5.00 | UPD       | NEW        |    11963
    18 | 10.00 | UPD       | OLD        |    11964
    18 |  5.00 | UPD       | NEW        |    11964
    19 | 10.00 | UPD       | OLD        |    11965
    19 |  5.00 | UPD       | NEW        |    11965
    20 | 10.00 | UPD       | OLD        |    11966
    20 |  5.00 | UPD       | NEW        |    11966
    20 |  5.00 | UPD       | OLD        |    11997
    20 | 10.00 | UPD       | NEW        |    11997
    19 |  5.00 | UPD       | OLD        |    11998
    19 | 10.00 | UPD       | NEW        |    11998
    18 |  5.00 | UPD       | OLD        |    11999
    18 | 10.00 | UPD       | NEW        |    11999
    17 |  5.00 | UPD       | OLD        |    12000
    17 | 10.00 | UPD       | NEW        |    12000
    16 |  5.00 | UPD       | OLD        |    12001
    16 | 10.00 | UPD       | NEW        |    12001
    15 |  5.00 | UPD       | OLD        |    12002
    15 | 10.00 | UPD       | NEW        |    12002
    14 |  5.00 | UPD       | OLD        |    12003
    14 | 10.00 | UPD       | NEW        |    12003
    13 |  5.00 | UPD       | OLD        |    12004
    13 | 10.00 | UPD       | NEW        |    12004
    12 |  5.00 | UPD       | OLD        |    12005
    12 | 10.00 | UPD       | NEW        |    12005
    11 |  5.00 | UPD       | OLD        |    12006
    11 | 10.00 | UPD       | NEW        |    12006
    14 | 10.00 | DEL       | OLD        |    12010
    15 | 10.00 | DEL       | OLD        |    12011
    16 | 10.00 | DEL       | OLD        |    12012
    17 | 10.00 | DEL       | OLD        |    12013
    18 | 10.00 | DEL       | OLD        |    12014
(45 rows)

select col41, col42, col43, col44, col45, emaj_verb, emaj_tuple, emaj_gid from emaj.mySchema1_myTbl4_log order by emaj_gid, emaj_tuple desc;
 col41 | col42 | col43 | col44 |   col45    | emaj_verb | emaj_tuple | emaj_gid 
-------+-------+-------+-------+------------+-----------+------------+----------
    11 |       |     1 |     1 | Step 6     | INS       | NEW        |    11995
    12 |       |     1 |     1 | Step 6     | INS       | NEW        |    11996
    12 |       |     1 |     1 | Step 6     | DEL       | OLD        |    12008
    11 |       |     1 |     1 | Step 6     | DEL       | OLD        |    12009
(4 rows)

select col11, col12, col13, emaj_verb, emaj_tuple, emaj_gid from emaj.mySchema2_myTbl1_log order by emaj_gid, emaj_tuple desc;
 col11 | col12 | col13 | emaj_verb | emaj_tuple | emaj_gid 
-------+-------+-------+-----------+------------+----------
(0 rows)

select col21, col22, col23, emaj_verb, emaj_tuple, emaj_gid from emaj.mySchema2_myTbl2_log order by emaj_gid, emaj_tuple desc;
 col21 | col22 | col23 | emaj_verb | emaj_tuple | emaj_gid 
-------+-------+-------+-----------+------------+----------
(0 rows)

select col31, col33, emaj_verb, emaj_tuple, emaj_gid from "emajC"."myschema2_myTbl3_log" order by emaj_gid, emaj_tuple desc;
 col31 | col33 | emaj_verb | emaj_tuple | emaj_gid 
-------+-------+-----------+------------+----------
(0 rows)

select col41, col42, col43, col44, col45, emaj_verb, emaj_tuple, emaj_gid from emaj.mySchema2_myTbl4_log order by emaj_gid, emaj_tuple desc;
 col41 | col42 | col43 | col44 | col45 | emaj_verb | emaj_tuple | emaj_gid 
-------+-------+-------+-------+-------+-----------+------------+----------
(0 rows)

select col51, col52, col53, col54, emaj_verb, emaj_tuple, emaj_gid from emaj.mySchema2_myTbl5_log order by emaj_gid, emaj_tuple desc;
 col51 | col52 | col53 | col54 | emaj_verb | emaj_tuple | emaj_gid 
-------+-------+-------+-------+-----------+------------+----------
(0 rows)

select col61, col62, col63, col64, col65, col66, emaj_verb, emaj_tuple, emaj_gid from emaj.mySchema2_myTbl6_log order by emaj_gid, emaj_tuple desc;
 col61 | col62 | col63 | col64 | col65 | col66 | emaj_verb | emaj_tuple | emaj_gid 
-------+-------+-------+-------+-------+-------+-----------+------------+----------
(0 rows)

-----------------------------
-- Step 9 : test the emaj_alter_group function with non rollbackable phil's group#3, group
-----------------------------
set role emaj_regression_tests_adm_user;
select emaj.emaj_create_group('phil''s group#3",',false);
NOTICE:  table "phil's schema3_myTbl2\_log" does not exist, skipping
CONTEXT:  SQL statement "DROP TABLE IF EXISTS emaj."phil's schema3_myTbl2\_log""
PL/pgSQL function "_create_tbl" line 83 at EXECUTE statement
SQL statement "SELECT  emaj._create_tbl( $1 ,  $2 ,  $3 , coalesce( $4 ,  $5 ), coalesce( $6 ,  $5 ),  $7 )"
PL/pgSQL function "emaj_create_group" line 87 at PERFORM
NOTICE:  trigger "phil's schema3_myTbl2\_emaj_log_trg" for table "myTbl2\" does not exist, skipping
CONTEXT:  SQL statement "DROP TRIGGER IF EXISTS "phil's schema3_myTbl2\_emaj_log_trg" ON "phil's schema3"."myTbl2\""
PL/pgSQL function "_create_tbl" line 148 at EXECUTE statement
SQL statement "SELECT  emaj._create_tbl( $1 ,  $2 ,  $3 , coalesce( $4 ,  $5 ), coalesce( $6 ,  $5 ),  $7 )"
PL/pgSQL function "emaj_create_group" line 87 at PERFORM
NOTICE:  table "phil's schema3_phil's tbl1_log" does not exist, skipping
CONTEXT:  SQL statement "DROP TABLE IF EXISTS "emaj #'3"."phil's schema3_phil's tbl1_log""
PL/pgSQL function "_create_tbl" line 83 at EXECUTE statement
SQL statement "SELECT  emaj._create_tbl( $1 ,  $2 ,  $3 , coalesce( $4 ,  $5 ), coalesce( $6 ,  $5 ),  $7 )"
PL/pgSQL function "emaj_create_group" line 87 at PERFORM
NOTICE:  trigger "phil's schema3_phil's tbl1_emaj_log_trg" for table "phil's tbl1" does not exist, skipping
CONTEXT:  SQL statement "DROP TRIGGER IF EXISTS "phil's schema3_phil's tbl1_emaj_log_trg" ON "phil's schema3"."phil's tbl1""
PL/pgSQL function "_create_tbl" line 148 at EXECUTE statement
SQL statement "SELECT  emaj._create_tbl( $1 ,  $2 ,  $3 , coalesce( $4 ,  $5 ), coalesce( $6 ,  $5 ),  $7 )"
PL/pgSQL function "emaj_create_group" line 87 at PERFORM
 emaj_create_group 
-------------------
                 4
(1 row)

reset role;
alter table "phil's schema3"."phil's tbl1" alter column "phil's col12" type char(11);
set role emaj_regression_tests_adm_user;
update emaj.emaj_group_def set grpdef_priority = 1 where grpdef_schema = 'phil''s schema3' and grpdef_tblseq = E'myTbl2\\';
select emaj.emaj_alter_group('phil''s group#3",');
NOTICE:  table "phil's schema3_phil's tbl1_log" does not exist, skipping
CONTEXT:  SQL statement "DROP TABLE IF EXISTS "emaj #'3"."phil's schema3_phil's tbl1_log""
PL/pgSQL function "_create_tbl" line 83 at EXECUTE statement
SQL statement "SELECT  emaj._create_tbl( $1 ,  $2 ,  $3 , coalesce( $4 ,  $5 ), coalesce( $6 ,  $5 ),  $7 )"
PL/pgSQL function "emaj_alter_group" line 199 at PERFORM
NOTICE:  trigger "phil's schema3_phil's tbl1_emaj_log_trg" for table "phil's tbl1" does not exist, skipping
CONTEXT:  SQL statement "DROP TRIGGER IF EXISTS "phil's schema3_phil's tbl1_emaj_log_trg" ON "phil's schema3"."phil's tbl1""
PL/pgSQL function "_create_tbl" line 148 at EXECUTE statement
SQL statement "SELECT  emaj._create_tbl( $1 ,  $2 ,  $3 , coalesce( $4 ,  $5 ), coalesce( $6 ,  $5 ),  $7 )"
PL/pgSQL function "emaj_alter_group" line 199 at PERFORM
 emaj_alter_group 
------------------
                4
(1 row)

--select rel_priority from emaj.emaj_relation where rel_schema = 'phil''s schema3' and rel_tblseq = 'phil''s tbl1';
select emaj.emaj_start_group('phil''s group#3",','M1_after_alter_group');
 emaj_start_group 
------------------
                4
(1 row)

select emaj.emaj_stop_group('phil''s group#3",');
 emaj_stop_group 
-----------------
               4
(1 row)

reset role;
alter table "phil's schema3"."phil's tbl1" alter column "phil's col12" type char(10);
set role emaj_regression_tests_adm_user;
update emaj.emaj_group_def set grpdef_priority = NULL where grpdef_schema = 'phil''s schema3' and grpdef_tblseq = E'myTbl2\\';
select emaj.emaj_alter_group('phil''s group#3",');
NOTICE:  table "phil's schema3_phil's tbl1_log" does not exist, skipping
CONTEXT:  SQL statement "DROP TABLE IF EXISTS "emaj #'3"."phil's schema3_phil's tbl1_log""
PL/pgSQL function "_create_tbl" line 83 at EXECUTE statement
SQL statement "SELECT  emaj._create_tbl( $1 ,  $2 ,  $3 , coalesce( $4 ,  $5 ), coalesce( $6 ,  $5 ),  $7 )"
PL/pgSQL function "emaj_alter_group" line 199 at PERFORM
NOTICE:  trigger "phil's schema3_phil's tbl1_emaj_log_trg" for table "phil's tbl1" does not exist, skipping
CONTEXT:  SQL statement "DROP TRIGGER IF EXISTS "phil's schema3_phil's tbl1_emaj_log_trg" ON "phil's schema3"."phil's tbl1""
PL/pgSQL function "_create_tbl" line 148 at EXECUTE statement
SQL statement "SELECT  emaj._create_tbl( $1 ,  $2 ,  $3 , coalesce( $4 ,  $5 ), coalesce( $6 ,  $5 ),  $7 )"
PL/pgSQL function "emaj_alter_group" line 199 at PERFORM
 emaj_alter_group 
------------------
                4
(1 row)

select emaj.emaj_drop_group('phil''s group#3",');
 emaj_drop_group 
-----------------
               4
(1 row)

-----------------------------
-- Step 10 : for phil''s group#3", recreate the group as rollbackable, update tables, 
--           rename a mark, then delete 2 marks then delete all before a mark 
-----------------------------
-- prepare phil's group#3, group
--
reset role;
alter table "phil's schema3"."myTbl2\" add primary key (col21);
NOTICE:  ALTER TABLE / ADD PRIMARY KEY will create implicit index "myTbl2\_pkey" for table "myTbl2\"
set role emaj_regression_tests_adm_user;
select emaj.emaj_create_group('phil''s group#3",',true);
NOTICE:  table "phil's schema3_myTbl2\_log" does not exist, skipping
CONTEXT:  SQL statement "DROP TABLE IF EXISTS emaj."phil's schema3_myTbl2\_log""
PL/pgSQL function "_create_tbl" line 83 at EXECUTE statement
SQL statement "SELECT  emaj._create_tbl( $1 ,  $2 ,  $3 , coalesce( $4 ,  $5 ), coalesce( $6 ,  $5 ),  $7 )"
PL/pgSQL function "emaj_create_group" line 87 at PERFORM
NOTICE:  trigger "phil's schema3_myTbl2\_emaj_log_trg" for table "myTbl2\" does not exist, skipping
CONTEXT:  SQL statement "DROP TRIGGER IF EXISTS "phil's schema3_myTbl2\_emaj_log_trg" ON "phil's schema3"."myTbl2\""
PL/pgSQL function "_create_tbl" line 148 at EXECUTE statement
SQL statement "SELECT  emaj._create_tbl( $1 ,  $2 ,  $3 , coalesce( $4 ,  $5 ), coalesce( $6 ,  $5 ),  $7 )"
PL/pgSQL function "emaj_create_group" line 87 at PERFORM
NOTICE:  table "phil's schema3_phil's tbl1_log" does not exist, skipping
CONTEXT:  SQL statement "DROP TABLE IF EXISTS "emaj #'3"."phil's schema3_phil's tbl1_log""
PL/pgSQL function "_create_tbl" line 83 at EXECUTE statement
SQL statement "SELECT  emaj._create_tbl( $1 ,  $2 ,  $3 , coalesce( $4 ,  $5 ), coalesce( $6 ,  $5 ),  $7 )"
PL/pgSQL function "emaj_create_group" line 87 at PERFORM
NOTICE:  trigger "phil's schema3_phil's tbl1_emaj_log_trg" for table "phil's tbl1" does not exist, skipping
CONTEXT:  SQL statement "DROP TRIGGER IF EXISTS "phil's schema3_phil's tbl1_emaj_log_trg" ON "phil's schema3"."phil's tbl1""
PL/pgSQL function "_create_tbl" line 148 at EXECUTE statement
SQL statement "SELECT  emaj._create_tbl( $1 ,  $2 ,  $3 , coalesce( $4 ,  $5 ), coalesce( $6 ,  $5 ),  $7 )"
PL/pgSQL function "emaj_create_group" line 87 at PERFORM
WARNING:  _check_fk_groups: Foreign key mytbl2_col21_fkey, from table phil's schema3.myTbl2\, references phil's schema3.mytbl4 that is outside groups (phil's group#3",).
CONTEXT:  SQL statement "SELECT  emaj._check_fk_groups (array[ $1 ])"
PL/pgSQL function "emaj_create_group" line 113 at PERFORM
WARNING:  _check_fk_groups: table phil's schema3.phil's tbl1 is referenced by foreign key mytbl4_col44_fkey from table phil's schema3.mytbl4 that is outside groups (phil's group#3",).
CONTEXT:  SQL statement "SELECT  emaj._check_fk_groups (array[ $1 ])"
PL/pgSQL function "emaj_create_group" line 113 at PERFORM
 emaj_create_group 
-------------------
                 4
(1 row)

select emaj.emaj_start_group('phil''s group#3",','M1_rollbackable');
WARNING:  _check_fk_groups: Foreign key mytbl2_col21_fkey, from table phil's schema3.myTbl2\, references phil's schema3.mytbl4 that is outside groups (phil's group#3",).
CONTEXT:  SQL statement "SELECT  emaj._check_fk_groups(array[ $1 [ $2 ]])"
PL/pgSQL function "_start_groups" line 45 at PERFORM
SQL statement "SELECT emaj._start_groups(array[ $1 ],  $2 , false,  $3 )"
PL/pgSQL function "emaj_start_group" line 16 at SQL statement
PL/pgSQL function "emaj_start_group" line 5 at RETURN
WARNING:  _check_fk_groups: table phil's schema3.phil's tbl1 is referenced by foreign key mytbl4_col44_fkey from table phil's schema3.mytbl4 that is outside groups (phil's group#3",).
CONTEXT:  SQL statement "SELECT  emaj._check_fk_groups(array[ $1 [ $2 ]])"
PL/pgSQL function "_start_groups" line 45 at PERFORM
SQL statement "SELECT emaj._start_groups(array[ $1 ],  $2 , false,  $3 )"
PL/pgSQL function "emaj_start_group" line 16 at SQL statement
PL/pgSQL function "emaj_start_group" line 5 at RETURN
 emaj_start_group 
------------------
                4
(1 row)

--
set search_path="phil's schema3";
--
insert into "phil's tbl1" select i, 'AB''C', E'\\014'::bytea from generate_series (1,31) as i;
update "phil's tbl1" set "phil\s col13" = E'\\034'::bytea where "phil's col11" <= 3;
update "phil's tbl1" set "phil\s col13" = E'\\034'''::bytea where "phil's col11" between 18 and 22;
insert into myTbl4 (col41) values (1);
insert into myTbl4 (col41) values (2);
insert into "myTbl2\" values (1,'ABC','2010-12-31');
delete from "phil's tbl1" where "phil's col11" > 20;
insert into "myTbl2\" values (2,'DEF',NULL);
select nextval(E'"phil''s schema3"."phil''s seq\\1"');
 nextval 
---------
    1000
(1 row)

--
select emaj.emaj_set_mark_group('phil''s group#3",','M2_rollbackable');
 emaj_set_mark_group 
---------------------
                   4
(1 row)

select emaj.emaj_set_mark_group('phil''s group#3",','M2_again!');
 emaj_set_mark_group 
---------------------
                   4
(1 row)

--
delete from "phil's tbl1" where "phil's col11" = 10;
update "phil's tbl1" set "phil's col12" = 'DEF' where "phil's col11" <= 2;
select nextval(E'"phil''s schema3"."phil''s seq\\1"');
 nextval 
---------
    1001
(1 row)

--
select emaj.emaj_set_mark_groups(array['phil''s group#3",'],'phil''s mark #1');
 emaj_set_mark_groups 
----------------------
                    4
(1 row)

select emaj.emaj_comment_mark_group('phil''s group#3",','phil''s mark #1','Third mark set');
 emaj_comment_mark_group 
-------------------------
 
(1 row)

--
select emaj.emaj_rename_mark_group('phil''s group#3",','phil''s mark #1','phil''s mark #3');
 emaj_rename_mark_group 
------------------------
 
(1 row)

-- 
select emaj.emaj_delete_mark_group('phil''s group#3",','M2_again!');
 emaj_delete_mark_group 
------------------------
                      1
(1 row)

--
select * from emaj.emaj_log_stat_group('phil''s group#3",','','');
    stat_group    |  stat_schema   | stat_table  | stat_rows 
------------------+----------------+-------------+-----------
 phil's group#3", | phil's schema3 | myTbl2\     |         2
 phil's group#3", | phil's schema3 | phil's tbl1 |        53
(2 rows)

select * from emaj.emaj_detailed_log_stat_group('phil''s group#3",','phil''s mark #3','');
 stat_group | stat_schema | stat_table | stat_role | stat_verb | stat_rows 
------------+-------------+------------+-----------+-----------+-----------
(0 rows)

--
select emaj.emaj_logged_rollback_group('phil''s group#3",','phil''s mark #3');
WARNING:  _check_fk_groups: Foreign key mytbl2_col21_fkey, from table phil's schema3.myTbl2\, references phil's schema3.mytbl4 that is outside groups (phil's group#3",).
CONTEXT:  SQL statement "SELECT  emaj._check_fk_groups( $1 )"
PL/pgSQL function "_rlbk_groups_step1" line 73 at PERFORM
SQL statement "SELECT emaj._rlbk_groups_step1( $1 ,  $2 ,  $3 , 1,  $4 )"
PL/pgSQL function "_rlbk_groups" line 19 at SQL statement
PL/pgSQL function "emaj_logged_rollback_group" line 11 at RETURN
WARNING:  _check_fk_groups: table phil's schema3.phil's tbl1 is referenced by foreign key mytbl4_col44_fkey from table phil's schema3.mytbl4 that is outside groups (phil's group#3",).
CONTEXT:  SQL statement "SELECT  emaj._check_fk_groups( $1 )"
PL/pgSQL function "_rlbk_groups_step1" line 73 at PERFORM
SQL statement "SELECT emaj._rlbk_groups_step1( $1 ,  $2 ,  $3 , 1,  $4 )"
PL/pgSQL function "_rlbk_groups" line 19 at SQL statement
PL/pgSQL function "emaj_logged_rollback_group" line 11 at RETURN
 emaj_logged_rollback_group 
----------------------------
                          2
(1 row)

select emaj.emaj_rollback_group('phil''s group#3",','phil''s mark #3');
WARNING:  _check_fk_groups: Foreign key mytbl2_col21_fkey, from table phil's schema3.myTbl2\, references phil's schema3.mytbl4 that is outside groups (phil's group#3",).
CONTEXT:  SQL statement "SELECT  emaj._check_fk_groups( $1 )"
PL/pgSQL function "_rlbk_groups_step1" line 73 at PERFORM
SQL statement "SELECT emaj._rlbk_groups_step1( $1 ,  $2 ,  $3 , 1,  $4 )"
PL/pgSQL function "_rlbk_groups" line 19 at SQL statement
PL/pgSQL function "emaj_rollback_group" line 7 at RETURN
WARNING:  _check_fk_groups: table phil's schema3.phil's tbl1 is referenced by foreign key mytbl4_col44_fkey from table phil's schema3.mytbl4 that is outside groups (phil's group#3",).
CONTEXT:  SQL statement "SELECT  emaj._check_fk_groups( $1 )"
PL/pgSQL function "_rlbk_groups_step1" line 73 at PERFORM
SQL statement "SELECT emaj._rlbk_groups_step1( $1 ,  $2 ,  $3 , 1,  $4 )"
PL/pgSQL function "_rlbk_groups" line 19 at SQL statement
PL/pgSQL function "emaj_rollback_group" line 7 at RETURN
 emaj_rollback_group 
---------------------
                   2
(1 row)

-----------------------------
-- Checking step 10
-----------------------------
-- emaj tables
select mark_id, mark_group, regexp_replace(mark_name,E'\\d\\d\.\\d\\d\\.\\d\\d\\.\\d\\d\\d','%','g'), mark_global_seq, mark_state, mark_comment, mark_last_seq_hole_id, mark_last_sequence_id, mark_log_rows_before_next from emaj.emaj_mark order by mark_id;
 mark_id |    mark_group    |        regexp_replace        | mark_global_seq | mark_state |     mark_comment     | mark_last_seq_hole_id | mark_last_sequence_id | mark_log_rows_before_next 
---------+------------------+------------------------------+-----------------+------------+----------------------+-----------------------+-----------------------+---------------------------
     606 | myGroup2         | M3                           |           11927 | DELETED    | This mark is deleted |                   599 |                  6045 |                         0
     611 | myGroup1         | M4                           |           11956 | DELETED    |                      |                   601 |                  6083 |                        10
     612 | myGroup1         | M5                           |           11966 | DELETED    |                      |                   601 |                  6089 |                         3
     616 | myGroup1         | Before logged rollback to M4 |           11996 | DELETED    |                      |                   606 |                  6117 |                        18
     618 | myGroup1         | STOP_%                       |           12014 | DELETED    |                      |                   606 |                  6137 |                         0
     619 | myGroup2         | STOP_%                       |           12014 | DELETED    |                      |                   606 |                  6137 |                         0
     628 | myGroup1         | Stop after rollback          |           12014 | DELETED    |                      |                   606 |                  6207 |                         0
     629 | myGroup2         | Stop after rollback          |           12014 | DELETED    |                      |                   606 |                  6207 |                         0
     630 | myGroup1         | Multi-1                      |           12014 | ACTIVE     |                      |                   606 |                  6221 |                          
     631 | myGroup2         | Multi-1                      |           12014 | ACTIVE     |                      |                   606 |                  6221 |                          
     636 | phil's group#3", | M1_rollbackable              |           12014 | ACTIVE     |                      |                   606 |                  6247 |                        52
     637 | phil's group#3", | M2_rollbackable              |           12066 | ACTIVE     |                      |                   606 |                  6251 |                         3
     639 | phil's group#3", | phil's mark #3               |           12069 | ACTIVE     | Third mark set       |                   606 |                  6259 |                          
(13 rows)

select sequ_id,sequ_schema, sequ_name, regexp_replace(sequ_mark,E'\\d\\d\.\\d\\d\\.\\d\\d\\.\\d\\d\\d','%','g'), sequ_last_val, sequ_is_called from emaj.emaj_sequence order by sequ_id;
 sequ_id |  sequ_schema   |             sequ_name              |        regexp_replace        | sequ_last_val | sequ_is_called 
---------+----------------+------------------------------------+------------------------------+---------------+----------------
    6025 | emajC          | myschema1_myTbl3_log_seq           | M3                           |            10 | t
    6028 | emaj           | myschema1_mytbl2_log_seq           | M3                           |             2 | t
    6029 | emajb          | myschema1_mytbl2b_log_seq          | M3                           |             1 | f
    6038 | myschema2      | myseq1                             | M3                           |          1003 | t
    6039 | myschema2      | myTbl3_col31_seq                   | M3                           |            20 | t
    6040 | emaj           | myschema2_mytbl1_log_seq           | M3                           |            15 | t
    6041 | emaj           | myschema2_mytbl2_log_seq           | M3                           |             2 | t
    6042 | emajC          | myschema2_myTbl3_log_seq           | M3                           |            10 | t
    6043 | emaj           | myschema2_mytbl4_log_seq           | M3                           |             4 | t
    6044 | emaj           | myschema2_mytbl5_log_seq           | M3                           |             4 | t
    6045 | emaj           | myschema2_mytbl6_log_seq           | M3                           |            14 | t
    6048 | emaj           | myschema2_mytbl1_log_seq           | RLBK_M2_%_START              |            15 | t
    6049 | emaj           | myschema2_mytbl2_log_seq           | RLBK_M2_%_START              |             2 | t
    6050 | emajC          | myschema2_myTbl3_log_seq           | RLBK_M2_%_START              |            10 | t
    6056 | emaj           | myschema2_mytbl1_log_seq           | RLBK_M2_%_DONE               |            15 | t
    6057 | emaj           | myschema2_mytbl2_log_seq           | RLBK_M2_%_DONE               |             2 | t
    6058 | emajC          | myschema2_myTbl3_log_seq           | RLBK_M2_%_DONE               |            10 | t
    6064 | emaj           | myschema2_mytbl1_log_seq           | RLBK_M3_%_START              |            15 | t
    6065 | emaj           | myschema2_mytbl2_log_seq           | RLBK_M3_%_START              |             2 | t
    6066 | emajC          | myschema2_myTbl3_log_seq           | RLBK_M3_%_START              |            10 | t
    6072 | emaj           | myschema2_mytbl1_log_seq           | RLBK_M3_%_DONE               |            15 | t
    6073 | emaj           | myschema2_mytbl2_log_seq           | RLBK_M3_%_DONE               |             2 | t
    6074 | emajC          | myschema2_myTbl3_log_seq           | RLBK_M3_%_DONE               |            10 | t
    6078 | myschema1      | myTbl3_col31_seq                   | M4                           |            20 | t
    6079 | emajC          | myschema1_myTbl3_log_seq           | M4                           |            10 | t
    6080 | emaj           | myschema1_mytbl1_log_seq           | M4                           |            30 | t
    6081 | emaj           | myschema1_mytbl4_log_seq           | M4                           |             8 | t
    6082 | emaj           | myschema1_mytbl2_log_seq           | M4                           |             3 | t
    6083 | emajb          | myschema1_mytbl2b_log_seq          | M4                           |             1 | f
    6084 | myschema1      | myTbl3_col31_seq                   | M5                           |            20 | t
    6085 | emajC          | myschema1_myTbl3_log_seq           | M5                           |            20 | t
    6086 | emaj           | myschema1_mytbl1_log_seq           | M5                           |            30 | t
    6087 | emaj           | myschema1_mytbl4_log_seq           | M5                           |             8 | t
    6088 | emaj           | myschema1_mytbl2_log_seq           | M5                           |             3 | t
    6089 | emajb          | myschema1_mytbl2b_log_seq          | M5                           |             1 | f
    6091 | emajC          | myschema1_myTbl3_log_seq           | M6                           |            20 | t
    6094 | emaj           | myschema1_mytbl2_log_seq           | M6                           |             3 | t
    6095 | emajb          | myschema1_mytbl2b_log_seq          | M6                           |             1 | f
    6098 | emaj           | myschema2_mytbl1_log_seq           | RLBK_M2_%_START              |            15 | t
    6099 | emaj           | myschema2_mytbl2_log_seq           | RLBK_M2_%_START              |             2 | t
    6100 | emajC          | myschema2_myTbl3_log_seq           | RLBK_M2_%_START              |            10 | t
    6106 | emaj           | myschema2_mytbl1_log_seq           | RLBK_M2_%_DONE               |            15 | t
    6107 | emaj           | myschema2_mytbl2_log_seq           | RLBK_M2_%_DONE               |             2 | t
    6108 | emajC          | myschema2_myTbl3_log_seq           | RLBK_M2_%_DONE               |            10 | t
    6112 | myschema1      | myTbl3_col31_seq                   | Before logged rollback to M4 |            20 | t
    6113 | emajC          | myschema1_myTbl3_log_seq           | Before logged rollback to M4 |            20 | t
    6114 | emaj           | myschema1_mytbl1_log_seq           | Before logged rollback to M4 |            32 | t
    6115 | emaj           | myschema1_mytbl4_log_seq           | Before logged rollback to M4 |            12 | t
    6116 | emaj           | myschema1_mytbl2_log_seq           | Before logged rollback to M4 |             3 | t
    6117 | emajb          | myschema1_mytbl2b_log_seq          | Before logged rollback to M4 |             1 | f
    6124 | myschema1      | myTbl3_col31_seq                   | STOP_%                       |            20 | t
    6125 | myschema2      | myseq1                             | STOP_%                       |          1004 | f
    6126 | myschema2      | myTbl3_col31_seq                   | STOP_%                       |            20 | t
    6127 | emajC          | myschema1_myTbl3_log_seq           | STOP_%                       |            35 | t
    6128 | emaj           | myschema1_mytbl1_log_seq           | STOP_%                       |            33 | t
    6129 | emaj           | myschema1_mytbl4_log_seq           | STOP_%                       |            14 | t
    6130 | emaj           | myschema1_mytbl2_log_seq           | STOP_%                       |             3 | t
    6131 | emajb          | myschema1_mytbl2b_log_seq          | STOP_%                       |             1 | f
    6132 | emaj           | myschema2_mytbl1_log_seq           | STOP_%                       |            15 | t
    6133 | emaj           | myschema2_mytbl2_log_seq           | STOP_%                       |             2 | t
    6134 | emajC          | myschema2_myTbl3_log_seq           | STOP_%                       |            10 | t
    6135 | emaj           | myschema2_mytbl4_log_seq           | STOP_%                       |            24 | t
    6136 | emaj           | myschema2_mytbl5_log_seq           | STOP_%                       |             9 | t
    6137 | emaj           | myschema2_mytbl6_log_seq           | STOP_%                       |            29 | t
    6155 | emajC          | myschema1_myTbl3_log_seq           | Multi-2                      |            35 | t
    6156 | emaj           | myschema1_mytbl1_log_seq           | Multi-2                      |            33 | t
    6157 | emaj           | myschema1_mytbl4_log_seq           | Multi-2                      |            14 | t
    6158 | emaj           | myschema1_mytbl2_log_seq           | Multi-2                      |             3 | t
    6159 | emajb          | myschema1_mytbl2b_log_seq          | Multi-2                      |             1 | f
    6160 | emaj           | myschema2_mytbl1_log_seq           | Multi-2                      |            15 | t
    6161 | emaj           | myschema2_mytbl2_log_seq           | Multi-2                      |             2 | t
    6162 | emajC          | myschema2_myTbl3_log_seq           | Multi-2                      |            10 | t
    6163 | emaj           | myschema2_mytbl4_log_seq           | Multi-2                      |            24 | t
    6164 | emaj           | myschema2_mytbl5_log_seq           | Multi-2                      |             9 | t
    6165 | emaj           | myschema2_mytbl6_log_seq           | Multi-2                      |            29 | t
    6169 | emajC          | myschema1_myTbl3_log_seq           | RLBK_Multi-1_%_START         |            35 | t
    6170 | emaj           | myschema1_mytbl1_log_seq           | RLBK_Multi-1_%_START         |            33 | t
    6171 | emaj           | myschema1_mytbl4_log_seq           | RLBK_Multi-1_%_START         |            14 | t
    6172 | emaj           | myschema1_mytbl2_log_seq           | RLBK_Multi-1_%_START         |             3 | t
    6173 | emajb          | myschema1_mytbl2b_log_seq          | RLBK_Multi-1_%_START         |             1 | f
    6174 | emaj           | myschema2_mytbl1_log_seq           | RLBK_Multi-1_%_START         |            15 | t
    6175 | emaj           | myschema2_mytbl2_log_seq           | RLBK_Multi-1_%_START         |             2 | t
    6176 | emajC          | myschema2_myTbl3_log_seq           | RLBK_Multi-1_%_START         |            10 | t
    6177 | emaj           | myschema2_mytbl4_log_seq           | RLBK_Multi-1_%_START         |            24 | t
    6178 | emaj           | myschema2_mytbl5_log_seq           | RLBK_Multi-1_%_START         |             9 | t
    6179 | emaj           | myschema2_mytbl6_log_seq           | RLBK_Multi-1_%_START         |            29 | t
    6183 | emajC          | myschema1_myTbl3_log_seq           | RLBK_Multi-1_%_DONE          |            35 | t
    6184 | emaj           | myschema1_mytbl1_log_seq           | RLBK_Multi-1_%_DONE          |            33 | t
    6185 | emaj           | myschema1_mytbl4_log_seq           | RLBK_Multi-1_%_DONE          |            14 | t
    6186 | emaj           | myschema1_mytbl2_log_seq           | RLBK_Multi-1_%_DONE          |             3 | t
    6187 | emajb          | myschema1_mytbl2b_log_seq          | RLBK_Multi-1_%_DONE          |             1 | f
    6188 | emaj           | myschema2_mytbl1_log_seq           | RLBK_Multi-1_%_DONE          |            15 | t
    6189 | emaj           | myschema2_mytbl2_log_seq           | RLBK_Multi-1_%_DONE          |             2 | t
    6190 | emajC          | myschema2_myTbl3_log_seq           | RLBK_Multi-1_%_DONE          |            10 | t
    6191 | emaj           | myschema2_mytbl4_log_seq           | RLBK_Multi-1_%_DONE          |            24 | t
    6192 | emaj           | myschema2_mytbl5_log_seq           | RLBK_Multi-1_%_DONE          |             9 | t
    6193 | emaj           | myschema2_mytbl6_log_seq           | RLBK_Multi-1_%_DONE          |            29 | t
    6194 | myschema1      | myTbl3_col31_seq                   | Stop after rollback          |            20 | t
    6195 | myschema2      | myseq1                             | Stop after rollback          |          1004 | f
    6196 | myschema2      | myTbl3_col31_seq                   | Stop after rollback          |            20 | t
    6197 | emajC          | myschema1_myTbl3_log_seq           | Stop after rollback          |            35 | t
    6198 | emaj           | myschema1_mytbl1_log_seq           | Stop after rollback          |            33 | t
    6199 | emaj           | myschema1_mytbl4_log_seq           | Stop after rollback          |            14 | t
    6200 | emaj           | myschema1_mytbl2_log_seq           | Stop after rollback          |             3 | t
    6201 | emajb          | myschema1_mytbl2b_log_seq          | Stop after rollback          |             1 | f
    6202 | emaj           | myschema2_mytbl1_log_seq           | Stop after rollback          |            15 | t
    6203 | emaj           | myschema2_mytbl2_log_seq           | Stop after rollback          |             2 | t
    6204 | emajC          | myschema2_myTbl3_log_seq           | Stop after rollback          |            10 | t
    6205 | emaj           | myschema2_mytbl4_log_seq           | Stop after rollback          |            24 | t
    6206 | emaj           | myschema2_mytbl5_log_seq           | Stop after rollback          |             9 | t
    6207 | emaj           | myschema2_mytbl6_log_seq           | Stop after rollback          |            29 | t
    6208 | myschema1      | myTbl3_col31_seq                   | Multi-1                      |            20 | t
    6209 | myschema2      | myseq1                             | Multi-1                      |          1004 | f
    6210 | myschema2      | myTbl3_col31_seq                   | Multi-1                      |            20 | t
    6211 | emajC          | myschema1_myTbl3_log_seq           | Multi-1                      |            35 | t
    6212 | emaj           | myschema1_mytbl1_log_seq           | Multi-1                      |            33 | t
    6213 | emaj           | myschema1_mytbl4_log_seq           | Multi-1                      |            14 | t
    6214 | emaj           | myschema1_mytbl2_log_seq           | Multi-1                      |             3 | t
    6215 | emajb          | myschema1_mytbl2b_log_seq          | Multi-1                      |             1 | f
    6216 | emaj           | myschema2_mytbl1_log_seq           | Multi-1                      |            15 | t
    6217 | emaj           | myschema2_mytbl2_log_seq           | Multi-1                      |             2 | t
    6218 | emajC          | myschema2_myTbl3_log_seq           | Multi-1                      |            10 | t
    6219 | emaj           | myschema2_mytbl4_log_seq           | Multi-1                      |            24 | t
    6220 | emaj           | myschema2_mytbl5_log_seq           | Multi-1                      |             9 | t
    6221 | emaj           | myschema2_mytbl6_log_seq           | Multi-1                      |            29 | t
    6244 | phil's schema3 | myTbl2\_col21_seq                  | M1_rollbackable              |             1 | f
    6245 | phil's schema3 | phil's seq\1                       | M1_rollbackable              |          1000 | f
    6246 | emaj           | phil's schema3_myTbl2\_log_seq     | M1_rollbackable              |             1 | f
    6247 | emaj #'3       | phil's schema3_phil's tbl1_log_seq | M1_rollbackable              |             1 | f
    6248 | phil's schema3 | myTbl2\_col21_seq                  | M2_rollbackable              |             1 | f
    6249 | phil's schema3 | phil's seq\1                       | M2_rollbackable              |          1000 | t
    6250 | emaj           | phil's schema3_myTbl2\_log_seq     | M2_rollbackable              |             2 | t
    6251 | emaj #'3       | phil's schema3_phil's tbl1_log_seq | M2_rollbackable              |            50 | t
    6256 | phil's schema3 | myTbl2\_col21_seq                  | phil's mark #3               |             1 | f
    6257 | phil's schema3 | phil's seq\1                       | phil's mark #3               |          1001 | t
    6258 | emaj           | phil's schema3_myTbl2\_log_seq     | phil's mark #3               |             2 | t
    6259 | emaj #'3       | phil's schema3_phil's tbl1_log_seq | phil's mark #3               |            53 | t
    6262 | emaj           | phil's schema3_myTbl2\_log_seq     | RLBK_phil's mark #3_%_START  |             2 | t
    6263 | emaj #'3       | phil's schema3_phil's tbl1_log_seq | RLBK_phil's mark #3_%_START  |            53 | t
    6266 | emaj           | phil's schema3_myTbl2\_log_seq     | RLBK_phil's mark #3_%_DONE   |             2 | t
    6267 | emaj #'3       | phil's schema3_phil's tbl1_log_seq | RLBK_phil's mark #3_%_DONE   |            53 | t
(141 rows)

select * from emaj.emaj_fk order by fk_groups, fk_session, fk_name;
 fk_groups | fk_session | fk_name | fk_schema | fk_table | fk_action | fk_def 
-----------+------------+---------+-----------+----------+-----------+--------
(0 rows)

select sqhl_id, sqhl_schema, sqhl_table, sqhl_hole_size from emaj.emaj_seq_hole order by sqhl_id;
 sqhl_id | sqhl_schema | sqhl_table | sqhl_hole_size 
---------+-------------+------------+----------------
     602 | myschema2   | mytbl4     |             20
     603 | myschema2   | mytbl5     |              5
     604 | myschema2   | mytbl6     |             15
     605 | myschema1   | mytbl1     |              1
     606 | myschema1   | mytbl4     |              2
(5 rows)

select rlbk_operation, rlbk_schema, rlbk_tbl_fk, rlbk_nb_rows from emaj.emaj_rlbk_stat
  order by rlbk_schema, rlbk_tbl_fk, rlbk_datetime, rlbk_operation;
  rlbk_operation  | rlbk_schema |    rlbk_tbl_fk    | rlbk_nb_rows 
------------------+-------------+-------------------+--------------
 del_log          | myschema1   | mytbl1            |            3
 rlbk             | myschema1   | mytbl1            |            3
 del_log          | myschema1   | mytbl1            |            1
 rlbk             | myschema1   | mytbl1            |            1
 rlbk             | myschema1   | mytbl1            |            1
 rlbk             | myschema1   | myTbl3            |           10
 del_log          | myschema1   | mytbl4            |            8
 rlbk             | myschema1   | mytbl4            |            8
 del_log          | myschema1   | mytbl4            |            2
 rlbk             | myschema1   | mytbl4            |            2
 rlbk             | myschema1   | mytbl4            |            2
 set_fk_immediate | myschema1   | mytbl4_col43_fkey |            8
 set_fk_immediate | myschema1   | mytbl4_col43_fkey |            2
 set_fk_immediate | myschema1   | mytbl4_col43_fkey |            2
 add_fk           | myschema1   | mytbl4_col44_fkey |            0
 add_fk           | myschema1   | mytbl4_col44_fkey |            0
 add_fk           | myschema1   | mytbl4_col44_fkey |            0
 rlbk             | myschema2   | mytbl4            |            4
 rlbk             | myschema2   | mytbl4            |            4
 rlbk             | myschema2   | mytbl4            |           12
 del_log          | myschema2   | mytbl4            |           20
 rlbk             | myschema2   | mytbl4            |           20
 set_fk_immediate | myschema2   | mytbl4_col43_fkey |            4
 set_fk_immediate | myschema2   | mytbl4_col43_fkey |            4
 set_fk_immediate | myschema2   | mytbl4_col43_fkey |           12
 set_fk_immediate | myschema2   | mytbl4_col43_fkey |           20
 add_fk           | myschema2   | mytbl4_col44_fkey |            2
 add_fk           | myschema2   | mytbl4_col44_fkey |            2
 add_fk           | myschema2   | mytbl4_col44_fkey |            2
 add_fk           | myschema2   | mytbl4_col44_fkey |            2
 rlbk             | myschema2   | mytbl5            |            1
 rlbk             | myschema2   | mytbl5            |            1
 rlbk             | myschema2   | mytbl5            |            3
 del_log          | myschema2   | mytbl5            |            5
 rlbk             | myschema2   | mytbl5            |            5
 rlbk             | myschema2   | mytbl6            |            3
 rlbk             | myschema2   | mytbl6            |            3
 rlbk             | myschema2   | mytbl6            |            9
 del_log          | myschema2   | mytbl6            |           15
 rlbk             | myschema2   | mytbl6            |           15
(40 rows)

-- user tables
select * from "phil's schema3"."phil's tbl1" order by "phil's col11","phil's col12";
 phil's col11 | phil's col12 | phil\s col13 
--------------+--------------+--------------
            1 | DEF          | \034
            2 | DEF          | \034
            3 | AB'C         | \034
            4 | AB'C         | \014
            5 | AB'C         | \014
            6 | AB'C         | \014
            7 | AB'C         | \014
            8 | AB'C         | \014
            9 | AB'C         | \014
           11 | AB'C         | \014
           12 | AB'C         | \014
           13 | AB'C         | \014
           14 | AB'C         | \014
           15 | AB'C         | \014
           16 | AB'C         | \014
           17 | AB'C         | \014
           18 | AB'C         | \034'
           19 | AB'C         | \034'
           20 | AB'C         | \034'
(19 rows)

select * from "phil's schema3"."myTbl2\" order by col21;
 col21 | col22 |   col23    
-------+-------+------------
     1 | ABC   | 12-31-2010
     2 | DEF   | 
(2 rows)

-- log tables
select "phil's col11", "phil's col12", "phil\s col13", emaj_verb, emaj_tuple, emaj_gid from "emaj #'3"."phil's schema3_phil's tbl1_log" order by emaj_gid, emaj_tuple desc;
 phil's col11 | phil's col12 | phil\s col13 | emaj_verb | emaj_tuple | emaj_gid 
--------------+--------------+--------------+-----------+------------+----------
            1 | AB'C         | \014         | INS       | NEW        |    12015
            2 | AB'C         | \014         | INS       | NEW        |    12016
            3 | AB'C         | \014         | INS       | NEW        |    12017
            4 | AB'C         | \014         | INS       | NEW        |    12018
            5 | AB'C         | \014         | INS       | NEW        |    12019
            6 | AB'C         | \014         | INS       | NEW        |    12020
            7 | AB'C         | \014         | INS       | NEW        |    12021
            8 | AB'C         | \014         | INS       | NEW        |    12022
            9 | AB'C         | \014         | INS       | NEW        |    12023
           10 | AB'C         | \014         | INS       | NEW        |    12024
           11 | AB'C         | \014         | INS       | NEW        |    12025
           12 | AB'C         | \014         | INS       | NEW        |    12026
           13 | AB'C         | \014         | INS       | NEW        |    12027
           14 | AB'C         | \014         | INS       | NEW        |    12028
           15 | AB'C         | \014         | INS       | NEW        |    12029
           16 | AB'C         | \014         | INS       | NEW        |    12030
           17 | AB'C         | \014         | INS       | NEW        |    12031
           18 | AB'C         | \014         | INS       | NEW        |    12032
           19 | AB'C         | \014         | INS       | NEW        |    12033
           20 | AB'C         | \014         | INS       | NEW        |    12034
           21 | AB'C         | \014         | INS       | NEW        |    12035
           22 | AB'C         | \014         | INS       | NEW        |    12036
           23 | AB'C         | \014         | INS       | NEW        |    12037
           24 | AB'C         | \014         | INS       | NEW        |    12038
           25 | AB'C         | \014         | INS       | NEW        |    12039
           26 | AB'C         | \014         | INS       | NEW        |    12040
           27 | AB'C         | \014         | INS       | NEW        |    12041
           28 | AB'C         | \014         | INS       | NEW        |    12042
           29 | AB'C         | \014         | INS       | NEW        |    12043
           30 | AB'C         | \014         | INS       | NEW        |    12044
           31 | AB'C         | \014         | INS       | NEW        |    12045
            1 | AB'C         | \014         | UPD       | OLD        |    12046
            1 | AB'C         | \034         | UPD       | NEW        |    12046
            2 | AB'C         | \014         | UPD       | OLD        |    12047
            2 | AB'C         | \034         | UPD       | NEW        |    12047
            3 | AB'C         | \014         | UPD       | OLD        |    12048
            3 | AB'C         | \034         | UPD       | NEW        |    12048
           18 | AB'C         | \014         | UPD       | OLD        |    12049
           18 | AB'C         | \034'        | UPD       | NEW        |    12049
           19 | AB'C         | \014         | UPD       | OLD        |    12050
           19 | AB'C         | \034'        | UPD       | NEW        |    12050
           20 | AB'C         | \014         | UPD       | OLD        |    12051
           20 | AB'C         | \034'        | UPD       | NEW        |    12051
           21 | AB'C         | \014         | UPD       | OLD        |    12052
           21 | AB'C         | \034'        | UPD       | NEW        |    12052
           22 | AB'C         | \014         | UPD       | OLD        |    12053
           22 | AB'C         | \034'        | UPD       | NEW        |    12053
           23 | AB'C         | \014         | DEL       | OLD        |    12055
           24 | AB'C         | \014         | DEL       | OLD        |    12056
           25 | AB'C         | \014         | DEL       | OLD        |    12057
           26 | AB'C         | \014         | DEL       | OLD        |    12058
           27 | AB'C         | \014         | DEL       | OLD        |    12059
           28 | AB'C         | \014         | DEL       | OLD        |    12060
           29 | AB'C         | \014         | DEL       | OLD        |    12061
           30 | AB'C         | \014         | DEL       | OLD        |    12062
           31 | AB'C         | \014         | DEL       | OLD        |    12063
           21 | AB'C         | \034'        | DEL       | OLD        |    12064
           22 | AB'C         | \034'        | DEL       | OLD        |    12065
           10 | AB'C         | \014         | DEL       | OLD        |    12067
            1 | AB'C         | \034         | UPD       | OLD        |    12068
            1 | DEF          | \034         | UPD       | NEW        |    12068
            2 | AB'C         | \034         | UPD       | OLD        |    12069
            2 | DEF          | \034         | UPD       | NEW        |    12069
(63 rows)

select col21, col22, col23, emaj_verb, emaj_tuple, emaj_gid from emaj."phil's schema3_myTbl2\_log" order by emaj_gid, emaj_tuple desc;
 col21 | col22 |   col23    | emaj_verb | emaj_tuple | emaj_gid 
-------+-------+------------+-----------+------------+----------
     1 | ABC   | 12-31-2010 | INS       | NEW        |    12054
     2 | DEF   |            | INS       | NEW        |    12066
(2 rows)

-----------------------------
-- Step 11 : for myGroup1, in a transaction, update tables and rollback the transaction, 
--           then rollback to previous mark 
-----------------------------
set search_path=myschema1;
--
begin transaction;
  delete from mytbl1;
rollback;
--
select emaj.emaj_rollback_group('myGroup1','EMAJ_LAST_MARK');
 emaj_rollback_group 
---------------------
                   2
(1 row)

-----------------------------
-- Checking step 11
-----------------------------
-- emaj tables
select sqhl_id, sqhl_schema, sqhl_table, sqhl_hole_size from emaj.emaj_seq_hole order by sqhl_id;
 sqhl_id | sqhl_schema | sqhl_table | sqhl_hole_size 
---------+-------------+------------+----------------
     602 | myschema2   | mytbl4     |             20
     603 | myschema2   | mytbl5     |              5
     604 | myschema2   | mytbl6     |             15
     605 | myschema1   | mytbl1     |              1
     606 | myschema1   | mytbl4     |              2
     607 | myschema1   | mytbl1     |             20
(6 rows)

select rlbk_operation, rlbk_schema, rlbk_tbl_fk, rlbk_nb_rows from emaj.emaj_rlbk_stat
  order by rlbk_schema, rlbk_tbl_fk, rlbk_datetime, rlbk_operation;
  rlbk_operation  | rlbk_schema |    rlbk_tbl_fk    | rlbk_nb_rows 
------------------+-------------+-------------------+--------------
 del_log          | myschema1   | mytbl1            |            3
 rlbk             | myschema1   | mytbl1            |            3
 del_log          | myschema1   | mytbl1            |            1
 rlbk             | myschema1   | mytbl1            |            1
 rlbk             | myschema1   | mytbl1            |            1
 rlbk             | myschema1   | myTbl3            |           10
 del_log          | myschema1   | mytbl4            |            8
 rlbk             | myschema1   | mytbl4            |            8
 del_log          | myschema1   | mytbl4            |            2
 rlbk             | myschema1   | mytbl4            |            2
 rlbk             | myschema1   | mytbl4            |            2
 set_fk_immediate | myschema1   | mytbl4_col43_fkey |            8
 set_fk_immediate | myschema1   | mytbl4_col43_fkey |            2
 set_fk_immediate | myschema1   | mytbl4_col43_fkey |            2
 add_fk           | myschema1   | mytbl4_col44_fkey |            0
 add_fk           | myschema1   | mytbl4_col44_fkey |            0
 add_fk           | myschema1   | mytbl4_col44_fkey |            0
 add_fk           | myschema1   | mytbl4_col44_fkey |            0
 rlbk             | myschema2   | mytbl4            |            4
 rlbk             | myschema2   | mytbl4            |            4
 rlbk             | myschema2   | mytbl4            |           12
 del_log          | myschema2   | mytbl4            |           20
 rlbk             | myschema2   | mytbl4            |           20
 set_fk_immediate | myschema2   | mytbl4_col43_fkey |            4
 set_fk_immediate | myschema2   | mytbl4_col43_fkey |            4
 set_fk_immediate | myschema2   | mytbl4_col43_fkey |           12
 set_fk_immediate | myschema2   | mytbl4_col43_fkey |           20
 add_fk           | myschema2   | mytbl4_col44_fkey |            2
 add_fk           | myschema2   | mytbl4_col44_fkey |            2
 add_fk           | myschema2   | mytbl4_col44_fkey |            2
 add_fk           | myschema2   | mytbl4_col44_fkey |            2
 rlbk             | myschema2   | mytbl5            |            1
 rlbk             | myschema2   | mytbl5            |            1
 rlbk             | myschema2   | mytbl5            |            3
 del_log          | myschema2   | mytbl5            |            5
 rlbk             | myschema2   | mytbl5            |            5
 rlbk             | myschema2   | mytbl6            |            3
 rlbk             | myschema2   | mytbl6            |            3
 rlbk             | myschema2   | mytbl6            |            9
 del_log          | myschema2   | mytbl6            |           15
 rlbk             | myschema2   | mytbl6            |           15
(41 rows)

-----------------------------
-- Step 12 : tests snaps and script generation functions
-----------------------------
-- first add some updates for tables with unusual types (arrays, geometric)
set search_path=myschema2;
insert into myTbl5 values (10,'{"abc","def","ghi"}','{1,2,3}',NULL);
insert into myTbl5 values (20,array['abc','def','ghi'],array[3,4,5],array['2000/02/01'::date,'2000/02/28'::date]);
update myTbl5 set col54 = '{"2010/11/28","2010/12/03"}' where col54 is null;
insert into myTbl6 select i+10, point(i,1.3), '((0,0),(2,2))', circle(point(5,5),i),'((-2,-2),(3,0),(1,4))','10.20.30.40/27' from generate_series (1,8) as i;
update myTbl6 set col64 = '<(5,6),3.5>', col65 = null where col61 <= 13;
-- reset directory for snaps
\! rm -R /tmp/emaj_test/snaps
\! mkdir /tmp/emaj_test/snaps
-- ... and snap the all groups
select emaj.emaj_snap_group('myGroup1','/tmp/emaj_test/snaps','CSV HEADER');
 emaj_snap_group 
-----------------
               6
(1 row)

select emaj.emaj_snap_group('myGroup2','/tmp/emaj_test/snaps','CSV HEADER');
 emaj_snap_group 
-----------------
               8
(1 row)

select emaj.emaj_snap_group('phil''s group#3",','/tmp/emaj_test/snaps','CSV HEADER');
 emaj_snap_group 
-----------------
               4
(1 row)

\! ls /tmp/emaj_test/snaps
_INFO
myschema1_myTbl3.snap
myschema1_myTbl3_col31_seq.snap
myschema1_mytbl1.snap
myschema1_mytbl2.snap
myschema1_mytbl2b.snap
myschema1_mytbl4.snap
myschema2_myTbl3.snap
myschema2_myTbl3_col31_seq.snap
myschema2_myseq1.snap
myschema2_mytbl1.snap
myschema2_mytbl2.snap
myschema2_mytbl4.snap
myschema2_mytbl5.snap
myschema2_mytbl6.snap
phil's schema3_myTbl2\.snap
phil's schema3_myTbl2\_col21_seq.snap
phil's schema3_phil's seq\1.snap
phil's schema3_phil's tbl1.snap
-- reset directory for emaj_generate_sql tests
\! rm -R /tmp/emaj_test/sql_scripts
\! mkdir /tmp/emaj_test/sql_scripts
--select * from emaj.emaj_mark order by mark_group, mark_id;
-- generate sql script for each active group (and check the result with detailed log statistics + number of sequences)
select emaj.emaj_generate_sql('myGroup1', 'Multi-1', NULL, '/tmp/emaj_test/sql_scripts/myGroup1.sql');
NOTICE:  table "emaj_temp_script" does not exist, skipping
CONTEXT:  SQL statement "DROP TABLE IF EXISTS emaj_temp_script"
PL/pgSQL function "emaj_generate_sql" line 121 at SQL statement
 emaj_generate_sql 
-------------------
                 1
(1 row)

select coalesce(sum(stat_rows),0) + 1 as check from emaj.emaj_detailed_log_stat_group('myGroup1', 'Multi-1', NULL);
 check 
-------
     1
(1 row)

select emaj.emaj_generate_sql('myGroup2', 'Multi-1', NULL, '/tmp/emaj_test/sql_scripts/myGroup2.sql');
 emaj_generate_sql 
-------------------
                21
(1 row)

select sum(stat_rows) + 2 as check from emaj.emaj_detailed_log_stat_group('myGroup2', 'Multi-1', NULL);
 check 
-------
    21
(1 row)

select emaj.emaj_generate_sql('phil''s group#3",', 'M1_rollbackable', NULL, '/tmp/emaj_test/sql_scripts/Group3.sql');
 emaj_generate_sql 
-------------------
                57
(1 row)

select sum(stat_rows) + 1 as check from emaj.emaj_detailed_log_stat_group('phil''s group#3",', 'M1_rollbackable', NULL);
 check 
-------
    56
(1 row)

-- process \\ in script files
\! find /tmp/emaj_test/sql_scripts -name '*.sql' -type f -print0 | xargs -0 sed -i_s -s 's/\\\\/\\/g'
-- comment transaction commands for the need of the current test
\! find /tmp/emaj_test/sql_scripts -name '*.sql' -type f -print0 | xargs -0 sed -i -s 's/^BEGIN/--BEGIN/;s/^COMMIT/--COMMIT/'
-- mask timestamp in initial comment
\! find /tmp/emaj_test/sql_scripts -name '*.sql' -type f -print0 | xargs -0 sed -i -s 's/at .* by/at [ts] by/'
\! ls /tmp/emaj_test/sql_scripts
Group3.sql
Group3.sql_s
myGroup1.sql
myGroup1.sql_s
myGroup2.sql
myGroup2.sql_s
-- reset directory for second set of snaps
\! rm -R /tmp/emaj_test/snaps2
\! mkdir /tmp/emaj_test/snaps2
-- in a single transaction and as superuser:
--   rollback groups, replay updates with generated scripts, snap groups again and cancel the transaction
reset role;
begin;
  select emaj.emaj_rollback_group('myGroup1','Multi-1');
 emaj_rollback_group 
---------------------
                   1
(1 row)

  select emaj.emaj_rollback_group('myGroup2','Multi-1');
 emaj_rollback_group 
---------------------
                   4
(1 row)

  select emaj.emaj_rollback_group('phil''s group#3",','M1_rollbackable');
WARNING:  _check_fk_groups: Foreign key mytbl2_col21_fkey, from table phil's schema3.myTbl2\, references phil's schema3.mytbl4 that is outside groups (phil's group#3",).
CONTEXT:  SQL statement "SELECT  emaj._check_fk_groups( $1 )"
PL/pgSQL function "_rlbk_groups_step1" line 73 at PERFORM
SQL statement "SELECT emaj._rlbk_groups_step1( $1 ,  $2 ,  $3 , 1,  $4 )"
PL/pgSQL function "_rlbk_groups" line 19 at SQL statement
PL/pgSQL function "emaj_rollback_group" line 7 at RETURN
WARNING:  _check_fk_groups: table phil's schema3.phil's tbl1 is referenced by foreign key mytbl4_col44_fkey from table phil's schema3.mytbl4 that is outside groups (phil's group#3",).
CONTEXT:  SQL statement "SELECT  emaj._check_fk_groups( $1 )"
PL/pgSQL function "_rlbk_groups_step1" line 73 at PERFORM
SQL statement "SELECT emaj._rlbk_groups_step1( $1 ,  $2 ,  $3 , 1,  $4 )"
PL/pgSQL function "_rlbk_groups" line 19 at SQL statement
PL/pgSQL function "emaj_rollback_group" line 7 at RETURN
 emaj_rollback_group 
---------------------
                   4
(1 row)

\i /tmp/emaj_test/sql_scripts/myGroup1.sql
-- file generated at [ts] by the emaj_generate_sql() function, for tables group myGroup1, processing logs between mark Multi-1 and the current situation
SET standard_conforming_strings = ON;
--BEGIN TRANSACTION;
ALTER SEQUENCE myschema1."myTbl3_col31_seq" RESTART 21 INCREMENT 1 MAXVALUE 9223372036854775807 MINVALUE 1 CACHE 1 NO CYCLE;
--COMMIT;
RESET standard_conforming_strings;
\i /tmp/emaj_test/sql_scripts/myGroup2.sql
-- file generated at [ts] by the emaj_generate_sql() function, for tables group myGroup2, processing logs between mark Multi-1 and the current situation
SET standard_conforming_strings = ON;
--BEGIN TRANSACTION;
INSERT INTO myschema2.mytbl5 VALUES (10, '{abc,def,ghi}', '{1,2,3}', NULL);
INSERT INTO myschema2.mytbl5 VALUES (20, '{abc,def,ghi}', '{3,4,5}', '{02-01-2000,02-28-2000}');
UPDATE ONLY myschema2.mytbl5 SET col51 = 10, col52 = '{abc,def,ghi}', col53 = '{1,2,3}', col54 = '{11-28-2010,12-03-2010}' WHERE col51 = 10;
INSERT INTO myschema2.mytbl6 VALUES (11, '(1,1.3)', '(2,2),(0,0)', '<(5,5),1>', '((-2,-2),(3,0),(1,4))', '10.20.30.40/27');
INSERT INTO myschema2.mytbl6 VALUES (12, '(2,1.3)', '(2,2),(0,0)', '<(5,5),2>', '((-2,-2),(3,0),(1,4))', '10.20.30.40/27');
INSERT INTO myschema2.mytbl6 VALUES (13, '(3,1.3)', '(2,2),(0,0)', '<(5,5),3>', '((-2,-2),(3,0),(1,4))', '10.20.30.40/27');
INSERT INTO myschema2.mytbl6 VALUES (14, '(4,1.3)', '(2,2),(0,0)', '<(5,5),4>', '((-2,-2),(3,0),(1,4))', '10.20.30.40/27');
INSERT INTO myschema2.mytbl6 VALUES (15, '(5,1.3)', '(2,2),(0,0)', '<(5,5),5>', '((-2,-2),(3,0),(1,4))', '10.20.30.40/27');
INSERT INTO myschema2.mytbl6 VALUES (16, '(6,1.3)', '(2,2),(0,0)', '<(5,5),6>', '((-2,-2),(3,0),(1,4))', '10.20.30.40/27');
INSERT INTO myschema2.mytbl6 VALUES (17, '(7,1.3)', '(2,2),(0,0)', '<(5,5),7>', '((-2,-2),(3,0),(1,4))', '10.20.30.40/27');
INSERT INTO myschema2.mytbl6 VALUES (18, '(8,1.3)', '(2,2),(0,0)', '<(5,5),8>', '((-2,-2),(3,0),(1,4))', '10.20.30.40/27');
UPDATE ONLY myschema2.mytbl6 SET col61 = 4, col62 = '(4,1.3)', col63 = '(2,2),(0,0)', col64 = '<(5,6),3.5>', col65 = NULL, col66 = '10.20.30.40/27' WHERE col61 = 4;
UPDATE ONLY myschema2.mytbl6 SET col61 = 5, col62 = '(5,1.3)', col63 = '(2,2),(0,0)', col64 = '<(5,6),3.5>', col65 = NULL, col66 = '10.20.30.40/27' WHERE col61 = 5;
UPDATE ONLY myschema2.mytbl6 SET col61 = 6, col62 = '(6,1.3)', col63 = '(2,2),(0,0)', col64 = '<(5,6),3.5>', col65 = NULL, col66 = '10.20.30.40/27' WHERE col61 = 6;
UPDATE ONLY myschema2.mytbl6 SET col61 = 7, col62 = '(7,1.3)', col63 = '(2,2),(0,0)', col64 = '<(5,6),3.5>', col65 = NULL, col66 = '10.20.30.40/27' WHERE col61 = 7;
UPDATE ONLY myschema2.mytbl6 SET col61 = 8, col62 = '(8,1.3)', col63 = '(2,2),(0,0)', col64 = '<(5,6),3.5>', col65 = NULL, col66 = '10.20.30.40/27' WHERE col61 = 8;
UPDATE ONLY myschema2.mytbl6 SET col61 = 11, col62 = '(1,1.3)', col63 = '(2,2),(0,0)', col64 = '<(5,6),3.5>', col65 = NULL, col66 = '10.20.30.40/27' WHERE col61 = 11;
UPDATE ONLY myschema2.mytbl6 SET col61 = 12, col62 = '(2,1.3)', col63 = '(2,2),(0,0)', col64 = '<(5,6),3.5>', col65 = NULL, col66 = '10.20.30.40/27' WHERE col61 = 12;
UPDATE ONLY myschema2.mytbl6 SET col61 = 13, col62 = '(3,1.3)', col63 = '(2,2),(0,0)', col64 = '<(5,6),3.5>', col65 = NULL, col66 = '10.20.30.40/27' WHERE col61 = 13;
ALTER SEQUENCE myschema2.myseq1 RESTART 1004 INCREMENT 1 MAXVALUE 9223372036854775807 MINVALUE 1000 CACHE 1 NO CYCLE;
ALTER SEQUENCE myschema2."myTbl3_col31_seq" RESTART 21 INCREMENT 1 MAXVALUE 9223372036854775807 MINVALUE 1 CACHE 1 NO CYCLE;
--COMMIT;
RESET standard_conforming_strings;
\i /tmp/emaj_test/sql_scripts/Group3.sql
-- file generated at [ts] by the emaj_generate_sql() function, for tables group phil's group#3",, processing logs between mark M1_rollbackable and the current situation
SET standard_conforming_strings = ON;
--BEGIN TRANSACTION;
INSERT INTO "phil's schema3"."phil's tbl1" VALUES (1, 'AB''C', E'\\014');
INSERT INTO "phil's schema3"."phil's tbl1" VALUES (2, 'AB''C', E'\\014');
INSERT INTO "phil's schema3"."phil's tbl1" VALUES (3, 'AB''C', E'\\014');
INSERT INTO "phil's schema3"."phil's tbl1" VALUES (4, 'AB''C', E'\\014');
INSERT INTO "phil's schema3"."phil's tbl1" VALUES (5, 'AB''C', E'\\014');
INSERT INTO "phil's schema3"."phil's tbl1" VALUES (6, 'AB''C', E'\\014');
INSERT INTO "phil's schema3"."phil's tbl1" VALUES (7, 'AB''C', E'\\014');
INSERT INTO "phil's schema3"."phil's tbl1" VALUES (8, 'AB''C', E'\\014');
INSERT INTO "phil's schema3"."phil's tbl1" VALUES (9, 'AB''C', E'\\014');
INSERT INTO "phil's schema3"."phil's tbl1" VALUES (10, 'AB''C', E'\\014');
INSERT INTO "phil's schema3"."phil's tbl1" VALUES (11, 'AB''C', E'\\014');
INSERT INTO "phil's schema3"."phil's tbl1" VALUES (12, 'AB''C', E'\\014');
INSERT INTO "phil's schema3"."phil's tbl1" VALUES (13, 'AB''C', E'\\014');
INSERT INTO "phil's schema3"."phil's tbl1" VALUES (14, 'AB''C', E'\\014');
INSERT INTO "phil's schema3"."phil's tbl1" VALUES (15, 'AB''C', E'\\014');
INSERT INTO "phil's schema3"."phil's tbl1" VALUES (16, 'AB''C', E'\\014');
INSERT INTO "phil's schema3"."phil's tbl1" VALUES (17, 'AB''C', E'\\014');
INSERT INTO "phil's schema3"."phil's tbl1" VALUES (18, 'AB''C', E'\\014');
INSERT INTO "phil's schema3"."phil's tbl1" VALUES (19, 'AB''C', E'\\014');
INSERT INTO "phil's schema3"."phil's tbl1" VALUES (20, 'AB''C', E'\\014');
INSERT INTO "phil's schema3"."phil's tbl1" VALUES (21, 'AB''C', E'\\014');
INSERT INTO "phil's schema3"."phil's tbl1" VALUES (22, 'AB''C', E'\\014');
INSERT INTO "phil's schema3"."phil's tbl1" VALUES (23, 'AB''C', E'\\014');
INSERT INTO "phil's schema3"."phil's tbl1" VALUES (24, 'AB''C', E'\\014');
INSERT INTO "phil's schema3"."phil's tbl1" VALUES (25, 'AB''C', E'\\014');
INSERT INTO "phil's schema3"."phil's tbl1" VALUES (26, 'AB''C', E'\\014');
INSERT INTO "phil's schema3"."phil's tbl1" VALUES (27, 'AB''C', E'\\014');
INSERT INTO "phil's schema3"."phil's tbl1" VALUES (28, 'AB''C', E'\\014');
INSERT INTO "phil's schema3"."phil's tbl1" VALUES (29, 'AB''C', E'\\014');
INSERT INTO "phil's schema3"."phil's tbl1" VALUES (30, 'AB''C', E'\\014');
INSERT INTO "phil's schema3"."phil's tbl1" VALUES (31, 'AB''C', E'\\014');
UPDATE ONLY "phil's schema3"."phil's tbl1" SET "phil's col11" = 1, "phil's col12" = 'AB''C', "phil\s col13" = E'\\034' WHERE "phil's col11" = 1 AND "phil's col12" = 'AB''C';
UPDATE ONLY "phil's schema3"."phil's tbl1" SET "phil's col11" = 2, "phil's col12" = 'AB''C', "phil\s col13" = E'\\034' WHERE "phil's col11" = 2 AND "phil's col12" = 'AB''C';
UPDATE ONLY "phil's schema3"."phil's tbl1" SET "phil's col11" = 3, "phil's col12" = 'AB''C', "phil\s col13" = E'\\034' WHERE "phil's col11" = 3 AND "phil's col12" = 'AB''C';
UPDATE ONLY "phil's schema3"."phil's tbl1" SET "phil's col11" = 18, "phil's col12" = 'AB''C', "phil\s col13" = E'\\034''' WHERE "phil's col11" = 18 AND "phil's col12" = 'AB''C';
UPDATE ONLY "phil's schema3"."phil's tbl1" SET "phil's col11" = 19, "phil's col12" = 'AB''C', "phil\s col13" = E'\\034''' WHERE "phil's col11" = 19 AND "phil's col12" = 'AB''C';
UPDATE ONLY "phil's schema3"."phil's tbl1" SET "phil's col11" = 20, "phil's col12" = 'AB''C', "phil\s col13" = E'\\034''' WHERE "phil's col11" = 20 AND "phil's col12" = 'AB''C';
UPDATE ONLY "phil's schema3"."phil's tbl1" SET "phil's col11" = 21, "phil's col12" = 'AB''C', "phil\s col13" = E'\\034''' WHERE "phil's col11" = 21 AND "phil's col12" = 'AB''C';
UPDATE ONLY "phil's schema3"."phil's tbl1" SET "phil's col11" = 22, "phil's col12" = 'AB''C', "phil\s col13" = E'\\034''' WHERE "phil's col11" = 22 AND "phil's col12" = 'AB''C';
INSERT INTO "phil's schema3"."myTbl2\" VALUES (1, 'ABC', '12-31-2010');
DELETE FROM ONLY "phil's schema3"."phil's tbl1" WHERE "phil's col11" = 23 AND "phil's col12" = 'AB''C';
DELETE FROM ONLY "phil's schema3"."phil's tbl1" WHERE "phil's col11" = 24 AND "phil's col12" = 'AB''C';
DELETE FROM ONLY "phil's schema3"."phil's tbl1" WHERE "phil's col11" = 25 AND "phil's col12" = 'AB''C';
DELETE FROM ONLY "phil's schema3"."phil's tbl1" WHERE "phil's col11" = 26 AND "phil's col12" = 'AB''C';
DELETE FROM ONLY "phil's schema3"."phil's tbl1" WHERE "phil's col11" = 27 AND "phil's col12" = 'AB''C';
DELETE FROM ONLY "phil's schema3"."phil's tbl1" WHERE "phil's col11" = 28 AND "phil's col12" = 'AB''C';
DELETE FROM ONLY "phil's schema3"."phil's tbl1" WHERE "phil's col11" = 29 AND "phil's col12" = 'AB''C';
DELETE FROM ONLY "phil's schema3"."phil's tbl1" WHERE "phil's col11" = 30 AND "phil's col12" = 'AB''C';
DELETE FROM ONLY "phil's schema3"."phil's tbl1" WHERE "phil's col11" = 31 AND "phil's col12" = 'AB''C';
DELETE FROM ONLY "phil's schema3"."phil's tbl1" WHERE "phil's col11" = 21 AND "phil's col12" = 'AB''C';
DELETE FROM ONLY "phil's schema3"."phil's tbl1" WHERE "phil's col11" = 22 AND "phil's col12" = 'AB''C';
INSERT INTO "phil's schema3"."myTbl2\" VALUES (2, 'DEF', NULL);
DELETE FROM ONLY "phil's schema3"."phil's tbl1" WHERE "phil's col11" = 10 AND "phil's col12" = 'AB''C';
UPDATE ONLY "phil's schema3"."phil's tbl1" SET "phil's col11" = 1, "phil's col12" = 'DEF', "phil\s col13" = E'\\034' WHERE "phil's col11" = 1 AND "phil's col12" = 'AB''C';
UPDATE ONLY "phil's schema3"."phil's tbl1" SET "phil's col11" = 2, "phil's col12" = 'DEF', "phil\s col13" = E'\\034' WHERE "phil's col11" = 2 AND "phil's col12" = 'AB''C';
ALTER SEQUENCE "phil's schema3"."myTbl2\_col21_seq" RESTART 1 INCREMENT 1 MAXVALUE 9223372036854775807 MINVALUE 1 CACHE 1 NO CYCLE;
ALTER SEQUENCE "phil's schema3"."phil's seq\1" RESTART 1002 INCREMENT 1 MAXVALUE 2000 MINVALUE 1000 CACHE 1 CYCLE;
--COMMIT;
RESET standard_conforming_strings;
  select emaj.emaj_snap_group('myGroup1','/tmp/emaj_test/snaps2','CSV HEADER');
 emaj_snap_group 
-----------------
               6
(1 row)

  select emaj.emaj_snap_group('myGroup2','/tmp/emaj_test/snaps2','CSV HEADER');
 emaj_snap_group 
-----------------
               8
(1 row)

  select emaj.emaj_snap_group('phil''s group#3",','/tmp/emaj_test/snaps2','CSV HEADER');
 emaj_snap_group 
-----------------
               4
(1 row)

rollback;
-- mask timestamp in _INFO files
\! sed -i_s -s 's/at .*/at [ts]/' /tmp/emaj_test/snaps/_INFO /tmp/emaj_test/snaps2/_INFO
-- and compare both snaps sets
-- sequences are detected as different because of :
-- - the effect of RESTART on is_called and next_val attributes
-- - internal log_cnt value being reset
\! diff --exclude _INFO_s /tmp/emaj_test/snaps /tmp/emaj_test/snaps2
diff --exclude _INFO_s /tmp/emaj_test/snaps/myschema1_myTbl3_col31_seq.snap /tmp/emaj_test/snaps2/myschema1_myTbl3_col31_seq.snap
2c2
< myTbl3_col31_seq,20,0,1,9223372036854775807,1,1,f,t
---
> myTbl3_col31_seq,21,0,1,9223372036854775807,1,1,f,f
diff --exclude _INFO_s /tmp/emaj_test/snaps/myschema2_myTbl3_col31_seq.snap /tmp/emaj_test/snaps2/myschema2_myTbl3_col31_seq.snap
2c2
< myTbl3_col31_seq,20,0,1,9223372036854775807,1,1,f,t
---
> myTbl3_col31_seq,21,0,1,9223372036854775807,1,1,f,f
diff --exclude _INFO_s /tmp/emaj_test/snaps/phil's schema3_phil's seq\1.snap /tmp/emaj_test/snaps2/phil's schema3_phil's seq\1.snap
2c2
< phil's seq\1,1001,0,1,2000,1000,1,t,t
---
> phil's seq\1,1002,0,1,2000,1000,1,t,f
set role emaj_regression_tests_adm_user;
-----------------------------
-- test end: check, reset history and force sequences id
-----------------------------
select hist_id, hist_function, hist_event, hist_object, regexp_replace(regexp_replace(hist_wording,E'\\d\\d\.\\d\\d\\.\\d\\d\\.\\d\\d\\d','%','g'),E'\\[.+\\]','(timestamp)','g'), hist_user from emaj.emaj_hist order by hist_id;
 hist_id |      hist_function       |   hist_event   |             hist_object              |                                        regexp_replace                                        | hist_user 
---------+--------------------------+----------------+--------------------------------------+----------------------------------------------------------------------------------------------+-----------
    6000 | STOP_GROUP               | BEGIN          | myGroup1                             |                                                                                              | postgres
    6001 | STOP_GROUP               | END            | myGroup1                             | 0 tables/sequences processed                                                                 | postgres
    6002 | RESET_GROUP              | BEGIN          | myGroup1                             |                                                                                              | postgres
    6003 | RESET_GROUP              | END            | myGroup1                             | 6 tables/sequences processed                                                                 | postgres
    6004 | DROP_GROUP               | BEGIN          | myGroup1                             |                                                                                              | postgres
    6005 | DROP_GROUP               | SCHEMA DROPPED | emajb                                |                                                                                              | postgres
    6006 | DROP_GROUP               | END            | myGroup1                             | 6 tables/sequences processed                                                                 | postgres
    6007 | FORCE_DROP_GROUP         | BEGIN          | myGroup2                             |                                                                                              | postgres
    6008 | FORCE_DROP_GROUP         | SCHEMA DROPPED | "emajC"                              |                                                                                              | postgres
    6009 | FORCE_DROP_GROUP         | END            | myGroup2                             | 8 tables/sequences processed                                                                 | postgres
    6010 | STOP_GROUP               | BEGIN          | phil's group#3",                     |                                                                                              | postgres
    6011 | LOCK_GROUP               | BEGIN          | phil's group#3",                     |                                                                                              | postgres
    6012 | LOCK_GROUP               | END            | phil's group#3",                     | 2 tables locked, 0 deadlock(s)                                                               | postgres
    6013 | SET_MARK_GROUP           | BEGIN          | phil's group#3",                     | Simple stop mark                                                                             | postgres
    6014 | SET_MARK_GROUP           | END            | phil's group#3",                     | Simple stop mark                                                                             | postgres
    6015 | STOP_GROUP               | END            | phil's group#3",                     | 4 tables/sequences processed                                                                 | postgres
    6016 | DROP_GROUP               | BEGIN          | phil's group#3",                     |                                                                                              | postgres
    6017 | DROP_GROUP               | SCHEMA DROPPED | "emaj #'3"                           |                                                                                              | postgres
    6018 | DROP_GROUP               | END            | phil's group#3",                     | 4 tables/sequences processed                                                                 | postgres
    6019 | FORCE_STOP_GROUP         | BEGIN          | myGroup4                             |                                                                                              | postgres
    6020 | LOCK_GROUP               | BEGIN          | myGroup4                             |                                                                                              | postgres
    6021 | LOCK_GROUP               | END            | myGroup4                             | 3 tables locked, 0 deadlock(s)                                                               | postgres
    6022 | FORCE_STOP_GROUP         | END            | myGroup4                             | 3 tables/sequences processed                                                                 | postgres
    6023 | DROP_GROUP               | BEGIN          | myGroup4                             |                                                                                              | postgres
    6024 | DROP_GROUP               | END            | myGroup4                             | 3 tables/sequences processed                                                                 | postgres
    6025 | CREATE_GROUP             | BEGIN          | myGroup1                             | rollbackable                                                                                 | postgres
    6026 | CREATE_GROUP             | SCHEMA CREATED | emajb                                |                                                                                              | postgres
    6027 | CREATE_GROUP             | SCHEMA CREATED | "emajC"                              |                                                                                              | postgres
    6028 | CREATE_GROUP             | END            | myGroup1                             | 6 tables/sequences processed                                                                 | postgres
    6029 | COMMENT_GROUP            |                | myGroup1                             |                                                                                              | postgres
    6030 | CREATE_GROUP             | BEGIN          | myGroup2                             | rollbackable                                                                                 | postgres
    6031 | CREATE_GROUP             | END            | myGroup2                             | 8 tables/sequences processed                                                                 | postgres
    6032 | START_GROUP              | BEGIN          | myGroup1                             | With log reset                                                                               | postgres
    6033 | LOCK_GROUP               | BEGIN          | myGroup1                             |                                                                                              | postgres
    6034 | LOCK_GROUP               | END            | myGroup1                             | 5 tables locked, 0 deadlock(s)                                                               | postgres
    6035 | SET_MARK_GROUP           | BEGIN          | myGroup1                             | M1                                                                                           | postgres
    6036 | SET_MARK_GROUP           | END            | myGroup1                             | M1                                                                                           | postgres
    6037 | START_GROUP              | END            | myGroup1                             | 6 tables/sequences processed                                                                 | postgres
    6038 | START_GROUP              | BEGIN          | myGroup2                             | With log reset                                                                               | postgres
    6039 | LOCK_GROUP               | BEGIN          | myGroup2                             |                                                                                              | postgres
    6040 | LOCK_GROUP               | END            | myGroup2                             | 6 tables locked, 0 deadlock(s)                                                               | postgres
    6041 | SET_MARK_GROUP           | BEGIN          | myGroup2                             | M1                                                                                           | postgres
    6042 | SET_MARK_GROUP           | END            | myGroup2                             | M1                                                                                           | postgres
    6043 | START_GROUP              | END            | myGroup2                             | 8 tables/sequences processed                                                                 | postgres
    6044 | SET_MARK_GROUP           | BEGIN          | myGroup1                             |                                                                                              | postgres
    6045 | LOCK_GROUP               | BEGIN          | myGroup1                             |                                                                                              | postgres
    6046 | LOCK_GROUP               | END            | myGroup1                             | 5 tables locked, 0 deadlock(s)                                                               | postgres
    6047 | SET_MARK_GROUP           | END            | myGroup1                             | M2                                                                                           | postgres
    6048 | SET_MARK_GROUP           | BEGIN          | myGroup1                             |                                                                                              | postgres
    6049 | LOCK_GROUP               | BEGIN          | myGroup1                             |                                                                                              | postgres
    6050 | LOCK_GROUP               | END            | myGroup1                             | 5 tables locked, 0 deadlock(s)                                                               | postgres
    6051 | SET_MARK_GROUP           | END            | myGroup1                             | M3                                                                                           | postgres
    6052 | COMMENT_MARK_GROUP       |                | myGroup1                             | Mark M3                                                                                      | postgres
    6053 | SET_MARK_GROUP           | BEGIN          | myGroup2                             |                                                                                              | postgres
    6054 | LOCK_GROUP               | BEGIN          | myGroup2                             |                                                                                              | postgres
    6055 | LOCK_GROUP               | END            | myGroup2                             | 6 tables locked, 0 deadlock(s)                                                               | postgres
    6056 | SET_MARK_GROUP           | END            | myGroup2                             | M2                                                                                           | postgres
    6057 | SET_MARK_GROUP           | BEGIN          | myGroup2                             |                                                                                              | postgres
    6058 | LOCK_GROUP               | BEGIN          | myGroup2                             |                                                                                              | postgres
    6059 | LOCK_GROUP               | END            | myGroup2                             | 6 tables locked, 0 deadlock(s)                                                               | postgres
    6060 | SET_MARK_GROUP           | END            | myGroup2                             | M3                                                                                           | postgres
    6061 | ROLLBACK_GROUP           | BEGIN          | myGroup2                             | Logged rollback to mark M2 (timestamp)                                                       | postgres
    6062 | LOCK_SESSION             | BEGIN          | myGroup2                             | Session #1                                                                                   | postgres
    6063 | LOCK_SESSION             | END            | myGroup2                             | Session #1 : 6 tables locked, 0 deadlock(s)                                                  | postgres
    6064 | SET_MARK_GROUP           | BEGIN          | myGroup2                             | RLBK_M2_%_START                                                                              | postgres
    6065 | SET_MARK_GROUP           | END            | myGroup2                             | RLBK_M2_%_START                                                                              | postgres
    6066 | ROLLBACK_TABLE           | BEGIN          | myschema2.mytbl4                     | All log rows with emaj_gid > 11919                                                           | postgres
    6067 | ROLLBACK_TABLE           | END            | myschema2.mytbl4                     | 4 rollbacked rows                                                                            | postgres
    6068 | ROLLBACK_TABLE           | BEGIN          | myschema2.mytbl5                     | All log rows with emaj_gid > 11919                                                           | postgres
    6069 | ROLLBACK_TABLE           | END            | myschema2.mytbl5                     | 1 rollbacked rows                                                                            | postgres
    6070 | ROLLBACK_TABLE           | BEGIN          | myschema2.mytbl6                     | All log rows with emaj_gid > 11919                                                           | postgres
    6071 | ROLLBACK_TABLE           | END            | myschema2.mytbl6                     | 3 rollbacked rows                                                                            | postgres
    6072 | ROLLBACK_SEQUENCE        |                | myschema2.myseq1                     | RESTART 1001 MAXVALUE 2000 CYCLE                                                             | postgres
    6073 | ROLLBACK_SEQUENCE        |                | myschema2."myTbl3_col31_seq"         |                                                                                              | postgres
    6074 | SET_MARK_GROUP           | BEGIN          | myGroup2                             | RLBK_M2_%_DONE                                                                               | postgres
    6075 | SET_MARK_GROUP           | END            | myGroup2                             | RLBK_M2_%_DONE                                                                               | postgres
    6076 | ROLLBACK_GROUP           | END            | myGroup2                             | 3 tables and 2 sequences effectively processed                                               | postgres
    6077 | ROLLBACK_GROUP           | BEGIN          | myGroup2                             | Logged rollback to mark M3 (timestamp)                                                       | postgres
    6078 | LOCK_SESSION             | BEGIN          | myGroup2                             | Session #1                                                                                   | postgres
    6079 | LOCK_SESSION             | END            | myGroup2                             | Session #1 : 6 tables locked, 0 deadlock(s)                                                  | postgres
    6080 | SET_MARK_GROUP           | BEGIN          | myGroup2                             | RLBK_M3_%_START                                                                              | postgres
    6081 | SET_MARK_GROUP           | END            | myGroup2                             | RLBK_M3_%_START                                                                              | postgres
    6082 | ROLLBACK_TABLE           | BEGIN          | myschema2.mytbl4                     | All log rows with emaj_gid > 11927                                                           | postgres
    6083 | ROLLBACK_TABLE           | END            | myschema2.mytbl4                     | 4 rollbacked rows                                                                            | postgres
    6084 | ROLLBACK_TABLE           | BEGIN          | myschema2.mytbl5                     | All log rows with emaj_gid > 11927                                                           | postgres
    6085 | ROLLBACK_TABLE           | END            | myschema2.mytbl5                     | 1 rollbacked rows                                                                            | postgres
    6086 | ROLLBACK_TABLE           | BEGIN          | myschema2.mytbl6                     | All log rows with emaj_gid > 11927                                                           | postgres
    6087 | ROLLBACK_TABLE           | END            | myschema2.mytbl6                     | 3 rollbacked rows                                                                            | postgres
    6088 | ROLLBACK_SEQUENCE        |                | myschema2.myseq1                     | RESTART 1004 MAXVALUE 9223372036854775807 NO  CYCLE                                          | postgres
    6089 | ROLLBACK_SEQUENCE        |                | myschema2."myTbl3_col31_seq"         |                                                                                              | postgres
    6090 | SET_MARK_GROUP           | BEGIN          | myGroup2                             | RLBK_M3_%_DONE                                                                               | postgres
    6091 | SET_MARK_GROUP           | END            | myGroup2                             | RLBK_M3_%_DONE                                                                               | postgres
    6092 | ROLLBACK_GROUP           | END            | myGroup2                             | 3 tables and 2 sequences effectively processed                                               | postgres
    6093 | ROLLBACK_GROUP           | BEGIN          | myGroup1                             | Unlogged rollback to mark M2 (timestamp)                                                     | postgres
    6094 | LOCK_SESSION             | BEGIN          | myGroup1                             | Session #1                                                                                   | postgres
    6095 | LOCK_SESSION             | END            | myGroup1                             | Session #1 : 5 tables locked, 0 deadlock(s)                                                  | postgres
    6096 | ROLLBACK_TABLE           | BEGIN          | myschema1.mytbl1                     | All log rows with emaj_gid > 11867                                                           | postgres
    6097 | ROLLBACK_TABLE           | END            | myschema1.mytbl1                     | 3 rollbacked rows                                                                            | postgres
    6098 | ROLLBACK_TABLE           | BEGIN          | myschema1.mytbl4                     | All log rows with emaj_gid > 11867                                                           | postgres
    6099 | ROLLBACK_TABLE           | END            | myschema1.mytbl4                     | 8 rollbacked rows                                                                            | postgres
    6100 | ROLLBACK_GROUP           | MARK DELETED   | myGroup1                             | mark M3 has been deleted                                                                     | postgres
    6101 | ROLLBACK_SEQUENCE        |                | myschema1."myTbl3_col31_seq"         |                                                                                              | postgres
    6102 | ROLLBACK_GROUP           | END            | myGroup1                             | 2 tables and 1 sequences effectively processed                                               | postgres
    6103 | SET_MARK_GROUP           | BEGIN          | myGroup1                             |                                                                                              | postgres
    6104 | LOCK_GROUP               | BEGIN          | myGroup1                             |                                                                                              | postgres
    6105 | LOCK_GROUP               | END            | myGroup1                             | 5 tables locked, 0 deadlock(s)                                                               | postgres
    6106 | SET_MARK_GROUP           | END            | myGroup1                             | M4                                                                                           | postgres
    6107 | SET_MARK_GROUP           | BEGIN          | myGroup1                             |                                                                                              | postgres
    6108 | LOCK_GROUP               | BEGIN          | myGroup1                             |                                                                                              | postgres
    6109 | LOCK_GROUP               | END            | myGroup1                             | 5 tables locked, 0 deadlock(s)                                                               | postgres
    6110 | SET_MARK_GROUP           | END            | myGroup1                             | M5                                                                                           | postgres
    6111 | SET_MARK_GROUP           | BEGIN          | myGroup1                             |                                                                                              | postgres
    6112 | LOCK_GROUP               | BEGIN          | myGroup1                             |                                                                                              | postgres
    6113 | LOCK_GROUP               | END            | myGroup1                             | 5 tables locked, 0 deadlock(s)                                                               | postgres
    6114 | SET_MARK_GROUP           | END            | myGroup1                             | M6                                                                                           | postgres
    6115 | ROLLBACK_GROUP           | BEGIN          | myGroup2                             | Logged rollback to mark M2 (timestamp)                                                       | postgres
    6116 | LOCK_SESSION             | BEGIN          | myGroup2                             | Session #1                                                                                   | postgres
    6117 | LOCK_SESSION             | END            | myGroup2                             | Session #1 : 6 tables locked, 0 deadlock(s)                                                  | postgres
    6118 | SET_MARK_GROUP           | BEGIN          | myGroup2                             | RLBK_M2_%_START                                                                              | postgres
    6119 | SET_MARK_GROUP           | END            | myGroup2                             | RLBK_M2_%_START                                                                              | postgres
    6120 | ROLLBACK_TABLE           | BEGIN          | myschema2.mytbl4                     | All log rows with emaj_gid > 11919                                                           | postgres
    6121 | ROLLBACK_TABLE           | END            | myschema2.mytbl4                     | 12 rollbacked rows                                                                           | postgres
    6122 | ROLLBACK_TABLE           | BEGIN          | myschema2.mytbl5                     | All log rows with emaj_gid > 11919                                                           | postgres
    6123 | ROLLBACK_TABLE           | END            | myschema2.mytbl5                     | 3 rollbacked rows                                                                            | postgres
    6124 | ROLLBACK_TABLE           | BEGIN          | myschema2.mytbl6                     | All log rows with emaj_gid > 11919                                                           | postgres
    6125 | ROLLBACK_TABLE           | END            | myschema2.mytbl6                     | 9 rollbacked rows                                                                            | postgres
    6126 | ROLLBACK_SEQUENCE        |                | myschema2.myseq1                     | RESTART 1001 MAXVALUE 2000 CYCLE                                                             | postgres
    6127 | ROLLBACK_SEQUENCE        |                | myschema2."myTbl3_col31_seq"         |                                                                                              | postgres
    6128 | SET_MARK_GROUP           | BEGIN          | myGroup2                             | RLBK_M2_%_DONE                                                                               | postgres
    6129 | SET_MARK_GROUP           | END            | myGroup2                             | RLBK_M2_%_DONE                                                                               | postgres
    6130 | ROLLBACK_GROUP           | END            | myGroup2                             | 3 tables and 2 sequences effectively processed                                               | postgres
    6131 | ROLLBACK_GROUP           | BEGIN          | myGroup2                             | Unlogged rollback to mark M3 (timestamp)                                                     | postgres
    6132 | LOCK_SESSION             | BEGIN          | myGroup2                             | Session #1                                                                                   | postgres
    6133 | LOCK_SESSION             | END            | myGroup2                             | Session #1 : 6 tables locked, 0 deadlock(s)                                                  | postgres
    6134 | ROLLBACK_TABLE           | BEGIN          | myschema2.mytbl4                     | All log rows with emaj_gid > 11927                                                           | postgres
    6135 | ROLLBACK_TABLE           | END            | myschema2.mytbl4                     | 20 rollbacked rows                                                                           | postgres
    6136 | ROLLBACK_TABLE           | BEGIN          | myschema2.mytbl5                     | All log rows with emaj_gid > 11927                                                           | postgres
    6137 | ROLLBACK_TABLE           | END            | myschema2.mytbl5                     | 5 rollbacked rows                                                                            | postgres
    6138 | ROLLBACK_TABLE           | BEGIN          | myschema2.mytbl6                     | All log rows with emaj_gid > 11927                                                           | postgres
    6139 | ROLLBACK_TABLE           | END            | myschema2.mytbl6                     | 15 rollbacked rows                                                                           | postgres
    6140 | ROLLBACK_GROUP           | MARK DELETED   | myGroup2                             | mark RLBK_M2_%_START has been deleted                                                        | postgres
    6141 | ROLLBACK_GROUP           | MARK DELETED   | myGroup2                             | mark RLBK_M2_%_DONE has been deleted                                                         | postgres
    6142 | ROLLBACK_GROUP           | MARK DELETED   | myGroup2                             | mark RLBK_M3_%_START has been deleted                                                        | postgres
    6143 | ROLLBACK_GROUP           | MARK DELETED   | myGroup2                             | mark RLBK_M3_%_DONE has been deleted                                                         | postgres
    6144 | ROLLBACK_GROUP           | MARK DELETED   | myGroup2                             | mark RLBK_M2_%_START has been deleted                                                        | postgres
    6145 | ROLLBACK_GROUP           | MARK DELETED   | myGroup2                             | mark RLBK_M2_%_DONE has been deleted                                                         | postgres
    6146 | ROLLBACK_SEQUENCE        |                | myschema2.myseq1                     | RESTART 1004 MAXVALUE 9223372036854775807 NO  CYCLE                                          | postgres
    6147 | ROLLBACK_SEQUENCE        |                | myschema2."myTbl3_col31_seq"         |                                                                                              | postgres
    6148 | ROLLBACK_GROUP           | END            | myGroup2                             | 3 tables and 2 sequences effectively processed                                               | postgres
    6149 | ROLLBACK_GROUP           | BEGIN          | myGroup1                             | Unlogged rollback to mark M5 (timestamp)                                                     | postgres
    6150 | LOCK_SESSION             | BEGIN          | myGroup1                             | Session #1                                                                                   | postgres
    6151 | LOCK_SESSION             | END            | myGroup1                             | Session #1 : 5 tables locked, 0 deadlock(s)                                                  | postgres
    6152 | ROLLBACK_TABLE           | BEGIN          | myschema1.mytbl1                     | All log rows with emaj_gid > 11966                                                           | postgres
    6153 | ROLLBACK_TABLE           | END            | myschema1.mytbl1                     | 1 rollbacked rows                                                                            | postgres
    6154 | ROLLBACK_TABLE           | BEGIN          | myschema1.mytbl4                     | All log rows with emaj_gid > 11966                                                           | postgres
    6155 | ROLLBACK_TABLE           | END            | myschema1.mytbl4                     | 2 rollbacked rows                                                                            | postgres
    6156 | ROLLBACK_GROUP           | MARK DELETED   | myGroup1                             | mark M6 has been deleted                                                                     | postgres
    6157 | ROLLBACK_SEQUENCE        |                | myschema1."myTbl3_col31_seq"         |                                                                                              | postgres
    6158 | ROLLBACK_GROUP           | END            | myGroup1                             | 2 tables and 1 sequences effectively processed                                               | postgres
    6159 | ROLLBACK_GROUP           | BEGIN          | myGroup1                             | Logged rollback to mark M4 (timestamp)                                                       | postgres
    6160 | LOCK_SESSION             | BEGIN          | myGroup1                             | Session #1                                                                                   | postgres
    6161 | LOCK_SESSION             | END            | myGroup1                             | Session #1 : 5 tables locked, 0 deadlock(s)                                                  | postgres
    6162 | SET_MARK_GROUP           | BEGIN          | myGroup1                             | RLBK_M4_%_START                                                                              | postgres
    6163 | SET_MARK_GROUP           | END            | myGroup1                             | RLBK_M4_%_START                                                                              | postgres
    6164 | ROLLBACK_TABLE           | BEGIN          | myschema1."myTbl3"                   | All log rows with emaj_gid > 11956                                                           | postgres
    6165 | ROLLBACK_TABLE           | END            | myschema1."myTbl3"                   | 10 rollbacked rows                                                                           | postgres
    6166 | ROLLBACK_TABLE           | BEGIN          | myschema1.mytbl1                     | All log rows with emaj_gid > 11956                                                           | postgres
    6167 | ROLLBACK_TABLE           | END            | myschema1.mytbl1                     | 1 rollbacked rows                                                                            | postgres
    6168 | ROLLBACK_TABLE           | BEGIN          | myschema1.mytbl4                     | All log rows with emaj_gid > 11956                                                           | postgres
    6169 | ROLLBACK_TABLE           | END            | myschema1.mytbl4                     | 2 rollbacked rows                                                                            | postgres
    6170 | ROLLBACK_SEQUENCE        |                | myschema1."myTbl3_col31_seq"         |                                                                                              | postgres
    6171 | SET_MARK_GROUP           | BEGIN          | myGroup1                             | RLBK_M4_%_DONE                                                                               | postgres
    6172 | SET_MARK_GROUP           | END            | myGroup1                             | RLBK_M4_%_DONE                                                                               | postgres
    6173 | ROLLBACK_GROUP           | END            | myGroup1                             | 3 tables and 1 sequences effectively processed                                               | postgres
    6174 | RENAME_MARK_GROUP        | BEGIN          | myGroup1                             | RLBK_M4_%_START                                                                              | postgres
    6175 | RENAME_MARK_GROUP        | END            | myGroup1                             | RLBK_M4_%_START renamed Before logged rollback to M4                                         | postgres
    6176 | DELETE_MARK_GROUP        | BEGIN          | myGroup1                             | RLBK_M4_%_DONE                                                                               | postgres
    6177 | DELETE_MARK_GROUP        | END            | myGroup1                             | RLBK_M4_%_DONE                                                                               | postgres
    6178 | DELETE_MARK_GROUP        | BEGIN          | myGroup1                             | M1                                                                                           | postgres
    6179 | DELETE_MARK_GROUP        | END            | myGroup1                             | M1                                                                                           | postgres
    6180 | DELETE_BEFORE_MARK_GROUP | BEGIN          | myGroup1                             | M4                                                                                           | postgres
    6181 | DELETE_BEFORE_MARK_GROUP | END            | myGroup1                             | 1 marks deleted ; M4 is now the initial mark                                                 | postgres
    6185 | STOP_GROUPS              | BEGIN          | myGroup1,myGroup2                    |                                                                                              | postgres
    6186 | LOCK_GROUPS              | BEGIN          | myGroup1,myGroup2                    |                                                                                              | postgres
    6187 | LOCK_GROUPS              | END            | myGroup1,myGroup2                    | 11 tables locked, 0 deadlock(s)                                                              | postgres
    6188 | SET_MARK_GROUPS          | BEGIN          | myGroup1,myGroup2                    | STOP_%                                                                                       | postgres
    6189 | SET_MARK_GROUPS          | END            | myGroup1,myGroup2                    | STOP_%                                                                                       | postgres
    6190 | STOP_GROUPS              | END            | myGroup1,myGroup2                    | 14 tables/sequences processed                                                                | postgres
    6191 | START_GROUPS             | BEGIN          | myGroup1,myGroup2                    | Without log reset                                                                            | postgres
    6192 | LOCK_GROUPS              | BEGIN          | myGroup1,myGroup2                    |                                                                                              | postgres
    6193 | LOCK_GROUPS              | END            | myGroup1,myGroup2                    | 11 tables locked, 0 deadlock(s)                                                              | postgres
    6194 | SET_MARK_GROUPS          | BEGIN          | myGroup1,myGroup2                    | Multi-1                                                                                      | postgres
    6195 | SET_MARK_GROUPS          | END            | myGroup1,myGroup2                    | Multi-1                                                                                      | postgres
    6196 | START_GROUPS             | END            | myGroup1,myGroup2                    | 14 tables/sequences processed                                                                | postgres
    6197 | SET_MARK_GROUPS          | BEGIN          | myGroup1,myGroup2                    | Multi-2                                                                                      | postgres
    6198 | LOCK_GROUPS              | BEGIN          | myGroup1,myGroup2                    |                                                                                              | postgres
    6199 | LOCK_GROUPS              | END            | myGroup1,myGroup2                    | 11 tables locked, 0 deadlock(s)                                                              | postgres
    6200 | SET_MARK_GROUPS          | END            | myGroup1,myGroup2                    | Multi-2                                                                                      | postgres
    6201 | ROLLBACK_GROUPS          | BEGIN          | myGroup1,myGroup2                    | Logged rollback to mark Multi-1 (timestamp)                                                  | postgres
    6202 | LOCK_SESSIONS            | BEGIN          | myGroup1,myGroup2                    | Session #1                                                                                   | postgres
    6203 | LOCK_SESSIONS            | END            | myGroup1,myGroup2                    | Session #1 : 11 tables locked, 0 deadlock(s)                                                 | postgres
    6204 | SET_MARK_GROUPS          | BEGIN          | myGroup1,myGroup2                    | RLBK_Multi-1_%_START                                                                         | postgres
    6205 | SET_MARK_GROUPS          | END            | myGroup1,myGroup2                    | RLBK_Multi-1_%_START                                                                         | postgres
    6206 | ROLLBACK_SEQUENCE        |                | myschema1."myTbl3_col31_seq"         |                                                                                              | postgres
    6207 | ROLLBACK_SEQUENCE        |                | myschema2.myseq1                     |                                                                                              | postgres
    6208 | ROLLBACK_SEQUENCE        |                | myschema2."myTbl3_col31_seq"         |                                                                                              | postgres
    6209 | SET_MARK_GROUPS          | BEGIN          | myGroup1,myGroup2                    | RLBK_Multi-1_%_DONE                                                                          | postgres
    6210 | SET_MARK_GROUPS          | END            | myGroup1,myGroup2                    | RLBK_Multi-1_%_DONE                                                                          | postgres
    6211 | ROLLBACK_GROUPS          | END            | myGroup1,myGroup2                    | 0 tables and 3 sequences effectively processed                                               | postgres
    6212 | ROLLBACK_GROUPS          | BEGIN          | myGroup1,myGroup2                    | Unlogged rollback to mark Multi-2 (timestamp)                                                | postgres
    6213 | LOCK_SESSIONS            | BEGIN          | myGroup1,myGroup2                    | Session #1                                                                                   | postgres
    6214 | LOCK_SESSIONS            | END            | myGroup1,myGroup2                    | Session #1 : 11 tables locked, 0 deadlock(s)                                                 | postgres
    6215 | ROLLBACK_GROUPS          | MARK DELETED   | myGroup1                             | mark RLBK_Multi-1_%_START has been deleted                                                   | postgres
    6216 | ROLLBACK_GROUPS          | MARK DELETED   | myGroup2                             | mark RLBK_Multi-1_%_START has been deleted                                                   | postgres
    6217 | ROLLBACK_GROUPS          | MARK DELETED   | myGroup1                             | mark RLBK_Multi-1_%_DONE has been deleted                                                    | postgres
    6218 | ROLLBACK_GROUPS          | MARK DELETED   | myGroup2                             | mark RLBK_Multi-1_%_DONE has been deleted                                                    | postgres
    6219 | ROLLBACK_SEQUENCE        |                | myschema1."myTbl3_col31_seq"         |                                                                                              | postgres
    6220 | ROLLBACK_SEQUENCE        |                | myschema2.myseq1                     |                                                                                              | postgres
    6221 | ROLLBACK_SEQUENCE        |                | myschema2."myTbl3_col31_seq"         |                                                                                              | postgres
    6222 | ROLLBACK_GROUPS          | END            | myGroup1,myGroup2                    | 0 tables and 3 sequences effectively processed                                               | postgres
    6223 | ROLLBACK_GROUPS          | BEGIN          | myGroup1,myGroup2                    | Unlogged rollback to mark Multi-1 (timestamp)                                                | postgres
    6224 | LOCK_SESSIONS            | BEGIN          | myGroup1,myGroup2                    | Session #1                                                                                   | postgres
    6225 | LOCK_SESSIONS            | END            | myGroup1,myGroup2                    | Session #1 : 11 tables locked, 0 deadlock(s)                                                 | postgres
    6226 | ROLLBACK_GROUPS          | MARK DELETED   | myGroup1                             | mark Multi-2 has been deleted                                                                | postgres
    6227 | ROLLBACK_GROUPS          | MARK DELETED   | myGroup2                             | mark Multi-2 has been deleted                                                                | postgres
    6228 | ROLLBACK_SEQUENCE        |                | myschema1."myTbl3_col31_seq"         |                                                                                              | postgres
    6229 | ROLLBACK_SEQUENCE        |                | myschema2.myseq1                     |                                                                                              | postgres
    6230 | ROLLBACK_SEQUENCE        |                | myschema2."myTbl3_col31_seq"         |                                                                                              | postgres
    6231 | ROLLBACK_GROUPS          | END            | myGroup1,myGroup2                    | 0 tables and 3 sequences effectively processed                                               | postgres
    6232 | STOP_GROUPS              | BEGIN          | myGroup1,myGroup2                    |                                                                                              | postgres
    6233 | LOCK_GROUPS              | BEGIN          | myGroup1,myGroup2                    |                                                                                              | postgres
    6234 | LOCK_GROUPS              | END            | myGroup1,myGroup2                    | 11 tables locked, 0 deadlock(s)                                                              | postgres
    6235 | SET_MARK_GROUPS          | BEGIN          | myGroup1,myGroup2                    | Stop after rollback                                                                          | postgres
    6236 | SET_MARK_GROUPS          | END            | myGroup1,myGroup2                    | Stop after rollback                                                                          | postgres
    6237 | STOP_GROUPS              | END            | myGroup1,myGroup2                    | 14 tables/sequences processed                                                                | postgres
    6239 | START_GROUPS             | BEGIN          | myGroup1,myGroup2                    | Without log reset                                                                            | postgres
    6240 | LOCK_GROUPS              | BEGIN          | myGroup1,myGroup2                    |                                                                                              | postgres
    6241 | LOCK_GROUPS              | END            | myGroup1,myGroup2                    | 11 tables locked, 0 deadlock(s)                                                              | postgres
    6242 | SET_MARK_GROUPS          | BEGIN          | myGroup1,myGroup2                    | Multi-1b                                                                                     | postgres
    6243 | SET_MARK_GROUPS          | END            | myGroup1,myGroup2                    | Multi-1b                                                                                     | postgres
    6244 | START_GROUPS             | END            | myGroup1,myGroup2                    | 14 tables/sequences processed                                                                | postgres
    6245 | SET_MARK_GROUPS          | BEGIN          | myGroup1,myGroup2                    | Multi-2                                                                                      | postgres
    6246 | LOCK_GROUPS              | BEGIN          | myGroup1,myGroup2                    |                                                                                              | postgres
    6247 | LOCK_GROUPS              | END            | myGroup1,myGroup2                    | 11 tables locked, 0 deadlock(s)                                                              | postgres
    6248 | SET_MARK_GROUPS          | END            | myGroup1,myGroup2                    | Multi-2                                                                                      | postgres
    6249 | DELETE_MARK_GROUP        | BEGIN          | myGroup1                             | Multi-2                                                                                      | postgres
    6250 | DELETE_MARK_GROUP        | END            | myGroup1                             | Multi-2                                                                                      | postgres
    6251 | ROLLBACK_GROUP           | BEGIN          | myGroup2                             | Unlogged rollback to mark Multi-2 (timestamp)                                                | postgres
    6252 | LOCK_SESSION             | BEGIN          | myGroup2                             | Session #1                                                                                   | postgres
    6253 | LOCK_SESSION             | END            | myGroup2                             | Session #1 : 6 tables locked, 0 deadlock(s)                                                  | postgres
    6254 | ROLLBACK_SEQUENCE        |                | myschema2.myseq1                     |                                                                                              | postgres
    6255 | ROLLBACK_SEQUENCE        |                | myschema2."myTbl3_col31_seq"         |                                                                                              | postgres
    6256 | ROLLBACK_GROUP           | END            | myGroup2                             | 0 tables and 2 sequences effectively processed                                               | postgres
    6257 | DELETE_MARK_GROUP        | BEGIN          | myGroup2                             | Multi-2                                                                                      | postgres
    6258 | DELETE_MARK_GROUP        | END            | myGroup2                             | Multi-2                                                                                      | postgres
    6259 | DELETE_MARK_GROUP        | BEGIN          | myGroup1                             | Multi-1                                                                                      | postgres
    6260 | DELETE_MARK_GROUP        | END            | myGroup1                             | Multi-1                                                                                      | postgres
    6261 | DELETE_MARK_GROUP        | BEGIN          | myGroup2                             | Multi-1                                                                                      | postgres
    6262 | DELETE_MARK_GROUP        | END            | myGroup2                             | Multi-1                                                                                      | postgres
    6263 | RENAME_MARK_GROUP        | BEGIN          | myGroup1                             | Multi-1b                                                                                     | postgres
    6264 | RENAME_MARK_GROUP        | END            | myGroup1                             | Multi-1b renamed Multi-1                                                                     | postgres
    6265 | RENAME_MARK_GROUP        | BEGIN          | myGroup2                             | Multi-1b                                                                                     | postgres
    6266 | RENAME_MARK_GROUP        | END            | myGroup2                             | Multi-1b renamed Multi-1                                                                     | postgres
    6267 | RENAME_MARK_GROUP        | BEGIN          | myGroup2                             | M2                                                                                           | postgres
    6268 | RENAME_MARK_GROUP        | END            | myGroup2                             | M2 renamed Deleted M2                                                                        | postgres
    6269 | DELETE_BEFORE_MARK_GROUP | BEGIN          | myGroup2                             | M3                                                                                           | postgres
    6270 | DELETE_BEFORE_MARK_GROUP | END            | myGroup2                             | 2 marks deleted ; M3 is now the initial mark                                                 | postgres
    6271 | COMMENT_MARK_GROUP       |                | myGroup2                             | Mark M3                                                                                      | postgres
    6272 | CREATE_GROUP             | BEGIN          | phil's group#3",                     | audit_only                                                                                   | postgres
    6273 | CREATE_GROUP             | SCHEMA CREATED | "emaj #'3"                           |                                                                                              | postgres
    6274 | CREATE_GROUP             | END            | phil's group#3",                     | 4 tables/sequences processed                                                                 | postgres
    6275 | ALTER_GROUP              | BEGIN          | phil's group#3",                     |                                                                                              | postgres
    6276 | ALTER_GROUP              | SCHEMA DROPPED | "emaj #'3"                           |                                                                                              | postgres
    6277 | ALTER_GROUP              | SCHEMA CREATED | "emaj #'3"                           |                                                                                              | postgres
    6278 | ALTER_GROUP              | END            | phil's group#3",                     | 1 dropped relations and 1 (re)created relations                                              | postgres
    6279 | START_GROUP              | BEGIN          | phil's group#3",                     | With log reset                                                                               | postgres
    6280 | LOCK_GROUP               | BEGIN          | phil's group#3",                     |                                                                                              | postgres
    6281 | LOCK_GROUP               | END            | phil's group#3",                     | 2 tables locked, 0 deadlock(s)                                                               | postgres
    6282 | SET_MARK_GROUP           | BEGIN          | phil's group#3",                     | M1_after_alter_group                                                                         | postgres
    6283 | SET_MARK_GROUP           | END            | phil's group#3",                     | M1_after_alter_group                                                                         | postgres
    6284 | START_GROUP              | END            | phil's group#3",                     | 4 tables/sequences processed                                                                 | postgres
    6285 | STOP_GROUP               | BEGIN          | phil's group#3",                     |                                                                                              | postgres
    6286 | LOCK_GROUP               | BEGIN          | phil's group#3",                     |                                                                                              | postgres
    6287 | LOCK_GROUP               | END            | phil's group#3",                     | 2 tables locked, 0 deadlock(s)                                                               | postgres
    6288 | SET_MARK_GROUP           | BEGIN          | phil's group#3",                     | STOP_%                                                                                       | postgres
    6289 | SET_MARK_GROUP           | END            | phil's group#3",                     | STOP_%                                                                                       | postgres
    6290 | STOP_GROUP               | END            | phil's group#3",                     | 4 tables/sequences processed                                                                 | postgres
    6291 | ALTER_GROUP              | BEGIN          | phil's group#3",                     |                                                                                              | postgres
    6292 | ALTER_GROUP              | SCHEMA DROPPED | "emaj #'3"                           |                                                                                              | postgres
    6293 | ALTER_GROUP              | SCHEMA CREATED | "emaj #'3"                           |                                                                                              | postgres
    6294 | ALTER_GROUP              | END            | phil's group#3",                     | 1 dropped relations and 1 (re)created relations                                              | postgres
    6295 | DROP_GROUP               | BEGIN          | phil's group#3",                     |                                                                                              | postgres
    6296 | DROP_GROUP               | SCHEMA DROPPED | "emaj #'3"                           |                                                                                              | postgres
    6297 | DROP_GROUP               | END            | phil's group#3",                     | 4 tables/sequences processed                                                                 | postgres
    6298 | CREATE_GROUP             | BEGIN          | phil's group#3",                     | rollbackable                                                                                 | postgres
    6299 | CREATE_GROUP             | SCHEMA CREATED | "emaj #'3"                           |                                                                                              | postgres
    6300 | CREATE_GROUP             | END            | phil's group#3",                     | 4 tables/sequences processed                                                                 | postgres
    6301 | START_GROUP              | BEGIN          | phil's group#3",                     | With log reset                                                                               | postgres
    6302 | LOCK_GROUP               | BEGIN          | phil's group#3",                     |                                                                                              | postgres
    6303 | LOCK_GROUP               | END            | phil's group#3",                     | 2 tables locked, 0 deadlock(s)                                                               | postgres
    6304 | SET_MARK_GROUP           | BEGIN          | phil's group#3",                     | M1_rollbackable                                                                              | postgres
    6305 | SET_MARK_GROUP           | END            | phil's group#3",                     | M1_rollbackable                                                                              | postgres
    6306 | START_GROUP              | END            | phil's group#3",                     | 4 tables/sequences processed                                                                 | postgres
    6307 | SET_MARK_GROUP           | BEGIN          | phil's group#3",                     |                                                                                              | postgres
    6308 | LOCK_GROUP               | BEGIN          | phil's group#3",                     |                                                                                              | postgres
    6309 | LOCK_GROUP               | END            | phil's group#3",                     | 2 tables locked, 0 deadlock(s)                                                               | postgres
    6310 | SET_MARK_GROUP           | END            | phil's group#3",                     | M2_rollbackable                                                                              | postgres
    6311 | SET_MARK_GROUP           | BEGIN          | phil's group#3",                     |                                                                                              | postgres
    6312 | LOCK_GROUP               | BEGIN          | phil's group#3",                     |                                                                                              | postgres
    6313 | LOCK_GROUP               | END            | phil's group#3",                     | 2 tables locked, 0 deadlock(s)                                                               | postgres
    6314 | SET_MARK_GROUP           | END            | phil's group#3",                     | M2_again!                                                                                    | postgres
    6315 | SET_MARK_GROUPS          | BEGIN          | phil's group#3",                     | phil's mark #1                                                                               | postgres
    6316 | LOCK_GROUPS              | BEGIN          | phil's group#3",                     |                                                                                              | postgres
    6317 | LOCK_GROUPS              | END            | phil's group#3",                     | 2 tables locked, 0 deadlock(s)                                                               | postgres
    6318 | SET_MARK_GROUPS          | END            | phil's group#3",                     | phil's mark #1                                                                               | postgres
    6319 | COMMENT_MARK_GROUP       |                | phil's group#3",                     | Mark phil's mark #1                                                                          | postgres
    6320 | RENAME_MARK_GROUP        | BEGIN          | phil's group#3",                     | phil's mark #1                                                                               | postgres
    6321 | RENAME_MARK_GROUP        | END            | phil's group#3",                     | phil's mark #1 renamed phil's mark #3                                                        | postgres
    6322 | DELETE_MARK_GROUP        | BEGIN          | phil's group#3",                     | M2_again!                                                                                    | postgres
    6323 | DELETE_MARK_GROUP        | END            | phil's group#3",                     | M2_again!                                                                                    | postgres
    6324 | ROLLBACK_GROUP           | BEGIN          | phil's group#3",                     | Logged rollback to mark phil's mark #3 (timestamp)                                           | postgres
    6325 | LOCK_SESSION             | BEGIN          | phil's group#3",                     | Session #1                                                                                   | postgres
    6326 | LOCK_SESSION             | END            | phil's group#3",                     | Session #1 : 2 tables locked, 0 deadlock(s)                                                  | postgres
    6327 | SET_MARK_GROUP           | BEGIN          | phil's group#3",                     | RLBK_phil's mark #3_%_START                                                                  | postgres
    6328 | SET_MARK_GROUP           | END            | phil's group#3",                     | RLBK_phil's mark #3_%_START                                                                  | postgres
    6329 | ROLLBACK_SEQUENCE        |                | "phil's schema3"."myTbl2\_col21_seq" |                                                                                              | postgres
    6330 | ROLLBACK_SEQUENCE        |                | "phil's schema3"."phil's seq\1"      |                                                                                              | postgres
    6331 | SET_MARK_GROUP           | BEGIN          | phil's group#3",                     | RLBK_phil's mark #3_%_DONE                                                                   | postgres
    6332 | SET_MARK_GROUP           | END            | phil's group#3",                     | RLBK_phil's mark #3_%_DONE                                                                   | postgres
    6333 | ROLLBACK_GROUP           | END            | phil's group#3",                     | 0 tables and 2 sequences effectively processed                                               | postgres
    6334 | ROLLBACK_GROUP           | BEGIN          | phil's group#3",                     | Unlogged rollback to mark phil's mark #3 (timestamp)                                         | postgres
    6335 | LOCK_SESSION             | BEGIN          | phil's group#3",                     | Session #1                                                                                   | postgres
    6336 | LOCK_SESSION             | END            | phil's group#3",                     | Session #1 : 2 tables locked, 0 deadlock(s)                                                  | postgres
    6337 | ROLLBACK_GROUP           | MARK DELETED   | phil's group#3",                     | mark RLBK_phil's mark #3_%_START has been deleted                                            | postgres
    6338 | ROLLBACK_GROUP           | MARK DELETED   | phil's group#3",                     | mark RLBK_phil's mark #3_%_DONE has been deleted                                             | postgres
    6339 | ROLLBACK_SEQUENCE        |                | "phil's schema3"."myTbl2\_col21_seq" |                                                                                              | postgres
    6340 | ROLLBACK_SEQUENCE        |                | "phil's schema3"."phil's seq\1"      |                                                                                              | postgres
    6341 | ROLLBACK_GROUP           | END            | phil's group#3",                     | 0 tables and 2 sequences effectively processed                                               | postgres
    6342 | ROLLBACK_GROUP           | BEGIN          | myGroup1                             | Unlogged rollback to mark Multi-1 (timestamp)                                                | postgres
    6343 | LOCK_SESSION             | BEGIN          | myGroup1                             | Session #1                                                                                   | postgres
    6344 | LOCK_SESSION             | END            | myGroup1                             | Session #1 : 5 tables locked, 0 deadlock(s)                                                  | postgres
    6345 | ROLLBACK_TABLE           | BEGIN          | myschema1.mytbl1                     | All log rows with emaj_gid > 12014                                                           | postgres
    6346 | ROLLBACK_TABLE           | END            | myschema1.mytbl1                     | 0 rollbacked rows                                                                            | postgres
    6347 | ROLLBACK_SEQUENCE        |                | myschema1."myTbl3_col31_seq"         |                                                                                              | postgres
    6348 | ROLLBACK_GROUP           | END            | myGroup1                             | 1 tables and 1 sequences effectively processed                                               | postgres
    6349 | SNAP_GROUP               | BEGIN          | myGroup1                             | /tmp/emaj_test/snaps                                                                         | postgres
    6350 | SNAP_GROUP               | END            | myGroup1                             | 6 tables/sequences processed                                                                 | postgres
    6351 | SNAP_GROUP               | BEGIN          | myGroup2                             | /tmp/emaj_test/snaps                                                                         | postgres
    6352 | SNAP_GROUP               | END            | myGroup2                             | 8 tables/sequences processed                                                                 | postgres
    6353 | SNAP_GROUP               | BEGIN          | phil's group#3",                     | /tmp/emaj_test/snaps                                                                         | postgres
    6354 | SNAP_GROUP               | END            | phil's group#3",                     | 4 tables/sequences processed                                                                 | postgres
    6355 | GENERATE_SQL             | BEGIN          | myGroup1                             | From mark Multi-1 to current situation towards /tmp/emaj_test/sql_scripts/myGroup1.sql       | postgres
    6356 | GENERATE_SQL             | END            | myGroup1                             | 1 generated statements                                                                       | postgres
    6357 | GENERATE_SQL             | BEGIN          | myGroup2                             | From mark Multi-1 to current situation towards /tmp/emaj_test/sql_scripts/myGroup2.sql       | postgres
    6358 | GENERATE_SQL             | END            | myGroup2                             | 21 generated statements                                                                      | postgres
    6359 | GENERATE_SQL             | BEGIN          | phil's group#3",                     | From mark M1_rollbackable to current situation towards /tmp/emaj_test/sql_scripts/Group3.sql | postgres
    6360 | GENERATE_SQL             | END            | phil's group#3",                     | 57 generated statements                                                                      | postgres
(357 rows)

--
reset role;
truncate emaj.emaj_hist;
alter sequence emaj.emaj_hist_hist_id_seq restart 10000;
alter sequence emaj.emaj_mark_mark_id_seq restart 1000;
alter sequence emaj.emaj_sequence_sequ_id_seq restart 1000;
alter sequence emaj.emaj_seq_hole_sqhl_id_seq restart 1000;
-- the groups are left in their current state for the parallel rollback test.
-- perform some updates to prepare the parallel rollback test
select count(*) from mySchema1.myTbl4;
 count 
-------
     0
(1 row)

select count(*) from mySchema1.myTbl1;
 count 
-------
    20
(1 row)

select count(*) from mySchema1.myTbl2; 
 count 
-------
     3
(1 row)

select count(*) from mySchema1."myTbl3";
 count 
-------
     5
(1 row)

select count(*) from mySchema1.myTbl2b;
 count 
-------
     0
(1 row)

select count(*) from mySchema2.myTbl4;
 count 
-------
     2
(1 row)

select count(*) from mySchema2.myTbl1;
 count 
-------
    10
(1 row)

select count(*) from mySchema2.myTbl2; 
 count 
-------
     2
(1 row)

select count(*) from mySchema2."myTbl3";
 count 
-------
    10
(1 row)

select count(*) from mySchema2.myTbl5;
 count 
-------
     3
(1 row)

select count(*) from mySchema2.myTbl6;
 count 
-------
    13
(1 row)

delete from mySchema1.myTbl4;
delete from mySchema1.myTbl1;
delete from mySchema1.myTbl2; 
delete from mySchema1."myTbl3";
delete from mySchema1.myTbl2b;
delete from mySchema2.myTbl4;
delete from mySchema2.myTbl1;
delete from mySchema2.myTbl2; 
delete from mySchema2."myTbl3";
delete from mySchema2.myTbl5;
delete from mySchema2.myTbl6;
alter sequence mySchema2.mySeq1 restart 9999;
